id,title,author,dynasty,genre,poem_type,sentences_simplified,meter_pattern,hash,words
fc02364f-f186-4d55-b4a2-2e00232a27a6,李郎中有诗谢寄藤杖仍次韵答之,何梦桂,宋,诗,七言律诗,海南觅得古藤枝 持与诗人杜牧之 紫贝斑文鞭更烂 赤龙苍骨蜕尤奇 路无夷险终全节 用有行藏一任时 非但与君扶脚力 𫓩蛟剸虎要支持,"7,7,7,7,7,7,7,7",57aea891f8ce1d6d67f8f8f445b7b2b2,海南 觅得 古藤枝 持 与 诗人 杜牧之 紫贝斑文 鞭 更 烂 赤龙苍骨 蜕尤奇 路无夷 险终 全节 用有 行藏 一任 时 非但 与 君 扶 脚力 𫓩 蛟 剸 虎 要 支持
63fcf9ea-f9fb-4cc6-a1cf-c5e3d782fc3d,和方山房韵寄李郎中,何梦桂,宋,诗,七言律诗,世路悠悠水上萍 相看谁与眼长青 千年彝鼎观勋业 一代图球见典型 谩道石能生白璧 自知竹已化青宁 绝怜驿路梅花句 肯落空江杜若汀,"7,7,7,7,7,7,7,7",331415055b5f6a236dfd43ebf09da1ef,世路 悠悠 水上 萍 相看 谁 与 眼 长青 千年 彝鼎 观 勋业 一代 图球 见 典型 谩道 石能 生白璧 自知 竹 已 化 青宁 绝怜 驿路梅花 句 肯 落空 江杜 若汀
62c1c805-5366-48b2-b306-7a9b9cac05a9,梅杖诗,何梦桂,宋,诗,七言律诗,曾向孤山㔉薜萝 根株栗栉试摩挲 持身惯历风波路 回首还怜雪月坡 铁骨自将惟世用 赤心不偶奈时何 会寻苍竹成龙去 莫向葛陂深处过,"7,7,7,7,7,7,7,7",c0b19cce79da9577e786b593cde402db,曾 向 孤山 㔉 薜萝 根株 栗 栉 试 摩挲 持身 惯历 风波 路 回首 还怜 雪 月 坡 铁骨 自将 惟世 用 赤心 不 偶奈时 何 会 寻苍竹 成龙 去 莫向葛 陂 深处 过
92c3fd67-c647-48a6-83c1-7df364aaee05,夜坐有感,何梦桂,宋,诗,七言律诗,银汉无声玉漏沉 楼高风露入衣襟 洞龙睡熟云归岫 枝鹊啼干月满林 瓮里故书前世梦 匣中孤剑少年心 征鸿目断阑干角 吹尽参差到夜深,"7,7,7,7,7,7,7,7",ac868d7a090ccf82646e1f1bb039e2b4,银汉 无声 玉漏 沉 楼高风 露入 衣襟 洞龙 睡熟 云归岫 枝 鹊 啼 干 月 满林 瓮里 故书 前世 梦 匣中 孤剑 少年心 征 鸿目断 阑干 角 吹 尽 参差 到 夜深
f719bd09-2b09-4557-9950-db52509e600f,存厨徐君征生挽歌,何梦桂,宋,诗,七言律诗,一厨聊寄等归藏 荷锸携壶毕此乡 逆旅不归前路恶 盖棺未了后期长 圹中酣饮自忘癖 道上哀歌人笑狂 千古心存千古事 青山流水付于塘,"7,7,7,7,7,7,7,7",2f0f882af0c50edaefa24942d7bb08ec,一 厨 聊 寄 等 归藏 荷 锸 携 壶 毕此 乡 逆旅 不 归 前路 恶 盖棺 未了 后期 长 圹 中 酣饮 自 忘 癖 道 上 哀歌 人 笑 狂 千古 心存 千古 事 青山 流水 付于 塘
5fffe1c8-6355-422b-b2ae-9eccdaf50b15,偶成  其一,何梦桂,宋,诗,七言律诗,一卷南华一炷香 身闲随处是仙乡 竹声侵户朝眠觉 花影移阶昼坐忘 杜曲自耕贫亦乐 柴桑可葬死何妨 悠悠往事俱尘土 剩得头颅上雪霜,"7,7,7,7,7,7,7,7",61f6a61a0fd9005cbd327cf53b707e29,一卷 南华 一炷香 身闲 随处 是 仙乡 竹声 侵户 朝眠觉 花影 移阶昼 坐忘 杜曲 自耕 贫 亦 乐 柴桑 可葬 死 何妨 悠悠 往事 俱 尘土 剩 得 头颅 上雪霜
35326b71-d80d-42f0-a186-fbf8f47058e2,偶成  其二,何梦桂,宋,诗,七言律诗,沉水烟销宝鸭香 山窝人在水云乡 鱼非惠子同鱼乐 蝶化庄周并蝶忘 心了固知身是寄 物齐宁与道相妨 清明即是神仙界 不用丹炉炼玉霜,"7,7,7,7,7,7,7,7",6ac9a3acc27ec0d88fa2e2639ee42706,沉 水烟 销宝 鸭香 山窝 人 在 水云 乡 鱼 非 惠子 同 鱼乐 蝶化 庄周 并 蝶 忘 心 了固 知身 是 寄 物 齐宁 与 道 相妨 清明 即 是 神仙 界 不用 丹 炉 炼 玉霜
17588385-912f-48fa-8f90-bed86e4ffef6,小有山中即事,何梦桂,宋,诗,七言律诗,闲随鹤影步山蹊 摘草归来养竹鸡 水带平沙流涧浅 云将落照压山低 覆阶乱叶凭风扫 护径丛筠借鹭栖 万物不言皆自得 此心触处见端倪,"7,7,7,7,7,7,7,7",c8daecbf7d055b90f95fd26e83ee27c5,闲随鹤影步山蹊 摘草 归来 养 竹鸡 水带 平沙 流涧 浅 云 将 落照 压山 低 覆阶乱 叶凭风 扫 护径 丛筠 借 鹭 栖 万物 不言皆 自得 此 心触处 见 端倪
c6e6093a-f2a9-4fd8-9926-96355ac05529,偶成寄王德甫,何梦桂,宋,诗,七言律诗,休休万事总归休 犹占青山对白头 籁寂乾坤机落落 境忘身世梦悠悠 孤云野水辽天鹤 明月清风露地牛 此意不知谁会得 一声铁笛万山秋,"7,7,7,7,7,7,7,7",ba9986dcb7cc7d8fefe2481a0433158b,休休 万事 总归 休 犹 占 青山 对 白头 籁 寂 乾坤 机 落落 境 忘 身世 梦 悠悠 孤云野 水辽天鹤 明月清风 露地 牛 此 意 不知 谁 会 得 一声 铁笛 万山 秋
2270d3d1-0826-4055-b408-915c00ac4206,和王德甫见寿二律  其一,何梦桂,宋,诗,七言律诗,百年闲梦寄山窝 世态人情任唯阿 竹裹贞心经岁老 梅开白眼看人多 身从野叟分樵牧 莫遣山灵扫桂萝 黄阁朱崖身外事 一蓑牛背夕阳歌,"7,7,7,7,7,7,7,7",7c76f65cc62dce360f5bb08a826e8bf1,百年 闲 梦 寄 山窝 世态人情 任唯 阿 竹裹 贞心 经岁 老 梅 开白 眼看 人 多 身 从 野叟 分 樵牧 莫遣 山灵 扫 桂萝 黄阁 朱崖 身 外事 一 蓑牛 背 夕阳 歌
dfe3237d-9bf0-47ad-94e1-54dcf888a561,和王德甫见寿二律  其二,何梦桂,宋,诗,七言律诗,灶堕丹飞昔未仙 重来人世了前缘 自怜白发随孤影 空抚青萍忆少年 黄菊秋余花尚耐 玄梨霜后果初圆 问君何以为翁寿 但诵黄庭内外篇,"7,7,7,7,7,7,7,7",9fe725a1006185623f8488019a7f6404,灶 堕 丹飞 昔 未 仙 重 来 人世 了 前缘 自怜 白发 随 孤影 空抚 青萍忆 少年 黄菊 秋余花尚耐 玄梨霜 后果 初圆 问君 何以 为 翁寿 但 诵 黄庭 内外 篇
d422772d-6e1a-4b40-a643-0ea03940016d,挽新城徐岘山,何梦桂,宋,诗,七言律诗,骑鸾一去藐尘寰 万里天风杳珮环 江海十年生白浪 星霜七秩陨朱颜 瑶池月堕梦中梦 翠岘云归山外山 身世到头秋露尽 吟魂犹自在人间,"7,7,7,7,7,7,7,7",b857d3a7240551b5bc9ab51e5e067e69,骑 鸾 一 去 藐 尘寰 万里 天风杳珮环 江海 十年 生 白浪 星霜七 秩 陨 朱颜 瑶池 月 堕 梦 中 梦 翠岘 云 归 山外 山 身世 到头 秋露 尽 吟 魂 犹自 在 人间
46a0059d-8149-4e5e-a091-1a004758becd,道汾阳不及访逢原蒙寄诗次韵,何梦桂,宋,诗,七言律诗,浮槎曾误客星占 屐齿空传遍好山 弱水方壶三万里 武夷玉女九重关 蹇馿有径穿花外 短棹无人出苇间 不是钟山真勒驾 自惭松桂莫能攀,"7,7,7,7,7,7,7,7",21e1750d6445a7f38eb82f9dca7702b6,浮槎 曾 误 客星 占 屐 齿 空 传遍 好 山 弱水 方壶 三万里 武夷 玉女 九重 关 蹇 馿 有 径 穿 花 外 短 棹 无人 出 苇间 不是 钟山 真勒驾 自惭 松桂 莫 能 攀
cf502e6a-a72a-4290-bbb1-798c73bba275,王石涧赋小有洞天之诗邵青谿和之辄次韵奉谢,何梦桂,宋,诗,七言律诗,自怜恶石狠难鞭 归去渔樵结老缘 野鹤分无轩上禄 醯鸡粗足瓮中天 病来摩诘非真佛 睡去希夷已半仙 僻好自耽如嗜酒 醉乡休与醒人传,"7,7,7,7,7,7,7,7",5c2ec587d98aa2ac207dc44c0bcc256a,自怜 恶石 狠难 鞭 归去 渔樵 结老缘 野鹤 分无 轩上禄 醯 鸡 粗足 瓮中 天 病来 摩诘 非 真佛 睡 去 希夷 已 半仙 僻 好 自 耽如 嗜酒 醉乡 休与 醒 人 传
e35542b5-942c-4758-a9a7-ce2e689b03a9,和韵问魏石川疾  其一,何梦桂,宋,诗,七言律诗,谩道无丹蜕骨凡 绣襦不换嫁时衫 老天倘未忘周孔 巫鬼何须问抵咸 身健加餐亲鼎饪 眼明减药认囊椷 山中吠犬千年杞 采采犹堪餍吻馋,"7,7,7,7,7,7,7,7",ab77764a19915242b7f770d1f6c2aff8,谩道 无 丹 蜕 骨 凡 绣 襦 不 换嫁 时衫 老天 倘 未 忘 周孔 巫 鬼 何须 问 抵 咸 身健 加餐 亲 鼎 饪 眼明 减药 认 囊 椷 山中 吠 犬 千年 杞 采采 犹堪 餍 吻 馋
64db3370-6c43-413d-b93c-c4a5826e4a8f,和韵问魏石川疾  其二,何梦桂,宋,诗,七言律诗,不是尘中骨相凡 蓉裳蕙带芰荷衫 勿疑有疾淫成蛊 须信无心感是咸 裹药曾经丹灶火 裁书祇欠土奁椷 病余努力加蔬饭 莫笑筼筜太守馋,"7,7,7,7,7,7,7,7",fce45f973740d1159ed063b9e64cc6d8,不是 尘 中 骨相 凡 蓉 裳 蕙 带 芰 荷 衫 勿疑有疾淫成 蛊 须信 无心 感是 咸 裹 药 曾经 丹 灶火 裁 书 祇 欠 土 奁 椷 病余 努力 加 蔬饭 莫 笑 筼 筜 太守 馋
7bcd6da8-5a8d-4008-9655-8d147688eee9,和韵问魏石川疾  其三,何梦桂,宋,诗,七言律诗,灵山何许问巫凡 狭地知难旋舞衫 枕上病虽忧白傅 床前教肯媿陈咸 君宜借力宽诗课 我亦埋头事药椷 种术养凫随分足 岂因富贵堕涎馋,"7,7,7,7,7,7,7,7",8eee9d69743a32571396bef54da58c91,灵山 何许 问巫 凡 狭地 知 难旋 舞衫 枕上 病 虽 忧 白傅 床 前 教 肯 媿 陈 咸 君宜 借力 宽 诗 课 我 亦 埋头 事 药 椷 种术养 凫随 分足 岂 因 富贵 堕涎 馋
91e8ef4d-1695-4946-97d8-b8eec1d0d87d,赠董君竹梧亭,何梦桂,宋,诗,七言律诗,买得园亭乐赋归 一庭翠碧映参差 自怜封户培新笋 更喜添孙养嫩枝 翠袖倚看云影乱 银床坐对月阴移 沉香栏北花如故 富贵无心懒赋诗,"7,7,7,7,7,7,7,7",668e1aa3e81e10529d662a982a8d2eb4,买 得 园亭 乐 赋归 一庭 翠碧映 参差 自怜 封户培 新笋 更 喜添 孙养 嫩枝 翠袖 倚 看 云影 乱 银床 坐 对 月 阴移 沉香 栏北花 如故 富贵 无心 懒 赋诗
5189c0ae-6dfa-4f42-bfe6-045c430ea0c3,山窝适兴,何梦桂,宋,诗,七言律诗,剩得闲身镇自怜 更怜闲占此山泉 满阶碧草客稀到 半榻白云人对眠 窗影枝摇知雀踏 壁痕苔湿认蜗涎 日长静看辛夷树 落尽闲花忘宿缘,"7,7,7,7,7,7,7,7",b331470c03ae7cafaae9c804cbe17706,剩 得闲 身镇 自怜 更怜 闲 占 此 山泉 满 阶 碧草 客 稀到 半 榻 白云 人 对眠 窗影枝摇知雀踏 壁 痕 苔 湿认 蜗涎 日 长静 看 辛夷 树 落尽闲花忘 宿缘
0eda07cf-00e8-4221-8169-43077bce12ad,感兴  其一,何梦桂,宋,诗,七言律诗,坐断乾坤老一窝 修篁翠袖自婆娑 半生梦觉青山在 万世期长白日过 云影对人闲里好 禽声入耳静边多 舞雩不是真狂者 乐上心来可奈何,"7,7,7,7,7,7,7,7",943aaa49d943edaf9a9507332b0cb1e8,坐断 乾坤 老 一 窝 修 篁 翠 袖 自 婆娑 半生 梦觉 青山 在 万世 期长 白日 过 云影 对 人 闲 里 好 禽声 入耳 静边 多 舞雩 不是 真狂 者 乐 上心 来 可 奈何
27b4e09b-2fe6-47c5-85fe-c6e757ca6c5c,感兴  其二,何梦桂,宋,诗,七言律诗,拟将物化问渔樵 妙里无形本寂寥 大地云生千嶂雨 中天月上九溟潮 山河劫运九中化 世界尘缘座上销 此意到头谁会得 任他人道似逍遥,"7,7,7,7,7,7,7,7",6a5dedfd9b383d7bfc3bdf513ee04433,拟将 物化 问 渔樵 妙里 无形 本 寂寥 大地 云生千 嶂 雨 中天 月 上九溟 潮 山河 劫运 九中 化 世界 尘缘 座 上销 此 意 到头 谁 会 得 任 他人 道 似 逍遥
72a3f61f-9dc1-4eb5-b30a-0daa892fe949,次山房韵  其一,何梦桂,宋,诗,七言律诗,天教龙马现河图 尽把先天授伏羲 三极都从九里出 六爻只向一中推 易如可毁乾坤熄 神本无方昼夜知 三圣有忧辞已赘 寥寥千载复何时,"7,7,7,7,7,7,7,7",11e41d4393dd5a160bd15a1e678bbb90,天教 龙马 现 河图 尽 把 先天 授 伏羲 三极 都 从 九里 出 六爻 只 向 一中 推 易 如 可毁 乾坤 熄 神本 无方 昼夜 知 三 圣 有 忧 辞 已 赘 寥寥 千载 复 何时
2d660d6e-c395-467a-901f-5182875f2484,次山房韵  其二,何梦桂,宋,诗,七言律诗,易寂无为有感几 几存万物未生时 阴阳理向极中看 天地心从复处知 潮上海门探月窟 日回地户濯咸池 何时骑鹤研朱露 共勘经图叩古羲,"7,7,7,7,7,7,7,7",24c732f940635f3cd8986922291c4654,易寂 无为 有感 几 几 存 万物 未生时 阴阳 理向 极中 看 天地 心 从复 处知 潮 上海 门 探 月 窟 日 回 地户 濯 咸池 何时 骑鹤 研 朱露 共勘 经图 叩 古羲
86a0008d-8194-4727-b7f2-2fe0e6e0aed6,次山房韵  其三,何梦桂,宋,诗,七言律诗,西狩事非文殆丧 舂陵书出道宁孤 六经有舌存先圣 千古留心付后儒 杲日丽天随处见 逝川行地几时无 斋居珍重赓歌意 即此全吞太极图,"7,7,7,7,7,7,7,7",6a93f98d43edf3b0fb84ba09d1959a4d,西狩 事 非 文 殆丧 舂 陵 书 出道 宁 孤 六经 有 舌 存 先圣 千古 留心 付后儒 杲 日丽 天 随处 见 逝 川 行地 几时 无 斋 居 珍重 赓 歌意 即此 全吞 太极图
2518a902-d526-4f9a-bf1c-3a1778670fec,己卯春过西湖,何梦桂,宋,诗,七言律诗,世事谁家屋上乌 重来犹认旧西湖 风帘隔岸自高下 烟寺前山半有无 野水菰蒲飞属玉 夕阳栏槛唤提壶 十年不记梅花梦 试向孤山问老逋,"7,7,7,7,7,7,7,7",00dd26c454a71c03d00e7f9088515a62,世事 谁家 屋上乌 重来 犹认旧 西湖 风帘 隔岸 自 高下 烟寺 前山 半 有无 野 水 菰 蒲 飞属 玉 夕阳 栏槛 唤 提壶 十年 不记 梅花 梦 试向 孤山 问 老 逋
bd1eb531-6a89-4590-b5f5-1ca762ee1387,再用前韵和诸公,何梦桂,宋,诗,七言律诗,白发星星纱帽乌 怕随年少过西湖 清明上冢行人少 寒食开门宫使无 半世行藏随杖屦 百年悲乐寄樽壶 归来第五桥边路 半树残阳噪毕逋,"7,7,7,7,7,7,7,7",7c2ae3f42ae3980b11b4cc26aaedb922,白发 星星 纱帽 乌 怕 随 年少 过 西湖 清明 上 冢 行人 少 寒食 开门 宫 使 无 半 世行 藏 随 杖 屦 百年 悲乐 寄 樽 壶 归来 第五 桥边 路 半树 残阳 噪 毕 逋
34aedb34-9b07-4131-b524-c8b7433c4db7,和昭德孙燕子韵  其一,何梦桂,宋,诗,七言律诗,飘零短翅叹谁同 犹记当年系足红 人事合离梦槐国 岁时来去旅新丰 新楼绿幕无巢地 故国乌衣隔海风 说尽兴亡人不识 春风双泪白须翁,"7,7,7,7,7,7,7,7",92cef835d19690d646b3f60516d236cf,飘零 短 翅 叹 谁 同 犹记 当年 系足红 人事 合离 梦槐 国 岁 时 来 去 旅 新丰 新楼 绿幕 无巢地 故国 乌衣 隔 海风 说 尽 兴亡 人 不识 春风 双泪 白须 翁
5575b2af-6bb5-4668-b2fa-6a7ce1c63232,和昭德孙燕子韵  其二,何梦桂,宋,诗,七言律诗,说著兴亡事不同 且斟玄玉驻颜红 云轩梦断宫花逝 彩缕盟寒墓草丰 处处社时茅屋雨 年年春后楝花风 人间不是无栖处 要认当年旧媪翁,"7,7,7,7,7,7,7,7",98614ce9d30713be32e894e0cddcbae0,说著 兴亡 事 不同 且 斟 玄玉 驻颜 红 云轩 梦断 宫花 逝 彩 缕 盟寒 墓草 丰 处处 社时 茅屋 雨 年年 春后 楝花 风 人间 不是 无栖 处 要 认 当年 旧 媪 翁
4193c5b0-9d25-46af-8b59-9ec333b1afdb,和梅镜寄韵,何梦桂,宋,诗,七言律诗,未能生翼化鲲鱼 谁御泠风问太初 十载青衫关洛客 半生白首楚桥书 蹇馿岂解思长道 病鹤徒知恋旧庐 世有二程精说易 臯比何事到横渠,"7,7,7,7,7,7,7,7",03c52b286dca4d4ed0955334c385a7cd,未能 生翼 化 鲲鱼 谁 御 泠 风 问 太初 十载 青衫 关洛客 半生 白首 楚桥 书 蹇 馿 岂 解 思 长 道 病鹤 徒 知 恋旧 庐 世 有 二程 精 说 易 臯 比 何事 到 横 渠
3fc1415d-e10f-4b0a-bc65-425ff4c10c16,和郦佥事见寄韵  其一,何梦桂,宋,诗,七言律诗,诗书无用戏侏儒 两序今犹见璧图 末路弟兄知己少 中原人物似君无 曲终湘水丝绳绝 书入昭陵笔砚芜 珍重江南春信早 暗随梅萼到西湖,"7,7,7,7,7,7,7,7",0f749b959c3a2c4abda776f66ed4e543,诗书 无用 戏 侏儒 两 序 今 犹见璧图 末路 弟兄 知己 少 中原 人物 似君无 曲终 湘水 丝绳 绝 书入 昭陵 笔砚 芜 珍重 江南春 信 早 暗随 梅萼 到 西湖
f187bda9-827a-4357-8383-e84888f3ea20,和郦佥事见寄韵  其二,何梦桂,宋,诗,七言律诗,半世虚名我误儒 樊中短翅倦南图 黄尘世路千年改 白发心期四海无 绩纺妇慵麻褐短 耕锄儿懦豆田芜 老来万事心灰尽 只愿君王赐镜湖,"7,7,7,7,7,7,7,7",8cd55e93294d426abc7c2dfc938a6a3f,半世 虚名 我 误 儒 樊中 短 翅 倦 南图 黄 尘世 路 千年 改 白发 心期 四海 无 绩纺 妇 慵 麻 褐 短 耕 锄 儿 懦 豆 田芜 老 来 万事 心灰 尽 只 愿 君王 赐 镜湖
97171ba4-6338-4759-b7fe-16f496ef9f75,病起有感,何梦桂,宋,诗,七言律诗,声干木铎说铃非 天地无情世运奇 吾道悠悠川水逝 人才落落晓星稀 百年身后千年远 万个人中一个知 一曲汾亭弹未尽 却教渔父泄天机,"7,7,7,7,7,7,7,7",b443d2c65a1bb77f585d781970b03c31,声 干木铎 说 铃 非 天地 无情 世运 奇 吾 道 悠悠 川 水 逝 人才 落落 晓星稀 百年 身后 千年 远 万 个人 中 一个 知 一曲 汾亭 弹 未尽 却 教 渔父 泄天机
d8ef7b51-62ca-44e4-b4be-ef8a08362d63,汾阳诸公招徐祥叔归代之答谢  其一,何梦桂,宋,诗,七言律诗,富贵男儿昼锦衣 天涯漂泊众心违 人情钩饵惊鱼去 世界瓶罗碍雀飞 隠去甘从山鬼唤 狎游宁堕海翁机 草堂犹在终归去 只恐风尘白发微,"7,7,7,7,7,7,7,7",9d97e00eca596964698cb40f16c9484d,富贵 男儿 昼 锦衣 天涯 漂泊 众心 违 人情 钩 饵 惊 鱼 去 世界 瓶罗碍雀 飞 隠 去 甘 从 山鬼 唤 狎游 宁 堕海 翁 机 草堂 犹 在 终归 去 只恐 风尘 白发 微
771e8a97-4aeb-45ab-870c-27204d130b0a,汾阳诸公招徐祥叔归代之答谢  其二,何梦桂,宋,诗,七言律诗,涧陵望断忆玄晖 一片春云渭水涯 洞里桃开成隔世 山中柯烂忘来时 归休韦曲应无頼 隠去玄真那有诗 松菊相逢如见问 此心欲寄已忘辞,"7,7,7,7,7,7,7,7",42d09a4110f45d05b02c48a6083ff70a,涧陵 望断 忆玄晖 一片 春 云 渭水 涯 洞 里 桃 开成 隔世 山中 柯烂 忘 来时 归休韦 曲 应 无 頼 隠 去 玄 真 那 有 诗 松菊 相逢 如见 问 此 心 欲 寄 已 忘辞
478ac856-e58f-49f6-8ce5-cd4c2f27a93e,和何宁谷韵,何梦桂,宋,诗,七言律诗,一曲樽前浩浩歌 流年容易隙驹过 眼前白发故人少 郭外青枫古冢多 流水不弹嗟老矣 雍门欲听奈愁何 回头城阙应非昔 还记千年老鹤么,"7,7,7,7,7,7,7,7",26fce62d551477c8be6a9af46c435818,一曲 樽 前 浩浩 歌 流 年 容易 隙驹 过 眼前 白发 故人 少 郭外青 枫 古 冢 多 流水 不弹 嗟老矣 雍门欲听奈愁何 回头 城阙 应非 昔 还 记 千年 老鹤 么
e33a554e-8e0f-4030-b6b4-c00027f54626,归途再得八句并寄,何梦桂,宋,诗,七言律诗,石田归去醉时歌 白日飞帆送客过 舞袖低旋兼地狭 出门长啸觉天多 子卿朔漠知存否 武帝秋风奈老何 极目西陵台下路 漳河东去复来么,"7,7,7,7,7,7,7,7",b127ceb4b19ed858c8b0360112c93402,石田 归去 醉 时歌 白日 飞帆 送客 过 舞袖 低旋 兼地 狭 出门 长啸 觉天 多 子卿 朔漠 知存 否 武帝 秋风 奈 老何 极目 西陵 台下 路 漳河 东去 复来 么
f325e621-3916-4913-9b5d-2d51e50f4bcb,何逢原寄和章再和前韵,何梦桂,宋,诗,七言律诗,日暮归来弹铗歌 诗筒何处又相过 人生百岁乐时少 春色三分尘土多 愧乏丹砂修浑沌 且拚樽酒醉无何 近来江上风涛恶 还有闲鸥似我么,"7,7,7,7,7,7,7,7",5bd5123efdbe9f4e5d17d20c928b6e1c,日暮 归来 弹 铗 歌 诗筒 何处 又 相过 人生 百岁 乐 时 少 春色 三分 尘土 多 愧乏 丹砂 修 浑沌 且 拚樽 酒醉 无 何 近来 江 上风 涛 恶 还有 闲鸥 似 我么
302a523c-9d21-4850-94b1-58dfc339b503,和昭德孙闻鹃,何梦桂,宋,诗,七言律诗,平生抵掌志伊吾 闻著鹃声泪血枯 故国蚕丛千古恨 雾关熊耳一身孤 自从飞去啼痕在 纵不归来有梦无 莫向延秋门上叫 门楼无数白头乌,"7,7,7,7,7,7,7,7",b60d58902b2a5def95f626ea8367e2a6,平生 抵 掌志 伊吾 闻著鹃 声泪 血 枯 故国 蚕丛 千古 恨 雾关 熊耳 一身 孤 自从 飞去 啼痕 在 纵不 归来 有 梦 无 莫向 延秋门 上 叫 门楼 无数 白头 乌
700a2ba2-ed61-4d6e-909d-8d93d193f83f,和抱瓮冯提学二首  其一,何梦桂,宋,诗,七言律诗,吁嗟世事落黄间 倦矣人间行路难 流水已随钟子老 仙舟徒羡李膺观 从来豪杰为时出 到底功名耐久看 大厦将成要梁栋 雪深方见玉龙寒,"7,7,7,7,7,7,7,7",5d358fe9ed107de3533d5d28c07ed99a,吁 嗟 世事 落 黄间 倦 矣 人间 行路难 流水 已 随 钟子 老 仙舟 徒羡 李膺 观 从来 豪杰 为 时 出 到底 功名 耐久 看 大厦 将 成要 梁栋 雪深 方见 玉龙 寒
fdea3e87-dc31-4065-b33b-69c230258ead,和抱瓮冯提学二首  其二,何梦桂,宋,诗,七言律诗,山人日卧岭云长 扣户诗书枉纪纲 多病半生双白鬓 相思一日九回肠 人情取舍成刍狗 世事兴亡化石羊 明日相逢且拚醉 转头三万六千场,"7,7,7,7,7,7,7,7",d5fcb38caaf7720a58e85b6349185ad7,山人 日 卧岭 云长 扣户 诗书 枉 纪纲 多 病 半生 双白鬓 相思 一日 九 回肠 人情 取舍 成 刍狗 世事 兴亡 化石 羊 明日 相逢 且 拚醉 转头 三万 六千 场
8dbceed9-790b-4490-9508-715615cbc166,闻琴一首,何梦桂,宋,诗,七言律诗,自呼浊酒赋江蓠 一曲朱绳万感随 沙漠美人青冢恨 关河壮士北邙噫 无人流水音谁赏 老我雍门听转悲 夜半月明天籁寂 飞乌犹自绕南枝,"7,7,7,7,7,7,7,7",543602782879eb95b0cfe6e007e77123,自呼 浊酒 赋 江蓠 一曲 朱绳万 感随 沙漠 美 人 青冢 恨 关河 壮士 北 邙 噫 无人 流水 音 谁 赏 老 我 雍门 听转 悲 夜半 月 明 天籁 寂 飞乌 犹自 绕 南枝
6a69384a-89f6-4933-8e3b-b7dcf756e917,赠乔县尹,何梦桂,宋,诗,七言律诗,神君当日蔼民谣 复见君来试割刀 花下帘栊闲讼牒 柳边亭榭见旌旄 农桑课最茧丝殿 刍秣征宽马骨高 泉出后田浑不饮 恐他滴滴是民膏,"7,7,7,7,7,7,7,7",e5ddd961215de0805ca3cee41a3d465a,神君 当日 蔼 民谣 复见 君 来 试 割刀 花下 帘 栊 闲 讼 牒 柳边 亭榭 见 旌旄 农桑 课 最 茧丝 殿 刍秣 征 宽 马 骨 高 泉 出 后 田浑 不 饮 恐 他 滴滴 是 民膏
b051b421-5063-43ed-9fb3-a4042a999f8d,寄方龙溪,何梦桂,宋,诗,七言律诗,欲扣玄关访偓佺 人间无路铁鞋穿 瑯邪旧约惊千载 嵩岳新来下二仙 肯把丹砂分药鼎 便将白玉种芝田 瓣香欲谢双岩过 却道龙溪合受拳,"7,7,7,7,7,7,7,7",9ab6e9dd99cd2dcab54e83b4978118f3,欲 扣 玄关 访 偓 佺 人间 无 路 铁鞋 穿 瑯邪 旧约 惊 千载 嵩岳 新 来 下 二仙 肯 把 丹砂 分药 鼎 便 将 白玉 种 芝田 瓣 香欲 谢双岩 过 却道 龙溪 合受 拳
9d2be1ad-7e13-4c64-97c9-f65c4647851d,乐意,何梦桂,宋,诗,七言律诗,真乐攻心无奈何 自行自坐自讴歌 云收雨浄天无滓 月朗渊澄水不波 更把新诗勾野兴 时将浊酒发天和 傍人笑我荒唐甚 真乐攻心无奈何,"7,7,7,7,7,7,7,7",c14b5a1ce844a8e9baa062b124f3f876,真乐 攻心 无奈何 自行 自 坐自 讴歌 云 收 雨 浄 天 无 滓 月朗渊 澄水 不波 更 把 新诗 勾 野兴 时 将 浊酒 发天 和 傍 人 笑 我 荒唐 甚 真乐 攻心 无奈何
0e7b4412-c4ac-43cb-a2c6-8a56d5cdc544,挽宁谷居士何公三首  其一,何梦桂,宋,诗,七言律诗,英雄千古入泉台 八十余龄死更哀 隠谷云归龙已老 吟坛月堕鹤空回 黄花满地诗人老 青槚成阡吊客来 白发盖棺公事了 朔风世路正黄埃,"7,7,7,7,7,7,7,7",291b7b4ce78545460e69ff362a20ce4a,英雄 千古 入 泉台 八十余 龄 死 更 哀 隠 谷 云 归 龙 已 老 吟 坛 月 堕 鹤 空 回 黄花 满地 诗人 老 青槚成阡 吊客 来 白发 盖棺 公事 了 朔风 世路 正 黄埃
b8471ef7-6bb6-4dbf-90a1-14b3a3584b85,挽宁谷居士何公三首  其二,何梦桂,宋,诗,七言律诗,天寒白月堕西湖 血泪啼枯听薤歌 食子俱亡收子在 近孙犹少远孙多 北邙有地存诗窖 后圃无人负鞠窠 欲志鲁山惭四绝 空遗陈迹照松萝,"7,7,7,7,7,7,7,7",01eb0b4a63ee49d81bc9dab4ff904a2b,天寒 白月 堕 西湖 血泪 啼 枯 听 薤 歌 食子 俱 亡 收子 在 近孙犹少 远 孙 多 北邙 有 地存 诗窖 后 圃 无人 负 鞠 窠 欲志 鲁山 惭 四绝 空 遗 陈迹 照 松萝
a267e890-36ca-4eb2-a9d1-cb1b253ef149,挽宁谷居士何公三首  其三,何梦桂,宋,诗,七言律诗,鼠绕枯藤啮未休 得如此老死何求 翁逾八十媪黄发 孙见曾玄儿白头 身世幅巾归茧室 岁时盂饭洒狐丘 百年心事无人识 分付黄花满地秋,"7,7,7,7,7,7,7,7",a8182610b475cb5e33e659c956fceb14,鼠 绕 枯藤 啮 未 休 得 如此 老死 何求 翁 逾 八十 媪 黄 发 孙见曾 玄儿 白头 身世 幅巾 归 茧 室 岁 时 盂 饭 洒 狐丘 百年 心事 无人 识 分付 黄花 满地 秋
df1971f0-114b-46e4-a79f-56ac31dd2f26,挽合门唐中斋,何梦桂,宋,诗,七言律诗,英州别驾老昭陵 尚有钱塘八代孙 三略兵书生未识 百篇诗史死犹存 羊公岘首行人泪 白傅龙门过客樽 盂饭寝园谁是主 凤亭霜露有鸡豚,"7,7,7,7,7,7,7,7",b12556bf0164c9c1fa3fb11ad32bb232,英州 别 驾 老 昭陵 尚有 钱塘 八代 孙 三略兵 书生 未识 百篇 诗史 死 犹存 羊公岘 首 行人 泪 白傅 龙门 过客 樽 盂 饭 寝园 谁 是 主 凤亭 霜露 有 鸡豚
2f495fef-a7d9-4f5f-a3bd-108356855423,挽吏部刘谦山,何梦桂,宋,诗,七言律诗,犹记青原白鹭盟 转头宿草上新茔 屋梁月落丹心在 海水天寒白发生 樽酒十年儿女泪 篇诗两地弟兄情 盖棺事了君无愧 未死遑知身后名,"7,7,7,7,7,7,7,7",c09a9815f768f21b80d9cba7ef574d5d,犹记 青原 白鹭 盟 转头 宿草 上 新茔 屋梁 月 落 丹心 在 海水 天寒 白 发生 樽 酒 十年 儿女 泪 篇 诗 两地 弟兄 情 盖棺 事 了 君 无愧 未 死 遑 知 身后 名
