id,title,author,dynasty,genre,poem_type,sentences_simplified,meter_pattern,hash,words
12326041-033f-4632-bb82-ad41bf556bff,離臨安日范伯達送茶約至釣臺烹之正月十八日宿臺下兼簡務德,朱翌,唐,诗,七言律诗,过尽长滩唤落帆 舟人取火上高岩 已携败絮来投宿 记有珍茶旋启缄 忽忆住时同短𦩘 要须于此办长镵 可怜一夜梅花雨 点滴犹随舳尾衔,"7,7,7,7,7,7,7,7",805d3ffbf9c0c57089af4172f4c8ced0,过 尽 长滩 唤 落帆 舟 人 取火 上高岩 已 携 败絮 来 投宿 记有 珍茶 旋 启 缄 忽忆 住 时 同 短 𦩘 要 须 于 此 办 长 镵 可怜 一夜 梅花 雨 点滴 犹 随 舳 尾 衔
2fe976c0-473e-43a1-9b60-81a3c9aed85a,釣臺觀新刻范文正碑,朱翌,唐,诗,七言律诗,日角曈曈上蔡阳 有星飞去避余光 东西怵迫谢新进 南北逍遥乐故乡 载刻庙碑求琰琬 一新祠宇照沧浪 使君著意敦风俗 更作高堂牓卒章,"7,7,7,7,7,7,7,7",08759f97d54a52eb3a477e867972e9c6,日 角 曈 曈 上蔡 阳 有星 飞去 避 余光 东西 怵 迫 谢新进 南北 逍遥 乐 故乡 载刻 庙碑 求 琰 琬 一新 祠宇 照 沧浪 使君 著 意敦 风俗 更 作 高堂 牓 卒 章
c138d5ba-e42d-4b35-b601-71fd5c9d120a,競秀閣,朱翌,唐,诗,七言律诗,辋川遥展右丞图 盘谷中藏李愿居 龙睡潭深飞客櫂 凤鸣枝老结吾庐 但令蜡屐去前齿 安用鸱夷托后车 西望子陵三十里 烟云来往问何如,"7,7,7,7,7,7,7,7",a48ebbb37d668bc4a20b8cfb6d5493fa,辋 川 遥展 右丞图 盘谷 中藏 李 愿居 龙 睡 潭 深 飞 客 櫂 凤鸣枝 老结吾 庐 但令 蜡屐 去 前齿 安用 鸱 夷 托 后车 西望子 陵 三十里 烟云 来往 问 何如
c6212f7b-7702-4464-870a-7fa9f6424340,遊玉泉  其一,朱翌,唐,诗,七言律诗,坡陀石上大绅垂 踞石跏趺世虑微 奉引有春扶屐去 送归生月带星稀 一时花木助欢笑 四顾风云入指挥 是日乃书惊蛰节 鸣蛙已傍小池归,"7,7,7,7,7,7,7,7",e03649d53a203988342ca067d7afdcbf,坡陀石 上 大绅 垂 踞 石 跏趺 世虑 微 奉 引有 春 扶 屐 去 送 归生 月 带 星 稀 一时 花木 助 欢笑 四顾 风云 入 指挥 是 日 乃 书 惊蛰节 鸣 蛙 已 傍 小池 归
2916d8f7-31de-458a-b70e-ffc9039f4e6f,遊玉泉  其二,朱翌,唐,诗,七言律诗,款段寻山不著鞭 每逢佳处且周旋 生无一字夸金谷 喜与诸公会玉泉 雷转正喧三级浪 绅垂直自九重天 有能庚伏留终日 大胜朝堂食万钱,"7,7,7,7,7,7,7,7",7bc917465b76be132319f6a04a5bebf6,款段 寻山 不著 鞭 每逢 佳 处 且 周旋 生无一字 夸 金谷 喜 与 诸公 会 玉泉 雷 转正 喧 三级 浪 绅 垂直 自 九重天 有能庚 伏留 终日 大胜 朝堂 食 万 钱
4dc52c84-ce2f-43d4-af5f-3f4025ccd389,立夏前一日登馬氏山亭,朱翌,唐,诗,七言律诗,百忧不到酒三行 万事尽休棋一枰 梅子未黄先著雨 樱桃欲熟正防鶑 忽惊夏向明朝立 便恐春从此地更 数蝶飞来花寂寞 乱蛙鸣处水纵横,"7,7,7,7,7,7,7,7",dc910dc4b9dd242a1cf15a2b54b1673f,百忧 不到 酒 三行 万事 尽 休棋 一 枰 梅子 未 黄 先 著 雨 樱桃 欲 熟 正 防 鶑 忽 惊 夏 向 明朝 立 便恐 春 从此 地 更 数蝶 飞来 花 寂寞 乱 蛙鸣 处水 纵横
32b7c56c-3b2a-46d3-92b2-e2f1cfa0213c,夏日登葉氏山亭,朱翌,唐,诗,七言律诗,云气向晓不待族 风伯忽来吹使醨 溪南溪北半篙碧 荷叶荷花一段奇 旋扣柴荆行问道 少休松槛坐移时 渊明志广桑麻长 此语勿传朝市知,"7,7,7,7,7,7,7,7",a4020546f4ed8c77c2055fef8a893eb8,云气 向晓 不 待 族 风伯 忽来 吹 使 醨 溪 南溪 北半 篙 碧 荷叶 荷花 一段 奇 旋扣 柴荆行 问道 少 休 松槛 坐移 时 渊明 志广桑 麻长 此 语 勿 传 朝市 知
8f52538c-7176-439b-bf8a-b4e4a00da09f,題翠波亭,朱翌,唐,诗,七言律诗,天垂叠𪩘翠相交 风展文漪碧半篙 胜日难逢宜乐此 好山多买不为饕 了无叹息同登岘 忽有会心如在濠 更看溪光山色里 红霞蒸起万株桃,"7,7,7,7,7,7,7,7",54a73597567be7a27c9064d36e49803b,天 垂叠 𪩘 翠 相交 风展 文漪碧 半 篙 胜日 难逢 宜乐 此 好 山 多 买 不 为 饕 了 无 叹息 同登 岘 忽 有 会心 如在 濠 更 看 溪 光 山色 里 红霞 蒸起 万株 桃
17dda4cf-934f-45c6-b688-d54e4789fe94,七夕日遊仙人洞,朱翌,唐,诗,七言律诗,蝉引秋风上桂枝 登山临水不胜悲 兽蹲虎踞石见怪 天划神刓洞出奇 无复碧蓝鸡刷羽 空余青栗猬攒皮 傥分衲子三椽屋 当与仙人五日期,"7,7,7,7,7,7,7,7",723c7aabba3fbebf439da5a938244095,蝉 引 秋风 上 桂枝 登山临水 不胜 悲 兽 蹲 虎踞 石 见怪 天划 神 刓 洞 出奇 无复 碧蓝 鸡刷羽 空余 青栗 猬 攒 皮 傥 分 衲子 三 椽 屋 当 与 仙人 五 日期
a345558f-93db-4705-9b4f-1281bb8af21e,晨光亭夾徑草深庵僧澄鋤去之將種桃李,朱翌,唐,诗,七言律诗,径荒随处长蓬蒿 忽告通幽且尽薅 已问花翁移郁李 竟从金母折蟠桃 住庵事简吾何力 种树功高子有劳 吏用公材当小试 把锄来趁雨如膏,"7,7,7,7,7,7,7,7",9298f85f887a0cf643ebd6f951947349,径荒 随 处长 蓬蒿 忽 告 通幽 且 尽 薅 已 问 花 翁移郁 李 竟 从 金母 折 蟠桃 住 庵 事 简 吾 何力 种树 功高子 有劳 吏用 公材 当 小试 把 锄 来 趁雨如膏
5a54290c-59ca-4bd8-9599-3457170f04bf,晚步城外,朱翌,唐,诗,七言律诗,芒履宽柔野策轻 晚来无暑步重𬮱 人间争梦大槐国 物外谁寻小草民 一鹭缓飞为我伴 半川铺练写余真 何从可觉秋消息 忽有凉飔到白苹,"7,7,7,7,7,7,7,7",2a60bfcdf011d06e07408bc08a2a40d5,芒履 宽柔 野策 轻 晚来 无暑 步重 𬮱 人间 争梦 大槐国 物 外 谁 寻 小 草民 一 鹭 缓飞 为 我 伴 半川 铺 练写 余真 何 从 可觉 秋 消息 忽 有 凉飔到白苹
29f3de3e-7d44-4003-a26f-461fb7825ae2,冬至後三日與羅楚入倅廳兩松下梅花盛開取酒酌石臺上思得名手作松梅圖  其一,朱翌,唐,诗,七言律诗,老松鳞甲待拏云 俯视梅花意亦亲 粉色上参冬岭秀 虬枝下挽越溪真 乘闲到此能终日 与我来游尽可人 今代华光古韦毕 生绡一幅两传神,"7,7,7,7,7,7,7,7",1f6cab3c3e50cd1fc6ad973ad5ab5c9a,老松 鳞甲 待 拏 云 俯视 梅花 意 亦 亲 粉色 上 参冬 岭 秀 虬枝 下 挽 越溪 真 乘闲到 此 能 终日 与 我 来 游 尽 可 人 今代 华光 古韦 毕 生绡 一幅 两 传神
eeada3bc-d586-4b17-b055-d91096659cda,冬至後三日與羅楚入倅廳兩松下梅花盛開取酒酌石臺上思得名手作松梅圖  其二,朱翌,唐,诗,七言律诗,匆匆前日贺书云 那似今朝笑语亲 年例一来窥雪样 岁寒同此见天真 梅间蜂阵长围日 松下鸱蹲反吓人 一碗檑茶未忘本 三杯薄酒不能神,"7,7,7,7,7,7,7,7",77ccfd2a7209c37083f5caca699fd55a,匆匆 前日 贺书云 那 似 今朝 笑语 亲 年 例 一来 窥雪 样 岁寒 同此 见 天真 梅间 蜂阵 长围 日 松下 鸱 蹲 反 吓人 一碗 檑 茶 未 忘本 三杯 薄酒 不能 神
ce421a41-7115-4a1b-bc0a-2021cb422432,冬至後雪夜,朱翌,唐,诗,七言律诗,腊前梅蕊未斜横 至后醅香试满觥 过眼文书开数叶 打窗风雨又三更 闭门高卧直差易 拥鼻微吟何似生 稍取湿薪供热弄 住山如此不多争,"7,7,7,7,7,7,7,7",3290a8b41113aedba565bf3031039e38,腊前 梅蕊 未 斜 横 至 后 醅 香 试满 觥 过眼 文书 开 数叶 打 窗 风雨 又 三 更 闭门 高卧 直差易 拥鼻 微吟 何似生 稍 取湿 薪 供热 弄 住山 如此 不多 争
a1a64dc2-a720-4772-9157-a4cf186e035f,送鄧清臣之行在,朱翌,唐,诗,七言律诗,老去何嫌雪满颠 放怀惟与子周旋 起趋吴越时难得 上继张余理必然 岭海断云归雁底 江湖春浪白鸥前 故人相见问今我 雨笠烟蓑事力田,"7,7,7,7,7,7,7,7",20c183caf050dda818d9315bbdaf146d,老 去 何 嫌 雪满颠 放怀 惟 与 子 周旋 起 趋 吴越 时 难得 上 继张 余理 必然 岭海断云 归雁底 江湖 春浪 白鸥 前 故人 相见 问 今 我 雨笠 烟 蓑事力 田
b36194b9-5130-4d38-b8bf-f342132863cb,元宵懷都城簡胡令俊民時胡連夕在告,朱翌,唐,诗,五言古体,天豁晴光合 簷收雪汁干 灯期欣在候 火令不为难 方喜春风动 犹怜暮色寒 仙晨今夜乐 帝所旧年观 郁郁卿云密 葱葱瑞气盘 五门双阙耸 三岛十洲攒 风伯清黄道 钩陈卫赤鸾 声流车水快 花影烛龙蟠 入望云裳举 低迷杂珮珊 歌翻楼上下 人与月团栾 夜色清凝露 香风静泛兰 陆莲摇艳质 汤鲤转惊澜 故国云天外 家风楚俗完 良时亦竞作 游兴颇相干 诸县丰登际 元戎礼数宽 辍耕来野父 沽酒办余欢 少问飞凫客 遥知道室安 樵青能笑语 太白酌弥漫 要是弦堂宓 何妨花县潘 黄庭须默课 灯录不重看 羡子闭门坐 嗟予脚力殚 醉归哦五字 一一待公刊,"5,5,5,5,5,5,5,5,5,5,5,5,5,5,5,5,5,5,5,5,5,5,5,5,5,5,5,5,5,5,5,5,5,5,5,5,5,5,5,5,5,5,5,5",e128b619bafe5680dec73bb9e653c5f1,天 豁 晴 光合 簷 收雪 汁 干 灯期 欣 在 候 火令 不 为难 方喜 春风 动 犹怜 暮色 寒 仙晨 今夜 乐 帝所 旧年 观 郁郁 卿云密 葱葱 瑞气 盘 五门 双阙 耸 三岛 十洲 攒 风伯 清 黄道 钩 陈卫赤 鸾 声流 车水 快 花影 烛 龙蟠 入望 云裳 举 低迷 杂珮珊 歌 翻 楼上 下 人 与 月团 栾 夜色 清 凝露 香风 静泛兰 陆莲摇 艳质 汤鲤 转惊澜 故国 云天 外 家风 楚俗 完 良 时 亦 竞作 游兴 颇 相干 诸县 丰登 际 元戎 礼数 宽 辍耕 来 野父 沽酒 办余 欢 少 问 飞 凫客 遥 知道 室 安 樵青能 笑语 太白 酌 弥漫 要是 弦堂 宓 何妨 花县 潘 黄庭 须 默课 灯录 不重 看 羡 子 闭门 坐 嗟予 脚力 殚 醉 归 哦 五 字 一一 待 公刊
6eed7de7-7c82-4791-8f1b-3026cfbbe3f7,南華五十韻,朱翌,唐,诗,五言古体,乡里黄梅接 家居祖刹邻 常闻肉身佛 甘作硙坊人 坚有悬腰石 空无拂镜尘 已舂诸米熟 自识本心真 拄杖敲顽质 袈裟绕净身 衣传千古信 法待五年伸 拨棹烦师送 投林避众嗔 风幡俱不动 金瓦定非伦 汝听宜皆谛 吾言决可遵 由兹开顿教 为世作良因 叶坠虽归本 烟斜不向新 铃声鸣白塔 雾气走黄巾 塑手藏衣袭 闺姝败钵唇 全提诸佛印 开尽一花春 代代灯灯续 尘尘刹刹均 性天南北合 道德帝王亲 歌鼓昭陵日 梯航外国珍 庄严及山谷 赐予出金银 龙翥开飞帛 春温布𬙂纶 镇安清净境 奔走护持神 楼阁三千界 香灯十二辰 苏铭模妙墨 柳记刻丰珉 自昔炎荒地 常容放逐臣 流人悲去越 从者病居陈 庚子何忧𫛳 春秋谩感麟 足生行路茧 眉结念亲颦 卜吐千瓶水 官分十束薪 九韶先幸舜 五岭后通秦 气候今无瘴 人情古亦惇 何尝疏北客 賸喜预嘉宾 鼓角催归梦 江湖动钓缗 时花开有信 山果种生仁 武水长怀古 曹溪每问津 端居七里郭 相望一由旬 抱被来投宿 闻钟起及晨 自怜终北向 天遣试南询 竟日云垂地 通宵雨溅茵 桥横一滴上 雀见五方驯 飞锡泉香发 连山宝气振 杖寻桃竹把 佩采楚兰纫 大礼行郊次 洪恩浃海滨 稍宽三面网 归作再生民 甫里将收栗 松江细煮莼 橘怀工戏彩 萱背更栽椿 风急团云絮 霜清洗月轮 治行今数日 问信不嫌频 三宿真成恋 诸寮且遍巡 鬭茶夸顾渚 羹芋说西岷 寺有坛经旧 谁知祖意谆 持归化岭北 大地免沉沦,"5,5,5,5,5,5,5,5,5,5,5,5,5,5,5,5,5,5,5,5,5,5,5,5,5,5,5,5,5,5,5,5,5,5,5,5,5,5,5,5,5,5,5,5,5,5,5,5,5,5,5,5,5,5,5,5,5,5,5,5,5,5,5,5,5,5,5,5,5,5,5,5,5,5,5,5,5,5,5,5,5,5,5,5,5,5,5,5,5,5,5,5,5,5,5,5,5,5,5,5",3485f3536a8b78afc95af53af5636937,乡里 黄梅 接 家居 祖刹 邻 常闻 肉身 佛 甘作 硙 坊 人 坚有 悬腰 石 空 无 拂 镜 尘 已 舂 诸米 熟 自识 本心 真 拄杖 敲 顽质 袈裟 绕 净身 衣传 千古 信 法 待 五年 伸 拨 棹 烦 师 送 投林 避众 嗔 风幡 俱 不动 金瓦定 非伦 汝 听 宜 皆 谛 吾 言 决可 遵 由兹 开 顿教 为 世作 良因 叶坠 虽 归 本 烟 斜 不 向 新 铃声 鸣 白塔 雾气 走 黄巾 塑手 藏 衣 袭 闺 姝 败 钵 唇 全提 诸佛印 开尽 一花春 代代 灯 灯续 尘 尘刹 刹 均 性天 南北 合 道德 帝王 亲 歌鼓 昭陵 日 梯航 外国 珍 庄严 及 山谷 赐予 出 金银 龙翥开飞 帛 春 温布 𬙂 纶 镇安 清净 境 奔走 护持 神 楼阁 三千 界 香灯 十二 辰 苏铭模 妙墨 柳 记刻 丰珉 自 昔 炎 荒地 常容 放逐 臣 流人 悲去 越 从者 病居 陈 庚子 何忧 𫛳 春秋 谩感 麟 足生 行路 茧 眉结念亲颦 卜 吐 千瓶 水 官分 十束 薪 九韶先 幸舜 五岭 后通 秦 气候 今 无瘴 人情 古亦 惇 何尝 疏北 客 賸 喜 预 嘉宾 鼓角 催归 梦 江湖 动 钓 缗 时花 开有 信 山果 种生仁 武水 长 怀古 曹溪 每 问津 端居 七里 郭 相望 一 由旬 抱 被 来 投宿 闻钟 起及 晨 自怜 终 北向 天 遣试 南询 竟 日 云 垂 地 通宵 雨溅茵 桥 横 一滴 上 雀 见 五方 驯 飞锡泉 香 发 连山 宝气 振 杖 寻桃竹 把 佩采 楚兰 纫 大礼 行郊 次 洪恩 浃 海滨 稍宽 三面 网 归作 再生 民 甫 里 将 收栗 松江 细 煮 莼 橘怀 工戏 彩 萱背 更 栽 椿 风 急团 云絮 霜 清洗 月 轮 治行 今 数日 问信 不嫌 频 三 宿 真 成恋 诸 寮 且 遍巡 鬭 茶 夸 顾 渚 羹芋 说 西岷 寺 有 坛经 旧 谁知 祖意谆 持 归化 岭北 大地 免 沉沦
b95925cf-8b22-4931-b52b-6bb09a4913ce,送吏部張尚書帥成都一百韻,朱翌,唐,诗,五言古体,一代亨衢上 明公逸步超 河东书具作 圯下老相邀 海阔云垂翼 天清斗压杓 三人前鼎甲 千佛仰孤飚 弟子师尊董 诸儒称述萧 西昆收俊乂 东壁绝尘嚣 别乘将离汴 轻舟径指苕 湖山纵清美 家国尚飘摇 恸哭天倾柱 归情户见蛸 奉祠投里闬 招隠向山椒 并海屯千卫 披榛拱百僚 回銮须故国 负靮且今朝 光列哀乌位 星驰封马轺 贤裾来接武 阴沴自潜消 香案依丹陛 螭㘭立紫霄 飞鸿九天去 归鹤一声嘹 主上思图旧 王人促见招 起居还左史 议论鄙南朝 大吕声扬远 元圭质匪雕 掖垣裁诏密 禁路赐缨彯 灭浇图兴夏 巡方首从姚 自南瞻析木 直北望玄枵 玉海千寻浪 江南五色鹞 矫如出尘隼 凛若在秋雕 去国还追信 刓章岂易尧 光华司马甲 整顿路车鞗 国事烦参决 廷询得具条 乘时笑干没 许国敢轻佻 河洛干戈满 陵原草木焦 青春深仗节 久雨更乘橇 取道先辕楚 扬旌转望萧 一抔藏万世 九庙正三昭 遂使仪如汉 将令乐奏韶 路迷彪过迹 涧涸夜生潮 去日春仍浅 归期暑正熇 君王喜不寐 天下首方翘 疏奏忠无隠 臣生苦不聊 戴天那忍共 得地岂宜骄 内治今当亟 高名不敢要 铨衡真有托 启事复何辽 道直咸推汲 谋深岂计晁 定非挥扇羽 宁要插蝉貂 褒贬书方举 奸谀骨合销 怀开真坦坦 燕处自夭夭 当宁西南顾 常怀参井迢 徧询医国效 立遣愈民痟 文武资兼禀 诗书气不恌 众皆可郤縠 一以委张昭 除目凌晨下 行装即日撩 被携犹剌刺 涉远乃翛翛 帆影三江水 车声万里桥 丈人峰嵂屼 神女峡岧峣 石室画暗淡 草堂人寂寥 山围玉垒峻 水减石犀遥 石表笋双立 铜青柏未凋 锦江喧士女 药市混仙樵 劫堕乾坤坏 流横海岳漂 惟兹井络外 依旧角弓弨 自昔三刀梦 多传五袴谣 威余严仆射 功说李文饶 文定棠尤美 乖崖福可徼 事今难悉数 公亦岂其苗 秦地新通栈 瞿塘稳泛桡 虎貔环外阃 耨耜得深穮 正可供壶奕 随宜列鼓箫 蒲鞭束高阁 竹马戏垂髫 好阅相如赋 终闲李广刁 奎文天象转 延阁士林标 此去庭无愈 行闻众选陶 付之枢极运 咸仰泰阶霄 贱子无三径 平生有一瓢 老将书蠹槁 时作草虫喓 大笑玉三刖 不求银十腰 古今同阅宙 南北信吹薸 已类蜂粘网 真成鹿覆蕉 屡经多盗境 几至独身跳 何处地堪避 知谁战敢挑 月明三匝鹊 巢比一枝鹩 钓濑长烹鲤 穷山饱听鸮 临书池尽黑 就局博嫌么 臂有七贤把 丹亡九转烧 唯堪贯薜荔 未肯𢫬芳虈 卖药难争价 为农等寓侨 稍能羞野葛 初未识江珧 已罢寻蛩駏 欣闻退猲獢 谁怜人为米 敢有意迁乔 过我深披藋 追凉薄曳绡 狐裘怜晏子 缟带与公侨 挽引烦推毂 陶甄为置窑 清时容潦倒 策府著刍荛 忆昨西湖上 随公羽盖飘 青山迎晋履 绿水泛湖𦨣 上相尊仍美 将军勇正骁 道争棋屡覆 壶响箭呈枭 茶乳晴尤发 香云浄更翲 晚花栖嫩菊 近岸俯游鲦 四望天连水 群簪玉及瑶 政亲连榻坐 倏见锡戈雕 良月霜枫冷 佳晴雪霰销 留公已无策 鼎食望加调,"5,5,5,5,5,5,5,5,5,5,5,5,5,5,5,5,5,5,5,5,5,5,5,5,5,5,5,5,5,5,5,5,5,5,5,5,5,5,5,5,5,5,5,5,5,5,5,5,5,5,5,5,5,5,5,5,5,5,5,5,5,5,5,5,5,5,5,5,5,5,5,5,5,5,5,5,5,5,5,5,5,5,5,5,5,5,5,5,5,5,5,5,5,5,5,5,5,5,5,5,5,5,5,5,5,5,5,5,5,5,5,5,5,5,5,5,5,5,5,5,5,5,5,5,5,5,5,5,5,5,5,5,5,5,5,5,5,5,5,5,5,5,5,5,5,5,5,5,5,5,5,5,5,5,5,5,5,5,5,5,5,5,5,5,5,5,5,5,5,5,5,5,5,5,5,5,5,5,5,5,5,5,5,5,5,5,5,5,5,5,5,5,5,5,5,5,5,5,5,5",54d5dd204cb5341f31aa36c3561f345c,一代 亨 衢上 明公逸 步 超 河东 书 具作 圯 下 老 相邀 海阔云 垂翼 天清斗 压 杓 三 人 前 鼎 甲 千 佛仰 孤飚 弟子 师尊 董 诸儒 称述 萧 西昆收 俊 乂 东壁 绝 尘嚣 别 乘 将 离 汴 轻舟 径 指苕 湖山 纵 清美 家 国尚 飘摇 恸哭 天倾柱 归 情户 见 蛸 奉祠 投 里 闬 招 隠 向 山椒 并 海屯 千卫 披 榛拱 百僚 回銮 须 故国 负 靮 且 今朝 光列哀 乌位 星驰 封马 轺 贤 裾 来接 武 阴 沴 自 潜 消 香案 依丹 陛 螭 㘭 立紫霄 飞鸿 九天 去 归鹤 一声 嘹 主 上思 图 旧 王 人 促见 招 起居 还 左史 议论 鄙 南朝 大 吕 声扬 远 元圭 质匪 雕 掖垣 裁诏 密 禁路 赐 缨 彯 灭 浇图 兴夏 巡方 首 从 姚 自南瞻 析木 直北 望玄 枵 玉海 千寻浪 江南 五色 鹞 矫 如 出尘 隼 凛若 在 秋雕 去国 还 追信 刓 章 岂 易 尧 光华 司马 甲 整顿 路 车 鞗 国事 烦 参决 廷 询得 具条 乘时 笑 干 没 许国 敢 轻佻 河洛 干戈 满 陵原 草木 焦 青春 深 仗 节 久雨 更 乘 橇 取道 先辕 楚 扬旌 转望 萧 一 抔 藏 万世 九庙 正三昭 遂 使 仪 如汉 将令 乐奏韶 路迷彪 过迹 涧 涸夜生潮 去日 春 仍 浅 归期 暑 正 熇 君王 喜 不寐 天下 首方 翘 疏奏 忠 无 隠 臣 生苦不聊 戴天那 忍 共 得 地 岂宜 骄 内治 今 当 亟 高 名 不敢 要 铨衡 真 有 托 启事 复何 辽 道 直 咸 推 汲 谋 深 岂计 晁 定非 挥 扇 羽 宁要 插 蝉 貂 褒贬 书方 举 奸 谀 骨 合销 怀开真 坦坦 燕 处 自夭夭 当 宁 西南 顾 常怀 参井迢 徧 询 医 国 效 立 遣愈 民 痟 文武 资 兼 禀 诗书 气 不 恌 众 皆 可 郤 縠 一 以 委 张昭 除 目 凌晨 下 行装 即日 撩 被 携 犹 剌 刺 涉 远 乃 翛 翛 帆影 三 江水 车 声 万里 桥 丈人 峰 嵂 屼 神女 峡 岧 峣 石室 画 暗淡 草堂 人 寂寥 山围 玉垒 峻 水减石犀遥 石表笋 双立 铜青 柏未 凋 锦江 喧 士女 药市 混仙 樵 劫 堕 乾坤 坏 流 横海岳 漂 惟兹井络外 依旧 角弓 弨 自 昔 三刀 梦 多 传 五袴谣 威 余严仆 射 功 说 李文饶 文定 棠尤 美 乖 崖 福 可 徼 事今 难 悉数 公亦 岂 其 苗 秦地 新通 栈 瞿塘 稳泛 桡 虎 貔环 外 阃 耨 耜 得 深 穮 正 可 供壶奕 随宜 列鼓箫 蒲 鞭束 高阁 竹 马戏 垂髫 好阅 相如 赋 终 闲 李广 刁 奎 文 天象 转 延阁 士林 标 此去 庭 无愈 行闻众 选陶 付之枢极运 咸仰泰 阶霄 贱子 无 三径 平生 有 一瓢 老将 书蠹 槁 时作 草虫 喓 大笑 玉三 刖 不求 银 十腰 古今 同 阅宙 南北 信 吹 薸 已 类 蜂 粘网 真成鹿 覆 蕉 屡经 多 盗 境 几 至 独身 跳 何处 地 堪避 知 谁 战 敢 挑 月 明三 匝 鹊 巢比 一枝 鹩 钓濑 长 烹 鲤 穷 山 饱 听 鸮 临书池 尽 黑 就 局 博嫌 么 臂 有 七 贤 把 丹 亡 九 转烧 唯堪贯 薜荔 未 肯 𢫬 芳 虈 卖药 难 争价 为 农 等 寓 侨 稍 能 羞 野葛 初未 识 江珧 已 罢 寻 蛩 駏 欣闻 退 猲 獢 谁 怜 人为 米 敢 有意 迁 乔 过 我 深 披 藋 追 凉薄曳 绡 狐裘 怜 晏子 缟 带 与 公侨 挽引 烦 推毂 陶甄 为 置 窑 清时 容 潦倒 策府 著 刍荛 忆 昨 西湖 上 随 公羽盖 飘 青山 迎晋履 绿水 泛湖 𦨣 上 相尊 仍 美 将军 勇 正 骁 道争 棋 屡覆 壶 响箭 呈 枭 茶 乳 晴 尤发 香云浄更 翲 晚 花栖嫩 菊 近岸 俯 游 鲦 四望 天连 水 群簪 玉及瑶 政亲 连 榻 坐 倏 见 锡 戈雕 良 月 霜 枫 冷 佳 晴雪 霰销 留 公 已 无策 鼎 食望 加调
