id,title,author,dynasty,genre,poem_type,sentences_simplified,meter_pattern,hash,words
13cbeac1622ec0e61468708e0c9064a7,玉漏迟,陈著,宋,词,词,故都冬亦好 风光可是 人间曾有 问雪楼台 肉阵不教寒透 妙手搀春弄巧 唤得应 千花如绣 灯市酒 笙歌镇似 元宵时候 见说是事都新 但破冻潮声 去来依旧 老梦无情 不到六桥风柳 回首孤山好景 倩人问 梅花安否 应自瘦 雪霜可能僝僽,"5,4,4,4,6,6,3,4,3,4,4,6,5,4,4,6,6,3,4,3,6",5d03f54a0787569947b49e39a4c420c1,故都 冬 亦 好 风光 可是 人间 曾 有 问雪 楼台 肉阵不教寒 透 妙手 搀 春弄巧 唤 得 应 千花如绣 灯市 酒 笙歌 镇似 元宵 时候 见 说 是 事 都 新 但 破冻 潮声 去来 依旧 老梦 无情 不到 六桥 风柳 回首 孤山 好景 倩 人 问 梅花 安否 应 自瘦 雪霜 可能 僝 僽
fca1080d35a8a482362a4aa03b0e76d9,沁园春,陈著,宋,词,词,天盖西倾 地轴东翻 两年以来 那关中形势 已归勃勃 江南人马 都是回回 咄咄书空 栖栖问路 岁晚山空风雪催 如何得 与浑家踏遍 雪顶岩隈 谁知有客敲推 把世变心烦都说开 道严霜不杀 不成葭苇 冱寒惯耐 方是松梅 万事过前 一场梦里 分付茅柴三两杯 犹痴望 有太平时节 游戏春台,"4,4,4,5,4,4,4,4,4,7,3,5,4,6,8,5,4,4,4,4,4,7,3,5,4",ab1fefa3e68a9d0e34557b8ac05ac6dd,天盖西 倾 地轴 东翻 两年 以来 那 关中 形势 已 归 勃勃 江南 人马 都 是 回回 咄咄书空 栖 栖 问路 岁晚 山空 风雪 催 如何 得 与 浑家 踏遍 雪顶 岩 隈 谁知 有 客 敲 推 把 世变 心烦 都 说 开 道 严霜 不 杀 不成 葭 苇 冱 寒 惯 耐 方是 松梅 万事 过前 一场 梦 里 分付 茅 柴三 两杯 犹 痴望 有 太平 时节 游戏 春 台
bd8684778b8fa0f1b5fa81d2c5805518,沁园春,陈著,宋,词,词,旗盖运迁 衣冠事乖 岂非命来 自黄粱枕觉 分明看破 翠蓬舟近 及早抽回 谁料山深 也同鼎沸 步步危机忙里催 愁无奈 过青山万叠 碧水千隈 此愁何计能推 算何日天教眉锁开 记六桥花舫 晴边访柳 孤山草酌 雪后评梅 回首西湖 伤心前事 覆水如何收上杯 东风好 问如今吹入 谁处楼台,"4,4,4,5,4,4,4,4,4,7,3,5,4,6,8,5,4,4,4,4,4,7,3,5,4",715929bb5b575f14b6a883b49609812e,旗盖 运迁 衣冠 事乖 岂非 命来 自 黄粱 枕觉 分明 看破 翠蓬舟 近 及早 抽回 谁料 山 深 也 同 鼎沸 步步 危机 忙 里 催 愁 无奈 过 青山 万叠 碧水 千 隈 此 愁 何计 能 推 算 何日 天教 眉锁 开 记 六桥 花舫 晴 边 访 柳 孤山 草 酌 雪 后 评梅 回首 西湖 伤心 前 事 覆水 如何 收上 杯 东风 好 问 如今 吹入 谁 处 楼台
59fbb3032147dede65d1776db5f46018,沁园春,陈著,宋,词,词,人生功名 在醉梦中 早须掉头 自南宫一券 尘泥偶脱 前程双毂 日月如流 蕙帐真盟 菜羹馀味 江上归舟谁得留 谁知道 有邵平瓜圃 何日封侯 天天又不人由 奈危世山林也有忧 况青岗不助 晋家风鹤 黑云直卷 吴分星牛 分寸残生 万千魔障 他事如今都罢休 关心处 是离离禾黍 故国宗周,"4,4,4,5,4,4,4,4,4,7,3,5,4,6,8,5,4,4,4,4,4,7,3,5,4",7be6ab8451d88bb155f9d0d825cdd535,人生 功名 在 醉 梦 中 早须 掉头 自 南宫 一券 尘泥 偶 脱 前程 双毂 日月如流 蕙 帐 真盟 菜羹 馀 味 江上 归 舟 谁 得留 谁 知道 有 邵平 瓜圃 何日 封侯 天天 又 不 人 由 奈 危世 山林 也 有 忧 况 青岗 不助 晋 家风 鹤 黑云 直卷 吴分星 牛 分寸 残生 万千 魔障 他 事 如今 都 罢休 关心 处 是 离离 禾 黍 故国 宗周
8f1a20f2a8c97178609c402326e1dc62,沁园春,陈著,宋,词,词,无价韶华 一笑相酬 青钱似苔 奈东风轻劣 催红雨去 西园次第 放绿阴回 老后时光 眉间心事 恰似怕酸人著梅 须知道 有谁能百岁 日日开怀 从教世变轮推 也莫问人间春去来 看渊明归了 有形谁役 少陵醉里 无闷堪排 贫贼何妨 风流自别 不是沈沈浊世杯 层霄上 与大鹏盘礴 下视浮埃,"4,4,4,5,4,4,4,4,4,7,3,5,4,6,8,5,4,4,4,4,4,7,3,5,4",266f47c0e4ff7647caa513878cfa1b9e,无价 韶华 一 笑 相酬 青 钱 似 苔 奈 东风 轻劣 催 红 雨 去 西园 次第 放 绿阴 回 老后 时光 眉间 心事 恰似 怕 酸 人 著 梅 须 知道 有 谁 能 百岁 日日 开怀 从教 世变 轮 推 也 莫 问 人间 春去 来 看 渊明 归 了 有形 谁 役 少陵 醉里 无闷堪 排 贫贼 何妨 风流 自别 不是 沈沈 浊世 杯 层霄 上 与 大鹏 盘礴 下视 浮 埃
88d3ce7dea8f246de93258e42a3b029c,沁园春,陈著,宋,词,词,人生几何 如何不自 珍重此生 向蠹残字上 甘心抛掷 蜗尖争处 著意丁宁 箭过时光 剑炊世界 谁带经锄谁笔耕 分明似 满一锅汤沸 无处清□ 输兄 练得闲成 □无辱无忧惧惊 但菜羹粝饭 不求他味 芒鞋竹杖 足畅幽情 八十年来 万千看破 胸次春风秋月明 梅花帐 称困眠醒起 无打门声,"4,4,4,5,4,4,4,4,4,7,3,5,4,2,4,7,5,4,4,4,4,4,7,3,5,4",5479d7d0398a345b2b3c6c67e084bfa0,人生 几何 如何 不 自 珍重 此生 向 蠹残字 上 甘心 抛掷 蜗尖争 处 著意 丁宁 箭 过 时光 剑 炊 世界 谁 带经 锄 谁 笔耕 分明 似 满 一 锅汤 沸 无处 清 □ 输兄 练 得闲 成 □ 无辱 无忧 惧惊 但 菜羹 粝 饭 不求 他 味 芒鞋 竹杖 足 畅 幽情 八十年 来 万千 看破 胸次 春风 秋月明 梅花 帐 称 困眠 醒起 无打门声
636d95f8387e2a95b4bbc724e699913f,沁园春,陈著,宋,词,词,信书成痴 挨到如今 无生可谋 奈浑家梦饭 谷难虚贷 长年断肉 菜亦悭搜 风雨潇潇 江山落落 死又还生春复秋 八十岁 是这般多活 堪吊堪羞 休休 盍自回头 要铁汉须从穷处求 那袁安闭户 恬然僵卧 少陵任妇 长是贫愁 一等清风 千年佳话 蚁蚋看他金谷楼 是是是 笑出门天阔 一片云浮,"4,4,4,5,4,4,4,4,4,7,3,5,4,2,4,8,5,4,4,4,4,4,7,3,5,4",56e6b4f99baa6a13cde930967ff1d22d,信书 成痴 挨 到 如今 无生可谋 奈 浑家 梦 饭 谷难 虚贷 长年 断肉 菜 亦 悭 搜 风 雨潇潇 江山 落落 死 又 还生 春复秋 八十岁 是 这般 多 活 堪 吊堪羞 休休 盍 自 回头 要 铁汉 须 从穷 处求 那 袁安 闭 户 恬然 僵卧 少陵 任妇 长是 贫愁 一等 清风 千年 佳话 蚁 蚋 看 他 金谷 楼 是 是 是 笑 出门 天 阔 一片 云浮
61b03caff9a5a854dac4d69cab71cd5c,水龙吟,陈著,宋,词,词,好花天也多悭 放迟留做残春主 丰肌弱骨 晴娇无奈 新妆相妒 翠幕高张 玉阑低护 怕惊风雨 记年时 多少诗朋酒伴 逢花醉 簪花舞 那料无情光景 到如今 水流云去 残枝剩叶 依依如梦 不堪相觑 心事谁知 杜鹃饶舌 自能分诉 日西斜 烟草凄凄 望断洛阳何处,"6,7,4,4,4,4,4,4,3,6,3,3,6,3,4,4,4,4,4,4,4,3,4,6",cd999b1c86235c6ebb5f24714907e106,好 花 天 也 多 悭 放迟 留做 残春 主 丰肌弱骨 晴 娇 无奈 新妆 相妒 翠幕 高张 玉阑 低护 怕 惊 风雨 记年 时 多少 诗朋酒 伴 逢花醉 簪花 舞 那 料 无情 光景 到 如今 水流 云 去 残枝 剩叶 依依 如 梦 不堪 相觑 心事 谁知 杜鹃 饶舌 自能 分诉 日西 斜 烟草 凄凄 望断 洛阳 何处
bce32305b31f810a45f4ec3fe7f1f78d,水龙吟,陈著,宋,词,词,百花开遍园林 又春归也谁为主 深黄浅紫 娇红腻白 他谁能妒 似不胜情 醉归花月 梦回云雨 又丰肌 恰被东风摇动 盈盈底 霓裳舞 世事纷纷无据 与杨花 飞来飞去 当年斗大 知他多少 蜂窥蝶觑 金谷春移 玉华人散 此愁难诉 漫寻思 承诏沈香亭上 倚阑干处,"6,7,4,4,4,4,4,4,3,6,3,3,6,3,4,4,4,4,4,4,4,3,6,4",ef0d82d2092544fc7180c7025ef7bdd4,百花 开遍 园林 又 春 归 也 谁 为主 深黄 浅 紫 娇红 腻 白 他 谁 能妒 似 不胜 情 醉 归 花 月 梦回 云雨 又 丰 肌 恰 被 东风 摇动 盈盈 底 霓裳 舞 世事 纷纷 无据 与 杨花 飞来飞去 当年 斗 大 知 他 多少 蜂窥蝶 觑 金谷 春 移 玉 华人 散 此 愁 难诉 漫 寻思 承 诏 沈香亭 上 倚 阑干 处
617a774dc4b36d646b27d5431c50336a,水龙吟,陈著,宋,词,词,杜鹃啼正忙时 半风半雨春悭霁 酴醿未过 樱甜初熟 梅酸微试 一种红芳 九苞真色 舞窗翻砌 自仙樊去后 无人题凤 阑干外 成孤媚 谁信阳春妙手 锦云机 新番裁制 东君冷看 如何描摸 天然艳美 浑欲乘风 又如羞日 做双飞体 伫骖鸾 称得花前弄玉 与吟箫婿,"6,7,4,4,4,4,4,4,5,4,3,3,6,3,4,4,4,4,4,4,4,3,6,4",4f20bcc47802aca7e2c0c44a1cd868ca,杜鹃 啼 正 忙 时 半风半雨 春 悭 霁 酴 醿 未 过 樱甜 初 熟 梅酸 微试 一种 红芳 九 苞 真色 舞窗 翻砌 自 仙樊 去后 无人 题凤 阑干 外 成 孤媚 谁 信阳 春 妙手 锦云 机 新番 裁制 东君 冷 看 如何 描摸 天然 艳美 浑欲 乘风 又 如 羞 日 做 双飞 体 伫 骖 鸾 称 得 花 前 弄玉 与 吟 箫 婿
383d7243a3c2e2739faf2844a123310a,瑞鹤仙,陈著,宋,词,词,对南山翠峭 几百年 银青门第转好 梅花弄春小 向重帘暖处 华筵开早 斑衣簇绕 舞香云 哄堂颂祷 稳生涯 都自心田 自有老天堪靠 应道 □□□□ 乐事难逢 可轻过了 鲈肥蟹健 桑落酒 酿来妙 称瑶卮争劝 襟怀宽放 一点尘嚣不到 但从今 家庆年年 醉乡里笑,"5,3,6,5,5,4,4,3,4,3,4,6,2,4,4,4,4,3,3,5,4,6,3,4,4",b3367ca26435ef111a8a55be952c7527,对 南山 翠峭 几百年 银青 门第 转好 梅花 弄 春 小 向 重帘 暖 处 华筵 开 早 斑衣 簇绕 舞 香云 哄堂 颂祷 稳 生涯 都 自 心田 自有 老天 堪靠 应道 □ □ □ □ 乐事 难逢 可轻 过 了 鲈 肥 蟹 健 桑落 酒 酿来 妙 称 瑶 卮 争 劝 襟怀 宽 放 一点 尘嚣 不到 但 从今 家庆 年 年 醉乡 里 笑
4938509b7ada04010629fa86d4c1eec8,洞仙歌,陈著,宋,词,词,清溪带竹 竹外山光抱 新筑浑如图画了 称闲心 管领昨夜天风 吹送□ 端的琅音恰到 谁知青云上 鸾凤翱翔 曾把功名试多少 到如今梦觉 佩著飞霞 浑家问 玉芝瑶草 试冷看 重门外如何 恁得似 壶中羽衣尘表,"4,5,7,3,6,3,6,5,4,7,5,4,3,4,3,5,3,6",8ed222be09aeb7af5df4aad082be04df,清溪 带 竹 竹 外 山光 抱 新筑 浑如 图画 了 称 闲心 管领 昨夜 天风 吹送 □ 端的 琅音 恰 到 谁知 青云 上 鸾凤 翱翔 曾 把 功名 试 多少 到 如今 梦觉 佩著 飞霞 浑家 问 玉芝 瑶草 试冷 看 重 门外 如何 恁 得 似 壶 中 羽衣 尘表
1b83dff8a6a2e657c210d712dd7cc6af,贺新郎,陈著,宋,词,词,北马飞江过 画图中 花城柳郭 万摧千挫 羌管直惊猿鹤梦 愁得千山翠锁 有多少 风餐雨卧 回首西湖空溅泪 醉沈沈 轻掷金瓯破 平地浪 如何亸 君家志气从来大 舞蓝袍 牵丝幕外 肯饶他个 谁料腥埃妨阔步 孤瘦依然故我 待天有情时须可 且占雪溪清绝处 看精神 全是梅花做 嫌暖饱 耐寒饿,"5,3,4,4,7,6,3,4,7,3,5,3,3,7,3,4,4,7,6,7,7,3,5,3,3",c8af5bc527c6685a898f7577409ed670,北马飞 江 过 画图 中 花城 柳郭 万 摧千挫 羌 管 直惊猿鹤梦 愁 得 千山 翠锁 有 多少 风餐雨卧 回首 西湖 空 溅 泪 醉 沈沈 轻 掷 金瓯 破 平地 浪 如何 亸 君家 志气 从来 大 舞蓝袍 牵丝 幕外 肯饶 他个 谁料 腥 埃 妨 阔步 孤瘦 依然故我 待 天 有情 时须 可 且 占 雪溪清 绝处 看 精神 全 是 梅花 做 嫌 暖 饱 耐寒 饿
40f95851d49e46f8bb0a6de8a6a72a8e,念奴娇,陈著,宋,词,词,晓村深处 记当年 轻被东风吹别 重得相看春雨屋 心事从头细说 深院灯寒 流苏帐暖 曾梦梅花月 如今何在 消凝分付啼鴂 亭馆飞入腥烟 残香惟有 数朵酴醿雪 旧燕寻巢来又去 也觉双飞声咽 泛梗生涯 空花世界 且做杯中活 可人兰玉 风光还有时节,"4,3,6,7,6,4,4,5,4,6,6,4,5,7,6,4,4,5,4,6",4cce631b5d7ee06929436a668df4ca7f,晓村 深处 记 当年 轻 被 东风 吹 别 重 得 相看 春雨 屋 心事 从头 细说 深院 灯寒 流苏 帐 暖 曾梦 梅花 月 如今 何在 消凝 分付 啼 鴂 亭馆 飞入 腥 烟 残香 惟有 数朵 酴 醿 雪 旧 燕寻巢 来 又 去 也 觉 双飞 声 咽 泛 梗 生涯 空花 世界 且 做 杯中 活 可 人 兰玉 风光 还有 时节
7e6493b89131e4e6e5e6a1c89708bfad,念奴娇,陈著,宋,词,词,百年光景 算山中 多占人间分数 一片清风梅是主 弹压粗花俗树 小小鱼池 深深莺谷 曲曲香云路 堪诗堪画 是天分付闲处 闻要跨鹤西游 家林自好 且何妨留驻 趁取酴醿新煮酒 烧笋煎花为具 万事皆空 千金一刻 底用闲愁苦 无情杜宇 笑他催我归去,"4,3,6,7,6,4,4,5,4,6,6,4,5,7,6,4,4,5,4,6",1ca3a9605adcca485489f5ac5af6960e,百年 光景 算 山中 多 占 人间 分数 一片 清风 梅 是 主 弹压 粗 花俗 树 小小 鱼池 深深 莺谷 曲曲 香云路 堪 诗 堪 画 是 天 分付 闲处 闻 要 跨鹤西游 家林 自好 且 何妨 留驻 趁 取 酴 醿 新 煮 酒 烧笋 煎 花 为 具 万事 皆空 千金一刻 底用 闲 愁苦 无情 杜宇 笑 他 催 我 归去
87441c96d90574bdfb14b1ba152a9cf1,念奴娇,陈著,宋,词,词,雨帘高卷 见榴花 应怪风流人老 是则年年佳节在 无奈闲心悄悄 巧扇风轻 香罗雪湿 梦里曾看了 如今溪上 欢盟分付年少 偏是眉好相宜 呼儿扶著 把菖蒲迎笑 说道浮生饶百岁 能有时光多少 幸自清贫 何妨乐趣 谱入瑶琴调 杯杯酒满 这般滋味谁晓,"4,3,6,7,6,4,4,5,4,6,6,4,5,7,6,4,4,5,4,6",271879481daeb9f427d5c9678db95f50,雨帘 高 卷 见 榴花 应怪 风流 人 老 是 则 年 年 佳节 在 无奈 闲心 悄悄 巧 扇风 轻 香罗 雪湿 梦 里 曾 看 了 如今 溪 上 欢盟 分付 年少 偏 是 眉 好 相宜 呼儿 扶著 把 菖蒲 迎笑 说道 浮生 饶 百岁 能 有 时光 多少 幸自 清贫 何妨 乐趣 谱 入 瑶 琴调 杯 杯酒 满 这般 滋味 谁 晓
f7ab4b3a8b7dd5d0c1312c96561affb9,绮罗香,陈著,宋,词,词,障暑稠阴 梳凉细缕 □□□□□□ 露腋玲珑 多少闹中幽趣 断又续 可是无情 □相送 短长亭路 记春风 曾著莺啼 便娇那得袅如许 知音人自暗省 凝睇青云影里 黄昏犹伫 一部笙𥱧 消得翠腰供舞 堪对景 翻入新妆 鬓影低 衬教眉妩 试回头 旧日章台 怕听声咽处,"4,4,6,4,6,3,4,3,4,3,4,7,6,6,4,4,6,3,4,3,4,3,4,5",0ec935e188007bd640461d9668007b5b,障暑 稠 阴 梳 凉细缕 □ □ □ □ □ □ 露腋 玲珑 多少 闹 中 幽趣 断 又 续 可是 无情 □ 相 送 短长 亭路 记 春风 曾 著 莺啼 便 娇 那 得 袅 如许 知音 人 自暗 省 凝睇 青云 影里 黄昏 犹 伫 一部 笙 𥱧 消得 翠 腰 供 舞 堪 对 景 翻入 新妆 鬓影 低 衬教眉 妩 试 回头 旧日 章台 怕 听 声 咽 处
0ef5ac0196d615850155c5f58e3eab25,绮罗香,陈著,宋,词,词,袅入风腔 清含露脉 声在丝丝烟碧 破暑吹凉 天付弄娇双腋 似恋恋 舞翠纤腰 断还续 忍相离拆 最欢时 微雨初晴 夕阳犹湿淡云隔 新来多少怆感 心怕无情过马 攀条惊著 梦里妆台 休说听来曾昨 凝伫漫 番节笙音 暗自将 玉阑轻拍 问谁能 唤起陶潜 醉翁同赋却,"4,4,6,4,6,3,4,3,4,3,4,7,6,6,4,4,6,3,4,3,4,3,4,5",ae0d6ee3e87bb6f3a7860ec0a62eab55,袅入风腔 清 含露 脉 声 在 丝丝 烟 碧 破暑 吹 凉 天付弄娇双腋 似 恋恋 舞翠 纤腰 断 还续 忍相离 拆 最 欢 时 微雨 初晴 夕阳 犹湿淡云 隔 新 来 多少 怆 感 心 怕 无情 过马 攀 条 惊著 梦 里 妆台 休说 听来 曾 昨 凝 伫漫 番节 笙音 暗自 将 玉阑 轻拍 问 谁 能 唤起 陶潜 醉翁 同赋 却
a816e58c467009d75a6dfd0956bad64c,绮罗香,陈著,宋,词,词,霁晓楼台 斜阳渡口 凉腋新声初到 占断清阴 随意自成宫调 看取次 颤引薰风 想无奈 露餐清饱 有时如 柔袅𥱧丝 忽如笙咽转娇妙 谁知忧怨极处 轻把宫妆蜕了 飞吟枝杪 耳畔如今 凄感又添多少 愁绪正 萦绕妆台 怎更禁 被他相恼 送残音 立尽黄昏 月明深院悄,"4,4,6,4,6,3,4,3,4,3,4,7,6,6,4,4,6,3,4,3,4,3,4,5",bef11a404743ce2b944f392f75ffee5e,霁 晓 楼台 斜阳 渡口 凉腋 新声 初 到 占断 清 阴 随意 自成 宫调 看取 次 颤引 薰风 想 无奈 露餐 清 饱 有时 如 柔袅 𥱧 丝 忽 如 笙 咽 转 娇妙 谁知 忧怨 极 处 轻 把 宫 妆 蜕 了 飞吟 枝 杪 耳畔 如今 凄感 又 添 多少 愁绪 正 萦绕 妆台 怎 更禁 被 他 相恼 送 残音 立尽 黄昏 月 明 深院 悄
2600ee49f7f864801749924ba4a6b302,满江红,陈著,宋,词,词,梦里京华 忽听得 庭花遗曲 到醒来 愁满东风山屋 春事已非空结绮 晓班无分随群玉 想天涯 沦落杜秋娘 攒眉绿 谁能顾 荒芜菊 谁能问 平安竹 任时光流转 都成虚辱 无可奈何天地隘 只饶走得溪山足 但逢人 相问麦青青 何时熟,"4,3,4,3,6,7,7,3,5,3,3,3,3,3,5,4,7,7,3,5,3",97e27ff21d74fc2a439aa7ea287ef1e5,梦 里 京华 忽 听 得 庭花 遗曲 到 醒来 愁满 东风 山屋 春事 已非 空结 绮 晓班 无分 随群 玉 想 天涯 沦落 杜秋娘 攒眉 绿 谁 能 顾 荒芜 菊 谁 能 问 平安 竹 任 时光 流转 都 成 虚辱 无可奈何 天地 隘 只 饶 走 得 溪 山 足 但 逢 人 相问 麦 青青 何时 熟
d54643bb9e29b2b68f6abf5e394c3ca0,烛影摇红,陈著,宋,词,词,吾菊山翁 鹤骖来自蓬云界 平铺心地有天知 楚楚生兰茝 膝下青衫舞拜 更参差 斑衣戏队 清闲无事 门外从他 惊尘飞隘 寿八千年 百分才一朱颜耐 何妨长主翠嵩春 酒约诗盟在 家庆堂前欢会 领霞卮 醺红浅带 是人说道 真吕先生 风流潇洒,"4,7,7,5,6,3,4,4,4,4,4,7,7,5,6,3,4,4,4,4",231611b7984f6ee8eddfc21903245e91,吾 菊 山翁 鹤 骖 来自 蓬云界 平铺 心地 有天 知 楚楚 生 兰 茝 膝下 青衫 舞拜 更 参差 斑衣 戏队 清闲 无 事 门外 从 他 惊 尘 飞隘 寿 八千 年 百分 才 一 朱颜 耐 何妨 长 主 翠嵩春 酒约 诗盟 在 家庆堂 前 欢会 领霞 卮 醺 红 浅 带 是 人 说道 真 吕先生 风流潇洒
70f6a07c84f2f063294ec20721931ec7,烛影摇红,陈著,宋,词,词,潇洒琴帘 月灯归后新谐好 青云香里共清风 消得金花诰 争奈天颠地倒 好光阴 都惊散了 更听人说 七七年时 多多烦恼 挨到如今 信知空挂闲怀抱 天于负处最饶人 颦也翻成笑 牢闭柴门自好 对梅花 杯盘草草 满前儿女 耐后夫妻 齑盐偕老,"4,7,7,5,6,3,4,4,4,4,4,7,7,5,6,3,4,4,4,4",4fe431c6b3e89a5ab80dd8b41cd6ffa1,潇洒 琴帘 月 灯 归 后 新 谐 好 青云 香里共 清风 消 得 金花 诰 争奈天颠 地 倒 好 光阴 都 惊散 了 更 听 人 说 七七年 时 多多 烦恼 挨 到 如今 信知空挂闲 怀抱 天 于 负处 最饶 人 颦 也 翻成 笑 牢 闭 柴门 自 好 对 梅花 杯盘 草草 满前 儿女 耐后 夫妻 齑 盐 偕老
0536561c6e066a8d31bf273ba72075bc,烛影摇红,陈著,宋,词,词,双杏堂深 山明水秀潆洄著 稳铺心事做平生 不买颦眉错 是则苍髯白发 笑微微 朱颜自渥 一团春意 半隐风流 他谁能学 六十年华 又从今起新花甲 葵榴初艳芰荷香 争赴开筵约 家庆真堪恣乐 碧瑶杯 须拚满酌 瑟琴声里 弟劝兄酬 儿歌孙拍,"4,7,7,5,6,3,4,4,4,4,4,7,7,5,6,3,4,4,4,4",05ef904bf67ea70675f9b99af23b3906,双杏堂 深 山明水秀 潆 洄 著 稳铺 心事 做 平生 不 买 颦眉 错 是 则 苍髯 白发 笑微微 朱颜 自 渥 一团 春意 半 隐 风流 他 谁 能学 六十年 华 又 从今 起新 花甲 葵榴 初 艳 芰 荷香 争赴 开筵 约 家庆 真堪恣乐 碧瑶 杯 须 拚满 酌 瑟 琴声 里 弟 劝 兄酬 儿歌 孙 拍
baf1a9ef2880f51ce3f80b9636b84534,声声慢,陈著,宋,词,词,珍丛凤舞 曾是宣和 春风送归禁幄 翠浅红深 婉娩步空金落 腥尘未飞动处 是先知 早辞华萼 好在□ 四并难多少 怨怀无托 猛拍阑干谁会 浮世事 悠悠白云黄鹤 有酒当花 休得是今非昨 花犹百年宁耐 算人生 能几欢乐 又忽忽 醉梦里 春去不觉,"4,4,6,4,6,6,3,4,3,5,4,6,3,6,4,6,6,3,4,3,3,4",d19605dc84e15c80a9be98f43b5d65d0,珍丛 凤舞 曾 是 宣和 春风 送 归禁幄 翠 浅红 深 婉 娩 步 空金 落 腥 尘 未 飞动 处 是 先知 早 辞华萼 好 在 □ 四 并 难 多少 怨怀无托 猛拍 阑干 谁 会 浮 世事 悠悠 白云 黄鹤 有 酒 当 花 休得 是 今 非 昨 花犹 百年 宁耐 算 人生 能 几 欢乐 又 忽忽 醉梦里 春去 不觉
379cab6b60f9feb3bc60475786d289ea,祝英台近,陈著,宋,词,词,小盆池 新压藕 翠盖已擎雨 巧弄红妆 明艳便能许 自怜华发萧萧 风流无分 醉时眼 何妨偷觑 黯然伫 回首今是何时 逢花笑还语 梦里西湖 双落泪如缕 斜阳十里烟芜 六桥风浪 有谁掉 采莲舟去,"3,3,5,4,5,6,4,3,4,3,6,5,4,5,6,4,3,4",5c5949632369ea0fb3c5480f699b1127,小 盆池 新 压 藕 翠盖 已 擎 雨 巧 弄 红妆 明艳 便 能 许 自怜 华发 萧萧 风流 无 分 醉 时 眼 何妨 偷觑 黯然 伫 回首 今 是 何时 逢花笑 还 语 梦 里 西湖 双 落泪 如缕 斜阳 十里 烟芜 六桥 风浪 有 谁 掉 采莲舟 去
44e7bb53475af4fc240f86d7b2afcf1f,江城子,陈著,宋,词,词,中秋佳月最端圆 老痴顽 见多番 杯酒相延 今夕不应悭 残雨如何妨乐事 声淅淅 点斑斑 天应有意故遮阑 拍人间 等闲看 好处时光 须用著些难 直待黄昏风卷霁 金滟滟 玉团团,"7,3,3,4,5,7,3,3,7,3,3,4,5,7,3,3",dcd10ad74b832983f4bd28486a6073b9,中秋 佳 月 最端圆 老 痴 顽 见 多番 杯酒 相延 今夕 不应 悭 残雨 如 何妨 乐事 声 淅淅 点 斑斑 天应 有意 故 遮 阑 拍 人间 等闲 看 好处 时光 须 用著 些 难 直待 黄昏 风卷 霁 金 滟 滟 玉 团团
003b45cd6630fcd0de20502c7bdf045a,江城子,陈著,宋,词,词,人生难满百年心 得分阴 胜千金 吹帽风流 时节又相寻 回首赐萸休说梦 真率具 自山林 逢迎一笑且开襟 酒频斟 量犹禁 相劝相期 长健似如今 醉也从他儿女手 争把菊 满头簪,"7,3,3,4,5,7,3,3,7,3,3,4,5,7,3,3",a145e4955ea564260abf1e31722473ee,人生 难 满 百年 心 得分 阴 胜 千金 吹 帽 风流 时节 又 相寻 回首 赐 萸 休 说 梦 真率 具 自 山林 逢迎 一 笑 且 开襟 酒频 斟 量 犹禁 相劝 相期 长 健似 如今 醉 也 从 他 儿女 手 争 把 菊 满头 簪
52e6482916a41398384ff976a7fe1eea,江城子,陈著,宋,词,词,纷纷都说会双星 鹊桥成 凤骖迎 风雨凄凉 何故锁苍冥 儿女空愁谁解意 须道我 试来听 人间天上不同情 最无凭 是柔盟 应怪痴人 虚妄做浮生 正值楼台多簇燕 教没兴 不开晴,"7,3,3,4,5,7,3,3,7,3,3,4,5,7,3,3",72d4cc1588bd53a186b9054017d5fe6b,纷纷 都说会 双星 鹊桥 成 凤 骖 迎 风雨 凄凉 何故 锁 苍冥 儿女 空 愁 谁 解意 须 道 我 试来 听 人间天上 不 同情 最 无 凭 是 柔盟 应怪 痴人 虚妄 做 浮生 正值 楼台 多 簇 燕 教 没兴 不开 晴
2740e8f4484565b807fd4648377407d8,江城子,陈著,宋,词,词,笼街弹压上元灯 满瑶城 簇珠星 老矣如今 谁记旧来曾 眼底相逢惟有月 空对面 若为情 残生消不尽齑茎 瘦棱棱 困腾腾 扶起眉间 杯酒酹寒檠 也为风光陪一笑 心下事 梦中惊,"7,3,3,4,5,7,3,3,7,3,3,4,5,7,3,3",e8394231dc60e248cb0507229b14765c,笼街 弹压 上 元 灯 满瑶城 簇珠星 老 矣 如今 谁 记 旧来 曾 眼底 相逢 惟有 月 空 对面 若为 情 残生 消 不尽 齑茎 瘦棱棱 困 腾腾 扶 起 眉间 杯酒 酹 寒 檠 也 为 风光 陪 一 笑 心下 事 梦 中 惊
a123ebd9e48ab24bd9cef3414da3e8fc,江城子,陈著,宋,词,词,年年端午又今朝 鬓萧萧 思摇摇 应是南风 湘浦正波涛 千古独醒魂在否 无处问 有谁招 何人帘幕倚兰皋 看飞桡 夺高标 饶把笙歌 供笑醉陶陶 孤坐小窗香一篆 弦绿绮 鼓离骚,"7,3,3,4,5,7,3,3,7,3,3,4,5,7,3,3",c207fbfa0e74a95b5d3dc78624d79a68,年 年 端午 又 今朝 鬓 萧萧 思 摇摇 应 是 南风 湘浦 正 波涛 千古 独醒 魂 在否 无处 问 有 谁 招 何人 帘幕 倚 兰皋 看飞 桡 夺 高标 饶 把 笙歌 供笑 醉 陶陶 孤坐 小窗 香 一 篆 弦 绿 绮 鼓 离骚
02869565fe2a0c676fc4d9f1b265cbc1,青玉案,陈著,宋,词,词,钱塘江上潮来去 花落花开六桥路 三竺三茅钟晓暮 当年梦境 如今故国 不忍回头处 他谁做得愁如许 平地波涛挟风雨 往事凄凄都有据 月堂笑里 夕亭话后 自是无人悟,"7,7,7,4,4,5,7,7,7,4,4,5",3d80a7a9ab3c09d31507e4d457bf2fd2,钱塘江 上潮 来 去 花落花开 六 桥 路 三 竺三茅 钟晓暮 当年 梦境 如今 故国 不忍 回头 处 他 谁 做 得 愁 如许 平地 波涛 挟 风雨 往事 凄凄 都 有 据 月 堂 笑 里 夕 亭 话 后 自 是 无人 悟
81b2e6442dbfcdf0d0fd4053a08ee2a9,青玉案,陈著,宋,词,词,青山流水迢迢去 总是东风往回路 送得春来春又暮 莺如何诉 燕如何语 只有春知处 时光渐渐春如许 何用怜春怕红雨 到处空飞无实据 花开也好 花飞也好 此意须双悟,"7,7,7,4,4,5,7,7,7,4,4,5",a93d6ac4f0b685d90dd1183595df0b69,青山 流水 迢迢 去 总是 东风 往回 路 送得 春来 春 又 暮 莺 如何 诉 燕 如何 语 只有 春 知处 时光 渐渐 春 如许 何用 怜 春 怕 红雨 到处 空飞 无 实据 花 开 也好 花飞 也好 此 意须双悟
13a4d459fae861edb39906d8dc73678c,渔家傲,陈著,宋,词,词,浪麦风微花雾扫 痕沙水浅溪桥小 属玉双双飞杳杳 山宽绕 新晴绣得春分晓 独立无言心事渺 曾将宇宙思量了 世变何涯人已老 休烦恼 林泉况味终须好,"7,7,7,3,7,7,7,7,3,7",04adca44cdb0ccf2d96558b7a5b372ee,浪麦 风微花雾 扫 痕沙 水浅 溪桥 小 属 玉 双双 飞 杳 杳 山宽 绕 新 晴 绣 得 春 分晓 独立 无言 心事 渺 曾 将 宇宙 思量 了 世变 何涯 人 已 老 休 烦恼 林泉 况味 终须 好
