id,title,author,dynasty,genre,poem_type,sentences_simplified,meter_pattern,hash,words
e6949f15-d100-4c38-a88e-8fecf7b514eb,千顷廨院小憩老僧旧𦶟左臂干缘宝叔塔一绝悯之,钱时,宋,诗,七言绝句,见说当年老比丘 茶毗一臂作重修 山头宝叔成新塔 泉下应贻父母忧,"7,7,7,7",9f70fa6017c3bd67fbf2ddceee3cd04e,见 说 当年 老 比丘 茶毗 一臂 作 重修 山头 宝叔成 新塔 泉下 应贻 父母 忧
ee822498-8940-40ce-ab8d-a8ed62bb87c8,樵姪誓酒一绝喜之,钱时,宋,诗,七言绝句,誓酒应须立志坚 波流逐逐岂其然 一时感慨无难事 老叔今逾四十年,"7,7,7,7",d778638bea2f2b999005fe38e06b1cac,誓 酒 应 须 立志 坚 波流 逐逐 岂 其然 一时 感慨 无 难事 老叔 今 逾 四十年
14514027-0b0a-44db-8414-8a76ce0b9724,泊桐步,钱时,宋,诗,七言绝句,一枕寒江浪拍天 更添急霰打船舷 人间有底风波恶 不废山翁夜熟眠,"7,7,7,7",4b89afa67d723c3637ccbc3700cbcef4,一枕寒 江浪 拍 天 更添 急 霰打 船舷 人间 有 底 风波恶 不 废 山翁 夜 熟眠
149649e5-5728-4811-9442-34ef0e862a4d,飞花二首  其一,钱时,宋,诗,七言绝句,尧夫花看半开时 花半开时春正肥 此日老夫无拣择 慇懃直到看花飞,"7,7,7,7",488e5074d2829e94a7ba998619c2609e,尧 夫花 看 半开 时 花 半开 时 春 正 肥 此日 老夫 无 拣择 慇 懃 直到 看 花飞
7a6cf2e8-b3e2-489b-8f84-51976456f8a2,飞花二首  其二,钱时,宋,诗,七言绝句,看花恰莫厌离披 花到离披亦自奇 不是老夫无拣择 春风无日不花枝,"7,7,7,7",4d12d8812a1568c4befd7870aea6ffb5,看 花 恰莫厌离 披 花 到 离 披 亦 自奇 不是 老夫 无 拣择 春风 无日 不 花枝
966f5642-19c5-4439-8168-145ac19395f6,山中吟三首  其一,钱时,宋,诗,七言绝句,百不如人此老身 老身何必要如人 等闲花草随宜种 多在山中住几春,"7,7,7,7",a447fbc077b1491259b67e5c18431d95,百 不如 人 此 老身 老身 何必 要 如人 等闲 花草 随宜 种 多 在 山中 住 几 春
8a9fd9b3-508a-4da5-80a5-05f16f7ef092,山中吟三首  其二,钱时,宋,诗,七言绝句,一毫头许便争衡 蛮触寻兵决死生 山隠等闲收至宝 却无人共老夫争,"7,7,7,7",3cf2978765247373f3a6759c6e2446f5,一毫 头许 便 争衡 蛮触寻兵 决死 生 山 隠 等闲 收 至宝 却 无人 共 老夫 争
fa66b8b9-ec63-4b01-83b6-02578dc28a69,山中吟三首  其三,钱时,宋,诗,七言绝句,说是说非无了时 到头谁免堕危机 满林春鸟高低语 终日不闻人是非,"7,7,7,7",348850543e7f5dd33f37085bc0fcce57,说 是 说 非 无 了 时 到头 谁 免 堕 危机 满林春 鸟 高低 语 终日 不 闻人 是非
b0d2e683-75f4-41e9-8a91-08f5294e64cb,试墨,钱时,宋,诗,七言绝句,玉藏顽石藕出泥 物以质就知者稀 世间毁誉苦未定 楮君不言公是非,"7,7,7,7",6bd8d2eed3e5dc2ec8cfe977cb2cf2f3,玉藏 顽石 藕 出 泥 物以质 就 知者 稀 世间 毁誉 苦 未定 楮 君 不 言 公 是非
eb2c4373-45e2-4ffb-96e7-ddea7ec0e5bb,洗竹,钱时,宋,诗,七言绝句,满地槐花有底忙 我无题目可商量 呼童遍洗庭前竹 冷眼相看到雪霜,"7,7,7,7",2add4dfcdd4d739214d4c12aaa750f6e,满地 槐花 有底 忙 我 无 题目 可 商量 呼童 遍洗 庭前 竹 冷眼 相 看到 雪霜
bc1c1a9c-db8c-49f4-b3b7-311a3c2adb07,里中有虚传榜帖者,钱时,宋,诗,七言绝句,榜帖虚传哄里闾 聚门如束散如驱 莫言此个无端的 世上浮名总是虚,"7,7,7,7",dee65ef73d0217274c04d1e349d24e5d,榜帖 虚 传 哄 里闾 聚门 如束 散如 驱 莫言 此个 无端 的 世上 浮名 总是 虚
a375e476-382c-4679-95c9-53d572367ad1,筑岁寒亭,钱时,宋,诗,七言绝句,曲径方池竹几竿 诛茅脔石要谁看 王侯第宅连云起 无此闲亭号岁寒,"7,7,7,7",240ffe565f47a5b1aa77d36e0e51cf85,曲径 方池 竹 几竿 诛茅脔 石 要 谁 看 王侯 第宅 连云 起 无此 闲 亭 号 岁寒
e5adf950-612d-4dbc-ba36-89557f86bf4e,岁寒落成,钱时,宋,诗,七言绝句,万间金屋苦嫌少 六尺茅亭宽有余 意惬即为真受用 世间荣谢不关渠,"7,7,7,7",22780fdc7d6df9aea51cf390818e208b,万 间 金屋 苦 嫌少 六尺 茅亭宽 有余 意 惬即 为 真 受用 世间 荣谢 不关 渠
16d8780e-677c-45da-8cbb-0d885445a463,示贺客二首  其一,钱时,宋,诗,七言绝句,得便宜是落便宜 几万人中有个知 此日冬窝无事客 埋头更学十分痴,"7,7,7,7",7504b8fc698e067c899eaf06f27eb889,得 便宜 是 落 便宜 几万人 中 有个 知 此日 冬 窝 无事 客 埋头 更 学 十分 痴
b088f33e-64a7-4ecd-bd4c-2ed1264a8ec5,示贺客二首  其二,钱时,宋,诗,七言绝句,白玉壶中春淡淡 小梅枝上日晖晖 何心更问世荣辱 有口不言人是非,"7,7,7,7",728a6eeac8bb79097874f39a8edbe464,白 玉壶 中春 淡淡 小梅枝 上日 晖 晖 何心 更 问世 荣辱 有口不言人 是非
1cd1cd6c-f6ff-4cc4-8eb7-8c39085d0958,看花,钱时,宋,诗,七言绝句,兰畹梅林事未阑 瑞香那复夜团团 东君动是经年别 每到花开仔细看,"7,7,7,7",c56aeeb0fadd2e296a8f917bee58de0a,兰 畹 梅林 事 未 阑 瑞香 那 复夜 团团 东君 动是 经年 别 每 到 花 开 仔细 看
0b22c9d4-e905-4e83-8cad-0e4782356e2f,岁寒杂咏  其一,钱时,宋,诗,七言绝句,一把寒茅四柱亭 客来只道省经营 虽然受用无花巧 五十余年造得成,"7,7,7,7",2bc22452dabe442d2ba2554b477bd642,一把 寒茅 四柱 亭 客 来 只 道 省 经营 虽然 受用 无 花巧 五十余年 造得 成
c83fab1b-7573-4ccd-9a89-5851d23d490e,岁寒杂咏  其二,钱时,宋,诗,七言绝句,箨龙罗立已斑斑 亭鏁梅阴翠屋间 王母飞轻频拂水 黄公声远暮还山,"7,7,7,7",27935482250c1001b3f4cac0b1d133ee,箨 龙罗立 已 斑斑 亭 鏁 梅 阴 翠 屋 间 王母 飞 轻频 拂 水 黄公声 远暮还山
df10898b-4aae-4b31-8e40-84a7ee274fe0,岁寒杂咏  其三,钱时,宋,诗,七言绝句,无窗无户四边空 月透疎林水透风 砌下嚘嚘鸣蟋蟀 细论心曲可山翁,"7,7,7,7",af0f1784ade07992bbdf45637af4156d,无窗无户 四边 空 月 透 疎 林 水 透风 砌 下 嚘 嚘 鸣 蟋蟀 细论 心曲 可 山翁
757f7ad9-edd4-47e4-865a-7ecacabe0d7d,岁寒杂咏  其四,钱时,宋,诗,七言绝句,森森多愿长琅玕 相伴山翁老岁寒 雨后箨龙添几许 儿童欢喜报来看,"7,7,7,7",7793270684d89816a9526fc1df6c833a,森森 多 愿长 琅玕 相伴 山翁 老 岁寒 雨 后 箨 龙 添 几许 儿童 欢喜 报 来看
754849a3-bd8c-4c3a-91d3-cbf9a02066f7,岁寒杂咏  其五,钱时,宋,诗,七言绝句,弯弓稍稍舒双肘 圆竹频频运两骭 觅得养生书一卷 只留梁上不曾看,"7,7,7,7",bb54451d89b4373070483f30a8812dd0,弯弓 稍稍 舒双 肘 圆 竹 频频 运 两 骭 觅得 养生 书 一卷 只 留 梁 上 不曾 看
248f4e9e-6df4-4941-aa69-7dc582b5ee86,岁寒杂咏  其六,钱时,宋,诗,七言绝句,笋入栏干曲透茅 青琅玕脱紫文苞 晚来拆草验生意 一夜能添二尺高,"7,7,7,7",8a61eaf27b14f2e47c9b2551bd0762c7,笋入 栏干 曲透 茅 青 琅玕 脱 紫文苞 晚来 拆 草验 生意 一夜 能 添 二尺 高
d9575458-3275-438d-958c-1c28493d9f20,岁寒杂咏  其七,钱时,宋,诗,七言绝句,生疎只是自生疎 志若专时定不粗 世事从来不两大 莫教错了用工夫,"7,7,7,7",c06c717b46955d4120db0463b4f2901e,生 疎 只是 自 生 疎 志 若 专时定 不 粗 世事 从来不 两 大 莫 教错 了 用工夫
83c362be-fd15-47a6-8472-14d551190670,留青阳游九华寄袁仓使,钱时,宋,诗,七言绝句,元自与山无半面 昔人诗里旧相知 西风吹上千岩顶 竹杖芒鞋住几时,"7,7,7,7",7167ca2fab69c09f0ede03232b8a4152,元 自 与 山 无 半面 昔人 诗 里 旧 相知 西风 吹 上千 岩顶 竹 杖 芒 鞋 住 几时
fb6d73b1-3ae4-400d-977f-8f3872a655d0,雪夜冯周二兄来小酌诗呈仓使  其一,钱时,宋,诗,七言绝句,朔风吹玉满天涯 旷望平林处处花 袖手冬窝无事客 不分疆界是谁家,"7,7,7,7",7a7ece62fab610b0ab1302302dea02ed,朔风 吹 玉满 天涯 旷望平 林 处处 花 袖手 冬 窝 无事 客 不 分 疆界 是 谁家
47fbc029-5539-4631-91b2-5bb9ea6c2e7b,雪夜冯周二兄来小酌诗呈仓使  其二,钱时,宋,诗,七言绝句,入夜同人为我来 旋寻香味小衔杯 满堂和气虽云乐 怕有人间暖未回,"7,7,7,7",eda16e6cab23edd5c65aadd49a1e4d6c,入夜 同 人为 我 来 旋 寻 香味 小衔 杯 满堂 和 气 虽 云乐 怕 有 人间 暖 未 回
45ce0e81-ce4c-4ffd-be7d-439aba782dfe,答振父,钱时,宋,诗,七言绝句,老生便作老生涯 不羡漫花顷刻花 身在山林心在国 太平风露是吾家,"7,7,7,7",0cc4c7ad48495296b8ab58894d94941a,老生 便 作 老 生涯 不 羡漫 花 顷刻 花 身 在 山林 心 在 国 太平 风露 是 吾 家
d7aae81f-ace8-4baa-abab-9ef14289a3c1,二月望游齐山呈仓使二首  其一,钱时,宋,诗,七言绝句,生平忠胆上摩天 两鬓如丝山水缘 欲向翠微穷望眼 淮山无数锁春烟,"7,7,7,7",1674be772c894dedad5080c4eb87f619,生平 忠 胆 上 摩天 两鬓 如丝 山水 缘 欲 向 翠微 穷 望眼 淮山 无数 锁 春烟
ffd20b14-2be3-418d-abce-7ce11a82445b,二月望游齐山呈仓使二首  其二,钱时,宋,诗,七言绝句,春到花朝花未多 小梅才作玉婆娑 东君不是恩光薄 无柰霜欺雪压何,"7,7,7,7",248f57833eab203468d592b95d495a44,春 到 花朝花 未 多 小梅 才 作 玉 婆娑 东君 不是 恩光薄 无 柰 霜 欺 雪 压 何
11a1d777-0ad5-49bb-8c89-7b60e0fb91e8,竹所睡起偶成书呈谢守之,钱时,宋,诗,七言绝句,万竹中通两牖虚 红尘炎暑不关渠 幽人日用底难办 一榻午风清有余,"7,7,7,7",e8c612f0b6e3a86e6b6d70516f8d8b79,万 竹 中 通 两 牖 虚 红尘 炎暑 不关 渠 幽 人 日用 底 难办 一 榻 午 风 清 有余
2d78c8ff-163f-4276-8ec3-31b7f18fab39,竹所见梅,钱时,宋,诗,七言绝句,岁华冉冉走尘沙 望着家山便仙家 竹所夜深风戛玉 道人消坐共梅花,"7,7,7,7",844d6815cc188f784772caca1b3afbae,岁 华 冉冉 走 尘沙 望 着 家 山 便 仙家 竹所 夜深 风戛玉 道人 消坐 共 梅花
07e57db6-abca-4886-94e8-224287e66261,治径,钱时,宋,诗,七言绝句,草迷三径绿芊芊 可是山翁懒得便 直自酴醾花去后 不曾行到大门前,"7,7,7,7",34de4e975b7593e25b5d45ddea01fb23,草迷 三径 绿 芊芊 可是 山翁 懒得 便 直 自 酴 醾 花 去 后 不曾 行到 大 门前
5ae9275b-8680-402e-8e81-35430fb90003,旅火,钱时,宋,诗,七言绝句,湖边车马日提壶 有眼何曾识野蔬 肯为饥羸忘肉味 孰云医国世间无,"7,7,7,7",e534ce06b1b498cd197e548b5b7ed1b0,湖边 车马 日 提壶 有 眼 何曾 识 野 蔬 肯为 饥 羸忘 肉 味 孰 云 医国 世间 无
9c5e8d04-1992-4575-b5e2-5ec8d44a7e46,别朱几仲,钱时,宋,诗,七言绝句,古貌臞然一病翁 胸中戈甲气如虹 子房元凯能骑马 破贼红旗未足功,"7,7,7,7",dbb770efba0179cc3645f662b24cee16,古 貌 臞 然 一 病 翁 胸中 戈甲 气如虹 子房 元凯 能 骑马 破 贼 红旗 未 足 功
768db6cb-f011-40e3-9bfe-db577cc78cd1,东松庵观岳武穆遗碑,钱时,宋,诗,七言绝句,虎视关河指日平 东松岭路小提兵 奸臣误国英雄死 千古遗碑夕照明,"7,7,7,7",d8f7451c80edf547e22707a600a08a1d,虎视 关河 指日 平 东 松岭 路 小 提兵 奸臣 误国 英雄 死 千古 遗碑 夕照 明
80eb9f59-e9d9-47b2-af75-ffc8489c73ed,六月六日姪孙辈同食大麦二首  其一,钱时,宋,诗,七言绝句,大麦新炊苜蓿盘 一壶春酒小团栾 金丹九死生灵命 莫作寻常粝饭看,"7,7,7,7",d55143b597222e7e09d5fa323684ee9f,大麦 新 炊 苜蓿 盘 一 壶 春酒 小团 栾 金丹 九死生 灵命 莫作 寻常 粝 饭 看
1db9399c-65ce-4175-804e-49188be6b335,六月六日姪孙辈同食大麦二首  其二,钱时,宋,诗,七言绝句,冬春饿骨委寒波 宿麦离离柰尔何 此日一餐虽志喜 愧无膏泽汗颜多,"7,7,7,7",7901981ddcaaaa88691ba93ef669a395,冬春 饿 骨委 寒波 宿麦 离离 柰 尔 何 此日 一餐 虽 志喜 愧 无 膏泽 汗颜 多
462d14ba-b07d-4889-b6f8-542b5cfa8207,感蛙,钱时,宋,诗,七言绝句,翠蟾戛戛閙黄昏 反手为妖覆手祥 明月夜光遭按剑 可怜箕子学佯狂,"7,7,7,7",cb13f42c616bf6a359c0f4cb4f6cc2e7,翠 蟾戛戛閙 黄昏 反手 为 妖覆手祥 明月 夜光 遭 按 剑 可怜 箕 子 学 佯狂
5c093a75-6496-47b5-8e15-aee78dbec53b,夜索熟水甘甚,钱时,宋,诗,七言绝句,呼童夜半一杯汤 盎盎天和入肺肠 咽正滑时即挥去 人间此意细思量,"7,7,7,7",7663df179933dbff45e7858dc4f2fc14,呼童 夜半 一杯 汤 盎盎天 和 入 肺肠 咽 正滑 时即 挥去 人间 此 意细 思量
1a26998a-a50c-47a1-b74c-cebca212b8c8,早步庭前,钱时,宋,诗,七言绝句,顷刻苏枯不费工 老夫何苦卧龙公 萧萧金凤枝头雨 一夜花开无数红,"7,7,7,7",ae4e6f799a8055daeea6a16470f13344,顷刻 苏枯 不 费工 老夫 何苦 卧龙 公 萧萧 金凤 枝头 雨 一夜 花 开 无数 红
7d4b7cfa-c6c6-4948-9e15-b669cbb551d5,文峰讲行昏礼和起潜韵,钱时,宋,诗,七言绝句,自是无人别是非 何曾此外更精微 一门济济今成俗 政要回头悟指归,"7,7,7,7",a6fb308cf55d1c9cd4bb9e0b47f4db41,自 是 无人 别 是非 何曾 此外 更 精微 一门 济济 今 成俗 政要 回头 悟 指归
fa559d26-6620-4535-97e6-296921b90c0e,用前韵答起渊,钱时,宋,诗,七言绝句,一念能回百念非 直须端的道心微 暮春曾点缘何事 千古寥寥独咏归,"7,7,7,7",06f74f657af72926ae5356c7f5ab09e3,一念 能回 百念 非 直须 端的 道心 微 暮春 曾点 缘何 事 千古 寥寥 独咏 归
361d32d0-1d49-475d-ac5b-b0fa598ffa9c,文峰夜饮三首  其一,钱时,宋,诗,七言绝句,溪山回首昔人非 賸喜文峰拥翠微 尊俎笑谈春满院 不辞和月夜深归,"7,7,7,7",a895d6faa0cae35529371b54af5115f3,溪山 回首 昔人 非 賸 喜 文峰 拥 翠微 尊 俎 笑谈 春 满院 不辞 和 月 夜深 归
824387f6-3fcc-41a0-b570-f5b721496598,文峰夜饮三首  其二,钱时,宋,诗,七言绝句,万事浮云过眼非 人间真乐尽稀微 从今一笑春风里 未用吹箫月下归,"7,7,7,7",66649f9c4381913c1535c815cdce3c82,万事 浮云 过眼 非 人间 真 乐尽 稀微 从今 一 笑 春风 里 未 用 吹箫 月 下归
61990730-7698-4aba-b0a8-476a5b1ec22e,文峰夜饮三首  其三,钱时,宋,诗,七言绝句,可怜绳墨窘韩非 说着神仙到紫微 办得一双无事眼 玉梅枝上看春归,"7,7,7,7",358618e1621443b2ff99f817c3b18562,可怜 绳墨 窘 韩非 说 着 神仙 到 紫微 办 得 一双 无事 眼 玉梅 枝 上 看 春 归
f7430107-f903-49e7-87c2-d20211c51eb2,答洪文父问仁二首  其一,钱时,宋,诗,七言绝句,千差万别总成非 谁解回光到隠微 大路迢迢平似砥 欲归谁不遣君归,"7,7,7,7",b138538ca03422eb8e9e93d33a78744e,千差万别 总成 非 谁 解回 光 到 隠 微 大路 迢迢 平似 砥 欲 归 谁 不 遣 君 归
1205277f-436b-4936-8c60-696a97fa065a,答洪文父问仁二首  其二,钱时,宋,诗,七言绝句,自心自过自知非 痛刬根芽事眇微 个里工夫真切己 百年覊旅一朝归,"7,7,7,7",8e03d8c45da768c26199f7161bed74b5,自心 自过 自知 非 痛 刬 根芽 事 眇 微 个 里 工夫 真切 己 百年 覊 旅 一朝 归
15364cfa-ace8-4fa7-9ea0-6190a9427211,冰壶二首  其一,钱时,宋,诗,七言绝句,一扫从前万虑非 寒光冷照发幽微 乾坤总在冰壶里 不费壶公日暮归,"7,7,7,7",bfb8ccc3c149b4fb19becfd221fecdfa,一 扫 从前 万 虑 非 寒光 冷 照发 幽微 乾坤 总 在 冰壶 里 不费壶 公 日暮 归
418ba60e-af22-4cf4-b4e6-42faf648b7b1,冰壶二首  其二,钱时,宋,诗,七言绝句,说著冰壶事已非 此时消息我知微 游云断处千山出 夕照明边一鸟归,"7,7,7,7",9e797b4f5abe7dcfdfd483f705750ab5,说著 冰壶 事 已非 此时 消息 我 知微 游云 断 处 千山 出 夕照 明边 一鸟归
69deeaab-18a1-461e-bbcc-bf37eb971470,别诸亲友二首  其一,钱时,宋,诗,七言绝句,良会难逢万事非 弥旬缱绻思清微 家山一夜梅花发 月霁风光夜欲归,"7,7,7,7",8d6cb838f109c585e841e3dbf087f5fd,良会 难逢 万事 非 弥 旬 缱绻 思清微 家 山 一夜 梅花 发 月 霁 风光 夜 欲 归
b0ab38c4-5128-448d-ab84-7bdeec95e3d5,别诸亲友二首  其二,钱时,宋,诗,七言绝句,四十年间梦已非 论文谈道意方微 愿言著眼羲皇上 南北东西莫浪归,"7,7,7,7",2d0167c29585664e2eabd6356a887eca,四十年 间 梦 已非 论文 谈道 意方 微 愿言 著 眼 羲 皇上 南北 东西 莫浪归
b35e03c1-e91f-4414-bf76-be575f783170,归来有怀诸亲友,钱时,宋,诗,七言绝句,不著人间一点非 言言讲切到深微 江头送别元无别 自是令人不忍归,"7,7,7,7",cd073ae7319ff140ce1533c8ea98add4,不著 人间 一点 非 言 言 讲 切到 深微 江头 送别 元 无别 自 是 令人 不忍 归
d575df3c-633e-4421-bf73-cf13fdbf17a4,起潜观心四绝词旨俱胜仍用非字奉酬以尽愚衷  其一,钱时,宋,诗,七言绝句,休论人是与人非 会得观心过亦微 泛滥此生长似旅 天寒日暮是谁归,"7,7,7,7",2501d37eec65862415e86f36889d295f,休论 人 是 与 人 非 会 得 观心 过亦微 泛滥 此 生长 似 旅 天寒 日暮 是 谁 归
f27e1e33-59ab-49a2-ad53-de2569e7dc6e,起潜观心四绝词旨俱胜仍用非字奉酬以尽愚衷  其二,钱时,宋,诗,七言绝句,浑然天爵本无非 过眼荣华亦已微 忆得古人诗一句 锦城虽好不如归,"7,7,7,7",2a181920c2d400ec994e0d67d64efa0d,浑然 天爵 本 无非 过眼 荣华 亦 已微 忆 得 古人 诗 一句 锦城 虽 好 不如 归
de1a3f52-1c68-43a5-8ed2-b214667613a0,起潜观心四绝词旨俱胜仍用非字奉酬以尽愚衷  其三,钱时,宋,诗,七言绝句,耻过如何更作非 观心须识动之微 一朝透脱无疆界 处处吾家不用归,"7,7,7,7",a81a0f143012257b5a2cb9b4735d4e1b,耻 过 如何 更 作非 观心 须识动之微 一朝 透脱 无疆界 处处 吾 家 不用 归
395c1991-03f1-4102-9c9f-9f28e587e5d8,起潜观心四绝词旨俱胜仍用非字奉酬以尽愚衷  其四,钱时,宋,诗,七言绝句,雾霭溟蒙山缥缈 江波浩荡雨霏微 头头总是吾家事 更要回归定失归,"7,7,7,7",64fbec433fed7730f54c3755ea54ad96,雾霭 溟 蒙山 缥缈 江波 浩荡 雨霏微 头头 总是 吾 家事 更 要 回归 定 失归
68a0d624-7c25-4a2f-b9d0-22e9c41eed31,岁除自语二首  其一,钱时,宋,诗,七言绝句,尽道今年岁运恶 谁知岁运不关渠 一斋深处深深坐 老眼如灯照古书,"7,7,7,7",8143939a8d350860a8013b39916bfc4b,尽道 今年 岁 运恶 谁知 岁 运不关 渠 一 斋 深处 深深 坐 老 眼 如 灯 照 古书
5b6a7518-dcac-4b4b-8086-487e1252edc8,岁除自语二首  其二,钱时,宋,诗,七言绝句,尽道今年岁运恶 谁知最好是今年 夜光明月反散落 遗稿一朝成巨编,"7,7,7,7",52944d34c76e5f81f2113805f2e77fc4,尽道 今年 岁 运恶 谁知 最好 是 今年 夜光 明月 反 散落 遗稿 一朝 成巨 编
3b5c42dc-359b-4ac0-bdfc-4dce2f85c62d,仓台准朝旨牒县礼请讲行荒政以疾弗果出,钱时,宋,诗,七言绝句,溪山闲袖经纶手 畎亩能忘康济心 霈泽自天难出位 空惭有问到云林,"7,7,7,7",acc64ef7de0f80cbac5c693eaa401cbc,溪山 闲袖 经纶 手 畎 亩 能 忘 康济 心 霈 泽 自天 难出 位 空 惭 有 问 到 云林
4c219746-b0ab-408f-9101-376630bf3c2d,夜坐一斋偶成,钱时,宋,诗,七言绝句,世态炎凉反复易 交情贵贱死生殊 双眸炯炯碧天阔 霁月光风夜读书,"7,7,7,7",ed5fe7ea58303765acfeb7d3175fa1da,世态炎凉 反复 易 交情 贵贱 死 生殊 双眸 炯炯 碧天阔 霁月光风 夜 读书
a23a8336-177a-4612-973a-eb2317cded25,山隠见梅,钱时,宋,诗,七言绝句,万竹林端满树春 畧无一点世间尘 年年相见年年好 转觉梅花是故人,"7,7,7,7",4609fb91dd7af42e72701a5f4341954b,万 竹林 端 满树春 畧 无 一点 世间 尘 年 年 相见 年 年 好 转觉 梅花 是 故人
d36c3569-0e84-4a48-bdca-ff6c2b66fa04,数日不登蜀阜梅盛开二首  其一,钱时,宋,诗,七言绝句,賸觉工夫通草圣 畧无闲暇问花神 国香早是将春到 也趁梅花候主人,"7,7,7,7",be38486d03d01499151244e793ae8a4c,賸 觉 工夫 通 草圣 畧 无 闲暇 问 花神 国香 早是 将 春 到 也 趁 梅花 候 主人
8ada74f4-c71a-4667-b502-3064bd3205f0,数日不登蜀阜梅盛开二首  其二,钱时,宋,诗,七言绝句,一自梅边惹著春 山川草木顿精神 晚来风起香无际 认得香根有几人,"7,7,7,7",df183300f343e8418abf219d2084c2de,一自梅 边 惹著 春 山川 草木 顿 精神 晚 来风 起 香 无际 认得 香根 有 几 人
06d3b843-83bd-4b96-9317-838caddaee28,池上感梅,钱时,宋,诗,七言绝句,青梅如豆叶如钱 尚有余花一颗圆 应笑东君大时样 冰霜冷眼看春妍,"7,7,7,7",f278b3b4c2275848f39560dc551241cb,青梅 如 豆叶 如 钱 尚有余 花 一颗 圆 应笑 东君 大时样 冰霜 冷 眼看 春妍
9c113b36-2243-4418-9bd7-44816236f3d1,顺堂夜雨,钱时,宋,诗,七言绝句,海棠初绽锦成林 多少人间富贵心 隽永一灯论语课 萧萧风雨夜堂深,"7,7,7,7",979e57d32af9b21e4cc8c924df57bc1c,海棠 初绽 锦 成林 多少 人间 富贵 心 隽永 一灯 论语 课 萧萧 风雨 夜 堂 深
aadca183-f529-4195-a3b0-e729482085c5,赤石庵,钱时,宋,诗,七言绝句,野花啼鸟日初迟 拂面和风酒一巵 草草山房终胜俗 堂堂春色易成诗,"7,7,7,7",0023fd72981b4b69d77d6a3f47d3ea83,野花 啼鸟日 初迟 拂面 和风酒一 巵 草草 山房 终胜俗 堂堂 春色 易成诗
7a2b67a9-72b5-4083-b6a0-1e0b98e6efe7,晚坐新亭对溪山有感二首  其一,钱时,宋,诗,七言绝句,莫道溪山阅世长 溪山今古几兴亡 金丹大药皆虚妄 别有长生不死方,"7,7,7,7",d214738600bf7f2f0e5de126a14a90bc,莫道 溪山 阅世 长 溪山 今古 几 兴亡 金丹 大药 皆 虚妄 别 有 长生不死 方
f285c58e-5ac8-443b-9f39-289c1b6c7b16,晚坐新亭对溪山有感二首  其二,钱时,宋,诗,七言绝句,莫道壶中日月长 壶中日月只寻常 乾坤今古无穷妙 是我庭前一草芒,"7,7,7,7",0aea57258fdc2bcb2450b8fb4cfa20c5,莫道 壶中日月 长 壶中日月 只 寻常 乾坤 今古 无穷 妙 是 我 庭前 一 草芒
f769c11d-ec34-426f-943d-5258f92614f8,同汪信道过南塘,钱时,宋,诗,七言绝句,平波漫漫拂垂杨 野草幽花满路香 杜宇初啼春未老 又扶山轿过南塘,"7,7,7,7",bc0ff5fca22c6faf9e238e1b2b5f8798,平波 漫漫 拂 垂杨 野草 幽花 满路 香 杜宇 初 啼 春 未 老 又 扶 山轿 过 南塘
dc189f17-b119-44aa-aa85-9e807cafcdc4,比得牡丹谓常品耳开花乃醉西施甚奇,钱时,宋,诗,七言绝句,姑射山人玉雪肌 是谁污作醉西施 草间天艳无人识 不到花开总不知,"7,7,7,7",fe9bac3100e32b541305cdc1682d2186,姑射山人 玉雪 肌 是 谁 污作 醉 西施 草间 天艳 无人 识 不到 花开总 不知
150486b8-e7ed-47d3-b97f-96a0fad5f601,新亭晚步,钱时,宋,诗,七言绝句,单衣轻箑晚徘徊 嫩绿深红锦作堆 杨柳溪头风力软 腾腾飞絮过墙来,"7,7,7,7",a470e42a6193474d644f32417dad89c1,单衣 轻 箑 晚 徘徊 嫩绿 深红 锦作堆 杨柳 溪头 风力 软 腾腾 飞絮 过墙 来
2c639681-de24-41f2-8970-8ee4bf8cdb0d,暮山,钱时,宋,诗,七言绝句,断雨暂提苍玉出 游云忽卷画图归 须臾变态无穷妙 更著双双白鹭飞,"7,7,7,7",35e5ff0cfb7cd9d12f8bab643ddcd7a1,断雨 暂 提 苍玉 出 游云忽 卷 画图 归 须臾 变态 无穷 妙 更著 双双 白鹭飞
46e1db58-0cc9-4617-ba3b-64dfd06cbe05,荷花入梅阴中,钱时,宋,诗,七言绝句,老梅临沼绿阴阴 一朵荷花透入林 不比世间红粉面 结交真有岁寒心,"7,7,7,7",715721079e95db1633ab85b5cb2dbca1,老梅临 沼绿 阴阴 一朵 荷花 透入 林 不 比 世间 红粉 面 结交 真 有 岁 寒心
5a2a8bd3-f5f1-4300-91f7-a4690db88d02,辛簿赵尉夜语新亭二首  其一,钱时,宋,诗,七言绝句,老夫身世尽山林 门外红尘没膝深 有底一般闲快活 光风霁月夜论心,"7,7,7,7",2b74d8c3428f4cccba4c4209e9d64627,老夫 身世 尽 山林 门外 红尘 没膝 深 有 底 一般 闲 快活 光风霁月 夜论 心
51fde2ae-9df8-483a-a66e-abec199625a2,辛簿赵尉夜语新亭二首  其二,钱时,宋,诗,七言绝句,纷纷门外走红尘 底是人间快活人 未判两仪先太极 直须端的自家身,"7,7,7,7",f1d560193298f1ba4f33ac1a0fdab3e7,纷纷 门外 走 红尘 底 是 人间 快活人 未判 两仪 先 太极 直须 端的 自家 身
df5c51b6-42f8-4e95-bff2-7c914fff770b,江东报英烈拟封二字侯喜成三绝  其一,钱时,宋,诗,七言绝句,焕章飞报下徽州 英烈将褒二字侯 千古沉沉黄壤骨 一朝提上碧云头,"7,7,7,7",65e493ddbdb532d8528612090fc877cc,焕 章 飞报 下 徽州 英烈 将 褒 二 字 侯 千古 沉沉 黄壤 骨 一朝 提上 碧 云头
461b835e-782a-4bf5-912b-9adf4b71016e,江东报英烈拟封二字侯喜成三绝  其二,钱时,宋,诗,七言绝句,胡尘明越连焦土 海道温台暂翠华 西溯涛江渠叵测 不知豪杰起山家,"7,7,7,7",7197419b1c0f4ae8b61da2405edd7e1c,胡尘明 越连 焦土 海道 温台 暂 翠华 西溯涛 江渠 叵测 不知 豪杰 起 山家
38ecf93e-b2ff-4ea1-a848-717d47419324,江东报英烈拟封二字侯喜成三绝  其三,钱时,宋,诗,七言绝句,长驱席卷蹑遐踪 蓦地桐江一扫空 北走天骄吾事了 归来袖手敢言功,"7,7,7,7",ceb48fbe0a632073dd020c9c942a5569,长驱 席卷 蹑遐踪 蓦地 桐江 一 扫 空 北 走 天骄 吾 事 了 归来 袖手 敢言 功
89f026c1-8f26-4d4e-853f-d6a7c1e8df19,雪中呈陈参政及检详兵部二丈二首  其一,钱时,宋,诗,七言绝句,中原赤子帝王州 坦腹何时缚蔡酋 闻道铁衣寒彻骨 边臣应赐紫茸裘,"7,7,7,7",39b2b27c2b34d0c9e6f191a94967abee,中原 赤子 帝王 州 坦腹 何时 缚 蔡 酋 闻道 铁衣 寒 彻骨 边臣 应赐 紫茸 裘
