id,title,author,dynasty,genre,poem_type,sentences_simplified,meter_pattern,hash,words
3dc6914a-ae9e-49f0-99ab-246713e195db,乞补外出江皋待命泊伟观二首  其一,许及之,唐,诗,五言古体,经年充拾遗 一字无所补 岂不怀故乡 念方事新主 一朝冒超迁 循墙不遑处 宁离人间世 亦恋行在所 有亲方頼禄 有子方应举 守道在守官 奈当事斯语,"5,5,5,5,5,5,5,5,5,5,5,5",7102643c44898f06b8b4af709c4b47af,经年 充 拾遗 一字无所补 岂 不 怀 故乡 念 方事 新主 一朝 冒 超迁 循 墙 不 遑 处 宁离 人间 世 亦 恋行 在 所 有亲方 頼 禄 有 子方 应举 守道 在 守官 奈 当事 斯语
7f787970-65b9-4931-b3a1-b31a69015bde,乞补外出江皋待命泊伟观二首  其二,许及之,唐,诗,五言古体,欲去不得遂 正如太庙羊 登俎分所宜 得去喜可量 圣度真如天 不妨且翺翔 扶老复携幼 迁居大江傍 居然得伟观 怅焉渺遐荒 潮头来如山 亲乐想未央,"5,5,5,5,5,5,5,5,5,5,5,5",fe5a730bdcd83247761869accac8c95a,欲 去 不得 遂 正如 太庙 羊 登俎分所宜 得 去 喜 可量 圣度 真 如天 不妨 且 翺 翔 扶老复 携幼 迁居 大江 傍 居然 得伟 观 怅焉渺遐荒 潮头 来 如 山 亲乐 想 未央
f0a5359f-47a1-4b48-bc19-cb11e85e17e1,题廨舍壁二首  其一,许及之,唐,诗,五言古体,明时有何遗 亦复许掇拾 大言得面陈 小言可封入 有时效疎愚 岂是当务急 每蒙天下施 听之恐不及 退思自生惭 黄卷常在执 旧田虽甚芜 新井尚可汲 勉哉竞斯辰 万一如有立,"5,5,5,5,5,5,5,5,5,5,5,5,5,5",12e324f7334691cbf2f91334b7e4a997,明时 有何 遗 亦 复许 掇 拾 大 言 得 面陈 小言 可 封入 有 时效 疎 愚 岂 是 当务 急 每 蒙 天下 施 听之恐 不及 退思 自生 惭 黄卷 常 在 执 旧 田 虽 甚 芜 新井 尚可 汲 勉 哉 竞 斯辰 万一 如有 立
0959e226-bcd0-4487-a95b-3fbae4dda687,题廨舍壁二首  其二,许及之,唐,诗,五言古体,本不事矰弋 未免执矢疑 客来非不多 益友每远之 薰风时一顾 素抱谁与期 久要竹居叟 谈诗能解颐 两颊贮微笑 径造观我私 请解褦襶衣 相与举近诗,"5,5,5,5,5,5,5,5,5,5,5,5",08baf6fd2ddca830e363fe8b0a28447b,本 不 事 矰 弋 未免 执矢疑 客 来 非不多 益友 每 远 之 薰风 时 一顾 素 抱 谁 与 期 久 要 竹居叟 谈 诗 能 解颐 两颊 贮 微笑 径造观 我 私 请 解 褦 襶 衣 相与 举近 诗
8fa42835-021e-4a9a-8801-702559603020,纶子效靖节止酒体赋筠斋余亦和而勉之,许及之,唐,诗,五言古体,纶以筠名斋 种筠当掩关 爱筠栽竹易 见竹知筠难 竹以筠为本 筠居竹之间 希筠岁寒操 追筠古风还 筠中听瑟瑟 筠外泻潺潺 人与筠俱胜 筠随境共闲,"5,5,5,5,5,5,5,5,5,5,5,5",d9071b84840ba8b0730c80c20d19b6bc,纶 以 筠 名 斋 种筠 当 掩关 爱筠 栽 竹易 见 竹知筠 难 竹以筠 为 本 筠 居 竹 之间 希筠 岁寒 操 追 筠 古风 还 筠 中 听 瑟瑟 筠 外 泻 潺潺 人 与 筠 俱 胜 筠 随 境 共 闲
a915aa6c-9bbe-42bf-8f88-3b28554e764a,重题陈汉卿贫亦好斋,许及之,唐,诗,五言古体,古人重安贫 未若贫而乐 岂不爱膏粱 顾乃嗜藜藿 我闻首阳饿 荣名千驷怍 况乃陋巷子 箪瓢殊不恶 刀头得几何 蜗角战方虐 以兹悟生理 贫中始澹泊 陈侯清时英 廊庙宜著脚 圭窦势岂容 贫斋意聊托 苍生方饥渴 未可云盘礴 且来禄万锺 脱粟躬自薄,"5,5,5,5,5,5,5,5,5,5,5,5,5,5,5,5,5,5,5,5",96cb24a993a857ab4988e72f27407060,古人 重 安贫 未若贫而乐 岂 不 爱 膏粱 顾乃 嗜 藜 藿 我 闻 首阳 饿 荣名千 驷怍 况乃 陋巷 子 箪瓢 殊不恶 刀头 得 几何 蜗角 战方 虐 以 兹悟 生理 贫 中 始 澹泊 陈侯 清时 英 廊庙 宜著 脚 圭 窦 势 岂容 贫 斋 意 聊托 苍生 方 饥渴 未 可 云盘 礴 且 来 禄万锺 脱 粟 躬 自薄
623a4564-ff0b-4967-828e-2a9e45820df2,次韵常之松庐有感,许及之,唐,诗,五言古体,年少爱节序 老大感岁时 亦知夜漏短 自喜昼景迟 怀人笏频拄 矫首帽屡欹 至情何惨怆 同气相因依 君家说大难 心胸缊多奇 永欢思伐木 长歌倚式微 眷言无鴈地 渴想前鸿俱 一别如昨日 二年忽今兹 数传龟组解 备著鲈风词 寒乡少瑞应 远览期长离 解缆辞江皋 反袂接水湄 无从犹出涕 有弟应垂洟 今见松庐作 可胜薤露悲 怜君抱苦节 爱兄见哀诗 无复逝水向 当有高山知 老惭无领解 久约同襟期 勉和吹箎章 聊慰深长思,"5,5,5,5,5,5,5,5,5,5,5,5,5,5,5,5,5,5,5,5,5,5,5,5,5,5,5,5,5,5,5,5,5,5",575d53e61d3b3f26b0811383664862ec,年少 爱 节序 老大 感岁 时 亦 知夜 漏短 自喜 昼景 迟 怀人 笏 频 拄 矫 首帽 屡 欹 至 情何 惨怆 同 气相 因 依 君家 说 大难 心胸 缊 多 奇 永欢思 伐木 长 歌 倚 式微 眷言 无 鴈 地 渴想 前鸿俱 一别 如 昨日 二年 忽今 兹 数传 龟 组解 备著 鲈 风 词 寒乡少瑞 应 远览 期长 离 解缆 辞 江皋 反袂 接水 湄 无从 犹出涕 有 弟 应 垂 洟 今 见 松庐 作 可胜 薤露 悲 怜 君 抱 苦节 爱兄见 哀 诗 无复 逝水 向 当 有 高山 知 老 惭 无 领解 久 约 同 襟期 勉 和 吹 箎 章 聊慰 深长 思
9654bf2b-699a-4e59-a0e4-5ecc28125f23,周时仲提干求二亲墓亭扁答以攀柏因为著语,许及之,唐,诗,五言律诗,扫松拜亲墓 攀柏念亲泣 柏露滴儿衣 儿泪和露湿 五鼎从可陈 三釜嗟何及 坟前白颈鸦 终日声楂楂,"5,5,5,5,5,5,5,5",7a40b4d3ab4a353800706565b9be114e,扫 松拜 亲墓 攀 柏念 亲泣 柏露 滴儿 衣 儿泪 和 露湿 五鼎 从 可 陈 三釜嗟何 及 坟 前 白颈 鸦 终日 声 楂 楂
8ce4fc5e-a1e8-4853-9bf8-d288efc8587b,跋宋朝老再和陶渊明归去来辞,许及之,唐,诗,五言古体,吾乡说三宋 伯也抱奇伟 太学三十年 不作举子语 晚当拜特恩 青衫送还官 开口论世事 有舌不可扪 吾皇开寿域 汪濊泽万国 勉公俯而就 如女有正色 翻然感际会 千载今一时 谁欤俾宿留 再和归来辞 渊明归有田 公归徒四壁 姑奉祝融祠 胜煮南山石 公乎未得第 我辈惭登科 空飧了无补 奈此归来何,"5,5,5,5,5,5,5,5,5,5,5,5,5,5,5,5,5,5,5,5,5,5,5,5",1d7cbac5cc53e9e4c4a270503946f832,吾 乡 说 三宋 伯 也 抱 奇伟 太学 三十年 不 作 举子 语 晚 当 拜特 恩 青衫 送还 官 开口 论 世事 有 舌 不可 扪 吾 皇 开 寿域 汪 濊 泽 万国 勉 公 俯 而 就 如 女 有 正色 翻然 感 际会 千载 今 一时 谁 欤 俾 宿留 再 和 归来 辞 渊明 归有 田 公归徒 四壁 姑 奉 祝融 祠 胜 煮 南 山石 公乎 未得 第 我辈 惭 登科 空 飧 了 无补 奈 此 归来 何
a1e65843-f037-4f0d-aa37-c2965b77e11b,次韵题吴无过所藏张无垢难老堂诗轴,许及之,唐,诗,五言古体,养亲感卧冰 慕亲悲履霜 眷兹母孙情 胚胎炳前光 先生一奖励 吴氏增激昂 至今诸孙行 如立严师傍 躬行斯入室 言辞特滥觞 当时五子名 佩服讵可忘 省也滋拳拳 何止升其堂,"5,5,5,5,5,5,5,5,5,5,5,5,5,5",fd60658ca8b08fc0314f28086e63a2bc,养亲 感卧 冰 慕亲 悲履霜 眷兹 母孙 情 胚胎 炳 前 光 先生 一 奖励 吴氏 增 激昂 至今 诸孙行 如立 严师 傍 躬行 斯 入室 言辞 特 滥觞 当时 五子 名 佩服 讵 可 忘 省 也 滋 拳拳 何止 升 其 堂
483c51c7-9261-492d-b7d8-484862d35f46,次韵廖端叟求墨,许及之,唐,诗,五言古体,忆昨同舍时 爱子志尚坚 研穷非口耳 点勘分乌焉 读声锵金石 笔思涌漪涟 合并几寒暑 分散如云烟 家虽才咫尺 见且无夤缘 甥馆闻徙居 我屋欣接椽 乃以随吏鞅 而叹抱遗编 嗟哉燕鸿隔 漫尔夔蚿怜 三年阅黄榜 万选遗青钱 祇擅文场声 不上吏部铨 儒冠未为误 洛诵方流传 夏果烦送似 唐律仍灿然 为墨贻古作 如珠出深渊 书生均老丑 嗜好相后先 亦有大禹圭 未许蒲氏贤 何惜遗久交 相得真忘年 久知铁为研 更以心自鞭 矧古传毛颖 端合遗陈玄 落笔看余万 斗酒须十千 虽无兰亭茧 愿助韦郎牋 古今一俛仰 人墨相磨研 有无要相通 唱和聊成篇 我今辟三径 门开西一偏 已过中秋月 皆为晚凉天 何妨对花下 取笑同樽前 第惭葵卫足 欲愈犹联拳,"5,5,5,5,5,5,5,5,5,5,5,5,5,5,5,5,5,5,5,5,5,5,5,5,5,5,5,5,5,5,5,5,5,5,5,5,5,5,5,5,5,5,5,5,5,5,5,5,5,5,5,5",b66e418855ff7205c6e494caa267bc89,忆昨同 舍 时 爱子 志尚坚 研穷 非 口耳 点勘 分乌焉 读声 锵 金石 笔 思涌 漪涟 合并 几 寒暑 分散 如 云烟 家 虽 才 咫尺 见 且 无 夤缘 甥馆 闻 徙居 我 屋 欣接 椽 乃以 随 吏 鞅 而 叹抱 遗编 嗟哉燕鸿隔 漫 尔 夔 蚿 怜 三年 阅 黄榜 万 选遗 青钱 祇 擅 文场 声 不上 吏部 铨 儒冠 未 为 误 洛 诵 方 流传 夏果烦 送似 唐律 仍 灿然 为 墨贻古 作 如 珠 出 深渊 书生 均 老 丑 嗜好 相后 先 亦 有 大禹 圭 未许 蒲氏贤 何惜 遗久 交 相得 真 忘 年 久 知铁 为 研 更以 心自鞭 矧 古 传 毛 颖 端合 遗 陈玄 落笔 看 余万 斗酒 须 十千 虽 无 兰亭 茧 愿助 韦 郎 牋 古今 一 俛 仰 人墨 相磨 研 有无 要 相通 唱和 聊成 篇 我 今 辟 三径 门开西 一偏 已 过 中秋月 皆 为 晚凉 天 何妨 对 花下 取笑 同 樽 前 第 惭 葵卫 足 欲愈犹联拳
eada398c-0029-444f-92b2-3dc5e174ffd8,次韵德友惠黄雀,许及之,唐,诗,五言古体,兴来把酒杯 径欲连台拗 聊用资吟哦 岂谓贪醉饱 晨起秋思清 茶罢诗肠搅 筠斋伫远思 诗筩驰速巧 饷我晚田雀 如鹰初脱爪 惠我长城句 如栋畧无桡 雀命虽甚微 饥驱亦良挠 何异不农耕 而乃窃禄稍 哦诗思陶谢 论交怀管鲍 只消寄诗篇 断不厌煎炒,"5,5,5,5,5,5,5,5,5,5,5,5,5,5,5,5,5,5,5,5",d88b6bfcf9378436ea3f2a1a1010a50f,兴来 把 酒杯 径欲 连 台 拗 聊用 资 吟哦 岂谓 贪醉饱 晨 起 秋思 清 茶 罢 诗肠 搅 筠 斋 伫 远 思 诗 筩 驰 速 巧 饷我 晚 田雀 如 鹰 初 脱 爪 惠 我 长城 句 如栋 畧 无 桡 雀命 虽 甚微 饥驱亦良挠 何异 不 农耕 而 乃 窃 禄 稍 哦 诗思 陶谢 论交 怀管 鲍 只 消寄 诗篇 断 不厌 煎炒
272d264d-b25b-41da-92bc-760918543937,再次大用韵赋梅花,许及之,唐,诗,五言古体,暖律回枯荄 春阳发寒梗 梅根有特操 花事每先省 分苗本十洲 孕玉可千顷 松篁纳深交 桃李绝奇请 冬居姑射山 下荫太华井 幽栖有心赏 巡簷常笑领 相对各忘言 岂但无机穽 诗虽道未尊 技可造经綮 孤标固洗凡 累句自无警 转庵诗家医 妙剂即苏眚 元方诗家禅 默参惟打静 欲离香色想 恐堕人我境 昨夜来朔风 吹香过南町 小解作浅语 醍醐欣灌顶,"5,5,5,5,5,5,5,5,5,5,5,5,5,5,5,5,5,5,5,5,5,5,5,5,5,5,5,5",6052f8a405cef4f9f85e2c63f64aa449,暖律 回 枯 荄 春阳 发寒 梗 梅根 有 特操 花事 每 先省 分苗本 十洲 孕 玉 可 千顷 松篁 纳 深交 桃李 绝奇 请 冬居姑 射 山 下荫 太华井 幽 栖 有心 赏 巡簷 常 笑 领 相对 各 忘言 岂但 无机 穽 诗 虽 道 未 尊 技可造经 綮 孤标 固洗凡 累 句 自无警 转 庵 诗家 医 妙剂 即 苏 眚 元方 诗家 禅 默参惟打静 欲 离 香色 想 恐 堕 人 我 境 昨夜 来 朔风 吹 香 过 南町 小解 作浅 语 醍醐 欣 灌顶
e867f83b-32a2-44cd-a3c5-20f2278a2fca,再次转庵用梗字韵赋梅,许及之,唐,诗,五言古体,见梅思洛阳 何愁道路梗 见雪忆灞桥 便可心思省 仙家种玉成 造化炊粱顷 凛然孤高标 敢以尘溷请 将军有传令 遽成临渴井 王言惟作命 盍作和羹领 香色归本根 滋味岂机穽 自非泯全牛 安得试尝綮 转庵句中画 梅诗言外警 难韵有辘轳 妙语压菑眚 昨夜垂垂雨 一洗娟娟静 便觉容成圃 真是太玉境 朝来知见香 堕在区别町 不如两忘言 搔首孤山顶,"5,5,5,5,5,5,5,5,5,5,5,5,5,5,5,5,5,5,5,5,5,5,5,5,5,5,5,5",e0e09d37f21d3660d013751922bec7aa,见 梅思 洛阳 何愁 道路 梗 见 雪忆 灞桥 便 可 心思 省 仙 家种 玉成 造化 炊粱 顷 凛然 孤高 标 敢 以 尘 溷 请 将军 有 传令 遽成 临渴 井 王言惟 作命 盍 作 和 羹 领 香色归本根 滋味 岂 机 穽 自非泯 全牛 安得 试尝 綮 转 庵 句 中 画 梅诗言 外警 难 韵 有 辘轳 妙语 压 菑 眚 昨夜 垂垂雨 一 洗娟 娟静 便 觉容 成圃 真是太 玉境 朝 来 知见 香 堕 在 区别 町 不如 两 忘言 搔首 孤 山顶
31ec35f2-2911-4945-906f-0ae78ae54e7a,园丁以菊为屏为船转庵竹院谛赏不足分题得塔字,许及之,唐,诗,五言古体,眷彼东篱花 忽作西灵塔 又如船子泛 复似南屏阖 园翁起童心 须弥欣芥纳 分题要铿锵 饫秋振萧飒 我合浮屠尖 工须画溪罨 崚嶒玉崔嵬 团栾金匼匝 俨然香色俱 间彼青黄杂 天成具体相 人事因假合 愿修衣裓供 用作布地蹋 那将有漏身 久实无缝合 转庵曾著语 竹院尝挂搭 我有一句子 无问亦无答,"5,5,5,5,5,5,5,5,5,5,5,5,5,5,5,5,5,5,5,5,5,5,5,5",dc1b89da54df953d3dc849a53e596664,眷 彼 东篱 花 忽作 西 灵塔 又 如 船子 泛 复似 南屏阖 园翁 起 童心 须弥 欣 芥纳 分题 要 铿锵 饫 秋振 萧飒 我 合 浮屠 尖 工须 画 溪 罨 崚嶒 玉 崔嵬 团 栾 金 匼 匝 俨然 香色 俱 间 彼 青黄 杂 天成 具体 相 人事 因 假合 愿修 衣 裓 供 用作 布地 蹋 那 将 有 漏身 久实无 缝合 转 庵 曾 著 语 竹院 尝 挂搭 我 有 一句 子 无问 亦 无答
6428c985-8508-4786-bccf-9b417fe03fee,德友惠竹栽甚富而又得佳篇既种复喜雨次韵谢之,许及之,唐,诗,五言古体,嗜酒爱风竹 种竹涓日醉 小园窘边幅 杂芳纷位置 此君何可无 野卉辟之易 亩许得滋旷 千个栽不翅 故人虽借居 爱竹有幽致 肯割钟山青 分植容成地 移来天亦喜 凉生雨兼值 既免躬抱瓮 何惜亲阅视 飒爽已可人 能同听秋思,"5,5,5,5,5,5,5,5,5,5,5,5,5,5,5,5,5,5",034d2dc59ac0073d6bcd0b0d1bf97c94,嗜酒 爱风竹 种竹涓 日 醉 小园 窘 边幅 杂芳 纷 位置 此君 何 可 无 野卉 辟之易 亩 许得滋 旷 千个 栽 不 翅 故人 虽 借居 爱竹 有 幽致 肯割 钟山 青 分植容成地 移来 天 亦 喜 凉生雨 兼值 既免 躬抱 瓮 何惜亲 阅视 飒爽 已 可 人 能同 听 秋思
0f2672c8-b37a-4c64-bb08-f8491375403c,转庵观赵十一圣花,许及之,唐,诗,五言古体,有艺者赵生 杂出逞活法 飞走异族类 指教各驯狎 参戏竿欲摧 险弄首将压 当场等嬉笑 旁观举震霅 其间圣花术 殆是天下甲 出没鬼物惊 变幻风雨霎 觌面唤名葩 信手如素插 洞视空樊笼 赤立却巾帢 居然龆龀儿 恍出虎兕柙 脱索妇更神 倒锥目不眨 穿杨百步间 设的两口夹 一箭中关捩 四坐骇汗洽 或驰若转轮 或舞若挥箑 机缄孰主张 造化在嘘呷 技进无万殊 妙用才一掐 傥然自胡越 谁能会鄏郏,"5,5,5,5,5,5,5,5,5,5,5,5,5,5,5,5,5,5,5,5,5,5,5,5,5,5,5,5,5,5,5,5",53d4064fe0bce9aea1e0f61f2ffdc2bb,有 艺者 赵生 杂 出逞 活法 飞 走 异族 类 指教 各 驯 狎 参戏竿欲摧 险 弄 首将 压 当场 等 嬉笑 旁观 举 震 霅 其间 圣 花术 殆 是 天下 甲 出没 鬼物 惊 变幻 风雨 霎 觌 面 唤名 葩 信手 如 素 插 洞视 空 樊笼 赤立 却 巾 帢 居然 龆 龀 儿 恍 出 虎 兕 柙 脱索妇 更 神 倒 锥目 不 眨 穿 杨 百步 间 设 的 两口 夹 一 箭 中 关捩 四 坐 骇汗 洽 或 驰若 转轮 或 舞 若 挥 箑 机 缄 孰 主张 造化 在 嘘 呷 技进无万殊 妙用 才 一 掐 傥 然 自 胡越 谁 能 会 鄏 郏
e37bc68a-4efc-45e8-b0f8-f12c0d7e59f4,次转庵圣花韵,许及之,唐,诗,五言古体,转庵诗三昧 仍嗜书八法 写出金弹句 可玩不可狎 近观圣花作 险若君独压 壮如钱塘潮 清若苕溪霅 僚丸同妙手 痀蜩真脱甲 庖刀方奏砉 郢风复运霎 文章特小技 圣处奚假插 得趣堪献佛 高吟岸乌帢 达者越拘挛 迷者泥检柙 岂知造化机 目击不容眨 衮衮万马奔 翼翼两攻夹 灵根有变通 时雨自浃洽 意轻秦赵璧 价重蒲葵箑 记舟何用痕 印钱偶因掐 于道得达尊 问鼎不问郏,"5,5,5,5,5,5,5,5,5,5,5,5,5,5,5,5,5,5,5,5,5,5,5,5,5,5,5,5,5,5",b644ab2c8677911e8b5ca224527e1fbc,转 庵 诗 三昧 仍 嗜 书 八法 写出 金弹 句 可玩 不可 狎 近观 圣花 作 险 若 君 独压 壮如 钱塘潮 清 若苕 溪 霅 僚丸 同 妙手 痀 蜩 真 脱 甲 庖 刀 方奏 砉 郢 风 复运 霎 文章 特小 技 圣 处 奚 假 插 得趣 堪献 佛 高吟岸乌 帢 达者 越 拘挛 迷者 泥 检 柙 岂知 造化 机 目击 不容 眨 衮衮 万 马 奔 翼翼 两 攻 夹 灵根 有 变通 时雨 自 浃 洽 意轻 秦 赵璧 价重 蒲葵 箑 记舟 何用 痕 印钱 偶因 掐 于 道 得 达 尊 问鼎 不问 郏
56c7a94d-ec4d-4562-9dd6-f2cb56260122,范武子挽词,许及之,唐,诗,五言古体,呜呼吾武子 天乎夺何速 潇洒锦绣肠 秀润琅玕腹 出口论世事 好语惊拙目 孝友式里闾 急难骇僮仆 曩于建业都 共庀主人属 但不同姓氏 何翅如手足 一日不晤对 尺简频往复 中夜怀清姿 有梦堕修竹 时予悼伉俪 感尔念鳏独 别去几岁华 亦闻悲壶俶 同病心相怜 异县情愈笃 我欲托以妹 子不鄙其族 两穷忽相值 一家有余睦 去作建安县 振彼七闽俗 岂不化彊梗 元不用鞭扑 邑人歌载途 当路荐联牍 彼守何坚忍 于民能迫促 二年甘不考 百谪宁忍辱 子方困吏鞅 妹忽沦鬼录 入户悲方缠 出门湿如束 骏足不受羁 盐车宜折轴 讣来忽收书 痛甚不容读 未令吾母知 可闻尔母哭 人生会有终 汝死冤乎毒 吁嗟先大夫 艰难脱荒服 衣钵自桐乡 生涯去巴蜀 清德诚可种 石田不能粟 尔母今在堂 何以供水菽 尔弟独当户 何以资耕筑 三儿须教训 一女待鞠育 自愧贫多累 未能分薄禄 近拟乞州麾 因用致家塾 此愿未吾遂 有身莫渠赎 所居读书岩 旁依紫逻曲 忆昔曾同登 相期共结屋 今晨何为者 昨梦不可续 平生乐哉丘 终焉埋此玉 虽遣奠刍陈 不及墓草宿 呜呼吾武子 临风泪盈掬,"5,5,5,5,5,5,5,5,5,5,5,5,5,5,5,5,5,5,5,5,5,5,5,5,5,5,5,5,5,5,5,5,5,5,5,5,5,5,5,5,5,5,5,5,5,5,5,5,5,5,5,5,5,5,5,5,5,5,5,5,5,5,5,5,5,5,5,5,5,5,5,5,5,5,5,5,5,5",939498e5f06fc1f3086d2cb95cf6ee6d,呜呼 吾 武子 天乎夺 何速 潇洒 锦绣 肠 秀润 琅玕 腹 出口 论 世事 好 语 惊 拙目 孝友 式 里闾 急难 骇 僮仆 曩 于 建业 都 共 庀 主人 属 但 不同 姓氏 何翅如 手足 一日 不 晤对 尺 简频 往复 中夜 怀清 姿 有 梦 堕修 竹 时 予悼 伉俪 感尔念 鳏独 别 去 几岁 华 亦 闻 悲 壶 俶 同 病心 相怜 异 县情 愈 笃 我 欲 托 以 妹 子 不鄙 其族 两 穷 忽 相值 一家 有余 睦 去 作 建安 县 振彼七 闽 俗 岂 不 化 彊 梗 元 不用 鞭 扑 邑 人 歌 载途 当 路 荐 联 牍 彼 守 何 坚忍 于 民能 迫促 二年 甘 不 考 百 谪 宁 忍辱 子方 困 吏 鞅 妹 忽 沦鬼 录 入户 悲方 缠 出门 湿 如束 骏 足 不 受羁 盐车 宜 折 轴 讣来 忽 收书 痛 甚 不容 读 未 令 吾 母知 可 闻尔母 哭 人生 会 有终 汝 死 冤乎毒 吁 嗟先 大夫 艰难 脱荒 服 衣钵 自 桐乡 生涯 去 巴蜀 清德诚 可种 石田 不能 粟 尔母 今在 堂 何以 供水 菽 尔弟 独当 户 何以 资耕筑 三儿 须 教训 一 女 待 鞠育 自愧 贫多累 未能 分 薄禄 近 拟 乞州 麾 因 用致 家塾 此 愿 未 吾 遂 有身 莫渠赎 所居 读书 岩 旁 依 紫 逻曲 忆昔曾 同登 相期 共 结屋 今晨 何为 者 昨 梦 不可 续 平生 乐哉丘 终焉 埋 此 玉 虽 遣 奠刍 陈 不及 墓草 宿 呜呼 吾 武子 临风 泪盈掬
de725dc3-28ab-40bd-88e5-9f05b7ffee39,应致远以百韵古诗见示推许过当病中姑借放翁韵奉酬,许及之,唐,诗,七言古体,我诗何敢希杨公 况复进之陆放翁 烦君妙语相纵臾 控地岂得追培风 两翁齐名家异县 叹惜余年能几见 斯人不上甘泉班 我辈先之腼颜面 君到灵山亲得语 切莫提撕落言句 恨君相见一年迟 不同蓟北燕南路,"7,7,7,7,7,7,7,7,7,7,7,7",71b9d77abb66702f89f040c35f75680d,我 诗 何敢 希杨公 况复进 之 陆放翁 烦 君 妙语 相纵臾 控地 岂 得 追 培风 两 翁 齐名 家 异 县 叹惜 余年 能 几 见 斯人 不上 甘泉 班 我辈 先之 腼 颜面 君 到 灵山 亲得 语 切莫 提 撕落 言 句 恨君 相见 一年 迟 不同 蓟北 燕南路
1d9868f6-c059-4303-a36c-7251b56f57c2,胡伯晖有诗训豚犬辈次韵以广其意,许及之,唐,诗,七言古体,金风著幕惊新秋 银河摇落光飞浮 天籁既息虫声啾 书生白发不解愁 挑灯夜诵疾于流 人生在勤业箕裘 少不努力进厥修 老将噬脐孰怨尤 悠悠天壤卑微休 安得独叹命不犹 昔人忘食兼忘忧 何适非学息与游 道不敢径川不游 朝吟暮讽夜校讐 至理渐渍如膏油 好处心会非力求 不特祇为科第谋 正使积书如邺侯 手尚不触读岂周 张口云雾正自羞 学与不学人焉廋 汝曹曾念及此不 贤师学到无全牛 乃翁为汝相延留 一官为援乏蚍蝣 欲糊汝口违松楸 敢辞折腰向督邮 赋归无地堪耕收 勉旃汲古到索丘 困来时复揩双眸,"7,7,7,7,7,7,7,7,7,7,7,7,7,7,7,7,7,7,7,7,7,7,7,7,7,7,7,7,7,7",4c6c63c56fce0faccac64c7acf97663a,金风 著幕 惊新 秋 银河 摇落 光飞 浮 天籁 既息 虫声 啾 书生 白发 不 解愁 挑灯 夜 诵 疾 于 流 人生 在 勤业 箕裘 少 不 努力 进厥 修 老将 噬 脐 孰 怨尤 悠悠 天壤 卑微 休 安 得 独叹命 不犹 昔人 忘食 兼 忘忧 何 适非 学息 与 游 道 不敢 径川 不 游 朝 吟暮讽 夜校 讐 至 理 渐 渍 如 膏油 好处 心会 非 力求 不 特 祇 为 科第 谋 正 使 积书 如 邺 侯 手尚 不 触读 岂 周 张口 云雾 正 自羞 学 与 不学人 焉 廋 汝曹曾 念及 此 不 贤师 学到 无 全牛 乃翁 为 汝相延 留 一 官 为 援乏 蚍蝣 欲 糊 汝 口 违 松 楸 敢辞 折腰 向督邮 赋归 无地堪耕收 勉 旃 汲古 到 索丘 困 来时 复 揩 双眸
78c6b8bf-a357-46c6-b5c5-590791e4117d,次德友韵,许及之,唐,诗,七言古体,忆昨得君和陶诗 床头细读人谓痴 二南固自立墙面 十驾亦欲鞭驽疲 退惭作吏了无补 正使得句安能奇 有时拈笔弄纸墨 大似临敌收枪旗 投老且愿共诗社 鬭健聊欲为儿嬉 恨子寓舍苦迢递 有僧借屋无奔驰 乞米不须烦送似 无储自足常宴如 转庵与为方外旧 仆也何翅管中窥 岂有修竹真可款 曷不宿雾及早披 来诗赓酬特未已 追逐登临随所之,"7,7,7,7,7,7,7,7,7,7,7,7,7,7,7,7,7,7,7,7",d076d12b5d993e70b15199e9330b4d5c,忆昨得君 和 陶诗 床头 细读 人 谓 痴 二南 固 自立 墙面 十驾 亦 欲 鞭 驽疲 退惭作吏 了 无补 正 使得 句 安能奇 有时 拈 笔 弄 纸 墨 大似临敌收枪旗 投老 且 愿 共 诗社 鬭 健 聊 欲 为 儿 嬉 恨子 寓舍 苦迢递 有 僧 借 屋 无 奔驰 乞米 不须 烦 送似 无储 自足 常宴 如 转 庵 与 为 方外 旧 仆 也 何翅管 中 窥 岂 有 修竹真 可款 曷 不 宿 雾 及早 披 来 诗 赓 酬 特未 已 追逐 登临 随所之
a28030fa-53ef-415f-9b81-0ebff1c80ff7,得赵昌甫诗集转呈转庵却以谢梦得诗见示有诗次韵,许及之,唐,诗,七言古体,我馋嗜诗欣染指 但见其长有谁毁 早年游方识赵谢 如鲁逢掖宋章甫 谢诗澜翻豪且古 赵句清癯澹而苦 学力到后成一家 渠自不知为孰使 天各一方费渴思 想见冰增寒似水 居然老手斫方圆 出户中规还中矩 转庵活法已参遍 何止得心仍得髓 我如无宝穷波斯 望著是珍先自喜 忽得赵璧急呈似 示以谢草如寄取 自怜老去无长进 努力吟哦训儿子,"7,7,7,7,7,7,7,7,7,7,7,7,7,7,7,7,7,7,7,7",b36ec5fabb1f6a1c2c3e147fd9909d16,我 馋 嗜 诗 欣 染指 但见 其 长 有 谁 毁 早年 游方 识 赵谢 如鲁逢 掖 宋章甫 谢诗澜 翻 豪 且 古 赵 句 清癯 澹而 苦 学力 到 后 成 一家 渠自 不知 为 孰 使 天各一方 费渴思 想见 冰 增 寒似 水 居然 老手 斫 方圆 出户 中 规还 中矩 转 庵 活法 已 参遍 何止 得心 仍 得 髓 我 如无宝穷 波斯 望著 是 珍 先自 喜 忽得 赵璧 急 呈似 示以 谢草 如 寄取 自怜 老 去 无 长进 努力 吟哦 训 儿子
5b31b801-6771-411b-af31-eec1c7268423,再次转庵韵,许及之,唐,诗,七言古体,能诗何殊臂使指 得句不愁人背毁 诗何缘瘦道自肥 谁嘲饭颗山前甫 誓不惊人死不休 言是良工心独苦 骊黄牝牡元不问 智诈勇贪俱可使 合时端如锥画沙 悟处快于瓴建水 赵诗平澹谢奇古 所以吾侪夸絜矩 转庵更是可怜人 诗眼既高窥字髓 我生何能补一字 君美非溢私两喜 更须传抄及同社 定不惊嗟斯是取 骚坛摩垒真几人 安能碌碌数余子,"7,7,7,7,7,7,7,7,7,7,7,7,7,7,7,7,7,7,7,7",7f2e72f075bfa95938ceabf2fc80d8cc,能诗 何殊 臂 使 指 得 句 不 愁 人 背毁 诗何缘 瘦 道 自肥 谁 嘲饭 颗 山前 甫 誓 不 惊人 死不休 言 是 良 工心 独苦 骊 黄 牝牡 元 不问 智诈勇 贪俱可使 合 时端 如锥画沙 悟 处快 于 瓴 建水 赵诗平 澹谢奇 古 所以 吾侪 夸 絜 矩 转 庵 更是 可怜 人 诗眼 既 高 窥 字 髓 我 生何能补一字 君美 非 溢私 两 喜 更 须 传抄 及 同 社 定不 惊嗟 斯 是 取 骚坛 摩垒 真 几 人 安 能 碌碌 数余子
