id,title,author,dynasty,genre,poem_type,sentences_simplified,meter_pattern,hash,words
66ea10eb-4d0b-4445-a541-8b3f06a06ce5,題閩縣西湖,陳康伯,唐,诗,七言律诗,凿开百顷碧融融 颍上钱塘约略同 杨柳两堤连绿荫 芰荷十里馥香风 波涵翠𪩘层层出 潮接新河处处通 舆诵载涂农事起 从今岁岁作年丰,"7,7,7,7,7,7,7,7",c573936187e8f8294e04fc3d448cf451,凿开 百顷 碧 融融 颍 上 钱塘 约略 同 杨柳 两 堤 连 绿荫 芰 荷 十里 馥 香风 波涵翠 𪩘 层层 出 潮 接 新河 处处 通 舆诵 载 涂 农事 起 从今 岁 岁 作年 丰
20fdc316-9c4c-46bf-976d-6ed02f6db9d9,送葉守,陳康伯,唐,诗,七言绝句,海国民皆兴礼义 潢池盗已息干戈 农桑四境丰年屡 箫鼓千村叶气多,"7,7,7,7",b261984616796b07fb2ee20d79db6cc9,海 国民 皆 兴 礼义 潢池 盗 已息 干戈 农桑 四境 丰年 屡 箫 鼓 千 村叶气 多
9d6d81b9-d16c-4baa-8bdc-57b90092d15f,句,揚無咎,唐,诗,五言古体,陈迹千年在 斯人百代无,"5,5",3802a441a30aa6ba4408e6c30020aa2d,陈迹 千年 在 斯人 百代 无
0ff2b66f-1666-4bff-9737-867e5285c7a5,雙魚花,朱翌,唐,诗,五言古体,物生本不同 所贵以形似 如何小草间 或作潜渊类 宛然花叶分 有此尾鬣备 如以柳贯腮 十百共一蒂 可肩比目鳞 与世为上瑞 稽首蓬莱宫 愿附花鸟使,"5,5,5,5,5,5,5,5,5,5,5,5",3495630ca7dffb322a1c14c3405220ff,物生本 不同 所贵 以 形似 如何 小草 间 或 作潜渊 类 宛然 花叶 分 有此 尾 鬣备 如以 柳贯 腮 十百 共 一蒂 可肩 比目 鳞 与 世为 上 瑞 稽首 蓬莱 宫 愿附 花鸟 使
d70c03d8-3fe4-457c-97de-f3f819976d8e,送山芥與徐稚山,朱翌,唐,诗,五言古体,北风撼坤轴 飞雪封高崖 万草坐冻死 不复存根荄 蔚然苍山底 有此紫玉钗 本无尘土侵 宁畏霜霰埋 偶为樵牧知 遂与薇蕨偕 坚瘦故耐久 苦森终怒俳 未免一时出 肯事众口谐 可以寄乐天 时供八关斋 可以送庾郎 三九代食鲑 朱门厌𬊈煼 嘉蔬日谁差 飞觞失行次 可口相推排 尔来走缾甖 遂费登山鞋 文昌列宿光 骑省后人佳 居官乃退步 养气能实骸 一箸须子同 苦硬求吾侪,"5,5,5,5,5,5,5,5,5,5,5,5,5,5,5,5,5,5,5,5,5,5,5,5,5,5,5,5,5,5",28f2b9d999ea305592678623075b0990,北风 撼 坤轴 飞雪 封 高崖 万 草 坐 冻死 不 复 存根 荄 蔚然 苍山 底 有此 紫 玉钗 本 无 尘土 侵 宁畏霜 霰埋 偶为 樵牧 知 遂与薇蕨 偕 坚瘦 故 耐久 苦森终 怒 俳 未免 一时 出 肯事 众口 谐 可以 寄 乐天 时 供 八关 斋 可以 送 庾郎 三九 代食 鲑 朱门 厌 𬊈 煼 嘉 蔬日 谁 差 飞觞 失行 次 可口 相 推排 尔 来 走 缾 甖 遂 费 登山鞋 文昌 列宿光 骑省 后人 佳 居官 乃 退步 养气 能 实骸 一 箸 须子 同 苦 硬求 吾侪
b564997a-e6f5-43a4-a7f1-e6ebc93ba3cf,淮人多食蛙者作詩示意,朱翌,唐,诗,五言古体,淮人为水族 庖脍亦已巧 田间有鸣鸡 性命得自保 吴人口垂涎 捕取穷浩渺 于吴产或多 于淮求则少 要之业境会 食债良自绕 予也家淮南 游吴尝草草 平生下箸处 但觉皆羊枣 不论赤𩽼公 亦及长须老 何况鼓吹部 可作钟鼎宝 世间多空中 所见徒有表 至美不外示 鱼鼈岂皆好 君看十月鹑 羽翼甚轻矫 变化须臾间 不念旧池沼 食鹑乃无言 食蛙或颦愀 鹑蛙等无二 妄想自颠倒 舌根无尽期 所得在一饱 哀哉南路徐 食方说𬊈煼 但俱供芋羹 不必著锦袄 较之食疮痂 岂但能稍稍,"5,5,5,5,5,5,5,5,5,5,5,5,5,5,5,5,5,5,5,5,5,5,5,5,5,5,5,5,5,5,5,5,5,5,5,5,5,5",2ac67089c56db19fb69f6e2f7971bf0c,淮 人为 水族 庖 脍 亦 已巧 田间 有 鸣 鸡 性命 得 自保 吴 人口 垂涎 捕取 穷 浩渺 于 吴产 或 多 于淮求 则 少 要 之 业境 会 食债 良 自绕 予 也 家 淮南 游 吴尝 草草 平生 下箸 处 但 觉 皆 羊枣 不论 赤 𩽼 公 亦 及 长须 老 何况 鼓吹 部 可 作 钟鼎 宝 世间 多 空中 所见 徒 有 表 至 美 不 外示 鱼 鼈 岂 皆 好 君 看 十月 鹑 羽翼 甚轻 矫 变化 须臾 间 不 念旧 池沼 食鹑 乃 无言 食蛙 或 颦 愀 鹑 蛙 等 无二 妄想 自 颠倒 舌根 无尽期 所得 在 一 饱 哀哉 南路 徐 食方 说 𬊈 煼 但 俱供 芋羹 不必 著 锦 袄 较之 食 疮痂 岂但 能 稍稍
4ea554ba-f285-43d0-a55e-ee5264c7326c,游月巖詩,朱翌,唐,诗,五言古体,赫日方正中 忽见第二月 老木盘硬枝 扶疏真桂叶 烟云成显晦 弦望靡盈阙 初无大小余 可以历没灭 但能照行人 千古此山侧 却笑天上轮 昼夜不停辙,"5,5,5,5,5,5,5,5,5,5,5,5",0f2b22cda14e202a080e631aa1015105,赫 日方 正中 忽 见 第二 月 老 木盘 硬枝 扶疏 真桂叶 烟云 成显 晦 弦 望 靡 盈 阙 初无 大小 余 可以 历没灭 但 能照 行人 千古 此 山侧 却 笑 天上 轮 昼夜 不停 辙
d29b51f9-316a-4cd4-a976-0d2ffaabddbb,張翰惠書告窘,朱翌,唐,诗,五言古体,伯龙营什一 抚掌鬼在侧 燕公铸横财 地下万炉执 贫富有物司 得失难智索 我今竟日餐 或待门生设 朝园𣃁菜根 暮火团松节 黄嬭坐上座 方兄行禁谒 安能决余波 可以润子箧 俯视腰一围 何时解三篾 荐福纵有碑 震雷即惊裂 读我送穷文 还君乞米帖,"5,5,5,5,5,5,5,5,5,5,5,5,5,5,5,5,5,5,5,5",52ad9769bf42e043f3e9e1b29b43df94,伯龙营 什一 抚掌 鬼 在 侧 燕公铸 横财 地下 万 炉 执 贫富 有 物司 得失 难 智索 我 今 竟 日 餐 或 待 门生 设 朝园 𣃁 菜根 暮 火团 松节 黄 嬭 坐 上 座 方兄 行禁 谒 安能 决 余波 可以 润 子 箧 俯视 腰 一围 何时 解三 篾 荐 福 纵 有 碑 震雷即惊裂 读 我 送 穷 文 还 君 乞米 帖
807fe77a-cf5d-4a8d-80f5-3bbd5a1504ff,與劉令食枸杞,朱翌,唐,诗,五言古体,周党过仲叔 菽水无菜茹 我槃有枸杞 与子同一箸 若比闵县令 已作方丈富 但令齿颊香 差免腥膻污 我寿我自知 不待草木辅 政以不种勤 日夕供草具 更约傅延年 一饭美无度 解衣高声读 苏陆前后赋,"5,5,5,5,5,5,5,5,5,5,5,5,5,5,5,5",da122a6712454fa2f1958b95568df10d,周党 过仲叔 菽水 无菜 茹 我 槃 有 枸杞 与 子 同一 箸 若比闵 县令 已 作 方丈 富 但令 齿颊 香 差免 腥膻 污 我 寿 我 自知 不 待 草木 辅 政以不种勤 日夕 供 草具 更约 傅延 年 一 饭 美 无度 解衣 高声 读 苏陆 前后 赋
5c8273dc-1982-4596-9f15-5276fba0a5e5,王令收桂花蜜漬埳地瘞三月啟之如新,朱翌,唐,诗,五言古体,桂花老月窟 堕地散金蕊 长忧风雨余 失此香旖旎 抚树三叹息 留花姑少俟 枕中有仙方 解使香不死 蜜蜂喜输粮 余润获渐靡 瘗深阅三月 发复验封玺 虚堂习新观 博山为频启 初从鼻端参 忽置秋色里 氤氲缥缈间 可以降月姊 自兹闻四时 何止名七里,"5,5,5,5,5,5,5,5,5,5,5,5,5,5,5,5,5,5,5,5",1ba24b22ed2139a93b91d613e1a38819,桂花 老 月 窟 堕 地 散 金蕊 长忧 风雨 余 失 此 香 旖旎 抚树三 叹息 留 花姑 少 俟 枕中 有 仙 方 解使 香 不 死 蜜蜂 喜 输粮 余润获 渐 靡 瘗 深 阅 三月 发 复验 封玺 虚堂 习新观 博山 为 频启 初 从 鼻端 参 忽置 秋色 里 氤氲 缥缈 间 可以 降 月 姊 自兹 闻 四时 何止 名 七里
627cd3d0-49b2-4bd8-8e64-8c2f4a760f60,與郭令步至城下見田間稻秧已可插慨然有感示郭令,朱翌,唐,诗,五言古体,端居倦来往 春去谁与娱 眷眷斗升米 翛翛东南都 薄暮喜穿屐 同游又吾徒 念昔始经此 污邪祝满车 及今几何日 立苗还欲疏 怀新舞翠剡 生意蔚以舒 吾生将安之 土偶之与俱 清夜梦乡曲 未觉田园芜 他时招子归 把锄春雨余,"5,5,5,5,5,5,5,5,5,5,5,5,5,5,5,5,5,5",48a9fa153cdb7703e3a687e9aebdcc43,端居 倦 来往 春去 谁 与 娱 眷眷 斗升 米 翛 翛 东南 都 薄暮 喜 穿 屐 同游 又 吾 徒 念昔始 经此 污邪 祝 满车 及 今 几何 日 立苗 还 欲 疏 怀新舞 翠剡 生意 蔚以舒 吾 生 将 安 之 土偶 之 与 俱 清夜 梦乡 曲 未觉 田园 芜 他时 招子 归 把 锄 春雨 余
7e29323d-080d-45c3-9462-9818e4313345,重午菊有花遂與菖蒲同採,朱翌,唐,诗,五言古体,菖蒲秀端午 黄花作重阳 万物各时行 半岁遥相望 云何忽并开 相与同一觞 仙人九节杖 东坡一枝香 洗去仲夏热 如逢晚秋霜 均是酒中物 俱使吾年长 莫夸雨露私 勿笑草木狂 登高阅竞渡 乐哉未渠央,"5,5,5,5,5,5,5,5,5,5,5,5,5,5,5,5",804266da9c3340936edf5702e10baf85,菖蒲 秀 端午 黄花 作 重阳 万物 各时 行 半岁 遥 相望 云何忽 并 开 相与 同一 觞 仙人 九节 杖 东坡 一枝香 洗 去 仲夏 热 如 逢 晚 秋霜 均 是 酒 中物 俱 使 吾 年长 莫夸 雨露 私 勿 笑 草木 狂 登高 阅 竞渡 乐哉 未 渠央
a1256b4f-7adf-42e9-96ba-bb2d2cefa472,競渡示周宰,朱翌,唐,诗,五言古体,英英屈大夫 遗骨沦湘湄 楚人念何深 叫空冤水妃 虽无些词招 顾有铙鼓悲 忆昨上巳日 纵观金明池 突殿隠负鼇 长桥低卧蜺 诸公贵人来 珠幢绀幰随 两军各气焰 万楫生光辉 龟鱼戢影避 虎龙挟翼飞 想当大军后 益觉游子稀 况我中兴君 高拱绝宴嬉 羁人老淮楚 古寺临长溪 节物亦撩人 风俗自随时 往来两舴艋 规模具体微 邑人乐丰年 聚观眼不移 捐金赏先至 顿足助绝驰 在昔攻战具 今但娱群儿 因而语兵法 可以威四夷 八宝水中央 大海压左圻 其中椎剽奸 连舰扬鼓旗 先事能预防 在易则见几 作诗示周郎 赤壁有成师,"5,5,5,5,5,5,5,5,5,5,5,5,5,5,5,5,5,5,5,5,5,5,5,5,5,5,5,5,5,5,5,5,5,5,5,5,5,5,5,5,5,5",83194c05e72c027f098929fb22d55c8a,英 英 屈 大夫 遗骨 沦 湘 湄 楚 人念 何深 叫 空 冤水妃 虽 无些 词 招 顾 有 铙 鼓 悲 忆 昨上 巳 日 纵观 金明池 突 殿 隠 负 鼇 长桥 低 卧 蜺 诸公 贵人 来 珠 幢 绀 幰 随 两 军 各 气焰 万楫生 光辉 龟 鱼 戢 影 避 虎 龙 挟翼飞 想 当 大军 后 益觉 游子 稀 况 我 中兴 君 高 拱 绝宴 嬉 羁 人 老 淮 楚 古寺 临长溪 节物 亦 撩人 风俗 自 随时 往来 两 舴艋 规模 具体 微 邑 人乐 丰年 聚观眼不移 捐金 赏 先至 顿足 助绝 驰 在 昔 攻 战具 今 但 娱群 儿 因而 语 兵法 可以 威四夷 八宝 水 中央 大海 压 左圻 其中 椎 剽奸 连舰 扬鼓旗 先事 能 预防 在 易 则 见 几 作诗 示周郎 赤壁 有 成师
5cefd728-8c5e-494e-8ff9-cad8ffb2a0ba,竹枕,朱翌,唐,诗,五言古体,方床洗湘斑 夏簟织蕲笛 谁与同卧起 青奴甚相得 嘉哉直节君 契分近愈密 深林捕猫头 乃复枕上膝 直从无热天 径下清凉国 早晚报平安 一觉我自适 梦中从我游 子猷推第一,"5,5,5,5,5,5,5,5,5,5,5,5,5,5",fe8f91cac926b3e9b5af0d8dd86b5141,方床 洗 湘 斑 夏 簟 织 蕲 笛 谁 与 同卧 起 青奴 甚相 得 嘉哉 直节 君 契分 近愈 密 深林 捕 猫头 乃复 枕上 膝 直 从 无 热天 径 下 清凉 国 早晚 报平安 一觉 我 自适 梦 中 从 我 游 子猷 推 第一
10c25a21-a61e-4a0c-ac68-e17afd12ac8e,西園月夜竹影滿堂,朱翌,唐,诗,五言古体,良夜天彻幕 林间月如筛 解与竹传神 月娥真画师 东坡元不死 鹤驾相追随 习气未扫除 戏笔聊一麾 调和水墨匀 幻出虬龙枝 图成不挂壁 掷地容俯窥 欲进复小却 尚虑鞋底泥,"5,5,5,5,5,5,5,5,5,5,5,5,5,5",ee832905e4badee91f486bab5709b1be,良夜 天彻 幕 林间 月 如 筛 解与 竹 传神 月娥 真 画师 东坡 元 不 死 鹤驾相 追随 习气 未 扫除 戏笔 聊 一 麾 调和 水墨 匀 幻出 虬龙 枝 图成 不 挂壁 掷 地容 俯窥 欲 进复 小 却 尚虑 鞋底 泥
803e6a4b-bc88-41db-b4b9-2f2d16cc46b8,初直省宿,朱翌,唐,诗,五言古体,薄暮欣暑退 吏散列闲屋 冰厅冷如水 孤坐一巾幅 久绝青绫赐 仅免床下伏 何尝语丁宁 但愧头蓄缩 频年耗太仓 初夜费官烛 枕书倦已抛 梦蝶来更速 咍台到天明 从人笑列宿,"5,5,5,5,5,5,5,5,5,5,5,5,5,5",1af81323d257da06ab85f3e8a08a58f5,薄暮 欣暑 退 吏 散列 闲屋 冰厅 冷如 水 孤坐 一巾 幅 久 绝 青 绫赐 仅 免床 下伏 何尝 语 丁宁 但 愧 头 蓄缩 频年 耗 太仓 初夜 费官烛 枕书 倦 已 抛 梦蝶 来 更速 咍 台 到 天明 从 人 笑 列宿
a2c416e1-2bc1-4146-b59e-57651b4d40a5,次韻胡明仲見寄,朱翌,唐,诗,五言古体,去年玉笋班 仰视见櫑具 论事似陆贽 任事似裴度 今年起衡山 出守非不遇 床头看周易 象在益长裕 解琴须更张 谋国乃疾固 要开天地炉 更使万物铸 可怜冰氏子 大似铁𬬻步 自谓乐于贫 公乃知其素 来删城旦书 聊免吏部注 祝公早来朝 为上宽北顾,"5,5,5,5,5,5,5,5,5,5,5,5,5,5,5,5,5,5,5,5",501ce00a5dc95ba9d0114b30c4c32bfb,去年 玉笋 班 仰视 见 櫑 具 论事 似 陆贽 任事 似 裴 度 今年 起 衡山 出守 非不 遇 床头 看 周易 象 在 益 长裕 解琴 须 更 张 谋国 乃 疾固 要 开 天地 炉 更 使 万物 铸 可怜 冰氏子 大 似 铁 𬬻 步 自谓 乐于 贫 公乃知 其 素 来 删 城旦 书 聊免 吏部 注 祝公 早来 朝 为 上宽 北顾
3aebf94e-c0ea-4eb1-9f71-58a70054be25,送張巨山,朱翌,唐,诗,五言古体,天方六月暑 君有千里行 相从苦不款 惜别难为情 发轸子胥山 落帆石头城 火云午尤奇 水风晚更清 辉辉萤自烛 嘒嘒蝉争鸣 今代太史氏 昔者兰台英 人如晋宋间 诗与颜谢并 吾君志恢复 求士出至诚 玉堂紫微省 待子来经营,"5,5,5,5,5,5,5,5,5,5,5,5,5,5,5,5,5,5",610d5077b25fdbba04b504747076181d,天方 六月 暑 君 有 千里 行 相 从苦 不款 惜别 难为情 发 轸 子 胥山 落帆 石头城 火云 午 尤奇 水风晚 更 清 辉 辉 萤自烛 嘒 嘒 蝉 争鸣 今代 太史 氏 昔者 兰台 英 人 如 晋宋 间 诗 与 颜谢 并 吾 君志 恢复 求士 出 至诚 玉堂 紫微 省 待子 来 经营
5bd4e8b9-48f0-4ee2-af84-975b3c48e835,七月十四夜月分韻得明字,朱翌,唐,诗,五言古体,澹澹烟覆渚 呜呜角收声 白毫万丈光 下注千山倾 良夜三五时 玉楼十二城 皇天老眼开 碧湛双瞳睛 窥我读书窗 徘徊到天明 风从树头来 挟我入太清 飞萤转蒿丛 熠燿徒营营 露气下庭宇 秀爽凌冠缨 以兹无尽景 对此不平鸣 不如使云遮 寂历忘吾情,"5,5,5,5,5,5,5,5,5,5,5,5,5,5,5,5,5,5,5,5",d7d14e46f1d0a1d5c9a10287bd8ad091,澹澹 烟 覆 渚 呜呜 角 收声 白 毫 万丈 光 下注 千山 倾 良夜 三五 时 玉楼 十二 城 皇天 老眼 开 碧湛 双瞳 睛 窥 我 读书 窗 徘徊 到 天明 风 从 树头 来 挟 我 入 太 清 飞萤 转 蒿 丛 熠燿 徒 营营 露气 下庭 宇 秀 爽 凌冠缨 以兹 无尽 景 对此 不平 鸣 不如 使 云遮 寂 历 忘 吾 情
1ad67950-a8eb-4c4f-aa52-520c23d9f026,有感,朱翌,唐,诗,五言古体,退之传毛颖 步骤过迁固 当时不入眼 怪笑且惊怖 柳州极不平 裁书细说喻 浮云蔽两曜 凭虚亦暂驻 何伤黄道行 终古元气聚 呜呼古今一 吾其秘缃素,"5,5,5,5,5,5,5,5,5,5,5,5",4711bf601ce329089cc46e8094ccf962,退之传 毛颖 步骤 过迁 固 当时 不 入眼 怪 笑 且 惊怖 柳州 极 不平 裁书 细说 喻 浮云 蔽 两 曜 凭 虚 亦 暂 驻 何 伤 黄道 行 终古 元气 聚 呜呼 古今 一 吾 其 秘 缃 素
d0a35531-fbc2-4f66-a3df-4590b4e36fc7,曉上烏石灘,朱翌,唐,诗,五言古体,急滩上水船 进寸辄退尺 老夫敢稳坐 解衣起佐刺 凡我同舟人 有力俱不惜 已济各相贺 可以正枕席 反观顺流人 如电亦如射 艰难与快意 等是时行役 月落东方明 云收远山碧 翩然两白鹭 过眼已无迹 天地正尔宽 何苦自跼蹐 脱带且腰舟 歇我履一只,"5,5,5,5,5,5,5,5,5,5,5,5,5,5,5,5,5,5,5,5",bcccea656860e8208f0802c09d72a516,急滩 上水船 进 寸辄退尺 老夫 敢 稳 坐 解衣 起佐 刺 凡 我 同 舟 人 有力 俱 不惜 已济 各 相贺 可以 正 枕席 反观 顺流 人 如 电 亦 如射 艰难 与 快意 等 是 时 行役 月 落 东方 明 云 收 远山 碧 翩然 两 白鹭 过眼 已 无 迹 天地 正尔宽 何苦 自 跼 蹐 脱带 且 腰舟 歇 我 履 一只
23950a5b-5709-4aa9-989f-c65be336891c,章質夫帥廣時以酒六壺寄東坡於惠州書到而酒不至東坡有詩傳在人口思召作廣東漕翌適居曲江亦惠六尊且云吾家故事也爲作此詩,朱翌,唐,诗,五言古体,西枢镇番禺 绍圣之初年 复露落南人 雅意极周旋 六尊南海春 万里罗浮仙 先生洗破觥 使者张空拳 五十有六字 至今星斗悬 君持泽国节 我赋囚山篇 欣然故事修 要使家法传 礼等百牢我 情均一觞天 夜来灯有花 不忧爨无烟 但恨语无味 何以追昔贤,"5,5,5,5,5,5,5,5,5,5,5,5,5,5,5,5,5,5,5,5",905f02a0f834ef540b38c477acacb02d,西枢镇 番禺 绍圣 之 初年 复露 落南 人 雅意 极 周旋 六尊 南海 春 万里 罗浮仙 先生 洗破 觥 使者 张 空拳 五十 有 六 字 至今 星斗 悬 君 持 泽国 节 我 赋 囚 山 篇 欣然 故事 修 要 使 家法 传 礼 等 百牢 我 情 均 一 觞 天 夜来 灯 有 花 不 忧 爨 无烟 但 恨 语 无味 何以 追昔贤
4c89d235-8be8-45a6-9c2d-ff2047a0cdf0,三月旦行園,朱翌,唐,诗,五言古体,我柳已飘絮 我笋亦上竹 雪毡密盖地 犊角横入屋 兹辰略行园 喜色动眉绿 炎荒异中原 气候少清淑 一日具四时 旦暮变寒燠 而我于此间 兀若蚕上簇 但爱草木长 遂使杖屦熟 喜甚得小诗 意断语不续 尚可羊何和 不用唐衢哭 诸公幸无事 来不待休沐 床敷三百棋 胜负任反复,"5,5,5,5,5,5,5,5,5,5,5,5,5,5,5,5,5,5,5,5,5,5",5a83c2acae5df66b6bb9d1a8b89bbbcd,我 柳 已 飘絮 我 笋 亦 上 竹 雪 毡 密盖地 犊角 横入 屋 兹 辰 略行 园 喜色 动眉 绿 炎 荒异 中原 气候 少 清淑 一日 具 四时 旦暮 变 寒 燠 而 我 于 此间 兀 若 蚕 上簇 但 爱 草木 长 遂 使 杖 屦 熟 喜 甚 得 小 诗 意 断语 不续 尚可 羊何 和 不用 唐衢 哭 诸公 幸无事 来 不待 休 沐 床 敷 三百 棋 胜负 任 反复
1833d49a-edf7-4542-96bf-cbbc534211d3,飯大涌泉入紫微洞洞乃余尋出,朱翌,唐,诗,五言古体,山川有佳处 神物严守卫 自非夙有因 孰敢发其秘 众壑拥流泉 青间见白沸 洗我杖与屦 时作深入计 要须乡道先 行与老人值 指我洞壑已 忽不知所诣 𣃁荒刬巨石 稍去眼中翳 豁然大厦开 位可百人置 嵌严一日出 自此沓游骑 开山属老夫 爱山必同类 甚畏长风寒 当暑皆敛袂 欢伯遂行登 相引入胜地,"5,5,5,5,5,5,5,5,5,5,5,5,5,5,5,5,5,5,5,5,5,5,5,5",d5b49beb7e0f803e5da247f74c998124,山川 有 佳 处 神物 严 守卫 自 非 夙有因 孰 敢 发 其 秘 众壑 拥 流泉 青间 见白 沸 洗 我 杖 与 屦 时作 深入 计 要 须 乡 道 先 行 与 老人 值 指 我 洞 壑 已 忽 不知 所诣 𣃁 荒 刬 巨石 稍 去 眼中 翳 豁然 大厦 开 位可 百人 置 嵌 严 一日 出 自此 沓 游骑 开山 属 老夫 爱山 必 同类 甚 畏 长 风寒 当暑 皆 敛 袂 欢伯 遂行 登 相 引入 胜地
20d061b4-dc84-465c-b0d0-333621d97537,歲乙丑余年四十有九矣因誦太白四十九年非一往不可復之句次其韻,朱翌,唐,诗,五言古体,南来不赢粮 随身一竿竹 四年钓曹溪 溪水香可掬 求方驻隙驹 辟谷起黄独 五十止欠一 何地可归宿 今晨祖师前 一掷杯珓卜 去以六月息 来期七日复 往事一局棋 信手不必覆 吾生行休矣 自此生处熟,"5,5,5,5,5,5,5,5,5,5,5,5,5,5,5,5",cb297e1d16e35bbeb033f80e16361fad,南来 不 赢 粮 随身 一竿 竹 四年 钓 曹溪 溪水 香 可 掬 求 方 驻 隙驹 辟谷 起 黄独 五十 止 欠 一 何地 可 归宿 今晨 祖师 前 一 掷 杯 珓 卜 去 以 六月 息 来期 七日 复 往事 一局 棋 信手 不必 覆 吾 生行 休 矣 自此 生处 熟
b9893aba-74af-41a6-8773-4416dd9a4ae9,題劉憲十君子軒,朱翌,唐,诗,五言古体,北极元轩气 受命惟尔独 四方散子孙 万里异闽蜀 戴谱六十一 岩谷无遗录 段记三十九 冥搜出隠伏 世若不尽见 谁为合其族 儒林老丈人 与世谈无欲 开轩延十君 跪坐进三沐 高低列云来 新旧间伯叔 团栾十家春 门户各清肃 客至为卷帘 赞名问寒燠 一见伯玉辈 遂使季子服 我欲作竹史 就君求品目,"5,5,5,5,5,5,5,5,5,5,5,5,5,5,5,5,5,5,5,5,5,5,5,5",4f57abac488ac5e8a262e8dfcae7d392,北极 元轩 气 受命 惟尔 独 四方 散 子孙 万里 异 闽 蜀 戴谱 六十一 岩谷 无遗 录 段 记 三十九 冥 搜 出 隠 伏 世若 不尽 见 谁 为合 其族 儒林 老丈人 与世谈无欲 开 轩 延十君 跪坐 进三 沐 高低 列云 来 新旧 间 伯叔 团 栾 十家 春 门户 各 清肃 客 至为 卷帘 赞名 问 寒 燠 一 见 伯玉 辈 遂 使 季 子服 我 欲 作 竹史 就 君求 品目
9e4346b8-4b95-4f25-8002-b71f7f7f3091,予居曲江五年今歲又暮慨然有感,朱翌,唐,诗,五言古体,坐对研旁峰 卧阅屏上山 一事不挂心 万病方穷源 吾君礼南郊 吾母望北还 一岁几得书 五年阙问安 是自取之尔 尚复何所言 手种庭下梅 花开聊喜欢 系日既无术 缩地良独难,"5,5,5,5,5,5,5,5,5,5,5,5,5,5",95fa5d15945d2c6888a45ff0466f2c99,坐 对 研旁 峰 卧阅 屏 上山 一事 不 挂心 万 病方 穷源 吾 君 礼 南郊 吾 母望 北 还 一岁 几得 书 五年 阙 问安 是 自取 之尔 尚复何 所 言 手 种庭 下 梅 花 开聊 喜欢 系日 既 无术 缩地 良独 难
a736e6a5-f57c-4806-bf71-f9bfc06f0a85,寄江東王端明,朱翌,唐,诗,五言古体,德人大江南 壶歌温玉帐 三岁丰年玉 民倚嵩华壮 政碑满七尺 赐盖高一丈 平生诗有声 行与李杜抗 余力到行草 妙合晋人样 如此未赐环 颇复辜众望 前时幕下生 今作倚门肮 故国动远思 一夜清江涨 身如龟甲卷 书自鱼乙放 南风造新凉 爽气来叠嶂 壶觞得自引 茵鼎保无恙 愿公介厚禨 中卣调秬鬯,"5,5,5,5,5,5,5,5,5,5,5,5,5,5,5,5,5,5,5,5,5,5,5,5",0cfca632c576670c63c08d12beb79e23,德 人大 江南 壶 歌 温玉 帐 三岁 丰年 玉 民 倚 嵩华壮 政碑 满 七尺 赐 盖 高一丈 平生 诗 有声 行 与 李杜抗 余力 到 行草 妙合晋 人样 如此 未 赐 环 颇复辜 众望 前时 幕下 生 今 作 倚门 肮 故国 动远思 一夜 清江 涨 身 如 龟甲 卷 书 自 鱼乙放 南风 造新 凉 爽气 来 叠嶂 壶 觞 得 自引 茵 鼎 保 无恙 愿 公介 厚 禨 中 卣 调 秬 鬯
cc04503a-132c-4f03-b946-005f732277e7,十月旦讀子美北風吹瘴癘羸老思散策之句初寮嘗作十詩因次其韻  其一,朱翌,唐,诗,五言古体,战休左触氏 梦破大槐国 肝胆方一家 燕越非异域 是中路坦平 本自无降陟 乾坤有乾坤 无极复无极 海角尽东南 天门洞西北 万里无寸草 何人不相识 亦有鼓刀儿 大烹举铜鬲,"5,5,5,5,5,5,5,5,5,5,5,5,5,5",3afe1b8d9edcb6a2966ea1504252f665,战休 左触氏 梦 破 大槐国 肝胆 方 一家 燕越 非 异域 是 中路 坦平 本自 无降 陟 乾坤 有 乾坤 无极 复 无极 海角 尽 东南 天 门洞 西北 万里 无 寸草 何人 不 相识 亦 有 鼓 刀儿 大 烹 举 铜 鬲
c60fda23-85fe-4c4e-8dc8-ec9f49f52bef,十月旦讀子美北風吹瘴癘羸老思散策之句初寮嘗作十詩因次其韻  其二,朱翌,唐,诗,五言古体,问学要根柢 文章忌雷同 字求反切当 义用训诂通 纵之逼论剑 收之入檀弓 平生苦我心 不如作一农 林间潇洒侯 川上赤𩽼公 姑从贤者乐 勿笑鄙夫空 秋宵引佳月 暑昼追凉风 如此了一生 我其塞上翁,"5,5,5,5,5,5,5,5,5,5,5,5,5,5,5,5",c4a567d7fdcb8e1b9b3e5db2956b0862,问学 要 根柢 文章 忌 雷同 字求 反切 当 义用 训诂 通 纵之逼 论剑 收之入 檀 弓 平生 苦 我心 不如 作 一 农 林间 潇洒 侯 川上 赤 𩽼 公 姑 从 贤者 乐 勿 笑 鄙夫 空 秋宵 引佳 月 暑 昼 追 凉风 如此 了 一生 我 其 塞上 翁
63d20dff-499d-4f96-b361-b5b6c1c76d5d,十月旦讀子美北風吹瘴癘羸老思散策之句初寮嘗作十詩因次其韻  其三,朱翌,唐,诗,五言古体,戏语陇头子 与若本等夷 朱紫强包裹 本非我所宜 失脚落番山 杳杳随风吹 将买二顷田 树以枳棘篱 还我本来面 度今正其时 此策我自决 欲问其从谁 譬彼沈疴人 忽然饮上池 穷命可抵虎 宁畏山林魑,"5,5,5,5,5,5,5,5,5,5,5,5,5,5,5,5",1c8724ce93c43c1e21917dd9dcc8bbc4,戏语 陇 头子 与若 本 等 夷 朱紫强 包裹 本 非 我 所 宜 失脚 落 番山 杳 杳 随 风吹 将 买 二顷 田 树 以 枳棘 篱 还 我 本来 面 度 今 正 其时 此 策 我 自决 欲 问 其 从 谁 譬彼沈 疴 人 忽然 饮 上池 穷 命 可 抵 虎 宁畏 山林 魑
d2cce229-c165-4d06-8a0e-2ca15830a5e5,十月旦讀子美北風吹瘴癘羸老思散策之句初寮嘗作十詩因次其韻  其四,朱翌,唐,诗,五言古体,老火已退师 寓客不忧瘴 静坐窥物理 一一见情状 用起举拂子 功成卓拄杖 五行更主事 衰绝变生王 此身属造物 穷健胜美恙,"5,5,5,5,5,5,5,5,5,5",a54b846bda2c1b3676675a8ec15fa714,老火 已 退 师 寓客 不忧瘴 静坐 窥 物理 一一 见 情状 用 起举 拂子 功成卓 拄杖 五行 更 主事 衰绝 变生 王 此身 属 造物 穷健胜美恙
