id,title,author,dynasty,genre,poem_type,sentences_simplified,meter_pattern,hash,words
a458c4d3-ba8a-4b7f-a773-af5eea836f99,池上次潘茂洪韵,张镃,唐,诗,七言绝句,水禽花底静藏头 识我青苹欲暮愁 三十六陂焉用许 一航冲岸柳丝桑,"7,7,7,7",992ffa307de22d32fce8b2262fb601e9,水禽 花底 静藏 头 识 我 青 苹欲 暮 愁 三十六 陂 焉用 许 一航 冲岸 柳丝 桑
43c8ea22-f326-416e-b7f7-748a52ae10c4,题苍云亭,张镃,唐,诗,七言绝句,老桧分行直瓦亭 激泉岩罅骨毛醒 从来庐阜太行眼 对此须教一样青,"7,7,7,7",92c48cb8c61be2c6c069b0710aecbad4,老桧 分行 直瓦亭 激泉岩 罅骨毛 醒 从来 庐阜 太行 眼 对此 须 教 一样 青
7f62d6cb-8b15-4d31-ad04-35f86b644133,初闻南湖蛙声成三诗  其一,张镃,唐,诗,七言绝句,杏花杨柳傍清明 淡沲风光画不成 春到此时须急赏 绕堤今夜有蛙声,"7,7,7,7",efdbdd40e35c1b009beb1db419b9d6fe,杏花 杨柳 傍 清明 淡 沲 风光 画 不成 春 到 此时 须 急 赏 绕 堤 今夜 有 蛙声
69846ef9-c242-40d8-bd47-808822dd5612,初闻南湖蛙声成三诗  其二,张镃,唐,诗,七言绝句,竞喜蒿蓬月到时 莫嫌喧噪没新奇 凭谁试问波神看 定诵南湖近日诗,"7,7,7,7",fc26953fdada25f6c632de552cf8decc,竞喜 蒿 蓬 月 到 时 莫 嫌 喧噪 没 新奇 凭 谁 试问 波 神 看 定诵 南湖 近日 诗
9b4c6d39-1540-4b23-998f-e91f506025eb,初闻南湖蛙声成三诗  其三,张镃,唐,诗,七言绝句,皇恩汪濊及虫鱼 尔得安心大泽居 科斗未生休纵乐 吴侬倾听且防渠,"7,7,7,7",d1740fede6023bc0465533c92ce077e3,皇恩 汪 濊 及 虫 鱼 尔 得 安心 大泽 居 科斗 未生 休纵 乐 吴侬 倾听 且 防渠
a69b7d73-52f5-4d82-a945-b456fb19f4f8,绿筠轩旧在于潜寂照寺今移立县治之东竹间凿小池植莲为赋两绝  其一,张镃,唐,诗,七言绝句,按图得此已欣然 胜趣何尝有变迁 一把香茅千个玉 不妨邂逅揖苏仙,"7,7,7,7",5beabe9a97184a9094ed59d2031eac66,按 图 得 此 已 欣然 胜趣 何尝 有 变迁 一把 香茅 千个 玉 不妨 邂逅 揖 苏仙
46dd4c39-6100-40c4-a3b3-ad6a19134969,绿筠轩旧在于潜寂照寺今移立县治之东竹间凿小池植莲为赋两绝  其二,张镃,唐,诗,七言绝句,气韵非关竹有鱼 莫嫌清荫杂芙蕖 官居不俗从何得 窗下风翻末尽书,"7,7,7,7",32d5a958d71b76f89078ab766d3ac3d6,气韵 非关 竹 有 鱼 莫嫌清 荫 杂芙 蕖 官居 不俗 从 何 得 窗 下风 翻 末 尽 书
5dcb72fb-eb78-4c8e-aae4-30bb38013d53,分题得古木,张镃,唐,诗,七言绝句,穴处曾经起怒雷 断藤枯藓半离披 根茎托土何妨远 会见春风长活枝,"7,7,7,7",888f032c75c97c9feb7edab832177c1a,穴处 曾经 起怒 雷 断藤 枯藓 半离 披 根茎 托土 何妨 远 会见 春风 长活 枝
84d917e6-8af8-46b5-ab70-a63ca01b6181,云露堂,张镃,唐,诗,七言绝句,种玉栽琼树树匀 主人心地况长春 便教不假云间路 亦有芳菲日日新,"7,7,7,7",637740c34886f810de10e2cdd3e4ff1b,种玉 栽 琼树树匀 主人 心地 况 长春 便 教 不 假 云间 路 亦 有 芳菲 日日 新
50430723-baf6-4d28-a171-7c49281c8807,南湖上观萍,张镃,唐,诗,七言绝句,风掠浮萍水面来 翠绡成段接还开 无情却似多情物 不到诗中不肯回,"7,7,7,7",5d36fbe53c3440af629f0f0bcb49092a,风掠 浮萍 水面 来 翠绡 成段 接 还 开 无情 却 似 多情 物 不到 诗 中 不肯 回
980f82cb-cb18-48d1-8f9e-3aab502ed516,题荷花画屏,张镃,唐,诗,七言绝句,芙蓉世界水为宫 宴处铿轰沸鼓钟 后乘舞妃香十里 月寒谁见晓骑龙,"7,7,7,7",4309dc0d24eb9b62a2bce257c99b31a1,芙蓉 世界 水为宫 宴处 铿轰沸鼓钟 后 乘 舞妃 香 十里 月 寒 谁 见 晓骑龙
f90b55d7-144e-44b1-bd80-ed55504c1f92,连朝,张镃,唐,诗,七言绝句,连朝溪雨溢荷塘 流水倾银万叶香 不是风吹乱花侧 那知处处著鸳鸯,"7,7,7,7",572cab75faba11d4629d8a312656bdd9,连朝溪 雨 溢 荷塘 流水 倾银 万叶 香 不是 风吹 乱花 侧 那 知 处处 著 鸳鸯
f18bc623-1a1f-4ef0-95dd-49b1ae516771,次韵酬王梦得西湖上见寄,张镃,唐,诗,七言绝句,一萼香红未破尘 绿波惊眼自摇春 晴新策蹇湖边去 供作他年画里人,"7,7,7,7",30c3c83fc60a736c50fa247f7b420af4,一 萼香 红 未 破 尘 绿波 惊眼自摇春 晴新 策 蹇 湖边 去 供作 他 年画 里 人
1cc812cd-0a94-498d-9499-777589dcc4e8,甲辰仲冬八日元衡携两诗过访及归次韵酬送后篇兼寄张武子  其一,张镃,唐,诗,七言绝句,每将幽事当功名 唯欠能诗竹里僧 迳写此篇为疏引 庵成来往岂无凭,"7,7,7,7",4c44c8ff557c08d786fbdba19e526798,每 将 幽事 当 功名 唯 欠能 诗竹 里 僧 迳 写 此 篇 为 疏 引 庵 成 来往 岂 无 凭
30826c96-baa5-4e93-a85e-153b0ea72172,甲辰仲冬八日元衡携两诗过访及归次韵酬送后篇兼寄张武子  其二,张镃,唐,诗,七言绝句,合处畴能证不疑 吾宗神秀岁寒姿 无书寄便今犹懒 说似应须倩老师,"7,7,7,7",3dcbd80e6619e90d704a3050dc034066,合处畴 能证 不疑 吾 宗神 秀 岁寒 姿 无 书 寄 便 今 犹 懒 说似 应 须倩 老师
3b0c3982-f2ff-40cf-b9b5-ff8de85a0fbc,张似之送栗子木瓜,张镃,唐,诗,七言绝句,带日零风色未干 肯随槃俎鬭斓斑 客炉爆处从毡破 女手批时忌蜜悭,"7,7,7,7",429cee277446e84a9753fde2ac24682b,带 日 零 风色 未 干 肯 随 槃 俎 鬭 斓 斑 客炉 爆处 从 毡 破 女手 批 时 忌 蜜 悭
2719d3b0-9087-4df5-b41a-421d8b196bb9,题崔悫画白鹭伺龟,张镃,唐,诗,七言绝句,能言元绪已失计 潜来公子尤多机 藏头壳里勿自暴 曳尾泥中胡不归,"7,7,7,7",156999346c679da2177cf83dcbd69d25,能言 元绪 已 失计 潜 来 公子 尤多 机 藏头 壳里 勿 自暴 曳尾泥 中 胡不归
773874eb-0ab9-44f4-be33-14565e75edbc,持上人别久矣一日来访举似近作且言迁寓新房因次韵赠之,张镃,唐,诗,七言绝句,幽云心性阿师同 懒复随春泥白红 指日茶香申旧好 蔓阴窗户葡萄风,"7,7,7,7",5acc638e484dd1e8b28ffcc902496121,幽云 心性 阿师同 懒复 随 春泥 白红 指 日 茶香 申旧 好 蔓阴 窗户 葡萄 风
bc7dddcb-677c-4e3a-95c9-b3919cd76f1b,晓边,张镃,唐,诗,杂言,晓边花面雨蒙松 鶑避金丸翠竹丛 春半风光自招,"7,7,6",de9b8c1f886c0ee53f46cbd2746e0b69,晓边 花面 雨蒙松 鶑 避 金丸 翠竹 丛 春半 风光 自 招
ed28048c-146f-43ea-a594-21f5d50bfda2,水蕉,张镃,唐,诗,七言绝句,笼丛旧爱谿边树 路转清风尽日阴 窗下不生分别相 石盆秋水养蕉林,"7,7,7,7",5b2542a8d643f401c8036064419da05e,笼丛 旧 爱 谿 边 树 路 转 清风 尽 日 阴 窗下 不生 分别 相 石盆 秋水 养蕉林
98d65032-798e-42fd-9c84-799c5c335b5a,次韵酬张郎中赋水蕉四首  其一,张镃,唐,诗,七言绝句,春去论年卒未回 溪头传信却先来 绿牋展尽全无字 此语何堪谕俗埃,"7,7,7,7",5c9f19bc0f4f28f491e5010987e8c201,春去 论 年 卒 未 回 溪头 传信 却先 来 绿 牋 展 尽 全 无 字 此 语 何堪 谕俗 埃
3d8cb2a3-d78b-43a1-bc5a-29c49f76e82c,次韵酬张郎中赋水蕉四首  其二,张镃,唐,诗,七言绝句,火云空际正巑岏 漫瞰平湖百亩宽 叶叶是风根是雪 一窗因尔忽生寒,"7,7,7,7",db9f4fc00f2f1239e70ade6096908120,火云 空际 正 巑 岏 漫瞰 平湖 百亩 宽 叶叶 是 风根 是 雪 一 窗 因 尔忽生 寒
1447d40d-2a8a-43ff-9c25-cea084e51f93,次韵酬张郎中赋水蕉四首  其三,张镃,唐,诗,七言绝句,诗卷寻常要往回 今朝却怕此诗来 只缘快读清凉语 返觉林居有世埃,"7,7,7,7",0200a92ecead5857b70ed63e2bb64314,诗卷 寻常 要 往回 今朝 却 怕 此 诗 来 只 缘 快 读 清凉 语 返觉 林 居有 世埃
579bc7f9-a15f-40fe-b33f-a99870919838,次韵酬张郎中赋水蕉四首  其四,张镃,唐,诗,七言绝句,往年植处倚苍岏 曾蔽秋苔两席宽 别后不因贪水宿 儿孙那得许萧寒,"7,7,7,7",27079b880611617cec44f7c4a042feae,往年 植处 倚 苍 岏 曾蔽秋 苔 两席 宽 别后 不 因 贪水宿 儿孙 那 得许 萧寒
9b42cf45-e3fe-49ea-aaf6-aa665d4002c2,骑鲸桥,张镃,唐,诗,七言绝句,池港开门就作桥 朱栏相望压鲸腰 风摇慢折游溶绿 波底何妨著霁霄,"7,7,7,7",d83c38639dff98477437a8b08b0db32a,池港 开门 就 作 桥 朱栏 相望 压鲸 腰 风 摇慢 折游 溶绿 波底 何妨 著 霁 霄
bce28757-3185-482a-bf64-f081cf6a14af,鸥渚偶成二首  其一,张镃,唐,诗,七言绝句,昼阴无意到湖亭 引客悠然试一行 便有同盟数公在 冒烟挥袂喜相迎,"7,7,7,7",02fad46bd50ae3f3b5356fd4e902d99a,昼阴 无意 到 湖 亭 引客 悠然 试 一行 便 有 同盟 数公 在 冒烟 挥 袂 喜 相迎
438e5955-85d2-4676-87e6-fdf01c3651b9,鸥渚偶成二首  其二,张镃,唐,诗,七言绝句,去去西南绿筿湾 折旋遵渚又飞还 轻拳击水纤鳞起 滴沥波明一带间,"7,7,7,7",121e3f65f4bf4ee597a07002be9e63de,去 去 西南 绿 筿 湾 折旋 遵渚 又 飞 还 轻 拳击 水纤 鳞 起 滴沥 波明 一带 间
67039f73-1f67-475f-96c5-6b40dc48ac54,从张子立觅馿二绝  其一,张镃,唐,诗,七言绝句,寒馿休爱鸽毛青 指日骅骝辇路行 听水听松方属我 灞桥风雪可寒盟,"7,7,7,7",b016c0ccda4d6cd2c93bddaa9efba112,寒 馿 休 爱 鸽 毛 青 指 日 骅骝 辇 路 行 听 水 听 松方 属 我 灞桥 风雪 可 寒盟
89b52f0d-8a3d-4184-aeb9-21ce49404586,从张子立觅馿二绝  其二,张镃,唐,诗,七言绝句,几回曾许借侬骑 兴到牵来已早迟 乞与南湖了幽事 白裘乌帽要相宜,"7,7,7,7",4606c8f4f30b5e06d15c6bc452d4e25d,几回 曾许 借 侬 骑 兴到 牵来 已早 迟 乞与 南湖 了 幽事 白裘 乌 帽 要 相宜
50fde93a-089c-4db2-9ad6-ba80259bbd2b,燕坐  其一,张镃,唐,诗,七言绝句,瓮面水明红菡萏 草头风战黑蜻蜓 平生最爱游侠传 燕坐且读离骚经,"7,7,7,7",7b2d4450360ef8e21d2244542561b700,瓮面水明红 菡萏 草头 风战 黑 蜻蜓 平生 最 爱 游侠 传 燕 坐 且 读 离骚 经
36830379-1bc0-4871-b46b-b5ea5ba997f1,燕坐  其二,张镃,唐,诗,七言绝句,为君刻意五七字 甫壮知心一两人 百计纵疎终办此 直疑贾孟是前身,"7,7,7,7",ff58c2be0df41c388758c20ad8416783,为 君 刻意 五七 字 甫 壮 知心 一两 人 百计 纵 疎 终 办 此 直疑 贾孟 是 前身
6ab3c069-5cc6-42ca-8c47-6cdd2ce2518b,夜赋,张镃,唐,诗,七言绝句,月黑林间亦自奇 莲花两朵白如衣 初疑野鹭池中立 试拍栏干吓不飞,"7,7,7,7",3c600d62f5e9da6430a3e9b08a4876a7,月 黑 林间 亦 自奇 莲花 两朵 白如衣 初疑 野 鹭池 中立 试拍 栏干 吓 不 飞
cacf3ffc-697f-461a-890c-bc4a73a72064,题画扇,张镃,唐,诗,七言绝句,谁将琢月挥云笔 偃仰江山尺素中 眼界未舒君莫厌 出门三丈软尘红,"7,7,7,7",dca7d64351c00e243155c19e98131b8e,谁 将 琢 月挥云 笔 偃仰 江山 尺素 中 眼界 未 舒君 莫厌 出门 三丈 软尘 红
5d1b7415-1f76-4a40-a995-501d7f8e9d1f,春日泛舟南湖因遍游近港坐间书客所携四扇  其一,张镃,唐,诗,七言绝句,远近高低锦树明 直疑春教蝶多情 人间万事思量尽 只好园居过此生,"7,7,7,7",6275e2367a3814fdefbf590109073571,远近 高低 锦树 明 直疑 春教蝶 多情 人间 万事 思量 尽 只好 园 居 过 此生
4b429e42-2b4c-47d4-9b63-2a94d7ef5b9e,春日泛舟南湖因遍游近港坐间书客所携四扇  其二,张镃,唐,诗,七言绝句,丝簧同上木兰船 细草熏熏柳色天 要是有诗方称此 不然枉作地行仙,"7,7,7,7",ceefd2590fd15b8a7230c8f8dd9e2424,丝簧 同上 木兰 船 细草 熏熏 柳色 天 要是 有 诗方 称 此 不然 枉 作地 行仙
b9191b20-f6d4-4f8f-a428-be9f4fe0217e,春日泛舟南湖因遍游近港坐间书客所携四扇  其三,张镃,唐,诗,七言绝句,先须放櫂绕湖游 倒看行云水底浮 客去莫归朝市说 引渠无意作公侯,"7,7,7,7",768fc3b65b60e61ef67ec03aa3f9ed71,先须 放 櫂 绕 湖 游 倒 看 行云 水底 浮 客 去 莫 归 朝市 说 引渠 无意 作 公侯
0f7918fe-94cc-4e95-b838-a57a881dd8b4,春日泛舟南湖因遍游近港坐间书客所携四扇  其四,张镃,唐,诗,七言绝句,赏玩归来日未斜 门前春水绿杨遮 园亭西畔晴尤好 一色墙头见杏花,"7,7,7,7",cffb8baefc7445d0217823017fec478d,赏玩 归来 日 未 斜 门前 春水 绿 杨 遮 园亭 西畔晴 尤好 一色 墙头 见 杏花
a2d3a3ac-a279-4021-b7bc-c74bdaa477a9,题扇,张镃,唐,诗,七言绝句,梧竹风来玉枕凉 月高偏爱占华堂 休言境界亲曾有 画出如闻夜气香,"7,7,7,7",2165c278868a80867d3ea3b3b60b3705,梧竹 风 来 玉枕凉 月 高 偏爱 占华堂 休言 境界 亲曾 有 画 出如闻夜气香
e65390de-3b79-4ecc-8772-4c02f93987d4,次韵徐衡仲饷淮白鱼,张镃,唐,诗,杂言,漫浪功名付直钩 谁能鏖战学焚舟 随人不但羹鱼美 解道江 揺扌 虫 似鹿头,"7,7,7,3,2,1,3",356f5a48093028185322e1ed2cdc6ee2,漫浪 功名 付 直钩 谁 能 鏖战 学 焚舟 随 人 不但 羹 鱼 美 解道 江 揺 扌 虫 似 鹿 头
6eb94f8d-cbfc-458d-8b0d-fdd65b88f918,戏倣韩致光体,张镃,唐,诗,七言绝句,意懒风前侧帽簷 落梅红在麦修纤 归家说尽单行处 可奈温香翡翠奁,"7,7,7,7",51f8fa59ae222652559d94740e33d641,意懒 风 前侧 帽簷 落 梅红 在 麦修 纤 归家说 尽 单行 处 可奈 温香 翡翠 奁
75c4f364-db68-4399-ab62-27e48c97d2d0,桥亭观月,张镃,唐,诗,七言绝句,全似苍崖涌月轮 暗林横贯一溪明 家中幻出山中景 圮上追凉恰二更,"7,7,7,7",9189ab3062d39577b5a63b7224d8623e,全似苍崖涌 月 轮 暗林 横贯 一 溪 明 家中 幻出 山中 景 圮 上 追凉 恰 二 更
c3aaf2f3-93c5-48f0-b05d-8959817b708c,方壶,张镃,唐,诗,七言绝句,春在壶中晚更长 众仙相命醉霓觞 戏将龙脑真珠网 搭上周回碧玉廊,"7,7,7,7",59a09c66a006090a8919077138aae93b,春在 壶 中晚 更 长 众仙 相命 醉 霓觞 戏 将 龙脑 真珠 网 搭 上周 回 碧玉 廊
6c228723-38e3-42c7-9d7a-d2c4b1aa0964,白头翁鸟,张镃,唐,诗,七言绝句,桧丛丛啭惬新晴 巧好春林百鸟声 羽辈误教推皓首 细听多是少年情,"7,7,7,7",1343df5346758c55e90e7ca4f8dff246,桧 丛 丛 啭 惬新 晴 巧好 春林 百鸟 声 羽辈 误教 推 皓首 细 听 多 是 少年 情
9accc96e-53eb-462a-a71e-88fe91cab073,暂往嘉兴离桂隠过渡,张镃,唐,诗,七言绝句,侧望山来起复平 横冲波去碧还明 谁言身在笋舆上 自是乘风空里行,"7,7,7,7",59920884c85ade655888ed4f1e78bd9b,侧望 山 来 起复 平 横冲 波 去 碧 还 明 谁 言 身 在 笋舆 上 自 是 乘风 空里 行
2e74999f-e626-4c53-9cc3-6e4c8c052d8a,暂归桂隠杂书四首  其一,张镃,唐,诗,七言绝句,风院帘垂飐翠旌 茂阴疎转表新晴 清和自是常年景 有底今番触拨人,"7,7,7,7",aba9e6306003ae844ff15f2080432eec,风院 帘 垂 飐翠旌 茂 阴 疎 转 表 新 晴 清 和 自是 常年 景 有 底 今番 触拨 人
13893fc5-9d7f-426f-9ec9-e6f4acde6692,暂归桂隠杂书四首  其二,张镃,唐,诗,七言绝句,作双㶉𫛶住方池 乐此荷钱近钓矶 应笑主翁尘袂黑 故从清泚浣红衣,"7,7,7,7",3db28cdc87c5bcd2b343eccd317ac160,作 双 㶉 𫛶 住 方池 乐 此 荷 钱 近 钓矶 应笑 主翁 尘 袂 黑 故 从 清 泚 浣 红衣
60a548b6-19ce-42bd-82db-193ca1feb431,暂归桂隠杂书四首  其三,张镃,唐,诗,七言绝句,诗料无穷满目前 只须拈出见成篇 骑兵莫道随官俗 也解争奴曲涧船,"7,7,7,7",59cf8ab20b263874c67b3da12b6e6253,诗料 无穷 满 目前 只须 拈 出见 成篇 骑兵 莫道 随 官俗 也 解争 奴曲 涧 船
9797abb6-d74b-4f96-8b4e-842365a37850,暂归桂隠杂书四首  其四,张镃,唐,诗,七言绝句,茅屋烟升正早炊 覆墙高柳涨新枝 飞绵莫便沾泥去 旧爱疎篱雪下时,"7,7,7,7",c309f0ac282f2a42b7d6c601a16f4eb8,茅屋 烟 升 正 早 炊 覆墙 高 柳 涨 新枝 飞绵 莫 便 沾泥 去 旧爱疎篱 雪 下 时
55c52098-e660-4c1d-9878-8656477c8384,嘲蝶,张镃,唐,诗,七言绝句,柳外飞飞蛱蝶儿 惠风心性彩云姿 终朝守定墙头舞 不得邻家一句诗,"7,7,7,7",a16d693af5d1d1333553bf54d75b96ce,柳外飞 飞 蛱蝶 儿 惠风 心性 彩云 姿 终朝 守定 墙头 舞 不得 邻家 一句 诗
1342c618-cbf8-4f69-ab6e-fc0f9935e38a,至华藏寺先呈琏长老,张镃,唐,诗,七言绝句,切莫撞钟领众迎 作家相见要情真 亦庵自是优婆塞 知事当人定不瞑,"7,7,7,7",c692c8204be6b2366286ac709742d90e,切莫 撞钟 领众 迎 作家 相见 要 情真 亦庵 自是 优婆 塞 知事 当 人定 不瞑
65673da4-4c24-4f54-aed5-9346d48f48ef,荠花,张镃,唐,诗,七言绝句,荠花繁处蝶争飞 忽忆前年三月时 流水流杯人共醉 晚来疎雨又新诗,"7,7,7,7",0ea96fb66d6d84a52ec7c37945719d95,荠花 繁处 蝶争 飞 忽忆 前年 三月 时 流 水流 杯人 共 醉 晚 来 疎 雨 又 新诗
bade01be-7c14-488d-96d8-ebdbdead3be5,题左顾亭,张镃,唐,诗,七言绝句,物我何曾有异同 莫言龟印偶相逢 水中放去炉中得 心法须知一镜空,"7,7,7,7",68a2e84b24131bc792c51feab04d0bc5,物 我 何曾 有 异同 莫言 龟 印偶 相逢 水中 放去 炉 中 得 心法 须知 一 镜空
29a57fca-a79a-466b-aa5f-9c4a9f93504a,安溪道中,张镃,唐,诗,七言绝句,染晴波色重于蓝 烟坞人家屋两三 明月在山天在水 后回休睡泊溪南,"7,7,7,7",490f66f645c3031043d817c3b590b11a,染 晴波色 重于 蓝 烟坞 人家 屋 两三 明月 在 山天 在 水 后 回休 睡泊 溪南
01314d8e-8838-4e23-a9ef-f7decd6f6a09,七夕口占,张镃,唐,诗,七言绝句,凉生金井未飘桐 月户星楼记古风 乞巧频年但成拙 懒将祈请效儿童,"7,7,7,7",966c4e8f0db32862628205194bd3c7bc,凉生 金井 未 飘 桐 月 户星 楼记 古风 乞巧 频年 但 成拙 懒 将 祈请 效 儿童
1f4436f2-443b-45d5-b5fb-97d60fc30df1,七夕池上泛舟四首  其一,张镃,唐,诗,七言绝句,居士乘闲养就痴 争如灵鹊自知时 不从楼上求新巧 却向船中赋拙诗,"7,7,7,7",0a2dd5b261ee9d88ab9eb48eabbdb194,居士 乘 闲养 就 痴 争如 灵鹊 自知 时 不 从 楼上 求新 巧 却 向 船中 赋 拙 诗
439aea52-a8df-4ac7-8564-1ec0f32a1567,七夕池上泛舟四首  其二,张镃,唐,诗,七言绝句,秋入冯夷碧殿凉 仙游十万不分行 锦蜺香满烟蒙繖 翠凤光浮露涤裳,"7,7,7,7",1aa93647e07229982781c4ce3ecfb629,秋入 冯夷碧殿 凉 仙游 十万 不 分行 锦 蜺 香 满 烟 蒙 繖 翠凤光 浮露 涤裳
6873d590-b483-4c4d-a470-86f3167a124b,七夕池上泛舟四首  其三,张镃,唐,诗,七言绝句,柳系荃桡句未成 拨船微动碧香迎 琉璃自爱无瑕翳 不放池西一叶生,"7,7,7,7",30ac1c158cecbd998272cde4e07f9503,柳系荃 桡句 未成 拨 船 微动 碧香迎 琉璃 自爱 无瑕 翳 不放 池西 一叶 生
70efa01c-2a24-4e1e-ab65-0ccc252010e2,七夕池上泛舟四首  其四,张镃,唐,诗,七言绝句,夜雨连明旋出奇 涨平荷盖失参差 更教红莟肩齐水 要学湘妃晓浴时,"7,7,7,7",1c814fc2b65191e7eeebcf99b32a10c3,夜雨 连明旋 出奇 涨平 荷盖失 参差 更 教 红 莟 肩 齐 水 要学 湘妃 晓浴 时
edcaea8c-dc34-477e-9bd8-4570c6765fea,龙瑞宫,张镃,唐,诗,七言绝句,阳明古罅閟灵宫 祷雨传闻见活龙 可是高人不留我 却从归路数杉松,"7,7,7,7",33f3d82073df7f005cf29d16a12e78a0,阳明 古 罅閟 灵 宫 祷 雨 传闻 见 活 龙 可是 高 人 不留 我 却 从 归路 数杉 松
b1a43f99-8eca-482a-85cc-bb957fe34ca9,秋清,张镃,唐,诗,七言绝句,更阑何事识秋清 历历江湖兴致新 犬吠数声风外𫇛 隔城同是未眠人,"7,7,7,7",f12d8bf70c192405a3a8c3b3ca085e30,更阑 何事 识 秋清 历历 江湖 兴致 新 犬吠 数声 风 外 𫇛 隔城 同是 未眠 人
2cdeabe0-19ba-45f9-902d-6a7fed2405ea,桥廊上作  其一,张镃,唐,诗,七言绝句,夜半沾衣露气浓 茂林迥岸月髼松 无人不道长安住 却似乱山烟翠中,"7,7,7,7",7a7bcb276c332025b0e8b7ee6ff15a1d,夜半 沾衣 露气 浓 茂林 迥 岸 月 髼 松 无人 不道 长安 住 却 似乱 山 烟 翠 中
1f501ed8-56f4-49e5-a6e5-ecefb29e4e07,桥廊上作  其二,张镃,唐,诗,七言绝句,千载清风笠泽仙 提携曾置笔床边 吾行不汲长桥水 要煮青山陆羽泉,"7,7,7,7",341abaa650b2b55aa831d1f58a933501,千载 清风 笠 泽 仙 提携 曾 置 笔 床边 吾 行 不 汲 长桥 水 要 煮 青山 陆羽 泉
9c7d5589-4f1f-4481-80e6-f3b1c9c0e129,煎白云茶二首  其一,张镃,唐,诗,七言绝句,水西幽寺风光足 山上行云雪色明 不放精英入闲草 夜铛嘉话得松声,"7,7,7,7",2810b7befd9e50a09035c7a76fd3b400,水西 幽寺 风光 足 山上 行云 雪色明 不 放 精英 入 闲草 夜铛 嘉 话 得 松 声
2b725560-8ca1-4c61-9351-4d10b4c49117,煎白云茶二首  其二,张镃,唐,诗,七言绝句,嫩芽初见绿蒙茸 已破人间睡思浓 玉食会当陪上苑 贵名高冠密云笼,"7,7,7,7",ebe0e713b860d151e50f87e655d80ca4,嫩芽 初见 绿蒙茸 已 破 人间 睡思 浓 玉食 会 当 陪 上苑 贵名 高冠 密云 笼
b7d907c6-1978-4ffd-98d3-122cd11773d5,得巨笋三尺围送王叔兴,张镃,唐,诗,七言绝句,猫头名字出长沙 别号犀株岂过夸 好对竹尊招二子 藕如船大枣如瓜,"7,7,7,7",d89da82fa79877c271eea9ec3a403a36,猫头 名字 出 长沙 别号 犀株 岂 过 夸 好 对 竹 尊 招二子 藕 如 船 大枣 如 瓜
c23f1c62-0f88-44ba-92d7-b51478e65490,得巨鱼送叔祖,张镃,唐,诗,七言绝句,桃花流水正关渠 雨后俄收紫鲙鱼 岂是斋厨真欠此 小诗聊当腹中书,"7,7,7,7",097028a7b91a2ba0cc8c55c052ab5ce2,桃花流水 正关 渠 雨后 俄 收 紫 鲙 鱼 岂 是 斋 厨 真 欠 此 小 诗 聊 当 腹中 书
77b8c4d5-1e02-4b89-8906-ec6574bbd1f9,舟行观新月,张镃,唐,诗,七言绝句,一痕如掐夕天涯 望转青林出没时 不是山高爱藏月 月光犹嫩怯人窥,"7,7,7,7",7fc0dcec94be18fb0626d6bb5bd5a5a7,一痕如掐夕 天涯 望转 青林 出没 时 不是 山高爱藏 月 月光 犹嫩 怯 人 窥
7e88bbab-bdf8-4e68-9af5-e92e61d9d104,苏隄观木芙蓉因见浄慈明上人翌日惠诗酬赠二绝  其一,张镃,唐,诗,七言绝句,来访秋花本为诗 酒杯征逐负幽期 山中圣出明书记 还了清游一段奇,"7,7,7,7",b4b711684cd900876723d242cfea974b,来访 秋 花本 为 诗 酒杯 征逐 负 幽期 山中 圣 出明 书记 还 了 清游 一段 奇
380d8568-765d-4a9b-8ff9-f4ba8f5789e2,苏隄观木芙蓉因见浄慈明上人翌日惠诗酬赠二绝  其二,张镃,唐,诗,七言绝句,口边白醭公家事 坐上清狂我辈真 会乞一闲归故隠 定因能赋结高人,"7,7,7,7",c1a21aa8d7c0942501461c3718ad978c,口边 白 醭 公家 事 坐上 清狂 我辈 真 会乞 一 闲 归 故 隠 定因 能 赋结 高人
413af394-1886-431b-bc49-7e655495ed87,池上木芙蓉欲开述兴二首  其一,张镃,唐,诗,七言绝句,芙蓉环望压波明 燕尾舟从绿处撑 待得花成红沓堕 老夫天地锦纵横,"7,7,7,7",0782035dfb25910e44f4979523ddd614,芙蓉 环望 压波 明 燕尾 舟 从 绿 处撑 待 得 花成红沓堕 老夫 天地 锦 纵横
1a7b0e47-6904-46b6-acab-8d40e6589404,池上木芙蓉欲开述兴二首  其二,张镃,唐,诗,七言绝句,岸巾三酌便酣眠 堕地鸾牋写未全 明月满城人定说 若无诗累是神仙,"7,7,7,7",f8afff789ab9e073ccbbe7fd45b98885,岸 巾三酌 便 酣眠 堕地 鸾 牋 写 未 全 明月 满城 人定 说 若 无 诗 累 是 神仙
cc6c7cd6-4086-4280-9207-05ae5aa76220,题羔羊斋外木芙蓉,张镃,唐,诗,七言绝句,慵粧酣酒夕阳浓 洗尽霜根看绮丛 绿地团花红锦障 不知庭院有西风,"7,7,7,7",13f03f211e2fe399320f1795928ec2be,慵 粧 酣 酒 夕阳 浓 洗尽霜 根 看 绮丛 绿地 团花 红 锦障 不知 庭院 有 西风
449ba87c-3e80-46d6-b379-cb672566841a,窗前木芙蓉,张镃,唐,诗,七言绝句,辛苦孤花破小寒 花心应似客心酸 更凭青女留连得 未作愁红怨绿看,"7,7,7,7",4449bfdcdf018af3f6e70261651bc55e,辛苦 孤花破 小寒 花心 应似 客 心酸 更 凭 青女 留连 得 未 作 愁红怨绿 看
2b75663b-fea3-45b8-a51b-de6ce272197a,山堂,张镃,唐,诗,七言绝句,芒鞋疎到笋篱东 惯得苍苔把径封 已愧君诗足真味 尚将鸡肋较驼峰,"7,7,7,7",094529daf62a2b015f92be469bb0c046,芒 鞋 疎 到 笋篱 东 惯得 苍苔 把 径 封 已愧 君 诗 足 真味 尚将 鸡肋 较 驼峰
617c91f7-fbb1-44ee-82f4-73f4c94c66b1,王倅德远有诗谢送菊因酬二绝  其一,张镃,唐,诗,七言绝句,晚香烟冷万金篱 林下何曾必课诗 如许簿书花一到 便成琼报碧云词,"7,7,7,7",fa3a6db679d63b92990c54e8be652a0b,晚 香烟 冷 万金 篱 林下 何曾 必课 诗 如许 簿书花 一 到 便成 琼报 碧云 词
785b901e-98af-4240-8197-5ae252c3438f,王倅德远有诗谢送菊因酬二绝  其二,张镃,唐,诗,七言绝句,爱竹君家有子猷 黄花君复向人求 不妨官事兼幽事 应笑侬归两过秋,"7,7,7,7",d771032a90b430387e03f09e6abad28e,爱 竹君 家 有 子猷 黄花 君 复向 人求 不妨 官事 兼 幽事 应 笑 侬 归 两 过秋
4e9800e4-a23c-4c87-808d-d40d95902510,九日,张镃,唐,诗,七言绝句,重阳冷菊青黄蕊 半醉幽人黑白头 今岁有番堪恨处 病无诗句过中秋,"7,7,7,7",092b1465f8a56ccb62aeb5df01972a03,重阳 冷菊青 黄蕊 半 醉 幽人 黑白 头 今岁 有 番 堪恨 处 病 无 诗句 过 中秋
8d5371ed-9582-4dd0-b02e-67b89aba6f61,丽秋花,张镃,唐,诗,七言绝句,疎翠巧装丹凤尾 素绡轻纽玉虫须 春花莫把秋丛薄 若比娇妍总合输,"7,7,7,7",8723617e57f2606bc935bcb1b2a2366b,疎 翠 巧 装 丹 凤尾 素绡 轻纽 玉虫 须 春花 莫 把 秋丛 薄 若比娇 妍 总合 输
