id,title,author,dynasty,genre,poem_type,sentences_simplified,meter_pattern,hash,words
6e958390-3dd2-4373-ab95-99622c7481a6,謝人寄新詩集,齊己,唐,诗,七言律诗,所闻新事即戈矛 欲去终疑是暗投 远客寄言还有在 此门将谓总无休 千篇著述诚难得 一字知音不易求 时入思量向何处 月圆孤凭水边楼,"7,7,7,7,7,7,7,7",f62752191f99cd8a3039c18ed945c82e,所闻 新 事 即 戈矛 欲 去 终疑 是 暗 投 远客 寄言 还有 在 此 门将 谓 总 无休 千篇 著述 诚 难得 一 字 知音 不易 求 时入 思量 向 何处 月 圆 孤 凭 水边 楼
6423f9d6-9d28-4564-bb87-b32d57f06a78,謝元願上人遠寄檀溪集,齊己,唐,诗,七言律诗,白首萧条居汉浦 清吟编集号檀溪 有人收拾应如玉 无主知音只似泥 入理半同黄叶句 遣怀多拟碧云题 犹能为我相思在 千里封来梦泽西,"7,7,7,7,7,7,7,7",f799338050890ae3ba18ba6e11ccfe24,白首 萧条 居汉浦 清吟 编集 号 檀溪 有人 收拾 应 如玉 无 主 知音 只似 泥 入理 半 同 黄叶 句 遣怀 多 拟 碧云 题 犹能 为 我 相思 在 千里 封来 梦 泽西
80f879b3-0b18-43af-94ca-c774e89e9480,寄道林寺諸友,齊己,唐,诗,七言律诗,吟兴终依异境长 旧游时入静思量 江声里过东西寺 树影中行上下方 春色湿僧巾屦腻 松花沾鹤骨毛香 老来何计重归去 千里重湖浪渺茫,"7,7,7,7,7,7,7,7",e5fa5c29784dec3d4eb939621d7d2b2c,吟 兴终 依异 境长 旧游 时 入静 思量 江声 里 过 东西 寺 树影 中行 上 下方 春色 湿 僧 巾 屦 腻 松花 沾鹤骨 毛香 老 来 何 计重 归去 千里 重湖 浪 渺茫
ac535cf7-3d3c-4a8b-88cc-10860986b0a6,贈智滿三藏,齊己,唐,诗,七言律诗,灌顶清凉一滴通 大毗卢藏遍虚空 欲飞薝卜花无尽 须待陀罗尼有功 金杵力摧魔界黑 水精光透夜灯红 可堪东献明天子 命服新酬赞国风,"7,7,7,7,7,7,7,7",79f746a4280d9c5010d489b7b151e660,灌顶 清凉 一滴 通 大 毗卢 藏 遍 虚空 欲 飞 薝 卜 花 无尽 须 待 陀罗尼 有功 金杵力 摧 魔界 黑 水 精光 透夜 灯红 可堪 东献 明天 子 命服 新酬 赞 国风
70b0dd8f-3815-40ea-9d7b-0e0c1b22d8a1,謝王先輩湘中迴惠示卷軸,齊己,唐,诗,七言律诗,少小即怀风雅情 独能遗象琢淳精 不教霜雪侵玄鬓 便向云霄换好名 携去湘江闻鼓瑟 袖来缑岭伴吹笙 多君百首贻衰飒 留把吟行访竺卿,"7,7,7,7,7,7,7,7",73dbf20aaa20e1e3c7eda0359b797a2d,少 小 即 怀 风雅 情 独能 遗象 琢 淳精 不 教 霜雪 侵 玄鬓 便 向 云霄 换 好 名 携去 湘江 闻 鼓瑟 袖 来 缑 岭 伴 吹笙 多 君 百首 贻 衰飒 留 把 吟行 访 竺卿
3cf7c137-d5b8-48e1-812e-0ea9b056ac71,荆渚寄懷西蜀無染大師兄,齊己,唐,诗,七言律诗,大沩心付白崖前 宝月分辉照蜀天 圣主降情延北内 诸侯稽首问南禅 清秋不动骊龙海 红日无私罔象川 欲听吾宗旧山说 地边身老楚江边,"7,7,7,7,7,7,7,7",0232abc3a5c37e25102457e239971e53,大 沩 心 付白 崖 前 宝月分 辉 照 蜀 天 圣主 降情 延北 内 诸侯 稽首 问南禅 清秋 不动 骊 龙海 红日 无私 罔 象 川 欲 听 吾 宗 旧 山 说 地边 身 老楚 江边
94cb5b04-e3f9-4cb2-849e-8b7657796deb,謝武陵徐巡官遠寄五七字詩集,齊己,唐,诗,七言律诗,五字才将七字争 为君聊敢试悬衡 鼎湖菡萏摇金影 蓬岛鸾皇舞翠声 还是灵龟巢得稳 要须仙子驾方行 两边珍重遥相惠 何夕灯前尽此情,"7,7,7,7,7,7,7,7",f4ff0c7e68061b29cf6d125315287324,五 字 才 将 七 字争 为 君 聊 敢试 悬衡 鼎湖 菡萏 摇金 影 蓬岛 鸾 皇舞 翠声 还是 灵龟巢 得 稳 要 须 仙子 驾方 行 两边 珍重 遥相 惠 何夕 灯 前 尽 此情
a91bf2b0-6ba5-4c88-8433-ff456d70a128,重宿舊房與愚上人靜話,齊己,唐,诗,七言律诗,曾此栖心过十冬 今来潇洒属生公 檀栾旧植青添翠 菡萏新栽白换红 北面城临灯影合 西隣壁近讲声通 不知门下趋筵士 何似当时石解空,"7,7,7,7,7,7,7,7",b7405e48a1f6db50ffc551e4ca130140,曾此 栖心 过 十冬 今来 潇洒 属生 公 檀 栾 旧 植青 添 翠 菡萏 新 栽白换红 北面 城临 灯影 合 西 隣 壁 近 讲 声 通 不知 门下 趋 筵士 何 似 当时 石 解空
69ccd68e-76b6-4472-a228-7fac8116d0a0,謝南平王賜山雞,齊己,唐,诗,七言律诗,五色文章类彩鸾 楚人罗得半摧残 金笼莫恨伤冠帻 玉粒颁慙剪羽翰 孤立影危丹槛里 双栖伴在白云端 上台爱育通幽细 却放溪山去不难,"7,7,7,7,7,7,7,7",0d8fc86c20abb6c26536a78117466263,五色 文章 类彩 鸾 楚人罗得半 摧残 金笼 莫 恨 伤 冠 帻 玉粒 颁 慙 剪 羽 翰 孤立 影危 丹槛 里 双栖 伴在 白云 端 上台 爱育 通幽 细 却 放 溪 山 去 不难
e45df110-8ab8-4e43-b5bb-d8ef0ac82b63,荆門病中雨後書懷寄幕中知己,齊己,唐,诗,七言律诗,病根翻作忆山劳 一雨聊堪浣郁陶 心白未能忘水月 眼青独得见秋毫 蝉声晚簇枝枝急 云影晴分片片高 还忆赤松兄弟否 别来应见鹤衣毛,"7,7,7,7,7,7,7,7",21d8f43bf9ddb198d9aa4f842fa2a23e,病根 翻作 忆山劳 一雨聊堪 浣 郁陶 心白 未能 忘水 月 眼青 独得 见 秋毫 蝉声 晚 簇 枝枝急 云影 晴分 片片 高 还忆 赤松 兄弟 否 别 来 应见 鹤 衣毛
759ee047-917a-4a49-affd-383fee929dd2,宿江寺,齊己,唐,诗,七言律诗,岛僧留宿慰衰颜 旧住何妨老未还 身共锡声离鸟外 迹同云影过人间 曾无梦入朝天路 忆有诗题隔海山 珍重来晨渡江去 九华青里扣松关,"7,7,7,7,7,7,7,7",25f3efc6e1aa1a3c4f05146af84b9216,岛 僧 留宿 慰 衰颜 旧 住 何妨 老 未 还 身 共 锡 声 离 鸟 外 迹同 云影 过 人间 曾 无梦入朝天路 忆 有 诗题 隔 海山 珍重 来晨 渡江 去 九华 青里 扣松 关
698fd1d7-bd94-4db8-a131-fca4bd77ef7b,謝貫微上人寄示古風今體四軸,齊己,唐,诗,七言律诗,四轴骚词书八行 捧吟肌骨遍清凉 谩求龙树能医眼 休问图澄学洗肠 今体尽搜初剖判 古风淳凿未玄黄 不知谁肯降文阵 暗点旌旗敌子房,"7,7,7,7,7,7,7,7",bcabc1c92b7b92e00a416b7baa599570,四 轴 骚 词 书 八行 捧吟 肌骨 遍 清凉 谩求 龙树 能 医眼 休 问图 澄学 洗肠 今 体 尽 搜 初 剖判 古风 淳 凿 未 玄 黄 不知 谁肯 降文 阵 暗点 旌旗 敌 子房
ef913822-6acf-4bb9-993c-4ebcdf3ce131,荆州貫休大師舊房,齊己,唐,诗,七言律诗,疎篁抽笋柳垂阴 旧是休公种境吟 入贡文儒来请益 出官卿相驻过寻 右军书画神传髓 康乐文章梦授心 销得青城千嶂下 白莲标塔帝恩深,"7,7,7,7,7,7,7,7",f48dc86244061f5b0bf8d50b6a0bee77,疎 篁 抽 笋 柳 垂 阴 旧 是 休 公种 境 吟 入贡 文儒 来 请益 出官 卿相 驻过 寻 右 军 书画 神传髓 康乐 文章 梦授 心 销得 青城 千嶂 下 白莲 标塔 帝恩深
cdb5e910-b2dd-472d-a292-3fd991281be0,寄谷山長老,齊己,唐,诗,七言律诗,游遍名山祖遍寻 却来尘世浑光阴 肯将的的吾师意 拟付茫茫弟子心 岂有虚空遮道眼 不妨文字问知音 沧浪万顷三更月 天上何如水底深,"7,7,7,7,7,7,7,7",7750416893ea22ca1c508905df695e1b,游遍 名山 祖 遍寻 却 来 尘世 浑 光阴 肯 将 的的 吾师 意 拟付 茫茫 弟子 心 岂 有 虚空 遮道 眼 不妨 文字 问 知音 沧浪 万顷 三 更 月 天上 何如 水底 深
03f9784e-5572-4bd5-a336-edd81a34b189,寄黃暉處士,齊己,唐,诗,七言律诗,蒙氏艺传黄氏子 独闻相继得名高 锋铓妙夺金鸡距 纤利精分玉兔毫 濡染只应亲赋咏 风流不称近方刀 何妨寄我临池兴 忍使江淹役梦劳,"7,7,7,7,7,7,7,7",a7c7a9ae2e015bde655bdd523ff758d1,蒙氏艺 传 黄氏子 独闻 相继 得名 高 锋 铓 妙 夺 金鸡 距 纤利 精分 玉 兔毫 濡染 只 应 亲 赋咏 风流 不 称近 方刀 何妨 寄 我 临池 兴 忍使 江淹 役 梦 劳
f52e91b4-136a-419b-929c-3a768939524b,荆門勉懷寄道林寺諸友,齊己,唐,诗,七言律诗,荣枯得失理昭然 谁𢽾离骚更问天 生下便知真梦幻 老来何必叹流年 清风不变诗应在 明月无踪道可传 珍重匡庐沃洲主 拂衣抛却好林泉,"7,7,7,7,7,7,7,7",c3b70acb63a2b65821e0b54010d01eb8,荣枯 得失 理 昭然 谁 𢽾 离骚 更 问 天 生下 便 知真 梦幻 老 来 何必 叹 流 年 清风 不变 诗应 在 明月 无踪 道 可传 珍重 匡庐 沃洲 主 拂衣 抛却 好林泉
1fa14626-2576-4120-be7f-9b7a44b71295,荅崔校書,齊己,唐,诗,七言律诗,雪色衫衣绝点尘 明知富贵是浮云 不随喧滑迷真性 何用潺湲洗汚闻 北阙会抛红𫘟騀 东林社忆白氛氲 清吟有兴频相示 欲得多慙蠹蚀文,"7,7,7,7,7,7,7,7",3470948ba3dfc4b72f7fcb34f879025a,雪色 衫衣 绝点 尘 明知 富贵 是 浮云 不随 喧滑 迷 真性 何用 潺湲 洗 汚 闻 北阙 会 抛 红 𫘟 騀 东林 社忆 白氛 氲 清吟 有 兴频 相示 欲得多慙蠹 蚀 文
8a7c74d4-ccf3-44ea-8c23-5caadc174805,乞櫻桃,齊己,唐,诗,七言律诗,去年曾赋此花诗 几听南园烂熟时 嚼破红香堪换骨 摘残丹颗欲烧枝 流莺偷啄心应醉 行客潜窥眼亦痴 闻说张筵就珠树 任从攀折半离披,"7,7,7,7,7,7,7,7",069ed76d38aee723f64806cfe7a8c713,去年 曾 赋 此 花 诗 几 听 南园 烂熟 时 嚼 破红香堪换骨 摘 残 丹 颗 欲 烧 枝 流莺 偷 啄心 应醉 行客 潜窥眼 亦 痴 闻 说 张 筵就 珠树 任 从 攀折 半离 披
8e3fd930-32f2-4055-a97a-f45045d26e40,寄南雅上人,齊己,唐,诗,七言律诗,曾得音书慰暮年 相思多故信难传 清吟何处题红叶 旧社空怀堕白莲 山水本同真趣向 侯门刚有薄因缘 他时不得君招隐 会逐南归楚客船,"7,7,7,7,7,7,7,7",4f90549eaa391ac32bbb704b817d3593,曾 得 音书 慰 暮年 相思 多 故 信难 传 清吟 何处 题 红叶 旧 社 空怀 堕 白莲 山水 本同 真趣 向 侯门刚 有 薄 因缘 他时 不得 君 招隐 会 逐 南归 楚 客船
e0d3b21d-07c4-468c-856b-650d7f34d1d7,寄歐陽侍郎,齊己,唐,诗,七言律诗,又闻繁总在嘉州 职重身闲倚寺楼 大象影和山面落 两江声合郡前流 棋轻国手知难敌 诗是天才肯易酬 毕竟男儿自高达 从来心不是悠悠,"7,7,7,7,7,7,7,7",b8d0427466b921d9bcc49f922612a594,又 闻 繁 总 在 嘉州 职重 身 闲 倚 寺 楼 大象 影 和 山面 落 两江 声合郡 前 流 棋轻 国手 知难 敌 诗 是 天才 肯易酬 毕竟 男儿 自高达 从来 心 不是 悠悠
9421ca75-ec29-4853-b00d-e3a7fe24e0a8,與崔校書靜話言懷,齊己,唐,诗,七言律诗,同年生在咸通里 事佛为儒趣尽高 我性已甘披祖衲 君心犹待脱蓝袍 霜髭晓几临铜镜 雪鬓寒疎落剃刀 出世朝天俱未得 不妨还往有风骚,"7,7,7,7,7,7,7,7",42e3ab2a379740a5a97e1fe64b141afd,同年 生 在 咸通 里 事佛 为 儒趣 尽 高 我性 已 甘披祖 衲 君心 犹待 脱 蓝袍 霜 髭 晓几临 铜镜 雪鬓 寒 疎 落 剃刀 出世 朝天俱未得 不妨 还 往有 风骚
64ebd3bb-0b7f-402a-8ab4-ea31cb490079,謝人惠拄杖,齊己,唐,诗,七言律诗,邛州灵境产修篁 九节材应表九阳 造化已能分尺度 保持争合与寻常 幽林剪破清秋影 高手携来绿玉光 深谢鲁儒怜潦倒 欲教撑拄遶禅床,"7,7,7,7,7,7,7,7",90995cb6584e6d13a9da0d8aec674fe6,邛州 灵境 产修 篁 九节 材应 表 九阳 造化 已能分 尺度 保持 争合 与 寻常 幽林 剪破 清秋 影 高手 携来 绿玉光 深 谢鲁儒 怜 潦倒 欲 教撑 拄 遶 禅 床
2c4422f1-a943-453f-92ab-f5e9b10371a2,謝秦府推官寄丹臺集,齊己,唐,诗,七言律诗,秦王手笔序丹台 不错褒扬最上才 凤阙几传为匠硕 龙门曾用振风雷 钱郎未竭精华去 元白终存作者来 两轴蚌胎骊颔耀 枉临禅室伴寒灰,"7,7,7,7,7,7,7,7",12218b0314bca63f0125fd90770ad1be,秦王 手笔 序丹台 不错 褒扬 最上 才 凤阙 几 传为 匠 硕 龙门 曾用振 风雷 钱郎 未 竭 精华 去 元 白终 存 作者 来 两 轴 蚌胎 骊 颔 耀 枉临 禅室 伴寒 灰
d0cd71b5-447f-47c1-b7fd-c1897b40a355,題畫鷺鷥兼簡孫郎中,齊己,唐,诗,七言律诗,曾向沧江看不真 却因图画见精神 何妨金粉资高格 不用丹青点此身 蒲叶岸长堪映带 荻花丛晚好相亲 思量画得胜笼得 野性由来不恋人,"7,7,7,7,7,7,7,7",4766d64796dadebac9f17af505a51500,曾 向 沧江 看 不 真 却 因 图画 见 精神 何妨 金粉 资高格 不用 丹青 点 此身 蒲叶岸 长堪 映带 荻 花丛 晚 好 相亲 思量 画 得胜 笼得 野性 由来 不 恋人
6d4eabee-0c78-4b7a-b0e8-d72fc2ce4568,賀行軍太傅得白氏東林集,齊己,唐,诗,七言律诗,乐天歌咏有遗编 留在东林伴白莲 百尺典坟随丧乱 一家风雅独完全 常闻荆渚通侯论 果遂吴都使者传 仰贺斯文归朗鉴 永资声政入薰弦,"7,7,7,7,7,7,7,7",b44d8a7ae0c503288e0d110b3cc895a9,乐天 歌咏 有 遗编 留在 东林 伴 白莲 百尺 典坟 随 丧乱 一家 风雅 独 完全 常闻 荆渚 通侯论 果遂吴 都 使者 传 仰贺 斯文 归朗鉴 永资声 政入 薰 弦
cde282bf-0fc9-4137-b86d-2ea05b7e800c,韶陽微公,齊己,唐,诗,七言律诗,曲江晴影石千株 吾子思归梦断初 有信北来山叠叠 无言南去雨疎疎 祖师门接园林路 丞相家同井邑居 闲野老身留得否 相招多是秀才书,"7,7,7,7,7,7,7,7",00ea49b745ece41a3bd5c7fa31afd492,曲江 晴影 石 千株 吾子 思归 梦断 初 有 信 北来 山 叠叠 无言 南去 雨 疎 疎 祖师 门 接 园林 路 丞相 家 同 井邑 居 闲 野老 身留 得否 相招多 是 秀才 书
99059bde-ecf3-413e-820c-586952a4ef99,將之匡岳過尋陽,齊己,唐,诗,七言律诗,帆过寻阳晚霁开 西风北雁似相催 大都浪后青堆没 五老云中翠叠来 此路便堪归水石 何门更合向尘埃 远公林下莲池畔 个个高人尽有才,"7,7,7,7,7,7,7,7",33ef289087b9de489f70098b8cec4f2e,帆 过 寻阳 晚 霁 开 西风 北雁 似相 催 大都 浪 后 青堆 没 五 老 云中 翠叠 来 此路 便 堪归 水石 何门 更 合向 尘埃 远 公 林下 莲池 畔 个个 高 人 尽有 才
c7c6ae30-66f8-49c1-ba5c-03b62bf81c12,寄湘幕王重書記,齊己,唐,诗,七言律诗,抛掷浟江旧钓矶 日参筹划废吟诗 可能有事关心后 得似无人识面时 官好近闻加茜服 药灵曾说换霜髭 高才直气平生志 除却徒知即不知,"7,7,7,7,7,7,7,7",b357eedc679ae09ab476d70e4211abee,抛掷 浟 江 旧 钓 矶 日 参 筹划 废 吟诗 可能 有事 关心 后 得似 无人 识面 时 官 好 近闻 加茜服 药灵 曾 说 换 霜 髭 高才 直气 平生 志 除却 徒知即 不知
d5cc543d-11aa-4deb-aa8d-5e17b2f72a0b,宿沈彬進士書院,齊己,唐,诗,七言律诗,相期只为话篇章 踏雪曾来宿此房 喧滑尽消城漏滴 窗扉初掩岳茶香 旧山春暖生薇蕨 大国尘昏惧杀伤 应有太平时节在 寒宵未卧共思量,"7,7,7,7,7,7,7,7",f70563f08198efa9b920c59e8bb87998,相期 只 为 话 篇章 踏雪 曾来 宿 此 房 喧滑 尽 消城 漏滴 窗扉 初 掩 岳 茶香 旧山 春 暖 生薇 蕨 大国 尘昏惧 杀伤 应有 太平 时节 在 寒宵 未 卧 共 思量
6df5256e-78af-4c54-9395-007ad3463acf,靜院,齊己,唐,诗,七言律诗,花院相重点破苔 谁心肯此话心灰 好风时傍疎篁起 幽鸟晚从何处来 笔砚兴狂师沈谢 香灯魂断忆宗雷 浮生已问空王了 箭急光阴一任催,"7,7,7,7,7,7,7,7",869a539b522930767c6f6d12793edaac,花院 相 重点 破 苔 谁 心肯 此话 心灰 好 风 时 傍 疎 篁 起 幽 鸟 晚 从 何处 来 笔砚 兴狂 师 沈谢 香 灯 魂 断 忆宗雷 浮生 已 问 空王 了 箭 急 光阴 一任 催
a89b1879-338a-4912-a6c6-5e21bac3f4d2,送白處士遊峨嵋,齊己,唐,诗,七言律诗,闲身谁道是羁游 西指峨嵋碧顶头 琴鹤几程随客棹 风霜何处宿龙湫 寻僧石磴临天井 𣃁药秋崖倒瀑流 莫为寰瀛多事在 客星相逐不回休,"7,7,7,7,7,7,7,7",02fd305a49e33fc86ba95edaeab76888,闲身 谁 道 是 羁游 西 指 峨嵋 碧 顶头 琴鹤 几程 随 客 棹 风霜 何处 宿 龙湫 寻僧石 磴 临 天井 𣃁 药秋 崖 倒 瀑流 莫为寰 瀛 多 事 在 客星 相 逐不 回休
13e741a2-9c9e-4594-8238-e390d182754c,寄顧蟾處士,齊己,唐,诗,杂言,久闻为客过苍梧 休说携家归镜湖 山水颠狂应尽在 鬓 毛凋落免贫无 和僧抢入云中峭 带鹤驱成涧底孤 春醉醒来有余兴 因人乞与武陵图,"7,7,7,1,6,7,7,7,7",d02f3b8c44aa9ba6a613c8ff98da4520,久闻 为 客 过 苍梧 休说 携家 归 镜湖 山水 颠狂 应尽 在 鬓 毛 凋落 免贫 无 和僧 抢入 云中 峭 带 鹤 驱成 涧 底 孤 春醉 醒来 有 余兴 因人 乞与 武陵 图
cc40b164-5d54-419a-acdd-60141cad70a5,懷金陵知舊,齊己,唐,诗,七言律诗,海门相别住荆门 六度秋光两鬓根 万象倒心难盖口 一生无事可伤魂 石头城外青山叠 北固窗前白浪翻 尽是共游题版处 有谁惆怅拂苔痕,"7,7,7,7,7,7,7,7",f52f09ab020182f82a7c287886a50b99,海门 相别 住 荆门 六度 秋光 两鬓 根 万象 倒 心难盖口 一生 无事可伤魂 石头 城外 青山 叠 北固 窗前 白浪 翻 尽是 共游题 版处 有 谁 惆怅 拂 苔 痕
907749c8-6b53-4587-a4c2-d0ef699e13c8,喜得自牧上人書,齊己,唐,诗,七言律诗,吴都使者泛惊涛 灵一传书慰毳袍 别兴偶随云水远 知音本自国风高 身依闲淡中销日 发向清凉处落刀 闻著括囊新集了 拟教谁与序离骚,"7,7,7,7,7,7,7,7",54fab09539293bc57ea64939d286329b,吴 都 使者 泛 惊涛 灵 一传 书 慰 毳 袍 别兴偶 随 云水 远 知音 本自 国风 高 身 依闲淡 中 销日 发 向 清凉 处落 刀 闻 著括 囊 新集 了 拟 教 谁 与 序 离骚
6f2263b7-4acf-4fc8-9c8b-0b64421f5ce0,驚秋,齊己,唐,诗,七言律诗,晓窗惊觉向秋风 万里心凝淡荡中 池影碎飜红菡萏 井声干落绿梧桐 破除闲事浑归道 销耗劳生旋逐空 妖杀九原狐兔意 岂知丘陇是英雄,"7,7,7,7,7,7,7,7",abf8bf8f3fb41a964d45d140eba5407e,晓 窗 惊觉 向 秋风 万里 心 凝淡荡 中 池影 碎 飜 红 菡萏 井声 干落绿 梧桐 破除 闲事 浑 归道 销耗 劳生 旋逐 空 妖杀 九原 狐 兔 意 岂知 丘陇 是 英雄
408fa9f3-969b-4ced-872d-3c67988c8b9a,聞沈彬赴吳都請辟,齊己,唐,诗,七言律诗,长讶高眠得稳无 果随征辟起江湖 鸳鸯已列罇罍贵 鸥鹤休怀钓渚孤 白日不妨扶汉祚 清才何让赋吴都 可能更忆相寻夜 雪满诸峰火一炉,"7,7,7,7,7,7,7,7",0b88f2b1c0421ed61b8251994326ab9a,长讶 高眠 得 稳无 果 随 征辟 起 江湖 鸳鸯 已 列 罇 罍 贵 鸥 鹤 休怀 钓渚 孤 白日 不妨 扶汉祚 清才 何 让 赋 吴 都 可能 更忆相寻夜 雪满 诸峰 火 一 炉
8664f8c0-15c3-46f6-a291-12d426efd682,寄江夏仁公,齊己,唐,诗,七言律诗,寺阁高连黄鹤楼 簷前槛底大江流 几因秋霁澄空外 独为诗情到上头 白日有余闲送客 紫衣何啻贵封侯 别来多少新吟也 不寄南宗老比丘,"7,7,7,7,7,7,7,7",38e4965d9cc9c0c7a4fd1ec1ef359459,寺阁 高连 黄鹤楼 簷 前槛 底 大 江流 几 因 秋霁澄 空外 独为 诗情 到 上头 白日 有 余闲 送客 紫衣 何啻 贵 封侯 别 来 多少 新 吟 也 不 寄 南宗老 比丘
9f478fc9-82f5-46bb-a7c2-32c312f2109a,中春林下偶作,齊己,唐,诗,七言律诗,净境无人可共携 闲眠未起日光低 浮生莫把还丹续 万事须将至理齐 花在月明蝴蝶梦 雨余山绿杜鹃啼 何能向外求攀折 岩桂枝条拂石梯,"7,7,7,7,7,7,7,7",db23fcff1139206d4532e19341a41255,净境 无人 可 共 携 闲眠 未 起 日光 低 浮生 莫 把 还丹续 万事 须 将 至 理齐 花 在 月 明 蝴蝶梦 雨余山 绿 杜鹃 啼 何 能 向 外求 攀折 岩 桂枝 条 拂 石梯
b1aacbaa-27b9-40c5-8ed4-5708c9b778f7,送劉秀才歸桑水寧覲,齊己,唐,诗,七言律诗,归和初喜戢戈矛 乍捧乡书感去留 雁序分飞离汉口 鸰原骞翥在鼇头 家邻紫塞仍千里 路过黄河更几州 应到高堂问安后 却携文入帝京游,"7,7,7,7,7,7,7,7",8248944fb207f5ef75c06bcd6ec07d23,归和初 喜 戢 戈矛 乍 捧 乡书 感 去留 雁序 分 飞离 汉口 鸰 原 骞 翥 在 鼇头 家邻 紫塞 仍 千里 路过 黄河 更 几 州 应 到 高堂 问安 后 却 携 文入 帝京 游
4f76a711-3d6a-45d4-9385-07bdda535ba5,寄曹松,齊己,唐,诗,七言律诗,旧制新题削复刊 工夫过甚琢琅玕 药中求见黄芽易 诗里思闻白雪难 扣寂颇同心在定 凿空何止发冲冠 夜来月苦怀高论 数树霜边独傍栏,"7,7,7,7,7,7,7,7",b1262c166b4cbeaed2ec6791c0390492,旧制 新题 削 复刊 工夫 过 甚 琢 琅玕 药 中 求见 黄芽易 诗里 思闻 白雪 难 扣寂 颇 同心 在 定 凿空 何止 发冲 冠 夜来 月 苦 怀 高论 数树 霜 边 独傍 栏
b6720361-8068-43b2-b768-5be3081a5b31,酬蜀國歐陽學士,齊己,唐,诗,七言律诗,因缘刘表驻经行 又听西风堕叶声 鹤发不堪言此世 峨嵋空约在他生 已从禅祖参真性 敢向诗家认好名 深愧故人怜潦倒 每传仙语下南荆,"7,7,7,7,7,7,7,7",b7e1a46c7fe1842a715b86f545fbf272,因缘 刘表 驻 经行 又 听 西风 堕 叶声 鹤发 不堪 言 此 世 峨嵋 空约 在 他 生 已 从 禅祖 参 真性 敢 向 诗家 认好 名 深愧 故人 怜 潦倒 每 传 仙 语 下 南荆
0de2b0b9-eec7-4310-b4ee-f9e65aaa0926,寄荆幕孫郎中,齊己,唐,诗,七言律诗,珠履风流忆富春 三千鹓鹭让精神 诗工凿破清求妙 道论研通白见真 四座共推操檄健 一家谁信买书贫 别来乡国魂应断 劒阁东西尽战尘,"7,7,7,7,7,7,7,7",ababa19492cb30edaa80d12832afae49,珠 履 风流 忆富春 三千 鹓 鹭 让 精神 诗工 凿 破清求妙 道论 研通 白见 真 四座 共推 操 檄健 一家 谁 信买书 贫 别 来 乡 国魂 应断 劒 阁 东西 尽 战尘
5da58fe6-8dd7-404b-9039-b97f4c1de736,謝王詹事垂訪,齊己,唐,诗,七言律诗,鸟外孤峰未得归 人间触类是无机 方悲鹿轸栖江寺 忽讶轺车降竹扉 王泽乍闻谭涣汗 国风那得话玄微 应惊老病炎天里 枯骨肩横一衲衣,"7,7,7,7,7,7,7,7",3b04c00c63ff238dc5d4bb8abade9404,鸟 外 孤峰 未 得 归 人间 触类 是 无机 方悲鹿 轸 栖 江寺 忽讶 轺 车 降 竹扉 王泽乍 闻谭 涣汗 国风 那 得 话 玄微 应惊 老病 炎天 里 枯骨 肩 横 一 衲衣
90ba8d2f-0cd0-4b92-a735-9b95b652a47b,題南平後園牡丹,齊己,唐,诗,七言律诗,暖披烟艳照西园 翠幄朱栏护列仙 玉帐笙歌留尽日 瑶台伴侣待归天 香多觉受风光剩 红重知含雨露偏 上客分明记开处 明年开更胜今年,"7,7,7,7,7,7,7,7",7ad77d629cbfd1b2f2d5ee019e512e85,暖 披烟 艳照 西园 翠 幄 朱 栏护列仙 玉帐 笙歌 留尽 日 瑶台 伴侣 待 归天 香 多 觉受 风光 剩 红重 知含 雨露 偏 上 客 分明 记开 处 明年 开 更 胜 今年
5b149cbb-8afb-4733-8c81-3b2ddec93ee7,和李書記,齊己,唐,诗,七言律诗,繁极全分青帝功 开时独占上春风 吴姬舞雪非真艳 汉后题诗是怨红 远蜨恋香抛别苑 野莺衔得出深宫 君看万态当筵处 羞杀蔷薇点碎丛,"7,7,7,7,7,7,7,7",fb22f818b4c82d8c6ffec8251d398ac9,繁极 全分 青帝 功 开时 独占 上 春风 吴姬 舞雪 非 真艳 汉后 题诗 是 怨 红 远 蜨 恋 香 抛 别 苑 野 莺 衔 得出 深宫 君 看 万态 当 筵处 羞杀 蔷薇 点 碎丛
90cd671b-e7d6-44da-98dd-98b545733145,謝孫郎中寄示,齊己,唐,诗,七言律诗,一念禅余味国风 早因持论偶名公 久伤琴丧人亡后 忽有云和雪唱同 绳琢静闻罤象外 是非闲见寂寥中 时来日往缘真趣 不觉秋江度塞鸿,"7,7,7,7,7,7,7,7",a62c3be5b48a18db4a4865892776e266,一 念 禅 余味 国风 早 因 持论 偶名 公 久 伤琴 丧人亡 后 忽 有 云 和 雪 唱 同 绳 琢 静闻 罤 象 外 是非 闲见 寂寥 中 时 来 日 往缘 真趣 不觉 秋 江度 塞鸿
bf679d8e-9c66-443b-ba26-8483114622d4,愛吟,齊己,唐,诗,七言律诗,正堪凝思掩禅扃 又被诗魔恼竺卿 偶凭窗扉从落照 不眠风雪到残更 皎然未必迷前习 支遁宁非悟后生 传写会逢精鉴者 也应知是咏闲情,"7,7,7,7,7,7,7,7",a15a29a71eb74ad50dea81240a6e4b26,正堪 凝思 掩 禅 扃 又 被 诗 魔 恼 竺卿 偶 凭 窗扉 从 落照 不眠 风雪 到 残更 皎然 未必 迷前 习 支遁 宁非 悟 后生 传写 会 逢精鉴 者 也 应知 是 咏 闲情
2bbc37d7-649f-4ab0-bb44-d629736310ab,寄懷東林寺匡白監寺,齊己,唐,诗,七言律诗,南岳别来无约后 东林归住有前缘 闲搜好句题红叶 静敛霜眉对白莲 雁塔影分疎桧月 虎溪声合几峰泉 修心若似伊耶舍 传记须添十九贤,"7,7,7,7,7,7,7,7",caeb497bea361b06700a155730d082f2,南岳 别 来 无约 后 东林 归住 有 前缘 闲 搜 好句 题 红叶 静敛霜 眉 对 白莲 雁塔 影 分 疎 桧 月 虎溪 声合 几峰 泉 修心 若 似 伊耶舍 传记 须 添 十九 贤
b21f9b40-9614-4147-88e6-1feb24e56553,謝人惠十色花牋幷棋子,齊己,唐,诗,七言律诗,陵州棋子浣花牋 深愧携来自锦州 海蚌琢成星落落 吴绫隐出雁翩翩 留防桂苑题诗客 惜寄桃源敌手仙 捧受不堪思出处 七千余里劒门前,"7,7,7,7,7,7,7,7",2fc2b79db43634e2f0d61a9221df99b6,陵州 棋子 浣 花 牋 深愧 携 来自 锦州 海蚌 琢成 星 落落 吴 绫隐 出 雁 翩翩 留防 桂苑 题诗 客 惜寄 桃源 敌手 仙 捧 受 不堪 思 出处 七千余里 劒 门前
521f5114-a3ab-4cad-97ca-0ec76f4237a3,夏日寓居寄友人,齊己,唐,诗,七言律诗,北游兵阻复南还 因寄荆州病掩关 日月坐销江上寺 清凉魂断剡中山 披缁影迹堪藏拙 出世身心合向闲 多谢扶风大君子 相思时到寂寥间,"7,7,7,7,7,7,7,7",d086edecd7077ee32751a2aed2c31660,北 游兵 阻复 南 还 因 寄 荆州 病 掩关 日月 坐销 江上 寺 清凉 魂 断 剡 中山 披 缁 影迹 堪 藏拙 出世 身心 合向 闲 多谢 扶风 大 君子 相思 时 到 寂寥 间
