id,title,author,dynasty,genre,poem_type,sentences_simplified,meter_pattern,hash,words
c62f136e-3b6a-4716-88f0-1c946dec7ab7,约斋西窗先有垂柳腊后四日辟地增植花数十辈,张镃,唐,诗,七言律诗,经年规画种酴醿 柳际春将一再归 蔓草藩墙才放远 海棠桃杏得成围 连宵冷月知予乐 数日条风挟鸟飞 尽写前人题品句 诵声时撼绿窗扉,"7,7,7,7,7,7,7,7",90e5b1a0d302e39f9420e11ef08795a6,经 年 规画 种 酴 醿 柳际春 将 一再 归 蔓草 藩 墙 才 放 远 海棠 桃杏 得成 围 连宵 冷月 知予 乐 数日 条风 挟 鸟 飞 尽 写 前人 题品 句 诵 声 时 撼 绿 窗扉
db96e965-505c-4b82-b4f8-16ee2c15c0c8,雪,张镃,唐,诗,七言律诗,阖夜惊飚落树巢 平明沟瓦渐迷坳 鍪函静听来千骑 珪璧遥知委四郊 再白呈祥矜大稔 积阴嘘气遏方苞 池边废沼邀闲立 乍合冰澌怯杖敲,"7,7,7,7,7,7,7,7",2742187fcd4c2d7e3edf0867345337a6,阖夜 惊飚 落 树巢 平明 沟瓦 渐 迷 坳 鍪 函 静听 来 千 骑 珪璧 遥知 委 四郊 再 白 呈祥 矜大 稔 积阴 嘘气 遏 方 苞 池边 废沼 邀 闲立 乍 合 冰 澌 怯 杖 敲
44d0cfa5-4dba-49f4-9ccd-9c0a7efdc881,雪晴希稷次韵再赋为答,张镃,唐,诗,七言律诗,冻枿归禽易辨巢 烛龙分燿入堂坳 长须喜戒锄荒圃 小队闲思猎近郊 坐许刚筠全直节 行看弱柳发新苞 僧炉遥想煨松柮 犬逐应门认客敲,"7,7,7,7,7,7,7,7",c15f18efd8ad8f1d6eefa8c31ac3a470,冻 枿 归 禽 易 辨 巢 烛龙 分 燿 入 堂 坳 长须 喜戒 锄 荒圃 小队 闲思 猎 近郊 坐 许刚筠 全直 节 行 看 弱 柳 发新 苞 僧炉 遥想 煨 松 柮 犬逐应门 认客 敲
1152b7f0-ce62-431c-97e7-bf15fa22a3c0,丙午十二月晦日雪霁,张镃,唐,诗,七言律诗,晓爱晴晖万瓦融 近山春意便葱茏 敲冰踏雪三旬里 送腊迎年此夜中 仁政果能销运厄 闲家何幸乐时丰 明朝扫径看桃柳 要识天公两样风,"7,7,7,7,7,7,7,7",b476d1b262e98bed90cdcde21c359663,晓爱晴 晖 万瓦 融 近 山 春意 便 葱茏 敲 冰 踏雪 三旬 里 送 腊 迎 年 此 夜中 仁政 果能 销运 厄 闲家 何幸乐 时 丰 明朝 扫径 看 桃 柳 要识 天公 两样 风
0b882e62-4beb-4301-a8bf-53b193e9a87e,守岁,张镃,唐,诗,七言律诗,寒缸孤照听更迟 情绪斟量睡却宜 春向岁前三日到 老缘头上二毛知 朱泥逐疫烧灵药 桃板书符换旧诗 但愿明年更闲散 无灾无难复何疑,"7,7,7,7,7,7,7,7",c2aef53e9f04c080c7822d6328aa8d85,寒缸 孤照 听 更迟 情绪 斟量 睡 却 宜 春 向 岁前 三日 到 老缘 头上 二毛 知 朱 泥逐疫 烧 灵药 桃 板书 符换 旧诗 但愿 明年 更 闲散 无灾 无难复 何疑
d88d4cfc-673f-4b85-82f7-3036d3bb3fc3,夕霁,张镃,唐,诗,七言律诗,霜雪连朝作劲威 暮来吹散景偏宜 未开璧月千秋镜 已建金云十丈旗 脱帽渐看山峍屼 袭裘须判酒淋漓 乘闲书纸休嫌数 簿领丛中怕说诗,"7,7,7,7,7,7,7,7",4329d4f0187f168ca65131ffc9aeefdd,霜雪 连朝 作劲 威 暮来 吹散 景 偏宜 未 开 璧月 千秋 镜 已 建 金云 十丈 旗 脱帽 渐 看 山 峍 屼 袭 裘 须 判酒 淋漓 乘 闲书 纸 休嫌 数 簿 领 丛中 怕 说 诗
f858c3f2-8485-400e-87ae-3240d766f907,春分后一日山堂述事  其一,张镃,唐,诗,七言律诗,永日柴扉手自关 不惊时序若循环 炼成黄土为真药 守得青苔遍假山 戊己燕知随鸟历 西南樱喜趁花斑 春光莫恨中分过 能使时长始是闲,"7,7,7,7,7,7,7,7",f030f8536677d1f91257d8960428cebe,永日 柴扉 手 自关 不 惊 时序 若 循环 炼成 黄土 为 真药 守 得 青苔 遍 假山 戊 己 燕 知随 鸟历 西南 樱 喜 趁 花斑 春光 莫 恨 中 分过 能 使 时长 始是 闲
6304709b-649a-4a13-b844-d4b5f6d4396e,春分后一日山堂述事  其二,张镃,唐,诗,七言律诗,每到山堂懒作诗 今朝诗兴觉偏宜 层林飒还阴填户 乱石巃嵷翠绕池 猛欲近前闻紫燕 忽听高处啭黄鹂 风铃不必簷间语 境界非凡我熟知,"7,7,7,7,7,7,7,7",f22b305df31ee7a10eff5ad3f3a1d76c,每 到 山堂 懒 作诗 今朝 诗兴 觉 偏宜 层 林飒 还 阴填户 乱石 巃 嵷 翠 绕 池 猛 欲 近前 闻紫燕 忽 听 高处 啭 黄鹂 风铃 不必 簷 间 语 境界 非凡 我 熟知
f4164007-1e5f-4ddb-b0ed-ed129ac6b330,春分后一日山堂述事  其三,张镃,唐,诗,七言律诗,老圃工夫愈可嘉 种藤萦树尽开花 人间似我能闲少 石上看云到日斜 樵径有苔休埽叶 茅庵无客亦煎茶 两边最喜添新竹 夕照斜时渐可遮,"7,7,7,7,7,7,7,7",3ba572358364fc84d3c1e8eb4813d8bb,老圃 工夫 愈 可嘉 种 藤萦树 尽 开花 人间 似 我 能 闲少 石 上 看 云 到 日 斜 樵径 有 苔 休 埽 叶 茅庵 无 客 亦 煎 茶 两边 最 喜添 新竹 夕照 斜 时渐 可 遮
e18fee2d-129a-4d36-9581-9af382cfdff5,春分后一日山堂述事  其四,张镃,唐,诗,七言律诗,岩通道院碧桃妍 别号琅华小洞天 香火微官方称职 轩裳闲梦自无缘 星坛夜礼魁罡列 丹室朝存震兑全 绝粒飞升休漫语 不求人已是神仙,"7,7,7,7,7,7,7,7",6c23b886b3b3e49adebe93f553581ad9,岩 通道 院 碧桃 妍 别号 琅华 小洞天 香火 微 官方 称职 轩裳 闲梦 自 无缘 星坛 夜礼魁罡列 丹室朝 存 震兑 全 绝粒 飞升 休漫语 不求人 已 是 神仙
734716c5-9b51-4b9b-a585-e3aa3826f3e5,闲课,张镃,唐,诗,七言律诗,居闲投课熟为优 似此工夫尽不愁 量涧打船轻似盏 转墙开迳曲如钩 已令山圃收黄犊 又盖湖亭记白鸥 春水画桥桃四百 新年那羡武陵游,"7,7,7,7,7,7,7,7",02b7edb8124e8baa6273c716a96d9fd7,居闲 投课 熟为 优 似此 工夫 尽不 愁 量 涧 打船 轻似 盏 转墙 开 迳 曲 如 钩 已 令 山 圃 收 黄犊 又 盖 湖亭 记白鸥 春水 画桥 桃 四百 新年 那 羡 武陵 游
e4b7a874-f7e6-474f-95ad-3c3d1dfa3767,自咏,张镃,唐,诗,七言律诗,南湖老子太汗漫 第一生来懒做官 钱物用多常是解 权门路便不曾钻 红裙遣去如僧榻 白发梳来称道冠 若没祖财教饭饱 定应饿作壁鱼干,"7,7,7,7,7,7,7,7",61b069697a50f24131539207f0f30956,南湖 老子 太 汗漫 第一 生来 懒 做官 钱物 用 多常 是 解 权门 路 便 不曾 钻 红裙 遣 去 如 僧 榻 白发 梳来 称道 冠 若 没祖 财教饭 饱 定应 饿作 壁鱼 干
8f885523-6a98-400f-b1ff-33f6b6d1a755,自叹,张镃,唐,诗,七言律诗,居士年来更觉痴 竹梢云过望移时 晓窗倦栉犹思梦 夜榻忘眠尚改诗 匹马未能随李广 一丘端欲效元规 客谈休讶无心对 贪看蜘蛛结网丝,"7,7,7,7,7,7,7,7",82edd21c3e67d91711e1b215916f4322,居士 年来 更觉 痴 竹梢云 过望 移 时 晓窗倦 栉犹思梦 夜 榻 忘眠 尚 改 诗 匹马 未能 随 李广 一 丘端 欲 效元 规 客谈 休讶 无心 对 贪看 蜘蛛 结 网丝
d0474221-23d2-40b0-ae6d-2ed21b17aeeb,山堂晚兴,张镃,唐,诗,七言律诗,小堂清占景无哗 不向阶前种俗花 过雨家茶脱黄玉 近霜天竹缀丹沙 静眠宁羡蚁来梦 孤坐屡谙蜂报卫 万事一身安分定 关河休用发长嗟,"7,7,7,7,7,7,7,7",8794153e90220cff7f783de28c7a3385,小堂清 占 景 无 哗 不 向 阶 前种 俗花 过雨家 茶 脱 黄玉 近 霜天 竹缀 丹沙 静眠宁 羡 蚁 来 梦 孤坐 屡谙蜂 报卫 万事 一身 安分 定 关河 休用 发长 嗟
49a357cb-14f2-443e-bd3c-98893eceec39,园中晚兴,张镃,唐,诗,七言律诗,满襟斜日澹如秋 烟竹湘花结暮愁 几树蝉清新抱叶 一湾鱼乐旧忘钩 蔬盘饱去山家饭 楚调吹来水园讴 此事不教千载识 苦谐时辈祗贻羞,"7,7,7,7,7,7,7,7",45e0dea27a2f4c882ae87c0cb6049afe,满 襟 斜 日 澹如秋 烟竹 湘 花结 暮 愁 几 树 蝉 清新 抱 叶 一 湾 鱼乐 旧 忘 钩 蔬盘 饱去 山家 饭 楚调 吹来 水园 讴 此事 不 教 千载 识 苦 谐 时 辈 祗 贻羞
4cc0840e-bb44-49d3-9c45-5e2ddb55ea9c,竹轩诗兴,张镃,唐,诗,七言律诗,柴门风卷却吹开 陿径初成竹旋栽 梢影细从茶椀入 叶声轻逐篆烟来 暑天倦卧星穿透 冬昼闲吟雪压摧 预想此时应更好 莫移墙下一株梅,"7,7,7,7,7,7,7,7",834ae29e44aabbbec06336cadae707ff,柴门 风卷 却 吹开 陿 径 初 成竹 旋 栽 梢 影细 从 茶 椀 入 叶声 轻逐 篆 烟 来 暑天 倦 卧星 穿透 冬 昼 闲吟 雪压 摧 预想 此时 应 更好 莫移 墙下 一株 梅
cbc997cd-749f-44db-a99a-9723f7586c87,偶书  其一,张镃,唐,诗,七言律诗,移居桂隠诗全少 半为支离半为慵 今日一杯才引兴 便成七字不求工 鹤来池畔闲寻水 蝉在松梢快语风 门外车尘红似火 唤渠不应嗫嚅翁,"7,7,7,7,7,7,7,7",c4f98dbcc6a825e8b3e57e206f322f6c,移居 桂 隠 诗 全 少 半 为 支离 半 为 慵 今日 一杯 才 引兴 便成 七 字 不求 工 鹤 来 池畔 闲 寻水 蝉 在 松 梢 快 语风 门外 车尘 红 似火 唤 渠 不 应 嗫嚅 翁
882029f9-f6fb-4204-9c78-dd4ac24efa3b,偶书  其二,张镃,唐,诗,七言律诗,花柳无情浪占春 浴鹅波暖草方熏 催畊野旷鸣黄犊 瞰客篱疎立茜裙 拚睡工夫便日永 得闲滋味苦愁分 行行快趁风烟阁 莼鲙诗坛要策勋,"7,7,7,7,7,7,7,7",1e60a8650ff5bbd9be88eafb82980ff6,花柳 无情 浪 占 春 浴鹅 波 暖 草方 熏 催 畊 野 旷 鸣 黄 犊 瞰 客篱 疎 立 茜 裙 拚睡 工夫 便 日 永 得闲 滋味 苦愁 分 行行 快 趁 风烟 阁 莼鲙 诗坛 要策 勋
cc236b1a-a3c4-43ca-a777-f63e2373efbd,偶书  其三,张镃,唐,诗,七言律诗,清晓啁啾响众禽 共忻暄色上穹林 已如料峭春初景 不作萧条岁暮心 堆径尚看桐叶在 遶篱那顾菊丛深 秦正嘉月将何祝 长寿新芽当酒斟,"7,7,7,7,7,7,7,7",a0857ac95ce7e6bf238a3ba546312b67,清晓 啁啾 响 众 禽 共 忻 暄 色 上 穹林 已 如 料峭 春初 景 不 作 萧条 岁暮 心 堆径 尚 看 桐叶 在 遶篱 那 顾 菊 丛 深 秦正嘉 月 将 何祝 长寿 新芽 当 酒 斟
46fc8679-797c-4acb-8122-4b0c847a56a6,偶书  其四,张镃,唐,诗,七言律诗,野水因晴自少文 淡云当昼不容昏 夹泥船小才通港 洗菜人归定入村 布谷飞鸣随燕去 舂锄俛啄得鱼吞 春风有得诗如许 妙处从来复细论,"7,7,7,7,7,7,7,7",168257fe642ca2302bb9d0a5ac680b4b,野水因 晴 自少 文 淡云 当 昼 不容 昏 夹泥 船小 才 通 港 洗菜 人 归定 入村 布谷 飞鸣 随 燕 去 舂 锄 俛 啄 得 鱼 吞 春风 有 得 诗 如许 妙处 从来 复 细论
b4879a1b-7ded-4bac-aba1-1af6220fad73,客有折秋香来桂隠者喜成七言呈以道,张镃,唐,诗,七言律诗,半纪移居野水旁 年年尝为木樨忙 若非老树从头发 安得西风彻骨香 数朶折来犹甚爱 满林开后得无狂 今番莫把寻常比 一段清香两主张,"7,7,7,7,7,7,7,7",be1e25e6d84f3ad6023210093aeb5928,半纪 移居 野水 旁 年 年 尝为 木樨 忙 若非 老树 从 头发 安 得 西风 彻骨 香 数 朶 折 来 犹 甚 爱 满林 开 后 得 无狂 今番 莫 把 寻常 比 一段 清香 两 主张
e6e16f59-8704-46c8-a2c3-6e277cbd63d7,南湖书斋,张镃,唐,诗,七言律诗,雨深愁入树花飘 尽际翻晴现帝霄 目力壮时苍岫长 心情闲处戏鱼跳 秋云总是诗家物 夜市今连里陌桥 船子不来同载我 却惊翡翠出兰苕,"7,7,7,7,7,7,7,7",64d48d41d7217b734f89bd0734ae99ea,雨 深 愁 入 树花 飘 尽际 翻 晴现 帝霄 目力 壮时 苍岫长 心情 闲处 戏鱼 跳 秋云 总是 诗家 物 夜市 今 连里 陌桥 船子 不来 同载 我 却 惊 翡翠 出兰苕
31638326-b612-4511-89d3-c4ea98172768,题尚友轩,张镃,唐,诗,七言律诗,作者无如八老诗 古今模轨更求谁 渊明次及寒山子 太白还同杜拾遗 白傅东坡俱可法 涪翁无己总堪师 胸中活底仍须悟 若泥陈言却是痴,"7,7,7,7,7,7,7,7",291fe2ef149ccc8ea1ae6290032baf1a,作者 无如八老诗 古今 模轨 更求 谁 渊明 次 及 寒 山子 太白 还 同 杜 拾遗 白傅 东坡 俱 可 法 涪翁 无己 总 堪 师 胸中 活底 仍须 悟 若泥陈言 却是 痴
10357002-2104-40cc-a00b-185d60de0727,次韵叔祖阁学秋兴,张镃,唐,诗,七言律诗,岁序推流感世浮 乐闲宜早向农畴 修梧绿减俄过夏 短发丝添剥得秋 千古是非归啸傲 一门酬唱胜交游 祗因名句多难数 常笑区区赵倚楼,"7,7,7,7,7,7,7,7",137623524431fafc91380d2fc66f4215,岁序 推 流感 世浮 乐闲 宜 早 向 农畴 修梧 绿 减 俄 过夏 短 发丝 添 剥得 秋 千古 是非 归 啸傲 一门 酬唱 胜 交游 祗 因 名句 多难 数 常 笑 区区 赵倚楼
bc97d30c-7ca5-4879-934e-855bbea5c6e0,桂隠花正开得诚斋木樨七言次韵奉酬,张镃,唐,诗,七言律诗,未说香高众卉林 清名先已入人深 衣青萼绿不见珮 屋贮阿娇纯用金 久恨酒肠悭似琖 更输诗字响如砧 公能为办归休计 肯向花前叹陆沉,"7,7,7,7,7,7,7,7",9681d44af52dc7dfc92a87e50fbb5877,未 说 香 高 众卉 林 清名 先 已 入 人 深 衣青萼 绿 不见 珮 屋 贮 阿娇纯 用 金 久 恨 酒 肠 悭 似 琖 更 输 诗 字 响 如 砧 公能 为 办归 休计 肯向 花 前 叹 陆沉
4b35206a-32a8-4190-b017-ce9f8b303686,诚斋再韵见遗走笔复和并邀尤检正京右司观花,张镃,唐,诗,七言律诗,要趁清霜未染林 小山同赏桂丛深 已拚醉后缠头锦 莫待风前布地金 兰桨溯流歌客櫂 麝材匀捣付香砧 戈挥就借如椽笔 不信湖边日易沉,"7,7,7,7,7,7,7,7",34ff25abb16b6bfcb4acae196833f04b,要 趁 清 霜 未 染 林 小山 同赏桂 丛 深 已 拚醉 后 缠头 锦 莫待风 前布 地金 兰桨 溯流 歌 客 櫂 麝材 匀 捣付 香 砧 戈挥 就 借 如 椽 笔 不 信 湖边 日易 沉
dcd13a18-1ff6-49db-bb53-7670ac4ca0ec,诚斋三用韵因更和呈以坚顾临之约,张镃,唐,诗,七言律诗,不比先贤傲竹林 鸣驺许过径蓬深 瑰词走送惊联璧 钝思追酬漫注金 岩底幽人矜社瓮 闺中幼妇感秋砧 何如醉袖淋漓墨 一笑人间百虑沉,"7,7,7,7,7,7,7,7",d780b873f6bf33a99ed11f04ecb80ff2,不 比 先贤 傲 竹林 鸣 驺 许 过径 蓬深 瑰词 走送 惊 联璧 钝 思 追酬 漫注 金 岩底 幽人 矜 社 瓮 闺中 幼妇 感秋 砧 何如 醉袖 淋漓 墨 一 笑 人间 百虑 沉
0143dbf5-f33b-4d66-90d4-b68fcd838302,尤丈京丈和篇沓至四用前韵为谢,张镃,唐,诗,七言律诗,江南从识桂花林 岁岁逢秋属意深 夜气未添承露掌 晓光先上辟寒金 玉笙殿迥应留月 铁杵岩高不用砧 争似吾家种流水 拥香亭榭绿沉沉,"7,7,7,7,7,7,7,7",feccd1c9f80f1a8f4eb207bf4a7264af,江南 从识 桂花 林 岁 岁 逢 秋 属意 深 夜气 未 添 承露 掌 晓光先 上辟 寒金 玉笙 殿 迥 应留 月 铁杵 岩 高 不用 砧 争似 吾 家种 流水 拥香 亭榭 绿沉沉
dda75366-9d32-429d-b047-9c850ae89544,五用前韵咏丹桂花,张镃,唐,诗,七言律诗,遍看韶淑万花林 谁似秋风巧力深 点注红泥千日酒 剪裁紫磨十分金 色迷仙令疑勾漏 香醉姮娥忘藁砧 莫把钓竿烟外去 珊瑚休道海中沉,"7,7,7,7,7,7,7,7",9964947fe3f41eb26f5eaf12a0429eb3,遍看 韶 淑万 花林 谁 似 秋风 巧力深 点 注 红泥 千日 酒 剪裁 紫 磨 十分 金 色迷 仙令疑 勾漏 香醉姮娥 忘 藁 砧 莫 把 钓竿 烟 外 去 珊瑚 休道 海中 沉
5731e88e-ab7c-4f7e-a642-8113a5e911e2,安溪山间寻桂得之,张镃,唐,诗,七言律诗,心期经岁只秋芳 况有溪山近好凉 天宇荡开暄浊意 岩花催就泬寥香 招寻拟把深枝折 爱护休令背蕊伤 三五冰轮行散影 仙凡同异要平章,"7,7,7,7,7,7,7,7",ef1c0478f002896a6c50d10afccaeb52,心期 经岁 只 秋芳 况有 溪山 近 好 凉 天宇 荡 开暄 浊意 岩 花催就 泬 寥 香 招寻 拟 把 深枝折 爱护 休令 背蕊 伤 三五 冰轮 行散 影 仙 凡同 异要 平章
355e003e-dcc9-4d69-a54c-0c6319687a31,晚步池上,张镃,唐,诗,七言律诗,藤杖徐穿竹径凉 地宽那更水云乡 山明屋背髻鬟耸 蝉奏树头丝吹长 蓑笠钓船家自有 轩裳朝路梦俱忘 英雄本志今朝得 十亩香荷著醉狂,"7,7,7,7,7,7,7,7",a171c774192320c0e32f650977dbcda5,藤杖徐 穿 竹径 凉 地宽 那 更 水云 乡 山明 屋 背 髻 鬟 耸 蝉 奏 树头丝吹长 蓑笠 钓船 家 自有 轩裳 朝路 梦俱忘 英雄 本志 今朝 得 十亩 香荷 著醉 狂
a9795533-e61f-4da7-8555-058e1813ff81,纳凉至夜深,张镃,唐,诗,七言律诗,积潦斜阳忽射阶 夜深穿树雨还来 披襟径放清凉入 倚扇微教嬾困催 出草乱萤时自照 叫空孤鸟暗飞回 贪吟四鼓犹妨寝 除此人间念总灰,"7,7,7,7,7,7,7,7",3cf209a81a6dc525781b136f97d6f041,积潦 斜阳 忽射 阶 夜深 穿 树雨 还 来 披襟 径放 清凉 入 倚 扇 微 教 嬾 困 催 出 草乱 萤时 自照 叫 空 孤 鸟 暗 飞回 贪吟 四鼓 犹妨 寝 除 此 人间 念 总灰
02bb2d61-85f1-4024-a11b-a32cdd1a0bb6,游石湖,张镃,唐,诗,七言律诗,几年飞梦越来城 试扣柴荆恰快晴 松菊正酬闲客意 烟波真似主人情 黑头据要方行志 绿野当年浪得名 我亦邻乡植桑柘 访公非为忆莼羹,"7,7,7,7,7,7,7,7",18d4e0c5050c32548161228548461431,几年 飞梦 越 来 城 试扣 柴荆 恰快 晴 松菊正 酬 闲 客意 烟波 真似 主人 情 黑头 据 要 方行志 绿野 当年 浪 得名 我 亦 邻 乡 植桑 柘 访 公非 为忆 莼羹
a0161b68-76cb-4f97-85c2-a07c274eac0b,泛湖,张镃,唐,诗,七言律诗,駮云飞去见晴岚 叠𪩘平湖影共涵 景与新诗争上下 天将真赏冠东南 频来但觉如初到 得侣何妨纵剧谈 归路一弯明月好 閙花风里跃华骖,"7,7,7,7,7,7,7,7",722384e0e400bd7695e131ef28b2fcd6,駮 云 飞去 见 晴岚 叠 𪩘 平湖 影共 涵 景 与 新诗 争 上下 天将 真 赏 冠 东南 频来 但 觉 如初 到 得侣 何妨 纵剧 谈 归路 一 弯 明月 好 閙 花 风 里 跃 华 骖
324945a7-2d30-45f8-b782-417f8f4bd44c,曲廊,张镃,唐,诗,七言律诗,曲廊桐树绿阴阴 簷珮风来奏玉琴 但有疎帘知独立 更无尘事恼闲心 雪霜鬓畔谁能免 城府胸中枉自深 二六时辰真快乐 坐禅才罢即行吟,"7,7,7,7,7,7,7,7",d6a726ad427c3058ac0fc07b45e41bcf,曲廊 桐树 绿 阴阴 簷珮风 来 奏 玉 琴 但 有 疎 帘 知 独立 更 无尘 事 恼 闲心 雪 霜鬓 畔 谁 能免 城府 胸中 枉自 深 二六 时辰 真 快乐 坐禅 才 罢 即 行吟
d808d7d8-941c-433e-af6e-60b7ac48dce9,自横山归偶成,张镃,唐,诗,七言律诗,杖藜如向碧空行 路转松杉面面声 遗庙香残人少到 古台仙去草闲生 都缘世念多时绝 不但尘襟逐境清 却上小舆归寓舍 晚峰明暗紫烟横,"7,7,7,7,7,7,7,7",05019ed0ac7db1e0c2a43c7f246f290f,杖 藜 如 向 碧空 行 路转松 杉 面面 声 遗庙 香 残 人 少 到 古台仙 去 草 闲生 都缘 世念 多 时 绝 不但 尘襟逐境 清 却上 小 舆归 寓舍 晚峰 明暗 紫烟 横
5b20b81f-207e-4738-88ef-128f852378a4,秋日登集仙台,张镃,唐,诗,七言律诗,地荒无处可追游 頼有兹山景颇幽 远水一隅横雪练 乔松千丈舞云虬 飘飖霞想生来僻 胶扰尘心老更休 不向是中观月去 城中那可度中秋,"7,7,7,7,7,7,7,7",d2f257d65164bf710b559b39dddd19b9,地荒 无处 可 追游 頼 有 兹 山 景颇 幽 远 水 一隅 横雪 练 乔松 千丈 舞云 虬 飘 飖 霞 想 生来 僻 胶扰 尘心 老 更 休 不向 是 中观 月 去 城中 那 可度 中秋
20a17412-df8e-400a-8d4d-4caaf40f27c2,圣井亭,张镃,唐,诗,七言律诗,重到虚亭意豁然 望高容易觉秋天 山边旷野全无水 树杂轻烟间有田 极目几时忘去路 西风何日送归船 残蝉更唤斜阳好 衬出金刚翠筿边,"7,7,7,7,7,7,7,7",a79fb76f561186d837688046f4000f5d,重到 虚亭意 豁然 望高 容易 觉 秋天 山边 旷野 全 无水 树 杂轻 烟间 有 田 极目 几时 忘 去路 西风 何日 送归 船 残 蝉 更 唤 斜阳 好 衬出 金刚 翠 筿 边
8a1eaad1-c141-4315-911d-133bd9e33aac,离城中,张镃,唐,诗,七言律诗,雨后溪流尔许深 枕堤楼阁静沉沉 暂来殊鬰登临恨 欲别难禁去住心 倚槛乍离桥百尺 系船犹恋柳千寻 黄昏最喜林端月 影掠波寒彻底金,"7,7,7,7,7,7,7,7",3ef24adad73d80fb63dbd8c70f489733,雨 后 溪流 尔许深 枕堤 楼阁 静 沉沉 暂 来殊 鬰 登临 恨 欲 别 难禁 去 住心 倚 槛 乍 离 桥 百尺 系船 犹恋柳千寻 黄昏 最喜 林端 月 影掠 波寒 彻底 金
318c5e49-3086-409f-ab64-7eec57b83380,野芳亭写望,张镃,唐,诗,七言律诗,晚雨凄微叶未斑 小亭非但揖西山 船行半出青蒲末 塔立参排杂树间 了事儿痴妨剧醉 澹阴天气合清闲 幽居不与红尘隔 退食何能一往还,"7,7,7,7,7,7,7,7",46b23f80c70920d702fc59059b5871fd,晚雨 凄微 叶 未 斑 小亭 非但 揖 西山 船行 半出 青蒲 末 塔立 参排 杂树 间 了 事儿 痴妨 剧醉 澹阴 天气 合 清闲 幽居 不 与 红尘 隔 退食何 能 一往 还
89ffe852-de03-4633-ad17-9af6075ddc8a,泛锦池霞川呈张以道二首  其一,张镃,唐,诗,七言律诗,夕风轻飏一池香 遥为荷花泛短航 俗子几曾贪韵胜 闲人赢得放清狂 幽栖野鹤林松黑 乱扑流萤水叶凉 会取渭川当日意 不将终老俟周王,"7,7,7,7,7,7,7,7",b6c7b6bf600d58d2adff590a1f7b0571,夕 风轻 飏 一 池 香 遥为 荷花 泛短航 俗子 几曾 贪韵胜 闲人 赢得 放 清狂 幽 栖 野鹤 林松黑 乱 扑 流萤 水叶凉 会 取 渭川 当日 意 不 将 终老 俟 周 王
2ab789bb-2d00-4444-906e-668930e95e1f,泛锦池霞川呈张以道二首  其二,张镃,唐,诗,七言律诗,戏选婵娟结伴来 画桥低处侧鸾钗 娲簧静试醒松响 鲁酒聊倾旷荡怀 万事亦须从使便 百年无过任天排 怜君近许同心友 分取湖光到竹斋,"7,7,7,7,7,7,7,7",7a6f8fc7b994d234582772de8884dac9,戏 选 婵娟 结伴 来 画桥 低 处 侧 鸾 钗 娲 簧 静 试醒 松响 鲁酒 聊 倾旷荡怀 万事 亦须 从使 便 百年 无过 任天 排 怜 君 近许 同心 友 分取 湖光 到 竹 斋
fdf54d60-62cf-49a0-82f0-7d5b09de9c51,以道次韵因再和二首  其一,张镃,唐,诗,七言律诗,秋林何翅一般香 楚思无穷属野航 不必再参庞老语 要须先会接舆狂 青灯渐向韦编熟 白露初添玉井凉 久矣荡除人我相 莫疑高尚鄙侯王,"7,7,7,7,7,7,7,7",aad0697fceae3011f241e568096d9d1a,秋林 何翅 一般 香 楚思 无穷 属 野 航 不必 再 参 庞老语 要 须 先 会 接 舆狂 青灯 渐 向 韦 编 熟 白露初 添 玉井 凉 久 矣 荡除 人 我 相 莫疑 高尚 鄙 侯王
57b9f88d-4684-453b-accc-ed2342942a9e,以道次韵因再和二首  其二,张镃,唐,诗,七言律诗,顷年寻地喜初来 墙下松飘满迳钗 屈指五经寒暑候 教人一扫利荣怀 南湖又共诗翁住 东寺须连单位排 触景未尝瞒昧得 肯从颜氏学心斋,"7,7,7,7,7,7,7,7",6c71cc2ce4655bbba5c2d6632a25c12c,顷年 寻 地 喜 初来 墙下 松 飘 满 迳 钗 屈指 五经 寒暑 候 教人 一 扫 利荣怀 南湖 又 共 诗翁 住 东寺 须连 单位 排 触景 未尝 瞒 昧 得 肯 从 颜氏 学心 斋
eec63325-6337-4d16-8831-9211219d15a6,蒲龛,张镃,唐,诗,七言律诗,纷华尝遍气豪粗 未到衰年一点无 行幛不施机上锦 坐龛祇葺水中蒲 斜斜策杖随椶屦 寂寂闻香对瓦𬬻 若昧那伽常在定 结跏徒费钝工夫,"7,7,7,7,7,7,7,7",fe885553c44c7a2989a4a58f22cf0d56,纷华 尝遍 气豪 粗 未 到 衰 年 一点 无 行幛 不施 机上 锦 坐 龛 祇 葺 水中 蒲 斜 斜 策杖 随 椶 屦 寂寂 闻香 对 瓦 𬬻 若 昧 那 伽常 在 定 结 跏 徒费 钝 工夫
eb379972-31fe-414a-a8d3-9c4c9b6ed4c5,雨中约梅再赋,张镃,唐,诗,七言律诗,寄语堂前万玉枝 未须开尽等人归 行云佩杂衣从湿 溅水裙轻步自微 关塞垂杨横槊赋 禁津芳草掞毫挥 为君岂复仍关念 看到清阴碧实肥,"7,7,7,7,7,7,7,7",cda232ab1ec2474498a63ffce93f5232,寄语 堂 前 万玉枝 未须 开尽 等 人 归 行云 佩 杂衣 从 湿 溅水 裙 轻步 自微 关塞 垂杨 横 槊 赋 禁津 芳草 掞 毫 挥 为 君 岂复 仍 关念 看到 清 阴 碧 实肥
bd7ed80f-a2f5-48b9-bdb6-199ae536568e,寒堂梦松,张镃,唐,诗,七言律诗,堂成初喜豢髯龙 肯梦当年十八公 宝树未穿烟际雪 钧天先听日边风 成丹得所从春首 栖鹄无声过夜中 谁遣墙阴接芝径 月晴应是费拖筇,"7,7,7,7,7,7,7,7",77bf54f97a8090c4f5b868f8303329fb,堂 成 初 喜 豢 髯 龙 肯梦 当年 十八 公 宝树 未 穿 烟际 雪 钧 天 先 听 日 边风 成丹 得所 从 春 首 栖 鹄 无声 过夜 中 谁 遣 墙 阴接 芝径 月 晴 应 是 费 拖 筇
e6f291fd-49eb-4349-baac-8ad27ee46eed,苍寒堂,张镃,唐,诗,七言律诗,短桥斜路入松林 何止能销利欲心 眼悟一真清浄色 耳通千古泰和音 尺量梢影邀僧记 竹护根茎恐鹤侵 莫讶塼炉多宿火 春晴犹似处云深,"7,7,7,7,7,7,7,7",aff7170c19f3a94bb21f4e5887035dd5,短 桥 斜路 入 松林 何止 能销 利欲 心 眼悟 一 真 清 浄 色 耳通 千古 泰和 音 尺量 梢 影邀 僧记 竹护 根茎 恐鹤 侵 莫讶 塼 炉 多 宿 火 春晴 犹似 处 云 深
36a53802-886f-45c7-851d-b68daef11c0c,约周希稷游湖上园,张镃,唐,诗,七言律诗,句法参同李翰林 风流依约谢宣城 放怀应喜醉三日 听曲知无误一声 箬叶露方高石室 桂枝香谱度银笙 西清东观迟归去 相就盘跚勃窣行,"7,7,7,7,7,7,7,7",8fc684e6de4c5cf5f1bcaf72d8487ecd,句法 参同 李翰林 风流 依约 谢 宣城 放怀 应喜醉 三日 听曲 知 无误 一声 箬叶 露方 高 石室 桂枝 香谱度 银笙 西清东 观迟 归去 相 就 盘 跚 勃 窣 行
