id,title,author,dynasty,genre,poem_type,sentences_simplified,meter_pattern,hash,words
d796d9f6-e95f-48e9-8280-ecf9ff0c4726,余爲建陽令遣小吏王堪爲西山翁之役翁留之仙遊山房招鶴亭之上令抄道書久之若有所悟棄家不歸後六七年訪余田間敝裘跣足真爲道人矣自言欲謁翁於桐城作五詩送之  其一,劉克莊,唐,诗,七言绝句,向来刀笔充书佐 岁晚衣巾学道流 毕竟贤于人一著 醉中梦里忽回头,"7,7,7,7",4aba6d46fde1540a4060fb6494156c19,向来 刀笔 充书 佐 岁晚 衣巾 学道 流 毕竟 贤 于 人 一 著 醉 中 梦 里 忽 回头
b84b962a-5961-4178-bf97-4f475108a529,余爲建陽令遣小吏王堪爲西山翁之役翁留之仙遊山房招鶴亭之上令抄道書久之若有所悟棄家不歸後六七年訪余田間敝裘跣足真爲道人矣自言欲謁翁於桐城作五詩送之  其二,劉克莊,唐,诗,七言绝句,拂袖归来久闭关 道人剥啄访平安 要知对面刘高尚 即是翻身靖长官,"7,7,7,7",9030bcf1ad1731498f5d0ab706575207,拂袖 归来 久 闭关 道人 剥啄 访 平安 要知 对面 刘 高尚 即 是 翻身 靖 长官
9b011c5d-8368-4487-aef9-1b6358528ef5,余爲建陽令遣小吏王堪爲西山翁之役翁留之仙遊山房招鶴亭之上令抄道書久之若有所悟棄家不歸後六七年訪余田間敝裘跣足真爲道人矣自言欲謁翁於桐城作五詩送之  其三,劉克莊,唐,诗,七言绝句,去去寻师莫远寻 蓬莱何处海深深 山房幸有栖身地 且读西山夜气箴,"7,7,7,7",1b0577b21cc7e4bb7b3a76c8171730dc,去去 寻师 莫远 寻 蓬莱 何处 海 深深 山房 幸有 栖身 地 且 读 西山 夜气 箴
f6e76c03-db31-45b8-8c15-1b32a7633173,余爲建陽令遣小吏王堪爲西山翁之役翁留之仙遊山房招鶴亭之上令抄道書久之若有所悟棄家不歸後六七年訪余田間敝裘跣足真爲道人矣自言欲謁翁於桐城作五詩送之  其四,劉克莊,唐,诗,七言绝句,闻说周僊有后身 出山不为两朱轮 白云丹灶俱无恙 凭汝殷勤谢主人,"7,7,7,7",9cefa044d9b5538d70cb07bc4bc9c0f9,闻 说 周 僊 有 后 身 出山 不为 两 朱 轮 白云 丹 灶 俱 无恙 凭 汝 殷勤 谢 主人
96c47920-048b-4974-969e-e9951e44020e,余爲建陽令遣小吏王堪爲西山翁之役翁留之仙遊山房招鶴亭之上令抄道書久之若有所悟棄家不歸後六七年訪余田間敝裘跣足真爲道人矣自言欲謁翁於桐城作五詩送之  其五,劉克莊,唐,诗,七言绝句,或盘碧汉唳清宵 几载山中伴寂寥 今日鹤来翁已出 他年却恐费翁招,"7,7,7,7",49cf3aefebe79420b9544c0a7d42ba43,或 盘碧汉 唳 清宵 几载 山中 伴 寂寥 今日 鹤 来 翁 已 出 他 年 却 恐 费 翁 招
672f4fdb-4d71-49a9-bfa7-e88518838a8d,和南塘食荔歎,劉克莊,唐,诗,七言古体,君欲和诗无匆匆 唱首天下文章公 今年荔子况倍熟 亭亭锦盖高张空 猿偷鸦啄牧童采 林间残颗犹殷红 在昔唐家充岁贡 吟讽何止杜陵翁 南穷交州西蜀土 快马驮送如飞龙 绛裳冰肌初照眼 玉环一笑恩光浓 惟闽以远幸免涴 一颗不到温泉宫 自从陈紫无真本 皱玉晚出尤称雄 迩来鸡舌擅瑰玮 赞香誉味万喙同 麟台仙人亲题品 天为此果开遭逢 乃知微物似有数 声价亦与时污隆 列圣俭德被华戎 微如淮白不敢供 奈何置驿奉私室 安得木铎观民风 山蹊谷堑日力穷 血肩踠足驰筠笼 请公移此食荔叹 置在薰风殿阁中,"7,7,7,7,7,7,7,7,7,7,7,7,7,7,7,7,7,7,7,7,7,7,7,7,7,7,7,7,7,7",d3dcdfda1f1cf46487572ae8dcf32ca6,君欲 和 诗 无 匆匆 唱 首 天下 文章 公 今年 荔子况 倍 熟 亭亭 锦盖 高张 空 猿 偷鸦 啄 牧童 采 林间 残 颗 犹 殷红 在 昔 唐家充 岁贡 吟讽 何止 杜陵翁 南 穷 交州 西 蜀 土 快 马 驮 送 如 飞龙 绛裳 冰肌 初 照眼 玉环 一 笑 恩光 浓 惟 闽 以 远 幸免 涴 一颗 不到 温泉 宫 自从 陈紫 无 真本 皱 玉 晚 出 尤 称雄 迩来 鸡 舌 擅 瑰玮 赞香誉味万喙 同 麟 台 仙人 亲题 品 天 为此 果开 遭逢 乃知 微物 似 有数 声价 亦 与 时 污 隆 列圣俭 德 被 华戎 微 如 淮白 不敢 供 奈何 置 驿奉 私室 安得木 铎 观 民风 山蹊谷堑日力穷 血 肩 踠 足 驰 筠 笼 请 公移 此 食荔 叹 置 在 薰风 殿阁 中
95bd75aa-f377-45ac-8582-2dcdfe21ea0d,送真西山再鎮溫陵,劉克莊,唐,诗,七言律诗,父老香花夹路催 朱幡那忍更徘徊 弓张至此尤宜弛 珠去安知不复回 海上有艘堪致粟 洛中无篚胜生财 泉人毕竟修何福 消得西山两度来,"7,7,7,7,7,7,7,7",cf82353db8949317d586d77c7f1da4da,父老 香花 夹路 催 朱幡 那 忍 更 徘徊 弓张 至此 尤宜弛 珠 去 安知 不复 回 海上 有 艘 堪致 粟 洛中 无 篚 胜 生财 泉人 毕竟 修何福 消 得 西山 两度 来
ec52ea58-cc04-412f-b742-a92642afbc25,水仙花,劉克莊,唐,诗,七言律诗,岁华摇落物萧然 一种清芬绝可怜 不许淤泥侵皓素 全凭风露发幽妍 骚魂洒落沉湘客 玉色依稀捉月僊 却笑涪翁太脂粉 误将高雅匹婵娟,"7,7,7,7,7,7,7,7",20c3d0dd97ef80e5208e707a98c5c6bb,岁 华 摇落 物 萧然 一种 清芬 绝 可怜 不许 淤泥 侵 皓素 全 凭风 露发 幽 妍 骚魂 洒落 沉 湘 客 玉色 依稀 捉 月 僊 却 笑 涪翁 太 脂粉 误 将 高雅 匹 婵娟
1a8ae700-fb03-4131-98b9-9fafbf89ac25,葵花二首  其一,劉克莊,唐,诗,七言绝句,植物虽微性有常 人心翻覆至难量 李陵卫律阴山死 不似葵花识太阳,"7,7,7,7",8874ad30ca2972ea7a028c00c763fe6a,植物 虽 微性 有常 人心 翻覆 至 难量 李陵卫 律 阴山 死 不 似 葵花 识 太阳
a298c0e7-21e8-400a-b0d9-6f88016e4f4a,葵花二首  其二,劉克莊,唐,诗,七言绝句,下了江南奏凯回 曹公鞅鞅未忘怀 争知野老门庭冷 旌节无心忽自来,"7,7,7,7",5c28cd9af2a17c49657eaaa10f7f817e,下 了 江南 奏凯 回 曹公鞅 鞅 未 忘怀 争知 野老 门庭 冷 旌节 无心 忽 自来
9a96eaa7-17c8-40ac-a699-96419f411a08,題鄭寧文卷,劉克莊,唐,诗,七言律诗,昔侍西山讲习时 颇于函丈得精微 书如逐客犹遭绌 辞取横汾亦恐非 筝笛岂能谐雅乐 绮纨元未识深衣 嗟余老矣君方少 勤向师门扣指归,"7,7,7,7,7,7,7,7",b212b19f9c4af1cec25a1d7765aa483a,昔 侍 西山 讲习 时 颇 于 函丈 得 精微 书 如 逐客 犹 遭 绌 辞取 横汾 亦 恐非 筝 笛 岂能 谐 雅乐 绮 纨元 未 识 深 衣 嗟余 老 矣 君方少 勤向 师门 扣 指归
8d049eed-82e1-4e52-9df4-3a5c76a49994,悼阿駒七首  其一,劉克莊,唐,诗,七言绝句,吾老方期汝亢宗 爱怜不与众雏同 岂知希世千金产 止作空花赚廼翁,"7,7,7,7",c98c622d38154009be10591148ccbdab,吾 老方 期 汝亢宗 爱怜 不 与 众 雏 同 岂知 希世 千金 产 止作 空花 赚 廼 翁
1e1d354c-40d7-4542-a039-c64c4abf6878,悼阿駒七首  其二,劉克莊,唐,诗,七言绝句,长兄开卷每随声 大母繙经亦谛听 眉目分明无夭法 恐缘了了与惺惺,"7,7,7,7",6e8afaeede4f6d379b410ce0353d04c2,长兄 开卷 每 随声 大 母 繙 经 亦 谛听 眉目 分明 无夭法 恐 缘了 了 与 惺惺
72a585b3-363e-427f-b5ed-e540b886022f,悼阿駒七首  其三,劉克莊,唐,诗,七言绝句,北辙南辕有返期 吾儿掣手去何之 梦中玉雪来怀抱 愁绝邻钟唤醒时,"7,7,7,7",f05b6f4797cf74eebc0f5ce742991fce,北辙南辕 有 返期 吾 儿 掣 手 去 何之 梦中玉 雪 来 怀抱 愁绝邻钟 唤醒 时
803f9f3d-edfe-4a6a-ade0-0c9d69d27b76,悼阿駒七首  其四,劉克莊,唐,诗,七言绝句,隔日犹能唤女兄 儿于孝友殆天成 直须见汝莲花上 才得胸中一点平,"7,7,7,7",dbfc1573cfa671b2cc75c9218f9abb36,隔日 犹能 唤 女兄 儿 于孝友 殆 天成 直须 见 汝 莲花 上 才 得 胸中 一点 平
1aaf1aa3-7178-48a9-b01a-605453d5efa7,悼阿駒七首  其五,劉克莊,唐,诗,七言绝句,富贵威权得自由 收融二子杀杨修 闲人于物无恩怨 那得仓舒只么休,"7,7,7,7",eb11248999923e92416e8b070ec3b225,富贵 威权 得 自由 收融 二子 杀 杨修 闲人 于 物无 恩怨 那 得 仓 舒 只么 休
75303f68-3587-4c7a-9120-431304f3dbb3,悼阿駒七首  其六,劉克莊,唐,诗,七言绝句,眼有玄花因悼亡 观书对客两茫洋 情知泪是衰翁血 更为童乌滴数行,"7,7,7,7",413d1e0fa2768c78c959d561e46f5215,眼有 玄花 因 悼亡 观书 对 客 两茫洋 情知 泪 是 衰翁 血 更为 童乌滴 数行
c3e13350-50b6-46b5-9734-e8c45a1896bb,悼阿駒七首  其七,劉克莊,唐,诗,七言绝句,人生忧患本无涯 强取瞿聃语自排 吾母白头尤念我 吞声不敢恼慈怀,"7,7,7,7",5e437235c328c6e5cbd3587b8cc65876,人生 忧患 本 无涯 强取 瞿聃语 自排 吾 母 白头 尤 念 我 吞声 不敢 恼 慈怀
e0e9f682-aa7c-4011-b792-d18cefaada92,鄭寧示邊報走筆戲贈,劉克莊,唐,诗,七言律诗,曾客嫖姚与伏波 惯骑生马拥雕戈 金台有命终须筑 铁砚无功亦且磨 见说帛书来汝洛 又传毡帐迫淮河 只今西北多机会 吾子南归意若何,"7,7,7,7,7,7,7,7",01b7c7186988d8ced4ecb8ca04bd0eba,曾客 嫖 姚 与 伏波 惯骑 生马拥雕戈 金台 有 命 终须 筑 铁砚 无功 亦且 磨 见 说 帛书 来 汝洛 又 传 毡帐 迫 淮河 只今 西北 多 机会 吾子 南归 意 若何
142916ff-b940-4eb3-be11-380c98fe53b2,挽劉學諭,劉克莊,唐,诗,七言律诗,少游乡校至华颠 常以虀盐养浩然 科举法行无誉士 丘园礼废有遗贤 刘贲下第人称屈 李汉编文后必传 闻道诸郎皆秀孝 拂云华表看它年,"7,7,7,7,7,7,7,7",0c9d27ad6085f0d02cc3f8b71b1a3683,少游 乡校 至 华颠 常 以 虀 盐 养 浩然 科举 法行 无誉士 丘园 礼 废有 遗贤 刘贲 下 第 人称 屈 李汉 编文 后 必 传 闻道 诸郎 皆 秀 孝 拂云 华表 看 它 年
772088a6-fa1c-43b4-8150-320aee7d1ed9,送陳戶曹之官襄陽二首  其一,劉克莊,唐,诗,七言律诗,丞相曾参督府谋 郎君今复赞边筹 彼哉金谷饮长夜 去矣玉关防盛秋 尺度岂能拘快士 功名断不在中州 习池水满堤花艳 安得相陪赋远游,"7,7,7,7,7,7,7,7",85c0c6e17d81208ddb705b49bae81f1e,丞相 曾 参 督府 谋 郎君 今复赞 边 筹 彼 哉 金谷 饮 长夜 去 矣 玉 关防 盛秋 尺度 岂能 拘快 士 功名 断 不 在 中州 习 池水 满堤 花艳 安 得 相陪 赋 远游
749fe528-50d3-41e0-bb3b-0278c430c8a7,送陳戶曹之官襄陽二首  其二,劉克莊,唐,诗,七言律诗,幕府秋风事日生 参军匹马去兼程 起为楚舞何其壮 吟退胡兵在此行 且喜岘山碑有跋 不愁江表传无名 老儒那复封侯梦 止愿躬耕看太平,"7,7,7,7,7,7,7,7",7774cf40a613a59681feb2a1c3db89bb,幕府 秋风 事日 生 参军 匹马 去 兼程 起为 楚舞 何其 壮 吟退 胡兵 在 此行 且 喜 岘山 碑 有 跋 不愁 江表 传 无名 老儒 那 复 封侯 梦 止愿 躬耕 看 太平
8a085a61-cfc0-42c3-a4b6-1d478c2bdc61,旴士張季携所注三略訪西山先生既跋其書余復題二絕於卷尾  其一,劉克莊,唐,诗,七言绝句,张生快士非拘儒 袖出一编相斫书 扑虱拍蚊吾不忍 断蛇刺虎子何麤,"7,7,7,7",3e70372d85926ca9f1ba02ebb084e4d1,张生 快士 非 拘 儒 袖 出 一 编相 斫 书 扑虱 拍 蚊 吾 不忍 断蛇 刺 虎子 何 麤
725e32d2-8fc4-4b9b-b075-00edd8144dd4,旴士張季携所注三略訪西山先生既跋其書余復題二絕於卷尾  其二,劉克莊,唐,诗,七言绝句,千里从师细讲评 横渠昔亦谒高平 自从受得中庸了 止说西铭不说兵,"7,7,7,7",fb3bd9d2b7a1549b0d7658ce31ba1319,千里 从师 细 讲评 横渠 昔 亦 谒 高平 自从 受得 中庸 了 止 说 西铭 不 说 兵
f14bba58-6a49-4094-ad8d-f09e7a09601f,送湯伯紀歸番昜,劉克莊,唐,诗,七言律诗,华宗所产必人英 久见诸贤说父兄 荀氏晚添文若出 杨家又有敬之生 进堪负荷斯文责 退亦流传后世名 身老荒村无可恨 独于佳友尚关情,"7,7,7,7,7,7,7,7",a44113739c19cf3a2362de3a8d00907b,华宗 所 产必人 英 久 见诸 贤 说 父兄 荀氏 晚 添 文 若 出 杨家 又 有 敬之生 进堪 负荷 斯文 责 退 亦 流传后世 名 身 老 荒村 无 可恨 独于 佳友 尚关 情
1de4f3ae-f705-4958-b26e-cf62b9c19ebb,病後訪梅九絕  其一,劉克莊,唐,诗,七言绝句,梦得因桃数左迁 长源为柳忤当权 幸然不识桃并柳 却被梅花累十年,"7,7,7,7",f900ff9c0e22e8c3d5058dd68bc51760,梦得 因 桃数 左迁 长源 为 柳忤 当权 幸然 不识 桃 并 柳 却 被 梅花 累 十年
7bb959b7-b656-43c7-9264-8f388cba4775,病後訪梅九絕  其二,劉克莊,唐,诗,七言绝句,先生岁晚被人疑 梅畔浑无一字诗 明月清风愁并案 野花啼鸟怕随司,"7,7,7,7",80a5eb3d175f7f0cff327141d357e65e,先生 岁晚 被 人疑 梅畔浑 无 一 字 诗 明月清风 愁 并 案 野花 啼 鸟 怕 随司
39b28826-8456-4c76-ba20-03aeb4774e6f,病後訪梅九絕  其三,劉克莊,唐,诗,七言绝句,区区毛郑号精专 未必风人意果然 犬彘不吞舒亶唾 岂堪与世作诗笺,"7,7,7,7",4242916dbeb273e0fb446fe5db771872,区区 毛 郑 号 精专 未必 风人 意 果然 犬 彘 不 吞 舒 亶 唾 岂堪 与 世作 诗笺
e388b1f1-eb94-4ae0-9644-fb178e034ae4,病後訪梅九絕  其四,劉克莊,唐,诗,七言绝句,和靖林间欬嗽时 一边觅句一边饥 而今始会天公意 不惜功名只惜诗,"7,7,7,7",11df53b50c73885358e128ca14341ae0,和靖 林间 欬嗽 时 一边 觅句 一边 饥 而今 始 会 天 公意 不惜 功名 只惜 诗
0ee02ddc-e574-4f27-93ae-cba5825cd669,病後訪梅九絕  其五,劉克莊,唐,诗,七言绝句,老子无粮可御冬 强鸣饥吻和寒蛩 舍南舍北花如雪 止咽清香饱杀侬,"7,7,7,7",72e6e8f5542ecabd36f205c0a1608935,老子 无粮 可御 冬 强鸣 饥吻 和 寒 蛩 舍南 舍北 花如雪 止咽 清香 饱 杀 侬
5f43782b-f915-4f4b-8918-c0ee06fb9494,病後訪梅九絕  其六,劉克莊,唐,诗,七言绝句,与梅交绝几星霜 瞥见南枝喜欲狂 便欲佩壶携铁笛 为花痛饮百千场,"7,7,7,7",e2ae0de25bc2c94e5debabcfb326d3f3,与 梅 交绝 几星 霜 瞥见 南枝 喜欲狂 便 欲 佩 壶 携 铁笛 为 花 痛饮 百千 场
8f890a16-8256-49b2-98d1-dbf3f557281f,病後訪梅九絕  其七,劉克莊,唐,诗,七言绝句,一联半首致魁台 前有沂公后简斋 自是君诗无警策 梅花穷杀几人来,"7,7,7,7",d36a5ac7b4e224743a0f30ca5431efbc,一 联 半首 致 魁台 前 有 沂 公后 简斋 自 是 君 诗 无 警策 梅花 穷 杀 几 人 来
c046f210-3181-49e3-b032-e233bfadbe77,病後訪梅九絕  其八,劉克莊,唐,诗,七言绝句,春信分明到草庐 呼儿沽酒买溪鱼 从前弄月嘲风罪 即日金鸡已赦除,"7,7,7,7",8d7fedb511a4c27f3d064a0297990711,春信 分明 到 草庐 呼儿 沽酒 买 溪 鱼 从前 弄月嘲风 罪 即日 金鸡 已 赦除
fabbbd92-c0ac-42ae-a640-73cba4692c61,病後訪梅九絕  其九,劉克莊,唐,诗,七言绝句,菊得陶翁名愈重 莲因周子品尤尊 后来谁判梅公案 断自孤山迄后村,"7,7,7,7",cda94c6bd51169fc0c1c3656904e1402,菊 得 陶翁 名 愈 重 莲因 周子品 尤 尊 后来 谁 判 梅 公案 断 自 孤山 迄后 村
5963d225-dc30-4103-9c33-3b57327006c6,陪西山遊鼓山一首,劉克莊,唐,诗,五言古体,先生廊庙姿 非直藩翰才 南州彩旗留 北阙丹诏催 重臣方暑行 停骖小裴回 客中载枚邹 物外寻宗雷 遂穷天海观 一豁风云怀 眷言此灵山 自判宇宙来 登临几朱轮 灭没随飞埃 堂堂蔡与赵 继者其谁哉 共惟勋业侔 况乃名节偕 伊余忝载笔 适值祖帐开 虽陪叔子游 独抱湛辈哀 饯诗堪复瓿 不敢镌苍崖,"5,5,5,5,5,5,5,5,5,5,5,5,5,5,5,5,5,5,5,5,5,5,5,5",967ed3a234bd61745f165af4eaf08744,先生 廊庙 姿 非直 藩 翰 才 南州 彩旗 留 北阙丹 诏 催 重臣 方暑 行 停 骖 小 裴 回 客 中 载 枚 邹 物 外 寻宗雷 遂 穷 天海 观 一 豁 风云 怀 眷言 此 灵山 自判 宇宙 来 登临 几 朱 轮 灭 没随 飞埃 堂堂 蔡 与 赵 继者 其 谁 哉 共 惟 勋业 侔 况乃 名节 偕 伊余 忝 载 笔 适值 祖帐 开 虽 陪 叔子 游 独 抱湛 辈 哀 饯诗 堪复 瓿 不敢 镌 苍崖
ea52ad54-8d2a-4499-b08e-d81fd68ee46f,鼓山用餘干趙相韻,劉克莊,唐,诗,七言律诗,城郭区区一聚埃 江山如此信佳哉 挟龙相国骑箕去 招鹤仙人弭节来 试问炊粱成短梦 何如煨芋拨残灰 危亭更著文公扁 日落山空未忍回,"7,7,7,7,7,7,7,7",084ffce8ea0bd3d7344bad0ec1fcfe73,城郭 区区 一 聚 埃 江山 如此 信佳哉 挟 龙 相国 骑 箕 去 招鹤 仙人 弭 节来 试问 炊粱 成 短 梦 何如 煨 芋拨残灰 危亭 更 著文 公扁 日落 山空 未 忍回
72e539d1-59fa-4263-b810-8c5f3f7678c3,題真仁夫畫卷,劉克莊,唐,诗,杂言,草木黄落 水云莽苍 孤舟卸帆 冻鴈失行 昔余远游 沿漓溯湘 堠长店疎 仆痡马僵 行李萧然 有诗满囊 今其老矣 宁志四方 抚卷追思 历历不忘,"4,4,4,4,4,4,4,4,4,4,4,4,4,4",ce744fe22fa36e29ccbd5ba3a4332a83,草木 黄落 水云 莽苍 孤舟卸帆 冻 鴈 失 行 昔 余 远游 沿漓 溯 湘 堠 长 店 疎 仆 痡 马 僵 行李 萧然 有 诗 满 囊 今 其 老 矣 宁志 四方 抚 卷 追思 历历 不 忘
f311cdb3-0789-44d0-b6ca-f9b24e24c344,題龍眠十八尊者,劉克莊,唐,诗,杂言,尝闻天台境 肉身往无从 仁夫示此图 恍惚游其中 应真一一若旧识 或踞怪石临飞淙 山鬼投牒何敬恭 天女问法尤丰茸 盆鱼鬐鬛等针粟 放去夭矫拏空蒙 山深无人地祇出 被服导从侔王公 前驱鸷兽后夔魍 徐行殿以一瘦筇 巉巉苍壁谡谡松 下有老宿眉雪浓 石桥灭没云气断 似是鬼国非天宫 层冰融结挟怒瀑 毒虺喷薄含腥风 至人于此方入定 坏衲羃首枯株同 等闲一坐六十劫 汝技有尽吾无穷 书生往往谈性命 怵以祸福犹儿童 倒持手版口劝进 对此宁不面发红 我知龙眠笔外意 要与浊世针盲聋 退之云释善变幻 恺之谓画能神通 幻耶神耶两莫诘 与子持叩西山翁,"5,5,5,5,7,7,7,7,7,7,7,7,7,7,7,7,7,7,7,7,7,7,7,7,7,7,7,7,7,7,7,7,7,7",9bef54d6386e73bfead8d74ec647789a,尝闻 天台 境 肉身 往 无从 仁夫示 此 图 恍惚 游 其中 应 真 一一 若 旧识 或 踞 怪石 临飞 淙 山鬼 投牒 何敬恭 天女 问法 尤丰茸 盆 鱼 鬐 鬛 等 针 粟 放 去 夭矫 拏 空 蒙 山 深 无人 地 祇 出 被服 导从 侔 王公 前驱 鸷兽 后 夔 魍 徐行 殿 以 一 瘦 筇 巉 巉 苍 壁 谡 谡 松 下有 老宿眉 雪浓 石桥 灭 没 云气 断 似是 鬼国 非 天宫 层 冰融 结挟 怒 瀑 毒 虺 喷薄 含腥 风 至 人 于此方 入定 坏 衲 羃 首 枯株 同 等闲 一 坐 六十 劫 汝技 有 尽 吾 无穷 书生 往往 谈 性命 怵 以 祸福 犹 儿童 倒持 手 版口 劝进 对此 宁 不面 发红 我 知 龙 眠 笔 外意 要 与 浊世 针盲 聋 退 之 云 释善 变幻 恺 之 谓 画 能 神通 幻耶神 耶 两 莫诘 与 子持 叩 西山 翁
ecae36f2-c629-4756-afd5-0f2536498881,米元章有帖云老弟山林集多於眉陽集然不襲古人一句子瞻南還與之說茫然歎久之似歎渠偷也戲跋二首  其一,劉克莊,唐,诗,七言绝句,大令云亡笔不传 世无行草已千年 偶然遗下鹅群帖 生出杨风与米颠,"7,7,7,7",57c3f07f20ca8421c21ecf74ca51b2f1,大令云 亡 笔 不 传 世无 行草 已 千年 偶然 遗下 鹅群 帖 生出 杨风 与 米颠
8b3fba74-6a0b-4d6a-9a01-ecef58f2daea,米元章有帖云老弟山林集多於眉陽集然不襲古人一句子瞻南還與之說茫然歎久之似歎渠偷也戲跋二首  其二,劉克莊,唐,诗,七言绝句,二集一传一不传 可能宝晋胜坡仙 苏郎不醉常如醉 米老真颠却辨颠,"7,7,7,7",ab2cf44e4454d6df3e0e7fadf06b9409,二集 一传 一不 传 可能 宝晋胜 坡 仙 苏郎 不 醉 常如醉 米老真 颠 却 辨 颠
490808af-0645-4f8a-9ad1-c0d6e77894fa,跋周忘機畫一首,劉克莊,唐,诗,七言绝句,周郎词艺妙天下 似是诗家非画家 宁与嵇公写琴操 不为盛尹作梅花,"7,7,7,7",73c939cf7b0d33fbf04a0897abfa7961,周郎 词艺 妙 天下 似是 诗家 非 画家 宁 与 嵇公 写 琴 操 不为 盛尹 作 梅花
2dd344c7-372e-4a6c-9791-609d82e562d9,題林戶曹寒齋,劉克莊,唐,诗,七言律诗,举世争驰势利场 君于冷处看人忙 不营摩诘散花室 只设苏州听雨床 种果园林无虎守 勘书窗几有萤光 直须唤起西塘老 来向斋中伴石塘,"7,7,7,7,7,7,7,7",bf37a96032132b7ce48a2e69ee5fefdf,举世 争驰 势利 场 君 于 冷 处 看 人 忙 不营 摩诘 散花 室 只 设 苏州 听 雨 床 种果 园林 无虎守 勘 书 窗 几 有 萤光 直须 唤起 西塘 老 来 向 斋 中 伴 石塘
4de2547e-a53a-4f09-b128-151c5d358259,呈黄建州,劉克莊,唐,诗,七言律诗,当年虎穴挺身临 匹马平欺万绿林 余欲关弓常掩涕 汝能卖剑即回心 歌廉民已嗟来暮 微管吾安得至今 欲谒铃斋参嫡派 管蠡何敢测高深,"7,7,7,7,7,7,7,7",b0de1b9a9b34c2da2f8d8d869b0ec0e5,当年 虎穴 挺身 临 匹马平欺万 绿林 余 欲关弓常 掩涕 汝 能 卖 剑 即 回心 歌廉民 已 嗟来 暮 微管 吾 安 得 至今 欲 谒 铃 斋 参 嫡派 管蠡 何敢 测 高深
7c89230f-0d0b-43bc-8277-92167a1eaabe,過建陽二首  其一,劉克莊,唐,诗,七言律诗,溪上重来两鬓丝 岂知拙政久犹思 旄倪欲见叶公面 香火共存朱邑祠 争劝令君持酒琖 不容老子闭车帷 谁言俗薄今非古 我与斯民各秉彜,"7,7,7,7,7,7,7,7",9fdb9e8202e09fe5aedb6cf5c841c499,溪 上 重来 两鬓 丝 岂知 拙 政 久犹思 旄 倪 欲 见 叶公 面 香火 共存 朱邑祠 争劝 令君 持 酒 琖 不容 老子 闭车 帷 谁 言 俗 薄 今 非古 我 与 斯民 各 秉 彜
7a601272-772e-4f6e-a6ee-27072438a36f,過建陽二首  其二,劉克莊,唐,诗,七言律诗,白布裙襦雪满颠 携扶伛偻拜车前 皆言庾氏相因粟 犹是君侯不饮泉 自昔活民须有备 即今去客愧无权 愚公老矣痴如故 长把心灯望后贤,"7,7,7,7,7,7,7,7",41bfa8623fcb960ec1914cef10ffe0f7,白布 裙 襦 雪满颠 携扶 伛偻 拜 车 前 皆 言 庾氏 相 因 粟 犹 是 君侯 不 饮 泉 自 昔 活民 须 有备 即 今去 客愧 无权 愚公 老 矣 痴 如故 长 把 心灯 望 后 贤
9b835527-4a1d-4c3e-9dbe-8b9f2f68eb52,過章戴二首  其一,劉克莊,唐,诗,七言律诗,鲁叟新阡何处寻 桥边感旧独沉吟 一生欲唾奸谀面 千古难磨道义心 溪昔放鱼晴鱍鱍 门今罗爵冷涔涔 发潜頼有西山笔 何日碑成勒碧岑,"7,7,7,7,7,7,7,7",18740eb25a5af645c8e9f628abed449a,鲁叟 新阡 何处寻 桥边 感旧 独 沉吟 一生 欲 唾奸谀面 千古 难 磨 道义 心 溪 昔 放 鱼 晴 鱍 鱍 门 今 罗爵冷 涔涔 发 潜 頼 有 西山 笔 何日 碑 成勒碧岑
1a1805fb-b88b-43d3-b906-068bdd9adb62,過章戴二首  其二,劉克莊,唐,诗,七言律诗,曾向明时雪李邕 又闻名在聘贤中 忆言鸱吻施茅屋 忍见龟趺立柏宫 杯酒昔常陪贺老 只鸡终待哭乔公 情知客泪先难制 邻笛那堪咽晚风,"7,7,7,7,7,7,7,7",4e18ffcc19fd3262ec7c586f70ca71bc,曾 向 明时 雪李邕 又 闻名 在 聘 贤 中 忆言 鸱吻 施 茅屋 忍见 龟 趺 立柏宫 杯酒 昔常 陪贺 老 只 鸡终待 哭 乔公 情 知客 泪 先 难制 邻笛 那堪 咽 晚风
1e97439e-55ef-4a5a-bf59-24460c00306c,答李泉州元善,劉克莊,唐,诗,五言古体,平生陈无己 白首欠吟债 未尝交马吕 况肯见章蔡 附热生可鄙 中寒死亦快 吾方尚此友 巾车与同载 前瞻有膺滂 却顾有融泰 要当坚一壁 讵可立两界 恕乎行谊亏 希也名节坏 史君惠良箴 下走敢不拜 怀哉道义交 异彼姑息爱,"5,5,5,5,5,5,5,5,5,5,5,5,5,5,5,5,5,5",a6fe491258b681ac3748f8d3c30dad50,平生 陈 无己 白首 欠吟 债 未尝 交马 吕 况 肯见章 蔡 附热生 可鄙 中寒 死 亦 快 吾 方 尚此 友 巾 车 与 同载 前瞻 有 膺 滂 却顾 有 融泰 要 当 坚 一壁 讵 可立 两界 恕乎 行谊 亏 希 也 名节 坏 史君惠良 箴 下 走 敢 不 拜 怀哉 道义 交 异彼 姑息 爱
04f836bb-83e7-4dcb-bf64-7592398359d1,送趙信州二首  其一,劉克莊,唐,诗,七言律诗,君于朝列号名流 信在江东亦望州 保抱彼民思父母 赍咨吾辈惜交游 香凝应物吟诗榻 虹贯元章载画舟 涧上泉边今寂寞 岂无遗藁待搜求,"7,7,7,7,7,7,7,7",cc70559876dacda250295b0f8b1ad3ed,君 于 朝列号 名流 信 在 江东 亦 望 州 保抱 彼民思 父母 赍 咨 吾辈 惜 交游 香凝应物 吟诗 榻 虹贯 元章 载画 舟 涧 上 泉边 今 寂寞 岂 无遗 藁 待 搜求
c2425778-db17-474e-8486-438b12b0a752,送趙信州二首  其二,劉克莊,唐,诗,七言律诗,贫者惟言可赠行 临分握手尽交情 马于辔力穷时骇 鸥向机心动处惊 齐士岂无堪客礼 蔡人便遣作牙兵 遥知陌上罗敷女 竞看双旌出劝耕,"7,7,7,7,7,7,7,7",c7d299f76e5ef278667de91af9cf9b41,贫者 惟言 可赠 行 临分 握手 尽 交情 马 于 辔力 穷时骇 鸥 向 机 心动 处惊 齐士 岂 无堪 客礼 蔡 人 便 遣作 牙兵 遥知 陌上 罗敷 女 竞看 双 旌出 劝耕
594039a4-c05c-449f-8454-2dc7eb4b2c05,題趙子固詩卷,劉克莊,唐,诗,七言律诗,紫芝仲白俱仙去 晚秀惟君擅士林 字肖率更亲手作 诗疑贾岛后身吟 九成合奏音方备 三染为𫄸色始深 老去尤于朋友笃 未忘几研琢磨心,"7,7,7,7,7,7,7,7",0bc4f06bd3b385633995027e63dca508,紫芝 仲白 俱 仙 去 晚 秀惟君 擅 士林 字 肖率 更 亲手 作 诗 疑 贾岛 后 身吟 九成 合奏 音方备 三 染为 𫄸 色 始 深 老 去 尤于 朋友 笃 未 忘 几 研 琢磨 心
