id,title,author,dynasty,genre,poem_type,sentences_simplified,meter_pattern,hash,words
70be1311-1e92-44bf-b4ce-479a0e740337,寄怀寿光主簿四叔父,晁补之,唐,诗,杂言,我初就学首未冠 叔父不以童儿看 我今生年二十一 叔父晚作东州官 侧身西望不得见 泪下两脸何汍澜 青春白日不照贫士屋 使我四壁长年寒 六年两岁从进士 晚学扬雄识难字 贷钱乞米出都门 鼓腹吹篪入吴市 读书击剑老死终 何为古来慷慨无人知 上有九重之青天 下有百尺之黄泥 收声藏热等雷火 白杨蔓草秋风悲 生亦不可料 死亦不可量 荆山长号刖两足 何如船尾歌沧浪 我不能钩章抉句攀俊造 又不能赤鸡白狗追年少 矫首翻肠无一言 归去吴松学渔钓 主簿卑官何所施 秋来两鬓应生丝 阿宜已冠无成事 犹忆它年冬至诗,"7,7,7,7,7,7,9,7,7,7,7,7,7,9,7,7,7,7,5,5,7,7,10,10,7,7,7,7,7,7",39506094823bef2ac7abd9ac12a7c7d4,我 初 就学 首未 冠 叔父 不 以 童儿 看 我 今生 年 二十一 叔父 晚 作 东州 官 侧身 西 望 不得 见 泪 下 两 脸何汍澜 青春 白日 不照 贫士 屋 使 我 四壁 长年 寒 六年 两岁 从 进士 晚学 扬雄 识 难 字 贷钱 乞米 出 都 门 鼓腹 吹 篪 入 吴 市 读书 击剑 老死 终 何为 古来 慷慨 无人 知 上 有 九重 之 青天 下 有 百尺 之 黄泥 收声 藏 热 等 雷火 白杨 蔓草 秋风 悲 生亦 不可 料 死 亦 不可 量 荆山 长号 刖 两 足 何如 船尾 歌 沧浪 我 不能 钩 章 抉 句 攀 俊 造 又 不能 赤鸡 白狗 追 年少 矫首翻肠无一言 归去 吴松学渔 钓 主簿 卑官何所施 秋来 两鬓 应 生丝 阿宜 已 冠 无 成事 犹忆 它 年 冬至 诗
120245a6-3d5b-4b99-ba66-f171949f58f3,收麦呈王松龄秀才,晁补之,唐,诗,七言律诗,晁庄寂莫依东山 王庄负郭容往还 东山刺蓟深一尺 负郭家近饶盘餐 穿鞋戴笠随麦陇 旱日炎炎烟燎颜 贱贫辛苦事当尔 君屋鳞鳞三百间,"7,7,7,7,7,7,7,7",e30b589ff7c4437658027ce46c800b3d,晁庄寂 莫依 东山 王庄 负 郭容 往 还 东山 刺 蓟 深 一尺 负郭 家 近 饶 盘 餐 穿鞋 戴笠 随 麦陇 旱日 炎炎 烟 燎 颜 贱 贫 辛苦 事 当尔 君屋 鳞鳞 三百 间
a5a8f2e2-da07-4ee9-b3a2-95e6480c9bed,花林示杨彭年秀才,晁补之,唐,诗,七言律诗,花林远望春阳浮 卒然相值东山头 犊儿初乳毛物润 鸦子欲哺鸣声柔 一生会合尽天幸 万事反复非人谋 倒头且拟醉千日 相如渴病干咽喉,"7,7,7,7,7,7,7,7",94b5858b792f68dd05cef6f71b86862d,花林 远望 春阳 浮 卒 然 相值 东 山头 犊儿 初乳 毛 物润 鸦子 欲 哺 鸣声 柔 一生 会合 尽 天幸 万事 反复 非人 谋 倒头 且 拟醉 千日 相如 渴病 干 咽喉
cf0fdded-6527-4db6-b32a-682d53137f13,莎鸡食蝗,晁补之,唐,诗,七言古体,居贫得田不百亩 天赐时雨苗氤氲 迟明当熟晚未刈 灾蝗夜至如惊军 秋风吟茅雨洗瓦 叶上穗落青纷纷 常嫌莎鸡聒麦垅 纺车细掉喧晨昏 莎鸡可怜尔吻利 驱蝗逐蝻群披分 岂惟秋蝉畏螳斧 蝗亦为尔森跳奔 天下灾蝗凡几郡 安得尔辈盈千群 扬眉振羽如屯云 尔虽强聒谁烦闻,"7,7,7,7,7,7,7,7,7,7,7,7,7,7,7,7",fc6f9f4e99702acb453e8b8ac9f09fe9,居贫得田不 百亩 天赐 时雨苗 氤氲 迟明 当 熟 晚 未 刈 灾蝗 夜至如惊军 秋风 吟 茅雨 洗 瓦 叶上穗 落 青 纷纷 常嫌莎 鸡聒 麦 垅 纺车 细 掉 喧 晨昏 莎鸡 可怜 尔 吻 利 驱 蝗逐蝻 群 披分 岂 惟 秋蝉 畏 螳斧 蝗 亦 为 尔 森 跳 奔 天下 灾蝗 凡 几 郡 安 得 尔辈 盈 千群 扬眉 振羽 如 屯 云 尔 虽 强聒 谁 烦 闻
31e70b83-c0df-4b69-9eb0-89752851be8e,题李偁推官颐斋,晁补之,唐,诗,杂言,无舍灵龟观朵颐 自求口实君自知 谁为此者君名之 其说不烦求我诗 君家严君业夔伊 虎视眈眈雄四夷 四方是维天子毗 汶阳一室大泽陂 我往受业拜门垂 闻公一语洗然奇 我归瞠若安可追 君才固是麒麟儿 幼读父书壮思施 不卑小官乃吾师 况有内乐潜天倪 荒城无人谁过之 面城筑室兹逶迤 去年秋雨河股移 百草不生苔拥基 蚁子缘础蚓粪泥 夜眠不稳忧为池 今年闰早春气迟 墙根隙地稍可埤 初植防风种黄耆 莱州石鼎青琉璃 地罏宿火风鸣枝 对君长语清未疲 外轻内顺生理宜 问从何得聊我治 眉州夫子言可规 麻田处士术安期 今之崇丘历九疑 见人不语下臂驰 遁逃乎阴食蛤梨 君何伧囊不往随 与访汗漫还无时 还无时 我何适 北山之南南山北,"7,7,7,7,7,7,7,7,7,7,7,7,7,7,7,7,7,7,7,7,7,7,7,7,7,7,7,7,7,7,7,7,7,7,7,7,3,3,7",4428af43606555d0d9aabe768f8b22f0,无舍灵 龟观 朵颐 自 求 口实 君 自知 谁 为此 者 君名 之 其 说 不烦求 我 诗 君 家严 君业 夔 伊 虎视眈眈 雄 四夷 四方 是 维 天子 毗 汶阳 一室 大泽 陂 我 往 受业 拜门 垂 闻公一语 洗然奇 我 归 瞠若安 可 追 君才 固是 麒麟 儿 幼 读 父书 壮 思施 不卑 小官 乃 吾师 况有 内乐 潜天 倪 荒城 无人 谁 过 之 面城 筑室 兹 逶迤 去年 秋雨 河股 移 百草 不生 苔 拥 基 蚁子 缘础 蚓 粪 泥 夜 眠 不稳 忧为 池 今年 闰 早春 气 迟 墙根 隙地 稍 可 埤 初植 防风 种 黄耆 莱州 石鼎青 琉璃 地 罏 宿 火 风 鸣 枝 对 君长语 清 未 疲 外轻内顺 生理 宜 问 从 何 得 聊 我 治 眉州 夫子 言 可 规 麻田 处士 术安期 今 之 崇丘 历九疑 见 人 不语 下臂 驰 遁逃 乎 阴食 蛤梨 君 何 伧 囊 不往 随 与 访 汗漫 还 无 时 还 无 时 我何 适 北 山之南 南山 北
647c3318-e7af-44c5-bc4f-4414b11a4c47,答赵滋主簿,晁补之,唐,诗,七言律诗,我昔寻幽径山上 曾傍苕溪弄菱桨 南临天目指掌间 隔岭如闻笑言响 年来清血断征衣 碧发丹颜日夕非 便欲相期煮白石 与君晚入烟霞飞,"7,7,7,7,7,7,7,7",9365d1edd4b8aedd6d6d48962a3a43b9,我 昔 寻 幽径 山上 曾 傍 苕溪 弄 菱 桨 南临 天目 指掌 间 隔 岭 如闻笑言响 年 来 清 血 断 征衣 碧发丹 颜 日夕 非 便 欲 相期 煮 白石 与 君 晚 入 烟霞 飞
599e2166-4305-47f4-bbf9-075d29bcc77a,饮城西赠金乡宰韩宗恕,晁补之,唐,诗,杂言,大夫盘中定州盏 三举檐花舞凌乱 请君行盏且莫稽 为君起赋饮城西 城西古道如涧深 东风吹沙不见林 虚堂更觉野原阔 榆柳浩浩波涛吟 杂花一园来远道 两株江南梅更好 樱桃已晚犹烂漫 百株如雪聊可绕 常时东风无此寒 常时诸君无此闲 且看瓶口似鱼贯 莫惜面文如缬斑 大夫工为宋玉赋 思不能涯字无数 秀才酷类东野贫 白屋青山愁曲身 籍咸不肯羞北阮 主簿高材即仇览 成诗午景已妍和 罢酒花开应更多 山翁归不醉 当奈岘山何,"7,7,7,7,7,7,7,7,7,7,7,7,7,7,7,7,7,7,7,7,7,7,7,7,5,5",dda6b16ac78965c63d7b2755b3ae80a8,大夫 盘中 定州 盏 三 举檐 花舞 凌乱 请 君 行 盏 且莫 稽 为 君 起 赋 饮 城西 城西 古道 如 涧 深 东风 吹沙 不见 林 虚堂 更 觉野 原阔 榆柳 浩浩 波涛 吟 杂花 一园 来 远道 两株 江南 梅 更好 樱桃 已晚 犹 烂漫 百株 如 雪 聊 可绕 常时 东风 无此 寒 常时 诸君 无此 闲 且 看 瓶口 似 鱼贯 莫惜 面文 如 缬 斑 大夫 工为 宋玉赋 思 不能 涯 字 无数 秀才 酷类 东野 贫 白屋 青山 愁曲身 籍咸 不肯 羞 北 阮 主簿 高材 即 仇览 成诗 午景 已 妍 和 罢 酒花 开应 更 多 山翁 归不醉 当奈 岘山 何
e8c4949a-4a10-4cab-ba35-7e34e7c8ca71,答陈履常秀才谑赠,晁补之,唐,诗,七言古体,驱车触热中烦满 苦无蔗浆冻金碗 陈君诗卷可洗心 持作终朝晤言伴 男儿三十四方身 布衣不化京洛尘 白驹皎皎在空谷 黄鸟𪾢睆鸣青春 子桑之居十日雨 入门不复闻人语 形骸正是吹一吷 安用虚名齐后土 文章初不用意成 黼黻帝躬临下民 时花俚服诮新巧 牛马安所辞吾名 禹穴幽奇行可强 江北江南正相望 乘涛鼓枻何当往 爱惜水仙桃竹杖 不应越女三年留 相见还须未白头 蘧生知非苦不早 巨壑夜半遗藏舟 达人一言嚆矢疾 相从琢磨悔去日 菖蒲正是可怜花 我独闻名不曾识,"7,7,7,7,7,7,7,7,7,7,7,7,7,7,7,7,7,7,7,7,7,7,7,7,7,7,7,7",12ac21ce2418e9c043d911ecd67c8b36,驱车 触热 中 烦满 苦 无 蔗浆 冻 金碗 陈君 诗卷 可 洗心 持作 终朝 晤 言 伴 男儿 三十 四方 身 布衣 不化 京洛 尘 白驹 皎皎 在 空谷 黄鸟 𪾢 睆 鸣 青春 子桑 之 居 十日 雨 入门 不 复 闻人 语 形骸 正是 吹 一 吷 安用 虚名 齐 后土 文章 初不 用意 成 黼 黻 帝 躬临 下民 时花 俚服 诮 新巧 牛马 安所辞 吾 名 禹穴幽 奇行 可强 江北 江南 正 相望 乘涛 鼓 枻 何 当 往 爱惜 水 仙桃 竹杖 不 应越 女 三年 留 相见 还 须 未 白头 蘧 生知 非苦 不早 巨壑 夜半 遗藏舟 达人 一 言 嚆 矢 疾 相从 琢磨 悔 去日 菖蒲 正是 可怜 花 我 独 闻名 不曾 识
eba74fd6-452a-44dd-a9cd-e20a9ca3024b,和王仲甫病暑,晁补之,唐,诗,七言古体,吴邦惮暑如蜂虿 河曲还遭长日晒 蔗浆金碗頼蠲烦 内托潜阴数为败 黄昏乍快风吹发 驱拊蚊虻坐明发 青衫主簿气如云 茂陵无事悲消渴 茫洋河伯何为者 两涘无因辨牛马 何生狂梦涸归墟 喉舌汤汤未劳泻 能来一嗽华池津 七椀清风立有神 更寻齿下微妙诀 遣君体适仍魂平 案头白纸如堆雪 人事纷纷日将月 与君未遇尤四时 利害相磨生内热,"7,7,7,7,7,7,7,7,7,7,7,7,7,7,7,7,7,7,7,7",5571d567e8449296da36c7deff5548ef,吴邦 惮 暑 如 蜂 虿 河曲 还 遭长 日晒 蔗浆 金碗 頼 蠲 烦 内托 潜 阴数 为败 黄昏 乍 快 风吹 发 驱 拊 蚊 虻 坐明 发 青衫 主簿 气 如云 茂陵 无事 悲 消渴 茫 洋河 伯 何为 者 两 涘 无 因 辨 牛马 何生 狂 梦涸 归 墟 喉舌 汤汤 未 劳泻 能来 一嗽 华池 津 七 椀 清风 立 有神 更 寻 齿 下 微妙 诀 遣 君体 适仍 魂平 案头 白纸 如 堆 雪 人事 纷纷 日 将 月 与 君 未 遇 尤 四时 利害 相磨 生 内热
544fb1e6-8522-46bd-a480-c93d260ff46d,赠送澶州监酒税刘铨殿直,晁补之,唐,诗,七言古体,顿丘淇水雄朔方 官收榷算资公藏 晨朝百贩罗庭堂 望门逆鼻闻椒浆 惜哉刘子气方刚 峨冠凛凛颀而扬 丈夫有志固难量 短袖不足供倡佯 黄河七月鸣浮梁 风埃瘦马景山长 刘子何之魏北乡 悲歌弹铗邀孟尝 冯驩一语惊齐王 况如刘子足自强 读书满腹钳尔吭 酆城埋宝夜则光 士惟不用久乃彰 不见将军家平阳 遭时有用名焜煌,"7,7,7,7,7,7,7,7,7,7,7,7,7,7,7,7,7,7,7",6019d9272b3f2aa4771ae9cdd0af38cb,顿丘 淇水雄 朔方 官 收 榷 算 资公藏 晨朝 百贩 罗庭堂 望门逆鼻闻 椒 浆 惜哉 刘子 气方 刚 峨冠 凛凛 颀而扬 丈夫 有志 固难量 短袖 不足 供倡 佯 黄河 七月 鸣 浮梁 风埃 瘦马 景山 长 刘子 何之魏 北乡 悲歌 弹 铗 邀 孟尝 冯 驩 一 语 惊 齐 王 况如 刘子足 自强 读书 满腹 钳尔 吭 酆 城 埋 宝夜 则 光 士惟 不用 久 乃 彰 不见 将军 家 平阳 遭 时 有用 名 焜 煌
45d3d4bb-c436-4926-8dc2-50d489f0584f,和颜随饮酒,晁补之,唐,诗,七言古体,樊山夜涨河鸣鼓 奎火占中知溽暑 颜阖居邻胡子都 共喜夏麋登宴俎 参军河北主簿南 骑马相逢不相语 市西老屋断人居 自觉天风生广宇 青菅席坐土阶湿 黄绠汲泉塼井古 翩翩后至王将军 开口相投律呼吕 丈夫得意吐然诺 杯酒形骸安足数 露顶张颠且勿帻 起舞我能先众客 二豪礼法空是非 一斗三杯眼方白 中虚呕冷腹横𫄠 汗如槁壤朝阳蒸 咈然烦厌暂莫遏 饮蛇不省疑吞绳 豨苓卷桂导停饮 两日不咀公厨冰 长篇忽听凤皇曲 却似半岭逢孙登 君家铛勺还应洗 须我下床仍食美 西池何似汉江长 谁使蒲萄变新泚 醉捉蟹螯挛五指 吏部拍浮非在水 抱琴宁复待招邀 昨夜雨凉孤兴起 金丹定有换肠药 不用俗医论表里,"7,7,7,7,7,7,7,7,7,7,7,7,7,7,7,7,7,7,7,7,7,7,7,7,7,7,7,7,7,7,7,7,7,7,7,7",3df2cfacfa192d67fc1db623575ad1fc,樊 山夜 涨河 鸣鼓 奎 火 占 中 知 溽暑 颜 阖居邻 胡子 都 共 喜 夏 麋登宴 俎 参军 河北 主簿 南 骑马 相逢 不相语 市西 老屋 断 人居 自觉 天风生广 宇 青菅席坐 土阶湿 黄 绠 汲 泉 塼 井 古 翩翩 后 至 王将军 开口 相投 律 呼吕 丈夫 得意 吐然诺 杯酒 形骸 安 足数 露顶 张颠 且 勿 帻 起舞 我 能 先众 客 二 豪 礼法 空 是非 一斗 三杯 眼方 白 中 虚 呕冷腹横 𫄠 汗如槁壤 朝阳 蒸 咈 然 烦厌 暂莫 遏 饮蛇 不 省疑 吞绳 豨苓 卷 桂导 停饮 两日 不咀 公厨 冰 长篇 忽 听 凤皇曲 却 似半 岭 逢 孙登 君家 铛 勺 还 应洗 须 我 下床 仍 食 美 西池 何似 汉江 长 谁 使 蒲 萄 变 新 泚 醉 捉 蟹 螯 挛 五指 吏部 拍浮 非 在 水 抱 琴宁 复待 招邀 昨夜 雨凉孤 兴起 金丹 定 有换 肠药 不用 俗 医论 表里
de9f49ec-1f65-4302-b1af-e21550aebc03,压沙观梨,晁补之,唐,诗,七言古体,邺城旁缺通清沟 城南之水城中流 白沙涨陆最宜果 万梨压树当高秋 去年花开往独晚 不见琼苞肠欲断 隆冬骑马傍高原 却恨枯枝寒日短 忽然变化何处来 一夜东风吹雪满 晴川极望百畮开 三山银阙正崔嵬 杂花不容一朵间 照眼冷艳云为堆 堂中置酒对己好 千葩万蕊谁能绕 暖景氤氲一片忙 蝴蝶飞来落青草 人间浩荡看春光 岂徒田猎心发狂 向人惨澹迫归兴 落日岘山催羽觞 故园桃李春蹊没 惜哉拔去无奇术 明日重寻傥可期 暴雨流阶不能出,"7,7,7,7,7,7,7,7,7,7,7,7,7,7,7,7,7,7,7,7,7,7,7,7,7,7",170e90376e6958a26bec14e5a2d49d7b,邺 城旁 缺通 清沟 城南 之 水城 中流 白沙 涨陆 最宜 果 万 梨 压树 当 高秋 去年 花 开往 独晚 不见 琼苞肠欲断 隆冬 骑马 傍 高原 却 恨 枯枝 寒日 短 忽然 变化 何处 来 一夜 东风 吹雪 满 晴川 极 望百 畮 开 三山 银阙正 崔嵬 杂花 不容 一朵 间 照眼 冷艳 云为堆 堂 中 置酒 对 己 好 千葩 万蕊 谁 能 绕 暖景 氤氲 一片 忙 蝴蝶 飞来 落 青草 人间 浩荡 看 春光 岂 徒 田猎 心 发狂 向 人 惨 澹迫 归兴 落日 岘山 催 羽觞 故园 桃李 春蹊没 惜哉 拔 去 无 奇术 明日 重寻傥 可期 暴雨 流阶 不能 出
0fba0185-a768-4f62-88c0-3d5d96dcaa9f,过金堤刘景文,晁补之,唐,诗,七言古体,云间高堞如云白 草下深濠如草碧 逶迤陇断出平堤 前见黄河如带直 官居乃在城西原 荒台古木乌鸟翻 美人芳气如秋菊 坐令晔晔弃中园 不忧泑泽豪不杀 夜识汉中龟鼈在 借须走马候水曹 后时此会何由再 霸陵往来初避名 执贾不回人更惊 无心踯躅路寝养 服车安用仍一鸣 未若捧甖何不可 二豪螟蛉与蜾臝 况闻举案良亦贤 那爱五花论酒钱 不然憭栗坐岁晚 风入衰柳催寒蝉 我论李君其趣独 自喻愚公徙王屋 是中聊可外形骸 官闲方辔相与来,"7,7,7,7,7,7,7,7,7,7,7,7,7,7,7,7,7,7,7,7,7,7,7,7,7,7",9b17f12542f8c9e3f46e90c5340c0fc1,云间 高 堞 如云 白 草 下 深 濠 如 草 碧 逶迤 陇 断出 平堤 前见 黄河 如 带 直 官居乃 在 城西 原 荒台 古木 乌鸟 翻 美 人 芳气 如秋 菊 坐 令 晔 晔 弃 中园 不 忧 泑 泽 豪 不 杀 夜识 汉中 龟 鼈 在 借须 走马 候水 曹 后时 此会何 由再 霸陵 往来 初 避名 执 贾 不 回 人 更 惊 无心 踯躅 路 寝养 服车 安用 仍 一鸣 未 若 捧 甖 何不 可 二 豪 螟蛉 与 蜾臝 况闻 举案良亦贤 那 爱 五花 论 酒钱 不然 憭 栗 坐 岁晚 风入 衰 柳 催 寒蝉 我 论 李君其 趣 独 自喻 愚公 徙 王屋 是 中 聊 可外 形骸 官 闲方 辔 相与 来
0b872b10-86e1-4b40-8fce-69ba475e8ca7,送赵燮,晁补之,唐,诗,七言律诗,赵侯慷慨诸公客 少日论兵今发白 自言颇似鞲上鹰 老得一州聊铩翮 送行谁复双眼青 断肠红颊倾渌醽 停歌自解水苍佩 醉骑紫燕黄河冰,"7,7,7,7,7,7,7,7",4ff27cdac29bbfe35b49c7ffffadbb96,赵侯 慷慨 诸公 客 少日 论兵 今 发白 自言 颇似 鞲 上 鹰 老 得 一 州 聊 铩 翮 送行 谁 复 双眼 青 断肠 红颊 倾 渌 醽 停歌 自解 水 苍佩 醉 骑 紫燕 黄河 冰
3d48bad7-b507-4a9b-ac59-8311f8c1b2d3,送石梁赴举,晁补之,唐,诗,七言律诗,鹤知半夜鸡知旦 岁晚淹留客心乱 功名识时贵及早 不忍饭牛衣至骭 家居负米有季弟 能视明星弋凫雁 男儿业就可以行 桃李荣时腰绶灿,"7,7,7,7,7,7,7,7",763dbe8cc5b65edd16b801f5da340373,鹤 知 半夜 鸡知旦 岁晚 淹留 客心 乱 功名 识 时 贵 及早 不忍 饭 牛 衣 至 骭 家居 负米 有 季弟 能视 明星 弋 凫雁 男儿 业 就 可以 行 桃李 荣 时 腰 绶 灿
67aeff8a-0ca8-43c9-8b5f-c51fdd15d330,送张缗子望太常簿,晁补之,唐,诗,七言古体,张侯于我丈人行 十年江湖心乡往 平生独立白雪曲 少时妙誉青云上 胡为四十尚飘蓬 逢衣骑马邺城中 将军宝帐簪履肃 开府画筵箫鼓雄 况复儒宫饱闲暇 堂有丛书竹萧洒 论文不厌夜经过 起看北斗插黄河 相逢安得怨寂莫 仲宣楼头良可乐 何当奇计出番禺 未应长檄开邛筰 太常句稽亦不冗 少卿淑问清时重 俎豆之事则尝闻 男儿读书业有用 归去天边道路长 东风春草满池塘 美人不来时晼晚 谁与玩此林间芳,"7,7,7,7,7,7,7,7,7,7,7,7,7,7,7,7,7,7,7,7,7,7,7,7",26e40a8a14cd86b68e9399c6f25b7fd2,张侯 于 我 丈人 行 十年 江湖 心乡 往 平生 独立 白雪 曲 少时 妙誉 青云 上 胡为 四十 尚 飘蓬 逢 衣 骑马 邺 城中 将军 宝 帐簪 履肃 开府 画 筵箫 鼓雄 况复儒 宫 饱 闲暇 堂 有 丛书 竹 萧洒 论文 不厌 夜 经过 起看 北斗 插 黄河 相逢 安 得 怨寂莫 仲宣 楼头 良 可乐 何 当 奇计 出 番禺 未 应长 檄开 邛 筰 太常 句 稽 亦 不冗 少 卿 淑 问清 时重 俎 豆 之 事 则 尝 闻 男儿 读书 业 有用 归去 天边 道路 长 东风 春草 满 池塘 美 人 不 来时 晼 晚 谁 与 玩 此 林间 芳
9aedb871-4b38-46be-87d6-703c2c887276,郑彦能求拟江亭诗,晁补之,唐,诗,七言古体,亭下流泉三亩隘 谁拟西江晴一派 桃李佳名闻昔人 此言虽小可喻大 宁非逐楚憔悴身 当是羊裘傲汉人 避世墙东王君公 五经纷纶井大春 端然养鱼废车马 一身环堵观天下 吾人郑子诗句新 高堂素壁开萧洒 何当湛湛见青枫 白苹落日慰相逢 一亭两槛更何有 波涛风雨船前后 莫忆乘槎犯汉津 莫忆楼船下石城 尽醉渔阳无好曲 短蓑铜斗平生足,"7,7,7,7,7,7,7,7,7,7,7,7,7,7,7,7,7,7,7,7",7587f2a6d2e1334655d93f4bcd7091da,亭 下 流泉 三亩 隘 谁 拟 西江 晴 一派 桃李 佳 名闻 昔人 此言 虽 小可 喻大 宁非 逐 楚 憔悴 身 当 是 羊 裘傲 汉人 避世墙东 王君公 五经 纷纶 井大春 端然 养鱼 废 车马 一身 环堵 观 天下 吾人 郑子 诗句 新 高堂 素壁 开 萧洒 何当湛 湛见青 枫 白 苹 落日 慰 相逢 一 亭 两槛 更 何有 波涛 风雨 船 前后 莫忆 乘 槎 犯 汉津 莫忆 楼船 下 石城 尽 醉 渔阳 无好 曲 短 蓑铜 斗 平生 足
ae601865-a2ec-49f2-b718-25a10a283380,赠杨景平,晁补之,唐,诗,杂言,君不见华阴杨君汉孔子 君生其后无乃似 平居恐惧西北隅 力行发愤尚不媿 君今鸣橹下长淮 眼明清晓三楚开 扬州行矣勿濡滞 江南细雨收黄梅 我今正是鸟折翼 肺病三年广文直 昔时黄帽榜舟人 却向西湖当不识 寄声关子老渔樵 小山桂树不须招 乘槎东海未敢必 欲去天台观石桥,"10,7,7,7,7,7,7,7,7,7,7,7,7,7,7,7",bc4b95f0b192db038eaed11cb3a02cce,君不见 华阴 杨君汉 孔子 君生 其后 无 乃似 平居 恐惧 西北 隅 力行 发愤 尚 不 媿 君 今 鸣 橹 下 长淮 眼 明清 晓三楚 开 扬州 行 矣 勿 濡 滞 江南 细雨 收 黄梅 我 今 正是 鸟折翼 肺病 三年 广文直 昔时 黄帽 榜 舟 人 却 向 西湖 当 不识 寄声 关子 老 渔樵 小山 桂树 不须 招 乘 槎 东海 未敢 必 欲 去 天台 观 石桥
59993e5c-2efa-4d46-80b4-130fd964ab28,送吴黯赴阙,晁补之,唐,诗,七言古体,我初官此君未来 君今去此我未往 翻飞岂不慕缅邈 留滞何能悲鞅掌 学道平生昧蹊径 半世端如走榛莽 古人曾病田甫田 切磋安可去吾党 东风消雪送鸿雁 南国连山生筿簜 为当归梦五湖中 会有高名百寮上,"7,7,7,7,7,7,7,7,7,7,7,7",5ef90987d1bf9f8222aaca1d9081010b,我 初官 此君 未来 君 今去 此 我 未往 翻飞 岂 不慕 缅 邈 留滞 何能悲鞅 掌 学 道 平生 昧 蹊径 半世 端 如 走 榛莽 古人 曾病 田甫田 切磋 安 可去 吾 党 东风 消雪 送 鸿雁 南国 连山 生 筿 簜 为 当归 梦 五 湖中 会 有 高 名 百 寮 上
f7a8e881-7688-4b08-bcc5-696e5d8f8cc0,送陈逸之筠州,晁补之,唐,诗,七言古体,居贫百草春靃靡 制作舞雩春服美 爱君欲赠华韡韡 思君何处无芳卉 三年眼花祇欲眠 惊梦往往音跫然 单金安所用吾技 术成正复迁刘累 不狩何由有貆特 钱镈须勤晚方积 呻吟裘氏日已多 恩流三族功比河 告行风雨春物空 催花作果黍芃芃 亦从梁汴即清颍 湛湛已见江头枫 严君被命分符虎 昔者无襦今五袴 未劳负米迂山川 姑弟酒中从圣贤,"7,7,7,7,7,7,7,7,7,7,7,7,7,7,7,7,7,7,7,7",6b150121b29e8444c3aafa8410f8c4a4,居贫 百草 春 靃 靡 制作 舞雩 春服 美 爱君 欲 赠 华 韡 韡 思君 何处 无芳卉 三年 眼花 祇 欲 眠 惊梦 往往 音 跫 然 单 金安 所用 吾 技 术 成 正 复迁 刘累 不狩 何由 有 貆 特 钱 镈 须 勤 晚 方积 呻吟 裘氏 日 已多 恩流三族功比河 告行 风雨 春物 空 催花 作果 黍 芃 芃 亦 从 梁汴 即 清 颍 湛湛 已 见 江头 枫 严君 被 命分 符虎 昔者 无 襦 今 五袴 未 劳 负米 迂 山川 姑弟 酒 中 从 圣贤
f296fc98-eec6-4afa-aa4e-139ca2d6333f,过刘季孙,晁补之,唐,诗,七言古体,刘侯岁覆春堤料 居不曾闲须我劳 未嫌清浊各有携 匪报琼瑶以为好 吏诃单绞自可更 儿笑接䍠从复倒 为怜徒步此青袍 重忆归来著黄帽 官忙未向林野疏 时清不废诗书傲 梨花如雪许重寻 秋实垂墙晚方到,"7,7,7,7,7,7,7,7,7,7,7,7",36051e07f72325c939d4f72e004794fb,刘侯 岁 覆 春 堤料 居 不曾 闲须 我 劳 未 嫌 清浊 各 有 携 匪报 琼瑶 以为 好 吏 诃 单 绞自可更 儿 笑 接 䍠 从 复倒 为怜 徒步 此 青袍 重忆 归来 著 黄帽 官 忙 未 向 林野疏 时 清 不 废 诗书 傲 梨 花如雪 许重 寻 秋实 垂墙 晚方 到
8ddfcb91-0d5a-40e5-8e72-0026ca5e5112,赠段万顷,晁补之,唐,诗,七言古体,美人窈窕家南国 可与副笄亲黍稷 平生寂莫凤将雏 惭愧木桃犹报璧 石城三桨为谁催 万里清江凌不测 王门酒肉傲胜诡 岂有邹阳仍下客 危词欲洗大夫冤 千载独怀吾祖贤 不量腹小文籍博 颇似井蜺轻饮川 丈夫趣舍无南北 情亲非为墙屋连 子真正用卧谷口 乃有高名諠日边 胸中傀磊契何所 自笑柴愚得参鲁 借令好问忘足茧 狐腋岂堪黄犬补 吾身栎社真寄耳 趣取无用安足数 无心俎几彘盘辱 拳曲不羞人厌睹 土山出火石为融 羲和当午车隆隆 通渠束带过者寡 乃独葛巾终日同 倾囷倒廪用饷我 我为牙羽陈编钟 蝉声入耳廪节改 别我整骖无愧容,"7,7,7,7,7,7,7,7,7,7,7,7,7,7,7,7,7,7,7,7,7,7,7,7,7,7,7,7,7,7,7,7",5c773c39681124dec9c8ceb17698ddc4,美 人 窈窕 家 南国 可 与 副 笄 亲 黍 稷 平生 寂 莫凤 将 雏 惭愧 木桃 犹报璧 石城 三 桨 为 谁 催 万里 清江 凌 不测 王门 酒肉 傲胜诡 岂 有 邹阳 仍 下客 危词 欲 洗 大夫 冤 千载 独怀吾 祖贤 不量 腹小 文籍 博 颇似 井 蜺 轻 饮 川 丈夫 趣舍 无 南北 情亲 非为 墙屋 连 子 真正 用 卧 谷口 乃 有 高 名 諠 日 边 胸中 傀磊 契 何 所 自 笑 柴愚 得 参 鲁 借令 好 问 忘 足茧 狐 腋 岂堪黄犬补 吾 身 栎 社 真 寄 耳 趣 取 无用 安 足数 无心 俎 几 彘 盘 辱 拳曲 不羞人厌睹 土山 出 火石 为 融 羲 和 当午 车 隆隆 通渠 束带 过者 寡 乃 独 葛巾 终日 同 倾 囷 倒 廪 用饷 我 我 为 牙 羽 陈 编钟 蝉声 入耳 廪 节 改 别我 整 骖 无愧 容
1f553ade-ce32-42f0-9dba-1e8b3b015353,次韵鲁直谢李右丞送茶,晁补之,唐,诗,七言古体,都城米贵斗论璧 长饥茗椀无从识 道和何暇索槟榔 惭愧云龙羞肉食 壑源万畮不作栏 上春伐鼓惊山颜 题封进御官有局 夜行初不更驿宿 冰融太液俱未知 寒食新苞随赐烛 建安一水去两水 易较岂如泾与渭 右丞分送天上余 我试比方良有似 月团清润珍豢羊 葵花琐细胃与肠 可怜赋罢群玉晚 宁忆睡余双井香 大胜胶西苏太守 茶汤不美夸薄酒,"7,7,7,7,7,7,7,7,7,7,7,7,7,7,7,7,7,7,7,7",a9d4605c5d43de37f7ffc7e7cc16ac56,都城 米贵斗 论璧 长 饥 茗 椀 无从 识 道 和 何暇 索 槟榔 惭愧 云龙 羞 肉食 壑 源万 畮 不 作 栏 上 春伐鼓惊山颜 题封 进御 官有局 夜行 初 不 更 驿宿 冰融 太液 俱 未知 寒食 新 苞 随 赐 烛 建安 一 水 去 两 水 易 较 岂 如 泾与渭 右丞 分送 天上 余 我 试 比方 良有 似 月团 清润 珍 豢 羊 葵花 琐细 胃 与 肠 可怜 赋 罢 群 玉 晚 宁忆 睡 余双 井 香 大胜 胶西 苏 太守 茶汤 不美 夸 薄酒
