id,title,author,dynasty,genre,poem_type,sentences_simplified,meter_pattern,hash,words
705d5f6d-b075-41e3-a4d6-8d5075b6e5dc,桂隠纪咏 俯巢轩,张镃,唐,诗,五言绝句,化国舒长日 林隈分外知 年年庭荫匝 数遍鹊寻儿,"5,5,5,5",fccd7c92874e8e05721ef2a98919ac93,化国 舒长 日 林 隈 分外 知 年 年 庭 荫 匝 数遍 鹊 寻儿
cd905602-b51f-4e12-a2ab-a397f75c602f,桂隠纪咏 书叶轩,张镃,唐,诗,五言绝句,抛絮轻于柳 栖禽不待凰 题诗非胜纸 留咏托枝凉,"5,5,5,5",9db74394ef2b7fd2e447ca93b017f7c5,抛 絮 轻 于 柳 栖 禽 不 待 凰 题诗 非 胜纸 留咏 托枝凉
bd543b20-5e91-4dec-b746-ff078cb84cf8,桂隠纪咏 静赏亭,张镃,唐,诗,五言绝句,皂隷百轻肥 金朱弹丸箧 君方踞胡床 风掀缃册叶,"5,5,5,5",fba553bc1a255f3b1401cddcf2aaa919,皂隷 百 轻 肥 金朱 弹丸 箧 君方 踞 胡床 风 掀 缃 册叶
998da26f-a500-45af-87aa-73b0f8569a94,桂隠纪咏 拥山亭,张镃,唐,诗,五言绝句,揜抱复回环 亭居紫翠间 思量天下物 谁更好如山,"5,5,5,5",7ee9ce21458ce954570247560d3ccc4a,揜 抱 复 回环 亭 居紫翠 间 思量 天下 物 谁 更好 如 山
eece7f5c-1520-4ed2-81f1-7f5207bcdd1c,桂隠纪咏 抚鹤亭,张镃,唐,诗,五言绝句,立缟芳桂阴 置汝固已当 他年莫姓丁 止厕子姪行,"5,5,5,5",ad89df68aada473dbf6dd8ba04e0d1f5,立 缟 芳 桂阴 置 汝固 已当 他 年 莫姓丁 止 厕 子 姪 行
5a867a30-902f-43dc-bb55-b15787c92b35,桂隠纪咏 俯镜亭,张镃,唐,诗,五言绝句,唤作大圆镜 波文从此生 何妨云影杂 榜样自天成,"5,5,5,5",860463356e68521c3a4089a6fed2e61d,唤作 大圆 镜 波文 从此 生 何妨 云影 杂 榜样 自 天成
89c2c84f-0f3a-431a-b539-4cc003065ba8,桂隠纪咏 依绿亭,张镃,唐,诗,五言绝句,月出烟暝时 水调谁家唱 短櫂欲相寻 先经此亭上,"5,5,5,5",dec62be18ca434e4153793f7cc98d563,月 出 烟 暝 时 水调 谁家 唱 短 櫂 欲 相 寻 先经 此 亭 上
93c065ef-632b-4e21-8bd8-8a27e83e1d30,桂隠纪咏 云外亭,张镃,唐,诗,五言绝句,芒屦方疑湿 天晴迳又干 由来云在下 木杪是栏干,"5,5,5,5",94026611de8b7e18f372bd5d1fe8dc41,芒 屦 方疑 湿 天晴 迳 又 干 由来云 在 下 木杪 是 栏干
b143957b-5c96-47d7-912a-18511e7931ca,桂隠纪咏 沙际亭,张镃,唐,诗,五言绝句,小檝轻撶去 无人伴此翁 午烟青一点 鱼虎出深丛,"5,5,5,5",84c0be58ca1f014f610e23600eb88254,小 檝 轻 撶 去 无人 伴 此 翁 午 烟青 一点 鱼虎 出 深 丛
049b1fe5-2a43-483e-a08e-332ccfa400f8,桂隠纪咏 鲈乡亭,张镃,唐,诗,五言绝句,溪叟挈笭箵 曾来候此亭 未知余不杀 刚要著鱼经,"5,5,5,5",5708c649ad5e99a0e2c7433b46b8ee53,溪 叟 挈 笭 箵 曾来候 此 亭 未知 余 不 杀 刚要 著鱼 经
57e9ec65-f6ba-4654-aa53-b4c98f228347,桂隠纪咏 摘霞亭,张镃,唐,诗,五言绝句,一片吹来锦 人言是杏花 倚栏堪把玩 胜似日边霞,"5,5,5,5",96da431186fdfc7d9371aeebbb5a05ab,一片 吹来 锦 人言 是 杏花 倚栏 堪 把玩 胜似 日边霞
2f86f83f-3ede-4041-841d-db47c93aece0,桂隠纪咏 琼莩亭,张镃,唐,诗,五言绝句,莫羡海棠色 听言著子时 骊珠千万颗 撒向嫩桑枝,"5,5,5,5",a25322c79bb15c81989fed47154eadbe,莫羡 海棠 色 听言 著子 时 骊珠 千万颗 撒向 嫩桑枝
5c7db32e-2a74-423b-af24-09567d84337d,桂隠纪咏 粲金亭,张镃,唐,诗,五言绝句,柘弹黄金子 谁将满树装 珍禽来往惯 风落不惊忙,"5,5,5,5",8c4e8c527a15aa7a3a5066fb023323b6,柘 弹 黄金 子 谁 将 满 树装 珍禽 来往 惯 风落不惊忙
d0080534-848e-440a-a84c-19bc37faad53,桂隠纪咏 满霜亭,张镃,唐,诗,五言绝句,疑驾洞庭帆 累累看绕山 花时芳气洁 伯仲素馨间,"5,5,5,5",5c22453b4a1db8032913f9ee58cd2ac8,疑驾 洞庭 帆 累累 看绕 山 花时芳 气洁 伯仲 素 馨 间
422ac071-3a94-4001-9b59-4981db51897a,桂隠纪咏 听鶑亭,张镃,唐,诗,五言绝句,不向他园去 能来共竹林 故乡知我念 特地奏秦音,"5,5,5,5",e9b1c5d08fafb6b91f03762de65e995e,不 向 他 园 去 能来 共 竹林 故乡 知 我 念 特地 奏 秦音
92911884-4f14-407a-a317-09192451f2bb,桂隠纪咏 松桥,张镃,唐,诗,五言绝句,欲向松间去 梅西竹坞穿 莫言吟兴在 风雪灞桥边,"5,5,5,5",a8c5b0f6ea2271de27bbabadae978f2a,欲 向 松间 去 梅西竹 坞 穿 莫言 吟兴 在 风雪 灞 桥边
4626052d-7d5c-44dd-877d-3a334c735e46,桂隠纪咏 竹桥,张镃,唐,诗,五言绝句,新篁故蒙丛 恶草刚荟翳 删薙似少恩 成渠玉无际,"5,5,5,5",90135e2783705da0619d9ee1f80039dd,新篁 故 蒙丛 恶草 刚 荟翳 删 薙 似 少 恩 成渠玉 无际
25d89d10-9ea2-4652-9095-a0e07c35a494,桂隠纪咏 柳桥,张镃,唐,诗,五言绝句,初因桥种柳 却用柳名桥 桂隠从兹入 春风莫浪招,"5,5,5,5",4a4e9129bbb63a0c1953452d6f7eb5a1,初因桥 种 柳 却 用 柳名桥 桂 隠 从 兹 入 春风 莫浪 招
9059a579-a973-4559-9725-ddb0e9a31fb2,桂隠纪咏 平桥,张镃,唐,诗,五言绝句,桥向平边度 风从阔处来 泠然旬五日 无去亦无回,"5,5,5,5",27b5dd45cb9cb7bbf081c6d49f25e000,桥 向 平 边度 风从阔 处来 泠然 旬 五日 无去 亦 无 回
8ad71f2a-2f4c-4bb7-806e-14844426486d,桂隠纪咏 兴远桥,张镃,唐,诗,五言绝句,窈窕或崎岖 不是邯郸步 因来此凭栏 又送孤鸿去,"5,5,5,5",f1b9cfb282e33eb1b6f588ce6fe93a87,窈窕 或 崎岖 不是 邯郸 步 因来此 凭栏 又 送 孤鸿 去
11cc6f49-3ceb-4069-83d1-a6efd5337be7,桂隠纪咏 归喜桥,张镃,唐,诗,五言绝句,半岁吏尘役 天书教放归 思量难报称 安稳饭和衣,"5,5,5,5",ec70e96255301e4f9bb25e3c19992a2d,半岁 吏 尘 役 天书 教 放归 思量 难 报称 安稳 饭 和 衣
6c205faa-03fe-4797-a20e-2d5e413f698a,桂隠纪咏 静乐庐,张镃,唐,诗,五言绝句,城市非无地 如何此结庐 一家耽静乐 两个水边居,"5,5,5,5",0164bca9dc45ea66e62494006a0e45cf,城市 非 无地 如何 此 结庐 一家 耽 静乐 两个 水边 居
1e0fca5b-a9ed-4bd7-b9f1-2b2970156d0e,桂隠纪咏 心足寮,张镃,唐,诗,五言绝句,闻道华胥国 依稀似醉乡 近来参得透 睡稳不因床,"5,5,5,5",8454521adf3bbc9ab80122c2dc371a39,闻道华 胥国 依稀 似 醉乡 近来 参得 透 睡稳 不 因 床
9a2124a3-6923-467c-90d1-025097aa91bb,桂隠纪咏 茂光台,张镃,唐,诗,五言绝句,风日清美时 月露澄爽际 能来此徜徉 扫除闻见翳,"5,5,5,5",d22d2fc7796bf1be37baf7a8aeadf3b5,风日 清美 时 月 露 澄爽际 能来 此 徜徉 扫除 闻见 翳
08400ec1-30e2-4dfd-8756-578529bcf239,桂隠纪咏 安乐泉,张镃,唐,诗,五言绝句,潜通大壑水 一杯千虑散 只因都放下 如熟病得汗,"5,5,5,5",adc5987327c330f478b2131804856d61,潜通 大壑 水 一杯 千虑散 只 因 都 放下 如 熟病 得 汗
836b5c05-c51b-4f3e-8f97-584f5ebdea19,桂隠纪咏 鹊泉,张镃,唐,诗,五言绝句,鹊饮树底泉 人立石边路 相亲不相疑 所性平等故,"5,5,5,5",6c45efc53ddc55c4e657025cbdf2e594,鹊 饮 树底泉 人立石 边路 相亲 不 相疑 所性 平等 故
46d2487f-7230-4c54-811b-22eb937d4b4a,桂隠纪咏 樵迳,张镃,唐,诗,五言绝句,路入前山处 苍苔裹石棱 不逢负薪叟 时见隔林僧,"5,5,5,5",f8a77a5578a33a6054e1f5d9767e5e84,路入 前山 处 苍苔 裹 石 棱 不逢 负薪 叟 时 见 隔 林僧
cb24c44e-9290-4e4f-94fd-d6076342b8e8,桂隠纪咏 霞川,张镃,唐,诗,五言绝句,方舟卧看化 丹霞二三里 穷眼谢玄晖 休言余散绮,"5,5,5,5",a119dde959f84245f9525545e49a4d08,方舟 卧 看化 丹霞 二三里 穷 眼 谢玄晖 休言 余散绮
a4a9085f-a47e-46ff-ab16-9bb600b010c3,桂隠纪咏 檥苹舟,张镃,唐,诗,五言绝句,玉立蜻蜓小 香欺漫港秋 百年清绝意 孤棹抵封侯,"5,5,5,5",dae20fa9bc25c23de958c88646af9e93,玉立 蜻蜓 小 香 欺漫 港秋 百年 清 绝意 孤 棹 抵 封侯
5bfa77b3-a764-4112-8205-b0a920945586,戏答客问,张镃,唐,诗,五言绝句,桂隠芙蓉盛 柴门日日开 若无诗与酒 不请看花来,"5,5,5,5",f21aa5352c5464a1f2aadf443ed5b563,桂 隠 芙蓉 盛 柴门 日日 开 若 无 诗 与 酒 不 请 看 花 来
37d46552-c397-4eea-a6f8-babca3a3cae7,题松身,张镃,唐,诗,五言绝句,不见蛰根时 唯喜苍阴覆 借汝叶间声 当我风信句,"5,5,5,5",b7cf49a40a4630a1ec4e2ca3baa0577a,不见 蛰根 时 唯喜苍 阴覆 借 汝 叶间 声 当 我 风信 句
70326238-90f2-4ddf-a285-9c1f1c80c1ce,前后植木犀楼上有月台尽见诸山,张镃,唐,诗,五言绝句,盛世适亲逢 楼台得地雄 无形兼有象 俱在太和中,"5,5,5,5",1e90ffd309f06e3e1bb5e0ef79fa7940,盛世 适亲 逢 楼台 得 地雄 无形 兼有 象 俱 在 太和 中
2d357f63-c667-44f4-9712-92cc4239cc16,登春陌,张镃,唐,诗,五言绝句,花柳燄通津 幽居日日春 门前往来者 同是华封人,"5,5,5,5",45f6b8d5dc61304c6b57f7b34f6d14af,花柳 燄 通 津 幽居 日日春 门前 往来 者 同是 华封 人
9bbe7e1b-8069-43a3-846e-fddb0597d0e8,香玉花,张镃,唐,诗,五言绝句,髣髴是荼䕷 金沙著白衣 香于佛见笑 大似野蔷薇,"5,5,5,5",02e043bceb6247cf5ca777d39d4f5892,髣髴是荼 䕷 金沙 著 白衣 香于佛 见笑 大 似 野蔷薇
add27351-786b-44f8-8214-7a52b72d80c2,题水墨画水仙木犀  其一,张镃,唐,诗,五言绝句,翠袖擎金盏 香风动宝车 几间莫轻觑 故故薄云遮,"5,5,5,5",fafe57db049fa326a0e2b731f36d05cd,翠袖擎 金盏 香 风动 宝车 几间 莫轻觑 故故 薄 云遮
aafbe64e-5fd9-41ec-b54d-f0d1198433d8,题水墨画水仙木犀  其二,张镃,唐,诗,五言绝句,昔年风露乡 裙破鬰金黄 别来参祖意 坏色染衣裳,"5,5,5,5",10c8690f4125db0ba9f9439e2a7fcbac,昔年 风露乡 裙 破 鬰 金黄 别 来 参祖 意 坏色 染 衣裳
3ea2a34e-4d86-4f15-ae2f-0aa07dcc14a9,题瑞香花扇,张镃,唐,诗,五言绝句,梦里谁曾见 香篝紫绣蒙 枝间两飞蝶 我共漆园翁,"5,5,5,5",a223cbf5c65136776431e79182808cd6,梦 里 谁 曾 见 香 篝紫绣 蒙 枝间 两 飞蝶 我 共 漆园 翁
b44f8d75-be43-4f95-a93f-f562d111e7e9,泛星槎,张镃,唐,诗,五言绝句,鼻祖寻河源 织女喜停机 我不愿上天 湖中亦忘归,"5,5,5,5",34275f40858f4330edd4ad66b375ae33,鼻祖 寻 河源 织女 喜 停机 我 不 愿 上天 湖中 亦 忘归
259b98c9-08a6-42ea-b664-e7128a91e996,题平甫弟梁溪庄园,张镃,唐,诗,五言绝句,两字虽差远 花繁好作名 假饶千万偈 难状尔多情,"5,5,5,5",f352caf7966c13ec0aa5b616f1deb42e,两 字 虽 差远 花 繁好 作名 假 饶 千万 偈 难 状 尔 多情
5dd99fd5-5c70-484d-9c4b-83befa58d490,茶谷闲步,张镃,唐,诗,五言绝句,自携折脚铛 煮芽仍带叶 客至请渠尝 俗尘消旷劫,"5,5,5,5",4dc2e9e86d0f005bb82ba02bb5f34fa0,自携折脚铛 煮 芽 仍 带 叶 客 至 请 渠 尝 俗尘消 旷劫
80dd0d16-00d5-49ac-bad7-a4e938e31135,涧西闲泛,张镃,唐,诗,五言绝句,曲曲通航小 兰桡手自移 映丛怜白鹭 特地过湾迟,"5,5,5,5",e7e9b32a8af0cdbb8457d63e637e50f1,曲曲 通航 小 兰 桡手 自移 映 丛怜 白鹭 特地 过湾 迟
2cb57ded-78c3-4eee-9225-05cfe24adbe9,同王梦得夜坐,张镃,唐,诗,五言绝句,何处起香云 清谈我与君 雨来临水坐 鱼跃隔窗闻,"5,5,5,5",d67e83639fd00cba080b5bbd34ba33a9,何处 起 香云 清谈 我 与 君 雨 来临 水 坐 鱼跃 隔 窗闻
260e3195-c36e-4fe5-95cc-f352ba339d4a,晚兴,张镃,唐,诗,五言绝句,江汉旧名侯 飘萧发未秋 时荣那似此 天地入诗游,"5,5,5,5",c6123e1496c11ba9d9c633a49948030a,江汉 旧 名侯 飘萧 发 未秋 时 荣 那 似此 天地 入 诗游
f9767e93-a940-4224-be51-930305dd9d55,道经寒芦港,张镃,唐,诗,五言绝句,芦深可藏人 下有扁舟泊 正似洞庭风 日暮孤帆落,"5,5,5,5",0b91ff651af88bf2e759d5d00bcbd8d7,芦深 可藏 人 下 有 扁舟 泊 正似 洞庭 风 日暮 孤帆 落
3092a4c4-32ae-405d-9081-7c3ea41a3694,戏成白发二首  其一,张镃,唐,诗,五言绝句,怕见人言老 梳头夜二更 谁知灯烛夜 漏逗愈分明,"5,5,5,5",35141579fb1626e6cf5efb25f4fe690b,怕 见 人言 老 梳头 夜二 更 谁知 灯烛 夜 漏 逗愈 分明
d865f821-5db4-4250-a52f-a2bac71d92b0,戏成白发二首  其二,张镃,唐,诗,五言绝句,朝朝摘白发 新生亦非黑 纵使白不生 秃翁还讳得,"5,5,5,5",c767f1c9c7602ac0c2b7366acbf24018,朝朝 摘 白发 新生 亦非 黑 纵使 白 不生 秃 翁 还 讳得
a7ca2337-a795-47b7-a64d-ae579cc4e9d8,秋夜,张镃,唐,诗,五言绝句,人间睡正浓 月到修髯底 三伏凛如秋 蒙头思衲被,"5,5,5,5",8fcecd9901da57234e21b492f81c763b,人间 睡 正浓 月 到 修 髯 底 三伏 凛如 秋 蒙头 思衲 被
ea853c34-8ff9-42ac-8fba-949ddbab4235,约斋,张镃,唐,诗,五言绝句,博学非能事 详言道转乖 只因省气力 处处是吾斋,"5,5,5,5",8e4c1a9ef3083fd7b555e63f6bded952,博学 非 能事 详 言 道 转乖 只 因 省 气力 处处 是 吾 斋
9d1280f2-f28d-47be-b8a2-c9d3158cb52c,赠道士,张镃,唐,诗,五言绝句,虎向深渊绕 龙归猛火蟠 昆仑飞日月 奚但鼎中安,"5,5,5,5",ee4bbd543cbb945496e76fdfb6c564d9,虎 向 深渊 绕 龙归 猛火 蟠 昆仑 飞 日月 奚 但 鼎中 安
a90e293a-a483-42dd-a6f4-fc746e6b6356,再过鶑脰湖,张镃,唐,诗,五言绝句,晓雾蒙鸿合 山藏岸绝痕 浩波吞日去 金晃玉乾坤,"5,5,5,5",459992ebbbfb6f83200f3e8f081c7f70,晓雾 蒙鸿合 山藏岸 绝痕 浩波吞日 去 金晃玉 乾坤
7d452356-a389-4df4-972d-d98bc9132dad,珍林,张镃,唐,诗,五言绝句,李枣栗银杏 橙梨柿木瓜 杨梅与金橘 不让满园花,"5,5,5,5",d0b1f6da81a10d13a6bee9e726a591d5,李枣栗 银杏 橙 梨 柿 木瓜 杨梅 与 金橘 不让 满园 花
b3c98748-7a58-4db4-8f3a-13a7febfb635,并闾岭,张镃,唐,诗,五言绝句,稍丛暮气升 还为露珠滴 暗响出林隈 锵锵小金石,"5,5,5,5",d7c66c659b6452dfa5bcb9f78e758373,稍 丛 暮气 升 还 为 露珠 滴 暗响 出 林 隈 锵锵 小 金石
c495a027-f39c-44e3-b9b2-6bcf48b68d8c,药溪,张镃,唐,诗,五言绝句,野药随宜种 芎苗嚼最香 屐痕休厌数 桤树逐溪长,"5,5,5,5",e02f5f4d1674da176c8f1c7c48d9ece4,野药 随宜 种 芎 苗 嚼 最 香 屐 痕 休厌 数 桤 树 逐 溪长
c72d312f-b00c-4f8b-a3f9-9bb60f507847,南湖,张镃,唐,诗,五言绝句,胸中诗本悭 天教专一壑 万景休坌来 老夫重然诺,"5,5,5,5",ae80cb0d1c2e9cd6259f81016b86b9e3,胸中 诗本 悭 天教 专一 壑 万景休 坌 来 老夫 重然 诺
e61fc4d9-d5a7-4aaf-b33c-7bb254303d95,小疾,张镃,唐,诗,杂言,风雨溪山数宿 归来尽有佳晴 小疾何妨隠几 隔窗娇听鶑声,"6,6,6,6",253bae8d873e41df3aa1fcc99eeb31cc,风雨 溪山 数宿 归来 尽有 佳 晴 小 疾 何妨 隠 几 隔 窗 娇 听 鶑 声
a28b0c55-14ae-4afb-be74-36ca5f94ceb9,浄相兰若僧师雅持塑佛疏缘化赠山偈二首  其一,张镃,唐,诗,杂言,居士卖屋为宅 盖成舍与瞿昙 尚自无钱结裹 何能转施南山,"6,6,6,6",6e1b85fb08574b81bdc634026f021fdb,居士 卖屋 为 宅 盖成舍 与 瞿 昙 尚自 无钱 结裹 何 能 转施 南山
3b261803-7947-4b62-817a-d31f69a24987,浄相兰若僧师雅持塑佛疏缘化赠山偈二首  其二,张镃,唐,诗,杂言,一语雅师听取 插草已自完成 况是三间殿了 如何却欠全身,"6,6,6,6",3217ebf18704b22bcb3e79a494295f66,一 语雅师 听取 插草 已自 完成 况是 三间 殿 了 如何 却 欠 全身
eeebbc44-5bd6-4073-b17f-baf8420903e0,丁未立春,张镃,唐,诗,七言绝句,今岁春从底处回 非关缇室动葭灰 幽人昨夜池塘梦 已见新春草际来,"7,7,7,7",8601aafb74f055ff5ef34dde87a8e47b,今岁 春 从 底处 回 非关 缇 室 动 葭 灰 幽 人 昨夜 池塘 梦 已 见 新春 草际 来
c47d6f40-1904-4dc9-8b05-c576891a7a4c,岁旦立春  其一,张镃,唐,诗,七言绝句,天心历数本相同 何事偏窥造化功 苍震欲承干健力 岁端春肇一时中,"7,7,7,7",cea689f23aec7cfe98619ed9fd35078e,天心 历数 本 相同 何事 偏 窥 造化 功 苍震 欲 承干 健力 岁 端 春 肇 一时 中
aeee652e-2d3d-45c1-9233-142e20991423,岁旦立春  其二,张镃,唐,诗,七言绝句,授受须知道一同 机缄默运仰神功 重轮赫日当天照 万国阳和淑气中,"7,7,7,7",4b8da7515740cb0b0737e59ed1383717,授受 须 知道 一同 机 缄默 运仰 神功 重轮赫日 当天 照 万国 阳 和 淑气 中
bfe3154f-e5a4-4bfd-bb76-8aa59f1d80e9,岁旦立春  其三,张镃,唐,诗,七言绝句,赞美平时万口同 耸观造化协天功 圣朝家法皆仁德 宽大应符帝诏中,"7,7,7,7",deb7152ffe4944c851bfa2ee9ba3c865,赞美 平时 万口 同 耸 观 造化 协天 功 圣朝 家法 皆 仁德 宽大 应符帝 诏 中
50d24060-1bd5-46f3-af3f-ed88fa45a228,岁旦立春  其四,张镃,唐,诗,七言绝句,从此车书看混同 王春丕建四时功 八千岂但庄椿比 宸极光符万岁中,"7,7,7,7",4c0d07d1f8bfe720a13ff80972f1df28,从此 车书 看 混同 王春丕 建 四时 功 八千 岂但 庄椿 比 宸 极光 符 万岁 中
84183b35-afa2-41a6-8a61-8bf759a10d22,岁旦立春  其五,张镃,唐,诗,七言绝句,宝翰钟王妙与同 虎龙腾跃更新功 诗成秦观如佳兆 适契青宫得意中,"7,7,7,7",23bb56a3a5f4f4a131d59b09db11f63d,宝翰钟 王妙 与 同 虎龙 腾跃 更新 功 诗 成 秦观 如佳兆 适契 青宫 得意 中
ee697185-3f69-4f0e-96aa-922befc80179,岁旦立春  其六,张镃,唐,诗,七言绝句,结宇城隅野老同 只将歌咏纪元功 枯荄亦喜春回早 为在条风振拂中,"7,7,7,7",f48769492e0ea6ebb60cc7a7b26315d8,结宇 城隅 野老 同 只 将 歌咏 纪元 功 枯 荄 亦 喜 春 回 早 为 在 条风 振拂 中
ef1b9b74-e5f2-4d3f-9813-12f0f82c376e,春风,张镃,唐,诗,七言绝句,春风日日过东墙 睡起人闲蝶自忙 吹尽玫瑰能底惜 只缘销去一年香,"7,7,7,7",47ac31b41b5d23039ebbc2cf3919ed8c,春风 日日 过 东墙 睡起 人 闲蝶 自忙 吹 尽 玫瑰 能 底 惜 只 缘 销去 一年 香
0a83a6e8-ed62-40b1-b0cf-d7d1688ec348,淳熙己酉二月二日皇帝登宝位镃获厕廷绅辄成驩喜口号十首  其一,张镃,唐,诗,七言绝句,晓色葱茏丽建章 今辰天地不寻常 中宵若没阴云蔽 应见前星日样光,"7,7,7,7",d787a23077bb87b4a74e55f30c7d963c,晓色 葱茏 丽 建章 今 辰 天地 不 寻常 中宵 若 没 阴云 蔽 应见 前 星日 样光
84528497-1c2a-4019-a681-c2023403c806,淳熙己酉二月二日皇帝登宝位镃获厕廷绅辄成驩喜口号十首  其二,张镃,唐,诗,七言绝句,只似闲时朝殿来 华驹徐步转东街 铜门已见飞腾象 先下浑银两字牌,"7,7,7,7",2b99427098485d33082102a0aabcac7d,只 似 闲时 朝 殿 来 华驹 徐步 转 东街 铜门 已 见 飞腾 象 先下 浑 银两 字牌
8b815105-70b2-499b-bf4a-68ecd3a5075d,淳熙己酉二月二日皇帝登宝位镃获厕廷绅辄成驩喜口号十首  其三,张镃,唐,诗,七言绝句,深严黼座瑞光中 仿佛遥瞻穆穆容 特衣赭袍缘底事 御天嗣圣欲乘龙,"7,7,7,7",708efbbddaeaa50c7cdd717ed903b980,深 严 黼 座 瑞 光 中 仿佛 遥 瞻 穆穆容 特衣 赭袍 缘底 事 御 天嗣圣 欲 乘龙
e371a9fa-5fdb-4188-94d8-d34aa4f920eb,淳熙己酉二月二日皇帝登宝位镃获厕廷绅辄成驩喜口号十首  其四,张镃,唐,诗,七言绝句,宣召班排过隔廊 耸闻神器授储皇 只将揖逊为家法 我宋真宜万代昌,"7,7,7,7",cec18ef3d9c1282dff76d168845def7b,宣召 班 排过 隔廊 耸 闻 神器 授储 皇 只 将 揖 逊 为 家法 我 宋真宜 万代 昌
38afcd4e-0b63-4315-bcd8-75ffe018646f,淳熙己酉二月二日皇帝登宝位镃获厕廷绅辄成驩喜口号十首  其五,张镃,唐,诗,七言绝句,百僚重入贺新君 亿载从今仰大昕 文德岂惟循舜道 武功行见访尧勋,"7,7,7,7",d2502979871fbf639233ea781e5c4099,百僚 重入 贺新君 亿载 从今 仰大昕 文德 岂 惟 循 舜 道 武功 行见 访尧勋
9816c6d8-dfc0-42d6-88c8-476c7e29e605,淳熙己酉二月二日皇帝登宝位镃获厕廷绅辄成驩喜口号十首  其六,张镃,唐,诗,七言绝句,聪哲从来简帝心 万方臣子合君临 东常议事犹经岁 仰体慈皇属意深,"7,7,7,7",ff35dae8fb4c5c426630bd2560375123,聪 哲 从来 简 帝心 万方 臣子 合 君临 东常 议事 犹经 岁 仰体 慈皇 属意 深
7cede370-4155-48e2-b384-35b62ca19b19,淳熙己酉二月二日皇帝登宝位镃获厕廷绅辄成驩喜口号十首  其七,张镃,唐,诗,七言绝句,和风淑气夹钟初 寿域重开际八区 不战自令边徼服 喜看风动媲唐虞,"7,7,7,7",fd199d343a9e0886800c68fabc3dbdb6,和 风淑气夹钟 初 寿域 重开 际 八区 不战 自令 边 徼 服 喜 看 风动 媲唐 虞
399a88c6-bc4e-4ccd-bea2-3566fc711b38,淳熙己酉二月二日皇帝登宝位镃获厕廷绅辄成驩喜口号十首  其八,张镃,唐,诗,七言绝句,圣父移居太母傍 銮舆躬侍袭龙香 乍从黄繖窥天表 愈觉英资似寿皇,"7,7,7,7",3a3362f7cee65950f6313927f5ce9adc,圣父 移居 太母 傍 銮舆 躬侍 袭 龙香 乍 从 黄 繖 窥 天 表 愈觉 英资 似 寿皇
1f584f06-4267-4675-a909-0f1360b4fa2c,淳熙己酉二月二日皇帝登宝位镃获厕廷绅辄成驩喜口号十首  其九,张镃,唐,诗,七言绝句,黎庶曾何帝力知 七旬三入乂宁时 春寒谁怕妨花柳 一日东风万国吹,"7,7,7,7",c471046ad2dd78fb69e41e41821ee79a,黎庶 曾 何 帝力 知 七旬 三 入 乂 宁 时 春寒 谁 怕 妨 花柳 一日 东风 万国 吹
d68a3a23-0afe-4e16-b7db-aad682e4753d,淳熙己酉二月二日皇帝登宝位镃获厕廷绅辄成驩喜口号十首  其一○,张镃,唐,诗,七言绝句,小臣奕世沐深恩 寓直蓬山三十春 空抱一编无所用 也叨拜望属车尘,"7,7,7,7",e80d78f012e3987142f7b162625e7714,小臣 奕 世 沐 深恩 寓 直 蓬山 三十 春 空 抱 一 编 无 所用 也 叨 拜望 属 车尘
c45b3cd8-28eb-44c3-8e9d-4b991f290020,敬和东宫春日泛湖韵,张镃,唐,诗,七言绝句,空林飞彩逐丝轻 瑞日重光特易晴 岁岁都人望行乐 六旗遥映百花明,"7,7,7,7",915e69bc95702de8e3ed770350fe73cb,空林 飞彩 逐丝轻 瑞 日 重光 特易晴 岁 岁 都 人 望 行乐 六 旗 遥映 百花 明
fd37fa57-3c13-43cf-bbf6-e1c058688b21,敬和东宫早梅二首  其一,张镃,唐,诗,七言绝句,月质风裳不受尘 独从天上巧呈新 情知压倒横斜语 青震专回万木春,"7,7,7,7",6ed558182672d6603c5455e4d42d71aa,月质 风裳 不 受 尘 独从 天上 巧呈新 情知 压倒 横斜 语 青震 专 回 万木春
cbbc46d5-b11a-43b3-85a0-e23f5c8d1b11,敬和东宫早梅二首  其二,张镃,唐,诗,七言绝句,乾坤连夜玉为尘 照映冰容面面新 句妙莫疑难属和 真成白雪对阳春,"7,7,7,7",ae37580516f5290e9c645a4cdcde371f,乾坤 连夜 玉为尘 照映 冰容 面面 新 句 妙莫 疑难 属 和 真 成 白雪 对 阳春
fd648a77-ee86-4e29-afa8-1e8653da6608,正月初四日听新乐成绝句  其一,张镃,唐,诗,七言绝句,鼇抃钧天沸广场 渡江何翅纪铿锵 频年遏密无悰绪 乐叟闲来说泰皇,"7,7,7,7",6ea8b6df2adfe7613ad01524a4c08540,鼇 抃 钧 天 沸 广场 渡江 何翅纪 铿锵 频年 遏密 无 悰 绪 乐叟 闲 来说 泰皇
498968a8-4df6-4ad9-932e-68d5472b2e49,正月初四日听新乐成绝句  其二,张镃,唐,诗,七言绝句,治音安乐绍熙初 试听咸韶可并驱 鼗武磬襄奚足数 作成从此不愁无,"7,7,7,7",430aac435391d55831ce6ce973001e71,治音 安乐 绍熙 初 试听 咸韶可 并 驱 鼗 武磬襄 奚 足数 作成 从此 不 愁无
5610a42f-0cd8-41dd-8fc2-c208bdadd166,正月初四日听新乐成绝句  其三,张镃,唐,诗,七言绝句,呜呜胡笛鹧鸪声 三叠鸣鼍舞袖轻 灯市花村旧欢醉 如今自厌邈无情,"7,7,7,7",344e4802a4af492f78774a4ef9c37d9b,呜呜 胡笛 鹧鸪 声 三叠 鸣 鼍 舞袖 轻 灯市 花村 旧欢 醉 如今 自 厌 邈 无情
2624a220-99c7-4cca-a9de-afbbd915d36d,壬寅立春  其一,张镃,唐,诗,七言绝句,经旬寒雨正霖霪 才转东风便肯晴 我自西畴心念熟 不须学稼始归耕,"7,7,7,7",a72a4b00824aaa3da08a26fdf9d1e4b4,经 旬 寒 雨正霖 霪 才 转 东风 便 肯 晴 我 自 西畴 心念 熟 不须 学稼 始归 耕
428b2a0e-4f88-4f35-88d9-e05c4d1dd4e8,壬寅立春  其二,张镃,唐,诗,七言绝句,蓼醯蔬餠媚晨羞 一饱宁知老到头 但听儿童语声喜 黑头青角看泥牛,"7,7,7,7",501c7eefb9b08fd2f49ea852aa7b769d,蓼 醯 蔬 餠 媚 晨 羞 一饱宁知老 到头 但 听 儿童 语声 喜 黑头 青角 看 泥牛
d6581c51-f2b3-43f6-80d5-dfd512e48322,堂中安奉高宗寿皇今上御书碑,张镃,唐,诗,七言绝句,路转修林特地殊 九光霞气羃仙庐 苍瑶不刻飞天篆 尽是三清玉帝书,"7,7,7,7",3d19e9817466e8c8e707f32c046243cb,路 转修 林 特地 殊 九光霞 气 羃 仙 庐 苍瑶 不刻 飞天 篆 尽 是 三清 玉帝 书
71b22ea8-215a-4906-b673-b5799116c627,集英殿立侍观进士唱名六首  其一,张镃,唐,诗,七言绝句,早放天扉一刻开 更声初断雨声催 不因变化鱼龙日 焉有风云转首来,"7,7,7,7",7169ead5d5430097b14f88ea89f25b17,早放天 扉 一刻 开 更声 初断 雨声 催 不 因 变化 鱼龙 日 焉 有 风云 转首 来
f830433e-b7b7-458a-b4a1-0b559afa3f52,集英殿立侍观进士唱名六首  其二,张镃,唐,诗,七言绝句,山绕彤城瑞雾凝 催班晓色渐分明 龙门肃立章身别 得著银袍却最荣,"7,7,7,7",c3425e21b5e9a910d9cbcbdbb1857af8,山 绕 彤城 瑞 雾 凝 催班 晓色 渐 分明 龙门 肃立 章 身别 得著 银袍 却 最荣
67389441-e1bd-49c6-a2cd-de5afac2172f,集英殿立侍观进士唱名六首  其三,张镃,唐,诗,七言绝句,君王策士几临轩 好学隆儒古莫肩 忠鲠尽将裨治道 不令鼌董誉空传,"7,7,7,7",1a942851cbfe52cd4b12009aebee928a,君王 策士 几临 轩 好学 隆儒古 莫肩 忠鲠尽将裨治道 不 令 鼌 董 誉 空 传
