id,title,author,dynasty,genre,poem_type,sentences_simplified,meter_pattern,hash,words
62d2c25f-c764-47fb-9b7b-815a608707ea,答雲居西和尚偈,釋慧暉,唐,诗,五言绝句,和尚不知禅 困来便打眠 泥牛吃水草 木马咬瓦砖,"5,5,5,5",af986b6e143a65cd2f5d3c54610cfdd8,和尚 不知 禅 困来 便 打眠 泥牛 吃 水草 木马 咬 瓦 砖
fe44bbfb-d61c-4113-ac69-98852dfec93c,偈四首  其一,釋慧暉,唐,诗,杂言,朔风凛凛扫寒林 叶落归根露赤心 万派朝宗船到岸 六窗虚映芥投针 本成现 莫他寻 性地闲闲耀古今 户外冻消春色动 四山浑作木龙吟,"7,7,7,7,3,3,7,7,7",7713a4912ff1cdcb64b6fb0f14467a10,朔风 凛凛 扫 寒林 叶落归根 露 赤心 万派 朝宗 船 到岸 六 窗 虚映 芥 投针 本 成现 莫 他 寻 性地 闲 闲耀 古今 户外 冻消 春色 动 四山 浑作木 龙吟
2443861d-55cf-496a-87ba-fb2edbff3670,偈四首  其二,釋慧暉,唐,诗,杂言,巢知风 穴知雨 甜者甜兮苦者苦 不须计较作思量 五五从来二十五 万般施设到平常 此是丛林饱参句,"3,3,7,7,7,7,7",679a34addcc6dc5aa29cd915ddfb410b,巢知风 穴 知雨 甜者 甜兮苦 者 苦 不须 计较 作 思量 五五 从来 二十五 万般 施设 到 平常 此是 丛林 饱 参句
090a90e8-5f0a-4a43-a22a-9f3cec746cfa,偈四首  其三,釋慧暉,唐,诗,杂言,谷之神 枢之要 里许旁参 回途得妙 云虽动而常闲 月虽晦而弥照 宾主交参 正偏兼到 十洲春尽花凋残 珊瑚树林日杲杲,"3,3,4,4,6,6,4,4,7,7",59ed5593e567333b5fcaf454970e0b18,谷之神 枢之要 里 许 旁 参 回途 得妙 云 虽 动 而 常闲 月 虽晦而弥照 宾主 交参 正偏 兼到 十洲 春 尽 花 凋残 珊瑚 树林 日 杲杲
3ac6af55-90e4-4154-bd8c-55d6a734fa8f,偈四首  其四,釋慧暉,唐,诗,七言绝句,皮肤脱落绝方隅 明了身心一物无 妙入道寰深静处 玉人端驭白牛车,"7,7,7,7",9f53f9f784a64cbc83d6288aa8887d3f,皮肤 脱落 绝方 隅 明 了 身心 一物 无 妙入道寰 深静 处 玉人 端驭 白 牛车
9eeed401-83ea-4f5e-baf6-43958f38475b,頌古十九首  其一,釋慧暉,唐,诗,七言绝句,那咤太子本来身 卓卓无依不受尘 云散水流天地静 篱间黄菊正争春,"7,7,7,7",215c12db3257feabd2d8f10a3d18677f,那 咤 太子 本来 身 卓卓无依不受尘 云散 水流 天地 静 篱间 黄菊 正争 春
34dcabe1-f1a4-40d8-8e38-25c3f903ca41,頌古十九首  其二,釋慧暉,唐,诗,七言绝句,是风是旛君莫疑 百草丛中信步归 王道太平无忌讳 戏蝶流鶑遶树飞,"7,7,7,7",99d228ce7d3de3f66234fcf659fe58bb,是 风 是 旛 君 莫 疑 百草 丛中 信步 归 王道 太平 无 忌讳 戏蝶 流 鶑 遶 树 飞
65fe84d4-f277-406d-aacc-4472ee43ce9a,頌古十九首  其三,釋慧暉,唐,诗,七言绝句,不是风旛不是心 衲僧徒自强锥针 岩房雨过昏烟静 卧听凉风生竹林,"7,7,7,7",ceda3b2311549cdaa2340efddbc97073,不是 风 旛 不是 心 衲僧 徒 自强 锥针 岩 房雨 过昏 烟静 卧 听 凉风 生 竹林
3c6389f2-a4d3-4b61-a292-87142fb95fa6,頌古十九首  其四,釋慧暉,唐,诗,杂言,一人道不落 一人道不昧 夜来一阵狂风生 浪打石头如粉碎,"5,5,7,7",b705e7d668fd7ca0d3fd93451645b5ed,一 人 道 不落 一 人 道 不昧 夜来 一阵 狂风 生 浪 打 石头 如 粉碎
87f9649c-9ec4-4f23-87c9-fabf715d5f54,頌古十九首  其五,釋慧暉,唐,诗,杂言,枯木岩前烟嶂昏 羚羊挂角觅无门 玉梭暗掷千峰外 一线虚通晓色分 孤迥迥 绝瘢痕 万古寒潭搅不浑 正坐当堂金殿冷 回头尽是我儿孙,"7,7,7,7,3,3,7,7,7",fc57857d400f0fb102f2445502349c8a,枯木 岩前 烟 嶂 昏 羚羊挂角 觅 无门 玉梭 暗掷 千峰 外 一线 虚 通晓 色分 孤 迥 迥 绝 瘢痕 万古 寒潭 搅 不 浑 正坐 当堂 金殿 冷 回头 尽是 我 儿孙
a1a598b9-314b-439f-891d-13f52d2d8627,頌古十九首  其六,釋慧暉,唐,诗,七言绝句,百尺竿头氎布巾 上头题作酒家春 相逢不饮空归去 洞里桃花笑杀人,"7,7,7,7",b9c531df53c92759186d0cb398fb8c54,百尺竿头 氎 布 巾 上头 题作 酒家 春 相逢 不 饮 空 归去 洞 里 桃花 笑 杀人
3a0e13af-5188-449f-b853-a7f37bc0d4d7,頌古十九首  其七,釋慧暉,唐,诗,七言绝句,庵主当年用得亲 衲僧眼里要生筋 赵州舌有龙泉剑 开口等闲疑杀人,"7,7,7,7",461580ce4cfad2470872e853b6edf548,庵主 当年 用得 亲 衲僧 眼里 要 生筋 赵州 舌 有 龙泉剑 开口 等闲 疑 杀人
a42e3387-e4b6-465c-93d3-837ef85a9649,頌古十九首  其八,釋慧暉,唐,诗,七言绝句,重重去尽自平常 春暖风和日渐长 户外鸟啼声细碎 岩花狼藉满山房,"7,7,7,7",084e319954a8b92a7afa68739a1bcf58,重重 去 尽自 平常 春 暖风 和 日渐 长 户外 鸟啼 声 细碎 岩花 狼藉 满山 房
f97007a5-a5f3-4520-a45d-5f2bb09452b7,頌古十九首  其九,釋慧暉,唐,诗,七言绝句,翰墨场中唤得回 桂林昨夜觉花开 暗香漏泄通消息 散作人间调鼎才,"7,7,7,7",514313166f2585b41f3f068c43584996,翰墨 场中 唤得 回 桂林 昨夜 觉花 开 暗香 漏泄 通 消息 散作 人间 调鼎 才
ed7e0a3b-36a2-41a8-87f7-e4de60c4f846,頌古十九首  其一○,釋慧暉,唐,诗,七言绝句,非男女相独闲闲 正体堂堂孰可攀 一句不传千圣眼 九天风静月弯弯,"7,7,7,7",e50154c69f7c2a72acde00da2eaea70b,非 男女 相独闲闲 正体 堂堂 孰 可 攀 一句 不 传 千 圣 眼 九天 风静 月 弯弯
a73b754e-07b7-41dd-8baf-9ee850f732ab,頌古十九首  其一一,釋慧暉,唐,诗,七言绝句,上座莫要礼老朽 兴平未易扬家丑 尊贵从来不出门 渠侬岂在威音后,"7,7,7,7",2f197120f934265ad7839a7b1b2777da,上 座 莫要 礼 老朽 兴平 未易扬 家丑 尊贵 从来不 出门 渠侬 岂 在 威音 后
5ccff36b-4e51-46d8-a780-59bafccfd3d8,頌古十九首  其一二,釋慧暉,唐,诗,七言绝句,午夜山房月色深 十分明白堕功勋 拨开向上通天窍 烟嶂重重不见人,"7,7,7,7",ee8527ba5be74d0c5a13f80313578ed5,午夜 山房 月色 深 十分 明白 堕 功勋 拨开 向上 通天 窍 烟 嶂 重重 不见 人
c2c00814-9028-4896-a40b-e55647b73887,頌古十九首  其一三,釋慧暉,唐,诗,七言绝句,故山岌岌锁寒烟 未肯将心轻授传 玉女夜寻无字印 石人遥指月明前,"7,7,7,7",2594d7e57acd3a7bb1c8e994f2492665,故山 岌岌 锁 寒烟 未肯 将 心轻 授传 玉女 夜寻无字 印 石人 遥指 月 明前
71739632-bdce-48c1-8c80-ef7724f98ed5,頌古十九首  其一四,釋慧暉,唐,诗,七言绝句,一片孤云不露丑 白云儿倚青山父 鹤巢灵滴梦初回 新月半钩升万户,"7,7,7,7",af9e180618e5307a3934af419ffa2ec9,一片 孤云 不露 丑 白云 儿 倚 青山 父 鹤 巢灵 滴 梦 初 回 新月 半 钩 升 万户
5f3d94ef-b108-43eb-9f27-b0a9862376b8,頌古十九首  其一五,釋慧暉,唐,诗,七言绝句,寂寂无依病正深 雪老当年痛处针 一唤唤回春梦破 千山浑作木龙吟,"7,7,7,7",29fcc24ae2d501a0498f82307f770513,寂寂 无 依病 正 深 雪老 当年 痛处 针 一 唤 唤回 春梦 破 千山 浑作木 龙吟
f965cd33-dfde-4a9a-94f4-354987735c7b,頌古十九首  其一六,釋慧暉,唐,诗,七言绝句,心径苔生何处去 谢家人不在渔船 芦花万顷水天阔 白鸟深沉任转旋,"7,7,7,7",4419181babe5cb3fc514b01baae91042,心径 苔生 何处 去 谢家 人 不 在 渔船 芦花 万顷 水天阔 白鸟 深沉 任 转旋
32b8afb3-055d-4607-ac07-cadc0cfe15d7,頌古十九首  其一七,釋慧暉,唐,诗,七言绝句,不打飞鸢便到来 大圆镜里绝尘埃 东君节令分明也 桃李年年二月开,"7,7,7,7",fad6db85cb6e88c23e3b524f83d2117b,不 打 飞鸢 便 到来 大圆 镜 里 绝 尘埃 东君 节令 分明 也 桃李 年 年 二月 开
c595264c-35b0-40a0-a6f6-aca5c1992f60,頌古十九首  其一八,釋慧暉,唐,诗,七言绝句,□世如来一口吞 故山深静月黄昏 光分顶后千门晓 坐看春回入烧痕,"7,7,7,7",b5ee349778a401968860c878d60f622a,□ 世 如来 一口 吞 故山 深静 月 黄昏 光分 顶后 千门 晓 坐看 春 回入 烧痕
70467e72-1384-407c-a203-76562fe08e52,頌古十九首  其一九,釋慧暉,唐,诗,七言绝句,混而不杂体常虚 雪月交光类莫如 应处万端无罣碍 片云自在卷还舒,"7,7,7,7",527f7ff4d06119a5f05bc00bfec5d856,混而不杂体常虚 雪月 交光 类 莫如 应处 万端 无 罣碍 片云自 在 卷 还 舒
e8c69d9f-05ce-40f8-a16d-4ad3b2177dad,贈慧暉偈,釋雲居西,唐,诗,五言绝句,云居不会禅 洗足上床眠 不觉枕子落 打破常住砖,"5,5,5,5",f2384a10ae770335036deeb598e99241,云居 不会 禅 洗足 上床 眠 不觉 枕子 落 打破 常住 砖
58bc521a-17e0-40db-9afa-8551a78ba134,蒙亭詩和張洵韻,葉宗諤,唐,诗,七言古体,我行几许逾沅湘 直抵八桂漓水旁 千山倒影摇溪光 秀色不借草木苍 兹亭构胜俯回塘 野花风递罗绮香 岩前伏波航羽觞 一洗尘思生清凉 疑有仙人白玉床 壶中景迥日月长 步此仙籁音琅琅 世间名利真毫芒 此景不独冠南方 恨不筑室轻侯王 回首尘迹空渺茫 瞥去未必计非良 其如樽酒情难忘 恍然一梦五云乡,"7,7,7,7,7,7,7,7,7,7,7,7,7,7,7,7,7,7",1d47fc5e3f737e7b142077ae5688ed2f,我行 几许 逾 沅 湘 直抵 八桂 漓水 旁 千山 倒影 摇溪光 秀色 不 借 草木 苍 兹 亭 构胜 俯回 塘 野花 风 递 罗绮 香 岩前 伏波航 羽 觞 一 洗尘 思生 清凉 疑有 仙人 白玉 床 壶 中景 迥 日月 长 步此仙籁音 琅琅 世间 名利 真毫芒 此景 不独 冠 南方 恨 不 筑室 轻 侯 王 回首 尘迹 空 渺茫 瞥去 未必 计非良 其 如 樽 酒情 难忘 恍然 一梦 五 云乡
0c93c49b-f617-46ed-8932-95421312364f,句,葉宗諤,唐,诗,七言古体,凤凰台上山吞月 白鹭洲边水接天,"7,7",592cd83e7c5aad8f6866ed539dcbfccb,凤凰台 上山 吞 月 白鹭洲 边水 接天
b2148654-5ae5-4244-9ef1-d81c2d8f0b5c,通山  其一,李傳正,唐,诗,五言绝句,我爱通羊好 居民山作城 眼前无俗事 枕畔有滩声,"5,5,5,5",e0fb0cbdc7175e9f1175280e9aa84c21,我 爱 通 羊 好 居民 山作城 眼前 无 俗事 枕畔 有 滩声
b287b897-366c-4f1a-9768-87954f439b3e,通山  其二,李傳正,唐,诗,五言绝句,我爱通羊好 回环云水间 重峦与叠嶂 真是翠屏山,"5,5,5,5",e5b27036b74fc1cf7c077c773a8e33d0,我 爱 通 羊 好 回环 云水 间 重峦 与 叠嶂 真是 翠屏山
8f289b17-bc42-4e1c-92a2-876514685672,通山  其三,李傳正,唐,诗,五言绝句,我爱通羊好 清无一点尘 峭山多洞户 樵牧识仙人,"5,5,5,5",2f8f31b6a60666e54ab882f94c822750,我 爱 通 羊 好 清 无 一点 尘 峭山 多 洞户 樵牧识 仙人
e54681f5-b2be-4f90-97ce-5a7aad97738d,遊淡山巖,彭從虎,唐,诗,七言古体,竹苞未翦山虽幽 福庭胜概难穷搜 天公念此久闭塞 密召五丁诒厥谋 巽维一夕启邃窦 光圆瓮牖端相侔 方床翠屏广罗列 药臼香山深抉锼 道人振锡蟒潜遁 处士化石岩中留 训狐昨夜又鸣报 果是五马今朝游,"7,7,7,7,7,7,7,7,7,7,7,7",31d8cfb923fee20679bcd00af2f75f4d,竹 苞 未 翦 山 虽 幽 福庭 胜概 难穷 搜 天公 念 此久 闭塞 密召 五丁 诒 厥 谋 巽维 一夕 启 邃 窦 光 圆 瓮 牖 端相 侔 方床 翠屏广 罗列 药臼 香山 深 抉 锼 道人 振 锡蟒 潜遁 处士 化石 岩 中 留 训狐 昨夜 又 鸣 报 果是 五马 今朝 游
9fd1f14a-432e-4cc4-970c-3e0f41a13bab,句,李會,唐,诗,七言古体,金沙滩上双㶉𫛶 肯为分司御史来,"7,7",b3d5d424849d835d851801cfe3a234cb,金沙滩 上双 㶉 𫛶 肯为 分 司御史 来
47b641f2-84f5-4613-bcbd-13a7664019e0,紹興丁巳二月三十日同晏元老馮應禮羅君瑞遊龍多山訪飛仙遺迹以兩詩書事  其一,何麒,唐,诗,七言律诗,世路聱牙赤水过 故升天险问龙多 书中旧识唐公昉 图里又闻冯盖罗 绛阙岧岧双鹤下 青空杳杳八鸾歌 一篇跳出孙樵语 未应虚皇玉字科,"7,7,7,7,7,7,7,7",4d2d643784fd1c5fd5eb577ab54f43e5,世路 聱牙 赤水 过 故升 天险 问龙 多 书 中 旧识 唐 公 昉 图里 又 闻 冯 盖罗 绛 阙 岧 岧 双 鹤 下 青空 杳 杳八鸾歌 一篇 跳出 孙 樵语 未 应 虚皇 玉字 科
a0af0cc3-4e72-4ad2-8a82-395f64f64abd,紹興丁巳二月三十日同晏元老馮應禮羅君瑞遊龍多山訪飛仙遺迹以兩詩書事  其二,何麒,唐,诗,七言律诗,丁令梅仙梁市客 穿云随我上虚无 携持頼有竹都尉 偃蹇更逢松大夫 山积五仓窥石□ 霞拖九芒觅丹炉 圣泉闻说经汤旱 中有龙蟠不用雩,"7,7,7,7,7,7,7,7",418c41a2025e2b5ff48b0101fa0837f8,丁令梅 仙 梁市 客 穿 云 随 我 上 虚无 携 持 頼 有 竹 都尉 偃蹇 更 逢 松 大夫 山积 五 仓 窥 石 □ 霞 拖 九芒觅丹炉 圣泉 闻 说 经汤 旱 中 有 龙蟠 不用 雩
08c2da2e-8975-41cc-9beb-82ede34a36dc,南樓,何麒,唐,诗,七言绝句,武昌形势凤凰边 万里长江落槛前 笑杀元规乱天下 南楼何借此人传,"7,7,7,7",12a073e55e7ba3fd8f886d5d5824aced,武昌 形势 凤凰 边 万里 长江 落槛 前 笑 杀 元 规乱 天下 南楼 何 借 此人 传
e2b71db1-93d8-4b19-9622-cc6ac5610424,外大父丞相初登科爲雒縣主簿經攝垍窯鎮稅官留詩護國寺中令狐監征錄以見寄謹再拜追和而記其後,何麒,唐,诗,七言律诗,传翁遗墨賸咨嗟 四海当年尚一家 大老不为今日用 小诗徒遣后人夸 兴来思跨巴滇马 归去方乘下泽车 燕麦兔葵僧舍里 何如梦得访桃花,"7,7,7,7,7,7,7,7",36e07e4b10ac070f7dd52fce7f4469f2,传翁 遗墨 賸咨 嗟 四海 当年 尚 一家 大 老 不为 今日 用 小诗徒 遣 后人 夸 兴来 思 跨 巴 滇 马 归去 方乘 下泽车 燕麦 兔葵 僧舍 里 何如 梦 得访 桃花
30438940-8ee6-4f26-87eb-4a3240073ae5,虎丘,何麒,唐,诗,五言律诗,平地涌岩壑 棱层惊大雄 何曾远人世 真欲傍天宫 白虎威灵在 赤乌缘影空 生公能说法 音与塔铃同,"5,5,5,5,5,5,5,5",6b2dd778672902573ecdaae529032714,平地 涌 岩 壑 棱层 惊大 雄 何曾 远 人世 真欲傍 天宫 白虎 威灵 在 赤乌 缘影 空 生公能 说法 音 与 塔铃 同
eef1612c-a1b4-4c96-85ad-20767cf5509b,巖下觀瀑旦晚異狀子文有詩輒次其韻,何麒,唐,诗,七言古体,瀑色清明气犹雄 非烟非云非白虹 兜罗绵光秀罘罳 瑠璃□影摇帘栊 风吹银潢洒苍壁 日照玉柱擎青空 谁言物象要有尽 我觉端倪殊不穷 思涌回翔掀舞时 句在缥缈空蒙中 更将七字写亭午 倚天长剑拖芒锋,"7,7,7,7,7,7,7,7,7,7,7,7",b9034128d13e24580b35800cb55c6848,瀑色 清明 气犹雄 非 烟非 云非 白虹 兜 罗绵光 秀 罘 罳 瑠 璃 □ 影摇 帘 栊 风吹 银潢 洒 苍壁 日照 玉柱擎 青空 谁 言 物象 要 有 尽 我 觉 端倪 殊不穷 思涌 回翔 掀舞 时 句 在 缥缈 空蒙 中 更 将 七 字 写 亭午 倚天 长剑 拖芒锋
e74b8f42-e161-4ebe-ad37-85651c261bcd,題陽華巖,何麒,唐,诗,五言古体,名山固多岩 兹岩擅天下 屋大享千人 谷深量万马 谽谺通一水 旁午飞桥跨 石砾巧雕锼 松篁森绘画 古人栖遁处 文字犹凭借 语妙元次山 名高陶别驾 瞿君三体篆 殆可斯翁亚 却后累百年 吾人来叹咤 伊予邱壑姿 嗜好若天假 终焉卜真隠 学道冀陶冶 丹成生羽翼 召节青童把 挥手挹霞芒 竦身朝帝者,"5,5,5,5,5,5,5,5,5,5,5,5,5,5,5,5,5,5,5,5,5,5,5,5",a2c81db62004a655408b1d5d92293cae,名山 固 多 岩 兹 岩 擅 天下 屋 大享千人 谷 深量 万 马 谽 谺 通 一 水 旁午 飞桥 跨 石砾巧 雕 锼 松篁 森 绘画 古人 栖 遁 处 文字 犹 凭借 语妙 元次山 名 高 陶别 驾 瞿君 三体 篆 殆可 斯翁亚 却后 累 百年 吾人 来 叹咤 伊予 邱壑姿 嗜好 若天 假 终焉卜真 隠 学道 冀 陶冶 丹成生 羽翼 召节 青童 把 挥手 挹 霞 芒 竦 身 朝 帝者
479e9002-2453-4892-b999-257584d3bc25,題師子巖  其一,何麒,唐,诗,五言古体,旦为阳华游 轩豁谐素志 那知此嵌岩 近在回翔地 石如狻猊状 蹲伏呀可畏 虽无嚬呻威 尚使百兽避 漫郎嗜泉石 足迹靡不至 是岩端见遗 定自求其备 澹岩冠湘中 瓌玮传万耳 此郎靳一言 亦以山无水 骨多欠膋血 草木咸枯悴 其谁喜冥搜 韵语发天秘 石门何晃荡 坐久三叹喟 径欲挽银潢 淙淙满人意,"5,5,5,5,5,5,5,5,5,5,5,5,5,5,5,5,5,5,5,5,5,5,5,5",f9e92ba7647f3935e18d9a94653953e5,旦 为 阳华游 轩 豁谐 素志 那 知 此 嵌 岩 近 在 回翔 地 石如 狻猊 状 蹲伏 呀 可畏 虽无嚬呻威 尚使 百兽 避 漫 郎 嗜 泉石 足迹 靡不 至 是 岩端 见 遗 定 自求 其 备 澹岩冠 湘中 瓌 玮 传 万 耳 此 郎 靳 一言 亦 以 山 无水 骨 多 欠 膋 血 草木 咸 枯悴 其 谁 喜 冥 搜 韵语 发天 秘 石门 何 晃荡 坐 久 三 叹 喟 径 欲 挽 银潢 淙淙 满 人 意
9af8da9f-a764-4a89-af4a-6591146b31e7,題師子巖  其二,何麒,唐,诗,五言古体,一楠枯再生 两石合无罅,"5,5",3bd09c69f742176a2fd01d410492daf5,一 楠 枯 再生 两石合 无 罅
a4ae696a-b1dc-486a-b857-cb81f408c6aa,題師子巖  其三,何麒,唐,诗,七言古体,梁山韮黄妙天下 玉筯金钗盈大把,"7,7",406a7ea3dcb835dd1263491ac061bdb4,梁山 韮 黄 妙 天下 玉 筯 金钗 盈 大 把
b761a490-0dce-465f-b0f3-e14bab10658f,建炎丞相成國呂忠穆公退老堂  其一,徐公裕,唐,诗,七言律诗,注意惟闻简帝心 聊成退老寓登临 放怀绿野岩瞻重 寄傲平泉国念深 海阔水云和岛屿 时清钟鼓乐园林 谢公岂久东山趣 天下苍生傒作霖,"7,7,7,7,7,7,7,7",fa0634657efa475cf72c5b29e61db954,注意 惟 闻 简 帝心 聊成 退 老寓 登临 放怀 绿野 岩瞻 重 寄 傲 平泉 国念 深 海阔 水云 和 岛屿 时 清 钟 鼓乐 园林 谢公 岂 久 东山 趣 天下 苍生 傒 作 霖
7ceccbdd-f18a-4d44-b5ca-013c81241901,建炎丞相成國呂忠穆公退老堂  其二,徐公裕,唐,诗,七言律诗,国栋帡幪不日成 天河星斗宿簷楹 台符影烛江山丽 赤舄光临草木荣 猿鹤从今惊夜帐 盐梅行复作和羹 衰颜白发尘埃客 狂斐裁诗继颂声,"7,7,7,7,7,7,7,7",530501326e5d069c9c9957f677109580,国 栋 帡 幪 不 日 成 天河 星斗 宿簷 楹 台符 影烛 江山 丽 赤 舄 光临 草木 荣 猿 鹤 从今 惊夜 帐 盐 梅行 复作 和 羹 衰颜 白发 尘埃 客 狂 斐 裁诗 继 颂声
cfaf6497-10cb-47c0-848a-30ad266ddb50,宮詞四首  其一,吳百生,唐,诗,五言律诗,妙选昭阳进 羞花妬六宫 行阶莲落地 随御柳含风 按舞天光近 征歌烛影红 夜深金殿合 环珮月明中,"5,5,5,5,5,5,5,5",11de38edbf98163fc2f2d0c7055d2ad8,妙 选 昭阳 进 羞 花 妬 六 宫 行阶莲 落地 随 御 柳含风 按 舞 天光 近 征歌 烛影 红 夜深 金殿 合 环珮月 明 中
3cf8602d-6ec4-4e84-85f4-c778cb0539b6,宮詞四首  其二,吳百生,唐,诗,五言律诗,阿娇金屋闭 群玉奉龙轝 夜色明光酒 春风长信裾 传宣严仗合 应侍冶容虚 笑簇嫣然地 名花总不如,"5,5,5,5,5,5,5,5",0c21d7c615accb9a6a92f8ae50eab8c9,阿娇金屋 闭 群 玉 奉 龙 轝 夜色 明光 酒 春风 长信 裾 传 宣严仗 合 应侍 冶容 虚 笑 簇 嫣然 地 名花 总 不如
fc917e61-1682-46ac-8507-3f177767ac9f,宮詞四首  其三,吳百生,唐,诗,五言律诗,钧乐云中动 銮舆天上行 百花齐醉日 孤月独明更 玉漏频催酒 金炉细结甍 春秋有常幸 日日调清平,"5,5,5,5,5,5,5,5",62ac3cc1ce378a95011b84d96338e08b,钧乐 云中 动 銮舆 天上 行 百花 齐醉 日 孤 月 独明 更 玉 漏频 催酒 金炉 细结 甍 春秋 有常 幸 日日 调 清平
00454e69-8c43-4f5f-b282-9505d3d0e70e,宮詞四首  其四,吳百生,唐,诗,五言律诗,中使质明催 珠宫宝扇回 髻云双凤拥 歌雪百花堆 竞立徼殊宠 群趋望独魁 寿阳春夜额 贴尽一庭梅,"5,5,5,5,5,5,5,5",79f86491a766180729a7fe7238b39932,中 使 质明 催 珠宫 宝扇 回 髻 云双凤 拥 歌雪 百花 堆 竞立 徼 殊宠 群 趋望 独魁 寿阳 春夜 额 贴尽 一庭 梅
62f7d078-0ebb-417f-984b-15f65cfd0d8b,莫釐遠眺,吳百生,唐,诗,五言律诗,金庭隔尘耸 玉柱插天浮 石古不知岁 谿虚长欲秋 绣重红错翠 锦簇阁兼楼 望里三州远 吟边松月留,"5,5,5,5,5,5,5,5",bffa267feba0da6b1ae1fd8219212a2d,金庭 隔尘耸 玉柱 插 天 浮 石古 不知 岁 谿 虚 长 欲 秋 绣 重红 错翠 锦簇 阁 兼 楼 望里三州 远 吟 边 松 月 留
2f656c13-8a85-42ab-85c0-924865ab943e,烏夜啼,吳百生,唐,诗,七言绝句,夜夜乌来啼未央 明月出户空飞霜 吹笳征夫不就寝 宫筵列烛声满堂,"7,7,7,7",a8544380097f7e208cfc3c781efc3e2e,夜夜 乌来啼 未央 明月 出户空飞霜 吹 笳 征夫 不 就寝 宫 筵列烛 声 满堂
778c59e2-1238-40fc-845d-e674fb9cb18a,鹿苑禪寺,范潔,唐,诗,七言律诗,晋远风流八百年 虎溪无复社中贤 爱斯吐月吞风屋 有此开花结子莲 直使渊明通耿介 亦教灵运费攀援 知师戒洁方投社 欲对松窗设榻眠,"7,7,7,7,7,7,7,7",dabdfb742911d5cd86fa258cb0be2485,晋远 风流 八百年 虎溪 无复社中贤 爱斯 吐 月 吞 风屋 有 此 开花 结子 莲 直 使 渊明 通 耿介 亦 教 灵 运费 攀援 知师 戒洁方 投社 欲 对 松窗 设 榻 眠
96896973-722a-4127-b170-6ae7350c6ba9,題徽宗宸翰,康與之,唐,诗,七言绝句,玉辇宸游事已空 尚余奎藻绘春风 年年花鸟无穷恨 尽在苍梧夕照中,"7,7,7,7",6e53ade557139e0beb5f5d592f5061ac,玉 辇 宸 游 事 已 空 尚余奎 藻绘 春风 年 年 花鸟 无穷 恨 尽 在 苍梧 夕照 中
cdf93440-aa64-4fb1-898a-8b6066bbbef3,遊慧力寺  其一,康與之,唐,诗,杂言,天涯芳草尽绿 路旁柳絮争飞 啼鸟一声春晚 落花满地人归,"6,6,6,6",95b0de834f32617842c505ad263602d6,天涯 芳草 尽 绿 路旁 柳絮 争飞 啼 鸟 一声 春晚 落花 满地 人 归
8be1136b-9d33-45ac-8d17-9584544cc4a9,遊慧力寺  其二,康與之,唐,诗,七言绝句,江上浓阴晓未开 瘦筇支我上苍苔 春寒前日去已尽 今日又从何处来,"7,7,7,7",37cffb26d7893812b0a22925620b7270,江上 浓 阴晓未 开 瘦 筇 支 我 上苍 苔 春寒 前日 去 已尽 今日 又 从 何处 来
f533fffe-fd49-4755-8c15-afc5aad4042a,僻居,康與之,唐,诗,五言律诗,巷僻过从少 柴门尽日关 鶑声常在柳 云影不离山 有道难言□ 虽贫未厌闲 川原烟四暝 春思有无间,"5,5,5,5,5,5,5,5",75d98aa81cde7ed33ac98d9b21f18c05,巷 僻 过 从少 柴门 尽日 关 鶑 声 常 在 柳 云影 不离 山 有 道 难言 □ 虽 贫未厌闲 川原 烟 四 暝 春思 有 无间
b4be6a00-7c6c-470c-837c-3a0b8c26023b,鷺,康與之,唐,诗,七言绝句,春暗汀洲杜若香 风标公子白霓裳 碧天片雪忽飞去 何处人家水满塘,"7,7,7,7",0c34a7aa94b9b620a40b6a8f09c79706,春 暗 汀洲 杜若香 风标 公子 白 霓裳 碧 天片 雪忽 飞去 何处 人家 水满塘
1ed0f692-49d5-4191-b01f-637bb85e2875,琵琶,康與之,唐,诗,七言绝句,夜深琵琶声似裂 一曲霓裳一庭月 曲终人影在西阶 困倚东风步摇折,"7,7,7,7",003263f9121ff33fd9b9d36a2dd0da2b,夜深 琵琶 声似裂 一曲 霓裳 一庭 月 曲终 人影 在 西阶 困 倚 东风 步摇折
04a2b664-e0f1-436d-8b1a-62c23b52ad44,可惜,康與之,唐,诗,七言绝句,帘幕重重下玉钩 隔帘春在柳梢头 东风著意相料理 吹去杨花不自由,"7,7,7,7",d7d876d5b071ac28cc1e83a90e2b7fd0,帘幕 重重 下 玉 钩 隔 帘 春 在 柳 梢头 东风 著意 相 料理 吹 去 杨花 不 自由
079de10a-f3be-4109-86d5-0891321e6550,鶴舒臺,康與之,唐,诗,七言律诗,白云深处路崎岖 鹤去台空景物殊 山展翠屏连紫幕 泉分清溜滴明珠 道人祇问丹砂井 隠客犹寻九节蒲 试问葛仙仙去后 至今遗迹事如何,"7,7,7,7,7,7,7,7",85a0d2e7eefbfef75db510aa4b318b02,白云 深处 路 崎岖 鹤 去 台空 景物 殊 山展翠 屏 连 紫幕 泉 分清 溜滴 明珠 道人 祇 问 丹砂 井 隠 客 犹 寻 九节 蒲 试问 葛仙仙 去 后 至今 遗迹 事 如何
17f6e723-d747-4d1c-b18d-a86b151c975c,招真詞,康與之,唐,诗,杂言,白鹤巢兮丹井空 蓬山杳兮烟霞蒙 陵谷变兮今古 木叶下兮秋风 飞仙去兮朝太微 黄冠野服兮以游以嬉 餐霞卧月兮世不我违 与世涤映兮天门可驰 苍龙嘷兮云漫扉 石泉冽兮山芋肥 俯仰宇宙兮日月蔽亏 灵秀回薄兮野芳呈姿 山中之乐兮万化莫移 仙人不来兮隠者曷归,"7,7,6,6,7,9,9,9,7,7,9,9,9,9",190ba43122143e6589e6ebae7bd80fb6,白鹤 巢兮 丹井 空 蓬山 杳 兮 烟霞 蒙 陵谷 变 兮 今古 木叶 下兮 秋风 飞仙 去 兮 朝太 微 黄冠野服 兮 以游 以 嬉 餐霞 卧 月 兮 世 不 我 违 与 世 涤映 兮 天门 可驰 苍龙 嘷 兮 云漫扉 石泉 冽 兮 山芋 肥 俯仰 宇宙 兮 日月 蔽 亏 灵秀 回 薄 兮 野芳 呈 姿 山中 之 乐 兮 万化莫移 仙人 不来 兮 隠 者 曷 归
72e589de-24fb-4dd0-bcd7-88729687049a,嚴陵懷古,康與之,唐,诗,七言绝句,建武中兴宝运开 股肱俱是济时才 汉家鼎祚如磐石 此老方图拂袖来,"7,7,7,7",5a74e82348c6a64006e48d240e5cb104,建武 中兴 宝运开 股肱 俱 是 济 时 才 汉家鼎 祚 如 磐石 此 老方 图 拂袖 来
369d2521-8922-42d3-994c-ab5453f069c6,玉虹洞二首  其一,康與之,唐,诗,七言绝句,睡起疏帘一半开 更无人迹过青苔 须臾苍狗风前变 雷雨驱潮出海来,"7,7,7,7",fcd2d89e7e940c3c8e732068f54455ab,睡起 疏帘 一半 开 更 无人迹 过 青苔 须臾 苍狗风 前 变 雷雨 驱潮 出海 来
444d0d70-d916-46c6-880e-caa98ba6153c,玉虹洞二首  其二,康與之,唐,诗,七言绝句,满山一夜风篁响 透屋三更月露寒 自掩残书推枕睡 江湖秋梦水云宽,"7,7,7,7",736e42d55fc3513d7c3c299ad0aabeda,满山 一夜 风 篁 响 透屋 三 更 月 露寒 自掩 残书 推枕 睡 江湖 秋梦 水云 宽
