id,title,author,dynasty,genre,poem_type,sentences_simplified,meter_pattern,hash,words
308f07ed-2ee0-4d19-a36b-9b7a6cc90590,題釣雪圖  其一,趙蕃,唐,诗,五言绝句,空蒙天外林 璀璨岸头石 何许放舟回 寂然方自得,"5,5,5,5",6a81a5e6cc44d4f788e50682e9270dc0,空蒙 天外 林 璀璨 岸头 石 何许 放舟 回 寂然 方 自得
8f8de45c-e915-4097-ae38-fa40c22a731f,題釣雪圖  其二,趙蕃,唐,诗,五言绝句,沙鸥故飞飞 湖雁更历历 顾我亦忘机 相看同一适,"5,5,5,5",44f9cab184f8e273312fe421aad50ad1,沙鸥 故 飞飞 湖雁 更 历历 顾 我 亦 忘 机 相看 同一 适
ad13468d-5576-4631-a047-20989daf9822,題釣雪圖  其三,趙蕃,唐,诗,五言绝句,画师端为谁 钓者亦安在 我不识若人 相望大千内,"5,5,5,5",177d7d5399a99441c9a41e5214f91e10,画师 端 为 谁 钓者 亦 安 在 我 不识 若 人 相望 大千 内
dbc7fd5f-0012-48d1-8b1f-5308d0ae085c,題釣雪圖  其四,趙蕃,唐,诗,五言绝句,曾恨固无遗 谢兴亦不浅 人言介庵介 我谓远斋远,"5,5,5,5",ac0c73e4046d33cae3888ce2ff2fc86c,曾 恨 固 无遗 谢兴亦 不 浅 人 言介庵 介 我 谓 远 斋 远
a77fd3fc-4bb4-4ccf-8f6b-41debf722688,二十三日早霽,趙蕃,唐,诗,杂言,晴云如衣如絮 落月似钩似梳 鸬鹚㶉𫛶未觉 一段并能属予,"6,6,6,6",7580e9ae32f0bc218d22d1ad9ead26b4,晴云 如 衣 如 絮 落 月 似 钩 似 梳 鸬鹚 㶉 𫛶 未觉 一段 并能 属予
1127e794-f9a6-4e35-9e23-93ac24c912a2,喜晴  其一,趙蕃,唐,诗,七言绝句,雨脚昏昏扫不空 柴门未觉有春风 晚晴骤喜窗明处 犹倚蒲团附火红,"7,7,7,7",8989c99fef9c0e1cded09c72c539c4fd,雨脚 昏昏 扫不空 柴门 未觉 有 春风 晚晴 骤喜 窗 明处 犹 倚 蒲团 附 火红
c5d42a83-e246-4d16-b22b-bd7b44329072,喜晴  其二,趙蕃,唐,诗,七言绝句,梅花已逐冻泥空 留得余香傲晚风 春事十分财入手 只愁病眼眩青红,"7,7,7,7",6d849bcb5eb7029b0aadf7f3ac0e3d70,梅花 已 逐 冻 泥空 留 得 余香 傲 晚风 春 事 十分 财 入手 只 愁病眼眩 青红
9e431d97-fa95-4a69-a8a5-afd9be34f0c7,喜晴  其三,趙蕃,唐,诗,七言绝句,扫除诗癖未能空 从使人讥手病风 事业深虞一无就 壮颜都有几时红,"7,7,7,7",5ca30c0d9682c910991dfbccc951a741,扫除 诗癖 未能 空 从使 人 讥手 病风 事业 深虞 一 无 就 壮颜 都 有 几时 红
9ed46e6b-a2d2-4627-92a4-2a279c806750,喜晴  其四,趙蕃,唐,诗,七言绝句,两公贤比道州阳 总为勤民鬓已苍 喜雨喜晴俱有赋 乐忧宁止为诗昌,"7,7,7,7",33131a38114cad6f007677af844dba3d,两 公贤 比 道州阳 总为 勤民鬓 已 苍 喜雨 喜 晴 俱 有 赋 乐忧宁止 为 诗昌
25cca798-0559-4e30-8759-5fdac9c3f880,晚霽,趙蕃,唐,诗,七言绝句,雨歇蝉声抱木悲 茅簷独立看云移 一阴十日不见月 想见清光分外奇,"7,7,7,7",b12e187da97ea8c33235c58754a1da90,雨歇 蝉声 抱木悲 茅簷 独立 看 云 移 一 阴 十日 不见 月 想见 清 光 分外 奇
1625878e-ae57-447e-b629-dd768bcca757,帖俞王諸君求筆,趙蕃,唐,诗,七言绝句,颜公笔法有家法 豪锥料得皆千金 闻道分张遍亲友 可能乞我助呻吟,"7,7,7,7",8426c26da4074794161fd46b3cf1f9f0,颜公 笔法 有 家法 豪锥料 得 皆 千金 闻道 分张 遍 亲友 可能 乞我 助 呻吟
60902a35-1dd8-4e3e-bbee-60aec04766cb,成父期以十八日至已而爽約,趙蕃,唐,诗,七言绝句,已是跫然误足音 更堪疎雨过平林 呼灯自举一巵酒 颠倒海涛寻破衾,"7,7,7,7",515b3fd907c3892cf27527c32629ac7d,已 是 跫 然 误 足音 更 堪 疎 雨 过 平 林 呼灯自举一 巵 酒 颠倒 海涛 寻破 衾
e4f101fa-c161-4045-ad4a-b08ad70c35ad,雨後晨起懷斯遠  其一,趙蕃,唐,诗,七言绝句,梦过百花蝴蝶飞 可堪朝暮子规啼 山中有屋不归去 想见当门碧草齐,"7,7,7,7",568173e44a8b1b91906ba5eb96b259f2,梦 过 百花 蝴蝶 飞 可堪 朝暮 子规 啼 山中 有 屋 不 归去 想见 当门 碧草 齐
90132a35-95fc-4c08-a062-dc86353c9298,雨後晨起懷斯遠  其二,趙蕃,唐,诗,七言绝句,百鸟喧嘲工败眠 静听黄鸟独清圆 何云丝竹不如肉 佳处政因出自然,"7,7,7,7",e0e724a95a7deb9116ca0324538716b4,百鸟 喧嘲工败眠 静听 黄鸟 独清 圆 何云 丝竹 不如 肉 佳 处 政因 出 自然
5e3219b8-e6c2-47d8-ab5a-13df1d1f4c90,泊舟西村見居民云數里間有梅訪之殊未花,趙蕃,唐,诗,七言绝句,漠漠烟村四五家 水清霜落路平沙 我来欲问梅消息 地冷年年未放花,"7,7,7,7",1883e45d4d2553c0b0b90b16b279a0f8,漠漠 烟村 四五家 水清霜 落路 平沙 我 来 欲 问 梅 消息 地冷 年 年 未放 花
a5db9254-f84f-4e66-8932-0542ca64569a,文殊院晨起,趙蕃,唐,诗,七言绝句,山禽百族自呼名 撩我僧窗睡不成 纵汝多言吾自喜 了知今日十分晴,"7,7,7,7",870ad03cd04068ade643fb19479aec4b,山禽 百族 自 呼名 撩 我 僧 窗 睡 不成 纵 汝 多 言 吾 自喜 了知 今日 十分 晴
7b0cb33b-ea5c-4e4d-abf7-6f0b3dd7e84c,舟中清明,趙蕃,唐,诗,七言绝句,三日舟行风打头 春愁那更值覊愁 一年谁似清明节 忍向天涯除破休,"7,7,7,7",c625b5b209b37c6909d5c196eb6a1a98,三日 舟 行风 打头 春愁 那 更 值 覊 愁 一年 谁 似 清明节 忍向 天涯 除 破休
ae3b312b-92d5-4178-9c73-918608aa5343,離家,趙蕃,唐,诗,七言绝句,饥来驱我去何之 束担垂行却住时 幼女亦知离别感 挽衣端欲问归期,"7,7,7,7",3db5baac368731becb4b1d51ce839347,饥 来 驱 我 去 何之 束担 垂行 却 住 时 幼女 亦 知 离别 感 挽 衣端 欲 问 归期
979c86c7-bd26-40c4-bd67-228c3fce29c9,靈鷲道間,趙蕃,唐,诗,七言绝句,霏霏小雨湿松株 疑是初成道士图 我亦搜诗要穷底 此时幽思不枝梧,"7,7,7,7",dde124dd243ccfccb3d9a21b4aace239,霏霏 小雨 湿松 株 疑是 初 成 道士 图 我 亦 搜 诗 要 穷底 此时 幽思 不 枝梧
72fef31f-ef0d-497a-95d3-b61507950f47,竹巖道間,趙蕃,唐,诗,七言绝句,前山后山异夷险 昨日今日分炎凉 人间万事祇如此 那似一杯真意长,"7,7,7,7",876c03739e11c245f16641da7026975e,前山 后山 异夷险 昨日 今日 分 炎凉 人间 万事 祇 如此 那 似 一杯 真意 长
787318d0-761d-40c2-98f9-f2dede847988,尹丈少稷舊作借竹軒詩數首如雨重時驚入屋梢風微亦得聽蕭騷之句尤爲警拔雨中看竹因用其語作兩絕句  其一,趙蕃,唐,诗,七言绝句,山居面面皆修竹 雨重时惊入屋梢 坐诵方斋旧诗句 人间那有续弦胶,"7,7,7,7",a0ec703828927a33f90e62058c52b37c,山居 面面 皆 修 竹 雨 重时 惊入 屋梢 坐诵 方斋 旧 诗句 人间 那 有 续弦 胶
693c102e-94df-43d8-9570-65873268d6b1,尹丈少稷舊作借竹軒詩數首如雨重時驚入屋梢風微亦得聽蕭騷之句尤爲警拔雨中看竹因用其語作兩絕句  其二,趙蕃,唐,诗,七言绝句,离立何妨出屋高 风微亦得听萧骚 南山昨夜新雷起 行有横鞭破土膏,"7,7,7,7",ee3bdd2e34974be17c9a8283ceaf9b20,离立 何妨 出 屋 高 风 微 亦 得 听 萧骚 南山 昨夜 新雷 起 行 有 横 鞭 破土 膏
01039647-0978-4608-9c63-4d9494c489d8,答施榮甫,趙蕃,唐,诗,七言绝句,昨韵村中好客稀 今吟临水送将归 笑谈未了风吹断 何日重来款竹扉,"7,7,7,7",4be9742815200c3202ea9d686ecc6dc4,昨 韵 村 中 好客 稀 今 吟 临水 送 将 归 笑谈 未了 风吹 断 何日 重 来款 竹扉
1cc2b6ed-59b6-4ff1-8cca-72457eee617a,碧雲  其一,趙蕃,唐,诗,杂言,碧云散舒 合且复离 皓月涌照 圆而不亏 嗟我所期 曷云不来,"4,4,4,4,4,4",74f3e7ed1673f537e01b368d75db661e,碧云 散 舒 合 且 复离 皓月 涌照 圆而不亏 嗟我 所期 曷 云 不 来
2382e800-8b70-4bc9-980c-e3bca3ed973e,碧雲  其二,趙蕃,唐,诗,杂言,翳翳村巷 遥遥犬声 肃肃庭树 啾啾鸟鸣 所期不来 实关我情,"4,4,4,4,4,4",a31017d9fffd20f92b2bce02933c14e0,翳 翳 村 巷 遥遥 犬声 肃 肃 庭树 啾 啾 鸟鸣 所期 不来 实关 我 情
8a2e8c9d-82da-4e18-96fe-64d19daea03a,碧雲  其三,趙蕃,唐,诗,杂言,寒镫既张 幽室有光 岂无他人 惟子之良 闭彼柴荆 今夕斯长,"4,4,4,4,4,4",b0b67a6a02c8cb379c31fb38ecfaeb3c,寒 镫 既 张 幽室 有 光 岂 无 他人 惟 子之良 闭彼柴荆 今夕 斯长
9b7f3832-1cf3-45e1-ba47-bfecd74aa06b,三月十三日夜五更聞杜鵑時成父欲入浙因賦六章章四句以送之  其一,趙蕃,唐,诗,杂言,不如归去 苍山茂树 独胡为乎 空此号謼,"4,4,4,4",ba4b58c30340ae47e7a3abbabf0e7d4c,不如归去 苍山 茂树 独 胡为乎 空此号 謼
53842117-be34-4f4e-a6ba-533206bd087b,三月十三日夜五更聞杜鵑時成父欲入浙因賦六章章四句以送之  其二,趙蕃,唐,诗,杂言,归去来兮 斯言可师 我今已归 胡能不知,"4,4,4,4",c05a8a2093fd5e5e088efafd4cb4033a,归去来兮 斯言 可 师 我 今 已 归 胡能 不知
5802f850-6ae7-4159-9e69-e0cfc4fb61c8,三月十三日夜五更聞杜鵑時成父欲入浙因賦六章章四句以送之  其三,趙蕃,唐,诗,杂言,不如归去 春且云莫 山中之乐 岂同岐路,"4,4,4,4",f7230a10bd8d7b30d130c5254b7c3a9f,不如归去 春 且云 莫 山中 之 乐 岂同 岐路
523ba74d-1f88-4f88-8dc5-cd9984ab551e,三月十三日夜五更聞杜鵑時成父欲入浙因賦六章章四句以送之  其四,趙蕃,唐,诗,杂言,归去来兮 言发动随 古之逸民 舍陶而谁,"4,4,4,4",8203872f5ed3c858c8a3e3e6f94f0e13,归去来兮 言 发动 随 古之 逸民 舍陶 而 谁
75845834-666b-4c13-aebb-4e754312a962,三月十三日夜五更聞杜鵑時成父欲入浙因賦六章章四句以送之  其五,趙蕃,唐,诗,杂言,不如归去 载丁载宁 劝子勿去 子宁我听,"4,4,4,4",175306b76b0a77fb9a7cc8b463cde75c,不如归去 载 丁载宁 劝 子 勿 去 子宁 我 听
53aba926-5c4b-4dc6-8b5d-4480e6a69ee5,三月十三日夜五更聞杜鵑時成父欲入浙因賦六章章四句以送之  其六,趙蕃,唐,诗,杂言,不如归去 子宁肯住 归去来兮 早歌式微,"4,4,4,4",50b0026f3393ecc884c805fff445bc9f,不如归去 子 宁肯 住 归去来兮 早 歌 式微
94882ff7-68f8-4748-99ab-c81b02a299d5,山行見月作  其一,趙蕃,唐,诗,杂言,有风肃然 落于树巅 使我沈疴 不药而痊,"4,4,4,4",0a94f648bb0e125a62f98a1f3aeb836e,有 风 肃然 落于 树巅 使 我 沈 疴 不药 而 痊
b3285714-6cbe-4312-93dc-12d810b35175,山行見月作  其二,趙蕃,唐,诗,杂言,意行何之 陟此云岭 如梦而觉 如昏而醒,"4,4,4,4",f52972f01f3e8b09c521d65f9161dcb4,意行 何之 陟 此 云岭 如梦而觉 如昏 而 醒
9fd9a8db-6b84-4609-91b2-39ba9b7438bc,山行見月作  其三,趙蕃,唐,诗,杂言,东坡老翁 有言莫酬 凉天佳月 即为中秋,"4,4,4,4",35731d00cdc0d79c799ba49cd71b25ca,东坡 老翁 有言莫酬 凉 天 佳 月 即 为 中秋
00490ce0-f9d6-4fe6-aba6-21869c5ff616,山行見月作  其四,趙蕃,唐,诗,杂言,恨我无酒 负尔一醉 酌兹寒泉 兀尔忘睡,"4,4,4,4",87c905ad9d853d9178afeb06e52e05a4,恨 我 无 酒 负 尔一醉 酌 兹 寒 泉 兀 尔 忘 睡
e5deb698-6edb-45de-886c-cd240f38783b,古意二首  其一,趙蕃,唐,诗,五言律诗,齐王昔好竽 有客工鼓瑟 持之立王门 三年不得入 不知所好异 卒致遭怒叱 我今幸早计 归去无自逸,"5,5,5,5,5,5,5,5",09f8cde7497b0265e8dfc20550d9bc7c,齐王 昔 好 竽 有 客工 鼓瑟 持之立 王门 三年 不得 入 不知 所 好 异 卒 致 遭 怒叱 我 今 幸早 计 归去 无自逸
dd730439-12bd-4b69-afc9-af68456ec590,古意二首  其二,趙蕃,唐,诗,五言律诗,曾闻蜀道难 难于上青天 蜀道难何以 嵯峩剑门关 未抵鄱阳湖 无风浪掀船 脱身其早归 无污蛟鳄涎,"5,5,5,5,5,5,5,5",62f5662e1c1f43f9539ba424e1801f42,曾 闻 蜀道难 难于上青天 蜀道难 何以 嵯 峩 剑门关 未抵 鄱阳湖 无 风浪 掀船 脱身 其早 归 无污 蛟 鳄 涎
91bf9372-e0c2-4fea-a046-e4cf7152d7f5,擬古,趙蕃,唐,诗,五言律诗,松柏抱奇姿 自应能岁寒 篱菊盖小草 后雕良独难 谁云一时芳 顾将比春兰 兰开桃李际 菊傲风霜阑,"5,5,5,5,5,5,5,5",725b2d7b3335f860337f7d91d3e37946,松柏 抱奇 姿 自 应能 岁寒 篱菊 盖 小草 后雕 良独 难 谁 云 一时 芳 顾 将 比 春兰 兰开 桃李 际 菊 傲 风霜 阑
e1ccb99a-149a-4a49-9c8c-4d862177e3d2,呈尤運使袤延之五首  其一,趙蕃,唐,诗,五言律诗,往者江次对 不妄出荐口 门无杂遝宾 麟角鼈肋九 斯文独许公 是谓言可否 几年阙通谒 今乃获拜手,"5,5,5,5,5,5,5,5",5f43e01f468a13577d50d4d2a1a0d54e,往者 江次 对 不妄 出荐 口 门 无 杂 遝 宾 麟角 鼈 肋 九 斯文 独许 公 是 谓 言 可否 几年 阙通 谒 今 乃 获拜 手
9a5e4826-3738-4a25-ad1e-e703c3e42c79,呈尤運使袤延之五首  其二,趙蕃,唐,诗,五言律诗,今时使者中 所进非一律 学术用其长 公独名副实 江左更江右 非为循更迭 政以岁方艰 当遣德星出,"5,5,5,5,5,5,5,5",46571316cd84cf6c4a66a4e986168574,今时 使者 中 所 进非 一律 学术 用 其 长 公独名 副 实 江左 更 江右 非为 循 更迭 政以岁方艰 当 遣 德星 出
462d0e7a-8bf8-4803-b994-7faded2e3e59,呈尤運使袤延之五首  其三,趙蕃,唐,诗,五言律诗,少年见公文 大类韩退之 集古一千卷 复楷欧少师 楷欧亦类韩 万顷定渺弥 于今到收敛 宁易窥涘涯,"5,5,5,5,5,5,5,5",0e7c22a9f60c2a0bf4e49e43af7af563,少年 见 公文 大 类 韩 退 之 集古 一千卷 复 楷 欧少师 楷 欧亦 类 韩 万顷 定 渺 弥 于今 到 收敛 宁易 窥 涘 涯
4a517e3c-ecd4-4d95-a5a3-b9cad7d1da57,呈尤運使袤延之五首  其四,趙蕃,唐,诗,五言律诗,翰墨有先达 知己仅三数 省斋怜其贫 晦庵过其誉 怀哉介庵老 先我骑鲸去 公如幸教之 岂叹岁不与,"5,5,5,5,5,5,5,5",50f48fabcac4dc653f2440c1d1189ab3,翰墨 有先 达 知己 仅 三数 省 斋 怜 其 贫 晦庵 过其 誉 怀哉介庵 老 先 我 骑 鲸 去 公如 幸教之 岂 叹 岁 不 与
08fa1996-1036-40dc-8d24-73a7ad3a1182,呈尤運使袤延之五首  其五,趙蕃,唐,诗,五言律诗,青衿诗学为 白发步乃却 茫茫悟中入 了了难边觉 抱疴每向人 谁有如神药 公乎有异闻 蕲为启玄钥,"5,5,5,5,5,5,5,5",cddabd7baf7b13b951f329650c6b3b59,青衿 诗学 为 白发 步乃 却 茫茫 悟 中 入 了了 难边 觉 抱疴 每 向 人 谁 有如 神药 公乎 有 异闻 蕲 为 启 玄钥
712b7de1-1c55-45cd-a722-d7bffe240c7a,常州先生以太守入對五首  其一,趙蕃,唐,诗,五言律诗,皇皇几甸符 郁郁容台礼 固殊彼奏召 有待今沃启 上能格君心 次可裨国体 俗吏急簿书 细务纷盐米,"5,5,5,5,5,5,5,5",f302ec1686d372f9b1e1d001995277c2,皇皇 几甸 符 郁郁 容台礼 固殊 彼 奏 召 有待 今 沃启 上 能格 君心 次 可 裨 国体 俗 吏 急 簿 书 细务纷 盐米
6cef188f-8d66-47ab-bb4d-728391ba3037,常州先生以太守入對五首  其二,趙蕃,唐,诗,五言律诗,争观苏翰林 未识李北海 独能亲话言 异彼想风采 徬徨计拍马 留滞搴兰茝 匹马候南还 轻舟即东汇,"5,5,5,5,5,5,5,5",e7aa3b1299e8c0542e00167b732fafbb,争 观苏 翰林 未识 李北海 独能 亲话 言 异彼想 风采 徬徨 计 拍马 留滞 搴 兰 茝 匹 马候 南 还 轻舟 即 东汇
1b0e01f7-4c5d-428d-ba3b-ffb776e6d515,常州先生以太守入對五首  其三,趙蕃,唐,诗,五言律诗,一州固匪轻 四海岂不重 与其事扶疎 孰若深培壅 骥不取德称 马多求驾泛 伟哉底柱功 障彼百川汹,"5,5,5,5,5,5,5,5",ff590083fc0dd3e4e7c8c96cf7e7cc2a,一 州 固匪轻 四海 岂 不重 与其 事 扶 疎 孰若 深 培 壅 骥 不取 德 称 马多求 驾 泛 伟哉 底柱 功 障 彼 百川 汹
0b31b7c7-f59d-4af5-9e6c-ceb1f5fdd31c,常州先生以太守入對五首  其四,趙蕃,唐,诗,五言律诗,青毡非旧物 乔木岂故国 家传墨庄书 人嗣文靖德 欲知治兴衰 是系道滋熄 愚独愧衣冠 身宜亲稼穑,"5,5,5,5,5,5,5,5",2ec58c93e7007632d51c4a55768b7ea6,青 毡 非 旧物 乔木 岂 故国 家传 墨庄 书 人 嗣 文靖德 欲 知治 兴衰 是系道滋熄 愚独愧 衣冠 身宜 亲 稼穑
629715ae-3e79-486d-a00e-1205f05dca22,常州先生以太守入對五首  其五,趙蕃,唐,诗,五言律诗,姑苏访虎丘 西庵作清游 能谈著书人 老僧非黑头 义兴望荆溪 景坡亦前修 不能乘桴者 沧波没白鸥,"5,5,5,5,5,5,5,5",7f0d3b113d661f93adced2982d54f27f,姑苏 访 虎丘 西庵 作清 游 能 谈 著书 人 老僧 非 黑头 义兴 望 荆溪 景坡 亦 前修 不能 乘 桴 者 沧波 没白 鸥
9e5b7e89-6c76-4962-9873-829448c101ee,送趙叔自吏部知福州四首  其一,趙蕃,唐,诗,五言律诗,当年治安策 通达如贾谊 汲黯不留内 似非朝廷美 得非萧望之 政事要详试 两州已有声 刺史还连帅,"5,5,5,5,5,5,5,5",8a00d9a91e6998e7d56152b9b2b3e29b,当年 治安 策 通达 如 贾谊 汲 黯 不留 内 似非 朝廷 美 得 非 萧望之 政事 要 详 试 两州 已有 声 刺史 还 连帅
897dc9a8-bf3a-4950-95ec-fc287dfe9e49,送趙叔自吏部知福州四首  其二,趙蕃,唐,诗,五言律诗,人从闽中来 尽道闽中乐 旧谷既年丰 今雨还时若 公行亦何事 重赴三山约 我乃愿从之 微官还见缚,"5,5,5,5,5,5,5,5",57e5fda50ed34e2fa4fe2a80f34d8e1c,人 从 闽 中 来 尽 道 闽 中乐 旧谷 既 年 丰 今雨 还 时 若 公行 亦 何事 重 赴 三山 约 我 乃 愿 从 之 微官 还 见 缚
84d02c76-3d0a-4fce-be42-a1259aaabbf2,送趙叔自吏部知福州四首  其三,趙蕃,唐,诗,五言律诗,公虽去朝廷 秘殿通班在 不应献纳忠 于尔分内外 而况我此州 甘棠存蔽芾 旱疫苦相仍 要当蒙大赉,"5,5,5,5,5,5,5,5",678ea2d6de3e452e80044706f6e49e3b,公 虽 去 朝廷 秘殿 通班 在 不 应 献纳 忠 于尔 分 内外 而况 我此 州 甘棠 存蔽 芾 旱 疫 苦相 仍 要 当 蒙大赉
7e6d6e59-7750-415d-a040-7eca2cd6853b,送趙叔自吏部知福州四首  其四,趙蕃,唐,诗,五言律诗,忆昨过辞公 云有湖外役 迟迟未能去 乃此困艰食 湖外米虽贱 旱岁贾者多 贾多米必贵 吾饥其奈何,"5,5,5,5,5,5,5,5",c5948afcbaf6951d2d3ed77c47d88b26,忆昨 过辞 公 云有湖 外役 迟迟 未能 去 乃此 困 艰食 湖外 米 虽 贱 旱岁 贾者 多 贾 多米 必贵 吾 饥其 奈何
b1cef321-3e8b-474b-8c96-558e48fe4025,呈陸嚴州五首  其一,趙蕃,唐,诗,五言律诗,江山不因人 何以相发挥 人而非江山 兴亦无所归 是故新定郡 得公倍光辉 岂惟江山然 鸥鸟亦依依,"5,5,5,5,5,5,5,5",9086131a31d163dfacf996635b290b4c,江山 不 因 人 何以 相 发挥 人 而 非 江山 兴亦无所归 是 故 新定 郡 得 公倍 光辉 岂 惟 江山 然 鸥鸟 亦 依依
117af861-cd7c-40e0-b315-998ef0890524,呈陸嚴州五首  其二,趙蕃,唐,诗,五言律诗,簿领古白下 檄书走临川 陈诗道所怀 奈此巍巍然 临分得闻见 语以故有连 此意亦厚矣 乖离今十年,"5,5,5,5,5,5,5,5",3eac0ed4a5ff9d09a4a7829aa1a3de3b,簿 领古白 下 檄书 走 临川 陈诗道 所 怀 奈 此 巍巍 然 临 分得 闻见 语以故 有 连 此 意 亦 厚 矣 乖离 今 十年
7a82a0f0-5eb8-480e-8e44-101fae3621f0,呈陸嚴州五首  其三,趙蕃,唐,诗,五言律诗,会稽岩壑林 新定山水薮 一焉唤来居 一焉烦出守 人言公未遇 我独以为不 得失彼此间 于兹分薄厚,"5,5,5,5,5,5,5,5",c63095a7f8b16e9f22b7ac18f79065e2,会 稽 岩 壑 林 新 定 山水 薮 一 焉 唤 来 居 一焉烦 出守 人 言 公未 遇 我 独 以为 不 得失 彼此间 于兹 分 薄厚
4ba31e21-fb59-4a0d-a1b2-3e31145d1d98,呈陸嚴州五首  其四,趙蕃,唐,诗,五言律诗,一代文翰主 百年风月怀 于今则所独 视古良与偕 试评云雾窗 孰与山水斋 况我方与严 身沈名不埋,"5,5,5,5,5,5,5,5",9ac2ec000c3ebb5a610adeb71d4eed2c,一代 文翰 主 百年 风月 怀 于今 则 所 独 视 古良 与 偕 试评 云雾 窗 孰与 山水 斋 况 我方 与 严 身 沈 名 不 埋
d3d5be89-504f-4cf0-b4c0-ef9d77e1b031,呈陸嚴州五首  其五,趙蕃,唐,诗,五言律诗,往游金陵都 始攀石湖仙 为我谈公诗 大雅后有焉 谓我欠公诗 勉哉成其天 此语久不理 今朝堕公前,"5,5,5,5,5,5,5,5",f52728f085cce60983adedd84ebf2178,往 游 金陵 都 始 攀 石湖 仙 为 我 谈 公诗 大雅 后 有 焉 谓 我 欠 公诗 勉哉成其天 此 语 久 不理 今朝 堕 公前
32f44ca5-8911-4fb4-8e9a-f302871ed39c,聞克齋舅氏除江東提舉以此寄賀,趙蕃,唐,诗,五言古体,春风桃李花 开落几许时 谅彼松柏质 动有千岁期 舅氏早负名 不作窈窕姿 冰霜饱摧剥 未觉明堂迟 小休朱两轓 四牡已载驰 歛散有常度 刺举由我施 过家得上冢 偃薄宁久为 又意汉廷上 鼓舞须厥辞 文章岂憎命 穷人讵因时 贱子盍自勉 毋庸罪毛锥,"5,5,5,5,5,5,5,5,5,5,5,5,5,5,5,5,5,5,5,5",d6c477cd37acd032a64b4f7a60fe716b,春风 桃李 花 开落 几许 时 谅彼 松柏 质 动有 千岁 期 舅 氏 早 负名 不 作 窈窕 姿 冰霜 饱 摧剥 未觉 明堂 迟 小休 朱两 轓 四 牡已载 驰 歛 散 有 常 度 刺举 由 我 施 过家 得上 冢 偃薄宁久 为 又 意 汉廷 上 鼓舞 须厥辞 文章 岂 憎命 穷人 讵 因时 贱 子 盍 自勉 毋庸 罪毛 锥
c127368f-5f81-4eec-bd7c-07a913ec4f5d,寄賀周子充除左相留正除右相王謙仲除參政,趙蕃,唐,诗,五言古体,淳熙十六年 正月十九日 雪余雨更作 有客方抱疾 忽传底处书 昏暮叩蓬荜 问之何许人 乃是吾家姪 书中道何为 除目报甲乙 要令二父知 此意深所悉 我方盘谷归 讵应闻黜陟 虽云在田野 又可忘辅弼 况于乡里贤 与夫旧连率 及其先友家 投分亦颇密 恭惟三君子 德盛难具述 要皆由从官 以至秉政笔 于今天下事 孰得复孰失 仰思与夜继 想不遑暇逸 置邮速传命 颂口当四出 而我病不能 欲置还未毕 要歌夔臯诗 称美宁敢溢 愿观勋业成 公论斯可必 曾闻鸟鸣春 气应还唧唧 喜甚屐且折 忧深纬宁恤,"5,5,5,5,5,5,5,5,5,5,5,5,5,5,5,5,5,5,5,5,5,5,5,5,5,5,5,5,5,5,5,5,5,5,5,5,5,5,5,5",1dc16156596eb86cbb79ed05d3d6a406,淳熙 十六年 正月 十九日 雪余雨 更 作 有 客方 抱 疾 忽 传 底处 书 昏暮 叩 蓬荜 问 之 何许人 乃是 吾 家 姪 书 中道 何为 除 目报 甲乙 要 令 二 父知 此 意深 所悉 我方 盘谷 归 讵 应 闻黜 陟 虽 云 在 田野 又 可 忘 辅弼 况于 乡里 贤 与 夫 旧 连率 及其 先友 家 投分 亦 颇 密 恭 惟 三 君子 德盛 难 具述 要 皆 由 从 官 以至 秉政 笔 于今 天下事 孰得复孰失 仰思 与 夜 继 想 不 遑 暇 逸 置 邮速 传命 颂口 当 四出 而 我病 不能 欲置 还 未 毕 要 歌 夔 臯 诗 称 美宁 敢 溢 愿观 勋业 成 公论 斯可必 曾 闻 鸟鸣 春 气应 还 唧唧 喜 甚 屐 且 折 忧 深纬 宁恤
551a6bd4-c36e-4e7f-9eec-7e07a5725618,子暢尉曹秩滿侍親攝戶掾於上饒賦詩二首以送之  其一,趙蕃,唐,诗,五言律诗,游君父子间 情谊等骨肉 那知三年度 但谓一日足 今晨复何事 溪头有行舳 临别惨莫言 裴回谩瞻瞩,"5,5,5,5,5,5,5,5",82240f1e48a46e2004daf73268a3aafc,游君 父子 间 情谊 等 骨肉 那 知 三 年度 但 谓 一日 足 今晨 复 何事 溪头 有 行 舳 临别 惨 莫言 裴 回 谩瞻 瞩
d1280464-34a9-4085-957d-07aa11b95bfa,子暢尉曹秩滿侍親攝戶掾於上饒賦詩二首以送之  其二,趙蕃,唐,诗,五言律诗,平生几游居 有亲亦有故 一饭或相忘 素书不能屡 心知世情薄 但益古人慕 如君父子贤 百盖一二数,"5,5,5,5,5,5,5,5",b7180ddc95c2ca4536eb77f5d481604d,平生 几 游居 有亲 亦 有 故 一 饭 或 相忘 素书 不能 屡 心 知 世情 薄 但益 古人 慕 如 君 父子 贤 百盖 一 二数
52b5fd7f-3f14-4a55-ba33-f3fa80b924b9,寄曾運使,趙蕃,唐,诗,五言古体,知名必曹刘 乃可暗中索 无闻若我遭 过眼谁复忆 如何十年后 姓名犹见识 当时所陈诗 亦复能道说 岂我能致然 先生自为德 维时岁云莫 归路千山隔 见公不三四 身已限南北 迨兹去无由 乃悔来卒迫 况今落蛮夷 公且天咫尺 犹拟信州船 看竹茶山宅,"5,5,5,5,5,5,5,5,5,5,5,5,5,5,5,5,5,5,5,5",ee15ef8c504dfa7da41ff128df555285,知名 必 曹刘 乃 可 暗中 索 无闻 若 我 遭 过眼 谁 复忆 如何 十年 后 姓名 犹 见识 当时 所 陈诗 亦 复能 道 说 岂 我 能致 然 先生 自为 德 维 时 岁 云 莫 归路 千山 隔 见公不 三四 身 已 限 南北 迨 兹 去 无 由 乃悔 来 卒 迫 况 今 落 蛮夷 公 且 天 咫尺 犹拟 信州 船 看 竹 茶山 宅
