id,title,author,dynasty,genre,poem_type,sentences_simplified,meter_pattern,hash,words
1eddf43d-8763-4d3f-b6d8-855faf418916,春景 遊絲白日靜,劉辰翁,唐,诗,五言古体,静似长门里 初晴未暑时 悠悠销白日 冉冉上游丝 白发因风起 青虫映户垂 墙阴双蝶远 花影一帘迟 新垒干泥絮 晴衙散蜜脾 鸟惊梅子落 深院客争棋,"5,5,5,5,5,5,5,5,5,5,5,5",3ee7254d445646519a67ccdfa358f874,静似 长门 里 初晴 未暑 时 悠悠 销 白日 冉冉 上 游丝 白发 因风 起 青虫 映户 垂 墙 阴 双蝶 远 花影 一 帘 迟 新垒 干泥 絮 晴 衙散蜜 脾 鸟 惊 梅子 落 深院 客争 棋
3982cfd5-c10f-4cf5-920e-5baf657a1feb,春景 柳葉暗金溝,劉辰翁,唐,诗,五言古体,辇路垂垂柳 昆明寂寂流 近天高翠叶 映日暗金沟 眠起当前殿 萎蕤拂御舟 锁成三阁暮 流出六宫愁 桐影题难立 杨花宕不收 至今寒食雨 堕泪曲江头,"5,5,5,5,5,5,5,5,5,5,5,5",b3f1ad30d6140a16237b40437438afa2,辇 路 垂 垂柳 昆明 寂寂 流 近天 高翠叶 映 日 暗金 沟 眠 起 当 前殿 萎蕤 拂 御 舟 锁 成三阁 暮 流出 六宫 愁 桐影题 难立 杨花 宕 不 收 至今 寒食 雨 堕泪 曲江 头
aa317683-9c1a-4a49-938d-7c8e3dc7dfbe,春景 花飛減却春,劉辰翁,唐,诗,五言古体,老子情如海 花无醉后新 飞来如许雪 减却不多春 轻薄随流水 颠狂落近邻 犹寒犹未晚 半雨半成尘 拾翠危无路 残红老得人 清晨添酒量 日日是芳辰,"5,5,5,5,5,5,5,5,5,5,5,5",5e6ce4d11b75bb3b834bf4cd51d1a781,老子 情如海 花无醉 后 新 飞来 如许 雪 减却 不 多 春 轻薄 随 流水 颠狂 落 近邻 犹寒 犹 未晚 半 雨 半成 尘 拾翠危无路 残红 老 得 人 清晨 添 酒量 日日 是 芳辰
10fb230e-568d-4217-8c96-43ee9418f0f5,春景 城春草木深,劉辰翁,唐,诗,五言古体,春又不知暮 城荒独至今 楼台花下远 草木雨中深 寒食无烟绿 颓垣有月侵 荒苔随意古 落子又成阴 邻笛残兵泪 胡琴故国心 废兴天不语 钟鼓遍园林,"5,5,5,5,5,5,5,5,5,5,5,5",4e024af2bdfcdcabd17293cffdf80869,春 又 不知 暮 城荒 独 至今 楼台 花下 远 草木 雨 中 深 寒食 无烟 绿 颓 垣 有 月 侵 荒苔 随意 古 落子 又 成 阴 邻笛 残兵 泪 胡琴 故国 心 废兴 天 不语 钟鼓 遍 园林
e3ee062c-c185-458f-b178-83b73e40bb55,春景 春色在鄰家,劉辰翁,唐,诗,五言古体,春色阑珊去 朱门懒梦华 悠悠看蝶翅 往往在邻家 暖日明金谷 光风媚浣沙 似闻携手笑 疑有隔墙花 望眼穿银汉 香尘透绿纱 是谁窥宋玉 憔悴一枝斜,"5,5,5,5,5,5,5,5,5,5,5,5",8686b34d8ef21b3597cb54643da9170a,春色 阑珊 去 朱门 懒 梦华 悠悠 看 蝶翅 往往 在 邻家 暖 日 明 金谷 光风 媚 浣 沙 似 闻 携手 笑 疑有 隔墙 花 望眼 穿 银汉 香尘 透绿 纱 是 谁 窥 宋玉 憔悴 一枝 斜
34b03e06-6d47-40b8-90a5-0ab3fbfbc9b7,春景 吹面受和風,劉辰翁,唐,诗,五言古体,寒曾欺我倒 今日是和风 吹面浓春酒 开怀受化工 未知来暖律 政似识癯翁 大袖犹堪满 衰颜欲更红 鬓如新柳动 鼻与暗香通 天上知何信 千花一笑中,"5,5,5,5,5,5,5,5,5,5,5,5",6a44d5dc5b094733556270c57033181d,寒曾 欺 我 倒 今日 是 和 风 吹面 浓 春酒 开怀 受 化工 未知 来 暖律 政似识 癯 翁 大袖 犹堪满 衰颜 欲 更 红 鬓 如 新 柳动 鼻 与 暗香 通 天上 知何 信 千花一笑 中
694d36c2-b6f4-4eb7-86ee-7c5fb5a13a65,春景 火樹銀花合,劉辰翁,唐,诗,五言古体,星炬乱林鸦 火城标赤霞 端门开璧月 散树合银花 光燄摇千尺 扶疏转九华 昭回三阁近 凿落万枝斜 玉李迷天象 金莲出内家 龙光如海蜃 犹有误连车,"5,5,5,5,5,5,5,5,5,5,5,5",2acc25b2e6ad009ba33b751bddc78f54,星炬乱林 鸦 火 城标 赤霞 端门 开 璧月 散树 合 银花 光 燄 摇 千尺 扶疏 转 九华 昭 回 三 阁 近 凿落 万枝 斜 玉李迷 天象 金莲 出 内家 龙光 如海蜃 犹 有误 连车
8486f644-c0b1-4681-9203-8ce39ed11785,夏景 薰風自南來,劉辰翁,唐,诗,五言古体,当年唐殿阁 何似道人庵 闲日长如此 薰风来自南 清香吹不断 大暑故如惔 静见花阴午 凉添竹径三 客遮前席坐 人卧北窗酣 别墅棋边急 闲将赤壁谈,"5,5,5,5,5,5,5,5,5,5,5,5",0c1d03f037294dee90d77b3dd0cdaa2e,当年 唐 殿阁 何 似 道人 庵 闲日 长 如此 薰风 来自 南 清香 吹 不断 大暑 故 如 惔 静见花 阴午 凉 添 竹径 三 客 遮 前席 坐 人 卧北 窗 酣 别墅 棋 边 急 闲 将 赤壁 谈
03fd9763-a350-4af4-91ba-b88897232caf,夏景 夏雨生衆綠 其一,劉辰翁,唐,诗,五言古体,入夏可曾晴 阴阴众绿成 但惊春尽去 谁信雨中生 一月须梅润 千林但叶声 荷边蒲猗傩 桑外笋峥嵘 芳草非无恨 新条各向荣 秧田禾似浪 满眼几时平,"5,5,5,5,5,5,5,5,5,5,5,5",4070deb4f6c5bf2090f1e8be5601cf3e,入夏 可 曾 晴 阴阴 众 绿 成 但 惊春尽 去 谁 信雨 中 生 一月 须梅润 千林 但 叶声 荷边 蒲猗 傩 桑外笋 峥嵘 芳草 非无恨 新 条 各 向 荣 秧田 禾 似 浪 满眼 几时 平
c69494c2-eef8-4e15-8582-51e4fe32ad2b,夏景 夏雨生衆綠 其二,劉辰翁,唐,诗,五言古体,无人嫌夏雨 众木共欣荣 已办黄梅熟 还将绿叶生 送春无物色 尽日是簷声 处处桑麻长 阴阴桃李成 风翻蒲水白 烟共草天平 山色沈冥久 朝来两黛横,"5,5,5,5,5,5,5,5,5,5,5,5",ea625452bcd289127da4eda0c89818b4,无人 嫌 夏雨 众木 共 欣荣 已 办 黄梅 熟 还 将 绿叶 生 送 春 无 物色 尽日 是 簷 声 处处 桑麻长 阴阴 桃李 成 风 翻 蒲水白 烟共草 天平 山色 沈冥久 朝 来 两 黛横
ced48d2a-9d77-4b48-93d4-db316c2b5e97,夏景 雨過苔花潤,劉辰翁,唐,诗,五言古体,雨过残春远 晴天半入梅 草根余落照 花润只深苔 山共朱帘卷 庭无蜡屐来 翠钱流地满 珠靥照人开 寂寂承残霤 青青绕废台 唾茸宫壁在 残月照余哀,"5,5,5,5,5,5,5,5,5,5,5,5",8eeb3113e9de6f67051ea50428a1796b,雨 过 残春 远 晴天 半 入梅 草根 余 落照 花润 只 深 苔 山共朱 帘 卷 庭 无 蜡 屐 来 翠 钱 流地 满 珠 靥 照 人 开 寂寂 承 残 霤 青青 绕 废台 唾茸 宫壁 在 残月 照 余哀
fbd0b1df-8472-47aa-801d-16c5024b05c0,夏景 既雨晴亦佳,劉辰翁,唐,诗,五言古体,既雨失阴霾 天怜万灶蛙 是虽犹暑润 亦自觉晴佳 早见瓢翻海 今无漏透阶 但能开晚景 麤足慰人怀 山翠光浮玉 涂泥软衬鞋 一帘花露影 醉眼为渠揩,"5,5,5,5,5,5,5,5,5,5,5,5",aca7c5a9a2832389576d33cc35fd59c3,既 雨失 阴霾 天怜 万 灶 蛙 是 虽 犹暑润 亦 自觉 晴佳 早 见 瓢 翻 海 今 无漏 透阶 但 能开 晚景 麤 足 慰 人 怀 山翠光 浮玉 涂泥 软 衬鞋 一 帘 花露 影 醉眼 为 渠 揩
3c986bb8-6a0c-428e-9081-ffb4216e4f71,夏景 樹濕風凉進,劉辰翁,唐,诗,五言古体,树晚晴犹湿 好风如故长 翛然林下意 进似雨时凉 坐觉茅容徙 来看吕政忙 飘萧初似暑 淅沥转成霜 倚袖岚添翠 题秋叶欲黄 不知兼露下 河汉芰荷香,"5,5,5,5,5,5,5,5,5,5,5,5",6b6991f7c5eabfe13e50dc13561888a3,树 晚晴 犹湿 好 风 如故 长 翛 然 林下 意 进似 雨 时 凉 坐觉 茅容 徙 来看 吕政忙 飘 萧初 似 暑 淅沥 转成 霜 倚 袖 岚 添 翠 题 秋叶 欲 黄 不知 兼露 下 河汉 芰 荷香
559a1b65-ea57-46a5-813c-119eb24a99c3,夏景 松凉夏健人 其一,劉辰翁,唐,诗,五言古体,松影夏天云 凉开一院新 若无如此暑 可以健于人 风外潮声起 林间客欠伸 自怜三伏日 重得百年身 鹤唳如轻举 儿扶更怒嗔 下山逢急雨 为洗覆车尘,"5,5,5,5,5,5,5,5,5,5,5,5",69c7fa425c246d000e1ce2c20ca771f2,松影 夏天 云 凉 开 一 院 新 若 无 如此 暑 可以 健于 人 风 外 潮声 起 林间 客 欠伸 自怜 三伏 日 重 得 百年 身 鹤唳 如 轻举 儿 扶 更 怒嗔 下山 逢急雨 为 洗 覆车 尘
bd9e2432-2131-4a30-bf02-3eb4c0d67ada,夏景 松凉夏健人 其二,劉辰翁,唐,诗,五言古体,天地若为容 凉阴何处逢 困人惟夏日 健我是云松 雨立三千丈 风生一万重 如餐华峰藕 不藉葛陂龙 脱帽苍虬笑 披衣病鹤松 月明天似水 归路踏芙蓉,"5,5,5,5,5,5,5,5,5,5,5,5",a1923322a47497602e4c0e212c6677e5,天地 若为 容 凉阴 何处 逢 困人 惟 夏日 健 我 是 云松 雨立 三千丈 风生 一万 重 如 餐 华峰 藕 不藉 葛陂龙 脱帽 苍 虬笑 披衣 病鹤 松 月 明天 似 水 归路 踏 芙蓉
d8f4b162-35a6-4b92-bb76-1cfd19139f6e,夏景 露頂灑松風,劉辰翁,唐,诗,五言古体,野处阙过逢 投巾仰露空 萧萧松下老 洒洒顶门风 暑不容章甫 天犹念秃翁 昂霄潮汹汹 落雪鬓蓬蓬 搔首平生事 忘形半醉中 蓬莱归去路 潦倒笑臣同,"5,5,5,5,5,5,5,5,5,5,5,5",2167e512e23ebef68ef2bcd178222930,野 处 阙 过 逢 投巾 仰露 空 萧萧 松下 老 洒洒 顶门 风 暑 不容 章甫 天 犹念 秃 翁 昂霄潮 汹汹 落雪 鬓 蓬蓬 搔首 平生 事 忘形 半 醉 中 蓬莱 归 去路 潦倒 笑臣 同
d5c70747-48f2-4934-b86b-104d1f1a118b,夏景 清風松下來,劉辰翁,唐,诗,五言古体,狭世清风少 清风不受催 惟应松下有 肯向坐间来 襟袖元如水 山林自少埃 遂惊弘景宅 不是楚王台 柳巷无人扫 柴门尽日开 是谁前喝道 空遣鹤飞回,"5,5,5,5,5,5,5,5,5,5,5,5",5cb41c16029e4073d271d38cf4d07ccc,狭 世 清风 少 清风 不受 催 惟应 松下 有 肯向 坐间 来 襟袖 元 如 水 山林 自少 埃 遂 惊 弘景宅 不是 楚王 台 柳巷 无人 扫 柴门 尽日 开 是 谁 前 喝道 空 遣 鹤 飞回
527ad96f-d86f-46e3-a750-f9f9445e030b,夏景 林風凉不絕,劉辰翁,唐,诗,五言古体,不可居无竹 清风动满林 长无如夏日 凉不绝予襟 安得秋如许 能令午正阴 两间何舋舋 三径自深深 簟玉翻如水 簷冰语至今 故人千万里 明月两知心,"5,5,5,5,5,5,5,5,5,5,5,5",9652546ae6b8bcb6b85b4ba39f417e8d,不可 居无竹 清风 动 满林 长无如 夏日 凉 不绝予襟 安得秋 如许 能令 午 正 阴 两间 何 舋 舋 三 径自 深深 簟 玉 翻如 水 簷 冰语 至今 故人 千万里 明月 两 知心
e713cc77-b19f-4b5c-8ca9-6be9196d8e0f,夏景 喬木生夏凉,劉辰翁,唐,诗,五言古体,何可无乔木 多年雨露成 是间凉意别 长夏绿阴生 日度云旗影 风含涧水声 能令霜六月 不待月三更 翠幄宜琴枕 枯棋就石枰 五楸朝又暮 故国可胜情,"5,5,5,5,5,5,5,5,5,5,5,5",cdccb6fc933892c69e50e2a52fefd194,何 可 无 乔木 多年 雨露 成 是 间 凉意 别 长 夏 绿阴 生 日度 云旗 影 风 含 涧 水声 能令 霜 六月 不待 月 三 更 翠 幄 宜 琴 枕 枯棋 就 石 枰 五楸朝 又 暮 故国 可胜 情
52cda013-77d9-4f76-b324-017d5a89d590,夏景 清室夏含霜,劉辰翁,唐,诗,五言古体,一室兰香满 阴阴夏木成 炎光虽自酷 霜意自含清 珮玉传风马 钩帘下水精 燕台无六月 楚户忽三更 冷袖藏冰藕 凉蟾满露茎 江湖无雁信 诗鬓自先惊,"5,5,5,5,5,5,5,5,5,5,5,5",0fc890e01fe43dea1e1d7eeba5cde891,一 室 兰香满 阴阴 夏木成 炎光 虽 自酷 霜意 自含 清 珮玉 传 风 马 钩 帘 下水 精 燕台 无 六月 楚户 忽三 更 冷袖 藏冰藕 凉蟾 满露 茎 江湖 无雁信 诗鬓 自先 惊
544247e9-00a2-4cce-823e-4a96984ee64f,夏景 凉引簟先秋,劉辰翁,唐,诗,五言古体,八尺横斜簟 寒光凝不流 引教凉到我 坐觉意先秋 溽暑收梅雨 清风度竹楼 湘纹殊似水 班扇未应愁 冷逼金茎润 温便玉臂柔 颇哀城市悄 斗米换衾裯,"5,5,5,5,5,5,5,5,5,5,5,5",0b2f16069b31e980a96e2fa840e39dbf,八尺 横斜 簟 寒光 凝不流 引教 凉 到 我 坐 觉意 先秋 溽暑 收 梅雨 清 风度 竹楼 湘 纹 殊似 水 班扇 未 应愁 冷 逼 金茎润 温便 玉臂 柔 颇 哀 城市 悄 斗 米 换 衾 裯
c59fa34b-3efa-4f88-a87b-45f36831c323,夏景 盛夏火爲日,劉辰翁,唐,诗,五言古体,日在天无二 明明夏盛时 到今虽可爱 非火孰能为 谩把薰弦语 难禁坐甑炊 未应一杯水 能沃九华枝 王屋飞犹在 昆冈事可知 未须频梦灶 倏忽看崦嵫,"5,5,5,5,5,5,5,5,5,5,5,5",075087dbb1f78869b0a016539fab6ad7,日 在 天无二 明明 夏盛 时 到今 虽 可爱 非 火 孰能 为 谩把 薰 弦 语 难禁 坐 甑 炊 未 应 一杯 水 能 沃 九华 枝 王屋 飞 犹 在 昆冈 事 可知 未须 频 梦 灶 倏忽 看 崦 嵫
276659e1-0bb0-4b96-a528-bcd589ff79f6,夏景 蓮房墜粉紅,劉辰翁,唐,诗,五言古体,莲欲成房去 三三两两空 摘来中有子 坠处粉尤红 已镂冰为藕 谁将翠作蓬 半妆摇越棹 一水腻秦宫 濯濯含秋露 亭亭立晓风 么荷因见忆 憔悴感青铜,"5,5,5,5,5,5,5,5,5,5,5,5",504c54378c696cb0f70591d635b074b1,莲欲 成房 去 三三两两 空 摘来 中 有 子 坠 处 粉 尤 红 已 镂冰 为 藕 谁 将 翠作蓬 半妆摇 越 棹 一 水 腻 秦宫 濯濯 含 秋露 亭亭 立晓风 么 荷 因 见忆 憔悴 感 青铜
b2b61778-82ba-459c-ae62-bd9670bdd273,夏景 竹影金瑣碎,劉辰翁,唐,诗,五言古体,竹可淋漓画 难将竹影临 寂寥谁布地 琐碎总如金 密处开为径 疏时舞又阴 汗青销作字 翡翠屑成林 弄月平分破 临风凿落斟 锵然声入耳 忽认是徽琴,"5,5,5,5,5,5,5,5,5,5,5,5",a81a984880b178a61f5a446f6091579b,竹 可 淋漓 画 难 将 竹影 临 寂寥 谁 布地 琐碎 总 如 金 密处 开为 径 疏 时 舞 又 阴 汗青 销作 字 翡翠 屑 成林 弄 月 平分 破 临风 凿落 斟 锵 然 声 入耳 忽 认是 徽琴
2829ed50-7a11-4f36-afbc-dfc82696d5d7,夏景 炎赫衣流汗,劉辰翁,唐,诗,五言古体,暑绤衣能几 长流汗似痁 惶惶何栗栗 赫赫复炎炎 安得三庚度 犹如十日兼 坐惊惭背浃 不是泪襟沾 汤餠何堪试 煎茶可更添 可人娇熨玉 频起立风簷,"5,5,5,5,5,5,5,5,5,5,5,5",092dc7340791b96d4f304bc8e1cebe5c,暑 绤 衣 能 几 长 流汗 似 痁 惶惶 何栗栗 赫赫 复 炎炎 安得三庚 度 犹如 十日 兼 坐惊惭背浃 不是 泪襟 沾 汤 餠 何堪 试 煎 茶 可 更添 可 人 娇 熨 玉 频 起立 风簷
c831adb2-010c-42d6-ba84-19adb39cf956,夏景 夢回蓮葉雨,劉辰翁,唐,诗,五言古体,万叶胜花开 莲香雨送来 欲知凉可爱 政是梦初回 未拟华胥转 谁将绣户推 棹歌摇别浦 裙影湿阳台 天上霓裳断 人间羯鼓催 酒醒茎露渴 狂引碧筒杯,"5,5,5,5,5,5,5,5,5,5,5,5",e612f12fd72ab0045d81c0ec532e5f46,万叶 胜花 开 莲 香雨 送来 欲 知凉 可爱 政是 梦 初 回 未 拟 华胥 转 谁 将 绣 户 推 棹 歌 摇别 浦 裙影 湿 阳台 天上 霓裳 断 人间 羯鼓 催 酒醒 茎 露渴 狂引 碧筒 杯
978b7c17-dc9e-4f04-a76e-4934e00f8f71,夏景 衣冷欲裝綿 其一,劉辰翁,唐,诗,五言古体,老厌人间热 单衣就冷泉 不知清到骨 故欲转装绵 萝月满襟雪 松风半臂仙 顿疏桃竹莹 拟就柳花眠 倚倦思燕玉 全生愿蜀毡 温汤无去路 搔首听潺湲,"5,5,5,5,5,5,5,5,5,5,5,5",b57764f2d46d7d7b60cc466b6f81772b,老 厌 人间 热 单衣 就 冷 泉 不知 清 到 骨 故 欲 转装 绵 萝月 满襟雪 松风 半 臂 仙 顿 疏 桃 竹 莹 拟就 柳花眠 倚倦 思燕玉 全生 愿 蜀 毡 温汤 无 去路 搔首 听 潺湲
2801a4d4-1911-4d64-a054-fd791810cc29,夏景 衣冷欲裝綿 其二,劉辰翁,唐,诗,五言古体,石洞元无暑 泉声洒面凉 衣疑中夜冷 绵欲此时装 洒洒惊荷雨 披披变葛霜 拟将洴澼絖 换却薄罗裳 中道怜班女 温言忆楚王 骊山在何许 我更念温汤,"5,5,5,5,5,5,5,5,5,5,5,5",99abc2e77a46304a5c826e084a72b530,石洞 元 无暑 泉声 洒 面 凉 衣疑中夜冷 绵 欲 此时 装 洒洒 惊 荷 雨 披 披变 葛霜 拟将 洴 澼 絖 换 却 薄 罗裳 中道 怜班 女 温言 忆 楚王 骊山 在 何许 我 更 念 温汤
6cfe6e82-e3cd-4556-97d7-df4afd1371f0,夏景 褦襶子,劉辰翁,唐,诗,五言古体,俗子高门走 那知物意嫌 婆娑中避暑 褦襶早趋炎 楚楚朝衣格 峨峨古帽簷 夤缘三伏谒 瞻仰上官严 尚说毛寒栗 宁辞背汗沾 寄言乡里者 贷我北窗眠,"5,5,5,5,5,5,5,5,5,5,5,5",8a9f23b5349c9baeaf36a556661c02c0,俗子 高门 走 那 知物 意嫌 婆娑 中 避暑 褦 襶 早 趋 炎 楚楚 朝 衣格 峨峨古 帽簷 夤缘 三伏 谒 瞻仰 上官 严 尚 说 毛寒栗 宁辞 背 汗 沾 寄言 乡里 者 贷 我 北 窗 眠
23106164-8ec6-47fc-9226-b4baf2187bc9,夏景 清泉潔塵襟,劉辰翁,唐,诗,五言古体,是事不堪闻 清泉独可亲 翛然携鬓影 聊以洁尘襟 帘泻千年雨 蓝拖百尺绅 能令肝肺雪 更遣芰荷新 京洛昏沈梦 江湖淡荡身 一瓢明月燕 并洗脱𫖇嗔,"5,5,5,5,5,5,5,5,5,5,5,5",300a22db3d34515b428de4123d80876a,是 事 不堪 闻 清泉 独 可亲 翛 然 携 鬓 影 聊以 洁尘襟 帘泻 千年 雨 蓝拖 百尺 绅 能令肝 肺雪 更 遣 芰 荷 新 京洛 昏 沈梦 江湖 淡荡 身 一瓢 明月 燕 并 洗脱 𫖇 嗔
66b24ba1-d73b-42f5-82cd-36bc69fbce5d,夏景 涉江採芙蓉,劉辰翁,唐,诗,五言古体,梦破芙蓉雨 蛾眉琐绿窗 悠悠思远道 采采涉长江 北渚浮湘水 西兴渡越邦 波穿红锦乱 影转画桡双 花路迷相问 菱歌远失腔 扣舷惊水鸟 晼晚笑吴憃,"5,5,5,5,5,5,5,5,5,5,5,5",2e978a2e6b47ec6d690d9bdcb21876ed,梦 破 芙蓉 雨 蛾眉 琐 绿窗 悠悠 思 远道 采采 涉 长江 北渚 浮 湘水 西兴 渡越邦 波 穿 红 锦 乱 影转 画 桡双 花路 迷 相问 菱歌 远 失腔 扣 舷 惊 水鸟 晼 晚 笑 吴 憃
5aa007b9-dd82-4bc0-833c-ffafaf66eddd,夏景 公子調冰水,劉辰翁,唐,诗,五言古体,盛世佳公子 明光避暑曾 调冰初入水 和水亦成冰 鸣佩朝仪凤 扬鞲夕臂鹰 汲来金碗脱 搅碎玉崚嶒 一吸风林壑 重倾雪肺膺 琼姬持袖举 疑饮露盘升,"5,5,5,5,5,5,5,5,5,5,5,5",4cc809f96896a92fa3d291595a11ad91,盛世 佳 公子 明光 避暑 曾 调冰 初入 水 和 水 亦 成 冰 鸣佩 朝仪 凤 扬 鞲 夕 臂 鹰 汲来 金碗 脱 搅碎 玉 崚嶒 一 吸风 林壑 重 倾雪 肺 膺 琼 姬 持袖 举 疑 饮露 盘升
29d824be-5adf-4a90-95fb-2a70b7c3634d,夏景 炎宵惡明燭,劉辰翁,唐,诗,五言古体,畏日才宵匿 谁教烛又添 明虽无可恶 看得故成炎 漏永风如禁 膏残饮未厌 万枝何用许 一点有人嫌 蛾命那知惜 虫花懒复占 吴牛应自笑 何事畏银蟾,"5,5,5,5,5,5,5,5,5,5,5,5",c031fa0c2b36e6536b1be3e94e588286,畏日才宵匿 谁 教烛 又 添 明 虽 无 可恶 看得 故 成炎 漏永风如禁 膏残饮未厌 万枝 何用 许 一点 有人 嫌 蛾命 那 知惜 虫花 懒复 占 吴牛 应自 笑 何事 畏 银 蟾
0fe7eabb-58b9-498b-8d0b-e51040de20fb,夏景 行雲遞崇高,劉辰翁,唐,诗,五言古体,自不容无雨 行云尽日劳 来来方汗漫 递递看崇高 一气埋飞鸟 层阴压戴鳌 前驱淝水阵 后至浙江涛 羊角天帆席 龙身海桔槔 鸿蒙惊久别 握手重相遭,"5,5,5,5,5,5,5,5,5,5,5,5",f0637f23ae3aea01a4352d05fad6610f,自 不容 无雨 行云 尽日劳 来来 方 汗漫 递递 看 崇高 一气 埋 飞鸟 层 阴压 戴 鳌 前驱 淝 水 阵 后 至 浙江 涛 羊角 天帆 席 龙身 海 桔 槔 鸿蒙 惊 久别 握手 重相 遭
fffc17a5-c1f8-4dca-87a0-48a79fb8a56d,夏景 訟風伯,劉辰翁,唐,诗,五言古体,岂敢讼穹穹 何堪败愿丰 云乎难致雨 伯也实司风 长是垂将合 吹之使不同 不思商怨后 但霸楚称雄 已脱知臣罪 不诛无岁功 皇恩惩使悔 终念小心仝,"5,5,5,5,5,5,5,5,5,5,5,5",74aa39a4134c878d26ab2d93588fd53e,岂敢 讼 穹穹 何堪 败愿 丰 云乎难致雨 伯 也 实司 风 长 是 垂 将 合 吹 之 使 不同 不思 商怨 后 但霸楚 称雄 已 脱知 臣 罪 不诛无岁功 皇恩 惩 使悔 终念 小心 仝
e4f0198b-d715-4468-9c7c-7da039bd4460,夏景 亭深到芰香,劉辰翁,唐,诗,五言古体,十里荒寒地 亭空暑不侵 能令尘土外 更到芰荷深 水阁临风迥 莲舟隔浦寻 红妆风四面 翠倚月中心 此处闲搔首 何人泣露襟 拍浮宜有酒 乱挽碧筒斟,"5,5,5,5,5,5,5,5,5,5,5,5",57b52c99c05fab43d60ad436da77f6ee,十里 荒寒 地 亭 空暑 不 侵 能令 尘土 外 更 到 芰 荷 深 水阁 临风 迥 莲舟 隔浦 寻 红妆 风 四面 翠倚 月 中心 此处 闲 搔首 何人 泣露襟 拍浮 宜 有 酒 乱 挽 碧 筒 斟
be8abb56-40b9-4dd2-bb07-9aeffa7fa3bb,夏景 蟬聲集古寺,劉辰翁,唐,诗,五言古体,此寺创何年 人间几变迁 山空千万古 声集两三蝉 振木缲余茧 凭风咽断弦 助成骚国晚 惊破少林禅 喧寂闻尘外 炎凉落照边 客来悲世事 虫语暮钟连,"5,5,5,5,5,5,5,5,5,5,5,5",2f9230f155d2245468123fe66c04fce9,此 寺 创 何年 人间 几 变迁 山空 千万 古 声集 两三 蝉 振木 缲 余 茧 凭 风 咽 断弦 助成 骚国 晚 惊破 少林 禅 喧寂闻尘外 炎凉 落照 边 客 来 悲 世事 虫 语 暮 钟 连
67e78fc8-f1b2-4dfa-8ea9-abdb665be17d,夏景 綠荷雨跳珠,劉辰翁,唐,诗,五言古体,荷外雨潇潇 舟如泊断桥 忽惊红粉乱 又见绿珠跳 万叶明苍水 轻风问步摇 疏疏沾羽盖 点点溅鲛绡 玉露明金掌 红妆湿翠翘 珮痕留不得 立地使魂销,"5,5,5,5,5,5,5,5,5,5,5,5",e6f81b141d060ff77e6bd44d751e50f2,荷 外 雨潇潇 舟 如 泊 断桥 忽 惊 红粉 乱 又 见 绿珠 跳 万叶 明苍水 轻风 问步 摇 疏 疏 沾 羽 盖 点点 溅 鲛绡 玉露 明金掌 红妆 湿翠 翘 珮痕 留 不得 立地 使魂 销
26d1621f-737c-4d50-9eed-47d4a221475d,夏景 扇枕,劉辰翁,唐,诗,五言古体,千古一黄香 庭萱昼日长 枕闲非受热 扇举欲先凉 畏暑侵支发 摇风愿满堂 恨无寒水玉 琢在碧纱床 泉涧心如棘 瑶池鬓已霜 如何荀奉倩 只在玉人傍,"5,5,5,5,5,5,5,5,5,5,5,5",d03553d59e39fab3a0ac150610e5daa4,千古 一 黄香 庭萱 昼日 长 枕闲非 受热 扇 举欲先凉 畏 暑 侵 支发 摇风愿 满堂 恨无寒水玉 琢在 碧纱 床 泉涧 心 如 棘 瑶池 鬓 已 霜 如何 荀奉倩 只 在 玉人 傍
6ea6a976-79e3-4466-841a-bed267b0db26,夏景 雲雨覺虛無,劉辰翁,唐,诗,五言古体,天欲今朝雨 云如满八区 居然同愿望 如此竟虚无 鹏运风犹黑 龙光电又驱 遂成神女梦 误拟阿香呼 酷吏逾前憯 余民绝望苏 皇心终不测 变化属须臾,"5,5,5,5,5,5,5,5,5,5,5,5",c37da4732ac70918c577c1e710134677,天欲 今朝 雨 云如满 八区 居然 同 愿望 如此 竟 虚无 鹏运 风 犹 黑 龙光电 又 驱 遂 成 神女 梦 误拟 阿香 呼 酷吏 逾 前 憯 余民 绝望 苏 皇心 终 不测 变化 属 须臾
c647a396-66d5-4788-be69-992d5698df64,夏景 高風動秋聲,劉辰翁,唐,诗,五言古体,万窍忽争号 南风动地豪 此声何处起 到地似秋高 草木波颓靡 乾坤暑战鏖 有人推户外 无叶下庭皋 寒扇怜孤影 征鞍感二毛 豪鹰双角耸 无计剪蓬蒿,"5,5,5,5,5,5,5,5,5,5,5,5",8979d312f683af94a7e9f492e423473a,万 窍 忽 争 号 南风 动地 豪 此 声 何处 起 到 地 似 秋 高 草木 波 颓靡 乾坤 暑 战 鏖 有人 推 户外 无叶 下 庭 皋 寒扇 怜 孤影 征 鞍感 二毛 豪鹰 双角 耸 无计 剪 蓬蒿
bf55cdf0-1af7-4a06-9805-c4e860d04c25,夏景 清風左右至,劉辰翁,唐,诗,五言古体,风于万里外 飞动故人情 如许殷勤至 居然左右清 吹潮成雪色 入竹已秋声 珮玉丁丁起 台襟翼翼生 玉川从此去 列子御之行 邂逅浮丘老 相携上五城,"5,5,5,5,5,5,5,5,5,5,5,5",b8d9862445018527e00d1d1b3e5e05c8,风 于 万里 外 飞动 故 人情 如许 殷勤 至 居然 左右 清 吹潮成雪色 入 竹 已 秋声 珮玉 丁丁 起 台 襟翼 翼生 玉川 从此 去 列子 御 之 行 邂逅 浮丘 老 相 携 上 五城
ba6cf087-6f30-4fbc-b7f5-59ffebae84c5,秋景 乞巧文,劉辰翁,唐,诗,五言古体,能拙吾无比 高灵昔有闻 不知天下巧 乞以世间文 果列空庭露 香浮入汉云 天孙何冉冉 柳子盖云云 有说能要我 无才可赠君 绛衣持节后 穷达竟何分,"5,5,5,5,5,5,5,5,5,5,5,5",7c63f3a28c10e0288130fa1737d3062e,能 拙 吾 无比 高灵昔 有 闻 不知 天下 巧 乞以 世间 文 果列 空庭 露 香 浮入 汉云 天孙何 冉冉 柳子盖 云云 有 说 能 要 我 无才 可赠 君 绛 衣 持节 后 穷达 竟 何分
0bd14e27-5ce2-4baa-9ac2-373231a0ed36,秋景 曬書,劉辰翁,唐,诗,五言古体,芸香天上宴 不到野人居 见说星期夕 闲将腹晒书 笑人操犊鼻 容我辟蟫鱼 小勿欺椰子 中从著石渠 从他便是懒 乞汝巧相如 此日何堪负 余暄献纳疏,"5,5,5,5,5,5,5,5,5,5,5,5",4d64db84df7a2d5de7856ecb11525065,芸香 天上 宴 不到 野人 居 见 说 星期 夕 闲 将 腹晒 书 笑人 操 犊鼻 容 我 辟 蟫 鱼 小 勿 欺 椰子 中 从著 石渠 从 他 便是 懒 乞 汝 巧 相 如 此日 何堪 负 余暄 献纳 疏
8fd89da4-526e-46e7-baf1-d05ec2645f1d,秋景 牛女年年渡,劉辰翁,唐,诗,五言古体,牛女是谁传 灵桥不待船 昔年曾此渡 每渡似初年 此夕须停织 何人更服牵 星期无了日 河水尚依然 岁晚长疏隔 人间早弃捐 瑶池人独处 搔首待君还,"5,5,5,5,5,5,5,5,5,5,5,5",6ae48295736715a60c5cd65eef283c5a,牛女 是 谁 传 灵桥 不待 船 昔年 曾此 渡 每 渡似 初年 此夕 须 停织 何人 更 服 牵 星期 无 了 日 河水 尚 依然 岁晚 长 疏 隔 人间 早 弃 捐 瑶池 人 独处 搔首 待 君 还
cd87f35c-22df-4a98-95c8-7c81ec22ba04,秋景 機絲虛夜月,劉辰翁,唐,诗,五言古体,不见机边女 当时独月知 坐令如此夜 虚却理残丝 缲得扶桑茧 张成锦字词 弦光空到晓 花影不侵帷 尺寸知何用 须臾即别离 小窗思妇懒 不是恤周嫠,"5,5,5,5,5,5,5,5,5,5,5,5",070140d8d7aa874e095bb41a9d0d6b24,不见 机边 女 当时 独 月 知 坐令 如此 夜 虚 却 理残丝 缲 得 扶桑 茧 张成 锦字 词 弦光空 到 晓 花影 不侵 帷 尺寸 知 何用 须臾 即 别离 小窗 思妇 懒 不是 恤周 嫠
