id,title,author,dynasty,genre,poem_type,sentences_simplified,meter_pattern,hash,words
c1647238-0c30-4e36-a495-f906bf968b6e,奉送中丞姊夫俦自大理卿出镇江西叙事书怀因成十二韵,杜牧,唐,诗,五言古体,惟帝忧南纪 搜贤与大藩 梅仙调步骤 庾亮拂橐鞬 一室何劳扫 三章自不冤 精明如定国 孤峻似陈蕃 灞岸秋犹嫩 蓝桥水始喧 红旓罣石壁 黑矟断云根 滕阁丹霄倚 章江碧玉奔 一声仙妓唱 千里暮江痕 私好初童稚 官荣见子孙 流年休挂念 万事至无言 玉辇君频过 冯唐将未论 庸书醻万债 竹坞问樊村,"5,5,5,5,5,5,5,5,5,5,5,5,5,5,5,5,5,5,5,5,5,5,5,5",0ff39b9eff6e9f746392f9f70e393c4c,惟帝 忧 南纪 搜贤 与 大 藩 梅仙 调 步骤 庾亮 拂 橐 鞬 一 室 何劳扫 三章 自不冤 精明 如定 国 孤峻 似 陈蕃 灞 岸 秋 犹嫩 蓝桥 水 始 喧 红 旓 罣 石壁 黑 矟 断 云 根 滕阁 丹霄 倚 章江 碧玉 奔 一声 仙妓 唱 千里 暮 江 痕 私好 初 童稚 官荣 见 子孙 流年休 挂念 万事 至 无言 玉 辇 君 频过 冯唐 将 未 论 庸书 醻 万 债 竹 坞 问 樊村
3505ad96-c84a-4b98-a39f-14ba342b75c1,中丞业深韬畧志在功名再奉长句一篇兼有咨劝,杜牧,唐,诗,七言律诗,樯似邓林江拍天 越香巴锦万千千 滕王阁上柘枝鼓 徐孺亭西铁轴船 八部元侯非不贵 万人师长岂无权 要君严重疎欢乐 犹有河湟可下鞭,"7,7,7,7,7,7,7,7",76396abe4842cee7bcbbaa146f4284cf,樯 似 邓林江 拍 天 越香 巴锦 万千 千 滕王阁 上柘枝鼓 徐孺亭 西 铁轴 船 八部 元侯 非 不贵 万 人 师长 岂 无权 要 君 严重 疎 欢乐 犹 有 河 湟 可 下 鞭
6f2cae42-5acf-4da1-a61f-72419368e255,和裴杰秀才新樱桃,杜牧,唐,诗,五言古体,新果真琼液 人应宴紫兰 圆疑窃龙颔 色已夺鸡冠 远火微微辨 繁星历历看 茂先知味好 曼倩恨偷难 忍用烹酥酪 从将玩玉盘 流年如可驻 何必九华丹,"5,5,5,5,5,5,5,5,5,5,5,5",f7299f107421b8974abaa9c7a628ba0e,新 果真 琼液 人应宴 紫兰 圆 疑 窃 龙 颔 色 已 夺 鸡冠 远 火 微微 辨 繁星 历历 看 茂 先知 味 好 曼倩 恨偷 难 忍用 烹 酥酪 从 将 玩 玉盘 流 年 如 可驻 何必 九华 丹
6fdcd0fa-27a4-482b-bf8a-eaab0bc8bc42,春思,杜牧,唐,诗,五言律诗,岂君心的的 嗟我泪涓涓 绵羽啼来久 锦鳞书未传 兽垆凝冷焰 罗暮蔽晴烟 自是求佳梦 何须讶画眠,"5,5,5,5,5,5,5,5",cfbcf4371c33dce3fd06b438d7825703,岂 君心的 的 嗟我泪 涓涓 绵羽 啼来 久 锦鳞 书 未 传 兽 垆 凝 冷焰 罗暮蔽晴 烟 自是 求 佳 梦 何须 讶画 眠
94a19824-e433-4e6a-8f87-4c5a9cfe0ff9,代人作,杜牧,唐,诗,五言古体,楼高春日早 屏束麝烟堆 盼眄凝魂别 依稀梦雨来 绿鬟羞妥么 红颊思天偎 鬬草怜香蕙 簪花间雪梅 戌辽虽咽切 游蜀亦迟回 锦字梭悬壁 琴心月满台 笑筵凝贝启 眠箔晓珠开 腊破征车动 袍襟对泪裁,"5,5,5,5,5,5,5,5,5,5,5,5,5,5,5,5",3c1d4c902981ec4c4322a9f7b3723d41,楼高 春日 早 屏束 麝烟 堆 盼 眄 凝 魂 别 依稀 梦 雨来 绿鬟 羞妥 么 红颊 思天 偎 鬬 草 怜 香 蕙 簪花 间 雪梅 戌 辽 虽 咽 切 游蜀亦迟 回 锦字 梭 悬壁 琴心 月 满台 笑 筵凝贝 启 眠 箔晓珠 开 腊 破征 车动 袍襟 对 泪裁
365b3c04-4d11-4731-82cc-d76e6c171c09,偶题二首 一,杜牧,唐,诗,五言律诗,劳劳千里身 襟袂满行尘 深夜悬双泪 短亭思远人 苍江程未息 黑水梦何频 明月轻桡去 唯应钓赤鳞,"5,5,5,5,5,5,5,5",42a470770e4bbb216bb9b0984e3a25ea,劳劳 千里 身 襟 袂 满行 尘 深夜 悬 双泪 短 亭 思远人 苍江程 未息 黑水 梦 何频 明月 轻 桡去 唯应 钓 赤 鳞
2b30699f-57ee-4173-b04f-68440e5ac8bd,偶题二首 二,杜牧,唐,诗,五言律诗,有恨秋来极 无端别后知 夜阑终耿耿 明发竟迟迟 信已凭鸿去 归唯与燕期 只因明月见 千里两相思,"5,5,5,5,5,5,5,5",1092e515d5b7829866f7d8ac9edbc5c8,有 恨 秋来 极 无端 别后 知 夜阑 终 耿耿 明发 竟 迟迟 信 已 凭 鸿 去 归唯 与 燕期 只 因 明月 见 千里 两 相思
887b1c4c-7031-43ee-9bfa-b296ea65e694,冬至日遇京使发寄舍弟,杜牧,唐,诗,七言律诗,远信初凭双鲤去 他乡正遇一阳生 尊前岂解愁家国 辇下唯能忆弟兄 旅馆夜忧姜被冷 暮江寒觉晏裘轻 竹门风过还惆怅 疑是松窗雪打声,"7,7,7,7,7,7,7,7",b8ce5dbf8d52940b3743d8d4044352af,远 信 初 凭 双 鲤 去 他 乡 正 遇 一 阳生 尊 前 岂 解愁 家国 辇 下 唯 能忆 弟兄 旅馆 夜 忧 姜 被 冷 暮 江 寒觉晏 裘 轻 竹 门风 过 还 惆怅 疑 是 松 窗雪 打声
6ff67319-1420-431b-8919-47d3ce3dc52e,洛下送张曼容赴上党召,杜牧,唐,诗,七言律诗,歌阕罇残恨却偏 凭君不用设离筵 未趍雉尾随元老 且蓦羊肠过少年 七叶汉貂真密近 一枝诜桂亦徒然 羽书正急征兵地 须遣头风处处痊,"7,7,7,7,7,7,7,7",816199a94cf261bb50962ab188ff764e,歌阕 罇 残 恨 却 偏 凭 君 不用 设离 筵 未 趍 雉尾 随 元老 且 蓦 羊肠 过 少年 七叶 汉 貂 真 密 近 一枝 诜 桂亦 徒然 羽书 正 急 征兵 地 须 遣头 风 处处 痊
afef2ebf-09f0-4382-bd61-6fd6d976c5c4,宣州留赠,杜牧,唐,诗,七言律诗,红铅湿尽半罗裙 洞府人间手欲分 满面风流虽似玉 四年夫婿恰如云 当春离恨杯长满 倚柱关情日渐曛 为报眼波须稳当 五陵游宕莫知闻,"7,7,7,7,7,7,7,7",2562c11b6cd589055fdc24c01aa2328a,红铅 湿 尽 半 罗 裙 洞府 人间 手 欲 分 满面 风流 虽 似 玉 四年 夫婿 恰如 云 当春 离恨 杯 长满 倚 柱 关情 日渐 曛 为 报 眼波 须 稳当 五陵 游宕 莫知闻
591996f4-bf22-4cdc-9b10-d0e4d76a08e3,寄题宣州开元寺,杜牧,唐,诗,七言绝句,松寺曾同一鹤栖 夜深台殿月高低 何人为倚东楼柱 正是千山雪涨溪,"7,7,7,7",80c825008ae2ba31ff93c5dbb5ee0eb8,松寺 曾 同一 鹤 栖 夜深 台殿 月 高低 何人 为 倚 东楼 柱 正是 千山 雪涨溪
9f1ed5a7-7e08-4763-9b30-022940f7873c,赠张祜,杜牧,唐,诗,五言律诗,诗韵一逢君 平生称所闻 粉毫唯画月 琼尺只裁云 鲸阵人人慑 秋星历历分 数篇留别我 羞杀李将军,"5,5,5,5,5,5,5,5",c2eb996cdfeea383a17a698c15eae5df,诗韵 一 逢 君 平生 称 所闻 粉毫 唯画 月 琼尺 只 裁 云 鲸 阵 人人 慑 秋星 历历 分 数篇 留别 我 羞杀 李将军
c2b0867f-6c2d-459d-be41-e134ab5980c5,残春独来南亭因寄张祜,杜牧,唐,诗,七言律诗,暖云如粉草如茵 独步长堤不见人 一岭桃花红锦黦 半溪山水碧罗新 高枝百舌犹欺鸟 带叶梨花独送春 仲蔚欲知何处在 苦吟林下拂诗尘,"7,7,7,7,7,7,7,7",705a02472348bc733cda41b78930de41,暖 云 如 粉草 如茵 独步 长堤 不见 人 一 岭 桃花 红 锦 黦 半 溪 山水 碧罗新 高枝 百舌犹欺鸟 带 叶 梨花 独送 春 仲蔚 欲 知 何处 在 苦吟 林下 拂 诗尘
40cc2a73-237a-486c-814d-7ee4b5ebc40f,宣州开元寺南楼,杜牧,唐,诗,七言绝句,小楼才受一床横 终日看山酒满倾 可惜和风夜来雨 醉中虚度打窗声,"7,7,7,7",f3617d0f8d094b4ab7f953987d971e5c,小楼 才 受 一床 横 终日 看 山酒 满倾 可惜 和 风 夜来 雨 醉 中 虚度 打 窗声
e4aa94ca-3755-45ec-9498-c06bb0f3a0dc,寄远人,杜牧,唐,诗,五言绝句,终日求人卜 回回道好音 那时离别后 入梦到如今,"5,5,5,5",2ed469838034062252e9afe33630d0d5,终日 求人 卜 回回 道 好 音 那时 离别 后 入梦 到 如今
b4a303de-5b86-4c01-8ce8-a1dbf72c1809,别沈处士,杜牧,唐,诗,五言绝句,旧事参差梦 新程逦迤秋 故人如见忆 时到寺东楼,"5,5,5,5",6f77f10429748bcff31825bac74362cb,旧事 参差 梦 新程 逦 迤 秋 故人 如 见忆 时 到 寺 东楼
bacd210b-0cda-4410-abe0-ab047244236f,留赠,杜牧,唐,诗,七言绝句,舞靴应任闲人看 笑脸还须待我开 不用镜前空有泪 蔷薇花谢即归来,"7,7,7,7",873d0087a818ba3a28d5519fa226810e,舞靴 应任 闲人 看 笑脸 还 须 待 我 开 不用 镜 前 空有 泪 蔷薇花 谢 即 归来
c024c8e8-e428-4e6d-9745-3c2f3d18a0dd,奉和仆射相公春泽稍愆圣君轸虑嘉雪忽降品汇昭苏即事书成四韵,杜牧,唐,诗,七言律诗,飘来鸡树凤池边 渐压琼枝冻碧涟 银阙双高银汉里 玉山横列玉墀前 昭阳殿下风回急 承露盘中月彩圆 上相抽毫歌帝德 一篇风雅美丰年,"7,7,7,7,7,7,7,7",515f23200681d2d9cf0658c9f1680e1e,飘来 鸡树 凤 池边 渐 压 琼枝冻 碧涟 银阙 双高 银汉 里 玉山 横列 玉墀 前 昭阳 殿下 风回急 承露盘 中月 彩 圆 上 相 抽 毫歌 帝德 一篇 风雅 美 丰年
38191316-4846-4ca6-8ae5-dd6f045c10a1,寄李播评事,杜牧,唐,诗,五言律诗,子列光殊价 明时忍自高 宁无好舟檝 不泛恶风涛 大翼终难戢 奇锋且自韬 春来烟渚上 几净雪霜毫,"5,5,5,5,5,5,5,5",bc72fdfb0f4141359cf5df3d4554c3cf,子列 光殊 价 明时 忍自 高 宁 无 好 舟 檝 不泛 恶风 涛 大翼 终 难 戢 奇锋 且 自 韬 春来 烟渚 上 几 净 雪 霜 毫
9c055fb2-6053-4b98-81b3-2d67d66a622e,送牛相出镇襄州,杜牧,唐,诗,五言古体,盛时常注意 南雍暂分茅 紫殿辞明主 岩廊别旧交 危幢侵碧雾 寒斾猎红旓 德业悬秦镜 威声隐楚郊 拜尘先洒泪 成厦昔容巢 遥仰沈碑会 鸳鸯玉佩敲,"5,5,5,5,5,5,5,5,5,5,5,5",9133f81adcd02772fdcd0178a988ef00,盛 时常 注意 南雍 暂分 茅 紫殿 辞 明主 岩廊 别 旧交 危幢 侵 碧 雾 寒 斾 猎 红 旓 德业 悬秦镜 威声 隐楚 郊 拜 尘 先 洒泪 成厦 昔 容巢 遥仰 沈碑 会 鸳鸯 玉佩 敲
b42edbc6-fb78-402d-93eb-b8ecaa8f2e97,送薛邽二首 一,杜牧,唐,诗,七言绝句,可怜走马骑驴汉 岂有风光肯占伊 只有三张最惆怅 下山回马尚迟迟,"7,7,7,7",1ffe060745eb388665811599476c301d,可怜 走马 骑驴 汉 岂 有 风光 肯占 伊 只有 三张 最 惆怅 下山 回 马尚 迟迟
4bd29207-6187-45f2-a2ad-f79c03d0f46c,送薛邽二首 二,杜牧,唐,诗,七言绝句,小捷风流已俊才 便将红粉作金台 明年未去池阳郡 更乞春时却重来,"7,7,7,7",1f456c3b490f5c8dbd441df756091c3d,小捷 风流 已 俊 才 便 将 红粉 作 金台 明年 未 去 池阳 郡 更乞 春时 却 重来
935bd7bc-a138-4dfb-8b26-f0fb92d6c05d,见穆三十宅中庭海榴花谢,杜牧,唐,诗,七言律诗,矜红掩素似多才 不待樱桃不逐梅 春到未曾逢宴赏 雨余争解免低徊 巧穷南国千般艳 趁得春风二月开 堪恨王孙浪游去 落英狼籍始归来,"7,7,7,7,7,7,7,7",25d0d068f943d56fde229460e6ed5e56,矜 红 掩素 似多 才 不 待 樱桃 不逐 梅 春 到 未曾 逢 宴赏 雨余争 解免 低徊 巧 穷 南国 千般 艳 趁 得 春风 二月 开 堪恨 王孙 浪游 去 落英 狼籍 始 归来
744e9a24-dd66-49db-98ca-e4bc6fc9000e,留诲曹师等诗,杜牧,唐,诗,五言古体,万物有丑好 各一姿状分 唯人即不尔 学与不学论 学非探其花 要自拨其根 孝友与诚实 而不忘尔言 根本既深实 柯叶自滋繁 念尔无忽此 期以庆吾门,"5,5,5,5,5,5,5,5,5,5,5,5",e9c44455d3ba7760f2cc71fa2149d93c,万物 有 丑好 各一 姿状 分 唯人 即 不尔 学 与 不学论 学非 探 其 花 要 自拨 其 根 孝友 与 诚实 而 不 忘 尔 言 根本 既深 实 柯叶 自滋繁 念尔 无 忽此 期 以 庆吾门
cde1f648-3c9a-4cf0-bfed-a6d332e68971,洛阳,杜牧,唐,诗,七言律诗,文争武战就神功 时似开元天宝中 已建玄戈收相土 应回翠帽过离宫 侯门草满宜寒兔 洛浦沙深下塞鸿 疑有女娥西望处 上阳烟树正秋风,"7,7,7,7,7,7,7,7",4abcf60681ae11a7b1639f69f286a112,文争 武战 就 神功 时 似 开元 天宝 中 已 建 玄戈 收相 土 应回 翠帽 过 离宫 侯门草 满 宜 寒 兔 洛浦 沙深 下 塞鸿 疑有 女娥 西 望 处 上阳 烟树 正 秋风
44df66a3-8658-4efd-82d8-1c81fa8e17c1,寄唐州李玭尚书,杜牧,唐,诗,七言律诗,累代功勋照世光 奚胡闻道死心降 书功笔秃三千管 领节门排十六双 先揖耿弇声寂寂 今看黄霸事𪭢𪭢 时人欲识胸襟否 彭蠡秋连万里江,"7,7,7,7,7,7,7,7",35bc1b9f64471b5830c3a35aa2397c88,累代 功勋 照 世光 奚胡闻 道 死心 降 书功 笔秃 三千 管 领节门 排 十六 双 先 揖 耿 弇 声 寂寂 今 看 黄霸 事 𪭢 𪭢 时人 欲识 胸襟 否 彭蠡秋 连 万里 江
b1baa48c-1fe5-4baf-ad05-ef892110b9cf,南陵道中,杜牧,唐,诗,七言绝句,南陵水面漫悠悠 风紧云轻欲变秋 正是客心孤回处 谁家红袖凭江楼,"7,7,7,7",2795c0a5be8cc19df7fb929f12e8cd30,南陵 水面 漫 悠悠 风 紧云轻欲变 秋 正是 客心 孤回 处 谁家 红袖 凭 江楼
856d779c-f973-4f04-89a1-35d661850f18,登九峰楼,杜牧,唐,诗,七言古体,晴江滟滟含浅沙 高低遶郭滞秋花 牛歌鱼笛山月上 鹭渚鹙梁溪日斜 为郡异乡徒泥酒 杜陵芳草岂无家,"7,7,7,7,7,7",aff162e089eac46a0b778d99b6a3ca4a,晴江 滟 滟 含 浅 沙 高低 遶 郭 滞 秋 花 牛歌 鱼笛山 月 上 鹭 渚 鹙 梁 溪 日 斜 为 郡 异乡 徒泥 酒 杜陵 芳草 岂 无 家
7ccb7b70-88c7-4456-bfc4-a311163907b7,别家,杜牧,唐,诗,七言绝句,初岁娇儿未识爷 别爷不拜手咤叉 拊头一别三千里 何日迎门却到家,"7,7,7,7",36fa3e78239d0f95a4ae2b5eefcdccd8,初岁 娇儿 未识 爷 别爷 不 拜 手 咤 叉 拊 头 一别 三千里 何日 迎门 却 到 家
1045aa50-9dce-4ad7-98a5-685b20577d2e,归家,杜牧,唐,诗,五言绝句,穉子牵衣问 归来何太迟 共谁争岁月 赢得鬓边丝,"5,5,5,5",40bcda0563754c3bbc31f18107fc729b,穉 子 牵 衣 问 归来 何太迟 共 谁 争 岁月 赢得 鬓边 丝
af2e6182-d775-47aa-b4d9-9782276dab41,雨,杜牧,唐,诗,七言绝句,连云接塞添迢递 洒幕侵灯送寂寥 一夜不眠孤客耳 主人牕外有芭蕉,"7,7,7,7",0a3c4849aa27b76c5219c4edd29e6291,连云 接塞添迢 递 洒 幕 侵 灯 送 寂寥 一夜 不眠 孤客 耳 主人 牕 外 有 芭蕉
34be7e6b-2b22-4dde-9f70-4c4c353a499d,送人,杜牧,唐,诗,七言绝句,鸳鸯帐里暖芙蓉 低泣关山几万重 明镜半边钗一股 此生何处不相逢,"7,7,7,7",36525752dfe5ddaad732b79ab6166f15,鸳鸯 帐 里 暖 芙蓉 低泣 关山 几万 重 明镜 半边 钗 一股 此生 何处 不 相逢
355ca8d1-8156-405f-bf92-306300aa2950,遣怀,杜牧,唐,诗,五言绝句,道泰时还泰 时来命不来 何当离城市 高卧博山隈,"5,5,5,5",64d9093143585c796d5fd9c9da8b2782,道泰 时 还 泰 时 来 命 不 来 何当 离 城市 高卧 博山 隈
1cc2085a-c6d6-47cf-b318-d0b7b5f0f03c,醉赠薛道封,杜牧,唐,诗,七言绝句,饮酒论文四百刻 水分云隔二三年 男儿事业知公有 卖与明君直几钱,"7,7,7,7",151f9f3ba9695496ed8d919d51bb4c5f,饮酒 论文 四百 刻 水分 云 隔 二三年 男儿 事业 知 公有 卖 与 明君直 几 钱
9bcbe47d-5f86-486f-9331-b5767bd2bdc1,歙州卢中丞见惠名酝,杜牧,唐,诗,七言律诗,谁怜贱子启穷途 太守封来酒一壶 攻破是非浑似梦 削平身世有如无 醺醺若借嵇康懒 兀兀仍添宁武愚 犹念悲秋更分赐 夹溪红蓼映风蒲,"7,7,7,7,7,7,7,7",7dd9aac493d8c2bcaeb154f1de659508,谁怜 贱子 启 穷途 太守 封来 酒 一 壶 攻破 是非 浑似 梦 削平 身世 有如 无 醺醺 若 借 嵇康 懒 兀 兀 仍 添 宁武 愚 犹念 悲秋 更分 赐 夹溪 红 蓼 映 风 蒲
b6e4d4dd-6e8a-430a-b2ba-7cbf27dae7be,咏袜,杜牧,唐,诗,七言绝句,钿尺裁量减四分 纤纤玉笋裹轻云 五陵年少欺他醉 笑把花前出画裙,"7,7,7,7",246de992bef2843d9b7cd51bddfb56d9,钿 尺 裁量 减 四分 纤纤 玉笋 裹轻云 五陵年少 欺 他 醉 笑 把 花前 出画 裙
3031ec06-0355-494d-92cc-3a8e59c14c0c,宫词二首 一,杜牧,唐,诗,七言绝句,蝉翼轻绡傅体红 玉肤如醉向春风 深宫锁闭犹疑惑 更取丹沙试辟宫,"7,7,7,7",11b6107d7cd3c9ad1f910024a2d46890,蝉翼 轻 绡 傅体红 玉肤 如 醉 向 春风 深宫 锁闭 犹 疑惑 更取 丹沙 试辟 宫
7e64a32c-3280-4976-ba88-d1a228252032,宫词二首 二,杜牧,唐,诗,七言绝句,监宫引出暂开门 随例须朝不是恩 银钥却收金锁合 月明花落又黄昏,"7,7,7,7",2e5d9130b4120a4a06c8ae4bceb59177,监宫 引出 暂 开门 随例 须 朝 不是 恩 银钥 却 收金 锁合 月 明 花落 又 黄昏
eba9a9be-713d-490f-beeb-ed5207561d49,月,杜牧,唐,诗,七言绝句,三十六宫秋夜深 昭阳歌断信沈沈 唯应独伴陈皇后 照见长门望幸心,"7,7,7,7",2a5df23a588ceda91a90ed48eda8d279,三十六 宫 秋夜 深 昭阳 歌断 信沈沈 唯应 独伴 陈皇后 照 见长 门望 幸心
33ec79f1-061f-44ef-97f0-3ffaa3e1b3d8,忍死留别献监铁裴相公二十叔,杜牧,唐,诗,五言律诗,贤相辅明主 苍生寿域开 青春辞白日 幽壤作黄埃 岂是无多士 偏蒙不弃才 孤坟三尺土 谁可为培栽,"5,5,5,5,5,5,5,5",c0b28acfcac4046b45adbb73218b3174,贤 相辅 明主 苍生 寿域 开 青春 辞 白日 幽壤 作 黄埃 岂 是 无 多士 偏 蒙 不弃 才 孤坟 三尺 土 谁 可为 培栽
13456be7-bc92-41c9-ae31-991f5fe92bb5,悲吴王城,杜牧,唐,诗,七言律诗,二月春风江上来 水精波动碎楼台 吴王宫殿柳含翠 苏小宅房花正开 解舞细腰何处往 能歌姹女逐谁回 千秋万古无消息 国作荒原人作灰,"7,7,7,7,7,7,7,7",4661bc3a9e851096ca14bbc0a6587665,二月 春风 江 上来 水精 波动 碎 楼台 吴王 宫殿 柳含翠 苏小宅 房花 正开 解舞 细腰 何处 往 能歌 姹女逐谁 回 千秋万古 无 消息 国作 荒原 人作灰
0dab2d47-1373-43bb-99b0-06b6d5129945,闺情代作,杜牧,唐,诗,七言律诗,梧桐叶落鴈初归 迢递无因寄远衣 月照石泉金点冷 凤酣箫管玉声微 佳人刀杵秋风外 荡子从征梦寐希 遥望戌楼天欲晓 满城冬鼓白云飞,"7,7,7,7,7,7,7,7",11c4e0388742bf71fa9e11126c99e340,梧桐叶 落 鴈 初 归 迢 递 无 因 寄 远 衣 月 照 石泉 金点 冷 凤酣 箫管 玉声微 佳人 刀 杵 秋风 外 荡子 从 征 梦寐 希 遥望 戌 楼 天 欲晓 满城 冬 鼓 白云飞
c8d3ec3e-a9de-48b3-bbf9-0def81e3e1c6,寄沈褒秀才,杜牧,唐,诗,七言律诗,晴河万里色如刀 处处浮云卧碧桃 仙桂茂时金镜晓 洛波飞处玉容高 雄如宝劒冲牛斗 丽似鸳鸯养羽毛 他日忆君何处望 九天香满碧萧骚,"7,7,7,7,7,7,7,7",260a281581a055ef3cd01bcac9507597,晴河 万里 色 如 刀 处处 浮云 卧 碧桃 仙 桂茂 时 金镜晓 洛波 飞处 玉容 高 雄 如 宝 劒 冲 牛 斗 丽 似 鸳鸯 养 羽毛 他 日 忆 君 何处 望 九天 香满 碧萧 骚
e23c0686-ed4f-49fe-bef0-87d3f0208bc9,入关,杜牧,唐,诗,七言绝句,东西南北数衢通 曾取江西径过东 今日更寻南去路 未秋应有北归鸿,"7,7,7,7",8088f8581c3db3a52ef6398354d75440,东西南北 数衢 通 曾 取 江西 径 过东 今日 更 寻 南 去路 未秋 应有 北归鸿
f70b17f7-1b78-4f15-a342-a42d3ff8835f,及第后寄长安故人,杜牧,唐,诗,七言绝句,东都放牓未花开 三十三人走马回 秦地少年多酿酒 已将春色入关来,"7,7,7,7",c70670358c194c1efc0b5ea18ebf1ca7,东都 放 牓 未 花 开 三十三 人 走马 回 秦地 少年 多 酿酒 已 将 春色 入关 来
c1c063c6-ca9b-416b-9bfc-2c86bbb99f15,偶作,杜牧,唐,诗,七言绝句,才子风流咏晓霞 倚楼吟住日初斜 惊杀东隣绣床女 错将黄晕压檀花,"7,7,7,7",3287c87b10482e1b11c2818af3d6549f,才子 风流 咏晓 霞 倚 楼 吟住 日初 斜 惊杀 东 隣 绣 床 女 错 将 黄晕 压檀花
146a9f1c-7fc6-47b5-be72-f668cfc8373b,赠终南兰若僧,杜牧,唐,诗,七言绝句,北阙南山是故乡 两枝仙桂一时芳 休公都不知名姓 始觉禅门气味长,"7,7,7,7",eaddb14f67e123c96e6acabc970cbf2e,北阙 南山 是 故乡 两枝 仙 桂 一时 芳 休 公 都 不 知名 姓 始觉 禅门 气味 长
92ae04dc-89af-45d6-9e31-204a01df801d,遣怀,杜牧,唐,诗,七言绝句,落魄江南载酒行 楚腰肠断掌中轻 十年一觉扬州梦 赢得青楼薄幸名,"7,7,7,7",b07f77e2a3a6be5f1108c28f68baa1a2,落魄 江南 载酒 行 楚 腰 肠断 掌中 轻 十年 一 觉 扬州 梦 赢得 青 楼薄幸 名
a4e6c0b0-c1d7-4f12-9dd9-f96a10b81550,秋感,杜牧,唐,诗,七言绝句,金风万里思何尽 玉树一窓秋影寒 独掩柴门明月下 泪流香袂倚阑干,"7,7,7,7",d6543924c6e7a2cbb3d303197e2a6962,金风 万里 思何 尽 玉树 一 窓 秋 影 寒 独掩 柴门 明月 下 泪流 香 袂 倚 阑干
ef9b9e25-0e0d-4eca-83c6-43d1b4fa241f,赠渔父,杜牧,唐,诗,七言绝句,芦花深泽静垂纶 月夕烟朝几十春 自说孤舟寒水畔 不曾逢著独醒人,"7,7,7,7",efdd383a0ac7f911ddc6d23f1a698ad4,芦花 深泽 静垂纶 月 夕烟 朝 几十 春 自 说 孤舟寒 水畔 不曾 逢著 独醒 人
ffc847e7-2310-4a97-94e1-0ae702802599,叹花,杜牧,唐,诗,七言绝句,自恨寻芳到已迟 往年曾见未开时 如今风摆花狼籍 绿叶成阴子满枝,"7,7,7,7",cae3abc32205ee243b96310fc27d0062,自恨 寻芳 到 已迟 往年 曾 见 未 开时 如今 风摆花 狼籍 绿叶成阴 子满枝
ddc766a7-d68e-4866-8605-c629e84ac134,题刘秀才新竹,杜牧,唐,诗,五言律诗,数茎幽玉色 晓夕翠烟分 声破寒窗梦 根穿绿藓纹 渐笼当槛日 欲碍入帘云 不是山阴客 何人爱此君,"5,5,5,5,5,5,5,5",488a02a5aa1d28964bd2dab502a3a710,数茎 幽 玉色 晓夕翠 烟分 声破 寒窗 梦 根 穿 绿藓 纹 渐 笼 当槛 日 欲碍入帘云 不是 山阴 客 何人 爱 此君
56da3304-439a-400b-b283-16de3add74ce,山行,杜牧,唐,诗,七言绝句,远上寒山石径斜 白云生处有人家 停车坐爱枫林晚 霜叶红于二月花,"7,7,7,7",1e974592166f88771cec0bcc32704c8e,远上 寒 山石 径 斜 白云 生处 有 人家 停车 坐爱 枫林晚 霜叶 红 于 二月 花
ea52e3d8-e8b5-4acd-a85f-74d13d22048a,书怀,杜牧,唐,诗,七言绝句,满眼青山未得过 镜中无那鬓丝何 秖言旋老转无事 欲到中年事更多,"7,7,7,7",f6fb37bf21d72677e51885991e26c0c8,满眼 青山 未 得 过 镜 中 无 那 鬓丝 何 秖 言 旋 老 转 无 事 欲 到 中年 事 更 多
7cc1af10-9062-47ef-aedb-ff11013997c4,紫薇花,杜牧,唐,诗,七言绝句,晓迎秋露一枝新 不占园中最上春 桃李无言又何在 向风偏笑艳阳人,"7,7,7,7",5acb5841462aaca6a809e0e5f7393b71,晓迎 秋露 一枝 新 不 占 园中 最上 春 桃李无言 又 何在 向 风偏 笑 艳阳 人
e7162d8b-3d05-4385-a92a-0a6ddf32e7d0,醉后呈崔大夫,杜牧,唐,诗,七言绝句,谢傅秋凉阅管弦 徒教贱子侍华筵 溪头正雨归不得 辜负东窓一觉眠,"7,7,7,7",32b6f2691ce1d7b3203499683f160032,谢傅 秋凉 阅 管弦 徒教 贱子 侍华 筵 溪头 正雨 归 不得 辜负 东 窓 一 觉 眠
6980e261-1fc5-4972-9b07-650f312434b0,和宣州沈大夫登北楼书怀,杜牧,唐,诗,七言律诗,兵符严重辞金马 星劒光芒射斗牛 笔落青山飘古韵 帐开红斾照高秋 香连日彩浮绡幕 溪逐歌声遶画楼 可惜登临佳丽地 羽仪须去凤池游,"7,7,7,7,7,7,7,7",19a53c49231ed744800aa7f80af02916,兵符 严重 辞 金马 星 劒 光芒 射 斗牛 笔落 青山 飘 古韵 帐 开 红 斾 照 高 秋 香 连日 彩 浮 绡 幕 溪 逐 歌声 遶 画楼 可惜 登临 佳丽 地 羽仪 须 去 凤池 游
4dbd4fda-b163-459c-be32-d8a68f109ea0,夜雨,杜牧,唐,诗,五言律诗,九月三十日 雨声如别秋 无端满阶叶 共白几人头 点滴侵寒梦 萧骚著淡愁 渔歌听不唱 蓑湿棹回舟,"5,5,5,5,5,5,5,5",7d0548aa75c00858fb900152f969c5ca,九月 三十日 雨声 如 别秋 无端 满 阶叶 共 白 几 人头 点滴 侵 寒 梦 萧 骚著 淡愁 渔歌 听 不 唱 蓑湿 棹 回 舟
f227dee2-18e9-4d48-8e35-f1334c178d14,方响,杜牧,唐,诗,七言绝句,数条秋水挂琅玕 玉手丁当怕夜寒 曲尽连敲三四下 恐惊珠泪落金盘,"7,7,7,7",6d0dd14dfb732ea9ed7b260384809061,数条 秋水 挂 琅玕 玉手 丁当 怕 夜寒 曲 尽连 敲 三 四下 恐惊 珠泪 落金 盘
62c7187b-f03e-4d9f-b214-4eb888efe7b3,将出关宿层峰驿却寄李谏议,杜牧,唐,诗,五言律诗,孤驿在重阻 云根掩柴扉 数声暮禽切 万壑秋意归 心驰碧泉涧 目断青琐闱 明日武关外 梦魂劳远飞,"5,5,5,5,5,5,5,5",f8e20b09ef5ee116c2b4be0f68418eb5,孤驿 在 重阻 云根 掩 柴扉 数声 暮禽 切 万 壑 秋意 归 心 驰 碧泉涧 目断 青 琐 闱 明日 武 关外 梦魂劳远飞
f0b64169-685b-4a85-b9fa-5d45bb30b487,使回枉唐州崔司马书兼寄四韵因和,杜牧,唐,诗,七言律诗,清晨候吏把书来 十载离忧得暂开 痴叔去时还读易 仲容多兴索衔杯 人心计日殷勤望 马首随云早晚回 莫为霜台愁岁暮 潜龙须待一声雷,"7,7,7,7,7,7,7,7",1705f96c3ffa0ba06a7925746d17c29e,清晨 候吏 把 书 来 十载 离忧 得 暂开 痴叔 去时 还 读 易 仲容 多 兴索 衔 杯 人 心计 日 殷勤 望 马首 随 云 早晚 回 莫为霜 台 愁 岁暮 潜龙 须 待 一声 雷
29031e87-be6f-46b1-9387-e2a9d9083231,郡斋秋夜即事寄斛斯处士许秀才,杜牧,唐,诗,七言律诗,有客谁人肯夜过 独怜风景奈愁何 边鸿怨处迷霜久 庭树空来见月多 故国杳无千里信 彩弦时伴一声歌 驰心秖待城乌晓 几对虚簷望白河,"7,7,7,7,7,7,7,7",ed97566edd8aefe72c7ff46620fc78a9,有 客 谁 人 肯夜 过 独怜 风景 奈 愁 何 边鸿 怨处迷霜 久 庭树 空来 见 月 多 故国 杳无 千里 信 彩弦 时伴 一声 歌 驰 心 秖 待 城 乌 晓 几对 虚簷望 白河
353c08bf-bf93-41e2-8c1e-826514703eab,早春题真上人院,杜牧,唐,诗,七言绝句,清羸已近百年身 古寺风烟又一春 寰海自成戎马地 唯师曾是太平人,"7,7,7,7",459dba436b7124904503a49023fd7883,清 羸已 近 百年 身 古寺 风烟 又 一 春 寰海 自成 戎马 地 唯师 曾 是 太平 人
