id,title,author,dynasty,genre,poem_type,sentences_simplified,meter_pattern,hash,words
957630ab-2aaa-4fc2-8360-1077d5fd8570,予旧服术迂其效弃去比过临邛蒙李丈分惠并副以诗次其韵以自警,李流谦,唐,诗,五言古体,是身如芭蕉 敢保金石固 得生况尪陋 愧彼硕且武 百万护一喘 人自疑窃斧 灵根著异效 尝资一溉助 苦邀旦夕验 弃去悔昔误 那知百破衣 岂易一线补 沧溟称微溜 九仞亦拳土 见弹思炙美 拊手鸮未许 九州作秦鼎 万生入𬊈煮 赫然一炊顷 众忿久已贮 碑方峄山夸 骨作骊山腐 初心欲速耳 竟不守门户 吾宗活人手 一诺轻季布 缄诗遣分送 爱我骨肉似 恐为石髓凝 亦防山鬼妬 汲汲事服饵 长谣记所自 愿求必世仁 借秦谕其故 解牛得养生 持问子庄子,"5,5,5,5,5,5,5,5,5,5,5,5,5,5,5,5,5,5,5,5,5,5,5,5,5,5,5,5,5,5,5,5,5,5,5,5",de3eab05648836c6fbbe85b66d66b349,是 身 如 芭蕉 敢保 金石 固 得生 况 尪 陋 愧 彼硕 且 武 百万 护一喘 人 自疑 窃 斧 灵 根著 异效 尝资 一溉 助 苦 邀 旦夕 验 弃 去 悔 昔 误 那 知百破衣 岂 易 一线 补 沧 溟 称 微 溜 九仞亦 拳土 见 弹思炙美 拊 手 鸮 未 许 九州 作 秦鼎 万 生入 𬊈 煮 赫然 一 炊 顷 众忿 久已 贮 碑方 峄山 夸 骨作 骊山 腐 初心欲速耳 竟 不守 门户 吾 宗 活人 手 一 诺 轻 季布 缄 诗 遣 分送 爱 我 骨肉 似 恐 为 石髓 凝 亦 防 山鬼 妬 汲汲 事服 饵 长 谣记 所 自 愿求 必世仁 借 秦谕其 故 解牛得 养生 持 问子 庄子
ddc42ace-7035-405d-abc6-2211d7102f09,游护圣寺分韵得共字,李流谦,唐,诗,五言古体,散员绳检宽 暇日得放纵 天明风发屋 飞盖怯掀弄 朋簪诺已宿 驾言盍不勇 幽禅远城郭 伉壮塔庙涌 华鲸三击罢 僧众肃如拱 香秔撩鼻观 馋沫出流湩 三生石上歌 浩劫几丘冢 失脚今悔深 弹指昔缘重 联裾玉连环 谈端豁烦壅 草木自臭味 雨露元一垅 摩挲老瓦盆 此酌宜数共 已无系日绳 但有思家梦,"5,5,5,5,5,5,5,5,5,5,5,5,5,5,5,5,5,5,5,5,5,5,5,5",9f628d71ca1c9b1332118959e24acb9d,散员绳 检宽 暇日 得 放纵 天明 风 发屋 飞盖 怯 掀弄 朋簪 诺 已 宿 驾 言 盍 不勇 幽 禅 远 城郭 伉 壮 塔庙 涌 华鲸三 击 罢 僧众 肃 如 拱 香 秔 撩 鼻 观 馋沫 出 流 湩 三生石 上歌 浩劫 几丘 冢 失脚 今 悔 深 弹指 昔 缘 重 联裾 玉 连环 谈 端 豁烦 壅 草木 自 臭味 雨露 元一 垅 摩挲 老 瓦盆 此 酌 宜 数共 已 无系 日 绳 但有 思家 梦
cf3f1774-ae50-4905-8fe6-72a3b51a18b6,旅中,李流谦,唐,诗,五言律诗,客舍供朝𫗦 旅食不知旨 取酒浇饿肠 乞火伸冻指 萍根托江流 江自不能止 传舍贪阅人 风雨亦阅尔,"5,5,5,5,5,5,5,5",9af437395f3d53709b8b03448abeeb0d,客舍 供朝 𫗦 旅食 不知 旨 取酒 浇 饿 肠 乞火 伸冻 指 萍根托 江流 江自 不能 止 传舍 贪阅 人 风雨 亦阅尔
ecedf762-5579-4ac2-bf55-bc08cec22ba0,过弥牟有携鱼过者买而放之因志以诗,李流谦,唐,诗,五言古体,行役道荒戍 马行何徐徐 市人捉筠篮 偃然数尾鱼 始疑失清波 残息惫不苏 俄掉尾与鬐 示之尚可图 杀戒宿所持 坚盟敢渝初 尔命如丘山 我金若锱铢 敢靳百钱惠 坐视甘醢葅 空篮俱置之 涟漪纵缧俘 旋收褫骇魄 亟反清泠居 仆夫亦欣然 毋疑校人诬 为龙未可知 风雷跃云衢 田文出函关 子卿反荒区 骨肉一笑粲 乐哉定何如 人心如面然 贤鄙异所趋 放者尚反顾 捕者已纵罦 为德惩不竟 护以西竺书 世事岂易料 聊欲明区区 人羊互吞啄 佛语深切肤 闻声戒肉食 孟轲远庖厨 孔释喜交戈 好生理则符 浪言物与人 贵贱越与胡 人贵当食物 物固供人须 此语实魔语 地狱正为渠 炯炯一灵光 彼此亡欠余 一念偶负堕 流转乃尔殊 目前怙强雄 屠脔弃束刍 此身宁石人 竟免为物欤 悬想刀几毒 响应疾鼓桴 天骥警鞭影 蹇驽烦箠驱 箠驱可致力 诗宜勒盘盂,"5,5,5,5,5,5,5,5,5,5,5,5,5,5,5,5,5,5,5,5,5,5,5,5,5,5,5,5,5,5,5,5,5,5,5,5,5,5,5,5,5,5,5,5,5,5,5,5,5,5,5,5,5,5,5,5,5,5,5,5",508c07f1f7c680622b69e1639204782e,行役 道 荒 戍 马行何 徐徐 市人 捉 筠 篮 偃然 数尾 鱼 始疑 失 清波 残息惫 不苏 俄 掉 尾 与 鬐 示 之 尚可 图 杀戒 宿所 持 坚 盟敢 渝 初 尔 命 如 丘山 我金 若 锱铢 敢 靳百 钱惠 坐视 甘 醢 葅 空篮 俱置 之 涟漪 纵 缧 俘 旋收 褫骇 魄 亟反 清泠 居 仆夫 亦 欣然 毋疑校 人 诬 为 龙 未可知 风雷 跃云 衢 田文 出 函关 子卿 反 荒区 骨肉 一 笑 粲 乐哉 定 何如 人心如面 然 贤 鄙 异 所 趋 放者 尚 反顾 捕者 已 纵 罦 为 德 惩 不竟 护以 西竺 书 世事 岂易料 聊欲明 区区 人羊 互 吞 啄 佛语 深切 肤 闻声 戒 肉食 孟轲 远 庖厨 孔释 喜交戈 好 生理 则 符 浪言物 与 人 贵贱 越 与 胡 人 贵 当 食物 物 固供 人 须 此 语实 魔语 地狱 正 为 渠 炯炯 一 灵光 彼此 亡 欠 余 一念 偶 负 堕 流转 乃尔 殊 目前 怙强雄 屠 脔 弃 束刍 此身 宁 石人 竟免 为 物 欤 悬想 刀 几毒 响应 疾鼓 桴 天骥 警鞭 影 蹇 驽烦 箠 驱 箠 驱 可 致力 诗宜勒 盘 盂
6080db88-52c6-454e-812b-dc267ce896b7,自离芜湖多阻风是日早次鴈汊风顺亟驾帆以行既而稍驶落帆之半晚次雷口舟人以贪风曛暮不得泊几危,李流谦,唐,诗,五言古体,九牛可倒曳 兼旬逆风里 老来砚笔衰 文思每如此 篙儿疲晚牵 赤日汗流趾 峻阪有疾圆 秃羽无纵矢 朝来日初亮 旗脚忽西指 竖帆沸群呼 劈浪轻一苇 路经百家村 鸡豚不敢市 有客访江浒 疾谈幸其起 过目不留瞬 倏忽洲渚异 一日三日程 长年抃而喜 敏者贵乘便 拙者拱以竢 齐人诮轲迂 秦亦毒鞅驶 吾尝为此论 谁肯味无味 使帆勿尽风 如食勿尽美 君看赤手人 重负亦俱至,"5,5,5,5,5,5,5,5,5,5,5,5,5,5,5,5,5,5,5,5,5,5,5,5,5,5,5,5,5,5",f2c047dbdd03c647285bae07ed26acb4,九 牛 可 倒曳 兼 旬 逆风 里 老 来 砚 笔 衰 文思 每 如此 篙 儿 疲 晚 牵 赤 日 汗流 趾 峻阪 有 疾 圆 秃 羽 无纵矢 朝 来日 初 亮 旗脚 忽 西 指 竖 帆 沸 群呼 劈浪 轻一 苇 路经 百家 村 鸡豚 不敢 市 有 客访 江浒 疾谈 幸其 起 过目 不留 瞬 倏忽 洲 渚 异 一日 三 日程 长年 抃 而 喜 敏 者 贵 乘 便 拙 者 拱 以 竢 齐 人 诮 轲 迂 秦亦 毒 鞅 驶 吾 尝 为此 论 谁肯 味 无味 使 帆 勿 尽 风 如 食 勿 尽 美 君 看 赤手 人 重负 亦 俱 至
9f004434-d755-4098-a018-d3c8f84b2b67,过大信口忆西归录载大江渺渺忽二石山如伏猊引出水面东西对峙江形若瓢然而山乃其口然相距犹三四里则江之广狭可见视之信然妙哉写物之功感而赋此篇,李流谦,唐,诗,五言古体,两山如伏猊 波面忽引首 江形若瓢然 此山乃其口 往读西归志 一一未深剖 及兹亲见之 语巧极雕镂 妙哉写物功 万像不藏覆 当时偶然书 信在三纪后 临流重吁叹 有涕泫襟袖 君看连城璞 岂但今不售,"5,5,5,5,5,5,5,5,5,5,5,5,5,5,5,5",ab87f1e2aa8e735a5855615e4013e7f8,两 山 如 伏猊 波面 忽 引首 江形 若 瓢然 此 山 乃 其 口 往 读西 归志 一一 未深 剖 及 兹 亲见 之 语巧 极 雕镂 妙哉 写物 功 万 像 不藏 覆 当时 偶然 书 信 在 三纪 后 临流 重 吁叹 有 涕 泫 襟 袖 君 看 连城 璞 岂但 今 不 售
5747c011-b69c-4021-afd9-681936443423,游无为寺,李流谦,唐,诗,五言古体,导师生何年 人犹记此日 香火缁俗会 风雨神鬼集 我来恰秋深 迥迥原野阔 群山势愈壮 老木气不折 拄筇踏危磴 小憩马与仆 屡休才及门 到寺已曛黑 车从如沸羹 无地可插脚 阇黎揖客坐 意象颇猝猝 弛担得禅房 持钵叩香积 倒床不复醒 梦与仙梵接 明朝没阶趋 燎香望玉色 丐福吾未能 修敬敢不肃 是身如芭蕉 危脆不坚实 绿发俄素丝 赭颜倏枯腊 百年已长久 大抵俱化易 稽首不动尊 向来何证得 衲衣坐蒙头 万古一交睫 傥非定慧力 枯骨已瓦砾 物物具兹妙 抱宝诉空乏 伐柯则不远 内照无别法 一钵寄空岩 定当掷此帻,"5,5,5,5,5,5,5,5,5,5,5,5,5,5,5,5,5,5,5,5,5,5,5,5,5,5,5,5,5,5,5,5,5,5,5,5,5,5,5,5,5,5",f5152472ddd0ed167e7acd717ff9a2d9,导师 生 何年 人 犹记 此日 香火 缁 俗 会 风雨 神鬼 集 我 来 恰秋深 迥 迥 原野 阔 群 山势 愈壮 老 木气 不折 拄 筇 踏 危 磴 小憩 马与仆 屡 休 才 及 门 到 寺 已 曛 黑 车 从 如沸羹 无地 可 插脚 阇黎揖 客 坐 意象 颇 猝 猝 弛 担得 禅房 持 钵 叩 香积 倒床 不 复醒 梦 与 仙 梵接 明朝 没阶趋 燎 香 望 玉色 丐 福 吾 未能 修敬敢 不肃 是 身 如 芭蕉 危脆 不 坚实 绿发 俄 素丝 赭颜 倏 枯 腊 百年 已 长久 大抵 俱化易 稽首 不动 尊 向来 何 证得 衲衣 坐 蒙头 万古 一交睫 傥 非定 慧力 枯骨 已 瓦砾 物物 具 兹 妙 抱 宝 诉 空乏 伐柯 则 不远 内照 无别 法 一 钵 寄 空岩 定当 掷 此 帻
491d6787-90a6-4efa-8168-249f1769a4d9,林夫有诗趣归期次其韵答之,李流谦,唐,诗,五言古体,乾坤大逆旅 日月两行客 江头垂杨树 折尽供马策 学舍如冰壑 远与簿书隔 天风吹我去 自哂殊役役 英英君子僚 妙响协竽瑟 诗来促还期 珠琲莹巾帙 久枵渴嘉馔 积阴跂白日 谈为无底囊 剪烛期竟夕 但恐又西东 搥车叹寂寂 盍不歌归来 已痼烟霞疾,"5,5,5,5,5,5,5,5,5,5,5,5,5,5,5,5,5,5,5,5",6646b4bec4245510780855411b45396c,乾坤 大 逆旅 日月 两行 客 江头 垂 杨树 折尽 供马策 学舍 如 冰壑 远 与 簿 书 隔 天 风吹 我 去 自 哂 殊役 役 英 英 君子 僚 妙 响 协 竽 瑟 诗 来 促还 期 珠 琲 莹 巾 帙 久 枵 渴 嘉 馔 积 阴 跂 白日 谈为 无底 囊 剪烛 期 竟夕 但 恐 又 西东 搥 车 叹 寂寂 盍 不 歌 归来 已 痼 烟霞 疾
919da2bb-9241-4eba-aef3-093e79915974,还家,李流谦,唐,诗,五言律诗,吾家在何许 水泉修竹林 鸥鹤失闲伴 跂予有遐心 窗前小梅花 耐霜笑吟吟 小待新酒熟 冷蘂劝清斟,"5,5,5,5,5,5,5,5",c74565779027dd24f3807d8f2fb3b000,吾 家 在 何许 水泉 修 竹林 鸥 鹤失闲 伴 跂 予 有 遐 心 窗前 小 梅花 耐霜 笑吟吟 小 待 新 酒 熟 冷 蘂 劝 清 斟
3de448bf-dc2c-479f-a031-ce498cb84ff3,送李司户之官临邛,李流谦,唐,诗,五言古体,威凤翔九霄 千百但一遇 苍蝇何所来 满盘挥不去 吾人一肝肠 未可舍跬步 掺裾辄经年 把臂速炊黍 譬如枝上花 风里得暂聚 天果何意哉 未易测其故 安得三间茅 藜苋同旦暮 秋色如行色 别语不得吐 鹤峰得佳句 尚足慰延伫 从今夜夜月 伴我照庭户,"5,5,5,5,5,5,5,5,5,5,5,5,5,5,5,5,5,5,5,5",05d1cad055e5573097e97d869595ad1e,威 凤翔 九霄 千百 但 一遇 苍蝇 何所来 满盘 挥 不 去 吾人 一 肝肠 未可舍 跬步 掺 裾 辄 经 年 把 臂 速 炊 黍 譬如 枝 上 花 风 里 得 暂 聚 天果 何意 哉 未易 测 其 故 安 得 三间 茅 藜 苋同 旦暮 秋色 如 行色 别语 不得 吐 鹤峰 得 佳句 尚足 慰延 伫 从 今夜 夜月 伴 我 照庭户
bfbe7ce8-000e-4052-9e72-502d41c2517d,中秋玩月分韵得一字,李流谦,唐,诗,五言古体,向来高楼月 人境居第一 天福不得再 天意亦叵测 浊河幸一澄 威凤乃屡出 过日惜清玩 草具成胜集 共咏昔年诗 仍是昔年客 酒阑感存没 悲欢异今昔 怀我盘谷翁 蘂宫此何夕 仰瞻云汉章 正恐翁手缉 蹑云侍琅舆 颇恨无此骨 拭泪罢清酌 览镜有华发,"5,5,5,5,5,5,5,5,5,5,5,5,5,5,5,5,5,5,5,5",85407a5cf9d918863550d8881f51881d,向来 高楼 月 人境 居 第一 天福 不得 再 天意 亦 叵测 浊河 幸一澄 威凤乃 屡 出 过日 惜 清玩 草具 成胜 集 共咏 昔年 诗 仍 是 昔年 客 酒 阑 感存 没 悲欢 异 今昔 怀 我 盘谷 翁 蘂 宫 此 何 夕 仰瞻 云汉 章 正恐 翁 手 缉 蹑云 侍琅 舆 颇 恨 无此 骨 拭泪 罢 清酌 览 镜 有 华发
74c95432-7be0-49b6-8b5a-4fbb66adfbd3,累年中秋无月今年凡数夕有之十五日尤佳,李流谦,唐,诗,五言古体,境浊常鲜惬 事难获易欣 皎月当中秋 觇候每倦勤 扁舟泊沙岸 是夕无纤云 冷侵碧琉璃 又如烂镕银 十年五年无 千里万里明 对此欲不饮 恐触蟾兔嗔 尊空更重看 徐步长江滨 大鱼时拨剌 宿鹭联拳惊 可无横吹者 或有琵琶人 领览此奇绝 但怕添愁新 颇欲从冰娥 暂陪白玉轮 载我到广寒 一醉罗袜尘 归来闭阁卧 耿耿鸡未晨 顾瞻篷窗间 尚余半金盆,"5,5,5,5,5,5,5,5,5,5,5,5,5,5,5,5,5,5,5,5,5,5,5,5,5,5,5,5",00a58638f3b388ded23c3b2cb9f98de1,境 浊 常鲜 惬 事 难 获 易欣 皎月 当 中秋 觇 候 每 倦勤 扁舟 泊 沙岸 是 夕无纤云 冷 侵 碧琉璃 又 如烂镕银 十年 五年 无 千里 万里 明 对此 欲 不 饮 恐 触 蟾兔 嗔 尊空 更 重看 徐步 长江 滨 大鱼 时 拨 剌 宿鹭 联拳 惊 可 无 横吹 者 或 有 琵琶 人 领览 此 奇绝 但怕 添 愁 新 颇欲 从 冰娥 暂 陪 白玉 轮 载 我 到 广寒 一 醉 罗 袜 尘 归来 闭 阁 卧 耿耿 鸡 未晨 顾瞻篷 窗间 尚 余半 金盆
6d23f1a9-f9a4-4096-b9c7-46e0a5efea58,虱叹,李流谦,唐,诗,五言古体,得生固么陋 宅体仍秽卑 巢穴我襟裾 食饮吾肤肌 毒比蚤蚊炽 类兼蚋蚁微 阴幽巧相传 不知来何时 殄馘未掩戈 遗妖复蕃滋 观处初若无 掇之或如遗 捷走欲违祸 深藏殆知几 窜壁尤恶啄 潜沙更危机 处头与物化 遂使白变缁 称臣托疵贱 名官慙素尸 扪摸傲逆温 梳爬厌懒嵇 吉凶陋巫占 彼岂能先知 殊快勇夫射 宁辱达士讥 蚩儿厌膏粱 兀坐如瓠肥 屠门饫雄餐 亦足饱汝饥 我身如枯株 但有骨附皮 嘬啮竟何得 馋吻亦及之 夜眠辍佳梦 昼坐伤沉思 往往暴丑形 或为洁者嗤 抑搔两甲折 掩捕双目疲 期我犯不校 责人所难为 汤沐犹宽恩 磔裂乃所宜 吏贪摩其牙 巨力犹足支 舐糠及小家 此岂禁鞭笞 愿作秋禽狝 毋使蔓草滋 虱去息疴痒 贪惩消怨咨 仁者恶害人 勿谓伤吾慈,"5,5,5,5,5,5,5,5,5,5,5,5,5,5,5,5,5,5,5,5,5,5,5,5,5,5,5,5,5,5,5,5,5,5,5,5,5,5,5,5,5,5,5,5,5,5,5,5,5,5,5,5,5,5",698433bd5e7ee41b5733c56d2d9cab28,得生 固么 陋 宅体 仍 秽卑 巢穴 我 襟 裾 食饮 吾 肤 肌 毒 比 蚤 蚊 炽 类 兼 蚋 蚁 微 阴幽巧 相传 不知 来 何时 殄 馘 未 掩 戈 遗妖 复蕃 滋 观处 初 若无 掇 之 或 如 遗 捷 走 欲 违祸 深藏 殆知 几 窜 壁 尤 恶 啄 潜沙 更 危机 处头 与 物化 遂 使 白 变 缁 称臣 托疵 贱 名 官 慙 素 尸 扪摸傲 逆温 梳爬 厌懒 嵇 吉凶 陋 巫 占 彼 岂能 先知 殊 快 勇夫 射 宁辱达士讥 蚩儿 厌 膏粱 兀 坐 如 瓠 肥 屠门 饫 雄 餐 亦 足 饱 汝 饥 我身 如 枯株 但 有 骨 附皮 嘬 啮 竟 何得 馋 吻 亦 及 之 夜 眠 辍 佳 梦 昼 坐伤 沉思 往往 暴丑 形 或为 洁 者 嗤 抑搔两甲折 掩捕 双目 疲 期 我 犯不校 责人 所 难为 汤沐 犹 宽 恩 磔 裂 乃 所 宜 吏 贪 摩其牙 巨力 犹足 支 舐 糠 及 小家 此 岂禁 鞭笞 愿作 秋 禽 狝 毋使 蔓草 滋 虱去息 疴 痒 贪惩 消怨 咨 仁者 恶 害人 勿 谓 伤 吾 慈
24c24228-9b20-4bd0-b851-f20ef97e3385,赠听声上官术士,李流谦,唐,诗,五言古体,造化秘密藏 凝然大狙宅 操纵掌握间 殆似不容测 惟人号最灵 研穷深探赜 支干究生旺 更以形骸索 摸骨与听声 个中更奇特 无烦觌面知 祸福悉已白 至理非口传 妙处从心得 官君持此术 行尽山水国 所历多巧中 一醉天地窄 祇今天下士 何啻累千百 纷纷肉食鄙 正须囊锥客 仆仆尘埃中 岂无凤毛翮 勿以朝野殊 穷通理不隔 上方劳梦想 胡弗为指摘 致君尧舜上 尔术光史册 若共俗人言 怀抱真可惜,"5,5,5,5,5,5,5,5,5,5,5,5,5,5,5,5,5,5,5,5,5,5,5,5,5,5,5,5,5,5,5,5",54d6ffe5797fc31b2c1d075a0b0024e7,造化 秘密 藏 凝然 大 狙宅 操纵 掌握 间 殆似 不容 测 惟人 号 最灵 研 穷 深 探 赜 支干 究生 旺 更 以 形骸 索 摸骨 与 听声 个 中 更 奇特 无 烦 觌 面 知 祸福 悉已 白 至 理非 口传 妙处 从 心得 官君持 此 术 行 尽 山水 国 所历 多巧 中 一 醉 天地 窄 祇 今天 下士 何啻 累 千百 纷纷 肉食 鄙 正须 囊 锥 客 仆仆 尘埃 中 岂 无 凤毛翮 勿 以 朝野 殊 穷通 理 不 隔 上方 劳 梦想 胡弗 为 指摘 致 君 尧舜 上 尔术光 史册 若 共 俗人 言 怀抱 真 可惜
f4c0e454-ccb9-4bc6-8eb2-37b5f028b88c,送张时择从杨茂州之招,李流谦,唐,诗,五言古体,州闾我知君 楚璞未剖初 家无两钱锥 腹有万卷书 闭门饱葵苋 抚几咏唐虞 儿乳腥未濯 才能辨之乎 巍科似拾遗 却走我不如 流俗校成败 往往遭揶揄 岂知磻溪叟 空钓宁在鱼 穷途有知己 一笑肝胆输 羔鴈朝在门 挽我不得徐 鲸鲲依洪波 凤凰集修梧 士贵得所托 往矣膏子车 忠信行蛮貊 九夷圣肯居 使君况儒将 奥学窥盘谟 小诗迺余澜 已足吞五湖 老羌弛弓刀 玉帐一事无 举杯哦新篇 主宾兴不孤 明日思君处 一千里平芜,"5,5,5,5,5,5,5,5,5,5,5,5,5,5,5,5,5,5,5,5,5,5,5,5,5,5,5,5,5,5,5,5,5,5",3ff5caa71339caebb4ce80f9889b9e35,州 闾 我 知 君 楚璞 未 剖 初 家 无 两 钱 锥 腹有 万卷书 闭门 饱 葵苋 抚 几咏 唐虞 儿 乳 腥 未 濯 才能 辨之乎 巍 科 似 拾遗 却 走 我 不如 流俗 校 成败 往往 遭 揶揄 岂知 磻溪 叟 空 钓宁 在 鱼 穷途 有 知己 一 笑 肝胆 输 羔 鴈 朝 在 门 挽 我 不得 徐 鲸 鲲依 洪波 凤凰 集修 梧 士贵得 所 托 往 矣 膏子 车 忠信 行蛮 貊 九夷 圣 肯居 使君 况 儒将 奥学窥 盘 谟 小诗迺余澜 已足 吞 五湖 老羌 弛 弓 刀 玉帐 一事 无 举杯 哦 新篇 主宾 兴不孤 明日 思君 处 一千里 平芜
be2eeee5-d96c-4733-8e79-8a450c329644,送无害弟之官并呈使君蹇丈一笑,李流谦,唐,诗,五言古体,人生一饮啄 大似有夙缘 蔡蒙穷坤陬 宦游自吾先 哦松千尺下 剖竹羌水边 泮宫撷芹藻 我归才一年 子又卢奴去 妙指按五弦 识人旧鱼鸟 入眼昔山川 子才如干将 当屠横海鳣 纤鳞拾沮洳 人怪我辗然 火宿用弥壮 鸷伏飞无前 弟兄立分拆 门户同仔肩 老僊泉下责 岂但冕与蝉 别离不须悲 使君直二天 不敢祝翁归 冰镜自高悬 梦想五贤堂 囊贮白雪篇 何时见华筑 琬琰行当镌,"5,5,5,5,5,5,5,5,5,5,5,5,5,5,5,5,5,5,5,5,5,5,5,5,5,5,5,5,5,5",4f4f5e8b886595b8cc8879ff08674f1d,人生 一 饮 啄 大 似 有 夙缘 蔡蒙 穷坤 陬 宦游 自 吾 先 哦 松 千尺 下 剖 竹 羌 水边 泮 宫 撷 芹 藻 我 归 才 一年 子 又 卢奴 去 妙 指 按 五 弦 识 人 旧 鱼 鸟 入眼 昔 山川 子 才 如 干将 当 屠横 海 鳣 纤鳞 拾 沮洳 人 怪 我 辗然 火宿 用 弥壮 鸷伏 飞无 前 弟兄 立 分拆 门户 同 仔肩 老 僊 泉下 责 岂但 冕 与 蝉 别离 不须 悲 使君 直 二天 不敢 祝翁 归 冰镜 自 高悬 梦想 五贤堂 囊 贮 白雪 篇 何时 见 华筑 琬 琰 行当 镌
f78349ea-ac81-4e60-a3f1-7547b286b3e7,一春无日不饮遂作肺嗽效乐天体,李流谦,唐,诗,五言古体,生与酒俱生 长与酒俱长 行时酒在樽 坐时酒在盎 一日不举酒 一日眉不放 春来身无事 结客鏖胜赏 南山步新堤 西湖撑彩舫 或飞名园盖 或祖都门帐 大酌须淋漓 小酌犹酣畅 家山忽入梦 江头问两桨 友社惜我去 共和骊驹唱 剧饮连昼夜 大似灌鼠壤 不往愠眉须 好意难弃忘 平生无肺病 因兹作微恙 终夕劳喘呀 如吹竹筒样 积痰动盈缶 咽吐不停吭 童奴更谒谏 浸恐伤府藏 万里寄一身 节宣岂宜爽 𫇴荛不可遗 予心默云当 饮食著圣经 观颐识爻象 惯习未易夺 刚制乃所尚 初如键弩牙 又类遏溪涨 稍稍撤觞斝 久之绝怅望 肠枯与吻燥 但当吸瀣沆 宵枕遂小康 其效疾影响 遽言终止之 未敢保其往 酒颂我文章 酒徒我钩党 有时倚危楼 搔首独惆怅 大药不可求 此物足凭仗 陶谢匪沉酗 遗意觇佛彷 下士闻道笑 识者眉睫上 更欲买黄金 归铸杜康像,"5,5,5,5,5,5,5,5,5,5,5,5,5,5,5,5,5,5,5,5,5,5,5,5,5,5,5,5,5,5,5,5,5,5,5,5,5,5,5,5,5,5,5,5,5,5,5,5,5,5,5,5,5,5,5,5,5,5,5,5",48e0aa70370d34bbb81372f32c38ed67,生 与 酒 俱 生 长 与 酒 俱 长 行时 酒在 樽 坐 时 酒 在 盎 一日 不 举酒 一日 眉不放 春来 身无事 结客 鏖胜 赏 南山 步 新堤 西湖 撑 彩舫 或 飞 名园 盖 或 祖都门 帐 大 酌须 淋漓 小酌 犹 酣畅 家山 忽 入梦 江头 问 两 桨 友社 惜 我 去 共和 骊驹 唱 剧饮 连 昼夜 大似 灌鼠壤 不往 愠眉 须 好意 难 弃 忘 平生 无 肺病 因 兹 作 微恙 终夕 劳喘 呀 如 吹 竹筒 样 积痰 动 盈 缶 咽 吐 不停 吭 童奴 更 谒 谏 浸恐 伤府 藏 万里 寄 一身 节 宣 岂 宜爽 𫇴 荛 不可 遗 予心 默云 当 饮食 著 圣经 观 颐识 爻象 惯习 未易 夺 刚 制 乃 所尚 初 如 键 弩 牙 又 类 遏 溪 涨 稍稍 撤 觞 斝 久之 绝 怅望 肠 枯 与 吻 燥 但 当 吸瀣 沆 宵 枕 遂 小康 其 效疾 影响 遽言 终止 之 未 敢保 其 往 酒 颂 我 文章 酒徒 我 钩 党 有时 倚 危楼 搔首 独 惆怅 大药 不可 求 此物 足 凭仗 陶谢 匪 沉 酗 遗意 觇 佛 彷 下士 闻道笑 识者 眉睫 上 更 欲 买 黄金 归铸 杜康 像
7cb80da4-dcd0-4956-9d93-692480ca87e6,送乐季和,李流谦,唐,诗,五言古体,袖有礼神璧 横夭射䗖𬟽 携持易羊皮 贤士衔隠痛 短檠风雪窗 鼎钟入宵梦 出门雀适羿 挽弓不再中 九折生庭除 欹轮失严鞚 事固不可知 浅者发嘲哄 磨以百艰虞 吾觉此意宠 蝇棘芟根株 织文彻机综 如簧祇嚣烦 战胜属阴拱 诘朝乌帽斜 瘦马霜鬣耸 行世心愈老 转物身自重 解鞍浇客垢 先拨床头瓮 君归我送之 我归欲谁送,"5,5,5,5,5,5,5,5,5,5,5,5,5,5,5,5,5,5,5,5,5,5,5,5,5,5",fd65b3f4f4ea21c06407283dd1c90f1d,袖有礼神璧 横 夭射 䗖 𬟽 携持 易 羊皮 贤士 衔 隠 痛 短 檠 风雪 窗 鼎钟入宵梦 出门 雀 适 羿 挽 弓 不再 中 九折 生 庭除 欹 轮 失 严 鞚 事固不 可知 浅者 发嘲 哄 磨以 百艰虞 吾 觉 此意宠 蝇 棘 芟根 株 织文 彻机 综 如 簧 祇 嚣 烦 战胜 属 阴 拱 诘朝 乌帽 斜 瘦马 霜 鬣 耸 行世心 愈 老 转物 身 自重 解鞍浇 客垢 先 拨 床头 瓮 君 归 我 送 之 我 归欲 谁 送
66cfd568-9253-4c40-a4e0-de39b64c144c,送李仲信,李流谦,唐,诗,五言古体,凤巢无鸺鹠 虎穴不生狸 巽岩四十年 名声儿童知 黄流出昆仑 笔力子似之 严兵鏖残敌 往往辄偃麾 廉颇用赵人 战胜地有宜 一吸空湖江 兹行定英奇 事功出邂逅 道德为根基 傥践钟鼎盟 毋爽藜藿期 请因问安际 订我言是非,"5,5,5,5,5,5,5,5,5,5,5,5,5,5,5,5,5,5",4b3d5f7a4f4ca5f4564fc1861c398e6c,凤巢 无 鸺 鹠 虎穴 不生 狸 巽 岩 四十年 名声 儿童 知 黄 流出 昆仑 笔力 子似之 严兵 鏖 残敌 往往 辄 偃麾 廉颇 用 赵人 战胜 地 有 宜 一 吸空 湖江 兹 行定 英奇 事功 出 邂逅 道德 为 根基 傥 践 钟鼎 盟 毋爽藜 藿期 请 因 问安 际 订 我 言 是非
a96f7c27-34d9-42d6-9521-9531759e3ba3,送仲明赴举,李流谦,唐,诗,五言古体,进退士所重 视天为鼓钲 采薇北山曲 濯足南涧滨 高风岂不伟 奈何万苍黔 道可济天下 不必丘园尊 先生一世士 抱宝三家村 蚤日湖海兴 搅须见霜根 我尝叹洄洑 再拜愿有言 钓鱼须远去 沮洳无鲸鲲 北风折群木 严驾夙在门 万里著掌间 一舸气已吞 岷峩頼君重 努力答山灵 造物饱阅骏 眼未见此人 小却犹玉堂 尚堪托斯文 贱子惜此别 赠送慙空樽 唯有清夜梦 相逐东南奔,"5,5,5,5,5,5,5,5,5,5,5,5,5,5,5,5,5,5,5,5,5,5,5,5,5,5,5,5,5,5",5d09bdfbee7dc0d932625e7f1829d4ba,进退 士所 重 视天为鼓 钲 采薇 北山 曲 濯足 南涧 滨 高风 岂 不伟 奈何 万 苍黔 道 可济 天下 不必 丘园 尊 先生 一世 士 抱 宝 三家村 蚤 日湖 海兴 搅 须 见 霜 根 我 尝 叹 洄 洑 再拜 愿 有 言 钓鱼 须 远去 沮洳 无 鲸 鲲 北风 折 群木 严驾 夙在门 万里 著 掌间 一 舸 气 已 吞 岷 峩 頼 君 重 努力 答山 灵 造物 饱阅 骏 眼 未 见 此人 小 却 犹玉堂 尚堪托 斯文 贱子 惜 此 别 赠送 慙 空 樽 唯有 清夜 梦 相逐 东南 奔
d9ea56a6-7632-46b2-ae02-77c8c5b309d4,送吕义甫,李流谦,唐,诗,五言古体,河伯矜秋浸 望洋始一叹 是以太史公 身行天下半 可怜据坎者 寸尺尽霄汉 我友故英发 骧首轻皂栈 结束万里游 是行吾所赞 荣途听其遇 丈人教不倦 向来开说易 一语无疏传 曰为可用者 此本同世患 停舟佳山水 心目有奇观 更接摇麈谈 中夜光赫焕 我方堕吏罝 沮洳杂鳅蚬 眼看飞鸿翔 别樽恨不满,"5,5,5,5,5,5,5,5,5,5,5,5,5,5,5,5,5,5,5,5,5,5,5,5",35758878dc605c335cbd6413f97e0a36,河伯 矜 秋 浸 望洋 始一叹 是 以 太史公 身 行天下 半 可怜 据 坎者 寸尺尽 霄汉 我友 故 英发 骧 首轻 皂栈 结束 万里 游 是 行 吾 所 赞 荣途听其遇 丈人 教 不倦 向来 开说 易 一语无疏传 曰 为 可用 者 此 本同 世患 停 舟 佳 山水 心目 有 奇观 更 接 摇 麈 谈 中 夜光 赫焕 我方 堕 吏 罝 沮洳 杂 鳅 蚬 眼看 飞鸿 翔 别樽恨 不满
