id,title,author,dynasty,genre,poem_type,sentences_simplified,meter_pattern,hash,words
98c6e66a-a985-47c1-b508-c6910c326928,和樓倅宗簿  其二,劉宰,唐,诗,杂言,余幼好此奇服兮 岁荏苒而华颠 闻若人之好修兮 搴众芳而独专 结微情以陈词兮 鳞鸿杳以无传 惟圣哲之茂行兮 在举能而任贤 横江湖以扬舲兮 宁维楫之可捐 烂晨光兮破群幽 清风发兮凉气飕飕 琼珮兮锵锵 玉鸾鸣兮啾啾 时不可兮骤得 君胡为乎此留,"7,6,7,6,7,6,7,6,7,6,7,8,5,6,6,6",72a7289a1c25027516afa52880b9d838,余幼 好此 奇服 兮 岁 荏苒 而 华颠 闻若人 之 好 修 兮 搴 众 芳 而 独 专 结微情 以 陈词 兮 鳞 鸿 杳以无传 惟 圣哲 之 茂行 兮 在 举能 而 任贤 横 江湖 以 扬 舲 兮 宁维楫 之 可捐 烂 晨光 兮 破 群 幽 清风 发兮 凉气 飕飕 琼珮兮 锵锵 玉鸾鸣 兮 啾 啾 时 不可 兮 骤得 君 胡为乎 此 留
b13a9f20-e8b8-4eed-b4d0-51cbc047f5f5,月桂辭送陳兄部運京口,劉宰,唐,诗,杂言,芳菲菲兮月之桂 子之家兮传芳世世 月之桂兮古犹今 往则得兮子宁不嗣音 冠鹖冠兮谢章甫 司征商兮河之浒 更兼官兮部运 幸讫事兮无忤 归来兮归来 倚门怅望兮高堂慈母,"7,8,7,9,7,7,6,6,5,9",8b6be12aa42cdee65e1158e91246d64d,芳菲 菲 兮 月之桂 子 之 家 兮 传 芳 世世 月 之 桂兮 古犹 今 往 则 得 兮 子宁 不 嗣 音 冠 鹖 冠 兮 谢 章 甫 司征 商兮河 之 浒 更 兼 官 兮 部运 幸 讫 事 兮 无 忤 归来 兮 归来 倚门 怅望 兮 高堂 慈母
473932bd-190b-4423-a9da-b2f390e802a4,書竇文卿墓,劉宰,唐,诗,杂言,栋宇兮煌煌 鬓发兮苍苍 羌一言兮会心 驾吾车兮建阳 车既驾兮遄归 今良是兮昨非 释众累兮春冰 耿吾心兮夕晖 斯道兮孔寿 斯人兮不忘 十载兮重来 泬漻兮此堂 风撼兮寒松 霜凋兮百草 佳城兮葱葱 万古兮是保,"5,5,6,6,6,6,6,6,5,5,5,5,5,5,5,5",b5f66d3fe90086c9f91a0bc6f589fb26,栋宇 兮 煌煌 鬓发 兮 苍苍 羌 一言 兮 会心 驾吾车 兮 建阳 车 既 驾 兮 遄 归 今良 是 兮 昨 非 释 众 累 兮 春冰 耿吾 心 兮 夕晖 斯道兮 孔寿 斯人 兮 不 忘 十载 兮 重来 泬 漻 兮 此 堂 风撼兮 寒松 霜 凋 兮 百草 佳城 兮 葱葱 万古 兮 是 保
4b4893dd-8fb9-4e8e-a195-fa42c699cb20,雲邊種松,劉宰,唐,诗,五言绝句,渐止牛羊牧 还添雨露滋 但令萌蘗长 自有岁寒姿,"5,5,5,5",755e67a9958b1a9b1fd179d725af2657,渐止 牛羊 牧 还 添 雨露 滋 但令 萌蘗 长 自有 岁寒 姿
29b6fbe8-cb04-4cec-9768-001355dae3e2,題屏間,劉宰,唐,诗,五言绝句,野旷乾坤大 身闲日月迟 有生均自得 造物本无私,"5,5,5,5",1376f4b9440f58e39ca26f6ed8b8ccc1,野旷 乾坤 大 身闲 日月 迟 有生 均 自得 造物 本 无私
f0910aeb-0370-4741-a9ad-ddb128c17ee0,謝陳僉惠紅綠柿,劉宰,唐,诗,五言绝句,红绿分佳果 丹青让好辞 遥怜霜落叶 岸帻坐题诗,"5,5,5,5",b56f5cea31f7907349b0a925c5bb93bf,红绿 分 佳果 丹青 让 好辞 遥怜 霜 落叶 岸 帻 坐 题诗
dc17b2b9-e38d-4133-82e8-20b99fe4087b,送李季允侍郎歸蜀五絕用禪房花竹幽爲韻  其一,劉宰,唐,诗,五言绝句,密叶秋逾润 幽花晚更妍 去来谁是主 试问白头禅,"5,5,5,5",0ae77f3a143df750b0d068dc01b911f7,密 叶秋 逾 润 幽花 晚更 妍 去来 谁 是 主 试问 白头 禅
ed8c543b-1ac4-4f1f-9cae-15687fcb07dc,送李季允侍郎歸蜀五絕用禪房花竹幽爲韻  其二,劉宰,唐,诗,五言绝句,地僻风烟好 身闲日月长 未知嘉遯吉 占验笑京房,"5,5,5,5",4750a6df5d9e5eb5d185ed3b99c884d4,地 僻 风烟 好 身闲 日月 长 未知 嘉 遯 吉 占验 笑 京房
1e76c3c4-076b-47cf-af59-3f99ceb8fe97,送李季允侍郎歸蜀五絕用禪房花竹幽爲韻  其三,劉宰,唐,诗,五言绝句,淮海身如系 岷峨路去赊 相思冰雪里 却立嗅梅花,"5,5,5,5",fa129cba8c27763f66a54155861fcadb,淮海 身如系 岷峨路 去 赊 相思 冰雪 里 却 立 嗅 梅花
19614669-f72d-499c-b2a9-ae4c13d819f3,送李季允侍郎歸蜀五絕用禪房花竹幽爲韻  其四,劉宰,唐,诗,五言绝句,交情契金兰 燕乐非丝竹 我歌古别离 语尽君当续,"5,5,5,5",e55168d52444c2ec9c42c70f16dc7cbc,交情 契 金兰 燕乐非 丝竹 我 歌古 别离 语尽君当续
91edeede-03c6-4786-8cd1-a76bf3f6e654,送李季允侍郎歸蜀五絕用禪房花竹幽爲韻  其五,劉宰,唐,诗,五言绝句,日脚收新雨 禅房早得秋 重来应更好 谁与共清幽,"5,5,5,5",e07ee92661c2b586509f3822ee975416,日 脚 收 新 雨 禅房 早 得 秋 重来 应 更好 谁 与 共 清幽
2b4d7768-37c1-4054-91d5-c6582bef50bf,送昔監稅滿替,劉宰,唐,诗,五言绝句,但了官中事 都无俸外钱 妙年能尔尔 晚节更须坚,"5,5,5,5",1d72540e3c77fb7c8a548d4ec857d777,但 了官 中事 都 无 俸 外 钱 妙 年 能 尔尔 晚节 更须 坚
0cf7fb47-1476-4220-9ecb-2f8582e1e2ce,題虎丘劍池,劉宰,唐,诗,五言绝句,石壁千年立 池泉百尺深 萧萧陵下木 遗恨古犹今,"5,5,5,5",cdb69c98357d3bfcbaadf4b9ba1e0956,石壁 千年 立 池泉 百尺 深 萧萧 陵 下 木 遗恨 古犹 今
54177d1c-9ff3-4e1f-98dc-8378f57fe400,題王氏天開圖畫卷後,劉宰,唐,诗,五言绝句,浓淡非粧点 纵横谢剪裁 凭栏一凝睇 图画信天开,"5,5,5,5",525d2e9caddbd89eb037aa22489a9d98,浓淡 非 粧 点 纵横 谢 剪裁 凭栏 一 凝睇 图画 信 天开
80c607fd-2a04-4974-9be9-5201e329d7a2,次王兄韻二首  其一,劉宰,唐,诗,五言绝句,锦绣胸中富 珠玑笔下生 如何鹿门去 不向玉堂盛,"5,5,5,5",25a9a15f6324c7a4dea9588c75183221,锦绣 胸中 富 珠玑 笔下 生 如何 鹿门 去 不 向 玉堂盛
d6b8a6fd-6493-472c-a739-77fdce552fef,次王兄韻二首  其二,劉宰,唐,诗,五言绝句,买屋依三阜 开窗对两池 去来谁是主 空锁壁间诗,"5,5,5,5",3c3c403621db931745c535023176368a,买屋 依 三阜 开窗 对 两池 去来 谁 是 主 空锁 壁间 诗
2e79c66c-49e2-4669-a9a6-3565e676d2a7,再用韻  其一,劉宰,唐,诗,五言绝句,野径梅初发 寒塘草又生 能来同社酒 莫笑瓦盆盛,"5,5,5,5",6dcdb2b2c8d2fd50aaf1de9f574a8027,野径 梅初 发 寒塘草 又 生 能来 同 社酒 莫笑 瓦盆 盛
238a057f-9d9b-49a1-99c0-0ec6618578f5,再用韻  其二,劉宰,唐,诗,五言绝句,绿杨陶令宅 芳草谢家池 开径应须我 酬君未有诗,"5,5,5,5",4a783cb195e490ddc61da8eac65c966d,绿 杨 陶令宅 芳草 谢家 池 开径 应须 我 酬 君 未有 诗
afe10590-3e28-4abc-83bd-9eafb3f25ca1,雲邊遣興,劉宰,唐,诗,五言绝句,穴处堪忘世 松餐足永年 有时云雨止 独立看青天,"5,5,5,5",7d9c39f11847dc2bfbbd2395c09357fc,穴处 堪忘 世 松餐 足 永年 有时 云雨 止 独立 看 青天
c9c1859a-ac8e-493f-b674-9e156fd14dd3,送李果州  其一,劉宰,唐,诗,五言绝句,萧然瘦鹤姿 不受世俗尘 吾衰久矣夫 眼明见斯人,"5,5,5,5",df3e33d59ce018caa76495f5adcbcb84,萧然 瘦鹤 姿 不 受 世俗 尘 吾 衰久 矣 夫 眼明 见 斯人
54a9e075-4b1d-474a-b348-d78b640fc6db,送李果州  其二,劉宰,唐,诗,五言绝句,含香趋汉陛 前席问贾生 要路须民庸 锦衣聊昼行,"5,5,5,5",54637b676d74b4a43cea584e65ce8659,含香 趋汉 陛 前席 问 贾生 要 路 须 民庸 锦衣 聊 昼行
f61e2f95-5e51-4976-8ee5-f248c92dbf98,送李果州  其三,劉宰,唐,诗,五言绝句,一年春好处 寒食一百五 想见束晨装 沙头震鼍鼓,"5,5,5,5",2f9e11714081e9833bb0e59671aa0095,一年 春 好处 寒食 一百 五 想见 束晨 装 沙头 震 鼍 鼓
576807f7-acca-4127-b4c5-a0b09d5f2bae,送李果州  其四,劉宰,唐,诗,五言绝句,昔吾有先正 走卒称司马 忧国等忧家 人物君其亚,"5,5,5,5",d77eb42e85e359172c00aabcc32adc1f,昔 吾 有 先正 走卒 称 司马 忧国 等 忧家 人物 君其亚
2fecf3ad-211b-415c-b7db-731a12ae1776,儀真法曹日作,劉宰,唐,诗,七言绝句,纷纷恶直喜阿谀 局束英豪气不舒 万事付渠三昧手 此生自放五车书,"7,7,7,7",496e3a399520e7792b6660be5583ba67,纷纷 恶直 喜 阿谀 局束 英豪 气 不 舒 万事 付渠 三昧 手 此生 自放 五车 书
534b4a34-5c26-4382-ae90-9ec9542557d1,題儀真常平倉壁,劉宰,唐,诗,七言绝句,苦被微官缚此身 汗衣亭午亚红尘 维舟醉卧垂杨下 输与江湖自在人,"7,7,7,7",d08e568f6bcfc00050acdcfd911f9b0b,苦 被 微官 缚 此身 汗衣 亭午 亚 红尘 维舟 醉卧 垂杨 下 输与 江湖 自 在 人
6f810820-762e-497c-8ff6-253e9cbfd067,儀真呈隣居同官,劉宰,唐,诗,七言绝句,南楼风物怯新晴 管领心知独有君 从使市声鏖午枕 不妨清梦到行云,"7,7,7,7",914393a13af7b26ed3c101b3ac907f3b,南楼 风物 怯 新 晴 管领 心 知 独有 君 从使 市声 鏖午 枕 不妨 清 梦 到 行云
7665c179-0dfe-4eab-8e74-7c958fe67f2b,過尤溪,劉宰,唐,诗,七言绝句,尤溪塘上征人路 记得停骖一解颜 十载重来儿女换 似曾相识有青山,"7,7,7,7",592af7254bc550ff4ce4af7c1e573ec6,尤溪 塘 上征 人路 记得 停 骖 一解颜 十 载重 来 儿女 换 似曾相识 有 青山
d2626dd4-3189-40bf-9c2d-4eaaa14b186f,過剡溪,劉宰,唐,诗,七言绝句,青山叠叠水潺潺 路转峰回又一湾 想见雪天无限好 不妨独棹酒船还,"7,7,7,7",a5cdef80d6dbc49f2426f312935d21f8,青山 叠叠 水 潺潺 路 转 峰回 又 一 湾 想见 雪天 无限 好 不妨 独 棹 酒 船 还
403eb746-219a-4ef0-b1ef-7bba3f3e9e47,賦陳太史所築凌雲亭四首  其一,劉宰,唐,诗,七言绝句,太史曾题仲举舆 子虚赋就压蓬庐 终然不负凌云志 会向蓬莱顶上居,"7,7,7,7",9dde6128d62615813deaeb68884410ea,太史 曾题 仲举 舆 子虚赋 就 压 蓬庐 终然 不负 凌云志 会 向 蓬莱 顶上 居
a31dd7f6-337b-46e8-8ad3-c0ac9a59f3fa,賦陳太史所築凌雲亭四首  其二,劉宰,唐,诗,七言绝句,吏退庭空一迳深 交柯密叶布繁阴 婆娑谁识先生意 恐负当时庇物心,"7,7,7,7",b8a3469db918734faec8e0ffa1b52542,吏 退庭 空 一迳 深 交 柯密叶 布繁阴 婆娑 谁 识 先生 意 恐 负 当时 庇 物心
805543a2-7829-4df0-87e0-b3c56246f0be,賦陳太史所築凌雲亭四首  其三,劉宰,唐,诗,七言绝句,紫烟缥缈接云霞 亭下连甍十万家 想见当年关尹子 已占柱史入京华,"7,7,7,7",28bfc827bdc0f60d5ebadf1f6327085d,紫烟 缥缈 接 云霞 亭 下 连 甍 十万家 想见 当年 关尹子 已 占 柱 史 入 京华
f8b980ef-acf8-4686-a811-2f84588d5755,賦陳太史所築凌雲亭四首  其四,劉宰,唐,诗,七言绝句,身自蓬莱顶上来 彩云深处见崔嵬 凭高莫作凌云想 闻说天门有诏催,"7,7,7,7",522a9f0272163b43a811a5f1e8f705a6,身 自 蓬莱 顶上来 彩云 深处 见 崔嵬 凭 高 莫 作 凌云 想 闻 说 天门 有 诏 催
09cf38b9-6ef8-46ba-a1c2-2478f69aa0dc,題馮公嶺旅邸,劉宰,唐,诗,七言绝句,层楼杰阁耸朱栏 楼下行人自往还 但见彩云横木末 不知身在翠微间,"7,7,7,7",10dd0966fceec71ebe9419834ac359fc,层楼 杰阁 耸 朱栏 楼下 行人 自往 还 但 见 彩云 横木 末 不知 身 在 翠微 间
287c0bec-b840-4c81-b5ad-39203de31702,題永嘉寺壁,劉宰,唐,诗,七言绝句,石泉飞下宝莲宫 似听钧天奏未终 千古风流谢康乐 可无屐齿此山中,"7,7,7,7",84e4cc58b677276f227f98625032d7a1,石泉 飞下 宝莲宫 似 听 钧 天奏 未终 千古 风流 谢康乐 可 无 屐 齿 此 山中
fb3a7ec2-2fdc-45bf-a0e4-ae892e2d6456,題石門奉真觀,劉宰,唐,诗,七言绝句,叠障为屏石作门 阴云漠漠雨昏昏 清游到晚不知去 要上峰头望晓暾,"7,7,7,7",ad5c70d21f4beef014f945692fd1bf21,叠障 为 屏石 作门 阴云 漠漠 雨 昏昏 清 游到 晚 不知 去 要 上峰 头 望晓暾
48214cee-0a39-4207-bd54-f16170a1d26a,吳門道中,劉宰,唐,诗,七言绝句,三吴豪侠骋轻肥 尽是当年襁褓儿 鬓发苍苍颜色改 问翁如此复何为,"7,7,7,7",9db4a1981191b8ef22b9671c906c983e,三 吴 豪侠 骋 轻 肥 尽 是 当年 襁褓 儿 鬓发 苍苍 颜色 改 问翁 如此 复 何为
9c83a9e0-4726-4783-996b-a350988f240f,舟過惠山,劉宰,唐,诗,七言绝句,小立船头看惠山 山尖半在有无间 蚕眠未老秧方绿 且放烟云自往还,"7,7,7,7",9a90feb6d040da4ad2868840ae28ccc1,小立 船头 看 惠山 山尖 半在 有 无间 蚕眠 未 老 秧方 绿 且 放 烟云 自往 还
8ae4771a-0da7-4be5-8c17-1be4f2d72018,舟中,劉宰,唐,诗,七言绝句,蓼岸著花红半吐 稻畦过雨绿平铺 炊烟起处三家市 却向江湖忆画图,"7,7,7,7",4be63ea704d8b51d7763a5832a025350,蓼 岸 著 花红 半 吐 稻 畦 过雨 绿 平铺 炊烟 起处 三家 市 却 向 江湖 忆 画图
f18a2ded-3449-4df4-aee7-b2ab053b7be0,醉中,劉宰,唐,诗,七言绝句,一樽绿酒与君同 且喜荷香送晚风 四座尽倾谈柄白 满筵不用舞裙红,"7,7,7,7",1d1887521365bb12589a025170eae84f,一 樽 绿 酒 与 君 同 且 喜 荷香 送 晚风 四座 尽 倾谈 柄 白 满 筵 不用 舞裙 红
645a5bc5-cbbf-4dd9-b317-a6f0b7a85d40,漫塘口占,劉宰,唐,诗,七言绝句,醉著船头背月眠 醒来红日浴晴川 等闲活计无人共 独占江湖万里天,"7,7,7,7",497e03cf2d3fb7751b1afeb9d52da3f2,醉著 船头 背 月 眠 醒来 红日 浴 晴川 等闲 活计 无人 共 独占 江湖 万里 天
487c1987-d4a1-45b8-98c0-659310d78fb9,九日,劉宰,唐,诗,七言绝句,捣飺𥬠酒荐新舂 叹息年来甔石空 不惜解衣供一饷 要令稚子识家风,"7,7,7,7",0290d507f226c13cb11075f1a7f2df88,捣 飺 𥬠 酒 荐 新 舂 叹息 年 来 甔 石 空 不惜 解衣 供一 饷 要 令 稚子 识 家风
5eeeab7e-2560-4d24-a629-ec8b192c177a,感春,劉宰,唐,诗,七言绝句,隔溪啼鸟弄新音 绕岸蒲芽迸绿簪 花事只今强半在 不妨风雨搅春阴,"7,7,7,7",7b68dfea1b14567db170eb28f94d8779,隔溪 啼 鸟 弄 新音 绕岸 蒲芽 迸 绿簪 花事 只今 强半 在 不妨 风雨 搅 春 阴
1970e60a-6e6d-4202-97ad-92a21252e12e,七夕,劉宰,唐,诗,七言绝句,天孙今夕渡银潢 女伴纷纷乞巧忙 乞得巧多成底事 祇堪装点嫁衣裳,"7,7,7,7",9485291fe54ecdc844781d021cd4d70d,天孙 今夕 渡 银潢 女伴 纷纷 乞巧 忙 乞得 巧 多成 底事 祇 堪 装点 嫁衣裳
4236ff56-b79e-4051-848a-b1d16b49dc66,天台道中用陳氏園亭韻  其一,劉宰,唐,诗,七言绝句,笋舆穿过万重山 邂逅登亭一解颜 剩欲题诗徧苍石 举头羞见岭云闲,"7,7,7,7",85ad8abc9ecd3ddfef884f97fe49cd9c,笋 舆 穿过 万重山 邂逅 登亭 一解颜 剩欲 题诗 徧 苍 石 举头 羞见 岭 云 闲
61c18258-998b-4686-90c4-0e4ad4effadb,天台道中用陳氏園亭韻  其二,劉宰,唐,诗,七言绝句,亭俯澄波对碧山 山头古木总苍颜 爱山未办还山计 猿鹤还应伴我闲,"7,7,7,7",b611fed57951f6b2b1370df7200edda1,亭 俯 澄波 对 碧山 山头 古木总 苍颜 爱山 未办 还山 计 猿 鹤 还 应伴 我 闲
30f64283-4117-495a-a5f0-4bcedc3d0463,秋懷二首  其一,劉宰,唐,诗,七言绝句,翠幄迎霜半染红 高林风过杂笙钟 澄光万顷天无滓 留与羲和驾六龙,"7,7,7,7",22d7916e735380f4e6d35d3feed7b845,翠 幄 迎 霜半 染红 高林风 过 杂 笙 钟 澄光 万顷 天 无 滓 留 与 羲 和 驾 六 龙
77552c48-1315-464a-adda-34295284ba8e,秋懷二首  其二,劉宰,唐,诗,七言绝句,一抹红绡日脚霞 千林暮霭纳归鸦 西风卷尽梧桐叶 乞与中庭散月华,"7,7,7,7",97d608a3c28844955e2982a297a096c3,一抹 红 绡 日 脚 霞 千林 暮霭 纳归 鸦 西风 卷 尽 梧桐叶 乞与 中庭 散 月华
a8db2ded-82d1-4f13-aa89-2cecc21af326,嘲啼鳥,劉宰,唐,诗,七言绝句,破袴年来未改为 园中啼鸟汝何知 从教解使君侯悟 尔死何由得盖帷,"7,7,7,7",c57db9cadc1fe47e9f39d8d73aee4b6e,破袴年来 未 改为 园中 啼 鸟 汝何 知 从教 解 使君 侯悟 尔 死何由得盖帷
ac65f0a1-ec84-47ca-b079-0e351876624d,東陽道中聞杜鵑,劉宰,唐,诗,七言绝句,万里云山路渺茫 车轮竟日往来忙 凭君一语成归去 笑杀儿时射四方,"7,7,7,7",e8fe5ff292b6331f73134191272ad9c2,万里 云 山路 渺茫 车轮 竟 日 往来 忙 凭 君一语 成 归去 笑 杀 儿时 射 四方
88171827-6c81-4c5e-b7c3-c4a1ab4e3d76,聞桔橰,劉宰,唐,诗,七言绝句,岁旱田家竞作劳 车声夜半响嗷嘈 市门多少夸毗子 日晏高眠笑尔曹,"7,7,7,7",332974220b8766d78bd37d80c31228d8,岁 旱田 家 竞作 劳 车 声 夜半 响嗷嘈 市门 多少 夸 毗子 日 晏高眠 笑 尔曹
58d723ca-94ea-41db-91b9-b7d1bafbb12e,宿直里店二首  其一,劉宰,唐,诗,七言绝句,扁舟泛泛逐惊湍 朔吹飙飙作晓寒 舣棹远来投野店 应门幸喜得儒冠,"7,7,7,7",a4c3b7677249abcabeb22b24b6323455,扁舟 泛泛 逐 惊 湍 朔 吹飙 飙作 晓寒 舣 棹 远 来 投 野店 应 门 幸喜 得 儒冠
a34dcec6-fce4-49d1-8add-73b27c9ff4d5,宿直里店二首  其二,劉宰,唐,诗,七言绝句,稻获田空宿水禽 去来终夜有清音 投床倦客无他想 祇有江湖万里心,"7,7,7,7",90a43d62eccc9879da9e9a9213c2598a,稻获田 空宿 水禽 去来 终夜 有 清音 投床 倦客 无 他 想 祇 有 江湖 万里 心
b83fce73-eb21-4dc8-9ec6-a5e155a776e3,雷發散雨書懷,劉宰,唐,诗,七言绝句,轰雷惊散半空雨 赫日冲开万里云 依旧炎炎还酷暑 南来犹幸有晴薰,"7,7,7,7",1b193d1fa34fd56274af0ea4c26836eb,轰雷惊散 半空 雨 赫日 冲开 万里 云 依旧 炎炎 还 酷暑 南来 犹幸 有 晴薰
00e027ac-d538-4549-b491-8761c7377c87,題呂城廟,劉宰,唐,诗,七言绝句,吕公遗垒枕高冈 落日西风草木荒 王气悬知南国在 不妨北面俨冠裳,"7,7,7,7",41ac6b81742ace23c4652d20b7704a04,吕公 遗垒 枕 高冈 落日 西风 草木 荒 王气 悬知 南国 在 不妨 北面 俨冠 裳
737c0e52-3f18-4693-8d5a-38b9fb4d0b56,和陳倅校書惠詩,劉宰,唐,诗,七言绝句,故交衮衮白头新 倾盖相望有几人 奉诏君应归册府 一蓑我欲老江滨,"7,7,7,7",7cf427eb779a483fac293680812a1639,故交 衮衮 白头 新 倾盖 相望 有 几 人 奉 诏 君 应 归册 府 一蓑我欲老 江滨
c7b98bb9-6e92-438c-90e8-e4fafdbbd80c,和陳校書祈雨有應,劉宰,唐,诗,七言绝句,一念忧民敢惮烦 肩舆得得款祠坛 莫嫌勺水能多少 自是壶中世界宽,"7,7,7,7",ac8b05d1985d83441326733751494d81,一 念 忧民 敢 惮 烦 肩舆 得 得款 祠坛 莫嫌勺 水能 多少 自 是 壶 中 世界 宽
fd3fe48c-d606-4a96-84e8-256259ebd03e,和陳校書生孫,劉宰,唐,诗,七言绝句,四海声名陈太丘 元方有子复何忧 他年羔鴈成群至 不独丹青诧豫州,"7,7,7,7",5d77dfa6f81bb3049306d975dafc905c,四海 声名 陈太丘 元方 有子复何忧 他 年 羔 鴈 成群 至 不独 丹青 诧 豫州
7b4fac25-a630-4e51-b6a5-8c92e95aae40,和趙季行用蘭花韻三首  其一,劉宰,唐,诗,七言绝句,破除百卉发孤芳 造化工夫有抑扬 平易堂中无个事 一枝相对吐清香,"7,7,7,7",f94d24613eec42982cb66d8de10a2366,破除 百卉 发 孤芳 造化 工夫 有 抑扬 平易 堂 中 无个 事 一枝 相对 吐 清香
da09d733-adf3-4b9e-b4e5-b8c9e96a6a5b,和趙季行用蘭花韻三首  其二,劉宰,唐,诗,七言绝句,结根嵓谷谢群芳 多谢光风为发扬 骚客毋烦赋纫佩 省郎行矣趣含香,"7,7,7,7",23ba0e8668d6f101b68a7e10381fe889,结根 嵓 谷 谢 群芳 多谢 光风 为 发扬 骚客 毋烦赋 纫 佩 省郎 行 矣 趣 含 香
e1fa7c69-b8e1-4ebb-81ad-29b78d77125c,和趙季行用蘭花韻三首  其三,劉宰,唐,诗,七言绝句,𫛸鴂潜消百草芳 清芬散逐楚风扬 洛阳姚魏空增价 愧死嵓隈有国香,"7,7,7,7",863d22031fdc6b54883f84779e5cc575,𫛸 鴂 潜 消 百草 芳 清芬 散逐 楚 风扬 洛阳 姚魏 空增 价 愧 死 嵓 隈 有 国 香
a1b3172e-3376-425b-9157-a77ac4ec0068,次韻蘇明仲,劉宰,唐,诗,七言绝句,诗翁名字简思陵 死去人疑化鹤丁 败絮当年犹自拥 褐衣今日可忘情,"7,7,7,7",33b1b5e0228e8c18877ac6cfc8182344,诗翁 名字 简思陵 死去 人 疑化 鹤丁 败絮 当年 犹自 拥 褐衣 今日 可 忘情
cb1bb17d-fe6f-44e6-9843-5e270f8c3e46,酬陳子與,劉宰,唐,诗,七言绝句,门外秋光入句频 门前积雨少来人 利名到底成何事 赢得江湖自在身,"7,7,7,7",c4c50fe64724186f3f9c4afe8c6545df,门外 秋光入 句 频 门前 积雨 少 来 人 利名 到底 成 何事 赢得 江湖 自 在 身
4c53db01-0d17-4c62-bba6-6ae98fc525a5,送晦庵語孟集註與諸姪,劉宰,唐,诗,七言绝句,伊洛遗书徧讨论 微言千古破童昏 要知此老殷勤意 送与君家好弟昆,"7,7,7,7",585b7c9d1a504a6d9547fb8b0a2b343b,伊洛 遗书 徧 讨论 微言 千古 破 童昏 要知 此 老 殷勤 意 送与 君家 好弟 昆
7446281d-1378-4aae-940d-e0ff5c87c25e,冬日即事,劉宰,唐,诗,七言绝句,飞廉不解却丰隆 结就浓阴万里同 须信碧霄无点滓 晓来红日自生东,"7,7,7,7",07a72bb1a7b31ab6e51e63174d9e1fe6,飞廉 不解 却 丰隆 结 就 浓 阴 万里 同 须信碧霄 无 点 滓 晓来 红日 自 生东
51bb844a-b251-4b12-8814-5f75cec68569,戲和荆公讀漢書,劉宰,唐,诗,七言绝句,当年泚笔笑愚忠 后日私书迹更穷 自是京刘异恭显 未知君意与谁同,"7,7,7,7",279279f0d8eb268c36acad27f9cf1d49,当年 泚 笔 笑 愚 忠 后日 私书迹 更 穷 自 是 京 刘异恭 显 未知 君意 与 谁 同
f31846ed-0523-4ee2-b0c1-8f9140c38979,讀韓詩和其韻,劉宰,唐,诗,七言绝句,韩子文同孟氏醇 陈言去尽只天真 君诗费却雕镌力 笔下应夸自有神,"7,7,7,7",4d404e0b4e17d70017452b35e23cffe4,韩子文 同 孟氏醇 陈言 去 尽 只 天真 君 诗费 却 雕 镌 力 笔下 应夸 自有 神
36a0f0ff-309c-4cb4-83f8-0b627a1798b8,讀蘇武傳,劉宰,唐,诗,七言绝句,李陵卫律两降人 大义相规几尽诚 陵语不传传卫律 要令千载识交情,"7,7,7,7",de21f06fbc4fa43937f46f9c6f64a6b4,李陵卫 律 两 降人 大义 相规几 尽诚 陵语 不 传传 卫律 要 令 千载 识 交情
a7fbf89c-c4a9-4583-b5ee-e7af69a52b88,讀公孫弘卜式兒寬傳,劉宰,唐,诗,七言绝句,儒雅弘宽世所宗 汗青中介牧羊翁 史家有意君知否 未必文华胜朴忠,"7,7,7,7",534f796667878f3b87e96a9200bf0e92,儒雅 弘宽世 所 宗 汗青 中介 牧羊 翁 史家 有意 君 知否 未必 文华 胜 朴忠
44f511df-790f-41fc-bd1d-cb4398caa020,讀樓護傳,劉宰,唐,诗,七言绝句,刘氏难令吕氏安 郦生大义炳如丹 君卿卖友阿王莽 死去何颜见吕宽,"7,7,7,7",d55479961489af3f29e875cd6ca37700,刘氏 难 令 吕氏安 郦生 大义 炳 如 丹 君卿 卖友 阿 王莽 死去 何颜见 吕宽
024e6923-0cc0-428e-9443-938372825883,讀衛青傳,劉宰,唐,诗,七言绝句,任侠行权世所诛 将军尚借齿牙余 古来名将勤招选 底事牢辞不敢居,"7,7,7,7",8bce82730e28df0d44f3c60a7a3abf65,任侠 行权 世所 诛 将军 尚 借齿牙余 古来 名将 勤 招选 底事 牢辞 不敢 居
d8ec6233-3575-4444-ad6b-bea9fb94f811,書陳少陽遺墨後,劉宰,唐,诗,七言绝句,赎死何由可百身 遗书犹足警来人 当时珍重千金字 此日凄凉一窖尘,"7,7,7,7",cafee984716eb446436dd1e0e1776024,赎死 何由可百身 遗书 犹足 警来 人 当时 珍重 千金 字 此日 凄凉 一 窖 尘
020be693-0cca-4f76-a0e9-7c8590c9eeda,送應徽之歸天台,劉宰,唐,诗,七言绝句,去来行李苦匆匆 世路崎岖一笑中 闻道倚门占鹊喜 早寻归棹浙江东,"7,7,7,7",47da0d7d3eea95363e0cc6f7c3cd32e0,去来 行李 苦 匆匆 世路 崎岖 一 笑 中 闻道 倚门 占 鹊 喜 早 寻 归 棹 浙江 东
79955406-b4fa-4cbb-a60d-f44bc17c1683,借明秀軒韻送趙推入幕二首  其一,劉宰,唐,诗,七言绝句,七泽波涛笔下吞 相逢晓日上天门 祇今出处难同调 惭愧高轩几访存,"7,7,7,7",906cae4c70a350a2524df028c0133c91,七泽 波涛 笔下 吞 相逢 晓 日 上 天门 祇 今 出处 难 同调 惭愧 高轩 几 访存
4de54e62-af94-42b8-b47a-30a3ba6a3f65,借明秀軒韻送趙推入幕二首  其二,劉宰,唐,诗,七言绝句,纷纷末俗假成真 幕府归来岁聿新 万里终存江海志 一毫莫染簿书尘,"7,7,7,7",5de5a06ca16b9fa2ab529841c08e42aa,纷纷 末俗 假成 真 幕府 归来 岁聿新 万里 终存 江海 志 一毫 莫染 簿 书 尘
d1dfbfa8-66ce-4528-bc86-57b6b07e6325,雲邊即事,劉宰,唐,诗,七言绝句,山鸟纷纷不计名 晓来聒聒弄新晴 山人不识虞庭乐 疑是箫韶奏九成,"7,7,7,7",c3c2eb4061c904c5ee5c5b0d25ffd679,山鸟 纷纷 不计 名 晓 来聒 聒弄 新 晴 山人 不识 虞庭乐 疑 是 箫 韶 奏 九成
4a1a16f4-14a8-4f79-8b1b-f566ffea3e33,題龍祠米元暉詞後,劉宰,唐,诗,七言绝句,醉笔淋漓纪胜寻 重来尚想百年心 浪将一字殊先后 谁识朱弦太古音,"7,7,7,7",fb7e2ad29a4e94afdaa30cb013c2f715,醉 笔 淋漓 纪胜 寻 重来 尚 想 百年 心 浪 将 一字殊 先后 谁 识 朱弦 太 古音
ec2ccf86-9204-4bf8-a3ee-64a6cd95f4c4,松影,劉宰,唐,诗,七言绝句,老松偃蹇印晴空 倒影参差澹月中 夜久无人共清赏 一庭萧瑟走虬龙,"7,7,7,7",4594799a02f5801b7ce13ebd3c961b74,老松 偃蹇 印 晴空 倒影 参差 澹月中 夜久 无人 共 清赏 一庭 萧瑟 走 虬龙
c3eef51a-2d51-454a-958b-4018e9ce42de,戲傳老,劉宰,唐,诗,七言绝句,锦绣囊开一夜风 万家花柳鬭青红 谁知一点阳和气 尽在高禅杖锡中,"7,7,7,7",eb107ce182682d375fa9f0bad9dd55fb,锦绣 囊 开 一夜 风 万家 花柳 鬭 青 红 谁知 一点 阳 和 气 尽在 高 禅杖 锡 中
0c755d35-7311-4e30-aaed-86dc4191d820,謝薦醫,劉宰,唐,诗,七言绝句,容貌天黥二十年 刳肠一洗怅无缘 祇今纵使逢医缓 却顾霜毛已飒然,"7,7,7,7",5e9064bc596690f689e65e6b6b0d45b2,容貌 天 黥 二十年 刳 肠 一 洗怅 无缘 祇 今 纵使 逢医缓 却 顾 霜 毛 已 飒然
