id,title,author,dynasty,genre,poem_type,sentences_simplified,meter_pattern,hash,words
0744b8bc-0edf-46c0-b10b-3ca163abcd3e,赠山房先生得宣命,何昭德,唐,诗,七言律诗,飞凤翩翩下九阍 先生出处重斯文 不将钟鼎易朱绂 要老桐山守白云 处士一生纯是晋 逸民千古尚为殷 皇家恩意如天大 定把三峰乞与君,"7,7,7,7,7,7,7,7",1f9d6724d556ac3cd16a2a93ac935ded,飞凤 翩翩 下九 阍 先生 出处 重 斯文 不 将 钟鼎 易朱绂 要 老桐山 守 白云 处士 一生 纯 是 晋 逸民 千古 尚为 殷 皇家 恩 意 如 天大 定 把 三峰 乞与 君
d2d3c7d5-4bff-4488-9344-01ef76271d6b,贺山房先生得宣命,卢珏,唐,诗,七言律诗,自从骢马到清溪 浄洗江山绝点埃 霜月高擎随地转 春风吹喜自天来 皇华礼遣荣花县 宣命恩浓出柏台 海内苍生望霖雨 庙堂正要栋梁材,"7,7,7,7,7,7,7,7",da38eadb358e0b9e52a554da83ce575e,自从 骢 马 到 清溪 浄 洗 江山 绝点 埃 霜月 高擎 随地 转 春风 吹 喜 自天 来 皇华礼 遣荣 花县 宣命恩 浓出 柏台 海内 苍生 望 霖雨 庙堂 正要 栋梁材
73d181e0-b64c-4aea-8569-4e66e581664c,天边风露楼漫题,卢珏,唐,诗,杂言,十二阑干俯碧溪 凭高一览万山低 晴滩历历轻帆上 烟树重重幽鸟啼 但觉兴随流水远 不知身与白云齐 年来先寄东君信 多种梅花在屋衹要,"7,7,7,7,7,7,7,8",b3b9004716bfa0b4fa800db34e80b279,十二 阑干 俯 碧溪 凭 高 一览 万山 低 晴滩 历历 轻 帆 上 烟树 重重 幽 鸟啼 但 觉兴 随 流水 远 不知 身 与 白云 齐 年 来 先寄 东君 信 多种 梅花 在 屋 衹 要
0e75a538-13a1-4d5e-aa5c-83597623c5f2,慈井,方山京,唐,诗,七言绝句,古井千年尚著名 只缘慈孝不胜情 碧烟自好浓霜白 何必溪流擅独清,"7,7,7,7",b65d68827ce4369ac07206866c3a8087,古井 千年 尚 著名 只 缘 慈孝 不胜 情 碧烟 自好 浓 霜 白 何必 溪流 擅独 清
c505c114-acd8-4b6b-854f-b193748cf372,重游临武秀岩  其一,曾晞颜,唐,诗,杂言,琼楼玉宇落荒村 鸡犬无声到洞门 采凤久藏丹穴羽 青莲倒续华峰根 笑谈疑歪风宫商应 剜刻浑无斧凿痕 莫讶空中能卓立 亭亭一柱拄乾坤,"7,7,7,7,8,7,7,7",b8315b4c65e9ea866aad2cba580e9113,琼楼玉宇 落 荒村 鸡犬 无声 到 洞门 采凤久 藏 丹穴羽 青莲 倒续 华峰根 笑谈 疑 歪风 宫商 应 剜 刻 浑无 斧凿 痕 莫讶 空中 能 卓立 亭亭 一柱 拄 乾坤
d7d61336-badb-4ae4-9ad3-3eb57b2e0cfa,重游临武秀岩  其二,曾晞颜,唐,诗,七言律诗,十番春事付风埃 屐齿参经识苍苔 野鸟避人犹巧语 山花向日尽迟开 奇峰自是平地起 活水不知何处来 天若便教羁馽脱 宁须海上觅蓬莱,"7,7,7,7,7,7,7,7",e27815e8b86744821b863a803ad77d84,十番 春事 付风 埃 屐 齿 参 经识 苍苔 野鸟 避人 犹 巧语 山花 向 日 尽迟 开 奇峰 自 是 平地 起 活水 不知 何处 来 天 若 便 教 羁 馽 脱 宁须 海上 觅 蓬莱
6e31f598-d7f9-4b37-9a02-f30415966b37,四柏亭,孔梦斗,唐,诗,五言古体,道乡采芹暇 手植四株柏 相对有正味 爱此岁寒格 忠言贾奇祸 几削谏臣迹 柏亦助道乡 每号风雨夕 柏死公不死 大名日皦白 后人补种之 存棠思召伯 亭亭俨相持 撑云空百尺 是柏出虽晚 风致犹古昔 我来跂遗芳 清坐假一席 徘徊意难舍 猛把阑干拍 寄语景行人 用意幸勿窄,"5,5,5,5,5,5,5,5,5,5,5,5,5,5,5,5,5,5,5,5,5,5",419bd52063338452cb26a10dc8ecaacb,道 乡 采 芹 暇 手植 四株 柏 相对 有 正味 爱 此 岁寒 格 忠言 贾 奇祸 几 削谏 臣迹 柏亦助 道 乡 每 号 风雨 夕 柏死公 不 死 大名 日 皦 白 后人 补种 之 存棠 思召 伯 亭亭 俨 相持 撑 云 空 百尺 是 柏 出 虽 晚 风致 犹 古昔 我 来 跂 遗 芳 清 坐 假 一席 徘徊 意 难舍 猛 把 阑干 拍 寄语 景 行人 用意 幸勿 窄
f8fdd8c2-e941-4f73-a989-6752f48b5266,神灯,朱天民,唐,诗,五言古体,昔向长老说 北山有神灯 六月神初度 邑人竞高登 夜深无消息 忽其见崚嶒 璀璨作奇葩 点缀横玉绳 渐渐出阴壑 两两度松藤 乍明既倏晦 此没或彼兴 光中若有人 前后相参承 久久乃散去 各自为侪朋 神意会群望 欢尽车方升 我家枕朔冈 梦寐云气腾 日暮启窗户 挥扇却炎蒸 跂于默一祝 祥光来相应 体大赤杲日 中莹融明冰 此乃少为贵 群嘱当未曾,"5,5,5,5,5,5,5,5,5,5,5,5,5,5,5,5,5,5,5,5,5,5,5,5,5,5,5,5",1e8b7cbadf771f9a00a22060e51aae53,昔 向 长老 说 北山 有 神灯 六月 神 初度 邑 人 竞高 登 夜深 无 消息 忽其 见 崚嶒 璀璨 作 奇葩 点缀 横 玉绳 渐渐 出 阴壑 两 两度 松藤 乍明 既 倏 晦 此 没 或 彼兴 光 中 若 有人 前后 相 参承 久久 乃 散去 各自 为侪 朋 神 意会 群望 欢尽 车方 升 我家 枕 朔冈 梦寐 云气 腾 日暮 启 窗户 挥 扇 却 炎 蒸 跂 于 默 一 祝 祥光 来 相应 体大赤杲 日 中莹融 明冰 此 乃 少 为 贵 群嘱 当 未曾
097a3673-7321-49af-9e8d-c18f53e768b7,襄樊失守,彭秋宇,唐,诗,七言律诗,六年援绝困重围 到此无谋更出奇 慷慨如张虽有愧 孤穷似李亦堪悲 列城寒月惊鸿散 夷路西风哨马驰 机速房深谋画处 岂无高着活危棋,"7,7,7,7,7,7,7,7",fd825620ce68bb0a2184b4a5d0525f2e,六年 援绝 困 重围 到 此无谋 更 出奇 慷慨 如 张 虽 有愧 孤 穷 似 李亦堪 悲 列城 寒月 惊鸿 散 夷 路 西风 哨 马 驰 机速房 深谋画 处 岂 无高 着 活 危棋
b34aad14-d88d-4caa-9f65-5d85b8b4e2aa,江上师溃,彭秋宇,唐,诗,杂言,江上西风督戍秋 国人延颈捷随收 中宵弃甲三军溃 往岁藏已经百战休 甚羡虞公前采石 可怜下谓后雷州 诸贤着意筹新局 嫠妇如今正有忧,"7,7,7,8,7,7,7,7",ee4d9fa3afc7898420465f32570dd6bf,江 上 西风 督 戍 秋 国人 延 颈 捷 随 收 中宵 弃甲 三军 溃 往 岁 藏 已经 百战 休 甚 羡 虞 公前 采石 可怜 下谓 后 雷州 诸贤 着意 筹新 局 嫠 妇 如今 正 有 忧
c4ee30f3-f7fa-417d-bdeb-d7d317d0bd2e,南征,彭秋宇,唐,诗,七言律诗,圣皇神武志规恢 南国胡为贡未来 铜柱地荒云隔断 珠崖天圣鴈飞回 秋风曾见秦师出 晓日今闻汉诏哀 中国有人终慕化 且看万象乐春台,"7,7,7,7,7,7,7,7",98262045a4ff214286a5f47f03bbb940,圣 皇 神武 志规 恢 南国 胡为贡 未来 铜柱 地荒 云 隔断 珠崖 天圣 鴈 飞 回 秋风 曾 见 秦师 出 晓 日 今 闻汉诏 哀 中国 有人 终慕化 且 看 万象 乐春台
6b98eb84-2833-42c9-8094-cce6e4db7b36,再平南扰,彭秋宇,唐,诗,七言律诗,乾坤重辟八荒春 何事中间有末臣 南粤一隅先汉地 阳樊数世有周民 山川惯识旌旗影 道路长愁士马尘 闻说讨平归奏凯 剩俘女子载珠珍,"7,7,7,7,7,7,7,7",97c9121daf697c946f4b9a1ccfa6e601,乾坤 重辟 八荒 春 何事 中间 有 末臣 南粤 一隅 先汉 地 阳樊 数世 有 周民 山川 惯识 旌旗 影 道路 长 愁 士马 尘 闻 说 讨平 归 奏凯 剩俘 女子 载珠珍
0c36b1c4-aeb7-4f87-b485-af14c7e144c6,西风,彭秋宇,唐,诗,七言律诗,边笳凄惨动江城 朔鴈南飞几阵横 云气昏昏秋万里 旄头烱烱夜三更 向来海上凫毛出 何日关中马角生 天地无情豪杰尽 西风颠倒若为情,"7,7,7,7,7,7,7,7",294ede2fafb3265a41167758a5dd6a1b,边笳 凄惨 动 江城 朔 鴈 南 飞 几阵 横 云气 昏昏 秋 万里 旄 头 烱 烱 夜 三 更 向来 海上 凫毛出 何日 关中 马角 生 天地 无情 豪杰 尽 西风 颠倒 若为 情
eb38afbb-bb38-4462-917a-a4f435ffc4d1,庚申喜闻,彭秋宇,唐,诗,七言律诗,万方欢喜醉春风 数路飞书奏凯同 天拟诸公扶社稷 人言多难识英雄 周邦虽小名犹正 楚国方强力易穷 从此东南基岱岳 好磨崖石颂成功,"7,7,7,7,7,7,7,7",3ca53364c366994bd2be1336e4089423,万方 欢喜 醉 春风 数路 飞 书 奏凯 同 天拟 诸公 扶 社稷 人 言 多难 识 英雄 周邦 虽 小名 犹正 楚国 方 强力 易 穷 从此 东南 基 岱岳 好 磨 崖石 颂 成功
849f5487-8f03-4a4f-b793-675bdc1f4c60,边事,彭秋宇,唐,诗,七言律诗,边头无日不秋风 荐食无厌更启戎 谁拥貔貅专玉帐 不收鹦鹉着金笼 江曾飞度量丝熟 襄已重围堕甑同 安得扶持今社稷 重来韩岳数英雄,"7,7,7,7,7,7,7,7",909c6bfb4909b9439bb24ce0bf7359c8,边头 无日不 秋风 荐 食 无厌更启戎 谁 拥 貔貅 专玉 帐 不 收 鹦鹉 着 金笼 江曾飞 度量 丝 熟 襄 已 重围 堕 甑 同 安 得 扶持 今 社稷 重来 韩岳 数 英雄
a780d6ad-9ae6-4e20-8a0c-faa1ba648585,乙亥纪闻,彭秋宇,唐,诗,七言律诗,羽书朝暮涨氛埃 天诏勤王起草莱 寒上风高鹰飏去 江头雾暗马飞来 诸贤忠爱谋安出 四将英灵唤不回 漠漠雪天秋万里 飞鸣无数鴈鸿哀,"7,7,7,7,7,7,7,7",1a5699730b81fbd3e44abac1afcf33c9,羽书 朝暮 涨氛 埃 天诏 勤王 起草 莱 寒 上风 高 鹰 飏 去 江头 雾 暗 马 飞来 诸贤忠 爱 谋 安出 四 将 英灵 唤 不 回 漠漠 雪天 秋 万里 飞鸣 无数 鴈 鸿 哀
df747dad-50b9-44a6-96af-0ee64f9cabc4,乙亥冬,彭秋宇,唐,诗,七言律诗,祸乱方来苦不禁 此生谁料有如今 四郊云扰旌旗影 诸阃风寒社稷心 杞国有人忧凛凛 桃源无路入深深 少陵野老怀忠愤 醉里攒眉强自吟,"7,7,7,7,7,7,7,7",1f580047b88d978c2daa3428e6e95021,祸乱 方来苦 不禁 此生 谁料 有 如今 四郊 云扰 旌旗 影 诸 阃 风寒 社稷 心 杞国 有人 忧 凛凛 桃源 无路入 深深 少陵 野老 怀忠 愤 醉里 攒眉 强自吟
274a6d92-b695-4229-85cc-e407f18ba1e4,读吟啸集  其一,彭秋宇,唐,诗,七言律诗,兴废明知数有天 臣心感激义当然 孔明尚欲西都蜀 王蠋宁甘北面燕 凤鹤不灵凄落日 蛟龙已逝冷长川 丈夫一为纲常死 表表人间万古传,"7,7,7,7,7,7,7,7",a2bc96b047b115c39da1e9ab7b73ea70,兴废 明知 数 有 天 臣心 感激 义 当然 孔明尚 欲西 都 蜀 王 蠋 宁 甘 北面 燕 凤鹤 不灵 凄 落日 蛟龙 已逝 冷 长川 丈夫 一 为 纲常 死 表表 人间 万古 传
c22d1be8-d5f9-4361-bed8-bfea331a97a9,读吟啸集  其二,彭秋宇,唐,诗,七言律诗,力支大厦烱孤忠 太息黄旗运不东 天若有情虹贯日 人谁不死气凌空 倍增晁董儒科重 可与夷齐史传同 地位九分人物好 更于何处觅英雄,"7,7,7,7,7,7,7,7",158b947bd2607ef4e06d607a21e7298b,力支 大厦 烱 孤 忠 太息 黄旗 运不东 天 若有情 虹贯 日 人 谁 不 死 气 凌空 倍增 晁 董儒科 重 可 与 夷齐 史传 同 地位 九分 人物 好 更于 何处 觅 英雄
ef0f7e7b-acaa-4b2b-8cd5-35ca362010c6,秋兴  其一,彭秋宇,唐,诗,七言律诗,沙尘破褐客秋风 落落亲朋半老翁 野旷有时闻啸虎 天宽无处寄征鸿 四方玉帛燕山北 万里帆樯海水东 回首可怜歌舞地 芳花石础树阴中,"7,7,7,7,7,7,7,7",b965cc23a62c1059a2708d700736c60c,沙尘 破褐客 秋风 落落 亲朋 半 老翁 野旷 有时 闻 啸虎 天 宽 无处 寄征鸿 四方 玉帛 燕山 北 万里 帆樯 海水 东 回首 可怜 歌舞 地 芳花 石础 树阴 中
496bae57-3935-4fda-b2aa-679b0e15c526,秋兴  其二,彭秋宇,唐,诗,七言律诗,西风卷地送凄凉 目断归帆落日黄 鴈过江天云漠漠 龙游沧海水茫茫 故人入梦三更月 近事惊心两鬓霜 试把浊醪浇磊磈 樽中犹带芷兰香,"7,7,7,7,7,7,7,7",ce1c07cb237add9e1de31c429e7e9c0e,西风 卷 地 送 凄凉 目断归帆 落日 黄 鴈 过 江天 云 漠漠 龙游 沧海 水 茫茫 故人 入梦 三 更 月 近 事 惊心 两 鬓霜 试 把 浊 醪浇磊 磈 樽 中 犹 带 芷兰 香
c7af38d2-0e0f-4819-829e-279d51a805f9,世事,彭秋宇,唐,诗,七言律诗,茫茫世事等浮萍 愁绪方浓醉又醒 日月双飞天不老 干戈百战地常腥 此时弓马多秦戍 何日衣冠见汉庭 宇宙西风愁不尽 谁家门巷草青青,"7,7,7,7,7,7,7,7",6244e1290b2326ee5643005ab26ed72c,茫茫 世事 等 浮萍 愁绪 方浓醉 又 醒 日月 双 飞天 不 老 干戈 百战 地 常腥 此时 弓马多 秦 戍 何日 衣冠 见 汉庭 宇宙 西风 愁 不尽 谁 家门 巷草 青青
5f702289-7e2f-453b-9a5c-577c171f908a,闻鬼,彭秋宇,唐,诗,七言律诗,荒郊白骨卧枯莎 有鬼衔冤苦奈何 半夜数声凄枕席 十年几度惨干戈 英魂无托子孙绝 史笔不知忠义多 欲反髑髅生世乐 近来富贵亦消磨,"7,7,7,7,7,7,7,7",c5c183de69f968d6ce60f09f7c784702,荒郊 白骨 卧 枯 莎 有鬼 衔冤 苦 奈何 半夜 数声 凄 枕席 十年 几度 惨 干戈 英魂 无托 子孙 绝 史笔 不知 忠义 多 欲 反 髑髅 生世乐 近来 富贵 亦 消磨
fbe4e156-6035-4691-a006-d8abb1453ec9,感旧,彭秋宇,唐,诗,七言律诗,五更漏尽醉魂醒 谁富胸中十万兵 如昔襄阳坚砥柱 至今江左屹金城 南来铁马吹唇沸 北去铜人泪眼盈 闻说钱塘风景异 胥涛犹有不平鸣,"7,7,7,7,7,7,7,7",9f1f682f0b6292f4d54fa13a5ad6edb3,五更 漏尽 醉魂醒 谁 富 胸中 十万 兵 如昔 襄阳 坚 砥柱 至今 江左 屹 金城 南 来 铁马 吹唇沸 北去 铜人 泪眼 盈 闻 说 钱塘 风景 异 胥涛 犹 有 不平 鸣
d133461f-e096-4437-8749-3d9e528431c1,罪言,彭秋宇,唐,诗,杂言,四境风寒满目秋 区区嫠妇深忧 岂无豪杰二三策 亦有东南百十州 斫案肯迎新造魏 挥戈曾复旧宗周 仓公一望休惊走 好把囊中暝眩投,"7,6,7,7,7,7,7,7",96c07b1f535e7c44bf0e37867d3892cc,四境 风寒 满目 秋 区区 嫠 妇 深忧 岂 无 豪杰 二三 策 亦 有 东南 百十 州 斫 案 肯迎 新造 魏 挥戈 曾 复旧 宗周 仓 公 一望休 惊走 好 把 囊中 暝 眩 投
1183659e-1e5f-4cd1-acb9-862ad9550a0c,闲愁,彭秋宇,唐,诗,七言律诗,江横天堑涌鲸波 信是闲愁两鬓皤 上界有春娱日月 中原无梦冷山河 扶持宇宙人非少 经济风涛论尽多 昨夜甘泉烽火急 禁中拊髀忆廉颇,"7,7,7,7,7,7,7,7",ea90407cefb4d4b9199aa7b022e2cb9c,江横 天堑 涌 鲸 波 信是 闲愁 两鬓 皤 上界 有春 娱 日月 中原 无梦冷 山河 扶持 宇宙 人 非少 经济 风涛论尽多 昨夜 甘泉 烽火 急 禁 中 拊 髀 忆 廉颇
3538be7a-bd1b-42e6-8580-4226b230f7f3,感旧,彭秋宇,唐,诗,杂言,督府由来十十六秋 几回祈去几回留 人称姬旦三朝辅 谁羡鸱夷一舸游 葛岭春风天地醉 芜湖夜月战事今愁 平生心事青编在 身与皇家共戚休,"8,7,7,7,7,8,7,7",19b940309e0d57850804e7a0f81f1627,督府 由来 十 十六 秋 几回 祈去 几回 留 人称 姬旦 三 朝辅 谁 羡 鸱 夷 一 舸 游 葛岭 春风 天地 醉 芜湖 夜月 战事 今 愁 平生 心事 青编 在 身 与 皇家 共戚 休
b84cf332-7ce3-41b7-97f7-141d32cd7860,感时,林伯元,唐,诗,七言绝句,旧谷新丝价未平 田苗一半属官青 白头老子面如鬼 倚杖开门见彗星,"7,7,7,7",e8c17eef799389e075cb7db75a570e14,旧谷 新丝价 未 平 田苗 一半 属 官 青 白头 老子 面如鬼 倚 杖 开门 见 彗星
1e4d60ae-5027-4639-8396-f9a3e4ecb2a7,题衢州驿舍,衢州士人,唐,诗,七言绝句,午夫荷担在山阿 膏血如何有许多 不若扁舟竟归去 休从清献墓前过,"7,7,7,7",b7426fadf93b2673a10300a7ede36a85,午夫 荷担 在 山阿 膏血 如何 有 许多 不 若 扁舟 竟 归去 休 从 清献 墓 前 过
912cfc51-5824-4dee-88ae-712df51c3b9d,诗三首  其一,严中和,唐,诗,七言绝句,山中道人不裹巾 一片石床生绿鳞 昨夜瓦瓶冰冻破 梅花无水自精神,"7,7,7,7",510ed76281d2716120302da1df3fc55f,山中 道人 不 裹 巾 一片 石床 生绿鳞 昨夜 瓦瓶 冰冻 破 梅花 无水 自 精神
3789a1c6-fb17-4ba1-b47d-8fc12ceac523,诗三首  其二,严中和,唐,诗,七言绝句,梅天雨气入帘栊 衣润频添柏火烘 四月江南无矮树 人家都在绿阴中,"7,7,7,7",d7bbe84bd9984cc185593060f9461f30,梅天雨 气入 帘 栊 衣润频 添柏 火烘 四月 江南 无 矮树 人家 都 在 绿阴 中
7bb9942a-db30-4aaf-a392-1d8b3b7acead,诗三首  其三,严中和,唐,诗,七言绝句,一声杜宇三更后 向晓绿阴连碧苔 却恨楼高春数尺 柳绵飞不上窗来,"7,7,7,7",36a625d9e641c7a591fab85e090d5d2e,一声 杜宇 三 更后 向晓 绿阴 连碧苔 却 恨 楼高春 数尺 柳绵飞 不 上 窗 来
0102a066-3f10-45af-8270-086fc5ec5a51,月夜看桂,严中和,唐,诗,七言绝句,玉杵声中舞素娥 西风叶叶自婆娑 一天清气无人管 惟有山楼树影多,"7,7,7,7",26a4c00e090e1f636c8e9611ef3df303,玉杵声 中 舞 素娥 西风 叶叶 自 婆娑 一天 清气 无人管 惟有 山楼 树影 多
865e0d4e-83b5-4ee1-a312-61afa8106566,句  其一,严中和,唐,诗,五言古体,树影踏不碎 花香嗅却无,"5,5",68e02d30f1a48fe5baf700c8b6f2d586,树影 踏 不碎 花香 嗅 却 无
5eb4d3f5-6d4f-4af0-baeb-0120758f9cd9,句  其二,严中和,唐,诗,五言古体,寺老柳遮塔 雨多春碍船,"5,5",d3e3bdbb8a2b70ba9891dd5ce0545683,寺 老 柳遮塔 雨 多 春碍 船
605316fe-6b1e-4815-b3cc-85db8f8e498d,句  其三,严中和,唐,诗,五言古体,涧水活不冻 山枫老自灵,"5,5",4ffe9034a3e34cddf4527594aa0ef0c5,涧水 活 不 冻 山枫 老自灵
d97da44a-213d-4916-9bf8-192b0dbba06a,句  其四,严中和,唐,诗,七言古体,画扇题诗鸾背湿 铜彝煎脑鸭心香,"7,7",ce5b2a6e4c38ce86ee53b9981485521c,画扇 题诗 鸾 背 湿 铜 彝 煎 脑 鸭 心 香
5fde8586-2ff1-4cc8-bda8-38bab7150dfb,冬日,翁定远,唐,诗,七言绝句,迟明骑马谒朱门 安得梅花入梦魂 惭愧高人眠正熟 一生知不受人恩,"7,7,7,7",f19e96877ed9955d19a3cf00c243105b,迟明 骑马 谒 朱门 安 得 梅花 入梦 魂 惭愧 高 人 眠 正熟 一生 知不受 人 恩
927584f6-59a5-4206-904a-c26d38077587,题廨壁,士人某,唐,诗,七言绝句,霜拂金鞍玉坠腰 邻鸡催唤紫宸朝 争如林下饱清梦 残月半窗松影摇,"7,7,7,7",8d1a8d4810ea42a3cbd0afa6f25a5c31,霜 拂 金鞍玉 坠 腰 邻鸡 催唤 紫宸 朝 争 如林 下 饱 清 梦 残月 半 窗松 影摇
3c56d859-3d6c-46c2-91d0-27ba856d2d0b,于朱宣慰家作画讫作,释子温,唐,诗,五言绝句,昔有朱买臣 今有朱宣慰 两个担柴失 并皆金紫贵,"5,5,5,5",81ac5a26810b0155f71a8cec97df1500,昔 有 朱买臣 今 有 朱 宣慰 两个 担柴 失 并 皆 金紫贵
4b32b6cd-33d5-4c87-82d5-619412352565,题画葡萄,释子温,唐,诗,七言绝句,曾向流沙取梵书 草龙珠帐满征途 轻句短策难将带 记得西风月上初,"7,7,7,7",20b263e5c85ca040b87fc3c7734a42f2,曾 向 流沙 取 梵书 草 龙 珠 帐 满 征途 轻 句 短策 难将 带 记得 西风 月 上初
9daa1b86-f0fe-4845-96fb-695eb73367a6,题葡萄图,释子温,唐,诗,七言绝句,明月清风宗炳社 夕阳秋色庾公楼 修心未到无心地 万种千般逐水流,"7,7,7,7",6f08fd7837c212c244e47e828d041476,明月清风 宗炳 社 夕阳 秋色 庾公楼 修心 未 到 无心 地 万种 千般 逐 水流
8c446bcc-f652-47b8-8025-185ac7e70359,天台陈石居出示乃祖梅隐先生遗稿其序中所载与友人冯使君入蜀之事可伤因赋四十字,吕胜之,唐,诗,五言律诗,临文增太息 复见此人不 义重午金诺 身轻万里游 好诗今寡和 壮志古难酬 一盏梅花露 年年荐陇头,"5,5,5,5,5,5,5,5",6e8125f05045498a928d10cd2e075460,临文 增 太息 复见 此人 不 义重午金诺 身轻 万里 游 好 诗 今 寡 和 壮志 古 难 酬 一盏 梅花 露 年 年 荐 陇 头
d73d488a-87db-4f02-8d89-6b8db657b6ba,题周草窗江村小景扇面,吕胜之,唐,诗,五言绝句,飞鹭落凫渚 山花灿如绣 爱闲人不来 柴门掩春昼,"5,5,5,5",de5fc1f002b7c73d553879365a29198e,飞鹭 落 凫渚 山花 灿 如 绣 爱 闲人 不 来 柴门 掩 春昼
a19bf9a5-a02e-4e6c-9822-77b5237e00e5,晋王大令保母帖,王沂孙,唐,诗,五言古体,脱落黄祊帖 按辞大令书 稍作兰亭面 七美谅非虚 或讶缺勿毁 或疑集悲夫 考真固云癖 订伪亦以愚 第观竁中藏 清玩唯研壶 晋人擅风流 宜与后世殊 所惜尚言数 卜年八百余 贞石久且泐 双松当几枯 片磗曷未化 逮兹厄耕锄 方其内幽镌 要以托荒墟 孰知坐此故 反能误意如 传世岂所幸 况遭孽韩污 辨端更为累 但资文字娱 陶土或若此 何为殉玉鱼,"5,5,5,5,5,5,5,5,5,5,5,5,5,5,5,5,5,5,5,5,5,5,5,5,5,5,5,5",583268af349599ad1741ab66c678b899,脱落 黄 祊 帖 按 辞 大令书 稍作 兰亭 面 七美 谅 非虚 或 讶缺 勿 毁 或 疑集 悲夫 考真 固 云 癖 订伪 亦 以 愚 第 观 竁 中藏 清玩 唯研壶 晋 人 擅 风流 宜 与 后世 殊 所惜 尚言 数 卜 年 八百余 贞石 久 且 泐 双松 当 几 枯 片 磗 曷 未 化 逮 兹厄 耕 锄 方 其内 幽 镌 要以 托 荒墟 孰知 坐 此 故 反能 误意 如 传世 岂 所幸 况 遭 孽 韩 污 辨 端 更为 累 但 资 文字 娱 陶土 或若 此 何为 殉 玉 鱼
c4042dc0-f2d0-4ee7-b330-0aa44769453f,观周曾秋塘图有作,王沂孙,唐,诗,杂言,秋 秋 萧洒 清幽 人静处 水边头 波细纹纹 风色飕飕 鸥鹭情相狎 凫鸳乐自由 疎苇败荷池沼 白苹红蓼汀洲 几竿渔钓去已尽 一段晚云寒不收,"1,1,2,2,3,3,4,4,5,5,6,6,7,7",d5a1de0c8a0b597bf093a5a550dc45d9,秋 秋 萧洒 清幽 人静 处 水边 头 波 细纹 纹 风色 飕飕 鸥 鹭 情相 狎 凫鸳 乐 自由 疎 苇 败 荷 池沼 白苹红 蓼 汀洲 几竿 渔 钓去 已尽 一段 晚 云 寒 不 收
9d53a4da-1567-49d0-a066-dd9ddd78d097,梦中作,陈观国,唐,诗,杂言,水声兮激激 云容兮茸茸 千松拱绿 万荷奏红 爰宅兹岩 以逸放翁 屹万仞与世隔 峻一极而天通 予乃控野鹤 追冥鸿 往来乎蓬莱之宫 披海氛而一笑 以观九州之同,"5,5,4,4,4,4,6,6,5,3,7,6,6",c966a0b0c5212e7f04d46bade83ff8ed,水声 兮 激激 云容兮 茸茸 千松 拱 绿 万 荷 奏 红 爰 宅 兹 岩 以 逸放翁 屹 万仞 与 世隔 峻 一极而天通 予 乃 控 野鹤 追 冥 鸿 往来 乎 蓬莱 之宫 披 海氛 而 一 笑 以 观 九州 之同
07f3054c-5833-42b8-97c7-0e9be9b5eda2,送邓牧心出陶山,陈观国,唐,诗,杂言,青山无送迎 幽人自来去 落叶若相送 卷卷及行屦 簷端有孤云 仍为守其处 落叶惜人不在山 孤云尚期人再还 斯人可期复可惜 我处落叶孤云间,"5,5,5,5,5,5,7,7,7,7",9d02d707549043db54f56617b78260e6,青山 无送 迎 幽 人 自来 去 落叶 若 相送 卷 卷 及 行 屦 簷 端 有 孤云 仍为 守 其处 落叶 惜 人 不 在 山 孤云尚 期 人 再 还 斯人 可期复 可惜 我 处 落叶 孤 云间
29dd1cbc-5cc9-4a44-ade6-3242f522d62f,游九锁山,陈观国,唐,诗,五言古体,名山隔游尘 九锁尘更少 闲云抱苍石 古涧茁灵草 一亭瞰蛟舞 曾此憩坡老 水性自云静 潴泄寄人巧 聊复助奇观 未须纵澜倒 小挹丹泉润 侧步石壁峭 洞深篝火入 志险极幽讨 人间几何年 仙迹棋未了 向夕山月吐 光碎松下道 天空琼馆寒 禽响药如捣,"5,5,5,5,5,5,5,5,5,5,5,5,5,5,5,5,5,5,5,5",66d7932c5dbf30cdc71b5df13dc07163,名山 隔游 尘 九锁尘 更少 闲云 抱 苍石 古涧 茁灵 草 一 亭 瞰 蛟 舞 曾此 憩坡 老 水性 自 云静 潴泄 寄 人巧 聊 复助 奇观 未须 纵澜倒 小 挹 丹泉润 侧步 石壁 峭 洞 深 篝火 入 志险 极 幽讨 人间 几何 年 仙迹 棋 未了 向夕山 月 吐 光碎 松下 道 天空 琼馆 寒 禽响药 如 捣
b4bf4314-7643-4f5e-bd21-f17ed31aceef,送刘蒙川,陈一斋,唐,诗,五言律诗,春草征帆远 春江落日程 瘴乡官是客 儒服老谈兵 海阔龙无影 山空凤不鸣 梅花东阁路 凄断故人情,"5,5,5,5,5,5,5,5",46a99bac280c3f2b4091bdb5b3ed62c4,春草 征帆 远 春江 落 日程 瘴 乡官 是 客 儒 服老 谈兵 海阔龙 无影 山空 凤不鸣 梅花 东阁 路 凄断 故 人情
0f377c8f-dba6-446d-a936-409d5cfbac5d,谿亭次汪桐阳,陈一斋,唐,诗,五言律诗,空亭明远嶂 老树黯余矄 野兴临流坐 秋声入夜闻 渔归孤棹月 鹤睡一松云 记得前溪路 人家两岸分,"5,5,5,5,5,5,5,5",8da697edd667af414fc6aaeac3baf8d2,空亭 明远 嶂 老树 黯余 矄 野兴 临流 坐 秋声 入夜 闻 渔 归 孤 棹 月 鹤 睡 一松 云 记得 前 溪路 人家 两岸 分
eb679a7b-4ee1-4677-9ea4-ab720bb26522,维扬怀项朴庵,陈一斋,唐,诗,七言律诗,长铗悲弹负壮游 京华倦客又扬州 西风昨夜他乡梦 明月故人何处楼 石塔钟残枫叶暝 瓜州棹远荻花秋 幽窗一点寒灯影 徙倚阑干生暮愁,"7,7,7,7,7,7,7,7",bca1364ecdc3b6ecc07e91870abec34e,长 铗 悲弹 负壮游 京华 倦 客 又 扬州 西风 昨夜 他 乡 梦 明月 故人 何处 楼 石塔 钟残 枫叶 暝 瓜州 棹 远 荻 花秋 幽窗 一点 寒 灯影 徙倚 阑干 生暮愁
4ab28c75-ca71-41e5-b9e2-a62e0dbe8702,句,梅州民,唐,诗,七言古体,曾氏井泉千古冽 蒲侯心事一般清,"7,7",e922b91a0ac7572528d982b0ba9af387,曾氏 井泉 千古 冽 蒲侯 心事 一般 清
138878a6-d471-4b3b-9cac-59caed7e85fb,投蒲寿宬  其一,潮州书生,唐,诗,七言绝句,梅花落地点苍苔 天意商量要入梅 蛱蝶不知春去也 双双飞过粉墙来,"7,7,7,7",75910e1872489ed99f175af7a5f4f773,梅花 落地 点 苍苔 天意 商量 要 入梅 蛱蝶 不知 春去 也 双双 飞过 粉墙 来
515723db-b662-4b35-a924-bcdd15cac75f,投蒲寿宬  其二,潮州书生,唐,诗,七言绝句,剑戟纷纷扶主日 山林寂寞闭门时 水声禽语皆时事 莫道山翁总不知,"7,7,7,7",42f82cf5d58482767576d72bfe1beb9e,剑戟 纷纷 扶主 日 山林 寂寞 闭门 时 水声 禽语 皆 时事 莫道 山翁 总 不知
