id,title,author,dynasty,genre,poem_type,sentences_simplified,meter_pattern,hash,words
19a82a28-5247-4fa6-be7e-36c343391aff,南獠纳欵,陈元光,唐,诗,杂言,南薰阜物华 南獠俨庭寔 野味散芳芬 海殽参茂密 胸篆飞瑞烟 𧏖珠媚炎日 掩嫮笼白鹇 盐章闷㶉𫛶 归化服维新 皇朝重玄 质 盾 筮辰贡龙颜 表子躬逢地吉,"5,5,5,5,5,5,5,5,5,4,1,1,5,6",82730c2bf3ea5f941724b5d7f55121da,南薰 阜 物华 南 獠俨 庭 寔 野味 散 芳 芬 海 殽 参 茂密 胸 篆 飞 瑞 烟 𧏖 珠 媚 炎日 掩 嫮 笼 白鹇 盐章 闷 㶉 𫛶 归化 服 维新 皇朝 重 玄 质 盾 筮 辰 贡 龙颜 表子 躬逢 地吉
29993900-8dac-4f8a-8f9b-c8a039ea4355,观雪篇,陈元光,唐,诗,五言古体,不敢希酿泉 忻然覩香雪 圭璧充庭辉 山林变瑶阙 农郊卜岁丰 帅阃和民悦 触簷鸣瑀珩 拂衙凛铁钺 藻台净冰鉴 茶壶团素月 圣恩宏海陬 边臣効芹说,"5,5,5,5,5,5,5,5,5,5,5,5",477604b0b70cc2a9f28467a210ee0155,不敢 希酿 泉 忻然 覩 香雪 圭璧 充庭 辉 山林 变 瑶 阙 农郊 卜岁 丰 帅 阃 和 民悦 触 簷 鸣 瑀 珩 拂衙凛铁 钺 藻台 净 冰鉴 茶壶 团素 月 圣恩 宏海 陬 边臣 効 芹 说
da95fee3-ad04-4d93-8233-23775f3f72bc,平獠宴喜,陈元光,唐,诗,杂言,玉钤森万骑 金鼓肃群雄 扫穴三苗窜 旋车百粤空 风生云无帐 雪压碧油 幢 憧 火烈消穷北 呈祥应岁东 朝端张孝友 炮鳖待元戎,"5,5,5,5,5,4,1,1,5,5,5,5",7737a3ce2bc375d57b02bde406b82101,玉钤森 万 骑 金鼓 肃 群雄 扫穴 三 苗 窜 旋车 百 粤 空 风生云无帐 雪压 碧油 幢 憧 火烈 消穷 北 呈祥 应 岁 东 朝端 张孝友 炮 鳖 待 元戎
3dbb8599-e210-450d-8421-8bc7e8a206f6,山游怀古,陈元光,唐,诗,五言古体,迅烈驱黎瘴 委蛇陡翠微 汉宫尘漠漠 随社黍离离 圣远津稀问 蟾升树亦辉 晨昏童冠浴 夜静士民嬉 边檄兴师旅 秋深近阻饥 仲由刚协力 曾点志同时 倚曲酬歌去 宣尼正哂而,"5,5,5,5,5,5,5,5,5,5,5,5,5,5",16f5d2d67ea5416ebbc12373e3c267d9,迅烈 驱 黎 瘴 委蛇 陡 翠微 汉宫 尘 漠漠 随 社黍 离离 圣远津 稀 问 蟾升树 亦 辉 晨昏 童冠浴 夜静 士民 嬉 边 檄 兴师 旅 秋 深 近 阻饥 仲由刚 协力 曾点志 同时 倚 曲酬 歌去 宣尼正 哂 而
e1f76fee-0484-467a-a8e0-f2bae00973a4,旋师之什,陈元光,唐,诗,杂言,雪尽青山昏 师旋赤眉至 皇天监有光 边帅却非义 六月张貔貅 万弓发羊豕 海岳皆效灵 苗民悉循纪 卷舒如祥云 进止若时雨 薄暮天为阴 衔枚肃我旅 一火空巢窝 群凶相籍死 采芑 歌言旋 记此非黩武,"5,5,5,5,5,5,5,5,5,5,5,5,5,5,2,3,5",f45bd47bf0faa85e8d1e69e3e5ee672c,雪 尽 青山 昏 师旋 赤眉 至 皇 天监 有 光 边帅 却 非义 六月 张 貔貅 万 弓发羊 豕 海岳皆 效灵 苗民 悉 循 纪 卷舒 如 祥云 进止 若 时雨 薄暮 天 为 阴 衔枚 肃 我 旅 一 火 空巢 窝 群 凶相 籍 死 采 芑 歌言 旋 记 此 非 黩武
59c06748-75e6-439e-8442-2b48d77bd8b5,喜雨次曹泉州,陈元光,唐,诗,五言古体,上帝将垂谴 边臣惊不宁 徬徨劳野马 干曝俯龙亭 精意馨穹昊 阳和正郁蒸 𬘡缊云作瑞 黮𪒘雨成声 原湿枯随发 生灵死复苏 刑牲崇礼报 作颂庆升平,"5,5,5,5,5,5,5,5,5,5,5,5",b8f045b0d341a5356f83e079127fffba,上帝 将 垂 谴 边臣 惊不宁 徬徨 劳 野马 干 曝 俯 龙亭 精意 馨穹 昊 阳 和 正郁 蒸 𬘡 缊 云 作 瑞 黮 𪒘 雨成声 原湿 枯随 发 生灵 死 复苏 刑牲 崇礼 报 作颂 庆 升平
fde9ceda-c0e7-4da0-aa8a-603a36426917,其二,陈元光,唐,诗,五言古体,羲和停火轮 霡霂深民福 年康收篚文 庭寔陈秋获 土产若未腴 勤绥功则博 九五垂衣裳 千万监忠朴 铜虎谨深悬 木铎今始作 诰勅常佩吟 酒色难湎惑 愿皇钦福多 锡民无灾瘼 载答圣皇恩 转轮赴河洛,"5,5,5,5,5,5,5,5,5,5,5,5,5,5,5,5",dd8f41d42b1fd30014b49b6f0c1fc798,羲 和 停火 轮 霡 霂 深 民 福 年 康 收 篚 文 庭 寔 陈 秋 获 土产 若 未 腴 勤绥 功则 博 九五 垂 衣裳 千万 监 忠 朴 铜 虎 谨 深 悬 木铎 今 始 作 诰勅 常 佩 吟 酒色 难湎惑 愿 皇钦福 多 锡民 无灾 瘼 载答 圣 皇恩 转轮 赴 河洛
6bb93adb-c980-48b3-8abf-c9c81e0afa44,望阙谢恩,陈元光,唐,诗,五言古体,御扆褒忠勇 官符再佩箴 遐陬蒙一体 服马赫遥临 海岭知天瑞 懽忻荷圣心 排衙香御胸 应郭撒妖祲 讲武勤西狩 呼嵩拜北钦 天颜严咫尺 夙夜敢荒淫,"5,5,5,5,5,5,5,5,5,5,5,5",77d44c4d77bb31d7a3d421601f1063e0,御 扆 褒 忠勇 官符 再 佩 箴 遐 陬 蒙 一体 服 马赫 遥临 海岭 知天 瑞 懽 忻 荷 圣心 排衙 香 御 胸 应 郭 撒妖 祲 讲武 勤西 狩 呼嵩拜 北钦 天颜严 咫尺 夙夜 敢 荒淫
7345602b-4dfc-48df-9dd1-03efa6f59a4b,教民祭蜡,陈元光,唐,诗,五言古体,玉垒陈酽酪 金盌荐芳饎 父老吹龙笛 官僚仗虎墀 山川出云雨 神祇回耀辉 舞蹈幽明洽 趋跄礼度微 祈禳称世世 民社两无违,"5,5,5,5,5,5,5,5,5,5",2f1b6c48df600ba021996ce937c54606,玉垒 陈 酽 酪 金 盌 荐 芳 饎 父老 吹 龙 笛 官僚 仗 虎 墀 山川 出 云雨 神祇 回耀 辉 舞蹈 幽明 洽 趋跄 礼度 微 祈 禳 称 世世 民社 两 无 违
a043d398-4fc5-4ef9-96cb-69a5f7b3cb29,祀后土,陈元光,唐,诗,五言古体,天启鉴湖清 灵源浸天碧 不为潜龙盘 上翊飞龙续 花气喷龙香 河光溥龙德 福以龙德钟 寿以龙仁益 百礼祀龙神 九歌感龙格 龙湖配天长 万叶复千亿,"5,5,5,5,5,5,5,5,5,5,5,5",7f63427b5a8efe4050939f7c3285c6fc,天启 鉴湖 清 灵源 浸 天 碧 不 为 潜龙 盘 上翊 飞龙 续 花气 喷 龙香 河光溥 龙德 福以龙 德 钟 寿 以 龙仁益 百 礼 祀 龙神 九歌 感龙格 龙湖 配 天长 万叶 复 千亿
ca282c71-ed6c-4cde-a5ae-8b76328de253,修文语土民,陈元光,唐,诗,五言古体,庙算符天象 干旄格有苗 三军歌按堵 万骑弛鸣镖 虔岭顽民远 朝阳寇逆招 偃文休众士 锡命自皇朝 莫篆天然石 惟吹洛下箫 声闻神起舞 气感海无妖 方叔猷元壮 相如赋未饶 成周放牛马 林野任逍遥,"5,5,5,5,5,5,5,5,5,5,5,5,5,5,5,5",e5fab5ceb7a7988532e5e7f7eb887be5,庙 算符 天象 干 旄 格 有 苗 三军 歌 按 堵 万 骑 弛鸣镖 虔岭 顽民 远 朝阳 寇 逆 招 偃文休 众士 锡命 自 皇朝 莫 篆 天然 石 惟 吹 洛 下 箫 声闻 神 起舞 气感 海 无 妖 方叔猷 元壮 相如赋 未 饶 成周 放 牛马 林野 任 逍遥
7b766c6c-0358-4d51-8739-899205485b5d,半径庐居语父老,陈元光,唐,诗,五言古体,寒猿号岭表 添我哭声哀 万浦驱潮至 愁连拨不开 二州诸父老 百里载牲来 窍竁成堆玉 坊戎未砌阶 菜芜间半径 金石耀双台 感怆千秋恨 期消四境埃 阴扶祈大母 显相赖殊才 兽舞梁山下 龙眠潮海涯 三杯酬地杰 一杖陟山回 环拜诸公罢 拈香奠晚罍,"5,5,5,5,5,5,5,5,5,5,5,5,5,5,5,5,5,5,5,5",5d287e4ddb30b66edd02c1992e1d5b06,寒 猿 号 岭 表 添 我 哭声 哀 万浦 驱潮 至 愁 连拨 不 开 二州 诸 父老 百里 载牲 来 窍 竁 成堆 玉 坊 戎 未 砌 阶 菜芜 间 半径 金石 耀 双台 感 怆 千秋 恨 期 消 四境 埃 阴扶祈 大母 显 相赖 殊 才 兽舞 梁山 下 龙眠潮 海涯 三杯 酬 地杰 一 杖 陟 山 回 环拜 诸公 罢 拈香 奠 晚 罍
00ac0e48-fa98-474c-ad99-0dd02edd6227,其二,陈元光,唐,诗,杂言,丹心忠老母 白首媚萱堂 万里提兵路 三苗葬子方 桑田多变海 萱草独凌霜 华洁凝秋色 葳蕤灿晚芳 山灵驱毒蛀 神女靓明粧 剥落千花后 舒迟百岁康 如何龄九五 霞佩陟云房 语罢成追暮 群然泪雨茫 原按 志铭 总章己巳 闽广之交 獠蛮啸聚 高宗命陈政公出抚之 至界 以兵少请援 朝命二兄敏 敷领兵南下 太母魏氏见三子之闽 乃与俱往 至浙之江山县 敏 敷病疽 至浦城 孙子亦疽 魏母提兵至镇 政得进屯云霄营 政卒 孙元光将军 代领其众 奉建州治 垂拱四年 魏氏卒 将军以支孙承重 付州事于许天正 葬祖母于半径山 结庐守制 漳人称半径将军 故有 庐居语父老 之作,"5,5,5,5,5,5,5,5,5,5,5,5,5,5,5,5,2,2,4,4,4,9,2,5,5,5,9,4,6,1,3,3,4,6,7,2,5,4,4,4,3,7,7,7,4,7,2,5,2",685e0f6d71d71ad670d0e069e9d91caf,丹心 忠 老母 白首 媚 萱堂 万里 提兵 路 三 苗 葬 子方 桑田 多变 海 萱草 独凌霜 华洁 凝 秋色 葳蕤 灿 晚 芳 山灵 驱毒 蛀 神女 靓 明 粧 剥落 千花 后 舒迟 百岁 康 如何 龄 九五 霞佩陟云 房 语罢成追暮 群然 泪雨 茫 原 按 志铭 总章 己巳 闽广 之 交 獠蛮 啸聚 高宗 命 陈政公 出抚 之 至界 以 兵 少 请援 朝命 二 兄 敏 敷 领兵 南下 太母 魏氏 见 三子 之 闽 乃 与 俱往 至 浙 之 江山县 敏 敷 病疽 至 浦城 孙子 亦 疽 魏母 提兵 至 镇 政得 进屯 云霄 营 政卒 孙元光 将军 代领 其 众 奉建 州治 垂拱 四年 魏氏 卒 将军 以 支孙 承重 付州 事 于 许天 正 葬 祖母 于 半径 山 结庐 守制 漳 人称 半径 将军 故 有 庐居语 父老 之 作
07fee188-929e-416c-9d84-4344f992cb74,语州县诸公敏续,陈元光,唐,诗,五言古体,总角趋朝对 雄飞出禁城 人才当翊国 世赏可辞荣 怜厥神童子 寻为壮友生 南方承父镇 北阙列儒名 移孝为忠吉 由奢入俭宁 长安瞻日月 岭海肃风霆 败事诚因酒 增高必自陵 尊老须养老 使士要推诚 寅协无他式 清勤慎不矜,"5,5,5,5,5,5,5,5,5,5,5,5,5,5,5,5,5,5",b06e3b324ce123947852b7abc1f19f43,总角 趋朝 对 雄飞 出 禁城 人才 当 翊 国 世赏可辞荣 怜厥 神 童子 寻为 壮 友生 南方 承 父镇 北阙 列儒 名 移孝为忠 吉 由奢入俭 宁 长安 瞻 日月 岭海肃 风霆 败事 诚 因酒 增高 必自 陵 尊老 须 养老 使士 要 推诚 寅 协 无 他 式 清 勤慎 不矜
fd0f9e48-5d13-4189-a81b-f78b0bc2f016,其二,陈元光,唐,诗,五言古体,敦伦开野叟 勤学劝生儒 刊爵虽殊分 同仁本一途 云泥如有隔 水火岂相资 饮露知蝉洁 观颜觉鉴虚 潜光同隐豹 出宰必悬鱼 适国无先后 梯云有卷舒 天文回北极 水势赴东都 定策参耆宿 轮忠奉简书 弥重勋业懋 开国负称孤,"5,5,5,5,5,5,5,5,5,5,5,5,5,5,5,5,5,5",b86000d57b4b92bad038280735279515,敦伦 开 野叟 勤学 劝生 儒 刊爵 虽 殊 分 同仁 本 一途 云泥 如有 隔 水火 岂 相资 饮露知蝉洁 观颜 觉鉴 虚 潜光 同 隐豹 出宰 必 悬 鱼 适国无 先后 梯云 有 卷舒 天文 回 北极 水势 赴 东 都 定策 参 耆宿 轮 忠 奉 简书 弥重 勋业 懋 开国 负称 孤
43ac31d7-9fd7-485c-b234-4dd4bb2f8f95,和王采访重九见访,陈元光,唐,诗,杂言,河北推儒雅 嵩高降岳神 明径通桂掖 飞幰渡荆津 明快宜朝美 疏通亦我怜 怒同雷电厉 喜沛雨霖恩 乔木家声旧 严轺帝命新 心交今管 鲍 饱 筹运访张陈 是日登高节 伊谁送酒频 江州华胄使 携榼再慇懃,"5,5,5,5,5,5,5,5,5,5,4,1,1,5,5,5,5,5",9c9efc5fbd80190f77eafad2d8e223ec,河北 推 儒雅 嵩 高 降 岳神 明径通 桂掖 飞 幰 渡 荆 津 明快 宜 朝 美 疏通 亦 我 怜 怒 同 雷电 厉 喜 沛雨霖 恩 乔木 家声 旧 严 轺 帝命 新 心交今 管 鲍 饱 筹运 访张 陈 是 日 登高 节 伊 谁 送酒 频 江州 华胄 使 携 榼 再 慇 懃
0529a02c-1329-4ad2-8c01-861648901498,公庭春宴,陈元光,唐,诗,杂言,东风驱冻去 万品破阳辉 红紫粧春媚 罍樽试酒奇 公庭开月榭 农榼荐时牺 兴逐芳芬发 杯同蜂蝶飞 谁云佳节会 独与赏心违 信手撚红 瓣 辨 粘衣尽紫蕤 阴移来日者 各赠满须归,"5,5,5,5,5,5,5,5,5,5,4,1,1,5,5,5",11cddd20fcb31deb4890db2b222eb980,东风 驱冻 去 万品 破 阳辉 红 紫 粧 春 媚 罍 樽 试 酒 奇 公庭 开 月 榭 农 榼 荐 时牺 兴逐 芳 芬 发 杯 同 蜂蝶 飞 谁 云 佳节 会 独与 赏心 违 信手 撚 红 瓣 辨 粘衣 尽 紫 蕤 阴 移来 日者 各 赠 满须 归
ea760c98-3002-44b8-8f6d-ada7f0dacd89,酬裴使君王探公,陈元光,唐,诗,五言古体,百粤临南海 儒冠任使轺 馈我兼金佩 和之美玉箫 清风生四座 丽日正良霄 意气宜令契 公忠岂古饶 简书频诵读 玉烛要均调 冰鉴秋霄察 君门万里遥 骊𬴂歌四牡 谔谔答清朝,"5,5,5,5,5,5,5,5,5,5,5,5,5,5",ec727dacb8e1a907a28ccdbb1a4c8d85,百粤临 南海 儒冠 任 使 轺 馈我 兼 金佩 和 之 美玉 箫 清风 生 四座 丽日 正良霄 意气 宜 令契 公忠 岂 古饶 简书 频 诵读 玉烛 要 均 调 冰鉴 秋霄察 君门 万里 遥 骊 𬴂 歌 四 牡 谔 谔 答 清朝
4be44055-3322-451c-839f-d7f57d478499,晚春旋漳会酌,陈元光,唐,诗,五言古体,帝德符三极 皇风振四夷 将轺春暮饮 士卒岭南驰 马啸腥风远 兵歌暖日怡 妖云驱屏迹 芳卉媚迎诗 拍掌横弓槊 徘徊索酒巵 阴处窜蛇豕 暗笑使君迷,"5,5,5,5,5,5,5,5,5,5,5,5",06cca5d8df1852fac7f22edc7b152945,帝德符 三极 皇风 振 四夷 将 轺 春 暮 饮 士卒 岭南 驰 马啸 腥 风 远 兵歌 暖 日 怡 妖云 驱 屏迹 芳卉 媚 迎 诗 拍掌 横弓 槊 徘徊 索 酒 巵 阴处 窜 蛇 豕 暗笑 使君 迷
eab3c5b4-60fa-421d-8125-803cdfd47d19,故国山川写景,陈元光,唐,诗,五言古体,浮光昂岳望 固始秀民乡 第宅参文武 姻㜕半帝王 珠楼帘结绮 花苑水流香 礼节传家范 簪缨奕世芳 飞鞭驰道坦 聚盖艳阳光 箫鼓迎懽会 桐麻遣唁丧 勋臣扶景运 风树配天长,"5,5,5,5,5,5,5,5,5,5,5,5,5,5",58d9525fb361a61a5b3919a7ac084cb1,浮光 昂岳望 固始 秀民乡 第宅 参 文武 姻 㜕 半 帝王 珠楼 帘结 绮 花苑 水流 香 礼节 传家 范 簪缨 奕 世 芳 飞鞭 驰道 坦 聚盖 艳 阳光 箫 鼓 迎 懽 会 桐麻 遣唁 丧 勋臣 扶景 运 风树 配 天长
358aa3dd-e1fc-4e88-9d1c-5a015b47ff64,神湖州三山神题壁,陈元光,唐,诗,五言古体,孤随不尊士 幽谷多豪杰 三山亦隐者 韬晦忘其名 胜迹美山水 妙思神甲兵 精诚谅斯在 对越俨如生 木石森驺伏 云烟拂旆旌 雨旸祈响应 龙凤勅碑铭 清泚符神洁 香芹契德馨 三山耀神德 万岁翊唐灵,"5,5,5,5,5,5,5,5,5,5,5,5,5,5,5,5",df3a5ae352da0f90d1b7f3c22e6e42bb,孤随不尊士 幽谷 多 豪杰 三山 亦 隐者 韬晦 忘 其 名 胜迹 美 山水 妙思 神 甲兵 精诚 谅斯 在 对 越 俨如 生 木石 森 驺 伏 云烟 拂 旆 旌 雨 旸 祈 响应 龙凤 勅 碑铭 清 泚 符 神 洁 香芹 契德馨 三山 耀神德 万岁 翊 唐灵
32dfe0b6-c0ae-423d-afaa-371504961f9a,其二,陈元光,唐,诗,五言古体,孤云悦我心 一点通神意 流泉濯巨灵 深谷豁神智 魈魅神之兵 黎庶神所庇 精气烛彼天 名山妥灵地 岭表开崇祠 辽东建神帜 六字动天威 九重颁岁祭 相期翊国忠 我舆三神契,"5,5,5,5,5,5,5,5,5,5,5,5,5,5",0acf5517081bf0cca58e0363a92a1cff,孤云悦 我心 一点 通神 意 流泉 濯 巨灵 深谷 豁 神智 魈 魅神 之 兵 黎庶 神 所 庇 精气 烛 彼天 名山 妥灵 地 岭 表开 崇祠 辽东 建神帜 六 字动 天威 九重 颁 岁 祭 相期 翊 国 忠 我 舆三神 契
de6c7f41-e9e1-46cf-89ab-21f463991a8d,其三,陈元光,唐,诗,杂言,孤征东岭表 冒 胃 雨一登临 再拜烟雾霁 群峰奎璧森 独山峰耸阁 中谷水鸣琴 明山卉木翳 遥林云雾深 瞻庙开明贶 平辽断秽祲 神颫号万籁 列宿献千禽 树尾扬旌帛 山头旋革金 葵阳烘固介 华露润华簪 鼎立峥嵘势 钟闻杳霭阴 绾荷据口勾 掬水洗怀襟 瀑石流觞咏 丰碑驻马吟 三山香火地 万古帝王钦,"5,1,1,4,5,5,5,5,5,5,5,5,5,5,5,5,5,5,5,5,5,5,5,5,5,5",1dd1e87385d79892d7e0445f1b61a807,孤征 东岭 表 冒 胃 雨 一 登临 再拜 烟雾 霁 群峰 奎璧 森 独 山峰 耸 阁 中谷 水 鸣琴 明山卉 木翳 遥林 云雾 深 瞻 庙 开明 贶 平辽 断秽 祲 神 颫 号 万籁 列宿献 千禽 树 尾 扬 旌帛 山头 旋革金 葵阳 烘固 介 华露 润华 簪 鼎立 峥嵘 势 钟闻 杳 霭 阴 绾 荷据口 勾 掬水 洗怀襟 瀑石 流觞 咏 丰碑 驻 马吟 三山 香火 地 万古 帝王 钦
24ba9f62-8588-4509-8ff3-dae05f9b7ba7,至人行,陈元光,唐,诗,杂言,至人平念虑 好恶归其衷 试剑三苗罪 同车盖世雄 断蛟驱猛虎 附凤翊飞龙 际会风云上 清平岭海中 穷民加保惠 勋士禄功庸 姝子干旌纰 妖淫桎 梏 桔 凶 热筹消 氵灾 气 精盖启宸聪 卓尔三才立 岿哉一道同,"5,5,5,5,5,5,5,5,5,5,5,3,1,1,1,3,2,1,5,5,5",5bf280b5a76722c4ee1dcd7de6b62e38,至 人平 念虑 好恶 归其衷 试剑 三 苗 罪 同 车 盖世 雄 断 蛟 驱 猛虎 附 凤翊 飞龙 际会风云 上 清平 岭海 中 穷民 加保惠 勋士 禄 功庸 姝 子 干旌 纰 妖淫 桎 梏 桔 凶 热 筹消 氵 灾 气 精 盖启宸 聪 卓尔 三才 立 岿哉 一道 同
9fb6f4a0-a546-4318-b9a4-b3f3ac16228c,云龙,陈元光,唐,诗,杂言,乾坤成列神流通 纯阳附阴生神龙 伸屈妙运参帝功 一鼓𬘡缊油云从 飞翔四海雨域 中 十 万汇焦枯仰化融 苦时潜德来奋踪 群生渴想心忡忡 雷鸣云起德斯普 变化循环自今古,"7,7,7,7,6,1,1,7,7,7,7,7",0f760632afa986e87b62696fde8e9e06,乾坤 成列 神 流通 纯阳 附 阴生 神龙 伸屈 妙运 参帝 功 一 鼓 𬘡 缊 油 云 从 飞翔 四海 雨域 中 十 万 汇 焦枯 仰化 融 苦 时 潜德 来 奋踪 群生 渴想 心 忡忡 雷鸣 云 起 德斯 普 变化 循环 自 今古
88a5d97d-263f-4eb6-b4c8-879fca9c7ec7,风虎,陈元光,唐,诗,七言古体,乾坤义气为虎神 咆哮尚阚谁相亲 浮云满谷随相震 啸地生风鼓气新 日入山林膳百兽 时清效数宗麒麟 忍饥渡河知仁人 威彰挥爪雄武臣 戴王秉义无忘噬 作政行苛何诛夷,"7,7,7,7,7,7,7,7,7,7",9514c14e9379fb4ad57e1d0e2839ae8a,乾坤 义气 为 虎 神 咆哮 尚 阚 谁 相亲 浮云 满谷 随相 震 啸 地生 风 鼓气 新 日 入 山林 膳 百兽 时 清效 数宗 麒麟 忍饥 渡河 知 仁人 威 彰 挥 爪 雄武 臣 戴 王秉义 无 忘噬 作政行 苛何诛夷
96280614-a33c-424a-9fb5-cb239188867c,圣作物覩,陈元光,唐,诗,杂言,乾坤正气钟圣物 聪明天纵临生民 四灵百端皆符身 九夷八蛮咸来宾 制作百为开彝伦 明禋千载秋又春 物覩之圣为何人 羲 义 农尧舜禹汤文 万古帝王咸准则 祗令万物覩者德,"7,7,7,7,7,7,7,1,1,6,7,7",d8dbe45085bc7e42add419a9099462ae,乾坤 正气 钟 圣物 聪明 天纵 临 生民 四灵 百端 皆 符身 九夷 八 蛮 咸 来宾 制作 百 为 开彝伦 明 禋 千载 秋又春 物 覩 之 圣 为何 人 羲 义 农 尧舜禹汤 文 万古 帝王 咸 准则 祗 令 万物 覩 者 德
9b78f631-394f-475c-833f-63412c81caa8,真人操,陈元光,唐,诗,七言古体,阴阳妙教生真人 名山胜地隐其身 吹嘘濑气完元神 升降雪外离烟尘 轩辕乘龙万岁春 穆观王母存昆仑 青牛出关避世纷 招呼鸾鹤引霞樽 秦王汉武心尘土 欲求真仙恶得覩,"7,7,7,7,7,7,7,7,7,7",2d920ae67b909a4f882a1b33242e1d76,阴阳 妙 教生 真人 名山 胜地 隐 其身 吹嘘 濑气 完 元 神 升降 雪 外 离 烟尘 轩辕 乘龙 万岁 春 穆观 王母 存 昆仑 青牛 出关 避世 纷 招呼 鸾 鹤 引 霞 樽 秦王 汉武心 尘土 欲求 真仙恶得 覩
2dadcaf5-be61-48d2-af02-a9e9d701d9e8,恩义操,陈元光,唐,诗,七言古体,天尊地卑分君臣 干男坤女生男孙 怀恩抱义成人伦 入有双亲出有君 行义显亲亲以尊 隆恩敦君君以仁 君仁亲尊恩义纯 双全忠孝参乾坤 春秋乱贼纷然起 仲尼一笔扶人纪,"7,7,7,7,7,7,7,7,7,7",c779e0bc625e48acf2326923188e5413,天尊 地卑 分 君臣 干 男坤 女生 男孙 怀恩 抱义 成 人伦 入有 双亲 出有 君 行义 显 亲亲 以 尊 隆恩 敦君 君 以 仁 君仁 亲尊 恩义 纯 双全 忠孝 参 乾坤 春秋 乱贼 纷然 起 仲尼 一笔 扶 人纪
4bd93765-59eb-4e94-8dae-05ca2dd9685e,其二,陈元光,唐,诗,杂言,岭海物产知君臣 黑鲤朝北葵向曛 岭海物产知慈仁 寒獭祭鱼乌哺亲 吴起学曾斯学 荀 笋 欺君害民丧不奔 禄养生成忘义恩 不如鸡犬司门晨,"7,7,7,7,6,1,1,7,7,7",d1b6ac5e7447bcfe191174ae1f4d0470,岭海 物产 知 君臣 黑 鲤 朝 北葵 向 曛 岭海 物产 知 慈仁 寒 獭祭 鱼 乌 哺亲 吴起 学 曾斯学 荀 笋 欺君 害民 丧不奔 禄 养生 成忘义 恩 不如 鸡犬司 门 晨
fc003798-c335-4aee-b9a9-08b4bd619321,忠烈操,陈元光,唐,诗,杂言,干生男子坤生姝 国有君王家有夫 委 质 盾 结褵托其躯 三纲五常与命俱 一朝凶变违常途 匡扶弗得将何如 英英烈烈 他 地 虑无 舍生取义终不 渝 瑜 柏舟 之诗王蠋语 千古芳名耀青史,"7,7,1,1,1,5,7,7,7,4,1,1,2,6,1,1,2,5,7",d6b8a9ebac3b15f217a5b9155017f7d8,干生 男子 坤生 姝 国有 君王 家 有 夫 委 质 盾 结 褵 托 其 躯 三纲五常 与 命 俱 一朝 凶 变违 常途 匡扶 弗 得 将 何如 英 英烈 烈 他 地 虑 无 舍生取义 终不 渝 瑜 柏舟 之 诗 王 蠋 语 千古 芳名 耀 青史
cae12ed3-a69b-46ad-b498-4e7dbb6ae738,候夜行师七唱,陈元光,唐,诗,七言古体,一从长发离京城 侍父寒暄经万程 上吁玄天低吁地 朝瞻红日夜瞻星 诸君喜抵王师所 四顾伤为荆莽坰 群落妻拏凄泣声 俄然戎丑万交横 司空淑人频劝谕 英雄死义无求生 马皮远裹伏波骨 铜柱高标交趾惊 振旅龙江修战具 移文凤阙请增兵,"7,7,7,7,7,7,7,7,7,7,7,7,7,7",a089494f6d069878bb7bf37dcdb99ac2,一 从 长发 离 京城 侍父 寒暄 经 万程 上吁 玄天 低吁 地 朝瞻 红 日夜 瞻 星 诸君 喜抵 王师 所 四顾 伤为 荆 莽 坰 群落 妻 拏 凄 泣 声 俄然 戎丑万交横 司空 淑人 频 劝谕 英雄 死义 无 求生 马皮 远 裹 伏波骨 铜柱 高标 交趾 惊 振旅 龙江 修 战具 移 文凤阙 请 增兵
de2b9bcc-d661-4ecb-b3b2-9dbd7f05e64b,其二,陈元光,唐,诗,杂言,魏母咸亨奉勅文 府兵云众成营屯 屹然一镇云霄末 渐尔群言花柳春 男生女长通蕃息 五十八氏交为婚 火田黄稻俱甘旨 纲水金鱼洽醉 寇戎不测纷如雪 甲胄何时不出门 夜祀天皇弘德泽 日将山獠化缟民 一声谯鼓月初出 戍楼西北望皇阍,"7,7,7,7,7,7,7,6,7,7,7,7,7,7",9d4c6372d32f0aa61e131e51d12e0fb1,魏母 咸亨 奉 勅 文 府 兵 云 众 成营 屯 屹然 一 镇 云霄 末 渐尔 群言 花柳 春 男生 女长 通 蕃息 五十八 氏 交为 婚 火田 黄稻 俱 甘 旨 纲水 金鱼 洽醉 寇戎 不测 纷如雪 甲胄 何时 不 出门 夜 祀 天皇 弘德泽 日 将山 獠化 缟民 一声 谯 鼓 月初 出 戍 楼 西北 望皇 阍
f3037e51-1d32-49b0-b8ef-eb47756beb59,其三,陈元光,唐,诗,杂言,戍楼西北望皇阍 日暖桃绯京国春 公子踏青陪御辇 官民结彩庆姻门 上林花木胭脂媚 边境桑蔴戟剑屯 乳燕东风相对语 老亲上冢孰温存 采茶喜钻新榆火 修 禊 楔 争驱旧虏氛 尽醉韶华三月暮 谁闻更鼓二更巡,"7,7,7,7,7,7,7,7,7,1,1,1,5,7,7",edf9b6e09bb96b63323046c2429554a1,戍 楼 西北 望皇 阍 日暖 桃 绯京国 春 公子 踏青 陪 御 辇 官民 结彩 庆姻 门 上 林 花木 胭脂 媚 边境 桑 蔴 戟 剑 屯 乳燕 东风 相对 语 老亲 上 冢 孰 温存 采茶 喜 钻 新 榆 火 修 禊 楔 争驱 旧虏 氛 尽 醉 韶华 三月 暮 谁 闻 更鼓 二 更 巡
5fcbd670-473d-4c72-8b8a-3f686d99a04e,其四,陈元光,唐,诗,杂言,戍楼西北望皇家 夏永南征岭海赊 殿阁凉生梅浦雨 葵柳红映锦江霞 侮凌烽火心如水 变幻风云眼未花 犀照湖花消魍 鬼象 龙呈剑气射虚邪 赤鸟黑马流红汗 绿柳金莺冒翠华 淬砺戈矛寻石上 沉浮瓜李戏江涯 蕙兰纫佩生香满 荷芰缝衫御暑嘉 较斧开林驱虎豹 施罟截港捕鱼虾 火田畬种无耕犊 阴隙戎潜起宿鸦 夜析重门防暴客 三更三点尚排衙,"7,7,7,7,7,7,6,2,7,7,7,7,7,7,7,7,7,7,7,7,7",cc8b25f02b73eb70fead177214e85ecc,戍 楼 西北 望 皇家 夏永 南征 岭海 赊 殿阁 凉生 梅浦雨 葵柳 红映 锦江 霞 侮凌 烽火 心如水 变幻 风云 眼 未 花 犀照 湖 花消 魍 鬼象 龙呈 剑气 射 虚 邪 赤鸟 黑马 流红汗 绿柳 金莺 冒 翠华 淬砺 戈矛 寻石 上 沉浮 瓜 李 戏 江涯 蕙兰 纫 佩 生香 满 荷 芰 缝 衫 御 暑 嘉 较 斧 开林 驱 虎豹 施 罟 截 港 捕鱼 虾 火田 畬 种 无耕犊 阴隙 戎 潜起 宿鸦 夜析重门 防暴 客 三 更 三点 尚排 衙
f6f1bc7c-f73f-44be-b695-dffc7fd3e73e,其五,陈元光,唐,诗,杂言,戍楼西北望皇州 宿衙曾随上苑游 明月芦花迷曲岸 西风梧叶报清秋 凤凰台上几声笛 鹦鹉洲边一苇舟 对菊渊明怀刺史 抛梭织女弄牵牛 娟娟万里江河烂 耽耽孤星大火流 白雁远传苏武札 银鲈细切 季 李 鹰 羞 差 露凄霜肃吴砧捣 马壮兵强楚戍愁 报道四更笳鼓响 衔枚袭虏献俘囚,"7,7,7,7,7,7,7,7,7,7,7,4,1,1,1,1,1,7,7,7,7",5989953d652aabdaa34cabf58974e24c,戍 楼 西北 望皇州 宿衙 曾 随 上苑 游 明月 芦花 迷曲岸 西风 梧叶报 清秋 凤凰 台上 几声 笛 鹦鹉 洲边 一苇 舟 对 菊 渊明 怀 刺史 抛 梭织 女 弄 牵牛 娟娟 万里 江河 烂 耽 耽 孤星 大火 流 白雁远 传 苏武 札 银鲈 细切 季 李 鹰 羞 差 露 凄 霜 肃 吴 砧 捣 马壮兵 强楚 戍愁 报道 四 更笳鼓响 衔枚 袭 虏 献俘 囚
