id,title,author,dynasty,genre,poem_type,sentences_simplified,meter_pattern,hash,words
7c1c4aaf-01a0-425e-92e0-cc73fe2484ab,送晁以道,王安中,唐,诗,五言古体,人才限南北 河岳日边徼 异时颇自振 以远得轻笑 顾我尚友心 与渠不同调 吾州向虽陋 属令文元肖 仙凫谢云罗 雪浪涌海峤 问山如登天 翰墨相焜燿 高标快目击 胜语醒耳剽 永怀种秫潜 不翅憩棠召 八年杖屦隔 坐睡梦嵩少 何人佀严陵 寒滩理幽钓 无因接孙登 半岭听清啸 渐恐落流俗 中夜回光照 倒海觅三珠 更复得二妙 风埃邺王城 晚从折简召 仓曹宾客次 玉立见孤峭 神锋森挺脱 俛嘿愿还鞘 至今牛斗间 宝气干两曜 伯宜承华勋 仲合典书诏 翩翩谁辈行 官职忽哄叫 美须草未鬬 好面丧可吊 斯人但寂寞 瑚琏不荐庙 我尝当馈叹 吞愤类牛噍 渊龙岂易扰 遽敢议处劭 念昔忝闻道 锐甚冠始醮 百忧荒寸田 孰与耕新烧 区区冀有获 韅鞅鞭复掉 端来求代公 兀守信麦漂 便将涂六凿 风籁息号窍 政自畏攀援 拄颊遭诟谯 一官涕唾了 得失已悬料 嚢中餐玉法 朝饥傥能疗 纵无钱买山 解有杖荷𦰏 从公问箕颍 策足事游眺 共待四明归 重丐一言要,"5,5,5,5,5,5,5,5,5,5,5,5,5,5,5,5,5,5,5,5,5,5,5,5,5,5,5,5,5,5,5,5,5,5,5,5,5,5,5,5,5,5,5,5,5,5,5,5,5,5,5,5,5,5,5,5,5,5,5,5,5,5,5,5,5,5,5,5",6c9e31867228f4ffaa8af67dfd318f27,人才 限 南北 河岳 日边 徼 异 时 颇 自振 以 远 得 轻 笑 顾 我 尚 友心 与 渠 不同 调 吾 州 向 虽 陋 属 令文元 肖 仙 凫谢 云罗 雪 浪涌 海峤 问山 如 登天 翰墨 相 焜 燿 高标 快 目击 胜语 醒 耳 剽 永怀 种 秫潜 不 翅 憩 棠召 八年 杖 屦 隔 坐 睡梦 嵩 少 何人 佀 严 陵 寒 滩 理 幽 钓 无因 接 孙登 半 岭 听 清啸 渐 恐 落 流俗 中夜 回 光照 倒 海 觅三珠 更 复得 二 妙 风 埃邺 王城 晚 从 折 简召 仓 曹 宾客 次 玉立 见 孤峭 神锋 森 挺脱 俛 嘿 愿 还鞘 至今 牛斗间 宝气 干两曜 伯宜承 华勋 仲合 典书 诏 翩翩 谁 辈行 官职 忽哄 叫 美 须草未 鬬 好 面 丧可吊 斯人 但 寂寞 瑚 琏 不荐 庙 我 尝当馈 叹 吞愤类 牛 噍 渊龙 岂 易扰 遽敢 议处 劭 念昔忝 闻道 锐 甚 冠 始 醮 百忧荒寸田 孰与 耕 新 烧 区区 冀 有 获 韅 鞅 鞭 复 掉 端 来求 代公 兀 守信 麦漂 便 将 涂 六 凿 风籁息号窍 政自畏 攀援 拄 颊 遭 诟谯 一 官涕 唾 了 得失 已 悬料 嚢 中餐 玉法 朝饥傥 能疗 纵无钱买山 解有 杖 荷 𦰏 从 公问 箕 颍 策足事 游眺 共待 四明 归 重丐 一言 要
4694c774-ec67-41fe-8a72-4529b50a03d3,次韵和彭少逸送晁以道,王安中,唐,诗,五言古体,吾军久不张 建鼓觅同道 苍黄一二获 便作百万号 我行初济河 首得晁彭耗 轻车驾驷马 邂逅王良造 悠然望八极 颇已快远抱 两公前后辈 凛凛不殊操 晁文早纬国 辅以家学奥 向来宏词出 古气轧盘诰 萧生宁抱关 肯补郎衣皂 老成吾犹及 孝友神所劳 彭诗动惊俗 祖屈实自悼 追奇诣岑险 展读眩欲眊 知名渔父篇 雅惬志和好 勿前丞相嗔 何恃翰林傲 方将摩二垒 并可潄双瀑 瓜代苦敦薄 火攻良抵冒 荆州一人半 才慰阿坚到 只今事行李 遽欲戒驺导 箕山老仙伯 远行避喧噪 纷纷户外屦 三沐安无躁 仲氏往吹箎 吾党端有靠 坐念玉壶冰 讵堪风日曝 鲁公屋漏笔 莫靳平安报 否泰等时雨 春旱必秋涝 努力加饭餐 自余何足祷 无卿我定豪 别语愿忠告 睡翁赖少留 意适如爬瘙 大臣不暑行 官小奈亲耄 网罗今转疏 机穽岂重蹈 得失傥未量 天理问禆灶,"5,5,5,5,5,5,5,5,5,5,5,5,5,5,5,5,5,5,5,5,5,5,5,5,5,5,5,5,5,5,5,5,5,5,5,5,5,5,5,5,5,5,5,5,5,5,5,5,5,5,5,5,5,5,5,5,5,5,5,5",0ab5535710f16c00cb44521ba73b0d6b,吾 军 久 不张 建鼓 觅 同道 苍黄 一二 获 便 作 百万 号 我行 初济 河 首得 晁 彭 耗 轻 车驾 驷马 邂逅 王良 造 悠然 望 八极 颇 已快 远 抱 两 公前 后辈 凛凛 不殊 操 晁文早 纬国 辅以 家学 奥 向来 宏词 出 古气 轧盘 诰 萧生宁 抱关 肯补 郎 衣皂 老成 吾 犹及 孝友 神所 劳 彭 诗动 惊俗 祖屈 实自 悼 追奇诣 岑险 展读 眩 欲 眊 知名 渔父 篇 雅 惬志 和 好 勿 前 丞相 嗔 何恃 翰林 傲 方将 摩 二垒 并 可 潄 双 瀑 瓜代 苦敦 薄 火攻 良 抵 冒 荆州 一人半 才 慰 阿坚 到 只 今 事 行李 遽 欲 戒 驺 导 箕 山 老仙伯 远行 避 喧噪 纷纷 户外 屦 三 沐安 无躁 仲氏 往 吹 箎 吾 党端 有 靠 坐念 玉壶 冰 讵 堪 风日 曝 鲁公 屋漏 笔 莫靳 平安 报 否 泰 等 时 雨 春旱 必秋涝 努力 加饭 餐 自余何 足祷 无卿 我 定 豪 别语 愿 忠告 睡 翁赖 少留 意适 如 爬 瘙 大臣 不暑 行 官小奈 亲 耄 网罗 今 转 疏 机 穽 岂 重蹈 得失 傥 未量 天理 问 禆 灶
196c625f-f34a-4c6f-857e-5a75ea57b71b,长句送以道既辱和答而夏传圣诗亦用此韵以道复和一篇篇末颇及少逸与不肖因再赋此传圣姻家书问必数或可达以道,王安中,唐,诗,五言古体,癯儒缓趋走 不堪备游徼 古心乏妩媚 亦莫齿优笑 十年营负郭 毕愿了租调 诗书祝儿辈 风味久必肖 文穷觅退之 钱癖减和峤 此计堕渺茫 浪出岂炫燿 官供取无耻 几不类椎剽 退食独委蛇 顾欲辈周召 谁论玄尚白 端觉壮非少 缅怀千载人 有道混屠钓 风云随阔步 功业付长啸 事成有辞爵 缘断或遗照 飞潜无必同 出处信俱妙 肯以牛衣泣 求因狗监召 竟知貂尾短 何益鸢肩峭 士初如大刀 天高看拔鞘 提携龙雀环 胆破勒与曜 断蛟剸犀兕 左右随所诏 用舍要有时 遽欲帝阍叫 沾襟岂终悔 失马勿前吊 龟寜行曳泥 牺怯牵荐庙 但逃明火灼 讵厌短刍噍 固穷而山立 吾侪当勉劭 无祸福莫长 安用绿章醮 我今百念灰 内热息心烧 来亲晁氏贤 不住头忽掉 淋淫雨十日 坐恐行嚢漂 新篇寄邺城 钟磬逼耳窍 舂撞到彭夏 余子敢轻谯 是公天机深 世故成错料 良医百遇毒 彼已病俱疗 渊明寓托远 捉扇赞荷𦰏 吾将急捕逐 八表写长眺 迟暮傥同归 升斗何足要,"5,5,5,5,5,5,5,5,5,5,5,5,5,5,5,5,5,5,5,5,5,5,5,5,5,5,5,5,5,5,5,5,5,5,5,5,5,5,5,5,5,5,5,5,5,5,5,5,5,5,5,5,5,5,5,5,5,5,5,5,5,5,5,5,5,5,5,5",61dd29259c2a34b728e90a9e21e456a1,癯 儒 缓趋 走 不堪 备 游 徼 古心 乏 妩媚 亦莫齿 优笑 十年 营 负 郭 毕愿 了 租调 诗书 祝儿 辈 风味 久必 肖 文穷觅退之 钱 癖 减 和峤 此 计 堕 渺茫 浪出 岂 炫燿 官 供取 无耻 几不 类椎 剽 退食 独 委蛇 顾欲 辈 周 召 谁 论 玄尚白 端 觉壮 非少 缅怀 千载 人 有 道 混屠钓 风云 随 阔步 功业 付 长啸 事 成有 辞爵 缘断 或 遗照 飞 潜 无 必同 出处 信俱妙 肯以 牛 衣 泣 求 因 狗监 召 竟 知 貂 尾 短 何益 鸢 肩 峭 士初 如 大刀 天 高 看 拔鞘 提携 龙雀环 胆破勒 与 曜 断 蛟 剸 犀 兕 左右 随 所 诏 用 舍要 有时 遽 欲 帝 阍 叫 沾襟 岂终 悔 失马勿前吊 龟寜行曳 泥 牺怯 牵荐 庙 但 逃 明火 灼 讵 厌短刍 噍 固穷 而 山立 吾侪 当 勉 劭 无 祸福 莫长 安用 绿章 醮 我 今 百念 灰 内热 息心烧 来 亲 晁氏贤 不住 头 忽 掉 淋 淫雨 十日 坐 恐 行 嚢 漂 新篇 寄 邺 城 钟磬 逼 耳 窍 舂 撞 到 彭夏 余子 敢 轻 谯 是 公 天机 深 世故 成 错料 良医 百遇 毒 彼 已病 俱疗 渊明 寓托 远 捉 扇 赞荷 𦰏 吾 将 急捕 逐 八表 写长 眺 迟暮 傥 同归 升斗 何足 要
ba10f604-dca6-406f-b2fe-ef162df970a7,李永终还京师北岳王某以送晁以道韵作诗赠行某外大父贤良裴公实为邯郸公行状契义良厚故见之篇首,王安中,唐,诗,五言古体,外家东眷裴 典学不观徼 初来接诸彦 半发士龙笑 贤科两过阁 万字出戏调 尽记十二题 博洽古人肖 亡书问安世 多识数华峤 刘蕡廷策讦 罢去终弗燿 纵横五车读 未捷一律剽 生涯日萧索 更甚东陵召 当时邯郸公 似是洛阳少 文润淮南草 诗赓苑中钓 殿庐忽厌直 郡合或坐啸 相从宾客老 莫逆肝胆照 严诗见杜集 殆极天下妙 𫛳来蒲州坐 永隔宣室召 门生状董晋 寒笔信雄峭 岂惭吴季札 墓剑挂遗鞘 嗟予乃裴出 母贤如德耀 授予其父书 勉使起应诏 此文载编末 疾读快欲叫 耆旧成鬼录 零落真可吊 但闻康靖第 万物閟家庙 子孙同蠹鱼 奇字饱咀噍 始予识京掾 已叹才业劭 叔兮秉周礼 庄若客位醮 官闲恣讨论 灯火亲夜烧 固疑言语工 未睹寸管掉 高篇晚发伏 疲兵血争漂 予拔中山毛 载颖从八窍 携持托抱关 免以不敏谯 规容曹参随 敌敢杨雄料 宁忧无肉瘦 政恐俗难疗 冥搜废曹务 招隐慕芸𦰏 子行择所向 山水足观晀 慎勿厌家鸡 造请历权要,"5,5,5,5,5,5,5,5,5,5,5,5,5,5,5,5,5,5,5,5,5,5,5,5,5,5,5,5,5,5,5,5,5,5,5,5,5,5,5,5,5,5,5,5,5,5,5,5,5,5,5,5,5,5,5,5,5,5,5,5,5,5,5,5,5,5,5,5",86147eda6df4d22822b6e2cff3aa2520,外家 东眷 裴 典学 不 观 徼 初来 接 诸彦 半 发士 龙 笑 贤科 两 过阁 万 字 出戏 调 尽 记 十二 题 博洽 古人 肖 亡 书 问安 世 多 识数 华峤 刘 蕡 廷 策 讦 罢 去 终弗 燿 纵横 五车 读 未捷 一律 剽 生涯 日 萧索 更 甚 东陵 召 当时 邯郸 公 似 是 洛阳 少 文润 淮南 草 诗赓苑 中 钓 殿 庐 忽 厌直 郡合 或 坐啸 相从 宾客 老 莫逆 肝胆 照 严诗见 杜集 殆极 天下 妙 𫛳 来 蒲州 坐 永 隔 宣室 召 门生 状 董晋 寒笔 信雄 峭 岂 惭 吴 季札 墓 剑 挂 遗鞘 嗟予 乃 裴 出 母贤 如 德耀 授予 其父 书 勉使 起应 诏 此文 载编 末 疾读 快 欲 叫 耆 旧 成 鬼录 零落 真 可吊 但 闻康靖 第 万物 閟 家庙 子孙 同 蠹鱼 奇 字 饱 咀噍 始 予识 京 掾 已 叹 才 业 劭 叔 兮 秉 周礼 庄若 客位 醮 官闲 恣 讨论 灯火 亲夜 烧 固疑 言语 工 未睹 寸管掉 高篇晚 发伏 疲 兵 血争 漂 予拔 中山 毛 载颖从八窍 携持 托 抱关 免以 不 敏 谯 规容 曹 参随 敌 敢 杨雄 料 宁忧无肉瘦 政 恐俗 难疗 冥 搜废 曹务 招隐 慕芸 𦰏 子 行择 所向 山水 足 观 晀 慎 勿 厌 家鸡 造请 历权 要
f94a91e3-e984-473a-a8ef-0747b9bb8524,定武赠晁以道,王安中,唐,诗,五言古体,北山立雄秀 西山俨来奔 棱层上云雨 秘邃错朝昏 风霆倐号怒 势欲立厚坤 兹惟神灵宅 可但人物繁 嵩阳擅月旦 问山等龙门 谓我山之英 重以仁者言 丈人盖代手 脱口千载存 莼羮与羊酪 不复疑戏论 向来无极神 解与君争尊 堂堂甄孟成 版籍见诸孙 如何置不问 远借寒谷暄 我行傍乡梓 念此永弗谖 逢人试语似 喜色凌朝暾 问公谁辈行 故侯苏季昆 故侯遗妙墨 砻山龛山轩 亦有好事人 醉帖收蜿蜒 神明坐还观 声泪已复吞 公能破纸尾 师友道弥敦 要当藏名山 仍意作九原 续弦煎麟角 并洗万古冤,"5,5,5,5,5,5,5,5,5,5,5,5,5,5,5,5,5,5,5,5,5,5,5,5,5,5,5,5,5,5,5,5,5,5,5,5,5,5,5,5",4a9024fdeba4202f27cfd1ec71672bdf,北山 立雄秀 西山 俨来 奔 棱层 上 云雨 秘 邃 错朝昏 风 霆 倐 号 怒 势欲立厚坤 兹 惟 神灵 宅 可但 人物 繁 嵩阳 擅 月旦 问山 等 龙门 谓 我 山之英 重以 仁者 言 丈人 盖代 手 脱口 千载 存 莼羮与羊酪 不 复疑 戏论 向来 无极 神 解与 君争 尊 堂堂 甄孟成 版籍 见诸 孙 如何 置 不问 远 借 寒 谷 暄 我行 傍 乡梓 念 此 永 弗 谖 逢人试语 似 喜色 凌朝暾 问公 谁 辈行 故侯 苏季昆 故侯 遗妙 墨 砻 山 龛 山轩 亦 有 好事 人 醉 帖 收 蜿蜒 神明 坐 还 观 声泪 已复 吞 公能 破纸 尾 师友 道弥敦 要 当 藏 名山 仍意 作 九原 续弦 煎 麟角 并 洗 万古 冤
138684d6-05dc-40f9-905f-d89816f35d86,颜持约为范师厚作孔明坐啸图十大比丘象观者以为聱讹不可不下一句,王安中,唐,诗,七言律诗,穷颜妙画今虎头 忽以武侯为范侯 他日却写十比丘 下笔不数僧贯休 作佛作相三昧游 在江在海两浮沤 丈夫心机入法流 到处还渠第一筹,"7,7,7,7,7,7,7,7",621965fc5a00ae0388c90d62ef0beaf2,穷颜妙 画 今 虎头 忽以 武侯 为 范侯 他 日 却 写 十 比丘 下笔 不数 僧 贯休 作佛 作相 三昧 游 在 江 在 海 两 浮 沤 丈夫 心机 入法 流 到处 还 渠 第一 筹
9a5ba7c1-7238-409d-9be4-fb6816dc7a52,寄谢任伯,王安中,唐,诗,七言古体,盛乐宫前紫府君 开花流水不知春 悠悠永叹坐石室 自有此山无此人 我来婆娑弄明月 松声草色俱清新 列仙元癯不佞佛 却语小谢求纶巾 明经使者风生在 文字政须君等辈 鴈门鴈美亦思归 讲肄还当寻马队,"7,7,7,7,7,7,7,7,7,7,7,7",12a0ddeda19dab99785c924d638a3c65,盛乐 宫前 紫 府君 开花 流水 不知 春 悠悠 永叹 坐 石室 自有 此 山 无 此人 我 来 婆娑 弄 明月 松声 草色 俱 清新 列仙元 癯 不 佞佛 却 语 小 谢求 纶巾 明经 使者 风生 在 文字 政须 君 等 辈 鴈 门 鴈 美 亦 思归 讲 肄还 当 寻 马队
91c33612-3d21-491f-9965-7a558b5e4b72,寄江南睡翁,王安中,唐,诗,七言律诗,金鳯台头我欲仙 故人真谓翼垂天 目光射落三千尺 诗律追还五百年 应缘又踏瀛州土 寄问骑鲸今好否 俗情限量须破除 可无忘形我与渠,"7,7,7,7,7,7,7,7",cb2072c910bc836337f69b1d212586a7,金 鳯 台 头 我 欲 仙 故人 真谓翼 垂天 目光 射落 三千尺 诗律 追 还 五百年 应缘 又 踏 瀛州 土 寄 问 骑 鲸 今 好否 俗情 限量 须 破除 可 无 忘形 我 与 渠
eca9d7a1-ed3a-4907-b9cd-96630165d4e6,崇宁寺诗,王安中,唐,诗,七言律诗,周郎同岁小一月 老气凛凛能摧锋 佛隐由来足高士 经纶正在阿堵中 平生蓬藋一亩宫 颇与可人风味同 好在江南香火社 寄书会忆王墙东,"7,7,7,7,7,7,7,7",e184c0cc4c1459d2f1431fa41f94a23d,周郎 同岁 小 一月 老气 凛凛 能 摧锋 佛 隐由 来足 高士 经纶 正在 阿 堵 中 平生 蓬 藋 一亩 宫 颇 与 可 人 风味 同 好 在 江南 香火 社 寄书 会忆 王墙 东
e1b5441e-e478-4521-b994-981cf0c1af6e,次韵张应龙见赠长句,王安中,唐,诗,七言古体,深居听客谭西山 舌端崷崒生层峦 山形卓荦尚可想 客趣超诣何由攀 漳颍空回自不韵 梦涉山涧波旋环 但携云根万窍碧 归置毛颖陶泓间 客真与山欲争秀 烟霞气足词高闲 我亦良非适俗者 分山一半同君还,"7,7,7,7,7,7,7,7,7,7,7,7",1ef6275b07dc1ad10c900d264109cdab,深居 听 客 谭 西山 舌端 崷 崒 生 层峦 山形 卓荦 尚可 想 客趣 超诣 何由 攀 漳 颍 空 回自 不韵 梦 涉 山涧 波旋 环 但 携云根万窍碧 归置 毛颖陶 泓 间 客 真 与山欲争秀 烟霞 气足词 高闲 我 亦 良 非 适俗 者 分山 一半 同 君 还
62a7d756-a4d9-4222-8c82-d635f9dfe85e,同元忠少逸登大安阁各赋一篇,王安中,唐,诗,七言古体,胸中堆奇忽块磊 径欲凴虚寻我对 梵宫日月擦鸱尾 复道云霓涌鼇背 佛将高广快心赏 天为空长舒眼碍 冰层蹙岸见河漳 雪气明山数齐岱 安知一身寄城郭 却指万顶看阛阓 承平大驾昔此留 望幸遗民今几在 哦诗人物到白也 题字风流希湛辈 北都三士行作图 胜游一日不可废,"7,7,7,7,7,7,7,7,7,7,7,7,7,7,7,7",bf93493562fbd49953d4962e5ee39692,胸中 堆奇 忽块 磊 径 欲 凴 虚 寻 我 对 梵宫 日月 擦 鸱尾 复道 云霓 涌 鼇 背 佛 将 高 广快 心赏 天 为 空长舒 眼碍 冰层 蹙 岸 见 河漳 雪气明 山数 齐岱 安知 一身 寄 城郭 却 指 万顶 看 阛 阓 承平 大驾昔 此 留 望幸 遗民 今 几在 哦 诗 人物 到 白 也 题字 风流 希湛 辈 北都 三士 行 作图 胜游 一日 不可 废
d84d7b74-1bff-4317-a1b1-0fc9c754d093,颜夷仲欲赴蓝田丞而郓帅移雍姻家或当避读夷仲诗为和第二篇此次退之山石韵者,王安中,唐,诗,七言古体,秋虫不量翅股微 几欲唐突鹓鸾飞 高梧嘶风食沆瀣 何似死鼠鸱鸢肥 颜家事业更清绝 耆旧去眼知音稀 贤哉鼻祖井故在 执瓢便足忘君饥 一官晚悔登龙断 经岁不出关荆扉 蓝田之山石韫玉 白虹千丈晴霏霏 退之壁志见仿佛 二松阅世应百围 丞聋未换渠莫恶 郴江仙伯容抠衣 侧闻亲嫌又龃龉 漫恐髀肉摩鞍鞿 戏人造物亦薄相 咄咄此士将安归,"7,7,7,7,7,7,7,7,7,7,7,7,7,7,7,7,7,7,7,7",c7b8a527039f87cd9d4efd1a7fae0596,秋虫 不量 翅股 微 几欲 唐突 鹓 鸾 飞 高梧 嘶 风食 沆瀣 何 似 死 鼠 鸱 鸢 肥 颜家 事业 更 清绝 耆 旧 去 眼 知音 稀 贤 哉 鼻祖 井故 在 执 瓢便足忘君饥 一 官 晚 悔 登龙 断 经岁 不 出关 荆扉 蓝田 之 山石 韫 玉 白虹 千丈 晴 霏霏 退 之 壁志 见 仿佛 二松 阅世 应 百围 丞 聋 未换 渠 莫恶 郴江 仙伯容 抠 衣 侧闻 亲嫌 又 龃龉 漫恐 髀 肉 摩 鞍 鞿 戏人 造物 亦 薄 相 咄咄 此 士 将 安归
a5d9f561-67c0-4e3d-a89e-2b1cb2b16c06,赵圣符权涟水军使按周立事且去犹闻上乞不赦为作长句,王安中,唐,诗,七言古体,颍川异日刚彊守 诸吏僵仆奸豪走 济南使君羞怯懦 故破瞷宗三百口 官为声名计则多 寻常手滑如彼何 心知昔人不妄作 随事砭斫或拊摩 河神娶妇理必往 城北杀子吾当诃 襄𣸣赵侯世儒雅 轩昂忽变肠无它 奴欺主女积十载 侯以半纸申严科 人言赵侯广汉后 宜有擿伏如神手 青衫诸掾日蹉跎 众或屈凌天自佑 谁过襄𣸣刻石傍 告以吾言慰耆旧 侯今儿子能文章 母太夫人百岁寿,"7,7,7,7,7,7,7,7,7,7,7,7,7,7,7,7,7,7,7,7,7,7",6125eeb109da818fc3aa90de54a3941e,颍川 异 日刚 彊 守 诸吏 僵仆 奸豪 走 济南 使君 羞 怯懦 故 破 瞷 宗 三百 口 官 为 声名 计则 多 寻常 手 滑如 彼何 心 知 昔人 不 妄作 随 事 砭 斫 或 拊 摩 河神 娶 妇理 必往 城北 杀子 吾 当 诃 襄 𣸣 赵侯世 儒雅 轩昂 忽变肠 无 它 奴 欺主 女积 十载 侯 以 半纸 申严科 人言 赵侯 广汉 后 宜 有 擿 伏 如 神 手 青衫 诸 掾 日 蹉跎 众 或 屈凌 天自佑 谁 过 襄 𣸣 刻石 傍 告以 吾 言 慰 耆 旧 侯 今 儿子 能 文章 母 太夫人 百岁 寿
6851cfb9-958c-4fe1-90e9-69a927bf6e36,过客有赠达之金者达之作鲋鱼乞水急诗谨次韵,王安中,唐,诗,七言古体,李侯茫茫悲欲泣 人生岂能无缓急 晨炊米尽抱衾裯 富儿操金森壁立 纵横文字对空虚 肝膈不同如燥湿 寒乡眼界太褊迫 名誉才高憎怨集 诵书把琖九河悬 虽我亦惊追莫及 风雷会送横海鳣 跃上禹门过千级 奈何自比辙中鲋 商歌感慨行人揖 鲋鱼不愿决西江 李侯所须惟粟粒 肯捐一滴活波臣 客真义动修蛇蛰 得金遣客曾莫留 索我和篇何汲汲 孤竹之管空桑琴 已矣今人听不入,"7,7,7,7,7,7,7,7,7,7,7,7,7,7,7,7,7,7,7,7,7,7",57646fb21d6a666e847d862051d9fa8b,李侯 茫茫 悲欲泣 人生 岂能 无 缓急 晨炊 米 尽 抱 衾 裯 富儿操 金森 壁立 纵横 文字 对 空虚 肝膈 不同 如 燥湿 寒乡 眼界 太 褊迫 名誉 才 高 憎怨 集 诵 书 把 琖 九 河 悬 虽 我 亦 惊 追 莫及 风雷 会 送 横 海 鳣 跃上 禹门 过 千级 奈何 自 比辙 中 鲋 商歌 感慨 行人 揖 鲋 鱼 不 愿决 西江 李侯 所 须惟粟 粒 肯 捐 一滴 活波臣 客 真义 动修蛇 蛰 得 金遣客 曾 莫 留 索 我 和篇何 汲汲 孤竹 之 管 空桑 琴 已 矣 今人 听 不入
2d269e9a-8255-428f-bd2c-6df5ad4169ed,第二子赴河间诗人皆作诗送行读赵壻辟疆诗为次韵,王安中,唐,诗,七言古体,家世无人仕苕浙 送汝还为北城别 河间知不去吾远 汝母犹持离袖掣 中年生子今宦游 吾与汝母宜白头 中山西望三舍身 诸老汝近吾何愁 宫傅恩怜逮犹子 宫师雁行余五弟 至今乡闾尚心化 友爱推高一门里 向来寒甚草根蛩 迩来出入轩盖从 富贵不愿此身独 安乐幸与诸老同 门户固应多国器 汝往岂为功名会 古文科斗尽五车 娱人翰墨真余事 客程抢笠风卷纱 归及诸老醉榴花 京华新闻勿用说 一时名士诗可夸,"7,7,7,7,7,7,7,7,7,7,7,7,7,7,7,7,7,7,7,7,7,7,7,7",8b7935ac5d912f131bb538a69a5c028f,家世 无人 仕苕 浙 送 汝 还 为 北城 别 河间 知不去 吾 远 汝母 犹持离袖掣 中年 生子 今 宦游 吾 与 汝母 宜 白头 中 山西 望三 舍身 诸老汝 近 吾何 愁 宫傅恩 怜 逮 犹子 宫师 雁行 余 五弟 至今 乡闾 尚 心化 友爱 推高 一门 里 向来 寒 甚 草根 蛩 迩来 出入 轩盖 从 富贵 不 愿 此身 独 安乐 幸 与 诸 老同 门户 固应多 国器 汝 往 岂为 功名 会 古 文科 斗 尽 五车 娱人 翰墨 真余事 客程 抢笠 风卷 纱 归及 诸老醉 榴花 京华 新闻 勿 用 说 一时 名士 诗 可 夸
83e6c342-e18d-48ab-be09-48feff2e38d4,题李成山水,王安中,唐,诗,七言古体,五日十日一水石 此言虽工盖其迹 请看天地开辟初 岂铸日魂镕月魄 忽然而成随所遇 纳护风云元满肚 吐为千偈口澜翻 游戏法中同一趣 李侯落笔风烟气 妙处欲回真宰意 扁舟不动水粘天 落日孤明山若倚 断猿吟挂清枫林 涧松倒卧犹十寻 白鸥似作终老计 浮云自在年何深 由来神品完天力 一抺江流吞万碛 寸量尺度但形摹 画史如山尔何得 贵人费尽千黄金 宝奁玉轴谁敢争 一声常卖落公手 世间得丧谁亏盈 我生懒率更疏放 只有幼舆岩石相 它时真作画中人 傥辱书来问无恙,"7,7,7,7,7,7,7,7,7,7,7,7,7,7,7,7,7,7,7,7,7,7,7,7,7,7,7,7",0874af4aa1e5c914782045875dcbff2c,五日 十日一水 石 此言 虽 工盖 其 迹 请 看 天地 开辟 初 岂 铸 日魂镕月 魄 忽然 而 成随 所遇 纳护 风云 元 满 肚 吐 为 千 偈口澜 翻 游戏 法 中 同一 趣 李侯 落笔 风 烟气 妙处 欲 回真 宰意 扁舟 不动水 粘天 落日 孤明山 若 倚 断猿 吟挂 清 枫林 涧 松 倒卧 犹十寻 白鸥 似 作 终老 计 浮云 自 在 年 何深 由 来 神品 完 天力 一 抺 江流 吞 万 碛 寸量 尺度 但 形摹 画史 如 山尔 何得 贵人 费尽 千 黄金 宝奁 玉轴 谁 敢争 一声 常 卖落 公手 世间 得丧 谁 亏盈 我 生 懒率 更 疏放 只有 幼舆 岩石 相 它时 真 作 画中人 傥 辱 书 来 问 无恙
bebf2d7b-fdab-4726-9836-b4d777dd3f29,次韵题李公休辋川图,王安中,唐,诗,七言古体,山林策足高复高 俗子捷宦争秋毫 丹青邂逅着相衮 晚顾不欲传儿曹 妙哉吾家右丞相 睥睨一世轻鸿毛 云泉招隐去甚勇 粉墨状景随所遭 辋川庄图最得趣 尽写众𪩘围长臯 废城荒烟飒衰柳 断涧立石淙惊涛 筼筜插屋伴幽读 莲芰泼眼横轻舠 宫槐犹是鸣驺陌 漆园已作蒙庄逃 地因人好自奇胜 岂必海峤骞鲸鼇 想见解衣盘礴时 六种震动山灵号 平生经行意境足 朽木不运笔已操 小诗气象更清绝 远跨陶谢追风骚 乐安老人吾莫及 摹搨仿佛收藏牢 隶书十咏有体法 针肆见此古赤刀 一时墨妙谁窃去 龙剑飞失余环绦 只今跋题乃到我 千载吾祖安敢褒 家鸡诗画愧弗学 但思卜筑诛蓬蒿 辋川久无书契在 未免四海求田劳,"7,7,7,7,7,7,7,7,7,7,7,7,7,7,7,7,7,7,7,7,7,7,7,7,7,7,7,7,7,7,7,7,7,7,7,7",96632b5a6d1dad26bca23f246e459b23,山林 策足高 复高 俗子 捷 宦争 秋毫 丹青 邂逅 着 相衮 晚 顾 不 欲 传 儿 曹 妙哉 吾 家 右丞相 睥睨 一世 轻 鸿毛 云泉 招隐 去 甚勇 粉墨 状景 随 所 遭 辋 川 庄 图 最得趣 尽 写 众 𪩘 围 长 臯 废城 荒烟 飒衰柳 断涧 立石 淙 惊涛 筼 筜 插 屋 伴 幽 读 莲 芰 泼 眼 横 轻 舠 宫槐 犹 是 鸣 驺 陌 漆园 已 作 蒙庄 逃 地因 人 好 自奇 胜 岂必 海 峤 骞 鲸 鼇 想见 解衣盘礴 时 六种 震动 山灵 号 平生 经行 意境 足 朽木 不 运笔 已 操 小 诗 气象 更 清绝 远 跨 陶谢 追 风骚 乐安 老人 吾 莫及 摹 搨 仿佛 收藏 牢 隶书 十 咏有 体法 针 肆见 此古 赤刀 一时 墨妙 谁 窃去 龙剑飞 失余 环绦 只 今 跋 题 乃 到 我 千载 吾 祖 安敢 褒 家鸡 诗画 愧 弗学 但 思卜筑 诛 蓬蒿 辋 川 久 无 书契 在 未免 四海 求田 劳
