id,title,author,dynasty,genre,poem_type,sentences_simplified,meter_pattern,hash,words
0b05b4a9-0342-473e-8f6b-8d1bf516cd85,次韵袁州郑守鹿鸣宴,赵汝𬭼,宋,诗,七言律诗,诏增贡籍自端平 大比贤书拔众英 学备六经俱里选 赋推五色以文鸣 虽由黄卷能勤苦 皆藉朱轓与作成 来岁锦标先夺得 天街听喝状元声,"7,7,7,7,7,7,7,7",321e2389d094f23cd1f71651b35b5529,诏 增 贡籍 自 端平 大比贤 书拔 众 英 学备 六经 俱里 选 赋 推 五色 以 文鸣 虽 由 黄卷 能 勤苦 皆 藉 朱 轓 与 作成 来 岁 锦标 先 夺得 天街 听 喝 状元 声
d963c7c9-0f82-4205-8c79-de3a9e603d5e,宿江阁,赵汝𬭼,宋,诗,七言律诗,阁前眼界如图画 山色侵窗竹打簷 云带鴈声移别浦 月将梅影进疎帘 壮怀自笑年年减 华发无情日日添 夜半骤风天骤雪 贵家鼓舞客心嫌,"7,7,7,7,7,7,7,7",cdafb4bfa5096e7fdaac814be2edcbc6,阁 前 眼界 如 图画 山色 侵 窗 竹 打 簷 云 带 鴈 声 移 别 浦 月 将 梅影 进 疎 帘 壮怀 自笑 年 年 减 华发 无情 日日 添 夜半 骤风 天 骤雪 贵家 鼓舞 客心 嫌
c0a99390-01c9-496a-b22c-b527771e90df,久客写怀,赵汝𬭼,宋,诗,七言律诗,一身千里叹飘零 鬓影萧疎已半星 云鴈叫愁栏独倚 秋风吹面酒初醒 尘埃南北何曾歇 日月东西不暂停 昏暮谁家数声笛 含凄喷怨要人听,"7,7,7,7,7,7,7,7",7e8d073d9835d1a3f4ad40037f4f3c10,一身 千里 叹 飘零 鬓影 萧 疎 已 半 星 云 鴈 叫 愁 栏 独 倚 秋风 吹 面酒 初 醒 尘埃 南北 何曾 歇 日月 东西 不 暂停 昏暮 谁家 数声 笛 含凄喷 怨 要 人 听
82ba6c33-6301-46a7-a7f2-7058eb5f2b3b,清明日同傅元瞻阎才元周济美曾原伯宇文子友宇文子英汪冲之王谦仲集樱朱园分韵得食字二十韵,赵汝𬭼,宋,诗,五言古体,宦情随推移 世事分限域 帝城冠盖会 千里或咫尺 赏僚尽英贤 了事即余日 念我契阔情 招邀见怀忆 春事日光辉 湖山好颜色 徐行失前骑 可望不可即 徜徉大堤上 徙倚长桥侧 游龙䀭生花 意极反寥阒 山房启烟扉 僧话寄禅寂 同来妙人物 高论倾历历 朋簪忽逢会 并辔随休适 将军万金园 花竹照燕席 高情发清旷 绝𪩘疲危陟 俯视天壤间 锦绣蒙山泽 太平岂无象 黔首何知德 须臾碧云暮 过羽杯行疾 投林暝鸦还 隔浦灯火湿 呼车各零乱 红烛明青壁 良辰尚多欢 整整三分一 后会傥相从 前言未应食,"5,5,5,5,5,5,5,5,5,5,5,5,5,5,5,5,5,5,5,5,5,5,5,5,5,5,5,5,5,5,5,5,5,5,5,5,5,5,5,5",f12cb084973b6e2c325f2b176ecdce71,宦情 随 推移 世事 分限域 帝城 冠盖 会 千里 或 咫尺 赏僚 尽 英 贤 了 事 即 余日 念 我 契 阔情 招邀 见 怀忆 春事 日 光辉 湖山 好 颜色 徐行 失前 骑 可望 不可 即 徜徉 大堤 上 徙倚 长桥 侧 游龙 䀭 生花 意极 反 寥 阒 山房 启烟 扉 僧 话 寄 禅寂 同来 妙 人物 高论 倾 历历 朋簪 忽逢 会 并辔 随 休 适 将军 万金 园 花竹照 燕席 高情 发 清旷 绝 𪩘 疲危 陟 俯视 天壤 间 锦绣 蒙 山泽 太平 岂 无 象 黔首 何知德 须臾 碧云 暮 过 羽杯 行疾 投林 暝 鸦还 隔浦 灯火 湿 呼车 各 零乱 红烛 明青壁 良辰 尚多 欢 整整 三分 一 后会 傥 相 从 前言 未 应食
1d1910ec-b12d-4916-890e-484c4c39144e,访郑隠君不遇,赵汝𬭼,宋,诗,五言律诗,行尽枥林村 柴门闭夕曛 自来松下坐 闲想壁间文 守树猿偷果 窥山犬吠云 多应寻鹤去 祇隔暮溪𣸣,"5,5,5,5,5,5,5,5",a0cce679e07a37ac33bbb1d44451e506,行尽枥 林村 柴门 闭 夕 曛 自来 松下 坐 闲想 壁间 文 守树猿偷果 窥 山 犬吠 云 多 应 寻鹤 去 祇 隔 暮 溪 𣸣
e3aa5af0-1b65-410a-81b7-459ee910767e,流杯池,赵汝𬭼,宋,诗,五言律诗,分得兰亭胜 今才二十年 飞觞流石罅 曲水出天然 古意欠修竹 清香足旧莲 嶙峋裂奇怪 两兽卧山边,"5,5,5,5,5,5,5,5",3af9641027c73bddce7a4c7a4d65774c,分 得 兰亭 胜 今才 二十年 飞觞 流石 罅 曲水 出 天然 古意 欠修 竹 清香 足 旧 莲 嶙峋 裂 奇怪 两 兽 卧 山边
7a49148b-d079-4a7d-991a-5abb50f7298e,句  其一,赵汝𬭼,宋,诗,五言古体,巧须出大造 清欲与秋争,"5,5",fd62c46a7897ea6a51a4bf19ca5216aa,巧 须 出大 造 清 欲 与 秋争
c6b01324-d050-4a30-a486-a5d8ed3feeb9,句  其二,赵汝𬭼,宋,诗,五言古体,鸟残桃见核 虫蠹叶留痕,"5,5",183952c39c5d9c471d648991e68cc74f,鸟 残桃 见 核 虫 蠹叶 留痕
ffc58444-7d21-42d6-b8ff-da8e8202802c,句  其三,赵汝𬭼,宋,诗,七言古体,泾有泉流安得暑 亭因风扫自无尘,"7,7",d3a4fdcffb6734bb3e6d47e807c50cc5,泾有 泉流 安得暑 亭 因风扫自 无尘
edcf34ce-8639-4286-bc18-2fd294dd2bd6,句  其四,赵汝𬭼,宋,诗,七言古体,锄草就平眠鹿地 芟松勿损挂猿枝,"7,7",2f6b2a1e12e0239079001c3b0517531d,锄草 就 平眠 鹿地 芟松 勿 损挂 猿枝
37037d1d-f8ff-4c19-bcbd-b80cf6e619b8,诗二首  其一,赵汝域,宋,诗,七言绝句,醉梦腾腾听打衙 三年踪迹类瓠瓜 如今不似穿云子 一钵随身到处家,"7,7,7,7",6df81962f886ce80fa59d653459636de,醉梦 腾腾 听 打 衙 三年 踪迹 类 瓠 瓜 如今 不似 穿 云子 一 钵 随身 到处 家
0c7fe891-27f3-4d60-8eb8-71e003348adc,诗二首  其二,赵汝域,宋,诗,七言律诗,数叶梧桐落短廊 一泓秋水湛银塘 调琴独奏猗兰操 啜茗清飘茉莉香 涕泣两年同贾傅 痴梦千载笑君房 于今不作武宁客 蓑笠渔竿日月长,"7,7,7,7,7,7,7,7",7d05e1732f5f33069bc2abab792a93aa,数叶 梧桐 落 短 廊 一 泓 秋水 湛银塘 调琴 独奏 猗 兰操 啜 茗 清飘 茉莉 香 涕泣 两年 同 贾傅 痴梦 千载 笑 君房 于今 不 作 武宁 客 蓑笠 渔竿 日月 长
77a751bc-a246-4633-8ef1-405b49404dba,题栽梅桃,赵汝域,宋,诗,七言绝句,梅花开尽桃花开 两朵春移小院栽 索笑索吟殊未已 浑浑疑是故人来,"7,7,7,7",20ddac7d2cb045d7e349f16a29c1f776,梅花 开尽 桃花开 两朵 春 移 小院 栽 索笑 索吟殊 未 已 浑浑 疑 是 故人 来
45281bea-54db-4768-827c-8a58b8205dce,契友夜酌联句,赵汝域,宋,诗,五言律诗,银烛清谈久 乡情异路真 醉能忘世故 狂欲静风尘 细踏梅花月 长讴栗里春 不知时节换 诗句得来新,"5,5,5,5,5,5,5,5",053acc0718f59b8aa786d42829033d79,银烛 清谈 久 乡情 异路 真 醉 能 忘 世故 狂欲 静 风尘 细踏 梅花 月 长 讴栗 里 春 不知 时节 换 诗句 得来 新
b61ec528-9391-47b5-a3a4-04d8bd1d28d4,落梅,郑性之,宋,诗,七言绝句,夜来几阵隔窗风 便恐明朝已扫空 点在青苔真可惜 不如吹入酒杯中,"7,7,7,7",2c66e2631538eba84cd2586cf55b9048,夜来 几阵 隔窗 风 便 恐 明朝 已 扫 空 点 在 青苔 真 可惜 不如 吹入 酒杯 中
b13baeb9-9f13-449d-87c5-ea9798641f61,梅花,郑性之,宋,诗,七言律诗,先生多在山中宿 为爱横斜影上窗 茁发僧从深涧徙 赪肩奴过别峰扛 和羹宰相调金鼎 止渴将军拥碧幢 空谷不知如许艳 沽来村酒且开缸,"7,7,7,7,7,7,7,7",d104a154eacaca69be11789eaf8bb401,先生 多 在 山中 宿 为 爱 横斜 影上 窗 茁发僧从 深涧 徙 赪 肩 奴 过 别 峰 扛 和 羹 宰相 调金鼎 止渴 将军 拥 碧 幢 空谷 不知 如许 艳 沽 来 村酒 且 开 缸
f64756a0-82ef-4ea1-96a8-ded4ec16a789,南枝开北枝未开,郑性之,宋,诗,七言律诗,山北云衣裹萼红 山南莫恨雪乘风 眼前开谢人心别 醉里吟哦我辈同 春意收香归鼎实 月梢留影印阶空 诸君行试调羹手 来岁花边独钓翁,"7,7,7,7,7,7,7,7",b3dcd472eb9448a115a6f9d2056822e8,山北 云 衣裹 萼红 山南 莫恨雪 乘风 眼前 开谢 人心 别 醉里 吟哦 我辈 同 春意 收香 归 鼎实 月 梢 留 影印 阶空 诸君 行试 调羹 手 来 岁 花边 独钓翁
e308e2c4-34c1-4b1f-8337-b5b636b9daab,恩波桥,陈延龄,宋,诗,七言古体,富春胜趣景一幅 四面好山青簇簇 浙江逶迤向东来 千里平铺鸭头绿 老夫作官从此游 恩波阁道如虹浮 凭栏夜半玩星斗 会稽分夜天南头 是时万籁寂不作 惟见翺翔双白鹤 赤松正与董双成 坐驾云𫐌穷碧落 素娥海上来相迎 玉笙度曲鸾凤鸣 商音袅袅洗人耳 惊起葛翁仙梦醒 走着氅衣忙草草 开门误踢神炉倒 丹光飞起掩月明 虎啸龙吟天地老,"7,7,7,7,7,7,7,7,7,7,7,7,7,7,7,7,7,7,7,7",01434f2698524957800422290a605266,富春胜 趣景 一幅 四面 好 山 青 簇簇 浙江 逶迤 向东 来 千里 平铺 鸭头 绿 老夫 作 官 从此 游 恩波阁 道 如 虹 浮 凭栏 夜半 玩 星斗 会 稽 分 夜天 南头 是 时 万籁 寂不作 惟 见 翺 翔 双 白鹤 赤松 正 与 董双成 坐 驾云 𫐌 穷 碧落 素娥 海上 来 相迎 玉笙 度曲 鸾凤 鸣 商音 袅袅 洗 人 耳 惊起 葛翁仙 梦醒 走 着 氅衣 忙 草草 开门 误 踢 神炉 倒 丹光飞 起掩 月 明 虎啸 龙吟 天地 老
74e27530-66fc-4435-95dd-dcb59c17e576,浮觉院竹轩,陈延龄,宋,诗,七言律诗,山僧种竹数千个 堂户清阴日日浓 从便寄栖天外凤 等闲梦化钵中龙 护余贝叶云无迹 刺破苔痕石有踪 老去要盟莲社约 一枝携取策龙钟,"7,7,7,7,7,7,7,7",c8963c2bb7df245dd6ba16417ebc1bef,山僧 种 竹 数千个 堂户 清 阴 日日 浓 从便 寄 栖 天外 凤 等闲 梦化钵 中龙 护余 贝叶 云无迹 刺破 苔 痕石 有踪 老 去 要盟 莲社 约 一枝 携取 策 龙钟
d9a7b3c0-632c-4da7-b551-4fab65ae27b1,普明院,陈延龄,宋,诗,七言律诗,普明禅寺隠岩坰 狂客重来酒未醒 云气竟拖龙尾白 山容尽比佛头青 松林深处谁家屋 村墅斜阳若个亭 莫问笑谈归去晚 有诗留与赤松听,"7,7,7,7,7,7,7,7",50527a53c9523ff403c37b5644a320f3,普明 禅寺 隠 岩 坰 狂客 重来 酒 未 醒 云气 竟 拖 龙尾 白 山容 尽 比 佛头 青 松林 深处 谁家 屋 村墅 斜阳 若个 亭 莫 问 笑谈 归去 晚 有 诗 留 与 赤松 听
9a73e155-9220-497c-88ed-dea63fb0fc39,丹霞观,陈延龄,宋,诗,七言律诗,苍筤林深羽人观 正傍严陵旧钓台 山中白云夜或起 洞口丹霞昼不开 双成吹笛驾鸾下 葛翁掷杖为龙来 仙风道骨我亦有 姹女婴儿君可猜,"7,7,7,7,7,7,7,7",4dac0abcee339503caca2e146c96038e,苍 筤 林 深 羽 人 观 正 傍 严陵 旧 钓台 山中 白云 夜 或 起 洞口 丹霞 昼不开 双成 吹笛 驾 鸾 下 葛翁 掷 杖 为 龙 来 仙风道骨 我 亦 有 姹女 婴儿 君 可 猜
01d765d7-3910-41bb-8769-338fe8bf74e6,大安院,陈延龄,宋,诗,七言律诗,诗人假榻古兰若 松风涧水相泠泠 优婆塞倾椰子酒 须菩提讲莲花经 龙形老树雨知翠 佛头高山云见青 借问仙人渺何许 飞升一去三千龄,"7,7,7,7,7,7,7,7",d85ffbd15a97b1ec5399fb0b4a56b431,诗人 假 榻 古兰 若 松风 涧水 相泠泠 优婆 塞 倾 椰子 酒 须菩提 讲 莲花 经 龙形 老树雨 知 翠 佛头 高山 云见青 借问 仙人 渺 何许 飞升 一 去 三千 龄
f5e0779c-66e1-4738-a4ee-919e7144222b,祷雨作  其一,高定子,宋,诗,七言绝句,牵丝晨谒玉皇家 唤起慵龙乞井花 醒看满山枝叶语 晚唐句子是萌芽,"7,7,7,7",ec9e1520bf88215b14a672e1d9c1c7b9,牵丝晨 谒 玉 皇家 唤起 慵 龙 乞井 花 醒 看 满山 枝叶 语 晚唐 句子 是 萌芽
f7ab8c16-03b9-4d77-82b0-4233764c1225,祷雨作  其二,高定子,宋,诗,七言绝句,诗到眉山自一家 也将正命摄于邪 巧裁大涤天成景 戏咏庭蛟与洞鸦,"7,7,7,7",ef9a01901b2df00ef2446fe7994270d5,诗 到 眉山 自 一家 也 将 正命 摄于 邪 巧裁 大涤 天成 景 戏咏 庭 蛟 与 洞鸦
334db1bc-fc32-4c23-b49b-8b288161c84f,祷雨作  其三,高定子,宋,诗,七言绝句,两闲洒落无尘著 万象森罗触处逢 此意要令儿辈觉 擎天一柱爱中峰,"7,7,7,7",2da686eebabdc6508d0fb1db4d8a43f8,两 闲 洒落 无尘 著 万象森罗 触 处逢 此 意要 令 儿辈 觉 擎天 一柱 爱 中峰
2a133688-e851-4413-87bb-39a6f6c98ef3,句,高伯易,宋,诗,七言古体,函颅谨勿为终策 天下英雄暗破颜,"7,7",38af75d38329d1015fe2508b7d6d77bb,函颅 谨 勿 为 终策 天下英雄 暗破 颜
a01e5c9b-b5d6-4d4c-a285-c80cb507cfea,句  其一,高载,宋,诗,七言古体,拟约沧江异姓兄,7,92fd0ae1fd2d0b3d37ef86ab7e7a0da5,拟 约 沧江 异姓 兄
e59e38e2-6995-449b-b65e-3c68fab13ff7,句  其二,高载,宋,诗,七言古体,自是去凶明国是 毋轻函首启戎奸,"7,7",aaa2d44cfc97ed326e4c9caddd556725,自是 去 凶明 国是 毋轻函首启戎奸
de58735e-050b-4bba-ae46-f9f2fcd87704,梅雪堂,卢孝孙,宋,诗,五言古体,玄冬雪霰零 寒梅吐花白 皎皎冰玉姿 六出同一色 佳士开幽轩 于此心境悦 味澹志愈坚 冰霜励高节 永言贞素心 千载共孤洁,"5,5,5,5,5,5,5,5,5,5",e33b4f672417e57ce2f3d14464dea1c7,玄 冬雪 霰零 寒梅 吐 花白 皎皎 冰 玉 姿 六出 同一 色 佳 士开幽轩 于 此 心境 悦 味 澹志愈 坚 冰霜 励高节 永言贞 素心 千载 共 孤洁
14e6a4b7-d915-41da-aa34-bec68b6d741f,题画竹石,张翼,宋,诗,杂言,嗟彼凤去 空余虎蹲 竹不可食 石不能言,"4,4,4,4",8e694ce9d7467964def18aede4166ff4,嗟彼凤 去 空余 虎 蹲 竹 不可 食 石 不能 言
e5a19c46-d37d-4fa8-bf09-ddff346d0089,百花岩,吴驲,宋,诗,五言绝句,灵岩竞吐秀 百卉四时开 不假栽培力 天然锦绣堆,"5,5,5,5",c2705fd0f87d244727437bc911bf8e07,灵岩 竞吐 秀 百卉 四时 开 不 假 栽培 力 天然 锦绣 堆
a9eddbb3-1fe4-4110-8d9e-c17c1dbd6cc3,登中梁山  其一,李儒用,宋,诗,七言律诗,浩荡秋风使节归 南山重与北山违 自来人物瞻乌帽 更共宾僚款绿衣 秦地关河才咫尺 汉都风景尚依稀 壶浆迎处多遗老 绝叹登坛往事非,"7,7,7,7,7,7,7,7",a1f05e88bbe97fb8051d6bc056e8db26,浩荡 秋风 使节 归 南山 重 与 北山 违 自来 人物 瞻 乌 帽 更共 宾僚款 绿衣 秦地 关河 才 咫尺 汉都 风景 尚 依稀 壶 浆 迎 处 多 遗老 绝叹 登坛 往事 非
d794e584-ab58-47dd-a3ee-8ebd01bef963,登中梁山  其二,李儒用,宋,诗,七言律诗,路入梁州如砥平 登高远目更增明 霜清木落千山瘦 潦尽江空一水横 岁稳未宽忧国志 时危转切望乡情 英雄千载兴王地 孺子堪怜此曳兵,"7,7,7,7,7,7,7,7",50127272bcd76caacab6d0a34a3d8552,路入 梁州 如砥平 登高 远目 更 增明 霜清 木落 千山 瘦 潦尽 江空 一 水 横 岁 稳未 宽 忧国 志 时 危转 切望 乡情 英雄 千载 兴王 地 孺子 堪怜 此 曳兵
7b07f03a-f035-4ab7-91e4-4d703011c684,题左翰林三友亭,黄棨,宋,诗,七言绝句,劲节虬枝水月香 轩前高坐胜寻常 翰林此意知非浅 曾有坚心秉雪霜,"7,7,7,7",5979733303ce17b61feaf3d2c571a3fc,劲节 虬枝 水 月香 轩 前 高 坐胜 寻常 翰林 此 意知 非浅 曾有坚 心秉雪 霜
caea6d93-3beb-44fa-9f37-ed4613dd262e,过安仁,黄鉴,宋,诗,七言律诗,早发磐溪挂短篷 朔风吹雨晓蒙蒙 润含野色沾衣湿 暖逐春光养土融 图画宛然山远近 人家对住水西东 驿亭记得停车处 枫树曾连夕照红,"7,7,7,7,7,7,7,7",c8f1faddb62b8f8d6a22f6f283dfd14c,早 发 磐 溪 挂 短篷 朔风 吹 雨晓 蒙蒙 润 含 野色 沾衣 湿 暖 逐 春光 养 土融 图画 宛然 山 远近 人家 对 住水 西东 驿亭 记得 停车处 枫树 曾连 夕照 红
f5e8615f-83c3-43c2-a039-2f34c302c04d,寿赵仙尉,阮文卿,宋,诗,杂言,君不见苕溪有山号浮玉 降神储瑞皆天族 又不见苕溪有水名水晶 地灵人杰尽维城 苕溪山川称第一 孕秀梅仙尤杰出 我来席上揖清风 义气相与吞长虹 见人须见大丈夫 纵是封侯亦不如 周官一卷长生箓 未必人间有此书 功名一入英雄手 彩棒暂持出浙右 摧奸抉隠李开府 夜月花村无吠狗 凛凛英风凌四豪 一同谁敢犯秋毫 不惟握发勤延士 又且官清马骨高 书生惯作无毡客 负箧南归居最仄 何怜踪迹苦奔驰 俾近渊明时请益 马走暂停憇县斋 晨昏黄嬭仍相陪 不觇王母蟠桃结 隔墙无得献金杯 欣逢子月阳来复 一天佳气回寒谷 蓂生九叶庆垂弧 佥将瑞应长庚宿 绿衣槐简舞蹁跹 重拜萱堂王母仙 瑶池新革偷桃令 有子今如曼倩贤 不祝算如龟与鹤 愿君早施江夏略 扫除膻秽□神京 长与长生同寿乐 不祝禄如山与丘 愿君爵冠朱虚侯 今归且定郏鄏鼎 长使卜世过成周,"10,7,10,7,7,7,7,7,7,7,7,7,7,7,7,7,7,7,7,7,7,7,7,7,7,7,7,7,7,7,7,7,7,7,7,7,7,7,7,7,7,7,7,7",59c5e062b43a8b48e5755c460751f0fc,君不见 苕溪 有 山号 浮 玉 降神 储瑞皆 天族 又 不见 苕溪 有 水名 水晶 地灵人杰 尽 维城 苕溪 山川 称 第一 孕 秀 梅仙 尤 杰出 我 来 席 上 揖 清风 义气 相与 吞 长虹 见 人 须 见 大丈夫 纵是 封侯 亦 不如 周官 一卷 长生 箓 未必 人间 有 此书 功名 一 入 英雄 手 彩棒 暂 持出 浙右 摧奸 抉 隠 李 开府 夜月 花村 无 吠 狗 凛凛 英风 凌四豪 一同 谁 敢 犯 秋毫 不惟 握 发勤 延士 又 且 官清马 骨 高 书生 惯作 无 毡 客 负箧 南归 居 最仄 何怜 踪迹 苦 奔驰 俾 近 渊明 时 请益 马 走 暂停 憇 县 斋 晨昏 黄 嬭 仍 相陪 不 觇 王母 蟠桃 结 隔墙 无 得 献 金杯 欣逢 子月阳 来复 一天 佳 气 回 寒谷 蓂 生 九叶 庆 垂 弧 佥 将 瑞 应 长庚 宿 绿衣 槐 简舞 蹁跹 重拜 萱堂 王母 仙 瑶池 新 革 偷 桃令 有 子 今 如 曼倩贤 不 祝算 如 龟 与 鹤 愿君 早施 江夏 略 扫除 膻秽 □ 神京 长 与 长生 同 寿乐 不 祝 禄如山 与 丘 愿君 爵冠 朱虚侯 今 归 且 定 郏 鄏 鼎 长 使 卜 世 过成 周
42f04913-1d91-44d7-ba39-34a5f57a2fef,春暮,刘镇,宋,诗,五言律诗,春至又春暮 闲心成古心 花光随雨薄 草色共烟深 粉蝶稀狂影 黄鹂送好音 余芳留不得 还共夕阳沈,"5,5,5,5,5,5,5,5",9c07a798effa1fae70e736fcf0e386a9,春至 又 春 暮 闲心 成古 心 花光 随雨薄 草色 共烟 深 粉蝶 稀狂 影 黄鹂 送 好 音 余芳 留 不得 还 共 夕阳 沈
bd0ffde1-a5a0-4916-a126-ef8644a7c82d,山中早行,刘镇,宋,诗,五言绝句,严钟将报曙 游子已登途 野火时明灭 星残似有无,"5,5,5,5",4e7672f5ba9fc09e3f40b3de47013d3a,严钟 将报 曙 游子 已 登途 野火 时 明灭 星 残似 有无
f0087608-4504-442c-9531-3ccc57ddbc78,八岁女善棋,刘镇,宋,诗,五言律诗,慧黠过男子 娇痴语未真 无心防敌手 有意恼诗人 得路逢师笑 输机怕父嗔 汝还知世事 一局一回新,"5,5,5,5,5,5,5,5",91fcd2a84eb3ce5b73a5fcee18a08ae3,慧黠 过 男子 娇痴 语 未 真 无心 防 敌手 有意 恼 诗人 得 路 逢 师 笑 输机 怕 父 嗔 汝 还 知 世事 一局 一回 新
c874d4c8-a308-46ed-b1d0-e95e22bb8301,赠隠者,刘镇,宋,诗,五言律诗,夫子生东野 经年不到城 爱吟无俗趣 贪画得闲名 荒径侵山影 虚堂出燕声 我惭为谪吏 泉石负幽情,"5,5,5,5,5,5,5,5",4a53f136fff999f4fc4dfae0dd2845f3,夫子 生 东野 经 年 不到 城 爱吟 无俗趣 贪画 得闲 名 荒径 侵 山影 虚堂出燕声 我 惭 为 谪 吏 泉石 负 幽情
121121d6-1f5e-4b0e-9e45-b2d103bac55e,太姥山,刘镇,宋,诗,七言律诗,滚滚千山入马蹄 出游回首日平西 人从杜宇鸣时别 天向蒹葭静处低 白鸟得鱼闲钓艇 黄蜂抱蘂閙花枝 好将太姥山前路 付与孤猿自在啼,"7,7,7,7,7,7,7,7",fd7b51f964847a6aa22cdb8acf723df9,滚滚 千山 入 马蹄 出游 回首 日 平西 人 从 杜宇 鸣 时别 天向 蒹 葭 静 处低 白鸟 得 鱼 闲 钓艇 黄蜂 抱 蘂 閙 花枝 好 将 太姥山 前路 付与 孤猿 自在 啼
27f2f459-75fc-4ad6-8b95-d1c7e6697c21,严子陵钓台,刘镇,宋,诗,七言绝句,汉业重恢百战闲 君王侧席叹才难 故人可是擎天手 肯放桐江把钓竿,"7,7,7,7",b2c74a26e0fa19fcad179fc4f1722806,汉业重 恢 百战 闲 君王 侧席 叹 才 难 故人 可是 擎天 手 肯放 桐江 把 钓竿
dfc74b78-d171-4018-a164-97e09175ade7,浮膺山,刘镇,宋,诗,七言绝句,马头过了又馿头 何处飞来海上洲 绝顶试穷千里目 烟波深处是琉球,"7,7,7,7",c836d97073cfa89374324573b3593179,马头 过了又 馿 头 何处 飞来 海上 洲 绝顶 试 穷 千里目 烟波 深处 是 琉球
0a33ffa9-52a6-4410-83b1-2e13586da758,句,刘镇,宋,诗,五言古体,始终无玷缺 出处最光明,"5,5",45866bf6a9851fb641f43cc48b64e4b6,始终 无 玷缺 出处 最 光明
e8640175-6878-445f-a81c-8c94faf4a37a,李侍郎修路,陈褎,宋,诗,七言律诗,路余百里两山间 水驿山程总不安 谁把千金平滑蹬 免教一叶委惊滩 行人感叹何时已 贤守功名百世看 次第吾闽都似掌 却嗤蜀道号泥盘,"7,7,7,7,7,7,7,7",7f72dd0b5e8fcaf1e101810a72710d28,路 余 百里 两 山间 水驿 山程 总 不安 谁 把 千金 平滑 蹬 免教 一叶 委 惊 滩 行人 感叹 何时 已 贤守 功名 百世 看 次第 吾 闽 都 似 掌 却 嗤 蜀道 号 泥盘
ae10ff52-46f2-4643-ac07-2603634c401f,玛瑙宝胜寺,陈俞,宋,诗,五言律诗,雨霁佛屋明 苔迳深曲折 树摇高露惊 草密暗泉咽 前林忽清磬 烟灯远欲灭 寄谢尘中人 与君从此别,"5,5,5,5,5,5,5,5",3f02d3bbd48b28cc003bfc66f1054748,雨霁佛 屋明 苔 迳 深 曲折 树 摇高露惊 草密 暗泉 咽 前林 忽 清 磬 烟灯远欲灭 寄谢 尘 中 人 与 君 从此 别
58bec2af-84c0-4688-9a77-1e368f3fd0ed,雨后过玛瑙寺,陈俞,宋,诗,五言律诗,借屋傍精庐 无事数来往 披草通泉流 刻树记笋长 微风四山落 小立领松响 讵名息诸缘 暂喜脱尘网,"5,5,5,5,5,5,5,5",72e75a0d3e62efee10f459ee21a4ed6e,借屋傍精庐 无事 数 来往 披草 通 泉流 刻树 记笋 长 微风 四山 落 小 立领 松响 讵 名息 诸缘 暂 喜脱 尘网
6ea706d9-2e86-4b24-b5e9-1de88476e51d,重游,陈俞,宋,诗,五言律诗,觉闻浴鼓声 众散我徐赴 石槽温泉涌 赤脚蹑云雾 振衣新笋林 岸帻古松树 脱然得轻安 水因本无悟,"5,5,5,5,5,5,5,5",0c2733cc36169930585fe87fb97e0cfc,觉闻 浴 鼓声 众 散 我 徐 赴 石槽 温泉 涌 赤脚 蹑 云雾 振衣 新 笋林 岸 帻 古 松树 脱然得 轻安 水因 本无悟
8de1194f-018b-4fd6-b6a0-bf56e49479cc,午睡玛瑙起赴寿星浴,陈俞,宋,诗,五言律诗,达人心镜明 直道略委折 重来犬不惊 到家蝉声咽 君吟有造化 我唱无生灭 法界即大都 山川几回别,"5,5,5,5,5,5,5,5",925a108c96a04014199174b75a639a12,达 人心 镜明 直道略 委折 重来 犬不惊 到 家 蝉声 咽 君 吟有 造化 我 唱 无 生灭 法界 即 大都 山川 几回 别
59884c70-547c-4798-8f5d-9c61a13c8d2e,赠画鱼贾兄,陈俞,宋,诗,七言古体,春江浩荡春江阔 夜半湖声涌新沫 晓风吹断碧云根 万顷沧波带晴豁 浪花潋滟翻红桃 群鱼出没乘轻涛 悠扬得意鼓鳞鬣 十十五五同为曹 昔曾观澜知此意 真乐胸中渺无际 常嗟物理难形容 幸有贾君得精艺 巨鱼奋迅凌江湖 纤鳞错杂依菰蒲 精神万状幻新笔 巧与造化论锱铢 朅来过我示奇作 数幅生绡图纵壑 呼童展向虚堂中 恍若当年见鱼乐 如君画思几通神 眼高世俗空无人 石台去后今几载 毫端仿佛留芳尘 又宜学取洞清拔 写龙不写潜波鲔 徒能画鱼不画龙 空使馋夫吐馋水,"7,7,7,7,7,7,7,7,7,7,7,7,7,7,7,7,7,7,7,7,7,7,7,7,7,7,7,7",340ef08eb0a311eea9af2c38b8d5f7a1,春江 浩荡 春江 阔 夜半 湖声 涌 新沫 晓 风吹 断 碧云 根 万顷 沧波 带 晴 豁 浪花 潋滟 翻 红桃 群鱼 出没 乘轻涛 悠扬 得意 鼓 鳞 鬣 十十五五 同为 曹 昔 曾 观澜 知此意 真乐 胸中 渺 无际 常 嗟 物理 难 形容 幸有 贾君得 精艺 巨鱼 奋迅 凌 江湖 纤鳞 错杂 依 菰 蒲 精神 万状 幻 新 笔 巧 与 造化 论 锱铢 朅 来 过 我 示 奇 作 数幅 生 绡 图 纵 壑 呼童展 向 虚堂 中 恍若 当年 见 鱼乐 如君画思几 通神 眼高 世俗 空 无人 石台 去后 今 几载 毫端 仿佛 留芳 尘 又 宜 学取 洞 清拔 写 龙 不 写 潜 波 鲔 徒能 画鱼 不 画龙 空 使 馋夫吐 馋水
0c015747-5839-496b-9156-937926972496,访僧归云庵,陶崇,宋,诗,五言古体,闲过选佛场 归云翠如泼 入门偶有言 启颊师便喝 掩耳煨芋炉 但把火深拨 呼童酌玉虹 注之旃檀钵 嘘灰然微红 横铛水煎活 茶酣登甲亭 双眸为之豁 鸟啼空山幽 翔来集木末 风月一何佳 团𪢮共披抹 悠然澹忘归 于兹得解脱,"5,5,5,5,5,5,5,5,5,5,5,5,5,5,5,5,5,5",7b7c61ca297ac9f3375eee0ad9b0b6db,闲过 选 佛场 归云翠 如 泼 入门 偶 有 言 启 颊 师 便 喝 掩耳 煨 芋炉 但 把 火 深 拨 呼童酌 玉虹 注之 旃檀 钵 嘘 灰然 微红 横铛水 煎活 茶 酣 登 甲 亭 双眸 为 之 豁 鸟啼 空山 幽 翔 来 集木 末 风月 一何 佳 团 𪢮 共 披抹 悠然 澹忘 归 于兹 得 解脱
7d3386f6-f818-4481-91d5-0aa27878dae5,笔山,陶崇,宋,诗,七言绝句,晚来设色霞成绮 秋至回文鴈作行 借问墨池何处是 一江环遶潄琳琅,"7,7,7,7",22d054c983666008315ea8f870def279,晚 来 设色 霞 成 绮 秋 至 回文 鴈 作 行 借问 墨池 何处 是 一 江 环 遶 潄 琳琅
aa048a7c-9027-4f10-b872-86737a2b2b20,游都梁赋,沈诚,宋,诗,七言绝句,昔中原兮今边头 抱良图兮气干牛 窥泗城兮辨古汴 临清浦兮思白沟,"7,7,7,7",7297523b72cbc6901a9b2a587307e51d,昔 中原 兮 今 边头 抱良 图 兮 气 干 牛 窥 泗 城 兮 辨 古汴 临清 浦兮思 白沟
e323132d-83f2-44f6-bddd-1c7fb300bde2,句,杨昕,宋,诗,七言古体,二八玉泉分派泠 三千银界出尘清,"7,7",bd6e6f4680e16e4f0b8066a1ee17d38c,二八 玉泉 分派 泠 三千 银界 出尘 清
40fe8895-c2bb-4111-85bd-5f8ded5b80b7,三高祠  其一,刘寅,宋,诗,七言绝句,江流东去日滔滔 谁把功名等一毫 若使今人同古调 不应江上只三高,"7,7,7,7",23dbbbedb6843f9d9edcde7d5cb1ce21,江流 东去 日 滔滔 谁 把 功名 等 一毫 若 使 今人 同 古调 不应 江上 只 三 高
