id,title,author,dynasty,genre,poem_type,sentences_simplified,meter_pattern,hash,words
ed76cdf3-7a04-4f89-a848-e47635673b41,船回过德清,张镃,唐,诗,七言古体,溪平如簟不织纹 夕阳红叶参差分 芦边孤篷饭炊芹 风力引上萦长云 天将此意慰所欣 我倦不饭兴自醺 思懒岂复笔下勤 一默中有诗无垠 林木振动山应闻,"7,7,7,7,7,7,7,7,7",6887fe74a594a1672ba57bcfdea4c413,溪平 如 簟 不 织纹 夕阳红 叶 参差 分 芦边 孤篷 饭 炊 芹 风力 引上 萦长 云 天将 此 意慰 所 欣 我 倦 不饭 兴自 醺 思懒 岂复 笔下 勤 一默 中 有 诗 无垠 林木 振动 山应闻
ca4b4dd7-0971-4ada-876f-484917bad04f,夜宿龙井广福寺分韵得来字,张镃,唐,诗,七言古体,阳乌翅焦云崔嵬 避热马转南山隈 边湖兴熟厌频往 幽讨林落穿莓苔 涧声引步陟层岭 亭矗路侧双扉开 泓泉湛碧透坤轴 合有龙卧专风雷 抚栏立瞰眩奇閟 潄挹未敢持深杯 瘦筇趋寺更幽寂 苴补不到簷楹摧 老僧肃揖选凉坐 借床过夜容裴回 神灵变异亦喜客 跂脉现状潜鳞鳃 从容瞻敬忽无靓 应悯堕世余氛埃 堂中遗像成三老 英爽长在游天垓 认题扫壁说前辈 今昔玩视俱悠哉 出门因爱月正午 桂子秋到须重来,"7,7,7,7,7,7,7,7,7,7,7,7,7,7,7,7,7,7,7,7,7,7,7,7",2cd69944fa36d0079ddc2e2b989e42e2,阳乌翅 焦云 崔嵬 避热 马 转 南山 隈 边湖 兴熟厌 频往 幽讨林 落 穿 莓 苔 涧 声 引步 陟 层 岭 亭 矗路 侧 双扉 开 泓 泉 湛 碧 透坤 轴 合有 龙 卧 专 风雷 抚 栏 立 瞰 眩 奇 閟 潄 挹 未敢 持 深 杯 瘦 筇 趋 寺 更 幽寂 苴 补 不到 簷 楹 摧 老僧 肃 揖 选 凉 坐 借床 过夜 容裴 回 神灵 变异 亦 喜 客 跂 脉 现状 潜 鳞 鳃 从容 瞻敬忽无靓 应悯 堕世 余氛 埃 堂 中 遗像 成 三老 英爽 长在 游 天 垓 认题 扫壁 说 前辈 今昔 玩视俱 悠哉 出门 因 爱 月 正午 桂子秋 到须 重来
e1bd8008-fa4e-4f91-82d1-b1cedad53a64,七月望烟波观对月,张镃,唐,诗,七言古体,我生好奇难比论 流水古木期终身 卜居城隅易得趣 窗户日与青山亲 出门陂湖旧湮涸 连岁乃尔成奫沦 结亭据要虽屡赏 物景尚厌非清真 商飚入序才两夕 猛雨尽洗炎歊尘 今晨已复暑不奈 挥汗几欲捐衣巾 晚风引履到云镜 萧爽意象生无垠 须臾从地出伟观 光洁万丈推冰轮 波明上下互发越 弥望但怪镕黄银 烟芦窣飒杂虫响 渔艇隠约收丝缗 人生何用计俗眼 强起口笑胜眉颦 急倾巨醆叫李白 今古不问交精神 相随拟造广寒阙 共醉更住三千春,"7,7,7,7,7,7,7,7,7,7,7,7,7,7,7,7,7,7,7,7,7,7,7,7,7,7",2f6639b26e2b3739420d7b621c45e93f,我 生 好奇 难 比论 流水 古 木期 终身 卜居 城隅 易得 趣 窗户 日 与 青山 亲 出门 陂湖 旧 湮涸 连 岁 乃尔 成奫沦 结亭 据要 虽 屡 赏 物景 尚 厌非 清真 商飚 入 序才 两夕 猛雨 尽 洗 炎 歊 尘 今晨 已 复暑 不奈 挥汗 几欲 捐 衣巾 晚风 引 履到 云镜 萧爽 意象 生 无垠 须臾 从 地 出 伟观 光洁 万丈 推 冰轮 波明 上下 互发 越 弥望 但 怪 镕 黄 银 烟 芦 窣飒 杂 虫 响 渔 艇 隠 约 收 丝 缗 人生 何用 计俗 眼 强起口笑胜眉颦 急倾 巨 醆 叫 李白 今古 不问 交 精神 相随 拟造 广寒 阙 共 醉 更 住 三千 春
f1d62499-931f-4540-adf3-e818f6e24577,题寒绿轩,张镃,唐,诗,七言古体,甫里先生穷到老 剩有诗文记林草 杞苗菊叶果何佳 自喜春风颜色好 现庵主人同吾张 故家文献出大梁 相过肯对桂隠榻 握手书社倾肝肠 顷年客处东濒海 灌畦不仰园官菜 小窗寒绿独专名 实与天随同所爱 所爱既同人亦同 岂较早晏时遭逢 极知趣尚寓小物 过眼斥鷃高飞鸿 闲关馆舍人稀到 簷前席地聊从好 维杞与菊复移栽 撷可烹茶羹可芼 晓烟夕露清无边 尽扫万古红紫缘 对之饮水骨亦仙 屠沽儿家休击鲜,"7,7,7,7,7,7,7,7,7,7,7,7,7,7,7,7,7,7,7,7,7,7,7,7",3747d901a4f75c52fccd71854e49c84d,甫里 先生 穷 到 老 剩有 诗文 记林 草 杞苗 菊叶果 何佳 自喜 春风 颜色 好 现 庵 主人 同 吾 张 故家 文献 出 大梁 相过 肯对 桂 隠 榻 握手 书社 倾 肝肠 顷年 客处 东 濒海 灌畦 不 仰 园 官菜 小窗 寒绿 独 专名 实与 天 随同 所 爱 所爱 既 同人 亦 同 岂 较 早 晏 时 遭逢 极 知趣 尚寓 小物 过眼 斥 鷃 高 飞鸿 闲关 馆舍 人 稀到 簷 前 席地 聊 从 好 维杞 与 菊 复 移栽 撷 可 烹茶 羹 可 芼 晓烟夕 露清 无边 尽 扫 万古 红紫缘 对 之 饮水 骨 亦 仙 屠沽儿 家 休击 鲜
db28cc5e-9259-4b98-9f04-b3990e34a64c,登城歌,张镃,唐,诗,杂言,二月二十八 花开满林鶑恰恰 春光谁遣插翅飞 雪色情知添鬓发 暄风随我登古城 远树如簇山如萦 一川渺弥青镜平 云翳不定天疑行 去船住船纵复横 日辉迸射光晶晶 逆听万古苍蝇声 眼穿故国唤不应 鼎湖龙升朝帝廷 还领旧物苏函灵 维先忠烈为列星 侍尧受命行专征 今上移军复四京 实遵天时协群情 不战自可屈人兵 版图悉更郡县名 蛇荒鸟夷颁朔正 礼乐制度重修明 漏泉沛泽江海倾 小臣笔力鸿毛轻 愿书诏命奔驿程 涤洗罪眚哀孤惸 霜露所坠皆驩盈 此意一笑从谁评 旧游安期丹想成 未须遣鹤来相迎 我方居园学长生 后五百岁归蓬瀛,"5,7,7,7,7,7,7,7,7,7,7,7,7,7,7,7,7,7,7,7,7,7,7,7,7,7,7,7,7,7,7,7",400b1acb13dc61154a84cc9cbe9f4277,二月 二十八 花开满 林 鶑 恰恰 春光 谁 遣 插翅 飞 雪 色情 知添 鬓发 暄 风 随 我 登 古城 远树如簇 山如萦 一川 渺 弥 青镜平 云翳 不定 天疑行 去 船 住 船 纵复 横 日 辉 迸射 光 晶晶 逆 听 万古 苍蝇 声 眼 穿 故国 唤 不 应 鼎湖 龙升 朝 帝廷 还 领 旧物 苏函灵 维先 忠烈 为 列星 侍尧 受命 行 专征 今 上移 军 复 四京 实 遵 天时 协 群情 不战自可屈人兵 版图 悉 更 郡县 名 蛇 荒 鸟 夷 颁 朔 正 礼乐 制度 重修 明 漏泉 沛泽 江海 倾 小臣 笔力 鸿毛 轻 愿书 诏命 奔 驿程 涤 洗罪 眚 哀 孤 惸 霜露 所坠 皆 驩 盈 此 意一笑 从 谁 评 旧游 安期丹 想成 未须 遣 鹤 来 相迎 我方 居园 学 长生 后 五百岁 归蓬瀛
30247c99-8bec-4832-b5e1-05463ac99002,韩子师尚书致仕,张镃,唐,诗,七言古体,丈夫出处无两岐 彊自分别儿童痴 鹿门庞老不愿仕 名与诸葛争驱驰 天子从臣岂易得 履声已到黄金墀 堂堂文誉动宸极 奕世长策归论思 攀辕卧辙昔人事 前日作州重见之 万口祝公犹在耳 拜后爵土同封蕲 绪余间发有如此 功业盛著庸何疑 仙风却与松乔期 泛苕涉霅寻幽奇 洞天白石人未省 翦茅植树亲指麾 山灵地妪许时秘 恰与八座供娱嬉 人间台榭难顿著 临胜向背真天施 霞晨雾夕更护耀 鸥朋鹭导欣逶迤 乡来韩必今复来 飞云入步长相随 上章乞身世亦有 发落齿撼将何为 公未五十方朱颜 勇退奚俟谋耆龟 九重嘉赏宠殊职 百辟动色钦清规 镃也尘鞅方羁縻 先德未报鬓已丝 高节凛凛端可师 扣门粮休千里赍 一舸叫月从鸱夷,"7,7,7,7,7,7,7,7,7,7,7,7,7,7,7,7,7,7,7,7,7,7,7,7,7,7,7,7,7,7,7,7,7,7,7,7,7",59d0f53dd5b3b179b70b1d45f058f37c,丈夫 出处 无 两 岐 彊 自 分别 儿童 痴 鹿门 庞老 不 愿 仕 名 与 诸葛 争 驱驰 天子 从 臣 岂 易得 履声 已 到 黄金 墀 堂堂 文誉 动 宸 极 奕 世 长策 归论思 攀辕卧辙 昔 人事 前日 作州 重见 之 万口 祝公犹 在 耳 拜 后 爵土 同 封 蕲 绪 余间 发 有 如此 功业 盛著 庸 何疑 仙风 却 与 松乔 期 泛苕 涉 霅 寻 幽 奇 洞天 白石 人 未 省 翦 茅 植树 亲指 麾 山灵 地妪 许时 秘 恰 与 八座 供 娱 嬉 人间 台榭 难 顿著 临胜 向背 真天施 霞 晨雾 夕 更 护耀 鸥 朋 鹭导 欣 逶迤 乡 来 韩 必今 复来 飞云 入 步长 相随 上章 乞 身世 亦 有 发落 齿 撼 将 何为 公未 五十 方 朱颜 勇退 奚 俟 谋 耆 龟 九重 嘉赏宠 殊职 百辟动色 钦 清规 镃 也 尘 鞅 方 羁縻 先 德未报鬓已丝 高 节 凛凛 端 可 师 扣门 粮 休 千里 赍 一 舸 叫 月 从 鸱 夷
9f09848a-26fa-4879-b6e1-6d35151ac8c7,张户部惠山杨梅,张镃,唐,诗,杂言,尝闻魏伯阳 铸丹会稽山 功成试其徒 未欲泛与餐 绐言丹入口 命尽不可还 一人笃信道 快饵肯作难 翁复起诸死 携手升云鸾 临行作奇戏 留使后世看 聊将一粒变万颗 掷向青林化珍果 仿佛芙蓉箭镞形 涩如鹤顶红如火 只随翁字姑号阳 姓杨乃是讹偏旁 迄今年深少人识 地妪山君应记得 木生曲直味宜酸 此独甘香胜蜜团 吾宗望郎忽驰送 色映筠篮光欲动 想因见此列宿躔 曾遣冰壶纤指弄 我方水际呼清风 葛巾高挂千丈松 为公摘荷盛荐酒 此乐城中那更有,"5,5,5,5,5,5,5,5,5,5,5,5,7,7,7,7,7,7,7,7,7,7,7,7,7,7,7,7,7,7",dba1a6ac0fb770f92ac3b7c91ef86ee7,尝闻 魏伯阳 铸丹 会稽山 功 成试 其 徒 未 欲 泛 与 餐 绐 言 丹 入口 命 尽 不可 还 一 人 笃信 道 快 饵 肯作 难 翁复 起 诸 死 携手 升 云鸾 临行 作奇 戏 留使 后世 看 聊 将 一粒 变 万颗 掷 向 青林化 珍果 仿佛 芙蓉 箭镞 形 涩 如 鹤顶红 如 火 只 随 翁 字 姑号 阳 姓 杨 乃是 讹 偏旁 迄今 年 深 少 人识 地妪 山君 应 记得 木生 曲直 味 宜 酸 此 独甘香胜 蜜团 吾 宗望郎 忽 驰送 色 映筠 篮光 欲 动 想 因见 此 列 宿 躔 曾 遣 冰壶 纤指 弄 我方 水际 呼 清风 葛巾 高 挂 千丈 松 为 公摘 荷 盛荐 酒 此乐 城中 那 更 有
1d7bc55b-0a4b-4546-93f8-11b2b0e25c54,石首春鱼梅鱼三物形状如一而大小不同尔因赋长篇,张镃,唐,诗,七言古体,遐陬编户居海滨 不但生涯仰虾蟹 煮盐成雪雪成堆 清曝群鱼趋市卖 其间石首最得名 随潮百万鼙鼓声 长舻巨艑鬭截取 急逐风便来王城 头中有物从何得 精卫含冤口抛石 此鱼腹小不容舟 只把石吞那患迮 错将转上泥丸宫 又疑当年潄石翁 临流快咽透入脑 化作鳞鬣金巃嵷 子孙诜诜仍亹亹 曰春曰梅俱可喜 醉乡贪衒风味高 失身盘脍杯羹里 先生趁晴携酒觞 柳色正似鹅儿黄 与渠岂暇考族谱 便结保社南湖傍 软炊玉饭乘燕艇 撑对柴门乱花径 并呼三子伴渔童 食肉诸公自时政,"7,7,7,7,7,7,7,7,7,7,7,7,7,7,7,7,7,7,7,7,7,7,7,7,7,7,7,7",d666c9a4e993846d2d9c847196ab763a,遐 陬 编户 居 海滨 不但 生涯 仰 虾 蟹 煮 盐 成雪雪 成堆 清 曝 群鱼 趋市 卖 其间 石首 最 得名 随潮 百万 鼙 鼓声 长 舻 巨 艑 鬭 截取 急逐风 便 来 王城 头中 有 物 从 何 得 精卫 含冤 口 抛石 此 鱼腹 小 不容 舟 只 把 石 吞 那 患 迮 错 将 转上 泥丸 宫 又 疑 当年 潄 石 翁 临流 快 咽 透入 脑 化作 鳞 鬣 金 巃 嵷 子孙 诜 诜 仍 亹 亹 曰 春 曰 梅 俱 可喜 醉乡 贪 衒 风味 高 失身 盘 脍 杯 羹 里 先生 趁 晴 携酒 觞 柳色 正似 鹅儿 黄 与 渠 岂暇 考 族谱 便 结保 社 南湖 傍 软 炊 玉 饭 乘 燕艇 撑 对 柴门 乱 花径 并 呼 三子 伴 渔童 食肉 诸公 自 时政
0ea78532-262e-43ee-9f44-396f44a98857,宿吴江华严院,张镃,唐,诗,七言古体,宿云蔽空溪溟蒙 我船晓系红蓼丛 宿雨滑道树沥漉 我车早转青泥冲 破程约涉一舍外 远目未快千山供 岸傍小店换马去 毡裘障冷披蒙茸 须臾巾盖不容展 莽莽暗雾逢逢风 偕行客舆屡掀簸 适值官骑来憧憧 刀弓负带竞硉矹 𫘰驷𩧄驖骓𩨈骢 争前迭进步殊窘 迫暮始望桥垂虹 石塘百丈捍骇浪 间有滩碛纷鱼筒 鸦群黑白混鸥起 帆影乱点遥波中 笔床茶灶住此地 得句未必慙龟蒙 浮图屋老且投宿 解担正听黄昏钟 纱笼炙灯照佛古 展席布榻便吾慵 酒边纸尽莫翻写 睡觉红日生于东,"7,7,7,7,7,7,7,7,7,7,7,7,7,7,7,7,7,7,7,7,7,7,7,7,7,7,7,7",89e5d5e4bbdd0c560058b7c905ee5aea,宿云 蔽空 溪 溟 蒙 我 船 晓系 红 蓼 丛 宿雨 滑道 树 沥 漉 我 车 早 转 青泥 冲 破程 约 涉一 舍外 远目 未快 千山 供 岸 傍 小店 换马 去 毡 裘 障 冷 披 蒙茸 须臾 巾 盖 不容 展 莽莽 暗雾 逢逢风 偕行 客舆 屡 掀簸 适值 官骑 来憧憧 刀弓 负带 竞 硉 矹 𫘰 驷 𩧄 驖 骓 𩨈 骢 争前 迭 进步 殊 窘 迫暮始望桥 垂虹 石塘 百丈 捍 骇浪 间有 滩 碛 纷 鱼 筒 鸦群 黑白 混鸥 起 帆影 乱点 遥波 中 笔床 茶 灶 住 此地 得 句 未必 慙 龟 蒙 浮图 屋老 且 投宿 解担 正 听 黄昏 钟 纱笼 炙灯照 佛古 展席 布榻 便 吾 慵 酒 边纸 尽莫 翻写 睡觉 红日 生于 东
5c6b6b59-cc6b-40df-90fe-2c538c5285c0,山堂纪实,张镃,唐,诗,七言古体,莓苔墙下斑斓长 烟霏谷口依稀上 晨辉迳奔鸟声来 夕影屡逢蟾魄晁 杖拖瘦路鸣敲铿 天台庐阜著脚行 中林稳置盘陀石 并坐不与孤云争 疎红叠翠如先有 霜藤蔓缘惊蛇走 枝枝叶叶巧相搀 岁寒俱是论心友 庵前台上晴最嘉 数杯薄酒聊随茶 客来劝主主劝客 醉倒冠履从欹斜 且道如今夸甚处 见成不是虚排句 堂前新展假山诗 约斋老子堂中住,"7,7,7,7,7,7,7,7,7,7,7,7,7,7,7,7,7,7,7,7",9115f12393891f2d4d9668cce92993eb,莓 苔 墙下 斑斓 长 烟霏 谷口 依稀 上 晨 辉 迳 奔 鸟声 来 夕影 屡 逢 蟾魄 晁 杖 拖 瘦 路 鸣 敲 铿 天台 庐阜 著 脚行 中林 稳置 盘陀 石 并 坐 不 与 孤云争 疎 红 叠翠 如 先 有 霜 藤蔓 缘 惊 蛇 走 枝枝叶叶 巧相 搀 岁寒 俱 是 论 心友 庵 前 台上 晴 最嘉 数杯 薄酒 聊随 茶 客 来 劝 主主 劝 客 醉倒 冠履 从 欹 斜 且 道 如今 夸 甚处 见成 不是 虚 排 句 堂 前 新展 假山 诗 约 斋 老子 堂 中 住
a6b7a615-f183-4a46-a96e-8afa17bae2a0,种菊,张镃,唐,诗,七言古体,今年植菊良寡谋 丛萎满望如田畴 黄深白浅欠旌别 未表劲浄专高秋 初移风雨连朝恶 才到暄晴骤开却 铺毡未暇坐观嬉 携筇粗放行吟乐 游蜂冶蝶拨不开 粉趐云动鸣轻雷 霜前姿性本介洁 肯受浼辱宁摧颓 道人犹拣鲜鲜蕊 铜缾换浸重添水 一声清磬晓窗深 香边坐断三千偈 歌缘酒分从束轻 正色已定十种名 来年自种先献佛 不应直为杯中物,"7,7,7,7,7,7,7,7,7,7,7,7,7,7,7,7,7,7,7,7",a5dface28353eafe0466e5e6b8a4e35c,今年 植菊良 寡谋 丛 萎满 望 如 田畴 黄深白 浅 欠 旌别 未表 劲 浄 专 高 秋 初移 风雨 连朝恶 才 到 暄 晴 骤开 却 铺 毡 未暇 坐观 嬉 携 筇 粗放 行吟 乐 游蜂 冶蝶 拨不开 粉 趐 云 动 鸣 轻 雷 霜前 姿性 本介洁 肯受 浼 辱 宁 摧 颓 道人 犹 拣 鲜鲜 蕊 铜 缾 换 浸 重 添水 一声 清磬晓 窗 深 香边 坐断 三千 偈 歌缘 酒分 从束 轻 正色 已 定 十种 名 来年 自种 先献 佛 不应 直为 杯中物
89921977-6ed0-4d76-991a-7727a35cac71,杨秘监为余言初不识谭德称国正因陆务观书方知为西蜀名士继得秘监与国正唱和诗因次韵呈教,张镃,唐,诗,杂言,人心怀感初因喜 感到极时还堕泪 亦犹雕琢用功深 自发诗中平淡意 更须绝处悟一回 方知迷梦唤醒采 今谁得此微妙法 诚斋四集新板开 我尝读之未盈卷 万汇纷纶空里转 君不见严陵使君敛眉头 清虚山水吟两秋 又不见国学先生离文句 变现佛魔麾总去 相逢三翁同肺肠 江西吴蜀如一乡 只怜我似臭革囊 任翁薰染终难香,"7,7,7,7,7,7,7,7,7,7,10,7,10,7,7,7,7,7",6decf48b200207846968e702eb50e702,人 心怀 感初 因 喜 感到 极时 还 堕泪 亦 犹 雕琢 用功 深 自发 诗 中 平淡 意 更 须 绝处 悟 一回 方知 迷梦 唤醒 采 今 谁 得 此 微妙 法 诚 斋 四集 新板 开 我 尝读 之 未 盈 卷 万 汇 纷纶 空里 转 君不见 严陵 使君 敛 眉头 清虚 山水 吟 两 秋 又 不见 国学 先生 离 文句 变现 佛魔 麾总 去 相逢 三 翁 同 肺肠 江西 吴 蜀 如 一乡 只怜 我 似 臭 革囊 任翁 薰染 终难 香
78b58334-f4f0-4696-a32a-d51941a49078,张郎中尤少卿相继过访未果往谢先成古诗寄呈,张镃,唐,诗,七言古体,高标无过张户部 督赋文移多似雨 侵晨径造梦蝶床 冷坐谭诗捐俗语 博闻无过尤少卿 议礼辨析纷如争 破午远到煨芋室 抵掌谈事非今情 梦蝶床前何所有 一盏术汤聊代酒 煨芋室中殊可怜 半椀草茶不直钱 登车出门尚回盼 隣媪巷童惊走看 雪寒水际正萧条 安得驺呼连改观 世上尘劳忙若钻 想欲跳身脱羁绊 只堪告诉向梅花 我是梅花千树伴 春风不觉园中换 刺字交驰烦则乱 狂歌愈见野人真 巨笔掀空合有神,"7,7,7,7,7,7,7,7,7,7,7,7,7,7,7,7,7,7,7,7,7,7,7,7",f44479f758f2757c68c518f7ffba86e5,高标 无过 张 户部 督赋 文移 多 似 雨 侵晨 径造 梦蝶 床 冷 坐 谭诗 捐 俗语 博闻 无过 尤少卿 议礼 辨析 纷如争 破午 远到 煨 芋室 抵掌 谈事 非今 情 梦蝶 床 前何 所有 一盏 术 汤 聊 代酒 煨 芋室 中殊 可怜 半 椀 草 茶 不 直 钱 登车 出门 尚 回盼 隣 媪 巷 童 惊 走 看 雪寒 水际 正 萧条 安得 驺 呼 连 改观 世上 尘劳 忙 若 钻 想 欲 跳身 脱 羁绊 只 堪 告诉 向 梅花 我 是 梅花 千 树伴 春风 不觉 园中 换 刺字 交驰 烦 则 乱 狂歌 愈 见 野人 真 巨笔 掀空合 有神
5d813a0c-078b-4083-80e8-ba2c4c05410d,秋风,张镃,唐,诗,杂言,秋风本自佳 岂直令人悲 连宵天上送好月 我病偶失登楼时 长安城中少人咏 风月似厌空相随 凌晨吹云满虚际 却向山头移雨至 老夫识破不生愁 黄叶阶前从委地 人生三万六千日 何苦区区论得失 定将印绶弃掷归南湖 秋风与我还相娱,"5,5,7,7,7,7,7,7,7,7,7,7,9,7",53928eda54a44a9feb233fb038392fbd,秋风 本自 佳 岂直 令人 悲 连宵 天上 送 好 月 我 病偶 失 登楼 时 长安城 中 少 人咏 风月 似厌空 相随 凌晨 吹云满虚际 却 向 山头 移雨 至 老夫 识破 不生 愁 黄叶 阶 前 从 委地 人生 三万 六千 日 何苦 区区 论 得失 定 将 印绶 弃掷 归 南湖 秋风 与 我 还 相娱
c6e0b7b8-0497-45a4-827f-a0121c9c4818,同魏茂先潘茂洪泛湖终日,张镃,唐,诗,七言古体,天将奇观留东南 波织翡翠山堆蓝 仙庐佛刹互入望 渔篷游舫遥相衔 清愁闭户孤晴色 试逐薰风领佳客 平生行处后杯盘 枯淡自甘先笔墨 放船何处芙蓉开 绿幢翠葆从天来 凌波生尘想遗珮 抚槛徙倚心悠哉 秦关将种身九尺 须绕茶烟闲虎戟 潘君高隠百不知 酒酣慷慨乾坤窄 空蒙暮气收斜阳 柳色转岸参差香 南漪杜鹃易桧海 公子爱客邀举觞 毕逋栖乌噭城上 登车揽辔归相望 乘闲结伴须数来 与往不烦拘定向,"7,7,7,7,7,7,7,7,7,7,7,7,7,7,7,7,7,7,7,7,7,7,7,7",8b3007f32ac20e6ec03c3b0b25de4844,天将 奇观 留 东南 波织 翡翠 山堆 蓝 仙庐 佛刹 互入 望 渔篷 游舫 遥相 衔 清愁 闭 户 孤 晴色 试逐 薰风 领 佳客 平生 行处 后 杯盘 枯淡 自甘 先 笔墨 放船 何处 芙蓉 开 绿 幢 翠 葆 从 天来 凌波 生尘想遗珮 抚 槛 徙倚 心 悠哉 秦关 将 种身 九尺 须 绕 茶 烟闲虎戟 潘 君高 隠 百 不知 酒 酣 慷慨 乾坤 窄 空蒙 暮气 收 斜阳 柳色 转岸 参差 香 南漪 杜鹃 易桧海 公子 爱客 邀举 觞 毕逋栖乌 噭 城 上 登车 揽辔 归 相望 乘闲 结伴 须数 来 与 往 不烦 拘 定向
f60ffab9-80d2-4178-b81f-cee0de5087e2,次茂洪韵,张镃,唐,诗,七言古体,披岚长啸和岩洞 衣汗未冷毛发知 贪奇甘恋足欲驻 拥鼻将返心还疑 清音来贤祇过目 亭下树边俱欠诗 归舆渐受雨沾洒 客盖转适风倾欹 出门倚涧得雄观 放泉出匮供游嬉 勉赓新句未为报 他年共隠非公谁,"7,7,7,7,7,7,7,7,7,7,7,7",1d53d66a64690eedf1a935b7f2791343,披 岚 长啸 和 岩洞 衣汗 未 冷 毛发 知 贪奇甘恋足 欲 驻 拥鼻 将 返心 还疑 清音 来 贤 祇 过目 亭 下 树边 俱 欠 诗 归 舆渐受雨沾洒 客盖 转 适风 倾 欹 出门 倚 涧 得 雄观 放泉 出 匮供 游 嬉 勉 赓 新 句 未 为 报 他 年共 隠 非公 谁
022c0c4b-f643-4c7f-964d-20ac7c11408a,戏赠杨伯时,张镃,唐,诗,杂言,杨侯相逢复见寒梅开 鬓色不带浓霜来 君居山县适近我先垄 夜半应望灵气勃鬰缠崔嵬 去年竹寺倾樽罍 官来急救老眼饥 西枢相公喜人物 搜材剔抉英雄窟 苍松腴硬久阴崖 此亦鹖冠宁肯忽 近闻一饭蒙异恩 快劄好阙休驰奔 我诗安得达相门 春风后日自东起 太岁无缘只桃李,"9,7,9,11,7,7,7,7,7,7,7,7,7,7,7",7510f248c07034c892237b38dae72f00,杨侯 相逢 复见 寒梅 开 鬓色 不 带 浓 霜 来 君居 山县 适近 我 先 垄 夜半 应望 灵气 勃 鬰 缠 崔嵬 去年 竹 寺 倾 樽 罍 官 来 急救 老眼 饥 西枢 相公 喜 人物 搜材 剔 抉 英雄 窟 苍松 腴 硬 久 阴崖 此 亦 鹖 冠 宁肯 忽 近闻 一 饭 蒙异恩 快 劄 好 阙 休 驰 奔 我 诗 安 得 达 相门 春风 后日 自 东起 太岁 无缘 只 桃李
7b3e34e1-b3b0-4bf2-bc93-7b1062c58f9f,以道学谕凤口有感诗写物记事备极词情不容继和矣既辱珍示可无奉酬辄抒鄙怀次韵且名以溪妇吟末章反正不忘风人之义也,张镃,唐,诗,七言古体,人间盛衰理甚明 势去有如汤沃冰 听言一事足叹惋 恐君亦复伤中情 行都赫奕名王第 列屋珠玑多秀慧 主翁五十二本兵 宠冠诸家当盛世 其间属意字以端 姿品高妍兼妙艺 燕开云幄萃亲友 艳阵香藂尝窃睨 转眼陈迹俱已休 西风叶飞东水流 相逢应怪我鬓改 贪情省认俄惊羞 波明藏泪尚剪月 山浅带恨犹横秋 失身何心养儿女 啁啾耳厌山蛮语 困居村店少人沽 饤饾腥咸污盘俎 无言脉脉话最深 为君写作溪妇吟 人生荣悴由分定 有夫不必萌他心,"7,7,7,7,7,7,7,7,7,7,7,7,7,7,7,7,7,7,7,7,7,7,7,7,7,7",3117a0f64329d642e7e359d32b820684,人间 盛衰 理 甚明 势 去 有如 汤沃冰 听言 一事 足 叹惋 恐君 亦 复伤 中情 行 都 赫奕 名王 第 列屋 珠玑 多秀慧 主翁 五十二 本兵 宠冠 诸 家当 盛世 其间 属意 字 以端 姿品 高妍 兼 妙 艺 燕开云 幄 萃 亲友 艳 阵 香 藂 尝 窃 睨 转眼 陈迹 俱 已 休 西风 叶飞东 水流 相逢 应怪 我 鬓 改 贪情 省认 俄 惊羞 波明藏 泪 尚 剪 月 山 浅 带 恨犹横秋 失身 何心养 儿女 啁啾 耳厌山蛮语 困居 村店 少 人 沽 饤 饾腥 咸 污 盘 俎 无言 脉脉 话 最深 为 君 写作 溪妇 吟 人生 荣悴 由 分定 有 夫 不必 萌 他 心
9d67b8df-1c1d-4439-a310-65fddc092e33,赠道士张易,张镃,唐,诗,七言古体,道人生长清淮西 地荒战血孤鬼啼 饱知浊世一朝菌 摆落羁馽全天倪 穿霞踏月半区宇 山水名胜随攀跻 我来欣逢大条左 握手便许论刀圭 蕊珠七言素探讨 敷析秘奥开群迷 绵绵玄牝斡两曜 夜半虚室腾虹霓 同居蜀客话清简 物理返笑庄生齐 坳堂烛暗坐顷刻 石头路浄缘高低 倾壶随意荐岩果 不假沆瀣求交梨 他年相就养灵液 肯复自弃沦尘泥 蓬洲阆苑恣游宴 有句更继肩吾题,"7,7,7,7,7,7,7,7,7,7,7,7,7,7,7,7,7,7,7,7,7,7",438079123e76b39992113ac13c7131f9,道人 生长 清淮西 地荒 战血 孤鬼 啼 饱知 浊世 一朝 菌 摆落 羁 馽 全天 倪 穿 霞 踏月 半 区宇 山水 名胜 随 攀 跻 我 来 欣逢 大条 左 握手 便 许论 刀 圭 蕊 珠 七言 素 探讨 敷析 秘奥 开群迷 绵绵 玄 牝斡 两 曜 夜半 虚室 腾 虹霓 同居 蜀 客 话 清 简 物理 返笑 庄生齐 坳 堂 烛 暗 坐 顷刻 石头路 浄 缘 高低 倾壶 随意 荐 岩果 不 假 沆瀣 求交 梨 他 年 相 就 养 灵液 肯复 自弃 沦尘 泥 蓬洲 阆苑 恣 游宴 有 句 更 继肩 吾 题
bacfb9df-1220-4055-85ee-61bd66e3a149,一日,张镃,唐,诗,杂言,一日不炷香 已若神不清 一日不觅句 更觉身不轻 是身天地间 假物舒其情 君看屐与锻 自可了一生 世上纷纷蛮与触 两眼看渠怜不足 炉烟未断诗已成 更肯愁吟头白曲,"5,5,5,5,5,5,5,5,7,7,7,7",2f3664df80439292bdbb6ec4f66fab7b,一日 不 炷 香 已 若神不清 一日 不 觅句 更 觉身 不轻 是 身 天地间 假物 舒 其 情 君 看 屐 与 锻 自 可 了 一生 世上 纷纷 蛮 与 触 两 眼看 渠怜 不足 炉烟 未断 诗 已成 更 肯愁 吟头 白曲
c311e8b6-bac2-4977-b41e-a7e0407bfb77,次叔祖阁学暑中过清寒堂韵,张镃,唐,诗,七言古体,人材抡选何时停 高者栋负卑薪蒸 我家忠烈定社稷 任大岂但惩与膺 不毛夏渡泸潍水 裂面夜踏滹沱冰 强敌坐致九顿首 和议姑随三折肱 至今耆旧话曩昔 白发相对搔鬅鬙 堂堂传业翁克绍 中宸委寄恩重仍 禁林延阁望隆积 边琐辅镇才优胜 知闲未数持烛照 神专端与承蜩凝 会堂风云趣健步 人则父子功侪朋 从容中的仰文翰 仁者如射弓须弸 为山簷外六月冷 兴到不忍无诗登 袖归镃得正法眼 此事肯许参禅僧,"7,7,7,7,7,7,7,7,7,7,7,7,7,7,7,7,7,7,7,7,7,7,7,7",919cc467d7468621e1c4df0850971eab,人材 抡 选 何时 停 高者 栋负卑薪蒸 我家 忠烈 定 社稷 任大 岂但 惩与 膺 不毛 夏渡 泸潍 水 裂面 夜踏 滹沱 冰 强敌 坐致 九 顿首 和议 姑 随 三折肱 至今 耆 旧 话 曩 昔 白发 相对 搔 鬅 鬙 堂堂 传业 翁克绍 中宸 委 寄 恩重 仍 禁 林延阁 望隆 积 边 琐 辅 镇 才 优胜 知闲未数 持 烛照 神 专端 与 承 蜩 凝 会堂 风云 趣 健步 人则 父子 功侪 朋 从容 中 的 仰 文翰 仁者 如射 弓须 弸 为 山簷 外 六月 冷 兴到 不忍 无 诗 登 袖 归 镃 得 正 法眼 此事 肯许 参禅 僧
