id,title,author,dynasty,genre,poem_type,sentences_simplified,meter_pattern,hash,words
a585877c-27ca-429f-b17d-1e5a2f2cd2a6,和茅亦山韵二首  其二,黄庚,唐,诗,五言律诗,爱静吟成僻 躭书近欲痴 事多因错省 节不为贫移 长物新添画 生涯旧有诗 穷通系天命 知命复何疑,"5,5,5,5,5,5,5,5",eb00c032d3d31f7afdb7ceb9d0ecdac9,爱静 吟 成僻 躭 书 近 欲 痴 事 多 因 错省 节不为 贫移 长 物 新添 画 生涯 旧有 诗 穷通 系 天命 知命 复 何疑
8cb4d9ce-7723-4bfd-9d9d-4043ef29995b,题严子陵,黄庚,唐,诗,五言律诗,故人虽即位 自不愿为官 天下事已定 山中人可闲 一丝江月色 千古客星寒 捷径终南士 闻风定报然,"5,5,5,5,5,5,5,5",8a2f59d06a329df017715ba5e7c1f2c5,故人 虽 即位 自不愿 为官 天下事 已 定 山中 人 可 闲 一丝 江 月色 千古 客星 寒 捷径 终南 士 闻风 定报 然
48955e0d-4547-4f8e-93db-f53b004e3ad9,除夕,黄庚,唐,诗,五言律诗,爆竹惊残腊 冬春此夕分 且斟分岁酒 懒赋送穷文 客思愁簷雨 乡心逐海云 阳和在何处 明日问东君,"5,5,5,5,5,5,5,5",d7ed7e033040033aed4058c6968417d2,爆竹 惊残腊 冬春 此夕 分 且 斟 分岁 酒 懒 赋 送 穷 文 客思 愁簷雨 乡心 逐 海云 阳 和 在 何处 明日 问 东君
4511fe07-2cc5-4786-ae66-3471999125e0,和郑梅深,黄庚,唐,诗,五言律诗,江湖新识面 恰似旧相知 腹贮三余学 才工十咏诗 声名苏太史 家世郑当时 客路携琴去 终须遇子期,"5,5,5,5,5,5,5,5",f9d60e1a23bc4b7daa67dfec6d7b5295,江湖 新识面 恰似 旧 相知 腹 贮 三余 学 才工 十 咏诗 声名 苏 太史 家世 郑 当时 客路 携琴 去 终须 遇 子期
7d8ed49e-6246-42cf-b914-21e373d818be,即事,黄庚,唐,诗,五言律诗,雀罗门户静 无客扣柴扃 索句髭先白 看书眼尚青 云粘题石壁 月浸汲泉瓶 笑杀利名客 沉酣死不醒,"5,5,5,5,5,5,5,5",33f72812469248e90dab3f6231c7c54f,雀罗 门户 静 无 客扣 柴 扃 索 句 髭 先 白 看书 眼尚 青 云 粘题 石壁 月 浸 汲泉 瓶 笑 杀 利名 客 沉酣 死 不醒
2675ecfe-8652-4ade-a70d-d683d8f7b39c,对客,黄庚,唐,诗,五言律诗,窗下篝灯坐 相看白发新 共谈为客事 同是异乡人 诗写梅花月 茶煎谷雨春 明朝愁远别 离思欲沾巾,"5,5,5,5,5,5,5,5",1047bb61018bbee6c56bb6e8f0306fb0,窗下 篝灯 坐 相看 白发 新 共 谈为 客事 同 是 异乡人 诗 写 梅花 月 茶 煎 谷雨春 明朝 愁 远别 离思欲沾巾
90cc6fc9-2a48-4753-bf22-1980862289f5,寒夜呈梅深,黄庚,唐,诗,五言律诗,空斋对孤客 寂寞似僧家 炉冷频烧叶 灯昏不吐花 夜长添睡思 岁晚忆年华 吟倦推窗坐 梅簷月未斜,"5,5,5,5,5,5,5,5",33a710ec44bb988bb658936918eab237,空斋 对 孤客 寂寞 似 僧家 炉 冷 频烧叶 灯昏不吐花 夜长 添 睡 思 岁晚 忆 年华 吟倦 推窗 坐 梅簷 月 未 斜
13600e6c-18ea-4a07-9a05-71e08bcde0e2,林霁山架阁同宿山中,黄庚,唐,诗,五言律诗,秋风山馆客 移席近灯前 共语忽深夜 相看非少年 斗垂天末树 鳞出雨余天 亦有茅簷下 饭牛人未眠,"5,5,5,5,5,5,5,5",dcf4bd9d0a5b2e03c9cb4419fecbf522,秋风 山馆 客 移席 近 灯 前 共语 忽 深夜 相看 非 少年 斗 垂 天 末 树 鳞 出 雨 余天 亦 有 茅簷 下 饭 牛 人 未眠
6891138d-5a5d-48be-86d1-c9d276fbd9aa,游东庵,黄庚,唐,诗,五言律诗,庵连兜率寺 三径竹边开 林密暑不到 窗虚月自来 暮山啼鸟静 云树啸猿哀 拂拭残碑字 年深半绿苔,"5,5,5,5,5,5,5,5",41ba4ba37a8b8c48fea83ba041289a3a,庵 连 兜率 寺 三 径 竹 边 开 林密暑 不到 窗虚 月 自来 暮 山 啼 鸟 静 云树啸 猿 哀 拂拭 残 碑 字 年 深半 绿苔
7bc3fc6c-b974-4640-9ceb-6552bf7a5b43,赠了上人抄化,黄庚,唐,诗,五言律诗,破衲卷秋云 入山深更深 近闻营梵刹 应不累禅心 寒瀑泻苍壁 晚花生古林 遥思明月夜 谁听颖师琴,"5,5,5,5,5,5,5,5",0f1cd0f9dcb3a2e4be0435d4bd2662ec,破 衲 卷 秋 云 入山 深 更深 近闻 营 梵刹 应不累 禅心 寒 瀑 泻 苍壁 晚 花生 古林 遥 思明 月夜 谁 听 颖 师琴
67aeea87-ca64-4d42-8cb0-2332561e852b,呈茅一斋先生,黄庚,唐,诗,五言律诗,前辈凋零尽 如公尚典型 为僧眉独白 见客眼长青 教子成三俊 传家有六经 我来问奇字 应许扣柴扃,"5,5,5,5,5,5,5,5",57f1031e6134d4fad3dfb282333d7242,前辈 凋零 尽 如 公尚 典型 为 僧 眉 独白 见 客眼 长青 教子 成三俊 传家 有 六经 我 来 问 奇 字 应许 扣 柴 扃
1b2f99fa-0a7a-400f-a70b-bd01bd76dc62,别徐敬菊,黄庚,唐,诗,五言律诗,契阔又两载 光阴一掷梭 祇因离别久 不觉语言多 安得长留此 其如欲去何 诗盟终未冷 早晚更相过,"5,5,5,5,5,5,5,5",526e15bda65be95d24231c415dc057e4,契阔 又 两载 光阴 一 掷 梭 祇 因 离别 久 不觉 语言 多 安 得 长留 此 其 如欲去何 诗盟 终未 冷 早晚 更 相过
fe6ac168-8cc6-47c7-9c4d-3598fce8c9f3,寄姜仕可,黄庚,唐,诗,五言律诗,独学苦无友 年来媿广文 怀贤歌伐木 忆别赋停云 病后少出户 梦中多见君 盍簪须有日 却与共论文,"5,5,5,5,5,5,5,5",d4483778bb332398805acee9c9ad0d6f,独学苦无友 年 来 媿 广 文 怀贤歌 伐木 忆别赋 停 云 病 后 少 出户 梦 中 多 见 君 盍 簪须 有 日 却 与 共 论文
31346a57-d781-4d6b-9605-a2fa7a10e851,寄月山太守,黄庚,唐,诗,五言律诗,下车方数月 早已政声驰 太守一身瘦 东川百姓肥 勤劳惟听政 闲暇即吟诗 官况依然在 何须赋式微,"5,5,5,5,5,5,5,5",c87234394aa0df3560e5b20b2a4cfcd3,下车 方 数月 早已 政声 驰 太守 一身 瘦 东川 百姓 肥 勤劳 惟 听政 闲暇 即 吟诗 官况 依然 在 何须 赋 式微
315ffb7b-36a4-4091-92a0-ae788b8d5e17,岁晚书怀呈月山太守,黄庚,唐,诗,五言律诗,光阴催我老 衰病亦堪怜 残腊不多日 余生能几年 有为俱是妄 无事即成仙 近得安心法 蒲团学坐禅,"5,5,5,5,5,5,5,5",ab7734bab99585fa4971556a5080c121,光阴 催 我 老 衰病 亦 堪怜 残 腊 不 多日 余生 能 几年 有 为 俱 是 妄 无 事 即 成仙 近 得 安心 法 蒲团 学 坐禅
eab6cae5-870d-4b05-a5c5-a0de2a6ab5bf,鹤林仙坛寺,黄庚,唐,诗,五言律诗,古坛归鹤杳 野鹿自成群 岚气浮清晓 钟声出白云 树穿僧屋老 水到寺门分 人世无穷事 山中了不闻,"5,5,5,5,5,5,5,5",329eaeb096aadf565dee15ba1a384076,古坛 归鹤杳 野鹿 自成 群 岚 气浮 清晓 钟声 出 白云 树 穿 僧屋 老 水 到 寺门 分 人世 无穷 事 山中 了 不 闻
24386e1e-85da-4018-b517-1ee9591352e6,枕易,黄庚,唐,诗,七言律诗,古鼎烟销倦点朱 翛然高卧夜寒初 四簷寂寂半床梦 两鬓萧萧一卷书 日月冥心知代谢 阴阳回首验盈虚 起来万象皆吾有 收拾乾坤在草庐,"7,7,7,7,7,7,7,7",1121664bbc2a8416f3885dc5772ff9c6,古鼎 烟销 倦点 朱 翛 然 高卧 夜寒 初 四 簷 寂寂 半床 梦 两鬓 萧萧 一卷 书 日月 冥心知 代谢 阴阳 回首 验 盈虚 起来 万象 皆 吾 有 收拾 乾坤 在 草庐
c60ba7be-f971-4aca-bfeb-35987eaf1a78,棋声,黄庚,唐,诗,七言律诗,何处仙翁爱手谈 时闻剥啄竹林间 一枰子玉敲云碎 几度午窗惊梦残 缓著应知心路远 急围不放耳根闲 烂柯人去收残局 寂寂空亭石几寒,"7,7,7,7,7,7,7,7",43eeccff57b78621dcaec36963d5fc70,何处 仙翁 爱 手谈 时闻 剥啄 竹林 间 一 枰 子玉 敲云碎 几度 午窗 惊梦 残 缓著 应 知心 路 远 急围 不放 耳根 闲 烂 柯 人 去 收 残局 寂寂 空亭 石几寒
19e919a6-17fc-4ac0-980e-768f5b594a57,题李蓝溪梅花吟卷,黄庚,唐,诗,七言律诗,孤芳不与众芳同 肯媚东君事冶容 寒苦一生苏武雪 清高千古伯夷风 琼瑶照树偏宜晚 铁石盘根却耐冬 几度看花立霜晓 断肠都在角声中,"7,7,7,7,7,7,7,7",9be55b0386a93e1573467e56798fa7e2,孤芳 不 与 众芳同 肯媚 东君 事 冶容 寒苦 一生 苏武 雪 清高 千古 伯夷风 琼瑶 照树 偏宜 晚 铁石 盘根 却 耐 冬 几度 看 花立霜 晓 断肠 都 在 角声 中
8f05fb01-f9a7-48d3-9b1e-da204b63638b,秋夜,黄庚,唐,诗,七言律诗,博山香冷夜将阑 红影摇窗烛未残 庭树露浓花气湿 井梧风老叶声干 世情冷暖知心少 朋旧东西会面难 一段客愁吟不就 无言背月倚阑干,"7,7,7,7,7,7,7,7",4f75bd1060e41371a2a6b16992cf9777,博山 香冷 夜 将 阑 红影 摇窗烛未残 庭树 露 浓花气湿 井梧 风 老叶 声干 世情 冷暖 知心 少 朋旧 东西 会面 难 一段 客 愁 吟 不 就 无言 背 月 倚 阑干
9145d148-94ab-41fd-8ec3-b8a608572e01,秋夜和月山韵,黄庚,唐,诗,七言律诗,凉夜残灯照客愁 衾单添尽鹔鹴裘 半窗明月三更梦 一枕西风两鬓秋 吟骨棱棱宽带眼 归心切切望刀头 何时束箧家山去 独驾柴车访伯休,"7,7,7,7,7,7,7,7",68dbf260057e451b0142105ef015c35d,凉夜 残灯 照客 愁 衾 单 添 尽 鹔 鹴 裘 半窗 明月 三 更 梦 一 枕 西风 两鬓 秋 吟 骨 棱 棱 宽带 眼 归心 切切 望 刀头 何时 束 箧 家 山 去 独驾 柴车 访 伯休
bcfa4d5c-e24b-4c9d-a013-11e0e19050f4,兰亭会饮观晋帖,黄庚,唐,诗,七言律诗,祇说清谈晋业虚 兰亭之乐后来无 一时人物已陈迹 千古山林空画图 钟带夕阳来远寺 碑和春雨卧平芜 昭陵玉匣犹难保 笔意从谁认鼠须,"7,7,7,7,7,7,7,7",4b6bc14c72f8f6b0fe0b944b930ae33e,祇 说 清谈 晋业 虚 兰亭 之 乐 后来 无 一时 人物 已 陈迹 千古 山林 空 画图 钟带 夕阳 来 远 寺 碑 和 春雨 卧平芜 昭陵 玉匣 犹 难保 笔意 从 谁 认鼠 须
625ea23d-7c6a-4b55-b1b7-2ede4359b2b8,春游次王修竹监簿韵,黄庚,唐,诗,七言律诗,天色新晴带薄寒 主人饮客出城关 兰亭觞咏寻羲帖 窆石衣冠吊禹山 春水断桥芳草碧 晓风啼鸟落花闲 囊中诗句壶中酒 何必仙人大小还,"7,7,7,7,7,7,7,7",f5d50e2e1fd494cf27e2abc00b28a515,天色 新 晴带 薄寒 主人 饮客 出 城关 兰亭 觞 咏寻 羲 帖 窆 石 衣冠 吊 禹山 春水 断桥 芳草 碧 晓风 啼 鸟 落花 闲 囊中 诗句 壶 中 酒 何必 仙人 大小 还
e112ba7c-3c28-4186-bb4c-1c0c6406bbf4,修竹宴客东园,黄庚,唐,诗,七言律诗,二月春光泼眼浓 携樽宴客小亭东 酒当半醉半醒处 春在轻寒轻暖中 拂槛柳添吟鬓绿 压阑花妬舞衣红 晚来听唱梁州曲 声绕吴姬扇底风,"7,7,7,7,7,7,7,7",6d9c00efe6a2373c5fe2de614718e521,二月 春光 泼眼 浓 携 樽 宴客 小亭 东 酒 当半 醉 半醒 处 春在 轻寒 轻暖 中 拂 槛 柳添吟 鬓 绿 压 阑 花 妬 舞 衣 红 晚来 听唱 梁州 曲 声 绕 吴姬 扇 底 风
4a27f71c-a127-4d88-8fe6-edc47f409a3e,书怀,黄庚,唐,诗,七言律诗,刚肠不挠是男儿 舌在囊中岂足悲 落落世情难苟合 徨徨客路欲何之 旧时风月堪遗恨 好处江山尚欠诗 莫把闲愁萦素抱 人生双鬓易成丝,"7,7,7,7,7,7,7,7",44f17098407a7c26bae5c8b81f2ea775,刚肠不挠 是 男儿 舌 在 囊中 岂足悲 落落 世情 难 苟合 徨 徨 客 路欲何 之 旧时 风月 堪 遗恨 好处 江山 尚 欠 诗 莫 把 闲愁 萦 素 抱 人生 双鬓 易成丝
69904467-54da-4c09-80d2-214c12b317e2,送张伯威提举,黄庚,唐,诗,七言律诗,人生聚散等浮沤 忆昔过从与胜游 棋局敲残清夜月 菊花吟老半窗秋 客中送客难为别 山外看山总是愁 回首片帆江路远 疏烟斜雨到西州,"7,7,7,7,7,7,7,7",dd1aa87e568c2db7e86af01237e1463f,人生 聚散 等 浮 沤 忆昔 过从 与 胜游 棋局 敲 残 清夜 月 菊花 吟 老 半 窗秋 客 中 送客 难为 别 山外 看 山 总是 愁 回首 片帆 江路 远 疏烟 斜雨 到 西州
b8930028-1e74-42b5-a43e-1393cab72cf6,春日即事,黄庚,唐,诗,七言律诗,园林芳事渐阑珊 客思无聊午梦残 红杏花繁蜂蜜饱 碧芹香老燕泥干 光阴有限鬓已白 勋业无成心尚丹 倚遍吟阑天欲暮 一帘风雨卷青春,"7,7,7,7,7,7,7,7",491fdc2df75b051a39fcd4557b6033e6,园林 芳 事 渐 阑珊 客思 无聊 午 梦 残 红 杏花 繁 蜂蜜 饱 碧芹 香老燕 泥 干 光阴 有限 鬓 已 白 勋业 无 成心 尚丹 倚遍吟阑天欲暮 一 帘 风雨 卷 青春
60a6f1e8-f4e1-45c5-8222-52512311368d,小酌,黄庚,唐,诗,七言律诗,小酌园林酒半醺 落红影里惜余春 插花归去蜂随帽 傍柳行来鶑避人 白发尚为千里客 黄金难铸百年身 何时归赋沧浪水 澣我征衣万斛尘,"7,7,7,7,7,7,7,7",745c741c428c4dbae03cf4c843c33d9a,小酌 园林 酒 半醺 落 红影 里 惜 余春 插花 归去 蜂 随 帽 傍 柳 行 来 鶑 避 人 白发 尚为 千里 客 黄金 难 铸 百年 身 何时 归赋 沧浪 水 澣 我 征衣 万 斛 尘
04e191b0-cb27-4e44-9ce3-693e60d28c27,城南即事,黄庚,唐,诗,七言律诗,支筇破晓出南城 古寺凄迷草自生 几处亭台空锁钥 百年人物尽丘茔 雕梁语燕应无主 废圃残花似有情 世事转头皆梦境 浮生何用苦营营,"7,7,7,7,7,7,7,7",fdcf7aed0c16a20e2f67468423ec77aa,支 筇 破晓 出 南城 古寺 凄迷 草 自生 几处 亭台 空 锁钥 百年 人物 尽 丘茔 雕梁 语燕应无主 废圃 残花 似 有情 世事 转头 皆 梦境 浮生 何用 苦 营营
abd634c7-2e47-4668-bc68-940f83eb7bec,夜坐次林梅山韵,黄庚,唐,诗,七言律诗,人倚幽窗夜未阑 竹炉灰冷篆烟残 一天露气星辰湿 万壑风声草木寒 老去客怀多感慨 年来世事转艰难 何时归隠孤山下 明月梅花约共看,"7,7,7,7,7,7,7,7",d7516b19c0a324d19d7827415ae474ff,人 倚 幽 窗 夜 未 阑 竹 炉灰 冷 篆 烟 残 一天 露气 星辰 湿 万 壑 风声 草木 寒 老 去 客怀 多 感慨 年 来 世事 转 艰难 何时 归 隠 孤山 下 明月 梅花 约 共 看
0c457c4f-2216-4c58-8950-1e8c6be590d0,有感,黄庚,唐,诗,七言律诗,自叹文章不遇时 平生壮志与心违 十年湖海无家住 千里乡关有梦归 残夜月寒灯晕淡 高秋天阔雁声微 伤今思古愁无奈 老泪斑斑湿客衣,"7,7,7,7,7,7,7,7",8c14a65a6c7ddf529b1d3302e5b91560,自叹 文章 不 遇 时 平生 壮志 与 心 违 十年 湖海 无 家住 千里 乡关 有 梦 归 残夜 月 寒灯 晕淡 高 秋天 阔 雁 声 微 伤 今 思古 愁 无奈 老泪 斑斑 湿 客衣
2dd7ed46-446a-4296-a561-9cd4c41f47f1,即事,黄庚,唐,诗,七言律诗,蝇头蜗角两无营 心地宽闲景亦清 山色浅深分远近 云容舒卷弄阴晴 晓窗对菊思元亮 秋佩纫兰效屈平 独倚西风凝望眼 一行雁影夕阳明,"7,7,7,7,7,7,7,7",8137f9b20762ece290bf68d1ececd5dd,蝇头蜗角 两 无营 心地 宽 闲景 亦 清 山色 浅 深 分 远近 云容 舒卷 弄 阴晴 晓窗 对 菊 思元亮 秋佩纫兰 效屈 平 独倚 西风 凝望 眼 一行 雁影 夕阳 明
aa598642-57d6-4d4c-8ab9-bc685fb0da46,生朝自述,黄庚,唐,诗,七言律诗,都道人生七十稀 老逢初度叹衰迟 飞觞醉月贫无酒 走笔迎春富有诗 憔悴自怜蒲柳质 劬劳空起蓼莪思 门无贺客清如水 独对兰花诵楚辞,"7,7,7,7,7,7,7,7",2241945f3e1bc19b2f8c3ffd7c0333cd,都 道 人生七十 稀 老逢 初度 叹 衰迟 飞觞 醉 月 贫 无 酒 走笔 迎春 富有 诗 憔悴 自怜 蒲柳 质 劬劳 空起 蓼 莪 思 门 无 贺客 清 如 水 独对 兰花 诵 楚辞
dbafa1c3-f1e6-4f84-ae8c-50544e77f311,雪,黄庚,唐,诗,七言律诗,片片随风整复斜 飘来老鬓觉添华 江山不夜月千里 天地无私玉万家 远岸未春飞柳絮 前村破晓压梅花 羔羊金帐应粗俗 自掬水泉煮石茶,"7,7,7,7,7,7,7,7",a35cf717db66d289070d0a86ec8ec459,片片 随风 整复 斜 飘来 老鬓 觉添 华 江山 不 夜月 千里 天地 无私 玉 万家 远岸 未春 飞 柳絮 前村 破晓 压 梅花 羔羊 金帐 应 粗俗 自 掬水 泉 煮 石 茶
0762c662-9702-4506-b1fd-a139f53ca0d3,九日客怀,黄庚,唐,诗,七言律诗,乌帽斜欹白发侵 老来空忆旧登临 一枝黄菊西风泪 数亩苍苔故国心 梧颤秋声庭露冷 雁传寒信塞云深 不须贳酒酬佳节 只把陶诗细细吟,"7,7,7,7,7,7,7,7",4154549a71a65dcd4159cda59f2ff7ab,乌帽 斜 欹 白发 侵 老来 空 忆旧 登临 一枝 黄菊 西风 泪 数亩 苍苔 故国 心 梧颤 秋声 庭露 冷 雁传寒 信塞 云深 不须 贳 酒 酬 佳节 只 把 陶诗 细细 吟
bf53fa01-cd5f-4e5c-8763-50af2164a178,舟次樗蒱庙,黄庚,唐,诗,七言律诗,短棹冲寒过浦东 扁舟一叶载诗翁 断烟流水残云外 古木荒祠夕照中 吟罢小楼何处笛 酒醒孤枕半江风 潮生潮落朝还暮 堪叹人生自转蓬,"7,7,7,7,7,7,7,7",c833bc3be53a849c421e5ad865f653e9,短 棹 冲 寒 过 浦东 扁舟 一叶 载 诗翁 断烟 流水 残云 外 古木荒 祠 夕照 中 吟 罢 小楼 何处 笛 酒醒 孤枕半江风 潮生 潮落 朝 还 暮 堪叹 人生 自转 蓬
3bef9dcf-de12-485d-b901-1d04b30fc1d6,月夜登楼,黄庚,唐,诗,七言律诗,玉宇澄清暮霭收 吟边怕倚仲宣楼 寒蟾千里夜如昼 新雁一声天欲秋 湖海谁青豪杰眼 风霜易白少年头 更残忽听荒城角 吹老梅花总是愁,"7,7,7,7,7,7,7,7",6cfb90405f6217c55efea08ee11fa3e0,玉宇 澄清 暮霭 收 吟 边 怕 倚 仲宣楼 寒 蟾 千里 夜 如 昼 新 雁 一声 天欲秋 湖海 谁 青 豪杰 眼 风霜 易白 少年 头 更 残 忽 听荒 城角 吹 老 梅花 总是 愁
06555fc6-eee2-433f-932a-d47980e215ca,送慈州茅主簿入道,黄庚,唐,诗,七言律诗,儒冠不戴戴星冠 人世荣华作梦看 谱出三茅终得道 趣同五柳早休官 月寒缑岭来笙鹤 春蔼慈州忆枳鸾 笑指方壶最深处 凌空霞珮玉珊珊,"7,7,7,7,7,7,7,7",aa8aaf740e893824eaff1c8eb9b55d3d,儒冠 不 戴 戴星冠 人世 荣华 作梦 看 谱 出三茅 终得道 趣 同 五 柳 早 休 官 月 寒 缑 岭 来 笙 鹤 春蔼 慈州忆 枳鸾 笑 指 方壶 最深处 凌空 霞珮玉 珊珊
2fda9f43-706e-4eb7-a02a-accee3eae5c2,月夜次修竹韵,黄庚,唐,诗,七言律诗,徙倚吟阑傍野塘 古谯莲漏滴更长 月阶夜静蛩声切 竹院秋深鹤梦凉 坐挹水风侵袂冷 眠分花露满身香 浩歌欲溯明河去 醉唤天孙织锦囊,"7,7,7,7,7,7,7,7",702a30e1039924cf481c90fd302b48d5,徙倚 吟 阑 傍 野塘 古谯莲 漏 滴 更 长 月 阶 夜静 蛩 声 切 竹院 秋深鹤 梦 凉 坐 挹 水 风 侵 袂 冷 眠 分 花露 满身 香 浩歌 欲 溯 明河 去 醉唤 天 孙 织锦 囊
068e89c9-de45-4055-9f0d-8d5515149b2d,寓浦东书怀,黄庚,唐,诗,七言律诗,子规声里已非春 消遣光阴只苦吟 肘后无方医白发 床头有易胜黄金 年来不作功名梦 老去全休富贵心 独抱焦桐游海角 纷纷俗耳少知音,"7,7,7,7,7,7,7,7",19765a88900a6b4cd30cc4aaf0e82a68,子规 声 里 已非 春 消遣 光阴 只 苦吟 肘 后 无方 医 白发 床头 有易 胜 黄金 年来 不 作 功名 梦 老 去 全休 富贵 心 独抱 焦桐 游 海角 纷纷 俗耳少 知音
e28ccfa6-8b4e-40d9-863a-c5b5ba5cef6a,呈营田司杜希圣提领,黄庚,唐,诗,七言律诗,行李担书一鹤随 莲香𢅏幕政声驰 山川太史九州记 桑稼豳风七月诗 如晦箕裘传相种 少陵衣钵付孙枝 谋身儒术谁云拙 尧舜君民正此时,"7,7,7,7,7,7,7,7",607cfc00f9e9b0a97db1b2076df42e05,行李 担书 一 鹤 随 莲香 𢅏 幕 政声 驰 山川 太史 九州 记 桑稼 豳 风 七月 诗 如 晦 箕裘 传相 种 少陵 衣钵 付孙枝 谋身 儒术 谁 云 拙 尧舜 君民正 此时
ad4a15b9-d4d4-4f33-b062-97c1dcf17e7c,寄毛素轩宣慰,黄庚,唐,诗,七言律诗,旌麾曾驻鉴湖边 别去匆匆又两年 清夜梦分千里月 同乡人各一方天 素知心事有鸥在 欲寄音书无雁传 见说使星临浙右 明朝便买渡江船,"7,7,7,7,7,7,7,7",a44d646df731d194b6f3dd0bb8d9f243,旌 麾曾 驻 鉴湖 边 别 去 匆匆 又 两年 清夜 梦分 千里 月 同乡 人 各 一方 天 素知 心事 有 鸥 在 欲 寄 音书 无 雁传 见 说 使 星 临 浙 右 明朝 便 买 渡江 船
c2be117f-a1ea-4020-83c8-71807812c864,酒趣,黄庚,唐,诗,七言律诗,浊醪妙理契心期 小瓮新𥬠香满巵 闲里一生长是醉 饮中三昧有谁知 幕天席地忘形处 枕曲眠糟得意时 此味灵均应未解 独醒到死欲何为,"7,7,7,7,7,7,7,7",0eaca459620ebc00571aaa928f68ea62,浊 醪 妙理 契心 期 小 瓮 新 𥬠 香 满 巵 闲 里 一 生长 是 醉 饮 中 三昧 有 谁知 幕天席地 忘形 处 枕曲 眠 糟 得意 时 此 味 灵均 应 未 解 独醒 到 死 欲 何为
8dadf9ac-03ed-46c8-b174-d7b5da069b6a,秋怀,黄庚,唐,诗,七言律诗,雨里西风已倦游 老怀悲感不禁秋 世无阮籍谁青眼 今有杜陵人白头 雁摆行知兄弟义 燕营巢为子孙谋 谁怜湖海飘蓬客 只影孤灯相对愁,"7,7,7,7,7,7,7,7",387d3e0bcea7c660d58abaf907131ea9,雨 里 西风 已 倦游 老怀 悲感 不禁 秋 世 无 阮籍 谁 青眼 今 有 杜陵 人 白头 雁 摆行 知 兄弟 义 燕营巢 为 子孙 谋 谁 怜 湖海 飘蓬 客 只 影 孤灯 相对 愁
900ed937-6c22-4c40-ad59-c6287ea7d6a5,偶书,黄庚,唐,诗,七言律诗,频年踪迹堕江湖 三径荒苔忆旧庐 身老方知生计拙 家贫渐觉故人疏 松薪拾去朝炊黍 渔火分来夜读书 怨鹤惊猿应待我 台山何日赋归欤,"7,7,7,7,7,7,7,7",4947d31ac47ae3a2f3ca2516b265abb5,频年 踪迹 堕 江湖 三 径 荒 苔 忆旧 庐 身 老 方知 生计 拙 家贫 渐觉 故人 疏 松薪 拾去 朝 炊 黍 渔火 分来夜 读书 怨鹤惊猿应待 我 台山 何日 赋归 欤
f1e6306a-5e3c-4845-b1d0-e5bfdb22aa09,观史,黄庚,唐,诗,七言律诗,梧风萧瑟雨初晴 凉入书堂夜气清 耿耿兰膏照千古 迟迟莲漏转三更 力于兴废应难助 气为忠邪几不平 掩卷长嗟方就枕 窗前咿喔又鸡鸣,"7,7,7,7,7,7,7,7",935228f0567af0b8c21b226ca909f7e8,梧风 萧瑟 雨初晴 凉入 书堂 夜气 清 耿耿 兰膏 照 千古 迟迟 莲 漏转 三 更 力于 兴废 应 难助 气 为 忠 邪 几 不平 掩卷 长嗟方 就 枕 窗前 咿喔 又 鸡鸣
f854db91-40a3-414a-b0f1-ee56534f22cb,暮春,黄庚,唐,诗,七言律诗,寂寞园林三月时 客中几度见春归 柳眉绿皱鶑无语 花脸红销蝶倦飞 节物暗催双鬓老 功名长与寸心违 百年身世成何事 回首西山又落晖,"7,7,7,7,7,7,7,7",a44dab78ad3190f66c0625c479e4c3ef,寂寞 园林 三月 时 客 中 几度 见 春 归 柳眉 绿 皱 鶑 无 语 花 脸红 销蝶 倦 飞 节物 暗 催 双鬓 老 功名 长 与 寸心 违 百年 身世 成 何事 回首 西山 又 落晖
e4466819-acf0-4a3b-b16d-2d84f140ab78,对月,黄庚,唐,诗,七言律诗,万里无云天宇宽 十分秋色上楼看 月浮沧海蟾光湿 星落明河象纬寒 醉后尽教诗笔健 吟边莫放酒杯干 一声长笛知何处 愁杀夜深人倚阑,"7,7,7,7,7,7,7,7",92629ac0b212aee5844e1394ab36c2a3,万里无云 天宇 宽 十分 秋色 上楼 看 月 浮 沧海 蟾光 湿 星 落明 河象 纬寒 醉 后 尽 教诗 笔健 吟 边 莫放 酒杯 干 一声 长笛 知 何处 愁 杀 夜深 人 倚 阑
c222d562-1353-445c-b1b9-a682cdb54e9a,秋夜,黄庚,唐,诗,七言律诗,十分秋色满轩窗 景物凄清夜气凉 筛月帘栊金琐碎 捣霜砧杵玉丁珰 井梧叶脱无多影 岩桂花稠不断香 坐到更深吟兴动 砚池滴露写诗狂,"7,7,7,7,7,7,7,7",54f5003b24a8458797dd8e4e4bc6fd14,十分 秋色 满轩 窗 景物 凄清 夜气 凉 筛 月 帘 栊 金 琐碎 捣 霜 砧杵 玉 丁珰 井梧 叶 脱无多影 岩 桂花 稠 不断 香 坐 到 更深 吟 兴动 砚池 滴露 写诗 狂
26ceaa0d-b284-4741-a114-c9caccb2683b,寓舍即事,黄庚,唐,诗,七言律诗,矮屋编茅槿缚篱 诗人住处恰相宜 万间突兀梦不到 一室凄清心自知 窗下无灯童睡早 林间有月鹤归迟 八荒便作庭除看 南北东西任所之,"7,7,7,7,7,7,7,7",17faa6338410201ed633c4df87ade641,矮屋 编 茅 槿 缚 篱 诗人 住处 恰 相宜 万 间 突兀 梦 不到 一 室 凄清 心 自知 窗下 无 灯童 睡 早 林间 有 月 鹤 归迟 八荒 便 作 庭除 看 南北 东西 任所 之
207bae7f-25f0-4dbe-8ead-05dee32ae92b,书怀奉简兰若提举,黄庚,唐,诗,七言律诗,十年湖海叹飘零 晚景投闲百念轻 看水看山真有味 学书学剑恨无成 竹风吟晓诗情动 梧雨敲秋客梦惊 老傍人门非久计 不如归去学渊明,"7,7,7,7,7,7,7,7",9d3dc530f4401219471e9e80f402d578,十年 湖海 叹 飘零 晚景 投闲 百念 轻 看 水 看 山 真 有 味 学书学剑 恨 无成 竹 风吟 晓 诗情 动 梧雨 敲秋客 梦惊 老 傍 人门 非久 计 不如归去 学 渊明
41d5b5ae-a750-4588-a4cd-3e296b682518,登宝林飞来峰,黄庚,唐,诗,七言律诗,乘风飞步碧崔嵬 万壑千岩入眼来 古甃直穿沧海破 浮图高拂白云开 龟公埋没今无冢 乌喙登临旧有台 立尽斜阳不归去 一声孤雁过蓬莱,"7,7,7,7,7,7,7,7",5daa91194ee5fc8d5c36b27aa7f580f0,乘风 飞步 碧 崔嵬 万壑千岩 入眼 来 古 甃 直 穿 沧海 破 浮图 高 拂 白云 开 龟 公 埋没 今 无 冢 乌 喙 登临 旧有 台 立尽 斜阳 不 归去 一声 孤雁 过 蓬莱
ceaf601b-834a-4cb2-8fcc-bd9bb2cf4034,题吴实斋北山别业,黄庚,唐,诗,七言律诗,北山佳景胜南山 乘兴登临眼界宽 樵斧伐云春谷暗 渔榔敲月夜溪寒 一区池占林泉胜 四面天开图画看 竹屋数间尘不到 主人日日凭阑干,"7,7,7,7,7,7,7,7",efab4c9c4f238d1138e0fe435a826673,北山 佳景 胜 南山 乘兴 登临 眼界 宽 樵斧伐 云 春谷 暗 渔榔 敲 月夜 溪寒 一 区池 占 林泉胜 四面 天开 图画 看 竹屋 数间 尘 不到 主人 日日 凭 阑干
66917a2d-8f4c-4e8e-a824-440dce508532,书馆,黄庚,唐,诗,七言律诗,池馆深深锁翠凉 课余多暇日偏长 屋连湖水琴书润 窗近花阴笔砚香 吾道尚存贫亦乐 客身长健老何妨 十年心事闲搔首 厌听蝉声送夕阳,"7,7,7,7,7,7,7,7",20dfd2fdc88a521ebab156dcabcd936e,池馆 深深 锁 翠凉 课余 多 暇日 偏长 屋 连 湖水 琴书 润 窗 近 花 阴 笔砚 香 吾 道 尚存 贫 亦 乐 客 身长 健老 何妨 十年 心事 闲 搔首 厌听 蝉声 送 夕阳
