id,title,author,dynasty,genre,poem_type,sentences_simplified,meter_pattern,hash,words
8b6acc8e-5afa-415e-9ecb-afd65751df84,秋夜同友人话旧,谭用之,宋,诗,七言律诗,露下银河雁度频 囊中垆火几时真 数茎白发生浮世 一盏寒灯共故人 云外簟凉吟峤月 岛边花暖钓江春 何当归去重携手 依旧红霞作近邻,"7,7,7,7,7,7,7,7",f1651fa4a5e563cc4b231d11ca329971,露下 银河 雁度 频 囊中 垆 火 几时 真 数茎 白 发生 浮世 一盏 寒灯 共 故人 云 外 簟 凉 吟 峤 月 岛边 花 暖 钓江 春 何 当归 去 重 携手 依旧 红霞 作 近邻
8e4da786-b3d2-46fb-a11f-a6cb3bfc2bcb,古剑,谭用之,宋,诗,七言律诗,铸时天匠待英豪 紫焰寒星匣倍牢 三尺何年拂尘土 四溟今日绝波涛 雄应垓下收蛇阵 滞想溪头伴豹韬 惜是真龙懒抛掷 夜来冲斗气何高,"7,7,7,7,7,7,7,7",14bc84a5c64437d5540256fb6d210e92,铸 时 天匠 待 英豪 紫焰 寒星 匣倍牢 三尺 何年 拂尘 土 四 溟 今日 绝 波涛 雄应 垓下 收蛇 阵 滞想 溪头 伴豹 韬 惜 是 真龙懒 抛掷 夜来 冲 斗气 何高
c7593fea-f0e5-4ea6-b407-d4294e5ac25e,寄王侍御,谭用之,宋,诗,七言律诗,鸟尽弓藏良可哀 谁知归钓子陵台 炼多不信黄金耗 吟苦须惊白发催 喘月吴牛知夜至 嘶风胡马识秋来 燕歌别后休惆怅 黍已成畦菊已开,"7,7,7,7,7,7,7,7",d133d918e76358da7f23a29bbbef8397,鸟尽弓藏 良 可哀 谁知 归 钓子 陵台 炼 多 不信 黄金 耗 吟 苦须 惊 白发 催 喘月吴牛 知夜 至 嘶 风 胡马识 秋来 燕 歌别 后 休 惆怅 黍 已成 畦 菊 已 开
43a44c6a-b036-419f-9651-01d1af492358,别何处士陵俊老,谭用之,宋,诗,七言律诗,三皇上人春梦醒 东侯老大麒麟生 洞连龙穴全山冷 窗透鼇波尽室清 计拙耻居岩麓老 气狂惭与斗牛平 谁人为向青编上 直傍巢由写一名,"7,7,7,7,7,7,7,7",3cd691471d5a16f471517ee40d85b8d1,三 皇上 人 春梦 醒 东侯 老大 麒麟 生 洞 连 龙穴 全山 冷 窗 透 鼇 波 尽 室 清 计 拙耻 居岩 麓 老 气狂惭 与 斗牛 平 谁 人为 向 青编 上 直 傍 巢 由 写 一名
279cdc84-e1b6-4514-a200-4b843b97cf35,句  其一,谭用之,宋,诗,七言古体,流水物情谙世态 落花春梦厌尘劳,"7,7",8bd90b96bbaa108d7afc2c61c632e776,流水 物情 谙 世态 落花 春梦 厌 尘劳
c3407b36-206d-450e-a3c9-d20d885cc4c7,句  其二,谭用之,宋,诗,七言古体,织槛锦纹苔乍结 堕书花印菊初残,"7,7",0926a5de5cc0f4520ad01b1914f0ce20,织槛 锦 纹 苔 乍 结 堕书 花印 菊 初 残
1c2ddbf4-1cfd-4306-b171-36a574e5ab44,句  其三,谭用之,宋,诗,七言古体,光阴老去无成事 富贵不来争奈何,"7,7",98359c50d4aaacb70ca42e54bb1e5c90,光阴 老 去 无 成事 富贵 不来 争 奈何
3e2a21b8-4b55-4955-a984-8d305323db7e,句  其四,谭用之,宋,诗,七言古体,眠云无限好知己 应笑不归花满樽,"7,7",71d0e1b9f00925a0f36ca184c2de1745,眠 云 无限 好 知己 应笑不归花满樽
e5bd3f61-0a9c-401a-a5b8-d9c2b19dbde9,歌,南昌老翁媪,宋,诗,杂言,蓝采禾 蓝采禾 尘世纷纷事更多 争如卖药沽酒饮 归去深崖拍手歌,"3,3,7,7,7",105f9c34568a123cc75afaa8efb3d414,蓝采禾 蓝采禾 尘世 纷纷 事 更 多 争如 卖药 沽酒 饮 归去 深崖 拍手歌
a47e9fa9-5994-495b-9dd5-8c733db4a6bc,偈,释玄应,宋,诗,五言古体,今年六十六 世寿有延促 无生火炽然 有为薪不续 出谷与归源 一时俱备足,"5,5,5,5,5,5",19fd2d5ea1d8a8a28f6bdc2baff4cc50,今年 六十六 世寿 有 延促 无生 火炽 然 有 为 薪 不续 出谷 与 归源 一时 俱备 足
f666c953-4281-49a4-9dc7-d62990bfdc2d,宿冲虚观,胡衍,宋,诗,五言古体,钟静日已夕 尘缘谢驱役 琪树鹤争定 山空万籁寂 明月散庭除 寒光照床席 花鸟魂梦间 相见曾相识 五更仙鹿鸣 声近在篱隙 晓来问童子 石径无行迹,"5,5,5,5,5,5,5,5,5,5,5,5",c688466bf6bcaaaf912de9513428f4ff,钟静 日 已 夕 尘缘 谢 驱役 琪 树 鹤 争定 山空 万籁 寂 明月 散 庭除 寒光 照 床席 花鸟 魂 梦 间 相见 曾 相识 五更 仙 鹿鸣 声 近在 篱隙 晓来 问 童子 石径 无 行迹
1c13fdd4-6a21-4bb3-a12d-3f136c34e07d,朝斗坛,胡衍,宋,诗,七言绝句,不见铜龙何处飞 空余芳草旧台基 月明风冷禽声碎 疑是仙人佩玉归,"7,7,7,7",063956287975339e2c25671fe5cba036,不见 铜龙 何处 飞 空余 芳草 旧 台基 月 明 风冷 禽声 碎 疑 是 仙人 佩玉 归
1b8afbad-6772-41fa-b092-84046cffb1a9,诫儿姪八百字,范质,宋,诗,五言古体,去年初释褐 一命列蓬丘 青袍春草色 白纻弃如仇 适会龙飞庆 王泽天下流 尔得六品阶 无乃太为优 凡登进士第 四选升校雠 历官十五考 叙阶与尔俦 如何志未满 意欲凌云游 若言品位卑 寄书来我求 省之再三叹 不觉泪盈眸 吾家本寒素 门地寡公侯 先子有令德 乐道尚优游 生逢世多僻 委顺信沈浮 仕宦不喜达 吏隠同庄周 积善有余庆 清白为贻谋 伊余奉家训 孜孜务进修 夙夜事勤肃 言行思悔尤 出门择交友 防慎畏薰莸 省躬常惧玷 恐掇庭闱羞 童年志于学 不惰为箕裘 二十中甲科 赪尾化为虬 三十入翰苑 步武向瀛洲 四十登宰辅 貂冠侍冕旒 备位行一纪 将何助帝猷 即非救旱雨 岂是济川舟 天子未遐弃 日益素餐忧 黄河润千里 草木皆浸渍 吾宗凡九人 继踵升官次 门内无白丁 森森朱绿紫 鹓行洎内职 亚尹州从事 府掾监省官 高低皆清美 悉由侥幸升 不因资考至 朝廷悬爵秩 命之曰公器 才者禄及身 功者赏于世 非才及非功 安得专厚利 寒衣内府帛 饥食太仓米 不蚕复不穑 未尝勤四体 虽然一家荣 岂塞众人议 颙颙十目窥 龊龊千人指 借问尔与吾 如何不自媿 戒尔学立身 莫若先孝弟 怡怡奉亲长 不敢生骄易 战战复兢兢 造次必于是 戒尔学干禄 莫若勤道艺 尝闻诸格言 学而优则仕 不患人不知 惟患学不至 戒尔远耻辱 恭则近乎礼 自卑而尊人 先彼而后己 相鼠与茅鸱 宜鉴诗人刺 戒尔勿旷放 旷放非端士 周孔垂名教 齐梁尚清议 南朝称八达 千载秽青史 戒尔勿嗜酒 狂药非佳味 能移谨厚性 化为凶险类 古今倾败者 历历皆可记 戒尔勿多言 多言者众忌 苟不慎枢机 灾危从此始 是非毁誉间 适足为身累 举世重交游 拟结金兰契 忿怨容易生 风波当时起 所以君子心 汪汪淡如水 举世好承奉 昂昂增意气 不知承奉者 以尔为玩戏 所以古人疾 蘧蒢与戚施 举世重任侠 俗呼为气义 为人赴急难 往往陷刑死 所以马援书 殷勤戒诸子 举世贱清素 奉身好华侈 肥马衣轻裘 扬扬过闾里 虽得市童怜 还为识者鄙 我本羁旅臣 遭逢尧舜理 位重才不充 戚戚怀忧畏 深渊与薄冰 蹈之唯恐坠 尔曹当悯我 勿使增罪戾 闭门敛踪迹 缩首避名势 名势不久居 毕竟何足恃 物盛必有衰 有隆还有替 速成不坚牢 亟走多颠踬 灼灼园中花 早发还先萎 迟迟涧畔松 鬰鬰含晚翠 赋命有疾徐 青云难力致 寄语谢诸郎 躁进徒为耳,"5,5,5,5,5,5,5,5,5,5,5,5,5,5,5,5,5,5,5,5,5,5,5,5,5,5,5,5,5,5,5,5,5,5,5,5,5,5,5,5,5,5,5,5,5,5,5,5,5,5,5,5,5,5,5,5,5,5,5,5,5,5,5,5,5,5,5,5,5,5,5,5,5,5,5,5,5,5,5,5,5,5,5,5,5,5,5,5,5,5,5,5,5,5,5,5,5,5,5,5,5,5,5,5,5,5,5,5,5,5,5,5,5,5,5,5,5,5,5,5,5,5,5,5,5,5,5,5,5,5,5,5,5,5,5,5,5,5,5,5,5,5,5,5,5,5,5,5,5,5,5,5,5,5,5,5,5,5,5,5,5,5",69757eabd202a2e90ddad0f4cf494117,去年初 释褐 一 命 列 蓬丘 青袍 春草 色 白 纻 弃 如 仇 适会 龙飞 庆 王泽 天下 流 尔 得 六品 阶 无 乃 太 为 优 凡 登进士 第 四 选升 校 雠 历官 十五 考 叙阶 与 尔 俦 如何 志 未满 意欲 凌云 游 若言 品位 卑 寄书 来 我 求 省 之 再三 叹 不觉 泪盈眸 吾 家本 寒素 门地 寡 公侯 先子 有 令德 乐道尚 优游 生逢世多僻 委 顺信 沈浮 仕宦 不 喜达 吏 隠 同 庄周 积善 有 余庆 清白 为 贻谋 伊余奉 家训 孜孜 务 进修 夙夜 事 勤肃 言行 思悔 尤 出门 择 交友 防慎畏 薰 莸 省 躬 常惧 玷 恐 掇 庭 闱 羞 童年 志 于 学 不惰 为 箕裘 二十 中甲科 赪 尾 化为 虬 三十 入翰 苑 步武 向 瀛洲 四十 登宰 辅 貂冠 侍 冕旒 备 位行 一纪 将 何助 帝猷 即非 救 旱雨 岂 是 济川 舟 天子 未 遐弃 日益 素餐 忧 黄河 润 千里 草木 皆 浸渍 吾 宗 凡 九 人 继踵 升官 次 门内 无 白丁 森森 朱绿紫 鹓 行 洎 内 职 亚尹州 从事 府 掾 监 省 官 高低 皆 清美 悉由 侥幸 升 不因资考 至 朝廷 悬爵 秩 命 之 曰 公器 才者 禄 及 身 功者 赏于 世 非才 及 非 功 安得 专 厚利 寒衣 内府 帛 饥食 太仓 米 不 蚕复 不 穑 未尝 勤 四体 虽然 一家 荣 岂 塞 众人 议 颙 颙 十目 窥 龊 龊 千人指 借问 尔 与 吾 如何 不 自 媿 戒尔学 立身 莫若 先 孝弟 怡 怡 奉 亲长 不敢 生骄 易 战战复兢兢 造次 必 于是 戒尔学 干禄 莫若 勤 道 艺 尝 闻 诸 格言 学而优则仕 不 患 人不知 惟 患学 不至 戒尔远 耻辱 恭 则 近乎 礼 自卑 而 尊人 先彼 而后 己 相鼠 与 茅 鸱 宜鉴 诗人 刺 戒尔勿旷放 旷 放非 端士 周孔垂 名教 齐梁尚 清议 南朝 称 八达 千载 秽 青史 戒尔 勿 嗜酒 狂药 非佳 味 能移 谨厚 性 化为 凶险 类 古今 倾 败者 历历 皆 可记 戒尔勿多言 多 言者 众忌 苟 不慎 枢机 灾 危 从此 始 是非 毁誉 间 适足 为身 累 举世 重 交游 拟 结金兰 契 忿怨 容易 生 风波 当时 起 所以 君子 心 汪汪 淡如水 举世 好 承奉 昂昂 增 意气 不知 承奉 者 以 尔 为 玩戏 所以 古人 疾 蘧 蒢 与 戚 施 举世 重任 侠 俗呼为气义 为 人 赴 急难 往往 陷刑 死 所以 马援书 殷勤 戒 诸子 举世 贱 清素 奉身 好 华侈 肥 马衣 轻裘 扬扬 过 闾里 虽 得 市童 怜 还为 识者 鄙 我 本 羁旅 臣 遭逢 尧舜 理 位重 才 不充 戚戚 怀忧 畏 深渊 与 薄冰 蹈 之 唯恐 坠 尔曹 当悯 我 勿 使 增罪 戾 闭门 敛 踪迹 缩首 避名 势 名势 不久 居 毕竟 何足恃 物盛必有衰 有 隆 还有 替 速成 不 坚牢 亟 走 多 颠 踬 灼灼 园中 花 早 发还 先 萎 迟迟 涧畔 松 鬰 鬰 含 晚 翠 赋命 有 疾 徐 青云 难力 致 寄语 谢诸郎 躁进 徒 为 耳
b9423f90-7e22-4bc2-be5b-45df0d4b75bb,贺李昉,范质,宋,诗,七言律诗,翰苑重求李谪仙 词锋颖利胜龙泉 朝趋建礼霞烘日 夜直承明月印天 圣主重知缘国士 相公多喜为同年 青春才子金门贵 蜀锦袍新夺日鲜,"7,7,7,7,7,7,7,7",9d7721eaf70feb1b3943c17a7210aadf,翰苑 重求 李 谪仙 词锋 颖 利胜 龙泉 朝 趋建 礼霞 烘 日 夜 直 承 明月 印天 圣主 重 知缘 国士 相公 多 喜为 同年 青春 才子 金门 贵 蜀锦 袍 新 夺 日鲜
0b130882-ac80-4718-9371-a8ddce929aec,答使者,释定御,宋,诗,七言绝句,三年过了又三年 阅遍华岩满五千 功德完满珍重去 何劳使者上高田,"7,7,7,7",8e1ca0c82486cbfaf87df325d55428fc,三年 过 了 又 三年 阅遍 华岩 满 五千 功德 完满 珍重 去 何劳 使者 上高田
553a29fa-8dcf-4143-b43b-2672adb0a645,杨柳枝词四首  其一,孙光宪,宋,诗,七言绝句,阊门风暖落花干 飞遍江城雪不寒 独有晚来临水驿 闲人多凭赤栏干,"7,7,7,7",76bf2917f17f2931b7b6ae32e9784883,阊 门风 暖 落花 干 飞遍 江城 雪不寒 独有 晚 来临 水驿 闲人 多 凭 赤 栏干
a29b5f63-a18b-4b62-9add-f0b6f5074cca,杨柳枝词四首  其二,孙光宪,宋,诗,七言绝句,有池有榭即蒙蒙 浸润翻成长养功 恰似有人长点检 著行排立向春风,"7,7,7,7",b5b8404e916f85adb40f23dbf460f744,有 池 有 榭 即 蒙蒙 浸润 翻 成长 养功 恰似 有人 长 点检 著行 排立 向 春风
7978719b-1541-4be7-9d7b-8f3e2ed6b97f,杨柳枝词四首  其三,孙光宪,宋,诗,七言绝句,根柢虽然傍浊河 无妨终日近笙歌 毵毵金带谁堪比 还共黄鶑不较多,"7,7,7,7",84784a789c96db0ffbb1ff9eb9bc20da,根柢 虽然 傍 浊 河 无妨 终日 近 笙歌 毵 毵 金 带 谁 堪比 还 共 黄 鶑 不 较 多
c37a6e31-f4e2-40af-8d93-16fd3c907d78,杨柳枝词四首  其四,孙光宪,宋,诗,七言绝句,万株枯槁怨亡隋 似吊吴台各自垂 好是淮阴明月里 酒楼横笛不胜吹,"7,7,7,7",36216b88b0c3cde7c05506819385d479,万株 枯槁 怨亡 隋 似 吊 吴台 各自 垂 好 是 淮阴 明月 里 酒楼 横笛 不胜 吹
1b70a53d-87b4-463e-9542-b990b721e07d,采莲,孙光宪,宋,诗,七言绝句,菡萏香连十顷陂 小姑贪戏采莲迟 晚来弄水船头湿 更脱红裙裹鸭儿,"7,7,7,7",7dc0958dbf1d8b7870b39fd57406244a,菡萏 香连 十顷 陂 小姑 贪戏 采莲迟 晚 来 弄水 船头 湿 更 脱 红裙 裹 鸭 儿
54c73551-e429-49cd-88c3-22185067f616,八拍蛮,孙光宪,宋,诗,七言绝句,孔雀尾拖金线长 怕人飞起入丁香 越女沙头争拾翠 相呼归去背斜阳,"7,7,7,7",10546ca8af6f0c1d50657827b66576db,孔雀 尾 拖 金线 长 怕人 飞 起入 丁香 越 女 沙头 争拾 翠 相呼 归去 背 斜阳
2b4ae75e-3e81-4eca-a576-6355954259fa,竹枝词二首  其一,孙光宪,宋,诗,七言绝句,门前春水白苹花 岸上无人小艇斜 商女经过江欲暮 散抛残食饲神鸦,"7,7,7,7",fc5ec233f02cb4bcb96f4c43df439b60,门前 春水 白 苹花 岸上 无人 小艇 斜 商女 经过 江欲 暮 散 抛 残食 饲神 鸦
7d4cadea-008a-4478-aee1-f4271c2e94c6,竹枝词二首  其二,孙光宪,宋,诗,七言绝句,乱绳千结绊人深 越萝万丈表长寻 杨柳在身垂意绪 藕花落尽见莲心,"7,7,7,7",1c584c482f2de4280a0bfb80b26bc1e3,乱绳 千 结绊 人 深 越萝 万丈 表长 寻 杨柳 在 身 垂 意绪 藕花 落尽 见 莲心
b48aaff7-7f3e-453e-8315-5df93cf8a4fd,荆台,孙光宪,宋,诗,七言绝句,百尺荆台草径荒 如何前日谓云阳 古今不尽迁移恨 依旧台边水渺茫,"7,7,7,7",975b6d8c90d4a3703bdcefddd5d85ecd,百尺 荆台 草径 荒 如何 前日 谓 云阳 古今 不尽 迁移 恨 依旧 台边 水 渺茫
c668986b-816f-48aa-9bb9-1a00992e1a18,句  其一,孙光宪,宋,诗,五言古体,晓厨烹淡菜 春杼种橦花,"5,5",c43e9758eb14e6a87e9c8910f01e8633,晓 厨 烹 淡菜 春杼种 橦 花
38fb16ba-3b79-4ca1-a594-c279ded90f39,句  其二,孙光宪,宋,诗,七言古体,窗下有时留客宿 室中无事伴僧眠,"7,7",9b05bf4493fd7cace0ea4f8c71a58512,窗下 有时 留客 宿 室中 无 事伴 僧 眠
6877177d-82b2-434e-b45c-0234effeb242,答僧,释永安,宋,诗,五言古体,汝问西来意 且过这边立 昨夜三更时 雨打虚空湿 电影忽然明 不似蚰蜒急,"5,5,5,5,5,5",3f2a9fd518212cb08b0aa785b91a2463,汝 问西 来意 且过 这边 立 昨夜 三 更时 雨 打 虚空 湿 电影 忽然 明 不 似 蚰蜒 急
f60390e2-9a95-4fdf-a7b7-bb4b03b4d99a,石城怀古,刘洞,宋,诗,五言绝句,石城古岸头 一望思悠悠 几许六朝事 不禁江水流,"5,5,5,5",b500bcead1b1afa671aea8746d134d7c,石城 古 岸头 一 望思 悠悠 几许 六朝 事 不禁 江水 流
d698755e-40a8-4723-b7c7-1a3f984a9baf,句  其一,刘洞,宋,诗,七言古体,千里长江皆渡马 十年养士得何人,"7,7",c01e1b65323e620513d41b44f7b8e985,千里 长江 皆 渡 马 十年 养士 得 何人
9bf350ce-f260-471b-8242-10390fd3fe57,句  其二,刘洞,宋,诗,七言古体,翻忆潘郎章奏内 阴阴日暮好沾巾,"7,7",b58949788f2427a70164681fded5b500,翻忆 潘郎章 奏 内 阴阴 日暮 好 沾 巾
1bd74b34-fd59-4e32-a206-0f27a4657407,句  其三,刘洞,宋,诗,五言古体,百骸同草木 万象入心灵,"5,5",d27c65da8c2053dff7f963d1a61d731e,百骸 同 草木 万象 入 心灵
0125ea25-6c42-4146-a5ba-7c7a12133e69,保安寺,江景房,宋,诗,七言律诗,扰扰尘埃白日忙 偶然来谒赞公房 行登峻岭跻攀倦 坐俯清泉笑傲凉 林静鸟声酬客语 风来花气逐人香 此时已觉凡尘断 分得高僧兴味长,"7,7,7,7,7,7,7,7",a2011bcb1fb82ea914e452ad663d5c6e,扰扰 尘埃 白日 忙 偶然 来谒 赞 公房 行 登 峻岭 跻攀 倦 坐 俯 清泉 笑傲 凉 林静 鸟声 酬 客语 风来花气逐人香 此时 已觉 凡尘 断 分 得 高僧 兴味 长
f94cd8e1-76a4-4313-880f-64dc59f9356a,依韵攀和通判员外题金泉观之作,杨克让,宋,诗,七言律诗,冲虚脱屣世绵绵 胜地人来尚凛然 不见彩云迎皓鹤 空留怪石漱清泉 侵阶蔓草迷香迳 偃盖寒松杂暮烟 静化信从无妄得 堪思汉武亦神僊,"7,7,7,7,7,7,7,7",e0865a74a2764cec90162c68ce6da66e,冲虚 脱屣 世 绵绵 胜地 人 来 尚 凛然 不见 彩云 迎皓鹤 空留 怪石 漱 清泉 侵阶 蔓草 迷香 迳 偃盖 寒松 杂暮烟 静化信 从 无妄得 堪思 汉武亦 神 僊
632942ac-be68-424c-97cd-094699f4f7c5,贺李昉,窦仪,宋,诗,七言律诗,厩马牵来哕哕嘶 马蹄随步蹑云梯 新街锦帐达三字 旧制星垣放五题 视草健毫从席选 受降恩诏待公批 仙才已在神仙地 逢见刘晨为指迷,"7,7,7,7,7,7,7,7",313c7a9a5bb1e63da6c38f12780e7683,厩马 牵来 哕 哕 嘶 马蹄 随步 蹑 云梯 新街 锦帐 达 三 字 旧制 星垣 放 五题 视草 健 毫从席选 受降 恩 诏 待 公批 仙 才 已 在 神仙 地 逢见 刘晨 为 指迷
03826275-4c34-46c6-876d-67728055d828,过邠州留题,窦仪,宋,诗,七言绝句,多少樊笼不敢开 强拘物性要相倍 何时得似邠州守 德政临民鹤自来,"7,7,7,7",836fc97da5b23032a971a01049906793,多少 樊笼 不敢 开 强 拘 物性 要 相倍 何时 得 似 邠 州 守 德政 临民鹤 自来
cba626e8-019b-4036-9b2e-1b7ccfb56f7a,寄乡人,赵文度,宋,诗,七言绝句,圣主覃恩徧九垓 碧油红旆出关来 乡中父老如相问 十五年前赵秀才,"7,7,7,7",4db4080278ed3f387680a2ce3ed1a016,圣主 覃 恩 徧 九 垓 碧油红 旆 出关 来 乡中 父老 如 相问 十五年 前 赵 秀才
85b5d8ce-03ca-4a23-9150-343d86b91215,赠梦英大师,赵文度,宋,诗,七言律诗,携筇何日别长沙 凤篆功夫世所嘉 秦岭夜吟残海月 章台春讲雨天花 净瓶远贮湘潭水 片衲晴披岳面霞 圣主有恩酬绝艺 帘前师号紫袈裟,"7,7,7,7,7,7,7,7",b590d4ec3c57fd3ae0ee61336452a80f,携 筇 何日 别 长沙 凤 篆 功夫 世所 嘉 秦岭 夜 吟 残海 月 章台春 讲 雨 天花 净瓶 远 贮 湘潭 水 片 衲 晴 披 岳面霞 圣主 有 恩酬 绝艺 帘 前 师号 紫 袈裟
9774d247-0d6e-4bf4-8892-51c633d61d88,寄宣义英公,何承裕,宋,诗,七言律诗,书札精奇已换鹅 仍闻依旧卧烟萝 诗成万首犹嫌少 酒饮千钟不怕多 乡寺夜开云梦月 石房寒锁洞庭波 知师收拾南归去 为忆渔人唱楚歌,"7,7,7,7,7,7,7,7",7134af686e4f742529cdf0534c95da0e,书札 精奇 已 换 鹅 仍 闻 依旧 卧烟萝 诗 成 万首 犹 嫌少 酒 饮 千钟 不怕 多 乡 寺 夜 开 云梦 月 石房 寒锁 洞庭 波 知师 收拾 南 归去 为忆 渔人 唱 楚歌
f0b0880e-e9db-4a89-9c54-1882037a3e53,句,何承裕,宋,诗,七言古体,晓来犬吠张三妇 日暮猿啼吕四妻,"7,7",182d93300d25c3eab58db6e1473916f6,晓来 犬吠 张三妇 日暮 猿啼 吕四妻
3611f03b-ee08-432e-985f-93c4d8d28e52,桐庐员外出勋德之门以儒素为业泊来仪于京阙久飞誉于缙绅今则膺凤诏于朝端奏牛刀于江表会承旨尚书赋琼章于丹地饯兰櫂于清流愚虽不才敢继其作,扈蒙,宋,诗,七言律诗,王谢高门江鲍才 东游何用更裴回 弦歌好就吴乡拜 簪组初从魏阙来 清酒一尊携潋滟 旧诗千首贮琼瑰 健颿轻櫂须行乐 莫效当时庾信哀,"7,7,7,7,7,7,7,7",a527c540ca1446e237db0265982177be,王谢 高门江 鲍才 东游 何用 更 裴 回 弦歌 好 就 吴 乡 拜 簪组 初 从 魏阙 来 清酒 一尊 携 潋滟 旧诗 千首 贮 琼瑰 健 颿 轻 櫂 须 行乐 莫效 当时 庾信 哀
a83b6e27-3ab0-44da-9bd1-935864e53828,句,扈蒙,宋,诗,七言古体,五凤齐飞入翰林,7,0bdbb4037b2dcc3a8ebc299c2d3e1cf6,五凤 齐 飞入 翰林
bf1f2537-5ff4-4349-9d1e-98b43839271c,存目  其一,扈蒙,宋,诗,杂言,诗题 原无题句 微臣自愧头如雪 也向钧天侍玉皇,"2,4,7,7",5e87fed90199e37112b3e82449f1dd21,诗题 原 无题 句 微臣 自愧 头 如 雪 也 向 钧 天 侍 玉皇
6fa1b3b5-cc7d-404b-9add-9dd532653cb7,存目  其二,扈蒙,宋,诗,杂言,以上刘瑛整理,6,11fb89a15ba0fa2143cab31001d7f113,以上 刘瑛 整理
6bd4b204-c056-41fd-a624-ad7fb345ceb9,偶因团聚思想仙岩诣就观瞻龛龛礼谒推砂扫窟之次忽睹南大像北边一所古窟摧残岁久毁坏年深去戊申岁末发其心愿至己酉岁中方乃修全以咨推砂扫窟崇饰功德所申意者先奉为龙天〔八〕部拥护河湟梵释四王安人静塞伏愿当今帝主永坐蓬莱十道争钦八方慕化次为我府主令公长隆宝位命寿延年为绝塞之人王作苍生之父母荣同舜日化布尧时继叶临人承桃秉世观音院主道真等十人悟四大而无实睹丘井以悬腾虑□地以火风恐强象而煎逼道真等唯见牛车火宅空然劝时侣发无上之善心誓坚修于胜果今因作罢略述数行拙解舖舒用留于壁余才亏翰墨学寡三坟不但荒芜辄成短句,释道真,宋,诗,七言古体,人生四大惣是空 何个不觅出烦笼 造罪人多作福少 所以众生长受穷 坚修苦行仍本分 禁戒奢华并不同 今生努力懃精练 冥路不溺苦海中 日逐持经强发愿 弘道回去莫难逢 唯报往来游礼者 这回巡谒一层层,"7,7,7,7,7,7,7,7,7,7,7,7",cd6991a74c3618b312de7b527a5a2739,人生 四大 惣 是 空 何个 不 觅出 烦 笼 造 罪人 多 作 福少 所以 众 生长 受穷 坚修 苦行 仍 本分 禁戒 奢华 并 不同 今生 努力 懃 精练 冥路 不 溺 苦海 中 日 逐持 经强 发愿 弘道 回去 莫 难逢 唯报 往来 游礼 者 这回 巡谒 一层层
924cd973-7f37-40ad-bdb1-76405af64465,某又述,释道真,宋,诗,七言律诗,白壁从来好丹青 无知个个乱题名 三涂地狱交谁忍 十八湔铜灌一瓶 镌龛必定添福利 凿壁多层证无生 唯报往来游玩者 辄莫于此骋书题,"7,7,7,7,7,7,7,7",d4bbcef782be38e1c6c92d3691a3f11b,白壁 从来 好 丹青 无知 个个 乱 题名 三涂 地狱 交 谁 忍 十八 湔 铜 灌 一瓶 镌 龛 必定 添 福利 凿壁 多层 证 无生 唯报 往来 游玩 者 辄 莫于此骋 书题
b83f5104-062f-43f5-98d5-7f59b5fe540c,依韵,释道真,宋,诗,七言律诗,白壁虽然好丹青 无简迷愚难悟醒 纵有百般僧氏巧 也有文徒书号名 空留佳妙不题宣 却入五趣陷尘境 唯报往来游观者 起听前词□□□,"7,7,7,7,7,7,7,7",e5f2f583ad315ee9fc87a85e2a892757,白壁 虽然 好 丹青 无简迷 愚难悟 醒 纵 有 百般 僧氏巧 也 有 文徒 书号 名 空留 佳妙 不题 宣 却 入 五趣陷尘境 唯报 往来 游 观者 起听 前 词 □ □ □
81bd54b5-753d-4eae-8506-249dadfa32f1,某又述,释道真,宋,诗,七言律诗,能持净意作□家 解驾牛羊白鹿车 嫌阑砌前栽树少 怕空不种后园花 菩提上□因修得 佛果无生证有涯 此处涅盘观境□ 自然捷路到龙花,"7,7,7,7,7,7,7,7",3a6da2b04ef10ea9b8a8a4258b4a4f3a,能持 净意 作 □ 家 解驾 牛羊 白鹿 车 嫌 阑 砌 前 栽树 少 怕 空 不种 后园 花 菩提 上 □ 因 修得 佛果 无生 证有涯 此处 涅盘 观境 □ 自然 捷路 到 龙花
d7540229-7ee3-44c8-b973-147d86dad493,偶因闲日家事无牵蒙王氏以呼招乃书题于窟记伏见僧俗等五人个个苦行不异檀特山边各各谈空有似释迦园内且曹都头门传阀阅帝子王孙衣上惹勋郁之香颜前棐桃花之色念让宝之存宝行越前贤思知足而常足来救善友听经不倦制意马以停𧬊恋寂有诚拨心灯而更耀既有斯愿必上羊车更多奇功兴誉不尽辄上诗一首,释道真,宋,诗,杂言,谯国门传缙以绅 善男子即是帝王孙 文商碑背题八字 武盛弓弦重六钧 既出四门观生老 便知六贼不相亲 夜迶将心登峻岭 心定菩提转法轮,"7,8,7,7,7,7,7,7",8aeabc60920722be23615df5607ade0c,谯 国门 传 缙 以 绅 善 男子 即 是 帝王 孙 文商碑 背题 八字 武盛 弓弦 重六钧 既 出 四门 观生 老 便 知 六 贼 不 相亲 夜 迶 将 心 登 峻岭 心定 菩提 转法轮
8eadfa2f-e778-4a6d-9b67-bf362cf824d9,□因从台驾随侍□□（政）□（道）□（舍）□道真等七人就三危圣王寺□安下霸道场记□（维）□（天）□（福）十五年五月八日游记之耳,释道真,宋,诗,杂言,三危山内枲世□ 贤 结此道场下停□ 闲 侍送门人往不绝 圣是山谷水未宽 一旬之间僧久住 感动山神赐霜树 □值牟尼□ 威 力重 此山本□住□ 僧 □ 田,"7,1,7,1,7,7,7,7,5,1,2,6,1,1,1",fc720e7ddcb2a4a1d7e4901e6cef3b5d,三危山 内 枲 世 □ 贤 结 此 道场 下停 □ 闲 侍 送 门人 往 不绝 圣 是 山谷 水 未 宽 一旬 之间 僧 久 住 感动 山神 赐 霜 树 □ 值 牟尼 □ 威 力重 此 山本 □ 住 □ 僧 □ 田
ba3105a3-3b02-4ec5-abe1-84a84b42a8ea,蒸豚,紫衣师,宋,诗,七言律诗,嘴长毛短浅含臕 久向山中食药苗 蒸处已将蕉叶裹 熟时兼用杏浆浇 红鲜雅称金盘饤 熟软真堪玉箸挑 若把膻根来比并 膻根自合吃藤条,"7,7,7,7,7,7,7,7",b8cc8772525f8bfd6bfd5947e802253d,嘴 长毛 短浅 含 臕 久 向 山中 食药苗 蒸处 已 将 蕉叶 裹 熟 时 兼用 杏浆 浇 红鲜 雅称 金盘饤 熟软 真 堪 玉 箸 挑 若把 膻根 来比 并 膻根 自合 吃 藤条
