id,title,author,dynasty,genre,poem_type,sentences_simplified,meter_pattern,hash,words
9ead9218-3cbc-4cc2-ad68-9267181b99b1,记梦,华岳,宋,诗,杂言,溪泠泠 皷冬冬 虚堂淅沥生寒风 寒风绕我梦魂去 飞飏直上蓬莱宫 蓬莱宫殿女如玉 霓裳羽扇环帘栊 月娥留我宴珠翠 玳筵间列花丛丛 酒酣万象罗心胸 举杯话别殊匆匆 青鸾命驾下空阔 一声珰珮鸣丁东 被衣起坐周四顾 庭户悄悄无人踪 银河万里倒澄碧 冰鉴半轮斜倚空 横江孤鹤一声唳 唤起乡心千万重,"3,3,7,7,7,7,7,7,7,7,7,7,7,7,7,7,7,7,7",5da315590b343932c5f9a4ab43687a17,溪 泠 泠 皷 冬冬 虚堂 淅沥 生 寒风 寒风 绕 我 梦 魂 去 飞 飏 直 上 蓬莱 宫 蓬莱 宫殿 女 如玉 霓裳 羽扇 环帘 栊 月娥 留 我 宴 珠翠 玳筵 间列 花丛 丛 酒 酣 万象 罗 心胸 举杯 话别 殊 匆匆 青鸾 命 驾下 空阔 一声 珰珮鸣 丁东 被 衣 起 坐 周 四顾 庭户 悄悄 无人 踪 银河 万里 倒 澄碧 冰鉴 半轮 斜倚 空 横江 孤鹤 一声 唳 唤起 乡 心 千万重
7fb6594e-4c45-43b6-8e71-fce5d1bef3cf,梅,华岳,宋,诗,七言古体,衰兰枯荷了秋色 几向寒梢问消息 溪桥交马断肠时 翠袖佳人日暮归 玉面亭亭汉宫样 一见风流慰心赏 寒标孤绝太无情 谁为移春上玉京 月华凄切霜华白 夜半飘香度帘额 寄声横笛且休吹 愁杀江南未归客,"7,7,7,7,7,7,7,7,7,7,7,7",2831514dfc190d6b82692c1094852dfd,衰 兰 枯荷 了 秋色 几向 寒 梢 问 消息 溪桥 交马 断肠 时 翠袖 佳人 日暮 归 玉面 亭亭 汉宫 样 一 见 风流 慰心 赏 寒标 孤绝 太 无情 谁 为移 春上 玉京 月华 凄切 霜华 白 夜半 飘香 度 帘额 寄声 横笛 且 休吹 愁 杀 江南 未归 客
3307056a-3881-4935-9883-90ba1bb2bad4,山水吟,华岳,宋,诗,杂言,闽之山峨峨 可以接穹苍 闽士孕其秀 胸次尤难量 闽之水滔滔 可以烛妍丑 闽士生其间 其美不容口 君不见周家社稷生甫申 崧岳当年曾降神 又不见千里秀气钟三苏 眉山草木皆焦枯 我生恨不由河洛 虚负三光并五岳 地灵人杰推江东 人物风流兼磊落 顾此闽之东 自古多英雄 求其为绝称 独一忠穆公 公今已即世 后世谁可拟 惟有詹仲通 一人而已耳 仲通何如人 景星与凤凰 不险亦不深 山高兮水长,"5,5,5,5,5,5,5,5,10,7,10,7,7,7,7,7,5,5,5,5,5,5,5,5,5,5,5,5",1c2d5ee7403c0017eaa1844bc60c4036,闽 之山 峨峨 可以 接 穹苍 闽士 孕 其 秀 胸次 尤 难 量 闽 之 水 滔滔 可以 烛 妍 丑 闽士 生 其间 其 美 不容 口 君不见 周家 社稷 生甫 申 崧 岳 当年 曾 降 神 又 不见 千里 秀气 钟三苏 眉山 草木 皆 焦枯 我 生恨 不由 河洛 虚负 三光 并 五岳 地灵人杰 推 江东 人物 风流 兼 磊落 顾 此 闽 之东 自古 多 英雄 求 其 为 绝称 独一 忠 穆公 公今 已即 世 后世 谁 可拟 惟有 詹仲通 一 人 而已 耳 仲通 何如 人 景星 与 凤凰 不险 亦 不 深 山高兮 水长
9d9e5030-43c1-4e97-901b-f98599c541a4,浴,华岳,宋,诗,七言古体,龙藩地暖冬无雪 十月风光似三月 好风不动绮罗尘 人在绣帏帘半揭 酒肠拍索能回春 春潮八面香熏熏 香肌汗透披縠纹 思得沧海驱埃氛 银锅蟹眼生春雪 银瓢捾破锅心月 流霞倾入碧琅玕 香雾氤氲云半掇 花藤织出金芙蕖 烟青藕紫堆云盂 一声珰珮帘钩垂 皂盘捧出双明珠 蜡花照入兰汤阁 珠玑体迸红猊活 凤豁云涛濯锦毛 龙翻雪浪浇银甲 起拏裙雾围春风 臙巾抹出桃花红 香泉入齿潄寒玉 吐作冰雪飞长空 苍头急把春衫换 腕玉轻穿云一片 出门两腋生清风 身在嫦娥广寒殿,"7,7,7,7,7,7,7,7,7,7,7,7,7,7,7,7,7,7,7,7,7,7,7,7,7,7,7,7",f95b6b71e54156cde6b99f31b1e0d093,龙藩 地 暖冬 无 雪 十月 风光 似 三月 好风不动 绮罗 尘 人 在 绣 帏帘 半 揭 酒肠 拍索 能 回春 春潮 八面 香 熏熏 香 肌 汗 透 披 縠 纹 思得 沧海 驱埃 氛 银锅 蟹 眼生 春雪 银 瓢 捾 破 锅 心 月 流霞 倾入 碧 琅玕 香雾 氤氲 云 半 掇 花藤 织出 金芙蕖 烟青 藕 紫堆 云盂 一声 珰珮帘 钩 垂 皂盘 捧出 双 明珠 蜡花 照入 兰汤阁 珠玑 体 迸 红猊 活 凤豁 云涛 濯锦 毛 龙 翻雪浪浇 银甲 起 拏 裙 雾 围 春风 臙 巾 抹 出 桃花 红 香泉 入 齿 潄 寒 玉 吐作 冰雪 飞 长空 苍头 急 把 春衫 换 腕 玉 轻 穿 云 一片 出门 两 腋生 清风 身 在 嫦娥 广寒殿
5c147e6c-db83-4e1e-aa5e-99f6f3b40761,嘲热,华岳,宋,诗,七言古体,南方有神名祝融 发赭面丹唇朱红 执鞭入海驱赤龙 火车勒驾烧长空 千骖万乘如联辔 烈焰腾腾灼天地 九霄烜赫皆甑蒸 四海煎熬俱鼎沸 流金烁石气不通 天下俱在红炉中 葛衫襟湿疑有雨 罗纨柄折浑无风 祝融祝融毋太酷 天道炎凉尝反复 看看少皡催戍瓜 尽把凉风散烦溽,"7,7,7,7,7,7,7,7,7,7,7,7,7,7,7,7",7ddbaa5fd6fc85a42a7ad93ffd229948,南方 有神 名 祝融 发 赭面 丹唇 朱红 执鞭 入海 驱 赤 龙 火车 勒 驾烧 长空 千 骖 万乘 如 联辔 烈焰 腾腾 灼 天地 九霄 烜 赫 皆 甑 蒸 四海 煎熬 俱 鼎沸 流金 烁 石气 不通 天下 俱 在 红炉 中 葛衫襟 湿疑 有 雨 罗 纨柄 折 浑无风 祝融 祝融 毋 太酷 天道 炎凉 尝 反复 看看 少 皡 催 戍 瓜 尽 把 凉风 散烦 溽
a3c73da6-5fd6-4801-88dd-6d6baf895c71,钓鼇行,华岳,宋,诗,七言古体,北风浩荡沧溟阔 千万军声夜潮聒 翻空浊浪鼓雷霆 舟子停兰面如血 龙门有客何狰狞 弩目张胆殊不惊 桅樯破浪裂洋岛 直欲一举空蛟鲸 我之钓兮非世比 新月为钩索霞绮 先拗虹蜺为钓竿 却把鹍鹏作香饵 欲垂未垂号鬼神 星斗无光天地昏 海灵乞命免生死 一钩连六酬衔恩 我公万里风烟伯 度量汪汪寰海窄 蟠胸高耸蓬莱山 壮气直吞云梦泽 恩波万壑奔洪流 风帆浪楫交觥筹 金鳞照日巨如斗 四海触物无虚舟 我生本是钓鼇客 几岁滩头望风色 忽闻霹雳破昆仑 便整丝纶驾航舶 我今十辖迎公开 会须举手生风雷 不然长啸谢水府 明月满船归去来,"7,7,7,7,7,7,7,7,7,7,7,7,7,7,7,7,7,7,7,7,7,7,7,7,7,7,7,7,7,7,7,7",f97f95a57cbbbd1332c0ac5ae4896a7a,北风 浩荡 沧 溟 阔 千万 军声 夜潮 聒 翻空 浊浪 鼓 雷霆 舟子 停兰面 如 血 龙门 有客何 狰狞 弩目 张 胆殊 不惊 桅樯 破浪 裂洋岛 直 欲 一举 空 蛟 鲸 我 之 钓 兮 非 世比 新月 为 钩索 霞 绮 先 拗 虹 蜺 为 钓竿 却 把 鹍 鹏 作 香饵 欲 垂 未 垂 号 鬼神 星斗 无 光 天地 昏 海灵 乞命 免 生死 一 钩 连 六酬 衔恩 我 公 万里风 烟伯 度量 汪汪 寰海 窄 蟠 胸 高耸 蓬莱 山 壮气 直 吞 云梦泽 恩波万 壑 奔 洪流 风帆 浪楫 交 觥筹 金鳞照 日巨如斗 四海 触物 无虚舟 我 生本 是 钓 鼇 客 几岁 滩头 望风 色 忽闻 霹雳 破 昆仑 便整 丝纶 驾 航舶 我 今十 辖 迎 公开 会 须 举手 生 风雷 不然 长啸 谢水府 明月 满船 归去来
a1cba54c-9326-48f7-9ef8-fe687cf5a271,上赵漕,华岳,宋,诗,七言古体,太山之巅有乔松 凛凛千丈摩苍空 风云有会直相际 轰雷掣电蟠蛟龙 盘根错节真天种 卿月郎星伴辰拱 高风萧瑟涕清泉 桃李无言谩丘垄 南宫仙桂饶天香 南国蔽芾歌甘棠 大枝擎天作砥柱 小枝驾海成虹梁 六月无风天欲雨 赤龙衔火烧空宇 亭亭横盖指扶桑 万壑千崖冷无暑 大椿可笑欺庄周 便指千岁为春秋 使民若战夏后社 用汝当作商川舟 自惭藤蔓缠林壑 未遂鹪鹩一枝乐 盘桓已喜跨高寒 更借扶摇荐雕鹗 我闻处士方绸缪 三友简在公宁留 苍姬已托大夫荫 赤子愿陪丞相游,"7,7,7,7,7,7,7,7,7,7,7,7,7,7,7,7,7,7,7,7,7,7,7,7,7,7,7,7",73f60aa03b805f7f17f6be0420ca98d8,太山 之 巅 有 乔松 凛凛 千丈 摩 苍空 风云 有 会 直 相际 轰雷掣电 蟠 蛟龙 盘根错节 真 天种 卿 月郎 星伴 辰 拱 高 风 萧瑟 涕 清泉 桃李无言 谩丘 垄 南宫 仙 桂 饶天香 南国 蔽 芾 歌 甘棠 大 枝 擎天 作 砥柱 小枝 驾海成虹 梁 六月 无风天欲雨 赤龙衔 火烧 空宇 亭亭 横盖 指 扶桑 万 壑 千崖冷 无暑 大 椿 可笑 欺 庄周 便 指 千岁 为 春秋 使民 若 战夏 后 社 用 汝 当作 商川 舟 自惭 藤蔓 缠 林壑 未遂 鹪鹩一枝 乐 盘桓 已 喜 跨 高寒 更 借 扶摇 荐 雕 鹗 我 闻 处士 方 绸缪 三友 简在 公宁 留 苍姬 已 托 大夫 荫 赤子 愿 陪 丞相 游
fbd72ff9-bf95-43c4-90de-e3add2448a14,邻女搔绵吟,华岳,宋,诗,七言古体,闲窗日上三竿竹 窗下娇娥整轮辐 匆匆未暇理云鬟 半朵青鸦倚红玉 青梢摘尽银香囊 画栏平倚斑筠筐 时将纤手翻雪霜 酥胸玉面同光芒 捧归细卷银成索 牵出松松云一握 珠唇呵挺气温温 鹦觜踏车声络络 今年莫怪功绩稀 阿嬭勒绣鸳鸯帏 如今织出秋江练 十月正好裁新衣 客心闻此愁无著 一夜清寒动寥寞 明朝为问买一端 剪做道袍披落魄,"7,7,7,7,7,7,7,7,7,7,7,7,7,7,7,7,7,7,7,7",7062bd34db5442afc3fe8e9178b24c32,闲窗 日上三竿 竹 窗下 娇娥 整 轮辐 匆匆 未暇 理 云鬟 半朵 青鸦 倚 红玉 青梢 摘尽 银 香囊 画栏平 倚 斑 筠 筐 时 将 纤手 翻雪霜 酥胸 玉面 同 光芒 捧 归 细 卷 银 成索 牵出 松松 云一握 珠唇 呵 挺 气温 温 鹦觜 踏 车 声 络 络 今年 莫怪 功绩 稀 阿 嬭 勒 绣 鸳鸯 帏 如今 织出 秋江练 十月 正好 裁 新衣 客心 闻 此 愁 无著 一夜 清寒 动寥寞 明朝 为 问买 一端 剪 做 道袍 披 落魄
684821f1-32f6-4178-b52c-4f95d2ac003b,送商府判,华岳,宋,诗,七言古体,比年十月君初来 梅花破雪迎君开 自从佐剑寿民脉 凋山瘵水皆春台 去年七月君开府 燕燕鶑鶑为君舞 五日尽蛰潭底龙 千里应无市中虎 今年二月君将归 风牵回柳萦君衣 君衣不作回柳转 直上云端朝紫微 紫微有馆名西掖 珠玉罗钿瞰金碧 郎星卿月谩徘徊 个中自是神仙宅 紫微有山名大坡 乌飞豸立冠峨峨 一声霹雳震天地 万里腥血流江河 紫微有旨垂丹册 二者于斯请君择 便须东取元化钧 谈笑从容正疆埸 君家事业铭冠裳 鸾凤指日鸣朝阳 伊洛诸公有政事 洙泗诸子无文章 禀违展转情难处 溪上恩波湛今古 东风吹恨入长亭 零落桃花泪如雨,"7,7,7,7,7,7,7,7,7,7,7,7,7,7,7,7,7,7,7,7,7,7,7,7,7,7,7,7,7,7,7,7",9a4bf998eaefcf0a1c5b59015d12a209,比 年 十月 君 初来 梅花 破 雪迎君 开 自从 佐剑寿 民脉 凋 山 瘵 水 皆 春 台 去年 七月 君 开府 燕 燕 鶑 鶑 为 君 舞 五日 尽 蛰 潭底 龙 千里 应 无市 中 虎 今年 二月 君 将 归 风 牵回 柳萦君 衣 君衣 不 作回 柳 转 直 上 云端 朝 紫微 紫微 有 馆名 西掖 珠玉 罗 钿 瞰 金碧 郎星卿 月 谩 徘徊 个 中 自是 神仙 宅 紫微 有 山名 大坡 乌飞 豸 立 冠 峨峨 一声 霹雳 震天 地 万里 腥 血流 江河 紫微 有 旨 垂 丹 册 二者 于斯 请 君择 便 须 东取 元化钧 谈笑 从容 正疆 埸 君家 事业 铭 冠裳 鸾凤 指日 鸣 朝阳 伊洛 诸公 有 政事 洙 泗 诸子 无 文章 禀违 展转 情 难处 溪 上 恩波湛 今古 东风 吹 恨 入 长亭 零落 桃花 泪如雨
5d7d149b-98df-4793-8903-1fb51b946ca1,平政桥,华岳,宋,诗,七言古体,建水合流三百里 直下富沙如撚指 溪东披拽缆过西 千丈春风怒涛起 香轮不解碾清江 造舟贯索成河梁 年年麦熟梅欲黄 连城千里皆波光 淳熙太守忧溱洧 问津日夜思无计 老农叉手愿鸠工 叠石中流使民济 金珠卖价不计缗 镌瑕断梓功方成 功成燕雀贺新屋 炳然万栋辉丹青 插天䗖𬟽横江尾 下压寒潭碧无底 市声不到画梁间 秋色尽归朱箔里 我行一月无风波 今朝醉眼翻青罗 金鳌背路客挥𩍐 玉虹跨浪舟飞梭 石唇喷尽寒崖雪 雪中电掣金蛇赤 两岸楼头将相家 八州车马神仙客 人言辟人推政平 故此特以平政名 我闻政事平如水 水到不平还作声,"7,7,7,7,7,7,7,7,7,7,7,7,7,7,7,7,7,7,7,7,7,7,7,7,7,7,7,7,7,7,7,7",492019775117e5291f7ff35ea1809289,建水 合流 三百里 直下富沙 如 撚 指 溪东 披 拽 缆 过西 千丈 春风 怒涛 起 香轮 不解 碾 清江 造舟 贯索 成河 梁 年 年 麦 熟 梅欲 黄 连城 千里 皆 波光 淳熙 太守 忧 溱 洧 问津 日夜 思无计 老农 叉手 愿鸠 工 叠石 中流 使 民济 金珠 卖价 不计 缗 镌 瑕断梓 功 方成 功成 燕雀 贺 新屋 炳 然 万栋 辉 丹青 插 天 䗖 𬟽 横江 尾 下压 寒潭碧 无底 市 声 不到 画梁 间 秋色 尽 归 朱箔 里 我行 一月 无 风波 今朝 醉眼 翻 青罗 金鳌 背路 客挥 𩍐 玉虹 跨 浪 舟 飞梭 石唇 喷尽寒崖雪 雪 中 电 掣 金蛇 赤 两岸 楼头 将相 家 八州 车马 神仙 客 人言 辟 人 推 政平 故此 特以平 政名 我 闻 政事 平如水 水 到 不平 还 作声
2e4676a1-6a72-49e1-aa3b-e1437a8bed8d,赠陈道人,华岳,宋,诗,杂言,君不见樵人王翰画山水 一夜风雷揭窗纸 又不见长沙洞清画龙蛇 满轴烟云翻撚指 二子相去数百年 笔端妙意谁能传 双溪道人何所授 一见笔法堪齐肩 笔一淡 轻烟映出垂杨岸 远山依约有还无 斜照不红秋水漫 笔一浓 黑云万叠翻狂风 江天日暮暗烟霭 天地星斗皆昏朦 潇湘诗人不解语 被君吐作无声句 何时觅取绡一缣 写我英姿伴烟雨,"10,7,10,7,7,7,7,7,3,7,7,7,3,7,7,7,7,7,7,7",59f33e03c6e7c96a8d0c1c8f31b2d678,君不见 樵人 王翰 画 山水 一夜 风雷 揭 窗纸 又 不见 长沙 洞 清画 龙蛇 满轴 烟云 翻 撚 指 二 子 相去 数百年 笔端 妙 意 谁 能 传 双溪 道人 何 所 授 一 见 笔法 堪 齐肩 笔 一淡 轻 烟 映出 垂杨 岸 远山 依约 有 还 无 斜照 不 红 秋水 漫 笔 一 浓 黑云 万叠 翻 狂风 江天 日暮 暗 烟霭 天地 星斗 皆 昏朦 潇湘 诗人 不解 语 被 君 吐 作 无声 句 何时 觅取 绡 一 缣 写 我 英姿 伴 烟雨
173604f4-f691-4ebb-b62c-28340d9e0c0a,柴氏,华岳,宋,诗,杂言,节妇一樽酒 义士拜而受 义士一首诗 节妇双眉皱 眉皱意何如 有难难相救 叹我廊庙器 淹回在污陋 惠我旨且嘉 慇懃推意厚 吾今系闽建 家贫喜邻富 青眼到朱扉 白屋成华胄 吾闻孤竹子 周室三缄口 又闻杞梁妻 秦邦称烈妇 此辈诚间生 世代不常有 如何天一方 同时俱辐凑 愧无八品珍 草草具笾豆 何当再拜抠我衣 巵酒恭为儿女寿,"5,5,5,5,5,5,5,5,5,5,5,5,5,5,5,5,5,5,5,5,5,5,5,5,7,7",afe4fe730ef3559fb6661df4548e1a4b,节妇 一 樽 酒 义士 拜 而 受 义士 一首 诗 节妇 双 眉皱 眉皱 意 何如 有 难 难 相救 叹 我 廊庙 器 淹回 在 污陋 惠 我旨 且 嘉 慇 懃 推 意 厚 吾 今 系 闽建 家贫 喜邻富 青眼 到 朱 扉 白屋 成 华胄 吾 闻 孤 竹子 周室 三 缄口 又 闻 杞梁 妻 秦邦 称 烈妇 此辈 诚间 生 世代 不 常有 如何 天 一方 同时 俱 辐凑 愧 无 八品 珍 草草 具 笾 豆 何 当 再拜 抠 我 衣 巵 酒 恭 为 儿女 寿
1ba6435a-928e-4ceb-8c3f-58a4c715d950,伤春,华岳,宋,诗,杂言,衣袂怯春寒 春在江南岸 我意正伤春 复被春萦绊 一雨臙脂湿 万壑冰澌泮 撩我惜春心 与春伤烂漫 柳垂不染丝 织成愁一片 杏吐无烟火 烧碎肠千断 忆昔腰如柳 柳腰轻易按 忆昔面如花 花面娇难唤 人不似春芳 随处得看玩 因春忆美人 不见徒扼腕 何时醉卧花柳中 一笑千金不容换,"5,5,5,5,5,5,5,5,5,5,5,5,5,5,5,5,5,5,5,5,7,7",385fb37ae9e00743be76b805292cb5d0,衣 袂 怯 春寒 春在 江南 岸 我 意 正 伤 春 复 被 春 萦 绊 一 雨 臙脂 湿 万 壑 冰澌泮 撩 我 惜 春心 与 春 伤 烂漫 柳垂 不 染丝 织成 愁 一片 杏 吐 无 烟火 烧 碎肠千断 忆昔 腰 如 柳 柳腰 轻易 按 忆昔 面如花 花面 娇难 唤 人 不似 春芳 随处 得 看 玩 因 春忆 美 人 不见 徒 扼腕 何时 醉卧 花柳 中 一笑千金 不容 换
baf18fcf-d824-4d7d-a92f-062450ea8702,百舌,华岳,宋,诗,七言古体,流鶑一去无消息 燕怯春寒归未得 绿窗清昼静无人 似把衷情诉知识 上苑东风二月春 淡黄杨柳初成阴 解将一片无情舌 学尽百般能语禽 红英紫萼纷如雪 万姹千娇总饶舌 莫嫌花外太啁啾 默默难酬好时节 须臾绿暗红亦稀 伯劳杜宇鹰鹯飞 更兼猎弋恣罗网 卷舌不语全毛衣 堪嗟国士徒切直 不似幽禽明语默 何如钳口归山林 莫问燕南并越北,"7,7,7,7,7,7,7,7,7,7,7,7,7,7,7,7,7,7,7,7",5e484038be604b5ccdcc3089ea7f90f2,流 鶑 一 去 无 消息 燕 怯 春寒 归 未 得 绿窗 清 昼静 无人 似 把 衷情 诉 知识 上苑 东风 二月 春 淡黄 杨柳 初成 阴 解 将 一片 无情 舌 学尽 百般 能 语禽 红英紫 萼纷 如 雪 万 姹千娇 总 饶舌 莫 嫌 花 外 太 啁啾 默默 难酬 好时节 须臾 绿 暗红 亦 稀 伯劳 杜宇 鹰 鹯 飞 更 兼 猎 弋 恣 罗网 卷舌 不语 全 毛衣 堪 嗟国 士徒 切直 不似 幽禽 明语默 何如 钳口 归 山林 莫 问 燕南 并 越北
63c83ad5-8543-4d02-a5db-f3744582ed62,饮仙阁,华岳,宋,诗,七言古体,槽头压尽春山绿 槽下真珠泻醽醁 骚人一笑倾盖盘 满面春风涨红玉 少陵得此不欲言 乃指八子为中仙 主人倾盖慕此意 一阁新构堂西偏 于今世态薄于纸 何必劳心问青紫 愿君醉我金屈巵 万事过耳同风飞 醺醺和月尚栽竹 长啸一声归翠微,"7,7,7,7,7,7,7,7,7,7,7,7,7,7",28bc59e71639276dafff4b05b7833f2d,槽头 压尽 春 山绿 槽 下 真珠 泻 醽 醁 骚人 一 笑 倾盖 盘 满面春风 涨红 玉 少陵 得 此不欲言 乃 指 八子 为 中仙 主人 倾盖 慕此意 一 阁 新构 堂 西偏 于今 世态 薄 于 纸 何必 劳心 问 青紫 愿君 醉 我 金 屈 巵 万事 过 耳同风飞 醺醺 和 月 尚 栽 竹 长啸 一声 归 翠微
4849f79e-b4a2-4fe4-8f56-2ba4fe7d15f5,赠祝跛,华岳,宋,诗,五言古体,我生多蹇难 事业冷于水 内外两五行 丑恶讳人举 武夷有跛者 抱术徧荆楚 抠衣忽趋隅 觌面便相许 摇手无所需 再拜拂毫楮 一诗聊赠行 无以壮箱筥 他时了功名 为结烟霞侣,"5,5,5,5,5,5,5,5,5,5,5,5,5,5",9ba34fb67b9fb5068936805e94323582,我 生 多 蹇 难 事业 冷于 水 内外 两 五行 丑恶 讳人举 武夷 有 跛者 抱 术 徧 荆 楚 抠 衣 忽 趋 隅 觌 面 便 相许 摇手 无所 需 再拜 拂 毫 楮 一 诗 聊 赠行 无以 壮 箱 筥 他时 了 功名 为 结 烟霞 侣
bf021dfa-e20c-4c65-a002-504b050da01d,富沙道中述怀,华岳,宋,诗,五言律诗,败鼓非全材 毁瓦不自牧 造物儿未戏 达人火先扑 卜不到渭滨 人徒嗟海曲 彼哉真彼哉 伐尽牛山木,"5,5,5,5,5,5,5,5",4a384d052be1b65c400345e56ff5ffcb,败 鼓非 全材 毁 瓦 不 自牧 造物 儿 未 戏 达人 火 先 扑 卜 不到 渭滨 人徒 嗟 海曲 彼 哉 真彼哉 伐 尽 牛 山木
d39a61de-b6e4-41dc-9006-ddeacccd7853,骤雨,华岳,宋,诗,七言律诗,牛尾乌云泼浓墨 牛头风雨翩车轴 怒涛顷刻卷沙滩 十万军声吼鸣瀑 牧童家住溪西曲 侵早骑牛牧溪北 慌忙冒雨急渡溪 雨势骤晴山又绿,"7,7,7,7,7,7,7,7",f1e64e2470c6747f0fdc7f505320a4f4,牛尾 乌云 泼 浓墨 牛头 风雨 翩 车轴 怒涛 顷刻 卷 沙滩 十万 军声 吼鸣 瀑 牧童 家住 溪 西曲 侵 早 骑 牛牧 溪北 慌忙 冒雨 急 渡溪 雨势 骤 晴 山 又 绿
dc6080b5-aca0-4d83-a3c5-51c5dc193de5,别王泰之,华岳,宋,诗,七言律诗,黄尘漫漫小峰路 白石齿齿茗坑渡 相亭南来第一程 人烟萧条岁云暮 故人小隠三家村 约我旗亭聊一樽 相逢此地复相别 明朝怀抱同谁论,"7,7,7,7,7,7,7,7",6ec4393c3e177330ac482ff614d1a276,黄尘 漫漫 小峰 路 白石 齿 齿 茗 坑 渡 相亭 南来 第一 程 人烟 萧条 岁 云 暮 故人 小 隠 三家村 约 我 旗亭聊一樽 相逢 此地 复 相别 明朝 怀抱 同 谁 论
1498c0c1-1fc3-4dae-b603-b6b20d97b7b1,江上双舟催发,华岳,宋,诗,七言古体,前帆风饱江天阔 后帆半出疎林阙 后帆招手呼前帆 画鼓轻敲总催发 前帆雪浪惊飞湍 后帆舵尾披银山 前帆渐缓后帆急 相傍俱入芦花滩 岛屿萦回断还续 沙尾夕阳明属玉 望中醉眼昏欲花 误作闲窗小横轴,"7,7,7,7,7,7,7,7,7,7,7,7",2830aaf8fa304ff9e5aeddd1b494ca2e,前帆风饱 江天 阔 后帆 半 出 疎 林 阙 后帆 招手 呼前帆 画鼓 轻敲 总 催发 前帆雪浪惊 飞湍 后帆 舵 尾 披 银山 前帆渐缓 后帆急 相傍俱入 芦花 滩 岛屿 萦回 断 还续 沙尾 夕阳 明属玉 望中 醉眼 昏欲花 误作 闲窗 小 横轴
617b08c6-d793-462b-840e-1300efb5ef65,慰吴吉甫县尉,华岳,宋,诗,五言古体,子针如京师 一室膏鼎脔 兄室虽被戕 一妻犹可免 伯奢事行役 八子俱蹂践 兄家祸虽剧 一女特婉娈 女死固可伤 殊未敌冠冕 妻在固全躯 丧女忧莫遣 大厦既灰飞 丰储皆席卷 鹡鸰起叹嗟 鸾凰徒展转 我昔以难勤 荷兄垂劝勉 兄今以难告 倍觉泪淟涊 泛观天之理 祸福尝相反 有难既不死 他时非浅浅 去兄一牛鸣 为地良非远 不能见兄慰 面目实有腼 自料吾与兄 气量及者鲜 胡为苍者天 与子独羁蹇,"5,5,5,5,5,5,5,5,5,5,5,5,5,5,5,5,5,5,5,5,5,5,5,5,5,5,5,5,5,5,5,5",06de38c0c384cfe94d6377678dab028e,子针 如 京师 一室膏鼎脔 兄室 虽 被 戕 一 妻 犹可 免 伯奢 事 行役 八子 俱 蹂践 兄家 祸 虽 剧 一女 特婉 娈 女 死固 可伤 殊未敌 冠冕 妻 在 固 全躯 丧女忧莫遣 大厦 既灰 飞 丰储皆 席卷 鹡鸰起叹嗟 鸾 凰 徒 展转 我 昔 以 难勤 荷兄 垂 劝勉 兄 今 以 难告 倍觉 泪 淟 涊 泛观天之理 祸福 尝 相反 有 难 既 不 死 他时 非 浅浅 去 兄 一牛鸣 为 地良 非远 不能 见 兄 慰 面目 实有 腼 自料 吾 与 兄 气量 及者 鲜 胡 为 苍者 天 与 子独羁 蹇
604f8a24-643d-4e51-8291-703cf2a702c2,赠刘相士,华岳,宋,诗,五言古体,班超未侯汉 谁识乌孙客 韩信已王齐 谁知长乐厄 彼亦非异术 忠谀分黑白 直道世且违 彼亦何足责 自古勋业人 把镜惟自索 顾我洒落资 足可振翰翮 如何汗马秋 英雄尚南谪 祇应捻胎鬼 手段不合格 古括子刘子 阅人几千百 一见麞鼠质 便许正疆埸 知子忠且谀 愚固未暇择 万一符子言 亦可名简册 它时双蹇馿 约子访黄石,"5,5,5,5,5,5,5,5,5,5,5,5,5,5,5,5,5,5,5,5,5,5,5,5,5,5",c838f19516df9929ee5111028c80b84a,班超 未 侯汉 谁 识 乌孙客 韩信 已王 齐 谁知 长乐 厄 彼 亦非 异术 忠 谀 分 黑白 直道 世 且 违 彼 亦 何足 责 自古 勋业 人 把 镜 惟 自索 顾 我 洒落 资 足 可 振翰翮 如何 汗马 秋 英雄 尚南谪 祇 应 捻 胎 鬼 手段 不 合格 古括子 刘子 阅人 几千 百 一 见 麞 鼠 质 便 许正疆 埸 知子 忠且谀 愚固 未暇 择 万一 符子言 亦可 名 简册 它时 双 蹇 馿 约子 访 黄石
fe0bc932-b360-450c-be28-b9d18474bc54,诮胡同巡,华岳,宋,诗,五言古体,岳昔游时卿 兄尝过敝庐 扪心论事业 耐久良非虚 岳今隶城旦 气象诚惨舒 髠黥塞粪壤 敢辱长者车 尝闻古人交 穷达无亲疎 富贵不相忘 有终还有初 与兄三载别 无日不引裾 中间喜一见 欣慰云何如 相去天一涯 云涛疏鴈鱼 忽闻夙驾回 喜色喧门闾 相闻即相别 厥意良踌躇 尝闻郢中人 结客于樵渔 又闻淮南王 受德于刑余 岳既不自检 失身堕籧篨 壮士视一死 其犹尔欷歔 势分已霄壤 孤托难相于 愿兄此召还 巍然奉中除 前岩与西阁 谈笑看连茹 或过赵可父 为岳声起居 薰风有良便 当拜平安书,"5,5,5,5,5,5,5,5,5,5,5,5,5,5,5,5,5,5,5,5,5,5,5,5,5,5,5,5,5,5,5,5,5,5,5,5,5,5,5,5",32920698304f6b218f3a8811f02560ee,岳昔游 时 卿 兄 尝 过 敝 庐 扪心 论 事业 耐久 良 非虚 岳今隶 城旦 气象 诚惨 舒 髠 黥 塞 粪壤 敢辱 长者 车 尝闻 古人 交 穷达 无 亲 疎 富贵 不 相忘 有终 还有 初 与 兄 三载 别 无日 不 引 裾 中间 喜一见 欣慰 云 何如 相去 天一 涯 云涛 疏 鴈 鱼 忽闻 夙 驾回 喜色 喧 门 闾 相闻 即 相别 厥 意良 踌躇 尝 闻 郢 中 人 结客 于 樵渔 又 闻 淮南 王 受 德 于 刑余 岳 既 不 自检 失身 堕 籧 篨 壮士 视一死 其 犹 尔 欷 歔 势分 已 霄壤 孤托 难相 于 愿兄 此 召还 巍然 奉 中 除 前岩 与 西阁 谈笑 看连 茹 或过 赵可父 为 岳声 起居 薰风 有 良便 当拜 平安 书
