id,title,author,dynasty,genre,poem_type,sentences_simplified,meter_pattern,hash,words
1896f74f-66d7-48bb-8824-3c7a418751e7,林容州別墅,劉克莊,唐,诗,五言古体,出郭五里强 治地十亩宽 奇峰面朝挹 高阜背屈蟠 忽献若神授 久閟由天悭 兹焉卜寿宫 朱垩浮林端 使君世虑澹 出岭颜如丹 静思三窟危 孰如一丘安 莳松既森秀 引泉亦甘寒 愿言奉巾屦 暇日来盘桓,"5,5,5,5,5,5,5,5,5,5,5,5,5,5,5,5",3cf09e0a41dfe1c6bdaef94678300046,出 郭 五里 强 治地 十亩 宽 奇峰 面朝 挹 高阜 背 屈蟠 忽 献 若 神授 久 閟 由 天 悭 兹 焉 卜寿宫 朱 垩 浮 林端 使君 世虑 澹 出 岭 颜如丹 静思三 窟 危 孰 如一 丘安 莳松 既 森秀 引泉亦甘寒 愿言 奉 巾 屦 暇日 来 盘桓
1eb5320c-18e2-4027-a259-c4cc45223a76,哭林山人,劉克莊,唐,诗,五言律诗,僵卧茅簷下 怡然八十春 竟无衾覆首 惟有钟随身 赙吊稀来客 封崇托外亲 自言坟出贵 后必产奇人,"5,5,5,5,5,5,5,5",fa25a31f383d2f62091a636ad9cd5ed4,僵卧 茅簷 下 怡然 八十 春 竟 无 衾 覆 首 惟有 钟 随身 赙 吊 稀 来客 封崇托 外亲 自言坟出贵 后 必 产 奇人
e65f1559-64ed-40cc-8331-cf1961407ddf,挽方孚若寺丞二首  其一,劉克莊,唐,诗,七言律诗,使君神隽似龙麟 行地飞空不可驯 诗里得朋卿与我 酒边争霸世无人 宝钗去尽中年病 珠履来疎晚节贫 昔共诛茅听瀑处 溪云谷月亦悲辛,"7,7,7,7,7,7,7,7",a2927f60a55e56bac2279a39929f9656,使君 神 隽 似 龙麟 行地 飞空 不可 驯 诗 里 得 朋卿 与 我 酒边 争霸 世 无人 宝钗 去 尽 中年 病 珠 履 来 疎 晚节 贫 昔 共诛茅 听 瀑处 溪云谷 月 亦 悲辛
cb248c61-0b6c-4249-92c4-10450dbee4da,挽方孚若寺丞二首  其二,劉克莊,唐,诗,七言律诗,斯人讵意掩斯丘 六合茫茫不可求 射虎山中如昨日 骑鲸海上忽千秋 帝方欲老长沙傅 虏尚能言博望侯 回首濑溪溪畔路 跛馿无复从公游,"7,7,7,7,7,7,7,7",ebeee8032dca878338f6dae33a380dcf,斯人 讵 意掩 斯丘 六合 茫茫 不可 求 射 虎山 中 如 昨日 骑鲸 海上 忽 千秋 帝方 欲 老 长沙 傅 虏 尚 能 言 博望侯 回首 濑溪 溪畔 路 跛馿 无 复 从 公 游
3cf80784-6de6-491c-9e5a-125fb9be100b,挽方武成二首  其一,劉克莊,唐,诗,五言律诗,颇有翁标致 唐衣折角巾 虽疑头小锐 极爱腹精神 阔矣云霄志 悲哉露电身 世间无妙质 一恸惜斯人,"5,5,5,5,5,5,5,5",a8df02418c154563464cdd811f7e35d8,颇 有 翁 标致 唐衣 折角 巾 虽 疑头 小锐 极 爱 腹 精神 阔 矣 云霄 志 悲哉 露电身 世间 无妙 质 一 恸惜 斯人
df5aad2c-0587-4ceb-848b-d563cb60ffc7,挽方武成二首  其二,劉克莊,唐,诗,五言律诗,丱角诗名出 流传海内夸 师称起予者 翁问倩人邪 惜未参诸老 犹堪擅一家 从今崖瀑上 谁共访梅花,"5,5,5,5,5,5,5,5",91e81235653716b16e28409698b3c1e3,丱 角 诗名 出 流传 海内 夸 师称 起予 者 翁问倩 人 邪 惜 未 参诸 老 犹堪 擅 一家 从今 崖 瀑 上 谁 共访 梅花
733e8a3d-5ef8-4f50-b35c-b01f781a7646,福州道山亭,劉克莊,唐,诗,七言绝句,绝顶烟开霁色新 万家台观密如鳞 城中楚楚银袍子 来读曾碑有几人,"7,7,7,7",7387a0ac2347c407af46f5e694e71417,绝顶 烟 开 霁色 新 万家 台观密 如 鳞 城中 楚楚 银 袍子 来读 曾 碑 有 几 人
d1c8f1e3-7a48-4711-b576-fdad0554aefe,建州,劉克莊,唐,诗,七言绝句,风紧云高雪尚悭 建州城北倚阑干 林梢淡日红如线 应为梅花煖晚寒,"7,7,7,7",805fb9fefffc1d5330e704273c2da241,风 紧 云高雪 尚 悭 建 州 城北 倚 阑干 林梢淡 日 红 如 线 应为 梅花 煖 晚 寒
c1370113-d151-4ff2-ad7a-2d67f2973ff5,起來,劉克莊,唐,诗,七言绝句,起来呵手检衣篝 烛影蛩声伴小楼 頼有梦中堪细说 锦牋写不尽离愁,"7,7,7,7",36446714eb0be2e209fbbbdc1fc0bebc,起来 呵手 检衣 篝 烛影 蛩 声 伴 小楼 頼 有 梦 中 堪 细说 锦 牋 写 不尽 离愁
0bbb9f98-70c7-4add-b329-ec768b36af9b,入浙,劉克莊,唐,诗,七言绝句,浦城南畔只轻阴 入浙方惊雪许深 梅皜枫丹三百里 笑人短幅写寒林,"7,7,7,7",849a2bef90cffac3f1cc9f793e2de8a4,浦城 南畔 只 轻 阴 入 浙 方 惊雪许深 梅 皜 枫 丹 三百里 笑人 短幅 写 寒林
0904fd7b-ca3b-44ed-9eb0-2ac6b3071542,寄人,劉克莊,唐,诗,七言绝句,老携诗卷入京华 觅店先须近酒家 白发但能妨进取 未妨痛饮插梅花,"7,7,7,7",5132fa8b7ff812b6f804380d2d8a27ff,老 携 诗 卷入 京华 觅 店 先须 近 酒家 白发 但 能妨 进取 未妨 痛饮 插 梅花
90566890-c032-4787-8370-5b32365b8236,壽昌,劉克莊,唐,诗,七言绝句,山路泥深雪未干 病身初怕浙西寒 新年台历无人寄 且就村翁壁上看,"7,7,7,7",75f5f47c19317eedf95caeb1fa347168,山路 泥 深 雪 未 干 病身 初怕 浙西 寒 新年 台历 无人 寄 且 就 村 翁 壁上 看
3f427b18-a467-45ba-8547-43aca0d9e6cd,桐廬,劉克莊,唐,诗,七言绝句,桐庐道上雪花飞 一客骑馿觅雪诗 亦有扁舟蓑笠兴 江行却怕子陵知,"7,7,7,7",7a10b401b2fd33e070f71577ebf7cf90,桐庐 道 上 雪花 飞 一 客 骑 馿 觅 雪 诗 亦 有 扁舟 蓑笠 兴 江行 却 怕 子陵 知
b406fbfa-14cb-4f75-8d4c-58077e0e09ec,富陽,劉克莊,唐,诗,七言绝句,便著羊裘也不难 山林未有一枝安 富春耕种桐江钓 却羡先生别墅宽,"7,7,7,7",ea91cf399acc38c993f8d3b993d36ea8,便著 羊裘 也 不难 山林 未有 一枝 安 富春 耕种 桐江 钓 却 羡 先生 别墅 宽
58cae95f-9122-4105-9483-1f9211eb3224,記夢,劉克莊,唐,诗,七言绝句,父兄诲我髧髦初 老不成名鬓发疎 纸帐铁檠风雪夜 梦中犹诵小时书,"7,7,7,7",7499b49a73a0ad0038eb02478caed2ca,父兄 诲 我 髧 髦 初 老 不 成名 鬓发 疎 纸 帐 铁 檠 风雪 夜 梦 中 犹诵 小时 书
1f5e9b00-66d1-4d74-9edf-66ab16d0f961,出都,劉克莊,唐,诗,七言绝句,客子来时腊雪飞 出城忽已试单衣 湖边移店非无意 要共林逋话别归,"7,7,7,7",50e0a6ce8d5137926080d6dc01eeecb5,客子 来时 腊雪 飞 出城 忽已 试 单衣 湖边 移店 非 无意 要 共林 逋 话别 归
cee41adc-2164-439e-b378-27d7fb5d6c45,題硯,劉克莊,唐,诗,七言绝句,吾砚平生极自珍 涂云抹月发清新 临归携就西湖洗 不受东华一点尘,"7,7,7,7",fff6ae38c4da6712763728c270e009bc,吾 砚 平生 极 自珍 涂云 抹 月 发 清新 临归 携 就 西湖 洗 不 受 东华 一点 尘
f3b8fee6-cc4f-4634-ae86-58fc42d243e7,杜丞,劉克莊,唐,诗,五言律诗,忆冒重围入 孤城頼不亡 战功何日赏 檄草至今藏 旧事归诗卷 新寒入箭创 江边逢杜杲 鬓发各苍苍,"5,5,5,5,5,5,5,5",eac0ec18add019d362130d874e2d964f,忆 冒 重围 入 孤 城 頼 不 亡 战功 何日 赏 檄草 至今 藏 旧事 归 诗卷 新 寒 入 箭 创 江边 逢 杜杲 鬓发 各 苍苍
f66fc093-2874-49b5-94ad-eea8b1372460,久客,劉克莊,唐,诗,五言律诗,久客长安市 人情薄似云 宁为绝交论 不著送穷文 白发长千丈 黄金尽百斤 故山春事动 深恐废耕耘,"5,5,5,5,5,5,5,5",abcca7cfe5a2371670575542ada00c6b,久 客 长安 市 人情 薄似云 宁 为 绝交 论 不著 送 穷 文 白发 长 千丈 黄金 尽 百斤 故山 春事动 深恐 废 耕耘
128645df-dc04-4359-aa70-cfc374722304,贈陳起,劉克莊,唐,诗,七言律诗,陈侯生长纷华地 却以芸香自沐熏 炼句岂非林处士 鬻书莫是穆参军 雨簷兀坐忘春去 雪案清谈至夜分 何日我闲君闭肆 扁舟同泛北山云,"7,7,7,7,7,7,7,7",2b6812973f9282af03540c8c7296cb19,陈侯 生长 纷华 地 却 以 芸香 自沐熏 炼句 岂非 林 处士 鬻 书 莫 是 穆 参军 雨 簷 兀 坐忘 春去 雪案 清谈 至 夜分 何日 我 闲 君闭肆 扁舟 同泛 北山 云
cb8aa74d-663d-45ef-8650-d968135e3896,贈翁卷,劉克莊,唐,诗,五言律诗,非止擅唐风 尤于选体工 有时千载事 祇在一联中 世自轻前辈 天犹活此翁 江湖不相见 才见又西东,"5,5,5,5,5,5,5,5",24f59b1d6937265093e2059d0b70772f,非 止 擅 唐风 尤于 选体 工 有时 千载 事 祇 在 一 联 中 世 自轻 前辈 天犹活此 翁 江湖 不 相见 才 见 又 西东
1b9d8d08-ce4e-4329-9cc6-33a68bf5bd06,路傍桃樹,劉克莊,唐,诗,七言绝句,为爱桥边半树斜 解衣贳酒隔桥家 唐人苦死无标致 只识玄都观里花,"7,7,7,7",648f6332080540bbce15112f01b815a2,为 爱 桥边 半树 斜 解衣 贳 酒 隔 桥家 唐人 苦死无 标致 只识 玄都观里花
d4b78ff6-9d36-4794-9465-d3e1ffab6074,題壁,劉克莊,唐,诗,七言绝句,儿时挟弹长安市 不信人间果有愁 行遍江南江北路 始知愁会白人头,"7,7,7,7",fada6cab1942e6f7a4872994fa91764d,儿时 挟弹 长安 市 不 信 人间 果 有 愁 行遍 江南 江北 路 始知 愁 会 白人 头
9edb4f11-9dc6-450c-95a3-794e1085eeee,馬上口占,劉克莊,唐,诗,七言绝句,陌上秋千索渐收 金鞭懒逐少年游 晚风细落梨花点 飞上春衫总是愁,"7,7,7,7",3c2c06e64f750019a1ec8c8168f5c6bb,陌上 秋千 索渐 收 金鞭 懒 逐 少年游 晚风 细落 梨花 点 飞上 春衫 总是 愁
2f4eb6d8-c350-44d2-b6d6-455db670c737,挽李尚書二首  其一,劉克莊,唐,诗,五言律诗,韩范止如此 公乎事又艰 不陪冶城庙 合殉定军山 玺出千官贺 弓藏一老闲 雕戈提十万 犹记凯歌还,"5,5,5,5,5,5,5,5",ac6b58a0d1f9137ffa93208600639a24,韩范 止 如此 公乎 事 又 艰 不 陪 冶 城 庙 合 殉 定军山 玺 出 千 官 贺 弓藏 一 老 闲 雕戈 提 十万 犹记 凯歌 还
79249b5a-4420-4941-8025-3265cff48319,挽李尚書二首  其二,劉克莊,唐,诗,五言律诗,幕下多材隽 于今尽策勋 可怜狂处士 曾揖大将军 久戍儿郎老 新招部曲分 此生甘寂寞 有泪湿高坟,"5,5,5,5,5,5,5,5",c447178432840d9c8f4eb1ee0f24c274,幕下 多 材 隽 于今 尽 策 勋 可怜 狂 处士 曾揖 大将军 久 戍 儿郎 老 新 招部 曲分 此生 甘 寂寞 有 泪 湿 高 坟
53f97be3-cc4e-49d4-b32c-aaa472cad172,橋西,劉克莊,唐,诗,七言绝句,昔饮桥西岁月多 梨花深处待郎过 垂鞭欲访湔裙约 奈此萧萧鬓雪何,"7,7,7,7",51755cbdf1f104e6709fa0a88ddec92b,昔 饮 桥西 岁月 多 梨花 深处 待 郎 过 垂鞭欲访 湔 裙 约 奈 此 萧萧 鬓雪 何
fc068e73-a2ab-4d49-a8d3-ae67d6ad309f,黄田人家別墅繚山種海棠爲賦二絕  其一,劉克莊,唐,诗,七言绝句,万红扶路笑相迎 仿佛前身石曼卿 若向花中论富贵 芙蓉城劣海棠城,"7,7,7,7",f92389f5dda9df218a2e4466f741af72,万红扶 路 笑 相迎 仿佛 前身 石曼卿 若向花 中论 富贵 芙蓉城 劣 海棠 城
c99d7308-fbf3-4205-899c-b7392affbe03,黄田人家別墅繚山種海棠爲賦二絕  其二,劉克莊,唐,诗,七言绝句,海棠妙处有谁知 全在臙脂乍染时 试问玉环堪比否 玉环犹自觉离披,"7,7,7,7",73196cb36093cfe80bf3ec4dc1cb85a8,海棠 妙处 有 谁知 全在臙脂 乍 染 时 试问 玉环 堪 比否 玉环 犹 自觉 离 披
05b714dc-eb25-4b1d-8bd8-2b7a3400de6a,郭熙山水障子,劉克莊,唐,诗,杂言,高为峰岚下涛江 极目森秀涵苍凉 始知著色未造极 壹似丑女施铅黄 惊泉骇石聚幽怪 巨楠穹柏蟠老苍 鹿门寺 华子冈 是耶非耶远莫详 疑闻钟声起晻霭 似有帆影来微茫 陌穷渡绝雪满坂 馿鞍钓笠分毫芒 炎曦亭午试展玩 坐觉烟雨生缣缃 古来绝艺必名士 俗史辟易安敢当 大年脂粉米老狂 先朝仅数燕侍郎 吾闻汾阳子 贵购父画一笔不许它人藏 矮屏短轴已可宝 况此四幅垂华堂 呜呼主人谨护守 神雷鬼电或取将,"7,7,7,7,7,7,3,3,7,7,7,7,7,7,7,7,7,7,7,5,11,7,7,7,7",98ca1f9e5578374ad74c0d2f5f6811b4,高为峰 岚 下 涛 江 极目 森秀涵 苍凉 始知 著色 未造 极 壹 似 丑女 施 铅黄 惊泉骇石聚 幽怪 巨楠 穹柏 蟠 老 苍 鹿门寺 华子冈 是 耶非耶 远莫 详 疑闻 钟声 起 晻 霭 似 有 帆影 来 微茫 陌穷 渡绝 雪 满坂 馿 鞍 钓笠 分毫 芒 炎 曦 亭午 试展 玩 坐觉 烟雨 生 缣 缃 古来 绝艺 必 名士 俗史辟易 安 敢当 大 年 脂粉 米 老狂 先朝 仅 数 燕 侍郎 吾 闻 汾阳 子 贵购 父画 一笔 不许 它 人 藏 矮 屏 短 轴 已 可 宝 况此 四幅 垂华堂 呜呼 主人 谨 护守 神 雷鬼 电 或 取 将
780d0932-5b4e-4caf-9b73-5a62d4b29aa3,挽林夫人,劉克莊,唐,诗,五言律诗,奉使年三十 声名满四夷 奇哉何物媪 生此丈夫儿 墓竟同孙窆 家犹有妇持 向来称寿地 忍听鼓箫悲,"5,5,5,5,5,5,5,5",5148e959715740d22b9ba6b9717874c7,奉 使 年三十 声名 满四夷 奇 哉 何物 媪 生此 丈夫 儿 墓 竟 同 孙 窆 家 犹有 妇持 向来 称 寿地 忍听 鼓箫 悲
c4f90c47-dbda-41bb-bd72-d397e7a5d047,挽葉夫人,劉克莊,唐,诗,五言律诗,年与藁砧齐 来嫔自始笄 典刑丞相子 礼法大夫妻 怪𫛳惊频集 离鸾忍只栖 伤心衾含等 犹是嫁时赍,"5,5,5,5,5,5,5,5",be09eaff87d76cb9fe2cedeb6f8c75c0,年 与 藁 砧 齐 来 嫔 自始 笄 典刑 丞相 子 礼法 大 夫妻 怪 𫛳 惊 频集 离 鸾 忍 只 栖 伤心 衾 含 等 犹 是 嫁 时 赍
5e43a41a-7256-4763-814b-23d85c28410c,題洪使君詩卷,劉克莊,唐,诗,七言律诗,刻于芹泮士争披 传到茅庐我窃窥 突过韦郎森戟句 高如柳恽采苹诗 日惟坐啸熏沉水 间亦摇毫品荔支 况有太丘为小序 遥知流布满京师,"7,7,7,7,7,7,7,7",8e8227e22eead3ff286a339c916809cf,刻于 芹 泮士争 披 传到 茅庐 我 窃 窥 突过 韦郎森 戟 句 高 如 柳恽 采 苹诗 日 惟 坐啸 熏 沉水 间 亦 摇 毫品 荔支 况有 太丘 为 小序 遥知 流 布满 京师
63be5388-9f47-47a1-9015-33c515c81207,關仝驟雨圖,劉克莊,唐,诗,杂言,四山昏昏如泼墨 行人对面不相觌 凄乎太阴布肃杀 暗然混沌未开辟 千丈拏空蛰龙起 一声破柱春雷疾 我疑人间瓠子决 或是天上银河溢 异哉烟霏变态中 山川墟市明历历 茅寮竹寺互掩映 疎舂残磬渺愁寂 叟提鱼出寒裂面 童叱牛归泥没膝 羊肠峻坂去天尺 馿饥仆瘦行安适 林僧卸笠窘回步 海商抛矴忧形色 纵览鲲鹏信奇伟 戏看凫鴈亦萧瑟 乃知画妙与天通 模写万殊由寸笔 大而海岳既尽包 细如针粟皆可识 向来关生何似人 想见丘壑横胸臆 呜呼使移此手为文章 岂不擅场称巨擘,"7,7,7,7,7,7,7,7,7,7,7,7,7,7,7,7,7,7,7,7,7,7,7,7,7,7,9,7",71aa61e027383fce03e03dffb35c1e7d,四山 昏昏 如 泼墨 行人 对面 不相 觌 凄乎 太阴 布 肃杀 暗然 混沌 未 开辟 千丈 拏 空 蛰龙 起 一声 破柱 春雷 疾 我 疑 人间 瓠子 决 或是 天上 银河 溢 异哉 烟霏 变态 中 山川 墟 市明 历历 茅寮 竹寺 互 掩映 疎 舂 残 磬 渺 愁 寂 叟 提鱼 出寒 裂面 童 叱牛归泥 没膝 羊肠 峻 坂 去天 尺 馿 饥 仆 瘦 行 安适 林僧卸笠 窘 回步 海商 抛 矴 忧 形色 纵览 鲲鹏 信 奇伟 戏 看 凫鴈 亦 萧瑟 乃 知画妙 与 天通 模写 万 殊由寸笔 大 而 海岳 既 尽 包 细 如 针粟 皆 可识 向来 关生 何似 人 想见 丘壑 横 胸臆 呜呼 使移 此 手 为 文章 岂 不 擅场 称 巨擘
4675c2db-8d0d-4ff0-9837-1b2238164e09,哭左次魏二首  其一,劉克莊,唐,诗,五言律诗,少日一编书 中年丈二殳 乃知杜预智 谁谓狄山愚 小试飞箝策 方为进筑图 到头麟阁上 终不著臞儒,"5,5,5,5,5,5,5,5",22310222c4af261fa3042bc981a15e34,少 日 一 编书 中年 丈 二 殳 乃知 杜预智 谁 谓 狄山愚 小 试飞 箝策 方为 进筑 图 到头 麟 阁 上 终不 著 臞 儒
e935e856-dc33-4f09-9779-718ae476404c,哭左次魏二首  其二,劉克莊,唐,诗,五言律诗,甫痛何郎夭 丘明亦复然 因思题墓上 不若鬭樽前 剑马为谁得 琴书有女传 惟应千载下 配食雪堂僊,"5,5,5,5,5,5,5,5",5dc117586b5e86a1a6aa31d9f5bcd48f,甫 痛何郎夭 丘明 亦 复然 因 思题 墓 上 不 若 鬭 樽 前 剑马 为 谁 得 琴书 有 女 传 惟应 千载 下 配食 雪 堂 僊
d96e4cf5-edfb-41a8-8da8-c7280e8d48fd,寄永嘉王侍郎,劉克莊,唐,诗,五言律诗,珍重西清老 书来访薜萝 为邦应好在 作佛竟如何 花押常衙少 柑香静坐多 闻公须尚黑 未害小婆娑,"5,5,5,5,5,5,5,5",e92195f17f10e8b9b70617fb6e45de24,珍重 西清老 书 来访 薜萝 为 邦 应 好 在 作佛 竟 如何 花押 常衙 少 柑香 静坐 多 闻公 须 尚 黑 未害 小 婆娑
79e3e1b1-bf20-42e8-a8c6-827480805990,秋熱憶舊遊二首  其一,劉克莊,唐,诗,七言律诗,忆昔浮江更涉淮 早秋天气最佳哉 塞垣榆落蝉初少 泽国芦疎鴈已来 风露入怀诗笔健 关山满目笛声哀 南州九月犹𫄨绤 纵有清樽底处开,"7,7,7,7,7,7,7,7",c9a5d79f9886ca88e9d18da2c7ef5afd,忆昔浮 江 更 涉 淮 早秋 天气 最佳 哉 塞垣 榆落蝉 初少 泽国 芦 疎 鴈 已 来 风露 入怀 诗笔 健 关山 满目 笛声 哀 南州 九月 犹 𫄨 绤 纵有 清 樽 底处 开
ce5a4d8a-4cf4-4f07-a430-4e5c18eb6e86,秋熱憶舊遊二首  其二,劉克莊,唐,诗,七言律诗,塞上秋光冷似冰 当年豪举气凭陵 打毬不用炎方马 按猎初调异国鹰 山寨凄凉闻戍鼓 水村摇落见渔灯 而今病暍茅簷底 追记犹堪洗鬰蒸,"7,7,7,7,7,7,7,7",4235edc8e5390aa1529b0e82b92256c5,塞上 秋光 冷似 冰 当年 豪举 气 凭陵 打 毬 不用 炎 方马 按 猎 初 调 异国 鹰 山寨 凄凉 闻戍 鼓 水村 摇落 见 渔灯 而今 病 暍 茅 簷 底 追记 犹堪 洗 鬰 蒸
065c0235-591b-4ae5-82f0-737ea7adb1db,哭李景溫架閣,劉克莊,唐,诗,五言律诗,挟策说荆州 那知亦暗投 漫招温处士 几杀杜参谋 出幕有清议 还乡空白头 人间容不得 下与阿翁游,"5,5,5,5,5,5,5,5",eada4494e1973d10c9480269bc8b00ee,挟 策 说 荆州 那 知 亦 暗 投 漫 招温 处士 几 杀 杜 参谋 出幕 有 清议 还乡 空白 头 人间 容不得 下 与 阿翁 游
9128f3e5-b308-4ad5-b890-0d1453bea14b,送鄭端州,劉克莊,唐,诗,五言律诗,想入漳潮境 牙旗夹路红 帝方忧瘴俗 君可惠清风 海有沉珠户 岩无斲砚工 它年循吏传 要杂古人中,"5,5,5,5,5,5,5,5",408709b3224af11602fba0382cab5d10,想入 漳 潮境 牙旗 夹路 红 帝方 忧瘴俗 君可惠 清风 海 有 沉 珠户 岩 无 斲 砚 工 它 年 循吏 传 要 杂 古人 中
5239292c-6074-4fa1-b878-921b83da6db0,送方子約赴衢教,劉克莊,唐,诗,五言律诗,博士非如吏 巍然道自居 诸生趋避席 太守揖升车 朱笔浓批卷 青灯细勘书 汉廷重文藻 行矣召严徐,"5,5,5,5,5,5,5,5",31fed02625c3153dc6d94c903a2358e3,博士 非如吏 巍然 道 自居 诸生 趋避 席 太守 揖 升 车 朱笔 浓 批 卷 青灯 细 勘 书 汉廷重 文藻 行 矣 召 严徐
c43e95bc-1296-4974-8c2f-02039e6198ce,李園有懷孚若,劉克莊,唐,诗,七言律诗,曾与山公醉不归 李园水竹尚依稀 钿车疾取春鶑唱 铁笛潜惊宿鸟飞 昔把蟹螯同酒琖 今持马策叩城扉 溪头一片无情月 偏照愁人泪满衣,"7,7,7,7,7,7,7,7",e620d5918449d9fcf56b4116ccd2e495,曾 与 山公醉 不 归 李园 水竹 尚 依稀 钿 车 疾 取春 鶑 唱 铁笛 潜惊 宿鸟 飞 昔 把 蟹 螯 同 酒 琖 今 持 马策 叩 城扉 溪头 一片 无情 月 偏 照 愁人泪满衣
edf0747a-18a4-456f-bbe5-a455c422876e,送方阜高赴衡州法掾,劉克莊,唐,诗,五言律诗,仕不论高下 丝毫要及民 君其守三尺 古有活千人 岳树侵云杪 江蓠满水滨 楚芳饥可荐 切莫叹清贫,"5,5,5,5,5,5,5,5",bb509b32094d8407151caed48aba883f,仕 不论 高下 丝毫 要及 民 君 其 守 三尺 古 有活 千人 岳树 侵 云 杪 江蓠 满 水滨 楚芳 饥 可荐 切莫 叹 清贫
d0c0c4fa-1f93-48fd-b5cf-e5571ba497e2,答敖茂才,劉克莊,唐,诗,五言律诗,太傅品胡儿 樊川誉阿宜 既为诸父赏 焉用外人知 晓月家山梦 秋风客舍诗 桐城逢汝伯 一为说相思,"5,5,5,5,5,5,5,5",0f29cc8db8f77fed7b895d7bd59ef0a4,太傅 品 胡儿 樊川 誉 阿宜 既为 诸父 赏 焉用 外人 知 晓月家山 梦 秋风 客舍 诗 桐城 逢 汝伯 一为 说 相思
40c72030-13e7-4a35-88f9-8c2a001b2ffc,失貓,劉克莊,唐,诗,七言律诗,饲养年深性已驯 攀墙上树可曾嗔 击鲜偶羡邻翁富 食淡因嫌旧主贫 蛙跳阶庭殊得意 鼠行几案若无人 篱间薄荷堪谋醉 何必区区慕细鳞,"7,7,7,7,7,7,7,7",bd139c1167caf03d08bd33ff866517f2,饲养 年 深性 已 驯 攀 墙上 树 可 曾 嗔 击 鲜偶 羡邻 翁富 食 淡因 嫌 旧主 贫 蛙跳 阶庭 殊 得意 鼠行 几案 若 无人 篱间 薄荷 堪 谋醉 何必 区区 慕细鳞
86faf782-f1c3-4ed8-9380-2c33f86e2bc0,送張應斗還番昜,劉克莊,唐,诗,七言律诗,蕉荔漫山雾雨繁 虬须客子悔南辕 久留闽囝谁堪语 却忆番君可与言 豪杰虽穷留气在 圣贤不死有书存 归时洗换征衣了 拣个深山紧闭门,"7,7,7,7,7,7,7,7",8b389ee386dcd5f91ba8da2fc3d6648f,蕉荔 漫山 雾 雨 繁 虬须 客子 悔南辕 久留 闽 囝 谁 堪 语 却 忆 番 君 可 与 言 豪杰 虽 穷 留气 在 圣贤 不 死 有 书 存 归 时 洗换 征衣 了 拣 个 深山 紧闭 门
4e047130-bc25-4db3-beec-9227361482b5,爲圃二首  其一,劉克莊,唐,诗,七言律诗,屋边废地稍平治 装点风光要自怡 爱敬古梅如宿士 护持新笋似婴儿 花窠易买姑添价 亭子难营且筑基 老矣四科无入处 旋鉏小圃学樊迟,"7,7,7,7,7,7,7,7",7ededf3d47f89b069d88710e39f4b8ce,屋边 废地 稍 平治 装点 风光 要 自 怡 爱敬古梅 如 宿士 护持 新笋 似 婴儿 花 窠易 买姑 添价 亭子 难 营 且 筑基 老 矣 四科 无入 处 旋 鉏 小 圃 学 樊 迟
766f89f8-1ea3-46ef-9c2e-8cd0168ccc56,爲圃二首  其二,劉克莊,唐,诗,七言律诗,衰病归来占把茅 譬如僧葺退居寮 因存橘树斜通径 怕碍荷花小著桥 古有功名兴钓筑 今无物色到渔樵 可怜岁晚闲双手 种罢芜菁撷菊苗,"7,7,7,7,7,7,7,7",996166486d261e3bc262e3207e368971,衰病 归来 占 把 茅 譬如 僧 葺 退居 寮 因 存 橘树 斜通径 怕 碍 荷花 小 著桥 古有 功名 兴钓筑 今 无 物色到 渔樵 可怜 岁晚 闲 双手 种 罢 芜菁 撷 菊 苗
4a659aa1-ddd0-4138-a01f-9e62516b24ca,送黄舒文赴欽教,劉克莊,唐,诗,五言律诗,博士文中虎 垂髫已定交 雅宜对红药 胡乃涉黄茅 薄有先生饭 全无弟子嘲 犹胜迂阔者 荷锸垦荒郊,"5,5,5,5,5,5,5,5",04f28a153cf40942cfe272b3d2ed2220,博士 文中 虎 垂髫 已定 交 雅 宜 对 红药 胡乃涉 黄茅 薄 有 先生 饭 全 无 弟子 嘲 犹胜 迂阔 者 荷 锸 垦荒 郊
63d3fa74-a032-416f-af5b-fd9b1e3317fc,挽袁侍郎二首  其一,劉克莊,唐,诗,五言律诗,华发始遭逢 其如道不同 可曾留孟叟 俄已罢申公 谏草多传出 经疑尽解通 岂无南董氏 奋笔纪孤忠,"5,5,5,5,5,5,5,5",7f48254a410aeedaea0ecba58ca68a03,华发 始 遭逢 其 如 道 不同 可 曾 留 孟叟 俄 已 罢 申公 谏 草 多 传出 经疑尽解 通 岂 无 南 董氏 奋笔 纪孤忠
03ee7268-cc3b-49a1-97a3-8c8a9cecca1a,挽袁侍郎二首  其二,劉克莊,唐,诗,五言律诗,遗诰兼新讣 同时至荜门 龙髯先帝远 鲐背几公存 方恨三旌晚 俄惊一鉴昏 潸然关世道 不是哭私恩,"5,5,5,5,5,5,5,5",b81ce75c3e956d590d762a46655ad7f6,遗诰 兼新 讣 同时 至 荜 门 龙髯 先帝 远 鲐 背 几 公存 方恨 三旌晚 俄 惊一鉴昏 潸然 关 世道 不是 哭 私 恩
46aea541-661c-438a-a6e7-0ecea7a8ce00,敖器之宅子落成,劉克莊,唐,诗,七言律诗,臞翁卜筑向东臯 小憩江湖半世劳 遶屋树阴供杖屦 登楼山色发诗骚 客来贺厦杯行阔 市写抛梁纸价高 白虎渐台何处在 不如茅舍尚坚牢,"7,7,7,7,7,7,7,7",9dec08886a3b428d94fcc3baf382dde6,臞 翁 卜 筑 向东 臯 小憩 江湖 半世 劳 遶 屋 树阴 供 杖 屦 登楼 山色 发诗 骚 客 来 贺厦 杯行 阔 市 写 抛 梁 纸 价高 白虎 渐台 何处 在 不如 茅舍 尚 坚牢
d911dd80-ba6a-40fc-bc81-5dde44f63429,答陳珍,劉克莊,唐,诗,五言律诗,寂寂少游从 斯人未易逢 清贫今仲子 疎隽小元龙 君谨提诗笔 吾当避箭锋 勉旃鸣盛世 切勿效寒蛩,"5,5,5,5,5,5,5,5",97d9563e1698902bf82f942d687fc1d1,寂寂 少游 从 斯人 未易 逢 清贫 今仲子 疎 隽 小 元龙 君 谨 提诗 笔 吾 当避箭锋 勉 旃 鸣 盛世 切勿 效 寒 蛩
dfcffe18-4b02-49bb-9be6-dccaa069e858,挽表叔趙君任安撫二首  其一,劉克莊,唐,诗,五言律诗,丞相规恢策 家庭已习闻 宁论乘一障 真可帅中军 玉麈无能对 金钱有即分 心知伏波病 多半为忠勤,"5,5,5,5,5,5,5,5",31f04545414b7baf43871d3b089096cc,丞相 规 恢策 家庭 已 习闻 宁 论乘 一障 真可帅 中军 玉麈 无能 对 金钱 有即 分 心 知伏 波病 多半 为 忠勤
b0197efa-9855-4b6b-9692-5a2ba54d0613,挽表叔趙君任安撫二首  其二,劉克莊,唐,诗,五言律诗,叔在兵间日 书常笑我孱 初云机会易 晚叹事功难 寂寞郎官省 荒凉上将坛 遥怜会稽窆 新种短松寒,"5,5,5,5,5,5,5,5",8a4edc089864315580988c72b3269cc0,叔 在 兵间 日 书 常 笑 我 孱 初云 机会 易 晚 叹 事功 难 寂寞 郎官 省 荒凉 上将 坛 遥怜 会 稽 窆 新种 短松寒
