id,title,author,dynasty,genre,poem_type,sentences_simplified,meter_pattern,hash,words
7710cd6d-dd3a-42fe-b61f-1fce3668858b,致仕邵少卿挽辞二首  其一,王安石,宋,诗,五言律诗,谢朓城中守 梁鸿墓下归 素车驰吉路 丹旐卷寒辉 抚几虚容在 瞻图实貌非 无因置一酹 空此叹长违,"5,5,5,5,5,5,5,5",cb22be3569a0023da12e4909488aee42,谢 朓 城中 守 梁鸿 墓 下 归 素车 驰 吉 路 丹 旐 卷 寒 辉 抚 几 虚容 在 瞻图 实貌 非 无 因置 一 酹 空此 叹长 违
ccf522e4-c8e1-4a60-aaab-34cbb894f840,致仕邵少卿挽辞二首  其二,王安石,宋,诗,五言律诗,杯酒邗沟上 纷纷已十年 音容常想见 风迹每流传 老去元卿位 新开太守阡 庆门当更大 子弟固多贤,"5,5,5,5,5,5,5,5",b10fb732fee779d04ff08112c5ae345f,杯酒 邗沟 上 纷纷 已 十年 音容 常 想见 风迹 每 流传 老 去 元卿 位 新 开 太守 阡 庆门 当更 大 子弟 固 多贤
fa6e99ca-ba2e-4dcf-9245-5c59f83d17a7,葛郎中挽辞二首  其一,王安石,宋,诗,五言律诗,卷卷𰬸帷轻 空堂昼哭声 衣冠遗故物 杯案若平生 白马有悲送 赤车非古行 低徊九原日 光景在铭旌,"5,5,5,5,5,5,5,5",8b683ed260cffb09cb4247ac08c7fda8,卷 卷 𰬸 帷轻 空堂 昼 哭声 衣冠 遗故 物 杯案 若 平生 白马 有 悲 送 赤车 非古 行 低徊 九原 日 光景 在 铭旌
4738da3d-8b83-42fc-9284-72732a3e57e9,葛郎中挽辞二首  其二,王安石,宋,诗,五言律诗,蛮荆长往地 湖海独归时 旅榇蛟龙护 铭旌雁鹜随 此生要有尽 何物告无期 一片幽堂石 公知我不欺,"5,5,5,5,5,5,5,5",bbde9ac7d52153facd12c88baf25b2bf,蛮荆长往 地 湖海 独归 时 旅 榇 蛟龙 护 铭旌 雁 鹜 随 此生 要 有 尽 何物 告 无期 一片 幽堂 石 公知 我 不 欺
e364c936-532c-41d1-8f02-94f82863a1fe,悼王致处士,王安石,宋,诗,七言律诗,处士生涯水一瓢 行年七十更萧条 老妻稻下分遗秉 弱子松间拾堕樵 岂有声名高后世 遂无𫗴粥永今朝 穷魂散漫知何处 甬水东西不可招,"7,7,7,7,7,7,7,7",1e3b9d02eae7f390e625926f7564dccf,处士 生涯 水 一瓢 行 年 七十 更 萧条 老 妻稻 下 分遗 秉 弱子 松间 拾 堕 樵 岂 有 声名 高 后世 遂 无 𫗴 粥 永 今朝 穷魂 散漫 知 何处 甬水 东西 不可 招
a6db260d-167f-4006-8780-bd02ecb66e56,苏才翁挽辞二首  其一,王安石,宋,诗,五言律诗,空余一丹旐 无复两朱轓 寂寞蒜山渡 陂陀京口原 音容归绘画 才业付儿孙 尚有故人泪 沧江相与翻,"5,5,5,5,5,5,5,5",4b17ef0adad15d2e70c83b7b0394c6a8,空余 一 丹 旐 无复 两 朱 轓 寂寞 蒜 山 渡 陂陀 京口 原 音容 归 绘画 才业 付 儿孙 尚有 故人 泪 沧江 相与 翻
26bdccde-efbc-451a-92cd-c4edb3bf97f0,苏才翁挽辞二首  其二,王安石,宋,诗,五言律诗,翰墨随谈啸 风流在弟兄 浮名同逆旅 壮志负平生 使节何年去 丧车故老迎 悠悠京口外 落日照铭旌,"5,5,5,5,5,5,5,5",c86997a20a94400bea32d3dfbcb1189f,翰墨 随 谈啸 风流 在 弟兄 浮名 同 逆旅 壮志 负 平生 使节 何年 去 丧车 故 老迎 悠悠 京口 外 落 日照 铭旌
01ddd946-54dd-46a6-a42c-c6cd15877633,悼慧休,王安石,宋,诗,五言绝句,休公遂不起 难料复难忘 玉骨随薪尽 空留一分香,"5,5,5,5",08f8b254f2dbd34cbe57f30006919d7a,休 公 遂 不起 难料 复 难忘 玉骨 随薪尽 空留 一分 香
cd34e492-c43e-4a1c-b8d7-0c2f3cd28855,送吴显道五首  其一,王安石,宋,诗,杂言,五湖大浪如银山 问君西游何当还 以手抚膺坐长叹 空手无金行路难 丈夫意有在 吾徒且加餐 屏风九叠云锦张 千峰如连环 上有横河断海之浮云 可望不可攀 飞空结楼台 动影袅窕冲融间 沛然乘天游 下看尘世悲人寰 泊舟浔阳郭 去去翔寥廓 君今幸未成老翁 衰老不复如今乐,"7,7,7,7,5,5,7,5,9,5,5,7,5,7,5,5,7,7",d3d231faa323c6f9770266ef3b62ac86,五 湖 大浪 如 银山 问君 西游 何当 还 以 手 抚 膺 坐 长叹 空手 无金 行路难 丈夫 意有 在 吾 徒且 加餐 屏风 九叠 云锦 张 千峰 如 连环 上有 横河断海 之 浮云 可望 不可 攀 飞空 结 楼台 动影 袅窕冲 融间 沛然 乘 天游 下看 尘世 悲人寰 泊 舟 浔阳 郭 去去 翔 寥廓 君 今 幸未 成 老翁 衰老 不 复 如今 乐
8cc824a5-9091-424f-89af-d47c029cc5b0,送吴显道五首  其二,王安石,宋,诗,杂言,滕王高阁临江渚 东边日出西边雨 十五年前此会同 天际张帷列樽俎 公今此去何时归 我今停杯一问之 春风两岸水杨柳 昔日青青今在否 偶向东湖更向东 杏花两株能白红 落拓旧游应记得 插花走马月明中 荏苒荏苒瞻西海 明年花开复谁在 杏花杨柳年年好 南去北来人自老 少壮几时奈老何 与君把箸击盘歌 歌罢仰天叹 六龙忽蹉跎 眼中了了见乡国 自是不归归便得 欲往城南望城北 此心炯炯君应识,"7,7,7,7,7,7,7,7,7,7,7,7,7,7,7,7,7,7,5,5,7,7,7,7",756bbb4910e16080ae9d7938d53a3ba2,滕王 高阁 临江 渚 东边 日出 西边雨 十五年 前 此 会同 天际 张帷列 樽俎 公今 此去 何时 归 我 今 停 杯 一 问 之 春风 两岸 水 杨柳 昔日 青青 今在 否 偶向 东湖 更 向东 杏花 两株 能 白红 落拓 旧游 应 记得 插花 走马 月 明中 荏苒 荏苒 瞻 西海 明年 花 开复 谁 在 杏花 杨柳 年 年 好 南去北来 人 自 老 少壮 几时 奈 老何 与 君 把 箸 击 盘 歌 歌 罢 仰天 叹 六 龙 忽 蹉跎 眼中 了 了见 乡国 自是 不归归 便 得 欲 往 城南 望 城北 此 心 炯炯 君 应识
2e633ad7-5ffb-4646-9d61-c99314ac8b9f,送吴显道五首  其三,王安石,宋,诗,七言律诗,临川楼上柅园中 罗帏绣幕围香风 觥船一棹百分空 看朱成碧颜始红 杏花杨柳年年好 南去北来人自老 旧事无人可共论 惟君与我同怀抱,"7,7,7,7,7,7,7,7",b9f6c3092a891aa92002fb752146431d,临川 楼上 柅 园中 罗 帏绣 幕围 香风 觥船一 棹 百分 空 看朱成碧 颜始红 杏花 杨柳 年 年 好 南去北来 人 自 老 旧事 无人 可共论 惟 君 与 我 同 怀抱
ebc68fde-f003-4803-af9f-90f4a4eeab4b,送吴显道五首  其四,王安石,宋,诗,七言绝句,忽忆旧乡头已白 牙齿欲落真可惜 临江把臂难再得 江水江花岂终极,"7,7,7,7",cfab32d3a13e871212d83802cbc24577,忽 忆旧 乡头 已 白 牙齿 欲 落 真 可惜 临江 把 臂 难再 得 江水 江花 岂 终极
4db22b4b-acac-4f58-9ced-cf2231d21968,送吴显道五首  其五,王安石,宋,诗,七言绝句,百年多病独登台 知有归日眉放开 功名富贵何足道 且赋渊明归去来,"7,7,7,7",be2e439ff9e81be1d04eca8db9625c28,百年 多 病 独 登台 知有 归日眉 放开 功名富贵 何足道 且 赋 渊明 归去来
d7783f31-02e3-4922-a6ac-6fb44a642ad4,送吴显道南归,王安石,宋,诗,杂言,君不见蔡泽栖迟世看丑 豪气英风亦何有 忽然变轩昂 盛事传不朽 君今幸未成老翁 二十八宿罗心胸 何不上书自荐达 封侯起第一日中 秋月春风等闲度 山中旧宅无人住 宅中青桑叶宛宛 涧水流过田中路 遥知杨柳是门处 万里苍苍烟水暮 我欲寻之不惮远 君又暂来还径去 红亭驿路挂城头 忆君祇欲苦死留 天际张帷列樽俎 君歌声酸辞且苦 人生憔悴生理难 使人听此凋朱颜 劝君更尽一杯酒 明日路长山复山,"10,7,5,5,7,7,7,7,7,7,7,7,7,7,7,7,7,7,7,7,7,7,7,7",680ef2593c71c5efc3787d9f3d97590f,君不见 蔡泽栖 迟 世 看 丑 豪气 英 风 亦 何有 忽然 变 轩昂 盛事 传 不朽 君 今 幸未 成 老翁 二十八宿 罗 心胸 何不 上书 自荐 达 封侯 起 第一 日 中 秋月春风 等闲 度 山中 旧宅 无人 住 宅 中 青 桑叶 宛宛 涧 水流 过田 中路 遥知 杨柳 是 门处 万里 苍苍 烟水 暮 我 欲 寻 之 不惮 远 君 又 暂来 还 径 去 红亭 驿路 挂 城头 忆 君 祇 欲 苦 死 留 天际 张帷列 樽俎 君 歌声 酸辞 且 苦 人生 憔悴 生理 难 使 人 听 此 凋 朱颜 劝君 更 尽 一 杯酒 明日 路 长山 复山
04c016a1-32ba-497a-9e6e-6ed5358df678,送刘贡甫谪官衡阳,王安石,宋,诗,杂言,刘郎刘郎莫先起 遇酒当歌且欢喜 船头朝转暮千里 眼中之人吾老矣 九疑联绵皆相似 负雪崔嵬插花里 万里衡阳雁 寻常到此回 行逢二三月 好与雁同来 雁来人不来 如何不饮令心哀 莫厌潇湘少人处 谪官樽俎定常开,"7,7,7,7,7,7,5,5,5,5,5,7,7,7",6ca9e039e2711a3f5a2ac2d4bd18eb0b,刘郎 刘郎 莫先 起 遇酒 当歌 且 欢喜 船头 朝转暮 千里 眼中 之人 吾 老 矣 九 疑联绵 皆 相似 负雪 崔嵬 插花 里 万里 衡阳 雁 寻常 到此 回 行逢 二三月 好 与 雁 同来 雁 来 人 不 来 如何 不 饮 令心哀 莫厌 潇湘 少 人 处 谪 官 樽俎 定常 开
b9653e98-05dd-448b-973a-193635b9cc3d,赠宝觉,王安石,宋,诗,五言古体,大师京国旧 兴趣江湖迥 往与惠询辈 一宿金山顶 怀哉苦留恋 王事有朝请 别来能几时 浮念剧含梗 今朝忽相见 眸子清炯炯 夜阑接软语 令人发深省 化城出天半 远色有诸岭 白首对汀洲 犹思理烟艇,"5,5,5,5,5,5,5,5,5,5,5,5,5,5,5,5",c0259569b5f1a59b2ae6f639eb4029b4,大师 京国 旧 兴趣 江湖 迥 往 与 惠询 辈 一 宿金 山顶 怀哉 苦 留恋 王 事 有 朝 请 别 来 能 几时 浮念剧 含梗 今朝 忽 相见 眸子 清 炯炯 夜阑 接 软语 令人 发 深省 化城 出天 半 远色 有 诸岭 白首 对 汀洲 犹 思理 烟艇
8257ce9f-4a93-4a4c-9c12-f65e75349063,金山寺,王安石,宋,诗,五言古体,招提凭高冈 四面断行旅 胜地犹在险 浮梁袅相拄 大江当我前 飐滟翠绡舞 通流与厨会 甘美胜牛乳 扣栏出鼋鼍 幽姿可时睹 夜深殿突兀 太微凝帝宇 壁立两崖对 迢迢隔云雨 天多剩得月 月落闻津鼓 夜风一何喧 大舶夹双𫇛 颠沉在须臾 我自檝迎汝 始知像教力 但度无所苦 忆昨狼狈初 只见石与土 荣华一朝尽 土梗空俯偻 人事随转烛 苍茫竟谁主 咄嗟檀施开 绣楹盘万础 高阁切星辰 新秋照牛女 汤休起我病 转上青天去 摄身凌苍霞 同凭朱栏语 我歌尔其聆 幽愤得一吐 谁言张处士 雄笔映千古,"5,5,5,5,5,5,5,5,5,5,5,5,5,5,5,5,5,5,5,5,5,5,5,5,5,5,5,5,5,5,5,5,5,5,5,5,5,5,5,5",538ec34c62381c26bc267e2002bbdf0b,招 提凭 高冈 四面 断 行旅 胜地 犹 在 险 浮梁 袅相 拄 大江 当 我 前 飐 滟 翠 绡 舞 通流 与 厨会 甘美 胜 牛乳 扣 栏 出 鼋鼍 幽姿 可时睹 夜深 殿 突兀 太微 凝帝宇 壁立 两 崖 对 迢迢 隔 云雨 天 多 剩 得 月 月 落 闻津鼓 夜风 一何 喧 大舶 夹 双 𫇛 颠沉 在 须臾 我 自 檝 迎 汝 始知 像 教力 但度 无所苦 忆 昨 狼狈 初 只见 石 与 土 荣华 一朝 尽 土梗空 俯偻 人事 随 转烛 苍茫 竟 谁主 咄嗟 檀 施开 绣 楹 盘 万础 高阁 切 星辰 新秋照 牛女 汤休 起 我 病 转 上 青天 去 摄身 凌苍霞 同 凭 朱栏语 我 歌尔 其 聆 幽愤 得 一吐 谁 言 张 处士 雄笔映 千古
af98167b-4790-4122-8120-818a7099a68f,化城阁,王安石,宋,诗,五言古体,曾宫凭风回 两岸闻钟声 百里见秋毫 搆云有高营 化城若化出 仰攀日月行 俛视大江奔 众山遥相迎 大江蟠㠌根 旋流自成浪 却略罗翠屏 秀色各异状 楞伽海中山 迥出霄汉上 中有不死庭 天龙尽回向 惜哉不得往 侧坐渺难望 拥掩难恕宥 意欲铲叠嶂 登临独无语 一望一怊怅 忽忆少年时 孤屿坐题诗 空怀焉能果 唯有故人知,"5,5,5,5,5,5,5,5,5,5,5,5,5,5,5,5,5,5,5,5,5,5,5,5,5,5",8ecd75e60cad589b01fe1cfeae6d3051,曾宫 凭 风 回 两岸 闻 钟声 百里 见 秋毫 搆 云 有 高 营 化城 若 化出 仰攀 日月 行 俛 视 大江 奔 众山 遥相 迎 大江 蟠 㠌 根 旋流 自成 浪 却 略 罗翠屏 秀色 各 异状 楞伽 海 中山 迥出 霄汉 上 中有 不死庭 天龙 尽 回向 惜哉 不得 往 侧 坐渺难望 拥掩 难 恕 宥 意欲 铲 叠嶂 登临 独无 语 一 望 一 怊 怅 忽忆 少年 时 孤屿 坐 题诗 空怀 焉能 果 唯有 故人 知
a99a6b1b-700a-4780-b245-d8e67c6d1891,明妃曲,王安石,宋,诗,杂言,我本汉家子 早入深宫里 远嫁单于国 憔悴无复理 穹庐为室旃为墙 胡尘暗天道路长 去住彼此无消息 明明汉月空相识 死生难有却回身 不忍回看旧写真 玉颜不是黄金少 爱把丹青错画人 朝为汉宫妃 暮作胡地妾 独留青冢向黄昏 颜色如花命如叶,"5,5,5,5,7,7,7,7,7,7,7,7,5,5,7,7",35e805c8aabf85743117d53a445a0058,我 本汉 家子 早 入 深 宫里 远嫁 单于 国 憔悴 无复理 穹庐 为 室 旃 为 墙 胡尘暗天 道路 长 去 住 彼此 无 消息 明明 汉月 空 相识 死生 难有 却 回身 不忍 回看 旧 写真 玉颜 不是 黄金 少 爱 把 丹青 错画 人 朝 为 汉宫 妃 暮 作 胡 地妾 独留 青冢 向 黄昏 颜色 如花命 如叶
c85e3469-d793-4362-9093-3bccb5b95ddb,怀元度四首  其一,王安石,宋,诗,七言绝句,秋水才深四五尺 扁舟斗转疾于飞 可怜物色阻携手 正是归时君不归,"7,7,7,7",5b93cabd519e4afb0a2bacae481f71f5,秋水 才 深 四五尺 扁舟 斗转 疾于 飞 可怜 物色 阻 携手 正是 归时君 不 归
7fbec9b8-24c4-4cea-8c6d-8db7d3518919,怀元度四首  其二,王安石,宋,诗,七言绝句,舍南舍北皆春水 恰似蒲萄初酦醅 不见秘书心若失 百年多病独登台,"7,7,7,7",0e0c09e9b8c1c23930e960b5cec94ff0,舍南 舍北 皆 春水 恰似 蒲萄 初 酦 醅 不见 秘书 心若失 百年 多 病 独 登台
34d88a67-a92e-46c3-bfa4-7a7aed3de35e,怀元度四首  其三,王安石,宋,诗,七言绝句,思君携手安能得 上尽重城更上楼 时独看云泪横臆 长安不见使人愁,"7,7,7,7",01f45422d41726a6e744d674b6072c6d,思君 携手 安能 得 上尽 重城 更 上楼 时 独看云泪横臆 长安 不见 使 人 愁
cabf20fe-3e05-4057-be52-698a3940d089,怀元度四首  其四,王安石,宋,诗,五言律诗,自君之出矣 何其挂怀抱 孤坐屡穷辰 山林迹如扫 数枝石榴发 岂无一时好 不可持寄君 思君令人老,"5,5,5,5,5,5,5,5",474158805952929481c21b63006c3568,自君之出 矣 何其 挂 怀抱 孤坐 屡 穷 辰 山林 迹 如 扫 数枝 石榴 发 岂 无 一时 好 不可 持 寄 君 思君 令人 老
7feef873-c7a2-4092-96fb-f0cd47573ebb,招元度,王安石,宋,诗,七言绝句,早知皆是自拘囚 年少因何有旅愁 自是不归归便得 陆乘肩舆水乘舟,"7,7,7,7",735c2d81eff3b2c2e0db0a61afeb3f46,早知 皆 是 自 拘 囚 年少 因 何 有 旅 愁 自是 不归归 便 得 陆乘 肩舆 水乘舟
dc923251-fb2a-4029-a619-441a1b128f0d,示黄吉甫,王安石,宋,诗,七言绝句,三山半落青天外 势比凌歊宋武台 尘世难逢开口笑 生前相遇且衔杯,"7,7,7,7",4ea3eebcf51edbbbe8d53345c2d9ba62,三山 半落 青天 外 势 比 凌 歊 宋 武 台 尘世 难逢 开口笑 生前 相遇 且 衔 杯
4beca275-df43-43b4-b07f-bb55fcff83db,送张明甫,王安石,宋,诗,七言绝句,觥船一棹百分空 十五年前此会同 南去北来人自老 桃花依旧笑春风,"7,7,7,7",bbaa2e0ff67a27da8dc5c54cca595f81,觥船一 棹 百分 空 十五年 前 此 会同 南去北来 人 自 老 桃花 依旧 笑 春风
bde43088-2849-4de9-9752-f37ccb30f8fe,赠张轩民赞善,王安石,宋,诗,七言绝句,潮打空城寂寞回 百年多病独登台 谁人得似张公子 有底忙时不肯来,"7,7,7,7",b906adc05a179b7fa1ded295e2379627,潮 打 空城 寂寞 回 百年 多 病 独 登台 谁 人 得 似 张公子 有底 忙 时 不肯 来
d36fea4b-1cfe-45c4-bf17-8f1eb45ec07a,望之将行,王安石,宋,诗,七言绝句,江涵秋景雁初飞 沙尾长樯发渐稀 惆怅无因见范蠡 夕阳长送钓船归,"7,7,7,7",950c9a8408816fde1b554d87bfb4fa34,江涵 秋景 雁初飞 沙尾长 樯 发 渐稀 惆怅 无因见 范蠡 夕阳 长 送 钓船 归
7b55fdcf-6314-4aa6-91e7-0d4f030165b3,招叶致远,王安石,宋,诗,七言绝句,山桃野杏两三栽 嫩叶商量细细开 最是一年春好处 明朝有意抱琴来,"7,7,7,7",30bad53e0194ff0935c0e5f318c561d4,山桃 野杏 两三 栽 嫩叶 商量 细细 开 最 是 一年 春 好处 明朝 有意 抱 琴 来
126c0aa1-18d7-402c-999d-fe2c2d0dc397,独行,王安石,宋,诗,七言绝句,朱颜日夜不如故 深感杏花相映红 尽日独行春色里 醉吟谁肯伴衰翁,"7,7,7,7",e3d7c0c605c860291be00d139e65bda8,朱颜 日夜 不如 故 深感 杏花 相映红 尽日 独行 春色 里 醉吟 谁肯 伴 衰翁
73e6dbac-96f9-4183-af5a-2495bf646604,江口,王安石,宋,诗,七言绝句,六朝文物草连空 今古无端入望中 江上晚来堪画处 参差烟树五湖东,"7,7,7,7",3e2b759e904b7eafeb94c5619f523caf,六朝 文物 草 连空 今古 无端 入望 中 江上 晚来 堪画 处 参差 烟树 五 湖东
45e7a53b-3551-478a-adfb-b5b9d687a7b1,戏赠湛源,王安石,宋,诗,七言绝句,恰有三百青铜钱 凭君为算小行年 坐中亦有江南客 自断此生休问天,"7,7,7,7",868511a4ad90e41d18a307914e521be0,恰 有 三百 青铜 钱 凭 君 为算 小行 年 坐 中 亦 有 江南 客 自断 此生 休问 天
759daa31-d82b-4b35-ada2-79d2b1143656,与北山道人,王安石,宋,诗,七言绝句,可惜昂藏一丈夫 生来不读半行书 子云识字终投阁 幸是元无免破除,"7,7,7,7",811247f7cc79a007ec3e379c2f517070,可惜 昂藏 一 丈夫 生来 不读 半 行书 子云 识字 终投阁 幸是 元 无免 破除
7449d3d2-4af4-4e8f-90a9-7778e09c2ce3,梅花,王安石,宋,诗,七言绝句,白玉堂前一树梅 为谁零落为谁开 唯有春风最相惜 一年一度一归来,"7,7,7,7",3ba424e7602a0c520b8b4ad0c0feb29c,白玉堂 前一 树梅 为 谁 零落 为 谁 开 唯有 春风 最 相惜 一年一度 一 归来
6933fc8d-a255-482a-8501-4bb6144f7f5a,即事五首  其一,王安石,宋,诗,七言绝句,渐老逢春能几回 蓬门今始为君开 莫嫌野外无供给 更向花前把一杯,"7,7,7,7",ca3f7653b11ca8b2fb3cc31c0b7aea1a,渐 老逢春 能 几回 蓬门 今 始 为 君 开 莫 嫌 野外 无供给 更 向 花前 把 一杯
a7456c50-20d7-4fd3-9f1a-df986859d3f4,即事五首  其二,王安石,宋,诗,七言绝句,一树笼松玉刻成 游蜂多思正经营 攀枝弄雪时回顾 还绕樱桃树下行,"7,7,7,7",41dff68dc4ccd6193d5c4d3e47cfe825,一 树笼 松玉 刻成 游蜂 多思正 经营 攀枝 弄 雪 时 回顾 还 绕 樱桃树 下行
5e417bdd-b7b6-449a-98b5-b3d9b1d83763,即事五首  其三,王安石,宋,诗,七言绝句,幽栖地僻经过少 钟梵声中掩竹门 唯有多情枝上雪 暗香浮动月黄昏,"7,7,7,7",b827d07ead996be8e5dfff82d9fc299c,幽 栖 地 僻 经过 少 钟 梵声 中 掩 竹门 唯有 多情 枝 上 雪 暗香 浮动 月 黄昏
449fe7f8-775f-467f-9b7b-05d8cf4e2ba8,即事五首  其四,王安石,宋,诗,七言绝句,遮莫邻鸡下五更 愿为闲客此闲行 欲知前面花多少 颠倒青苔落绛英,"7,7,7,7",3faa82c59e84b64bc7f9fbcc26fa01a8,遮莫邻鸡下 五更 愿为 闲客 此 闲行 欲 知 前面 花 多少 颠倒 青苔 落绛 英
ce9dda65-cf97-40fb-8a07-d790b2de3f04,即事五首  其五,王安石,宋,诗,七言绝句,春光冉冉归何处 细雨斜风作夜寒 犹有数葩红好处 老年花似雾中看,"7,7,7,7",7b15f157740cfdc3278ec78ee235de8f,春光 冉冉 归 何处 细雨 斜 风作夜寒 犹 有数 葩 红 好处 老年 花似雾 中 看
05d18d57-d19f-4d63-ba59-b7d0574b8305,春风,王安石,宋,诗,七言律诗,春风吹园杂花开 青天露坐始此回 一杯一杯复一杯 笑言溢口何欢咍 古人白骨生青苔 我独不饮何为哉 何时出得禁酒国 垒曲便筑糟丘台,"7,7,7,7,7,7,7,7",cd16d4b157e810725d8ffb5c88de3219,春风 吹园 杂花 开 青天 露坐 始此 回 一杯 一杯 复 一杯 笑言 溢口 何 欢 咍 古人 白骨 生 青苔 我 独 不 饮 何为 哉 何时 出 得 禁酒 国 垒曲 便 筑 糟 丘台
1c198b41-1311-4105-96ce-8b0e71fe1449,春雪,王安石,宋,诗,五言绝句,春雪堕如簁 浑家醉不知 泥留虎斗迹 愁杀路傍儿,"5,5,5,5",a7e6acf61d4ef80082c8c5a9fa4d8c39,春雪 堕 如 簁 浑家 醉 不知 泥 留 虎斗迹 愁 杀 路 傍儿
ab984434-8870-452c-85af-cba70091b2b9,花下,王安石,宋,诗,五言绝句,花下一壶酒 定将谁举杯 雪英飞落近 疑是故人来,"5,5,5,5",5ff76572de0cae48bff9ad736f3569bd,花 下 一壶酒 定将 谁 举杯 雪英 飞落 近 疑 是 故人 来
467bb79b-9809-4842-89b1-fd0a3d467586,春山,王安石,宋,诗,五言律诗,春山春水流 曲折方屡渡 荒乘不知疲 行到水穷处 依然旧童子 要予竹西去 归时始觉远 草蔓已多露,"5,5,5,5,5,5,5,5",20bc1965fac43100f3c70b46b2e547f1,春 山春 水流 曲折 方 屡 渡 荒乘 不知 疲 行 到 水 穷 处 依然 旧 童子 要予 竹西 去 归 时 始 觉远 草蔓 已多 露
98fc9cee-9c18-4339-b462-019a4bc2d76d,金陵怀古,王安石,宋,诗,七言律诗,六代豪华空处所 金陵王气黯然收 烟浓草远望不尽 物换星移度几秋 至竟江山谁是主 却因歌舞破除休 我来不见当时事 上尽重城更上楼,"7,7,7,7,7,7,7,7",9e60dbfd2d56bbdb2b5ad3aafc80ec8c,六代 豪华 空 处所 金陵 王气 黯然 收 烟 浓草 远望 不尽 物换星移 度 几 秋 至竟 江山 谁 是 主 却 因 歌舞 破除 休 我 来 不见 当时 事 上尽 重城 更 上楼
51fd6fd0-0251-4a66-bfe2-21da2fa9edfe,沈坦之将归溧阳值雨留吾庐久之三首  其一,王安石,宋,诗,七言绝句,天雨萧萧滞茅屋 冷猿秋雁不胜悲 床床屋漏无干处 独立苍茫自咏诗,"7,7,7,7",003ad05de6df8efe4fe0412d16d80363,天雨 萧萧 滞 茅屋 冷猿 秋雁 不胜 悲 床床 屋漏 无干处 独立 苍茫 自 咏诗
1bff1a7e-6e65-45fe-82a2-792455b42da1,沈坦之将归溧阳值雨留吾庐久之三首  其二,王安石,宋,诗,五言绝句,檐雨乱淋幔 风悲兰杜秋 相看更促膝 人老自多愁,"5,5,5,5",283ff91d578df7c957e921f7b8a57078,檐 雨 乱 淋幔 风悲 兰杜秋 相看 更 促膝 人 老自 多愁
08a1de87-1399-4437-bc6d-ba061a9e64ca,沈坦之将归溧阳值雨留吾庐久之三首  其三,王安石,宋,诗,五言绝句,片云头上黑 淅淅野风秋 室妇叹鸣鹳 分为两地愁,"5,5,5,5",fa94dfc8e0a252826afd82395f157820,片 云头 上黑 淅淅 野 风秋 室妇 叹 鸣 鹳 分为 两地 愁
a643db06-ac28-4458-8bdc-5390b97e96c5,示蔡天启三首  其一,王安石,宋,诗,杂言,蔡子勇成癖 能骑生马驹 铦锋莹𬸯鹈 价重百砗磲 脱身事幽讨 禅龛只晏如 划然变轩昂 慎勿学哥舒 蔡子勇成癖 剑可万人敌 读书百纸过 颖锐物不隔 开口取将相 志气方自得 偪仄何偪仄 未见有一获 萧条两翅蓬蒿下 未能生彼升天翼 焉能学堂上燕 绚练新羽翮,"5,5,5,5,5,5,5,5,5,5,5,5,5,5,5,5,7,7,6,5",ad1242239d5c1c0776bd4818fa0fe952,蔡子勇 成 癖 能 骑生 马驹 铦 锋 莹 𬸯 鹈 价 重百 砗磲 脱身 事 幽 讨 禅 龛 只 晏如 划然 变 轩昂 慎勿学哥 舒 蔡子勇 成 癖 剑 可 万人敌 读书 百纸 过 颖 锐物 不 隔 开口 取 将相 志气 方 自得 偪仄 何 偪仄 未 见 有 一 获 萧条 两 翅 蓬蒿 下 未能 生彼 升天 翼 焉能 学堂 上 燕 绚练 新 羽 翮
8ba09d23-5b6e-494b-a82a-f29bb162dd24,示蔡天启三首  其二,王安石,宋,诗,七言绝句,身著青衫骑恶马 日驰三百尚嫌迟 心源落落堪为将 却是君王未备知,"7,7,7,7",461db333871419ad8d56fdba1f98f1f1,身著 青衫 骑 恶 马 日 驰 三百 尚 嫌 迟 心源 落落 堪为 将 却是 君王 未备 知
49ef5df8-63e8-47eb-881c-7879f660f0bf,烝然来思,王安石,宋,诗,杂言,念我独兮 亦莫我顾 烝然来思 程伯休父 我有旨酒 尔殽伊脯 酌言酬之 式歌且舞 不留不处 适彼乐土 言秣其马 率西水浒 有客宿宿 于时语语 山有桥松江有渚 式遄其归不我与 作此好歌 倡予和女,"4,4,4,4,4,4,4,4,4,4,4,4,4,4,7,7,4,4",73f88f4f3ce6d025af276fecdaf86954,念我独兮 亦 莫我顾 烝 然 来 思 程伯休 父 我 有 旨 酒 尔 殽 伊 脯 酌 言 酬 之 式 歌 且 舞 不留 不处 适彼 乐土 言秣其马 率 西 水浒 有 客宿 宿 于时 语语 山有桥 松江 有 渚 式 遄 其 归 不 我 与 作 此 好 歌 倡予 和 女
89d4cd1b-65cb-4f97-9ae9-f5c5e2d4cd4a,示杨德逢,王安石,宋,诗,杂言,我行其野 春日迟迟 有菀者柳 在水之湄 有鸣仓庚 岂曰不时 求其友声 颉之颃之 嗟我怀人 何日忘之 六日不詹 方何为期 期逝不至 我心西悲 跂予望之 其室则迩 一者之来 我心则喜 我之怀矣 升彼虚矣 爱而不见 云何吁矣,"4,4,4,4,4,4,4,4,4,4,4,4,4,4,4,4,4,4,4,4,4,4",5aaa43eec4ddc22318a795d2d50a6ba7,我行 其 野 春日 迟迟 有 菀 者 柳 在 水 之 湄 有 鸣 仓 庚 岂 曰 不时 求其友声 颉 之 颃 之 嗟我怀人 何日 忘 之 六日 不 詹 方何 为期 期逝 不至 我心 西悲 跂 予 望 之 其 室 则 迩 一者 之来 我心 则 喜 我 之 怀 矣 升彼虚 矣 爱 而 不见 云何吁 矣
46cbe061-c120-4d6c-bef7-8cf304df5403,示道光及安大师,王安石,宋,诗,杂言,春日载阳 陟彼高冈 乐彼之园 维水泱泱 维笋及蒲 既生既育 拚飞维鸟 集于灌木 嘤其鸣矣 乱我心曲 有怀二人 在彼空谷 既往既来 独寐寤宿 陟则在𪩘 或降于阿 瞻望弗及 伤如之何,"4,4,4,4,4,4,4,4,4,4,4,4,4,4,4,4,4,4",bfb22dd915725cf7b5ae28a67d259849,春日 载阳 陟彼 高冈 乐彼之 园 维水 泱泱 维笋 及 蒲 既生 既 育 拚飞 维鸟 集于 灌木 嘤其鸣矣 乱 我 心曲 有 怀 二人 在 彼 空谷 既往 既来 独寐 寤宿 陟 则 在 𪩘 或 降于 阿 瞻望 弗及 伤 如之何
