id,title,author,dynasty,genre,poem_type,sentences_simplified,meter_pattern,hash,words
64c79985-29a5-4e51-a1db-8c913e9db290,颂六十二首 五十六,道世,唐,诗,杂言,邈邈爱王城 峨峨欣鹫岭 业结三界狱 利钝十使颈 浊恶顺下趣 断漏升上顶 著我甘苦报 怖象投丘井 翘翘羡化伦 念念除心瘿 宿祐遇释尊 高慕大仙颖 既破无明结 还同欣鹫岭 荷戢怡冲心 随憇靡不静 见同书卷九十 断障部,"5,5,5,5,5,5,5,5,5,5,5,5,5,5,5,5,6,3",b69086cd040f467008bcdd598d44f8d5,邈 邈 爱王 城 峨峨欣 鹫岭 业结 三界 狱 利钝 十 使 颈 浊恶 顺下趣 断 漏升 上 顶 著 我 甘苦 报 怖 象 投丘井 翘翘 羡化 伦 念念 除 心瘿 宿 祐 遇 释尊 高慕 大仙 颖 既 破 无明 结 还 同 欣 鹫岭 荷 戢 怡 冲心 随 憇 靡不 静 见 同 书卷 九十 断障 部
d47e8cc7-6ad6-480e-a07f-9758e8c3a13f,颂六十二首 五十七,道世,唐,诗,杂言,五体悔前朝 三屈忏中夕 鸣椎诫旭旦 哀我苦劳役 引目寓金言 悲伤尘垢积 咄哉形非我 嗟往恒沉溺 踟蹰歧路嵎 挥手谢中折 洗涤归诚忏 皎洁凌云释 萧索业苦离 升陟随缘益 虽未齐高踪 且免幽途历 见同书卷一百三 洗忏部,"5,5,5,5,5,5,5,5,5,5,5,5,5,5,5,5,7,3",abdb38304d34d24f9bd6265d4dd07069,五 体悔 前朝 三 屈忏 中夕 鸣椎 诫旭 旦 哀 我 苦 劳役 引目 寓 金言 悲伤 尘垢 积 咄哉形非 我 嗟往 恒 沉溺 踟蹰 歧路 嵎 挥手 谢中折 洗涤 归诚 忏 皎洁 凌云 释 萧索 业苦 离 升 陟 随缘 益 虽 未齐 高踪 且免 幽途 历 见 同 书卷 一百 三 洗忏 部
279a95c3-9219-4492-ba33-4a36f8deeb46,颂六十二首 五十八,道世,唐,诗,杂言,大慈振法鼓 开悟无明聋 𬬻冶心秽垢 防非如利锋 护鹅不惜命 守草养生同 五篇遮轻重 七聚荡心胸 晨朝宣宝偈 夕夜虔诚恭 近求出苦海 远念法身踪 七支净三业 五分满金容 各愿坚固戒 净土得相逢 见同书卷一百七 三聚部,"5,5,5,5,5,5,5,5,5,5,5,5,5,5,5,5,7,3",7a214fde5fe9e08bdc48d992013c8613,大 慈振法 鼓 开悟 无明 聋 𬬻 冶心 秽垢 防非 如 利锋 护鹅 不惜 命 守草 养生 同 五篇 遮 轻重 七 聚荡 心胸 晨朝 宣宝偈 夕 夜 虔诚 恭 近 求出 苦海 远念 法身 踪 七支 净 三业 五分 满金容 各 愿 坚固 戒 净土 得 相逢 见 同 书卷 一百七 三聚 部
ff9de538-0b54-4ab3-a58b-97e62e800936,颂六十二首 五十九,道世,唐,诗,杂言,愚夫贪世利 俗士重虚名 三空既难辩 八风恒易倾 物我久空性 色心仍自萦 盛年爱华好 老死丘墓成 居高非虑祸 持满不忧盈 名利甘刀害 将非安久祯 凡愚苟求利 譬犬见秽精 不知祸来至 焉知怨苦声 见同书卷一百十一 利害篇,"5,5,5,5,5,5,5,5,5,5,5,5,5,5,5,5,8,3",3d766e72b28b7e2c01417b70b99ea796,愚夫 贪 世利 俗士 重 虚名 三空 既 难辩 八风 恒易 倾 物 我久 空性 色心 仍自 萦 盛年 爱华 好 老死 丘墓 成 居高非 虑 祸 持满 不忧 盈 名利 甘刀 害 将 非 安久祯 凡愚 苟求 利 譬犬见 秽精 不知 祸 来 至 焉知 怨苦声 见 同 书卷 一百 十一 利害 篇
7cf5fe07-d5d5-4eda-9ee2-1df0af303bd6,颂六十二首 六十,道世,唐,诗,杂言,噉他身血肉 贪毒无慈矜 养兹身秽质 虫㝢内消融 不护僧净器 受此厕中虫 后报入地狱 苦痛未知穷 见同书卷一百十三 便利部,"5,5,5,5,5,5,5,5,8,3",e1ec3618258c04eb33059ee5fe9aeb75,噉 他 身 血肉 贪毒 无 慈矜 养兹 身 秽质 虫 㝢 内 消融 不护 僧 净器 受 此 厕中虫 后 报入 地狱 苦痛 未知 穷 见 同 书卷 一百 十三 便利 部
7302cb31-458f-4694-97e8-72fe0c811a48,颂六十二首 六十一,道世,唐,诗,杂言,紫纨未可得 漳滨徒再离 一逢犬马病 贲育罢驱驰 既无九转术 复阙万金奇 不看授盐掌 唯梦莲华池 见同书卷一百十四 安置部,"5,5,5,5,5,5,5,5,8,3",432d93074a68ed5c87777609de020e50,紫 纨未可得 漳滨 徒 再 离 一 逢 犬马 病 贲 育 罢 驱驰 既 无九 转术 复 阙 万金 奇 不 看 授 盐 掌 唯梦 莲 华池 见 同 书卷 一百 十四 安置 部
7563aa8e-3e7f-4fa0-ac22-bb2bca62a020,颂六十二首 六十二,道世,唐,诗,杂言,龚胜无遗生 季业有穷尽 嵇叟理既迫 霍子命亦殒 屡屡厚霜指 纳纳冲风菌 邂逅竟既时 修短非所慜 恨我君子志 不得严上泯 送心正觉前 斯痛久已忍 既知人我空 何愁心不谨 唯愿乘来生 怨亲同诚朕 见同书卷一百十五 舍身篇,"5,5,5,5,5,5,5,5,5,5,5,5,5,5,5,5,8,3",613bf157e917c129643d9eeb93e4b2ea,龚胜 无遗 生 季业 有 穷尽 嵇叟理 既 迫 霍子命 亦 殒 屡屡 厚霜 指 纳纳冲 风菌 邂逅 竟 既时 修短 非 所 慜 恨 我 君子 志 不得 严上泯 送心 正觉 前 斯 痛 久已 忍 既 知人 我 空 何 愁心不谨 唯愿 乘来 生 怨亲 同 诚 朕 见 同 书卷 一百 十五 舍身 篇
79c86bec-ba25-4d81-a6f2-7753ac618047,澄州无虞县清泰乡都万里六合坚固大宅诗（五言）,韦敬辨,唐,诗,杂言,近𣸣纵横越 募岱去来阑 千岑为□绝 三峡以衢难 庶捷犹求跨 郡攘□能观 苦固于兹第 永世保无残 见广西上林县麒麟山唐永淳元年立 六合坚固大宅颂 碑附 转录自 广西少数民族地区石刻碑文集,"5,5,5,5,5,5,5,5,15,7,2,3,13",bd6f3f38648d3130ce66bff5df9f53fa,近 𣸣 纵横 越 募 岱去 来 阑 千岑 为 □ 绝 三峡 以 衢难 庶捷 犹求 跨 郡 攘 □ 能观 苦 固 于兹第 永世 保无 残 见 广西 上林县 麒麟山 唐永淳 元年 立 六合 坚固 大宅 颂 碑 附 转录 自 广西 少数民族 地区 石刻 碑 文集
49543d46-144f-4f04-9c42-4012f60937ee,咏竹（卒章）,薛元超,唐,诗,杂言,别有邻人笛 偏伤怀旧情 廖彩梁 乾陵稽古 收崔融撰 大唐故中书令赠光禄大夫秦州都督薛公墓志铭 引 墓志为近年于乾陵陪葬墓出土 1 薛公墓志铭 八岁 善属文 时房玄龄 虞世南试公咏竹 援毫立就 卒章云 诗略 玄龄等即公之父党 深所感叹,"5,5,3,4,4,20,1,13,1,5,2,3,4,7,4,3,2,8,4",ce8cecbc2eca33b582f7e31d3316f5ee,别 有 邻人 笛 偏 伤怀 旧情 廖彩梁 乾陵 稽 古 收 崔融 撰 大唐 故 中书令 赠 光禄 大夫 秦州 都督 薛公 墓志铭 引 墓志 为 近年 于 乾陵 陪葬 墓 出土 1 薛公 墓志铭 八岁 善属 文 时 房玄龄 虞世南 试公咏 竹 援 毫立 就 卒 章云 诗略 玄龄 等 即 公 之 父党 深所 感叹
180c1a2f-6df5-4a76-a40c-74f66c8f5edf,诗（幷序） 一,王梵志,唐,诗,五言古体,遥看世间人 村坊安社邑 一家有死生 合村相就泣 张口哭他尸 不知身去急 本是长眠鬼 𫏐来地上立 欲似养儿毡 回干且就湿 前死深埋却 后死续即人,"5,5,5,5,5,5,5,5,5,5,5,5",bb5f5c3baf43c8095c08bbe5fb7e0492,遥 看 世间 人 村坊 安社邑 一家 有 死生 合村 相 就泣 张口 哭 他 尸 不知 身 去 急 本 是 长眠 鬼 𫏐 来 地上 立 欲 似 养儿 毡 回干 且 就 湿 前 死 深埋 却 后 死续 即 人
5437dfee-9c37-4397-866f-44551f17cfb6,诗（幷序） 二,王梵志,唐,诗,杂言,吾富有钱时 妇儿看我好 吾若脱衣裳 与吾叠袍袄 吾出经 一作 绖 求去 送吾即上道 将钱入舍来 见吾满面笑 遶吾白鸽旋 恰似鹦鹉鸟 邂逅暂时贫 看吾即貌哨 戴密微校作 藐峭 人有七贫时 七富还相报 徒 大正藏 作 从 项 袁谓通 图 不误 财不顾人 且看来时道,"5,5,5,5,3,2,1,2,5,5,5,5,5,5,5,5,2,5,5,1,3,1,1,1,3,1,2,4,5",e811fc1d2fac74637f25483a77e511a0,吾 富有 钱 时 妇儿 看 我 好 吾 若 脱 衣裳 与 吾 叠 袍 袄 吾 出 经 一 作 绖 求 去 送 吾 即 上道 将 钱 入 舍来 见 吾 满面 笑 遶 吾 白 鸽 旋 恰似 鹦鹉 鸟 邂逅 暂时 贫 看 吾 即 貌 哨 戴密微 校作 藐峭 人 有 七 贫 时 七富 还 相报 徒 大正藏 作 从 项 袁谓通 图 不 误 财 不顾 人 且 看来 时道
6dcfdef5-298d-4ebf-97fb-e2a65e45d917,诗（幷序） 三,王梵志,唐,诗,杂言,家口总死尽 吾死无亲表 张改作 衰 郭校作 哀 急首卖 一作 买 资产 与设逆修斋 托生得好处 身死雇人埋 钱财隣保出 任你自相差,"5,5,3,1,3,1,3,2,1,2,5,5,5,5,5",8f876711ad09680643006918d232d471,家口 总 死 尽 吾 死无亲 表 张 改作 衰 郭校 作 哀 急 首卖 一 作 买 资产 与 设逆 修斋 托生 得 好处 身死 雇人 埋 钱财 隣 保 出 任 你 自 相差
54799a77-2bd2-4d69-8c4d-7b5cf5f3a25e,诗（幷序） 四,王梵志,唐,诗,杂言,身如圈里羊 命报恰 一作 怜 相当 羊即披毛走 人著好衣裳 脱衣 一作 却 赤体立 刑 一作 则 役不如羊 羊即日日死 人还日日亡 从头捉将去 还同肥好羊 羊 一作 人 即辛苦死 人去无破伤 命绝逐他走 魂魄历他乡 有钱多造福 吃著好衣裳 愚人广造罪 志 张改作 智 者好思量,"5,3,2,1,2,5,5,2,2,1,3,1,2,1,4,5,5,5,5,1,2,1,4,5,5,5,5,5,5,1,3,1,4",69294889df1e56c2a15169fa6523de8f,身 如 圈里 羊 命报 恰 一 作 怜 相当 羊 即 披 毛 走 人 著 好 衣裳 脱衣 一 作 却 赤体 立 刑 一 作 则 役 不如 羊 羊 即日 日 死 人 还 日日 亡 从头 捉 将 去 还 同 肥好 羊 羊 一 作 人 即 辛苦 死 人 去 无 破伤 命 绝逐 他 走 魂魄 历 他 乡 有钱 多 造福 吃著 好 衣裳 愚人 广造 罪 志 张 改作 智 者 好 思量
9a9c6ac1-6c15-4bb5-8d0c-2c6b038e71c1,诗（幷序） 五,王梵志,唐,诗,杂言,可笑世间人 痴多黠者少 不愁死路长 贪著苦烦恼 夜眠游鬼界 天晓归人道 忽起相罗拽 啾唧索租调 贫苦无处得 相接被鞭拷 一作 𢭦 生时有苦痛 不如早死好,"5,5,5,5,5,5,5,5,5,5,2,1,5,5",24b0727ac7ffb27b64d93c08d43fa337,可笑 世间 人 痴 多 黠者 少 不 愁 死路 长 贪著 苦 烦恼 夜眠游 鬼界 天晓归 人 道 忽起 相罗 拽 啾 唧索 租调 贫苦 无处 得 相接 被 鞭 拷 一 作 𢭦 生时 有 苦痛 不如 早 死 好
88cf75e5-95c4-45cb-a34d-6112bf5dbd5d,诗（幷序） 六,王梵志,唐,诗,杂言,他家笑吾贫 吾贫 五贫 极快乐 无牛亦无马 不愁贼 一作 贱 抄掠 你富户役高 差 一作 羞 科并用却 吾无呼唤处 饱吃长展脚 你富披锦袍 寻常被纒缚 穷苦无烦恼 草衣随体著,"5,2,2,3,5,3,2,1,2,5,1,2,1,4,5,5,5,5,5,5",55725d440d31199f1599191e61ce42b3,他家 笑 吾 贫 吾 贫 五 贫 极 快乐 无牛亦无马 不 愁 贼 一 作 贱 抄掠 你 富户 役 高 差 一 作 羞 科 并用 却 吾 无 呼唤 处 饱 吃 长展脚 你 富 披 锦袍 寻常 被 纒 缚 穷苦 无 烦恼 草衣 随体 著
cfa6643e-e24a-4566-95f7-1c267efdc519,诗（幷序） 七,王梵志,唐,诗,杂言,大有愚 一作 禺 痴君 独身无儿子 广贪多觅财 养奴多养婢 伺 张改作 司 项以为不误 命门前唤 不容 一作 客 别隣里 死得四片板 一条黄衾被 钱财奴婢用 任将别经 一作 绖 纪 有钱不解用 空手入都市 一作 示,"3,2,1,2,5,5,5,1,3,1,5,4,2,2,1,3,5,5,5,4,2,1,1,5,5,2,1",51495ab8b4c0e44b4e12b69da2e755e0,大 有 愚 一 作 禺 痴君 独身 无 儿子 广 贪多 觅财 养奴 多 养婢 伺 张 改作 司 项 以为 不 误 命 门前 唤 不容 一 作 客 别 隣 里 死 得 四片 板 一条 黄衾 被 钱财 奴婢 用 任 将 别 经 一 作 绖 纪 有钱 不解 用 空手 入 都市 一 作 示
51d5505e-7916-4f07-a110-254910975f37,诗（幷序） 八,王梵志,唐,诗,杂言,沉沦三恶道 家内无人知 有衣不能著 有马不能骑 有奴不能使 有婢不相随 有食不能吃 向前恒受饥 冥冥地狱苦 难见出头时 依巡 一作 相逐 次第去 却活知有谁,"5,5,5,5,5,5,5,5,5,5,2,2,2,3,5",a2bd03ec02dde9258bc3b65b10678154,沉沦 三 恶道 家内 无人 知 有 衣 不能 著 有 马 不能 骑 有 奴 不能 使 有婢 不 相随 有 食 不能 吃 向前 恒 受 饥 冥冥 地狱 苦 难 见 出头 时 依巡 一 作 相逐 次第 去 却 活知 有 谁
76ba2766-a815-4cde-be94-394f60871e21,诗（幷序） 九,王梵志,唐,诗,杂言,沉沦三恶道 负持 一作 时 松尾良树谓应作 特 愚痴鬼 荒忙身卒死 即遍 张改 追 项校作 属 伺 张改作 司 命使 反缚棒打走 先渡奈何水 倒拽至厅前 枷棒这 张改 遍 郭云不误 身起 死经一七日 刑名受罪鬼 牛头铁叉杈 狱 从项说补 卒 此字据 大正藏 补 把刀搨 碓 捣 梼 硙磨身 覆生还覆 项校作 复 死,"5,2,2,1,7,1,3,5,2,2,1,3,1,1,3,1,2,5,5,5,3,2,1,4,2,5,5,5,1,4,1,3,3,1,3,1,1,1,3,4,3,1,1",2178be1cd53b0826aaac3b56983f277f,沉沦 三 恶道 负持 一 作 时 松尾 良树谓 应作 特 愚痴 鬼 荒忙 身 卒 死 即 遍 张改 追 项校 作 属 伺 张 改作 司 命 使 反缚 棒打 走 先渡 奈何 水 倒 拽 至 厅 前 枷棒 这 张改 遍 郭云 不 误 身起 死 经 一 七日 刑名 受罪 鬼 牛头 铁叉 杈 狱 从 项说 补 卒 此 字据 大正藏 补 把 刀 搨 碓 捣 梼 硙 磨 身 覆 生还 覆 项校 作 复 死
b2912f38-7cc5-41cb-bbd3-2a02096dbbfc,诗（幷序） 十,王梵志,唐,诗,杂言,撩乱失精神 无由见家里 妻是他人妻 一作 事 儿被后翁使 驷马被金鞍 镂镫银秋辔 角弓无主张 宝剑抛著地 设却百日斋 浑家忘却你 钱财他人用 古来寻常事 前人多贮积 后人无惭愧 此是守财奴 不兑 张改作 免 贫穷事,"5,5,5,2,1,5,5,5,5,5,5,5,5,5,5,5,5,2,3,1,3",04bf47c7d0d774a2113a115bd4a1038d,撩乱 失 精神 无由见 家里 妻是 他人 妻 一 作 事 儿 被 后 翁 使 驷马 被 金鞍 镂镫 银秋 辔 角弓 无 主张 宝剑 抛著 地 设 却 百日 斋 浑家 忘却 你 钱财 他人 用 古来 寻常事 前人 多 贮积 后人 无 惭愧 此是 守财奴 不 兑 张 改作 免 贫穷 事
c37fc873-d348-4597-98ba-7b54763fcdb6,诗（幷序） 十一,王梵志,唐,诗,杂言,夫妇相对坐 千年亦不足 一个病着床 遥看手不 触 𧢻 正报到头来 徒费将钱卜 宝物积如山 死得一棺木 空手把两拳 口里徒含玉 永离台上镜 无心开 一作 关 衣眠 戴 松尾校作 服 镜里 戴 项校作 匣 尘满中 剪刀生衣醭,"5,5,5,4,1,1,5,5,5,5,5,5,5,3,2,1,2,1,4,1,2,1,3,1,3,5",7eb074275a4213b98fd16df2a2898ec7,夫妇 相对 坐 千年 亦 不足 一个 病 着床 遥 看 手 不 触 𧢻 正报 到头来 徒费 将 钱卜 宝物 积如 山 死 得 一 棺木 空手 把 两拳 口里 徒 含 玉 永离 台上 镜 无心 开 一 作 关 衣眠 戴 松尾 校作 服 镜 里 戴 项校 作 匣 尘 满 中 剪刀 生衣 醭
d2ee1ed4-a31f-4a54-b10c-8e13863086a5,诗（幷序） 十二,王梵志,唐,诗,杂言,平坐歌舞处 无由更习曲 琵琶绝巧 一作 咲 声 琴弦断不续 花帐 一作 怅 后人眠 前人自薄福 生坐七宝堂 死入土角触 郭校作 䚥 丧车相勾牵 鬼朴还相哭 日理 项 松尾校作 埋 几千般 光影急迅速,"5,5,4,2,1,1,5,2,2,1,3,5,5,5,3,1,5,5,2,1,4,1,3,5",66a8035c58df783fc998ab3d8273f98a,平 坐 歌舞 处 无由 更习 曲 琵琶 绝巧 一 作 咲 声 琴弦 断 不续 花帐 一 作 怅 后人 眠 前人 自 薄福 生坐 七宝 堂 死 入土 角触 郭校 作 䚥 丧车 相 勾 牵 鬼 朴 还 相哭 日 理 项 松尾 校作 埋 几千 般 光影 急 迅速
131c2c06-11bf-4046-b182-3df46901864f,诗（幷序） 十三,王梵志,唐,诗,杂言,富者办棺木 贫穷席裹 一作 里 角 相共唱奈河 周校作 何 送着空冢各 项校作 阁 千休即万休 永别生平乐 志 张改作 智 者入西方 愚人堕地狱 掇 一作 扌鵽 黄 项校作 缀 头入苦海 冥冥不省觉 擎头乡里行 事当逞靴袄 有钱但著用 莫作千年调,"5,4,2,1,1,5,3,1,5,3,1,5,5,1,3,1,4,5,1,2,2,1,3,1,4,5,5,5,5,5",5648474aa6ea9a99ddff21a10fd24367,富者 办 棺木 贫穷 席裹 一 作 里 角 相 共唱 奈河 周校 作 何 送 着 空 冢 各 项校 作 阁 千 休 即 万 休 永别 生平 乐 志 张 改作 智 者 入 西方 愚人 堕 地狱 掇 一 作 扌 鵽 黄 项校 作 缀 头入 苦海 冥冥 不省 觉 擎头 乡里 行 事 当 逞 靴 袄 有钱 但 著用 莫作 千年 调
1c0a00d0-e8e5-42b8-8fee-89fdf2ba09d6,诗（幷序） 十四,王梵志,唐,诗,杂言,百岁乃有一人 得七十者稀 张眼看他死 不能自觉知 痴皮裹脓血 顽骨强相随 两步行衣架 步步入阿鼻 双盲不识鬼 伺命急来追 赤绳串著项 反缚棒脊 一作 背 皮 露头赤脚走 身上无衣被,"6,5,5,5,5,5,5,5,5,5,5,4,2,1,1,5,5",154622816e54fe26eb6a0d7db713029a,百岁 乃有 一人 得 七十 者 稀 张 眼看 他 死 不能 自觉 知 痴 皮裹 脓血 顽 骨 强 相随 两 步行 衣架 步步 入 阿鼻 双盲 不识 鬼 伺命 急来 追 赤绳 串著 项 反缚 棒 脊 一 作 背 皮 露头 赤脚 走 身上 无 衣被
0a6872a0-f923-493f-b9f9-e3e756806ae6,诗（幷序） 十五,王梵志,唐,诗,杂言,独自心中骤 四面被兵围 向前十道捝 张改 税 戴 蒋校 挽 黄校 棁 背后铁锤锤 伺命张弓射 苦痛剧刀锥 使者门前唤 忙怕不容 一作 客 迟 倮 张校作 裸 体逐他走 浑舍共号悲 宅舍无人护 妻子被人欺 钱财不关己 庄 郭校 藏 收永长离 三魂无倚住 七魄散头飞,"5,5,5,2,1,1,2,1,2,1,5,5,5,5,4,2,1,1,1,3,1,4,5,5,5,5,1,2,1,4,5,5",657e1aa4e984e6c81a7bbca3ce259684,独自 心中 骤 四面 被 兵围 向前 十道 捝 张改 税 戴 蒋校 挽 黄校 棁 背后 铁锤 锤 伺命 张弓 射 苦痛 剧刀 锥 使者 门前 唤 忙 怕 不容 一 作 客 迟 倮 张校 作 裸 体逐 他 走 浑舍 共号 悲 宅舍 无人 护 妻子 被 人 欺 钱财 不关己 庄 郭校 藏 收 永长 离 三魂无倚 住 七魄散头飞
c1d578cb-f38a-4c8f-beed-5ef79eb22787,诗（幷序） 十六,王梵志,唐,诗,杂言,善劝诸贵等 □□□□□ 火急造桥梁 运度身得过 福至生西方 各难知厌足 身是有限身 程期太剧促 纵有百年活 徘徊如转烛 憨人连脑痴 买锦妻装束 无心造福田 有意事奴仆 只得𫏐时劳 项校 牢 旷身入苦毒,"5,5,5,5,5,5,5,5,5,5,5,5,5,5,5,2,1,5",4019a04a810fb2c9dd727e5e511d4ec4,善 劝 诸贵 等 □ □ □ □ □ 火急 造 桥梁 运度 身得 过 福至生 西方 各 难知 厌足 身 是 有限 身 程期 太剧 促 纵 有 百年 活 徘徊 如 转烛 憨 人 连 脑 痴 买 锦妻 装束 无心 造福 田 有意 事 奴仆 只得 𫏐 时劳 项校 牢 旷身入苦毒
1ffee7c6-c152-43a6-88af-976c174f2ab9,诗（幷序） 十七,王梵志,唐,诗,杂言,傍看数个大憨痴 造宅舍拟作万年期 人人百岁乃有一 纵令长命七十稀 少少撩乱死 □□□□期却半 欲似流星光暂时 中途少少辽乱死 亦有初生婴孩儿 无问男夫及女妇 不得惊忙审三思 年年相续罪根重 月月增长肉身肥 日日造罪不知足 恰似独养神猪儿 不能透圈四方走 还须圈里待死时 自造恶业还自受 如今痛苦还自知 以上十八首均录自张锡厚 王梵志诗校辑 卷一 张氏所据本为斯七七八 斯五七九六 斯五四七四 斯一三九九卷 幷以 大正藏 第八十五册 王梵志诗集 参校 按 本卷所录王梵志诗 皆据张锡厚 王梵志诗校辑 另曾参校 大正藏 本及 敦煌掇琐 录诗的原则是 尽可能地保持王诗的原貌 凡原文可通者 尽可能保持原文 原文显误 张氏所改为无可移易者 即予改正 原文虽误 张氏所作改动尚难成定论者 则仍保留原文 而以张说附收其下 各本有异文者 择其善者为正文 异文注出 一作某 张锡厚为王梵志诗的校录 写定作了十分可贵的努力 本卷充分利用了他的成果 笔者只在少数诗章的分篇及文字的定夺上提出了自己的看法 这是应该在这里说明的,"7,8,7,7,5,7,7,7,7,7,7,7,7,7,7,7,7,7,7,11,6,2,10,5,5,6,2,3,5,5,2,1,8,5,6,4,3,2,4,6,11,6,7,4,10,4,4,12,6,8,6,7,4,3,11,11,11,26,10",c0de546024646fa9bb8163ea2815d9a6,傍 看 数个 大 憨痴 造 宅舍 拟作 万年 期 人人 百岁 乃有 一 纵令 长命 七十 稀 少 少 撩乱 死 □ □ □ □ 期 却 半 欲 似 流星 光 暂时 中途 少少 辽乱 死 亦 有 初生 婴孩 儿 无问 男夫 及 女妇 不得 惊忙 审 三思 年 年 相续 罪 根重 月 月 增长 肉身 肥 日日 造罪 不知足 恰似 独 养神 猪儿 不能 透圈 四方 走 还 须 圈里 待 死 时 自造 恶业 还 自受 如今 痛苦 还 自知 以上 十八 首均录 自 张锡厚 王 梵志 诗校辑 卷 一 张氏 所 据 本 为 斯七 七八 斯 五七 九六 斯 五四 七四 斯一 三九 九卷 幷 以 大正藏 第八 十五 册 王 梵志 诗集 参校 按 本 卷 所 录 王 梵志 诗 皆 据 张锡厚 王 梵志 诗校辑 另 曾 参校 大正藏 本 及 敦煌 掇 琐 录诗 的 原则 是 尽可能 地 保持 王诗 的 原貌 凡 原文 可 通者 尽可能 保持 原文 原文 显误 张氏 所 改为 无可 移易 者 即予 改正 原文 虽 误 张氏 所 作 改动 尚难 成 定论 者 则 仍 保留 原文 而以 张说 附收 其 下 各本 有 异文 者 择 其 善者 为 正文 异文 注出 一 作 某 张锡厚 为 王 梵志 诗 的 校录 写定 作 了 十分 可贵 的 努力 本 卷 充分利用 了 他 的 成果 笔者 只 在 少数 诗章 的 分篇 及 文字 的 定夺 上 提出 了 自己 的 看法 这 是 应该 在 这里 说明 的
f9bf58f7-1413-4f48-8ebd-9ff51037ae75,诗（幷序） 十八,王梵志,唐,诗,杂言,吾家多有田 不善 戴校 若 广平王 戴校 玉 有钱怕 项校 惜 不用 身死留何益 承闻七七斋 𫏐施鬼来吃 永别生时盘 酒食无踪迹 配罪剔 张改 别 袁谓不误 受苦 隔命绝相觅,"5,2,2,1,3,2,1,3,2,1,2,5,5,5,5,5,3,2,1,4,2,5",657722dd8e640faa84d78604258cfc7c,吾 家 多 有 田 不善 戴校 若 广平 王 戴校 玉 有钱 怕 项校 惜 不用 身 死留 何益 承闻 七七 斋 𫏐 施鬼 来 吃 永别 生时 盘 酒食 无 踪迹 配罪 剔 张改 别 袁谓 不 误 受苦 隔命 绝相 觅
1da99391-10c1-4f78-8df9-e6579d6a9c54,诗（幷序） 十九,王梵志,唐,诗,杂言,借贷不交通 有酒深藏善 张改作 窖 项校 着 有钱怕人知 眷属相轻薄 身入黄泉下 他吃他人着 破除不由你 用尽遮他莫,"5,5,3,1,2,1,5,5,5,5,5,5",a1fdf82ef323adfc263b1a532c2b59d3,借贷 不 交通 有 酒 深藏 善 张 改作 窖 项校 着 有钱 怕人 知 眷属 相 轻薄 身入 黄泉 下 他 吃 他人 着 破除 不由 你 用尽 遮 他 莫
e42fc77e-76e8-4873-8d26-cca8745af5ca,诗（幷序） 二十,王梵志,唐,诗,杂言,道士头侧方 浑甚 张改作 身 总着黄 无心礼拜佛 恒贵天尊堂 三教同一体 徒自 浪 朗 褒扬 一被 项校 种 沾贤圣 无弱 亦 赤 无强 莫为分别相 师僧自设长 同尊佛道教 凡恪 项 戴校 俗 送衣裳 粮食逢医药 垂死续命汤 敕取一生活 应报上天堂,"5,2,3,1,3,5,5,5,2,1,1,2,2,2,1,3,2,1,1,2,5,5,5,2,1,2,1,3,5,5,5,5",f15ded410d500fc147913996c78e111f,道士 头 侧方 浑 甚 张 改作 身 总着 黄 无心 礼拜 佛 恒 贵 天尊 堂 三教 同 一体 徒自 浪 朗 褒扬 一 被 项校 种 沾 贤圣 无弱 亦 赤 无强 莫为 分别 相 师僧 自设 长 同尊佛 道教 凡 恪 项 戴校 俗 送 衣裳 粮食 逢 医药 垂死 续命汤 敕 取 一 生活 应 报上 天堂
872910fe-f2e1-491e-9b70-631a7f36c5df,诗（幷序） 二十一,王梵志,唐,诗,杂言,观内有妇人 一作 女 号名是女官 各各服梳畋 项谓通 略 悉带芙蓉冠 长裙并金色 横披 一作 被 张改作 帔 黄𠋆单 朝朝步虚赞 道声数千般 贫无巡门乞 得谷相共飡 常住无贮积 铛釜当房安 眷属王侵 张改作 役 苦 衣食远求难 出无夫婿见 病困绝人看 乞就 一作 与活 生缘活 交即免饥寒,"5,2,1,5,5,3,1,5,5,2,2,1,3,1,3,5,5,5,5,5,5,4,3,1,1,5,5,5,2,2,2,3,5",6849f1921d77d45a10990c0f39d2503b,观 内 有 妇人 一 作 女 号 名 是 女官 各 各服 梳 畋 项谓通 略 悉 带 芙蓉 冠 长裙 并 金色 横披 一 作 被 张 改作 帔 黄 𠋆 单 朝 朝步 虚 赞 道声 数千 般 贫 无 巡门 乞 得 谷相共 飡 常住 无 贮积 铛 釜当房安 眷属 王 侵 张 改作 役 苦 衣食 远求 难 出无 夫婿 见 病 困绝 人 看 乞就 一 作 与 活 生缘 活 交 即免 饥寒
8d68ed4f-cd9d-461e-b028-1c74275477be,诗（幷序） 二十二,王梵志,唐,诗,杂言,道人头兀雷 郭谓即 兀硉 例头肥特肚 本是俗家人 出身胜地立 饮食哺盂中 衣裳架上出 每日趁斋家 一本 家 前有 时 字 即礼七拜佛 饱吃更索钱 低头着门出 手把数珠行 开肚元无物 生平未必识 独养肥没忽 虫蛇能报恩 人子何处出,"5,3,2,5,5,5,5,5,5,2,1,2,1,1,5,5,5,5,5,5,5,5,5",edc72a33d9f361181915ca1e79bf9a6a,道 人头 兀 雷 郭谓 即 兀 硉 例头 肥特 肚 本 是 俗家 人 出身 胜地 立 饮食 哺盂 中 衣裳 架上 出 每日 趁 斋 家 一本 家 前 有 时 字 即 礼 七 拜佛 饱 吃 更索 钱 低头 着门 出 手把 数珠 行 开肚 元 无物 生平 未必 识 独 养肥 没忽 虫 蛇 能 报恩 人 子 何处 出
