id,title,author,dynasty,genre,poem_type,sentences_simplified,meter_pattern,hash,words
18f45619-d28a-4ee3-9491-9e8bbee6eee4,追和鲁直蜡梅二首  其一,王之道,唐,诗,五言绝句,一种幽素姿 凌寒为谁展 似嫌冰雪清 故作黄金浅,"5,5,5,5",a46385a4c4319a6c85467eb42eb67d0f,一种 幽素 姿 凌寒 为 谁 展 似 嫌 冰雪 清 故作 黄金 浅
7a252fcf-0b43-4f25-a686-2b8c7de54d3e,追和鲁直蜡梅二首  其二,王之道,唐,诗,五言绝句,岁穷压霜雪 春至喜风露 一枝蜡花梅 清香美无度,"5,5,5,5",2bd6c7c7f0c74d6b236683d094d5785d,岁 穷 压 霜雪 春 至 喜风露 一枝 蜡花 梅 清香 美 无度
a7f83c75-015b-4dbe-84d5-be891fe6f183,送道者史宝通作丐,王之道,唐,诗,五言绝句,昔日山前寺 兵余扫地空 汝今能协力 真是宝林通,"5,5,5,5",628dca283cb6100e210efac50b2f46c9,昔日 山前 寺 兵余 扫地 空 汝 今 能 协力 真是 宝林 通
36bb5bb3-a90b-4281-bf72-a2463d13fddf,又送道者王法圆作丐,王之道,唐,诗,五言绝句,誓将三寸舌 求结万人缘 宝刹成功日 当期道法圆,"5,5,5,5",007e5f074ca46f1dffcd938a0897bfa3,誓 将 三寸舌 求结 万 人缘 宝刹 成功 日 当期 道法 圆
6675d6a6-96d1-44cb-b586-bda1605b75b0,送浮屠道廓,王之道,唐,诗,五言绝句,一宿已先觉 四明那更游 去来无所着 风日海山秋,"5,5,5,5",9aa2caca57ca18daad168be2a201af2c,一 宿 已 先觉 四明 那 更 游 去来 无所 着 风日 海山 秋
99828df4-dab2-4098-89b5-e404d053d1b4,送贾教授伟满罢东归,王之道,唐,诗,七言绝句,妙年才气擅超群 试吏来司泮水芹 行矣玉堂应召直 忍将风袂与君分,"7,7,7,7",ba9f832336b820daa8af7f6bfc75b591,妙 年 才气 擅 超群 试吏 来 司泮 水芹 行 矣 玉堂 应召 直 忍 将 风 袂 与 君分
282ed3e9-be89-47e7-8fc0-269baf97952c,重阳示二三友,王之道,唐,诗,七言绝句,龙山何处暮云黄 坐想前贤落帽狂 茰实菊花良不恶 为君沽酒作重阳,"7,7,7,7",b847b9fab6a6b231a6cfb8721c61b5d6,龙山 何处 暮云 黄 坐想 前贤 落帽 狂 茰 实 菊花 良不恶 为 君 沽酒 作 重阳
e8122876-f5df-4b69-8a17-3c5f53f738cb,秋日悯旱题香山庄舍,王之道,唐,诗,七言绝句,千里骄阳稼穑枯 人心穷极但天呼 须烦岩壑为霖手 下泽苍生慰海隅,"7,7,7,7",a0c12eca183b4f543fe92cdd253151c1,千里 骄阳 稼穑 枯 人心 穷极 但 天呼 须烦岩 壑 为 霖 手 下泽 苍生 慰 海隅
97eaa3c2-8c3c-4a48-bd43-0fc0a150f583,寄梅花与曾子修,王之道,唐,诗,七言绝句,待船聊复驻征骖 手撚梅花望翠岚 花似若人清绝俗 故从江北寄江南,"7,7,7,7",1b2af868c4a90d573888620e6a29841d,待船 聊复 驻征 骖 手 撚 梅花 望翠岚 花似若 人 清 绝俗 故 从 江北 寄 江南
79e46586-e678-4426-be6b-05a83ba09c57,送曾式古归建昌,王之道,唐,诗,七言绝句,两年说归明日归 江头草软花芬菲 风调江浄船行驶 好看芳草怀春晖,"7,7,7,7",f0e896b28f1a102116fca44eb81981ad,两年 说 归 明日 归 江头 草 软 花芬菲 风调 江 浄 船 行驶 好看 芳草 怀 春晖
e7d7bb23-3e10-4086-aec4-3c196c3b47f5,酬孔纯老送海错三首  其一,王之道,唐,诗,七言绝句,海错东来自四明 感君怜我故分珍 拜嘉何必须豪饮 大嚼姑从得句新,"7,7,7,7",5fb82ef8a9703e1a8c7725a3a6e54b26,海错 东 来自 四明 感君怜 我 故分 珍 拜嘉何 必须 豪饮 大嚼 姑 从得 句 新
1bf506ba-57fb-49be-8e7f-75f73b71af55,酬孔纯老送海错三首  其二,王之道,唐,诗,七言绝句,螺头已荷兼三和 鳯髓何须贵八珍 多谢邦君怜不饮 只将诗句巧争新,"7,7,7,7",7f38d64432d899b864f286938f0ffd48,螺头 已荷 兼 三 和 鳯 髓 何须 贵 八珍 多谢 邦 君 怜 不 饮 只 将 诗句 巧争新
bed309fc-f6a7-4ea6-8d09-636ffc383057,酬孔纯老送海错三首  其三,王之道,唐,诗,七言绝句,恶语岂堪酬妙句 麤餐曾不餍常珍 得君海错俱奇绝 从此鄞江发兴新,"7,7,7,7",caa906cd8529eeea7ff4df2bd5d33b58,恶语 岂堪酬 妙句 麤 餐 曾 不 餍 常 珍 得君海 错俱 奇绝 从此 鄞江 发兴 新
dba12d74-30e8-4f88-b343-4d7a4c00e515,和子厚弟春日见寄三首  其一,王之道,唐,诗,七言绝句,睡起晴窗正忆渠 老兵声喏到前除 新诗价重连城璧 便觉贫家富不虚,"7,7,7,7",ca1f1c49092fed27666d5d685b5c5279,睡起 晴窗 正忆 渠 老兵 声 喏 到 前 除 新诗 价重 连城 璧 便 觉 贫家 富不虚
1545c424-134a-4886-8243-6498e6fa589f,和子厚弟春日见寄三首  其二,王之道,唐,诗,七言绝句,一鞭春色去迢迢 溪上红粧笑语娇 酒醉不知行客避 竞眠芳草鬬裙腰,"7,7,7,7",2b6edf07f2b5b0a805ddaf5ddf115d3a,一 鞭 春色 去 迢迢 溪 上 红 粧 笑语 娇 酒醉 不知 行客 避 竞眠 芳草 鬬 裙 腰
f0cac098-d490-476e-ae6d-9a39455d2eec,和子厚弟春日见寄三首  其三,王之道,唐,诗,七言绝句,十里西畴马送曛 晚风依约度溪云 悬知今夜桃花雨 一洗焦枯慰使君,"7,7,7,7",7aa8fc4397ef53c64cc78a0a9c170c3d,十里 西畴 马 送 曛 晚风 依约 度 溪 云 悬知 今夜 桃花 雨 一 洗 焦枯 慰 使君
8909c420-7b9f-4e86-ac7b-b124962c77f7,谢潘寿卿惠牋并诗,王之道,唐,诗,七言绝句,饷厚东阳一万畨 从今难放笔头闲 新诗正与花牋似 文彩纵横咳唾间,"7,7,7,7",66e61dc1b9d6caff79e62b3ba2eae226,饷厚 东阳 一万 畨 从今 难 放 笔头 闲 新诗 正 与 花 牋 似 文彩 纵横 咳 唾间
31b61b5a-c461-453c-ae0f-34c081bf6311,道上杂花盛开,王之道,唐,诗,七言绝句,涓涓流水雨晴初 夹道山花簇彩舆 千骑不辞迎候远 物情春意竟何如,"7,7,7,7",841cc74a38bbe7df0690813f3ac023b9,涓涓 流水 雨晴初 夹道 山 花簇 彩舆 千骑不辞 迎候 远 物情 春意 竟 何如
86bdfbbf-5671-4301-b339-6c3614fa44fb,风雨损花,王之道,唐,诗,七言绝句,雨多南国惜春归 多谢诗人赋采菲 堕白残红无处着 漫随风絮作团飞,"7,7,7,7",0aa6e7302cda02f28084b051885f7741,雨 多 南国 惜春归 多谢 诗人 赋 采菲 堕白 残红 无处 着 漫随 风絮 作团 飞
db9483e6-d426-444a-874a-f9cba7353a0c,落梅入砚池,王之道,唐,诗,七言绝句,玉佩翻然下帝傍 墨池照影妬新粧 时人莫作飘零看 收拾毫端无尽香,"7,7,7,7",091045d8afa126ce365a473a475585c3,玉佩 翻然 下帝 傍 墨池 照 影 妬 新 粧 时人 莫 作 飘零 看 收拾 毫端 无尽 香
5d5db80f-4fa5-482b-bdaf-2f9c10416455,玉树花,王之道,唐,诗,七言绝句,几年埋没乱荆榛 轩槛移来特地新 何事临风忍相对 伤心一曲旧亡陈,"7,7,7,7",892ecd017d6cf659984d0e0e675f728f,几年 埋没 乱荆 榛 轩 槛 移 来 特地 新 何事 临风 忍 相对 伤心 一曲 旧 亡 陈
8e692a68-a55f-4007-aa22-938c1eacbd67,芭蕉,王之道,唐,诗,七言绝句,秋风鸣玉雨疏疏 嫩绿临窗半卷舒 似是相知慰牢落 朝来肯寄一缄书,"7,7,7,7",2a4e323cf847c37565cb18a2c35aea6f,秋风 鸣玉雨 疏 疏 嫩绿 临窗 半 卷舒 似 是 相知 慰牢落 朝 来肯 寄 一 缄 书
a3f76175-ecdc-41ac-9c1b-d212356e92a5,菊,王之道,唐,诗,七言绝句,千林揺落见孤芳 色映青松破嫩黄 玉露凄凉三迳晚 金英芬馥几丛香,"7,7,7,7",c766c05f61f9068f1095ce61339c519f,千 林 揺 落 见 孤 芳 色映 青松 破 嫩黄 玉露 凄凉 三 迳 晚 金英 芬馥 几丛 香
82e775b3-568a-4a47-9b05-ffbfcf0ac5e1,山茶,王之道,唐,诗,七言绝句,开花不与众芳期 先得江梅破白时 犀甲鹤头微带雪 画屏曾见两三枝,"7,7,7,7",62a7b2660cb33a94acba3ecdc160b358,开花 不 与 众 芳期 先 得 江梅 破白 时 犀甲 鹤头 微带 雪 画屏 曾 见 两 三枝
ae2a603b-4d9f-47ab-9d85-298924d4dac7,荷花,王之道,唐,诗,七言绝句,亭亭青盖倚宫粧 新浴温泉体自香 暂借青风来一霎 欲披云锦见蜂房,"7,7,7,7",a431d5c10613f2db3117160959f5cd59,亭亭 青盖倚 宫 粧 新浴 温泉 体自香 暂借 青风 来 一霎 欲 披 云锦 见 蜂房
c972bf19-3578-4473-8dcc-d6eb44543e0e,红梅,王之道,唐,诗,七言绝句,秾华不与众芳同 偏爱施朱立晓风 莫道春来无酒病 脸霞犹带夜来红,"7,7,7,7",454a102b6554360f4fb42ea4db995421,秾 华 不 与 众 芳 同 偏爱 施朱 立晓风 莫道 春来 无酒 病 脸霞 犹 带 夜来 红
ecd75120-2877-4849-844e-f35ae9f06fcb,题乌江官舍木芙蓉,王之道,唐,诗,七言绝句,桃叶萧疏柳叶黄 清寒应怯夜来霜 芙蓉雅与秋相好 独对层台试晓粧,"7,7,7,7",88309060b1a0de102a9ae97b4431a904,桃叶 萧疏 柳叶黄 清寒 应 怯 夜来 霜 芙蓉 雅与秋 相好 独对 层台 试 晓 粧
3ac2104c-180b-4232-be0c-fd6e11166443,青梅,王之道,唐,诗,七言绝句,疏白欺人侵短鬓 老红乘酒驻衰颜 食梅已判非吾事 把读清诗忆故山,"7,7,7,7",fee9fc4a6d37034589a192b3a002b5fa,疏白 欺 人 侵 短 鬓 老红乘 酒 驻 衰颜 食梅 已 判非 吾 事 把 读清 诗忆 故 山
a28dd810-0391-4eb9-b08e-207e1a90b27d,和魏定父早春十首  其一,王之道,唐,诗,七言绝句,早从子美追懒真 近向长康得痴绝 相逢可笑复可怜 君看稀疏鬓邉雪,"7,7,7,7",3caeec23842362bab62f4c20829853bc,早 从 子 美 追懒 真 近 向 长康 得 痴绝 相逢 可笑 复 可怜 君 看 稀疏 鬓 邉 雪
4fb4abc4-a7d4-4a97-aa71-c205daa5e2a0,和魏定父早春十首  其二,王之道,唐,诗,七言绝句,安得都护胡青骢 与君并辔揺玲珑 南溪今日冻初觧 好看游鱼翻鬛红,"7,7,7,7",62250bb3b30babd7c4c40c1d35a375f0,安 得 都 护 胡青骢 与 君 并辔 揺 玲珑 南溪 今日 冻 初 觧 好看 游鱼 翻 鬛 红
c3e96a73-4f79-4444-98b6-85a8176e5654,和魏定父早春十首  其三,王之道,唐,诗,七言绝句,依依杨柳绕溪斜 黑白溪头鹄伴鸦 雨过芜菁自春色 一丛茅屋野人家,"7,7,7,7",d3df39a53cfe9dd358de3a0b4929e0b2,依依 杨柳 绕 溪 斜 黑白 溪头 鹄 伴 鸦 雨 过 芜菁 自 春色 一丛 茅屋 野人 家
238ac56c-38b1-471e-a67a-a22ca052776f,和魏定父早春十首  其四,王之道,唐,诗,七言绝句,晚来天意欲晴寒 幽鸟争春到舌端 诗骨自怜山様瘦 酒肠君似海能寛,"7,7,7,7",fd5ae8fbe3dfa1bd1601833b99baca28,晚来 天 意欲 晴寒 幽鸟 争春 到 舌端 诗骨 自怜 山 様 瘦 酒肠 君 似 海 能 寛
0da16650-c82f-4c28-b40e-8e7bbef4980f,和魏定父早春十首  其五,王之道,唐,诗,七言绝句,门前溪水绿萦回 风縠无邉费剪裁 待与东君写春色 好教红紫一时开,"7,7,7,7",466d58230c5fb1baf23014bd67e196c7,门前 溪水 绿 萦回 风 縠 无 邉 费 剪裁 待 与 东君 写 春色 好 教红 紫 一时 开
11e2afc4-1108-4689-8ef6-8fd57a6139cc,和魏定父早春十首  其六,王之道,唐,诗,七言绝句,春到花梢一点红 吹嘘应谢晓来风 南园缭绕城邉路 无限诗情杖履中,"7,7,7,7",ade3bd337cdcc32bb3a05ae66786e956,春 到 花 梢 一点红 吹嘘 应 谢晓 来风 南园 缭绕 城 邉 路 无限 诗情 杖 履 中
9df32245-5996-4f22-9786-95c40b7a0dc8,和魏定父早春十首  其七,王之道,唐,诗,七言绝句,㶁㶁溪流碎玉鸣 野梅随处伴行人 归欤路出临卭市 凖拟沉浮曲米春,"7,7,7,7",85fef58fae9f554f6aed7c3ee6ee0297,㶁 㶁 溪流 碎玉 鸣 野梅 随处 伴 行人 归 欤 路 出 临 卭 市 凖 拟 沉浮 曲米春
32f1d677-c479-43b0-8618-834ac60f55cf,和魏定父早春十首  其八,王之道,唐,诗,七言绝句,怪来庭砌堕寒梅 风笛数声清以哀 两日枯肠餍蔬笋 不堪茗椀发轻雷,"7,7,7,7",1cc68c600823a3f64b32e1ca3353d5a4,怪 来庭 砌 堕 寒梅 风笛 数声 清以哀 两日 枯肠 餍 蔬笋 不堪 茗 椀 发 轻 雷
391a5dee-b8ad-478a-bd24-6e573418fbd7,和魏定父早春十首  其九,王之道,唐,诗,七言绝句,辰瓜醉竹定何如 试问君家种莳书 坐久幽窗转斜日 恰怜梅影上衣裾,"7,7,7,7",201d33ccfb63528aa053bd1cc7091470,辰 瓜 醉 竹定 何如 试问 君 家种 莳 书 坐 久 幽窗 转斜 日 恰怜 梅影 上衣 裾
5e867c44-eaf4-4a68-a94c-ed6e06e38c1a,和魏定父早春十首  其一○,王之道,唐,诗,七言绝句,南禅相望无多地 深谢高轩日见过 归去山林遂闲放 却寻农圃问谁何,"7,7,7,7",52f4e10570e01c24d9e226e3155ff6b4,南禅 相望 无多 地 深 谢高轩 日见 过 归去 山林 遂 闲放 却 寻 农圃 问 谁何
ba071b2a-f60a-4531-bb2e-efc49d340008,和秦寿之春晚偶成八绝  其一,王之道,唐,诗,七言绝句,相从辄莫太怱怱 赌酒分茶自有功 谁谓春归无处覔 柳蹊飞絮乱因风,"7,7,7,7",ab811e0f919e5d86b6f7a488f3ce6d85,相 从辄 莫 太 怱 怱 赌酒 分茶 自 有功 谁 谓 春 归 无处 覔 柳蹊 飞絮 乱 因 风
ebf3851e-b90a-42c1-9d16-0c3654f2b5ed,和秦寿之春晚偶成八绝  其二,王之道,唐,诗,七言绝句,照眼酴醿正及时 鞓红相映似相知 天公应也怜芳意 一霎轻风宿雾披,"7,7,7,7",7b64acf23107158f5b8b483f5ac2a121,照眼 酴 醿 正 及时 鞓 红 相映 似 相知 天公 应 也 怜 芳意 一霎 轻风 宿雾 披
eb3d2326-e353-4bb1-b0aa-2f7e44ec0813,和秦寿之春晚偶成八绝  其三,王之道,唐,诗,七言绝句,花外霏微雨弄晴 乱红狼藉过清明 伤春正苦无聊甚 接接欣闻噪鹊声,"7,7,7,7",1995f953a892822d6d03360e52f4845a,花外霏 微雨 弄 晴 乱红 狼藉 过 清明 伤春 正苦 无聊 甚 接接 欣闻 噪鹊 声
f9619ef9-dbc6-4ae8-93e5-610e05afc057,和秦寿之春晚偶成八绝  其四,王之道,唐,诗,七言绝句,官闲时醉秀溪春 醉里吟诗字字新 欲报自惭无好语 年来胸次亦埃尘,"7,7,7,7",d64dd8ee5b27da9b2b34197d3f67337d,官 闲时 醉秀溪 春 醉里 吟诗 字字 新 欲报 自惭 无好语 年 来 胸次 亦埃尘
479ab2ef-db8d-42c8-890c-93e9287b20a8,和秦寿之春晚偶成八绝  其五,王之道,唐,诗,七言绝句,欲下荒庭意已阑 一枝红药坐中看 东风不息成何事 又酝春阴作夜寒,"7,7,7,7",661c892caee7cf70a1ffd2a0d54bdb1f,欲下荒庭意 已 阑 一枝 红药 坐 中 看 东风 不息 成 何事 又 酝春 阴作夜寒
1cb71d8d-f39a-49ab-884d-2223e4909ade,和秦寿之春晚偶成八绝  其六,王之道,唐,诗,七言绝句,轻阴还傍麦秋天 病怯春寒独衣绵 老境不知行乐好 坐来芳树看莺迁,"7,7,7,7",31cecf69459482ca8a994b6c13728ef0,轻 阴 还 傍 麦 秋天 病 怯 春寒 独衣绵 老境 不知 行乐 好 坐来 芳树 看 莺 迁
42598d6e-a69b-4e16-a533-0dbd634034f2,和秦寿之春晚偶成八绝  其七,王之道,唐,诗,七言绝句,春来谈笑数追陪 多谢传杯不放杯 醉里狂言应可笑 问春归去几时回,"7,7,7,7",3e1310508297faa64c09373234c871cd,春来 谈笑 数 追 陪 多谢 传杯 不 放 杯 醉里 狂言 应 可笑 问春 归去 几时 回
18a24691-3986-4bcd-bc8d-d864f468ded7,和秦寿之春晚偶成八绝  其八,王之道,唐,诗,七言绝句,带雨飞来燕一双 问伊何事为春忙 野人不觧呢喃意 勉强搜吟对麦光,"7,7,7,7",4e3789f1d2f9a325b1d8dc2b821aceb6,带雨 飞来 燕 一双 问 伊 何事 为 春忙 野人 不 觧 呢喃 意 勉强 搜吟 对 麦光
88657df6-79b9-49e5-b414-caed81aa820f,和王圜中道上初见梅花二首  其一,王之道,唐,诗,七言绝句,马头惊见一枝新 夹道欢呼拥吏民 咫尺招提鸡黍约 不妨同醉万家春,"7,7,7,7",b9b9e9aedd11ae8ffdac20bdeb89db8c,马头 惊 见 一枝 新 夹道 欢呼 拥 吏民 咫尺 招 提 鸡 黍 约 不妨 同醉 万家 春
9d640b32-a6f2-43a0-a068-f13e13a33a87,和王圜中道上初见梅花二首  其二,王之道,唐,诗,七言绝句,安养疮痍过所亲 野人何幸预斯民 自怜枯槁无生意 遂与寒梅竞得春,"7,7,7,7",db024d3ce270eb9c63f16907f86feb0c,安养 疮痍 过 所亲 野人 何幸 预斯民 自怜 枯槁 无 生意 遂 与 寒梅 竞得 春
b76536f5-25c3-4a26-9eb4-a6e67c558f68,和沈次韩春日郊行二首  其一,王之道,唐,诗,七言绝句,杨花落地䴙鹈飞 百里湖山碧四围 信步不知行几远 却怜芳草伴人归,"7,7,7,7",bc7bdd4ffbb9c7e5526bdea3a844354d,杨花 落地 䴙 鹈飞 百里 湖山 碧 四围 信步 不知 行 几远 却怜 芳草 伴人 归
e75f3942-ee7e-49d9-b414-e4a78bc30d6a,和沈次韩春日郊行二首  其二,王之道,唐,诗,七言绝句,山色新晴一蘸青 隔溪无数野花明 杞苖荻笋肥应美 采掇何妨趁晚烹,"7,7,7,7",a77f9b64282da05cd5af7ca65165914d,山色 新 晴 一 蘸 青 隔溪 无数 野花 明 杞苖 荻 笋 肥 应 美 采掇 何妨 趁晚 烹
3e8d97d3-1cfa-4701-92d0-4d854997698e,和张文伯春日劝农,王之道,唐,诗,七言绝句,奉诏欢均草莽臣 郊原风日自温温 欲知太守催耕意 重谷劭农本圣恩,"7,7,7,7",08acea6fefb4603e4678404b261c61bc,奉 诏 欢均 草莽 臣 郊原 风日 自 温温 欲 知 太守 催耕 意 重 谷劭 农本 圣恩
20248d77-0397-4b65-a716-d064169dc296,和刘春卿秋夜对月,王之道,唐,诗,七言绝句,天宇澄清桂影秋 骚人乘兴欲登楼 楼前白水三千顷 滉滉镕银烂不收,"7,7,7,7",517bae377f169aa49fdbf1c6136ce141,天宇 澄清 桂影秋 骚人 乘兴 欲 登楼 楼前 白水 三 千顷 滉滉镕银 烂 不 收
034898e6-0325-453f-8cef-13a909c6f045,和章序臣梅花二首  其一,王之道,唐,诗,七言绝句,三月诗筒绝往来 有时谈麈许追陪 梅花雅欲撩佳句 犯雪凌霜为我开,"7,7,7,7",4b20b71e41993c6c0b0acbf7ed63a720,三月 诗筒 绝 往来 有时 谈麈许 追 陪 梅花 雅 欲 撩 佳句 犯 雪凌霜 为 我 开
3a27b868-85e7-41c3-ad07-6dbf54f3239c,和章序臣梅花二首  其二,王之道,唐,诗,七言绝句,多谢苍头语我来 恍如相见笑相陪 新诗高妙梅清绝 展读花前病眼开,"7,7,7,7",66b3f253e33a34938871f8ddca41231d,多谢 苍头 语 我 来 恍如 相见 笑 相陪 新诗 高妙 梅清 绝 展读 花前 病眼 开
50393078-b312-435c-a70b-b7336d3b2909,和孔纯老江上避风题酒肆,王之道,唐,诗,七言绝句,对酒应从暮吹号 酒行还喜荐溪毛 若将物象评诗思 须向江头看怒涛,"7,7,7,7",790f079568d35371c2dfd096c00899a2,对 酒 应从 暮 吹号 酒行 还 喜荐 溪毛 若 将 物象 评 诗思 须 向 江头 看 怒涛
c35d391a-ca55-4813-b170-5de58bcc1391,和张文伯黄悦之席上赋雪,王之道,唐,诗,七言绝句,功成三白到春回 好放云天万里开 今夜子猷方对客 却烦安道过溪来,"7,7,7,7",ad6bb194f21eff98dff3335ff6abbc28,功成三白到春 回 好 放 云天 万里 开 今夜 子猷方 对 客 却 烦 安道 过 溪 来
e5d98e50-3888-4cb7-bf0f-3023000eadc3,和张文伯先梅后雪,王之道,唐,诗,七言绝句,六花无怪索诗催 正恐清寒勒早梅 待得江头千树暗 故争明洁逐风来,"7,7,7,7",73c8168f466423607299f899eed628df,六 花 无怪 索诗 催 正恐 清寒 勒 早 梅 待 得 江头 千树暗 故争 明洁 逐风来
c72c6b16-f03d-4238-96c1-f4224aa7eac8,和子厚弟冬至即事,王之道,唐,诗,七言绝句,天容如鉴地无尘 阳气依稀动紫荆 日晷渐长端可爱 霜华增重不胜清,"7,7,7,7",0b050420ebf8fdd59fd9e7b28ceaeab5,天容 如鉴 地 无尘 阳气 依稀 动 紫荆 日晷 渐 长 端 可爱 霜华 增重 不胜 清
981b338a-dede-4058-a788-175610b7e260,和王觉民双泉道中,王之道,唐,诗,七言绝句,白云深处是吾家 山市归来日影斜 独立前村聊送目 孤村流水闹寒鸦,"7,7,7,7",3b07e2016345a97de82491782d688fc7,白云 深处 是 吾 家 山市 归来 日影 斜 独立 前村 聊送 目 孤村 流水 闹 寒鸦
f5434d0b-7353-443b-97dc-fae32edfe9d8,和鲁如晦七夕,王之道,唐,诗,七言绝句,乞巧谁家绮席开 夜阑箫鼓趁虚催 启明不为牵牛计 又放朝阳送曙来,"7,7,7,7",444f59148acb484daac3fb76592c772c,乞巧 谁家 绮席 开 夜阑 箫 鼓 趁 虚 催 启明 不 为 牵牛 计 又 放 朝阳 送 曙来
8c9e2193-7b06-4597-b898-6c5eceb56e59,和陈天予经过南巢邑人迎旧尹,王之道,唐,诗,七言绝句,君来井邑笑烘烘 君去萧条逈不同 似说攀辕如昨日 可怜身老长儿童,"7,7,7,7",7607876a5c12f88621efae5194471145,君 来 井 邑 笑烘烘 君 去 萧条 逈 不同 似说 攀辕如 昨日 可怜 身 老长 儿童
159d48c2-5177-4271-8988-a19d9881d12b,和孔纯老别邻居钱进之醉寝留题,王之道,唐,诗,七言绝句,不敢搘笻问起居 虑烦炰脍破兵厨 杜门终日无人顾 新竹墙头出万夫,"7,7,7,7",3fa2c655bc8d41bc15ed6e5e8ff634bf,不敢 搘 笻 问 起居 虑 烦 炰 脍 破 兵 厨 杜门 终日 无人 顾 新竹 墙头 出 万夫
15b799e7-7942-4083-b7c2-696cfae7a891,和张文伯洞庭柑,王之道,唐,诗,七言绝句,金苞照爼出双柑 想见和枝映笋篮 欲倩玉纤分玉液 要濡燥吻发清谈,"7,7,7,7",fee0767f640a1954dae376ab075b3671,金苞 照 爼 出 双 柑 想见 和 枝映笋 篮 欲 倩 玉 纤分 玉液 要 濡 燥 吻 发 清谈
b068b1d9-8357-44e2-88bc-d66e4b36707d,和刘春卿晓起读书,王之道,唐,诗,七言绝句,梦断幽禽恰转更 窥窗残月淡孤灯 孜孜读诵如吾子 指日菁莪看锡朋,"7,7,7,7",279bc90c8c71b4e2b7b06c3fdedb3165,梦断 幽禽 恰 转 更 窥 窗 残月 淡 孤灯 孜孜 读诵 如 吾子 指日 菁 莪 看 锡 朋
f751302e-5540-498b-b075-b2e430eb1118,偶书,王之道,唐,诗,七言绝句,万事秋来只信缘 为谁清嚏晚风前 断虹收尽廉纤雨 喜见江南八月天,"7,7,7,7",9cb0c97e855000d1154ea1717cf0a0d9,万事 秋来 只 信缘 为 谁 清嚏 晚风 前 断虹收尽 廉纤雨 喜见 江南 八月 天
6b975292-2d0e-4d9a-b5d6-80ad7e58f8a7,和吕子梅题陈倅窗前新栽竹二首  其一,王之道,唐,诗,七言绝句,封殖要当同种玉 翺翔端复见停鸾 此君不是尘中物 岂减樊川十万竿,"7,7,7,7",7546ff6268ce74e7cdac41c51ae7afa6,封殖 要 当 同种 玉 翺 翔 端 复 见 停 鸾 此君 不是 尘 中物 岂 减 樊川 十万 竿
5f1217e1-7551-495e-a7b1-728026d4f95d,和吕子梅题陈倅窗前新栽竹二首  其二,王之道,唐,诗,七言绝句,自是清阴能借润 不应积雨尚流寒 先生端的磻溪裔 乞与沧溟作钓竿,"7,7,7,7",f939e37d0ade72a14913a87ad27d63cd,自是 清 阴能 借润 不 应 积雨 尚流 寒 先生 端的 磻溪 裔 乞 与沧 溟 作 钓竿
b68ed811-aae3-4cc8-bd65-b8b263cd047c,和陈勉仲赠淮西漕吴介之二首  其一,王之道,唐,诗,七言绝句,威严霜肃德春阳 民感澄清涕泗滂 畏垒大穣知不晚 三年端可笑庚桑,"7,7,7,7",701213941500e35d7e37e0015a0d9205,威严 霜 肃 德 春阳 民感 澄清 涕泗 滂 畏 垒 大 穣 知 不 晚 三年 端 可笑 庚 桑
c792024c-b170-4980-81b6-43a913ff34cc,和陈勉仲赠淮西漕吴介之二首  其二,王之道,唐,诗,七言绝句,九郡疮痍頼拊存 年来和气浃江村 此恩未易论天报 请看于公大里门,"7,7,7,7",41d900197f0b797f96dd9f4deb494d9c,九郡 疮痍 頼 拊 存 年来 和 气浃 江村 此恩未易论 天报 请 看于 公大里 门
8edd8148-5d17-4961-8dfb-cd6aaa173681,和赵积中白莲三首  其一,王之道,唐,诗,七言绝句,翠盖亭亭水满塘 六铢新制带天香 晚来扶洗娇无力 尽鬬冰肌不鬬粧,"7,7,7,7",64c1e423ae9a92a819d2cb92b8ab6720,翠盖 亭亭 水满塘 六铢 新制 带 天 香 晚来 扶洗 娇 无力 尽 鬬 冰肌 不 鬬 粧
5389b400-64a1-43b8-8228-c39d97c51683,和赵积中白莲三首  其二,王之道,唐,诗,七言绝句,清风习习晚香微 坐使诗人赋采菲 想见温泉初濯玉 侍儿娇拥太真妃,"7,7,7,7",7f3814d720cd1aa3eae0b31c75bc4e0f,清风 习习 晚 香 微 坐 使 诗人 赋 采菲 想见 温泉 初濯玉 侍儿娇 拥 太真妃
6676be2a-2252-418d-8df1-95bdb1c7b4af,和赵积中白莲三首  其三,王之道,唐,诗,七言绝句,耻同流辈弄胭脂 一様新裁雪白衣 何日与君携酒去 两般分取载将归,"7,7,7,7",88157be4c5e329d86bd0a766f6b64d80,耻同 流辈 弄 胭脂 一 様 新 裁 雪 白衣 何日 与 君 携酒 去 两般分 取载 将 归
0b816ea6-8afb-417c-8780-80f53e7b296c,和张元礼水仙花二首  其一,王之道,唐,诗,七言绝句,素颊黄心破晓寒 叶如谖草臭如兰 一樽坐对东风软 敢比江梅取次看,"7,7,7,7",2bfec554d94c482243b5d445fa264122,素颊 黄心 破晓 寒 叶如谖 草 臭 如 兰 一 樽 坐 对 东风 软 敢 比江梅 取次看
b457bc14-4bf3-4ad9-9682-ce0fc227fdcc,和张元礼水仙花二首  其二,王之道,唐,诗,七言绝句,沉水香浓画不烟 赋花谁是饮中仙 顾予老拙辞源澁 空想东坡万斛泉,"7,7,7,7",c8c451c74f91130e815f0f4aa3afc076,沉水 香浓 画 不烟 赋花 谁 是 饮 中仙 顾予 老拙 辞源 澁 空想 东坡 万 斛 泉
4ce6d909-6494-4ace-8280-11d74ffe9bd3,和秦寿之铜陵江上二首  其一,王之道,唐,诗,七言绝句,枫叶霜余霞灿烂 苇花风起雪纵横 铜陵江上秋容好 两绝新诗取次成,"7,7,7,7",48be45a80f866afbd39731c0354c1fb4,枫叶 霜 余霞 灿烂 苇花风 起雪 纵横 铜陵 江上秋 容好 两 绝 新诗 取次成
80ab8045-0bbd-435c-bbff-96e980f1cf23,和秦寿之铜陵江上二首  其二,王之道,唐,诗,七言绝句,烟销远水分帆影 木落疏林出斧痕 啸咏不知红日下 九华何处望中昏,"7,7,7,7",322772da77f9d9cdaad556a8f8f9aadc,烟销远 水分 帆影 木落 疏林 出 斧 痕 啸咏 不知 红日 下 九华 何处 望 中昏
effe0606-ac34-4852-be4f-155b5728d52d,和子厚弟九日登魏文振亭园七首  其一,王之道,唐,诗,七言绝句,潇洒湖东小小亭 一时酬唱有三明 亭前澄练无邉际 应助诗人写物情,"7,7,7,7",8e98efd065435beda5c418b947fcd35c,潇洒 湖东 小小 亭 一时 酬唱 有 三明 亭 前 澄练 无 邉 际 应助 诗人 写 物情
ee091278-aa06-4417-b42b-48b10e190546,和子厚弟九日登魏文振亭园七首  其二,王之道,唐,诗,七言绝句,乱插黄花趁节宜 年华休向镜中悲 已知和气回春谷 横管临风更一吹,"7,7,7,7",1e5c424cf8a2c8461577d5f0c652ac21,乱 插 黄花 趁 节宜 年华 休向 镜 中 悲 已知 和 气 回春 谷 横管 临风 更 一 吹
