id,title,author,dynasty,genre,poem_type,sentences_simplified,meter_pattern,hash,words
adbfc9e6-7fc5-49b9-97ed-809e7f583800,元德秀,徐钧,唐,诗,七言绝句,山水光中寄一枝 琴尊尽日每相随 太平老去身何恨 只隔明年便乱离,"7,7,7,7",06d759161fe549bf687b659efd41a445,山水 光 中 寄 一枝 琴尊尽日 每 相随 太平 老 去 身何恨 只 隔 明年 便 乱离
e3e90a85-d5ce-4d69-8f75-6eddca1bff35,李白,徐钧,唐,诗,七言绝句,风骨神仙籍里人 诗狂酒圣且平生 开元一遇成何事 留得千秋万古名,"7,7,7,7",224df213cc4a50e29ab85df738880ada,风骨 神仙 籍 里 人 诗 狂酒 圣 且 平生 开元 一 遇成 何事 留 得 千秋万古 名
01ec9aed-d7ef-4b02-914e-5b8f455b73db,杜甫,徐钧,唐,诗,七言绝句,万里飘零独此身 诗魂终恋浣花村 宁贫宁冻宁饥死 一饭何曾忘至尊,"7,7,7,7",3de9c48ece8af48b8b24720deaf8719d,万里 飘零 独此 身 诗魂 终恋 浣 花村 宁 贫 宁冻宁 饥 死 一 饭 何曾 忘 至尊
b9c39723-95fd-4fbd-8fec-ad5fb92bec6f,贺知章,徐钧,唐,诗,七言绝句,身外生涯总是虚 狂游一梦入清都 有家不住犹为观 底用区区觅鉴湖,"7,7,7,7",4b0fa1313c1e49b210fcab80ad88d5e2,身外 生涯 总是 虚 狂游 一梦 入 清 都 有家 不住 犹为 观 底用 区区 觅 鉴湖
579b2196-2b9b-48f5-816e-9150ebab570a,李林甫,徐钧,唐,诗,七言绝句,柄国年深巧蔽欺 如何方面用胡儿 只知怙宠身为计 不道渔阳乱已基,"7,7,7,7",f41ff18cebe194095c8b998769e6f7eb,柄 国 年 深巧蔽欺 如何 方面 用 胡儿 只 知 怙宠 身为 计 不道 渔阳 乱 已 基
a998e516-825b-48f6-bf81-1ab74f440b74,安禄山,徐钧,唐,诗,七言绝句,随人畜养宁知父 负主恩私岂有君 逆气终然招逆报 可怜四海乱如云,"7,7,7,7",883cdb3441495dd21391c1cecfc1e6f6,随 人 畜养 宁知父 负主恩私 岂 有 君 逆气 终然 招逆 报 可怜 四海 乱 如云
3385c2d9-549c-4188-9303-4d9ddbd882f8,王维,徐钧,唐,诗,七言绝句,凝碧池头听乐府 不能身死但能悲 辋川他日成名胜 藉得朝天一首诗,"7,7,7,7",54c679c2bd187aa223781889fc1f7c6f,凝 碧池 头 听 乐府 不能 身死 但 能 悲 辋 川 他 日 成 名胜 藉 得 朝天 一首 诗
27c1e51f-8887-42c0-98f9-72581cc89fb7,颜杲卿,徐钧,唐,诗,七言绝句,一曲霓裳失太平 渔阳鼙鼓暗风尘 君王只识杨丞相 不识平原老守臣,"7,7,7,7",0abe0891a2ed9f416c9d3d14d18d3189,一曲 霓裳 失 太平 渔阳鼙鼓 暗 风尘 君王 只识 杨 丞相 不 识 平原 老守臣
e1e748e9-9fc5-4215-a963-633e7c9d9187,僧一行,徐钧,唐,诗,七言绝句,两戒山河剖析明 历分十二议尤精 况逢燕国为删润 可信千年说尚行,"7,7,7,7",dc2877fed74593c0a287adb738f1c7ba,两戒 山河 剖析 明 历分 十二 议 尤精 况逢 燕国为 删润 可信 千年 说 尚行
9be25c8e-012b-4302-aa92-7fa59b851a92,杜鸿渐,徐钧,唐,诗,七言绝句,将相浮云了幻躯 髠缁何事效浮图 灵州劝进无君父 投佛还能脱罪无,"7,7,7,7",63c65a2cb44518d78e99151f2a81266a,将相 浮云 了 幻躯 髠 缁 何事 效 浮图 灵州 劝进 无 君父 投佛 还 能 脱罪 无
5960be08-054f-4dd1-a303-019847711e19,李泌,徐钧,唐,诗,七言绝句,衣白山人再造唐 谋家议国虑深长 功成拂袖还归去 高节依稀汉子房,"7,7,7,7",d6df23cadcca4511ff7d89ecbbca4ff4,衣 白山 人 再造 唐 谋 家议 国虑 深长 功成 拂袖 还 归去 高 节 依稀 汉子 房
32645967-30b3-437c-88d4-2781e1d04a75,郭子仪,徐钧,唐,诗,七言绝句,身佩安危三十年 谗锋虽中节弥坚 古今多少功名在 谁得如公五福全,"7,7,7,7",76d198e5ec17d4a15522df1765b6e396,身佩 安危 三十年 谗锋 虽 中节 弥坚 古今 多少 功名 在 谁 得如 公 五福 全
ca5fd44a-a265-40ab-8448-b28dcccb0e41,李光弼,徐钧,唐,诗,七言绝句,间关百战佐中兴 料敌行师妙若神 可惜罹谗终恨死 伤心不见白头亲,"7,7,7,7",4a36573ad541be49a1134a2dfbfa69d3,间 关百战 佐 中兴 料 敌 行师 妙若神 可惜 罹谗 终 恨死 伤心 不见 白头 亲
857d1597-0062-49cf-80dc-e353f7a9b467,张巡,徐钧,唐,诗,七言绝句,析骸易子守孤城 六万惟余四百人 生道杀民民不怨 千年庙食尚如新,"7,7,7,7",cce4529975517e0074fdaecc66fa3bff,析骸易子 守 孤 城 六万 惟余 四百人 生道 杀 民民 不怨 千年 庙食 尚 如 新
f9bfaced-eba6-4ea2-afbc-b7c120b9bf0b,许远,徐钧,唐,诗,七言绝句,自度才卑乐尚贤 输忠直欲保城全 如公岂是偷生者 一死何庸较后先,"7,7,7,7",e555a7f38f2db315024e27354d05f859,自度 才 卑 乐尚贤 输 忠直 欲 保城 全 如 公 岂 是 偷生 者 一 死 何庸 较后 先
0250a8cb-1244-4c16-b73c-17c3e08a2f1e,雷万春,徐钧,唐,诗,七言绝句,六矢飞穿诧木人 屹然不动勇无伦 极知力尽城将陷 吾亦忘君有此身,"7,7,7,7",06530deeeaf32af79c29cbc0cfd2da4d,六 矢 飞 穿 诧木 人 屹然 不动勇无伦 极 知 力尽 城 将 陷 吾 亦 忘 君 有 此身
db2911ca-68a7-45ee-a645-285688fc4c99,张镐,徐钧,唐,诗,七言绝句,仗节星驰趣援兵 睢阳惜已陷忠臣 闾邱振命虽诛死 犹有浮图着矢人,"7,7,7,7",d9cffefb66204def81144ab6268aae8a,仗 节 星驰 趣 援兵 睢阳 惜 已 陷 忠臣 闾 邱振命 虽 诛死 犹 有 浮图 着 矢人
5745c659-e0bb-4ee3-a335-d960fa728923,苏源明,徐钧,唐,诗,七言绝句,满朝比比拜边尘 伪命难污守节臣 褒赏但令知制诰 如何只待作文人,"7,7,7,7",3091b8a87696b26e38fd01fd9f5e72f7,满朝 比比 拜 边尘 伪命 难 污 守节 臣 褒赏 但令 知制 诰 如何 只 待 作文 人
ea6e0dce-1a39-4772-8508-9a05ab0cc93c,李勉,徐钧,唐,诗,七言绝句,指破奸邪叵测心 一言剀切盍沉吟 主昏不听终无奈 付与清风一曲琴,"7,7,7,7",d6241b338a787124fc98e56c93c9c7f1,指破 奸邪 叵测 心 一 言 剀切 盍 沉吟 主 昏不听终 无奈 付与 清风 一曲 琴
4aee95af-ba93-4085-aad3-db783aa2d1ac,陆贽,徐钧,唐,诗,七言绝句,锄奸抗疏反招疑 一斥忠州势亦危 只集名方无著述 不为良相且良医,"7,7,7,7",9a1928d3b282d8e5996d21d1815a41fb,锄奸 抗 疏反 招疑 一 斥 忠 州 势 亦 危 只 集 名方 无 著述 不 为 良相 且 良医
f02db410-40a0-4d1b-b629-bf63e4bfcc26,阳城,徐钧,唐,诗,七言绝句,裂麻已沮延龄相 抗疏能全陆贽生 为国重轻关一语 谁云七载噤无声,"7,7,7,7",2b7cb9b0d136105d0d669e723b50ae8c,裂麻 已 沮延 龄 相 抗疏能 全陆 贽 生 为国 重轻 关一 语 谁 云 七载 噤 无声
6cfb61f0-575a-4b48-8327-f224308b901f,张万福,徐钧,唐,诗,七言绝句,伏阁朝廷一谏官 白头武将亦欢颜 要知此喜非私喜 为救孤忠去巨奸,"7,7,7,7",6deac208ebb2bde063d2793c031b5d5b,伏阁 朝廷 一 谏官 白头 武将 亦 欢颜 要知 此 喜非 私喜 为 救 孤忠 去 巨奸
eb6e50a9-7bdf-4e46-a3bb-146d7b12ede7,陆羽,徐钧,唐,诗,七言绝句,野客躭茶著作经 一时评品亦良精 谁知茗饮成风后 从此朝廷榷法行,"7,7,7,7",5021133ccbf2cd34f868b06e890fa8e1,野 客 躭 茶 著作 经 一时 评品 亦 良 精 谁知 茗 饮 成风 后 从此 朝廷 榷 法 行
789266bf-43cc-4996-a89e-9baa277d495d,韦臯,徐钧,唐,诗,七言绝句,抚边年久赋徭宽 善政春秋俗自安 蜀道虽危今坦易 登天不比向时难,"7,7,7,7",6edc37da2f548f7094909d8bbcb5fcfc,抚边 年 久 赋 徭宽 善 政 春秋 俗自安 蜀道 虽 危今 坦易 登天 不比 向 时难
c88d2126-f240-42f1-ad25-8c793fb564a0,孔巢父,徐钧,唐,诗,七言绝句,力仗孤忠化积顽 奉辞竟不遣生还 何如入海随烟雾 自有诗留天地间,"7,7,7,7",a8a220e1bada7651cb57c542143b99e6,力仗 孤忠 化积 顽 奉辞 竟 不遣 生还 何如 入海 随 烟雾 自有 诗 留 天地间
fa1f5f21-cbab-4f6e-a730-5ec6f81d9e2c,刘禹锡,徐钧,唐,诗,七言绝句,取水枫林莫怨嗟 钟声才听又天涯 如何一斥终难反 为赋玄都观里花,"7,7,7,7",039308e8c819389d2921ef9234729174,取水 枫林 莫 怨嗟 钟声 才 听 又 天涯 如何 一 斥 终难 反 为 赋 玄都观 里 花
56b629ef-d90f-41d3-a779-0d3bf0ed14e3,柳宗元,徐钧,唐,诗,七言绝句,自负奇才却附人 伾文一跌误终身 聪明未易消磨尽 犹作罗池庙里神,"7,7,7,7",a4e60685ee3a9cb7cb10194f3bd8db56,自负 奇才 却 附 人 伾 文 一 跌 误 终身 聪明 未易 消磨 尽 犹作 罗池 庙里 神
ef9309fe-c93f-4df3-9cfd-c6f8ffb2ed4e,裴度,徐钧,唐,诗,七言绝句,功名久震平淮后 机务方闲罢相余 晚节浮沉非失计 一园花竹午桥居,"7,7,7,7",c7e61a16980359766a720189a9a09685,功名 久震平 淮 后 机务 方闲 罢 相余 晚节 浮沉 非 失计 一 园花 竹午桥 居
270239f5-9e83-4b03-8c18-397d9406ce2f,李愬,徐钧,唐,诗,杂言,雪夜平吴自一奇 功成犹守分尊卑 櫜鞬非无为 不受私赇不肯行,"7,7,5,7",3c7ecdec42c8d021f689c63a60d3f0f6,雪夜 平吴 自 一奇 功成犹 守分 尊卑 櫜 鞬 非 无为 不 受 私 赇 不肯 行
3733a0bb-2207-473b-93dd-a1fdf641a8d9,韩愈,徐钧,唐,诗,七言绝句,排斥异端尊孔孟 推原人性胜荀杨 平生胆气尤奇伟 何止文章日月光,"7,7,7,7",1bd4be45bdad7f4ac7927c376602503e,排斥 异端 尊 孔孟 推原 人性 胜 荀杨 平生 胆气 尤 奇伟 何止 文章 日 月光
ab217d0a-eb5e-4dae-a299-39999c3817a5,李翱,徐钧,唐,诗,七言绝句,幽怀赋好欧公赏 实录文高黄子称 复性一书几有道 千年真可续韩灯,"7,7,7,7",b7e1a15b7f802f60e6ee731d91d7c19c,幽怀 赋好 欧公赏 实录 文高 黄子 称 复性 一 书 几 有 道 千年 真 可续 韩 灯
65417a6f-c2dd-46ce-a155-d3c4d6981777,张籍,徐钧,唐,诗,七言绝句,师门昔已称高弟 乐府今尤说最工 但遣终身毋叛道 著书不必似轲雄,"7,7,7,7",19031fe8c697d148c01d1b90df528639,师门 昔 已 称 高弟 乐府 今 尤 说 最 工 但 遣 终身 毋 叛道 著书 不必 似 轲 雄
99f5fb32-25a6-40cb-a6b0-7fe6a5ec8bb5,皇甫湜,徐钧,唐,诗,七言绝句,授业韩门岁月深 文章有法笔千钧 三缣一字非邀价 赏识如裴复几人,"7,7,7,7",3a6994690152452a7782109d069dae7a,授业 韩门 岁月 深 文章 有 法笔 千钧 三 缣 一 字 非 邀价 赏识 如 裴复 几 人
458d9385-cbf7-4e73-aaeb-e1fa5356a47c,卢仝,徐钧,唐,诗,七言绝句,数间破屋洛城傍 门闭春风煮茗香 月蚀一诗讥逆党 添丁奇祸竟堪伤,"7,7,7,7",9938640854fea6decb17d19eb854bba9,数间 破屋 洛城 傍 门闭 春风 煮茗 香 月蚀 一 诗 讥 逆党 添丁 奇祸 竟 堪伤
028f9ee0-34a3-42fc-9482-e2363bcb0c1d,孟郊,徐钧,唐,诗,七言绝句,自古诗人例怨穷 不知穷正街诗工 先生吟苦身尤蹇 恰似霜阶诉候虫,"7,7,7,7",231ded03a5780dec2b0fcf6ae7bba0dc,自古 诗人 例怨 穷 不知 穷 正街 诗工 先生 吟苦身尤蹇 恰似 霜阶诉候 虫
f3516bbe-5834-47fc-bdb0-55e0b4b2d572,贾岛,徐钧,唐,诗,七言绝句,早弃浮屠学缀文 争知命薄第难登 行吟月下敲门句 气味依然不脱僧,"7,7,7,7",dc5c46952271e2cbe07046f3733455a2,早 弃 浮屠 学 缀文 争知 命薄 第 难 登 行吟 月 下 敲门 句 气味 依然 不 脱 僧
d10c7f94-52d7-4a5f-9530-0132bab94eb5,李汉,徐钧,唐,诗,七言绝句,官虽御史未为荣 一序韩编万古名 不是文翁能有眼 谁知佳婿在诸生,"7,7,7,7",ecbf97a23bb87f58bdd03e470ff0baf3,官 虽 御史 未 为 荣 一 序 韩 编 万古 名 不是 文翁 能有 眼 谁知 佳婿 在 诸生
5734d93a-c428-4900-aa93-c70a349fa473,温造,徐钧,唐,诗,七言绝句,威行藩将来朝觐 胆落金吾畏击弹 牛刃恢恢方用世 青山虽好去应难,"7,7,7,7",bb901496f0d2d68de9ca0f91147e05cf,威行 藩 将来 朝觐 胆落 金吾畏 击弹 牛 刃 恢 恢 方用 世 青山 虽 好 去 应 难
3bd4a366-864a-4830-9f8a-8dc971875a49,李绅,徐钧,唐,诗,七言绝句,手书不受叛臣污 摧抑多端只故吾 已喜生前能自保 却怜身后尚遭诬,"7,7,7,7",ff90a1b995fa27fd4f44eaaf374e5020,手书 不 受 叛臣 污 摧抑 多端 只 故 吾 已 喜 生前 能 自保 却怜 身后 尚 遭 诬
0204a29e-3fb5-4470-b3d5-31bb7a55f437,元稹,徐钧,唐,诗,七言绝句,元和诗体夙驰声 巧致公台只𫏐荣 绿野主人天下望 不应疏外负平生,"7,7,7,7",8f6ecfa79f0a35d543bf4129132637f1,元 和 诗体 夙驰声 巧 致公 台 只 𫏐 荣 绿野 主人 天下 望 不 应 疏 外 负 平生
ab4f2a8a-74ec-4290-89e1-c1fb75f1763a,元结,徐钧,唐,诗,七言绝句,漫劳当日牧舂陵 立石尤多感德民 独有磨崖碑故在 文章千古耀湘滨,"7,7,7,7",cf272fcd104a349cca332c15a740c4c4,漫劳 当日 牧舂陵 立石 尤多 感 德民 独有 磨崖 碑故 在 文章 千古 耀 湘滨
2a6ba36f-4270-481b-9dd2-db21688976e8,啖助,徐钧,唐,诗,七言绝句,谈经唐世岂无人 君独春秋学最深 力辩邱阳非左氏 后来朱子始知音,"7,7,7,7",1654756c59e6cc6377a10c2f27c9f8f7,谈 经 唐世岂 无人 君 独 春秋 学 最深 力 辩 邱阳非 左氏 后来 朱子 始 知音
6d37ff97-14f5-4a64-bd99-e7561b8bc5ae,张志和,徐钧,唐,诗,七言绝句,细雨斜风一钓丝 绿蓑青笠镇相随 朝廷休觅渔歌看 万顷千波总是诗,"7,7,7,7",f1b0bcd42820d9201e5d1e167414dea2,细雨 斜风 一 钓丝 绿蓑青笠 镇 相随 朝廷 休觅 渔歌 看 万顷 千波 总是 诗
d7a84646-48b1-4714-8799-51bac38c4e00,严武,徐钧,唐,诗,七言绝句,蜀政贪残岂自全 母心直向死方安 如何三度专方面 不博庭闱一饷欢,"7,7,7,7",4b21a7f439c93253df764987264bc7bc,蜀 政贪残 岂 自 全 母心 直 向 死方 安 如何 三度 专 方面 不 博庭闱 一饷 欢
ec7c5a6f-9619-4355-959c-2feef466ce6a,崔祐甫,徐钧,唐,诗,七言绝句,道德驰声满建中 岂无人可继余风 最怜贞观开元治 付与奸邪蕞陋翁,"7,7,7,7",f0fb7e2041d09247e3396ee03f4b1c26,道德 驰声满 建中 岂 无人 可 继 余风 最怜 贞观 开元 治 付与 奸邪 蕞 陋 翁
fbeeebaa-83c6-4d4c-8dce-2a9ed724034b,题壁,赵良埈,唐,诗,七言绝句,三北何人知管仲 五湖何处觅陶朱 壁间遗墨还堪睹 吊罢灵魂一束刍,"7,7,7,7",f5a157c2a9ad692768c0704138ad8a7c,三北 何人 知 管仲 五 湖 何处 觅陶朱 壁间 遗墨 还 堪睹 吊 罢 灵魂 一束 刍
a862524b-0842-4207-8931-d8e94af30485,凤凰谷,赵良埈,唐,诗,七言古体,罗浮绝顶凌苍穹 五云飞绕蓬莱宫 金乌玉兔出西东 铁桥万丈横霁虹 卧虎踞石龙蟠松 异香不动烟腾空 餐霞饮露凡圣同 水帘碎玉声玲珑 桃花流出片片红 碧梧翠竹环三峰 天边凤鸟来雝雝 仙风吹入石洞中 我欲呼之仪九重 歌舞圣化同天功,"7,7,7,7,7,7,7,7,7,7,7,7,7,7",3b78c7606085bcca0344d0fcf8165574,罗浮 绝顶 凌 苍穹 五云飞 绕 蓬莱 宫 金乌玉兔 出 西东 铁桥 万丈 横霁虹 卧 虎踞 石 龙蟠 松 异香 不动 烟 腾空 餐霞 饮露 凡圣 同 水帘 碎玉 声 玲珑 桃花 流出 片片 红 碧梧 翠竹 环 三峰 天边 凤鸟 来 雝 雝 仙 风吹 入 石洞 中 我 欲 呼之仪 九重 歌舞 圣化 同 天功
d354fbc7-eac2-405e-9b22-ada56418ac00,乡饮酒唱和诗,赵良埈,唐,诗,七言律诗,警书双羽出乎西 端坐凝香恶境移 已铸剑锋成耒耜 更陶瓦缶作尊彝 雅南歌里声千古 干巽维边位两仪 细数旴江知郡事 有如此事几人知,"7,7,7,7,7,7,7,7",556da3b730f68f8dbf76a3fc0177b21d,警书 双羽 出乎 西 端坐 凝香 恶境 移 已 铸 剑锋 成 耒耜 更 陶瓦 缶 作 尊 彝 雅南 歌 里 声 千古 干巽维 边位 两仪 细数 旴江 知 郡 事 有 如此 事 几 人 知
aabf24a5-9693-4257-81b9-8fc7942c053e,乡饮酒唱和诗,张肃,唐,诗,七言律诗,位分南北与东西 旷典才修俗顿移 乐合鸾皇下庭宇 觯扬虎蜼伏樽彝 头颅如许堪殊席 筋力无多奈缛仪 敢昧邦君明德意 后知方遣负先知,"7,7,7,7,7,7,7,7",a5d4368dfb743c4b3e7b12f36dd2b735,位分 南北 与 东西 旷典才 修俗顿 移 乐合鸾 皇下庭 宇 觯 扬 虎 蜼 伏 樽 彝 头颅 如许 堪殊席 筋力无多奈缛仪 敢 昧 邦 君 明德 意 后 知方 遣负 先知
819dff2b-4ca5-46b5-b62d-c3ec82772ae7,勉子读书,赵崇泞,唐,诗,七言律诗,男儿立志要崚嶒 莫与闾阎较重轻 一寸光阴无放过 十年灯火夙修成 学疏达境还堪愧 道在穷途亦可亨 未必儒冠能见悮 书窗努力继芳声,"7,7,7,7,7,7,7,7",61234b1784e897018458617aa094be13,男儿 立志 要 崚嶒 莫 与 闾阎 较 重轻 一寸 光阴 无 放过 十年 灯火 夙 修成 学疏 达 境 还 堪愧 道 在 穷途 亦可 亨 未必 儒冠 能 见 悮 书窗 努力 继芳 声
6a72b228-1424-4796-aff4-7ad5d85df939,浯溪,戴煜,唐,诗,杂言,断崖文字是唐碑 无限名贤赞颂诗 莫把中兴 前代 会须重见太平时,"7,7,4,2,7",a2b9ce1869e40154c4f29c8ddfd53568,断崖 文字 是 唐碑 无限 名贤 赞颂 诗 莫 把 中兴 前 代 会 须 重见 太平 时
368a1593-7e3f-4dff-8030-d3c4876376be,嘲丁大全  其一,林桂龙,唐,诗,七言绝句,一舵中流欠把持 偏轻偏重失便宜 孤舟不是无人渡 身作风波问阿谁,"7,7,7,7",4c24b8c350e1bd77bcdc83cb35d98580,一 舵 中流 欠 把持 偏轻 偏重 失 便宜 孤舟 不是 无人 渡 身作 风波 问 阿 谁
413f8d63-a4dc-47d7-ae0b-6e2d4cb10282,嘲丁大全  其二,林桂龙,唐,诗,七言绝句,移溪实壑误明君 惊动沿江十万军 幸是不沈湘水死 有何面目见灵均,"7,7,7,7",68502446ac344860f9bc4c15c16901c6,移溪 实壑 误明 君 惊动 沿江 十万 军 幸是 不 沈 湘水 死 有何面目 见 灵均
8d31bf8f-42c3-4138-8fa7-9a9bef72a1af,嘲丁大全  其三,林桂龙,唐,诗,七言绝句,稚子如何济急流 一篙才错便难收 当初把作寻常看 岂料中流解覆舟,"7,7,7,7",05dbbe292410d4a77ba4eab6a0fa7968,稚子 如何 济 急流 一 篙 才 错 便 难 收 当初 把 作 寻常 看 岂料 中流 解 覆舟
3c44c56a-315f-4b9a-8867-5e8ede643efb,题魏鹏卧屏,贾云华,唐,诗,七言绝句,花柳芳菲二月时 名园剩有牡丹枝 风流杜牧还知否 莫恨寻春去较迟,"7,7,7,7",e1732875d61c6abf779e612fa1255b79,花柳 芳菲 二月 时 名园 剩有 牡丹 枝 风流 杜牧 还 知否 莫 恨 寻 春去 较 迟
7a3b80e3-6ef5-467f-b1cc-7f90c84487d3,魏鹏负期醉卧戏题练裙,贾云华,唐,诗,七言绝句,暮雨朝云少定踪 空劳神女下巫峰 襄王自是无情绪 醉卧明月花影中,"7,7,7,7",9548fa90c45e83e313806c1ce583d7a0,暮雨朝云 少 定踪 空 劳神 女下 巫峰 襄王 自是 无 情绪 醉卧 明月 花影 中
bf47b256-fe75-42fc-9901-3396ab5fbee0,七夕,贾云华,唐,诗,七言绝句,斜軃香云倚翠屏 纱衣先觉露华零 谁云天上无离合 看取牵牛织女星,"7,7,7,7",e6a8494a179ff07cd6a623a537fe91df,斜 軃 香 云 倚 翠 屏 纱衣 先觉 露华 零 谁 云天 上 无 离合 看取 牵牛织女 星
ffcd912a-968e-48ea-a406-2274ccdb4401,永别  其一,贾云华,唐,诗,七言绝句,自从消瘦减容光 云雨巫山枉断肠 独宿孤房泪如雨 秋宵只为一人长,"7,7,7,7",810c7ed8fbdeab0a3aa443f52718f0ec,自从 消瘦 减 容光 云雨巫山 枉 断肠 独宿 孤房泪如雨 秋宵 只 为 一 人长
d5103afc-445c-4d86-a6ea-f2884905d5af,永别  其二,贾云华,唐,诗,七言绝句,正成薄命久寻思 宛转蛾眉能几时 汉水楚云千万里 留君不住益凄其,"7,7,7,7",864c58d5d43a215fd393d937b912e7b5,正成 薄命 久 寻思 宛转蛾眉 能 几时 汉水 楚云 千万里 留 君 不住 益 凄 其
f6bbdfdc-efe7-4f5d-8f28-4692c8098fe0,永别  其三,贾云华,唐,诗,七言绝句,物换星移几度秋 鸟啼花落水空流 人间何事堪惆怅 贵贱同归土一丘,"7,7,7,7",e45347e020012672eb458134e77996f7,物换星移 几度 秋 鸟啼花落 水空流 人间 何事 堪 惆怅 贵贱 同归 土 一 丘
d3a7c6f2-98f7-4ac1-a6b0-d441af1cf0bb,永别  其四,贾云华,唐,诗,七言绝句,相见时难别亦难 寒潮惟带夕阳还 钿蝉金雁皆零落 离别烟波伤玉颜,"7,7,7,7",9acf8ff3353d8afea88d2b2bcc48e8c6,相见 时 难别 亦 难 寒潮 惟 带 夕阳 还 钿 蝉 金雁皆 零落 离别 烟波 伤 玉颜
8d8df183-8d6e-4031-b5f6-ab2c170ea379,永别  其五,贾云华,唐,诗,七言绝句,倚栏无语倍伤情 乡思撩人拨不平 寂寞闲庭春又晚 杏花零落过清明,"7,7,7,7",72d0e9bc7ac44847921c0197d0277ab3,倚栏 无语 倍 伤情 乡思 撩人 拨 不平 寂寞 闲庭 春 又 晚 杏花 零落 过 清明
9cf7d4c8-4b20-4f6a-b94e-eae8ca58544f,永别  其六,贾云华,唐,诗,七言绝句,纱窗日落渐黄昏 春梦无心只似云 万里关山音信断 将身何处更逢君,"7,7,7,7",9ceea025742d24e0fcf12e89769c8828,纱窗 日落 渐 黄昏 春梦 无心 只似 云 万里 关山 音信 断 将身 何处 更 逢 君
a4b21b5a-a975-44d8-b915-8fdbea85e109,永别  其七,贾云华,唐,诗,七言绝句,魂归冥漠魄归泉 却恨青娥误少年 三尺孤坟何处是 每逢寒食一潸然,"7,7,7,7",35ecac8889428147a3d435be7feb32cf,魂归 冥漠 魄归泉 却 恨 青娥 误 少年 三尺 孤坟 何处 是 每逢 寒食 一 潸然
a07a997c-25b5-4d76-a4ef-dac55232aad4,永别  其八,贾云华,唐,诗,七言绝句,一封书寄数行啼 莫动哀吟易惨凄 古往今来只如此 几多红粉委黄泥,"7,7,7,7",c1e92c94456eb993158b73f2a7c9f03f,一封 书 寄 数行 啼 莫动哀吟易 惨凄 古往今来 只 如此 几多 红粉 委 黄泥
4ea41082-5ef4-4491-8ffc-e63d35f3eeaa,集元刺史句咏寒亭,杜子是,唐,诗,五言古体,长山绕井邑 嘐嘐天外青 烟云无近远 水石何幽清 半崖盘石径 如见小蓬瀛 时节方大暑 忽若秋气生 高亭临极巓 登高宜新晴 俗士谁能来 野客熙清阴 漫歌无人听 在酒共我倾 时复一回望 心月出四溟,"5,5,5,5,5,5,5,5,5,5,5,5,5,5,5,5",0afd5602a5dbbdb03e75ed801f2cfc7a,长山 绕 井 邑 嘐 嘐 天外 青 烟云 无近 远 水石 何幽清 半 崖 盘 石径 如见 小蓬瀛 时节 方 大暑 忽 若 秋气 生 高亭临极 巓 登高 宜新晴 俗士 谁 能 来 野 客熙 清 阴 漫歌 无人 听 在 酒 共 我 倾 时 复 一回 望 心 月 出 四 溟
11a29684-145f-4e5b-9e7a-a59e554bdabc,送西秦张仲实游大涤洞天,金应桂,唐,诗,五言律诗,山林有真趣 得趣即神仙 好趁暮春月 来游大涤天 晴岚融玉室 花气袭丹泉 此地通悬霤 清吟过叔元,"5,5,5,5,5,5,5,5",e41d77aeef1ee780b313eb89d93dbcf0,山林 有 真趣 得趣 即 神仙 好 趁 暮春 月 来 游 大 涤 天 晴岚 融玉室 花气 袭 丹泉 此地 通 悬 霤 清 吟 过 叔 元
e764f4b7-49b2-405d-9e59-0091d02d6e8c,绝命词,边居谊,唐,诗,七言绝句,孤城高倚汉江秋 血战三年死未休 铁石肝肠忠义胆 精灵常向岘山留,"7,7,7,7",c479a30802d4b36e105e958684c235e8,孤 城 高 倚 汉江 秋 血战 三年 死 未 休 铁石 肝肠 忠义 胆 精灵 常 向 岘山 留
e5e97e8d-fc66-4050-8c72-e74f97809add,今朝,李智远,唐,诗,七言绝句,四十三年处世中 梦中成梦又成空 今朝撒手还归去 木马频嘶物外风,"7,7,7,7",731128549039f65795fa9f732ca540c3,四十三年 处世 中 梦中成 梦 又 成 空 今朝 撒手 还 归去 木马 频 嘶 物 外 风
78a69ce2-1545-4f28-bc4c-765cd0cfa124,春日田园杂兴,刘汝钧,唐,诗,七言律诗,年来梦断百花场 安分农桑万虑降 为喜麦青行暖迳 因看蚕出倚晴窗 草坪闲见乌犍点 畬水飞来白鹭双 满饮茅柴拚烂醉 踏歌社下自成腔,"7,7,7,7,7,7,7,7",7e36d5713243e747ed3e4132f99f562e,年来 梦断 百花 场 安分 农桑 万 虑 降 为 喜麦 青行 暖 迳 因看 蚕出 倚 晴 窗 草坪 闲见 乌 犍点 畬 水 飞来 白鹭 双 满饮 茅柴 拚 烂醉 踏歌 社下 自成 腔
3c8f5d4f-3f9f-4175-9dae-03182a1b1a3c,次胡济鼎同年三律  其一,曹泾,唐,诗,七言律诗,五经为笥腹便便 千佛名髙此作缘 贵仕直堪梅和鼎 贫交猥为酒供钱 连章秋月鴈回翅 贮袖天香龙吐涎 旧话新情如觌面 同年真是我同年,"7,7,7,7,7,7,7,7",e6653e8cdbb120cc983fd88863ec5cb7,五经 为 笥 腹 便 便 千 佛 名 髙 此 作 缘 贵仕 直堪 梅和鼎 贫交 猥为 酒 供 钱 连章 秋月 鴈 回 翅 贮 袖天香龙吐涎 旧 话 新情 如 觌 面 同年 真是 我 同年
eaa8fb34-a0a5-4dd1-bee9-3cbfc9951a19,次胡济鼎同年三律  其二,曹泾,唐,诗,七言律诗,共是金明衣绿郎 梅仙风致压仇香 人如紫鳯仪丹阁 谁则青蚨涴锦囊 洛社菜羮时不禁 雪堂斗酒夜宜良 至尊端肯怜芹曝 臣罪当诛自恐惶,"7,7,7,7,7,7,7,7",d82d32d7d7a9b857dac90ecf332f8373,共 是 金明 衣绿郎 梅仙 风致 压仇 香 人 如 紫 鳯 仪 丹 阁 谁 则 青 蚨 涴 锦囊 洛社 菜 羮 时 不禁 雪堂 斗酒 夜 宜良 至尊 端 肯怜 芹 曝 臣 罪当诛自 恐惶
8f32b203-e48b-4403-b5f1-1be41e7ad80f,次胡济鼎同年三律  其三,曹泾,唐,诗,七言律诗,费却长吟复短吟 投瓜投李愧何深 吾人只记钱留纸 此老能令户作金 掷地有声知处处 如兰斯臭见心心 柏梁体后八仙赋 趾美重光未陆沉,"7,7,7,7,7,7,7,7",38d07bf5c84abb6b85fd8e523b1913e6,费 却 长吟 复 短吟 投瓜 投 李愧 何深 吾人 只 记钱 留纸 此 老 能令户 作金 掷地有声 知 处处 如 兰斯 臭见心心 柏梁体 后 八仙 赋 趾美 重光 未 陆沉
7512f324-a885-454c-87b1-59e8340351f0,次胡余学同年四首  其一,曹泾,唐,诗,七言律诗,对看中秋是好天 健来欣为子分田 只消菽水欢无尽 况有经书腹可便 家事既传情思穏 吟篇谩写墨痕鲜 惟余学课随年挨 共我艰劬知几员,"7,7,7,7,7,7,7,7",4e6180d9dd193cecbf7e902b9c6b6ff5,对 看 中秋 是 好 天 健来 欣为 子分 田 只 消 菽 水 欢 无尽 况有 经书 腹 可 便 家事 既 传 情思 穏 吟 篇 谩写 墨痕 鲜 惟余 学课 随年 挨 共 我 艰 劬 知 几员
