id,title,author,dynasty,genre,poem_type,sentences_simplified,meter_pattern,hash,words
b252d714-1d0a-40d4-a500-f036229bfff7,秋色,黄庚,唐,诗,七言绝句,虹影界开微惨淡 雁痕点破更凄清 一番雨过天容碧 尽是西风染得成,"7,7,7,7",c9606b8c55fa426d9b5d822192c1aef2,虹影 界 开 微 惨淡 雁痕 点破 更 凄清 一番 雨 过 天容 碧 尽 是 西风 染得 成
8405d681-4ee3-4b89-85e7-1cdb2dba6ef6,秋声,黄庚,唐,诗,七言绝句,庭外梧桐叶叶风 楼头过雁砌边蛩 隔窗砧杵敲残月 唤起乡愁归兴浓,"7,7,7,7",a6316fb4176b12a9508dd4f13bbeb5b2,庭外 梧桐叶 叶风 楼头 过 雁 砌 边 蛩 隔窗 砧杵 敲 残月 唤起 乡愁 归兴 浓
1fb9ddb4-e4fa-44ee-b4d9-cf4e5f741511,秋阴,黄庚,唐,诗,七言绝句,漠漠寒烟暗蓼汀 江涵雁影不分明 一天暝色迷清昼 云阁西风雨未成,"7,7,7,7",9740f016d9a760900a660920a34c522d,漠漠 寒烟 暗 蓼 汀 江涵雁 影 不 分明 一天 暝 色迷 清 昼 云阁 西 风雨 未 成
d4e1369f-d401-4f7d-be25-d970ee4533cf,秋霁,黄庚,唐,诗,七言绝句,雨过郊墟凉意新 凝云驳尽十分晴 隔江一抹斜阳影 怪向蓼花红处明,"7,7,7,7",0f47cdd330596d6bd66af2cb986af2de,雨过郊 墟 凉意 新 凝云驳 尽 十分 晴 隔江 一抹 斜阳 影 怪向 蓼花 红处明
8f9fae28-824c-41df-b994-06a9e408e4de,秋意,黄庚,唐,诗,七言绝句,庭前梧叶雨晴后 江上荻花风起时 凉透书窗人未觉 葛衣竹簟已先知,"7,7,7,7",4ccc2be1ecde65a8f451bf26d4aa3013,庭前 梧叶 雨晴 后 江上 荻 花风 起 时 凉透书 窗人 未觉 葛衣竹 簟 已 先知
fb7cdadf-4812-4f9f-8914-96d469b3be08,闺情效香奁体  其一,黄庚,唐,诗,七言绝句,金鸭烟销一字香 满怀春恨强梳粧 看花又怕东风恶 偷隔纱窗看海棠,"7,7,7,7",6dec0bd420708951d70c9f9f047dfcd2,金 鸭烟 销一 字香 满怀 春 恨 强 梳 粧 看 花 又 怕 东风 恶 偷隔 纱窗 看 海棠
683e2b46-2736-40cd-b11f-35f812b4478c,闺情效香奁体  其二,黄庚,唐,诗,七言绝句,泪澣香腮粉未干 相思成病怯春寒 此情欲向琵琶诉 整得琵琶又倦弹,"7,7,7,7",c4f65d2e67dcea7ca677df5e1c9fb467,泪 澣 香腮 粉未 干 相思 成病 怯 春寒 此 情欲 向 琵琶 诉 整 得 琵琶 又 倦 弹
69d2a62b-bd29-4376-8e87-9fcf088dde48,闺情效香奁体  其三,黄庚,唐,诗,七言绝句,黛眉愁里敛双蛾 别久无书事奈何 欲待怨他还又忆 怨时较少忆时多,"7,7,7,7",78474dab925f342ffbfc9bb4a5931726,黛眉 愁里敛 双蛾 别久 无 书 事 奈何 欲 待 怨 他 还 又 忆 怨 时 较 少 忆 时 多
31ec7561-cef7-4df7-bc44-8c293e2fcc7c,闺情效香奁体  其四,黄庚,唐,诗,七言绝句,懒向粧台对镜鸾 罗衣怯薄正春寒 黄金络索珊瑚坠 独立春风看牡丹,"7,7,7,7",0c4756451e26ea4951bc0e6d3f0d6a08,懒 向 粧 台 对 镜 鸾 罗衣 怯薄正 春寒 黄金 络索 珊瑚 坠 独立 春风 看 牡丹
22266ada-5d8e-4065-89d9-12740e19d56c,江村即事,黄庚,唐,诗,七言绝句,江村暝色渐凄迷 数点残鸦杂雁飞 雁宿芦花鸦宿树 各分一半夕阳归,"7,7,7,7",89da909b678740538649e6fb022cc20a,江村 暝 色 渐 凄迷 数点 残鸦 杂雁 飞 雁宿 芦花 鸦宿 树 各 分 一半 夕阳 归
d4f87e3f-6408-418f-8865-d85d56d0a525,春日,黄庚,唐,诗,七言绝句,紫燕评春语画梁 黄鹂搀晓啭垂杨 博山烟冷书窗静 风飐瓶花点砚香,"7,7,7,7",35325e41516d568f99a9cfedc91e8794,紫燕 评春 语画 梁 黄鹂 搀 晓 啭 垂杨 博山 烟 冷书 窗静 风 飐 瓶 花 点 砚 香
fd2728ec-721b-4d93-8324-7f1c3b7b993c,舟次九山,黄庚,唐,诗,七言绝句,水云尽处列奇峰 螺髻参差杳霭中 江岸维舟看不了 烟岚分碧入疏蓬,"7,7,7,7",5b9701365959e493109fc4b3108819e4,水云 尽处 列 奇峰 螺髻 参差 杳 霭 中 江岸 维舟 看 不了 烟岚 分碧入疏蓬
e31442b4-c574-452e-afc5-6450f915a669,读秦纪,黄庚,唐,诗,七言绝句,并吞六国独称雄 经籍灰飞烈焰中 书外有书焚不尽 一篇圯上汉成功,"7,7,7,7",2b7246a15a8937d9e70fd39e1645b1cf,并吞 六国 独 称雄 经籍 灰 飞 烈焰 中 书 外 有 书 焚 不尽 一篇 圯 上汉 成功
6e81623f-b002-49cf-92d1-a2a246e27a7e,修竹馆舍,黄庚,唐,诗,七言绝句,乳燕衔泥春昼长 枕书无梦到高唐 桃花红雨梨花雪 相逐东风过粉墙,"7,7,7,7",3623f38ccd9f53295a76f59235caea1a,乳燕 衔泥 春 昼长 枕书 无 梦 到 高唐 桃花 红雨 梨花 雪 相逐 东风 过 粉墙
75d6d5a1-0d58-46f3-a2c3-075cc935f9f5,夏日陪王君玉泛舟鉴湖,黄庚,唐,诗,七言绝句,波光万顷接天光 画舫归来载夕阳 一棹湖心天不暑 万荷风里满身香,"7,7,7,7",7c22d8927a68dde57bb35082ccf38216,波光 万顷 接 天光 画舫 归来 载 夕阳 一 棹 湖心 天不暑 万 荷风 里 满身 香
2d920b01-ed16-4064-ae4c-aa51cf2a02c6,秋夜登西楼,黄庚,唐,诗,七言绝句,清碧金英玉露漙 姮娥深夜不禁寒 桂花香里人敲句 倚遍高楼十二阑,"7,7,7,7",dd6e3643a7f7844f7068cd3b19a6afae,清碧 金英玉 露 漙 姮娥 深夜 不禁 寒 桂花香 里 人 敲 句 倚 遍 高楼 十二 阑
ed378f62-8acb-4305-a622-14f5df6d06c5,杂咏  其一,黄庚,唐,诗,七言绝句,柳嫌暮雨鶑声涩 花怯东风蝶梦寒 偶忆故园春色好 他乡花柳带愁看,"7,7,7,7",fb34e85043cd71a35f9e1bc3e9bf5719,柳嫌 暮 雨 鶑 声 涩 花怯 东风 蝶梦 寒 偶忆 故园 春色 好 他 乡 花柳 带愁 看
88971820-6f83-4279-a8bf-744367bda672,杂咏  其二,黄庚,唐,诗,七言绝句,人非陶令空看菊 诗不林逋漫咏梅 晋宋后来爱花者 输他高节与高才,"7,7,7,7",60dbeaf9e11ff108745522928585b7ef,人 非 陶令空 看 菊 诗 不 林逋漫 咏梅 晋宋 后来 爱 花者 输 他 高节 与 高 才
55bc9855-2d5d-49e1-999b-a9f6db2495d8,杂咏  其三,黄庚,唐,诗,七言绝句,天外斜阳犹在树 林间宿鸟已归巢 黄昏莫把柴门掩 恐有诗人带月敲,"7,7,7,7",5f74a725649808ab78a2b2ed941c43bc,天外 斜阳 犹 在 树 林间 宿鸟 已 归 巢 黄昏 莫 把 柴门 掩 恐 有 诗人 带 月 敲
8fe31cce-b1b7-4c00-a854-e7bafc352df7,杂咏  其四,黄庚,唐,诗,七言绝句,穉柳已回春暖意 残梅犹结岁寒心 百年身世诗中老 好景难消几度吟,"7,7,7,7",d7b2b552db702919b527a37109136cc0,穉 柳 已 回春 暖意 残梅 犹结 岁 寒心 百年 身世 诗 中 老 好景 难 消 几度 吟
0508b3e2-abd0-4fa8-a8ac-181765735cb2,杂咏  其五,黄庚,唐,诗,七言绝句,新绿园林微雨后 落红庭院夕阳时 一声杜宇催春去 贪睡棠妃未必知,"7,7,7,7",c3d2ec5312a6d1813f00772abba3a79d,新绿 园林 微雨 后 落红 庭院 夕阳 时 一声 杜宇 催 春去 贪睡 棠妃 未必 知
01597782-3197-4659-8d33-87d08ee565db,杂咏  其六,黄庚,唐,诗,七言绝句,持螯已饱团脐蟹 砟脍犹思巨口鲈 风物秋来多感慨 天寒酒醒客心孤,"7,7,7,7",5eb77d8a606a23dc32cac12648264b97,持 螯 已 饱 团脐 蟹 砟脍 犹 思 巨口 鲈 风物 秋来 多 感慨 天寒 酒醒 客心 孤
90e1d0aa-43d5-49c4-aaaa-2dfb5cd21756,杂咏  其七,黄庚,唐,诗,七言绝句,囊底诗成无卖处 床头金尽已多时 元龙豪气依然在 惯守清贫岂足悲,"7,7,7,7",3f1e75bdf10c94c93a32f0e4c6fc7066,囊 底 诗 成 无卖 处 床头金尽 已多时 元龙豪气 依然 在 惯守 清贫 岂足悲
2b1155c4-46a0-43c6-a45a-42f3b11ecfc5,杂咏  其八,黄庚,唐,诗,七言绝句,人无气节何足道 腹有诗书自不同 实学真才谁具眼 江湖难遇杜司空,"7,7,7,7",fd2fd25c401f3da4eb9a1be2c91ca746,人 无 气节 何足道 腹有 诗书 自 不同 实学 真才 谁 具眼 江湖 难遇 杜 司空
7ebac1c4-38ff-49d6-b63e-458b95b9fee6,杂咏  其九,黄庚,唐,诗,七言绝句,地多种竹堪容鹤 池不栽莲恐碍鱼 小径荒苔人不到 闭门闲学换鹅书,"7,7,7,7",112d9e3b96b0e9aa478ad4358d1390b1,地 多种 竹 堪 容鹤 池 不 栽 莲 恐 碍 鱼 小径 荒苔 人 不到 闭门 闲学 换鹅 书
d8ce8328-c2f0-41c4-8fd5-e4531d6242c7,竹林夏日,黄庚,唐,诗,七言绝句,不受炎光玉万竿 仙林便作晋林看 此君长带冰霜气 醉卧绿阴诗梦寒,"7,7,7,7",3d5810b116b068396aed0cd71e47448c,不受炎光玉万竿 仙林 便 作 晋林 看 此君 长 带 冰霜 气 醉卧 绿阴 诗梦寒
b6d2612c-421f-4882-915e-2af679cf98c6,滴翠松,黄庚,唐,诗,七言绝句,老翠蟠空一样高 月分寒影落庭臯 哦诗猛把阑干拍 宿鹤惊飞露湿袍,"7,7,7,7",681d226b9e0ce9fc34fa1e31c20929fd,老翠蟠 空 一样 高 月 分寒 影落 庭 臯 哦 诗 猛 把 阑干 拍 宿鹤 惊飞 露湿袍
797e1ad7-8aac-41f4-b433-b012f76cd686,夜窗,黄庚,唐,诗,七言绝句,香篆烟销夜已阑 砚池冰结漏声寒 梅花悬影书窗上 应待诗人带月看,"7,7,7,7",ff32d6077398f17c4fc4e2035192871a,香 篆 烟销夜 已 阑 砚池 冰结 漏声 寒 梅花 悬影 书 窗上 应待 诗人 带 月 看
97bd2957-4985-4ab3-becf-d966fdb7c844,寄郭印斋,黄庚,唐,诗,七言绝句,相思何日得相逢 料想君心与我同 莫怪近来书寄少 雁飞不肯下秋空,"7,7,7,7",736495f4265f949f2fb507278ce79623,相思 何日 得 相逢 料想 君心 与 我 同 莫怪 近来 书 寄少 雁飞 不肯 下秋 空
e47434b7-98ac-4b04-a23b-cdc2c3bc4737,句  其一,黄庚,唐,诗,五言古体,江蓠满意馨,5,e0059536b6a4a0d7e82dfdba4df1da6e,江蓠 满意 馨
1a03fc05-ed47-4d32-a596-c2516d969b04,句  其二,黄庚,唐,诗,五言古体,飒飒片帆轻,5,d4d45daca27fba22b7fb1d3ebbee2296,飒飒 片帆 轻
97b960bc-133f-41dd-9377-903f67b2286c,晓起,林景怡,唐,诗,五言古体,天鸡弄喔咿 残星在斜汉 整衣出幽扉 山城漏初断 微微水风生 冉冉田露散 此时游葛天 淡然空百羡 海色上寒梢 渐识梅花面,"5,5,5,5,5,5,5,5,5,5",99f2c072b5f9418f72bc8822201d016a,天鸡 弄 喔 咿 残星 在 斜汉 整衣 出 幽扉 山城 漏 初断 微微 水风 生 冉冉 田露 散 此时 游葛天 淡然 空百羡 海色 上 寒 梢 渐识 梅花 面
4215f6eb-693c-4a6c-a07a-3bc95be54822,废观,林景英,唐,诗,五言律诗,羽衣人已化 无处问殊庭 春色桃谁种 天香药自灵 片霞飞绝顶 一鹤下青冥 荒藓空阶下 犹闻夜祭星,"5,5,5,5,5,5,5,5",27875ef3f726975258632987e7a582d5,羽衣 人 已 化 无处 问殊庭 春色 桃 谁种 天香药 自灵 片霞飞 绝顶 一 鹤 下 青 冥 荒藓 空阶 下 犹闻 夜 祭星
080c01ba-9de7-4f67-9f33-5b4ff589eba3,寄陈莘村,林景英,唐,诗,五言律诗,玄冬梅半白 光接太丘星 雪月往来梦 溪山长短亭 利名成露草 行止付风萍 三十年来友 无如老典型,"5,5,5,5,5,5,5,5",b6b74789fed2751121d074f4909c99aa,玄冬梅 半白 光 接 太丘星 雪月 往来 梦 溪山 长短 亭 利名 成露 草 行止 付风萍 三十年 来友 无如老 典型
6cd4efe8-82a1-4c5f-aa74-07210b983527,秋风,林景英,唐,诗,五言律诗,飒然何处起 水国不成眠 触树人疑雨 开门月在天 渔舟移绝浦 雁阵落荒田 晓起伤漂荡 芦花走屋前,"5,5,5,5,5,5,5,5",022c34588a6939761abad8d1e0d03798,飒然 何处 起 水国 不 成眠 触树人疑雨 开门 月 在 天 渔舟 移绝 浦 雁阵 落荒 田 晓起 伤 漂荡 芦花 走 屋前
a9b54aa4-47d3-47e1-bcab-8c5c17a312a2,言归,林景英,唐,诗,五言律诗,言归江海上 甘向石田耕 不愧为斯世 能闲过此生 地从邻竹占 树听野禽争 坐咏风涛外 南山尽日行,"5,5,5,5,5,5,5,5",c3f0f13eeca2d1ccbeb9257d14ca13f8,言 归 江海 上 甘向石 田耕 不愧为 斯世 能 闲过 此生 地 从 邻竹 占 树 听 野禽 争 坐咏 风涛 外 南山 尽 日 行
b14202c2-d682-48a9-a4be-93ec2795022b,林氏庵呈周炼师,林景英,唐,诗,五言律诗,遥跨青田鹤 翩翩到此来 庭生自家草 山有主人梅 扫石夜朝斗 雨田秋起雷 谁知尘影里 清趣似蓬莱,"5,5,5,5,5,5,5,5",6480ffb5f41dfc676509b0fa5a722f04,遥 跨 青田 鹤 翩翩 到 此来 庭生 自家 草 山 有 主人 梅 扫石 夜朝 斗 雨田秋 起雷 谁知 尘影 里 清趣 似 蓬莱
46460c2e-ad50-4c40-87a4-dee1ee3b379b,送友之石龙,林景英,唐,诗,七言律诗,一杯渭酒劝诗豪 杨柳西风拂去袍 行路正当金虎壮 登云不惮石龙高 水悬岩白惊残雪 日漾溪红认落桃 记取奚囊新句得 月三四幅寄东臯,"7,7,7,7,7,7,7,7",9b59f0bb689543166dc85bf831140b86,一杯 渭酒劝 诗豪 杨柳 西风 拂去 袍 行路 正当 金虎壮 登云 不惮 石龙 高 水 悬岩 白惊 残雪 日 漾溪 红 认 落桃 记取 奚 囊 新 句 得 月 三 四幅 寄东 臯
2f4b3438-8e12-49e6-a5aa-ee1ac09e752a,日出入行,林景英,唐,诗,五言绝句,朝出扶桑来 莫入虞渊去 胡不缓驰驱 百岁一朝暮,"5,5,5,5",65af8b911866ad812801b38767c4858d,朝 出 扶桑 来 莫入 虞渊 去 胡不缓 驰驱 百岁 一 朝暮
a82f213c-79ad-469f-bc0a-deb37dc7ad6c,句,赵与侲,唐,诗,五言古体,溪月涵虚影 山云护断香,"5,5",5d368c0b0e875acbefccd70cb2580400,溪 月 涵虚 影 山云 护断 香
47ffc8fc-7cff-4d41-a488-c284ecb3a73d,句,朱焕文,唐,诗,七言古体,江山千里俱头白 骨肉十年终眼青,"7,7",9c475f0c78bb9a27c3c805f69fd9c293,江山 千里 俱头 白 骨肉 十年 终眼 青
2785a6e7-c8f3-4c59-a434-6c715fef06c2,澹山岩,赵德纶,唐,诗,七言律诗,岩扃二里锁烟霏 天下名山此本稀 硬石穿空谁运斧 寒泉滴雪欲添衣 仙游尘外杜萝老 僧住山间笋蕨肥 自叹微官犹缚我 倘容卜筑定忘归,"7,7,7,7,7,7,7,7",a703cc7c61037b393fced8137d982c57,岩 扃 二里 锁 烟霏 天下 名山 此 本稀 硬石 穿空 谁 运 斧 寒泉 滴雪欲添衣 仙游 尘 外 杜萝 老 僧 住 山间 笋 蕨肥 自叹 微官 犹缚 我 倘 容卜筑定 忘归
d79bf99b-8b20-4adf-99fc-ff100dfa283f,送退斋先生归武夷  其一,林若存,唐,诗,五言古体,我未识退斋 虚生七十载 一旦过诸途 未语心先拜 堂堂眉睫间 礼乐见三代 正涂日以荒 良心日以坏 天不产斯人 吾道将畴頼,"5,5,5,5,5,5,5,5,5,5",70e60bf26082a11aa6ceb976776be37f,我 未 识退 斋 虚生 七十 载 一旦 过 诸 途 未 语心 先 拜 堂堂 眉睫 间 礼乐 见 三代 正涂 日 以 荒 良心 日 以 坏 天不产 斯人 吾 道 将 畴 頼
94eeee1b-a8c1-417c-8b2a-ebfba4b10a14,送退斋先生归武夷  其二,林若存,唐,诗,五言古体,书院新鳌峰 五贤祠学宫 马邵独避席 将无道不同 专专论的派 此理谁当穷 独学无师友 前儒议温公 准绳规矩内 安得鞭霆风,"5,5,5,5,5,5,5,5,5,5",2cbc3e95601a24dc9acab4a94cbf0740,书院 新 鳌峰 五 贤 祠 学宫 马邵 独 避席 将 无道 不同 专 专论 的 派 此理 谁 当穷 独学 无 师友 前 儒议 温公 准绳 规矩 内 安 得 鞭霆风
0178dbe7-97a8-4acb-9435-aca315510f14,送退斋先生归武夷  其三,林若存,唐,诗,五言古体,我七君六旬 从会知无期 但贪言议合 不悮光景非 先生明当别 吾将俦决疑 欲言尚何限 记一十已遗 及其未溘先 幸无靳珍题,"5,5,5,5,5,5,5,5,5,5",839134ff2446eb59fe5a4245cd98940c,我 七 君 六旬 从 会 知 无期 但 贪言议 合 不 悮 光景 非 先生 明 当别 吾 将 俦 决疑 欲言尚何限 记 一十 已 遗 及其 未 溘先 幸无靳 珍题
687b040e-1f2a-4588-bccc-7e0ae6428887,送退斋先生归武夷  其四,林若存,唐,诗,五言古体,大运何茫茫 海桑逝不留 武夷有乔木 虬枝尚相樛 自昔擢巍科 为今阐大猷 万里惮北上 三年喜南游 长身古衣冠 庞眉瞭双眸 虽与今人居 不与今人俦 和风颜子春 泰山邹孟秋 一双忧世泪 溅入银河流 相期入圣域 舍子谁当优 奈何弃我去 荦确归途修 我欲断中流 去棹何悠悠 我欲息天风 别袂何飕飕 明晨君已远 晚岁吾何求 恐无后会期 笑作来生谋,"5,5,5,5,5,5,5,5,5,5,5,5,5,5,5,5,5,5,5,5,5,5,5,5,5,5,5,5",26517a8aed6a6928ff53e78df7e45c60,大运 何 茫茫 海桑 逝 不留 武夷 有 乔木 虬枝 尚相 樛 自 昔 擢 巍 科 为 今 阐 大猷 万里 惮 北上 三年 喜 南游 长身古 衣冠 庞眉 瞭 双眸 虽 与 今 人居 不 与 今人 俦 和 风 颜子 春 泰山 邹孟秋 一双 忧 世泪 溅入 银 河流 相期 入 圣域 舍子 谁 当 优 奈何 弃 我 去 荦 确 归途 修 我 欲 断 中流 去 棹 何 悠悠 我 欲息天风 别袂何 飕飕 明晨 君 已远 晚岁 吾 何求 恐无 后 会期 笑 作来 生谋
5ca9dac3-2d15-4ffb-8ea4-8a0567176e53,句  其一,尤冰寮,唐,诗,五言古体,累重无歌舞 官闲省簿书,"5,5",846c7e48616edb53c8fc1c20f70648c0,累重 无 歌舞 官 闲 省 簿 书
fefe23ba-cceb-430b-be4b-43fcf53c9897,句  其二,尤冰寮,唐,诗,七言古体,三条椽下归空榻 百尺楼中透远峰,"7,7",c50f3b874e0a5850893c5657eecb10bd,三条 椽 下 归 空 榻 百尺 楼中 透远 峰
ad9998c4-b466-473b-a121-4b5de5f0e517,句  其三,尤冰寮,唐,诗,五言古体,蚁返愁寻穴 鸦归喜见巢,"5,5",ead4b23d4e98fa30425e2a98b0105b19,蚁 返 愁寻穴 鸦归喜见巢
238eee8a-df9f-4def-a4b3-e01b50e45a55,凌源阁,戴应魁,唐,诗,七言律诗,天风吹铃语不烦 菩提树杪碧阑干 恒河月满三千界 大树云栖五百尊 辟支脑现赤蛇死 玉局手泽苍苔干 老僧出定蟠龙吼 唤醒诸寮佛子孙,"7,7,7,7,7,7,7,7",afc991a3da51d8434fffc29069db1f4d,天 风吹 铃语 不烦 菩提树 杪 碧 阑干 恒河 月 满 三千 界 大树 云栖 五百 尊 辟 支脑现 赤蛇死 玉局 手泽 苍苔 干 老僧 出定 蟠龙 吼 唤醒 诸 寮 佛 子孙
7e8f5f1a-ac8f-4d13-8747-201e5f5f157d,海月岩,戴应魁,唐,诗,七言律诗,谁把巉岩巧凿开 分明幻出小蓬莱 风迎蜃气楼台起 浪涌蟾光宫阙来 海阔鱼龙自吞吐 云深鸾鹤共徘徊 禅师九座经游处 一访遗踪为拂埃,"7,7,7,7,7,7,7,7",233253ff50ec81d0171971561aee4d30,谁 把 巉岩 巧 凿开 分明 幻出 小 蓬莱 风 迎 蜃气 楼台 起 浪涌 蟾光 宫阙 来 海阔 鱼龙 自 吞吐 云深鸾 鹤共 徘徊 禅师 九座 经游 处 一 访 遗踪 为 拂 埃
75f01b69-45de-4264-967f-fb7b146060e3,赠叠山先生,毛直方,唐,诗,七言律诗,一襟书传日星悬 湖海声名五十年 事不求知惟此理 文之未丧岂皆天 人方惊怪欧阳子 我独悲伤鲁仲连 看镜倚楼秋已暮 风巾霜屦重依然,"7,7,7,7,7,7,7,7",5910f2e29b8fb6d07d238d82e9b1b792,一 襟 书 传 日星 悬 湖海 声名 五十年 事不 求知 惟 此理 文之未 丧 岂皆天 人方 惊怪 欧阳 子 我 独 悲伤 鲁仲连 看 镜 倚 楼秋 已 暮 风巾 霜 屦 重 依然
a2280e8d-7a5e-4be4-986c-c5c70675a85b,拟古  其一,毛直方,唐,诗,五言古体,高堂列绮席 宾御何委蛇 粲粲金芙蓉 春葩照蛾眉 檀槽起清籁 铁拨弦鹍鸡 祇闻筵中曲 不闻曲中词 萧萧青冢魂 化作秋雁归 玉关去时泪 点点湿朱丝 岂知哀怨情 及此欢笑期 弹者锦缠头 听者金屈卮 但令今人乐 不惜古人悲,"5,5,5,5,5,5,5,5,5,5,5,5,5,5,5,5,5,5",8aa62a0778d6b428a99449e7ebdff005,高堂 列 绮席 宾御何 委蛇 粲粲 金 芙蓉 春葩 照 蛾眉 檀 槽 起 清籁 铁 拨弦 鹍 鸡 祇闻筵 中 曲 不 闻 曲 中 词 萧萧 青冢 魂 化作 秋雁归 玉 关去 时泪 点点 湿 朱丝 岂知 哀怨 情 及此 欢笑 期 弹者 锦缠头 听者 金屈卮 但令 今人 乐 不惜 古人 悲
b8111fe0-a375-4b2a-bae2-493686403fbf,拟古  其二,毛直方,唐,诗,五言古体,野色倏已暝 零落沾我裳 行役悲险艰 仰愧归鸟翔 羁愁浩难收 壮发日已苍 远林烟火微 投宿扣村庄 居人毕刈获 笑语井臼傍 问客来何疲 毋乃仕与商 所慎在出门 奚怨中路长,"5,5,5,5,5,5,5,5,5,5,5,5,5,5",d315233edda5993a2cefa995506f9e9b,野色 倏已 暝 零落 沾 我裳 行役 悲险 艰 仰愧 归 鸟 翔 羁愁 浩难 收 壮发 日 已 苍 远林 烟火 微 投宿 扣 村庄 居人 毕 刈 获 笑语 井臼 傍 问客 来 何 疲 毋乃仕 与 商 所慎 在 出门 奚 怨 中路 长
afccd4bd-a61c-4220-99c1-a0a8171fc150,杂怨  其一,毛直方,唐,诗,五言绝句,种莲恨不早 得藕常苦迟 谁知心中事 久已落怀思,"5,5,5,5",6f07b2e8cf83baad3eafee5080330a95,种莲 恨 不早 得 藕常苦迟 谁知 心中 事 久已 落怀 思
5554a140-45e4-46d4-b0ae-52207c3dd7f6,杂怨  其二,毛直方,唐,诗,五言绝句,花开能夜合 草发解宜男 对花今有恨 见草祇应惭,"5,5,5,5",56e6fcfa9bec7ee86831f0e51dfbc307,花 开能 夜合 草发 解宜 男 对 花今 有 恨 见 草 祇 应 惭
a598ef73-c044-4c18-9db3-53e22cb54fbe,江南曲  其一,毛直方,唐,诗,五言绝句,津头闻别语 三载以为期 安得中山酒 醒日是归时,"5,5,5,5",acdabe16f58b49cfe67e2a59247a3dd9,津头闻别语 三载 以 为期 安 得 中山 酒 醒 日 是 归 时
7e144685-25d9-4b34-a099-2a92a22c0cd3,江南曲  其二,毛直方,唐,诗,五言绝句,沽酒酹江神 发船相送饯 船去浪如席 船回风似箭,"5,5,5,5",58fde4e9b231fd9a6989c480a9f497ec,沽酒 酹 江 神 发船 相送 饯 船 去 浪如席 船 回 风 似 箭
5da0f113-f7fd-481b-9d7d-ad1b8b99d758,妾薄命,毛直方,唐,诗,杂言,妾肌如玉颜如花 长眉窈窈青山斜 深闺学成新妇礼 镜鸾不与留年华 昨朝东邻裁嫁衣 今朝西邻催结褵 自怜孤灯照春梦 年年风雨梨花时 不怨父母贫 不恨蹇修拙 妾生赋命自坎𡒄 底用闲情写红叶 千丝万丝霜练光 与谁织作云锦裳 千针万针两黼黻 与谁佩服朝明堂 吁嗟妾薄命 薄命可奈何 失时还自羞 失身羞更多 妾宁失时无失身 平生分定月下绳 但把贞心守贞色 肯信婵娟解误人,"7,7,7,7,7,7,7,7,5,5,7,7,7,7,7,7,5,5,5,5,7,7,7,7",6bf2873318b96ba1e9281ea378c64d52,妾 肌 如玉 颜如花 长眉窈窈 青山 斜 深闺 学成 新妇 礼 镜 鸾 不 与 留 年华 昨朝 东 邻裁 嫁衣 今朝 西邻 催结 褵 自怜 孤灯 照 春梦 年 年 风雨 梨花 时 不 怨 父母 贫 不 恨 蹇 修 拙 妾 生 赋命 自 坎 𡒄 底用 闲情 写 红叶 千丝 万丝 霜练光 与 谁 织作 云锦 裳 千针万针 两 黼 黻 与 谁 佩服 朝 明堂 吁 嗟妾 薄命 薄命 可 奈何 失 时 还 自羞 失身 羞 更 多 妾 宁失时无 失身 平生 分定 月 下绳 但 把 贞心 守贞 色 肯信 婵娟 解误 人
7e85652a-4806-43f4-b34e-055aab4ba619,独骏图,毛直方,唐,诗,七言古体,连天苜蓿青茫茫 盐车鼓车纷道傍 肉騣汗血不可常 权奇倜傥晦若藏 五之六之无留良 如此独步何堂堂 日三品豆慎所尝 天闲逸气谁能量 一尺之箠五尺缰 了与辔络俱相忘 大仆御直俨冠裳 庭前榻上婉清扬 有诏有诏且勿忙 一洗凡马銮锵锵 我观此图笔意长 欲言尚寄田子方,"7,7,7,7,7,7,7,7,7,7,7,7,7,7,7,7",4ee889fff15217edac9234b30362b489,连天 苜蓿 青 茫茫 盐车 鼓车 纷道 傍 肉 騣 汗血 不可 常 权奇 倜傥 晦若 藏 五之六之无留良 如此 独步 何 堂堂 日 三品 豆慎 所 尝 天 闲逸 气 谁 能量 一尺 之 箠 五尺 缰 了 与 辔络 俱 相忘 大 仆 御 直 俨冠 裳 庭前 榻 上 婉 清扬 有 诏 有 诏 且 勿 忙 一 洗 凡马銮 锵锵 我 观 此 图 笔意 长 欲 言 尚寄 田子方
5ad90f3c-8276-47a8-a2cc-4903f32a01df,赠督师曹将军,毛直方,唐,诗,七言古体,泰阶煌煌色已齐 祥飙为扫蚩尤旗 幅员浩荡春台熙 不遣桴鼓惊锄犂 羽林宿卫环三陲 居安却虑忘战危 整暇自许忘其机 司马八法律以规 搜苗猕狩凛弗违 碧油有幢俨军师 手持虎节谈鱼丽 闽关不以山与溪 歌舞七德宣皇威 有来视师省檄飞 将军名已草木知 干戈俎豆睢阳时 已分勾当江南归 流芳奕叶今孙枝 此行且赋从军诗 时清未用歌采薇 天子有道守四夷,"7,7,7,7,7,7,7,7,7,7,7,7,7,7,7,7,7,7,7,7,7",5a660619090ec5f3224cf5f9ca3fe382,泰阶 煌煌 色 已齐 祥 飙为 扫 蚩尤 旗 幅员 浩荡 春台熙 不 遣 桴 鼓 惊 锄 犂 羽林 宿卫 环三陲 居安 却虑 忘战 危 整暇 自许 忘 其 机 司马 八 法律 以 规 搜苗 猕狩 凛弗 违 碧油 有 幢 俨 军师 手持 虎节 谈 鱼丽 闽关 不 以 山 与 溪 歌舞 七德 宣皇威 有 来 视 师 省 檄飞 将军 名 已 草木 知 干戈 俎 豆 睢阳 时 已分 勾当 江南 归 流芳 奕 叶 今 孙 枝 此行 且 赋 从军 诗 时 清 未 用 歌 采 薇 天子 有 道 守 四夷
9824347a-8c21-48c6-a7ec-1c63f8188346,野宿,毛直方,唐,诗,五言律诗,归恨逐春深 迟休欲缩程 远山何处碧 落日故乡明 路改柴门僻 村空石硙鸣 乞蔬仍买米 一宿尚营营,"5,5,5,5,5,5,5,5",b3bca3a3e7d96a46640fc7cde1ed68be,归恨 逐 春 深 迟 休欲 缩程 远山 何处 碧 落日 故乡 明 路 改 柴门 僻 村空 石 硙 鸣 乞蔬 仍 买 米 一 宿尚 营营
d30e0c16-8725-4bd9-b805-1a3c2ea0f28c,秋感,毛直方,唐,诗,五言律诗,宇宙百年身 江湖万里心 世情高枕远 诗味闭门深 白发销穷达 青山傲古今 情知秋亦客 何事感秋吟,"5,5,5,5,5,5,5,5",ec71087992c38950b61b955e4f60e1e8,宇宙 百年 身 江湖 万里 心 世情 高枕 远 诗味 闭门 深 白发 销 穷达 青山 傲 古今 情知 秋亦客 何事 感秋 吟
2e295691-0cb3-4e44-b5d1-35189fd8dde6,渔父辞  其一,毛直方,唐,诗,七言绝句,万里清江两桨船 一竿一缕水云边 平生不识书与剑 也得醉饱供闲眠,"7,7,7,7",96711ba04a400a74e5a6416367da9a9b,万里 清江 两 桨 船 一竿 一缕 水云 边 平生 不识 书 与 剑 也 得 醉 饱供 闲眠
e78309ae-8e91-46c6-b8ac-dc50646574af,渔父辞  其二,毛直方,唐,诗,七言绝句,呼儿买米得新粳 渔村且喜见秋成 今朝尝新莫草草 好钓鲈鱼来煮羹,"7,7,7,7",f102150b649bcc299b83eff4f6fb6808,呼儿 买 米 得 新 粳 渔村 且 喜见 秋成 今朝 尝新 莫 草草 好 钓 鲈鱼 来 煮 羹
d6848d79-aedb-4e43-9869-e6de59a2d52d,渔父辞  其三,毛直方,唐,诗,七言绝句,得鱼穿柳持上溪 溪村杳杳屋稀稀 莫怪渔翁头易白 去年买鱼人又非,"7,7,7,7",2a53d773b0cfb5bd36c5413fb6db29ef,得 鱼 穿 柳 持 上溪 溪 村 杳 杳 屋 稀稀 莫怪 渔翁 头易 白 去年 买 鱼 人 又 非
