id,title,author,dynasty,genre,poem_type,sentences_simplified,meter_pattern,hash,words
87514ff705dc365a74f587e1d456fcca,沁园春,何梦桂,宋,词,词,光岳储精 宇宙呈祥 锺英俊材 想春秋夹谷 前生夫子 婆娑南赡 见在如来 龙角标辰 蟾胎煜丙 好是生朝华宴开 笙歌里 看儿童拜舞 春满行台 重重好事相催 便对把黄封酌寿罍 更愿公殿上 早纡衮绣 愿公堂下 长戏衣莱 昨夜瑶池 亲逢阿母 欲寄蟠桃桃始栽 三千岁 待开花结子 岁岁衔杯,"4,4,4,5,4,4,4,4,4,7,3,5,4,6,8,5,4,4,4,4,4,7,3,5,4",8179a8c7a01b4c9dfa309df00a10f8d9,光岳 储精 宇宙 呈祥 锺 英俊 材 想 春秋 夹谷 前生 夫子 婆娑 南 赡 见 在 如来 龙角 标辰 蟾胎 煜 丙 好 是 生 朝华 宴开 笙歌 里 看 儿童 拜舞 春 满 行台 重重 好事 相 催 便 对 把 黄封 酌 寿 罍 更 愿 公殿 上 早 纡 衮 绣 愿 公堂 下 长 戏衣 莱 昨夜 瑶池 亲逢 阿母 欲 寄 蟠桃 桃 始 栽 三千 岁 待 开花 结子 岁 岁 衔 杯
dc7e9f6507ec1fb8de62c3ef933fc539,满江红,何梦桂,宋,词,词,睡起纱窗 问春信 几番风候 待去做 踏青鞋履 懒拈纤手 尘满翠微低ぢ叶 离愁推去来还又 把菱花 独对泪阑干 羞蓬首 回鸾子 空怀袖 金缕曲 无心奏 记碧桃花下 夜参横斗 六幅罗裙香凝处 痕痕都是尊前酒 到如今 肠断怕回头 长门柳,"4,3,4,3,4,4,7,7,3,5,3,3,3,3,3,5,4,7,7,3,5,3",57b71e322a5203ee53fe64ed031eb9fa,睡 起 纱窗 问春 信 几番 风候 待 去 做 踏青 鞋 履 懒 拈 纤手 尘 满 翠微 低 ぢ 叶 离愁 推去 来 还 又 把 菱花 独对 泪 阑干 羞 蓬首 回 鸾 子 空怀 袖 金缕曲 无心 奏 记 碧 桃花 下 夜 参横 斗 六幅 罗裙香 凝处 痕痕 都 是 尊 前 酒 到 如今 肠断 怕 回头 长门 柳
0b368eca2c5cc456822e6d151377fa3c,沁园春,何梦桂,宋,词,词,衮衣绣裳 彤弓卢矢 山西将门 自雪岭蓬婆 夷成坦道 炎州蜓獠 刬去连营 吴越儿童 江淮草木 七见元戎识姓名 争知道 这一隅斗大 尚借麾旌 西风吹下天声 看万骑貔貅入井陉 彼山棚魍魉 雷霆震击 海濒赤子 天日开明 事业方来 乾坤无尽 千古英雄不偶生 从兹去 看云台翼轸 麟阁丹青,"4,4,4,5,4,4,4,4,4,7,3,5,4,6,8,5,4,4,4,4,4,7,3,5,4",4622169867b835fd0a5b5e8bc5189c5d,衮 衣 绣裳 彤弓 卢矢 山西 将门 自 雪岭 蓬婆 夷成 坦道 炎州蜓 獠 刬 去 连营 吴越 儿童 江淮 草木 七 见 元戎 识 姓名 争 知道 这 一隅 斗 大 尚 借 麾旌 西风 吹 下天 声 看 万 骑 貔貅 入 井陉 彼山 棚 魍魉 雷霆 震击 海濒 赤子 天日 开明 事业 方来 乾坤 无尽 千古 英雄 不偶 生 从兹 去 看 云台 翼 轸 麟 阁 丹青
429e74d897054f706dab4d0f493da512,水龙吟,何梦桂,宋,词,词,倚窗闲嗅梅花 霜风入袖寒初透 吾年如此 年年十月 见梅如旧 白发青衫 苍头玄鹤 花前尊酒 问梅花与我 是谁瘦绝 正风雨 年时候 不怕参横月落 怕人生 芳盟难又 高楼何处 寒英吹落 玉龙休奏 前日花魁 后来羹鼎 总归严岫 但逋仙流落 诗香留与 孤山同寿,"6,7,4,4,4,4,4,4,5,4,3,3,6,3,4,4,4,4,4,4,4,5,4,4",c23f1556c96a8f92677b96065d64f38c,倚 窗 闲 嗅 梅花 霜 风入 袖寒 初 透 吾 年 如此 年 年 十月 见 梅 如 旧 白发青衫 苍头 玄鹤 花前 尊酒 问 梅花 与 我 是 谁 瘦绝 正 风雨 年 时候 不怕 参横 月 落 怕 人生 芳盟 难 又 高楼 何处 寒英 吹落 玉龙 休奏 前日 花魁 后来 羹 鼎 总归 严岫 但 逋 仙 流落 诗香留 与 孤山 同 寿
7cb35050cf197bda524457a94d09eba4,酹江月・念奴娇,何梦桂,宋,词,词,三分春色 更消得风雨 几番零落 年少不来春老去 空负省薇阶药 燕子飞忙 杜鹃啼杀 总为谁悲乐 临春结绮 旧家何处楼阁 一任年去年来 怅歌阑舞断 尘生帘幕 千古雷塘浑一梦 人世到头俱错 百岁心期 一春光景 付与闲杯酌 青蛇犹在 莫教雷雨飞却,"4,5,4,7,6,4,4,5,4,6,6,5,4,7,6,4,4,5,4,6",f5625e64f05a500e6d0caaccbdde4bfb,三分 春色 更 消得 风雨 几番 零落 年少 不 来 春 老 去 空负 省薇 阶药 燕子 飞忙 杜鹃 啼杀 总为 谁 悲乐 临春 结 绮 旧 家 何处 楼阁 一任 年 去年 来 怅歌阑舞断 尘生 帘幕 千古 雷塘浑 一梦 人世 到头 俱 错 百岁 心期 一 春 光景 付与 闲杯 酌 青蛇 犹 在 莫教 雷雨 飞 却
553e089ad0ecf7557841073c4ec974c9,酹江月・念奴娇,何梦桂,宋,词,词,问春何去 乱随风飞坠 杨花篱落 罗袜香囊无觅处 谁有返魂灵药 细柳重门 碧桃深巷 回首曾行乐 玉龙吟断 夜深人在江阁 因念壁月琼枝 对玉人何处 绣帘珠幕 一半青铜尘满匣 空抚鸾刀金错 薇露烟销 莲膏花凝 不寐还孤酌 一春心事 总将愁里消却,"4,5,4,7,6,4,4,5,4,6,6,5,4,7,6,4,4,5,4,6",cf2b094fc2b89fc4783bed0899105537,问春何 去 乱 随风 飞坠 杨花 篱落 罗 袜 香囊 无觅处 谁 有 返 魂灵 药 细柳 重门 碧桃 深巷 回首 曾 行乐 玉 龙吟 断 夜深 人 在 江阁 因念壁 月 琼 枝 对 玉人 何处 绣帘 珠幕 一半 青铜 尘 满匣 空抚鸾 刀金 错 薇 露烟 销 莲膏 花凝 不寐 还 孤酌 一 春 心事 总 将 愁 里 消却
50f1a956accc4dfe2c19f54405d3e644,沁园春,何梦桂,宋,词,词,老去无心 看尽青山 山前暮云 问重来海燕 乌衣安在 乍归辽鹤 华表空存 世路悠悠 风尘渺渺 白发相催乌兔频 浮生事 算天涯海角 谁是闲人 几番甲子庚申 看青草年年秋又春 笑武陵源上 桃花未实 昆仑山下 瑶树长新 霓羽飘零 蛾眉萧飒 欲觅神仙隔两尘 草堂在 但休教山鬼 夜半移文,"4,4,4,5,4,4,4,4,4,7,3,5,4,6,8,5,4,4,4,4,4,7,3,5,4",9a3d87d28c7304945c133d3306cbb162,老 去 无心 看尽 青山 山前 暮云 问 重来 海燕 乌衣安 在 乍 归 辽 鹤 华表 空存 世路 悠悠 风尘 渺渺 白发 相 催 乌 兔 频 浮生 事 算 天涯海角 谁 是 闲人 几番 甲子 庚申 看 青草 年 年 秋 又 春 笑 武陵源 上 桃花 未实 昆仑山 下 瑶 树长 新 霓羽 飘零 蛾眉 萧飒 欲 觅 神仙 隔 两 尘 草堂 在 但 休教 山鬼 夜半 移文
968dd56b00e12d847f0a1ea44521a13f,摸鱼儿,何梦桂,宋,词,词,把心期 半生孤负 玉堂元在何处 朱弦弹绝无人听 空操离鸾烈女 遇不遇 休更问 悠悠世事都如许 人生草露 看百岁勋名 青铜鬓影 抚剑泪如雨 知谁语 落落江空岁暮 人间一梦今古 雷塘十里斜阳外 野草寒鸦无数 身世寓 聊尔耳 江山有恨谁堪付 冰心更苦 都说与梅花 参横月落 一醉且归去,"3,4,6,7,6,3,3,7,4,5,4,5,3,6,6,7,6,3,3,7,4,5,4,5",adc338b40774c1b67d47045e3a2c1fe4,把 心期 半生 孤负 玉堂 元在 何处 朱弦 弹 绝无 人 听 空操 离 鸾 烈女 遇不遇 休 更 问 悠悠 世事 都 如许 人生 草露 看 百岁 勋名 青铜 鬓影 抚剑 泪如雨 知 谁 语 落落 江空 岁暮 人间 一梦 今古 雷塘 十里 斜阳 外 野草 寒鸦 无数 身世 寓 聊尔耳 江山 有 恨 谁 堪付 冰心 更苦 都 说 与 梅花 参横 月 落 一 醉 且 归去
cfed2d4082d649e4194f06d4a8d76b5c,洞仙歌,何梦桂,宋,词,词,天涯何处 望苍江渺渺 纵算解飞人不到 笑双丸乌兔 两鬓霜蓬 聊尔耳 那是人间三岛 黄梁初梦觉 起看孤云 还自长歌自长啸 不记桃源何地 橘渚何年 生涯事 惟有炉烟茶灶 问先生谁友 有白石青松 共成三老,"4,5,7,5,4,3,6,5,4,7,6,4,3,6,5,5,4",5d549e2630c87920943262b267fc665b,天涯 何处 望苍江 渺渺 纵算 解 飞人 不到 笑 双丸 乌兔 两 鬓霜 蓬 聊尔耳 那 是 人间 三岛 黄梁初 梦 觉 起看 孤云 还 自 长歌 自 长啸 不记 桃源 何地 橘渚 何年 生涯 事 惟有 炉 烟 茶 灶 问 先生 谁 友 有 白石 青松 共成 三老
285d6cfe8c86ca1653bb8ba2a9959992,喜迁莺,何梦桂,宋,词,词,东君别后 见说道花枝 也成消瘦 夜雨帘栊 柳边庭院 烦恼有谁撋就 犹记旧看承处 梅子枝头如豆 最苦是 向重门人静 月明时候 知否 人不见 纵有音书 争似重携手 旧日沉腰 如今潘鬓 怎奈许多僝僽 极目万山深处 肠断不堪回首 情寸寸 到如今 只在长亭烟柳,"4,5,4,4,4,6,6,6,3,5,4,2,3,4,5,4,4,6,6,6,3,3,6",a12f190bb2404bfdb4ce2a204a98df36,东君 别 后 见 说道 花枝 也 成 消瘦 夜 雨帘 栊 柳边 庭院 烦恼 有谁 撋 就 犹记 旧 看 承处 梅子 枝头 如 豆 最苦 是 向 重 门人 静 月 明 时候 知否 人 不见 纵有 音书 争似 重 携手 旧日 沉腰 如今 潘鬓 怎奈 许多 僝 僽 极目 万山 深处 肠断 不堪回首 情寸 寸 到 如今 只 在 长亭 烟柳
de263cea7d04dcdb87043414ca9d09eb,沁园春,何梦桂,宋,词,词,尚书当年 蓬矢桑弧 初度佳期 是词林老虎 文场威凤 人中祥瑞 天下英奇 太守买臣 中书坡老 五十二年回首非 人间事 且开眉一笑 醉倒金卮 阿婆还忆年时 也曾趁鸿胪拜玉墀 念青衫荷叶 嫁衣尚在 青铜菱影 破镜犹遗 半席寒毡 一官俯首 造物还应戏小儿 问天道 看是他谁戏我 我戏他谁,"4,4,4,5,4,4,4,4,4,7,3,5,4,6,8,5,4,4,4,4,4,7,3,6,4",92d05598f77748bfeff610cb7dd88710,尚书 当年 蓬矢 桑 弧 初度 佳期 是 词林 老虎 文场 威凤 人 中 祥瑞 天下 英奇 太守 买臣 中书坡 老 五十二年 回首 非 人间 事 且开眉一笑 醉倒 金 卮 阿婆 还忆 年时 也 曾 趁 鸿 胪 拜 玉墀 念 青衫 荷叶 嫁衣 尚 在 青铜 菱影 破镜 犹遗 半席 寒 毡 一 官 俯首 造物 还 应 戏 小儿 问 天道 看 是 他 谁 戏 我 我 戏 他 谁
328d2fa030bfb65fdc960b7b3145902d,八声甘州,何梦桂,宋,词,词,倚阑干立尽 看东风 吹度柳绵飞 怕杜鹃啼杀 江南雁杳 游子何之 梦断扬州芍药 落尽簇红丝 歌吹今何在 一曲沾衣 往事不堪重省 记柳边深巷 花外幽墀 把菱花独照 脂粉总慵施 怅春归 留春未住 奈春归 不管玉颜衰 伤心事 都将分付 榆砌苔矶,"5,3,5,5,4,4,6,5,5,4,6,5,4,5,5,3,4,3,5,3,4,4",31c0bb05b7e9f2972659b35902c47d9f,倚 阑干 立尽 看 东风 吹度 柳绵飞 怕 杜鹃 啼杀 江南 雁杳 游子 何之 梦断 扬州 芍药 落尽簇 红丝 歌 吹 今何在 一曲 沾衣 往事 不堪 重省 记柳 边 深巷 花外幽墀 把 菱花 独照 脂粉 总 慵 施 怅春归 留 春 未 住 奈 春 归 不管 玉颜 衰 伤心事 都 将 分付 榆 砌 苔 矶
d00d247b41c04238bdf5002902b27d6c,八声甘州,何梦桂,宋,词,词,自辽东鹤去 算何人 插得翅能飞 笑平生错铸 儒冠误识 者也焉之 谩道寒蚕冰底 瓮茧解成丝 何许丝千丈 补得龙衣 镜里不堪勋业 纵梦中八翼 不到天墀 看墦间富贵 妻妾笑施施 对青山 千年不老 但梅花 头白伴人衰 严陵路 年年潮水 不上渔矶,"5,3,5,5,4,4,6,5,5,4,6,5,4,5,5,3,4,3,5,3,4,4",1379f70fae7598fbe0e61ab66c85991b,自 辽东 鹤 去 算 何人 插 得 翅 能 飞 笑 平生 错 铸 儒冠 误识 者 也 焉 之 谩道 寒蚕 冰底 瓮 茧 解成 丝 何许 丝 千丈 补得 龙衣 镜 里 不堪 勋业 纵梦中八翼 不到 天墀 看 墦 间 富贵 妻妾 笑 施施 对 青山 千年 不 老 但 梅花 头白伴 人 衰 严陵路 年 年 潮水 不 上 渔 矶
95469defea474870cb583fbb7e192fdb,贺新郎,何梦桂,宋,词,词,世事浑无定 问人间 翻来覆去 阿谁能忍 海怒惊涛山相拍 选甚鱼龙不任 看今古 英雄销尽 坐对青山闲白日 付长江 流送千年恨 天有意 唯何甚 待将洗耳泉边枕 正梅花 霜寒月白 斗回西柄 自寿一觞花前醉 醉亸彩幡金胜 笑儿辈 汾阳中令 倚遍层楼干阑曲 慨乾坤 渺渺青云影 无限事 尊前兴,"5,3,4,4,7,6,3,4,7,3,5,3,3,7,3,4,4,7,6,3,4,7,3,5,3,3",75a18f06ca02e5d4cba37af1e8c7a5ec,世事 浑 无定 问 人间 翻来覆去 阿 谁 能 忍 海怒 惊涛 山相 拍 选 甚 鱼龙 不任 看 今古 英雄 销尽 坐 对 青山 闲 白日 付 长江 流送 千年 恨 天 有意 唯何甚 待 将 洗耳 泉边 枕 正 梅花 霜寒 月白 斗回 西柄 自寿 一 觞 花前醉 醉 亸 彩 幡 金 胜 笑 儿 辈 汾阳 中令 倚 遍 层楼 干 阑 曲 慨 乾坤 渺渺 青云 影 无限 事 尊 前 兴
000f775f05d3445979c39950da1666de,贺新郎,何梦桂,宋,词,词,花落风初定 倚危阑 衷情欲诉 踌躇不忍 把酒问春春无语 吹落游尘怎任 待泪雨 红妆蔫尽 不道燕衔春将去 误啼鹃 唤起年年恨 芳草路 人愁甚 浮生一梦黄梁枕 且不妨 狂歌醉舞 麈谈挥柄 金谷平泉俱尘土 谁是当年豪胜 但五柳 依然陶令 千古兴亡东流水 望孤鸿 没处残阳影 无限意 伤春兴,"5,3,4,4,7,6,3,4,7,3,5,3,3,7,3,4,4,7,6,3,4,7,3,5,3,3",574152f825dc4741a29a151761b9b63a,花落 风 初定 倚危阑 衷 情欲 诉 踌躇 不忍 把酒 问 春春无语 吹落 游尘 怎 任 待 泪雨 红妆 蔫尽 不道 燕衔春 将 去 误 啼 鹃 唤起 年 年 恨 芳草 路 人 愁 甚 浮生 一梦 黄梁枕 且 不妨 狂歌醉舞 麈 谈挥 柄 金谷 平泉 俱 尘土 谁 是 当年 豪胜 但 五 柳 依然 陶令 千古兴亡 东 流水 望孤鸿 没处 残阳 影 无限 意 伤 春 兴
98937a8ca1e04bd5197c777cd13fc0bb,贺新郎,何梦桂,宋,词,词,更静钟初定 卷珠帘 人人独立 怨怀难忍 欲拨金猊添沉水 病力厌厌不任 任蝶粉 蜂黄消尽 亭北海棠还开否 纵金钗 犹在成长恨 花似我 瘦应甚 凄凉无寐闲衾枕 看夜深 紫垣华盖 低摇杠柄 重拂罗裳蹙金线 尘满双鸳花胜 孤负我 花期春令 不怕镜中羞华发 怕镜中 舞断孤鸾影 天尽处 悠悠兴,"5,3,4,4,7,6,3,4,7,3,5,3,3,7,3,4,4,7,6,3,4,7,3,5,3,3",27517b779ac811ee28f112347a41e1fb,更 静 钟 初定 卷 珠帘 人人 独立 怨 怀 难忍 欲 拨 金猊 添 沉水 病力 厌厌 不任 任 蝶粉 蜂黄 消尽 亭 北 海棠 还 开否 纵 金钗 犹 在 成长 恨 花似 我 瘦 应 甚 凄凉 无寐闲 衾 枕 看 夜深 紫垣 华盖 低 摇 杠柄 重 拂 罗裳 蹙 金线 尘满双鸳花胜 孤负 我 花期 春令 不怕 镜 中 羞 华发 怕 镜 中 舞断 孤鸾影 天 尽处 悠悠 兴
383eaceb63a926b885541a22765d60f8,八声甘州,何梦桂,宋,词,词,叹人生聊尔 便晨风 翼倦也回飞 况自骑款段 欲追骐骥 千里安之 种得玄芝瑶草 不染满头丝 一醉梅花下 笑舞青衣 说甚封侯万里 待朱门画战 大第崇墀 人世何时□足 造物任隆施 怪周公 如今不梦 意周公 政自怪吾衰 归来去 夕阳牛陇 夜月鸥矶,"5,3,5,5,4,4,6,5,5,4,6,5,4,6,5,3,4,3,5,3,4,4",32057e32976f7d2f0ab9f923e9f6bb6a,叹 人生 聊尔 便 晨风 翼 倦 也 回飞 况 自 骑款段 欲 追 骐骥 千里 安之 种得玄 芝 瑶草 不染 满头 丝 一 醉 梅花 下 笑 舞 青衣 说 甚 封侯 万里 待 朱门 画战 大 第崇墀 人世 何时 □ 足 造物 任隆施 怪 周 公 如今 不梦 意周公 政 自怪 吾 衰 归来 去 夕阳 牛陇 夜月 鸥 矶
c40f5e803697ca038532f5e58afec4b8,洞仙歌,何梦桂,宋,词,词,青衫白发 独倚江楼小 待欲题诗压崔颢 慨凤台今在否 白鹭沙洲 芳草外 剩得闲身江表 醉来疑梦里 梦入梅花 歌彻青衣听清窈 起着飞鸿没尽 白鸟玄驹 谁能数 曹瞒袁绍 待明年 七十问何如 笑只是今朝 浣花堂老,"4,5,7,6,4,3,6,5,4,7,6,4,3,4,3,5,5,4",1c5977365ef80cbe288208351e4be06c,青衫 白发 独倚 江楼 小 待 欲 题诗 压 崔颢 慨 凤台 今在 否 白鹭 沙洲 芳草 外 剩 得闲 身江 表 醉 来 疑 梦 里 梦入 梅花 歌彻 青衣 听清 窈 起 着 飞鸿 没尽 白鸟 玄驹 谁 能数 曹 瞒 袁绍 待 明年 七十 问 何如 笑 只是 今朝 浣 花堂 老
fdade5deaf1a0e78d04fb2e285b2127e,玉漏迟,何梦桂,宋,词,词,问春先开未 江南野水 得春初小 独殿群芳 却道花前开早 长苦冰霜压尽 更说甚 风标清窈 些子好 孤香冷艳 有谁知道 年年吹落还开 听画角楼头 送他昏晓 何处玉堂 满地苍苔不扫 谁是肝肠铁石 与共说 岁寒怀抱 花未老 无奈酒阑情好,"5,4,4,4,6,6,3,4,3,4,4,6,5,4,4,6,6,3,4,3,6",b342d807eb39edd0a45bf55f98d8562a,问春 先 开 未 江南 野水 得 春初 小 独殿 群芳 却道 花 前 开 早 长 苦 冰霜 压尽 更 说 甚 风标 清窈 些 子 好 孤香 冷艳 有 谁 知道 年 年 吹落 还 开 听 画角 楼头 送 他 昏晓 何处 玉堂 满地 苍苔 不 扫 谁 是 肝肠 铁石 与 共 说 岁寒 怀抱 花 未 老 无奈 酒 阑 情 好
cc84c8c4e5ff23dcc52346bc24780dff,蓦山溪,何梦桂,宋,词,词,飞仙欲下 水殿严妆早 娇湿怕春知 跨白虬 天门未晓 霓裳零乱 肌骨自清妍 梅檐月 柳桥风 世上红尘杳 重门深闭 忘却山阴道 呼酒嚼琼花 任醉来 玉山倾倒 无言相对 这岁暮心期 茅舍外 玉堂前 处处风流好,"4,5,5,3,4,4,5,3,3,5,4,5,5,3,4,4,5,3,3,5",5cb189ec6f05309ed6e1bd0854be89a5,飞仙 欲 下 水殿 严妆 早 娇湿 怕 春知 跨白 虬 天门 未晓 霓裳 零乱 肌骨 自 清妍 梅檐 月 柳桥 风 世上 红尘 杳 重门 深闭 忘却 山 阴道 呼酒 嚼 琼花 任醉 来 玉山 倾倒 无言 相对 这 岁暮 心期 茅舍 外 玉堂 前 处处 风流 好
882a4c31f20fdaa79841fcc6a4fd4478,蓦山溪,何梦桂,宋,词,词,春工未觉 何处琼英早 夜半翦银河 到人间 楼台初晓 霏霏脉脉 不是不多情 金帐暖 玉堂深 却怪音尘杳 天公谪下 暂落红尘道 颜色自还怜 怕轻狂 随风颠倒 冰心谁诉 但吹入梅花 明月地 白云阶 相照天寒好,"4,5,5,3,4,4,5,3,3,5,4,5,5,3,4,4,5,3,3,5",4f58ba601d79ffacf2b94fcd62a7a568,春工 未觉 何处 琼英 早 夜半 翦 银河 到 人间 楼台 初晓 霏霏 脉脉 不是 不 多情 金帐 暖 玉堂 深 却 怪 音尘 杳 天公 谪下 暂落 红尘 道 颜色 自 还怜 怕 轻狂 随风 颠倒 冰心 谁诉 但 吹入 梅花 明月 地 白云 阶 相照 天寒 好
8065c99f7eb43cf271a74d5ea6389916,蓦山溪,何梦桂,宋,词,词,蓬蓬窣窣 睡梦惊回早 谁为散天花 遍人间 夜深分晓 虚空幻出 富贵照乾坤 琼万顷 玉千株 莫道壶天杳 平明三尺 不拣江南道 只怕不坚牢 被天工 小儿翻倒 凝冰泮水 世态总无凭 明日事 昨朝人 谁丑还谁好,"4,5,5,3,4,4,5,3,3,5,4,5,5,3,4,4,5,3,3,5",1f7a9b0066d193925fb6d36a0c9e5859,蓬蓬 窣窣 睡梦 惊回 早 谁 为 散 天花 遍 人间 夜深 分晓 虚空 幻出 富贵 照 乾坤 琼 万顷 玉 千株 莫道 壶 天 杳 平明 三尺 不 拣 江南 道 只怕 不 坚牢 被 天工 小儿 翻倒 凝冰 泮水 世态 总 无 凭 明日 事 昨朝 人 谁 丑 还 谁 好
667c9f1e83ec7b15c6cc61c7622048f4,沁园春,何梦桂,宋,词,词,孔盖霓旌 月佩云裳 人间女仙 问韶光九十 何如今待 明朝最处 好是明年 戏舞称觞 一堂家庆 眼见儿孙曾又玄 奇绝处 看菱花白发 不改朱颜 当年 手种红莲 笑几度桑田沧海干 想蟾胎炼就 紫皇灵药 龙髯飞坠 玉女云𫐌 青鸟重来 红霞俨在 一曲云和犹未闲 羞尘世 把蛾眉蝉鬓 空为谁妍,"4,4,4,5,4,4,4,4,4,7,3,5,4,2,4,8,5,4,4,4,4,4,7,3,5,4",e030acdfc5d34fc30e64c5ef811b4e1b,孔盖 霓旌 月 佩云裳 人间 女仙 问 韶光 九十 何 如今 待 明朝 最处 好 是 明年 戏舞 称觞 一堂 家庆 眼见 儿孙 曾 又 玄 奇绝 处 看 菱花 白发 不 改 朱颜 当年 手种 红莲 笑 几度 桑田沧海 干 想 蟾胎 炼就 紫皇 灵药 龙髯飞 坠 玉女 云 𫐌 青鸟 重 来 红霞 俨在 一曲 云 和 犹未闲 羞 尘世 把 蛾眉 蝉 鬓 空 为 谁 妍
ab09e36da27bbb0c42ae4f0fe5630a09,浣溪沙,何梦桂,宋,词,词,细柳连营绿荫重 暖风旗影扬蛇龙 昼闲吟思入千峰 紫绶金牌人绿发 绣鞯丝辔马青骢 会将三箭取侯封,"7,7,7,7,7,7",a1f3fd97e366a3ffbfcdb3ef32a8ff70,细柳 连营 绿荫 重 暖风 旗影扬蛇龙 昼 闲吟 思入 千峰 紫绶 金牌 人 绿 发 绣 鞯 丝 辔马 青骢 会 将 三 箭 取 侯封
6de9a97733c21ae96c9d8a6753612086,浣溪沙,何梦桂,宋,词,词,金紫山前山万重 山高云密下苍龙 春来好雨遍三峰 芳草郊原眠茧犊 垂杨营垒系花骢 趣归行有紫泥封,"7,7,7,7,7,7",58981ef3d9b48ce11acf0e01ab178019,金紫 山前 山 万重 山 高云 密下 苍龙 春来 好 雨 遍 三峰 芳草 郊原 眠 茧 犊 垂杨 营垒 系花 骢 趣 归行 有 紫 泥封
87c92a0aaa766ce5a3f7be677047c6f7,蝶恋花,何梦桂,宋,词,词,风信花残吹柳絮 柳外池塘 乳燕时飞度 漠漠轻云山约住 半村烟树鸠呼雨 竹院深深深几许 深处人闲 谁识闲中趣 弹彻瑶琴移玉柱 苍苔满地花阴午,"7,4,5,7,7,7,4,5,7,7",9f843a8c9a3caa9a1795809369ee78bd,风信花 残 吹 柳絮 柳 外 池塘 乳燕 时 飞度 漠漠 轻 云山 约 住 半 村 烟树 鸠呼雨 竹院 深深 深 几许 深处 人 闲 谁 识 闲 中趣 弹彻 瑶 琴 移 玉柱 苍苔 满地 花阴午
6c4170179fbb5874b4c1f53ec5d263f6,大江东去・念奴娇,何梦桂,宋,词,词,半生习气 被风霜 销尽头颅如许 七十年来都铸错 回首邯郸何处 杜曲桑麻 柴桑松菊 归计成迟暮 一樽自寿 不妨沉醉狂舞 休问沧海桑田 看朱颜白发 转次全故 乌兔相催天也老 千古英雄坏土 汾水悲歌 雍江苦调 堕泪真儿女 兴亡一梦 大江依旧东注,"4,3,6,7,6,4,4,5,4,6,6,5,4,7,6,4,4,5,4,6",c69ef9e71523cb8ecd334557cb009567,半生 习气 被 风霜 销尽 头颅 如许 七十年 来 都 铸错 回首 邯郸 何处 杜曲 桑麻 柴桑松 菊 归 计成 迟暮 一 樽 自 寿 不妨 沉醉 狂舞 休问 沧海桑田 看 朱颜 白发 转次 全故 乌兔 相 催 天 也 老 千古 英雄 坏 土 汾水 悲歌 雍江 苦调 堕泪 真 儿女 兴亡 一梦 大江 依旧 东注
a7b2187c57e3803cb080b67f48605d3b,玉漏迟,何梦桂,宋,词,词,青衫华发 对风霜 倚遍危楼孤啸 恶浪平波 看尽世间多少 忘却金闺故步 都付与 野花啼鸟 祗自笑 悠悠心事 无人知道 扰扰世路红尘 看销尽英雄 青山亦老 宇宙无穷 事业到头谁了 高楼一声画角 把千古 梦中吹觉 天欲晓 起看蕊梅春小,"4,3,6,4,6,6,3,4,3,4,4,6,5,4,4,6,6,3,4,3,6",081326a836f64cd14d48f13e5ea479bb,青衫 华发 对 风霜 倚 遍 危楼 孤啸 恶浪 平波 看尽 世间 多少 忘却 金闺 故步 都 付与 野花 啼 鸟 祗 自笑 悠悠 心事 无人 知道 扰扰 世路 红尘 看销 尽 英雄 青山 亦 老 宇宙 无穷 事业 到头 谁 了 高楼 一声 画角 把 千古 梦 中 吹 觉 天 欲晓 起看 蕊 梅春 小
87a8757405f783ca8e543d9b0e7d5514,玉漏迟,何梦桂,宋,词,词,自怜翠袖 向天寒 独倚孤篁吟啸 半世虚名 孤负白云多少 欲问梅翁旧约 怕误我 沙头鸥鸟 时一笑 行行且止 人间蜀道 休怪岁月无情 叹尘世浮生 闲忙闲老 待趁黑头 万里封侯都了 今古勋名一梦 听未彻 钧天还觉 羌管晓 楼角曙星稀小,"4,3,6,4,6,6,3,4,3,4,4,6,5,4,4,6,6,3,4,3,6",105eb6c6f68c4cc3e62028f29efef56b,自怜 翠袖 向 天寒 独倚 孤篁 吟啸 半世 虚名 孤负 白云 多少 欲 问 梅翁 旧约 怕 误 我 沙头 鸥鸟 时 一 笑 行行 且 止 人间 蜀道 休怪 岁月 无情 叹 尘世 浮生 闲 忙 闲 老 待 趁 黑头 万里 封侯 都 了 今古 勋名 一梦 听 未 彻 钧 天 还 觉 羌 管晓 楼角 曙星 稀小
e91fbc0e4e07f1041b490b596c5ba511,水龙吟,何梦桂,宋,词,词,分知白首天寒 千林摇落寻真隐 天工付与 冰肌雪骨 暗香寒凝 自许负心 肯教色界 软红尘近 怅绿衣舞断 参横梦觉 依稀旧家犹认 不为角声落 向花前 为伊悲恨 玉堂茅舍 风流随处 年年孤另 不是人间 肝肠铁石 相逢休问 算知心 只许东风 漏泄一分春信,"6,7,4,4,4,4,4,4,5,4,6,5,3,4,4,4,4,4,4,4,3,4,6",986dc9b9547247af69a316725aa6dcbc,分知 白首 天寒 千林 摇落 寻真隐 天工 付与 冰肌 雪骨 暗香 寒凝 自许 负心 肯教 色界 软 红尘 近 怅 绿衣 舞断 参横 梦觉 依稀 旧家 犹 认 不为 角声 落 向 花前 为 伊 悲恨 玉堂 茅舍 风流 随处 年 年 孤 另 不是 人间 肝肠 铁石 相逢 休问 算 知心 只许 东风 漏泄 一分 春信
e164ecb88f8add1e62cd3ab6c063fb0a,八声甘州,何梦桂,宋,词,词,恨公来较晚 早归朝 骢马去难留 是朱轮华毂 联珪叠组 家世公侯 今在玉堂深处 借重护偏州 好把青毡拂 奕世勋猷 明日东津归路 正梅花霜暧 春上枝头 看连旗列鼓 送客下江楼 对云山 千年不老 向楼前 阅尽几行舟 留名在 严陵滩下 日夜东流,"5,3,5,5,4,4,6,5,5,4,6,5,4,5,5,3,4,3,5,3,4,4",4bb12415376f67a60c0a3e3c116b2422,恨 公来 较晚 早 归 朝 骢 马 去 难留 是 朱轮华毂 联 珪 叠 组 家世 公侯 今在 玉堂 深处 借重 护 偏 州 好 把 青 毡 拂 奕 世 勋 猷 明日 东津 归路 正 梅花 霜 暧 春 上 枝头 看连 旗列 鼓 送客 下 江楼 对 云山 千年 不 老 向 楼前 阅尽 几行 舟 留名 在 严陵滩 下 日夜 东流
659fe3d319c8e8cee9118cf68c61df56,传言玉女,何梦桂,宋,词,词,阿母今朝 飞下琼楼金阙 先教玉女 为传言细说 蟠桃手种 尚记此春时节 三千春后 开花初结 宴罢瑶池 洗娥眉 已半雪 九旬偷度 笑韶光一映 仙翁日月 算与人间全别 从今一岁 年年三月,"4,6,4,5,4,6,4,4,4,3,3,4,5,4,6,4,4",3972212f41a09ab9a95c423864cfbfec,阿母 今朝 飞 下 琼楼金阙 先教 玉女 为 传言 细说 蟠桃 手种 尚记 此春 时节 三千 春后 开花 初 结 宴 罢 瑶池 洗 娥眉 已 半 雪 九旬 偷度 笑 韶光 一 映 仙翁 日月 算 与 人间 全别 从今 一岁 年 年 三月
