id,title,author,dynasty,genre,poem_type,sentences_simplified,meter_pattern,hash,words
3632bde9-ba48-4fa7-ade8-40ac53d9364b,桃川山中用陳蘇舊韻示周遊,趙蕃,唐,诗,五言古体,仙人之为仙 终古莫尽世 颇笑区中人 沄沄逐川逝 念将与之游 端恐吾道废 如为千里行 数步辄一憩 不如返吾乡 耕凿仍树艺 及私具伏腊 输王应租税 人惟颜徒睎 学匪桀犬吠 桃源定何许 说自渊明制 今日复何日 身乃中山诣 嗟哉彼嬴秦 其虐甚幽厉 不知丧无日 万欲从始岁 商山被褐者 疢疾由德慧 徐福尚海山 此地只楚界 胡为略不闻 政坐耳目蔽 神仙非吾学 可以置度外 山高水深深 好事幽寻契,"5,5,5,5,5,5,5,5,5,5,5,5,5,5,5,5,5,5,5,5,5,5,5,5,5,5,5,5,5,5,5,5",6c3359fa09ff5b02474e4ab1922d3d3c,仙人 之为 仙 终古 莫尽世 颇 笑 区 中 人 沄 沄 逐 川 逝 念 将 与 之游 端恐 吾 道 废 如为 千里 行 数步 辄 一 憩 不如 返 吾 乡 耕凿 仍 树 艺 及 私具 伏腊 输王 应 租税 人 惟 颜徒 睎 学匪 桀 犬吠 桃源 定 何许 说 自 渊明 制 今日 复 何日 身 乃 中山 诣 嗟哉彼 嬴 秦 其 虐 甚 幽厉 不知 丧无日 万 欲 从始 岁 商山 被 褐者 疢 疾 由 德 慧 徐福 尚 海山 此地 只 楚界 胡为略 不 闻 政坐 耳目 蔽 神仙 非吾学 可以 置 度外 山高水 深深 好事 幽 寻契
efe64e9c-1369-4d6c-bca2-26e63129682e,與成父弟自嚴礲同入城晚宿黄巖,趙蕃,唐,诗,五言古体,昔人重离合 感慨思功名 我今迫贫贱 乃作分袂惊 徘徊未能别 崎岖复同行 扪萝到黄岩 倚杖日已倾 摩挲磴道古 开拓窗户明 道人惯看客 拨火治短檠 村醪偶提携 霜柑亦包并 病来不喜饮 一再泻浊清 道涂今日劳 林壑他年盟 苏州对床卧 不下五言城 自经长少公 增重手足情 细听松竹响 疑是风雨鸣 披衣更起坐 月出山四更,"5,5,5,5,5,5,5,5,5,5,5,5,5,5,5,5,5,5,5,5,5,5,5,5,5,5",55c034a17ee70d3b05686ba5eb80c472,昔人 重 离合 感慨 思 功名 我 今 迫 贫贱 乃作 分袂 惊 徘徊 未能 别 崎岖 复 同行 扪萝 到 黄岩 倚 杖 日 已 倾 摩挲 磴道 古 开拓 窗户 明 道人 惯 看客 拨 火治 短 檠 村 醪偶 提携 霜 柑 亦 包并 病来 不喜 饮 一再 泻 浊 清 道 涂 今日 劳 林壑 他 年 盟 苏州 对 床 卧 不下 五言 城 自经 长少 公 增重 手足 情 细 听 松 竹响 疑 是 风雨 鸣 披衣 更 起 坐 月 出山 四 更
b33b6e40-985f-4c42-a703-e244ebf6af1c,過愛直驛次張安國韻,趙蕃,唐,诗,五言古体,亭然一何奇 枯者亦靡侧 虽经岁祀多 未觉霜霰迫 余行再此驿 尔故无变色 慨念题诗人 深为九泉客 泥深兀羸马 苔老迷旧刻 爱尔故苍苍 余今变为白,"5,5,5,5,5,5,5,5,5,5,5,5",6be1b281a76b38c016fd0dd2c9e73d42,亭然一何奇 枯者 亦 靡 侧 虽 经岁 祀 多 未觉 霜 霰迫 余行 再此 驿 尔 故 无 变色 慨念 题诗 人 深 为 九泉 客 泥 深 兀 羸马 苔 老迷旧 刻 爱尔 故 苍苍 余 今 变为 白
5e33b012-6a48-4f74-8ede-d217d4688c05,承契兄昨過我於永豐山間今又相遇於鄱陽以暇日同遊薦福寺會軒蓋鼎來避之天慶觀作詩一首,趙蕃,唐,诗,五言古体,君为日边行 过我迂道里 我有江上役 值君亦行李 谁云动参商 邂逅乃如此 似非人力为 定是天所使 古云昔道场 门枕东湖水 相从及休日 趋去不停轨 参禅固未暇 作诗实先议 要问戴叔伦 当年卜居意,"5,5,5,5,5,5,5,5,5,5,5,5,5,5,5,5",fce63af3e94044c77310f1220aaf3ce1,君 为 日 边行 过 我 迂道 里 我 有 江上 役 值 君 亦 行李 谁 云动 参商 邂逅 乃 如此 似非 人力 为 定 是 天 所使 古云昔 道场 门枕 东湖 水 相从 及 休 日 趋去 不停 轨 参禅 固未暇 作诗 实先 议 要 问 戴叔伦 当年 卜居 意
9edfa1d5-505d-49a2-a3c8-68034b7504d4,發衡州後懷使君劉先生,趙蕃,唐,诗,五言律诗,四年别师门 十日留函丈 所问与所知 安得回赐放 孰为驱之去 兹行定焉往 倦马苦陂陀 白鸥思渺莽,"5,5,5,5,5,5,5,5",e2d59b5de07b2dd93fe00505770886c5,四年 别 师门 十日 留函 丈 所 问 与 所知 安得 回赐 放 孰 为 驱 之 去 兹 行定 焉 往 倦 马 苦 陂陀 白鸥思 渺莽
9ada071b-bf80-4566-a49a-8e69b3d77a29,閏七月二十日侍知府寺簿先生爲石鼓山向園之遊,趙蕃,唐,诗,五言古体,晦翁守南康 政成有余暇 驾言山之中 于日非聊假 紫霄作重阳 白鹿见图画 闻之几向风 恨不款段跨 今年五溪归 迩日三湘役 先生喜其至 舍以江亭阔 频能枉高轩 人骇非重客 那知先生意 于此自为德 兹日复何日 休沐著甲令 先生重过之 俱款石皷胜 西溪命题字 东岩俾开径 既除古莓苔 又索贤名姓 已焉兴未休 棹舟放中流 西风未却暑 一雨方回秋 僧坊远莫至 隠墅近得留 宁同岘山辈 不异舞雩游,"5,5,5,5,5,5,5,5,5,5,5,5,5,5,5,5,5,5,5,5,5,5,5,5,5,5,5,5,5,5,5,5",1310ae783caaaeaeaae36290bbcaa015,晦翁 守 南康 政成 有 余暇 驾言 山 之中 于 日非 聊假 紫霄 作 重阳 白鹿见 图画 闻之几 向 风 恨 不款 段 跨 今年 五溪 归 迩 日 三湘 役 先生 喜 其 至 舍以 江亭阔 频能 枉 高轩 人 骇非重客 那 知 先生 意 于此 自为 德 兹日 复 何日 休 沐著 甲令 先生 重过 之 俱款 石 皷 胜 西溪 命题 字 东岩 俾 开径 既 除 古莓苔 又 索贤 名姓 已 焉 兴未休 棹 舟 放 中流 西风 未 却暑 一 雨方 回秋 僧坊 远莫 至 隠 墅 近 得 留 宁同岘 山辈 不异 舞雩 游
a255ced3-c264-41cb-9b5e-cd951f9f29e4,蕃方爲紀遊之詩未就知府寺簿先生寵示佳句敢輒次韻,趙蕃,唐,诗,五言古体,兹因谋道来 不为看山新 看山虽云新 图画犹昔人 虚亭十日留 欲出凡几巡 隔江树差差 俯槛波粼粼 终藉席间语 乃涤胸中尘 况兹篮舆行 攀崖陟嶙峋 是知竹使符 不异邱壑身 世人何不察 百伪嫌一真 而我孤拙者 崎岖聿其轃 话言听矻矻 书札胜频频 先生今徐州 愚非欧阳陈 庶因唱酬诗 牵联诏无泯,"5,5,5,5,5,5,5,5,5,5,5,5,5,5,5,5,5,5,5,5,5,5,5,5",54109c4671a5f109af7ebe81f7b4aa15,兹因 谋道 来 不为 看 山 新 看 山 虽 云新 图画 犹 昔人 虚亭 十日 留 欲 出 凡 几 巡 隔 江树 差差 俯槛 波 粼粼 终藉 席间 语 乃涤 胸中 尘 况兹篮 舆行 攀 崖 陟 嶙峋 是 知 竹 使 符 不 异 邱 壑 身 世人 何不 察 百 伪嫌 一真 而 我 孤拙 者 崎岖 聿其 轃 话 言 听 矻 矻 书札 胜 频频 先生 今 徐州 愚 非 欧阳 陈 庶因 唱酬 诗 牵联 诏 无 泯
8d42d683-d555-4e0f-9188-17a0c5a786a9,仙巖道間,趙蕃,唐,诗,五言古体,兹岩如许深 中乃一物无 非仙莫能幻 故即岩之呼 何代有禅衲 孑焉寄褐蒲 名字不可考 种松今欲枯 我来值雪后 阴崖尽成晡 茶罢摄衣起 巾车问前途 前冈云气敷 后岭两脚暗 宵安礼贤枕 蚤赴天心饭 奔驰亦云极 憇息宁恤𫏐 自犹厌登车 况乃躬负担 行年甫三十 道里遍千万 怀哉坐一饥 使我历诸患 长卿病故多 次山仕真漫 盍整旧诗书 归欤老山涧,"5,5,5,5,5,5,5,5,5,5,5,5,5,5,5,5,5,5,5,5,5,5,5,5,5,5,5,5",4da847f248e2d0cb4796e70c4c6a9d04,兹 岩 如许 深 中 乃 一物 无 非 仙 莫 能 幻 故 即 岩 之 呼 何代 有 禅 衲 孑焉 寄 褐 蒲 名字 不可考 种松 今 欲 枯 我 来 值 雪 后 阴崖 尽 成 晡 茶 罢 摄 衣 起 巾 车 问 前途 前冈 云气 敷 后岭 两 脚 暗 宵 安礼贤 枕 蚤 赴 天心 饭 奔驰 亦云 极 憇息宁恤 𫏐 自犹厌 登车 况乃躬 负担 行年 甫 三十 道 里 遍 千万 怀哉 坐 一 饥 使 我 历 诸 患 长 卿 病故 多 次 山仕 真漫 盍 整旧 诗书 归 欤 老 山涧
b54b77f8-3d9e-40a9-b04f-ab21ec6c3863,題新樂鋪鋪在灘頭,趙蕃,唐,诗,五言律诗,朝烟山蒙蒙 暮霭山羃羃 穷日作山行 而不见山色 投昏宿此舍 乞晓动前辙 归梦遶家山 滩头有轻檝,"5,5,5,5,5,5,5,5",de49dbf944b6feb8a96041486be9cbc4,朝 烟山 蒙蒙 暮霭 山 羃 羃 穷 日 作山 行 而 不见 山色 投昏宿此舍 乞晓 动前辙 归 梦 遶 家 山 滩头 有 轻 檝
fb043773-ab2f-4111-a4c3-d9eb7685f3fc,夜泊劉口雨連明有懷成父,趙蕃,唐,诗,五言律诗,山中风雨夕 招要对床期 今夕风亦雨 牢落孤舟维 蓬窗与竹窗 萧瑟雨在兹 不寐欲至曙 何繇梦见之,"5,5,5,5,5,5,5,5",441586172a10ba2ef1656ca03b75f065,山中 风雨 夕 招要 对 床期 今夕 风亦雨 牢落孤舟 维 蓬窗 与 竹窗 萧瑟 雨在兹 不寐 欲 至 曙 何繇 梦见 之
17445c4a-2bd5-4bac-8931-97f7c11ec4b4,重九前一日東流道中,趙蕃,唐,诗,五言律诗,明日乃重九 今晨更天涯 马嘶原上草 菊放崖边花 吾家白云合 归路青嶂赊 去去无复道 行行空自嗟,"5,5,5,5,5,5,5,5",310bfe3f74e580a5a96d7fac97f2f7a5,明日 乃 重九 今晨 更 天涯 马嘶 原上 草 菊放崖 边 花 吾 家 白云 合 归路 青 嶂 赊 去去 无 复道 行 行空 自 嗟
27316403-5db2-40dc-b59d-6b73639e6465,意釣,趙蕃,唐,诗,五言古体,仲舒区中贤 谈治苦吃吃 但知羡川鱼 不虑网罟密 仁哉东坡公 游戏亦此术 究其广大心 意钓真玩物 我欲窃其语 作庐以自逸 东西南北人 有志特未必 相会有溪竹 竹下亭可立 亭成乞以名 四海一明月,"5,5,5,5,5,5,5,5,5,5,5,5,5,5,5,5",4e6e95022925b3ae3905e89ddd50758b,仲舒 区 中 贤 谈治 苦 吃 吃 但 知羡 川 鱼 不虑 网罟 密 仁哉 东坡 公 游戏 亦 此 术 究其 广大 心 意钓真 玩物 我 欲 窃其语 作庐 以 自逸 东西南北 人 有志 特 未必 相会 有 溪 竹 竹下 亭 可立 亭 成 乞以 名 四海 一 明月
acd625db-c76c-4810-adf0-c1a60a822a6f,半江遇風濤其勢危甚晚示同舟,趙蕃,唐,诗,五言古体,言归固多欣 值险辄大怖 方趋顺风捷 忽与犇涛遇 得非蛟龙争 无乃雷霆怒 我舟仅如掌 我命且如缕 何止失人色 殆欲成狼顾 神明力扶持 生死费调护 平生素多艰 安坐乃其处 便哦归来辞 勿草远游赋 同行信同忧 相唁劳相谕 急反浪头魂 还寻酒中趣,"5,5,5,5,5,5,5,5,5,5,5,5,5,5,5,5,5,5,5,5",065252b04491bf1135bef37a272d8153,言 归固 多 欣 值 险辄 大怖 方 趋 顺风 捷 忽 与 犇 涛 遇 得 非 蛟龙 争 无 乃 雷霆 怒 我 舟 仅 如 掌 我 命 且 如缕 何止 失 人色 殆欲 成狼顾 神明 力 扶持 生死 费 调护 平生 素多 艰 安坐 乃其 处 便 哦 归来 辞 勿草 远游 赋 同行 信同 忧 相唁 劳相谕 急 反 浪头 魂 还 寻酒 中趣
a1bfcc35-2c15-47be-ad80-82fa0601be24,十二月一日使風,趙蕃,唐,诗,五言古体,中宵不得休 常州已鸡鸣 欲知五更寒 扫霜四闻声 出门风暴起 挂席遂前征 官河沟渎耳 汹汹若未平 想见太湖中 白浪山岳倾 纡直虽有殊 高枕幸不惊 舟师尚若悔 吾身未宜轻 既无性命忧 从使嫌怨并,"5,5,5,5,5,5,5,5,5,5,5,5,5,5,5,5",986fae9672f9aec60c82a591f523defd,中宵 不得 休 常州 已 鸡鸣 欲 知 五更 寒 扫 霜 四 闻声 出门 风暴 起 挂席 遂 前征 官 河沟 渎耳 汹汹 若 未 平 想见 太湖 中 白浪 山岳 倾 纡 直 虽 有殊 高枕 幸不惊 舟 师尚若 悔 吾 身未宜 轻 既 无 性命 忧 从使 嫌怨 并
d6f8c864-ffdd-41f1-ab8e-57b330424dd6,嚴州道間得順風俗云七里瀧篙師云風便纔七里無風乃七十里爾,趙蕃,唐,诗,五言古体,桐江多犇湍 牵挽厌劳止 旧云七里泷 实乃七十里 篙师为予言 风便辄易尔 回思前日惊 留滞固可喜 溪神果何心 怜我倦行李 有风西南来 不徐亦不驶 布帆保无恙 为赐何其侈 眼中峰峦过 天外鸥鸟起 画图欠传貌 诗语费驱使 生平登临心 于此得自已 勿叹囊橐空 收将遗妻子,"5,5,5,5,5,5,5,5,5,5,5,5,5,5,5,5,5,5,5,5,5,5",4a1eb9501a2384afa1f26a06b32262d9,桐江多 犇 湍 牵挽厌劳止 旧 云 七里 泷 实乃 七十里 篙 师 为 予言 风 便 辄 易尔 回思 前日 惊 留滞 固 可喜 溪 神果 何心 怜 我 倦 行李 有 风 西南 来 不徐 亦 不驶 布帆 保 无恙 为 赐 何其 侈 眼中 峰峦 过 天外 鸥鸟 起 画图 欠 传貌 诗语 费 驱使 生平 登临 心 于此 得 自已 勿 叹 囊 橐 空 收将 遗 妻子
77eff7ad-ad7b-4253-898e-5cd4a7a5170b,永豐令括蒼章君尉上蔡謝君以淳熙改元二月晦日勸農於負郭祖印院事已率蕃爲汎舟之役,趙蕃,唐,诗,七言古体,前村后村桃李空 牡丹酴醿当春风 令君无暇问许事 亲率僚吏行劭农 清晨小队东郊出 宿雨初开泥尚湿 白头扶杖稚子旁 不待符移自相集 令君盛服临致言 国因肆赦新改元 雍熙淳化太宗年 治道度越唐汉前 尔曹何幸生此世 身不知兵无横税 去秋小歉未足云 诏书屡下忧勤意 吏令奉行敢不躬 尔无自惰愆尔功 吾言谆谆尔其听 酒肉更戴君恩丰 我时伫立观盛举 径欲佣田买牛具 不然枵腹亦以宽 年登贱籴夫何虑 少焉有白官盍休 携我山阴上小舟 谓我聊此半日留 与民同乐非宴游,"7,7,7,7,7,7,7,7,7,7,7,7,7,7,7,7,7,7,7,7,7,7,7,7,7,7,7,7",b94871b62b1aa6e6d4a344c402173236,前村 后 村 桃李 空 牡丹 酴 醿 当 春风 令君 无暇 问许 事 亲率 僚吏 行 劭 农 清晨 小队 东郊 出 宿雨初 开 泥 尚 湿 白头 扶杖 稚子 旁 不待 符移 自相 集 令君 盛服 临致 言 国因 肆赦新 改元 雍熙 淳化 太宗 年 治 道 度越 唐汉 前 尔曹 何幸生 此世 身 不知 兵无横税 去秋 小 歉 未 足 云 诏书 屡下 忧勤 意 吏令 奉行 敢不躬 尔 无 自 惰 愆 尔 功 吾 言 谆谆 尔 其 听 酒肉 更 戴君恩 丰 我时 伫立 观 盛举 径欲 佣田 买 牛 具 不然 枵 腹 亦 以 宽 年 登 贱 籴 夫 何虑 少 焉 有 白 官 盍 休 携 我 山阴 上 小舟 谓 我 聊 此 半日 留 与民同乐 非 宴游
602cfd7d-13c1-4fc7-b2cb-980402918cb7,四月十二日以夏潦暴甚艤舟辰之鐵槍崖下偶得浮木於水中宛然如山因其形似名曰卧嶺立峰喜而賦詩當寄交友之能詩者求著語焉,趙蕃,唐,诗,七言古体,昔读梅苏木山诗 未信人间有此奇 虽云尤物不必有 时一玩之何病为 吾行东南千万里 仙游不已遂臻此 奇奇怪怪日在眼 浩浩汤汤夜盈耳 旧评峡江似严陵 此行佳处亦可朋 又闻八桂好山水 亦应与此相云仍 画师好手不可遇 诗中有画无其具 江神好事不我尤 乞与一山酬愿素 不知何年遭仆落 浪激波冲几飘泊 岸高壁立自崭岩 泓浅坳深非斧凿 老夫得之喜莫极 欲加名字相刻画 卧之成岭立成峰 天成故尔非人力 多言𫍢𫍢欲何如 要觅新诗为写摹 余名敢与昔人并 用寄我友梅苏徒,"7,7,7,7,7,7,7,7,7,7,7,7,7,7,7,7,7,7,7,7,7,7,7,7,7,7,7,7",772a1493b64a5024b4412e8da9054d94,昔 读 梅 苏木 山诗 未信 人间 有此 奇 虽 云 尤物 不必 有 时 一 玩 之何 病 为 吾 行 东南 千万里 仙游 不已 遂 臻 此 奇奇怪怪 日 在 眼 浩浩汤汤 夜盈耳 旧 评 峡江 似 严陵 此行 佳 处 亦可 朋 又 闻 八桂 好 山水 亦 应 与 此 相 云 仍 画师 好手 不可 遇 诗中有画 无其 具 江神 好事 不 我 尤 乞与 一 山酬 愿素 不知 何年 遭仆 落 浪 激波 冲 几 飘泊 岸 高 壁立 自 崭 岩 泓 浅 坳 深 非 斧凿 老夫 得之喜莫极 欲 加 名字 相 刻画 卧之成岭 立成峰 天成 故尔非 人力 多 言 𫍢 𫍢 欲 何如 要觅 新诗 为 写 摹 余名 敢 与 昔人 并 用 寄 我友 梅苏 徒
27038e0a-8d5b-4f7c-920d-8b7f7fc430fc,八月二十四日同審知登塔山用審知前載九日留題之韻作二首時彥博歸及常山  其一,趙蕃,唐,诗,七言古体,郊原莽莽吹黄埃 余暑已去若复来 昨宵一雨为苏洗 晓兴坐觉飞崔嵬 平生诗盟有徐孺 笔力可挽狂澜回 要明两眼费双脚 作计似我何疏哉 兹游只欠王子在 见说归书一纸开 追随正复听君乐 流浪如我空增哀 吾邦此山颇高绝 泛菊况堪临季月 要当相与一杯酒 只恐因之又成别,"7,7,7,7,7,7,7,7,7,7,7,7,7,7,7,7",a7645a59d0aa3a3049d3ac904081873d,郊原 莽莽 吹 黄埃 余暑 已 去 若 复来 昨宵 一 雨 为苏 洗 晓兴 坐觉 飞 崔嵬 平生 诗盟 有 徐孺 笔力 可 挽 狂澜 回 要明 两眼 费 双脚 作 计似 我何 疏哉 兹 游 只 欠 王子 在 见 说 归 书 一纸 开 追随 正复 听 君乐 流浪 如 我 空增 哀 吾 邦 此 山 颇 高 绝 泛 菊况 堪临 季月 要 当 相与 一 杯酒 只恐 因之 又 成别
e2eea2f8-ac2c-47cc-87c1-006f33e7374e,八月二十四日同審知登塔山用審知前載九日留題之韻作二首時彥博歸及常山  其二,趙蕃,唐,诗,七言古体,出门生憎触风埃 故邀幽人山中来 小休危亭带曲折 未尽高塔当崔嵬 目营所到岂有极 脚力尚壮不拟回 旧游久阔空信耳 高处一上何佳哉 是山百年定谁主 一丘新壤手所开 渊明自祭岂非达 杜牧作志夫何哀 如君风流固旷绝 与我论交忘岁月 异时访我入此山 扣牛共唱生生别,"7,7,7,7,7,7,7,7,7,7,7,7,7,7,7,7",b35e1ac5af55a2487ffd60dd3bbdfcf2,出门 生憎触风埃 故 邀 幽人 山中 来 小休 危亭 带 曲折 未尽 高塔 当 崔嵬 目营 所 到 岂 有 极 脚力 尚壮 不 拟 回 旧游 久 阔 空信 耳 高处 一上 何佳哉 是 山 百年 定 谁 主 一 丘新壤 手所 开 渊明 自 祭 岂非 达 杜牧 作志 夫何 哀 如 君 风流 固旷 绝 与 我 论交 忘 岁月 异时 访 我 入 此 山 扣 牛 共唱 生生 别
6c820585-68ba-46ea-a2ef-75eeb45b8b15,明日同數公復登山忽聞履聲乃審知也携和詩三篇來復用韻作一首,趙蕃,唐,诗,七言古体,松间谡谡冲浮埃 跫然谁能为余来 凭高所历故已下 得君更觉争崔嵬 兹山不到近十载 频日能来已再回 人生万事每如此 而欲取必真愚哉 袖衔文书辱持似 快读不待纸尾开 金声讵须掷地出 隠隠自杂山风哀 吾曹用意果痴绝 非尔何以娱岁月 明当举似子王子 不但慰归仍赋别,"7,7,7,7,7,7,7,7,7,7,7,7,7,7,7,7",07e39d9d943eac4bb3f6a012e275d40d,松间 谡 谡 冲 浮 埃 跫 然 谁 能 为 余 来 凭 高所 历故 已下 得 君 更觉 争 崔嵬 兹山 不到 近 十载 频日 能来 已再 回 人生 万事 每 如此 而 欲 取 必真 愚哉 袖衔 文书 辱持 似 快 读 不待 纸尾 开 金声 讵 须 掷 地 出 隠 隠 自 杂 山风 哀 吾 曹 用意 果痴绝 非尔 何以 娱 岁月 明当 举似 子 王子 不但 慰归 仍 赋 别
56c3cbbd-c841-4a8d-9490-4ab341e5736c,貴溪隔岸有二巖僕舊遊也聞子暢受秋租於彼以詩寄之,趙蕃,唐,诗,七言古体,黄岩崭绝人人居 徐岩蟠鬰处士庐 扁舟半载泊南岸 折梅看雪频携壶 黄岩夹道松百株 风来迎送齐笙竽 坛崩殿古黄冠癯 悬岩石刻墨可模 徐岩触目多荒芜 啼啸往往纷鼪鼯 废基断砌或有无 名字不复知谁渠 闻君奉檄方受租 播糠瞇目莫与娱 作诗为君道何如 寻幽速遣从骑驱 赋成孰寄当念吾 不用寒温枉素书,"7,7,7,7,7,7,7,7,7,7,7,7,7,7,7,7,7,7",7163ea492a0a1a075953c9a61f4d911c,黄岩 崭绝 人人 居 徐岩 蟠 鬰 处士 庐 扁舟 半载 泊 南岸 折梅 看 雪 频 携 壶 黄岩 夹道 松 百株 风 来 迎送 齐笙 竽 坛 崩 殿 古 黄冠 癯 悬岩 石刻 墨可模 徐岩 触目 多 荒芜 啼啸 往往 纷 鼪 鼯 废 基断 砌 或 有无 名字 不 复知 谁 渠 闻君奉 檄方 受租 播糠 瞇 目 莫 与 娱 作诗 为 君道 何如 寻幽速 遣 从 骑驱 赋成 孰 寄当念 吾 不用 寒温 枉 素 书
e8d23f1d-680b-4a22-913f-389b3e1aff83,次韻斯遠同宿歲寒西軒六韻,趙蕃,唐,诗,七言古体,思君无计忧能舒 见君还愧腹每虚 知君于此未见止 而我但觉有不如 他人招呼厌来集 为我淹留成屡屈 岂惟高义笃交情 政頼微言起衰疾 南山三刹此最高 平生几许乎逍遥 异时我去君独遨 期当寄我山中谣,"7,7,7,7,7,7,7,7,7,7,7,7",7fcbaed3338119f9ab90c637db69248c,思君 无计 忧能 舒 见 君 还 愧 腹 每 虚 知君 于此 未 见止 而 我 但 觉有 不如 他人 招呼 厌来 集 为 我 淹留 成 屡屈 岂 惟 高 义 笃 交情 政 頼 微言 起衰 疾 南山 三 刹 此 最高 平生 几许 乎 逍遥 异 时 我 去 君 独 遨 期当 寄 我 山中 谣
0eec34ae-e7e4-4c1c-9dfa-e9e9df791784,謁孺子祠後由南昌還艤舟之地,趙蕃,唐,诗,七言律诗,南昌假传欲上书 孺子乃复辞聘车 东都已颠不可救 莽篡未露犹枝梧 福为市卒终潜吴 穉乃悬榻太守居 吁哉迹异心不殊 出处语默如是夫,"7,7,7,7,7,7,7,7",ce2bbd828e05dfb04a1bc8ae0ae39cae,南昌 假传 欲 上书 孺子 乃复 辞聘 车 东都 已 颠 不可 救 莽 篡未 露 犹 枝梧 福为 市卒 终潜 吴 穉 乃 悬 榻 太守 居 吁 哉 迹 异心 不殊 出处语默 如是 夫
bbf73c56-56d1-4467-9208-98320f30d60f,呈齊之二首  其一,趙蕃,唐,诗,杂言,舍舟步到南山寺 恍然忽记当年事 李侯见我颜色温 席间款语真有味 翰林风月久芜没 莫叹青衫百僚底 君不见少陵一生穷到死 亦有诗能驱疟鬼,"7,7,7,7,7,7,10,7",4f788653245ce5d9838710e14fe40ac5,舍舟 步到 南山寺 恍然 忽 记 当年 事 李侯 见 我 颜色 温 席间 款语 真 有 味 翰林 风月 久芜 没 莫叹 青衫 百僚 底 君不见 少陵 一生 穷 到 死 亦 有 诗 能 驱 疟鬼
6fe379e4-d6a9-4be1-a216-73944cf40229,呈齊之二首  其二,趙蕃,唐,诗,七言律诗,夜闻袁宏诵诗声 空山寂寞鱼龙惊 丈夫有才不贫贱 倦游何乃困长卿 平生读书得力处 公卿褐夫安重轻 鸿鹄一飞定千里 俯首莫与燕雀争,"7,7,7,7,7,7,7,7",1ce34e71cddc485af26553491b70c23f,夜闻 袁宏 诵诗 声 空山 寂寞 鱼龙 惊 丈夫 有 才 不 贫贱 倦游 何乃 困长 卿 平生 读书 得力 处 公卿 褐夫 安 重轻 鸿鹄 一 飞定 千里 俯首 莫 与 燕雀 争
df6dd16e-6ce2-4beb-abd5-3ce74246eabf,主山湖圍二渡,趙蕃,唐,诗,七言律诗,主山渡头成久立 长年傲客呼从疾 撑舟来前仅如掌 溯波却下几百尺 湖围桥坏新有船 众壑犇流会一川 嗟我胡为数此险 争似饭余牛背眠,"7,7,7,7,7,7,7,7",9b5d466bfd36f3a3edc80700625bc1cc,主山 渡头 成久立 长年 傲客 呼 从 疾 撑 舟 来 前 仅 如 掌 溯 波 却 下 几百 尺 湖围 桥 坏 新 有 船 众 壑 犇 流 会 一川 嗟我 胡 为数 此 险 争似 饭 余 牛 背眠
c015557c-8936-4653-a8f7-57412992334f,約明叔過買江天閣,趙蕃,唐,诗,七言古体,前年为君记江阁 醉里狂言不知怍 岂惟大负退之慙 要似扬雄真悔作 君家此阁端何然 万里长江咫尺山 江流湛湛山平远 合付画手非诗传 画工纵得空诸境 阁中之人妙难领 世人纷纷夔蚿蛇 是公了了形神影,"7,7,7,7,7,7,7,7,7,7,7,7",127a03b0fe9a428a9e906a88242c9635,前年 为 君记江阁 醉里 狂言 不知 怍 岂 惟 大 负退 之 慙 要似 扬雄 真 悔作 君家 此 阁端 何然 万里 长江 咫尺 山 江流 湛 湛山 平远 合付 画手 非 诗传 画工 纵 得空 诸 境 阁 中 之人 妙难 领 世人 纷纷 夔 蚿 蛇 是 公了 了 形神 影
054e6f09-e045-4cb9-a628-7424d72e3dcb,白鷺洲詞寄曾裘甫,趙蕃,唐,诗,七言律诗,白鹭洲前烟草微 黄鹤楼外烟云飞 缥缥黄鹤政高举 漾漾白鹭孤无依 鹤举直上登寥廓 鹭立汀洲方俯啄 卒然惊堕野人罝 岂不欲飞遭急缚,"7,7,7,7,7,7,7,7",5e026bb784012c8af3b38c4ec7cd8864,白鹭洲 前 烟草 微 黄鹤楼 外 烟云 飞 缥缥 黄鹤 政 高举 漾 漾 白鹭 孤无依 鹤 举直 上 登 寥廓 鹭 立 汀洲 方 俯 啄 卒 然 惊 堕 野人 罝 岂不欲飞 遭 急 缚
11047970-7c1c-4b05-b685-0efc22904554,示兒,趙蕃,唐,诗,七言律诗,我昔读书夜达晨 膏烛且尽继以薪 年来渐知得力处 箪瓢陋巷忘其贫 尔曹有身须自立 幸逃薪水供朝夕 不于文学自勤苦 长大始悔终何益,"7,7,7,7,7,7,7,7",b76b460191209243f1b30fce2db144f5,我 昔 读书 夜达晨 膏烛 且 尽继 以 薪 年来 渐 知 得力 处 箪瓢 陋巷 忘 其 贫 尔曹 有身 须 自立 幸逃 薪水 供 朝夕 不于 文学 自 勤苦 长大 始悔终 何益
dcd795f0-28c2-4f52-a431-f1938ed7bb5b,十八日記夢,趙蕃,唐,诗,杂言,冥冥落月子规哭 幽人梦成续复续 茅簷坏砌到何许 酴醿架倒留紫竹 紫竹新抽雨又滋 泪粉娟娟凝翠玉 梦中自省非宿游 又意簷村旧林谷 阿连对床呼得醒 亦说梦作看花行 看花梦向江南去 江石荦确屐有声 行逢古屋鬰峥嵘 仙家释氏俱莫名 看花非扬亦非洛 但见满眼灼灼朝霞明 梦中又意东庄路 普圆寺下芙蓉树 主人亦道旧相识 乃复不逢户外屦 嗟我与君无自疑 夜之所梦昼所为 扁舟若具可径归 知长不必询筮龟,"7,7,7,7,7,7,7,7,7,7,7,7,7,7,7,9,7,7,7,7,7,7,7,7",5612a9a3d8f41b71be212d3360c92e61,冥冥 落 月 子规 哭 幽人 梦 成续 复续 茅簷 坏 砌 到 何许 酴 醿 架 倒 留 紫竹 紫竹 新 抽 雨 又 滋 泪粉娟 娟凝 翠玉 梦 中 自省 非 宿游 又 意 簷 村 旧 林谷 阿连 对床 呼得 醒 亦 说 梦 作看 花行 看 花 梦 向 江南 去 江石荦 确屐 有声 行逢 古屋 鬰 峥嵘 仙家 释氏 俱 莫名 看 花非扬 亦非 洛 但 见 满眼 灼灼 朝霞 明 梦 中 又 意 东庄 路 普圆寺 下 芙蓉 树 主人 亦 道 旧 相识 乃复 不逢 户外 屦 嗟我与君无自疑 夜 之 所 梦 昼 所为 扁舟 若具可径归 知长 不必 询 筮 龟
