id,title,author,dynasty,genre,poem_type,sentences_simplified,meter_pattern,hash,words
a3b24220-c45d-42da-8aef-610749848acd,賦向宣卿有裕堂堂在伊山桓伊舊隠也,胡寅,唐,诗,五言古体,仕进行所志 退居适吾情 本无颠瞑患 那有得失惊 想彼贪者狼 跋疐不少宁 又哀触藩羝 两角挂紫荆 君子但居易 肯与世辙争 彼以戚戚终 我以坦坦生 斯堂谁所筑 向公勇且英 百炼见刚质 千寻抵孤清 艺兰畹畹滋 栽竹个个成 无复笛三弄 只闻弦诵声 客来引壶觞 客去山峥嵘 咄哉狙诈儿 夸眩机巧呈 揶揄复揶揄 镜空难遁形 天命有通塞 况公负时名 唐济嗣先业 选抡待扬庭 一朝看游刃 光芒发新硎 十步即千里 紫气无留行 青蝇失榛棘 周道如砥平,"5,5,5,5,5,5,5,5,5,5,5,5,5,5,5,5,5,5,5,5,5,5,5,5,5,5,5,5,5,5,5,5,5,5,5,5",2195e65388a18fa399d5de24b44ae75b,仕 进行 所志 退居 适吾 情 本 无颠瞑患 那 有 得 失惊 想 彼 贪者狼 跋 疐 不少 宁 又 哀触 藩 羝 两角 挂 紫荆 君子 但 居易 肯与世辙争 彼 以 戚戚 终 我 以 坦坦 生 斯堂 谁 所筑 向公勇 且 英 百 炼见 刚质 千 寻抵 孤清 艺兰 畹畹 滋 栽 竹 个个 成 无复 笛 三弄 只 闻 弦 诵 声 客 来 引 壶 觞 客 去 山 峥嵘 咄哉 狙诈 儿 夸眩 机巧 呈 揶揄 复 揶揄 镜 空难 遁形 天命 有 通塞 况 公负 时名 唐济嗣 先业 选 抡 待 扬庭 一朝 看 游刃 光芒 发新 硎 十步 即 千里 紫气 无 留行 青蝇 失 榛棘 周 道 如砥平
d1a8915c-3958-4ad2-9182-197c34aec621,以墨一品餉叔夏,胡寅,唐,诗,五言古体,人墨两相磨 此语昔贤叹 平生几两屐 何用积不散 未忘文字耳 四宝且同案 陶泓有润泽 毛颖称词翰 论交楮先生 相厚不相贯 直须造玄默 乃可发三粲 南山太古松 盈壑凌霄汉 煤珠贵轻远 胶结要坚捍 修圭及圆餠 脱手千金焕 寄君亦何意 往作文房伴 君子万卷读 胸次春冰泮 翻水即千篇 烨若云锦烂 猎华将食实 以道自澡盥 当年伏蒲疏 慨欲排世难 民瘼今益深 山谷宁可玩 请君携此宝 慎勿比医炭 恭惟上隆宽 缮写臣谨按 当从黝然处 凛有光芒观 继君诸皇祖 勋德侑清祼,"5,5,5,5,5,5,5,5,5,5,5,5,5,5,5,5,5,5,5,5,5,5,5,5,5,5,5,5,5,5,5,5,5,5,5,5,5,5",4a3605d17b3eb16d9561f0b5370848e1,人墨 两 相磨 此 语昔贤叹 平生 几两 屐 何用 积不散 未 忘 文字 耳 四宝 且 同案 陶泓 有 润泽 毛颖 称 词 翰 论交 楮 先生 相厚 不 相贯 直须 造 玄默 乃 可发 三 粲 南山 太 古松 盈壑 凌 霄汉 煤珠 贵 轻远 胶结 要 坚 捍 修圭 及 圆 餠 脱手 千金 焕 寄君亦 何意 往 作文 房伴 君子 万卷 读 胸次 春冰泮 翻水 即 千篇 烨 若 云锦 烂 猎华 将 食 实 以 道 自澡 盥 当年 伏蒲疏 慨欲排世难 民 瘼 今 益 深 山谷 宁可 玩 请 君 携 此 宝 慎勿 比 医炭 恭 惟 上隆 宽 缮写 臣 谨 按 当从 黝然 处 凛有 光芒 观 继 君 诸皇祖 勋 德 侑 清 祼
f0c4db05-fff7-4e7a-9cf8-4a5701ae57dc,和諸友春雪,胡寅,唐,诗,七言古体,蛰虫恰好雷声发 更听阳春歌白雪 仙葩乱坠絮缤纷 奇韵相高山崄绝 笔尖不为风力退 酒面肯作冰澌冽 千林万木绚华滋 玉李银桃几时结 不将瑶草充大药 独爱浮筠凛高节 天公悯世缁尘土 故使万秽蒙一洁 涵濡之力启丰登 后稷资为天下烈 手寒固已懒抟玩 齿病那敢夸嚼啮 清欢怅然怀旧赏 白战漫尔踵前哲 却欣淑气扫余寒 杲日当天不劳揭,"7,7,7,7,7,7,7,7,7,7,7,7,7,7,7,7,7,7,7,7",fc55e32e18f690f28262c4d2b82954c6,蛰虫 恰好 雷声 发 更 听 阳春 歌 白雪 仙葩 乱 坠 絮 缤纷 奇韵 相 高山 崄 绝 笔尖 不 为 风力 退 酒面 肯作 冰澌冽 千林万木 绚 华滋 玉李 银桃 几时 结 不 将 瑶草 充大 药 独爱 浮筠 凛高 节 天公 悯 世 缁 尘土 故使 万秽 蒙一洁 涵濡 之 力 启 丰登 后稷 资为 天下 烈 手 寒固 已 懒 抟 玩 齿病 那 敢 夸嚼 啮 清欢 怅然 怀旧 赏 白战漫尔 踵 前 哲 却 欣淑气扫余寒 杲 日 当天 不劳 揭
d427d1b1-0d65-4b83-9dce-70af0b7d8a3f,上元寄向令豐之,胡寅,唐,诗,七言律诗,雪罢梅残烟柳浮 上元灯火春风柔 红莲万枝开岳县 比似河阳花定羞 官松有明不敢斫 乌桕作烛供清愁 君能分光到蜗舍 为遣华星三百毬,"7,7,7,7,7,7,7,7",68ffd4c01619fb0a0ce658eb745b8229,雪罢梅 残 烟柳 浮 上 元 灯火 春风 柔 红莲 万枝 开 岳县 比似 河阳 花定羞 官松 有明 不敢 斫 乌桕 作烛 供 清愁 君能 分光 到 蜗舍 为 遣 华星 三百 毬
fb98b0e0-4d67-48d1-beb9-7baff6dbe8f0,贈邢子友,胡寅,唐,诗,五言古体,忆昔筮仕初 典教洛学省 故家多遗俗 往叩冠屡整 得交邢公子 伯仲皆豪颖 湖园万竿竹 伊水注深静 藤林与花岛 转步即殊景 梅台更称奇 云玉粲寒耿 官闲日从君 何宴不酩酊 每闻魁伟论 虽醉洒然醒 寻幽访古径 并辔缓无骋 向来春风鬓 忽忽雪飘颈 三川在何处 会合乃潭永 久要见襟抱 意态谢炎冷 顾予衰懦质 酬答忘形影 泛舟三百里 念我特相省 酒酣摅剧论 壮气尚雄猛 乐将高歌发 忠以微语警 岂无一可恨 不肯破空境 石坛夜焚香 岩寺朝供茗 相逢多讥评 墨守卒未领 湘流平似席 告别理归艇 愿言频惠音 庶以代咳謦 它年当扣门 此话欲重请,"5,5,5,5,5,5,5,5,5,5,5,5,5,5,5,5,5,5,5,5,5,5,5,5,5,5,5,5,5,5,5,5,5,5,5,5,5,5,5,5,5,5,5,5",26f441d70d654e7c158c3941cd3d703a,忆昔 筮 仕 初 典教 洛学 省 故家 多 遗俗 往 叩 冠 屡整 得交 邢 公子 伯仲 皆 豪颖 湖园 万竿竹 伊 水注 深静 藤林 与 花岛 转步 即 殊景 梅台 更 称奇 云玉 粲寒 耿 官 闲日 从 君 何宴 不 酩酊 每 闻 魁伟 论 虽 醉洒然醒 寻幽 访古 径 并辔 缓无骋 向来 春风 鬓 忽忽 雪飘 颈 三川 在 何处 会合 乃潭 永 久 要 见 襟抱 意态 谢炎冷 顾予 衰 懦 质 酬答 忘 形影 泛舟 三百里 念 我 特相 省 酒 酣 摅 剧论 壮气 尚 雄猛 乐 将 高歌 发 忠 以 微语 警 岂 无 一 可恨 不肯 破空 境 石坛 夜 焚香 岩寺 朝 供 茗 相逢 多 讥评 墨守 卒 未领 湘流 平似 席 告别 理归艇 愿言 频惠 音 庶以 代 咳 謦 它 年 当 扣门 此话 欲 重请
c6a6d5c0-d97c-4202-b3a9-419d0625d903,示法輪宗覺,胡寅,唐,诗,七言古体,身如槁木藏春色 眼似澄江映秋碧 洞庭湖上月同圆 石廪峰前人不识 从来说法閙云林 直措人心定难得 岂关佛运有穷通 自是担肩无膂力 看君古井直浪尽 阅世空花等尘寂 虽然独饭一盂香 争似分甘千百亿,"7,7,7,7,7,7,7,7,7,7,7,7",33d48aee5a04011761f7003b8bef2aac,身 如 槁木 藏 春色 眼似 澄江 映秋碧 洞庭湖 上月 同 圆 石廪峰 前人 不 识 从来 说法 閙 云林 直措 人心 定 难得 岂 关佛 运有 穷通 自是担肩无 膂力 看 君 古井 直浪 尽 阅世 空花 等 尘 寂 虽然 独饭 一盂 香 争似 分甘 千百 亿
0b229231-d9fb-431b-b1ef-20ce8c1acc25,仁仲小圃,胡寅,唐,诗,七言古体,白云不为轻风起 闲影融融映秋水 静中观物万象呈 借问此心何所始 蚊飞蠓过那足问 要识人生行乐耳 君开小圃富幽致 自外而观如画里 陶公高兴只柴桑 晏子之居徒近市 春归森森青竹上 秋尽离离从草靡 岁华流转只常在 月魄盈亏未尝死 经纶胸次自开泰 语笑尊前即倾否 君知消息何处来 於穆我师纯不已,"7,7,7,7,7,7,7,7,7,7,7,7,7,7,7,7,7,7",7506a9b211ae62b4b59f906d851e05f5,白云 不 为 轻风 起 闲影 融融 映 秋水 静 中观 物 万象 呈 借问 此 心何所始 蚊 飞 蠓 过 那 足 问 要识 人生 行乐 耳 君 开 小圃富 幽致 自外而观 如 画 里 陶公 高兴 只 柴桑 晏子 之 居徒 近 市 春 归 森森 青竹 上 秋尽离离从草靡 岁 华 流转 只常 在 月 魄 盈亏 未尝 死 经纶 胸次 自 开泰 语 笑 尊 前 即 倾否 君知 消息 何处 来 於穆 我 师纯 不已
7874dfdc-3bf9-4101-884f-7106a9a9f29a,人日驚蟄前數日大雪寄孫奇父韓叔夏,胡寅,唐,诗,五言古体,腊雪不溉旱 天公念嘉生 稚春乃祁寒 号令如冬行 栗烈鼓噫气 碎訇动霆声 初疑雨翻盆 旋觉霰洒甍 暂止俄并集 中宵遽开明 衾裯起棱角 屏幌同户楹 淅淅纸窗战 铛铛铜漏惊 鸡寒罢晓唱 鸦冻犹晨鸣 惊戒臧获起 吹嘘燎炉頳 开关醉魂醒 倚杖诗思清 便欲披鹤氅 岂思饮银铛 空蒙势转盛 飞舞祥争呈 月池方漫汗 潮山正峥嵘 讵应柳皆絮 却讶梅始英 荆璞羞自献 蓝田遣谁耕 尘埃争受洗 粪壤叨蒙荣 幸已陴𪩘崿 若为投涧坑 分功雨露泽 绚彩冰霜精 良足润麦麰 未能浃粱秔 经旬苦料峭 三日观荧晶 恍忆游汴洛 都忘在湘衡 瑶林鄙王衍 冠玉怀陈平 亦念袁邵公 长安门自撑 更奇李侍中 淮蔡功先成 渐喜云解駮 频瞻日舒晴 昂然秀松出 倏尔危檐倾 墙角仅委积 瓦沟那持盈 朝暾破凝沍 淑气苏鳏茕 断决冈陇色 斩余白蛇横 泮流溪谷响 击碎珊瑚琤 瓶去蚌珠餐 庭空狮子狞 粉图记姿态 不屑供使令 陡觉时序正 不令寒温争 冰泥就涸涩 卉木纷勾萌 蒨蒨弄池柳 煌煌然山樱 了无半面粧 强学六出霙 二老久不觌 千篇谅难评 羔醪忍独酌 凤茗宜同烹 或且放笔快 敢言当敌勍 木桃得琼玖 耳属长谣赓,"5,5,5,5,5,5,5,5,5,5,5,5,5,5,5,5,5,5,5,5,5,5,5,5,5,5,5,5,5,5,5,5,5,5,5,5,5,5,5,5,5,5,5,5,5,5,5,5,5,5,5,5,5,5,5,5,5,5,5,5,5,5,5,5,5,5,5,5,5,5,5,5,5,5,5,5,5,5,5,5",ffd5ad5f25b7e0157582dcd326552730,腊雪 不溉 旱 天公 念嘉生 稚春 乃 祁寒 号令 如冬 行 栗烈 鼓 噫 气 碎訇 动霆 声 初疑雨 翻 盆 旋觉霰洒 甍 暂止 俄 并 集 中宵 遽 开明 衾 裯 起 棱角 屏幌 同户 楹 淅淅 纸窗 战 铛铛 铜漏 惊 鸡寒罢晓 唱 鸦冻犹 晨鸣 惊戒 臧 获起 吹嘘 燎 炉 頳 开关 醉魂醒 倚 杖 诗思 清 便 欲 披 鹤 氅 岂 思饮 银铛 空 蒙势 转 盛 飞舞 祥争 呈 月池 方漫汗 潮山 正 峥嵘 讵 应 柳 皆 絮 却讶 梅始英 荆璞 羞 自献 蓝田 遣 谁 耕 尘埃 争 受洗 粪壤 叨蒙荣 幸已 陴 𪩘 崿 若为 投涧 坑 分功 雨露 泽 绚彩 冰霜 精 良足 润 麦 麰 未能 浃 粱 秔 经 旬 苦 料峭 三日 观 荧晶 恍忆 游汴洛 都 忘 在 湘 衡 瑶林 鄙 王衍 冠玉 怀陈平 亦 念 袁 邵公 长安 门 自撑 更 奇 李 侍中 淮 蔡功 先 成 渐 喜 云 解 駮 频瞻 日 舒晴 昂然 秀松 出 倏尔 危檐 倾 墙角 仅 委积 瓦沟 那 持 盈 朝 暾 破 凝 沍 淑气 苏 鳏茕 断决 冈陇色 斩 余 白蛇 横 泮 流 溪谷 响 击碎 珊瑚 琤 瓶 去 蚌珠 餐 庭空 狮子 狞 粉 图记 姿态 不屑 供 使令 陡觉 时序 正 不 令 寒温 争 冰泥 就涸 涩 卉 木纷勾 萌 蒨 蒨 弄 池 柳 煌煌 然 山 樱 了 无 半面 粧 强学 六出 霙 二老 久 不 觌 千篇 谅 难评 羔 醪忍 独酌 凤茗宜 同 烹 或且 放笔 快 敢言 当 敌 勍 木桃得琼 玖 耳属 长谣 赓
43aa7c0c-54c8-4921-a043-147d35f8edd8,送智京長老智京普融上足也,胡寅,唐,诗,五言古体,人生如浮云 片片随所起 值遇初偶然 解散亦俄尔 识君湘水头 凝袂衡岳里 十年去何住 新化五百里 乘兴出山来 相对淡无滓 因思相见初 贼帜森未弭 世事几秋叶 壮怀今止水 堂堂普融老 鹤瘦松孤峙 广舌浩江输 迅机无箭拟 八请六道场 到处万人喜 一灯千百焰 高第君得髓 法席既绍隆 诗鸣亦能似 衡门鲜晤语 杖锡盍留止 翩然复告辞 母病急甘旨 故知秉彝性 谁或外此理 为话本来心 闻闻即弹指,"5,5,5,5,5,5,5,5,5,5,5,5,5,5,5,5,5,5,5,5,5,5,5,5,5,5,5,5,5,5,5,5",3dc389498db0738a387ea13de13a89d8,人生 如 浮云 片片 随所起 值遇 初 偶然 解散 亦 俄尔 识 君 湘 水头 凝 袂 衡岳 里 十年 去 何 住 新化 五百里 乘兴 出山 来 相对 淡 无 滓 因 思 相见 初 贼 帜 森 未弭 世事 几 秋叶 壮怀 今 止水 堂堂 普融 老 鹤 瘦松 孤峙 广舌浩江 输 迅机无箭拟 八 请 六 道场 到处 万 人 喜 一灯 千百 焰 高第君 得 髓 法席 既 绍隆 诗鸣 亦 能 似 衡门 鲜晤语 杖 锡 盍 留止 翩然 复 告辞 母 病急 甘旨 故知 秉 彝 性 谁 或外 此理 为 话 本来 心 闻闻 即 弹指
b21c523f-fd18-491e-b153-0702263787e4,示端推單普,胡寅,唐,诗,五言古体,我是瘴岭跕 谁为青田真 若使新羽燕 老鹰安得亲 君行何方来 袖有三吴云 访予堕珠玉 蛰户开青春 无以答嘉赠 深衷宜重陈 仲尼且待贾 至宝宜贵珍,"5,5,5,5,5,5,5,5,5,5,5,5",115c5018e7972d7ba5e35d5d362aa479,我 是瘴 岭 跕 谁 为 青田 真 若 使 新 羽 燕 老鹰 安得 亲 君行 何方 来 袖 有 三 吴云 访予 堕 珠玉 蛰户 开 青春 无以 答 嘉 赠 深衷宜重陈 仲尼 且 待 贾 至宝 宜贵珍
bead21fc-e4a8-42b2-907f-d97cdbbbbbc6,謝楊珣梅栽,胡寅,唐,诗,五言古体,南土梅不贵 往往薪槱束 幸然傍寒厅 久亦未见录 墙隈非所恨 自可凌冬发 奈何瑶台伴 辱近紫姑闼 佳人虽薄命 时运忽来复 一朝蒙闵叹 移近东家屋 孤根便静深 池上映天碧 我为渠主人 梅是先生客 且须创幽榭 賸与种修竹 炎荒无雪片 且对冰花馥 西施佩生麝 姑射步微月 何当见旧官 应使中肠热,"5,5,5,5,5,5,5,5,5,5,5,5,5,5,5,5,5,5,5,5,5,5,5,5",c7f53d002df0162d464352a170349b5d,南土 梅不贵 往往 薪 槱 束 幸然 傍 寒厅 久 亦 未 见录 墙 隈 非 所 恨 自 可 凌冬 发 奈何 瑶台 伴 辱近 紫姑闼 佳人 虽 薄命 时运 忽来复 一朝 蒙闵 叹 移近 东家 屋 孤根 便 静 深 池 上映 天碧 我 为 渠 主人 梅 是 先生 客 且 须 创 幽 榭 賸 与 种 修 竹 炎 荒无 雪片 且 对 冰花 馥 西施 佩生 麝 姑射步 微 月 何当 见 旧 官 应使 中肠 热
5af7bc94-74eb-4623-b36d-0ff056cb6917,贈陳生,胡寅,唐,诗,五言古体,茅容杀一鸡 留半置庋板 奉亲须肉味 对客但蔬饭 仲由身负米 岂顾人嗤莞 参乎三釜乐 不羡千金产 古今履诚信 薄俗行苟简 竞敲声利关 汲汲组绶绾 指兹为显荣 于义遑复拣 贤如郭林宗 尚负牲牢赧 孝衰百行失 岂特厚宾馔 为人在我尔 谁以力自限 今君修古道 田土亦未昄 带经已能克 扶耒意无𪭾 似闻收一稔 铚艾工日僝 茂筠为载具 泛壑出𡾰𡶴 归家鱼菽美 愉婉已在眼 君非沮溺流 文字富编撰 中扃务恬息 外慕正除刬 晚交慰荒芜 切磋兼瑟僩 何时还过我 望望车有栈 梅花开正繁 飞雪待浮盏,"5,5,5,5,5,5,5,5,5,5,5,5,5,5,5,5,5,5,5,5,5,5,5,5,5,5,5,5,5,5,5,5,5,5,5,5,5,5,5,5",d12c0fa9dd28047ec721636bf0b69697,茅容 杀 一 鸡 留 半 置 庋 板 奉 亲须 肉味 对客 但 蔬饭 仲 由 身负 米 岂 顾 人 嗤 莞 参乎 三釜乐 不 羡 千金 产 古今 履 诚信 薄 俗行 苟 简 竞敲 声利 关 汲汲 组绶 绾 指 兹 为 显荣 于义 遑 复 拣 贤 如 郭林宗 尚 负牲 牢赧 孝 衰 百行 失 岂 特厚 宾馔 为 人 在 我 尔 谁 以力 自限 今君修 古道 田土 亦未 昄 带经 已 能 克 扶 耒意 无 𪭾 似 闻收 一稔 铚艾工日 僝 茂筠 为 载具 泛 壑 出 𡾰 𡶴 归家鱼 菽 美 愉婉 已 在 眼 君非 沮溺 流 文字 富 编撰 中 扃 务 恬息 外 慕正 除 刬 晚 交慰 荒芜 切磋 兼 瑟 僩 何时 还过 我 望望 车 有 栈 梅花 开 正繁 飞雪 待 浮 盏
6666da55-d3c0-4c32-8af6-ccedf9f18195,簡黎生生時旅寓郡庠,胡寅,唐,诗,五言古体,雨多杖藜阻 室迩言少赊 示病今如何 起居谅能佳 小市禁宰割 每无鱼与蛙 何以侑旅食 顷当羹苋茄 在昔多贫师 况自接东家 药物有所缺 谕我心莫遐 明日能相遇 煮茗看荷花,"5,5,5,5,5,5,5,5,5,5,5,5,5,5",c463c000350a23507e6a46b8dc2470cb,雨 多 杖 藜 阻 室 迩 言 少 赊 示病 今 如何 起居 谅能 佳 小市 禁 宰割 每 无 鱼 与 蛙 何以 侑 旅 食 顷当 羹 苋茄 在 昔 多 贫师 况 自 接 东家 药物 有所 缺 谕 我心 莫遐 明日 能 相遇 煮茗 看 荷花
c8529e31-aaa5-4a3f-b9d2-9080e824cc7e,和蔡生,胡寅,唐,诗,五言古体,吾生惭松独 天赋比樗散 学道才窥藩 圣门未容款 老来忧患集 鵻草经湿暵 衣带垂有余 樗腹无可坦 跫然喜君至 肯就我乎馆 一醉老瓦盆 宁用玻璃碗 春风正骀荡 柳暗月欲满 蚩蚩万物类 混化胎与卵 吾侪幸襟灵 诗书足相伴 浩然天宇内 未暇论修短 扬雄正希颜 曾子岂顾管 希声非折杨 下士每大莞,"5,5,5,5,5,5,5,5,5,5,5,5,5,5,5,5,5,5,5,5,5,5,5,5",6c7f54533142899258716bc6fb9901ea,吾 生 惭松 独 天赋 比 樗 散 学道 才 窥 藩 圣门 未 容款 老 来 忧患 集 鵻 草 经 湿 暵 衣带 垂 有余 樗 腹 无可 坦 跫 然 喜 君 至 肯 就 我 乎 馆 一 醉 老 瓦盆 宁用 玻璃碗 春风 正 骀 荡 柳暗月 欲 满 蚩 蚩 万物 类 混化胎 与 卵 吾侪 幸襟灵 诗书 足 相伴 浩然 天宇 内 未暇 论 修短 扬雄 正希颜 曾子 岂顾 管 希声 非 折 杨 下士 每 大莞
c18b92ad-f7e3-42a5-8fed-582831de0a6c,送張倩歸衡嶽,胡寅,唐,诗,五言古体,鄙人丽丹书 分合堕荒杳 玉郎胡为来 高谊云共眇 一年常惜日 四序乃过鸟 安能久相留 话别情太悄 离筵亦何有 瘴雨对蛮醥 羞以蛙与蛇 茹以芹及蓼 相将丹荔熟 怅望剥绛皎 爱君温克姿 不被欢伯绕 缅怀君祖烈 德粹学甚窈 乃翁才情富 未试嗟折夭 早交论金兰 晚契托萝茑 顾惭兼金赠 聊用苦语晓 发身在求仁 此理悟者少 人虽处尘世 心盍度尘表 凌霄而俛睨 万物孰不小 规模要宏廓 闻见忌寡𫍲 南方君子居 吾敢废强矫 勿兴儿女恋 后会龟已兆 千山空棱层 万水自漭渺 行行得夷路 长辔策騕褭,"5,5,5,5,5,5,5,5,5,5,5,5,5,5,5,5,5,5,5,5,5,5,5,5,5,5,5,5,5,5,5,5,5,5,5,5,5,5,5,5",7126331a9e46cc1fcc2e8cec7a21a45e,鄙人 丽丹 书 分合 堕荒 杳 玉郎胡 为 来 高谊云 共 眇 一年 常惜 日 四序 乃过 鸟 安能久 相留 话 别情 太 悄 离筵 亦 何有 瘴雨 对 蛮 醥 羞以 蛙 与 蛇 茹以芹 及 蓼 相将 丹荔 熟 怅望 剥 绛 皎 爱君 温克姿 不 被 欢伯 绕 缅怀 君祖烈 德粹学 甚 窈 乃翁 才情 富 未 试 嗟折夭 早 交论 金兰 晚 契托萝 茑 顾惭 兼 金 赠 聊用 苦语 晓 发身 在 求仁 此理 悟者 少 人 虽 处 尘世 心 盍 度 尘 表 凌霄而 俛 睨 万物 孰 不小 规模 要 宏廓 闻见 忌 寡 𫍲 南方 君子 居 吾 敢 废强 矫 勿 兴 儿女 恋 后 会 龟 已 兆 千山 空棱层 万 水 自 漭 渺 行行 得 夷 路 长辔 策 騕 褭
fba2139a-b0ea-473e-b8f8-c4b749cd1848,邀朱推單令周尉賞西鄰野人屋前梅花次單令韻,胡寅,唐,诗,五言古体,西崦一株梅 在野何清丽 遥知不是雪 香散青林际 肆筵宾沓来 秉炬仆相递 幸蒙五字诗 妙敌一言蔽 便恐清夜阑 行酒莫濡滞 莓苔何必扫 月地作瑶砌 细蕊护檀心 已带轻酸味 为语青裙妪 斤斧烦叱卫 会有移根人 趁得春风至 颗颗调君羹 年年映尘世 来游者谁子 此兴恐难继,"5,5,5,5,5,5,5,5,5,5,5,5,5,5,5,5,5,5,5,5,5,5",035d2b42e04dd9fdf7ab7b062af76905,西 崦 一株 梅 在野 何 清丽 遥知 不是 雪 香散青 林际 肆 筵宾 沓 来 秉 炬 仆 相递 幸蒙 五 字 诗 妙敌一言蔽 便 恐 清 夜阑 行酒 莫濡滞 莓 苔 何必 扫 月 地 作 瑶 砌 细蕊 护檀心 已 带轻 酸味 为 语青 裙妪 斤斧烦 叱卫 会 有 移 根 人 趁 得 春风 至 颗 颗 调 君 羹 年 年 映 尘世 来 游者 谁 子 此 兴 恐难 继
62c59dbb-51f7-4d8d-bb3e-9d7036e256aa,周尉不來用單令韻見寄和之,胡寅,唐,诗,五言古体,秾李太秾华 夭桃苦夭丽 不如姑射子 仙质淡难际 破寒传芳信 春意岂迢递 亭亭映碧霄 茨屋安得蔽 一壶扫花阴 聊散客愁滞 千珠联万玉 襞积谁所砌 飞英时落杯 草木吾臭味 颇嫌三弄笛 声杂郑和卫 二公何惠然 怅望周郎至 哦诗要何似 孤绝表一世 风吹佳句来 端可使人继,"5,5,5,5,5,5,5,5,5,5,5,5,5,5,5,5,5,5,5,5,5,5",b688516331c18d8afa67f0f87afe07a9,秾李太 秾 华 夭 桃苦夭丽 不如 姑射子 仙质 淡 难际 破 寒传芳 信 春意 岂迢 递 亭亭 映碧霄 茨屋安 得蔽 一 壶 扫花 阴 聊 散客 愁滞 千 珠联 万玉 襞 积 谁 所砌 飞英 时落 杯 草木 吾 臭味 颇 嫌 三弄 笛 声 杂 郑和 卫 二 公何 惠然 怅望 周郎 至 哦 诗 要 何 似 孤绝 表 一世 风吹 佳句 来 端 可 使 人 继
d04106e2-8427-4ae7-91f5-95cf9666937b,示周尉,胡寅,唐,诗,五言古体,官酒不可求 村酿不足酤 似闻糟床注 滴沥真珠露 载醪欲相过 好语亦已屡 梅花虽零落 残雪尚可顾 已捉笼中鸡 仍撷园中茹 一壶便堪醉 不必更携具 数朝风雨湿 两日已通路 行乐贵及时 蟋蟀岁云暮,"5,5,5,5,5,5,5,5,5,5,5,5,5,5,5,5",d10f7c78110dc2532333a4c16a07ddbe,官酒 不可 求 村酿 不足 酤 似闻糟 床 注 滴沥 真珠 露 载 醪欲 相过 好 语 亦 已屡 梅花 虽 零落 残雪 尚可 顾 已 捉笼 中鸡 仍 撷 园中 茹 一 壶 便 堪醉 不必 更 携 具 数朝 风雨 湿 两日 已 通路 行乐 贵 及时 蟋蟀 岁 云 暮
aa488bc1-3748-4a03-8b35-683f9eccedc9,題單令雙清閣,胡寅,唐,诗,五言古体,中扃有天游 一室四海见 倘无空虚地 六凿互争战 琴堂故萧爽 向也正墙面 棘茨莽蒙蔽 鼷鼠纷旋转 刬除资豁达 顿觉云水眩 瞰临幽阁出 率畧重营缮 从容五六客 尚得摇歌扇 西山隔雉楼 佛髻三两现 渺然宜北望 深碧湛芳蒨 群峰涌翠浪 远迩相明绚 珍禽知几种 演漾花雪片 有时惠风来 轻皱蹙霜练 最怜明月夜 酒渴光可咽 主人蔼优政 不媿宓子贱 挠之莫能浊 聊用青白燕 心澄迹自洁 眼静照还徧 他年腾踏去 回观等邮传 只今簷前渌 但足注诗砚 予方混泥涂 每媿陪高宴 更书梁栋间 何以贲花县,"5,5,5,5,5,5,5,5,5,5,5,5,5,5,5,5,5,5,5,5,5,5,5,5,5,5,5,5,5,5,5,5,5,5,5,5,5,5,5,5",6290de4c37348b70dbeab2ad70911ca8,中 扃 有 天游 一 室 四海 见 倘 无 空虚 地 六 凿 互 争战 琴堂 故 萧爽 向 也 正 墙面 棘 茨莽 蒙蔽 鼷鼠 纷 旋转 刬 除 资 豁达 顿觉 云水 眩 瞰 临 幽阁 出 率 畧 重 营缮 从容 五六 客 尚 得 摇歌扇 西山 隔 雉 楼 佛髻 三两 现 渺然 宜北 望 深 碧 湛 芳 蒨 群峰 涌 翠 浪 远 迩 相明 绚 珍禽 知 几种 演漾 花 雪片 有时 惠风 来 轻 皱 蹙 霜 练 最怜 明月 夜 酒 渴光 可咽 主人 蔼 优 政 不 媿 宓 子 贱 挠 之 莫 能 浊 聊用 青白 燕 心 澄迹 自洁 眼 静照 还 徧 他 年 腾 踏 去 回观 等 邮传 只 今 簷 前 渌 但 足注 诗砚 予 方 混泥 涂 每 媿 陪 高 宴 更 书 梁栋 间 何以 贲 花县
6fdf323d-a151-4cd8-b406-74d9ae964f51,贈朱推,胡寅,唐,诗,七言古体,浄绿环城亦何有 跳锦潜银不容取 尚余翠盖拥红粧 两两三三早秋后 秋官公廨临池傍 结筠为筏开轩窗 落日轻风泛船好 欢呼取笑徒相望 忽闻报予酒初熟 亟往从之倾白玉 疎蝉有思曳长缲 寒露无声洗残燠 君才岂合州县劳 前云后晖家世高 一经不但有遗训 千古记注谈滔滔 新州州土烝岚瘴 从来只是居流放 于今多住四方人 况复为官气条畅 山肴野蔌应时须 真率相期久已渝 君今满秩稍淹此 牛刀又欲将鸡屠 嗟予衰谢人所去 晚交幸作年家遇 浮生聚首安得常 一笑倾怀亦难屡 莫辞瓶罄烛再然 异日重逢歌此篇 岁时岂忍无记述 明朝仲朔青龙年,"7,7,7,7,7,7,7,7,7,7,7,7,7,7,7,7,7,7,7,7,7,7,7,7,7,7,7,7,7,7,7,7",3c963ad16478ea16607879c067b22aaf,浄 绿 环城 亦何 有 跳 锦 潜 银 不容 取 尚余翠 盖 拥 红 粧 两两三三 早 秋后 秋官公 廨 临池 傍 结筠 为 筏 开 轩 窗 落日 轻风 泛 船 好 欢呼 取笑 徒 相望 忽闻 报予 酒初 熟 亟往 从 之 倾 白玉 疎 蝉 有 思曳 长 缲 寒露 无声 洗 残 燠 君 才 岂 合州县 劳 前云 后 晖 家世 高 一经 不但 有 遗训 千古 记注 谈 滔滔 新州 州 土 烝 岚 瘴 从来 只是 居 流放 于今 多 住 四方 人 况 复为 官气 条畅 山肴野蔌 应 时须 真率 相期 久已 渝 君 今 满 秩 稍 淹 此 牛刀 又 欲 将 鸡 屠 嗟予 衰谢 人 所 去 晚 交幸 作年家 遇 浮生 聚首 安 得 常 一 笑 倾怀 亦 难屡 莫辞 瓶 罄 烛 再然 异 日 重逢 歌 此 篇 岁时 岂 忍无 记述 明朝 仲朔 青龙 年
a00a4396-12e5-4049-a4e6-bd0ed0cba6f6,題蔡生竹裏茅簷似野航,胡寅,唐,诗,七言古体,诛茅自结林中屋 林密先删百竿竹 南山献状漏南亭 北路行歌喧北曲 谁知江海蔡中郎 岁晚栖栖泊岭阳 未有浄名方丈室 小斋聊寄锦江航 劝君须学逃名隠 题揭徒然绚黛粉 请看郑圃四十年 妙在不知而不愠 我今亦住茅竹间 身世浑如系缆船 空洞之中何所有 圣门勋业浩无边 此君且伴幽人趣 时来岂不茅连茹 瓶罍果醉两三人 会约伊渠杖藜去,"7,7,7,7,7,7,7,7,7,7,7,7,7,7,7,7,7,7,7,7",9ae306861babb29fdebe24aa07b888b8,诛茅自结 林中 屋 林密先 删百竿竹 南山 献 状 漏 南亭 北路 行歌 喧 北曲 谁知 江海 蔡中郎 岁晚 栖栖泊岭阳 未有 浄 名 方丈室 小斋 聊 寄 锦江 航 劝君 须学 逃 名 隠 题 揭 徒然 绚黛 粉 请 看 郑圃 四十年 妙 在 不知 而 不 愠 我 今 亦 住 茅 竹间 身世 浑如 系 缆船 空洞 之中 何 所有 圣门 勋业 浩 无边 此君 且 伴 幽 人趣 时 来 岂不茅连茹 瓶 罍 果 醉 两三 人 会约 伊渠 杖 藜 去
