id,title,author,dynasty,genre,poem_type,sentences_simplified,meter_pattern,hash,words
4842dbd6-6ed9-453d-89ad-b8a09bfd14d4,赠南道人,王质,唐,诗,七言古体,露水班白未全白 长江大湖喜为客 西风渐少北风多 脚底路声行格格 一袍两𫏋都无余 腰间一二三葫芦 生涯如此祇如此 如此如此无他须 红黄弥漫杂奔走 观旁亦有可人否 公卿将相总不问 蓑衣铁拐岂无有 青山绿水逢迎时 亟来相报令吾知 戴起一顶青蒻笠 拖将七尺紫藤枝 因缘渺茫多阻隔 斯人吾前亦不识 且吞溪玉濯心神 更揽月轮摩眼力 摩到无明醉梦醒 挹袖拍肩须有人,"7,7,7,7,7,7,7,7,7,7,7,7,7,7,7,7,7,7,7,7,7,7",15f17dfbfa17da868bbc7e79e3cf3947,露水 班白 未 全 白 长江 大湖 喜为 客 西风 渐少 北风 多 脚底 路声 行 格格 一 袍 两 𫏋 都 无余 腰间 一二三 葫芦 生涯 如此 祇 如此 如此 如此 无 他 须 红 黄 弥漫 杂 奔走 观 旁 亦 有 可 人 否 公卿 将相 总 不问 蓑衣 铁 拐 岂 无有 青山绿水 逢迎 时 亟来 相报 令 吾 知 戴起 一顶 青蒻笠 拖 将 七尺 紫藤 枝 因缘 渺茫 多 阻隔 斯人 吾 前 亦 不识 且 吞 溪 玉 濯 心神 更 揽 月 轮 摩 眼力 摩到 无明 醉 梦醒 挹袖 拍 肩 须 有人
aceb5131-cf5e-4d71-9591-3ebe788f6d36,赠开怀道人,王质,唐,诗,七言古体,达磨只履投西归 一只迺为汝所持 汝持此只将奚为 十方三世包无遗 大挠十干十二支 衍作六十花参差 释迦佛亦不出斯 丈六身外还属谁 七十九年略可推 无始劫来何从知 可满盛著瑯琊儿 任汝胎年月日时 乌窠披上粗缯衣 龙尾引入黄金墀 平川袤野观游丝 东西南北随风飞 水流云在俱迟迟 凡度眼者都忘机 一物今古长光辉 无头无尾无骨皮 无男无女无妾妻 无肝无胆无心脾 大率一切皆无之 太空赤立孤凄凄 珞琭忽见全如痴 何况吕李杨徐奚 我命居申西南维 我身在未正直西 腊月三十日到来 此身此命成烟霏 卷起卦盘收卦棋 梅轩共看花阴移,"7,7,7,7,7,7,7,7,7,7,7,7,7,7,7,7,7,7,7,7,7,7,7,7,7,7,7,7,7,7,7,7",02ce3c9a81f263fba1dbe8142ba6273a,达磨 只 履投 西 归 一只 迺 为 汝 所 持 汝 持 此 只 将 奚为 十方 三世 包 无遗 大 挠 十干 十二支 衍作 六十 花 参差 释迦 佛 亦 不出 斯 丈 六 身外 还 属 谁 七十九年 略 可 推 无始 劫来 何 从 知 可 满盛 著瑯 琊 儿 任汝胎 年月日时 乌 窠 披上 粗 缯 衣 龙尾 引入 黄金 墀 平川 袤 野观 游丝 东西南北 随风 飞 水流 云 在 俱 迟迟 凡度 眼者 都 忘 机 一物 今古 长 光辉 无头无尾 无骨皮 无男无女无妾 妻 无肝无胆无 心脾 大 率 一切 皆 无 之 太空 赤立孤 凄凄 珞琭 忽 见 全 如 痴 何况 吕李杨 徐 奚 我 命居 申 西南 维 我身 在 未 正直 西 腊月 三十日 到来 此身 此 命成 烟霏 卷起 卦 盘 收 卦 棋 梅轩 共 看 花 阴移
6d89f83c-e38c-470b-81cd-356f09c23f8f,何处难忘酒  其一,王质,唐,诗,五言律诗,何处难忘酒 蛮夷太不庭 有心扶白日 无力洗苍溟 豪杰将斑白 功名未汗青 此时无一盏 壮气激雷霆,"5,5,5,5,5,5,5,5",42e8508a36d25f65166dbadf001fbb21,何处 难忘 酒 蛮夷 太不庭 有心 扶 白日 无力 洗 苍溟 豪杰 将 斑白 功名 未 汗青 此时 无 一盏 壮气 激 雷霆
3af0d1f8-7afb-449f-b205-4e44e9cd5e8e,何处难忘酒  其二,王质,唐,诗,五言律诗,何处难忘酒 奸邪太陆梁 腐儒还有郦 好汉总无张 曹赵扶开国 王徐卖靖康 此时无一盏 泪滴海茫茫,"5,5,5,5,5,5,5,5",293d1a832741324166c6f3d59a5e3189,何处 难忘 酒 奸邪 太陆 梁 腐儒 还有 郦 好汉 总 无 张 曹赵扶 开国 王徐 卖 靖康 此时 无 一盏 泪滴 海 茫茫
2be426ca-f9b5-4d63-ab09-6a5f14112885,何处难忘酒  其三,王质,唐,诗,五言律诗,何处难忘酒 英雄太屈蟠 时违聊置畚 运至即登坛 梁甫吟声苦 干将宝气寒 此时无一盏 拍碎玉阑干,"5,5,5,5,5,5,5,5",b829acb912ecfe76eed065050adda7f4,何处 难忘 酒 英雄 太屈蟠 时 违聊置 畚 运至 即 登坛 梁甫吟 声 苦 干将 宝气 寒 此时 无 一盏 拍 碎玉 阑干
9f39dee6-c59b-4e87-ba2d-94de61162565,何处难忘酒  其四,王质,唐,诗,五言律诗,何处难忘酒 生民太困穷 百无一人饱 十有九家空 人说天方解 时和气自丰 此时无一盏 入地诉英雄,"5,5,5,5,5,5,5,5",57bf0a6ea2ff32e66ec7d2d760e522f0,何处 难忘 酒 生民 太 困穷 百无一人饱 十 有 九家 空 人 说 天方 解 时 和 气 自 丰 此时 无 一盏 入 地 诉 英雄
a27a2be9-3887-4fd4-996a-589d26c727ae,次芜湖闻张彦晋船已行,王质,唐,诗,五言律诗,陆路如蛙钝 江流似马驰 不嫌君去速 只恨我来迟 儿女三杯酒 溪山五字诗 英豪到此地 莫更问何时,"5,5,5,5,5,5,5,5",24a6847c36d94a61b372bc4fae52ecf5,陆路 如 蛙 钝 江流 似马 驰 不 嫌 君 去 速 只 恨 我 来 迟 儿女 三 杯酒 溪山 五字 诗 英豪 到 此地 莫 更 问 何时
08fa152f-6c31-4c1b-aa0a-db9890d16f1c,芜湖道中,王质,唐,诗,五言律诗,扰扰千支水 攒攒一簇村 牛羊纷下括 鹅鸭閙争门 晚径飘松子 秋田长稻孙 霜天好风日 壮士铁衣温,"5,5,5,5,5,5,5,5",b3ecd7ed0c6cf54a94c2e4cd742d6bce,扰扰 千支 水 攒 攒 一簇 村 牛羊 纷 下括 鹅 鸭 閙 争 门 晚径 飘 松子 秋田 长稻 孙 霜天 好 风日 壮士 铁衣 温
dc7e96d8-0a70-4940-baf0-b0737629557a,山行即事二首  其一,王质,唐,诗,五言律诗,转岸波仍急 濒溪路半无 柳低侵树腹 莲湿坠花须 田舍篱忧倒 渔舟柁喜扶 雨余山更碧 倍费我工夫,"5,5,5,5,5,5,5,5",68a756195689ecf37a675b84344847ee,转岸波 仍 急 濒 溪 路 半无 柳 低侵 树腹 莲湿坠花 须 田舍 篱忧 倒 渔舟 柁 喜 扶 雨余山 更 碧 倍 费 我 工夫
773b9c2b-643f-45ca-bda7-df6fd1e1274e,山行即事二首  其二,王质,唐,诗,五言律诗,浮云在空碧 来往议阴晴 荷雨洒衣湿 苹风吹袖清 鹊声喧日出 鸥性狎波平 山色不言语 唤醒三日酲,"5,5,5,5,5,5,5,5",04ddbb23ddf2ff033695058eb9441879,浮云 在 空碧 来往 议 阴晴 荷雨 洒 衣湿 苹 风吹 袖清 鹊声喧 日出 鸥性 狎波 平 山色 不 言语 唤醒 三日 酲
a9848ebe-f62d-4a30-890e-dc640136a3a5,和御制诗五首  其一,王质,唐,诗,五言律诗,列圣兼仁武 随时议战和 伫开新日月 重照旧山河 西北浮云敛 东南王气多 大唐功十二 一一付铙歌,"5,5,5,5,5,5,5,5",87c5d6e8a65078ae930b2451fbf6e428,列圣 兼 仁武 随时 议战 和 伫开 新 日月 重 照旧 山河 西北 浮云 敛 东南 王气 多 大唐 功 十二 一一 付 铙 歌
9c7ad579-bde4-4a72-b798-e36ec3883f51,和御制诗五首  其二,王质,唐,诗,五言律诗,大庆通宣德 西华近保和 草荒朱雀道 沙壅护龙河 九庙烟尘暗 七陵风露多 君王既神武 父老莫悲歌,"5,5,5,5,5,5,5,5",8235a435655f4aee9d36f7299005507a,大庆 通 宣德 西华 近保 和 草荒 朱雀 道 沙 壅护 龙河 九庙 烟尘 暗 七陵 风露 多 君王 既 神武 父老 莫 悲歌
359cc45e-7767-4e75-8583-aab30eeb0a0d,和御制诗五首  其三,王质,唐,诗,五言律诗,濠楚前通泗 舒庐内接和 眼看花靥渡 梦想白沟河 火德时方盛 金行数不多 儒臣且经略 未要载赓歌,"5,5,5,5,5,5,5,5",7fb932760966f995c834b940ce1dc9af,濠 楚前通 泗 舒庐 内 接 和 眼看 花 靥 渡 梦想 白沟 河 火德 时方 盛 金行 数不多 儒臣 且 经略 未 要 载 赓 歌
d3a63674-2d1d-4a20-93ad-5f233bdcda9a,和御制诗五首  其四,王质,唐,诗,五言律诗,鼎待周公定 羹须傅说和 上方资羽翼 谁解废江河 志定功应就 时来力不多 晋公门下客 豫制凯旋歌,"5,5,5,5,5,5,5,5",01485b068d7004edb35ccaa2a4419cf5,鼎待 周 公定 羹 须傅 说 和 上方 资 羽翼 谁 解废 江河 志定 功应 就 时来力 不 多 晋公 门下 客 豫 制 凯旋 歌
bdeeb2ca-436e-480e-9998-410e64b5a086,和御制诗五首  其五,王质,唐,诗,五言律诗,景运开干德 升平到政和 七星摇帝座 两界隔天河 义士何曾少 谋夫不在多 鲤鱼长尺半 恐有扣牛歌,"5,5,5,5,5,5,5,5",0949a8c903c8fdd79b95b4053adc712a,景运 开干 德 升平 到 政和 七星 摇帝 座 两界 隔 天河 义士 何曾 少 谋夫 不 在 多 鲤鱼 长 尺 半 恐 有 扣 牛 歌
29e54549-ffaa-46d8-b219-9d2d761c8ea9,集杜子美句赋所居二首  其一,王质,唐,诗,五言律诗,田舍清江曲 柴扉扫径开 野花干更落 水鸟去仍囘 渺渺春风见 冥冥细雨来 幽栖身懒动 坐稳兴悠哉,"5,5,5,5,5,5,5,5",cbbe54af2c69d0950389f8488d29c101,田舍 清江 曲 柴扉 扫径 开 野花 干 更 落 水鸟 去 仍 囘 渺渺 春风 见 冥冥 细雨 来 幽 栖身 懒动 坐 稳兴 悠哉
2349dd0d-0e98-4916-94aa-a647cbe2a91e,集杜子美句赋所居二首  其二,王质,唐,诗,五言律诗,野屋流寒水 春星带草堂 忘机对芳草 驻屐近薇香 农事空山里 柴门古道傍 眼前今古意 看剑引杯长,"5,5,5,5,5,5,5,5",bafa50b115c96cad95f50a0d87737600,野屋 流寒 水 春星 带 草堂 忘机 对 芳草 驻屐 近 薇 香 农事 空 山里 柴门 古道 傍 眼前 今 古意 看 剑 引 杯 长
edb1ca86-6939-4302-a9f1-e41fb3998afa,郊居,王质,唐,诗,五言律诗,不著乌纱帽 自开青竹篱 雁号残月渚 猿挂冷霜枝 有泪不知落 无心空自悲 人情正翻覆 去住总难期,"5,5,5,5,5,5,5,5",905edb584936cff09eb5e2e3dd00bd7a,不著 乌纱帽 自开 青 竹篱 雁号 残月 渚 猿 挂 冷霜 枝 有 泪 不知 落 无心 空 自悲 人情 正 翻覆 去 住 总 难期
736032e1-2253-482a-9941-988d387aadee,秋兴,王质,唐,诗,五言律诗,有愿投金粟 无情上玉除 吾甘披短褐 君自曳长裾 浥浥云生屋 涓涓水到渠 十难三四好 八九在闲居,"5,5,5,5,5,5,5,5",8579b02fad8a2b8a206a70925f647c74,有 愿 投金 粟 无情 上玉 除 吾 甘披 短褐 君 自曳 长 裾 浥 浥 云 生 屋 涓涓 水 到 渠 十难 三四 好 八九 在 闲居
fc41ba24-e281-4f19-9135-335bd4ffae92,物幻诗,王质,唐,诗,五言律诗,北海鲲从化 南枝蚁战勋 宋龟灵自困 周蝶梦谁分 外物不可必 此形何足云 劳生竟不觉 幻境徒纷纷,"5,5,5,5,5,5,5,5",cb78c680724d4869f24a3a04b8dff942,北海 鲲从 化 南枝 蚁 战 勋 宋龟灵 自 困 周蝶梦 谁 分 外 物 不可 必 此 形何足云 劳生 竟 不觉 幻境 徒 纷纷
1982c57c-b9e3-4c05-ac2a-2aec6a6dfa06,次虞枢密九日登高韵,王质,唐,诗,五言律诗,风动旗千干 霜明甲万联 愁边悲有泪 幽燧冷无烟 杀气藏金钺 台光照玉船 元丰韩相国 故事讲军前,"5,5,5,5,5,5,5,5",e6880884e5ba867f89f60d1a51dcdfd1,风动 旗 千干 霜 明甲万 联 愁边悲 有 泪 幽燧 冷 无烟 杀气 藏金钺 台 光照 玉船 元丰 韩 相国 故事 讲军 前
dfbb45ba-1f8d-4a30-b224-65f849b2511d,代虞相挽杨参政二首  其一,王质,唐,诗,五言律诗,特起西南纪 孤飞五十年 名登千佛顶 位亚六阶躔 文社尊韩伯 经门事董先 山川有冥会 公在孝廉阡,"5,5,5,5,5,5,5,5",94dae84f84103c45dcab0568c3cf8d28,特 起 西南 纪 孤飞 五十年 名登千佛 顶 位亚 六阶 躔 文社 尊 韩伯 经门 事 董先 山川 有冥会 公在 孝廉 阡
3a66b314-c3e6-45fb-bf90-7868ba22f6ff,代虞相挽杨参政二首  其二,王质,唐,诗,五言律诗,道德平生足 功名岁晚成 挂冠方再表 负杖忽三声 乐寿兼仁智 哀荣备死生 我家无故老 不忍见公倾,"5,5,5,5,5,5,5,5",902a522424501a7c0114f8fe3db68ac1,道德 平生 足 功名 岁晚 成 挂冠 方再 表 负杖 忽 三声 乐寿 兼 仁智 哀荣 备死 生 我家 无故 老 不忍 见 公倾
23cf53b7-c0d1-457b-be16-28fd64b50788,代李叔介挽杨参政,王质,唐,诗,五言律诗,运泰风云合 名高泰华秋 杓衡方北指 江汉已东流 寡祐良臣死 钟情志士忧 惊心波浪里 不见济川舟,"5,5,5,5,5,5,5,5",1ca1035f853ce8e5bda8079d90eaf71c,运泰 风云 合 名 高 泰华 秋 杓 衡 方 北指 江汉 已 东流 寡 祐 良 臣 死 钟情 志士 忧 惊心 波浪 里 不见 济川 舟
2e11b935-3430-44da-960d-fb60f91cccc7,有感,王质,唐,诗,五言律诗,北斗阑干外 浮云拄杖中 天高千障立 月静一江空 宇宙横挥麈 乾坤落转蓬 浩歌聊举酒 无泪哭英雄,"5,5,5,5,5,5,5,5",cae03193ba40f7e4be5a6e3a3342a7e0,北斗 阑干 外 浮云 拄杖 中 天 高 千障 立 月 静一江 空 宇宙 横挥 麈 乾坤 落转 蓬 浩歌 聊 举酒 无泪哭 英雄
b5799f2c-9ea0-4f5b-93a0-0d6dc69d79c7,即事,王质,唐,诗,五言律诗,竹色交簷暗 苔痕拥舍深 群麕无定响 断雁有孤音 恋阙穿双眼 忧时折寸心 中原既传檄 乃更有陈琳,"5,5,5,5,5,5,5,5",8c4df32f845c9ae54b11febb58716f5a,竹色 交簷 暗 苔痕 拥舍 深 群 麕 无定 响 断 雁 有 孤音 恋 阙 穿 双眼 忧 时 折 寸心 中原 既传 檄 乃 更 有 陈琳
6b40b195-7f71-4985-b5bc-596481d64bf9,送晁侍郎二首  其一,王质,唐,诗,五言律诗,元衮催韩觐 锵鸾迟甫归 无功生静福 有道正危机 弃智轻观世 忘言妙格非 五车书满腹 字字莫相违,"5,5,5,5,5,5,5,5",9ee3cdae6d1fc9d7b20396111bc7a980,元衮 催 韩觐 锵 鸾 迟甫 归 无功 生静福 有 道 正 危机 弃 智 轻观 世 忘言 妙 格非 五车 书 满腹 字字 莫 相违
df4574af-d674-4f4f-af84-5837cfc6db5b,送晁侍郎二首  其二,王质,唐,诗,五言律诗,昔欲全家托 今惟只影依 任从龟左顾 独自鹊南飞 灾浅谋三至 心危泣百挥 英豪天下少 不敢废依归,"5,5,5,5,5,5,5,5",d0bf80226d674929f53f0bbd2c2f296a,昔 欲 全家 托 今 惟 只影 依 任 从 龟 左顾 独自 鹊南 飞 灾 浅 谋 三 至 心危泣百挥 英豪 天下 少 不敢 废 依归
7a33e04a-dbd2-44f8-9043-a505cf16f4e3,次青渠,王质,唐,诗,五言律诗,市井虽聊尔 风光略胜他 稻田方稍稍 瓦屋渐多多 得路皆平地 逢山但浅坡 日斜烟欲集 将奈晚寒何,"5,5,5,5,5,5,5,5",4c848f3f7e2daccbc6039c068365fdcd,市井 虽 聊尔 风光 略胜 他 稻田 方 稍稍 瓦屋 渐 多多 得 路 皆 平地 逢 山 但 浅坡 日 斜 烟 欲 集 将奈晚寒何
d8ac0c37-da06-4f32-993a-8db86f30a427,舟中作二首  其一,王质,唐,诗,五言律诗,昨日到今日 满江常涌波 山川非不好 风浪抑何多 所愧累公等 固知如我何 柁楼无晚照 高卧一长歌,"5,5,5,5,5,5,5,5",cf9aac5d45488ab911dab36fb021319f,昨日 到 今日 满江 常涌波 山川 非 不好 风浪 抑何多 所愧累 公等 固 知如 我何 柁 楼 无 晚照 高卧 一 长 歌
19fe7198-eaac-439d-8ca4-c7937695ec5c,舟中作二首  其二,王质,唐,诗,五言律诗,昨夜一叶落 秋风江汉波 晶晶红日淡 惨惨素烟多 世事今如此 吾曹可若何 凄凉聊系棹 一和大风歌,"5,5,5,5,5,5,5,5",9de434cdab3740b5cba42cb0af898546,昨夜 一叶 落 秋风 江汉 波 晶晶 红日 淡 惨惨 素烟 多 世事 今 如此 吾 曹可 若何 凄凉 聊 系 棹 一 和 大风歌
3ffd7cca-889b-4ecc-a9d9-1fdd7f7cf9a2,上王公明寿四首  其一,王质,唐,诗,五言律诗,缑氏吹箫远 王家奕叶光 昔多称建业 今独盛安阳 泰华何曾老 江河各自长 一名重两火 与宋大休祥,"5,5,5,5,5,5,5,5",58900c7aaaeb089612bd2bae07a8b150,缑氏 吹箫 远 王家 奕 叶 光 昔 多 称 建业 今 独盛 安阳 泰华 何曾 老 江河 各自 长 一名 重 两 火 与 宋大休祥
c755b386-ecce-4f23-88f6-e01edfb0b5d5,上王公明寿四首  其二,王质,唐,诗,五言律诗,正统承周后 元臣在邺昌 治平扶嗣圣 乾道作兴王 指日恢中土 何时过故乡 新堂标昼锦 门下有欧阳,"5,5,5,5,5,5,5,5",2932d20dbe2be185b95079aee21118d9,正统 承 周后 元臣 在 邺 昌 治平 扶嗣圣 乾道 作兴 王 指日 恢 中土 何时 过 故乡 新堂 标昼 锦 门下 有 欧阳
6efbda26-c891-41c6-8e60-b233ba204fb2,上王公明寿四首  其三,王质,唐,诗,五言律诗,稷契伊周后 功名事业谁 眼惊希世杰 心喜太平时 不老池边凤 长生印上龟 旗常书不尽 太庙有宗彝,"5,5,5,5,5,5,5,5",a9b2c2ed2cb70ba0e4fa799e5c295faa,稷 契 伊 周后 功名 事业 谁 眼 惊 希世杰 心喜 太平 时 不 老 池边 凤 长生 印上 龟 旗 常 书不尽 太庙 有宗彝
83546444-ee58-4a78-98df-c11f00c4424b,上王公明寿四首  其四,王质,唐,诗,五言律诗,风起云飞志 包含具善邻 试看公出手 毋谓我无人 挥羽思平魏 登场决并秦 功成身莫退 小驻八千春,"5,5,5,5,5,5,5,5",d41cf4dfd16028ffc11ea5dd7b3b0353,风起云飞志 包含 具善 邻 试看 公 出手 毋谓 我 无人 挥 羽思平 魏 登场 决并 秦 功成身莫退 小 驻 八千 春
28ef06c2-212d-4a38-aac3-49166a104124,采石道中,王质,唐,诗,五言律诗,闻说前年事 分明是偶然 群雄夸好手 万事有苍天 浪沫埋椿木 波声撼战船 萧条苦鬭者 挥泪立江边,"5,5,5,5,5,5,5,5",b6917edc7e3b53db2e352f9e2e196e17,闻 说 前年 事 分明 是 偶然 群雄 夸 好手 万事 有 苍天 浪沫 埋 椿 木 波声 撼 战船 萧条 苦 鬭 者 挥泪 立 江边
ef230378-4284-4e2c-a7f5-d191f5f549dd,魏城道中,王质,唐,诗,五言律诗,冈背车痕乱 崖阴马足黏 地炉茶带苦 幔店酒多甜 水减溪身瘦 冰凝树角铦 衣篝都已尽 无可更重添,"5,5,5,5,5,5,5,5",898ebabd3fad5567491eeef6f6292b84,冈背 车痕 乱 崖 阴 马 足 黏 地炉 茶带 苦 幔店 酒 多 甜 水 减 溪 身 瘦 冰凝树 角 铦 衣 篝都 已尽 无可 更 重添
c44469fc-03c4-43b1-a623-223d58edc011,青阳道中二首  其一,王质,唐,诗,五言律诗,今日青阳路 行行不忍过 人家茅屋少 原野稻田多 树木连苍色 陂塘湛碧波 斜阳攲半岭 将奈镜亭何,"5,5,5,5,5,5,5,5",62fb6a0c8861f9d9b30a8e1ee3a4b0c4,今日 青阳 路 行 行 不忍 过 人家 茅屋 少 原野 稻田 多 树木 连 苍色 陂塘 湛 碧波 斜阳 攲 半 岭 将 奈 镜 亭 何
e5420460-5194-4f79-b35d-5d921deb62c1,青阳道中二首  其二,王质,唐,诗,五言律诗,一路皆平坦 今朝稍屈盘 仆饥争小店 桥断拣枯滩 处处山都好 家家酒不酸 人生各有地 所乐是长安,"5,5,5,5,5,5,5,5",8aa0663c158a526da79fdc8061d180aa,一路 皆 平坦 今朝 稍 屈盘 仆 饥争 小店 桥 断 拣 枯滩 处处 山 都 好 家家酒 不 酸 人生 各 有 地 所乐 是 长安
abdb3eb2-6e8d-4247-bb13-75ed146c17f5,宿石谿寺,王质,唐,诗,五言律诗,落日寒山里 荒烟野寺中 僧垣水衣白 佛座藓花红 舍后蜂糖熟 门前雁米丰 夜长难早睡 拥被听松风,"5,5,5,5,5,5,5,5",d31526f853259727f4c863d06bad419d,落日 寒 山里 荒烟 野寺 中 僧垣 水衣 白 佛座 藓 花红 舍 后 蜂糖 熟 门前 雁米丰 夜长 难 早睡 拥 被 听松 风
4913f6d2-2a94-4094-b28d-3006434226f0,敕局同年相饯是日谢遣婢子春饶者还其家同年大不然之共怅然也,王质,唐,诗,五言律诗,已恨此身多 将如之子何 自甘吾潦倒 真恐汝蹉跎 身老便孤睡 家贫喜自歌 辎𫐌他日见 各想旧婆娑,"5,5,5,5,5,5,5,5",67777c8e514653dd9e14d2070c8b2899,已 恨 此身 多 将 如之子何 自甘 吾 潦倒 真恐 汝 蹉跎 身老 便 孤 睡 家贫 喜自 歌 辎 𫐌 他 日见 各 想 旧 婆娑
83e1c16d-d1e1-4f56-b105-8f1b8f2fb81b,发家书,王质,唐,诗,五言律诗,别乘非为辱 江陵稍近家 牙绯虽滞色 头白亦增华 见说堂前竹 胜如屋角花 脱身归到得 余事总尘沙,"5,5,5,5,5,5,5,5",11e083966b64ce6a7b16abe520dd3e18,别乘非为辱 江陵 稍 近 家 牙 绯虽 滞 色 头白 亦 增华 见 说 堂 前 竹 胜如 屋角 花 脱身 归 到 得 余 事 总 尘沙
15862c50-c90a-4ed0-9295-1b670b3d4d0d,上亭,王质,唐,诗,五言律诗,雨色昏何在 铃声怨阿谁 一朝人世改 万事帝心知 西去身虽脱 东边势更危 祇应南内里 不似上亭时,"5,5,5,5,5,5,5,5",8c4453494492814629e5a2fd1de49f39,雨色 昏 何在 铃声 怨 阿 谁 一朝 人世 改 万事 帝心 知 西去 身 虽 脱 东边 势 更 危 祇 应 南 内里 不似 上 亭 时
862a35ca-dbe9-432e-ad6d-e197cbb9eb9d,雨花台,王质,唐,诗,五言律诗,乱草踏秋碧 斜阳立晚红 天低昏海雾 江阔渡淮风 台有余基壮 碑无旧观丰 愁人惜倦眼 不敢送归鸿,"5,5,5,5,5,5,5,5",2e8bc05ed0b3774a6548e80ebd1e47cd,乱草踏秋碧 斜阳 立晚 红 天 低 昏 海雾 江阔渡 淮 风 台 有余 基壮 碑 无 旧观 丰 愁人惜倦 眼 不敢 送 归鸿
062dc271-32e5-4f11-afaa-4125b8ec02ee,见九华峰有四十余其最秀者不知孰为九也因作是诗,王质,唐,诗,五言律诗,稍稍云气散 溶溶山态囘 翠旌千丈立 宝障百重开 此地真堪老 何时遂得来 海中蛟蜃恶 吾不问蓬莱,"5,5,5,5,5,5,5,5",c6b199fbdf6083fdc704d112756d96cf,稍稍 云气 散 溶溶 山 态 囘 翠 旌 千丈 立 宝障 百 重开 此地 真 堪 老 何时 遂 得来 海中蛟 蜃恶 吾 不问 蓬莱
90e32d05-8c79-46b8-9084-05520758c5f8,送虞丞相孙运干诗三首  其一,王质,唐,诗,五言律诗,祖予尚闭户 景文当入山 未能黄绮外 姑在尚彭间 眼到风尘暗 头依树石斑 曹溪有正路 飞倦要知还,"5,5,5,5,5,5,5,5",af35ea9c75e76fca20f9fe1f96f4c354,祖予尚 闭 户 景文 当 入山 未能 黄绮 外 姑 在 尚彭 间 眼 到 风尘 暗 头 依树 石斑 曹溪 有 正路 飞倦 要知 还
2f9b7137-af57-48b3-9db0-ac4faa66550f,送虞丞相孙运干诗三首  其二,王质,唐,诗,五言律诗,尚象子生子 高风新又新 昔看三桧戏 今见一槐春 父祖有家法 典型如老人 傍观应自肯 自肯乃方亲,"5,5,5,5,5,5,5,5",e5c678066a32e8a2ecc198dc75bd3fac,尚象子 生子 高 风 新 又 新 昔 看 三 桧 戏 今 见 一 槐 春 父祖 有 家法 典型 如 老人 傍 观应 自肯 自肯 乃 方亲
0cb72646-f9ce-46bb-b004-1c8969fc6411,送虞丞相孙运干诗三首  其三,王质,唐,诗,五言律诗,曲肱真事业 袖手大文章 想子归家急 如吾舍世忙 何时见丞相 几日上瞿唐 见问宜多说 不言君亦忘,"5,5,5,5,5,5,5,5",6691ba3692fa9140690ca10356ece25e,曲肱 真 事业 袖手 大 文章 想子 归家 急 如 吾 舍世忙 何时 见 丞相 几日 上 瞿唐 见 问 宜 多 说 不言君亦忘
5134233e-c276-4640-8948-bc6fb676fba6,题东林姚贵高书屋,王质,唐,诗,五言律诗,岛屿深沉碧 溪花淡薄红 连山收宿雨 当户进凉风 暮霭孤村外 斜阳一笛中 西山起明月 未放酒杯空,"5,5,5,5,5,5,5,5",f04f7e6fd18b74ac07d973c099f60f5b,岛屿 深沉 碧 溪花 淡薄 红 连山 收宿 雨 当户 进 凉风 暮霭 孤 村外 斜阳 一 笛 中 西山 起 明月 未放 酒杯 空
201ff355-b91a-4caa-ad24-0426b7f239da,题洪景伯得江亭二首  其一,王质,唐,诗,五言律诗,眸子发孤照 太空无阻修 万波争赴海 一嶂直当楼 渺渺怜身小 茫茫觉世浮 斜阳攲埤堄 随意数行舟,"5,5,5,5,5,5,5,5",aa1ab3600558326ae034b7e9c293bd6a,眸子 发孤 照 太空 无阻 修 万波争 赴 海 一 嶂 直 当 楼 渺渺 怜身 小 茫茫 觉世 浮 斜阳 攲 埤 堄 随意 数 行舟
5beefb53-8750-40ce-b3ac-62d1d5b75d32,题洪景伯得江亭二首  其二,王质,唐,诗,五言律诗,主去朝行在 花留伴此亭 别催心衮衮 春搅思冥冥 此事须丘壑 何人嗣典型 但当添种竹 相对北山青,"5,5,5,5,5,5,5,5",b103b954ad337d50fd88a7db07c387b9,主去 朝行 在 花 留伴 此 亭 别 催心 衮衮 春 搅 思 冥冥 此事 须 丘壑 何人 嗣 典型 但当 添 种 竹 相对 北山 青
9bc1c6fd-e5bd-4343-bd5f-607aa422c759,题舫轩,王质,唐,诗,杂言,一舸江湖外 风涛有是非 著身安实地 冷眼看危机 烟树何曾远 鸥群自飞 若人能转物 满载月明归,"5,5,5,5,5,4,5,5",59e5b5e4b3e055d543a73cd8ea8154d2,一 舸 江湖 外 风涛 有 是非 著身 安 实地 冷 眼看 危机 烟树 何曾 远 鸥 群 自 飞 若 人能 转物 满载 月 明归
80c9ed06-c9b6-4fb0-9e04-2d3a4246fabb,题施大任双桂轩,王质,唐,诗,五言律诗,濯濯双引干 盘盘同结根 人知灵草木 天与好儿孙 妩媚花窥眼 婆娑秀此轩 门中福未艾 遶树更兰孙,"5,5,5,5,5,5,5,5",1bb1f5f3963d5bb098ff724f52dae2d9,濯濯 双引 干 盘盘 同 结根 人知 灵 草木 天 与 好 儿孙 妩媚 花窥眼 婆娑 秀 此 轩 门中 福未艾 遶 树 更 兰 孙
12713a9a-22b9-4c59-b1ab-15d3192f9c6c,题孤山寺,王质,唐,诗,五言律诗,窈窕孤山寺 光明大士龛 佛香时缥缈 茶味亦清甘 竹挺森千百 僧房并两三 全无兵火气 不似在淮南,"5,5,5,5,5,5,5,5",66e90834b7572adb270a1feb2434fe62,窈窕 孤山 寺 光明 大士 龛 佛香 时 缥缈 茶味 亦 清 甘 竹挺森 千百 僧房 并 两三 全 无 兵火 气 不似 在 淮南
0b21658f-8116-4429-9a3a-81403a411b4e,和王充道夜坐二首  其一,王质,唐,诗,五言律诗,索索风呼叶 萧萧雨打窗 遥思双白发 相对一残缸 梦落湘南浦 身浮浙右江 漏穷钟未断 犹自咽微撞,"5,5,5,5,5,5,5,5",67d47e177bd96f55283c299e387671c2,索索 风呼叶 萧萧 雨 打 窗 遥思 双 白发 相对 一 残缸 梦落 湘 南浦 身 浮 浙 右江 漏 穷 钟 未断 犹自 咽 微撞
ede85e3b-006c-45d3-af81-cef5dd4b7661,和王充道夜坐二首  其二,王质,唐,诗,五言律诗,风雨连三日 晨昏共一窗 天寒怜翠袖 夜永对青缸 有泪挥吴月 无船上楚江 梦寒元易断 钟静不须撞,"5,5,5,5,5,5,5,5",1d2ae2f4b62ad26ac562f43085dfeec6,风雨 连 三日 晨昏 共 一 窗 天寒 怜 翠 袖 夜 永 对 青缸 有 泪 挥 吴 月 无 船上 楚江 梦寒元 易断 钟静 不须 撞
bf00442c-43fa-4c8c-87a6-32f47fb904b1,和孙仲甫,王质,唐,诗,五言律诗,浦溆清溪遶 人家绿树围 竹墩森翠葆 莲荡乱红衣 薄雨生朝润 斜阳隠暮霏 桃花流水意 不在鳜鱼肥,"5,5,5,5,5,5,5,5",e201a302125fee0e9971d66767eae9f7,浦 溆 清溪 遶 人家 绿树 围 竹墩森 翠葆 莲 荡乱 红衣 薄雨生 朝润 斜阳 隠暮霏 桃花流水 意 不 在 鳜鱼 肥
