id,title,author,dynasty,genre,poem_type,sentences_simplified,meter_pattern,hash,words
1227c3de-97f6-4b14-9e72-c227c83fe4b8,酬令裕见寄之什,李吕,唐,诗,五言古体,伯才不鼓琴 良为知音撤 渊明琴无弦 荆扉昼常闭 吾道传沧洲 初不待识别 叔孙志谐俗 礼乐用绵𫈵 子陵持正论 阿谀腰领绝 宁可负凿方 枉尺未应屑 郊居本寂寞 况乃生计拙 食指日益繁 资用时告竭 客至坐无毡 窃与郑公埒 天随拾杞菊 焉能餍𫗦餟 平生所厚人 过门或电掣 尝闻贵易交 一命已变节 包苴既无鱼 裋褐倦造谒 阔远故人书 谁复访衰苶 有燄手可炙 其如火不热 闻酸蚋必聚 其如醯不冽 向来出肺肝 生死语虚设 醇风恣浇漓 仁义从荡灭 江湖足相忘 何苦怨离别 黄君忘年友 岁寒我辈列 抗志忌诡随 讲究亦可悦 高堂甘旨奉 敢以贫故阙 姑从敩学半 俯首栖林樾 近枉寄赠篇 用意尤清切 似闻于易道 琅诵口不辍 顾慙泽畔癯 韦编老披阅 未达言外意 搔首漫卼臲 三圣日星垂 墙仞靡容瞥 动静本自然 发明頼前哲 屈伸相感触 至理甚昭晰 泰反复于隍 需顺出自穴 机缄默循环 勿用腾口说 寒泉终可食 但贵井常渫 正乏双南金 报称愧灭裂 见许惠然来 谅不出良月 莫学王子猷 兴尽江天雪,"5,5,5,5,5,5,5,5,5,5,5,5,5,5,5,5,5,5,5,5,5,5,5,5,5,5,5,5,5,5,5,5,5,5,5,5,5,5,5,5,5,5,5,5,5,5,5,5,5,5,5,5,5,5,5,5,5,5,5,5,5,5,5,5,5,5,5,5,5,5,5,5",714e72fc68b7d8a0c8c7ab3de1b39947,伯才 不 鼓 琴 良 为 知音 撤 渊明 琴无弦 荆扉 昼常闭 吾 道 传 沧洲 初 不待 识别 叔 孙志谐 俗 礼乐 用 绵 𫈵 子陵持 正论 阿谀 腰领 绝 宁可 负凿 方 枉 尺 未 应屑 郊 居本 寂寞 况乃 生计 拙 食指 日益 繁 资用 时告 竭 客 至 坐无毡 窃 与 郑公埒 天 随拾 杞菊 焉能 餍 𫗦 餟 平生 所 厚 人 过门 或 电 掣 尝闻 贵易 交 一 命 已 变节 包 苴 既 无 鱼 裋 褐 倦 造 谒 阔 远 故人 书 谁 复访 衰 苶 有燄手可炙 其 如 火 不 热 闻 酸 蚋 必 聚 其 如 醯 不冽 向来 出 肺 肝 生死 语 虚设 醇 风恣浇漓 仁义 从 荡灭 江湖 足 相忘 何苦 怨 离别 黄君 忘 年友 岁寒 我辈 列 抗 志忌诡随 讲究 亦可 悦 高堂 甘旨奉 敢 以 贫故 阙 姑 从 敩 学 半 俯首 栖 林樾 近 枉 寄赠 篇 用意 尤 清切 似闻于易道 琅诵 口 不辍 顾 慙 泽 畔 癯 韦 编 老 披阅 未 达言 外意 搔首 漫 卼 臲 三圣 日星 垂 墙 仞 靡 容 瞥 动静 本 自然 发明 頼 前 哲 屈伸 相 感触 至 理 甚 昭晰 泰 反复 于隍 需顺 出自 穴 机 缄默 循环 勿 用腾 口说 寒泉 终 可食 但 贵井 常 渫 正乏 双南金 报称 愧 灭裂 见 许惠然 来 谅 不 出良 月 莫学 王子 猷 兴尽 江天 雪
72982724-951b-41d6-9c0e-31157f412c71,题焦山寺,李吕,唐,诗,七言古体,水轮依风负坤舆 百川东流同灌输 掀巾之陂莽吞受 沃焦之山初不濡 云根终古插江湖 狂澜滔天随卷舒 空神回飚避突兀 海门排霄岌相扶 僧居蚝山迷向背 佛宇蜃气成吹嘘 昔游玄冬崖壑枯 洪涛溅雨吹裳裾 风来驾潮愁海若 溟涨跋浪飜鲸鱼 羽渊咸池相荡潏 月阿日窟漂方隅 此身浮沤一缘聚 四大湿相弥空虚 针锋悬持妙善住 蚊睫坐睨焦螟居 山中老禅眼於菟 香饭遣化分雕胡 重渊垂涎舞蛟首 方丈宴寝凝薰炉 夜寒黑月照浊水 乞取坏衲摩尼珠,"7,7,7,7,7,7,7,7,7,7,7,7,7,7,7,7,7,7,7,7,7,7,7,7,7,7",792b94f70c61acdd6ebe5f271f0c11fd,水轮 依风 负 坤舆 百 川东 流同 灌输 掀 巾 之 陂 莽 吞受 沃焦 之 山 初 不 濡 云根 终古 插 江湖 狂澜 滔天 随 卷舒 空神 回飚 避 突兀 海门 排霄岌 相扶 僧 居 蚝 山 迷 向背 佛宇 蜃气 成 吹嘘 昔 游 玄冬崖 壑 枯 洪涛 溅 雨 吹 裳 裾 风来驾潮 愁海若 溟 涨 跋 浪 飜 鲸鱼 羽渊 咸池 相 荡 潏 月 阿 日 窟 漂 方隅 此身 浮 沤 一缘 聚 四大 湿 相 弥 空虚 针锋 悬持妙 善住 蚊睫 坐睨 焦螟 居 山中 老 禅 眼 於 菟 香饭 遣化 分雕 胡 重渊 垂涎 舞 蛟 首 方丈 宴寝 凝 薰炉 夜寒 黑 月 照 浊水 乞取 坏 衲 摩尼珠
8bd4945a-5789-4af0-bd59-028b3745ea51,题宋德器致爽轩,李吕,唐,诗,七言古体,将军啸咤风雷生 一诺之宠千金轻 仰头看山默不应 此段王郎真绝人 人言爽气定何物 面目俨然君不识 非氛非祲非烟云 可以意了难口说 子猷拄笏人笑痴 先生作斋人愈疑 但知谈河不救渴 岂信秀色能充饥 千峰横青朝过雨 折简招归入诗句 傥有俗客来叩门 为道我眠卿且去,"7,7,7,7,7,7,7,7,7,7,7,7,7,7,7,7",d88ffc70c1b2a73d73157ea63cd78ab3,将军 啸 咤 风雷 生 一 诺 之 宠 千金 轻 仰头 看山 默不应 此段 王郎真 绝人 人 言 爽气 定 何物 面目 俨然 君不识 非氛 非 祲 非 烟云 可以 意 了 难 口说 子猷 拄 笏 人 笑痴 先生 作 斋 人 愈疑 但 知谈 河 不 救渴 岂信 秀色 能 充饥 千峰 横青 朝过 雨 折简 招 归入 诗句 傥 有 俗客来 叩门 为 道 我 眠 卿 且 去
8cfde9ae-272f-4733-b16f-9d85b1d0c140,沧海行,李吕,唐,诗,杂言,沧海有船不可渡 痴人求仙死不悟 儿郎断乳能几时 忍令万里投蛟螭 儿牵母衣抱父泣 文书催行星火急 楼船一去更不归 至今思家朝夜啼 人生不禁别离苦 但得生存犹一处 君不见咸阳百万家 长城白骨埋泥沙,"7,7,7,7,7,7,7,7,7,7,8,7",f2af7c950683992d0f477d880d8d1847,沧海 有 船 不可 渡 痴人 求仙 死不悟 儿郎 断乳 能 几时 忍令 万里 投 蛟 螭 儿 牵 母衣 抱 父 泣 文书 催 行星 火急 楼船 一去 更 不 归 至今 思家 朝夜 啼 人生 不禁 别离 苦 但 得 生存 犹 一处 君不见 咸阳 百万 家 长城 白骨 埋 泥沙
3dd2e4e4-0371-47ad-b420-cc95674c6810,宿游伯均裕斋夜无蚊蚋熟寐达旦,李吕,唐,诗,七言律诗,处处如雷针在舌 咂肤成群难扑灭 主人作官重膏血 未劳挥拂蚊自绝 荆棘不产茅山旁 天台有菌皆可尝 期君守此化民术 异类尽令回善良,"7,7,7,7,7,7,7,7",b4777ae982881dffdbef4da25e1591bb,处处 如雷 针 在 舌 咂肤 成群 难 扑灭 主人 作官 重 膏血 未 劳挥 拂 蚊 自绝 荆棘 不产 茅山 旁 天台 有 菌 皆 可尝 期 君 守 此 化民术 异类 尽令 回 善良
1ccd2bee-c586-4544-91f2-be5c5f72d464,寄题张道士招真阁,李吕,唐,诗,杂言,君成道 去何许 寂寂空山号行府 自从汉末人相值 因循今莫覩 凄凉古庙落嵓隈 水遶闲庭萦嫩苔 敕令立观奉香火 屈指三十年中来 道士张君见奇古 精力强明奈寒暑 从前观心力勤苦 经画一新旧堂庑 尝闻仙者好楼居 杰阁翚飞接云衢 往来世外隠君子 万一鹤驭停须臾 我劝张君更磨练 莫遣光阴随物转 一朝平步玉皇前 何虑群仙不相面 多少纷纷尘世人 梦中说梦元非真 妙处工夫如会了 千百世界现全身,"3,3,7,7,5,7,7,7,7,7,7,7,7,7,7,7,7,7,7,7,7,7,7,7,7",83471c6d6108a9041a652ce06d7ebc40,君 成道 去 何许 寂寂 空山 号 行府 自从 汉末 人 相值 因循 今莫 覩 凄凉 古庙 落 嵓 隈 水 遶 闲庭 萦 嫩 苔 敕令 立观奉 香火 屈指 三十年 中来 道士 张君见奇 古 精力 强明奈 寒暑 从前 观 心力 勤苦 经画 一 新旧 堂 庑 尝闻 仙者 好 楼 居 杰阁翚飞接云衢 往来 世外 隠 君子 万一 鹤驭停 须臾 我 劝 张君 更 磨练 莫遣 光阴 随物 转 一朝 平步 玉皇 前 何虑 群仙 不 相面 多少 纷纷 尘世 人 梦中说梦 元 非 真 妙处 工夫 如 会 了 千百 世界 现 全身
f066538b-9985-4c15-b488-44f1c3557777,寄赠天台石桥京行人,李吕,唐,诗,七言古体,无心曾看石桥云 有耳曾听石桥水 俗尘未尽难重留 饭麻才竟归心起 自从一别五春风 梦绕桥庵西复东 雀噪亭前听茶鼓 蛇蟠砌外护瓜丛 更忆依人两乌鹊 朝朝飞下映真阁 树鹅土菌恣登盘 林麓素无虫兽恶 江湖迢递皆畏途 谁知世上有华胥 五百开士去虽久 犹余一老能清癯 几年胁背不著席 栋宇增新间金碧 风月忽寄盈尺书 约我重来共晨夕 恨不速驾鸺鹠皮 屈伸臂项款山扉 相逢定作解垢衣 水边石上同茹芝,"7,7,7,7,7,7,7,7,7,7,7,7,7,7,7,7,7,7,7,7,7,7,7,7",b249bd54cdbddb472cc6a2a0c68e5460,无心 曾 看 石桥 云 有 耳 曾 听 石桥 水 俗尘 未尽 难重 留 饭麻 才 竟 归心 起 自从 一别 五 春风 梦 绕 桥 庵 西复东 雀噪 亭 前 听 茶 鼓 蛇蟠 砌 外护瓜 丛 更忆 依人 两 乌鹊 朝朝飞 下映 真阁 树鹅 土菌 恣登 盘 林麓素 无虫兽恶 江湖 迢 递 皆 畏途 谁知 世上 有 华胥 五百 开士 去 虽 久 犹余一老能 清癯 几年 胁 背 不著 席 栋宇 增新 间 金碧 风月 忽 寄 盈尺 书 约 我 重来 共 晨夕 恨 不速 驾 鸺 鹠 皮 屈伸 臂 项款 山扉 相逢 定作 解垢 衣 水边 石上 同 茹芝
e7cc1671-4ba0-4a03-82f2-80d2ac1dbf9f,送赵彦修,李吕,唐,诗,七言古体,六月红尘如火烈 朝来一雨炎威歇 渐看苹末起凉飔 推上冰轮作清绝 王孙叱驭欲何之 直向铨曹射佳阙 天生良才必有用 岂应付与哙等埒 几载低头丐祠禄 岁寒颇获固穷节 傥逢佳士重荐论 平视朝绅可颃颉 顾我幽居苦羞缩 却扫柴门学藏拙 每向水边狎鸥鸟 未遑郊外习绵𫈵 君能脱略时从游 尝鼎一脔端可别 临行尚作半日留 满泛青甆话离别 秋风若遇南飞鸿 好寄一声慰骚屑,"7,7,7,7,7,7,7,7,7,7,7,7,7,7,7,7,7,7,7,7,7,7",b12d4851e8100157b45aaeccd3dcc6f4,六月 红尘 如 火烈 朝 来 一 雨炎威 歇 渐 看 苹末 起 凉 飔 推上 冰轮 作清 绝 王孙 叱驭欲何 之 直 向 铨 曹射佳 阙 天生 良才 必有用 岂 应付 与 哙 等 埒 几载 低头 丐 祠 禄 岁寒 颇 获固 穷节 傥 逢 佳士 重荐论 平视 朝绅 可颃 颉 顾 我 幽居 苦 羞缩 却 扫 柴门 学 藏拙 每 向 水边 狎 鸥鸟 未 遑 郊外 习绵 𫈵 君能 脱略 时 从 游 尝鼎一脔 端 可别 临行 尚作 半日 留 满 泛 青 甆 话 离别 秋风 若遇南 飞鸿 好 寄 一声 慰 骚屑
8f58d8fe-9362-40dd-88f2-231fc0640262,承德功仙尉出示直翁感兴之作辄次其韵,李吕,唐,诗,七言古体,蝇头蜗角使人愁 贪先务胜如争舟 隠心空逐市朝乐 著眼未省林泉幽 尘埃平时正汩没 出处与世相沉浮 由径反诮澹台子 拔葵仍笑公仪休 怀哉古道久寂寞 凤鸟不至三千秋 孰知名教真乐地 徒以得失为己忧 骑马四驰失其驭 放豚一去何当求 羡君渊源得所自 结交道义相追游 个中有路傥深造 直与古人为辈流,"7,7,7,7,7,7,7,7,7,7,7,7,7,7,7,7,7,7",5f335881be321fa886612630990e63b5,蝇头蜗角 使 人 愁 贪先务胜如争舟 隠 心 空 逐 市 朝 乐 著眼 未 省 林泉 幽 尘埃 平时 正 汩没 出处 与 世相 沉浮 由 径 反 诮 澹台 子 拔葵 仍 笑 公仪 休 怀哉 古道 久 寂寞 凤鸟 不 至 三 千秋 孰知 名教 真乐 地 徒 以 得失 为己 忧 骑马 四驰失其驭 放豚 一 去 何 当求 羡 君 渊源 得所 自 结交 道义 相 追游 个 中 有 路 傥 深造 直 与 古人 为 辈流
914122ce-64ed-4cb4-ac66-d3b232d3513c,贺吴守被召,李吕,唐,诗,七言古体,吴公骨秀如天人 胸襟落落皆经纶 少年固已富家学 筮仕聊称梅子真 挽弓驰马特余事 智勇未减飞将军 向者长汀初拥节 寇攘聚集惊乡村 谁知抚定有长策 不戮一夫令自新 稚耋讙呼弛兵革 至今妥贴无叛民 移帅赣川尤镇静 宿奸褫魄胥崩奔 往年群盗号渊薮 一旦荒垄安锄耘 钱流地上非横索 铃斋坐啸生阳春 践更盘错威望著 素秉公廉政有神 贪吏望风争解去 冤民在处皆获伸 还家坐席曾未煖 迅召连催已在门 或人未免巧求誉 我公特立天下闻 厥今器识兼文武 倒指谁欤当此举 江淮百万屯边兵 转输馈饷倾吴楚 中原荆棘今几年 师老不试漫貔虎 陛下翻然采舆论 天意可见公宜处 裴度指日平蔡州 充国先零岂难取 唾手燕云会有时 伫看大将建旗鼓 勒功异域鄙班超 归佐熙朝作申甫,"7,7,7,7,7,7,7,7,7,7,7,7,7,7,7,7,7,7,7,7,7,7,7,7,7,7,7,7,7,7,7,7,7,7,7,7,7,7,7,7",0280d7cfe91c070e94161f12fefee5d1,吴公骨秀 如天 人 胸襟 落落 皆 经纶 少年 固 已 富家 学 筮 仕 聊称 梅子 真 挽 弓 驰马 特余 事 智勇 未 减 飞将军 向者 长汀 初 拥节 寇攘 聚集 惊 乡村 谁知 抚定 有 长策 不戮 一夫 令自新 稚耋 讙 呼 弛 兵革 至今 妥贴 无叛 民 移帅 赣川 尤 镇静 宿奸 褫魄 胥 崩 奔 往年 群 盗号 渊薮 一旦 荒 垄安 锄 耘 钱 流 地上 非 横索 铃斋 坐啸 生 阳春 践 更 盘错 威望 著 素 秉公 廉政 有神 贪吏 望风 争解 去 冤民 在 处 皆 获伸 还 家 坐席 曾未 煖 迅 召 连 催 已 在 门 或 人 未免 巧求誉 我 公 特立 天下 闻 厥 今 器识 兼 文武 倒 指 谁 欤 当 此举 江淮 百万 屯 边兵 转输 馈饷 倾 吴楚 中原 荆棘 今 几年 师老 不 试漫 貔虎 陛下 翻然 采 舆论 天意 可见 公宜 处 裴度 指 日 平蔡州 充国 先 零 岂 难取 唾手 燕云会 有时 伫看 大将 建 旗鼓 勒 功 异域 鄙 班超 归佐 熙朝作 申甫
be9e552e-90c0-471f-9ff0-9e0f7072f1a8,送黄仲甄赴廷试,李吕,唐,诗,七言古体,我昔尝为东南行 烦君载酒送城阈 酒阑上马意恻怆 似叹飞沉异鳞翮 我言君岂哙等伍 霜蹄偶蹶未为失 整衔易辔便千里 宁比驽骀才寸尺 转头日月曾几何 君已声名满蟾窟 笑呼扁舟下吴会 去意猛作秋鹰掣 君家艺德知何年 弟兄头角俱突兀 仙枝万丈不供折 人家生子叹豚犊 春归洲渚波面肥 江神为君好风日 君王正御紫宸朝 蜀士半居青琐闼 牵联即日九天上 判司卑凡等厮役 向来于我作鱼羡 吾今洗眼看鹏击 人生行止特未定 遇坎乘流听造物 唯有名节不可污 与君相期保黄发,"7,7,7,7,7,7,7,7,7,7,7,7,7,7,7,7,7,7,7,7,7,7,7,7,7,7,7,7",b98a65d2b6f12fe8839ef76cfd2514e5,我 昔 尝为 东南 行 烦 君 载 酒 送 城阈 酒 阑 上马 意 恻 怆 似 叹 飞沉异 鳞 翮 我 言 君 岂 哙 等 伍 霜 蹄 偶蹶未为失 整衔 易辔 便 千里 宁比 驽骀 才 寸 尺 转头 日月 曾 几何 君 已 声名 满 蟾窟 笑呼 扁舟 下 吴 会 去 意猛 作秋 鹰 掣 君家 艺德 知 何年 弟兄 头角 俱 突兀 仙枝 万丈 不供 折 人家 生子 叹 豚犊 春 归洲渚波 面肥 江神 为 君 好 风日 君王 正 御 紫宸 朝 蜀士 半居青 琐 闼 牵联 即日 九天 上 判司 卑凡 等 厮役 向来 于 我 作鱼 羡 吾 今 洗 眼看 鹏 击 人生 行止 特 未定 遇 坎 乘流 听 造物 唯有 名节 不可 污 与 君 相期 保黄 发
7692c584-9758-47b6-97a2-d7da10b0261a,和韩羲仲主簿古岩韵,李吕,唐,诗,杂言,君不见版筑当年胥靡徒 貌象忽与帝梦符 卧龙抱膝吟梁甫 霸主不惮三顾庐 又不见形模苦遭妇女笑 袖手不解世俗书 碧山幽栖载典籍 银鱼焚弃甘林居 出处虽云兰菊异 道则一贯无二途 要之穷通有定分 所学岂以世俗拘 一旦风云合际会 坐令四海如唐虞 不用山林并容尔 胸中经济常自如 世间余子真碌碌 得失交病言嗫嚅 生前雅志一饱足 趋时妩媚忘远图 夫君承平相家子 典刑自与今人殊 青春已负老成器 白日兀坐圣贤俱 腹笥兼收线五色 准拟补衮膺时须 豹变要是有毛质 鹏飞九万看抟扶 古岩风月镇长好 请著斯名镵座隅,"10,7,7,7,10,7,7,7,7,7,7,7,7,7,7,7,7,7,7,7,7,7,7,7,7,7,7,7,7,7",efb65fd6eabf26ab6b0f8ecdbf328639,君不见 版筑 当年 胥靡 徒 貌 象 忽 与 帝梦符 卧龙 抱 膝 吟 梁甫 霸主 不惮 三顾 庐 又 不见 形模 苦 遭 妇女 笑 袖手 不解 世俗 书 碧山幽 栖载 典籍 银鱼 焚弃 甘林 居 出处 虽 云兰 菊异 道 则 一贯 无二途 要之 穷通 有定 分 所学 岂 以 世俗 拘 一旦 风云 合 际会 坐令 四海 如唐 虞 不用 山林 并 容尔 胸中 经济 常 自如 世间 余子真 碌碌 得失 交病 言 嗫嚅 生前 雅志 一 饱足 趋时 妩媚 忘 远图 夫君 承平 相家子 典刑 自 与 今人 殊 青春 已 负 老 成器 白日 兀 坐 圣贤 俱 腹 笥 兼收 线 五色 准拟 补 衮 膺 时 须 豹 变 要是 有 毛质 鹏飞 九万 看 抟 扶 古岩 风月 镇长 好 请著 斯名 镵 座 隅
0096ccc4-eaf0-4404-bb0b-00f718bbe2ae,登赋堂,李吕,唐,诗,七言古体,紫云之山几千丈 势压岷峩欲争长 茫茫巨浸擘山开 万穴鱼龙寄深广 眼明遥见使君家 华堂夜魄栖簷牙 手钓峡流揖峰翠 裾珮缥缈凌云霞 仲宣登楼炫能赋 字字悲啼叹飘寓 他人有心予忖之 魏夺刘倾渠不顾 使君胸著万卷书 向来游戏从鱼符 拂衣归卧唤不出 但有忧国心鬰纡 日落未落飞鸟灭 却立阑干思横发 一川樵牧歌太平 万古关河感亡国 丽词落纸焕黼裳 细研物变穷天藏 凭谁荐之九天上 我无羽翮不得将 公乎岂久榛棘下 狗监犹能援司马 子虚大人何足云 愿赋蒸民追大雅,"7,7,7,7,7,7,7,7,7,7,7,7,7,7,7,7,7,7,7,7,7,7,7,7,7,7,7,7",7594e50f934bda66fb5c556ef50df478,紫云 之山 几 千丈 势压 岷 峩 欲 争长 茫茫 巨 浸 擘 山 开 万 穴 鱼龙 寄 深广 眼明 遥见 使君 家 华堂 夜 魄 栖 簷 牙 手 钓峡 流揖 峰翠 裾 珮 缥缈 凌 云霞 仲宣 登楼 炫能 赋 字字 悲啼 叹 飘 寓 他人 有心 予忖 之 魏夺 刘倾渠 不顾 使君 胸著 万卷书 向来 游戏 从 鱼符 拂衣 归卧唤不出 但 有 忧国 心 鬰 纡 日落 未落 飞鸟 灭 却立 阑干 思横 发 一川 樵 牧歌 太平 万古 关河 感 亡国 丽 词 落 纸 焕 黼 裳 细 研物 变 穷 天藏 凭 谁荐 之 九天 上 我 无 羽 翮 不得 将 公乎 岂 久 榛棘 下 狗监 犹能 援 司马 子虚 大人 何足云 愿赋 蒸民 追 大雅
8aed6805-d99f-423a-9579-8b911061d76f,次韵令裕言诗,李吕,唐,诗,七言古体,寓形宇宙有感发 无一不可供诗眸 风花浩荡百变态 草木荣悴皆穷搜 浑成功括造化窟 未辞斧凿孰为优 要当险易随地出 或平或激如水流 不才正自困讥骂 白璧为赠非所求 自怜不具正法眼 解颐安足论赓酬,"7,7,7,7,7,7,7,7,7,7,7,7",cadcf345f4076da9c4beb4a4339b9a5a,寓形 宇宙 有 感发 无 一 不可 供诗 眸 风花 浩荡 百 变态 草木 荣悴 皆 穷 搜 浑 成功 括 造化 窟 未 辞 斧凿 孰 为 优 要 当 险易 随地 出 或 平 或 激如 水流 不 才 正 自困 讥骂 白璧 为 赠非 所求 自怜 不具 正 法眼 解颐 安足 论 赓 酬
f94a67e0-2267-40ea-b3fe-2e9e2bbd132d,自临州还题杉岭舖,李吕,唐,诗,七言律诗,自西徂东三百里 还闽入浙半月期 人生奔走遽如许 世路险夷当自知 造化密移真戏尔 富贵时来则为之 盱盱睢睢亦何益 磊磊落落真大奇,"7,7,7,7,7,7,7,7",b0578279bedfa7580ff6b313b125dc58,自西 徂 东 三百里 还 闽入浙 半月 期 人生 奔走 遽 如许 世路险 夷 当 自知 造化 密移 真戏 尔 富贵 时 来 则 为 之 盱盱 睢 睢 亦 何 益 磊磊落落 真大奇
9b97e871-dd56-44da-a6b3-4b1aee52fe94,送仲秉赴廷试五首  其一,李吕,唐,诗,五言律诗,乱石搜琮璧 修梧待凤凰 地灵真间阔 世眼但寻常 我友更谁子 平生唯此郎 连城不当价 容易莫商量,"5,5,5,5,5,5,5,5",d252c91075fa69d3e347065adde3cb73,乱石 搜 琮 璧 修梧 待 凤凰 地灵 真间 阔 世眼 但 寻常 我友 更 谁 子 平生 唯此郎 连城 不当 价 容易 莫 商量
6e065232-9a5d-42e4-a39e-f0abb99ea7bd,送仲秉赴廷试五首  其二,李吕,唐,诗,五言律诗,雾豹文章异 渊鲸爪角雄 荒陂寒泣露 空谷暮号风 突起能无意 平沉未分穷 不知貂冕地 冷砚破窗中,"5,5,5,5,5,5,5,5",3bc507c4d29a1dda9ac89e249b2feb0f,雾 豹 文章 异 渊 鲸 爪 角雄 荒 陂 寒 泣 露 空谷 暮号 风 突起 能 无意 平沉 未 分穷 不知 貂冕 地 冷砚破 窗中
3b4fa1ba-040e-4d88-baa2-d67ae6bd3e2a,送仲秉赴廷试五首  其三,李吕,唐,诗,五言律诗,欲献琅玕腹 君诗有宿盟 云天宸极邃 日月衮衣明 太守荐何武 诸公倾贾生 三山移步到 寄语问玄卿,"5,5,5,5,5,5,5,5",dd7c2ba0d9b97d7fc26c0e72103b9eb6,欲 献 琅玕 腹 君 诗 有 宿盟 云天 宸 极邃 日月 衮 衣 明 太守 荐 何武 诸公 倾 贾生 三山 移步 到 寄语 问 玄卿
ea51b9b2-beb7-4a68-987f-21a7e93d18ed,送仲秉赴廷试五首  其四,李吕,唐,诗,五言律诗,一元谁破碎 河洛漏微芬 星斗昭干纬 葩华粲地文 班扬浑细事 伊傅有殊勋 补履非神剑 相期敬所闻,"5,5,5,5,5,5,5,5",da68077c18df58dd3d431b0f75eb3f86,一元 谁 破碎 河洛 漏微 芬 星斗 昭干 纬 葩 华 粲地 文 班扬浑 细事 伊傅 有 殊勋 补 履非 神剑 相期 敬所闻
f315ef2c-0eb5-4674-8b14-35122ecfe250,送仲秉赴廷试五首  其五,李吕,唐,诗,五言律诗,元龙湖海士 可但著茅庐 诗老经从地 禹功疏凿余 蜀峰帆影隔 郢树鸟行疎 太史行天下 归来好著书,"5,5,5,5,5,5,5,5",55d418729cf79cd133eb762c10873f58,元 龙湖 海士 可但 著 茅庐 诗老 经从 地 禹功 疏凿 余 蜀峰 帆影 隔 郢 树 鸟 行 疎 太史 行天下 归来 好 著书
9be726a8-23b9-427c-ac68-bef49a4c56a5,挽昭怀皇后诗二首  其一,李吕,唐,诗,五言律诗,㡛御还龟洛 祎衣閟鲋隅 光华随渭水 巡狩隔苍梧 已卜先朝祔 旋闻反寝虞 昭怀千载谥 不朽在椒涂,"5,5,5,5,5,5,5,5",8e7ba4fa5ebe350080b78e52924f6b02,㡛 御 还 龟洛 祎 衣 閟 鲋 隅 光华 随 渭水 巡狩 隔 苍梧 已卜 先 朝 祔 旋闻 反寝 虞 昭怀 千载 谥 不朽 在 椒 涂
f4a6a26e-72be-4428-a333-4662166880e2,挽昭怀皇后诗二首  其二,李吕,唐,诗,五言律诗,愍册哀荣绝 鲜原卜兆安 世家金穴旧 大隧玉衣寒 何意簪花柰 空遗刈畹兰 神游泰陵庙 永护月衣冠,"5,5,5,5,5,5,5,5",76ac0c0f096b71e68507812a9beedcaf,愍 册 哀荣 绝 鲜原 卜兆安 世家 金穴 旧 大 隧 玉衣 寒 何意 簪花 柰 空 遗 刈 畹兰 神游 泰陵 庙 永护 月 衣冠
6cb1b7a2-fc71-4eea-a7db-2370337db55a,次涪陵游北岩寺伊川谪居尝传易于此有钩深堂鲁直名且书之故寺有四贤像伊川鲁直康节尹和靖,李吕,唐,诗,五言律诗,隔江定佳处 放艇得幽寻 直上云根径 尽行霜叶林 昔人非避世 此地可钩深 何物能熏染 幽禽亦好音,"5,5,5,5,5,5,5,5",c7027a1b292a0e0dc7702de544fa4456,隔江定 佳 处 放艇 得幽 寻 直上 云根 径 尽行 霜叶 林 昔人 非 避世 此地 可钩 深 何物 能 熏染 幽禽 亦 好 音
3a28711c-fadf-46f8-8a82-9673dc251082,癸丑季春上洲颓岸出败冢冢中有砖云元嘉二十二年七月二十六日余功曹冢后世子孙长兴富贵宜赊因题数句,李吕,唐,诗,五言律诗,八百年前窆 功曹身姓余 元嘉两行字 败甓八分书 富贵念犹在 子孙今已无 痴人不修省 视此意何如,"5,5,5,5,5,5,5,5",4bec8412274b2e16cc7c798412f61c61,八百年 前 窆 功 曹 身姓 余 元嘉 两行 字 败 甓 八分 书 富贵 念 犹 在 子孙 今 已 无 痴人 不 修 省 视此意 何如
3fc14b7b-fc6b-4c79-90b6-1d8c2bb7eff9,丁巳三月送周宰行,李吕,唐,诗,五言律诗,中郎宜有后 余庆在孙枝 学术堪时用 公卿半已知 五行人鲜俪 四字格尤奇 自此官清要 毋忘老布衣,"5,5,5,5,5,5,5,5",dff7044817c093bdff824eacccc51f03,中郎 宜 有 后 余庆 在 孙枝 学术 堪 时用 公卿 半 已知 五行 人 鲜俪 四 字格 尤奇 自此 官 清要 毋忘 老 布衣
f60114b1-f1a6-4924-87fe-48ebcba7a507,予一病七十日心事牢落作诗自解,李吕,唐,诗,五言律诗,抱病懒巾栉 自度作黄冠 披褐襟便短 拖鞋步稍安 忘机任俗薄 遮眼把书看 未必不为福 善乎能自宽,"5,5,5,5,5,5,5,5",f5eb5fea513f42029a7d8590c0cd62a6,抱病 懒 巾 栉 自度 作 黄冠 披褐襟 便 短 拖鞋 步 稍安 忘 机任 俗 薄 遮眼 把 书 看 未必 不为 福 善乎 能 自 宽
a39bdcf3-6b8d-470e-8f67-f0e900af4874,多病,李吕,唐,诗,五言律诗,守静偏多病 争先素不能 材非经世具 分合出家僧 利路防深穽 穷居任曲肱 息交休扰扰 藏拙要儚儚,"5,5,5,5,5,5,5,5",bee60f8ae7f322cc1787282693ccfa37,守静 偏 多 病 争先 素 不能 材非 经世 具 分 合 出家 僧 利路 防 深 穽 穷 居任 曲肱 息 交休 扰扰 藏拙 要 儚 儚
15f9d182-6bdb-483c-90f2-73370c0cd22f,游希夷观  其一,李吕,唐,诗,五言律诗,秘馆白云边 来游记昔年 黄冠姿槁甚 败屋意萧然 访古知僊裔 看碑识汉镌 危栏聊徙倚 风袂欲翩翩,"5,5,5,5,5,5,5,5",02f2cdc1c27f66d871a04769dfd72a0b,秘馆 白云 边 来 游记 昔年 黄冠姿 槁 甚 败屋 意 萧然 访古 知 僊 裔 看 碑识 汉 镌 危栏 聊 徙倚 风袂欲 翩翩
02c88ec5-df5f-44b3-9dd2-970276e78ffb,游希夷观  其二,李吕,唐,诗,五言律诗,枫老丹成叶 芦轻雪作花 晚风何处笛 疏柳欲栖鸦 绝壁生虚霭 晴天点片霞 莫教残酒醒 客里易思家,"5,5,5,5,5,5,5,5",f59dbf6b848e787c9ebb42b376d310c9,枫 老丹成 叶 芦轻雪 作花 晚风 何处 笛 疏 柳欲栖 鸦 绝壁 生虚霭 晴天 点 片 霞 莫教 残 酒醒 客里易 思家
15d5af64-c8ad-459a-8322-08534c2e9116,遣兴,李吕,唐,诗,五言律诗,天浄鸟飞远 路幽花自香 春风吹草木 野水满池塘 事去青山在 人闲白日长 兴来搔白发 微意久难忘,"5,5,5,5,5,5,5,5",7075c550b4012ae46c052f5df7043ab1,天 浄 鸟 飞 远 路幽花 自 香 春风 吹 草木 野水 满 池塘 事去 青山 在 人 闲 白日 长 兴来 搔 白发 微意久 难忘
