id,title,author,dynasty,genre,poem_type,sentences_simplified,meter_pattern,hash,words
350efff4-14ed-4a6b-b222-631b629e61bc,书龙寿寺煮泉亭壁  其二,李彭,唐,诗,五言律诗,客里多岑寂 寻春兴独賖 擎来妙喜叶 尽属法王家 不见青鞋士 来煎黑面茶 幽怀在天末 落日更鸣鸦,"5,5,5,5,5,5,5,5",64c1d6a20c46faf03b6a05c1a806614b,客里 多 岑寂 寻春兴 独 賖 擎来 妙喜叶 尽 属 法王 家 不见 青 鞋士 来 煎 黑面 茶 幽怀 在 天末 落日 更 鸣 鸦
f7f6b737-7b3c-4a9e-9740-cb2237e86b17,昙珠昙规二禅者归湖外乞诗二首  其一,李彭,唐,诗,五言律诗,淑气纷花药 喧风乐鸟乌 山僧来访别 稚子竟传呼 喷玉渥洼种 行沙沧海珠 湘天多过雁 能寄尺书无,"5,5,5,5,5,5,5,5",2530749c4654c2ea37e352f508eedbc5,淑气 纷 花药 喧风乐鸟乌 山僧 来访 别 稚子 竟 传呼 喷玉 渥洼 种 行沙 沧海 珠 湘 天 多 过雁 能 寄 尺书 无
7fecb8a0-5417-471e-9160-b7ec6e721408,昙珠昙规二禅者归湖外乞诗二首  其二,李彭,唐,诗,五言律诗,独秀峰前见 林间忆语离 游观如昨梦 换谢若晨炊 柳絮飞千尺 残阳隐半规 打包湖外去 探道就钳搥,"5,5,5,5,5,5,5,5",781857d1b13cbd38fdfaf929c87c25f8,独秀峰 前见 林间 忆语 离 游观 如 昨 梦 换谢 若 晨炊 柳絮飞 千尺 残阳 隐半规 打包 湖外 去 探道 就 钳 搥
0c5b7bd6-ceca-4f82-ab48-dc9cf2884005,西塔,李彭,唐,诗,五言律诗,秋山何秀整 风磴颇峥嵘 寺古残僧病 门深旧犬迎 崖蜂将割蜜 涧鸟自呼名 毳衲典刑在 萧然物外情,"5,5,5,5,5,5,5,5",3d1b7ff4b9b16f24b8dddb7ceec3961c,秋山 何秀 整 风 磴 颇 峥嵘 寺 古残僧 病 门 深 旧 犬 迎 崖 蜂 将 割 蜜 涧 鸟 自 呼名 毳 衲 典 刑 在 萧然物外 情
e771c609-9cd3-499a-9139-f3d77d139b55,病起过邻寺,李彭,唐,诗,五言律诗,惯作招提客 应非拖玉身 一年强半病 十畞未全贫 孝秀乡闾盛 朝颁符瑞频 不妨幽仄里 高卧姓庞人,"5,5,5,5,5,5,5,5",6e023dcec1eaf9db555198aa72e9b6f6,惯作 招提 客 应非 拖 玉身 一年 强 半病 十 畞 未 全 贫 孝秀乡闾盛 朝 颁 符瑞 频 不妨 幽仄 里 高卧 姓 庞人
6965b249-ac96-4ff7-ab20-18f89c0aa378,封氏野老留饮看白兔是晚微雪,李彭,唐,诗,五言律诗,封老朱颜在 髯髯已白须 酌醪招倦客 唤妇煮肥鲈 玉兔君家有 银甖客舍无 醉余看舞雪 未觉客情孤,"5,5,5,5,5,5,5,5",fdf077ba13681fc34890a495c6c8a595,封老 朱颜 在 髯 髯 已 白须 酌 醪招 倦 客 唤 妇 煮 肥 鲈 玉兔 君家 有 银 甖 客舍 无 醉 余 看 舞雪 未觉 客情 孤
c0bfc0f9-5c18-4f00-85c1-aa387ac6aff3,登无相绝顶旧有东坡题字今不复见,李彭,唐,诗,五言律诗,深云蒙无相 斜日照崔嵬 惨澹天梯往 苍茫地势开 巾裾拂河汉 谈话杂风雷 惆怅银钩处 归来首重回,"5,5,5,5,5,5,5,5",a0c128d71e6a8e4bfe2abe06a33b1c92,深 云 蒙无相 斜 日照 崔嵬 惨 澹 天梯 往 苍茫 地势 开 巾 裾 拂 河汉 谈话 杂 风雷 惆怅 银钩 处 归来 首 重回
03c26a46-1cc3-498c-be04-eab03e05df1e,次九弟韵兼怀师川二首  其一,李彭,唐,诗,五言律诗,抱瘵便秋晚 加餐喜岁丰 幽怀乌鸟乐 世故马牛风 坯户寒虫急 安巢野老同 年来百念冷 顿悟众缘空,"5,5,5,5,5,5,5,5",633dcb5086fcd2b0e273de1830a2025d,抱 瘵 便 秋晚 加餐 喜岁 丰 幽怀 乌鸟乐 世故 马牛风 坯户 寒虫 急 安巢 野老 同 年来 百念 冷 顿悟 众缘 空
76f8f1ea-e39d-4362-b035-1e92d69c4700,次九弟韵兼怀师川二首  其二,李彭,唐,诗,五言律诗,鸡回落雁渚 菊带傲霜华 稍过郊墟雨 犹鸣官地蛙 层空听隼击 俯杖看蜂衙 妙趣谁能解 怀人天一涯,"5,5,5,5,5,5,5,5",2211f00ba2222fa342653f607d034e70,鸡 回落 雁渚 菊带 傲霜华 稍 过 郊 墟 雨 犹鸣 官地 蛙 层空 听 隼 击 俯 杖 看 蜂 衙 妙趣 谁 能 解 怀人 天一 涯
9543950b-b84e-4ca6-a538-8160ac959816,次文虎韵戏晖书记,李彭,唐,诗,五言律诗,孤舟泛湛水 心法已圜融 诗律期三昩 庵居役二空 住山须拙斧 阅世任寒蓬 慢着寻幽履 雪泥殊未通,"5,5,5,5,5,5,5,5",d6066dcc59d07f3e11a3ca7b83533a62,孤舟 泛 湛水 心法 已 圜融 诗律 期三 昩 庵 居役 二 空 住山 须 拙 斧 阅世 任寒蓬 慢 着 寻幽履 雪泥 殊 未通
a69627a5-1fd2-447e-8c36-f71e604f84c0,次九弟韵后篇戏奉世十一弟二首  其一,李彭,唐,诗,五言律诗,少成怜季子 拔俗似安丰 逸气期公干 钩深似国风 未须轻小伎 著意要参同 聊语诗家病 尘窗研滴空,"5,5,5,5,5,5,5,5",0b2ca4c1473d82cb3aa696a729502d34,少 成怜 季子 拔 俗似 安丰 逸气 期 公干 钩 深似 国风 未须 轻小 伎 著意 要 参同 聊语 诗家 病 尘窗 研滴空
e3008771-0d83-40a7-b46d-06e43c12d9c9,次九弟韵后篇戏奉世十一弟二首  其二,李彭,唐,诗,五言律诗,莫学中郎将 休怀阴丽华 三余游竹素 两部有鸣蛙 乃肻亲庞老 多情过押衙 吾衰那复此 羡尔乐无涯,"5,5,5,5,5,5,5,5",0408ad80a38f2931983b42fede73a946,莫学 中郎将 休怀 阴丽华 三余 游竹素 两部 有 鸣 蛙 乃 肻 亲 庞 老 多情 过押 衙 吾 衰 那 复 此 羡 尔 乐 无涯
91f41563-0049-4e56-8e66-2311b7da1284,戏赠,李彭,唐,诗,五言律诗,王谢风流在 星星映角巾 属文无少尽 结社有迂轮 颇作餐霞侣 愿充观国宾 径须呼伯雅 且入醉乡春,"5,5,5,5,5,5,5,5",c21e1be21a563c1634bc5ac2867be685,王谢 风流 在 星星 映 角巾 属 文无少 尽 结社 有 迂 轮 颇 作餐 霞侣 愿 充观 国宾 径须 呼伯雅 且 入 醉乡 春
7752e720-8597-4f6b-845c-15025f7b5b29,赠邹中美,李彭,唐,诗,五言律诗,盛汉数邹阳 云孙复擅场 笋舆逢鹿苑 蜡屐绕羊膓 囊有壶公药 炉多荀令香 麻姑在乡国 期子共徜佯,"5,5,5,5,5,5,5,5",76abd8010a44dfba9298747aeff3b1db,盛汉数 邹阳 云孙复 擅场 笋舆 逢 鹿苑 蜡屐 绕 羊 膓 囊 有 壶 公药 炉 多 荀令香 麻姑 在 乡国 期子 共 徜佯
f60e4d47-5bdd-49c0-959f-9f79c689bc32,赠晖书记晖有伯时所画马甚奇,李彭,唐,诗,五言律诗,脱尽膏粱气 秖余云壑姿 囊中支遁马 笔下惠休诗 木末鸟还语 花边蝶浪窥 平章赖公等 吾病不能奇,"5,5,5,5,5,5,5,5",276dd44ac1fab0c0f610f6ea014c151f,脱尽 膏粱 气 秖 余 云 壑 姿 囊中 支遁 马 笔下 惠休诗 木末鸟 还 语 花边 蝶浪 窥 平章 赖公 等 吾 病 不能 奇
b4a8eac6-cd1e-416c-98c1-284a381909e2,闻官军已临贼境,李彭,唐,诗,五言律诗,闻道官军至 戈鋋压贼壕 鼎鱼犹未腐 穴兔竟何逃 锐气连全楚 皇恩贷尔曹 洗兵无复用 欢喜荐春醪,"5,5,5,5,5,5,5,5",67c5c56d75f076ee97a70d68234f4ec0,闻道 官军 至 戈鋋压贼壕 鼎鱼犹未腐 穴 兔 竟何 逃 锐气 连全楚 皇恩 贷 尔曹 洗兵 无 复用 欢喜 荐 春 醪
375079e4-208b-44e8-8e95-3baeb26b0d6a,次韵九弟游云居,李彭,唐,诗,五言律诗,禁足同僧夏 秋风倚杖前 扪萝怀鸟道 著屐到壶天 霜月悬崖腹 参旗落枕边 营诗嗟锦尽 老语不须传,"5,5,5,5,5,5,5,5",c96d71727abdc02b9386433832706987,禁足 同僧夏 秋风 倚 杖 前 扪萝 怀 鸟 道 著屐 到 壶 天 霜月 悬崖 腹 参旗 落 枕边 营诗 嗟锦尽 老语 不须 传
bd00bc92-0c98-4912-9a1c-a3af92cd2fb6,夜坐闻橹,李彭,唐,诗,五言律诗,日斜喧急雨 雨夜候虫秋 宴坐游三昩 因人吟四愁 疏林月色好 别渚橹声幽 却忆秦淮上 寒更渡小舟,"5,5,5,5,5,5,5,5",dcc52393372b8d3401e9852503a90e8e,日 斜 喧急雨 雨夜 候虫秋 宴 坐 游三 昩 因 人 吟 四 愁 疏林 月色 好 别渚橹 声 幽 却 忆 秦淮 上 寒 更 渡 小舟
020a5767-0609-4767-8601-f35ba74aaa6d,自云居归欲到瑶田作,李彭,唐,诗,五言律诗,稍上参云汉 中藏祗树园 烟横迷远屿 鸟度失孤村 一岭分晴雨 半山才晏温 回头听梵呗 真是欲忘言,"5,5,5,5,5,5,5,5",cab06dfe6dd5bd9d7c9411cee1e952c8,稍上 参 云汉 中藏 祗 树园 烟 横迷 远屿 鸟度 失孤 村 一 岭 分 晴雨 半山 才 晏温 回头 听 梵呗 真是 欲 忘言
6e76d7f6-8ce0-4006-b528-c2950e2318c1,绝章水,李彭,唐,诗,五言律诗,春水静游浪 晚吹怒生涛 归兴催舟楫 惊魂寄桔橰 留髠忽忘故 访戴敢辞劳 推挽柁师力 令人愧尔曹,"5,5,5,5,5,5,5,5",a949358ca87b6e5bb86affb1ae4763fa,春水 静游浪 晚 吹 怒生涛 归兴 催 舟楫 惊魂 寄 桔 橰 留 髠 忽 忘 故 访戴 敢辞 劳 推挽 柁 师力 令人 愧 尔曹
eed658f3-a9bb-481b-8990-67b593960c78,哭李少微三首  其一,李彭,唐,诗,五言律诗,应刘玉山陨 之子尚玙璠 未握论交臂 俄招去干魂 茂陵有遗藁 健妇解持门 何日生刍奠 人琴恐或存,"5,5,5,5,5,5,5,5",0ccd6ffeca563486910ffe288ee1ee74,应 刘 玉山 陨 之 子尚 玙 璠 未握 论 交臂 俄 招去 干魂 茂陵 有 遗 藁 健妇 解持 门 何日 生刍 奠 人琴 恐或 存
ce44d373-4a90-4d93-90fe-a17769a63861,哭李少微三首  其二,李彭,唐,诗,五言律诗,评阙汝南旦 穷嗟校尉途 故交非浪哭 吾道恐成孤 往在谈文处 还能步屧无 秋风聊倚杖 草树日疏芜,"5,5,5,5,5,5,5,5",dc50617b54fca0be34f155391705158f,评阙 汝南 旦 穷 嗟 校尉 途 故交 非 浪 哭 吾 道 恐 成 孤 往在 谈 文处 还 能步 屧 无 秋风 聊 倚 杖 草树 日 疏芜
ca7165d2-c348-4208-9045-22e4e251657c,哭李少微三首  其三,李彭,唐,诗,五言律诗,我客齐安岁 君官汾上春 安知濒鬼录 不作定交人 炀灶中郎满 鬬鸡开府频 如何令王济 清血染衣巾,"5,5,5,5,5,5,5,5",516e0b87bf5ce15f49d5cd1928828345,我 客 齐安 岁 君官汾 上春 安知 濒 鬼 录 不 作定 交人 炀 灶 中 郎 满 鬬 鸡 开府 频 如何 令王 济 清 血染 衣巾
866481e8-a321-4b67-9cd5-a233d677bd1e,次韵东坡五更山吐月  其一,李彭,唐,诗,五言律诗,一更山吐月 修木莹澄澜 全胜西园夜 金覊带笑看 团栾照坐好 倚徙冰人寒 缥瓷倾竹叶 何必办狼残,"5,5,5,5,5,5,5,5",3ec5401a8fcc83cc2ae0e5182b7982ef,一更山吐 月 修木莹 澄 澜 全胜 西园 夜 金 覊 带笑 看 团 栾照 坐 好 倚 徙 冰人 寒 缥瓷 倾 竹叶 何必 办狼 残
d24884ed-0af5-4f93-8478-cb1172c86a09,次韵东坡五更山吐月  其二,李彭,唐,诗,五言律诗,二更山吐月 寂寂山家夜 衰翁葆鬓湿 衡移复露下 泠泠泉可潄 冉冉云可藉 相携尘外人 共说无生话,"5,5,5,5,5,5,5,5",6dadef56c430224783375a0739cdfd4f,二 更 山 吐 月 寂寂 山家 夜 衰翁 葆 鬓 湿 衡移 复露 下 泠 泠 泉 可 潄 冉冉 云 可藉 相携尘 外人 共 说 无生话
2bd51195-09d5-4020-92bc-9debddbd5795,次韵东坡五更山吐月  其三,李彭,唐,诗,五言律诗,三更山吐月 无睡客还起 风微一铎鸣 历历正谈此 此身如传舍 幽怀湛秋水 兹游共昔游 定非聊尔尔,"5,5,5,5,5,5,5,5",3b6cda24f1bc01bf25a650aa5dbb9728,三 更 山 吐 月 无 睡 客 还 起 风 微 一 铎 鸣 历历 正 谈 此 此身 如 传舍 幽 怀湛 秋水 兹 游共 昔 游 定非 聊 尔尔
85ca79c9-be4f-4581-9869-c9a43b8fb8c7,次韵东坡五更山吐月  其四,李彭,唐,诗,五言律诗,四更山吐月 月是故园明 三峡笙簧起 紫霄星斗横 林猿霜后啸 山鬼夜深行 托宿耆阇寺 真游王舍城,"5,5,5,5,5,5,5,5",2f7c273f6e268ac487018006e0bd5c9c,四 更 山 吐 月 月 是 故园 明 三峡 笙簧 起 紫霄 星斗 横 林猿 霜 后 啸 山鬼 夜深 行 托 宿耆 阇寺 真游 王舍城
ec6eb62c-6642-4335-a39c-95ae1f94268f,次韵东坡五更山吐月  其五,李彭,唐,诗,五言律诗,五更山吐月 梦回人更幽 风来虎溪寺 江动庾公楼 鸡唤楚江曙 河残淮上秋 倚梧成短句 仅欲不胜讴,"5,5,5,5,5,5,5,5",3c31b0ba4400a439ab4456b39339dff0,五更 山 吐 月 梦回 人 更 幽 风 来 虎 溪 寺 江动 庾公楼 鸡 唤 楚江 曙 河残淮 上秋 倚 梧成 短句 仅 欲 不胜 讴
cae31d67-d68f-4187-947d-96a1636fdf06,不宿开先道中口占,李彭,唐,诗,五言律诗,穉菊含佳色 苔痕上老笻 了山已埋玉 卢老自鸣钟 但饮东溪水 休看双剑峰 斜阳空翠合 犹听隔溪舂,"5,5,5,5,5,5,5,5",cba20aefa1e1fa5cc47fb35852b3348a,穉 菊 含 佳 色 苔痕 上 老 笻 了 山 已 埋 玉 卢老 自鸣钟 但 饮东 溪水 休看 双 剑峰 斜阳 空翠合 犹 听 隔溪 舂
5c47baf5-f645-4588-9010-085d5134e376,雪,李彭,唐,诗,五言律诗,瑞木辞天汉 因风响触楹 光催晓鸡误 素失白鹇惊 冰柱随门见 瑶林逐径成 南州多疠鬼 藉汝胜鏖兵,"5,5,5,5,5,5,5,5",33b721d42ee2361ed05fb35ea5a7b285,瑞木辞 天汉 因 风响 触 楹 光 催晓 鸡误 素失 白鹇 惊 冰柱 随门 见 瑶林 逐径 成 南州 多 疠 鬼 藉 汝胜 鏖兵
19e6113b-eb05-467a-b235-ece954ffff66,王子张数以诗见过,李彭,唐,诗,五言律诗,午梦蛮花湿 晚凉衣带秋 愁来倚柱啸 诗到击盘讴 律熟无谁敌 词悭不拟酬 苏州语犹在 五字为君休,"5,5,5,5,5,5,5,5",4210aba88c21842a9f08337d4c91dd7e,午 梦 蛮 花 湿 晚凉 衣带 秋 愁 来 倚 柱啸 诗 到 击盘 讴 律 熟 无 谁 敌 词 悭 不 拟 酬 苏州 语 犹 在 五 字 为 君 休
fc664707-89da-49a0-ad25-d417a4e59eaa,同云叟游欧峰,李彭,唐,诗,五言律诗,远墅春辞木 空山晚著花 幽怀生蜡屐 稍上问星槎 屡共普熏饭 仍烹圆梦茶 期君未衰白 烂漫饱烟霞,"5,5,5,5,5,5,5,5",0e9d5e5d7af499caa9c86bbcc912637a,远墅 春辞 木 空山 晚 著 花 幽 怀生 蜡屐 稍上 问 星槎 屡共 普熏 饭 仍 烹 圆梦 茶 期君 未 衰白 烂漫 饱 烟霞
8269da0f-3975-4822-af1a-959c397bb428,书怀,李彭,唐,诗,五言律诗,未作终焉计 怀哉兴不疏 逢人问息耗 阅岁叹乘除 老境来颜面 归家识此渠 攀缘俱断绝 何暇羡严徐,"5,5,5,5,5,5,5,5",7edad62ed0623ca90ff260a236b78ee4,未作终焉计 怀哉 兴不疏 逢 人 问息 耗 阅 岁 叹 乘除 老境 来 颜面 归家识此 渠 攀缘 俱 断绝 何暇 羡 严徐
ff0bc89f-f28a-49e1-b3c1-c2038effd48b,游石镜溪,李彭,唐,诗,五言律诗,石镜溪边树 金轮峰上云 贪看鱼弄影 不觉鸟迷曛 山态迤迤好 泉声细细分 银钩怀柱史 谁复振斯文,"5,5,5,5,5,5,5,5",d781754f7f131b5c333337de2e9ba7f8,石镜 溪边 树 金轮 峰 上 云 贪 看 鱼 弄 影 不觉 鸟迷 曛 山态 迤迤 好 泉声 细细 分 银钩 怀柱史 谁 复振 斯文
f29b17ed-78f8-4d4c-b01f-fb01a0b29f75,怀秦处度,李彭,唐,诗,五言律诗,淮海紫髯叟 长吟独倚风 稍将芸辟蠹 应罢手书空 拄策旧寒涧 含毫余老松 观云毎怅望 苦念小安丰,"5,5,5,5,5,5,5,5",4ad75a8d6a3cd6e972ad1b08006bf0f4,淮海 紫髯叟 长吟 独倚 风 稍将 芸辟蠹 应 罢手 书空 拄 策 旧 寒 涧 含 毫余 老松 观云 毎 怅望 苦念 小 安丰
6c62597a-5253-42ca-b696-f7826266355a,留题壁间,李彭,唐,诗,五言律诗,远意在丘壑 篮舆同此寻 干云绝壁秀 落涧幽泉音 卷祴尽开士 听法多珍禽 烟横半峰暝 信是忘归心,"5,5,5,5,5,5,5,5",8fa008ea6bd20e3951702463b1a5360e,远 意在 丘壑 篮舆 同此 寻 干云 绝壁 秀 落涧 幽泉 音 卷 祴 尽 开 士 听法 多 珍禽 烟 横 半峰 暝 信 是 忘 归心
b84e69df-3362-4b03-9566-88f00969f379,过蕲州故居,李彭,唐,诗,五言律诗,系马金沙树 衡茅俨暝途 沾襟问邻老 携手忆於菟 意逐前云远 情随归路迂 霜风吹晓角 梦听小单于,"5,5,5,5,5,5,5,5",88b713d0f75e7ce80ada801e523aeedc,系马 金沙 树 衡茅 俨暝 途 沾襟 问邻 老 携手 忆 於 菟 意逐前云远 情 随 归路 迂 霜 风吹 晓角 梦 听 小 单于
c92d6ca2-52c2-4f26-9050-0c323a968063,寄文若,李彭,唐,诗,五言律诗,仲氏客淮上 蓬窗忆聚星 云从望中密 雨逐去边零 赤壁念存没 怡亭几醉醒 归欤勤著脚 莫负读书萤,"5,5,5,5,5,5,5,5",a1a74e697d9848b4f583a95f0bcc6384,仲氏客 淮 上 蓬窗忆 聚星 云从望 中密 雨 逐 去 边 零 赤壁 念存 没 怡亭 几 醉醒 归 欤 勤著 脚 莫 负 读书 萤
56c39751-988e-44cc-b0a3-a9ec81500618,用韦苏州神静师院韵寄微公,李彭,唐,诗,五言律诗,云卧衣裳冷 岩幽钟磬微 秋虫留雾牖 夕鸟下烟扉 无人瀹茗椀 坐我语斜晖 分携复经岁 长嗟志愿违,"5,5,5,5,5,5,5,5",4576ca0139ad02fe8c415c1724864c72,云卧 衣裳 冷 岩 幽 钟磬微 秋虫 留 雾 牖 夕 鸟 下 烟扉 无人 瀹 茗 椀 坐 我 语 斜晖 分 携复 经岁 长 嗟 志愿 违
a0f67a85-9745-4915-b7fc-f16a39030851,将到九江先寄王环中,李彭,唐,诗,五言律诗,鹿门真大隐 不减远人村 净供维摩室 邻居祗树园 秦淮挥别泪 楚岸倒芳樽 牢落还相见 定能颜色温,"5,5,5,5,5,5,5,5",33c7ed27976ea4cd78a6d1c74f3c8746,鹿门 真大 隐 不减 远 人 村 净 供 维摩 室 邻居 祗 树园 秦淮 挥别 泪 楚岸 倒 芳 樽 牢落 还 相见 定 能 颜色 温
b72716be-a613-4e2a-915a-243348741f87,新𥬠浊醪味严劲饮数盏大醉醉中作此诗,李彭,唐,诗,五言律诗,我生怜曲蘖 刚置自中年 破屋鸣春溜 阴崖响夜泉 兴来犹味著 饮罢剩狂颠 但病无风韵 聊堪栩栩眠,"5,5,5,5,5,5,5,5",b545b25fff775e927a90671967b4049a,我 生怜 曲蘖 刚 置 自 中年 破屋 鸣春 溜 阴崖 响 夜 泉 兴来 犹味著 饮 罢 剩狂颠 但 病 无 风韵 聊堪 栩栩 眠
fa524dd3-0476-4e4a-bee2-4f3e7d5ab173,佚老堂为柳仲辉题,李彭,唐,诗,五言律诗,小隐寄岩谷 堂成笑傲中 虽无黄阁相 不羡黑头翁 倚杖鸥边雨 营诗鴈背风 好闲多病处 清兴略相同,"5,5,5,5,5,5,5,5",0cb78be71dfdf56859849e35598ce2b8,小隐 寄 岩谷 堂 成 笑傲 中 虽 无 黄阁 相 不 羡 黑头 翁 倚 杖 鸥 边雨 营 诗 鴈 背风 好 闲 多 病 处 清兴 略 相同
57abc9a1-b0e8-4948-854f-7f220b816874,自宝峰还过长坑涧谷胜绝处,李彭,唐,诗,五言律诗,㶁㶁水循涧 悠悠山放云 关河元未远 境界有谁分 幽树花无赖 轻鸥声念群 个中须著句 传与世间闻,"5,5,5,5,5,5,5,5",3146d175d586bea6246150adc953d786,㶁 㶁 水循涧 悠悠 山放云 关河 元 未远 境界 有 谁 分 幽 树花 无赖 轻鸥 声念 群 个 中 须 著 句 传与 世间 闻
b82207eb-e0c0-47e5-90b7-57bbe2831f3e,蓺玉轩,李彭,唐,诗,五言律诗,短李江南秀 虬须让帝孙 开怀仍好客 爱画复堪论 蓺玉风烟外 蓝溪气象存 他年多结绿 会看有乘轩,"5,5,5,5,5,5,5,5",9382498b576dac195b673a6ee229f08f,短 李 江南 秀 虬须 让 帝 孙 开怀 仍 好客 爱画 复堪 论 蓺 玉 风烟 外 蓝溪 气象 存 他 年 多 结绿 会 看 有 乘 轩
69408a08-c335-470d-a6a8-00f991cb2b1a,豫章董瞿老求诗,李彭,唐,诗,五言律诗,珍重胶西相 风流后叶孙 退藏羞射策 旷远颇窥园 韵绝五峰秀 句奇三峡喧 羌山多胜践 周礼鲁俱存,"5,5,5,5,5,5,5,5",5d3c871d175dba49043772a610c6b335,珍重 胶西 相 风流 后叶 孙 退藏 羞射策 旷远 颇 窥 园 韵 绝 五峰 秀 句 奇 三峡 喧 羌山 多 胜践 周礼 鲁俱存
76047340-c857-4248-81bf-24dd0a9a090b,漫书,李彭,唐,诗,五言律诗,欧峰秋色外 一上一回高 践华谁云险 扪参未觉劳 云扉留野客 雾牖卧方袍 拄頬非吾事 何须似马曹,"5,5,5,5,5,5,5,5",bd57ac701ddb0ebf517b25eefca5af6b,欧峰 秋色 外 一 上 一回 高 践华 谁 云险 扪参 未觉 劳 云扉 留野 客 雾 牖 卧 方袍 拄 頬 非 吾 事 何须 似 马 曹
3f03af14-32b8-4307-a8e2-02dc54c136fd,钱盱眙赴上因乞诗,李彭,唐,诗,五言律诗,君自金张侣 从予嵇阮游 祗园分客袂 星渚系归舟 楚国烟霞晚 隋河榆柳秋 中州多汲引 行矣亦封侯,"5,5,5,5,5,5,5,5",4548d36003f748deaf623c9bd2f06822,君自金 张侣 从予 嵇阮游 祗 园 分 客 袂 星 渚 系 归 舟 楚国 烟霞 晚 隋河榆 柳秋 中州 多 汲引 行 矣 亦 封侯
e241766a-73e4-44d0-b163-4db75428de1b,次瑛上人韵,李彭,唐,诗,五言律诗,鼻祖真消息 风流出当家 观门亲杜顺 蹙指悟玄沙 顾我晚闻道 参同今未涯 悬知饮光笑 初不为拈花,"5,5,5,5,5,5,5,5",441d82cdd5fb4c749ae4d9cc3a34eca0,鼻祖 真 消息 风流 出 当家 观门 亲 杜顺 蹙 指悟 玄沙 顾 我 晚闻 道 参同 今未涯 悬知 饮光 笑 初 不 为 拈花
bd3b2400-f1e1-4591-a97d-4b83adbc19ce,题吴少冯听雨堂,李彭,唐,诗,五言律诗,碧涧寒侵屋 幽云夜度墙 贪看山入坐 惯听雨鸣廊 苦乏阴铿句 聊登孺子床 君非无汲引 寄傲学潜郎,"5,5,5,5,5,5,5,5",d285c29525c22434436e67b8bdc97ed5,碧涧寒 侵 屋 幽云 夜度 墙 贪看 山入 坐 惯 听 雨鸣廊 苦乏 阴铿 句 聊登 孺子 床 君非无 汲引 寄 傲学 潜郎
5028f33f-0efa-4ca3-a851-c5e5598b2fdb,喜得京师书信,李彭,唐,诗,五言律诗,簷间噪乌鹊 窗下集邕渠 喜有大梁使 能携小陆书 南烹饱薇蕨 北馔到庭除 得隽传消息 更看双鲤鱼,"5,5,5,5,5,5,5,5",7808bed8dd1a7fb6b2948496244229c4,簷 间 噪 乌鹊 窗 下集 邕渠 喜有 大梁 使 能 携 小 陆书 南 烹 饱 薇 蕨 北 馔 到 庭除 得 隽 传 消息 更 看 双 鲤鱼
e54d8999-7490-4897-a45c-8081626fc7fe,追凉对酒,李彭,唐,诗,五言律诗,袢暑晚来歇 追凉聊解颜 星移团扇底 月动缥瓷间 蝉噪断仍续 鸟喧栖复还 幽人嗜清旷 只合卧湖山,"5,5,5,5,5,5,5,5",91c55f77273e07962c1cfd11c822736d,袢 暑晚 来 歇 追凉 聊解 颜 星 移 团扇 底 月 动 缥瓷 间 蝉 噪 断 仍续 鸟 喧 栖复 还 幽人 嗜 清旷 只 合卧 湖山
a9d7f1fa-099e-466b-9e4f-1be4a7f8e651,上黄太史鲁直诗,李彭,唐,诗,五言古体,扈圣当元祐 雄名独擅长 群公调玉烛 延阁近扶桑 挥洒惊雷雨 观瞻列堵墙 密云来北苑 珍菓出明光 柱下惟青史 银台无露章 胡为随逐客 不作瑞斋房 岑寂金华省 萧条玉笋行 长庚万里去 大雅百夫望 老觉丹心壮 闲知清画长 珍蔬时入馔 荔子喜传芳 世故跏趺远 生涯啸傲傍 甘为剑外客 谁念太官羊 宣室二天诏 遗弓万国伤 老臣还召毕 陛下过成康 泽笏皆忠谠 弹冠多俊良 力辞佳吏部 直作老潜郎 忆在金华日 宁扶八座床 未能窥绛帐 颇识戏罗囊 候雁随阳去 奔驹度隙忙 千秋铜狄泣 万古玉人藏 诸阮衅犹在 蕲春痛未央 群雏极鹅雁 众口叹蛩螀 恨乏一廛地 归来屡择乡 亲交标鬼录 卜筑近僧坊 宿鸟频窥牖 行蜗毎画梁 著渠上麟阁 耻学赋高唐 勤我十年梦 持公一瓣香 聊堪比游夏 何敢似班扬 尚愧管中见 应须肘后方 他时解颜笑 何止获升堂,"5,5,5,5,5,5,5,5,5,5,5,5,5,5,5,5,5,5,5,5,5,5,5,5,5,5,5,5,5,5,5,5,5,5,5,5,5,5,5,5,5,5,5,5,5,5,5,5,5,5,5,5,5,5,5,5,5,5,5,5",00cd7936e725cfabe5cbd8fba1187a16,扈圣当元 祐 雄名 独 擅长 群公调 玉烛 延阁 近 扶桑 挥洒 惊 雷雨 观瞻 列 堵墙 密云 来 北苑 珍 菓 出 明光 柱 下 惟 青史 银台 无露章 胡为 随 逐客 不作 瑞斋 房 岑寂 金华 省 萧条 玉笋 行 长庚 万里 去 大雅 百夫望 老觉 丹心 壮 闲知 清 画长 珍蔬 时入 馔 荔子 喜传 芳 世故 跏趺 远 生涯 啸傲 傍 甘为剑 外客 谁 念 太官 羊 宣室 二天 诏 遗弓 万国 伤 老臣 还 召毕 陛下 过 成康 泽笏皆 忠 谠 弹冠 多俊良 力辞 佳 吏部 直作 老潜郎 忆 在 金华 日 宁扶 八座 床 未能 窥 绛 帐 颇识 戏罗囊 候雁随阳 去 奔 驹 度 隙 忙 千秋 铜 狄 泣 万古 玉人藏 诸 阮衅犹 在 蕲春 痛 未央 群 雏极 鹅 雁 众口 叹 蛩 螀 恨乏 一廛 地 归来 屡择乡 亲交 标鬼 录 卜 筑 近 僧坊 宿鸟 频 窥 牖 行蜗 毎 画 梁 著渠 上 麟 阁 耻学 赋 高唐 勤 我 十年 梦 持 公 一瓣 香 聊堪比游夏 何敢 似 班 扬 尚愧 管 中 见 应 须 肘后方 他时 解颜笑 何止 获 升堂
81e41027-4ecc-4640-98e4-b673dadbc467,观画山水,李彭,唐,诗,七言律诗,不爱边鸾爱李成 胸中成画自峥嵘 数行岛屿随人去 一段风烟向腕生 猨啼巫峡殷勤啸 雁到衡阳嘹唳鸣 我与群山成保社 直疑俱是旧经行,"7,7,7,7,7,7,7,7",3d2f008ccfac9ba246d4e085da478fb9,不 爱 边鸾 爱 李成 胸中 成画 自 峥嵘 数行 岛屿 随 人 去 一段 风烟 向 腕生 猨 啼 巫峡 殷勤 啸 雁 到 衡阳 嘹唳 鸣 我 与 群山 成保 社 直疑 俱 是 旧 经行
b38dedbf-213b-405f-aaae-e50b7ede145a,远明阁饮,李彭,唐,诗,七言律诗,百尺游丝入座来 浮岚空翠入樽罍 谈谐自得江山助 觞咏不劳丝管催 滕阁风流今未远 南楼气味唤仍回 城鸦欲曙众客醉 木末阑干悬斗魁,"7,7,7,7,7,7,7,7",81ef2bf1a859453ca34cd071e80bfe49,百尺 游丝 入座 来 浮岚 空翠 入 樽 罍 谈 谐 自得 江山 助 觞 咏不劳 丝管 催 滕阁 风流 今 未 远 南楼 气味 唤 仍 回 城鸦 欲 曙众 客醉 木末 阑干 悬斗魁
fabd2794-afc2-472a-ada0-1727caa91c07,城上,李彭,唐,诗,七言律诗,城上栖乌尾毕逋 寒塘乌影过相呼 一天欲放山阴雪 六幅如观栗里图 问老自应师粲忍 扶衰初喜得封胡 香醪已熟糟床注 唤客无劳满眼酤,"7,7,7,7,7,7,7,7",700183717ee26cbbc81c991a2fafbaa4,城上 栖 乌 尾 毕 逋 寒塘 乌影 过相 呼 一天 欲 放 山阴 雪 六幅 如 观 栗里图 问 老 自应师 粲忍 扶衰 初 喜得 封 胡 香醪 已 熟 糟床 注 唤 客 无劳 满眼 酤
6fd89181-81b3-4b0e-967a-67a9185739c8,宿万松兼示庆首座,李彭,唐,诗,七言律诗,步屧欣逢释梵宫 余霞尚带日归红 峰前晚霭晚来积 岫外秋天秋满空 独鸟深藏欹牖树 幽花香逐下山风 青灯耿耿照无睡 赖有能诗老赞公,"7,7,7,7,7,7,7,7",81586a8f0d5d2a2fc4a360d042479da5,步 屧 欣逢 释 梵宫 余霞 尚 带 日 归 红 峰 前晚 霭 晚来 积 岫 外 秋天 秋满空 独鸟 深藏 欹 牖 树 幽 花香 逐下 山风 青灯 耿耿 照 无 睡 赖 有 能 诗 老赞公
