id,title,author,dynasty,genre,poem_type,sentences_simplified,meter_pattern,hash,words
3d868704-6c27-4890-a856-ef160cf66594,离歌辞五首  其五,徐铉,宋,诗,五言绝句,拂匣收珠佩 回灯拭薄妆 莫嫌春夜短 匹似楚襄王,"5,5,5,5",bc80d2b14b5d6479fa17b8eee8ad2379,拂匣 收珠 佩 回灯 拭薄妆 莫 嫌 春夜 短 匹似 楚襄王
ef6a0261-311a-49a9-a9fa-fac1b630369b,梦游三首  其一,徐铉,宋,诗,七言律诗,魂梦悠扬不奈何 夜来还在故人家 香蒙蜡烛时时暗 户映屏风故故斜 檀的慢调银字管 云鬟低缀折枝花 天明又作人间别 洞口春深道路赊,"7,7,7,7,7,7,7,7",123666e527837c35c1609f2d6589c860,魂 梦 悠扬 不 奈何 夜来 还 在 故 人家 香蒙 蜡烛 时时 暗 户映 屏风 故故 斜 檀 的 慢调 银字 管 云鬟 低 缀 折枝 花 天明 又 作 人间 别 洞口 春 深 道路 赊
5b6cd9e2-6d7c-4510-85fd-973ad0d18fb4,梦游三首  其二,徐铉,宋,诗,七言律诗,绣幌银屏杳霭间 若非魂梦到应难 窗前人静偏宜夜 户内春浓不识寒 蘸甲递觞织似玉 含词忍笑腻于檀 锦书若要知名字 满县花开不姓潘,"7,7,7,7,7,7,7,7",4aea0605a3fa6ed01a98aed898890449,绣 幌 银屏 杳 霭 间 若非 魂 梦 到 应 难 窗前 人静 偏宜 夜 户内 春 浓 不识 寒 蘸 甲 递 觞 织似 玉 含词 忍笑 腻 于 檀 锦书 若 要知 名字 满县 花开 不 姓 潘
f08151cc-42cc-4716-aa7e-ee1762ad9312,梦游三首  其三,徐铉,宋,诗,七言律诗,南国佳人字玉儿 芙蓉双脸远山眉 仙郎有约长相忆 阿母无猜不得知 梦里行云还倏忽 暗中携手乍疑迟 因思别后闲窗下 织得回文几首诗,"7,7,7,7,7,7,7,7",c3da211dc4f8a255d172b4dfd31c2b30,南国 佳人 字 玉儿 芙蓉 双脸 远山 眉 仙郎 有 约 长相 忆 阿母 无猜 不 得知 梦 里 行云 还 倏忽 暗中 携手 乍疑迟 因 思别 后 闲 窗下 织得 回文 几首 诗
3ed739aa-0f4e-4dee-9180-e6d28e121d11,和萧少卿见庆新居  其一,徐铉,宋,诗,七言律诗,湘浦怀沙已不疑 京城赐第岂前期 鼓声到晚知坊远 山色来多与静宜 簪屦尚应怜故物 稻粱空自愧华池 新诗问我偏饶思 还念鹪鹩得一枝,"7,7,7,7,7,7,7,7",e1dfbde9d5ea875fe68ab242cb6e6bd7,湘浦 怀沙 已不疑 京城 赐 第 岂 前期 鼓声 到 晚 知 坊 远 山色 来 多 与 静宜 簪 屦 尚应 怜 故物 稻粱 空 自愧 华池 新诗 问 我 偏 饶 思 还 念 鹪鹩 得 一枝
5a28f7a6-b1e8-4920-8eb9-920e99d584ed,和萧少卿见庆新居  其二,徐铉,宋,诗,七言律诗,惊蓬偶驻知多幸 断雁重联惬素期 当户小山如旧识 上墙幽藓最相宜 清风不去因栽竹 隙地无多也凿池 更喜良邻有嘉树 绿阴分得近南枝,"7,7,7,7,7,7,7,7",dd2bc587a58f0df1183e639470196a2b,惊蓬偶 驻知 多 幸 断雁 重联 惬素 期 当户 小山 如 旧识 上墙 幽藓 最 相宜 清风 不 去 因 栽 竹 隙地 无多 也 凿 池 更 喜良 邻有 嘉树 绿阴 分得 近南 枝
76714d2b-1f8f-4f68-befb-62b4eb661121,送勋道人之建安,徐铉,宋,诗,五言律诗,下国兵方起 君家义独闻 若为轻世利 归去卧溪云 挂席冲岚翠 携筇破藓纹 离情似霜叶 江上正纷纷,"5,5,5,5,5,5,5,5",23a4dc35917050e98bf0fed256561db1,下国 兵方 起 君家义 独闻 若为 轻 世利 归去 卧溪 云 挂 席冲岚 翠 携 筇 破藓 纹 离情 似 霜叶 江上 正 纷纷
64314f4e-e7c7-44ed-b31b-2935aceb853a,送许郎中歙州判官兼黟县,徐铉,宋,诗,七言律诗,尝闻黟县似桃源 况是优游冠玳筵 遗爱非遥应卧理 祖风犹在好寻仙 朝衣旧识薰香史 禄米初营种秫田 大抵宦游须自适 莫辞离别二三年,"7,7,7,7,7,7,7,7",ef4b425a6a9c62b08fe468d4767222c5,尝闻 黟县 似 桃源 况是 优游 冠 玳筵 遗爱 非 遥应 卧理 祖风 犹 在 好 寻仙 朝衣 旧识 薰香 史 禄米初 营种 秫田 大抵 宦游 须 自适 莫辞 离别 二三年
d93c4f9b-933b-4770-b350-d8609583ef4f,送彭秀才南游,徐铉,宋,诗,七言律诗,问君孤棹去何之 玉笥春风楚水西 山上断云分翠霭 林间晴雪入澄溪 琴心酒趣神相会 道士仙童手共携 他日时清更随计 莫如刘阮洞中迷,"7,7,7,7,7,7,7,7",c744add8df0c4249118909b466c45607,问君 孤 棹 去 何之 玉笥 春风 楚水西 山上 断 云分 翠霭 林间 晴雪 入 澄溪 琴心 酒趣 神 相会 道士 仙童 手 共 携 他 日 时 清 更 随计 莫如 刘阮洞 中 迷
5a8b6d0a-6dd3-4e92-b4e4-2af9f70dbf5b,和明上人除夜见寄,徐铉,宋,诗,五言律诗,酌酒围炉久 愁襟默自增 长年逢岁暮 多病见兵兴 夜色开庭燎 寒威入砚冰 汤师无别念 吟坐一灯凝,"5,5,5,5,5,5,5,5",16e24005d80cbe55c6d70958f814b8a8,酌酒 围炉 久 愁襟默自增 长年 逢 岁暮 多 病 见 兵 兴 夜色 开庭 燎 寒威入 砚 冰 汤师 无 别念 吟 坐 一灯 凝
b16ab4a7-691b-4e67-8ad5-1a4cc311a077,正初和鄂州边郎中见寄,徐铉,宋,诗,五言律诗,潦倒含香客 凄凉赋𫛳人 未能全卷舌 终拟学垂纶 故友暌离久 音书问讯频 相思俱老大 又见一年新,"5,5,5,5,5,5,5,5",1d75c91f12530bd2725e4859d120f2d6,潦倒 含 香客 凄凉 赋 𫛳 人 未能 全 卷舌 终拟 学垂纶 故友 暌 离 久 音书 问讯 频 相思 俱 老大 又 见 一年 新
7c1b20d4-0d0c-4f10-a9c6-1e0a36a0bc32,送刘司直出宰,徐铉,宋,诗,五言律诗,之子有雄文 风标秀不群 低飞从墨绶 逸志在青云 柳色临流动 春光到县分 贤人多静理 未爽醉醺醺,"5,5,5,5,5,5,5,5",8cd7d547748bf1fe1161034077a9360a,之 子 有 雄文 风标 秀 不 群 低飞 从 墨绶 逸 志在 青云 柳色 临 流动 春光 到 县分 贤人 多 静理 未 爽 醉醺醺
9e136d21-d006-4c64-885e-0e9079664316,送从兄赴临川幕,徐铉,宋,诗,七言律诗,梁王籍宠就东藩 还召邹枚坐兔园 今日好论天下事 昔年同受主人恩 石头城下春潮满 金柅亭边绿树繁 唯有音书慰离别 一杯相送别无言,"7,7,7,7,7,7,7,7",ddffcba06388778050c0f5444b34b2da,梁王籍 宠 就 东藩 还召 邹枚 坐 兔园 今日 好论 天下事 昔年 同受 主人 恩 石头城 下 春潮 满 金 柅 亭 边 绿树 繁 唯有 音书 慰 离别 一杯 相 送别 无言
1e2da188-0f34-4f89-9a44-1db6070cf34d,送龚员外赴江州幕,徐铉,宋,诗,七言律诗,烦君更上筑金台 世难民劳藉俊才 自有声名驰羽檄 不妨谈笑奉罇罍 元规楼迥清风满 匡俗仙春画障开 莫忘故人离别恨 海潮回处寄书来,"7,7,7,7,7,7,7,7",3389b651caa5d4985bd223f80eae9f5e,烦 君 更 上筑 金台 世 难民 劳藉俊 才 自有 声名 驰 羽 檄 不妨 谈笑 奉 罇 罍 元 规楼 迥 清风 满 匡俗仙 春 画障 开 莫忘 故人 离别 恨 海潮 回处 寄 书 来
a6d9230a-83c9-4483-9f3f-b0b886533533,送朱先辈尉庐陵,徐铉,宋,诗,五言律诗,我重朱夫子 依然见古人 成名无愧色 得禄及慈亲 莫叹官资屈 宁论活计贫 平生心气在 终在静边尘,"5,5,5,5,5,5,5,5",ae4a9689393189a29912669d9e81cad3,我 重 朱夫子 依然 见 古人 成名 无 愧色 得 禄 及 慈亲 莫叹 官资屈 宁论 活计 贫 平生 心气 在 终在 静边 尘
46698569-9455-48ba-bb9b-26ee9ec753f1,送德林郎中学士赴东府得酒并序,徐铉,宋,诗,五言律诗,酌此杯中物 茱萸满把秋 今朝将送别 他日是忘忧 世乱方多事 年加易得愁 政成频一醉 亦未减风流,"5,5,5,5,5,5,5,5",073ec25d62b0f3fb5b94084b3b240d31,酌此 杯中物 茱萸 满 把 秋 今朝 将 送别 他 日 是 忘忧 世乱方多 事 年 加 易得 愁 政成频 一 醉 亦 未 减 风流
ad8b4c5c-dc85-4c6a-aab0-791d025afbdb,送陈先生之洪并寄萧少卿,徐铉,宋,诗,七言律诗,闻君仙袂指洪涯 我忆情人别路赊 知有欢娱游楚泽 更无书札到京华 云间驿阁连江静 春满西山倚汉斜 此处相逢应见问 为言搔首望龙沙,"7,7,7,7,7,7,7,7",f2b629e96dca42bf4832617d29975700,闻君仙 袂 指 洪涯 我 忆 情人 别路 赊 知有 欢娱 游楚泽 更 无 书札 到 京华 云间 驿阁 连江 静 春 满 西山 倚 汉 斜 此处 相逢 应见 问 为 言 搔首 望 龙沙
3c5f8ca7-11ab-421b-89b8-6d03df2f67fe,送龚明府九江归宁,徐铉,宋,诗,五言律诗,茂宰隳官去 扁舟著彩衣 湓城春酒熟 匡阜野花稀 解缆垂杨绿 开帆宿鹭飞 一朝吾道泰 还逐落潮归,"5,5,5,5,5,5,5,5",2fe95e461c81c60276ba16797092959b,茂宰 隳 官 去 扁舟 著 彩衣 湓 城 春酒 熟 匡 阜 野花 稀 解缆 垂杨 绿 开帆 宿鹭 飞 一朝 吾 道 泰 还 逐 落潮 归
d0de5eba-2cd6-42c8-91b0-f3553a8eba76,和江西萧少卿见寄二首  其一,徐铉,宋,诗,七言律诗,亡羊岐路愧司南 二纪穷通聚散三 老去何妨从笑傲 病来看欲懒朝参 离肠似线常忧断 世态如汤不可探 珍重加餐省思虑 时时斟酒压山岚,"7,7,7,7,7,7,7,7",3b657051d47da4a01512746e9b411f3c,亡羊 岐路 愧 司南 二纪 穷通 聚散 三 老 去 何妨 从 笑傲 病 来看 欲 懒 朝 参 离 肠 似 线 常 忧断 世态 如 汤 不可 探 珍重 加餐 省 思虑 时时 斟酒 压 山岚
52dc01b6-da6b-41b1-bf55-bb3ef11008fb,和江西萧少卿见寄二首  其二,徐铉,宋,诗,七言律诗,身遥上国三千里 名在朝中二十春 金印不须辞入幕 麻衣曾此叹迷津 卷舒由我真齐物 忧喜忘心即养神 世路风波自翻覆 虚舟无计得沉沦,"7,7,7,7,7,7,7,7",86d2bf8bf15fe1a169a0b025f9775af2,身 遥 上国 三千里 名 在 朝中 二十 春 金印 不须 辞入 幕 麻衣 曾此 叹 迷津 卷舒 由 我 真 齐物 忧喜忘心即 养神 世路 风波 自 翻覆 虚舟无计得 沉沦
297bc7e3-eb9a-45c8-90f9-30011c6944c5,送薛少卿赴青阳,徐铉,宋,诗,五言古体,我爱陶靖节 吏隠从弦歌 我爱费征君 高卧归九华 清风激颓波 来者何以加 我志两不遂 漂沦浩无涯 数奇时且乱 此图今愈赊 贤哉薛夫子 高举凌晨霞 安民即是道 投足皆为家 功名与权位 悠悠何用夸 携朋出远郊 酌酒藉平沙 云收远天静 江阔片帆斜 离怀与企羡 南望长咨嗟,"5,5,5,5,5,5,5,5,5,5,5,5,5,5,5,5,5,5,5,5,5,5",311b662716bda4a0212772dea4d3f552,我 爱 陶靖节 吏 隠 从 弦歌 我 爱 费征君 高卧 归 九华 清风 激颓 波 来者 何以 加 我 志 两 不遂 漂沦 浩 无涯 数 奇 时 且 乱 此 图 今 愈 赊 贤 哉 薛 夫子 高举 凌晨 霞 安民 即是 道 投足 皆 为 家 功名 与 权位 悠悠 何用 夸 携朋出 远郊 酌酒 藉 平沙 云 收 远 天静 江阔 片 帆 斜 离怀 与 企 羡 南望 长咨 嗟
4afc363d-e8c2-4ba1-a4fa-6695941caa0c,送高起居之泾县,徐铉,宋,诗,五言古体,右史罢朝归 之官句水湄 别我行千里 送君倾一巵 酒罢长叹息 此叹君应悲 乱中吾道薄 卿族旧人稀 胡为佩铜墨 去此白玉墀 吏事岂所堪 民病何可医 藏用清其心 此外慎勿为 县郭有佳境 千峰谿水西 云树杳回合 岩峦互蔽亏 弹琴坐其中 世事吾不知 时时寄书札 以慰长相思,"5,5,5,5,5,5,5,5,5,5,5,5,5,5,5,5,5,5,5,5,5,5",c1e1ec3c9b08924e4759cc6eca8b60a3,右史 罢朝 归 之 官 句 水 湄 别 我行 千里 送君 倾 一 巵 酒 罢长 叹息 此 叹 君 应 悲 乱 中 吾 道 薄 卿 族 旧人 稀 胡为佩 铜 墨 去 此 白玉 墀 吏事 岂所堪 民病 何 可 医 藏 用 清其心 此外 慎勿 为 县 郭 有 佳境 千峰 谿 水 西 云树杳 回合 岩峦 互蔽 亏 弹琴 坐 其中 世事 吾 不知 时时 寄 书札 以 慰长 相思
4d5d84c3-3521-433a-ade8-4b13da146199,宿茅山寄舍弟,徐铉,宋,诗,五言律诗,茅许禀灵气 一家同上宾 仙山空有庙 举世更无人 独往诚违俗 浮名亦累真 当年各自勉 云洞镇长春,"5,5,5,5,5,5,5,5",58522d87685effd214b41e994afb97a4,茅许 禀 灵气 一家 同 上宾 仙山 空 有 庙 举世 更 无人 独往诚违俗 浮名 亦 累真 当年 各 自勉 云洞 镇 长春
f1de9adf-559d-4f2f-a39d-552ad62a39b9,晚憩白鹤庙寄句容张少府,徐铉,宋,诗,五言律诗,日入林初静 山空暑更寒 泉鸣细岩窦 鹤唳眇云端 拂榻安棋局 焚香戴道冠 望君殊不见 终夕凭栏干,"5,5,5,5,5,5,5,5",2756716fc8d05ee0c2486541f85e0c9b,日 入 林初静 山空暑 更 寒 泉鸣细岩 窦 鹤唳 眇 云端 拂 榻 安 棋局 焚香 戴道冠 望君殊 不见 终夕 凭栏 干
01a36baa-f3c2-41ea-a6ef-8969f012544d,题紫阳观,徐铉,宋,诗,七言律诗,南朝名士富仙才 追步东乡遂不回 丹井自深桐暗老 祠宫长在鹤频来 岩边桂树攀仍倚 洞口桃花落复开 惆怅霓裳太平事 一函真迹锁昭台,"7,7,7,7,7,7,7,7",4f16c2ca9675d26c071c6c57c88de8e8,南朝 名士 富仙才 追步 东乡 遂 不 回 丹井 自 深桐 暗 老 祠 宫长 在 鹤 频来 岩边 桂树 攀 仍 倚 洞口 桃花 落复 开 惆怅 霓裳 太平 事 一 函 真迹 锁 昭 台
1047829a-6cf0-4a92-8eae-1b4966334806,赠奚道士,徐铉,宋,诗,七言律诗,先生曾有洞天期 犹傍天坛摘紫芝 处世自能心混沌 全真谁见德支离 玉霄尘闭人长在 金鼎功成俗未知 他日飚轮谒茅许 愿同鸡犬去相随,"7,7,7,7,7,7,7,7",aa28613d46993086c4d53f822aa935dc,先生 曾 有 洞天 期 犹 傍 天坛 摘 紫芝 处世 自 能心 混沌 全真 谁 见 德 支离 玉霄 尘 闭 人长 在 金鼎功 成俗 未知 他 日飚 轮 谒 茅 许 愿 同 鸡 犬 去 相随
0eb90f9e-9b84-49e3-b433-d68e1a6825ec,题碧岩亭赠孙尊师,徐铉,宋,诗,五言古体,绝境何人识 高亭万象含 凭轩临树杪 送目极天南 积霭生泉洞 归云锁石龛 丹霞披翠𪩘 白鸟带晴岚 仙去留虚室 龙归涨碧潭 幽岩君独爱 玄味我曾耽 世上愁何限 人间事久谙 终须脱羁鞅 来此会空谈,"5,5,5,5,5,5,5,5,5,5,5,5,5,5,5,5",4699b7ff17efc7191e4c0e7c2343e926,绝境 何人 识 高亭 万象 含 凭 轩临树 杪 送 目极 天南 积霭 生泉 洞 归云锁 石 龛 丹霞 披翠 𪩘 白鸟 带 晴岚 仙 去留 虚室 龙 归涨 碧潭 幽岩 君 独爱 玄味 我 曾 耽 世上 愁何限 人间 事久谙 终须 脱羁鞅 来 此 会 空谈
141ae8bd-a4e2-4b34-be81-9a32595f8496,题白鹤庙,徐铉,宋,诗,七言律诗,平生心事向玄关 一入仙乡似旧山 白鹤唳空晴眇眇 丹砂流涧暮潺潺 尝嗟多病嫌中药 拟问真经乞小还 满洞烟霞互陵乱 何峰台榭是萧闲,"7,7,7,7,7,7,7,7",1415dfce4b4d4bf4a8b36c30a02f2cd7,平生 心事 向 玄关 一 入 仙乡 似旧 山 白 鹤唳 空晴 眇 眇 丹砂 流涧 暮 潺潺 尝嗟 多 病 嫌 中药 拟 问 真经 乞小 还 满洞 烟霞 互陵 乱 何峰 台榭 是 萧闲
f3ff5c75-41af-4469-80bb-d3adb2b9c86c,步虚词五首  其一,徐铉,宋,诗,五言律诗,气为还元正 心由抱一灵 凝神归罔象 飞步入青冥 整服乘三素 旋纲蹑九星 琼章开后学 稽首奉真经,"5,5,5,5,5,5,5,5",f38c60b8d37410399cf5bdc6131877bd,气为 还 元 正 心由抱一灵 凝神 归 罔 象 飞 步入 青冥 整服 乘 三素 旋纲 蹑 九星 琼章 开 后学 稽首 奉 真经
fe398e7e-cb9a-498c-8956-da3ba0443753,步虚词五首  其二,徐铉,宋,诗,五言律诗,天帝黄金阙 真人紫锦书 霓裳纷蔽景 羽服迥临虚 白鹤能为使 班麟解驾车 灵符终愿借 转共世情疏,"5,5,5,5,5,5,5,5",b2681ecb55bcaa3ea6f8c8211b220de1,天帝 黄金 阙 真人 紫锦书 霓裳 纷蔽 景 羽服 迥临虚 白鹤 能为 使 班麟 解 驾车 灵符 终愿 借 转共 世情 疏
87208d5a-50a8-45d1-8612-d7b08160c012,步虚词五首  其三,徐铉,宋,诗,五言律诗,圣主过幽谷 虚皇在蕊宫 五千宗物母 七字秘神童 世人金壶远 人间玉籥空 唯余养身法 修此与天通,"5,5,5,5,5,5,5,5",fb6804e8aa6bb9874e1fb4cddfc2435c,圣主 过 幽谷 虚皇 在 蕊 宫 五千 宗物 母 七字 秘 神童 世人 金壶 远 人间 玉 籥 空 唯余养 身法 修 此 与 天通
7ee49032-3d57-4a09-9cd1-2ab63cebdbda,步虚词五首  其四,徐铉,宋,诗,五言律诗,何处求玄解 人间有洞天 勤行皆是道 谪下尚为仙 蔽景乘朱凤 排虚驾紫烟 不嫌园吏傲 愿在玉宸前,"5,5,5,5,5,5,5,5",94a3b2bf9046a6aa1629d888e6111902,何处 求 玄解 人间 有 洞天 勤行 皆 是 道 谪 下 尚 为 仙 蔽 景 乘 朱凤 排虚 驾 紫烟 不嫌 园吏 傲 愿 在 玉宸 前
31b023f7-7a33-4b60-8594-b2d41521bf16,步虚词五首  其五,徐铉,宋,诗,五言律诗,三素霏霏远 盟威凛凛寒 火铃空灭没 星斗晓阑干 佩响流虚殿 炉烟在醮坛 萧寥不可极 骖驾上云端,"5,5,5,5,5,5,5,5",dc9e8c5375156a2f3824f2f9f7d42264,三素 霏霏 远 盟威 凛凛 寒 火铃 空灭 没 星斗 晓 阑干 佩响流 虚殿 炉烟 在 醮 坛 萧寥 不可 极 骖 驾 上 云端
3588a5ee-6cbb-4c9f-ba1a-a2105efcfc76,留题,徐铉,宋,诗,七言绝句,瑶坛醮罢晚云开 羽客分飞俗士回 为报移文不须勒 未曾游处待重来,"7,7,7,7",50ca313fa93d8ba78e3cdcc18a886a7d,瑶 坛 醮 罢 晚 云 开 羽 客分 飞 俗士 回 为 报移 文 不须 勒 未曾 游 处待 重来
591d0ef6-bfdc-42be-9995-bd9198379aea,和陈洗马山庄新泉,徐铉,宋,诗,七言律诗,已开山馆待抽簪 更要岩泉欲洗心 常被松声迷细韵 急流花片落高岑 便疏浅濑穿莎径 始有清光映竹林 何日煎茶酝香酒 沙边同听暝猿吟,"7,7,7,7,7,7,7,7",a5c94ca94c65e109ae7ca7ed3e6e1931,已 开山 馆 待 抽 簪 更 要 岩泉 欲 洗心 常 被 松声 迷细 韵 急流 花片 落高 岑 便 疏浅 濑 穿莎 径 始 有 清 光映 竹林 何日 煎 茶 酝 香酒 沙边 同 听 暝 猿 吟
dc3e52b6-d85f-4119-88b2-638ecefe12e1,奉和七夕应令,徐铉,宋,诗,七言律诗,今宵星汉共晶光 应笑罗敷嫁侍郎 斗柄易倾离恨促 河流不尽后期长 静闻天籁疑鸣佩 醉折荷花想艳妆 谁见宣猷堂上宴 一篇清韵振金铛,"7,7,7,7,7,7,7,7",41c0561e8d946a78e018b2d71da05eff,今宵 星汉 共晶 光 应笑 罗敷 嫁 侍郎 斗柄 易 倾 离恨 促 河流 不尽 后期 长 静闻 天籁 疑鸣 佩 醉 折 荷花 想 艳妆 谁 见 宣猷 堂上 宴 一篇 清韵 振金铛
ec2704b8-2120-4f29-8127-9588d479fef0,又和八日,徐铉,宋,诗,七言律诗,微云疏雨淡新秋 晓梦依稀十二楼 故作别离应有以 拟延更漏共无由 那教人世长多恨 未必天仙不解愁 博望苑中残酒醒 香风佳气独迟留,"7,7,7,7,7,7,7,7",920224b8ca2255f9fa0840f4469673c1,微云 疏 雨 淡 新秋 晓梦 依稀 十二楼 故作 别离 应有 以 拟 延 更漏 共 无 由 那 教 人世 长 多 恨 未必 天仙 不 解愁 博望 苑 中 残 酒醒 香风 佳气 独迟 留
9f1542cd-efc7-4e1b-89ed-275ab86480bb,和印先辈及第后献座主朱舍人郊居之作,徐铉,宋,诗,七言律诗,成名郊外掩柴扉 树影蝉声共息机 积雨暗封青藓径 好风轻透白𦈌衣 嘉鱼始赋人争诵 荆玉频收国自肥 独坐公厅正烦暑 喜吟新咏见玄微,"7,7,7,7,7,7,7,7",51e15c7715d415961284643018297912,成名 郊外 掩 柴扉 树影 蝉声 共息 机 积雨 暗封 青藓 径 好 风 轻透白 𦈌 衣 嘉鱼 始 赋人 争诵 荆玉频 收国 自肥 独坐 公厅 正烦 暑 喜吟 新咏 见 玄微
7595248a-0979-4a53-84b9-65a61c3a92d3,和致仕张尚书新创道院,徐铉,宋,诗,五言律诗,梓泽成新致 金丹有旧情 挂冠朝睡足 隠几暮江清 药圃分轻绿 松窗起细声 养高宁厌病 默坐对诸生,"5,5,5,5,5,5,5,5",9eedbd555d9e166dc948f9b010d66e6c,梓泽 成新 致 金丹 有 旧情 挂冠 朝 睡足 隠 几 暮 江 清 药圃 分轻 绿 松 窗起 细声 养高宁 厌病 默坐 对 诸生
13152116-37aa-47a1-a0c5-9d97c3dee900,和尉迟赞善秋暮僻居,徐铉,宋,诗,七言律诗,登高节物最堪怜 小岭疏林对槛前 轻吹断时云缥缈 夕阳明处水澄鲜 江城秋早催寒事 望苑朝稀足晏眠 庭有菊花罇有酒 若方陶令愧犹贤,"7,7,7,7,7,7,7,7",fc9d77c264db79ab32fbabced75af6a7,登高 节物 最 堪怜 小岭 疏 林 对槛 前 轻吹 断 时 云 缥缈 夕阳 明处 水 澄鲜 江城 秋早 催 寒事 望苑 朝 稀足 晏 眠 庭 有 菊花 罇 有 酒 若方陶 令愧犹贤
b2433410-3421-47cf-a2d9-1c86a7872c82,和陈赞善致仕还京口,徐铉,宋,诗,七言律诗,海门山下一渔舟 中有高人未白头 已驾安车归故里 尚通闺籍在龙楼 泉声潄玉窗前落 江色和烟槛外流 今日君臣厚终始 不须辛苦画双牛,"7,7,7,7,7,7,7,7",02a9f0b1bf9b81b6481199a507c68107,海门 山下 一 渔舟 中有 高人 未 白头 已 驾 安车 归 故里 尚通 闺籍 在 龙楼 泉 声 潄 玉 窗前 落 江色 和 烟槛 外流 今日 君臣 厚 终始 不须 辛苦 画 双牛
24baa1ad-c24f-4560-a4ba-d94b2ffc4761,京使回自临川得从兄书寄诗依韵和,徐铉,宋,诗,五言律诗,珍重还京使 殷勤话故人 别离长挂梦 宠禄不关身 趣向今成道 声华旧绝尘 莫嗟容鬓老 诗句逐时新,"5,5,5,5,5,5,5,5",d13d0cc8e022d8517ae8d5cd013bfa07,珍重 还 京 使 殷勤 话 故人 别离 长 挂 梦 宠禄 不 关身 趣 向 今 成道 声 华 旧 绝尘 莫嗟容鬓老 诗句 逐时 新
862bb5ef-1239-493a-bcad-2c667c5fd933,陪郑王相公赋簷前垂冰应教依韵,徐铉,宋,诗,七言律诗,窗外虚明雪乍晴 簷前垂霤尽成冰 长廊瓦叠行行密 晚院风高寸寸增 玉指乍拈簪尚愧 金阶时坠磬难胜 晨餐堪醒曹参酒 自恨空肠病不能,"7,7,7,7,7,7,7,7",4634090d38f35350a5970ee951bc4cff,窗外 虚明雪乍晴 簷 前 垂 霤 尽 成 冰 长廊 瓦 叠行 行密 晚院 风高寸寸增 玉指 乍 拈 簪尚 愧 金阶 时 坠 磬 难胜 晨餐 堪醒 曹 参酒 自恨 空肠 病 不能
0c29f3cb-9cbd-49fe-90df-74be8d7a9c36,送礼部潘尚书致仕还建安,徐铉,宋,诗,七言律诗,名遂功成累复轻 鲈鱼因起旧乡情 履声初下金华省 帆影看离石首城 化剑津头寻故老 同亭会上问仙卿 冥鸿高举真难事 相送何须泪满缨,"7,7,7,7,7,7,7,7",76afc9ac89c3a35d8976bedec8febb44,名 遂 功 成累 复轻 鲈鱼 因 起旧 乡情 履声 初下 金华 省 帆影 看离 石首 城 化剑 津头寻故 老 同亭 会上 问仙卿 冥 鸿 高举 真 难事 相 送 何须 泪 满 缨
3cc5cf60-013c-449d-af5e-149d7eb14387,和尉迟赞善病中见寄,徐铉,宋,诗,七言律诗,仙郎移病暑天过 却似冥鸿避罻罗 昼梦乍惊风动竹 夜吟时觉露沾莎 情亲稍喜贫居近 性懒犹嫌上直多 望苑恩深期勿药 青云岐路未蹉跎,"7,7,7,7,7,7,7,7",e29d613f7a2d91f6dc7e36656f2c0544,仙郎 移病 暑天 过 却 似 冥 鸿 避 罻 罗 昼梦 乍 惊风 动竹 夜 吟 时 觉露 沾 莎 情亲 稍 喜贫 居近 性懒 犹嫌 上 直 多 望苑恩 深期 勿药 青云 岐路 未 蹉跎
004cb6fb-9f53-4f05-b21f-1fc9780c0e4a,池州陈使君见示游齐山诗因寄,徐铉,宋,诗,七言律诗,往岁曾游弄水亭 齐峰浓翠暮轩横 哀猿出槛心虽喜 伤鸟闻弦势易惊 病后簪缨殊寡兴 老来泉石倍关情 今朝池口风波静 遥贺山前有颂声,"7,7,7,7,7,7,7,7",03c288b8278e77300fd629dfad6650b5,往 岁 曾 游 弄水 亭 齐峰 浓 翠暮轩 横 哀 猿 出 槛 心 虽 喜 伤鸟闻弦势易惊 病 后 簪缨 殊寡兴 老 来 泉石 倍 关情 今朝 池口 风波 静 遥 贺 山前 有 颂声
472870f9-36a3-4493-aa8f-3a7e0b44f92f,再领制诰和王明府见贺,徐铉,宋,诗,七言律诗,蹇步还依列宿边 拱辰重认旧云天 自嗟多难飘零困 不似当年胆气全 鸡树晚花疏向日 龙池轻浪细含烟 从来不解为身计 一叶悠悠任大川,"7,7,7,7,7,7,7,7",983cae5c0b7b62d66ce6b5c7c8c9d3af,蹇 步 还 依列 宿边 拱辰 重认旧 云天 自 嗟 多难 飘零 困 不 似 当年 胆气 全 鸡树 晚花 疏向 日 龙池 轻 浪细 含烟 从来不 解为 身计 一叶 悠悠 任 大川
d2682a22-cc50-4101-b1d0-78bf35a0159d,送高舍人使岭南,徐铉,宋,诗,五言古体,西掖官曹近 南溟道路遥 使星将渡汉 仙掌乍乘潮 柳映灵和折 梅依大庾飘 江帆风淅淅 山馆雨萧萧 陆贾真迂阔 终童久寂寥 送君何限意 把酒一长谣,"5,5,5,5,5,5,5,5,5,5,5,5",7ebf3f0adcb0b05ad06849c116725c9e,西掖 官 曹 近 南溟 道路 遥 使星 将 渡 汉 仙掌 乍 乘 潮 柳映灵 和 折 梅依大 庾飘 江帆 风 淅淅 山馆 雨 萧萧 陆贾真 迂阔 终童 久 寂寥 送君 何 限意 把酒 一 长 谣
38f4583c-0514-4fb8-aae0-e4517a197428,和王明府见寄,徐铉,宋,诗,七言律诗,时情世难消我道 薄宦流年厄此身 莫叹京华同寂寞 曾经兵革共漂沦 对山开户唯求静 贳酒留宾不道贫 善政空多尚淹屈 不知谁是解忧民,"7,7,7,7,7,7,7,7",3c28a2b494d6eeaedda9398478a5c319,时情 世难消 我 道 薄 宦流 年 厄 此身 莫叹 京华 同 寂寞 曾经 兵革 共 漂 沦 对 山 开户 唯求 静 贳 酒 留宾 不道 贫 善 政空 多 尚 淹屈 不知 谁 是 解忧 民
33146baf-43f8-4d0c-9eff-98ec5d5787f5,和方泰州见寄,徐铉,宋,诗,七言律诗,逐客凄凄重入京 旧愁新恨两难胜 云收楚塞千山雪 风结秦淮一尺冰 置醴筵空情岂尽 投湘文就思如凝 更残月落知孤坐 遥望船窗一点星,"7,7,7,7,7,7,7,7",ed60aac0b624c142c758b11344c1ed9c,逐客 凄凄 重入 京 旧愁新恨 两难 胜 云 收 楚塞 千山 雪 风结 秦淮 一尺 冰 置 醴筵 空情 岂 尽 投 湘 文 就 思如 凝 更 残月 落知 孤坐 遥望 船窗 一点 星
fce875ba-50c2-4b80-b04a-3d77c0b1e411,文献太子挽歌辞五首  其一,徐铉,宋,诗,五言律诗,国有承祧重 人知秉哲尊 清风来望苑 遗烈在东藩 此日升缑岭 何因到寝门 天高不可问 烟霭共昏昏,"5,5,5,5,5,5,5,5",5c015a7e65011af2f639b12d69d838f7,国有 承 祧 重 人 知 秉 哲尊 清风 来望 苑 遗烈 在 东藩 此日 升 缑 岭 何 因 到 寝门 天高 不可 问 烟霭 共 昏昏
1dd6f6f2-b24a-45d4-b9af-b288a9126499,文献太子挽歌辞五首  其二,徐铉,宋,诗,五言律诗,夏启我君子 周储上帝宾 音容一飘忽 功业自纷纶 露泣承华月 风惊丽正尘 空余商岭客 行哭下宜春,"5,5,5,5,5,5,5,5",ebc4c5d0c0306a95381eb08f489df49b,夏启 我 君子 周储 上帝 宾 音容 一 飘忽 功业 自 纷纶 露泣 承华 月 风惊丽正尘 空余 商岭 客 行 哭 下 宜春
