id,title,author,dynasty,genre,poem_type,sentences_simplified,meter_pattern,hash,words
408b97c2-539c-45dd-90e1-e03935b04202,春雨,齊己,唐,诗,五言律诗,欲布如膏势 先闻动地雷 云龙相得起 风电一时来 霡霂农桑野 冥蒙杨柳台 何人待晴暖 庭有牡丹开,"5,5,5,5,5,5,5,5",fb64a3888c8f7d78284a80c9239a71c1,欲 布如 膏势 先闻 动 地雷 云龙 相得 起 风电 一时 来 霡 霂 农桑 野 冥蒙 杨柳 台 何人 待 晴 暖 庭 有 牡丹 开
629c6e7b-3662-444b-a22b-8df30f90b1a7,明月峰,齊己,唐,诗,五言律诗,明月峰头石 曾闻学月明 别舒长夜彩 高照一村耕 颇乱无私理 徒惊鄙俗情 传云遭凿后 顽白在峥嵘,"5,5,5,5,5,5,5,5",0ab9cae36b812f5065883daf868ac1f0,明月 峰头 石 曾 闻 学 月 明 别舒 长夜 彩 高照 一村 耕 颇 乱 无私 理 徒 惊 鄙俗 情 传云 遭凿 后 顽白 在 峥嵘
347ff74b-3ac5-4a01-b2c4-a15222b967c7,謝人惠紫栗拄杖,齊己,唐,诗,五言律诗,仙掌峰前得 何当此见遗 百年衰朽骨 六尺岁寒姿 雪外兼松凭 泉边待月欹 他时出山去 犹谢见相随,"5,5,5,5,5,5,5,5",c562be1705274d2557cb7698934361c1,仙 掌峰 前得 何 当此 见 遗 百年 衰朽 骨 六尺 岁寒 姿 雪 外 兼松 凭 泉 边 待 月 欹 他时 出山 去 犹谢 见 相随
3f9132ae-c791-4d4c-9ffd-034199d38222,送人遊湘湖,齊己,唐,诗,五言律诗,君游南国去 旅梦若为宁 一路随鸿鴈 千峰遶洞庭 林明枫尽落 野黑烧初经 有兴寻僧否 湘西寺最灵,"5,5,5,5,5,5,5,5",7766f41e03541f8eb7c7fff5dcb9fd3d,君游 南国 去 旅梦 若 为 宁 一路 随 鸿 鴈 千峰 遶 洞庭 林明枫 尽 落 野黑 烧 初经 有兴 寻僧 否 湘西 寺 最 灵
f969d44e-8927-4fb8-869b-be86c2234ebb,小松,齊己,唐,诗,五言律诗,发地才过膝 蟠根已有灵 严霜百草白 深院一林青 后夜萧骚动 空阶蟋蟀听 谁于千岁外 吟遶老龙形,"5,5,5,5,5,5,5,5",863f20917b31f1a6be51d5ce304fecd3,发地 才 过膝 蟠根 已有 灵 严霜 百草 白 深院 一 林青 后夜 萧 骚动 空阶 蟋蟀 听 谁 于 千岁 外 吟 遶 老 龙形
3dc51ba0-80f6-44d9-8a2b-57ecbc59e8a4,金江寓居,齊己,唐,诗,五言律诗,考槃应未永 聊此养闲疎 野趣今何似 诗题旧不如 春篁离箨尽 陂藕折花初 终要秋云是 从风恣卷舒,"5,5,5,5,5,5,5,5",a01329f9df018d1a7524661da9c12a3e,考 槃 应 未 永 聊 此 养 闲 疎 野趣 今 何 似 诗题 旧 不如 春 篁 离 箨 尽 陂 藕 折花 初 终要 秋云 是 从 风恣 卷舒
abbbd055-7935-417b-9ea6-db52300d5806,晚夏金江寓居答友生,齊己,唐,诗,五言律诗,日日冲残热 相寻入乱蒿 闲中滋味远 诗里是非高 碧耸新生竹 红垂半熟桃 时难未可出 且欲淬豪曹,"5,5,5,5,5,5,5,5",799f4beab2b453a3860a97b807929aad,日日 冲残 热 相 寻入 乱 蒿 闲 中 滋味 远 诗 里 是非 高 碧 耸 新生 竹 红垂 半熟 桃 时 难未 可出 且 欲 淬豪 曹
a5a855ad-92d2-495f-afc6-8a692eeed140,寄李洞秀才,齊己,唐,诗,五言律诗,到处听时论 知君屈最深 秋风几西笑 抱玉但伤心 野水翻红藕 沧江老白禽 相思未相识 闻在蜀中吟,"5,5,5,5,5,5,5,5",9b4f3c63ebd97a8808fad8e3769c5a3d,到处 听 时论 知君屈 最深 秋风 几西 笑 抱 玉 但 伤心 野水 翻红 藕 沧江 老 白禽 相思 未 相识 闻 在 蜀中 吟
0068feff-a674-4cda-b330-8ea23ab56a1c,過商山,齊己,唐,诗,五言律诗,叠叠叠岚寒 红尘翠里盘 前程有名利 此路莫艰难 云水侵天老 轮蹄到月残 何能寻四皓 过尽见长安,"5,5,5,5,5,5,5,5",1234384ea623167194a4a1d1beba0ae5,叠叠 叠 岚 寒 红尘 翠里盘 前程 有 名利 此路 莫 艰难 云 水侵 天老 轮蹄 到 月 残 何能寻 四皓 过尽 见 长安
fd5c1942-a090-468c-a456-6c4c5a2f49d2,蟬八韻,齊己,唐,诗,五言古体,咽咽复啾啾 多来自早秋 园林凉正好 风雨思相收 在处声无别 何人泪欲流 冷怜天露滴 伤共野禽游 静息深依竹 惊移瞥过楼 分明晴渡口 凄切暮关头 时节推应定 飞鸣即未休 年年闻尔苦 远忆所居幽,"5,5,5,5,5,5,5,5,5,5,5,5,5,5,5,5",822a448bb955fa66cf7567fcb18579ef,咽 咽 复 啾 啾 多 来自 早秋 园林 凉 正好 风雨 思相 收 在 处声 无别 何人 泪欲流 冷怜天 露 滴 伤 共 野禽 游 静息 深依 竹 惊移 瞥 过 楼 分明 晴 渡口 凄切 暮 关头 时节 推应 定 飞鸣 即未 休 年 年 闻尔 苦 远忆所居幽
af9018bc-b647-4429-9b00-413fa12bfc69,鷺鷥二首 一,齊己,唐,诗,五言律诗,日日沧江去 时时得意归 自能终洁白 何处悮翻飞 晚立银塘阔 秋栖玉露微 残阳苇花畔 双下钓鱼矶,"5,5,5,5,5,5,5,5",0a82edb4b6893a6f9790d1dee66f6b33,日日 沧江 去 时时 得意 归 自能终 洁白 何处 悮 翻飞 晚 立 银塘阔 秋栖 玉露 微 残阳 苇花畔 双 下 钓鱼 矶
b09d4d44-088a-4694-9263-549fc3af24f9,鷺鷥二首 二,齊己,唐,诗,五言律诗,雪里曾迷我 笼中旧养君 忽从红蓼岸 飞出白鸥群 影照翘滩浪 翎濡宿岛云 鸳鸿解相忆 天上列纷纷,"5,5,5,5,5,5,5,5",0c649a73a96c04b8c0aa8f1192ebd652,雪里曾 迷 我 笼 中 旧 养君 忽 从 红蓼岸 飞出 白鸥群 影照 翘 滩 浪 翎 濡 宿岛 云 鸳鸿 解 相忆 天上 列 纷纷
8ff20737-ba4e-482e-b1d6-b053ecd0c713,送僧歸南岳,齊己,唐,诗,五言律诗,浊世住终难 孤峰念永安 逆风眉磔磔 冲雪锡珊珊 石室关霞嫩 松枝拂藓干 岩猨应认得 连臂下句栏,"5,5,5,5,5,5,5,5",fb5051cb1dd25c949fc97f8d6cc6a3c8,浊世 住 终难 孤峰 念 永安 逆风 眉 磔 磔 冲雪 锡珊珊 石室 关霞嫩 松枝 拂藓 干 岩 猨 应 认得 连臂 下 句 栏
8f086365-2930-4dde-9ac3-a922af30550c,夏日林下作,齊己,唐,诗,五言律诗,烦暑莫相煎 森森在眼前 暂来还尽日 独坐只闻蝉 草媚终难死 花飞卒未蔫 秋风舍此去 满箧贮新篇,"5,5,5,5,5,5,5,5",a3396007abd2227ff44d4e56539370b8,烦暑 莫相 煎 森森 在 眼前 暂来 还 尽 日 独坐 只 闻 蝉 草 媚 终难 死 花飞 卒 未 蔫 秋风 舍此 去 满 箧 贮 新篇
e1b41c40-52db-462b-a6e0-543cdc5ffe5a,村居寄懷,齊己,唐,诗,五言律诗,风雨如尧代 何心欲退藏 诸侯行教化 下国自耕桑 道挫时机尽 禅留话路长 前溪久不过 忽觉早禾香,"5,5,5,5,5,5,5,5",a6ad43f15ceaf04fb7fe70c191e257bc,风雨 如 尧 代 何心欲 退藏 诸侯 行 教化 下国 自耕 桑 道 挫 时机 尽 禅 留话 路长 前 溪 久 不过 忽觉 早 禾 香
7386ed93-4b1f-4618-a5bd-93f18f55b0f0,酬王秀才,齊己,唐,诗,五言律诗,相于分倍亲 静论到吟真 王泽曾无外 风骚甚少人 鸿随秋过尽 雪向腊飞频 何处多幽胜 期君作近邻,"5,5,5,5,5,5,5,5",61b67fd3969fda398f5cc3f65e7860b8,相于 分倍 亲 静论 到吟 真 王泽曾 无外 风骚 甚 少 人 鸿 随 秋过尽 雪向腊 飞频 何处 多 幽胜 期君 作 近邻
32c9245c-8730-4b81-b133-5427f14946ce,贈無本上人,齊己,唐,诗,五言律诗,往年吟月社 因乱散扬州 未免无端事 何妨出世流 洞庭禅过腊 衡岳坐经秋 终说将衣钵 天台老去休,"5,5,5,5,5,5,5,5",e278404aa98a54b3cb547c79b8619e46,往年 吟 月 社 因 乱散 扬州 未免 无端 事 何妨 出世 流 洞庭 禅 过腊 衡岳 坐 经秋 终 说 将 衣钵 天台 老 去 休
2b9e51e7-dd6e-4fdb-a12c-dd083ebea766,寄華山司空圖,齊己,唐,诗,五言律诗,天下艰难际 全家入华山 几劳丹诏问 空见使臣还 瀑布寒吹梦 莲峰翠湿关 兵戈阻相访 身老瘴云间,"5,5,5,5,5,5,5,5",df54388998a1130bebe0a57baa2b0075,天下 艰难 际 全家 入 华山 几劳丹 诏 问 空 见 使臣 还 瀑布 寒 吹 梦 莲峰 翠 湿关 兵戈 阻 相访 身老瘴 云间
e0147be6-bd00-47a4-b53d-841accddaa08,題真州精舍,齊己,唐,诗,五言律诗,波心精舍好 那岸是繁华 碍目无高树 当门即远沙 晨斋来海客 夜磬到渔家 石鼎秋涛静 禅回有岳茶,"5,5,5,5,5,5,5,5",9fc7809d03bf516ae8bb5ffa9b6c57b6,波心 精舍 好 那 岸 是 繁华 碍目 无 高树 当门 即 远 沙 晨 斋 来 海客 夜 磬 到 渔家 石鼎秋涛 静 禅 回有 岳茶
ff75ba70-8fcb-434d-ba52-cecff1bfd2f7,懷道林寺因寄仁用二上人,齊己,唐,诗,五言律诗,名山知不远 长忆寺门松 昨晚登楼见 前年过夏峰 雨余云脚树 风外日西钟 莫更来东岸 红尘没马踪,"5,5,5,5,5,5,5,5",96ad55a8acf1b7d67635e426c318ff1f,名山 知 不远 长忆 寺门 松 昨晚 登楼 见 前年 过 夏峰 雨余 云脚 树 风 外 日西 钟 莫 更 来 东岸 红尘 没马 踪
cb216bc4-0d81-479f-a3ef-2ee9faa1ed11,尋陽道中作,齊己,唐,诗,五言律诗,秋声连岳树 草色徧汀洲 多事时为客 无人处上楼 云疎片雨歇 野阔九江流 欲向南朝去 诗僧有惠休,"5,5,5,5,5,5,5,5",1e10e57a668acb19f37478f92ea3677e,秋声 连岳树 草 色 徧 汀洲 多 事 时 为 客 无人 处 上楼 云 疎 片 雨 歇 野阔 九江 流 欲 向 南朝 去 诗僧 有惠 休
74054d40-b588-4403-a595-55698869fc34,東林雨後望香爐峰,齊己,唐,诗,五言律诗,翠湿僧窗里 寒堆鸟道边 静思寻去路 急遶落来泉 暮雨开青壁 朝阳照紫烟 二林多长老 谁忆上头禅,"5,5,5,5,5,5,5,5",b4808ab3311385762b02e99cb197cafe,翠 湿 僧 窗里 寒堆 鸟道 边 静思寻 去路 急 遶 落 来 泉 暮 雨 开 青壁 朝阳 照 紫烟 二林 多 长老 谁 忆 上头 禅
576da9e4-fb3f-47ca-8b1b-ee3171a66d33,寄雙泉大師師兄,齊己,唐,诗,五言律诗,清泉流眼底 白道倚岩棱 后夜禅初入 前溪树折冰 南凉来的的 北魏去腾腾 敢把吾师意 密传门外僧,"5,5,5,5,5,5,5,5",43b503d42ab4829b9e300b29f91c5d51,清泉 流 眼底 白道倚 岩 棱 后夜 禅 初 入 前溪 树折 冰 南凉 来的 的 北魏 去 腾腾 敢 把 吾师 意 密 传 门外 僧
24875964-dec1-410b-8bb8-f10fb93eb57d,送人潤州尋兄弟,齊己,唐,诗,五言律诗,君话南徐去 迢迢过建康 弟兄新得信 鸿鴈久离行 木落空林浪 秋残渐雪霜 闲游登北固 东望海苍苍,"5,5,5,5,5,5,5,5",d53d61053bc17ebbc7402580512ab7ab,君话 南 徐 去 迢迢 过 建康 弟兄 新 得 信 鸿 鴈 久 离 行 木 落空 林浪 秋残 渐雪霜 闲游 登北 固 东 望海 苍苍
d79dd82d-2f37-4304-b510-62b446485d1d,貽張生,齊己,唐,诗,五言律诗,日日见入寺 未曾含酒容 闲听老僧语 坐到夕阳钟 竹里行多影 花边偶过踪 犹言谢生计 随我去孤峰,"5,5,5,5,5,5,5,5",7051ed77856db85cd625c056e11cc85e,日日 见入 寺 未曾 含 酒容 闲 听 老僧 语 坐 到 夕阳 钟 竹 里 行 多 影 花边 偶 过踪 犹言谢 生计 随 我 去 孤峰
acc06edc-6b58-4a25-a462-d4541e9a2fb2,送人遊雍京,齊己,唐,诗,五言律诗,君来乞诗别 聊与怆前程 九野未无事 少年何远行 商云盘翠险 秦甸下烟平 应见周南化 如今在雍京,"5,5,5,5,5,5,5,5",cd9fc9eced421aaab89e40bd6bfe3407,君 来 乞诗 别 聊 与 怆 前程 九野未无事 少年 何 远行 商 云盘 翠险 秦甸 下 烟平 应见 周南 化 如今 在 雍京
700b5dfc-8c45-40b4-a559-20494d5ff44f,春草,齊己,唐,诗,五言律诗,处处碧萋萋 平原带日西 堪随游子路 远入鹧鸪啼 金谷园应没 夫差国已迷 欲寻兰蕙径 荒秽满汀畦,"5,5,5,5,5,5,5,5",99dda9df810bbe5de232ca702cc10f58,处处 碧 萋 萋 平原 带 日西 堪随 游子 路 远入 鹧鸪 啼 金谷园 应 没 夫差 国 已 迷 欲 寻兰蕙 径 荒秽 满汀 畦
d6db9572-1035-4fdf-9e29-efca749f51e5,懷華頂道人,齊己,唐,诗,五言律诗,华顶星边出 真宜上士家 无人触床榻 满屋贮烟霞 坐卧临天井 晴明见海涯 禅余石桥去 屐齿印松花,"5,5,5,5,5,5,5,5",093a2664bb900eb2ca3c3dd94c3c7a96,华顶 星边 出 真宜 上士 家 无人 触 床榻 满屋 贮 烟霞 坐 卧临 天井 晴明 见 海涯 禅余 石桥 去 屐 齿印 松花
32216375-4854-487a-b2be-b89a6d9f8148,寄自牧上人,齊己,唐,诗,五言律诗,五老回无计 三峰去不成 何言谢云鸟 此地识公卿 梦媿将僧说 心嫌触类生 南朝古山寺 曾忆共寻行,"5,5,5,5,5,5,5,5",d48dbc7d37438a0cd6994e32654bdceb,五 老 回 无计 三峰 去不成 何言 谢云鸟 此地 识 公卿 梦 媿 将 僧 说 心嫌 触类 生 南朝 古山 寺 曾忆 共 寻行
26ef4d65-5bc5-4d4f-b157-4f41b66b81e5,靜坐,齊己,唐,诗,五言律诗,日日只腾腾 心机何以兴 诗魔苦不利 禅寂颇相应 砚满尘埃点 衣多作卧棱 如斯自消息 合是个闲僧,"5,5,5,5,5,5,5,5",98060899ff1b04086e77a6ef15f4551d,日日 只 腾腾 心机 何以 兴 诗 魔 苦 不利 禅寂 颇 相应 砚 满 尘埃 点 衣多作卧棱 如斯自 消息 合 是 个 闲僧
532305fe-18ed-4cf1-b2b3-6a8efee3512d,送人遊衡岳,齊己,唐,诗,五言律诗,荆楚腊将残 江湖苍莽间 孤舟载高兴 千里向名山 雪浪来无定 风帆去是闲 石桥僧问我 应寄岳茶还,"5,5,5,5,5,5,5,5",5dd9f11a1c2988ee62701510a28f880b,荆楚腊 将 残 江湖 苍莽 间 孤舟载 高兴 千里 向 名山 雪浪 来 无定 风帆 去 是 闲 石桥 僧 问 我 应寄岳 茶 还
ef031c67-5e6e-441e-a405-b9c8dbef1c45,荅知己自闕下寄書,齊己,唐,诗,五言律诗,故人劳札翰 千里寄荆台 知恋文明在 来寻江汉来 群机喧白昼 陆海涨黄埃 得路应相笑 无成守死灰,"5,5,5,5,5,5,5,5",3923d05a5d96529b7f10ab648ad6b8f5,故人 劳札翰 千里 寄 荆台 知恋 文明 在 来 寻 江汉 来 群机 喧 白昼 陆海 涨 黄埃 得 路 应 相笑 无成 守 死灰
b7ade9e4-a623-4b61-978d-6aff8147a113,新笋,齊己,唐,诗,五言律诗,乱迸苔钱破 参差出小栏 层层离锦箨 节节露琅玕 直上心终劲 四垂烟渐宽 欲知含古律 试剪凤箫看,"5,5,5,5,5,5,5,5",fa680461c0a18c0d92f3595ca48ee962,乱 迸 苔 钱 破 参差 出 小栏 层层 离 锦 箨 节节 露 琅玕 直 上心 终劲 四 垂 烟 渐 宽 欲 知含 古律 试剪 凤箫 看
24ffa383-10c1-4ef6-8ea8-e9848276aed2,寄唐洙處士,齊己,唐,诗,五言律诗,行僧去湘水 归鴈度荆门 彼此亡家国 东西役梦魂 多慵如长傲 久住不生根 曾问兴亡事 丁宁寄勿言,"5,5,5,5,5,5,5,5",6d330e6fd97b1018ea92fbd27bf73507,行僧 去 湘水 归 鴈 度 荆门 彼此 亡家 国 东西 役 梦 魂 多 慵 如 长傲 久 住 不 生根 曾 问 兴亡 事 丁宁 寄 勿言
faaae310-4449-42da-ae3c-d5b44769c6ec,謝人惠竹蠅拂,齊己,唐,诗,五言律诗,妙刮筠篁制 纤柔玉柄同 拂蝇声满室 指月影摇空 敢舍经行外 常将宴坐中 挥谈一无取 千万媿生公,"5,5,5,5,5,5,5,5",d19e9ed1ce24a71b5da11865219437b0,妙 刮 筠 篁 制 纤柔 玉柄 同 拂 蝇 声 满室 指 月影 摇空 敢舍 经行 外 常将宴 坐 中 挥谈 一 无取 千万 媿 生 公
eaa53729-5851-4d2a-8b41-990b07014c9b,新燕,齊己,唐,诗,五言律诗,燕燕知何事 年年应候来 却缘华屋在 长得好时催 花外衔泥去 空中接食回 不同黄雀意 迷逐网罗媒,"5,5,5,5,5,5,5,5",734862cab6c1c4a481588a77e7fc15d3,燕燕 知 何事 年 年 应候 来 却 缘 华屋 在 长 得 好 时 催 花外 衔泥 去 空中 接食 回 不同 黄雀 意 迷逐 网罗 媒
ecd1e51d-7705-4ddb-98a2-ecb9b56bee62,謝王先輩寄氈,齊己,唐,诗,五言律诗,深谢高科客 名毡寄惠重 静思生朔漠 和雪长蒙茸 折坐资禅悦 铺眠减病容 他年从破碎 担去卧孤峰,"5,5,5,5,5,5,5,5",b9b824e5ae18b0ddaa0dbb66d9efc405,深 谢高科 客 名毡 寄惠 重 静思生 朔漠 和 雪长蒙茸 折坐 资禅 悦 铺眠 减 病容 他 年 从 破碎 担去 卧 孤峰
8b9c7c5b-3e12-427a-b6fc-564760456159,寄還闕下高輦先輩卷,齊己,唐,诗,五言律诗,去岁逢京使 因还所寄诗 难留天上作 曾换月中枝 趣极僧迷旨 功深鬼不知 仍闻得名后 特地更忘疲,"5,5,5,5,5,5,5,5",265839e36eb5089a283ed6cbb98494c4,去岁 逢 京 使 因 还 所 寄 诗 难 留 天上 作 曾 换 月 中枝 趣极僧 迷旨 功 深 鬼 不知 仍 闻 得名 后 特地 更 忘 疲
3b7b986e-cd7d-4350-82ef-1a7d0d662a4b,和孫支使惠示院中庭竹之什,齊己,唐,诗,五言律诗,忆就江僧乞 和烟得一茎 剪黄憎旧本 科绿惜新生 护噪蝉身稳 资吟客眼明 星郎有佳咏 雅合此君声,"5,5,5,5,5,5,5,5",2cc31ed54cd36bb2f077d8f825d94965,忆 就 江僧 乞 和 烟 得 一 茎 剪 黄憎 旧本 科绿惜 新生 护噪 蝉身 稳 资吟 客眼 明 星郎 有 佳 咏 雅合 此君 声
ab29e751-dee0-4fa2-ab51-9fc2b6a76058,苦熱中江上懷爐峰舊居,齊己,唐,诗,五言律诗,旧寄炉峰下 杉松遶石房 年年五六月 江上忆清凉 久别应荒废 终归隔渺茫 何当便摇落 披衲玩秋光,"5,5,5,5,5,5,5,5",0a8f3bcdb52f0acb4f1e3fe0d5ac7434,旧 寄 炉峰 下 杉 松 遶 石 房 年 年 五六月 江上忆 清凉 久别 应 荒废 终归 隔 渺茫 何当 便 摇落 披 衲 玩 秋光
101ceb21-6e66-457b-91b4-7d5ce891c4a0,送僧遊龍門香山寺,齊己,唐,诗,五言绝句,君到香山寺 探幽莫损神 且寻风雅主 细看乐天真,"5,5,5,5",b3496d9ca3da1bf8db6c4abbb1d7ede6,君 到 香山寺 探幽莫 损神 且 寻 风雅 主 细看 乐天 真
be0d5be9-5b04-4d28-8556-1f039ca31a99,江上值春雨,齊己,唐,诗,五言律诗,江臯正月雨 平陆亦波澜 半是峨嵋雪 重为泽国寒 农田淹寖尽 客櫂往来难 愁杀骚人路 沧浪正渺漫,"5,5,5,5,5,5,5,5",fa684b3e80c169cad7c77cb7c6083ed1,江 臯 正月 雨 平陆 亦 波澜 半 是 峨嵋 雪 重 为 泽国 寒 农田 淹 寖 尽 客 櫂 往来 难 愁 杀 骚人 路 沧浪 正 渺漫
2f300006-2568-4c7e-a6d8-45d674dc30ab,七十作,齊己,唐,诗,五言律诗,七十去百岁 都来三十春 纵饶生得到 终免死无因 密理方通理 栖真始见真 沃洲匡阜客 几劫不迷人,"5,5,5,5,5,5,5,5",cbe78ecd0784003c1bb630e4885c5fa7,七十 去 百岁 都 来 三十 春 纵饶 生 得到 终免 死 无 因 密理方 通理 栖 真 始见 真 沃洲 匡 阜客 几 劫 不 迷人
aac88dd4-40e4-48e0-b613-e22b305ef1e6,謝虛中寄新詩,齊己,唐,诗,五言律诗,旧友一千里 新诗五十篇 此文经大匠 不见已多年 趣极同无迹 精深合自然 相思把行坐 南望隔尘烟,"5,5,5,5,5,5,5,5",45ed7e55d683a6e7d7ad4c3fad795dcf,旧友 一千里 新诗 五十篇 此文 经 大匠 不见 已 多年 趣 极同 无迹 精深 合 自然 相思 把行 坐 南望 隔 尘烟
f2f9f1d7-4122-41b2-ac92-357d0fe05e00,送彬座主赴龍安請講,齊己,唐,诗,五言律诗,两论久研精 龙安受请行 春城雨雪霁 古寺殿堂明 白发老僧听 金毛师子声 同流有谁共 别著国风清,"5,5,5,5,5,5,5,5",4184ccdc3d2db8863ca935cdac64bc58,两 论 久 研精 龙安 受请 行 春城 雨雪 霁 古寺 殿堂 明 白发 老僧 听 金毛 师子声 同 流有 谁 共 别著 国风 清
a4c5f940-e701-45ec-ae27-7b63cae6ae7d,夏日荆渚書懷,齊己,唐,诗,五言律诗,嵩岳去值乱 匡庐回阻兵 中途息瓶锡 十载依公卿 不那猨鸟性 但怀林泉声 何时遂情兴 吟遶杉松行,"5,5,5,5,5,5,5,5",4f297e831934369784b87379938ae8ba,嵩岳 去 值 乱 匡庐 回阻 兵 中途 息 瓶 锡 十载 依 公卿 不那 猨 鸟 性 但 怀林泉 声 何时 遂情 兴 吟 遶 杉 松 行
25eab67e-065e-4ca3-9464-9b55a950813c,春日西湖作,齊己,唐,诗,五言绝句,一水遶孤岛 闲门掩春草 曾无长者辙 枉此问衰老,"5,5,5,5",17624bffca3b0549192c1a2e89b3c8de,一 水 遶 孤岛 闲门 掩 春草 曾 无 长者 辙 枉此 问 衰老
32796434-5818-4ebb-ab20-16e6d6951086,謝中上人寄茶,齊己,唐,诗,五言律诗,春山谷雨前 并手摘芳烟 绿嫩难盈笼 清和易晚天 且招邻院客 试煮落花泉 地远劳相寄 无来又隔年,"5,5,5,5,5,5,5,5",f5dbd75e509b149431fdd770552bbf63,春 山谷 雨前 并 手摘 芳烟 绿 嫩 难 盈笼 清 和 易 晚天 且 招邻 院客 试 煮 落花 泉 地远劳 相 寄 无来 又 隔 年
dd83d4bd-984a-4b86-9b25-abea03996ac4,送節大德歸闕,齊己,唐,诗,五言律诗,西京曾入内 东洛又朝天 圣上方虚席 僧中正乏贤 晨光金殿里 紫气玉帘前 知祝唐尧化 新恩异往年,"5,5,5,5,5,5,5,5",4d32f78eae932e04ce878c75ee6f03b5,西京 曾 入 内 东洛 又 朝 天 圣上 方 虚席 僧 中正 乏贤 晨光 金殿 里 紫气 玉帘 前 知祝 唐尧 化 新恩异 往年
dab0b054-181b-4058-aca9-7fdd9f1fe00d,覽清尚卷,齊己,唐,诗,五言律诗,李洞僻相似 得诗先示师 鬼神迷去处 风日背吟时 格已搜清竭 名还着紫卑 从容味高作 翻为古人疑,"5,5,5,5,5,5,5,5",3cf0b156de14f0c2e52f5857a82ba5d8,李洞 僻 相似 得 诗 先示 师 鬼神 迷 去处 风日 背吟 时 格已 搜清 竭 名 还 着 紫卑 从容 味 高 作 翻 为 古人 疑
adee4133-be4b-4325-8c55-752c589be191,荆門送晝公歸彭澤舊居,齊己,唐,诗,五言律诗,彭泽旧居在 匡庐翠叠前 因思从楚寺 便附入吴船 岸遶春残树 江浮晓霁天 应过虎溪社 伫立想诸贤,"5,5,5,5,5,5,5,5",6d515eec0892cb345a66819d12684249,彭泽 旧居 在 匡庐翠 叠 前 因思 从 楚寺 便 附入 吴 船 岸 遶 春 残 树 江 浮晓霁 天 应过 虎溪 社 伫立 想 诸贤
8a0ef495-fc54-48d2-ae3e-e9bd88ab8523,登祝融峯,齊己,唐,诗,五言律诗,猨鸟共不到 我来身欲浮 四边空碧落 绝顶正清秋 宇宙知何极 华夷见细流 坛西独立久 白日转神州,"5,5,5,5,5,5,5,5",0736809f043bab07b4248c6a9b1bec63,猨 鸟 共 不到 我 来 身 欲 浮 四边 空 碧落 绝顶 正 清秋 宇宙 知 何 极 华夷 见 细流 坛 西 独立 久 白日 转 神州
65e9f151-6e57-4d6e-bb55-fa20321f0992,寄貫休,齊己,唐,诗,五言律诗,子美曾吟处 吾师复去吟 是何多胜地 销得二公心 锦水流春阔 峨嵋叠雪深 时逢蜀僧说 或道近游黔,"5,5,5,5,5,5,5,5",601f76122a976524944b2098c3b9e297,子美曾 吟 处 吾师 复去 吟 是 何 多 胜地 销得 二 公心 锦 水流 春 阔 峨嵋 叠 雪深 时逢 蜀 僧 说 或 道 近 游 黔
012628f0-7000-4266-9d08-9f17234f9c35,送唐稟正字歸萍川,齊己,唐,诗,五言律诗,霜须芸阁吏 久掩白云扉 来谒元戎后 还骑病马归 烟村蔬饮淡 江驿雪泥肥 知到中林日 春风长涧薇,"5,5,5,5,5,5,5,5",c5927084cf712719926b36d979382f20,霜 须芸阁 吏 久 掩 白云 扉 来 谒 元戎 后 还 骑 病 马 归 烟村 蔬饮 淡 江驿 雪 泥肥 知到 中林 日 春风 长 涧 薇
2bc4e451-749c-4b0e-a0e1-91eaf750b679,寄懷江西栖公,齊己,唐,诗,五言律诗,龙沙为别日 庐阜得书年 不见来香社 相思遶白莲 江僧归海寺 楚路接吴烟 老病何堪说 扶羸寄此篇,"5,5,5,5,5,5,5,5",21b07345d30001594a416d432d0ba9e7,龙沙 为 别日 庐阜 得书 年 不见 来 香 社 相思 遶 白莲 江僧 归海 寺 楚路 接 吴 烟 老病 何堪 说 扶 羸寄 此 篇
0d9f31c2-c991-4291-9e0e-a77b877719a2,山中喜得友生書,齊己,唐,诗,五言律诗,柴门关树石 未省梦尘埃 落日啼猨里 同人有信来 自成为拙隐 难以谢多才 见说相思处 前峰对古台,"5,5,5,5,5,5,5,5",1ee68714a4f7e5496d1b18f10c18cae5,柴门 关树石 未省 梦 尘埃 落日 啼 猨 里 同 人 有 信来 自 成为 拙 隐 难以 谢多才 见 说 相思 处 前峰 对 古台
36f396a8-4e27-466a-89ea-77a57dc8a632,謝人惠扇子及茶,齊己,唐,诗,五言律诗,鎗旗封蜀茗 圆洁制鲛绡 好客分烹煮 青蝇避动摇 陆生夸妙法 班女恨凉飙 多谢崔居士 相思寄寂寥,"5,5,5,5,5,5,5,5",959150f45d7db2583696f93ed2c3f8cb,鎗 旗 封 蜀 茗 圆洁 制 鲛绡 好客 分 烹煮 青蝇 避 动摇 陆生 夸 妙法 班女 恨 凉 飙 多谢 崔 居士 相思 寄 寂寥
9cc69a02-6180-4801-8378-d9f7f2e4b6d9,寄監利司空學士,齊己,唐,诗,五言律诗,诗家为政别 清苦日闻新 乱后无荒地 归来尽远人 宽容民赋税 憔悴吏精神 何必河阳县 空传桃李春,"5,5,5,5,5,5,5,5",379cb4e02fca3aaa599e413448a8bf64,诗家 为政 别 清苦 日 闻 新 乱后无 荒地 归来 尽远 人 宽容 民 赋税 憔悴 吏 精神 何必 河阳 县 空传 桃李 春
ba9d2070-76f4-4239-984d-a8999ed41639,荅陳秀才,齊己,唐,诗,五言律诗,万事皆可了 有诗门最深 古人难得志 吾子苦留心 野叠凉云朵 苔重怪木阴 他年立名字 笑我老双林,"5,5,5,5,5,5,5,5",ceb52c5c5d5e4e937c9ceafa01940a3e,万事 皆 可 了 有 诗门 最深 古人 难得 志 吾子 苦 留心 野叠 凉 云朵 苔 重怪 木阴 他 年 立 名字 笑 我 老 双林
5b720442-c06f-4d1c-9bd6-b77fe6b8f866,遊橘洲,齊己,唐,诗,五言律诗,春日上芳洲 经春兰杜幽 此时寻橘岸 昨日在城楼 鹭立青枫杪 沙沈白浪头 渔家好生计 簷底系扁舟,"5,5,5,5,5,5,5,5",d7bc2432ceac1b58ae14091fa8f26bbf,春日 上芳洲 经 春兰 杜幽 此时 寻 橘岸 昨日 在 城楼 鹭 立青枫 杪 沙沈 白浪 头 渔家 好 生计 簷 底系 扁舟
80fbef34-d9af-46b6-a956-eae7d192aa37,寄武陵道友,齊己,唐,诗,五言律诗,阮肇迷仙处 禅门接紫霞 不知寻鹤路 几里入桃花 晚树阴摇藓 春潭影弄砂 何当见招我 乞与片生涯,"5,5,5,5,5,5,5,5",81d49d82107edd8defc3f393433646f7,阮肇迷 仙 处 禅门 接 紫霞 不知 寻鹤路 几里 入 桃花 晚 树阴 摇藓 春 潭影 弄 砂 何当 见 招 我 乞与片 生涯
6a150b95-ea6a-4072-9e97-7a5df29a24e9,謝人惠藥,齊己,唐,诗,五言律诗,五金元造化 九炼更精新 敢谓长生客 将遗必死人 久餐应换骨 一服已通神 终逐淮王去 永抛浮世尘,"5,5,5,5,5,5,5,5",cb728db3257513a41468433af6149865,五 金元 造化 九 炼 更 精新 敢谓 长生 客 将 遗 必 死 人 久 餐 应换 骨 一服 已 通神 终逐 淮 王 去 永 抛浮 世尘
1c50308e-e896-4d0b-94eb-20eaf22548f8,還族弟卷,齊己,唐,诗,五言律诗,岂要私相许 君诗自入神 风骚何句出 瀑布一联新 □若长如此 名须远逐身 闲斋舒复卷 留滞忽经旬,"5,5,5,5,5,5,5,5",0ec8e1c18aec9c494c31d0eb6c05c725,岂 要 私相 许 君诗 自 入神 风骚 何 句 出 瀑布 一 联新 □ 若长 如此 名 须 远 逐身 闲 斋 舒复卷 留滞 忽经 旬
