id,title,author,dynasty,genre,poem_type,sentences_simplified,meter_pattern,hash,words
ea0fc2ab-c351-463d-a648-e26dc519e970,和张彦智对雪,王之道,唐,诗,七言律诗,雪山何处觅瞿昙 压尽江南瘴与岚 待伴可堪风作党 交光应喜月成三 濯巾漉酒供杯勺 涉笔联诗尚笑谈 柳絮自今轻谢句 使君才气擅东南,"7,7,7,7,7,7,7,7",48e2fdd15602c8968244bf5de2b19e2c,雪山 何处 觅瞿 昙 压尽 江南 瘴与岚 待伴 可堪 风作党 交光 应喜 月 成 三 濯 巾 漉 酒 供 杯 勺 涉笔 联诗 尚 笑谈 柳絮 自今 轻谢 句 使君 才气 擅 东南
f538667d-12f4-474c-9776-aea965313635,苦寒,王之道,唐,诗,七言律诗,风屑琼寒透薄帷 拥裘端与火相宜 煖回炽焰身成直 拨到残灰手欲龟 赠炭尚谁怜正曜 授薪还自愧支离 不甘力请从缁侣 苦调寒窗强作诗,"7,7,7,7,7,7,7,7",380cd3ba663358d5f227c592e29eb1fe,风屑 琼 寒 透薄 帷 拥 裘端 与 火 相宜 煖回炽焰 身 成 直 拨到 残灰手 欲 龟 赠炭 尚 谁怜 正 曜 授 薪 还 自愧 支离 不甘 力 请 从 缁 侣 苦调 寒窗 强作 诗
5429948a-3fe2-441f-9698-9cbe2d6abcc4,题合肥驿,王之道,唐,诗,七言律诗,重来岁月恍如飞 但怪芜城壁四围 千里漫推新政善 几人能遂故园归 云蒸残暑催登谷 风作新凉戒授衣 小驿滞留朋旧绝 何妨白昼掩朱扉,"7,7,7,7,7,7,7,7",1bcabc60df5db94db76f2c5e0ed9e3af,重 来 岁月 恍如 飞 但 怪芜 城壁 四围 千里 漫 推 新政 善 几 人 能 遂 故园 归 云蒸 残暑 催登 谷 风作 新凉 戒授 衣 小驿 滞留 朋旧 绝 何妨 白昼 掩 朱 扉
5af5b56b-8310-4523-b83c-cdbf719fe6e4,题元发弟竹轩,王之道,唐,诗,七言律诗,竹林深处敞轩楹 分我西园一半清 苍玉几番披夏箨 老龙长此战秋声 寒侵虚幌诗增爽 绿浸疏醽醉不醒 应许七贤追盛集 烦君书入鄙夫名,"7,7,7,7,7,7,7,7",c675f4b3b3d682299b6d5b708d649538,竹林 深处 敞 轩楹 分 我 西园 一半 清 苍玉 几番 披 夏 箨 老 龙长 此战 秋声 寒 侵虚 幌诗 增爽 绿 浸 疏 醽 醉 不 醒 应许 七 贤 追 盛集 烦 君 书 入 鄙夫 名
1caafa43-0bc2-47fe-90f5-8e130beb7764,题时轩,王之道,唐,诗,七言律诗,图书堆里席凝尘 聊与时轩作主人 自恐谢安行不免 谁言陶侃困无津 东荣晓色高迎日 南圃花光得占春 想见戴侯风味胜 轻弹珠玉到江滨,"7,7,7,7,7,7,7,7",5e5f17a344d54b21a657f7fbbef55133,图书 堆 里 席凝尘 聊 与 时轩 作 主人 自恐谢 安行 不免 谁 言陶侃困无津 东荣 晓色 高 迎 日 南圃花 光 得 占 春 想见 戴侯 风味 胜 轻弹 珠玉 到 江滨
90ff028f-e207-4548-806c-4250af42c1ab,题许公塞驿,王之道,唐,诗,七言律诗,遐想清游意欲飞 巢湖西畔碧山围 高城别后骚人到 小驿春回燕子归 壁上新诗留醉墨 庭前飞絮点征衣 穷愁勿用频惆怅 来岁而今在北扉,"7,7,7,7,7,7,7,7",05320a471c983b70364c6998a302a797,遐想 清游 意欲 飞 巢湖 西畔 碧 山围 高 城别 后 骚人 到 小驿 春 回 燕子 归 壁上 新诗 留醉 墨 庭前 飞絮 点 征衣 穷愁 勿 用 频 惆怅 来 岁 而今 在 北扉
6dcc71d2-0d11-4264-aed5-db87cb91aebd,题无为秀溪亭,王之道,唐,诗,七言律诗,画桥雕槛接招提 新有幽人榜秀溪 十顷净明天上下 两奁光映水东西 飞楼涌殿参差见 古木修篁咫尺迷 此景此时君信否 绿杨阴里啭黄鹂,"7,7,7,7,7,7,7,7",149f295427115d2b9595f28d0187711a,画桥 雕槛 接招 提 新有 幽人 榜 秀 溪 十顷 净 明天 上下 两奁 光映 水 东西 飞楼涌 殿 参差 见 古木修 篁 咫尺 迷 此景 此时 君信 否 绿 杨阴里 啭 黄鹂
b7b9427b-8e45-447c-8737-bc19ec36cbe8,悯旱,王之道,唐,诗,七言律诗,食贫那识小槽红 回也箪瓢久屡空 翘候载芟歌济济 忍看云汉叹爞爞 困穷转觉蓬心隘 憔悴犹怜菜颊丰 坐对骄阳思霈泽 日占鸣鹳望穹窿,"7,7,7,7,7,7,7,7",9bfa1b9fc9024bae89ab1d155e8c38b3,食 贫 那 识 小 槽 红 回 也 箪瓢 久屡 空 翘候 载 芟歌 济济 忍看 云汉 叹 爞 爞 困穷 转觉 蓬心 隘 憔悴 犹怜 菜颊 丰 坐 对 骄阳 思霈 泽 日 占 鸣 鹳 望 穹窿
950d2a9d-74f6-4112-a837-3155852c254e,为兴国周少隠题,王之道,唐,诗,七言律诗,紫翠森攅面面山 个中佳致为君还 凭阑人在风尘表 落纸诗成咳唾间 良夜幸陪红袖醉 清时聊伴白鸥闲 笼纱归去高城晚 凝翠堂东月满湾,"7,7,7,7,7,7,7,7",3c578f496ee474e5446d9afb6dd59ea2,紫翠 森 攅 面 面 山 个 中佳 致为 君 还 凭 阑人 在 风尘 表 落 纸 诗 成咳 唾间 良夜 幸陪 红袖 醉 清时 聊伴 白鸥 闲 笼纱 归去 高城 晚 凝翠堂 东月 满湾
141d7b0c-f421-4b5e-b8d3-4461fb8f683b,为彭积甫题熈春堂,王之道,唐,诗,七言律诗,似闻伐石旋诛茅 已见高堂荫乐郊 百里湖山供眼界 满城桃李动春梢 寒梅过尽看成实 乳燕飞来欲定巢 何日登临闲信马 路邉人复少年嘲,"7,7,7,7,7,7,7,7",21cf2008c1bbbee7d81ab2177bdbccac,似闻伐石旋诛茅 已 见 高堂 荫 乐郊 百里 湖山 供 眼界 满城 桃李 动春 梢 寒梅 过 尽 看成 实 乳燕 飞来 欲定巢 何日 登临 闲 信马 路 邉 人 复 少年 嘲
865f68f6-b30e-42a6-88a3-6b3135c622b7,田间夜归有作示王觉民二首  其一,王之道,唐,诗,七言律诗,风云踪迹付扁舟 水竹生涯寄一丘 世故举同鸡抱鸭 物情无怪马生牛 百年半向愁中老 万事常从酒到休 莫爱得官轻得句 争如饱食对吟捜,"7,7,7,7,7,7,7,7",9c685679b977230177efd79d0ecff91c,风云 踪迹 付 扁舟 水竹 生涯 寄 一 丘 世故 举同 鸡 抱 鸭 物情 无怪 马生 牛 百年 半 向 愁 中 老 万事 常 从 酒 到 休 莫爱得 官 轻 得 句 争如 饱食 对 吟 捜
e863ef75-e00e-4e32-be7d-25e0ffffae13,田间夜归有作示王觉民二首  其二,王之道,唐,诗,七言律诗,江上秋来忆少牢 龟肠尤觉病诗饕 调和索似三分酱 澒洞看如八斗糟 水怪重增风势恶 湘灵难禁雁声高 何当一雨洗烟月 为放清光归我曹,"7,7,7,7,7,7,7,7",74c74df51294debc990ad0549682c241,江上秋 来忆 少 牢 龟肠 尤觉 病诗 饕 调和 索似 三分 酱 澒 洞 看 如 八斗 糟 水怪 重 增 风势 恶 湘灵 难禁 雁声 高 何 当 一 雨 洗烟 月 为 放清 光 归 我 曹
13f3e330-e70e-4c28-b050-6f3da6b2395f,寄题峡州楚塞楼,王之道,唐,诗,七言律诗,江向西陵势渐平 万山环合翠峥嵘 须知楚国尝为塞 不为涪翁浪得名 人若此贤真俊杰 楼还旧观焕神明 临风毎听滩声咽 似怨张仪作暮横,"7,7,7,7,7,7,7,7",1765a2fc55d14574bf026ab7ae561f9d,江 向 西陵 势渐 平 万 山环合 翠 峥嵘 须知 楚国 尝为 塞 不为 涪翁 浪 得名 人 若 此 贤 真 俊杰 楼 还 旧观 焕 神明 临风 毎 听 滩声 咽 似 怨 张仪 作 暮 横
71aaed81-6da9-40fa-a4b7-0bb367324149,和陶尉喜雨呈张文伯,王之道,唐,诗,七言律诗,贺客休辞酒盏深 使君心是老农心 精诚已致当时雨 膏泽将为异岁霖 得水槁苖俱竞秀 乘秋高鸟自能吟 宣风宜有中和作 戞玉锵金播八音,"7,7,7,7,7,7,7,7",41f859c7e6026c49c657167e436881ef,贺客 休辞 酒盏 深 使君 心 是 老农 心 精诚 已致 当时 雨 膏泽 将 为 异岁 霖 得 水 槁 苖 俱 竞秀 乘秋 高鸟 自能 吟 宣风 宜 有 中 和 作 戞 玉 锵 金 播 八音
956ccdba-4e79-4687-8725-adf77d65aac0,和王冲之喜雨呈张文伯,王之道,唐,诗,七言律诗,指点邦人著眼看 鲁侯雩祭正玄端 望来已见千山雨 此去那忧百谷干 高廪有期从穧敛 奔霆何处起龙蟠 新诗得得书灵应 传与群公好纵观,"7,7,7,7,7,7,7,7",cbf3cf1e2b13a2ea1c103d74743cd7cf,指点 邦 人 著 眼看 鲁侯 雩 祭 正 玄 端 望来 已 见 千山 雨 此去 那 忧 百谷 干 高 廪 有 期 从 穧 敛 奔 霆 何处 起 龙蟠 新诗 得得 书 灵应 传 与 群公 好 纵观
08ce95c0-42b2-490d-9c32-8f800682aec4,和应资深九日游康乐园二首  其一,王之道,唐,诗,七言律诗,村落潇潇晚吹生 斜阳天际与林平 黄花照眼吟肩耸 红袖扶头醉帽轻 可惯探题仍击钵 敢辞偿令独浮觥 相逢又复惊相别 樽酒何妨意气倾,"7,7,7,7,7,7,7,7",b7ca34bda3b2ab891800c58a6a561f8e,村落 潇潇 晚 吹生 斜阳 天际 与 林平 黄花 照眼 吟 肩 耸 红袖 扶头醉 帽 轻 可惯 探题 仍 击 钵 敢辞 偿令 独浮 觥 相逢 又 复惊 相别 樽 酒 何妨 意气 倾
df1136ff-e719-4f0b-a918-ec7d5bbdcdf6,和应资深九日游康乐园二首  其二,王之道,唐,诗,七言律诗,里社安闲得久生 金华端不羡初平 山林应有清修重 轩冕还将道义轻 诗捷口占那复藁 酒豪盆酌不论觥 一斑已幸窥秋句 囷廪他时冀倒倾,"7,7,7,7,7,7,7,7",ce6186688a8827ed65353d00a9654e72,里 社 安闲 得 久 生 金华 端 不羡 初平 山林 应有 清修 重 轩冕 还 将 道义 轻 诗捷口 占 那 复 藁 酒豪 盆 酌 不论 觥 一斑 已幸 窥 秋 句 囷 廪 他 时 冀 倒 倾
eb76f99a-f32e-42b2-b95e-f494509f6b2b,春日郊行和郭希鲁二首  其一,王之道,唐,诗,七言律诗,萦风杨柳绿丝长 过雨桑麻沃以光 联骑不妨多载酒 看花无用更烧香 望穷岩电捜诗眼 愁转车轮感别肠 胜集清游定何处 它年曲水记流觞,"7,7,7,7,7,7,7,7",4676bac6d20d3a9ad73351ab5d90dba0,萦风 杨柳 绿丝 长 过雨 桑麻沃 以 光 联骑 不妨 多载 酒 看 花 无用 更 烧香 望 穷 岩 电 捜 诗 眼 愁 转 车轮 感别 肠 胜集 清游定 何处 它 年 曲水 记 流觞
94cc299f-32c3-48d6-81ba-8e85bb3d36aa,春日郊行和郭希鲁二首  其二,王之道,唐,诗,七言律诗,坐对烟江叠嶂图 何如门外翠屏纡 寻芳敢擅携笻去 命友应从折简呼 酒里光阴闲活计 诗余情思静功夫 浪吟痛饮真难遇 休问西山日欲晡,"7,7,7,7,7,7,7,7",59e48bf4046d2c193abaadcb1ed962b0,坐 对 烟江 叠嶂 图 何如 门外 翠屏纡 寻芳 敢 擅 携 笻 去 命友 应从 折 简呼 酒 里 光阴 闲 活计 诗余 情思 静 功夫 浪吟 痛饮 真 难遇 休问 西山 日 欲 晡
54248b2c-1fd7-4bda-9732-426dc427fed1,和吴子美香林汤韵,王之道,唐,诗,七言律诗,泉沸鸡笼山下林 浔阳曾记尺余深 濯鲜瀹卵非予事 清暑攘寒盖我心 物态漫劳私暧暧 灵源当信匪今今 簿书汨没尘埃久 附骥何时遂涤襟,"7,7,7,7,7,7,7,7",cbd35b3b97778e01a68d7d56f49a3a7c,泉 沸 鸡笼 山下 林 浔阳 曾 记 尺 余 深 濯 鲜 瀹 卵 非 予事 清暑 攘 寒 盖 我心 物态 漫劳私 暧暧 灵源 当 信匪 今今 簿 书 汨没 尘埃 久 附骥 何时 遂 涤襟
74193364-fb37-45a6-9917-7495b6d3ff75,上已日阻雨和王冲之韵,王之道,唐,诗,七言律诗,袚除聊复对江亭 樽酒相从一笑倾 那得此时仍此乐 况逢难弟与难兄 潺潺暮雨簷间溜 滑滑春泥柳外声 好在海棠红合泪 向人凄怆益多情,"7,7,7,7,7,7,7,7",827b082271523c0f826b817083084ae5,袚 除 聊 复 对 江 亭 樽 酒 相 从 一 笑 倾 那 得 此时 仍此 乐 况 逢 难 弟 与 难兄 潺潺 暮 雨 簷 间 溜 滑滑 春泥 柳外声 好 在 海棠 红合泪 向 人 凄怆 益 多情
c32d8ad2-94ed-4ade-9fa1-67708b63ac60,和窦又勇秋日见访阻雨见赠,王之道,唐,诗,七言律诗,风雨萧萧暮不休 顿添寒色送穷秋 已荒深院菊犹在 欲去短亭人强留 千里书迟空噪鹊 四邻砧乱混鸣鸠 相逢棋战宜终日 卧稻从他烂不收,"7,7,7,7,7,7,7,7",576a8d3aa84f3a0aa44767f64a48c405,风雨 萧萧 暮 不休 顿 添 寒色 送 穷秋 已 荒 深院 菊 犹 在 欲 去 短 亭 人 强留 千里 书 迟 空 噪 鹊 四邻 砧 乱 混鸣 鸠 相逢 棋战 宜 终日 卧稻 从 他 烂 不收
0c728c07-1a1e-42f0-b8b7-ae025154ff10,和石守道喜雨,王之道,唐,诗,七言律诗,坐听簷雨快高吟 酒到从斟不厌深 酣战遂符占蚁信 鬰兴良慰望霓心 一时与被尧天泽 四海同苏傅野霖 沾足岂惟秋有岁 麦田犹及趁犁金,"7,7,7,7,7,7,7,7",d241a9e89a5a679e119f2335db1337b7,坐听簷雨 快高吟 酒 到 从 斟 不厌 深 酣战 遂 符 占 蚁 信 鬰兴良慰望霓 心 一时 与 被 尧 天泽 四海 同苏 傅野霖 沾足 岂 惟 秋 有 岁 麦田 犹及 趁 犁金
0019912c-fd9d-4304-a634-ad1d8fd06d11,伏蒙知县县尉二寮友以夏旱得雨赓石徂徕喜雨韵见贶不可虚辱复嗣其韵书谢仍命儿曹同赋,王之道,唐,诗,七言律诗,绿槐阴外听蝉吟 节过分龙夏已深 千里亢阳忧岁旱 一时甘雨快人心 养禾不害连朝曀 沃暑应容数日霖 多谢同寮怜老拙 双南佳句竞铿金,"7,7,7,7,7,7,7,7",00407d7656308a116d95e2d7b6b3faa6,绿槐 阴外 听 蝉吟 节 过分 龙夏 已深 千里 亢阳忧 岁 旱 一时 甘雨 快 人心 养禾 不害 连 朝 曀 沃暑 应容 数日 霖 多谢 同 寮 怜 老拙 双南 佳句 竞 铿 金
5efbcbae-2b59-43dd-ab03-0a81a2dd19dd,追和东坡张昌言喜雨呈同官,王之道,唐,诗,七言律诗,旱魃正须三尺雨 飞廉旋布四天云 诗成采笔挥琼玖 酒到酡颜散缬纹 莲沼灔翻宵溜急 槐庭清送午风薫 欣欣千里农夫庆 衰病空惭老使君,"7,7,7,7,7,7,7,7",6cafac860288010cc680aa7966a3ff77,旱魃 正须 三尺 雨 飞廉 旋布 四天 云 诗 成 采笔 挥 琼 玖 酒 到 酡 颜散缬 纹 莲 沼 灔 翻 宵 溜 急 槐庭 清 送 午 风 薫 欣欣 千里 农夫 庆 衰病 空惭 老 使君
b2195113-7070-4304-ac88-ea2561f5dd1a,和董令升舍人,王之道,唐,诗,七言律诗,雨余沙路润无泥 潋灔溪流与岸齐 苒苒年华催我老 酣酣春意得人迷 联珠便觉新诗富 浮玉还听雅唱低 杨柳缓揺阴正午 谁家篱落一声鸡,"7,7,7,7,7,7,7,7",605af05b83561fd5b1dcd1541b6ecb5e,雨余沙 路润 无泥 潋 灔 溪流 与 岸 齐 苒 苒 年华 催 我 老 酣 酣 春意 得 人 迷 联珠 便 觉 新诗 富 浮玉 还 听 雅 唱 低 杨柳 缓 揺 阴 正午 谁家 篱落 一声 鸡
de53b851-916d-4ce9-bc2e-e5b8e7880db9,和董令升舍人梦中得句,王之道,唐,诗,七言律诗,早晚天书下紫泥 如今人物擅三齐 才华好自銮坡进 诗思休从蝶梦迷 深院日迟黄鸟啭 长桥风软绿杨低 春容不用相撩拨 老去心情似木鸡,"7,7,7,7,7,7,7,7",f2d8979f60584551185aed18f3388c58,早晚 天书 下 紫泥 如今 人物 擅 三 齐 才华 好自銮坡 进 诗思 休 从 蝶梦 迷 深院 日 迟 黄 鸟啭 长桥 风 软 绿 杨 低 春容 不用 相 撩拨 老 去 心情 似 木鸡
eda721c7-5138-4ab6-9cae-96ea28e06131,和张安国舍人,王之道,唐,诗,七言律诗,判花西掖妙当年 曾见声华振日邉 文翰共推唐李峤 功名将踵汉韦贤 江山到处供诗笥 风月多情付酒船 琳馆正应聊尔耳 会看鹏击水三千,"7,7,7,7,7,7,7,7",c377fe801a4fa8cf9590fbefc949aadd,判花 西掖 妙 当年 曾见声 华振日 邉 文翰 共推 唐李峤 功名 将 踵 汉韦贤 江山 到处 供 诗 笥 风月 多情 付酒 船 琳 馆 正 应 聊尔耳 会 看 鹏 击水 三千
d35a8e75-b98b-49ce-bf3d-3c1c12de9dc8,和张文纪咏雪二首  其一,王之道,唐,诗,七言律诗,万境沉沉夜气严 广寒初下水晶帘 三杯强沃浇肠酒 一捻聊分暖砚盐 已恨梅梢遭挫折 可堪风物为般添 才高柳絮虽难到 此语于今亦恶拈,"7,7,7,7,7,7,7,7",c35cbd68599aa4416bc3e6c4289e4127,万 境 沉沉 夜气 严 广寒 初下 水晶 帘 三杯 强沃 浇 肠 酒 一 捻 聊 分 暖 砚 盐 已 恨 梅梢 遭 挫折 可堪 风物 为般 添 才 高 柳絮 虽 难到 此 语 于今 亦 恶 拈
c174af8e-051f-4733-966d-ff9cb63f618d,和张文纪咏雪二首  其二,王之道,唐,诗,七言律诗,朝来经阁课楞严 撩乱飞花竞擈帘 似是青腰夸黑帝 故教姑射混无盐 地炉无奈貂裘薄 斗酒难供座客添 诗债恼人眠不得 夜寒残管亦须拈,"7,7,7,7,7,7,7,7",31ed5f4672b1e91b547e556e13f20b1e,朝 来 经阁 课楞 严 撩乱 飞花 竞 擈 帘 似是 青 腰 夸黑 帝 故教 姑射 混无盐 地炉 无奈 貂裘 薄 斗酒 难供 座客 添 诗债 恼人 眠 不得 夜寒 残管 亦须 拈
8c9be00f-0814-476c-ad24-0b6f3a6c7b63,再和董令升雪二首  其一,王之道,唐,诗,七言律诗,春雪初融作燕泥 梅花零落杏花齐 遥山扫翠云初敛 芳草铺青路欲迷 别恨毎忧儿辈觉 老怀终为世情低 新诗价重连城壁 敢比灵犀独骇鸡,"7,7,7,7,7,7,7,7",ef1b3a3434fc4dd54eb0ff338ac46066,春雪 初 融作 燕泥 梅花 零落 杏花 齐 遥 山 扫 翠云初 敛 芳草 铺 青路 欲 迷 别 恨 毎 忧 儿 辈 觉 老怀 终为 世情 低 新诗 价重 连城 壁 敢 比 灵犀 独骇鸡
c50aad7a-0c1b-44e3-9841-7a7f5f27fb16,再和董令升雪二首  其二,王之道,唐,诗,七言律诗,欲下闲庭不蹋泥 但惊飞絮与堦齐 一枝误失禽栖穏 三窟遥应兔迹迷 填塞涧溪还地厚 壅培山阜觉天低 寒光照应东窗白 咿喔应先报晓鸡,"7,7,7,7,7,7,7,7",c72a6d802e13210047b94d471a3fb1bc,欲 下 闲庭 不蹋 泥 但 惊 飞絮 与 堦 齐 一枝 误失 禽 栖 穏 三窟 遥应 兔迹 迷 填塞 涧溪 还 地厚 壅 培 山阜 觉 天 低 寒光 照应 东窗 白 咿喔 应 先 报晓 鸡
b99fa4b8-7dfe-4a67-9a4b-6b119709e11c,追和东坡严车二雪诗  其一,王之道,唐,诗,七言律诗,公诗有意拂廉纤 令似欧阳韵更严 犬子亦应惭赋缟 痴儿端合愧夸盐 飞绵勃窣争平堑 冻笋槎牙欲堕簷 胡避只今何处是 玉屏森映一峰尖,"7,7,7,7,7,7,7,7",e4707810b9de693e9e59f5631dda546b,公诗 有意 拂 廉纤 令 似 欧阳 韵 更 严 犬子 亦 应 惭 赋 缟 痴 儿端 合愧 夸盐 飞绵 勃窣争平堑 冻笋 槎 牙 欲 堕 簷 胡避 只今 何处 是 玉屏 森 映 一 峰尖
b1f4001b-3c33-42d5-86e0-11e1596faa8c,追和东坡严车二雪诗  其二,王之道,唐,诗,七言律诗,雪满江城酒不賖 闭门那患出无车 未容踏冻寻梅萼 应喜临风见柳花 炭重乌银争晓市 蔬挑翠羽荷邻家 何人正下红莲幙 大嚼蒸羊手更义,"7,7,7,7,7,7,7,7",e7ea0bb2051870dc8193a1d04423e194,雪满 江城 酒 不 賖 闭门 那 患出 无车 未容踏冻 寻梅 萼 应喜 临风 见 柳 花 炭重乌 银争 晓市 蔬 挑 翠羽 荷 邻家 何人 正 下 红莲 幙 大嚼 蒸羊手更义
1be5e6bf-3c45-41e4-aa6a-52922d30569a,和周少隠实录院对竹三首  其一,王之道,唐,诗,七言律诗,夫子文章仆命骚 高标宁若岁寒凋 惯看雄辩朝挥麈 想见清吟夜度韶 老去荷君频折简 时来容我尚同寮 区区长倩何为者 不乐平原意本朝,"7,7,7,7,7,7,7,7",915b6fdb87813c865c0afeb773c7fd88,夫子 文章 仆命 骚 高标 宁若 岁寒 凋 惯 看 雄辩 朝 挥 麈 想见 清吟 夜度 韶 老 去 荷 君 频折 简 时 来容 我 尚 同 寮 区 区长 倩 何为 者 不 乐平 原意 本朝
4a166674-c04e-422f-850d-43c3d132ca8c,和周少隠实录院对竹三首  其二,王之道,唐,诗,七言律诗,老来须鬓白刁骚 犹喜丹心未遽凋 秋赋肯甘同宋玉 昼眠聊复继邉韶 翩翩幽鸟随风屐 炯炯寒灯伴夜寮 多谢故人珠玉寄 水云堆里望天朝,"7,7,7,7,7,7,7,7",3dfb2a538ba26c8ff13e0a5e2e613707,老来 须 鬓 白刁 骚 犹喜 丹心 未 遽凋 秋赋 肯甘 同 宋玉 昼 眠 聊复 继 邉 韶 翩翩 幽鸟 随风 屐 炯炯 寒灯 伴 夜 寮 多谢 故人 珠玉 寄 水云 堆 里 望 天朝
aae5ae32-8064-44c9-9e4d-cb82fb17682a,和周少隠实录院对竹三首  其三,王之道,唐,诗,七言律诗,窗寒疏竹共萧骚 可笑圆荷着露凋 实录成书辉日月 奉常新乐奏咸韶 佳篇千里来青琐 好梦连宵到绮寮 湖海固应聊尔耳 伫看丹诏下公朝,"7,7,7,7,7,7,7,7",85dcc11397a63b0f163dbae2e4a5609f,窗寒疏竹共萧骚 可笑 圆荷 着露 凋 实录 成书 辉 日月 奉 常 新乐 奏 咸韶 佳篇 千里 来 青 琐 好 梦 连 宵 到 绮寮 湖海 固应 聊尔耳 伫看 丹 诏 下 公朝
d813706b-f8a6-4d5c-92ca-4d4559213f82,和韵寄董令升舍人,王之道,唐,诗,七言律诗,曾将燕石报琼华 别后哦诗愧莫涯 空腹但看长柄械 缓行何用短辕车 神驰邓步弥天葑 梦入朋谿夹径花 何日天台寻药去 女仙迎笑饭胡麻,"7,7,7,7,7,7,7,7",be575217876eed24902c04cd1c645f71,曾将燕 石报 琼华 别后 哦 诗愧莫涯 空腹 但 看 长柄 械 缓行 何用 短 辕车 神驰 邓步 弥天 葑 梦入 朋 谿 夹 径 花 何日 天台 寻药 去 女仙 迎 笑 饭 胡麻
a6148dac-bf38-443d-b69c-9d3eab520f55,和余元明时元明邀余同李次元夜饮,王之道,唐,诗,七言律诗,坐中强半是同年 頼有斯人席更圆 跨马未须贪远道 举觞聊复望青天 枯荷折苇三墪路 明月清风百丈船 俯仰便成陈迹恨 须知此集不论钱,"7,7,7,7,7,7,7,7",b3e60713729a51fb18f2a1ed95c1968f,坐 中 强 半 是 同年 頼 有 斯人 席更圆 跨马 未须 贪 远道 举觞 聊 复望 青天 枯荷 折苇三 墪 路 明月清风 百丈 船 俯仰 便成 陈迹 恨 须知 此 集 不论 钱
dad37d92-3a7c-450e-b471-3d82adb3a25e,避寇糁潭登李彦修延秀阁,王之道,唐,诗,七言律诗,王师千里下邦畿 三月宜新对敌围 江上扁舟随处是 烟中华屋转头非 逢人借问何时定 有客来传二圣归 已办笭箵学元结 卜邻犹冀不相违,"7,7,7,7,7,7,7,7",19829b92776799fc072dedfd98cc682d,王师 千里 下 邦畿 三月 宜 新 对敌 围 江 上 扁舟 随处 是 烟 中华 屋 转头 非 逢 人 借问 何时 定 有 客 来 传 二 圣 归 已 办 笭 箵 学 元 结 卜邻 犹冀 不 相违
e0bb5956-22bc-4ad4-81d4-f537c1d1d015,和因上人午睡韵,王之道,唐,诗,七言律诗,多谢高人问起居 惠然相过共秋蔬 栖栖众且疑夫子 碌碌谁知效阿奴 老去睡乡还积欠 君来诗社责新逋 便便一觉南窗午 短簟方床意不疏,"7,7,7,7,7,7,7,7",431a2fa18138664e9c0c4031d71a3e68,多谢 高 人 问 起居 惠然 相过 共秋 蔬 栖 栖 众 且 疑 夫子 碌碌 谁知 效 阿奴 老 去 睡乡 还 积欠 君 来 诗社 责 新 逋 便 便 一觉 南窗 午 短 簟 方 床意 不疏
586e0124-dfce-4e29-9a32-226b6cad41fe,历阳寄定城尉彦逢弟,王之道,唐,诗,七言律诗,故园鹎𫛥久催耕 休恋公田秫与秔 别恨久随黄耳去 归心应望白云生 干戈丛里三书考 春夏交来几闭城 我亦蓝田负丞者 相从何日赋渊明,"7,7,7,7,7,7,7,7",46fdd8104202f1a48ec43abb2ba1d9d1,故园 鹎 𫛥 久 催耕 休恋 公田 秫与秔 别 恨 久 随 黄耳 去 归心 应望 白云 生 干戈 丛里 三 书 考 春夏 交来 几闭城 我 亦 蓝田 负丞者 相从 何日 赋 渊明
bd0aef65-73bf-4351-a530-692fc50c4109,和萧山临川亭壁间留题韵,王之道,唐,诗,七言律诗,水外峰峦碧四环 雨多门径藓苔斑 滞留又及炊新粟 欢喜何当见旧山 招隠有诗来霅上 倦游无梦到云间 西兴十里秋潮晚 坐数扁舟带月还,"7,7,7,7,7,7,7,7",30fab47d7c95a8301b5b834bcdf82ebf,水外 峰峦 碧 四环 雨 多 门径 藓苔 斑 滞留 又 及 炊 新 粟 欢喜 何当 见 旧山 招 隠 有 诗 来 霅 上 倦游 无梦到 云间 西兴 十里 秋潮 晚 坐数 扁舟 带 月 还
4c0fb3f1-bb40-4d96-b90f-ac6a3b0db74b,和彦逢弟春日即事,王之道,唐,诗,七言律诗,杨花如雪菜花黄 路出初郊正日长 喜对新诗醒病眼 会逢膏雨沃骄阳 过僧竹院茶争美 酌客山堂酒倍香 常恨抗尘仍走俗 不知身在水云乡,"7,7,7,7,7,7,7,7",430ef885c45c9fb58e01349edd57efb0,杨 花如雪 菜花 黄 路出 初郊 正 日 长 喜 对 新诗 醒病 眼 会 逢膏雨 沃 骄阳 过僧 竹院 茶争 美 酌 客 山堂 酒 倍 香 常恨 抗尘 仍 走 俗 不知 身 在 水云 乡
dd14399e-d24c-40dd-a4ba-6ec4b7da2331,和陈勉仲春日偶成二首  其一,王之道,唐,诗,七言律诗,帷幄何人正坐筹 匈奴轻汉索怀柔 回銮未睹迎天驷 劝穑还惊出土牛 雨过池塘新涨绿 春归原野霁烟浮 中兴自古须群策 更愿君王慎厥猷,"7,7,7,7,7,7,7,7",f103e677aaaae4a2393679beaec9d94b,帷幄 何人 正坐 筹 匈奴 轻 汉索 怀柔 回銮 未睹 迎天驷 劝 穑 还 惊 出土 牛 雨 过 池塘 新 涨 绿 春 归 原野 霁 烟 浮 中兴 自古 须 群策 更 愿 君王 慎厥猷
3a59a78a-dd70-4b45-ba5e-69cd46c9e49d,和陈勉仲春日偶成二首  其二,王之道,唐,诗,七言律诗,江表归来得自由 旧乡能复到温柔 辞源已见流三峡 笔力当期挽万牛 白日忍从黄雾塞 青天那复黑云浮 扫除骄寇还强汉 会有忠良告远猷,"7,7,7,7,7,7,7,7",2244807f7b2dfea99ad3f689c6909043,江 表 归来 得 自由 旧乡 能 复到 温柔 辞源 已 见 流 三峡 笔力 当期 挽 万 牛 白日 忍 从 黄雾塞 青天 那 复 黑 云浮 扫除 骄寇 还 强 汉 会 有 忠良 告 远 猷
aefc4ad2-babb-4afb-b7e8-c4af9c78abec,春日偶成,王之道,唐,诗,七言律诗,余生今赴迩英朝 似说夔龙许续貂 枯枿遂承新雨露 苍鹰应识旧云霄 废兴须信闗时命 劳逸谁能问贯条 十载山林劳梦寐 五更天仗听箫韶,"7,7,7,7,7,7,7,7",f6aeaa9d751d02d410171e395e395da9,余生 今 赴 迩 英 朝 似说 夔龙 许续 貂 枯 枿 遂 承 新 雨露 苍鹰 应识 旧 云霄 废兴 须 信 闗 时 命 劳逸 谁 能 问贯 条 十载 山林 劳 梦寐 五更天 仗 听 箫 韶
6bf36543-cc28-4649-b3fa-a3f5130e5149,春日次韵张叔元,王之道,唐,诗,七言律诗,迟日轻风过雨天 草青南陌欲生烟 江湖节物登王鲔 村落归心起杜鹃 已办寻芳游野寺 何当修褉泛溪船 路逢少妇携笼去 为说蚕儿向雨眠,"7,7,7,7,7,7,7,7",4e4f9557be49cacadd72a9890fa22ec0,迟 日 轻风 过 雨天 草 青南 陌欲 生烟 江湖 节物 登 王 鲔 村落 归心 起 杜鹃 已 办 寻芳 游野寺 何当 修 褉 泛 溪 船 路 逢 少妇 携笼 去 为 说 蚕儿 向 雨 眠
