id,title,author,dynasty,genre,poem_type,sentences_simplified,meter_pattern,hash,words
1bbeb803-08c2-4356-beab-3e44769efbcd,张丽华墓  其二,吴龙翰,唐,诗,七言绝句,结绮临春迹已尘 尚余抔土锁娉婷 玉颜不及陇头草 岁岁春风吹得青,"7,7,7,7",9b35588b72b626a874033f8496dff23b,结 绮临 春迹 已 尘 尚余 抔 土 锁 娉婷 玉颜 不及 陇头 草 岁 岁 春风 吹 得 青
2a49a889-bc9e-40b1-8904-0095de7ebb6b,王荆公读书堂,吴龙翰,唐,诗,七言绝句,六籍纷纷尽可奴 翻腾字说乃菑畬 可知山半青灯夜 只读商君一卷书,"7,7,7,7",d3d95ddc7a0ef300229e75a681a6064f,六 籍 纷纷 尽 可 奴 翻腾 字 说 乃 菑 畬 可知 山半 青灯 夜 只读 商君 一卷 书
90e555d6-4a6c-42fd-bad8-d5ded013c16c,登长干寺塔,吴龙翰,唐,诗,七言律诗,金陵王气已销沈 几度凭阑愁满襟 往事仅存南北史 伤情空费短长吟 龙蟠故国山河在 凤去荒台草木深 旧物尚余吴塔在 夕阳移影照江心,"7,7,7,7,7,7,7,7",b79855f72af411f4ab3b78b9b5546ba7,金陵 王气 已销 沈 几度 凭 阑 愁满襟 往事 仅存 南北 史 伤情 空费 短长 吟 龙蟠 故国 山河 在 凤 去 荒台 草木 深 旧物 尚余 吴塔 在 夕阳 移影 照 江心
2a5dfec1-554f-4816-bb29-e7e0c6375856,诗境,吴龙翰,唐,诗,五言律诗,流水环诗境 未容尘土侵 步迂松径曲 坐占草堂深 秋句蛩分和 山杯鸟劝斟 好怀无客共 相对一踌躇,"5,5,5,5,5,5,5,5",3c0ce28e2b53e117379b195bf87956db,流水 环诗 境 未 容 尘土 侵 步 迂松 径曲 坐 占 草堂 深 秋 句 蛩 分 和 山杯 鸟 劝 斟 好 怀无客 共 相对 一 踌躇
294c0e0e-84ca-4ff1-9117-e495bee1e0cd,谩题,吴龙翰,唐,诗,五言律诗,放旷疏林下 清风吹鬓毛 傍梅读周易 对酒歌离骚 诗思秋云淡 古怀明月高 五湖天地别 烟水绿平篙,"5,5,5,5,5,5,5,5",2584bbecdd7cc8845bba77991768d545,放 旷 疏 林下 清风 吹 鬓毛 傍 梅读 周易 对 酒歌 离骚 诗思 秋云淡 古怀 明月 高 五 湖 天地 别 烟水 绿平 篙
a82c8d5b-1202-473c-99a7-beb8894d658e,过淮南湖,吴龙翰,唐,诗,七言古体,黄尘茫茫北风起 黄芦萧萧日色死 百万征夫血怒流 点汚淮南一湖水 向来失著图中原 一朝此地化为边 养兵百年不用力 将军金印慙空悬 南湖南湖君莫渡 万仞山高鬼门户 夜夜青燐照断蓬 训狐自戴髑髅舞,"7,7,7,7,7,7,7,7,7,7,7,7",3f04ad9b0eae99f29a4897221758a7fa,黄尘 茫茫 北风 起 黄芦 萧萧 日 色 死 百万 征夫 血怒流 点 汚 淮南 一 湖水 向来 失著 图 中原 一朝 此地 化为 边 养兵 百年 不 用力 将军 金印 慙 空 悬 南湖 南湖 君莫渡 万仞山 高 鬼 门户 夜夜 青 燐 照 断 蓬 训狐自戴 髑髅 舞
41222228-52df-4c17-b408-98386e341d3e,泊真州方山下,吴龙翰,唐,诗,七言绝句,烟冷隋宫草木秋 屏山分翠接江流 片云不隔长芦寺 夜半钟声敲客愁,"7,7,7,7",8196b767b28567a1ec043fba9e7f414a,烟 冷 隋 宫 草木 秋 屏山 分翠 接 江流 片 云 不 隔 长芦寺 夜半钟声 敲 客愁
7255716f-a0d4-4014-aa80-8216a9a92abc,有所嗟,吴龙翰,唐,诗,七言绝句,乘鸾人去玉箫寒 云敛巫山晓梦残 柳线不堪系离别 自和烟雨搭阑干,"7,7,7,7",dd4e3acb3758d06d7f90dcb76d0b9820,乘 鸾 人 去 玉 箫 寒 云敛 巫山 晓梦 残 柳线 不堪 系 离别 自 和 烟雨 搭 阑干
40fb9f0a-74fd-4fb7-8165-fd3b9ac825b8,戊午诏与弟文战棘闱自惭师衂况有炊臼之梦不能为懐幸故人有荐乡书魁漕闱者良以自慰,吴龙翰,唐,诗,五言律诗,霜叶秋风下 寒窗著病身 乾坤为逆旅 岁月转车轮 白首无贤妇 青云有故人 愁懐今日解 漫啜瓮边春,"5,5,5,5,5,5,5,5",176a813a3de9674657a7a8561aea0150,霜叶 秋风 下 寒窗 著病 身 乾坤 为 逆旅 岁月 转 车轮 白首 无 贤妇 青云 有 故人 愁 懐 今日 解 漫 啜 瓮 边 春
a6746b2f-9639-4577-bb10-6325cc5346ba,先曾大父作竹夫人铭北窗蘧蘧偎尔冰肌毋徇其名乃邪其思甚有思致余不能道漫作俳优语,吴龙翰,唐,诗,七言绝句,水沈为骨玉为肌 専宠凉台会有时 长得夫人容两足 客星不遣史官知,"7,7,7,7",ad4ff691aa3ab651fd1e0a3a068ab2cb,水 沈为骨玉 为 肌 専 宠 凉台 会 有时 长 得 夫人 容两足 客星 不遣 史官 知
92d29eb4-5001-46c8-a879-976d0fd57b58,雨宿祁门道中,吴龙翰,唐,诗,五言律诗,乘骖古渡头 景色十分幽 山雨敲诗梦 溪流赴客愁 寒禽知警夜 髙树故吟秋 壮志难磨尽 终期汗漫游,"5,5,5,5,5,5,5,5",8b235a73fd4d236d6cdb65717e2f41f2,乘 骖 古 渡头 景色 十分 幽 山雨 敲 诗 梦 溪流 赴 客愁 寒禽 知警 夜 髙 树 故 吟 秋 壮志 难磨 尽 终期 汗 漫游
3d22ed38-17c0-471f-82b5-abf531cc6966,登当涂凌歊台,吴龙翰,唐,诗,七言绝句,髙台突兀玉千寻 尚想当年翠辇临 坐守夕阳移半塔 我吟未了让蝉吟,"7,7,7,7",e8ad5e8301ea0d0c68fea16c494e1536,髙 台 突兀 玉千寻 尚 想当年 翠 辇 临 坐守 夕阳 移半塔 我 吟 未了 让 蝉吟
29cdbaac-6592-4902-8cbe-b700b1636be7,晓发黄池过宁国,吴龙翰,唐,诗,七言绝句,簇簇人烟两岸分 暂时挂搭此行程 一笻风月无拘束 又复挑诗到宛城,"7,7,7,7",eb002d12e078cc23f566a5893c97f8b2,簇簇 人烟 两岸 分 暂时 挂搭 此 行程 一 笻 风月 无拘束 又 复 挑 诗 到 宛城
fed30373-7958-4981-b61b-5190599c7be8,登宣城郡楼仰谢公,吴龙翰,唐,诗,七言绝句,翠屏四面敞阑干 谢老诗情不说官 魂冷青山呼欲醒 吟声渗在石泉间,"7,7,7,7",6763af45929e07c074946c1c121df03f,翠屏 四面 敞 阑干 谢老 诗情 不 说 官 魂 冷 青山 呼欲醒 吟声 渗在 石泉 间
844a3cfe-4a3f-43a1-9934-c7142a6600cb,归途绩溪界喜见十里岩,吴龙翰,唐,诗,五言律诗,策杖前溪去 吾乡此路分 雨磨山出色 风约水成文 归信凭秋雁 思亲望白云 碧岩今日见 快饮带微醺,"5,5,5,5,5,5,5,5",8c098d41f803ab752f43681d2f828c1b,策杖 前 溪 去 吾 乡此路分 雨磨山 出色 风约 水 成文 归信 凭 秋雁 思亲 望 白云 碧岩 今日 见 快 饮带 微醺
4348fd89-f3f6-458f-a9c5-79a4cc72752c,自建邺归至绩溪迂路观石照,吴龙翰,唐,诗,七言绝句,谁磨白石如冰鉴 勲业安能试一窥 但觉秋风上潘髩 半因为客半因诗,"7,7,7,7",fe48493041e55ea2cad77e002e6aa406,谁 磨 白石 如 冰鉴 勲 业 安 能 试 一 窥 但 觉 秋风 上 潘 髩 半 因为 客半因 诗
82c67ca9-05b7-43e6-93b1-9dd64b5d923d,内丹,吴龙翰,唐,诗,七言律诗,太极虚空亦有根 打开闗捩是何人 丹田旋转乾坤槖 碧海循环日月轮 久矣我前曾有我 悠哉身外岂无身 分明好个通天窍 只要时人认得真,"7,7,7,7,7,7,7,7",b1340e57ab076b4a8c4c7595d3f7ee10,太极 虚空 亦 有 根 打开 闗 捩 是 何人 丹田 旋转乾坤 槖 碧海 循环 日月 轮 久 矣 我 前 曾 有 我 悠哉 身外 岂 无身 分明 好 个 通天 窍 只要 时 人 认得 真
c8222c0c-18ab-4919-ac88-5ebe97ff3c45,外丹,吴龙翰,唐,诗,七言律诗,手掇乾坤铛里煎 神仙肘后有书传 红铅黑汞一斤药 阳火阴符六百篇 金鼎自凝三素炁 玉𬬻轻散九霞烟 玄霜糁入空虚腹 一息乘风上碧天,"7,7,7,7,7,7,7,7",f522e499c4cfd81ebed7c78dd3d6fdb6,手 掇 乾坤 铛 里 煎 神仙 肘 后 有 书 传 红铅 黑 汞 一斤 药 阳火 阴符 六百 篇 金鼎 自 凝 三 素 炁 玉 𬬻 轻 散 九霞 烟 玄霜 糁 入 空虚 腹 一 息 乘风 上碧天
f813075f-ab37-4a4d-b77b-4b5be153edb1,对月,吴龙翰,唐,诗,五言古体,长空有明月 与我良有情 遥遥万里道 随我杖履行 耿耿吟床间 相随入枕衾 而我病风雅 长作秋蛩吟 吟声悲入月 月色寒入吟 月即是天眼 照我泪纵横 垂垂草上露 尽从月眼倾 不为富贵儿 只作苦吟人 君看朱门邃 翠幕围阳春 管弦沸清晓 银烛正荧荧,"5,5,5,5,5,5,5,5,5,5,5,5,5,5,5,5,5,5,5,5",fdea3badad35bbf9461371989b8b039a,长空 有 明月 与 我 良 有情 遥遥 万里 道 随 我 杖 履行 耿耿 吟 床间 相随 入 枕 衾 而 我病 风雅 长作 秋 蛩 吟 吟声 悲入 月 月色 寒入吟 月 即 是 天眼 照 我 泪 纵横 垂垂 草 上露 尽 从 月 眼 倾 不 为 富贵 儿 只 作苦 吟 人 君 看 朱门 邃 翠幕围 阳春 管弦 沸清晓 银烛 正 荧荧
8b9f1f06-af38-4f4e-b117-70e42cc7c256,题西湖画轴,吴龙翰,唐,诗,七言绝句,丹青谁写满轴莲 濯濯西施一段妍 汴水百年尘隔断 可无人作画图传,"7,7,7,7",fbde1df51ceea603d9a54f5541569d72,丹青 谁 写 满 轴 莲 濯濯 西施 一段 妍 汴水 百年 尘 隔断 可 无人 作画 图传
fada5890-8c5c-4c52-956e-4a4c7a4c23a7,登严子陵钓台,吴龙翰,唐,诗,七言绝句,万乘从君脚底眠 客星便入史官占 东都基业随流水 今日斯台尚姓严,"7,7,7,7",b644d8b0a176afa959dd5b0bc8f3ae0f,万乘 从 君 脚底 眠 客星 便入 史官 占 东 都 基业 随 流水 今日 斯台 尚姓 严
17647b2e-d7d8-4948-a180-86499fdd27ac,栽斑竹,吴龙翰,唐,诗,七言绝句,竹母初分种屋头 斑斑泪点带诗愁 他时看取成林玉 遥剪湘江一片愁,"7,7,7,7",4c09cb4c6e431244dcde86448de6cd31,竹母 初 分种 屋头 斑斑 泪点 带 诗 愁 他时 看取 成林 玉 遥 剪 湘江 一片 愁
c5e7bffe-a29e-482b-a937-e15de3d82b6f,县尹先伯祖家观遗书,吴龙翰,唐,诗,五言律诗,嗟哉吾伯祖 文响玉珊珊 髙折蟾宫桂 卑栖花县官 琴声流水尽 书卷白云寒 尚想伊吾夜 髙楼几倚阑,"5,5,5,5,5,5,5,5",0e412d15a2978db3aad7784cd53b3b1f,嗟哉吾 伯祖 文响 玉珊珊 髙 折 蟾宫 桂 卑 栖 花 县官 琴声 流水 尽 书卷 白云 寒 尚 想 伊吾 夜 髙 楼 几 倚 阑
d2d12478-33fd-4d38-aa9c-21fbafd5ef20,春山晚望,吴龙翰,唐,诗,七言绝句,糢糊数叠屋前山 翠色欺凌诗髩寒 啼鸟一声泥滑滑 晚钟春雨过林端,"7,7,7,7",f9c9ca48edf03f55cbd77b13bba06f6d,糢 糊 数 叠 屋前 山 翠色 欺凌 诗 髩 寒 啼 鸟 一声 泥 滑滑 晚钟 春雨 过林 端
5f895f42-597b-4150-a084-5506960a1c36,读董卓传,吴龙翰,唐,诗,七言绝句,巨妖吐毒气如蒸 谁遣腥膻汉帝陵 烟断洛阳残火在 为他吹著点脐灯,"7,7,7,7",2cb25688f6d28eed8db78709d296c662,巨 妖吐 毒气 如 蒸 谁 遣 腥膻 汉 帝陵 烟 断 洛阳 残火 在 为 他 吹 著点 脐灯
2dad8df0-ecdd-48d7-9883-82733a4bec5d,春日书所见,吴龙翰,唐,诗,七言绝句,寒云漠漠暮天低 社鼓声中日欲西 隔岸垂杨遮酒店 风帘移影照寒溪,"7,7,7,7",2160368bfba2b9c0e754c1c988c1e136,寒云 漠漠 暮天 低 社 鼓声 中日 欲西 隔岸 垂杨 遮 酒店 风帘 移影 照 寒溪
cd8c658c-4149-4c8c-b363-278aad3e4299,春懐,吴龙翰,唐,诗,七言律诗,梨花院落雨初晴 小醉醒来睡不成 过客光阴易老态 故人山色却长情 歌喉呖呖鸟声隽 舞袖翩翩蝶翅轻 好景相看作挞尽 闭门不觉了清明,"7,7,7,7,7,7,7,7",7c859a47e0004dd2ca37c76b988b4d40,梨花 院落 雨初晴 小醉 醒来 睡 不成 过客 光阴 易 老态 故人 山色 却 长 情 歌喉 呖呖 鸟声 隽 舞袖 翩翩 蝶翅 轻 好景 相 看作 挞 尽 闭门 不觉 了 清明
b12e14b3-82de-4b74-b650-56224f1ca806,昭君怨,吴龙翰,唐,诗,七言古体,汉家金屋贮娥眉 六宫何啻三千姬 中有一姬倾国色 可怜不到君王知 毛生笔下真少恩 玉颜黑子迷妍媸 君王按图不入眼 出身逺嫁单于妻 盈盈泪眼边月照 萧萧愁髩胡风吹 不忧死作龙城鬼 贞魂长在深宫里 犹胜男儿未贵时 咫尺金门如万里,"7,7,7,7,7,7,7,7,7,7,7,7,7,7",854fd9da1a4080ffc26384a5c49ddb01,汉家 金屋 贮 娥眉 六宫 何啻 三千 姬 中 有 一 姬 倾国 色 可怜 不到 君王 知 毛生 笔下 真少恩 玉颜 黑子 迷 妍媸 君王 按 图 不 入眼 出身 逺 嫁 单于 妻 盈盈 泪眼 边 月 照 萧萧 愁 髩 胡风 吹 不忧死作 龙城 鬼 贞 魂 长 在 深 宫里 犹胜 男儿 未 贵 时 咫尺 金门 如 万里
256bffc4-593a-43aa-a573-d805188ac852,饮马长城窟,吴龙翰,唐,诗,五言古体,汉兵北伐时 饮马长城窟 此城何以髙 中填战夫骨 此池何以深 战血化为洫 秋风吹水腥 马闻亦辟易 马渴可柰何 要马载金戈 长安有游冶 走马燕支坡,"5,5,5,5,5,5,5,5,5,5,5,5",4132c5d66e269168ddd4dd0a09ef5e2e,汉兵 北伐 时 饮马 长城 窟 此 城 何以 髙 中 填战 夫骨 此 池 何以 深 战血 化为 洫 秋风 吹水 腥 马闻 亦 辟 易 马 渴 可 柰 何 要 马 载 金戈 长安 有游 冶 走马 燕支坡
563134fa-aa29-45a7-b356-283bab1c9574,饯王广文,吴龙翰,唐,诗,五言律诗,宦居三载满 严驾出山城 诗担梅花白 离杯竹叶清 更筹催客梦 斥堠计行程 去去骖鸾鹤 长歌上玉京,"5,5,5,5,5,5,5,5",e129dd672797dbcd1c829de2d60f4469,宦居 三载 满 严驾 出 山城 诗担 梅花 白 离杯 竹叶 清 更 筹 催 客 梦 斥 堠 计 行程 去去 骖 鸾 鹤 长 歌 上 玉京
49f90167-6471-4154-b1a1-0070b73a2ff7,寓兴,吴龙翰,唐,诗,七言古体,盈盈楼上仙家姝 绿波濯濯明芙渠 感君恩情玉连锁 罗襦系君双明珠 青琐玲珑春夜永 为君闲调相思引 琼树朝新璧月满 琴声未断肠先断 剪剪轻寒袭春笋 金猊喷香薫袖暖,"7,7,7,7,7,7,7,7,7,7",96735b61dcabc81bae11b7bf5183d523,盈盈 楼上 仙家 姝 绿波 濯濯 明芙渠 感君 恩情 玉 连锁 罗襦 系君 双 明珠 青 琐 玲珑 春夜 永 为 君 闲调 相思 引 琼树朝 新 璧月 满 琴声 未 断肠 先 断 剪剪 轻寒袭 春笋 金猊 喷香 薫 袖 暖
335cb5ff-7326-4b0d-8fdb-77164d505bc9,夏日书事,吴龙翰,唐,诗,五言律诗,东林数间屋 长掩竹笆篱 槛柳拂棋局 瓶花落砚池 蝶狂如被酒 蝉咽似吟诗 脱帽挂岩石 凉飔入髩丝,"5,5,5,5,5,5,5,5",1252e998a052bf31ab1004e9ed6dde11,东林 数间 屋 长 掩 竹 笆篱 槛 柳 拂 棋局 瓶 花落 砚池 蝶 狂 如 被 酒 蝉咽 似 吟诗 脱帽 挂 岩石 凉 飔 入 髩 丝
eea7e4c5-03b5-41af-b45e-c8850418a8aa,草堂,吴龙翰,唐,诗,七言绝句,苍烟落日草堂深 浅浅寒侵白玉簪 等客不来童睡去 自摇修竹和新吟,"7,7,7,7",13f9427c952eb885830d3d19b869be19,苍烟 落日 草堂 深 浅浅 寒 侵 白 玉簪 等 客 不 来 童 睡 去 自摇修竹 和 新吟
539663d9-a3fe-44ee-ba26-cfa535dfb246,夜吟,吴龙翰,唐,诗,七言绝句,小院沈沈夜欲阑 东风吹月上阑干 手撼梅花露研墨 醉将吟笔蘸清寒,"7,7,7,7",75d6711bb8396e944cb446d456967241,小院 沈沈 夜欲阑 东风 吹 月 上 阑干 手撼 梅花 露 研墨 醉 将 吟 笔 蘸 清寒
aa1a37d3-3a04-4489-a3a1-1f0d61377a84,荷花,吴龙翰,唐,诗,杂言,花列千行彩袖 叶收万斛明珠 可惜坡仙不在 风情绝胜西湖,"6,6,6,6",43f4d02da50a224db73135db87bc3050,花列 千行 彩袖 叶收万 斛 明珠 可惜 坡 仙 不 在 风情 绝胜 西湖
a169ff99-7a7f-4524-8a04-333d3486fa61,升仙谣,吴龙翰,唐,诗,杂言,衣缥缈 佩丁东 金茎滴香露 玉树生凉风 冲破青冥跨黄鹤 身披星斗珍珠络,"3,3,5,5,7,7",6bea32f42b8ee20023e318c4148e8aad,衣 缥缈 佩 丁东 金茎 滴香 露 玉树 生 凉风 冲破 青 冥 跨 黄鹤 身披 星斗 珍珠 络
c784477e-e00b-49e0-9ae1-467be5b13531,挽徐县尹,吴龙翰,唐,诗,五言律诗,雄笔工褒贬 登科年少时 青山知宦拙 白首尚书痴 鹗荐仍归弟 凤毛喜有儿 传家遗卷在 光彩玉离离,"5,5,5,5,5,5,5,5",b0d2cf81e5d6b3cab40fe89919ec322e,雄笔 工 褒贬 登科 年少时 青山 知 宦 拙 白首 尚书 痴 鹗 荐 仍 归 弟 凤毛喜 有 儿 传家 遗卷 在 光彩 玉离 离
9d27e481-620e-4fd1-9bcd-2ad048affa61,赠相士,吴龙翰,唐,诗,七言绝句,万里烟霞侵鹤骨 九天风露注蝉尸 君看个人作诗苦 梅花细嚼当晨炊,"7,7,7,7",e4a225a3d13c549aa969fac13bc1a4c5,万里 烟霞 侵 鹤 骨 九天 风露注蝉尸 君 看 个人 作诗 苦 梅花 细嚼 当 晨炊
bb05d569-e1f5-44c8-b3ec-b1ffd36381b7,春郊即事,吴龙翰,唐,诗,七言绝句,登临故故检春工 小立苍苔数落红 院宇人归春寂寂 秋千闲在月明中,"7,7,7,7",7d468ef2bdf4ddbba63088cd49adcfb0,登临 故故 检春 工 小立苍 苔 数落 红 院宇 人 归 春 寂寂 秋千 闲 在 月 明中
19ee4a57-25f4-4795-93dc-041822dab3a3,寄题友梅堂友梅乃竹洲先生孙也,吴龙翰,唐,诗,五言律诗,公昔洲多竹 而孙梅作堂 月窗传瘦影 风壑度寒香 友也真鱼水 兄兮可雁行 相看动吟兴 时吐玉琳琅,"5,5,5,5,5,5,5,5",eea1f81f74f378a42976537e4591cc24,公昔洲 多 竹 而 孙梅 作堂 月 窗 传 瘦 影 风壑度 寒香 友 也 真 鱼水 兄 兮 可 雁行 相看 动吟 兴 时吐玉 琳琅
17ce118a-77e6-4616-9515-1d475bdfe1bf,甲子举中补滥忝前名考官刘簿云已在解选涝漉袁簿批有文字清快老健惜乎正榜之额有限之语,吴龙翰,唐,诗,七言律诗,奴颜婢膝浪驱驰 几被秋风吹髩丝 百万博卢空得雉 八千兵溃岂因骓 功名付我银凿落 世事从渠铁蒺藜 且跨蹇驴出门去 六朝故地要吾诗,"7,7,7,7,7,7,7,7",2d728841ee297626cb7c4a43771be9a7,奴颜婢膝 浪 驱驰 几 被 秋风 吹 髩 丝 百万 博卢空 得 雉 八千 兵 溃 岂 因 骓 功名 付 我 银 凿 落 世事 从 渠 铁蒺藜 且 跨 蹇 驴 出门 去 六朝 故地 要 吾 诗
3bc48226-b267-4399-929d-2e2fb7b08a89,秦淮  其一,吴龙翰,唐,诗,七言绝句,数里秦淮画轴开 唐人赏后宋人来 无边风月要酬答 一处旗亭买一杯,"7,7,7,7",9a17e28f46e619a4fb762b5c7832d89d,数里 秦淮 画轴 开 唐人 赏 后宋 人 来 无边风月 要 酬答 一处 旗 亭 买 一杯
257607b1-be10-483b-96d7-2888cd60f2fe,秦淮  其二,吴龙翰,唐,诗,七言绝句,歌歇陈宫玉树春 可怜商女亦成尘 老成惟有秦淮月 往日曾经照古人,"7,7,7,7",f455aabffd4dc11cc4da8cfca3d4c3b2,歌 歇 陈宫 玉树 春 可怜 商女 亦 成 尘 老成 惟有 秦淮 月 往日 曾经 照 古人
dca0aa91-cb0d-4d7b-9cee-4ad9208b8c2a,金陵懐古,吴龙翰,唐,诗,七言律诗,钟阜龙蟠势可奇 何年开此帝王基 东西日月磨今古 南北江山几合离 六代衣冠荒草下 中原台殿白云涯 春风吹落英雄泪 立尽斜阳未有诗,"7,7,7,7,7,7,7,7",848ea5ea97edda12503c0f848d7c3d9f,钟阜 龙蟠 势可奇 何年 开 此 帝王 基 东西 日月 磨 今古 南北 江山 几 合离 六代 衣冠 荒草 下 中原 台殿 白云 涯 春风 吹落 英雄 泪 立尽 斜阳 未有 诗
97dbd64d-16c2-45f9-a3f8-e6aafb22464b,拜李谪仙墓,吴龙翰,唐,诗,五言古体,先生放旷士 浩气吞洪蒙 蓬池与紫阁 轩盖绎相从 经营紫河车 破费十载功 金鼎驯乌兔 炎炎丹光红 一击混沌破 落地寻无踪 神仙有水解 戏剧惊愚蒙 当年遗剑履 一锸秋云封 我亦钻玄学 此心良券同 朅来荐泉菊 紫绮疑相逢 俨如真面目 晓月印寒空,"5,5,5,5,5,5,5,5,5,5,5,5,5,5,5,5,5,5,5,5",9f246d046c831d2571f36512d3f8bbd0,先生 放 旷士 浩气 吞 洪蒙 蓬池 与 紫阁 轩盖绎 相 从 经营 紫河车 破费 十载 功 金鼎驯 乌 兔 炎炎 丹光红 一 击 混沌 破 落地 寻 无踪 神仙 有 水解 戏剧 惊 愚蒙 当年 遗剑 履 一 锸 秋 云封 我 亦 钻 玄学 此 心 良券 同 朅 来 荐 泉 菊 紫 绮疑 相逢 俨如 真面目 晓月印 寒空
e7ad2b1b-0f55-420a-be7b-bf0280a554c2,登采石望夫石,吴龙翰,唐,诗,七言绝句,良人戍楚竟蹉跎 极目天涯岁月多 赖有江流是知己 有声似和扊扅歌,"7,7,7,7",eeee0055402cfb405514128edfb38b54,良人 戍 楚 竟 蹉跎 极目 天涯 岁月 多 赖有 江流 是 知己 有声 似 和 扊 扅 歌
421bd6f9-9fb1-437f-a487-ea17e387a5ff,登和州八公山昔年周师俘敌扵此有碑屹其上,吴龙翰,唐,诗,七言律诗,万姓丛居一弹丸 八公何在路漫漫 中原北望已尘暗 边地秋来又枣丹 猎猎阴风征骨乱 茫茫夜月鬼声寒 老兵指点擒生处 岘首残碑带泪看,"7,7,7,7,7,7,7,7",c8e4093095797d6b982926f5f0bd545b,万姓丛 居 一 弹丸 八公 何在 路 漫漫 中原 北望 已 尘暗 边地 秋来 又 枣丹 猎猎 阴风 征骨 乱 茫茫 夜月 鬼声寒 老兵 指点 擒生 处 岘首 残碑 带泪 看
992bf499-3278-4ac9-9956-1be77c8592b3,哭赵信庵  其一,吴龙翰,唐,诗,七言律诗,祥云中屹祝融峰 秀出全材一巨公 银管曾提修国史 金戈几出策邉功 九秋健羽横空鹗 万里威声当道熊 谭国为前冀国后 汗青千古玉玲珑,"7,7,7,7,7,7,7,7",741ff9491139bbd7f318ea40c7993485,祥云 中 屹 祝融峰 秀 出 全材 一 巨公 银管 曾 提 修国史 金戈 几出 策 邉 功 九秋健 羽 横空 鹗 万里 威声 当 道 熊 谭国为 前 冀国 后 汗青 千古 玉玲珑
989eea36-02e0-4073-9613-876f71e30c15,哭赵信庵  其二,吴龙翰,唐,诗,七言律诗,麟符玉策总兵权 手托江淮半壁天 大节有闗宗社里 深谋常画庙堂先 三朝已表蝉冠像 八袠终逢鸡梦年 不独羊公碑尚在 万民堕泪滴湘烟,"7,7,7,7,7,7,7,7",03a25c9ebd97d3300c7f73c1be4ed13c,麟符 玉策 总 兵权 手托 江淮 半壁 天 大节 有 闗 宗社 里 深谋常画 庙堂 先 三朝 已 表 蝉 冠 像 八 袠 终 逢 鸡 梦 年 不独 羊公碑 尚 在 万民 堕 泪滴 湘 烟
c73ef116-7ce0-48f9-a182-6a08ab07f3ff,秋日绵溪,吴龙翰,唐,诗,七言绝句,万顷寒潭镜面平 数声征雁叫霜晴 满林落叶秋风老 山路黄昏人少行,"7,7,7,7",c36656aa1bf51599d872965a935be6e3,万顷 寒潭 镜面 平 数声 征 雁 叫 霜 晴 满林 落叶 秋风 老 山路 黄昏 人 少 行
fc12dacf-893e-4265-9020-c528c0d4d484,哭秋崖先生  其一,吴龙翰,唐,诗,五言律诗,气节昻斯世 先生千载人 可怜成白首 犹只到朱轮 芧取群狙怒 雪逢越犬狺 方离罗织辱 身世已成尘,"5,5,5,5,5,5,5,5",ce6cdd8838daa590b47366604e70e4e6,气节 昻 斯世 先生 千载 人 可怜 成 白首 犹 只 到 朱 轮 芧 取 群 狙怒 雪逢越 犬 狺 方离 罗织 辱 身世 已成 尘
a2f56c9b-3b24-4608-8f0e-348fe37dcea2,哭秋崖先生  其二,吴龙翰,唐,诗,五言律诗,欧苏唤不起 文印属秋崖 大雅非常调 正音不类俳 寒江濯文思 明月镂吟懐 传业有杨晏 遗书冢墓埋,"5,5,5,5,5,5,5,5",f219e2aac29e67ce7f32df066c23c3a0,欧苏唤 不 起 文印属 秋崖 大雅 非常 调 正音 不类 俳 寒江 濯 文思 明月 镂吟 懐 传业 有 杨晏 遗书 冢 墓 埋
099348f1-c000-4e2b-b5fd-b823f0f55ca1,哭秋崖先生  其三,吴龙翰,唐,诗,五言律诗,昔年经盼目 此日罢从游 尤许为上足 敢令出一头 圣涯窥浩荡 学海探深幽 一瓣南丰后 他师不复求,"5,5,5,5,5,5,5,5",1ce29c4da57e4960c966160ef4d06fca,昔年 经盼 目 此日 罢 从 游 尤许 为 上足 敢令 出 一头 圣涯 窥 浩荡 学海 探 深幽 一瓣 南丰 后 他 师 不 复求
f0624c1c-0aaa-44f5-9549-e63ee1a7b954,吴越归秋晚,吴龙翰,唐,诗,五言律诗,湖海归来晚 园荒菊几丛 秋山吟骨瘦 霜叶醉颜红 吊影寒溪曲 懐人落月中 青灯滋味永 不用哭途穷,"5,5,5,5,5,5,5,5",a9067e1c3f9eb1965874b6f025a22a73,湖海 归来 晚 园 荒 菊 几丛 秋山吟 骨 瘦 霜叶 醉颜红 吊影 寒溪曲 懐 人 落 月 中 青灯 滋味 永 不用 哭途穷
65190bb5-3bca-4587-b7ef-7032bf5d5a7d,座中咏蝉分韵得饥字,吴龙翰,唐,诗,七言律诗,两翼才干壳已离 便升乔木最髙枝 银床落叶秋风里 金掌盘敧晓露时 断续翻成无调曲 悲凉做出苦吟诗 前身应是夷齐辈 髙卧西山自忍饥,"7,7,7,7,7,7,7,7",72ed21bff57c046433450881074d88a1,两翼 才干 壳 已 离 便升 乔木 最 髙 枝 银床 落叶 秋风 里 金掌盘 敧 晓露 时 断续 翻成 无调 曲 悲凉 做出 苦 吟诗 前身 应 是 夷 齐 辈 髙 卧 西山 自忍 饥
ce0cfc31-5b56-4f1b-9352-b6e0a29e2446,春晚野步,吴龙翰,唐,诗,七言绝句,寻花篱下蝶牵引 酌酒林间鸟劝酧 山色不随春态老 笛声自起夕阳愁,"7,7,7,7",2c6663f1093e6e643a1e659d9cd81023,寻 花篱 下蝶 牵引 酌酒 林间 鸟 劝 酧 山色 不随 春态 老 笛声 自起 夕阳 愁
2ee7757c-becb-4337-9f73-65ed2f763702,寓感,吴龙翰,唐,诗,五言古体,周家敦八议 姬旦衡何平 秦家尚苛法 四海怨商君 凤鸟时一鸣 枭鸟时一鸣 一鸣以为周 一鸣以为秦 法重灭尔族 德重润尔身 天帝厌杀伐 勿使伤阳春,"5,5,5,5,5,5,5,5,5,5,5,5",17242b79be50e31fea0b1785708d3125,周家 敦 八议 姬旦衡 何平 秦家尚 苛法 四海 怨商 君 凤鸟 时 一 鸣 枭鸟时一鸣 一 鸣 以为 周 一 鸣 以为 秦 法 重 灭 尔 族 德重润尔 身 天帝 厌 杀伐 勿 使伤 阳春
e1df53b7-07a8-4cb4-b5bd-8af275551004,离怨,吴龙翰,唐,诗,杂言,杨柳如少年 春风吹得老 朝为白雪花 暮为浮萍草 明月照妾夫 夜夜闗山道 明月分半光 照妾颜色好 空闺一十年 芳容秋叶槁 宝马嘶 妾夫归 对镜画眉双泪垂 前日夫悮妾今日妾悮夫 妾貌不如夫去时,"5,5,5,5,5,5,5,5,5,5,3,3,7,10,7",97a6fcc9287640a699d45e92bcf30d5e,杨柳 如 少年 春风 吹 得 老 朝 为 白雪 花 暮 为 浮萍 草 明月照 妾 夫 夜夜 闗 山道 明月 分半光 照妾 颜色 好 空闺 一 十年 芳容 秋叶 槁 宝 马嘶 妾 夫 归 对 镜 画眉 双泪 垂 前日 夫 悮 妾 今日 妾 悮 夫 妾 貌 不如 夫 去 时
ec85e739-c732-4382-b8ef-db6ee61e27ca,故人见寄韵,吴龙翰,唐,诗,七言律诗,青年铁砚亦曾磨 壮不如人可奈何 松菊犹存陶令迳 烟云不碍邵公窝 吟廊缓步看修竹 醉石髙眠枕绿莎 一笠一蓑吾事足 江湖浩荡白鸥波,"7,7,7,7,7,7,7,7",c4005f70f0b53012fb3538ba2fefc2b8,青年 铁砚亦 曾 磨 壮 不如 人 可 奈何 松菊 犹存 陶 令 迳 烟云 不碍 邵公 窝 吟 廊 缓步 看修 竹 醉 石 髙 眠 枕绿莎 一笠 一蓑吾事足 江湖 浩荡 白鸥波
ab1d166c-1d44-4c13-83ee-84174217ee10,楼居狂吟  其一,吴龙翰,唐,诗,七言绝句,茅斋悔著市廛间 长与青山面目悭 突兀小楼初结就 竹床石枕卧看山,"7,7,7,7",bc47cd1a94a5d7bf20b8b6856a532268,茅斋 悔著 市廛 间 长 与 青山 面目 悭 突兀 小楼 初结 就 竹床 石枕卧 看 山
