id,title,author,dynasty,genre,poem_type,sentences_simplified,meter_pattern,hash,words
91d2ee95-4292-4c7e-bb63-6d82627b4a7e,和元少卿雪,徐铉,宋,诗,七言律诗,朔风飞雪徧遥天 为瑞偏宜在腊前 有客棹舟将命友 何人高卧共称贤 瑶花散乱纷临席 玉树晶荧烂满川 闲想冰容比君子 始知姑射有神仙,"7,7,7,7,7,7,7,7",faa74c7d59f530f3d92939958f881fe1,朔风 飞雪 徧 遥 天 为 瑞 偏宜 在 腊前 有 客 棹 舟 将 命友 何人 高卧 共 称 贤 瑶花 散乱 纷临席 玉树 晶 荧烂 满川 闲想 冰容 比 君子 始知 姑射 有 神仙
aafff6b9-27b8-4635-b69b-4ba870f75ff3,送𫖳道人还西山,徐铉,宋,诗,五言律诗,尝忆洪崖涧 穿云路万寻 曾经照玄鬓 未得卸朝簪 老去驰庄蝶 年来有越吟 羡师从此去 旧隠翠微深,"5,5,5,5,5,5,5,5",5cade2e63d40897fcc25e33cfeb65aa4,尝忆 洪崖涧 穿 云路 万 寻 曾经 照 玄鬓 未 得 卸 朝 簪 老 去 驰 庄蝶 年来 有越 吟 羡 师 从此 去 旧 隠 翠微 深
d978beac-72c9-4b38-be2d-8285672712c3,送历阳方明府,徐铉,宋,诗,五言律诗,古县横江北 弦歌似武城 善辞金马召 欣著彩衣行 旧感河山色 离愁浚水声 外门庐井在 相送几重情,"5,5,5,5,5,5,5,5",97e84af69236cab63b53e45e66f7b0a9,古县 横 江北 弦歌 似 武城 善辞 金马 召 欣著 彩衣 行 旧 感河 山色 离愁 浚 水声 外门 庐井 在 相 送 几重 情
c1927de2-4db2-4c60-87fd-c6a8f049dc9b,送李著作之汉阳,徐铉,宋,诗,五言律诗,闻道驱征旆 行行至汉阳 初程微雨霁 满路落花香 远宦心常适 青云去未妨 惟余亲戚分 惆怅上河梁,"5,5,5,5,5,5,5,5",7da301e3f165ff34dbc08f797412ca7f,闻道 驱征 旆 行 行至 汉阳 初程 微雨 霁 满路 落 花香 远 宦心 常适 青云 去 未妨 惟余 亲戚 分 惆怅 上河 梁
d5ba7939-a834-439c-aeb2-c78f9b886ed9,哭刑部侍郎乔公诗,徐铉,宋,诗,五言古体,举世重文雅 夫君更质真 曾嗟混鸡鹤 终日异缁磷 词赋离骚客 封章谏诤臣 襟怀道家侣 标格古时人 逸老诚云福 遗形未免贫 求文空得草 埋玉遂为尘 静想忘年契 冥思接武晨 连宵洽杯酒 分日掌丝纶 蠹简书陈事 遗孤托世亲 前贤同此叹 非我独沾巾,"5,5,5,5,5,5,5,5,5,5,5,5,5,5,5,5,5,5,5,5",ebb9e0b8829642deca97e3f84318e14e,举世 重 文雅 夫君 更质 真 曾 嗟混鸡鹤 终日 异 缁 磷 词赋 离骚 客 封章 谏诤 臣 襟怀 道家 侣 标格 古时 人 逸 老诚 云福 遗形 未免 贫 求文 空得 草 埋 玉 遂 为 尘 静想 忘 年 契 冥思 接 武晨 连宵 洽 杯酒 分 日 掌丝纶 蠹简 书 陈 事 遗孤 托 世亲 前贤 同此 叹 非 我 独沾巾
4bc4f213-eb2c-4a89-a77c-39b6f9c04a17,吴王挽词  其一,徐铉,宋,诗,五言律诗,倏忽千龄尽 冥茫万事空 青松洛阳陌 荒草建康宫 道德遗文在 兴衰自古同 受恩无补报 反袂泣途穷,"5,5,5,5,5,5,5,5",1702bbf19e963eb4dbbddb7c6de4f7ba,倏忽 千龄 尽 冥 茫 万事 空 青松 洛阳 陌 荒草 建康 宫 道德 遗文 在 兴衰 自古 同 受恩 无 补报 反袂 泣途穷
405a0282-6eff-42af-a46f-f4b7f2be9f52,吴王挽词  其二,徐铉,宋,诗,五言律诗,土德承余烈 江南广旧恩 一朝人事变 千古信书存 哀挽周原道 铭旌郑国门 此生虽未死 寂寞已销魂,"5,5,5,5,5,5,5,5",95fac458a3002841f7473bc0bded015f,土德 承余 烈 江南 广 旧恩 一朝 人 事变 千古 信书 存 哀 挽 周 原道 铭旌 郑 国门 此生 虽 未 死 寂寞 已 销魂
f761e78a-66fd-4965-867c-cf9c345f3454,和元宗元日大雪登楼,徐铉,宋,诗,七言律诗,一宿东林正气和 便随仙仗放春华 散飘白絮惟分影 轻缀青旗始见花 落砌更依宫舞转 入楼偏向御衣斜 严徐共待金门诏 愿布尧言贺万家,"7,7,7,7,7,7,7,7",9d8cc04e9bb232ce73d3c4e3759b6d68,一 宿 东林 正气 和 便 随 仙 仗 放 春华 散 飘 白絮惟 分影 轻 缀 青旗 始见 花 落砌 更 依 宫舞 转 入 楼 偏向 御 衣 斜 严徐 共 待 金门 诏 愿布 尧 言 贺 万家
b56ea48b-10b8-44c9-9d35-a05cc2bc0cbe,句  其一,徐铉,宋,诗,七言古体,一夜黄星照官渡 本初何面见田丰,"7,7",a6a2e16acc2d85350fa075779437759f,一夜 黄星 照 官渡 本初 何 面见 田丰
6b1c2e0e-b1ac-4731-bd0f-cb4b2281aabf,句  其二,徐铉,宋,诗,五言古体,井泉分地脉 砧杵共秋声,"5,5",d2fde1baa31264c144d036cefc5d50e2,井泉 分 地脉 砧杵 共 秋声
b0c12763-71c5-43f6-aee3-90c377778b9b,句  其三,徐铉,宋,诗,七言古体,钟山祠畔宿烟晴 玉涧桥边碧树椿,"7,7",2b2e51034ee0f19da221ffbd0af5fee5,钟山 祠畔 宿烟晴 玉涧 桥边 碧树椿
fe5e6faa-4cee-451f-a208-684747139bf5,存目,徐铉,宋,诗,杂言,诗题 贡院锁宿闻吕员外使高丽赠送首句 圣化今无外,"2,15,5",589f8edc74a858fd26e851c8d53f1fdc,诗题 贡院 锁 宿闻 吕 员外 使 高丽 赠送 首句 圣化今 无外
0e22a40a-4f5a-4da4-8ff4-7483b8142099,题义门胡氏华林书院,宋琪,宋,诗,七言律诗,贤良肄业文方盛 孝友传家族更豪 旌表特恩门第贵 御书新赐姓名高 谋孙有后荣非数 待士无疏众岂劳 我想华林终未到 只因气概属仙曹,"7,7,7,7,7,7,7,7",9888d16d3f5f6cbceae35600c55bfba2,贤良 肄业 文方盛 孝友 传 家族 更 豪 旌表 特恩 门第 贵 御书 新 赐 姓名 高 谋 孙 有 后 荣非 数 待士 无疏众 岂劳 我 想 华林 终未 到 只 因 气概 属 仙 曹
cfeadf96-1cbe-46a4-9dc6-b00101145c4b,怀梦英大师,赵逢,宋,诗,七言律诗,林峦影里有清贤 与我相知二十年 书札爱工精玉筯 利名抛舍住金田 吟容贾岛称诗匠 辞许刘灵作酒仙 别后近闻栖华岳 乱云应得恣情眠,"7,7,7,7,7,7,7,7",a52b16eca0ba50f40d1d5fed123a08fb,林峦影 里 有 清 贤 与 我 相知 二十年 书札 爱工 精 玉 筯 利名 抛舍 住金 田 吟容 贾岛 称 诗匠 辞许 刘灵 作 酒仙 别 后 近闻 栖华岳 乱云 应得 恣情 眠
056fdfae-07e8-44e5-a932-25ac50adf3dd,句  其一,卞震,宋,诗,五言古体,雨壁长秋菌 风枝落病蝉,"5,5",e319f6766d14929726c28774d32d84cb,雨壁 长 秋菌 风枝落病蝉
b9d55170-bc25-44d6-a371-7086f3c2065e,句  其二,卞震,宋,诗,五言古体,老筇搘瘦影 寒木凭吟身,"5,5",f7c4a6c11da2047ec2bfb51c35747422,老 筇 搘 瘦 影 寒木 凭 吟身
f885d9d4-b377-4674-b4ee-cb79e5fe8953,句  其三,卞震,宋,诗,七言古体,诗债到春无处避 离愁因醉暂时无,"7,7",d585f6a4bf85200919ad15fca61999e3,诗债 到 春 无处 避 离愁 因 醉 暂时 无
8c8c791f-d6d0-457d-a770-ed4f70cff1a7,句  其四,卞震,宋,诗,七言古体,茶香解睡磨铛煮 山色牵怀著屐登,"7,7",3a595e4cf6315fffef5368087b68df4d,茶香 解睡 磨铛 煮 山色 牵怀 著屐 登
48a74f35-c190-4ae0-b289-760f8c747c2e,句  其五,卞震,宋,诗,五言古体,积雨生残稻 苍苔入旧笼,"5,5",7a1cbc81a5592cefbe3fa3f357cbdfc8,积雨 生残 稻 苍苔入 旧笼
68f4e7d2-5894-4b27-a5fa-b92821b79eee,句  其六,卞震,宋,诗,五言古体,风涛秋渡阙 烟雨晚村孤,"5,5",ff08a4f30c28ff3623c3be576d91875f,风涛 秋渡阙 烟雨 晚 村 孤
7a5092e0-5d8d-4461-888b-f45e050076a7,句  其七,卞震,宋,诗,五言古体,空囊万里客 斜月一床寒,"5,5",2c37a8aa72b9f77dbbc5ace2a03ad3e6,空囊 万里 客 斜 月 一床 寒
918ec55e-09d8-4328-a164-909c54f90aab,句  其八,卞震,宋,诗,七言古体,双阙暂随丹诏入 三峰寻与白云归,"7,7",dba4d1c93cab93855082d2976ab42218,双阙 暂 随 丹 诏 入 三峰 寻与 白云 归
89f7b63e-4eca-496b-89f8-dfa4d18e33b9,句  其九,卞震,宋,诗,七言古体,芳草又牵为客恨 白云空寄未闲心,"7,7",dd9be462c4a44cdf49e81175ce501ee0,芳草 又 牵为 客恨 白云 空寄未 闲心
6e8953c6-762c-45b5-8f60-8320d1c9d77b,敬礼瓦屋和尚塔偈,勾令玄,宋,诗,七言律诗,大空无尽劫成尘 玄步孤高物外人 日本国来寻彼岸 洞山林下过迷津 流流法乳谁无分 了了教知我最亲 一百六十三岁后 方于此塔葬全身,"7,7,7,7,7,7,7,7",2228f54034e2f951a57e3738fcd97103,大空 无尽 劫成 尘 玄步 孤高 物 外人 日本国 来 寻 彼岸 洞 山林 下过 迷津 流流 法 乳 谁 无分 了了 教知 我 最 亲 一百 六十三岁 后 方 于此 塔 葬 全身
83491979-42fd-4181-b701-cea2610aef5b,句,郭廷谓,宋,诗,五言古体,魄逐东流水 坟依独坐山,"5,5",ee6f0fdf3ccfe0c7073a20db462da3b3,魄逐东 流水 坟 依 独坐 山
779ad9fd-097c-4da5-9cc8-d590729c1e1f,过三岭苎溪,释清豁,宋,诗,七言绝句,世人休说行路难 鸟道羊肠咫尺间 珍重苎溪溪畔水 汝归沧海我归山,"7,7,7,7",ea9144c24e635c87b6c489abbcdb8fe9,世人 休说 行路难 鸟道羊肠 咫尺 间 珍重 苎溪 溪畔 水 汝归 沧海 我 归 山
50d2f350-e2c2-4852-8ef1-b1a980384b1b,归山吟寄友,释清豁,宋,诗,七言绝句,聚如浮沫散如云 聚不相将散不分 入郭当时君是我 归山今日我非君,"7,7,7,7",bd6570e4a3f7fa560211c11fc52f9fc8,聚如 浮沫 散 如云 聚不相将散 不分 入 郭 当时 君 是 我 归山 今日 我 非君
f12a2339-1230-410d-a069-fa268a65b2d1,青羊宫,郭忠恕,宋,诗,七言绝句,久知玄牝是根原 谁道长生别有门 一自描龙兴叹后 至今师事五千言,"7,7,7,7",de9db61df09fe071a3948bb63a8989e9,久 知 玄 牝是 根原 谁 道 长生 别 有 门 一自描龙 兴叹 后 至今 师事 五千 言
9587942f-fcb4-4f65-90d9-34c374468e54,送田表圣出知陈州,郭忠恕,宋,诗,七言律诗,客里暌离已不堪 何当出守正移骖 孔融在汉人应惮 善感鸣唐罪自甘 义重不嫌身死万 忧深宁忍口缄三 陈州亦是天朝地 好为疮痍雨露覃,"7,7,7,7,7,7,7,7",5500a98dd51135ba95fc989527da9597,客里 暌离 已 不堪 何当 出守 正 移 骖 孔融 在 汉人 应惮 善感 鸣 唐 罪 自甘 义重 不 嫌 身 死 万 忧深宁 忍口缄三 陈州 亦 是 天朝 地 好 为 疮痍 雨露 覃
d9e18cd7-e65b-47c7-874f-1b72a608cbf1,再逢英公有感,郭忠恕,宋,诗,七言律诗,伊余行止住飘蓬 与世乖违不可容 青眼交知长忆念 白云踪迹又相逢 风骚共会名何盛 篆隶同勤法转功 □□羡师超彼岸 琉璃钵里看降龙,"7,7,7,7,7,7,7,7",8cc5f7613f9e61baea906f7999aa0d2d,伊 余行 止住 飘蓬 与 世乖 违 不可 容 青眼 交知 长忆念 白云 踪迹 又 相逢 风骚 共 会 名 何盛 篆隶 同勤法 转功 □ □ 羡 师 超 彼岸 琉璃 钵 里 看降 龙
762664f3-8f43-49a4-8fa5-5ec8ca1dfc83,嘲聂崇义,郭忠恕,宋,诗,五言绝句,近贵全为聩 攀龙即是聋 虽然三个耳 其奈不成聪,"5,5,5,5",3bc7a5eed93a4769b4a6d922772f7f46,近贵全为聩 攀龙 即是 聋 虽然 三个 耳 其奈 不成 聪
732667ea-5338-48f0-8a8a-29565c30a65a,句,郭忠恕,宋,诗,七言古体,为逢末劫归依佛 不就新恩叙理官,"7,7",8cc8546d993728b77c86fb9a56d1f71c,为 逢末劫 归依 佛 不 就 新 恩 叙理 官
5e18f4c8-9d40-4568-9764-3a0d1554595a,龙子祠农人享神,王士元,宋,诗,杂言,晋州之西 山曰藐姑 有泉源源流不潴 疏为八道沟与渠 坐令瘠土成膏腴 多黍多稌多麻蔬 沄沄万亩碁局如 田家终岁惟勤劬 虽有干旱无忧虞 割牲酾酒父老趋 坎坎击鼓吹笙竽 报答龙神醉饱余 宛若泽国江乡居 晋州之东民岂迂 耕种自亦为农夫 年年汲井井欲枯 赤日炙背田不濡 父子筋力疲辘轳 肩頳汗浃良区区 老我见此空嗟吁 谁把劳逸分两途 凶年且为宽赋租,"4,4,7,7,7,7,7,7,7,7,7,7,7,7,7,7,7,7,7,7,7,7",ac801d3c623b8f9196fe96b01a8a4359,晋州 之西 山 曰 藐姑 有 泉源 源流 不 潴 疏为 八道 沟 与 渠 坐 令 瘠 土 成 膏腴 多 黍 多 稌 多 麻 蔬 沄 沄 万亩 碁 局 如 田家 终岁 惟 勤 劬 虽 有 干旱 无忧 虞 割牲 酾 酒 父老 趋 坎坎 击鼓 吹笙 竽 报答 龙神 醉 饱余 宛若 泽国 江 乡居 晋州 之 东民 岂 迂 耕种 自 亦 为 农夫 年 年 汲 井井 欲 枯 赤日炙背田 不濡 父子 筋力 疲 辘轳 肩 頳 汗 浃 良 区区 老 我 见 此空 嗟吁 谁 把 劳逸 分 两 途 凶年 且为 宽 赋租
092da229-1531-42d2-94e8-0b428810f3ca,赠英公大师,郑起,宋,诗,七言律诗,玉殿承恩四十年 水云心已悟南禅 李斯篆字功何妙 贾岛诗章学太玄 筇在几嗟无虎鬭 钵腥长笑有龙眠 闻今未老休慵堕 剩把书踪石上镌,"7,7,7,7,7,7,7,7",0da3288453441888420ec747b738ca17,玉殿承恩 四十年 水云 心 已 悟 南 禅 李斯 篆字 功何妙 贾岛诗 章学太 玄 筇 在 几 嗟无 虎 鬭 钵 腥 长 笑 有 龙 眠 闻 今 未 老 休 慵 堕 剩把书 踪石 上 镌
26de71c5-7e88-4a5d-9e77-206577c3cd85,寄题明月禅院二首  其一,释赞宁,宋,诗,七言律诗,参差峰岫昼云昏 入望交萝浊浪奔 震泽涌山来北岸 华阳连洞到东门 日生树挂红霞脚 风起波摇白石根 闻有上方僧住处 橘花林下采兰荪,"7,7,7,7,7,7,7,7",9f6947914c426d9c59885bd9fea2cbdf,参差 峰 岫 昼 云昏 入望 交萝 浊浪 奔 震泽 涌山 来 北岸 华阳 连洞 到 东门 日 生 树挂 红霞 脚 风起波摇 白石 根 闻有 上方 僧 住处 橘花 林下 采兰荪
8a50131a-0df0-4fdb-98ee-9654111a2ab7,寄题明月禅院二首  其二,释赞宁,宋,诗,七言律诗,积翠湖心迤逦长 洞台萧寺两交光 鸟行黑点波涛白 枫叶红连橘柚黄 人我绝时隈树石 是非来处接帆樯 如何遂得追游性 摆却营营不急忙,"7,7,7,7,7,7,7,7",87df0339e8158b809aa9fa0973fa8972,积翠 湖心 迤逦 长 洞台 萧寺 两 交光 鸟行 黑点 波涛 白 枫叶 红 连橘 柚 黄 人 我 绝时 隈 树石 是非 来 处接 帆樯 如何 遂 得 追 游性 摆 却 营营 不 急忙
a678b41b-58b1-43c8-b2a0-e0cd50e83714,夜吟,释赞宁,宋,诗,七言绝句,独坐闲吟野思清 秋庭萧索暮烟轻 孤灯欲灺月未上 万籁寂然蛩一声,"7,7,7,7",dd2fbecdb760ac37c01f5cfde911c409,独坐 闲吟 野思 清 秋庭 萧索 暮 烟 轻 孤灯 欲 灺 月 未 上 万籁 寂然 蛩 一声
9eb82a63-9d7e-46dc-ac3e-9f89854d4c62,居天柱山,释赞宁,宋,诗,五言律诗,四野豁家庭 柴门夜不扃 水边成半偈 月下了残经 虽逐诸尘转 终归一念醒 未知斯旨者 万役尽劳形,"5,5,5,5,5,5,5,5",f6e1e677d2f324eb0aa7ffa20ef0ef54,四野 豁 家庭 柴门 夜 不 扃 水边 成 半 偈 月 下 了 残 经 虽 逐 诸尘 转 终归 一 念醒 未知 斯旨者 万役 尽 劳形
6c25b424-fe42-49aa-9d52-42db8e749700,秋日寄人,释赞宁,宋,诗,七言绝句,白鸟行从山嘴没 青鸥群向水湄分 松斋独坐谁为侣 数片斜飞槛外云,"7,7,7,7",66b673659d28bd6c5a8a68a35ed09910,白鸟 行 从 山嘴 没 青鸥群 向 水 湄分 松斋 独坐 谁 为 侣 数片 斜 飞槛 外云
b8498238-27a7-4743-9212-67c2f19db29b,括浙江潮候,释赞宁,宋,诗,五言绝句,午未未未申 申卯卯辰辰 巳巳巳午午 朔望一般轮,"5,5,5,5",0b5c1aaca1d1c701471be74f4047105d,午 未 未未 申 申卯 卯辰辰 巳 巳 巳 午午 朔望 一般 轮
596fa2db-15ca-47e3-9ec2-2e22ba32726c,落花,释赞宁,宋,诗,七言绝句,蝶醉蜂狂香正浓 晚来阶下坠衰红 开时费尽阳和力 落处难禁一阵风,"7,7,7,7",c290405d3cbd302309f7e19890097dbb,蝶 醉 蜂 狂 香 正浓 晚来 阶 下坠 衰红 开时 费尽 阳和力 落处 难禁 一阵风
8cbe5192-a462-4c14-a7ba-145bae5530f6,悟空塔,释赞宁,宋,诗,七言律诗,浮图萧瑟入虚空 一聚全身罔像中 传马祖心开佛印 识龙潜主示神通 毫光委坠江楼月 道气馨香海岸风 此地化缘才始尽 更于何处动魔宫,"7,7,7,7,7,7,7,7",8899c689bd6c24a48ef9c1964b063fbe,浮图 萧瑟 入 虚空 一 聚 全身 罔 像 中 传 马祖 心 开佛 印 识 龙 潜 主示 神通 毫光 委坠 江楼 月 道气 馨香 海岸 风 此地 化缘 才 始尽 更于 何处 动 魔宫
c54b1990-79cd-41ad-b6c6-e5a8a61a31a3,句  其一,释赞宁,宋,诗,七言古体,山黛浅深春气力 浪花开合水工夫,"7,7",ab128a7c2646e714ab41d732f1a43838,山黛浅 深春 气力 浪花 开合 水 工夫
8cb8deda-3943-4cee-86a6-aa154b650c54,句  其二,释赞宁,宋,诗,五言古体,草浓春迳狭 树密晚窗阴,"5,5",d47182616ecd04b0b6a2e024c1c3d5dd,草浓春 迳 狭 树密 晚窗 阴
c0f3b598-bd89-404a-82cb-18e2b3bbf748,句  其三,释赞宁,宋,诗,五言古体,登楼千里月 欹枕一声蝉,"5,5",fde8165fa9be773545e8dce63a9ba193,登楼 千里 月 欹 枕 一声 蝉
33280551-8da6-410d-a4c1-7f3b26ceddc0,句  其四,释赞宁,宋,诗,五言古体,要路花争发 闲门草易荒,"5,5",05b5b760d535d2e6445b76d39c6256c0,要路 花争 发 闲门 草易 荒
417e809e-4074-4507-8da8-b3af000125c2,句  其五,释赞宁,宋,诗,五言古体,与闲为活计,5,14da0bd54b61d62ce9b49a1ed53d250b,与 闲为 活计
d5c18a3a-c6a3-454e-b3f8-52207a6afe25,句  其六,释赞宁,宋,诗,五言古体,何用密防奸,5,960c4ba8e0f40833fa033184913e86e8,何用 密防奸
d7de1ebb-8b2f-4f4d-861b-41daab71cddb,答赞宁,天目僧,宋,诗,杂言,中人事违 天眼中修定 我本无根株 只将笋为命,"4,5,5,5",96d5da90f29615319711bf49c8d9648b,中 人事 违 天 眼中 修定 我 本 无根株 只 将 笋 为 命
be83cf57-d4b2-4c9d-bfce-0472ef8580b9,偈,释可勋,宋,诗,五言绝句,秋江烟岛晴 鸥鹭行行立 不念观世音 争知普门入,"5,5,5,5",cf61e429ac1f3da8c5dc8ee84189ad4b,秋江 烟岛 晴 鸥 鹭 行行 立 不 念 观世音 争知 普门 入
66fbb146-a9ad-4665-8b46-7e93692888c1,句,释可勋,宋,诗,七言古体,天晓不干钟鼓事 月明岂为夜行人,"7,7",bb19cb24585a8810584fe0a4d6006877,天晓 不 干 钟鼓 事 月 明 岂 为 夜行人
9920c3e2-0f58-42dc-bccb-341e45796fd0,诗一首,许坚,宋,诗,五言绝句,祗应天上路 不为下方开 道既学不得 仙从何处来,"5,5,5,5",d5c29da3d6f6f828509756f5378daab7,祗 应天 上路 不 为 下方 开 道 既 学 不得 仙 从 何处 来
fb030b75-6205-45b9-852e-670ffe0fe0cb,题简寂观,许坚,宋,诗,七言律诗,尝恨真风千载隠 洞天还得恣游遨 松楸古迹一坛静 鸾鹤不来青汉高 茅氏井寒丹亦化 玄宗碑断梦曾劳 分明有个长生路 不向红尘白二毛,"7,7,7,7,7,7,7,7",8073948b03bd973bfe7bab7b2cffae8d,尝恨 真风 千载 隠 洞天 还 得 恣游 遨 松楸 古迹 一坛 静 鸾 鹤 不 来 青汉 高 茅氏 井寒丹 亦 化 玄宗碑 断 梦 曾 劳 分明 有个 长生 路 不 向 红尘 白二毛
54a7827a-47b3-4704-a0cb-d4579799a6e8,宿溧阳灵泉精舍僧以白字韵请留诗,许坚,宋,诗,七言律诗,近枕吴溪与越峰 前朝恩锡灵泉额 竹林晴见雁塔高 石室增栖几禅伯 荒碑字没秋苔深 古池香泛荷花白 客有经年别故林 落日啼猿情脉脉,"7,7,7,7,7,7,7,7",44f319e03181ea2ce523379e85cddae0,近 枕 吴溪 与 越峰 前朝 恩锡灵 泉额 竹林 晴见 雁塔 高 石室 增 栖 几 禅 伯 荒碑 字 没 秋 苔 深 古池 香泛 荷花 白 客 有经 年别 故林 落日 啼猿 情 脉脉
32555186-57bb-4d73-aea6-a4ae9e25dc1d,上徐舍人铉,许坚,宋,诗,七言绝句,几宵烟日锁楼台 欲寄侯门荐祢才 满面尘埃人不识 谩随流水出山来,"7,7,7,7",18c233da5912db4feaad6e15dd2803db,几 宵 烟 日 锁 楼台 欲 寄 侯门 荐 祢 才 满面 尘埃 人 不识 谩随 流水 出山 来
1724486c-0bd6-4ed3-a878-f8ee4419966c,戢兵山,许坚,宋,诗,七言绝句,石鼓高悬蕴大音 白云峰顶始铺金 能来斯地鼓斯鼓 尽达曹溪圣祖心,"7,7,7,7",67439a33eaee0a93ec9419a42cddb9fd,石鼓 高悬 蕴大 音 白云 峰顶 始 铺金 能来 斯地鼓斯鼓 尽 达 曹溪圣 祖心
8fbed758-00a6-4108-b478-a6181ae7ee11,题幽栖观,许坚,宋,诗,五言律诗,仙翁上升去 丹井寄晴壑 山色接天台 湖光照寥廓 玉洞绝无人 老桧犹栖鹤 我欲掣青蛇 他时冲碧落,"5,5,5,5,5,5,5,5",c2737e5633afec425071357715b4378a,仙翁 上升 去 丹井 寄晴壑 山色 接 天台 湖 光照 寥廓 玉洞 绝无 人 老桧犹 栖 鹤 我 欲 掣 青蛇 他时 冲 碧落
431b1898-bd46-4601-86f7-da93cc3d6ee7,登游齐山,许坚,宋,诗,七言绝句,星使南驰入楚重 此山偏得驻行踪 落花满地月华冷 寂寞旧山三四峰,"7,7,7,7",711fad45e32657e164d5e26472b94618,星使 南 驰入 楚重 此 山 偏 得 驻 行踪 落花 满地 月华 冷 寂寞 旧山 三四 峰
c288da51-702b-4e19-8343-dac15a45ae55,题扇,许坚,宋,诗,七言绝句,哦吟但写胸中妙 饮酒能忘身后名 但愿长闲有诗酒 一溪风月共清明,"7,7,7,7",905c8e39f793ddbae38f83c3eaac21b1,哦 吟 但 写 胸中 妙 饮酒 能 忘 身后 名 但愿 长 闲 有 诗 酒 一 溪 风月 共 清明
cb19bf7f-9089-4428-9de2-4c2c482dcdb3,题义门胡氏华林书院,许坚,宋,诗,七言律诗,尽说灵踪妨画图 幽奇高尚义群居 山林总是神仙隠 礼乐爰修周孔书 解驾十年惟壮士 担簦千里结名庐 功成霄汉非常事 对此那堪不我欺,"7,7,7,7,7,7,7,7",6f4c7fc7ed84d14bde322af4675b2512,尽说 灵踪 妨 画图 幽奇 高尚 义 群居 山林 总是 神仙 隠 礼乐 爰 修 周孔书 解驾 十年 惟 壮士 担 簦 千里 结名 庐 功成 霄汉 非常 事 对此 那堪 不 我 欺
1210ed6d-3233-419e-af8e-b0a9e0a06f7f,句,许坚,宋,诗,七言古体,卧久就慵伸雪项 少迟犹未整霜衣,"7,7",49eaff5e335d5f9e95a8de20c8b95f5a,卧 久 就 慵 伸 雪 项 少 迟 犹未整霜 衣
6bcde4fd-ea26-4189-8564-0d77910a43ac,句,文德嵩,宋,诗,七言古体,九品朝中无势援 五层山下有耕桑,"7,7",a041c26069f2c4950ac48c62fbbe307d,九品 朝 中 无势援 五层 山下 有 耕桑
b25f5426-267a-4373-b8dd-29ed11f9397b,题所居,黄子棱,宋,诗,七言律诗,青衫木笏尚初官 未老金鱼是等闲 世上几多名将相 门前谁有此溪山 市楼晚日红高下 客艇春波绿往还 人过小桥频指点 全家都在画图间,"7,7,7,7,7,7,7,7",9c80349b315f2495253ce37258cecdba,青衫 木笏尚 初 官 未 老 金鱼 是 等闲 世上 几多 名将 相 门前 谁 有此 溪山 市楼 晚日 红 高下 客艇 春波 绿往 还 人 过 小桥 频 指点 全家 都 在 画图 间
eae460ec-fb57-4e95-9339-32861a716fa1,答僧慧文  其一,释晓荣,宋,诗,五言绝句,般若大神珠 分形万亿躯 尘尘彰妙体 刹刹尽毗卢,"5,5,5,5",098c99a9a388ead08e28d717bcfd4da0,般若 大神 珠 分形 万亿 躯 尘尘彰 妙体 刹刹 尽 毗卢
09bc842e-8f54-4cd4-80e7-e5d893ebb541,答僧慧文  其二,释晓荣,宋,诗,五言绝句,一念周沙界 日用万般通 湛然常寂灭 常展自家风,"5,5,5,5",c4fd1fd01c5d016ee69ff685507de44b,一 念 周 沙界 日用 万般 通 湛然 常 寂灭 常展 自家 风
aed70828-a0fd-4b9a-bc1b-ac8ddbd82172,留鹤赠廖融,潘若冲,宋,诗,七言律诗,峭格数年同野兴 一官才罢共船归 稻粱少饲教长瘦 羽翼无伤任远飞 侧耳听吟侵静烛 衔花作舞带斜晖 朝天万里不将去 留伴高人向钓矶,"7,7,7,7,7,7,7,7",fddb925db4abb98542dd7a1ca559de30,峭格 数年 同 野兴 一 官 才 罢 共船 归 稻粱 少 饲 教长 瘦 羽翼 无伤 任远飞 侧耳 听吟 侵静 烛 衔 花作 舞带 斜晖 朝 天 万里 不 将 去 留伴 高人 向 钓矶
3640fd6f-274d-4e4f-933b-2bc5c1df5be3,寄南岳廖融,潘若冲,宋,诗,七言律诗,曾经别墅住行踪 春浪和烟撼钓筒 共步幽亭连石藓 寄眠静榻带松风 秋来频梦岳云白 别后应添鹤顶红 又泛汴舟随汴水 不堪南望思忡忡,"7,7,7,7,7,7,7,7",a220cdfb0237b5177c342d803426d01b,曾经 别墅 住 行踪 春浪 和 烟 撼 钓筒 共步 幽 亭 连 石藓 寄眠 静榻 带松 风 秋来 频梦 岳云白 别后 应添 鹤顶红 又 泛 汴 舟 随 汴 水 不堪 南望思 忡忡
790cb21f-cfe2-47ab-920b-f8d2de04aa2d,闻融与鹤相继而亡感赋绝句,潘若冲,宋,诗,七言绝句,南岳僧来共叹吁 风亭月榭已荒芜 先生去世未十日 留伴高吟鹤亦徂,"7,7,7,7",e9bdd7d173e5caeff45a58bc049705a9,南岳 僧 来 共 叹吁 风亭 月榭 已 荒芜 先生 去世 未 十日 留伴 高吟鹤 亦 徂
0e686b92-2ccc-458f-9649-dd771fe41801,哭廖融,潘若冲,宋,诗,五言律诗,天丧我良知 无言双泪垂 惟求相见梦 永绝寄来诗 应有异人吊 从兹雅道衰 春风古原上 新冢草离离,"5,5,5,5,5,5,5,5",41605440689f0aff0c5b96a66392bebb,天 丧 我 良知 无言 双泪 垂 惟求 相见 梦 永绝 寄来 诗 应有 异人 吊 从兹雅 道 衰 春风 古原 上 新 冢 草 离离
75e20c12-6b17-4d81-88d7-ab9a11af1d9f,赠王正己,潘若冲,宋,诗,五言律诗,两捧歌诗寄 公余即展开 无时惟北望 何日逐南来 梦里得芳草 笛中闻落梅 终朝一携手 江上有楼台,"5,5,5,5,5,5,5,5",ad470bd90a9c128aaba6548c6ca73426,两 捧 歌 诗 寄 公余 即 展开 无时 惟 北望 何日 逐 南来 梦 里 得 芳草 笛中闻 落 梅 终朝 一 携手 江上 有 楼台
49aff695-96e2-4fad-981a-f3bdbc09405c,北海题渚宫,窦俨,宋,诗,七言绝句,纪南南望水城宽 水色天光混一般 大抵江乡足诗景 咏吟如把画图看,"7,7,7,7",3704717f9914a8ee003e73cfc0bd59f2,纪南南 望 水城 宽 水色 天光 混 一般 大抵 江乡 足 诗景 咏吟 如 把 画图 看
01e6d957-19ef-492b-87c7-6e490cf8325f,偈答百丈僧,释道常,宋,诗,七言绝句,不要三乘要祖宗 三乘不要与君同 君今欲会通宗旨 后夜猿啼在乱峰,"7,7,7,7",2da8039b7d580f71c84731d3c0e09110,不要 三乘 要 祖宗 三乘 不要 与 君 同 君 今 欲 会通 宗旨 后夜 猿啼 在 乱峰
85dd39e2-e4a4-4f99-8751-172a8e3d87ac,宿廖融山斋,杨徽之,宋,诗,五言律诗,清和春尚在 欢醉日何长 谷鸟随柯转 庭花夺酒香 初晴岩翠滴 向晚树阴凉 别有堪吟处 相留宿草堂,"5,5,5,5,5,5,5,5",9217e625894fbe17b4caaa1d746d9e74,清 和 春尚 在 欢醉 日 何长 谷鸟 随 柯转 庭花 夺 酒香 初晴岩 翠滴 向晚 树阴凉 别 有 堪吟 处 相 留宿 草堂
93c4dadf-42f9-45c1-a45f-70e817318bb8,峨眉,杨徽之,宋,诗,五言绝句,嘉州山水地 二蜀最为美 翠岭叠峨眉 长澜涌锦水,"5,5,5,5",19f3b9ae6e2c26b3e832d04299d5cdca,嘉州 山水 地 二 蜀 最为 美 翠岭 叠 峨眉 长澜涌 锦水
