id,title,author,dynasty,genre,poem_type,sentences_simplified,meter_pattern,hash,words
c7a2a6af-4854-438b-b3e3-5a46ffb9121c,次韵苏中丞喜文潜病间,晁补之,唐,诗,七言律诗,携筇过子约朝朝 况是门无百步遥 午卧檐曦茶可煮 夜谈窗霰栗堪烧 范鱼何用惊生釜 郑鹿应知梦覆蕉 试作文殊问居士 从今一饭久如消,"7,7,7,7,7,7,7,7",706247b5cf71d5ec62740f893e3b3aca,携 筇 过子 约 朝 朝 况是 门无 百步 遥 午 卧 檐 曦 茶 可 煮 夜谈 窗霰栗 堪烧 范鱼 何用 惊生釜 郑鹿 应知 梦 覆 蕉 试作 文殊 问 居士 从今 一 饭 久 如 消
960f3dd4-cdae-40a6-8f4a-fb9fef321ea4,锁试呈同舍三首  其一,晁补之,唐,诗,七言律诗,官局悠悠共此行 来时庭菊未含英 五更脱叶惊书几 一夜寒砧满禁城 诗似凉风来有思 酒如清露挹无声 何时骢马催归去 更有林端魄一生,"7,7,7,7,7,7,7,7",282f0bdd68704c442e333eeac2375f0f,官局 悠悠 共 此行 来时 庭 菊 未含 英 五更 脱叶 惊书 几 一夜 寒 砧 满 禁城 诗 似 凉风 来有 思 酒 如 清露 挹 无声 何时 骢 马 催 归去 更 有 林端 魄 一生
98ee759d-6af8-4d6d-8945-ad461d6ddf00,锁试呈同舍三首  其二,晁补之,唐,诗,七言律诗,天街初月映天河 拜敕东华走马过 解榻暂如龟遇木 闭帘还似雉婴罗 倦依书册工催睡 闷倚诗篇足当歌 可待纷纷厌朱墨 昼闲唯有饮无何,"7,7,7,7,7,7,7,7",59ec108c338dd7f85c6088f9a4375452,天街 初月 映 天河 拜 敕 东华 走马 过 解榻 暂如 龟遇 木 闭帘 还 似 雉 婴 罗 倦 依 书册 工 催 睡 闷 倚 诗篇 足 当 歌 可待 纷纷 厌 朱墨 昼闲 唯有 饮无何
60810317-2ab6-48b9-94c5-4d82ca78a1bb,锁试呈同舍三首  其三,晁补之,唐,诗,七言律诗,周行栉比未应充 荐庙方求古鼎钟 经眼乍愁千纸积 解颐聊喜一言逢 黄花庭槛时虽过 白酒邻槽愿可从 更促寄衣真似旅 晓堂初怯露寒浓,"7,7,7,7,7,7,7,7",bd16933e75a6129bb6219393d6a748ee,周行 栉比 未 应充 荐 庙 方求 古鼎钟 经眼 乍 愁 千纸 积 解颐 聊喜一言逢 黄花 庭 槛 时 虽过 白酒 邻槽 愿 可 从 更 促寄 衣 真似 旅 晓堂 初 怯 露 寒 浓
fca7aaf5-2a18-4caa-8721-854205cc70b0,试院呈文潜用前韵,晁补之,唐,诗,七言律诗,神交千古圣贤中 尚想铜山应洛钟 倾盖十年唯子旧 知音一世更谁逢 天如蚁磨骎骎旦 谈似缲车亹亹从 邻榻邓侯那不共 拥衾百首兴方浓,"7,7,7,7,7,7,7,7",254012c01b908401e07547cb0c5f358d,神交 千古 圣贤 中 尚 想 铜山 应洛钟 倾盖 十年 唯子 旧 知音 一世 更 谁逢 天如蚁 磨 骎 骎 旦 谈似 缲 车 亹 亹 从 邻榻 邓侯 那 不 共 拥 衾 百首 兴方 浓
ee89a28f-9033-4f4a-b3cf-c8b7c56fcd5b,慎思闻家弟无斁捷解见贻用前韵,晁补之,唐,诗,七言律诗,吾弟平生辛苦同 匹雏志举百钧钟 自惭操瑟尚不斥 劝使力田终有逢 青眼故人欣捷报 白头老母喜占从 书林傥预西城集 釂子酣酣杏正浓,"7,7,7,7,7,7,7,7",d7c0dfe7f07285dd25b5a0858720de1f,吾 弟 平生 辛苦 同 匹 雏志 举百钧钟 自惭 操瑟尚 不斥 劝 使 力田 终 有 逢 青眼 故人 欣 捷报 白头 老母 喜占 从 书林 傥 预 西城 集 釂 子 酣 酣 杏 正浓
c1e03424-397b-4072-8d88-5850c818e04a,复用前韵寄题慎思豪塘居,晁补之,唐,诗,七言律诗,玉泉飞落白霞峰 散入山田亩十钟 邓子结庐真世外 陶公脱屣更谁逢 鶑啼春竹风烟近 龙起秋堂雨雹从 谁使山人空蕙帐 蓬莱金殿兴方浓,"7,7,7,7,7,7,7,7",751e2299fb59f51442d49a1edf2bcc65,玉泉 飞落 白霞峰 散入 山 田亩 十钟 邓子 结庐 真 世外 陶公 脱屣 更 谁逢 鶑 啼 春 竹 风烟 近 龙起秋堂 雨 雹 从 谁 使 山 人 空 蕙 帐 蓬莱 金殿 兴方 浓
147f454e-5933-471a-8640-60ab6da27ed7,呈曹子方,晁补之,唐,诗,七言律诗,曹子金门等陆沉 壮年裘马四方心 檄传白羽从沙井 诗写红巾遍武林 兵甲胸中无敌国 丝桐世外有知音 相逢不饮何为者 祗作寒厅拥鼻吟,"7,7,7,7,7,7,7,7",ae9cc75bd1266c049cdca0541920dc27,曹子 金门 等 陆沉 壮年 裘马 四方 心 檄传 白羽 从 沙井 诗 写 红巾 遍 武林 兵甲 胸中 无 敌国 丝桐 世外 有 知音 相逢 不 饮 何为 者 祗 作 寒厅 拥鼻吟
c50f8870-950f-4b4b-99fa-cf15e82af0ce,泗州王谏议明叟留饮,晁补之,唐,诗,七言律诗,云水东游蚤岁怀 半生尘土却教回 两行堤柳关心在 一点淮山入眼来 北省主人夸酒好 南风稚子喜帆开 扬州底事牵行色 端为琼花芍药催,"7,7,7,7,7,7,7,7",e46ec3e8b0168f6592c5e15424121608,云 水东 游蚤 岁 怀 半生 尘土 却 教 回 两行 堤 柳 关心 在 一点 淮山 入眼 来 北省 主人 夸酒 好 南风 稚子 喜帆开 扬州 底事 牵 行色 端 为 琼花 芍药 催
1468fed8-d52f-43c9-8c22-37fbddb0fc2d,招缙云守关彦远教授曾彦和集平山堂次关韵,晁补之,唐,诗,七言律诗,蜀冈势与蜀山通 龙虎盘挐上紫空 小语还忧惊太一 高堂元自在天中 少师杨柳无遗迹 承旨歌谣有旧风 斜日芜城易兴感 忘怀犹喜故人同,"7,7,7,7,7,7,7,7",6c9795ae79bafd56d223c62de5e840fc,蜀冈 势 与 蜀山 通 龙虎 盘 挐 上 紫 空 小语 还 忧惊 太 一 高堂 元 自 在 天中 少师 杨柳 无 遗迹 承 旨 歌谣 有 旧 风 斜 日芜 城易 兴感 忘怀 犹喜 故人 同
e8d517ef-29bb-4da2-b1cd-d7453a59a7b5,陪关彦远曾彦和集龙兴寺咏隋时双鸭脚次关韵,晁补之,唐,诗,七言律诗,风起雷塘陵上尘 雨荒苔院两株春 楼台有迹皆余烬 草木无知尚见珍 博士独能名玉棐 使君还许寿灵椿 宣城此物常充贡 谁与连艘送万囷,"7,7,7,7,7,7,7,7",f03a4b0f313233761cfd99b0c968b07d,风 起 雷塘陵 上 尘 雨荒 苔院 两株 春 楼台 有迹 皆 余烬 草木 无知 尚见珍 博士 独能 名 玉 棐 使君 还许 寿灵椿 宣城 此物 常充贡 谁 与 连 艘 送 万 囷
06b22724-001d-41d4-93cc-c35e95866659,阎醇老作默斋,晁补之,唐,诗,七言律诗,浄名良久文殊叹 此是如来不二门 要识结瘖非是默 应知分别亦无言 一弦曾得嵇生愧 三复能令孔子尊 正复立谈封万户 时清何害口澜翻,"7,7,7,7,7,7,7,7",f76ee247be45c3e9d3bd53ce3ad60aee,浄 名 良久 文殊 叹 此是 如来 不 二门 要识 结 瘖 非 是 默 应知 分别 亦 无言 一 弦 曾 得 嵇生 愧 三 复能 令 孔子 尊 正 复立 谈封 万户 时清何 害口 澜 翻
d0211d3c-ffd9-4ef7-a135-40428da697bb,与昙秀师别垂二十年而后相会于金山作,晁补之,唐,诗,七言律诗,诗笔多生习气牵 老来经呗亦随缘 何妨偶入东坡梦 未害闲依北固禅 万里波涛凭槛语 一山风雨并窗眠 未甘白首尘埃地 更约相逢二十年,"7,7,7,7,7,7,7,7",b7992d6aa6c202df7b9298be98a73f3a,诗笔 多 生 习气 牵 老来经 呗 亦 随缘 何妨 偶入 东坡 梦 未害 闲 依 北 固 禅 万里 波涛 凭槛 语 一 山 风雨 并 窗眠 未 甘 白首 尘埃 地 更约 相逢 二十年
87c73caf-eb46-43c6-99c5-a6ff1c1ee95f,送昙秀师归庐山梦斋,晁补之,唐,诗,七言律诗,扁舟又过楚江东 庐阜霜晴翠埽空 四海五湖皆逆旅 千岩万壑正秋风 会观沙界无华处 何必茅斋是梦中 已悟三生旧知识 不因天竺寺前逢,"7,7,7,7,7,7,7,7",660f1666d5240f64ea53a72887104603,扁舟 又 过楚 江东 庐阜 霜 晴 翠 埽 空 四海 五湖 皆 逆旅 千岩万壑 正 秋风 会观 沙界 无华 处 何必 茅斋 是 梦 中 已 悟 三生 旧 知识 不 因 天竺 寺 前 逢
2589951c-601c-4a2c-b357-f9bba7d584bd,戊子六月十三日曝书得史院赐笔感怀,晁补之,唐,诗,七言律诗,君王孝悌纂修意 丞相忠良典领宜 却恨身为周柱史 不令人识汉官仪 当年请郡新进笑 今日曝书陈迹迷 犹有院中宣赐笔 不妨林下醉题诗,"7,7,7,7,7,7,7,7",ed1018950dbf72a0d87b9672fdfe1bca,君王 孝悌 纂修 意 丞相 忠良 典领 宜 却 恨 身为 周柱史 不 令人 识 汉官仪 当年 请 郡 新 进笑 今日 曝书 陈迹 迷 犹 有 院中 宣赐笔 不妨 林下 醉 题诗
a57059f1-4e4b-4f73-8bd7-07a0da2b6640,和二叔父少监入馆见赐诗,晁补之,唐,诗,七言律诗,楩柟要是晚方成 雄朔遗风世共惊 屑去未惊容必去 逃名还自得高名 歌行元白辞涛壮 书画钟王笔势精 乘马辎车何足算 不将稽古愧桓荣,"7,7,7,7,7,7,7,7",f5d3dd6131f3fa9532933b8bfd84af50,楩 柟 要是 晚 方成 雄 朔 遗风 世共惊 屑 去 未 惊容 必 去 逃名 还 自得 高 名 歌行 元 白辞涛 壮 书画 钟王 笔势 精 乘马 辎车 何 足算 不将稽古愧 桓荣
15716218-4141-4ff7-8443-baed19858433,次韵四叔父寄贺二叔父少监入馆并见寄诗,晁补之,唐,诗,七言律诗,琅邪太守鲁儒英 典校还高刘更生 已似诸荀并才子 复如群窦占诗名 尚吟河水怜孤姪 应与乡人痛伯兄 老鹤长鸣近天汉 可容丛灌和骊庚,"7,7,7,7,7,7,7,7",bba22638b33f20fb34b05975fe0f3b5c,琅邪 太守 鲁儒英 典校 还 高 刘 更生 已 似 诸荀 并 才子 复如 群 窦 占 诗名 尚吟 河水 怜 孤 姪 应 与 乡人 痛 伯兄 老鹤 长鸣 近 天汉 可容 丛灌 和 骊 庚
88368a85-3984-4855-aac4-8e99d7062e16,送欧诚发,晁补之,唐,诗,七言律诗,春风共载扬州路 屈指都疑梦夜阑 可是重来俱白发 只堪归去却黄冠 为郎我頼文书少 作邑君逢政令宽 自古江山胜尘土 莫轻故步爱邯郸,"7,7,7,7,7,7,7,7",9b61f639908ac7672e5e0fb25701d0ca,春风 共载 扬州 路 屈指 都 疑 梦 夜阑 可是 重来 俱 白发 只 堪 归去 却 黄冠 为 郎我 頼 文书 少 作 邑 君 逢 政令 宽 自古 江山 胜 尘土 莫轻 故步 爱 邯郸
90080f3b-2e3d-489a-821c-3e72cabc39c2,守蒲次新安西先寄府教授之道弟,晁补之,唐,诗,七言律诗,文章之子日翘翘 恐不能如岂有超 助我彤襜问民俗 烦君泮水采风谣 预知薄宦妨同处 且可清樽约屡招 十月驱车汉函谷 冷云高处望中条,"7,7,7,7,7,7,7,7",0d54918eb27bd519e31a9ef1b3d8e06e,文章 之 子 日 翘翘 恐 不能 如 岂 有 超 助 我 彤襜 问 民俗 烦 君泮 水 采 风谣 预知 薄宦 妨同 处 且 可 清 樽 约 屡 招 十月 驱车 汉 函谷 冷云 高处 望 中 条
49e37d93-2d43-4446-a2a5-6aaeede1c498,再用前韵答之道弟府教授,晁补之,唐,诗,七言律诗,文辞便是升堂贾 谈辩宁非入幕超 已谓囊中能出颖 那知车下正哀谣 但从袁盎无何饮 莫笑冯公不见招 伴我河山访陈迹 明年红紫满阳条,"7,7,7,7,7,7,7,7",6221282a1435093ac699e5e2bf853ec2,文辞 便是 升堂 贾 谈辩 宁非 入幕 超 已谓 囊中 能出 颖 那 知车 下 正 哀谣 但 从 袁 盎无何饮 莫笑 冯公 不见 招 伴 我 河山 访 陈迹 明年 红紫 满阳 条
38f8aed6-866e-48f4-81c6-0a352131f471,渑池道中寄福昌令张景良通直,晁补之,唐,诗,七言律诗,十年一梦间湖湘 欲往从之道阻长 可但知君爱彭泽 不应言我薄淮阳 马穿崤底流泉白 鸟下关头落照黄 愁作驿亭寒不寐 怀人思古九回肠,"7,7,7,7,7,7,7,7",668a5660709e1fb506f89cb5063e534c,十年 一梦 间 湖湘 欲 往 从 之 道 阻长 可但 知 君 爱 彭泽 不 应言 我 薄 淮阳 马 穿 崤 底 流泉 白 鸟 下 关头 落照 黄 愁作 驿亭 寒 不寐 怀人 思古 九 回肠
3a7ce095-3287-426d-b012-9f389572b87a,次韵毅父提刑将至蒲见寄,晁补之,唐,诗,七言律诗,骑报山云见旗脚 吏趋原雪没靴翁 朅来定坐玄犹白 捷去还忧易又东 他日江湖空白首 只今关陇有清风 登瀛契分南迁梦 十五年来事事同,"7,7,7,7,7,7,7,7",2340d3bdf4a98a3ab5f0e6cbfb72fb40,骑报 山云见旗脚 吏 趋 原雪 没 靴 翁 朅 来 定 坐 玄 犹 白 捷 去 还 忧易 又 东 他 日 江湖 空白 首 只今 关 陇 有 清风 登 瀛 契 分 南 迁 梦 十五年 来 事事 同
88e81be8-834a-49f7-bc1f-ce2585b215ad,次韵毅父户部兄游栖岩寺,晁补之,唐,诗,七言律诗,恐是初禅第一天 千秋龙象镇危巅 坐看玉井莲飘叶 绝胜香罏日照烟 点点蚁封知晋甸 纷纷雁背向秦川 要须浩荡奇言称 付与南华旧老仙,"7,7,7,7,7,7,7,7",51a9189f0a6adb1dff1bc41fa4045bd5,恐 是 初 禅 第一天 千秋 龙象 镇 危巅 坐看 玉井 莲 飘 叶 绝胜 香 罏 日照 烟 点点 蚁 封知 晋甸 纷纷 雁 背向 秦川 要 须 浩荡 奇 言 称 付与 南华 旧 老 仙
f1bb83b0-cb5a-4ddd-89e2-3570c79da51d,庐山,晁补之,唐,诗,七言律诗,丹碧沉沉虎豹闲 松幢引度九重关 人间未觉浑无路 天上还惊更有山 瑶草红泉供挹酌 金风白露送跻攀 良游自叹平生误 便作归来鬓已斑,"7,7,7,7,7,7,7,7",8eb0eaa873d0cf6c138ae13b627abf87,丹碧 沉沉 虎豹 闲 松 幢 引度 九重 关 人间 未觉 浑无路 天上 还 惊 更 有 山 瑶草 红泉 供 挹 酌 金风 白露 送 跻攀 良游 自叹 平生 误 便 作 归来 鬓 已 斑
e47db264-cac4-4953-ab34-bede795c85ef,叙旧感怀呈提刑毅父并再和六首  其一,晁补之,唐,诗,七言律诗,儿童豪气自堪惊 未入乡人月旦评 叔向亦闻呼使上 子将一见便知名 平生兰省追高步 老去秦川共此行 頼有蒲城桑落酒 高楼条华慰人情,"7,7,7,7,7,7,7,7",00b900e469c70112fe2664e96a242b0f,儿童 豪气 自堪惊 未入 乡人 月旦评 叔向 亦 闻 呼使 上 子 将 一见 便 知名 平生 兰省 追 高步 老 去 秦川 共 此行 頼 有 蒲城 桑落 酒 高楼 条 华慰 人情
4681afd5-ea10-4832-b477-84a591843eba,叙旧感怀呈提刑毅父并再和六首  其二,晁补之,唐,诗,七言律诗,赋成庚子尚魂惊 往事如风未暇评 长乐钟前偶相对 凌烟图上等浮名 登车岂是君无意 襆被何妨我自行 更许心亲遗貌敬 老来尤见旧交情,"7,7,7,7,7,7,7,7",f8bc41c259e8cd95cca46a1f7f37c73b,赋成 庚子 尚魂 惊 往事 如风未暇 评 长乐 钟 前 偶 相对 凌烟图 上 等 浮名 登车 岂 是 君 无意 襆 被 何妨 我 自行 更许 心亲遗貌敬 老来 尤见旧 交情
a643e8c9-3d15-4de4-8e51-21cc0c9eda01,叙旧感怀呈提刑毅父并再和六首  其三,晁补之,唐,诗,七言律诗,二人射策几人惊 要与三苏共入评 先圣子孙多异禀 累朝图牒有高名 书传科斗犹须定 钓拂珊瑚未可行 子墨文章豪气在 登临怀古一含情,"7,7,7,7,7,7,7,7",27f9f614d261ef7f0a4f145df2ba8205,二人 射策 几 人 惊 要 与 三 苏共 入评 先圣 子孙 多 异禀 累 朝 图牒 有 高名 书 传科斗犹须定 钓拂 珊瑚 未 可行 子墨 文章 豪气 在 登临 怀古 一 含情
1e165116-0507-4467-bf3d-605627e4f567,叙旧感怀呈提刑毅父并再和六首  其四,晁补之,唐,诗,七言律诗,须弥纳芥事堪惊 千岁聊堪一日评 世上相逢俱梦寐 古来何处是功名 簿书听我依稀了 云水陪君浩荡行 便与此山同不朽 不应惆怅复牵情,"7,7,7,7,7,7,7,7",0cd3caba855a6f9ed4ff7ea35627295b,须弥 纳芥 事堪惊 千岁 聊堪 一日 评 世上 相逢 俱 梦寐 古来 何处 是 功名 簿 书 听 我 依稀 了 云水 陪 君 浩荡 行 便 与 此 山 同 不朽 不 应 惆怅 复 牵 情
290d7072-d79f-4ef3-9166-85ecbdf514b1,叙旧感怀呈提刑毅父并再和六首  其五,晁补之,唐,诗,七言律诗,郎潜如我未宜惊 户部须推宰相评 他日碧山思却走 当年紫府已收名 共知白发生青鬓 未废长歌续短行 樽酒不空多坐客 君家余事足陶情,"7,7,7,7,7,7,7,7",5ca1860016d876d8831524b7275ef0b7,郎潜 如 我 未 宜 惊 户部 须 推 宰相 评 他 日 碧山思 却 走 当年 紫府 已 收名 共 知白 发生 青鬓 未 废长 歌续 短行 樽 酒 不 空 多 坐客 君家 余 事 足 陶情
4aaa8ee5-fa82-40d3-9c70-66cd8e9f7cd0,叙旧感怀呈提刑毅父并再和六首  其六,晁补之,唐,诗,七言律诗,亲见扬雄自不惊 吾人要使后人评 白圭未可轻三复 小草须防得二名 太华耸天如剑立 黄河蹙野似军行 栖迟自忆衡门后 可是登楼不称情,"7,7,7,7,7,7,7,7",9965542be069cd514246bec2dc7357bb,亲见 扬雄 自不惊 吾人 要 使 后人 评 白圭 未 可轻 三 复 小草 须 防得 二名 太华 耸天如剑立 黄河 蹙 野似 军行 栖迟 自忆 衡门 后 可是 登楼 不称 情
286d1a8e-8c17-4567-910c-1c0f64dfa604,用评字韵和答府教授十二弟,晁补之,唐,诗,七言律诗,君诗飘举似鸿惊 书入扬州子弟评 圣世由来升俊造 少年已自得声名 六经正可三冬足 万里聊堪一日行 更约弥敦同姓乐 能来触咏畅幽情,"7,7,7,7,7,7,7,7",f0b717a1747d48bebd93fb61fb399be3,君 诗 飘 举似鸿惊 书入 扬州 子弟 评 圣世 由 来升 俊 造 少年 已 自得 声名 六经 正 可 三 冬 足 万里 聊堪 一日 行 更约 弥敦 同姓 乐 能来 触咏 畅 幽情
7791ac0a-bc2a-43a5-bf39-f90d215eaea0,次韵邠倅王正夫,晁补之,唐,诗,七言律诗,函谷鸡鸣满面尘 夫君泛爱尚为亲 清时有味俱吾党 黄发相看更几人 物理未惊翁丧马 世情应笑子知津 似闻绝塞风沙苦 只约觥船莫负春,"7,7,7,7,7,7,7,7",49ba50dbe1982122e2a80f8219792772,函谷 鸡鸣 满面 尘 夫君 泛爱 尚为 亲 清时 有 味 俱 吾 党 黄发 相看 更 几 人 物理 未 惊翁丧马 世情 应笑 子知津 似闻绝 塞 风沙 苦 只约 觥船莫负春
744ec50b-2b40-4276-a69f-7005e8c01d76,蠖轩孤坐寄曹南教授八弟,晁补之,唐,诗,七言律诗,畏暑经旬不涉街 蠖轩孤坐壁生苔 出檐碧笋犹争长 映户丹榴故后开 双蝶风前愁夜去 一蝉雨外送秋来 曹南瘦弟应相忆 白首迁兄未放回,"7,7,7,7,7,7,7,7",eda90cd98f5568defcd3e77a58b58acf,畏 暑经旬 不 涉街 蠖 轩 孤坐 壁生 苔 出檐碧笋 犹 争长 映户丹 榴故 后 开 双蝶 风 前 愁 夜去 一 蝉 雨 外 送 秋来 曹南 瘦 弟应 相忆 白首 迁兄 未 放回
c291953d-2602-4a35-807f-64474b728d06,次韵袁畴耕道见贻,晁补之,唐,诗,七言律诗,阅世纷纷共旅亭 归来眼为里人明 老夫未叹尝三已 吾子何忧取一名 仁义夙心成自误 文章小道得高评 曲池远市偏宜暑 携卷同来看月生,"7,7,7,7,7,7,7,7",ba9ae07403c661f6d6bd8fb6f1744da9,阅世 纷纷 共 旅 亭 归来 眼为 里 人 明 老夫 未 叹尝 三 已 吾子 何 忧取 一名 仁义 夙心 成 自误 文章 小道 得高 评 曲池 远 市 偏宜 暑 携卷 同 来看 月 生
d9e8ea77-7efe-4596-a978-b390b28f81ba,寄怀八弟三首  其一,晁补之,唐,诗,七言律诗,君好作官容我隠 我专筑室待君归 古来奇特俱安用 老去疏慵自不违 五府交书何怪密 双林白社未嫌稀 先君门户观之子 葵藿吾今遯益肥,"7,7,7,7,7,7,7,7",c57d74608dd3c6e0a338b0be84202232,君 好 作官 容我 隠 我 专 筑室 待 君 归 古来 奇特 俱 安用 老 去 疏 慵 自不 违 五府 交书 何怪 密 双林 白社 未 嫌 稀 先君 门户 观之子 葵 藿吾 今 遯 益 肥
59850e35-08bd-4444-a2c1-347be1fd1923,寄怀八弟三首  其二,晁补之,唐,诗,七言律诗,平日鸰原左右手 蟨邛前后未须论 清秋淮上多诗句 白首篱边近酒樽 杜舅高情笃兄弟 先君至性厚闺门 两公与尔同师法 相待归来老此园,"7,7,7,7,7,7,7,7",bcd89d21578fba3580dde233b075b166,平日 鸰 原 左右手 蟨 邛 前后 未须 论 清秋 淮 上 多 诗句 白首 篱边 近 酒 樽 杜舅 高情 笃 兄弟 先君 至 性 厚 闺门 两 公与尔 同 师法 相待 归来 老 此 园
6ae865db-d792-4cd1-b002-9fdaec52e197,寄怀八弟三首  其三,晁补之,唐,诗,七言律诗,扬州全盛吾能说 鸭脚琼花五百年 忽见山光好诗轴 却思淮浦旧渔船 柴荆故俗真虚老 松菊幽斋已重迁 便作扶藜望衡霍 清秋随分有风烟,"7,7,7,7,7,7,7,7",f7916ef55b109378c8422abae0a8310f,扬州 全盛 吾 能 说 鸭脚 琼花 五百年 忽见 山光 好 诗 轴 却 思 淮浦 旧 渔船 柴荆 故俗 真 虚老 松菊幽斋 已 重迁 便 作 扶 藜 望衡 霍 清秋 随分 有 风烟
4db4e353-7728-47e7-b4d8-d31d1df3a52e,感兴,晁补之,唐,诗,七言律诗,渊明褊志迷归去 叔夜支辞谬养生 道有穷通千世运 命无夭寿四时行 我能为蝶斯同化 子亦知鱼乃至情 谓马谓牛无不可 楚肝越胆太分明,"7,7,7,7,7,7,7,7",ac9c4e460a92d60285d64236150b14f4,渊明 褊 志 迷 归去 叔夜 支辞 谬 养生 道 有 穷通 千 世运 命 无 夭寿 四时 行 我 能 为 蝶斯 同化 子 亦 知鱼 乃至 情 谓 马谓牛 无 不可 楚 肝 越胆 太 分明
733eb486-5643-4593-b63e-564debaf5b2c,次韵留守王公喜春,晁补之,唐,诗,七言律诗,午窗罏火不应残 春许花期特地宽 塞雁初惊池藻暖 谷鶑犹怯井梧寒 未须园里幽寻去 且更楼前远望看 四牡行春定何日 亦闻钟鼓满城欢,"7,7,7,7,7,7,7,7",5a9532f0b8264ae93f67fb84b10bffef,午 窗 罏 火 不 应 残 春 许 花期 特地 宽 塞雁初 惊 池 藻 暖 谷 鶑 犹 怯 井梧 寒 未须 园里 幽 寻去 且 更 楼前 远望 看 四 牡行 春定 何日 亦 闻 钟鼓 满城 欢
49bd1a3c-d230-4313-bfd1-6fbf686a6f88,游华岳归道中望仙掌,晁补之,唐,诗,七言律诗,深岩踏遍寻归路 仙掌依然在碧虚 无限游人重驻马 岂惟狂客倒骑馿 挂图天汉朝霞上 落影秦关夕照余 千古全生才一士 可怜登览尽丘墟,"7,7,7,7,7,7,7,7",2ac7cced43485bbaacb64c9bd948fc9b,深岩 踏遍 寻 归路 仙掌 依然 在 碧虚 无限 游人 重 驻 马 岂 惟 狂客 倒 骑 馿 挂图 天汉 朝霞 上 落影 秦关 夕照 余 千古 全生 才 一士 可怜 登览 尽 丘墟
fbc3865e-e267-4394-b26f-090d6340fcf4,潼关道中,晁补之,唐,诗,七言律诗,尘土长安古道深 潼关依旧接桃林 使君骢马来何后 道士青牛去莫寻 春半河山犹寂莫 日长坑阪正崎嵚 平生冷笑元龙误 老觉求田负寸心,"7,7,7,7,7,7,7,7",bcada5a30d6521180d7782e8600ecfd5,尘土 长安 古道 深 潼关 依旧 接 桃林 使君 骢 马来 何后 道士 青牛 去 莫寻 春半 河山 犹寂 莫 日 长坑 阪正崎 嵚 平生 冷笑 元龙 误 老 觉求 田 负 寸心
eaae9bbc-4162-4bb9-8950-d62ff3b92074,自蒲赴湖早行作,晁补之,唐,诗,七言律诗,小隠幽情薄宦身 五更骑马寿安尘 春如流水行随客 晓与青山气逼人 报国丹心千载事 对花霜鬓一番新 秦吴绝域从来恨 我已能知莫问津,"7,7,7,7,7,7,7,7",b33daf7831d376029403a48c84426699,小 隠 幽情 薄 宦身 五更 骑马 寿安尘 春 如 流水 行随 客 晓与 青山 气 逼人 报国 丹心 千载 事 对 花 霜鬓 一番 新 秦 吴 绝域 从来 恨 我 已 能知 莫 问津
c42187b6-2c0b-4a52-957d-125bad53d124,罢蒲干濠道中寄府教授之道弟,晁补之,唐,诗,七言律诗,冲寒到郡待花开 花未开时却遣回 敢意三年容我隠 只如千里访君来 二崤毂击何为者 五老云霾安在哉 更约劖诗猿虎谷 它年重过埽莓苔,"7,7,7,7,7,7,7,7",a6bdc53bcd5a764973158950d01c2cd8,冲 寒 到 郡 待 花 开 花 未 开时 却 遣回 敢意 三年 容我 隠 只 如 千里 访 君 来 二 崤 毂 击 何为 者 五 老 云霾 安在 哉 更约 劖 诗 猿 虎 谷 它 年 重过 埽 莓 苔
2b0e8239-8250-4572-80b0-59bc163b2bac,次韵文潜尉福昌时壁间清暑亭诗,晁补之,唐,诗,七言律诗,梅福当年守此官 荆山谁见韫琅玕 人如修竹三冬好 诗与清溪九夏寒 未信簪裳妨小隠 蚤时雷雨起深蟠 春风揽辔河阳县 痛饮狂歌忆旧年,"7,7,7,7,7,7,7,7",de263f40de6236363cb1a3dba4bdf3f1,梅福 当年 守 此 官 荆山 谁 见 韫 琅玕 人 如 修 竹 三 冬 好 诗 与 清溪 九夏 寒 未信 簪裳 妨小 隠 蚤 时 雷雨 起 深 蟠 春风 揽辔 河阳 县 痛饮 狂歌 忆旧 年
0be7fea3-4ea6-4694-8963-2c4b35c52c19,赴蒲道中寄洛倅王定国,晁补之,唐,诗,七言律诗,莫嫌马上过春风 得句桃溪柳涧中 王事勤君急星火 客程驱我正萍蓬 朅来尚可轻千里 归去何妨共两翁 学道如今有微力 作官求了不求功,"7,7,7,7,7,7,7,7",3bbc2b3212057386ae561ee255ff1def,莫 嫌 马上 过 春风 得 句 桃溪 柳涧 中 王事勤 君 急 星火 客程 驱 我 正 萍蓬 朅 来 尚可 轻 千里 归去 何妨 共 两 翁 学 道 如今 有 微力 作官 求 了 不求 功
47f9bd7c-bc10-4a74-8b02-556c3a3e8f8e,再寄定国,晁补之,唐,诗,七言律诗,河南少尹古臞仙 销尽新缘窘旧缘 草字更无千载圣 谈言自有一家天 远游轻世唯何甚 少贬求容否不然 选壮坐狂俱龃龉 社樗元自可忘年,"7,7,7,7,7,7,7,7",ca8f1fec5a0e32cb65a0c0ef94d17cfc,河南 少 尹 古 臞 仙 销尽 新缘 窘旧 缘 草字 更 无 千载 圣 谈言 自有 一家 天 远游 轻世唯何 甚 少 贬求 容否 不然 选壮 坐狂俱 龃龉 社 樗 元 自可忘 年
46f8f017-ad1e-45c4-8ad6-c3fad1232935,答闳中顺之,晁补之,唐,诗,七言律诗,黄卷翛然遇古人 千秋遗恨一朝伸 久干文举尊中酒 虚负渊明头上巾 缨冠未暇念同室 闭眼自欲观吾身 幸有元和文似锦 不妨白雪和阳春,"7,7,7,7,7,7,7,7",bcfe3423f92c2874d196bf545b22582d,黄 卷 翛 然 遇 古人 千秋 遗恨 一朝 伸 久 干 文举 尊 中 酒 虚负 渊明 头上 巾 缨冠 未暇 念 同室 闭眼 自欲观 吾 身 幸有元 和文 似锦 不妨 白雪 和 阳春
a0cbadb7-a632-4f9d-b315-97466a86805d,自蒲赴湖至板桥逢杜谋伯,晁补之,唐,诗,七言律诗,二年两度踏京尘 犹喜常逢杜子春 文学老来从旧日 金兰同好更何人 身惭随檄终难强 计欲归耕未敢陈 正是桃花红似血 不应无酒但沾巾,"7,7,7,7,7,7,7,7",01e1c35de4bcb0d8c42c7c58e9ec8e66,二年 两度 踏 京 尘 犹喜 常 逢 杜子春 文学 老 来 从 旧日 金兰 同好 更 何人 身 惭 随 檄终难 强 计欲 归耕 未敢 陈 正是 桃花 红 似 血 不应 无酒 但 沾 巾
