id,title,author,dynasty,genre,poem_type,sentences_simplified,meter_pattern,hash,words
495a7400-5944-4a11-b93f-e766a80153ad,自登道来马谿作,李流谦,唐,诗,七言古体,朝暾拔山红一丈 露草烟林气萧爽 出门华构照新绿 并辔宝珂喧碎响 僮奴尚语林薄间 马蹄势已青云上 琳宫百年傲风雨 气象雄深挟千嶂 青山固是耐久交 老桧真成丈人行 山童候门惊马嘶 道士叠爻知客访 情亲肯自摘嘉蔬 兴发更遣沽村酿 未妨意行穷胜践 不用心违叹仙赏 双峰唤我却西去 穿迳萦纡转修蟒 荒桥下马久𥩟立 孤塔怀人嘿惆怅 多谢山僧供汤餠 腹犹果然虚雅饷 只应探讨尽老释 坐觉仙凡绝天壤 碎砾谁参水底禅 飞蜺空阁云间仗 凌霄固有飞霞珮 尘蒙浊骨何由往 归来闭户省初念 一炷炉香薰宿障 题诗聊复纪胜游 永与名山镇龙藏,"7,7,7,7,7,7,7,7,7,7,7,7,7,7,7,7,7,7,7,7,7,7,7,7,7,7,7,7,7,7,7,7",e3c00208665a310d25f3bdbd0c40bb64,朝 暾 拔山 红 一丈 露草 烟林气 萧爽 出门 华构 照 新绿 并辔 宝珂 喧 碎 响 僮奴尚 语林 薄间 马蹄 势 已 青云 上 琳宫 百年 傲 风雨 气象 雄深 挟千嶂 青山 固是 耐久 交 老桧真 成 丈人 行 山童 候门 惊 马嘶 道士 叠 爻 知客 访 情亲 肯自 摘 嘉 蔬 兴发 更 遣 沽 村 酿 未妨 意行 穷 胜践 不 用心 违叹 仙 赏 双峰 唤 我 却 西去 穿 迳 萦纡 转修 蟒 荒桥 下马 久 𥩟 立 孤塔怀 人 嘿 惆怅 多谢 山僧 供 汤 餠 腹 犹 果然 虚雅饷 只 应 探讨 尽 老 释 坐觉 仙 凡 绝 天壤 碎砾 谁 参 水底 禅 飞 蜺 空 阁 云间 仗 凌霄 固有 飞霞珮 尘 蒙 浊 骨 何由往 归来 闭 户 省 初 念 一 炷 炉 香薰 宿障 题诗 聊 复纪 胜游 永 与 名 山镇 龙藏
8e3ce0e2-efe4-4ebd-8bbe-c2f1bc1dc2ab,游秦园分韵得东字,李流谦,唐,诗,七言古体,爱春春浅如稚童 爱晴连日无雨风 闭门不出春笑侬 百年容易成老翁 山茶经霜尚能红 小梅吹雪香正浓 盍不亟倒琉璃钟 主人好意客亦同 粉牋乞句酬天公 笔端有气如白虹 少年射虎南山中 于今尘土蒙雕弓 安得雷雨鞭蛰龙 拊髀浩气亦欲东,"7,7,7,7,7,7,7,7,7,7,7,7,7,7",e91df1aa1041a49685d0beff10b21880,爱春春 浅 如 稚童 爱晴 连日 无雨 风 闭门不出 春 笑 侬 百年 容易 成 老翁 山茶 经霜 尚 能 红 小梅 吹雪 香 正浓 盍 不 亟 倒 琉璃 钟 主人 好意 客 亦 同 粉牋乞 句 酬 天公 笔端 有 气 如 白虹 少年 射虎 南山 中 于今 尘土 蒙 雕弓 安 得 雷雨 鞭 蛰龙 拊 髀 浩气 亦欲东
d393fc99-f5a5-43a7-ae6d-eaad92934f47,安居道中,李流谦,唐,诗,七言律诗,上如跻云下临渊 乱石当道如防贤 遥看一鸟转绝壑 鸟已烟沉吾木末 晚风吹雪作云飞 山中更添一尺泥 岁华如此犹浪走 梅花思人越消瘦,"7,7,7,7,7,7,7,7",aa0b9dc090233c7ba9567c164df8f750,上如 跻云 下 临渊 乱石 当道 如 防贤 遥 看 一 鸟 转绝 壑 鸟 已烟 沉吾 木末 晚风 吹雪 作云 飞 山中 更添 一尺 泥 岁 华 如此 犹浪 走 梅花 思人 越 消瘦
1a4790df-18fe-4db1-9f9f-e36eef0c28f2,同常和仲谒照老和仲有诗次其韵,李流谦,唐,诗,七言古体,杏花一株凌晓寒 刮眼创见春风还 天涯作客归未得 主人好事客疎顽 鸣鸠唤雨绿野浄 游丝挂空白日闲 祇园有僧坐隠几 柱杖与子来扣关 薰炉午篆转轻缕 浄缾晓汲翻微澜 禅僧不摇月照水 雄辩猝起雷破山 痴儿浪说三组贵 向我不博一笑懽 归来妙语出顷刻 照坐绮縠纷斓斑 火急为续永和帖 清景一失情易阑,"7,7,7,7,7,7,7,7,7,7,7,7,7,7,7,7,7,7",fb446da4d4b00f25e63fdaa1b3ac99fb,杏花 一株 凌晓寒 刮 眼 创见 春风 还 天涯 作客 归 未 得 主人 好事 客 疎 顽 鸣鸠 唤 雨 绿野 浄 游丝 挂 空白 日 闲 祇 园 有 僧 坐 隠 几 柱杖 与 子 来 扣关 薰炉 午 篆 转 轻缕 浄 缾 晓 汲 翻 微澜 禅僧 不 摇 月 照水 雄辩 猝起雷破山 痴儿 浪 说 三组 贵 向 我 不博 一 笑 懽 归来 妙语 出 顷刻 照 坐 绮縠 纷 斓 斑 火急 为续 永和 帖 清景 一失情易阑
008a8a97-ac15-4ec1-ab46-8959f7d0f4c4,东州行上费检正,李流谦,唐,诗,七言古体,东州十刹如西州 东州幽爽西喧湫 登临在在有佳处 我来无事得纵游 望川致爽两奇特 云烟流通东与北 一为清淑一旷远 清者发兴远快目 城西三刹跨一牛 五百云堂老比丘 捐金乐施到樵牧 不知愿力何年修 邓家名笔难再得 苦爱雍熙之两壁 贵人摸搨不曾休 真是化身千百亿 府公玉皇香案吏 帆薄三山风辄止 来苏疲瘵十万家 卷缩灵河一杯里 野人冠服裹狙猿 曳裾更欲之何门 慙无杜老惊人句 空负陈蕃解榻恩,"7,7,7,7,7,7,7,7,7,7,7,7,7,7,7,7,7,7,7,7,7,7,7,7",cced77e4f821890e212e69a499141f52,东州 十刹如 西州 东州 幽爽 西 喧 湫 登临 在 在 有 佳 处 我 来 无事 得纵 游 望川 致爽 两 奇特 云烟 流通 东 与 北 一为 清淑 一旷 远 清者 发兴 远快 目 城西 三 刹 跨 一 牛 五百 云堂 老 比丘 捐金 乐施 到 樵牧 不知 愿力 何年 修 邓家 名笔 难再 得 苦 爱 雍熙 之 两壁 贵人 摸 搨 不曾 休 真是 化身 千百 亿 府 公 玉皇 香案 吏 帆 薄 三 山风 辄 止 来苏 疲 瘵 十万家 卷缩 灵河 一杯 里 野人 冠服 裹 狙猿 曳裾 更 欲 之 何门 慙 无 杜 老 惊人 句 空负 陈蕃 解榻 恩
de7b24e9-9c10-4846-b700-8dccdaa19470,岩桂堂,李流谦,唐,诗,七言古体,湘峰峩峩湘水碧 万古鱼龙护冰魄 荷衣芷佩凝秋霜 欲诵遗章发先白 天生草木预何事 乃与骚人同一骨 今人古人共磨灭 惟有芬香埋不得 主人手植双桂树 宁为嬖玩娱燕席 亦知兰鲍随所化 勉进修名比馨洁 绕除霏霏风袭予 欲参灵螭驾寥阒 陈辞重华吊屈贾 酌以芳辛起湮鬰 日暮美人期未来 雾湿烟低花蔌蔌,"7,7,7,7,7,7,7,7,7,7,7,7,7,7,7,7,7,7",13555d729e2b18f9abdd6c9f689c10b8,湘 峰 峩 峩 湘水 碧 万古 鱼龙 护 冰魄 荷衣 芷佩凝 秋霜 欲 诵 遗章 发先 白 天生 草木 预 何事 乃 与 骚人 同一 骨 今人 古人 共 磨灭 惟有 芬香 埋 不得 主人 手植 双 桂树 宁为 嬖 玩 娱 燕席 亦知兰 鲍随 所 化 勉 进修 名 比馨洁 绕除 霏霏 风 袭予 欲 参灵 螭 驾 寥 阒 陈辞 重华 吊屈 贾 酌 以 芳 辛 起 湮鬰 日暮 美人期 未来 雾 湿 烟 低 花 蔌 蔌
1b761343-3bb3-4528-888c-fc182eb67aeb,岁庚午予过来凤驿观壁间碑刻火池事尝赋诗今岁甲午再过用前韵,李流谦,唐,诗,七言律诗,东西燕鸿长差池 二十五年车载脂 观河性在故应尔 化鹤人归空自疑 年来于道觉差近 此心颇已忘欣愠 吾儿亦复能此诗 镊白老人休更问,"7,7,7,7,7,7,7,7",a36c86351c6f1007ca8ce8b01e5acec1,东西 燕鸿长 差池 二十五年 车载 脂 观河性 在 故应尔 化鹤人归空自疑 年来 于 道觉 差 近 此 心 颇 已 忘 欣 愠 吾 儿 亦 复能 此 诗 镊白 老人 休 更 问
92db00e8-bb8d-4151-9df8-485a7c723f0f,慈云壁间有杨皓明叔崇宁甲申所题诗和者甚众,李流谦,唐,诗,七言律诗,浮花眩眼朱成碧 关渠何事愁寂寂 依旧渔竿入手来 老我江湖倦游客 径须一醉抛青春 校量细故非高人 茂弘雅量本不尔 几箑能障西风尘,"7,7,7,7,7,7,7,7",44bd8e20498930fd56e0de5d8bc6d722,浮花 眩眼 朱成碧 关渠 何事 愁 寂寂 依旧 渔竿 入手 来 老 我 江湖 倦 游客 径须 一 醉 抛 青春 校量 细故 非 高人 茂弘 雅量 本 不尔 几 箑 能 障 西 风尘
0bd9a8e7-da72-4370-9bfa-576c569072ba,自抛渡未尝惊恐次公安舟为疾风倒吹几不能返自江行未尝阻风将次沙市风留三日,李流谦,唐,诗,七言律诗,常时抛渡如不知 公安浪高船倒吹 数月江程绝无阻 一舍沙头风泊之 因行逢触发深省 无事安平人不领 要知忧乐自相形 天马擡头见鞭影,"7,7,7,7,7,7,7,7",19c9f04a12d1e58644931e17eadc3aa9,常时 抛渡 如 不知 公安 浪 高 船 倒 吹 数月 江程 绝无 阻 一 舍 沙头 风泊 之 因行 逢 触发 深 省 无 事 安平 人 不 领 要知 忧乐自 相形 天马 擡 头 见 鞭 影
fbba5df3-6d86-43fb-9d0b-3844bffb396d,刘蜕唐大中时人文冢在兜率寺予尝读孙樵自序其作云大中皇帝尝有诏褒时之艺能凡三人而樵居其一曰孙樵有扬马之文蜕既同时不应不在褒诏之列士之显晦固有定分刘君独未能忘此乎冢其文予盖疑其有激也作此吊之,李流谦,唐,诗,七言古体,诏书尝下大中朝 不闻称蜕但称樵 犠樽弃沟俱害性 此理要以达观超 封文为冢嬉笑怒 恚不人知防鬼妬 高岸为谷谷为陵 磨灭可无千载虑 向来述作等俳谐 传与不传何有哉 六经排孔讳服郑 未胜咸阳一炬灰 虚名误人箕斗尔 引调狙公嗔与喜 已嗤地下有修文 更笑楼成能作记,"7,7,7,7,7,7,7,7,7,7,7,7,7,7,7,7",b407700f11048c9bc6c096aa6e6ea917,诏书 尝下 大中 朝 不 闻 称 蜕 但 称 樵 犠 樽 弃 沟 俱 害 性 此理 要 以 达观 超 封文为 冢 嬉笑 怒 恚 不 人 知防 鬼 妬 高岸为谷 谷为陵 磨灭 可 无 千载 虑 向来 述作 等 俳 谐 传与 不 传 何 有 哉 六经 排孔 讳服 郑 未 胜 咸阳一炬 灰 虚名 误 人 箕斗 尔 引调 狙公 嗔与 喜 已 嗤 地下 有 修文 更 笑 楼 成能 作记
cea00fed-ed2e-4b95-8767-088163f11aa1,涵翠亭,李流谦,唐,诗,七言古体,太华峰头花十丈 十八韩翁语豪壮 法华会上如车轮 跨猊仙人妄与真 九州芒芒置勿问 万柄秋塘插寒镜 楚人裂裳缉为衣 一尘涴之色不怡 孽童万死剑斩马 何物奴言似之者 触花花恐怒且嗔 悲风猎猎吹白苹 我来拊槛笑仍喟 欲挽清泠濯斯秽 主人冁然客罢休 一醉能销千古愁,"7,7,7,7,7,7,7,7,7,7,7,7,7,7,7,7",1141b9b56ff3d0b704c1e602416fc8f2,太华 峰头 花 十丈 十八 韩翁语 豪壮 法华 会上 如 车轮 跨猊 仙人 妄 与 真 九州 芒 芒 置 勿 问 万柄秋 塘 插 寒镜 楚 人 裂裳 缉为 衣 一 尘 涴 之 色 不 怡 孽童 万死剑 斩马 何物 奴言 似 之者 触 花花 恐怒 且 嗔 悲风 猎猎 吹白 苹 我 来 拊 槛 笑 仍 喟 欲 挽 清泠 濯斯 秽 主人 冁 然 客 罢休 一 醉能 销 千古 愁
f2011ca8-5b27-457d-a7cb-2b08126cf72e,吊李允成知县,李流谦,唐,诗,七言古体,百年造化无遗力 霜雪十围岂易得 盲工操斤选朴樕 铜柯石根弃如掷 呜呼斯人何不淑 天畀之多人则啬 白眼千百碌碌子 老虎可缚蛟可馘 神锋屡染鸡鹜血 绕匣龙蛇夜悲泣 英灵不合世间著 蚁宫历游无半席 不如收拾还山川 化为球琳尚华国 意气偶合肝肠倾 手栽檀栾食予实 至今歛翼蓬蒿中 不与燕雀同感激 霜风吹愁愁更浓 屈折长虹玉三尺 晨兴揽衣发深省 古来精诚可裂石 玄堂文成许见不 鱼与熊掌当取一,"7,7,7,7,7,7,7,7,7,7,7,7,7,7,7,7,7,7,7,7,7,7,7,7",84afbe4f1a04db6abc77ccd5d88219dd,百年 造化 无遗 力 霜雪 十围 岂 易得 盲工 操 斤 选 朴 樕 铜 柯石 根弃如掷 呜呼 斯人 何不 淑 天 畀 之 多 人 则 啬 白眼 千百 碌碌 子 老虎 可 缚 蛟 可 馘 神锋 屡 染 鸡 鹜 血 绕 匣 龙蛇 夜 悲泣 英灵 不合 世间 著 蚁宫 历游 无 半席 不如 收拾 还 山川 化为 球 琳尚 华国 意气 偶合 肝肠 倾 手 栽 檀 栾食予 实 至今 歛 翼 蓬蒿 中 不 与 燕雀 同 感激 霜 风吹 愁愁 更 浓 屈折 长虹 玉 三尺 晨 兴揽 衣发 深省 古来 精诚 可裂 石 玄堂 文成 许见 不 鱼与熊掌 当取 一
7d669985-114d-443b-9408-da7863d02b96,飞乌道中,李流谦,唐,诗,七言律诗,朝发江亭暮山驿 面颜尘埃手龟拆 弟兄相逐两浮萍 一盏村醪慰愁寂 高堂老人念儿寒 儿念老人不得眠 慇懃祝付送书鴈 为传片字报平安,"7,7,7,7,7,7,7,7",ce52f13bbb26722dce126d44b96bceda,朝发江亭 暮 山驿 面颜 尘埃 手龟 拆 弟兄 相逐 两 浮萍 一盏 村 醪慰愁 寂 高堂 老人 念儿 寒 儿念 老人 不得 眠 慇 懃 祝 付 送 书 鴈 为 传片 字 报平安
530f01b0-d37e-4b3d-b39c-8c87f83454c8,飞乌与正老相值盖十月初见之梦兆云,李流谦,唐,诗,七言律诗,忆得初冬忘甲子 夜梦与师游破寺 明朝东望欲寄声 我在紫岩师锦水 空山行役偶相逢 物色看来与梦同 当时梦觉疑非梦 今日翻疑是梦中,"7,7,7,7,7,7,7,7",98fa2680b17899f6518b246ff5d67b5e,忆 得 初冬 忘 甲子 夜 梦 与 师游 破 寺 明朝 东望 欲 寄 声 我 在 紫岩 师锦水 空山 行役 偶 相逢 物色 看来 与 梦 同 当时 梦 觉疑 非梦 今日 翻疑 是 梦 中
86b0ace5-18fd-4031-ab5f-a3823e091bde,山口阻风,李流谦,唐,诗,七言律诗,舟行常有性命忧 江风一动令人愁 盘涡倒帆日方午 又作贾胡终日留 淮山隔江看细小 淡扫修眉晚尤好 岷峩行尽此江来 可是爱山心未了,"7,7,7,7,7,7,7,7",f05ef7e77a5ea0a23768d54b3d567e5e,舟 行 常有 性命 忧 江风 一动 令人 愁 盘涡 倒 帆 日方 午 又 作 贾胡 终日 留 淮山 隔江 看 细小 淡 扫 修眉 晚 尤好 岷 峩 行 尽 此 江 来 可是 爱山 心 未了
958f0f17-96f5-4418-97d3-adb588309d40,赋寿康海棠,李流谦,唐,诗,七言古体,何许园林春最酽 海棠万万千千点 不应惟是锦织成 正恐更将猩血染 未开半豆已欲滴 烂吐一庭尤潋滟 窥月洗雨俱可玩 抹雾横烟猝难掩 梓泽步障烘晓霞 温泉粉玉临秋鉴 相逢但欲酣且歌 目送谁言美而艳 桃花何处容面皮 欲笑春风无乃僭 光翻牖户翠堆幄 浓逼须眉缬生脸 裹头朝出常苦晚 烧烛夜看终未厌 见不数数梦来往 百斛可倾心独欠 老来世味薄如纸 斩断情根须一敛 随身鼓笛本游戏 过目埃氛亦俄暂 明朝风雨未可期 委地泥沙混真滥 凭君但向雪落时 个里直须勤点检,"7,7,7,7,7,7,7,7,7,7,7,7,7,7,7,7,7,7,7,7,7,7,7,7,7,7,7,7",8825787340e0f7c959c2759388bdfb7c,何许 园林 春 最 酽 海棠 万万千千 点 不应 惟 是 锦 织成 正恐 更 将 猩 血染 未开 半豆 已 欲 滴 烂吐一庭 尤 潋滟 窥 月 洗雨俱可玩 抹 雾横烟 猝难掩 梓泽 步障 烘 晓霞 温泉 粉玉临秋鉴 相逢 但 欲 酣 且 歌 目送 谁 言 美 而 艳 桃花 何处 容 面皮 欲 笑 春风 无 乃 僭 光 翻 牖 户 翠 堆 幄 浓 逼 须眉 缬 生 脸 裹头朝出常苦 晚 烧 烛夜 看 终未 厌 见 不 数数 梦 来往 百斛 可 倾心 独欠 老 来世 味 薄 如 纸 斩断 情 根须 一 敛 随身 鼓 笛本 游戏 过目 埃氛 亦 俄 暂 明朝 风雨 未可期 委地 泥沙 混真滥 凭 君 但 向 雪落 时 个 里 直须 勤 点检
b78cc481-bf0f-4dc4-9e46-c3f4b385f02e,峡中重九以菊有黄华分韵得菊字,李流谦,唐,诗,七言古体,江湖浪走嗟碌碌 往往佳时忘记录 今朝峡里作重阳 节物虽同感殊俗 终日悬忧湍濑间 何人为唱黄花曲 尚喜樽罍余旧醅 不然何以慰萧索 每思在家天气好 一瓮床头拨寒绿 欲熟未熟唤客饮 妇骂儿嘲醉不答 只今那能问甜涩 况是名樽难重得 晚行江干见篱落 小雨霏霏冒丛菊 若从主人觅数枝 金英未吐心亦足 归插铜缾对清酌 营度肴蔬选橙栗 茱萸在手花在头 起舞狂歌忘为客 人情一种无贵贱 余沥犹能到僮仆 渊明固是羲皇人 腰不可折带难束 白衣大自胜督邮 千古因渠重斯节 我行四方亦何事 此腹能须几圭撮 并头鸡鹜不自厌 仰首高飞愧鸿鹄 酒阑独诵归来章 醉面如頳背如沃,"7,7,7,7,7,7,7,7,7,7,7,7,7,7,7,7,7,7,7,7,7,7,7,7,7,7,7,7,7,7,7,7,7,7",dd856a3fb694d0d6103c663961f3be47,江湖 浪 走 嗟 碌碌 往往 佳 时 忘 记录 今朝 峡 里 作 重阳 节物 虽 同感 殊俗 终日 悬忧 湍 濑间 何人 为 唱 黄花 曲 尚喜 樽 罍 余 旧 醅 不然 何以 慰 萧索 每 思 在家 天气 好 一 瓮 床头 拨 寒绿 欲 熟 未熟 唤 客 饮 妇骂儿 嘲醉 不答 只今 那 能 问 甜涩 况是 名 樽 难重 得 晚行 江干 见 篱落 小雨 霏霏 冒 丛菊 若 从 主人 觅 数枝 金英 未吐心亦足 归 插 铜 缾 对 清 酌 营度肴 蔬选 橙栗 茱萸 在手 花 在 头 起舞 狂歌 忘为 客 人情 一种 无 贵贱 余 沥 犹能 到 僮仆 渊明 固是 羲 皇 人 腰 不可 折带 难束 白衣 大自 胜督 邮 千古 因 渠重斯 节 我行 四方 亦 何事 此 腹能 须几圭 撮 并 头鸡鹜 不自厌 仰首 高飞 愧 鸿鹄 酒 阑 独诵 归来 章 醉面 如 頳 背 如 沃
2794f555-4cf9-431e-a8c4-b4ff73b6d823,枕上闻橹声,李流谦,唐,诗,七言律诗,劝君不须下瞿唐 顺流从此道路长 劝君早上瞿唐去 溯流虽艰近家乡 我今出蜀几寒暑 催归苦念家人语 更烦舟子策全功 疾趁鸣鸡起摇橹,"7,7,7,7,7,7,7,7",8f1cd0a24b243506f05eb823d6a22f42,劝君 不须 下 瞿唐 顺流 从此 道路 长 劝君 早上 瞿唐 去 溯流 虽 艰近 家乡 我 今 出 蜀 几 寒暑 催归 苦念 家人 语 更 烦 舟子 策 全功 疾 趁 鸣 鸡 起 摇橹
2985cf71-95f3-44b8-9e0b-6b1951eb4aef,晚步江浒有得鼋大如箕赎放之邻叟言此家前数日已尝得一煮之通夕旦发盎视之鼋忽引首以水喷其面兹亦可惊异者作是诗以为好杀者之戒,李流谦,唐,诗,七言古体,卷帆江臯日西斜 散步聊纵腰脚麻 有鼋如箕谁所得 绳贯四足尚喘呀 偶然相值不忍去 倚杖却立空咨嗟 客囊虽云甚羞涩 数金何惜死可赊 破筐解缚置池上 初犹不动如磔蛙 舟人共观各呼舞 稍稍有力能爬沙 须臾一跃不复覩 去侣蛟鳄朋鱼虾 隣翁又传可愕事 宜志简牍惩凶邪 近尝得一付汤鼎 通夕烂煮劳薪葭 黎明发盎欲下箸 以水喷面摇其牙 此言听者惊自倒 小人不戒愚何加 我今赎放岂为德 逡巡得脱汝幸耶 不须叩门问长史 无用染指嗔子家 祝鼋好去勿浪出 水有网罟陆有罝 作诗快读不能寐 展转屡见灯生花,"7,7,7,7,7,7,7,7,7,7,7,7,7,7,7,7,7,7,7,7,7,7,7,7,7,7,7,7,7,7",cb6ec220f052b3e7520c0590d5873bc6,卷 帆 江 臯 日 西 斜 散步 聊纵 腰 脚麻 有 鼋如 箕 谁 所得 绳贯四足尚喘 呀 偶然 相值 不忍 去 倚 杖 却立 空咨 嗟 客囊 虽 云 甚 羞涩 数金 何惜 死 可 赊 破 筐 解缚 置 池上 初犹不动 如 磔 蛙 舟 人 共观 各 呼舞 稍稍 有力 能 爬 沙 须臾 一 跃 不 复 覩 去侣 蛟 鳄 朋 鱼虾 隣 翁 又 传可愕 事 宜志 简牍 惩凶 邪 近 尝 得 一 付 汤鼎 通夕烂煮劳薪 葭 黎明 发盎欲 下箸 以 水喷面摇其牙 此言 听者 惊自倒 小人 不 戒 愚 何加 我 今 赎放 岂 为 德 逡巡 得脱 汝幸耶 不须 叩门 问 长史 无用 染指 嗔子 家 祝 鼋好 去 勿 浪出 水 有 网罟 陆 有 罝 作诗 快 读 不能 寐 展转 屡见 灯生花
ce587f80-b87c-462b-9920-9e4dedfd1913,放鱼,李流谦,唐,诗,七言律诗,溪媪双鱼入手中 鬐鬛不摇犹眼红 咫尺波涛即胡越 不忍觳𧥆人心同 小舟自放清江侧 为龙何以报我德 只须旱岁活焦枯 不用明珠光的皪,"7,7,7,7,7,7,7,7",60357bff07313c6f7aaadaba0f271eb5,溪 媪 双鱼 入 手中 鬐 鬛 不 摇 犹 眼红 咫尺 波涛 即 胡越 不忍 觳 𧥆 人心 同 小舟 自放 清江 侧 为 龙 何以 报 我 德 只须 旱 岁 活 焦枯 不用 明珠 光的 皪
a937a329-4281-4159-85ed-dcfc8f91d4dc,遂宁登舟,李流谦,唐,诗,七言律诗,江流不知几曲折 但见远树合复分 上滩下滩橹声急 眠沙白鸥如不闻 山行畏迟舟欲速 试较里程翻诘曲 都缘归计失平章 端恐青山笑人俗,"7,7,7,7,7,7,7,7",b8d40ecc436e06a530db848d9e9372cc,江流 不知 几 曲折 但见 远树 合复 分 上滩 下 滩 橹 声 急 眠 沙白鸥 如不闻 山行 畏迟舟欲速 试 较 里程 翻诘 曲 都缘 归计失平章 端 恐 青山 笑 人俗
9b8bfcf8-2132-4dd9-a5d2-696364bbd003,舟著浅,李流谦,唐,诗,七言律诗,御风起帆如彍矢 不能万里犹千里 中流浪头屋高起 误入浅洲舟阁底 愚公不量欲移山 篙人伎穷客长叹 世言卒行好步难 何如一棹夷犹间,"7,7,7,7,7,7,7,7",4670fbee70c9851775423e470691aff9,御风 起帆 如 彍 矢 不能 万里 犹 千里 中 流浪 头屋 高起 误入 浅洲 舟阁 底 愚公 不量 欲 移山 篙 人 伎 穷 客 长叹 世言 卒 行 好步 难 何如 一 棹 夷 犹间
f01998d2-f5b7-4788-9a96-8d1526887b7f,鄂渚大风,李流谦,唐,诗,七言律诗,万艘相衔系江渚 夜半疾风来莫御 舟轻力孱费支拄 大声舂撞如臼杵 千金应有觅壶人 冤呼仓黄那忍闻 吾颜死灰鱼鼈喜 公无渡河公不止,"7,7,7,7,7,7,7,7",817e0d116a894211732347de2de49475,万艘 相 衔系 江渚 夜半 疾风 来 莫御 舟 轻力 孱费 支 拄 大声 舂 撞 如 臼杵 千金 应有 觅 壶 人 冤呼 仓 黄 那 忍闻 吾 颜 死灰 鱼 鼈 喜 公无 渡河 公 不止
dcf10c1d-0ab2-4bca-be3e-18f59075d4a9,访杨少虞得小诗并呈才夫,李流谦,唐,诗,七言律诗,坐遭飞埃瞇双目 不应更到琅玕腹 青山为人作御侮 对面亭亭削苍玉 公子翩翩故自佳 我来空叹驹局促 抱冰嚼雪岂能清 火里芙蕖初出浴,"7,7,7,7,7,7,7,7",3ff1d4ad2a893d2253e4fa19f30e3832,坐 遭飞 埃瞇 双目 不应 更 到 琅玕 腹 青山 为 人作 御侮 对面 亭亭 削 苍玉 公子 翩翩 故自 佳 我 来 空叹驹 局促 抱 冰 嚼 雪 岂能 清 火 里芙 蕖 初 出浴
06841ae5-14ef-46e3-a646-fad58542cae1,舟中夜读蟠舟诗,李流谦,唐,诗,杂言,夜读蟠舟诗 如共蟠舟语 五年别泪隔秋风 万里孤舟泊寒渚 行尽诸方勘尽禅 此句逢人未曾举 东坡老人喜流涎 荔丹元似江瑶柱,"5,5,7,7,7,7,7,7",c5b5c53cb554000c861a7f805a11abce,夜读 蟠舟 诗 如共蟠舟语 五年 别泪隔 秋风 万里 孤 舟 泊 寒 渚 行 尽 诸 方 勘 尽 禅 此 句 逢 人 未曾 举 东坡 老人 喜 流涎 荔丹 元 似 江瑶柱
6323c1da-9c92-4ea7-bdae-9d1da47ec031,杂言二首  其一,李流谦,唐,诗,七言律诗,春来无处无芳草 但觉故园春更好 海棠前日梦见之 今日看来浑未老 樱桃红杏相因依 梅阴吐芽青满枝 世间亦有如意事 酒熟正是花开时,"7,7,7,7,7,7,7,7",0e53c96c15ae67bf0c5eff7daf961e6b,春来 无处 无芳草 但 觉 故园 春 更好 海棠 前日 梦见 之 今日 看来 浑 未 老 樱桃红 杏相 因 依 梅阴 吐芽 青满枝 世间 亦 有 如意 事 酒 熟 正是 花 开时
4aaf0a23-75aa-45c1-a4a8-1f48a0e722c0,杂言二首  其二,李流谦,唐,诗,七言律诗,一萍无根托弥渺 分头常多聚常少 天涯碧草又伤心 况是一分春已了 啼禽飞来窥酒樽 樽中绿波吹鳞鳞 东君可只令人瘦 更在花边冷笑人,"7,7,7,7,7,7,7,7",6659378a451849b918dd81214f363e21,一 萍无根托弥渺 分头 常 多聚 常少 天涯 碧草 又 伤心 况是 一分 春 已 了 啼禽 飞来 窥 酒 樽 樽 中 绿波 吹 鳞鳞 东君 可 只 令人 瘦 更 在 花边 冷笑 人
1da55539-a48e-4aa2-b5a2-37a1a4f02b27,十八日同少虞才夫子友子西泛舟,李流谦,唐,诗,七言古体,清江不知日夜长 前日平流吹作浪 得得来寻白鸟盟 仍唤津人操两桨 残红渐稀绿渐多 苦留不住如春何 细看恰有三十日 我醉起舞君当歌 紫微玉堂九天上 人非仙骨何由往 舟中俱是斩蛟人 洗眼待观龙虎榜 夜归错落北斗横 转枕喔喔埘鸡鸣 一春常嗟睡不足 幸无官事莫相惊,"7,7,7,7,7,7,7,7,7,7,7,7,7,7,7,7",253fcb6aac86bf8412a9ed4dfbeea302,清江 不知 日夜 长 前日 平流 吹 作浪 得 得来 寻 白鸟 盟 仍 唤 津 人 操 两 桨 残红 渐 稀绿 渐多 苦留 不住 如春 何 细看 恰 有 三十日 我 醉 起舞 君当歌 紫微玉 堂 九天 上 人 非 仙 骨 何由往 舟 中 俱 是 斩 蛟 人 洗眼 待观 龙虎榜 夜归 错落 北斗 横 转 枕 喔 喔 埘 鸡鸣 一 春 常 嗟睡 不足 幸无 官事 莫相惊
e02b5fc4-acdf-480a-94f8-fa258d898d46,次德茂湖中韵,李流谦,唐,诗,七言律诗,秋风早已来吹人 朝数暮数唯归程 白湖粘天行未了 单舸夜泊令人惊 更阑剪烛共愁语 酒醒弹铗为商声 篙儿饭饱便熟睡 那识怀家去国情,"7,7,7,7,7,7,7,7",7c26b3db9cd5adc31e72ac1b4f57a942,秋风 早已 来 吹 人 朝数 暮数 唯 归程 白湖 粘天 行 未了 单舸 夜泊 令人 惊 更阑 剪烛 共 愁 语 酒醒 弹 铗 为 商声 篙 儿 饭 饱便 熟睡 那 识 怀家 去 国情
93066317-1aa0-4f85-b319-5b7d50fc26f6,次德茂菱花韵,李流谦,唐,诗,七言律诗,菱叶寒陂收晓镜 萧萧独伴黄芦暝 自同香草入骚吟 不羡玉台春压鬓 三四凫雏傍母眠 尽付与秋秋亦领 更看细雨出鱼儿 江上老翁渔未竟,"7,7,7,7,7,7,7,7",e78256812f25d502380e12de1a36e7c3,菱叶 寒 陂 收 晓镜 萧萧 独伴 黄芦 暝 自同 香草 入 骚吟 不羡 玉台春 压鬓 三四 凫雏 傍 母眠 尽 付与 秋秋亦 领 更 看 细雨 出 鱼儿 江 上 老翁 渔 未竟
43ff9ea7-1acc-4274-9b91-8ac1f71f69ff,万安道上逢牧者,李流谦,唐,诗,七言律诗,暖日平岗牛数尾 短蓑破笠三四子 牛饥吃草渴饮水 牧儿仰卧不摇箠 人牛意闲俱不知 笑我驻车独移时 薄暮骑牛却归去 晚烟遥见隔林炊,"7,7,7,7,7,7,7,7",aa7533cac1ddb9d0509abf65f34fe1e1,暖 日平岗 牛 数尾 短 蓑破笠 三四 子 牛饥吃草渴 饮水 牧儿 仰卧 不 摇 箠 人 牛意闲俱 不知 笑 我 驻车 独移 时 薄暮 骑牛 却 归去 晚 烟 遥见 隔林 炊
