id,title,author,dynasty,genre,poem_type,sentences_simplified,meter_pattern,hash,words
94e5846c-fe8a-43a0-b9eb-f25a75e42b60,送劉伯宣尹松江府五首  其四,俞德鄰,唐,诗,五言律诗,事丛缘网密 意广忌才疎 浩浩皇风远 迟迟化日舒 俗移三纪后 德洽百年余 擿伏非仁政 生民本一初,"5,5,5,5,5,5,5,5",71c30bc75d60efa73de4f2aebc27774d,事丛 缘网 密 意广 忌才 疎 浩浩 皇风 远 迟迟 化日 舒 俗移 三纪 后 德洽 百年 余 擿 伏 非 仁政 生民 本一初
9a6b0d6a-979e-40be-9ce3-2783c22895cc,送劉伯宣尹松江府五首  其五,俞德鄰,唐,诗,五言律诗,烹鲜知政理 履豨识民心 土壤分南北 诗书亘古今 遐方犹战伐 癃老正呻吟 三尺焦桐在 烦公发至音,"5,5,5,5,5,5,5,5",d57a8d78ced5ed687046f96a4c4588bb,烹 鲜知 政理 履 豨识 民心 土壤 分 南北 诗书 亘古 今 遐方 犹战伐 癃老 正 呻吟 三尺 焦桐 在 烦 公发 至 音
3592fe28-81c2-4296-a7a8-67683ec47499,次韻崔郎中遊西湖,俞德鄰,唐,诗,七言律诗,万顷湖光一苇杭 画桥横接旧堤长 松环九里烟云湿 梅压孤山水月香 梵宇琳宫增突兀 铜驼金谷自凄凉 悲吟一夜头添雪 惭愧崔鸿在洛阳,"7,7,7,7,7,7,7,7",ca37ca07d771d095fd1490368869d8a1,万顷 湖光 一 苇 杭 画桥 横接 旧 堤长 松环 九里 烟云 湿 梅压 孤 山水 月香 梵宇 琳宫 增 突兀 铜驼 金谷 自 凄凉 悲吟 一夜 头 添 雪 惭愧 崔鸿 在 洛阳
532c49a5-6c88-4903-9d61-ff273f1ae1f6,范仲山以磵谷居自號爲賦二首  其一,俞德鄰,唐,诗,七言律诗,山林朝市两相忘 寂寂幽居兴味长 雨过竹侵书帙浄 风轻花落砚池香 三杯卯酒醉未醉 一枕午窗凉更凉 人境结庐元不俗 渊明何必定柴桑,"7,7,7,7,7,7,7,7",07ce015e5d1481bad2dd8124b77c17cb,山林 朝市 两 相忘 寂寂 幽居 兴味 长 雨过竹 侵 书 帙 浄 风轻 花落 砚池 香 三杯 卯 酒醉 未 醉 一 枕午窗 凉 更凉 人境 结庐 元 不俗 渊明 何必 定 柴桑
ce4425d1-c60b-4b1b-9a80-aeddec9d4198,范仲山以磵谷居自號爲賦二首  其二,俞德鄰,唐,诗,七言律诗,丘壑中间著幼舆 何如此地卜幽居 棋声夜静客饮酒 花影昼闲儿读书 尘世覆蕉多得鹿 痴人缘木更求鱼 先生梦觉浑无事 一笑浮云指太虚,"7,7,7,7,7,7,7,7",fa9a5037a1b1c52ee595322ad4dd876f,丘壑 中间 著幼 舆 何 如此 地卜 幽居 棋声 夜静 客 饮酒 花影 昼 闲儿 读书 尘世 覆蕉 多 得 鹿 痴 人缘 木 更 求 鱼 先生 梦觉 浑无事 一 笑 浮云 指 太虚
3073dd8f-854a-4459-be1f-771beff1bc6b,山房遣興,俞德鄰,唐,诗,七言律诗,三径岚烟护碧苔 地无高下总栽梅 花随流水绕除去 云共好山排闼来 月冷蛙声諠鼓吹 风清蜃气耸楼台 过逢况有侯芭在 白首玄经未足咍,"7,7,7,7,7,7,7,7",1a523743b724993992dd086d687668dd,三 径 岚 烟 护 碧 苔 地 无 高下 总 栽 梅 花 随 流水 绕 除去 云 共 好 山 排 闼 来 月 冷 蛙声 諠 鼓吹 风清 蜃气 耸 楼台 过逢况 有 侯 芭在 白首 玄经 未 足 咍
a7e094b6-a236-4c45-8552-c5e0ef671e8c,遊靈巖,俞德鄰,唐,诗,七言律诗,蹑石扪萝一径通 凭阑极目思无穷 川明竹树萧疎外 人语烟云杳霭中 风月五湖西子舸 楼台千古梵王宫 艰难隠遁寻幽憩 晤语无人忆赞公,"7,7,7,7,7,7,7,7",0b0deb3426e21086838c83f2e149f9c7,蹑石扪萝 一 径 通 凭 阑 极目 思 无穷 川明竹 树 萧 疎 外 人 语 烟云 杳 霭 中 风月 五 湖西 子 舸 楼台 千古 梵 王宫 艰难 隠 遁 寻 幽 憩 晤 语 无人 忆赞公
7f98a81e-6109-48ae-bc84-86a2a9e3a781,次韻趙提舉二首  其一,俞德鄰,唐,诗,七言律诗,白首玄经病子云 感时怀旧独沾巾 十年战伐多新鬼 四海逢迎少故人 上苑鶑花非昔日 曲江蒲柳为谁春 涌金香酒甜如蜜 满眼沽来莫厌频,"7,7,7,7,7,7,7,7",757a4d141df3319e2f8013c0602cd4c5,白首 玄经 病子 云 感 时 怀旧 独沾巾 十年 战伐 多 新 鬼 四海 逢迎 少 故人 上 苑 鶑 花 非 昔日 曲江 蒲柳 为 谁 春 涌金 香酒 甜 如 蜜 满眼 沽 来 莫厌频
ec5a4bb7-ccf7-41a7-b965-0343981c2fc7,次韻趙提舉二首  其二,俞德鄰,唐,诗,七言律诗,寂历谋生后计然 已将穷达付苍天 狙公枉自计朝暮 徐邈但知中圣贤 岁月催人如过隙 功名随世任先鞭 纷纷燕雀惊鹰隼 谁识图真在左绵,"7,7,7,7,7,7,7,7",204f3b9d8c304fb8b4a63c698a8efa11,寂 历 谋生 后 计然 已 将 穷达 付 苍天 狙公 枉自 计 朝暮 徐邈 但 知中 圣贤 岁月 催人 如过 隙 功名 随 世任 先鞭 纷纷 燕雀 惊 鹰隼 谁 识图 真 在 左绵
65f2f252-cbcc-4d3d-938e-548e33e21f18,山林樂四首  其一,俞德鄰,唐,诗,五言律诗,山林何所乐 忽忽遂忘归 江阔天低水 山深雾湿衣 青虫当户织 白鸟背人飞 野性因留滞 非干与世违,"5,5,5,5,5,5,5,5",3267d01462fc23d3d24e172d154c85b4,山林 何所乐 忽忽 遂 忘归 江阔 天 低 水 山 深 雾 湿 衣 青虫 当 户织 白鸟 背人 飞 野性 因 留滞 非干 与 世 违
bda3ba01-3b2d-4fc4-9b34-e51cc105d2ed,山林樂四首  其二,俞德鄰,唐,诗,五言律诗,山林何所乐 佳兴四时同 琴罢庭留月 酒残松度风 鹤归苍汉外 猿叫碧萝中 却笑磻溪叟 区区理钓筒,"5,5,5,5,5,5,5,5",1da275768634fa00b58f694ffd8f3853,山林 何所乐 佳兴 四时 同 琴 罢 庭 留 月 酒 残 松度 风 鹤归 苍汉 外 猿 叫 碧萝 中 却 笑 磻溪 叟 区区 理 钓筒
f18aac43-6b79-4277-8136-9aa03360b540,山林樂四首  其三,俞德鄰,唐,诗,五言律诗,山林何所乐 所乐在琴书 醉买中山酒 游乘下泽车 结交忘鹿豕 分席混樵渔 何必桃源路 方为隠者居,"5,5,5,5,5,5,5,5",2088ac9c900afa52d9dc949c80da12e7,山林 何所乐 所乐 在 琴书 醉 买 中山 酒 游乘 下泽车 结交 忘 鹿 豕 分席 混樵 渔 何必 桃源路 方 为 隠 者 居
a4ae74f9-9a83-4cca-8acf-c345baf1515a,山林樂四首  其四,俞德鄰,唐,诗,五言律诗,山林何所乐 幽处两三家 曲径新移竹 疎篱旧著花 岚烟千嶂合 野水一桥斜 谁道无音乐 渔阳有掺挝,"5,5,5,5,5,5,5,5",aadf75f3329a89a79763f823ac7145bb,山林 何所乐 幽处 两三家 曲径 新 移 竹 疎篱 旧 著 花 岚 烟千嶂 合 野水 一 桥 斜 谁 道 无 音乐 渔阳 有 掺 挝
72b216e4-2dd2-4e99-8601-5d776f6472c5,淮楚絕無行樂地萬柳池邊有開元小寺稍潔因載酒約淮上翁荀桂叔林紹先諸友同遊,俞德鄰,唐,诗,七言律诗,柳外澄波系小艖 玉皇宫畔梵王家 蚁浮腊味杯行酒 鹤避晴烟灶煮茶 客里招邀慙草率 座中沾洽笑兰阇 杖藜归路西风晚 一抹寒林万点鸦,"7,7,7,7,7,7,7,7",abfb127f0da2b25d2bf97fa2d9c64f61,柳外澄 波系 小 艖 玉 皇宫 畔 梵 王家 蚁 浮 腊味 杯 行酒 鹤 避 晴 烟 灶 煮茶 客 里 招 邀 慙 草率 座 中 沾洽 笑 兰 阇 杖 藜 归路 西风 晚 一抹 寒林 万点 鸦
a37c7d0c-0ea1-4700-b266-acc836e4d32a,次韻夏楚材登山陽故城有感,俞德鄰,唐,诗,七言律诗,金粟松摧故国荒 春秋未作叹诗亡 十年漂泊家千里 百代兴衰梦一场 𧏖浦风清波鸭绿 渔梁春暖酒鹅黄 相逢且尽尊前醉 莫遣愁多白发长,"7,7,7,7,7,7,7,7",6a746cb96913d47305338765ce7e9400,金粟松 摧 故国 荒 春秋 未 作叹 诗亡 十年 漂泊 家 千里 百代 兴衰 梦 一场 𧏖 浦风 清波 鸭绿 渔 梁春 暖酒 鹅黄 相逢 且 尽 尊 前 醉 莫 遣 愁 多 白发 长
ebaa7afc-60b6-4f4f-9643-99f328f6da6f,初度留山陽,俞德鄰,唐,诗,七言律诗,茫茫南国徧旌旗 九日明朝有所思 元亮暮年书甲子 灵均初度忆庚寅 鱼龙寂寞秋江阔 豺虎从衡客路危 归去白云堪共卧 万山深处结茅茨,"7,7,7,7,7,7,7,7",f67d469d1297b23aeef1a62f33e24ad4,茫茫 南国 徧 旌旗 九日 明朝 有所思 元亮 暮年 书 甲子 灵均 初度 忆 庚寅 鱼龙 寂寞 秋江阔 豺虎 从衡 客路 危 归去 白云 堪 共 卧 万山 深处 结茅茨
432e3221-37aa-4d9a-8787-a45967857a00,答淮上翁二首  其一,俞德鄰,唐,诗,七言律诗,风雨凄凄战客衣 长淮东去鴈南飞 碧山学士老复老 芳草王孙归不归 尊酒细论悲昨梦 囊书空负笑前非 木奴千辈侯千户 早晚应须赋式微,"7,7,7,7,7,7,7,7",53814dbd553049f7f730b25cab74d41c,风雨凄凄 战客 衣 长淮 东 去 鴈 南 飞 碧山 学士 老复老 芳草 王孙 归不归 尊酒 细论 悲 昨 梦 囊 书空 负笑 前 非 木奴 千辈 侯 千户 早晚 应 须 赋 式微
f5e686e1-40b4-4a71-ae0d-5257c7b5ddee,答淮上翁二首  其二,俞德鄰,唐,诗,七言律诗,京江语别十三春 宇宙茫茫几战尘 客路秋风欺白发 阴房夜雨湿青燐 杖藜叹世悲谁子 悬印朝天少故人 回首鹿门思旧隠 荒坟宿草更沾巾,"7,7,7,7,7,7,7,7",2c1d682c4a67acad1633c7c9a9f031f2,京江 语别 十三 春 宇宙 茫茫 几 战尘 客路 秋风 欺 白发 阴房 夜雨 湿 青 燐 杖 藜 叹世悲 谁 子 悬印 朝 天 少 故人 回首 鹿门 思旧 隠 荒坟 宿草 更 沾 巾
ab6525f1-542d-496d-a3bf-296f73b4c4e0,懷林紹先三首  其一,俞德鄰,唐,诗,五言律诗,长淮滚浊澜 春半尚严寒 久客愁无寐 怀人醉不欢 读书狂李白 忘事老师丹 何日归林下 悠然饭一箪,"5,5,5,5,5,5,5,5",9d156d2d1616c247a486eb3d9695541e,长淮 滚浊澜 春半 尚 严寒 久 客 愁无寐 怀人醉 不欢 读书 狂 李白 忘 事 老师 丹 何日 归 林下 悠然 饭一 箪
2fc08896-870b-4c01-b5a2-6d32c3a8366b,懷林紹先三首  其二,俞德鄰,唐,诗,五言律诗,岁岁苦担簦 飘然云水僧 星霜变玄鸟 天地有青蝇 留滞慵僮仆 怀归畏友朋 求田端有暇 谁复问陈登,"5,5,5,5,5,5,5,5",91f51003ab6fd5e5bcc0a8e0e3462334,岁 岁 苦 担 簦 飘然 云水 僧 星霜 变 玄鸟 天地 有 青蝇 留滞 慵 僮仆 怀归畏 友朋 求 田端 有暇 谁 复 问 陈登
de1a6785-5fa7-4dcf-b4a8-52c7c07bf0ca,懷林紹先三首  其三,俞德鄰,唐,诗,五言律诗,羁怀不自憀 明日又花朝 我畏杖藜远 君难折简招 愁长怜发短 室迩叹人遥 剪尽西窗烛 凭谁慰寂寥,"5,5,5,5,5,5,5,5",472f1043933f716f1381842e12213acd,羁怀 不 自 憀 明日 又 花 朝 我 畏 杖 藜 远 君难折 简招 愁长怜 发短 室 迩 叹 人 遥 剪 尽 西窗 烛 凭 谁 慰 寂寥
77b556b5-999c-4e8f-b4fc-8cc432f37893,寓山陽天慶館作,俞德鄰,唐,诗,七言律诗,紫气浮关怅客情 琳宫羸卧绝逢迎 长廊夜静蛩吟苦 古殿秋深鹤唳清 勾漏丹砂何处问 蓝桥云液为谁倾 卷帘残月斜窥牖 街鼓冬冬又五更,"7,7,7,7,7,7,7,7",597d0b1b1d2dfc6dcec642a5ce3d6c6b,紫气 浮关 怅客 情 琳宫 羸卧 绝 逢迎 长廊 夜静 蛩 吟 苦 古殿 秋 深 鹤唳 清 勾漏 丹砂 何处 问 蓝桥 云液 为 谁 倾 卷帘 残月 斜 窥 牖 街鼓 冬冬 又 五更
05127796-b0d6-439f-82b6-00250c5a5403,次韻陳教授見寄二首  其一,俞德鄰,唐,诗,五言律诗,藜床听雨卧 雨霁抱琴行 古径荒苔合 秋渠坠叶平 流年悲鴈影 往事咽蛩声 谁识玄都观 刘郎旧有名,"5,5,5,5,5,5,5,5",60e5891b5f757969b8c59cdc070535c0,藜 床 听 雨 卧 雨霁 抱 琴行 古径 荒苔 合 秋渠 坠 叶平 流 年 悲 鴈 影 往事 咽 蛩 声 谁 识 玄都观 刘郎 旧 有名
08b08b43-c511-4bbb-ab56-0dd375210976,次韻陳教授見寄二首  其二,俞德鄰,唐,诗,五言律诗,江城吾旧隠 今岁喜秋穰 一顷南山豆 千畦负郭姜 看云扃户晚 对月引杯长 他日凭鱼鴈 犹堪话楚狂,"5,5,5,5,5,5,5,5",2bc0db906fdec5fb67d5c3b6b669b982,江城 吾 旧 隠 今岁 喜 秋穰 一顷 南山 豆 千 畦 负 郭姜 看 云 扃 户 晚 对 月 引杯 长 他 日 凭 鱼 鴈 犹堪话楚狂
f2d20887-e0c9-479e-adb5-3cdd7f3c6751,送程道大歸新安兼簡憲使盧處道學士四首  其一,俞德鄰,唐,诗,七言律诗,倦客思归整旆鞍 班荆祖道驻江干 浮云流水别离易 明月清风会晤难 携妓东山须载酒 上书北阙莫求官 诸公衮衮君休羡 得马还将失马看,"7,7,7,7,7,7,7,7",e5dffde8b51cb8db5f8f6756ac433eaf,倦 客思 归整 旆 鞍 班荆祖 道 驻 江干 浮云 流水 别离 易 明月清风 会晤 难 携妓 东山 须 载 酒 上书 北阙 莫求 官 诸公 衮衮 君 休羡 得 马 还 将 失马 看
f9693894-5829-4d91-9021-ae94a6c70061,送程道大歸新安兼簡憲使盧處道學士四首  其二,俞德鄰,唐,诗,七言律诗,十年故国黍离离 一日翩然赋式微 儒服政怜山鸟怪 机心何独海鸥飞 山中朝露闲观槿 岭曲春风自采薇 苍狗白衣从变化 是今非昔昔谁非,"7,7,7,7,7,7,7,7",fd65519bc6a46c9bc5804b9cf41c55d7,十年 故国 黍 离离 一日 翩然 赋 式微 儒服 政怜 山鸟 怪 机心 何独 海鸥 飞 山中 朝露 闲 观 槿 岭曲 春风 自 采薇 苍狗白衣 从 变化 是 今 非 昔昔 谁 非
2f6007c6-65dc-4305-bbdf-09f0a3a74a29,送程道大歸新安兼簡憲使盧處道學士四首  其三,俞德鄰,唐,诗,七言律诗,我生惭愧贾胡留 暮鼓晨钟复报秋 万里桥南存旧宅 十年客舍尚并州 青山是处堪埋骨 白发新来渐满头 此日送君何限意 长江万折有东流,"7,7,7,7,7,7,7,7",84b37fd67a7a9b70a8f5b63fd76efe09,我 生 惭愧 贾胡 留 暮鼓晨钟 复报 秋 万里 桥南 存 旧宅 十年 客舍 尚 并州 青山 是 处堪 埋骨 白发 新来渐 满头 此日 送君 何 限意 长江 万折 有 东流
4ea83252-462c-4e55-9837-d1eef4cd351a,送程道大歸新安兼簡憲使盧處道學士四首  其四,俞德鄰,唐,诗,七言律诗,戋戋束帛贲丘阿 有几英雄入网罗 少室山人征不起 贞元朝士已无多 声光赫奕埋轮使 音调凄清扣角歌 倾盖相驩应恨晚 乔松千尺有丝萝,"7,7,7,7,7,7,7,7",a77c6f10d1f45bd4f16282b2b42f0bb0,戋 戋 束帛贲 丘阿 有 几 英雄 入 网罗 少室 山人 征不起 贞元 朝士 已 无 多 声光 赫奕 埋 轮 使 音调 凄清 扣 角歌 倾盖 相 驩 应 恨 晚 乔松 千尺 有 丝萝
19eadf17-6ed7-40c8-8168-0a3e04a86e43,次韻程道益見贈二首  其一,俞德鄰,唐,诗,七言律诗,此生惭愧马牛襟 返锁柴门岁月深 避地管宁甘白帽 登台郭隗自黄金 风霜渐老骚人鬓 天地元知国士心 却喜程侯晚相遇 长鱼碧酒共清吟,"7,7,7,7,7,7,7,7",fcde50e2d391eb2606485b24f5ea1e65,此生 惭愧 马牛襟 返锁 柴门 岁月 深 避地 管宁 甘 白帽 登台 郭隗 自 黄金 风霜 渐 老 骚人 鬓 天地 元 知 国士 心 却 喜 程侯 晚 相遇 长 鱼 碧 酒 共 清吟
1375ee60-bfbd-4f24-8fb2-9eed450bd8a4,次韻程道益見贈二首  其二,俞德鄰,唐,诗,七言律诗,十载时艰泪染襟 余生几拟托幽深 匹夫无罪空怀璧 校尉有官从摸金 老去风尘犹瞇眼 春来药裹更关心 草玄作赋吾何敢 梁父吟成祇自吟,"7,7,7,7,7,7,7,7",da1a03759e617d317509821439a8b01f,十载 时艰 泪染襟 余生 几 拟托 幽深 匹夫无罪 空 怀璧 校尉 有 官 从 摸金 老 去 风尘 犹瞇 眼 春来 药裹 更 关心 草 玄作赋 吾 何敢 梁父吟 成 祇 自 吟
bb87c255-a8c1-4c5b-a075-12d4dd98a15a,病中三首  其一,俞德鄰,唐,诗,七言律诗,病来十日闭茅庐 孤负吟诗与著书 床下不知牛是蚁 濠间谁识子非鱼 羸形分绝麒麟画 老境堪同鹿豕居 坎止流行随所寓 分明天地一籧篨,"7,7,7,7,7,7,7,7",efcbf8a31cae44f94ea4c6ed709d3392,病来 十日 闭 茅庐 孤负 吟诗 与 著书 床 下 不知 牛 是 蚁 濠 间 谁识 子非鱼 羸形 分 绝 麒麟 画 老境 堪同 鹿 豕 居 坎止流行 随 所 寓 分明 天地 一 籧 篨
69c3654f-e570-4b41-a0b0-790a2b0a2e76,病中三首  其二,俞德鄰,唐,诗,七言律诗,腐儒麤粝愧无功 一月兼旬卧病中 赋就但应增肺渴 檄成元不愈头风 移心有法难忘药 折臂无缘定作公 世事渐艰吾已老 翛然梦不到槐宫,"7,7,7,7,7,7,7,7",0813fee82ca398506e40bbb63ee4751f,腐儒 麤 粝 愧 无功 一月 兼 旬 卧病 中 赋就 但 应增 肺渴 檄成元 不 愈头 风 移心 有 法 难忘 药 折臂 无缘 定作 公 世事 渐 艰 吾 已 老 翛 然 梦 不到 槐 宫
14f980ac-03e7-4225-af25-2042a887c6ec,病中三首  其三,俞德鄰,唐,诗,七言律诗,婢寻本草犬迎医 二竖驱除去复随 衰老维摩常示病 瘦生杜甫不关诗 门堪罗雀那容驷 釜不烹鱼但作糜 见说九重征武士 却须攘臂学支离,"7,7,7,7,7,7,7,7",8170ed7ae178e6e7883ad47440998a11,婢 寻 本草 犬 迎 医 二 竖 驱除 去 复随 衰老 维摩 常示 病 瘦 生 杜甫 不关 诗 门堪罗雀 那 容 驷 釜不烹鱼 但 作糜 见 说 九重 征 武士 却须 攘臂 学 支离
e4a3a82a-cdec-418c-91a8-78e436ba82ca,故舶使知泉州趙公挽詞五首  其一,俞德鄰,唐,诗,五言律诗,闽粤驱驰后 乾坤震荡中 名虽高斗北 身竟老辽东 仕止因时异 悲懽与世同 洛滨多侍从 立懦独清风,"5,5,5,5,5,5,5,5",411f0144b1d2e178d1aa849fdb67c5df,闽粤 驱驰 后 乾坤 震荡 中 名 虽 高 斗 北 身 竟 老 辽东 仕止 因时 异 悲 懽 与 世 同 洛滨 多 侍从 立 懦 独 清风
64f55576-4469-4a08-99e8-d3cada76dc48,故舶使知泉州趙公挽詞五首  其二,俞德鄰,唐,诗,五言律诗,慷慨辞双节 逍遥寄一筇 扬雄虽若凤 老子自犹龙 霁月窗前草 悲风陇上松 遗民应巷哭 何但辍秦舂,"5,5,5,5,5,5,5,5",8ef966cd53f6bac4c8c3a8ab7d07bfbf,慷慨 辞 双节 逍遥 寄 一 筇 扬雄 虽若 凤 老子 自 犹龙 霁月 窗前 草 悲风 陇上 松 遗民 应 巷 哭 何但 辍 秦 舂
c57f3ba5-1b01-4abc-bcc0-d93869df1ffe,故舶使知泉州趙公挽詞五首  其三,俞德鄰,唐,诗,五言律诗,壮岁风云会 衰龄岸谷迁 芾棠南国里 细柳曲江边 天地纷戈甲 园林寂管弦 康成共丁卯 肯避巳辰年,"5,5,5,5,5,5,5,5",05789c09a7e62d3515fb6ee55e52934b,壮 岁 风云 会 衰 龄 岸 谷 迁 芾 棠 南国 里 细柳 曲江 边 天地 纷 戈甲 园林 寂 管弦 康成 共 丁卯 肯避 巳 辰 年
2196bab5-bc60-497a-9992-01df8ffef017,故舶使知泉州趙公挽詞五首  其四,俞德鄰,唐,诗,五言律诗,杜陵侔稷契 诸葛陋袁曹 道在七分易 文过九辩骚 丘原终古闭 嵩岳极天高 况复阶庭树 于今有凤毛,"5,5,5,5,5,5,5,5",f14ded07563b7efcd53b42544aff105f,杜陵侔 稷 契 诸葛 陋 袁 曹 道 在 七分 易 文过九 辩骚 丘原 终古 闭 嵩岳极 天高 况复 阶庭 树 于今 有 凤毛
65b3a9a8-1702-46a8-aad0-40e5f96e2e8f,故舶使知泉州趙公挽詞五首  其五,俞德鄰,唐,诗,五言律诗,世梗投林密 人稀寄驿迟 一朝传易箦 千古竟骑箕 斲鼻空悲郢 援琴谩忆期 薤歌嗟已晚 生死负恩私,"5,5,5,5,5,5,5,5",31c9ed54364586c790bf2aeb90c53396,世梗 投林 密 人 稀 寄 驿迟 一朝 传易 箦 千古 竟 骑 箕 斲 鼻 空 悲 郢 援琴 谩忆 期 薤歌 嗟已 晚 生死 负恩 私
9d47c718-98d3-4bf7-8356-8b00b9724fcc,秋壑堂,俞德鄰,唐,诗,七言律诗,衮绣三朝乐盛时 湖山廊庙两栖迟 一声鼙鼓乾坤沸 万里烟尘草木悲 隔叶黄鹂空𪾢睆 定巢紫燕尚差池 春风不管人间事 犹绕雕阑飏绿漪,"7,7,7,7,7,7,7,7",2901630999b415f7589f67c69294692a,衮 绣 三朝 乐盛 时 湖山 廊庙 两栖 迟 一声 鼙 鼓 乾坤 沸 万里 烟尘 草木 悲 隔叶 黄鹂 空 𪾢 睆 定 巢紫燕 尚 差池 春风 不管 人间 事 犹绕 雕 阑 飏 绿 漪
22692cdc-7447-4fd7-a334-ff730e9d9702,懷聶道錄二首  其一,俞德鄰,唐,诗,七言律诗,形影参商已六春 春风吹梦益沾巾 江头杨柳送行客 窗外梅花疑故人 世事茫茫山岳隔 年光冉冉燕鸿新 一尊何日重携手 鹤外乾坤迥不尘,"7,7,7,7,7,7,7,7",7d87f6d9a7f00c79ae518743172a7b7b,形影 参商 已 六 春 春风 吹 梦益 沾 巾 江头 杨柳 送行 客 窗外 梅花 疑 故人 世事 茫茫 山岳 隔 年 光 冉冉 燕鸿新 一尊 何日 重 携手 鹤 外 乾坤 迥不尘
019f5550-7cc0-43a2-a731-96a2324f0f56,懷聶道錄二首  其二,俞德鄰,唐,诗,七言律诗,夜鹤朝猿伴苦吟 碧窗静锁绿云阴 青精可饭药资乏 黄独无苗山雪深 岂有故人分禄米 但闻隠士寄焦琴 相思一夜生春草 明月满街天籁沈,"7,7,7,7,7,7,7,7",7860d4ca8e3df59b4cea02e3b73a5f6f,夜鹤朝 猿伴 苦吟 碧窗静 锁 绿云 阴 青精 可饭 药资乏 黄 独无 苗山 雪深 岂 有 故人 分禄 米 但 闻 隠 士 寄 焦 琴 相思 一夜 生 春草 明月 满街 天籁 沈
9357bf22-c3e7-4e2e-9005-7f0bfe25279d,病愈出游,俞德鄰,唐,诗,七言律诗,桐帽椶鞋破晓烟 落花飞絮暮春天 风簷转日噪干鹊 云树隔溪啼杜鹃 客引茅亭沽旧酒 僧邀竹院话枯禅 病余一事还堪笑 脚力轻松倍去年,"7,7,7,7,7,7,7,7",b056528dcd7c595e47d58263e2fe6a57,桐 帽 椶 鞋 破晓 烟 落花 飞絮 暮春 天 风簷 转日 噪 干 鹊 云树 隔溪 啼 杜鹃 客引 茅亭 沽 旧 酒 僧 邀 竹院 话 枯 禅 病余 一事 还 堪 笑 脚力 轻松 倍 去年
0af385f6-2d47-47d6-8697-7045a42dc81a,舟行欲訪三茅踐許宗師鶴會之約,俞德鄰,唐,诗,七言律诗,磵饮岩栖愿已违 小舟拂晓泛涟漪 蒲丛露冷泣姑恶 木末云深叫子规 山近三茅便杖屐 酒沽五里带糟醨 乘风𠇹拟寻幽躅 莫负当年汗漫期,"7,7,7,7,7,7,7,7",d6db5e0f3796ba2f4344492e6ad874ef,磵 饮 岩 栖 愿 已 违 小舟 拂晓 泛 涟漪 蒲丛露 冷泣 姑恶 木末云 深 叫 子规 山近三茅 便 杖 屐 酒沽 五里 带 糟 醨 乘风 𠇹 拟 寻 幽躅 莫 负 当年 汗漫 期
ee5d6087-b17b-436e-a005-c8cbc51fc52f,夜卧旅邸夢入三茅山一道士病一道士鼾睡因作詩紀其概云,俞德鄰,唐,诗,七言律诗,梦入三茅叩玉扉 楼台金碧浄朝晖 岩花涧草高低见 田鹤沙禽下上飞 道士倚墙方熟睡 至人杜德不言机 人间天上元非远 非想非非更觉非,"7,7,7,7,7,7,7,7",590c9089ebc99a10fcff88b0a444cba1,梦入 三 茅叩玉 扉 楼台 金碧 浄 朝晖 岩 花涧 草 高低 见 田鹤沙 禽 下 上 飞 道士 倚 墙方 熟睡 至 人 杜德 不言 机 人间天上 元 非远 非 想 非非 更 觉非
c48083b8-b006-48ab-a9e7-be2e0cc98964,人日,俞德鄰,唐,诗,七言律诗,人日吟窗涤砚尘 探官擘茧笑乡邻 山人雅爱终南径 诗客空怀渭北春 誉毁盖棺犹未了 勋名看镜不须频 从今好是支离卧 有客问余方负薪,"7,7,7,7,7,7,7,7",cd6ba35df20405b0179380a6a7e0c590,人 日 吟 窗 涤 砚 尘 探官 擘 茧 笑 乡邻 山 人 雅爱 终南 径 诗客 空怀 渭北 春 誉毁 盖棺 犹 未了 勋名 看 镜 不须 频 从今 好 是 支离 卧 有 客 问 余方 负薪
577e86a1-6eb5-4b4c-b549-27b46d129913,郭朝奉挽詞二首  其一,俞德鄰,唐,诗,五言律诗,性俭家常足 心闲体自胖 令名缘有子 良贵不须官 遗像衣冠古 高堂几席寒 他年说耆旧 回首重辛酸,"5,5,5,5,5,5,5,5",7d03d1789ec1d709f94ac6842d4706b0,性 俭 家常 足 心 闲体 自 胖 令 名缘 有子 良贵 不须 官 遗像 衣冠 古 高堂 几席 寒 他 年 说 耆 旧 回首 重 辛酸
8bd69878-07cd-4724-b714-b0e2f5c34bf3,郭朝奉挽詞二首  其二,俞德鄰,唐,诗,五言律诗,世态十年别 交情奕代论 及门先倒屣 引酌定空尊 杖屦春风语 松楸夜月魂 些成嗟已晚 江阔听啼猿,"5,5,5,5,5,5,5,5",240614fe1822d62520c3c714e184d37b,世态 十年 别 交情 奕 代 论 及 门 先 倒 屣 引 酌定 空 尊 杖 屦 春风 语 松楸夜 月 魂 些 成嗟 已晚 江阔 听 啼猿
286cfd28-b765-4cd8-8550-eb1111a8a804,悼俞仁則,俞德鄰,唐,诗,七言律诗,藕花汀畔柳丝垂 杯酒殷勤话别离 风雨对床空有约 池塘梦草竟无诗 荒坟日落谁人吊 古屋苔深独我悲 毕竟功名大槐国 排云书在即丰碑,"7,7,7,7,7,7,7,7",c7f526e585ce1831a3947b0acc45160a,藕花 汀畔 柳丝 垂 杯酒 殷勤 话 别离 风雨对床 空 有 约 池塘 梦草 竟 无 诗 荒坟 日落 谁 人 吊 古屋 苔 深独 我 悲 毕竟 功名 大槐国 排云 书 在 即 丰碑
0c657ccc-9e1b-41a5-bb84-ac62e365084b,吳門逢友人,俞德鄰,唐,诗,七言律诗,泽国江山冷战云 扁舟春晚忽逢君 荒城鼓角含商气 旧曲楼台暗楚氛 海燕认巢迷故主 苔蜗篆壁变新文 更怜庾信江南赋 音调凄清不忍闻,"7,7,7,7,7,7,7,7",add3182821e5eee8761a521ea6c1f303,泽国 江山 冷战 云 扁舟 春晚 忽逢 君 荒城 鼓角 含 商气 旧曲 楼台 暗楚 氛 海燕 认巢 迷 故主 苔蜗 篆壁 变新 文 更怜 庾信 江南 赋 音调 凄清 不忍 闻
723f4f85-e6a7-4c41-95b8-aa77dcf61317,送張師道,俞德鄰,唐,诗,七言律诗,七闽幕府借词臣 一笑平反草木春 制下九重新涣汗 胸蟠千古旧经纶 生平耻不为伊傅 夜半何烦问鬼神 无限焦枯待霖雨 好将斯道觉斯民,"7,7,7,7,7,7,7,7",3c2ce433ab1b0705e2b96e4f397dc041,七 闽 幕府 借词 臣 一 笑 平反 草木 春 制下 九 重新 涣汗 胸 蟠 千古 旧 经纶 生平 耻 不 为 伊傅 夜半 何 烦 问 鬼神 无限 焦枯 待 霖雨 好 将 斯 道觉斯民
c2b81f21-6539-47d0-8ffa-b7869fa0e8f4,送道士孫雪房,俞德鄰,唐,诗,七言律诗,雾豹文章野鹤姿 黄冠晦迹淛江涯 携家拟就鹿门隠 奏赋何期狗监知 触热问涂行有日 排云论事岂无时 太平上策须倾倒 更忆崆峒麦熟诗,"7,7,7,7,7,7,7,7",4ecdc59076e730a2145a02e9f6652417,雾 豹 文章 野鹤 姿 黄冠 晦迹 淛 江 涯 携家 拟就 鹿 门 隠 奏赋 何期 狗监 知 触热 问 涂行 有 日 排云 论事 岂 无 时 太平 上策 须 倾倒 更忆 崆峒 麦熟 诗
ecb367e2-ca7e-435f-ba7b-6d3bc50e40dc,送董左丞二首  其一,俞德鄰,唐,诗,七言律诗,帝睠东南用正人 角巾归第请何频 相公久矣倦台鼎 故国依然倚世臣 霖雨合归天上作 忠言须造榻前陈 丈夫出处非徒尔 四海安危寄一身,"7,7,7,7,7,7,7,7",5e1cc22ad2768ce8de312ade3e16fd70,帝 睠 东南 用 正人 角巾 归 第 请 何频 相公 久 矣 倦 台 鼎 故国 依然 倚 世臣 霖雨 合归 天上 作 忠言 须 造 榻 前 陈 丈夫 出处 非徒 尔 四海 安危 寄 一身
