id,title,author,dynasty,genre,poem_type,sentences_simplified,meter_pattern,hash,words
b4cee23c-93dd-4831-882b-2bf58c3e4040,九奋 赋巴丘,薛季宣,唐,诗,杂言,巴丘兮峥嵘 嵚岑兮洞庭 秋霖兮阁泪 春草兮愁生 巴之蛇兮修之 云英甲兮火晶 戟微手足兮惟行 云雾飞腾兮匪翼 知绌信兮天性 展转委蛇兮至行 朝之游兮衡岳 莫饭流兮湘曲 鹿焱起兮中洲 人之逐兮悠悠 纷缭乱兮海波弗静 逐之颠者相望兮莫得持其腰领 鹿冠元兮森槎千角 蛇衔取兮不畏触 岁三迁而解甲兮骼髅具吐 羌有获兮故无取 象巨牙之双植兮 肥腯顽健 肉鸡兔虎龙而牛干兮 得鼠狶为首面 性羊狠而马行兮 狗猴心而蛇变 既备此十二神象兮 害于田其不远 蜿蜒蛇之怒兮 吸无劳乎宛转 虽有此修鼻骈齿兮 宁复餐而以卷 不劳咀此齿牙兮 害以蛇除 珠显灼而光明兮 不在短狐之毁誉 游兰若兮芳洲 卧香蒲兮翔素流 芷冈兮戏豫 丹穴兮优游 何蜂虫之阴戾琐微兮藏形于暗 骑蛇头而啜之兮堕厥颐而脱颔 阜堆骨兮名陵 风悲雨泣兮千龄万龄 象种繁兮蛇既毙 欲吞之兮谁能舍 鹿奔兮其复获 登蛇丘兮涕零零,"5,5,5,5,6,6,7,7,6,7,6,6,6,6,8,13,8,7,11,7,7,4,9,6,7,6,8,6,6,6,8,6,7,4,7,7,6,7,5,5,13,13,6,9,7,7,6,7",0dd2da6690ef840729a0ba8bfac3b2fb,巴丘 兮 峥嵘 嵚 岑 兮 洞庭 秋霖 兮 阁 泪 春草 兮 愁生 巴 之 蛇 兮 修之 云英 甲 兮 火晶 戟 微 手足 兮 惟行 云雾 飞腾 兮 匪翼 知 绌 信 兮 天性 展转 委蛇 兮 至 行 朝 之游 兮 衡岳 莫饭流 兮 湘 曲 鹿焱 起 兮 中洲 人 之 逐 兮 悠悠 纷 缭乱 兮 海波 弗静 逐之 颠者 相望 兮 莫 得持 其 腰 领 鹿冠 元兮森 槎 千角 蛇 衔取 兮 不畏 触 岁 三 迁 而 解甲 兮 骼 髅 具 吐 羌 有 获 兮 故 无取 象 巨牙 之 双植兮 肥 腯 顽 健 肉鸡 兔虎龙而牛干兮 得 鼠 狶 为首 面 性羊 狠而 马行兮 狗猴心而蛇变 既备 此 十二 神象 兮 害 于田 其 不远 蜿蜒 蛇 之 怒 兮 吸无劳乎 宛转 虽有 此 修鼻 骈齿 兮 宁 复餐 而以 卷 不劳咀此齿牙兮 害以 蛇 除 珠 显灼 而 光明 兮 不 在 短 狐 之 毁誉 游 兰若 兮 芳洲 卧 香蒲 兮 翔 素流 芷冈 兮 戏 豫 丹穴兮 优游 何蜂虫 之 阴戾 琐微 兮 藏 形于 暗 骑 蛇头 而 啜 之 兮 堕厥 颐而脱 颔 阜堆 骨 兮 名陵 风悲雨泣 兮 千龄 万龄 象种繁 兮 蛇 既 毙 欲吞之兮 谁 能 舍 鹿奔兮 其复 获 登 蛇 丘 兮 涕零 零
ec8fe5e5-a627-481f-ba6b-ee62616a22c7,九奋 记梦,薛季宣,唐,诗,杂言,解荃维兮放兰舸 蹇南越兮洞庭波 喷浪花兮飞白雪 身何居兮入明月 聊凝神兮隠处 梦龙宫兮波之下 珍珠庭兮紫贝阙 璆琳宫兮犀甲户 朝龙君兮殿堂 芰荷巾兮苹藻裳 圭琉璃兮荇带 佩美玉兮琅珰 龙君游兮何之 水晶宫兮丹水湄 骖苍虬兮飞廉御 丰隆车兮为后属 碜磹驱驼其左右兮使风伯为清路 都离宫兮忘反 命群臣兮燕衎 葅蘩蕴兮形盐 列鲸胎兮鼋卵 张钧天兮广漠野 鼓蛇鼖兮雷鼍鼓 铿浮磬兮□龙钟 歌湘灵兮奇相 舞三行兮清酤 戛止兮柷敔 观其臣之就位兮厥令尹曰瞋 鲑总群虾而将之兮 胄乃元惟鲍鱼 缘蛙声之聒聒兮 位高于五谏 鳣鱼大而无庸兮 处之冗散 鬰鬰余心之惛默兮 周章而蹇产 欲敶词而梦觉兮 嗟言之而已晚 怱怱余见斯情物兮 徒临流而惋叹,"7,7,7,7,6,7,7,7,6,7,6,6,6,7,7,7,14,6,6,6,6,7,7,7,6,6,5,12,8,6,7,5,7,4,8,5,7,6,8,6",c73bdaf76f2f8618c181eb3b3de68869,解荃维 兮 放兰 舸 蹇 南越 兮 洞庭 波 喷 浪花 兮 飞 白雪 身 何居兮 入 明月 聊 凝神 兮 隠 处 梦 龙宫 兮 波 之下 珍珠 庭 兮 紫贝阙 璆 琳 宫 兮 犀甲 户 朝 龙君 兮 殿堂 芰 荷 巾 兮 苹藻裳 圭 琉璃 兮 荇 带 佩 美玉 兮 琅珰 龙君 游兮何 之 水晶宫 兮 丹水 湄 骖 苍 虬兮 飞 廉 御 丰隆 车 兮 为 后 属 碜 磹 驱 驼 其 左右 兮 使 风伯 为 清路 都 离宫 兮 忘 反 命 群臣 兮 燕 衎 葅 蘩 蕴 兮 形 盐 列鲸 胎 兮 鼋卵 张钧 天 兮 广漠 野 鼓 蛇 鼖 兮 雷 鼍 鼓 铿 浮 磬 兮 □ 龙钟 歌 湘灵 兮 奇 相 舞 三行 兮 清 酤 戛止 兮 柷 敔 观其臣 之 就位 兮 厥 令 尹 曰 瞋 鲑总群 虾而将之兮 胄 乃 元 惟 鲍鱼 缘 蛙声 之聒 聒兮 位 高于 五 谏 鳣 鱼 大 而 无庸 兮 处 之 冗散 鬰 鬰 余 心 之 惛 默 兮 周章 而 蹇 产 欲 敶 词 而 梦 觉 兮 嗟言之 而已 晚 怱 怱 余 见 斯 情 物 兮 徒临流而 惋叹
e657e9f4-d867-4135-a508-48e132d6616f,九奋 行吟,薛季宣,唐,诗,杂言,行吟兮大泽 邈无人兮临水石 被发兮徙倚彷徨 遇隠沦兮嘉客 舣渔舟而前致恭兮 问余以名何 徒摇尔精兮 燋然尔形 曰原楚卿之贵戚兮 三闾次也 同王姓而氏惟屈兮 灵均先人之字也 世滔淫而混浊兮 我惟洁清 彼醉者之纷拏兮 同怒余之独醒 渔父愀然而教之兮 曰圣人之致一 不必动而营皇兮 卓时中之变物 贵莫贵于和光兮 太洁在情之甚嫉 混浊世兮胡不扬波而泥淈 众皆醉兮尚可𫗦糟而醨歠 不同人而求自异兮 宜一朝之见绌 指清流之灏灏兮 余将以逝 方浴茝而沐芳兮 振衣冠而卒岁 不自尘其皓皓兮 受汶汶而蒙世 父行歌而鼓枻兮 舟飘飘然无凝滞 歌沧浪之水兮时乎清浊 斯濯缨兮斯濯足 望斯人兮摇摇 欲从之兮无由 烟云邈兮不可见 嗟斯人兮已远,"5,7,7,6,8,5,5,4,8,4,8,7,7,4,7,6,8,6,7,6,7,7,11,11,8,6,7,4,7,6,7,6,7,7,10,7,6,6,7,6",7fb756ee9b2e8db3eca1f054cf519160,行吟 兮 大泽 邈 无人 兮 临水 石 被 发兮 徙倚 彷徨 遇隠沦 兮 嘉 客 舣 渔舟 而 前致 恭兮 问余以名何 徒摇尔精兮 燋然 尔 形 曰 原楚卿 之 贵戚 兮 三 闾 次 也 同 王姓 而 氏 惟屈兮 灵均 先人 之 字 也 世滔淫而 混浊 兮 我 惟 洁清 彼 醉者 之 纷 拏 兮 同 怒余之独醒 渔父 愀 然而 教之兮 曰 圣人 之致 一 不必 动而营皇 兮 卓 时 中 之 变物 贵 莫贵 于 和光兮 太洁 在 情 之 甚 嫉 混浊 世兮胡不 扬波 而 泥 淈 众皆醉 兮 尚可 𫗦 糟 而 醨 歠 不同 人而求自异 兮 宜 一朝 之 见 绌 指 清流 之 灏 灏 兮 余 将 以 逝 方 浴 茝 而 沐 芳 兮 振 衣冠 而 卒岁 不自尘其 皓皓 兮 受 汶 汶 而 蒙世 父行歌 而 鼓 枻 兮 舟 飘飘然 无 凝滞 歌 沧浪 之 水 兮 时乎 清浊 斯 濯缨 兮 斯 濯足 望 斯人 兮 摇摇 欲从之兮 无由 烟云 邈 兮 不 可见 嗟 斯人 兮 已远
e07cdc0b-cbdf-482b-b6bd-68910a2a7a6c,九奋 沈湘,薛季宣,唐,诗,杂言,观吾生兮何为乎今之世 永悲伤兮耿耿夜长而鲜寐 临清湘兮思逝无舟 伥欲行兮不济 拟飞腾兮假羽翰于黄鹄 鹄已亡兮曾是余之能服 将解衣而下游兮潜川不贯 惧射工之余中兮备蛟龙之刍豢 登衡山之嵯峨兮柏松委靡 怨飘风之怒狂兮害于物理 猨狖啸侣兮上获我冠 荆榛塞路兮下穿我履 望苍梧兮将重华之云愬 巉九疑之不可辩兮又藐然其烟雾 杀竹枝而求泪班兮思二妃之矩度 哀灵修之返无期兮荪舍兹将安寓 首阳河渎远而不可适兮 视申子夷齐其有故 将从此汨罗之水兮 傥务成之或遇 悲女媭之婵媛兮 临流而止余 涕滂沱兮 心悲江渚 念我独兮 斯不可以久处 心如石而莫转兮 吾其此介 与子别兮余将于迈 褰余衣兮不我止 蹈清泠兮余乃已 抱巨石兮怀沙 谌同流兮灏波 其穷幽兮眇眇 皇合德兮太皓,"10,11,8,6,10,10,11,13,11,11,9,9,10,14,14,14,10,8,8,6,7,5,4,4,4,6,7,4,8,7,7,6,6,6,6",79497f8f346e93fc1c09cc4ebf205146,观吾生 兮 何为 乎 今 之 世 永 悲伤 兮 耿耿 夜长 而 鲜寐 临清 湘 兮 思逝 无舟 伥欲 行 兮 不济 拟 飞腾 兮 假 羽 翰 于 黄鹄 鹄 已亡 兮 曾 是 余 之 能服 将 解衣 而 下游 兮 潜川 不贯 惧射 工之余中兮备 蛟龙 之刍 豢 登 衡山 之 嵯峨 兮 柏松 委靡 怨 飘风 之 怒狂兮 害于 物理 猨 狖 啸侣 兮 上 获 我 冠 荆 榛塞路 兮 下穿 我 履 望 苍梧 兮 将 重华 之 云 愬 巉 九 疑 之 不可 辩 兮 又 藐然 其 烟雾 杀 竹枝 而 求泪 班 兮 思二妃 之 矩度 哀 灵修 之 返 无期 兮 荪 舍 兹将 安寓 首 阳河 渎远 而 不可 适兮 视 申子夷 齐其有故 将 从此 汨罗 之 水 兮 傥 务成 之 或 遇 悲女媭之婵 媛 兮 临流 而止 余 涕 滂沱 兮 心悲 江渚 念我独兮 斯 不 可以 久 处 心如石而莫转兮 吾 其此 介 与 子别 兮 余 将 于 迈 褰 余衣兮 不 我 止 蹈 清泠 兮 余乃 已 抱 巨石 兮 怀沙 谌 同流 兮 灏 波 其 穷 幽 兮 眇 眇 皇合德 兮 太 皓
e2099ede-cee2-4d02-9d8d-6c768d59be4d,九禽言  其一,薛季宣,唐,诗,杂言,不如归去 巴江春暮 肠断口无声 早夜啼红雨 寻思帝蜀时 骊龙鱼服不知非 相妇未饶姬妾貌 流红长恨不如归,"4,4,5,5,5,7,7,7",e25c2f198e7dd7443d8d28aa28a9b214,不如归去 巴江 春 暮 肠断 口 无声 早夜 啼红雨 寻思 帝 蜀 时 骊龙 鱼服 不知 非 相妇 未 饶 姬 妾 貌 流红 长恨 不如 归
99dffcc0-48e6-404d-ae7c-e183517e46b0,九禽言  其二,薛季宣,唐,诗,杂言,婆餠焦 胡不归 炽炭炎炎不识儿 儿饥不敢取 儿苦长自啼 父母生儿忍不字 弃儿父母生何为,"3,3,7,5,5,7,7",f3a42c17e64546a23ba361e62656b8d9,婆 餠 焦 胡不归 炽 炭 炎炎 不识 儿 儿 饥 不敢 取 儿苦 长自 啼 父母 生儿 忍不字 弃儿 父母 生 何为
6b8b4e5f-4c7b-41b0-af57-0ed570e1464a,九禽言  其三,薛季宣,唐,诗,杂言,脱脚布袴 从教暴露 已自不能羞 有甚供租赋 官家官家听我语 我本农家困征取 祇今为鸟心不忘 愿王一念农家苦,"4,4,5,5,7,7,7,7",d5b5fc717b9447c1b1f8eef37c910fb5,脱脚 布袴 从教 暴露 已自 不能 羞 有 甚 供 租 赋 官家 官家 听 我 语 我 本 农家 困征 取 祇 今 为 鸟 心 不 忘 愿 王一念 农家 苦
c0f44ef6-deae-4184-8d05-51c53f1c8d39,九禽言  其四,薛季宣,唐,诗,杂言,蚕姑力作 缲丝一百箔 五月罢蚕缫 炎天勤织络 今年州府急催科 轻绡织成不得著 蔽体无裈独蚕妇 百箔丝蚕枉辛苦 贵人不念有寒人 一曲千缣赐倡女,"4,5,5,5,7,7,7,7,7,7",b16bd4f06964dc0409559c0f948382b0,蚕姑 力作 缲 丝 一百 箔 五月 罢 蚕 缫 炎天 勤织络 今年 州府 急 催 科 轻 绡 织成 不得 著 蔽体 无 裈 独 蚕 妇 百箔 丝蚕 枉 辛苦 贵人 不 念有 寒人 一曲 千 缣 赐 倡女
fe0da630-84de-46e3-b3e3-2b0a4423328f,九禽言  其五,薛季宣,唐,诗,杂言,新妇抱儿归 天清曜日晖 阴云凝雾雨 新妇抱儿去 窭窭勃姑鸟 此情那可晓 有儿有妇不作窠 教去教归几时了 谢豹谢豹独何心 挈我裳衣无处寻 白露漙兮风劲 红叶下兮秋深 我寒终不辞 皇天故不私 请看穴土重泉下 对人腼面何为者,"5,5,5,5,5,5,7,7,7,7,6,6,5,5,7,7",e4694ade4f99054b3735ff4bf3db78dc,新妇 抱 儿 归 天清曜 日 晖 阴云 凝雾雨 新妇 抱 儿 去 窭 窭 勃 姑鸟 此情 那 可晓 有儿 有妇 不 作 窠 教 去 教 归 几时 了 谢豹 谢豹 独何心 挈 我裳 衣 无处 寻 白 露 漙 兮 风 劲 红叶 下 兮 秋 深 我 寒终 不 辞 皇天 故 不 私 请 看 穴 土重 泉下 对 人 腼面 何为 者
d9cafc45-0207-47c3-97df-06636ef99449,九禽言  其六,薛季宣,唐,诗,杂言,泥滑滑 山冈路 一步一踌躇 行前复回顾 如膏兮小雨 胶胶兮薄土 失足无多来往人 扑落洪崖不堪数 战兢驱馿行不前 苦是昏黄无逆旅,"3,3,5,5,5,5,7,7,7,7",e9c3c6024be821a58bf213948fdf1151,泥 滑滑 山冈 路 一步 一 踌躇 行前 复 回顾 如膏兮 小雨 胶胶 兮 薄 土 失足 无多 来往 人 扑落 洪崖 不堪 数 战兢 驱 馿 行 不 前 苦 是 昏黄 无 逆旅
2c846652-8940-4cbd-a25c-49db8cc80cc5,九禽言  其七,薛季宣,唐,诗,杂言,行不得也哥哥 途远山高奈何 畏日流金兮长夏 荫人有樾兮无柯 足茧兮撑狞 口渴兮烟生 思量有底亏人处 不处高堂长路行,"6,6,7,7,5,5,7,7",b5d43140a63bd90d00be6a1d4aa87c3a,行不得也 哥哥 途 远山 高 奈何 畏 日 流金 兮 长夏 荫 人 有 樾 兮 无 柯 足茧 兮 撑 狞 口渴 兮 烟生 思量 有底 亏 人 处 不处 高堂 长路 行
dad6e229-2d54-4bc1-8e5a-ad1908f6b6aa,九禽言  其八,薛季宣,唐,诗,杂言,提葫芦 沽美酒 舞春风 卧花柳 且作醉乡游 此身非我有 与君看取垅头坟 人在谁知不长久,"3,3,3,3,5,5,7,7",878f11a99ce11c3e37797d15c44abac5,提 葫芦 沽 美酒 舞 春风 卧 花柳 且 作 醉乡 游 此身 非 我 有 与 君 看 取 垅 头 坟 人 在 谁知 不 长久
5471a109-efc6-433d-a645-70f8c9f2ef00,挽薛艮斋,薛季宣,唐,诗,七言律诗,眼看嘉木斧斤摧 竹路凄凉孰不哀 高论每闻前席听 谠言曾欲挽裾回 膏销果见龚生夭 刍奠空悲徐孺来 儒效俗传今若此 苍苍福善竟悠哉,"7,7,7,7,7,7,7,7",00a90eb5771ba2432100897a90a7ab35,眼看 嘉木 斧斤 摧 竹路 凄凉 孰 不 哀 高论 每 闻 前席 听 谠 言 曾 欲 挽 裾 回 膏销果 见 龚生夭 刍奠 空悲 徐孺 来 儒效俗 传今 若此 苍苍 福善 竟 悠哉
f1e2d10d-95f2-4f9e-99e7-8351d47c3c31,句,楼锡,唐,诗,七言古体,但爱窗间冬日暖 不知门外北风凉,"7,7",7d638a1e177c92bb5318991576a64e3f,但 爱 窗间 冬日 暖 不知 门外 北风 凉
5b22b003-8b66-4930-a776-3a7a9bc86db2,和朱晦庵,刘清之,唐,诗,五言绝句,谁云两州牧 择笏望辕门 渠亦髭须好 公今德义尊,"5,5,5,5",c1e241a570b45d83d920211d00762543,谁 云 两 州牧 择 笏 望 辕门 渠亦 髭须 好 公 今德 义 尊
6e1d5382-df68-42b6-854f-f97b2b49d449,洞霄宫,刘清之,唐,诗,七言律诗,青山锁断红尘路 石柱干霄藏洞府 老蛟据窟不可窥 千古流泉替渠舞 真墟容我辄跻攀 心旷方知白日闲 飞仙一去忽已远 坐对松梢云往还,"7,7,7,7,7,7,7,7",9486b0ea06d81a3db0dccbf0ffc8992b,青山 锁断 红尘 路 石柱 干霄 藏 洞府 老蛟 据 窟 不可 窥 千古 流泉 替 渠舞 真墟容 我 辄 跻攀 心旷 方知 白日 闲 飞仙 一去 忽 已远 坐 对 松梢云 往 还
f46b9480-7296-4d07-82b1-c0f4d4b4ca10,游洪阳洞  其一,刘清之,唐,诗,七言绝句,朝来拔脚尘埃底 共访人间小有天 唤醒几年朱墨梦 胸中丘壑故依然,"7,7,7,7",2259b2d3efa84e26adcf7abc5af054e9,朝 来 拔脚 尘埃 底 共访 人间 小 有 天 唤醒 几年 朱墨 梦 胸中 丘壑 故 依然
9dc898b6-aeac-4c8c-80ed-664be9044633,游洪阳洞  其二,刘清之,唐,诗,七言绝句,稚川仙去忆浮丘 携客岩前问旧游 怀古临风一杯酒 荻花枫叶不胜秋,"7,7,7,7",631010462b228ec955d40469e6ae3995,稚川 仙 去 忆 浮丘 携客 岩前 问 旧游 怀古 临风 一 杯酒 荻 花 枫叶 不胜 秋
f969db56-1457-4d65-a0e3-20e4dafa1112,洞庭湖,刘清之,唐,诗,七言律诗,天孙岁晚会湘灵 倒泻银河合洞庭 上下天光唯一白 中间山色不多青 荆潭万里收尘滓 宇宙连宵失晦明 莫道人间少仙境 诗魂酒魄一时醒,"7,7,7,7,7,7,7,7",2ff45e14b4d529e58c6b39858cef07aa,天孙 岁 晚会 湘灵 倒泻 银河 合 洞庭 上下 天光 唯一 白 中间 山色 不多 青 荆潭 万里 收尘 滓 宇宙 连宵 失 晦明 莫道 人间 少 仙境 诗魂 酒魄 一时 醒
a4b1dbba-995e-4c52-a434-7b929a70d488,句,刘清之,唐,诗,五言古体,愁非为宋玉 亦不因莫愁,"5,5",c41226d54c2416834fc9c806938df799,愁 非 为 宋玉 亦 不 因 莫愁
9dc77bb7-3baa-486a-bc44-7a8462922d77,古梅,俞亨宗,唐,诗,七言绝句,疏疏瘦蕊含清馥 矫矫虬枝缀碧苔 疑是髯龙离雪殿 苍鳞遥驾玉妃来,"7,7,7,7",b1aa23c8416cae4235cc3d37f24ebebc,疏 疏 瘦 蕊 含清馥 矫 矫 虬枝 缀 碧 苔 疑 是 髯 龙 离 雪 殿 苍鳞遥 驾 玉妃 来
ccbcb43e-f909-4d5f-99fa-da59ccb4128c,送王龟龄,何佾,唐,诗,七言绝句,断桥截镫亦堪怜 始信林间别有天 微见兵机第一义 朱轓暂席广文毡,"7,7,7,7",b3bc1a943003a63ed05f39e2d337a430,断桥 截镫 亦 堪怜 始信 林间 别 有 天 微见 兵机 第一义 朱 轓 暂 席 广 文 毡
7f6fb7c3-b6e7-4378-a3e4-16aafebb40a4,句,何佾,唐,诗,七言古体,滕王阁上烟波远 孺子亭中花竹深,"7,7",b058cb75f5c315677533317fcf7b0a76,滕王阁 上 烟波 远 孺子 亭 中花竹 深
646ba9b4-8166-4fe2-b102-bd2ea04d519b,句,魏几,唐,诗,其他,,,b4ab563f61d3a4d43312c1e88a21d156,
bf11b820-6ba9-49ba-906a-fee295ee45ad,挽东莱先生  其一,唐季度,唐,诗,五言律诗,多士将安放 先生今则亡 正宗传道德 余事见文章 遽作两楹梦 空遗百世芳 哲人胡不寿 天理竟难量,"5,5,5,5,5,5,5,5",685b267cc3d3aaa6770c84735f9892f4,多士 将 安放 先生 今 则 亡 正宗 传 道德 余 事 见 文章 遽 作 两 楹 梦 空 遗 百世 芳 哲人 胡不寿 天理 竟 难 量
32ca160f-e383-4183-9247-e52fec76c146,挽东莱先生  其二,唐季度,唐,诗,五言律诗,交友昔尝与 真诚久愈孚 公虽推齿序 我实仰师模 提耳言犹在 终身誓不渝 神驰埋玉处 恸哭向长途,"5,5,5,5,5,5,5,5",6a38ce6e7ddd502cc33c3f1a005e9b9b,交友 昔 尝 与 真诚 久愈孚 公 虽 推齿序 我 实仰 师模 提耳言犹在 终身 誓不渝 神驰 埋 玉 处 恸哭 向 长途
077ccc72-d2b5-43e8-a36a-31a1d6f2cf19,倩真观,唐季度,唐,诗,五言古体,不记开山日 炼丹惟葛仙 清泉沿石滴 孤嶂与天连 只就岩为屋 何须木作椽,"5,5,5,5,5,5",3e1bea7d20c7ff350f2bad7101b9fb7b,不记 开山 日 炼丹 惟 葛仙 清泉 沿 石滴 孤嶂 与 天连 只 就 岩 为 屋 何须 木作 椽
938cc9c5-349c-4963-aed1-8e2d2bc9d4cb,和林艾轩城山国清塘韵,陈士楚,唐,诗,七言古体,山光一洗红尘眼 长松夹道摇青繖 回头下瞰百川溶 亭皋小立凌刚风 杰阁玲珑朱绿户 何年蓬莱移左股 山僧见客不敛眉 梵呗琅琅应鱼鼓 欲携三尺弹龟山 淳风一去不复还 仞墙草长章逢少 几百年来风月闲 嗟哉贤圣远复远 天高地下日易晚,"7,7,7,7,7,7,7,7,7,7,7,7,7,7",a4dfe73cef45229e0aa9022961a1365f,山光 一 洗 红尘 眼 长松 夹道 摇 青 繖 回头 下瞰 百川 溶 亭 皋 小立凌 刚风 杰阁 玲珑 朱绿户 何年 蓬莱 移 左股 山僧 见 客 不敛 眉 梵呗 琅琅 应 鱼鼓 欲 携 三尺 弹 龟山 淳风 一去不复 还 仞 墙 草长章 逢 少 几百年 来 风月 闲 嗟哉 贤圣 远 复远 天高地下 日易晚
e6ae3513-1f4b-4712-b1fe-8b7ced5116a5,题闻政堂,李松龄,唐,诗,五言古体,先生敛经纶 筹帷赞西方 一朝去幕府 委佩朝明光 召见天叹晚 占对何琅琅 小试分顾忧 持麾来边疆 善政期必闻 明训思对扬 朝夕惧有阙 萧然坐斯堂 讼缿亦已空 燕寝凝清香 他年报政归 从渠爱甘棠,"5,5,5,5,5,5,5,5,5,5,5,5,5,5,5,5",ab5b4e021b328a03c4dbcb22f186be7f,先生 敛 经纶 筹 帷 赞 西方 一朝 去 幕府 委 佩朝 明光 召见 天叹晚 占 对 何 琅琅 小试 分顾 忧 持 麾来 边疆 善 政期 必 闻 明训思 对 扬 朝夕 惧 有 阙 萧然 坐 斯堂 讼 缿 亦 已 空 燕 寝 凝 清香 他 年报 政归 从 渠爱 甘棠
423a2e24-c958-45be-9394-01c8511f7a08,送僧还日本,窦从周,唐,诗,五言古体,榜人理行舻 日出江水平 扶桑渺何许 万里浮沧溟 上人国之彦 夙悟最上乘 慕此中华风 一锡事游行 名山与奥谷 足迹已徧经 曰予处阛阓 幸矣识韩荆 论诗坐终日 问法天花零 相得臭味同 蔼蔼芝兰馨 岂比钱刀徒 市利纷以营 去去须臾间 何以展我情 江草色萋萋 江花亦冥冥 浮云聚复散 不能常合并,"5,5,5,5,5,5,5,5,5,5,5,5,5,5,5,5,5,5,5,5,5,5,5,5",9621d3cdaab248b1f71a69d7e5a2299e,榜 人理 行舻 日出 江 水平 扶桑 渺 何许 万里 浮沧溟 上人国 之 彦 夙悟 最 上乘 慕 此 中华 风 一 锡 事 游行 名山 与 奥谷 足迹 已 徧 经 曰 予 处 阛 阓 幸矣 识 韩 荆 论诗 坐 终日 问法 天花 零 相 得 臭味 同 蔼蔼 芝兰 馨 岂 比 钱 刀徒 市利 纷以 营 去 去 须臾 间 何以 展 我 情 江 草 色 萋 萋 江花亦 冥冥 浮云 聚复 散 不能 常 合并
45020c82-9dd9-475b-8cea-6a344123daab,次韵陈可复见赠,周孚,唐,诗,七言律诗,二年穷谷𣃁黄精 两见骚人赋落英 万事吾今负初愿 百年君亦厌虚名 花开花落春还夏 窗暗窗明雨又晴 莫读离骚但饮酒 从来前辈戒秋声,"7,7,7,7,7,7,7,7",04949e2d9a2cb99d19087c12ee7e4802,二年 穷谷 𣃁 黄精 两 见 骚人 赋 落英 万事 吾 今 负 初愿 百年 君 亦 厌 虚名 花开花落 春 还 夏 窗暗 窗明雨 又 晴 莫读 离骚 但 饮酒 从来 前辈 戒 秋声
1f882828-9d77-4033-a808-bdaa7c3cdf27,赠萧光祖,周孚,唐,诗,五言律诗,之子固绝俗 少年甘寂寥 田园一蚊睫 书卷百牛腰 雪径晴犹冻 烟江晚不潮 个中勤著语 老耳欲闻韶,"5,5,5,5,5,5,5,5",7e38cdca6aae8aba947468969a26c661,之子 固 绝俗 少年 甘 寂寥 田园 一 蚊睫 书卷 百 牛腰 雪径晴 犹冻 烟江 晚 不 潮 个 中 勤著 语 老耳 欲 闻韶
d299ef2d-d592-4a1c-be6a-4b409fec9ed6,哭杨虞臣丈,周孚,唐,诗,五言古体,先君捐馆时 亲旧止四五 丁宁奉遗训 我没谁抚汝 孤生卧苫块 泣血诵此语 杨公十年旧 不见五年许 两萍忽相遇 握手涕如雨 高怀几骨肉 老语倾肺腑 生死见交情 公固不愧古 呜呼英锐气 又掩泉下土 我行田野间 陈迹时一覩 尚余旧题壁 犹有所畦圃 二儿吾未识 必有称家主 寥寥先友记 文缺久不补 渠如能缀缉 吾敢惮𫌨缕 但得行实完 虽迟不犹愈,"5,5,5,5,5,5,5,5,5,5,5,5,5,5,5,5,5,5,5,5,5,5,5,5,5,5,5,5",398d72781063fff6b345ab183b04523b,先君 捐馆 时 亲旧 止 四五 丁宁 奉 遗训 我 没 谁抚 汝 孤生卧 苫块 泣血 诵 此 语 杨公 十年 旧 不见 五年 许 两 萍 忽 相遇 握手 涕如雨 高怀 几 骨肉 老语 倾 肺腑 生死 见 交情 公固 不愧 古 呜呼 英 锐气 又 掩 泉下 土 我行 田野 间 陈迹 时一 覩 尚 余 旧 题壁 犹 有所 畦 圃 二儿 吾 未识 必 有 称 家主 寥寥 先友 记 文缺久不补 渠 如 能 缀 缉 吾 敢 惮 𫌨 缕 但 得行 实完 虽迟不犹愈
4d89d67e-1781-4e70-b47b-e83dcab8e827,赠萧希仁  其一,周孚,唐,诗,五言律诗,钟山昔游眺 苍翠莫崚嶒 不覩骑鲸像 空瞻下马陵 斯文今堕地 夫子独传灯 剩欲抠衣问 嗟予病未能,"5,5,5,5,5,5,5,5",b5a834538984701adf617d7d398aad0a,钟山 昔 游眺 苍翠 莫 崚嶒 不 覩 骑 鲸 像 空瞻 下马 陵 斯文 今 堕 地 夫子 独 传灯 剩欲抠衣问 嗟予 病 未能
fded45d9-6cf8-4339-8b0f-8fc9b2ed21fa,赠萧希仁  其二,周孚,唐,诗,五言律诗,赵子老岩壑 壮心轻世儒 曾无一湔祓 但看百喑呜 已作山头雀 谁怜屋上乌 知公主清议 试与一嘘枯,"5,5,5,5,5,5,5,5",0a790d2fbeba8f692cb4cd65fc11a100,赵子 老岩壑 壮心 轻世儒 曾 无 一 湔 祓 但 看百喑 呜 已 作 山头 雀 谁 怜 屋上乌 知 公主 清议 试 与 一 嘘 枯
3add5501-d756-4667-81bc-88e4fddbd53f,寄日新,周孚,唐,诗,七言绝句,楚水茫茫觌面难 燕鸿冉冉寄书还 自知荒泽谁为雨 却怪孤云未出山,"7,7,7,7",f31bc8c9ce4e440de93e6b3dd6bccffa,楚水 茫茫 觌 面 难 燕鸿 冉冉 寄书 还 自知 荒泽 谁 为 雨 却怪 孤云未 出山
77a65348-3056-400c-b2f0-61cb12be8781,病起次韵子和,周孚,唐,诗,七言律诗,不尽扬雄一鸱酒 却吟平子四愁诗 酒能作病终何益 诗解穷人亦漫为 便死正应如土偶 纵贫那可恨毛锥 如今只有荆卿在 能记田光少壮时,"7,7,7,7,7,7,7,7",5e6c2cd3501af98a37324c1270d5fee0,不尽 扬雄 一 鸱 酒 却 吟 平子 四 愁 诗 酒能 作病 终 何益 诗 解 穷人 亦 漫 为 便 死 正 应如 土偶 纵贫 那 可恨 毛 锥 如今 只有 荆卿 在 能记 田光 少壮 时
4c161572-5ab6-497b-9b68-10dcdfd73254,别闾丘诸公之临安,周孚,唐,诗,七言律诗,久耽笔砚弃犁锄 石友申申或骂予 涉世何殊枕中梦 误人今信案头书 不堪秋菊雕荒径 欲趁春帆返敝庐 回首交游幸无辱 蒯缑虽短不弹鱼,"7,7,7,7,7,7,7,7",8f7a95ead86521d6ca03ce936617d692,久 耽 笔砚 弃 犁锄 石友 申申 或 骂予 涉世 何殊 枕中 梦 误人 今 信 案头 书 不堪 秋菊雕 荒径 欲 趁春帆返敝庐 回首 交游 幸无辱 蒯 缑 虽 短 不 弹 鱼
0c1738fa-af35-409e-8115-3183b10fe682,别仲时  其一,周孚,唐,诗,五言绝句,江山共清焕 鱼鸟亦萧散 归与三亩园 趁此秋未晚,"5,5,5,5",6ed11f772d429d499663fac715bfad2c,江山 共 清 焕 鱼鸟 亦 萧散 归 与 三亩 园 趁此 秋 未晚
289c6a40-91b7-4d22-8f47-d4847e061c1a,别仲时  其二,周孚,唐,诗,五言绝句,当年丘壑心 皎皎秋夜月 那知蹭蹬间 秋风雕壮发,"5,5,5,5",98a12e1b5cd2d771fde356b869467b8e,当年 丘壑 心 皎皎 秋夜 月 那 知 蹭蹬 间 秋风 雕壮发
cbbf33ed-1195-4f1a-87a3-676d30361b46,别仲时  其三,周孚,唐,诗,五言绝句,童乌已黄土 其奈太玄何 尚喜熊儿在 能为田父歌,"5,5,5,5",4d2100aa56d177ec2dcc36d6bd8122b0,童乌 已 黄土 其 奈 太玄何 尚喜 熊儿 在 能 为 田 父歌
e52cbd92-5467-450e-9bf4-d2646083418d,别仲时  其四,周孚,唐,诗,五言绝句,窗隙风微度 簷头月半欹 当君感秋日 是我到家时,"5,5,5,5",001dba41fd123a7920ae9044dec8bc93,窗隙 风微度 簷 头 月 半 欹 当 君感 秋日 是 我 到 家 时
c1e5763c-e7c9-4e8f-a964-f1938dc4fb14,别仲时  其五,周孚,唐,诗,五言绝句,穷愁好著书 到此已绝笔 十年意外谤 庶可弭万一,"5,5,5,5",db9f9f5be907fdfba77e46f2d23a097f,穷愁 好 著书 到 此 已 绝笔 十年 意外 谤 庶可 弭 万一
