id,title,author,dynasty,genre,poem_type,sentences_simplified,meter_pattern,hash,words
8c205680-fd59-4887-afe8-8d38a48fcef3,次韵因老见赠,王之道,唐,诗,五言古体,扁舟历阳来 访君得少息 登堂默无语 见者称目击 去年糁江上 群盗罗剑戟 君时濡须游 入山笑相揖 肩担祖师禅 问答挥即栗 岂惟警聋瞆 亦足慰岑寂 春容褪丹青 雨意铺水墨 定将傥赴感 澄霁自端的 麦秋数日间 饥肠颇贪得 兵余敝庐尽 何独空四壁 维摩幸无恙 胡避有新室 白云夲无心 能归定能出 岿然三杰峰 况是旧相识 我有半仙丹 和剂等菖术 为言山中人 蟠桃已成实,"5,5,5,5,5,5,5,5,5,5,5,5,5,5,5,5,5,5,5,5,5,5,5,5,5,5,5,5,5,5",4275f79bb8ce0eb35bfc5e1dc86aecbf,扁舟 历阳 来 访 君 得 少息 登堂 默无语 见者 称 目击 去年 糁 江 上 群盗 罗 剑戟 君 时 濡 须 游 入山 笑 相揖 肩担 祖师 禅 问答 挥即栗 岂 惟警 聋 瞆 亦 足慰 岑寂 春容 褪 丹青 雨意 铺 水墨 定将 傥 赴 感 澄 霁 自 端的 麦秋 数日 间 饥肠 颇 贪得 兵余敝庐 尽 何独 空 四壁 维摩 幸 无恙 胡 避有 新室 白云 夲 无心 能 归定 能出 岿然 三杰 峰 况是 旧 相识 我 有 半 仙丹 和剂 等 菖术 为 言 山中 人 蟠桃 已成 实
2e9e6e81-cb04-4271-be47-121ff63cd258,信阳和同官喜雨韵,王之道,唐,诗,七言古体,欲识农夫田作苦 久雨祷晴晴祷雨 祷晴得雨雨得晴 此患到今传自古 苾芬非是萧兰馨 诚心一发通三灵 文昌俗吏亦何者 乃能致雨兴雷霆 尔来旱气爞爞热 夜望天涯电光掣 原田嘉谷半焦黄 何独枯鱼濡涸辙 忽然一雨洗瘴昬 珠玉无边难价论 坐令愁叹变欢抃 千岩万壑江流奔 从今不厌商羊舞 十日一犂均下土 漏邦寒俭酒味醨 且硙新茶其分乳 庭前花草还青葱 想见黍稌纷芄芄 吾君早晚复疆宇 屡丰将见追元丰 天人大扺常相即 人若必天天可必 愿修人事格天心 天若不从非所恤 泰亨自复先朋来 时通端不忧尘埃 新诗要非所宜辱 敢以木李酬琼瑰 六年无蓄号不足 菜色定应缘半菽 要令汸暴似海岳 岂但河沙论秉斛 炎天赫日当流金 去国多年思转深 只今淮北望霓切 须烦伊傅资商霖,"7,7,7,7,7,7,7,7,7,7,7,7,7,7,7,7,7,7,7,7,7,7,7,7,7,7,7,7,7,7,7,7,7,7,7,7,7,7,7,7",c23f3bf5ff8af9a01a9ad0af75df683b,欲识 农夫 田作 苦 久雨 祷 晴 晴 祷 雨 祷 晴 得 雨雨得晴 此 患 到 今 传 自古 苾 芬 非 是 萧 兰 馨 诚心 一发 通三灵 文昌 俗吏 亦 何者 乃能 致雨 兴 雷霆 尔 来 旱 气 爞 爞 热 夜望 天涯 电光 掣 原田 嘉谷 半 焦黄 何独 枯鱼 濡涸 辙 忽然 一 雨 洗瘴 昬 珠玉 无边 难 价论 坐令 愁 叹变 欢 抃 千岩万壑 江流 奔 从今 不厌 商羊 舞 十日 一 犂 均 下 土 漏邦 寒俭 酒味 醨 且 硙 新茶 其 分 乳 庭前 花草 还 青葱 想见 黍 稌 纷 芄 芄 吾 君 早晚 复疆宇 屡 丰 将 见 追 元丰 天 人大 扺 常 相 即 人 若 必 天天 可 必 愿修 人事 格 天心 天 若 不 从非 所恤 泰亨 自复先朋来 时通端 不忧 尘埃 新诗 要 非所宜 辱 敢 以 木李酬 琼瑰 六年 无 蓄号 不足 菜色 定应缘 半 菽 要 令 汸 暴 似 海 岳 岂但 河沙 论 秉 斛 炎天 赫日 当 流金 去 国 多年 思转 深 只今 淮北 望 霓切 须 烦 伊傅 资商 霖
0888dec3-f29a-452f-9c5b-5cfea28ac986,次韵子厚弟喜雨行赠赵守端质,王之道,唐,诗,七言古体,我生畏暑如畏焚 奈此岁旱风尘昏 十年废放卧岩壑 名虽八品身黎元 恒旸乞雨雨乞霁 雨转为淫旸转炽 不知此理果何如 每讶天心异人意 去年避地还家园 蒿莱满目高侵天 秋阳肆虐冬益甚 涉春陂泽皆平川 迩来焦稿遍区宇 黄金融液胶流弩 赵侯日为疲瘵忧 应怪鲁书三不雨 天人大抵常相资 顾我录录伤无奇 鬻浆苦凉屠苦热 敢望屏翳从招麾 圣主东巡群后觐 万里江淮方水运 折冲御侮赖亲贤 何独为霖福斯郡 精诚昭格吾谁欺 顷间祷雨人所知 忽然簷溜泻河汉 数声霹雳轰相随 公堂六月清无暑 旋硙龙团试分乳 官曹相贺复何言 且戒农夫筑场圃 小人托庇安村墟 获同野老歌而呼 愿公玉带悬金鱼 奉报得雨禾生稃 霏霏不厌沾衣裾 稍晴欲自躬犂锄 斯民食足吾其俱 何妨把酒仍观书,"7,7,7,7,7,7,7,7,7,7,7,7,7,7,7,7,7,7,7,7,7,7,7,7,7,7,7,7,7,7,7,7,7,7,7,7,7,7,7,7",0c60166fab015808882f5f524ff8270f,我 生畏 暑 如畏焚 奈 此 岁 旱 风尘 昏 十年 废放 卧岩 壑 名 虽 八品 身 黎元 恒 旸 乞雨雨乞 霁 雨 转为 淫 旸 转 炽 不知 此理 果 何如 每 讶 天心 异人 意 去年 避地 还 家园 蒿 莱 满目 高 侵 天 秋阳 肆虐 冬益 甚 涉 春 陂 泽 皆 平川 迩来 焦稿 遍 区宇 黄金 融液 胶流 弩 赵侯 日 为 疲 瘵 忧 应怪 鲁书 三不雨 天 人 大抵 常相资 顾 我 录录 伤无奇 鬻 浆 苦凉 屠苦 热 敢 望屏翳 从 招 麾 圣主 东巡群 后 觐 万里 江淮 方 水运 折冲御侮 赖亲贤 何独 为 霖 福斯 郡 精诚 昭格 吾 谁 欺 顷间 祷 雨 人 所知 忽然 簷 溜 泻 河汉 数声 霹雳 轰 相随 公堂 六月 清 无暑 旋 硙 龙 团 试 分 乳 官曹相 贺复何 言 且 戒 农夫 筑 场圃 小人 托庇 安 村墟 获同 野老 歌 而 呼 愿 公 玉带 悬 金鱼 奉 报得 雨禾生 稃 霏霏 不厌 沾衣 裾 稍 晴 欲 自 躬 犂 锄 斯 民食 足吾其俱 何妨 把酒 仍 观书
8537a069-f373-4a78-8360-c33f165d04b8,酬潘县尉,王之道,唐,诗,七言古体,尧明文采灿星宿 子全道义高金玉 伤哉二子不可见 墓上悲风号拱木 逢君论友话偶及 令我呑声为渠哭 因渠感君不我鄙 远寄锦囊诗一轴 有如贝阙罗珠玑 东攫西拏厌吾欲 又如康衢走骐骥 朝越暮燕惟尔逐 匹夫获罪坐怀璧 谁使夜光冲蔀屋 仲尼知本故称水 请看悬崖泻飞瀑 我从二子方弱冠 俛仰三终同转毂 壮年登第今已老 碌碌无奇堪齿录 羡君节操似松筠 雪里高标仍绝俗 已将义命等穷途 肯为身名强荣辱 高情慷慨怜衰晚 妙句纵横丐膏馥 开缄反复读数过 骨竦毛森头觳觫 施隆报蔑君勿诮 明月轻投得鱼目 人生遇合会有日 行矣鸣驺入空谷 燮调元化坐庙堂 长使斯民歌鼓腹,"7,7,7,7,7,7,7,7,7,7,7,7,7,7,7,7,7,7,7,7,7,7,7,7,7,7,7,7,7,7,7,7,7,7",94d3bb4ceaa4f58446e571cabf65bc81,尧 明 文采 灿 星宿 子 全 道义 高 金玉 伤哉 二子 不 可见 墓 上 悲风 号 拱木 逢 君 论友 话偶 及 令我 呑 声 为 渠 哭 因 渠感 君不我鄙 远 寄 锦囊 诗 一 轴 有如 贝阙罗 珠玑 东 攫西 拏 厌 吾 欲 又 如 康衢 走 骐骥 朝越 暮 燕惟尔 逐 匹夫 获罪 坐 怀璧 谁 使 夜光 冲 蔀 屋 仲尼 知本 故 称水 请 看 悬崖 泻 飞瀑 我 从 二子 方弱冠 俛 仰 三 终 同 转 毂 壮年 登第 今 已 老 碌碌无奇 堪 齿录 羡 君 节操 似 松筠 雪里 高标 仍 绝俗 已将 义命 等 穷途 肯为 身名 强 荣辱 高情 慷慨 怜 衰 晚 妙句 纵横 丐 膏 馥 开 缄 反复 读数 过 骨 竦 毛 森头 觳觫 施隆 报蔑 君 勿 诮 明月 轻 投 得 鱼目 人生 遇合 会 有 日 行 矣 鸣 驺 入 空谷 燮 调元化 坐 庙堂 长 使 斯 民歌 鼓腹
d8e8bc02-387b-4f32-88c4-45431330de3b,赠淮西运干徐伯远,王之道,唐,诗,七言古体,嗟予偃伏淮南村 十年不践公侯门 谁令金印入魂梦 平章六字承君恩 左手人头右手印 此理未可轻易论 丈夫盖棺事始定 擒戎会使来称藩 争如徐子擅骚雅 笔力豪纵今文园 杨君收印六十载 细观制作同新翻 为言常侍故家物 其先得自南昌潘 珠还合浦有时节 余庆未艾钟仍昆 子今得之类摘鹊 此贶重可轻玙璠 便当凖拟佩三印 并与文安遗子孙,"7,7,7,7,7,7,7,7,7,7,7,7,7,7,7,7,7,7,7,7",c3fb2ac758c4a039cbb0a20d22ec6127,嗟予 偃伏 淮南 村 十年 不践 公侯 门 谁 令 金印 入 魂 梦 平章 六 字 承君恩 左手 人头 右手 印 此理 未 可 轻易 论 丈夫 盖棺 事 始定 擒 戎 会 使来 称 藩 争如 徐子 擅 骚 雅 笔力 豪纵 今文 园 杨君 收印 六十 载 细观 制作 同新 翻 为 言 常侍 故 家物 其 先 得 自 南昌 潘 珠 还 合浦 有 时节 余庆 未 艾钟 仍 昆 子 今 得 之类 摘 鹊 此 贶 重 可 轻 玙 璠 便当 凖 拟 佩 三 印 并 与 文安 遗 子孙
bee06c9b-e71b-4b0c-b024-cd278a940f36,和王觉民梅花诗,王之道,唐,诗,七言古体,梅花似是东君客 漏泄春风犯寒坼 冰肌玉骨照双泉 应为孤根借泉脉 先生狂得次公醒 诗思蔼蔼飘晴云 为怜老拙有旧分 俾预胜赏沾清芬 我时被酒酒初透 香扑鼻端曾一嗅 别来飞雪往未能 想见精神愈高痩 西湖处士真诗仙 东坡老人所推先 岂知此花自奇绝 神助妙语相争妍 浪言投李报琼玖 牛后何如作鸡口 我今无物报投琼 木李虽轻聊借手 先生标致良可人 此诗不减花娉婷 相当欹枕初得句 夜兴冠坐如惊霆 愿君追作淮夷雅 换取公卿重文价 嗟予衰矣不复论 但欲高门容驷马,"7,7,7,7,7,7,7,7,7,7,7,7,7,7,7,7,7,7,7,7,7,7,7,7,7,7,7,7",fa5d52ba5d310ef58b414bdc14b51ef6,梅花 似 是 东君 客 漏泄 春风 犯 寒 坼 冰肌玉骨 照 双泉 应为 孤 根借 泉脉 先生 狂 得 次 公醒 诗思 蔼蔼 飘晴云 为怜 老拙 有旧 分 俾 预胜 赏 沾 清芬 我时 被 酒酒 初 透 香 扑鼻 端 曾 一 嗅 别 来 飞雪 往 未能 想见 精神 愈 高 痩 西湖 处士 真 诗仙 东坡 老人 所 推先 岂知 此 花 自 奇绝 神助 妙语 相 争妍 浪言 投 李报琼 玖 牛后 何如 作鸡口 我 今 无物 报 投琼 木李 虽 轻聊 借手 先生 标致 良 可 人 此 诗 不减 花 娉婷 相当 欹 枕 初得 句 夜兴冠 坐如惊霆 愿君 追作 淮夷 雅 换取 公卿 重 文价 嗟予 衰 矣 不 复论 但 欲 高 门容 驷马
c24f3fb0-291a-4f22-bdfe-b34b25ce3c77,沈汤辅隠轩诗,王之道,唐,诗,七言古体,小隠山林大朝市 夫子命轩良有意 仕途捷径固无取 泉石膏肓亦犹次 不知朝隠谁得之 我恐曼倩为近似 公卿百执各有职 岂容妄隠但充位 古人禄仕所不免 意在全身近于智 庄周梅福此其流 吏隠之名可无愧 沈君有弟今休文 咳唾成章数千字 耻从举子事进取 逸韵高情寓吟醉 乃兄宦达方强仕 翠竹停鸾想风致 君侯才业伯仲间 退以求名名亦遂 方今尧舜理四海 岩穴弹冠求自试 朝廷既治群吏肃 何处堪为隠者地 不如市隠最得策 大胜山林自憔悴 花源缭绕转红绿 竹洞深沉入幽邃 我闻此风颇健羡 图成未可日月冀 他时傥作江西游 兄曰能来访予季,"7,7,7,7,7,7,7,7,7,7,7,7,7,7,7,7,7,7,7,7,7,7,7,7,7,7,7,7,7,7,7,7",c022f671853bafff56bdb3c8ceea2ed2,小 隠 山林 大朝 市 夫子 命 轩良 有意 仕途 捷径 固无 取 泉石膏肓 亦 犹次 不知 朝 隠 谁 得 之 我 恐 曼倩 为 近似 公卿 百 执 各 有 职 岂容 妄 隠 但 充 位 古人 禄仕 所 不免 意在 全身 近于 智 庄周 梅福 此其 流 吏 隠 之 名 可 无愧 沈君 有 弟 今 休 文 咳 唾 成章 数千 字 耻 从 举子 事 进取 逸 韵 高 情寓 吟醉 乃兄 宦达方 强 仕 翠竹 停 鸾 想 风致 君侯 才业 伯仲 间 退 以求 名名 亦 遂 方 今 尧舜 理 四海 岩穴 弹 冠求 自试 朝廷 既 治 群 吏 肃 何处 堪 为 隠 者 地 不如 市 隠 最 得 策 大胜 山林 自 憔悴 花源 缭绕 转 红绿 竹洞 深沉 入 幽邃 我 闻 此风 颇 健羡 图成 未 可 日月 冀 他 时 傥 作 江西 游 兄 曰 能 来访 予 季
cd18d1f1-b01e-4c74-8dcd-ef8ed9f86ddd,大梁食李有感呈彦时兄,王之道,唐,诗,七言古体,葵花已过荷花繁 南风入户清而温 担头有李初入眼 令人引脰怀家园 三年为客在两处 李熟未果登清樽 翻思整冠诚可乐 何苦鑚核辄不存 急宜买冰致凝凛 全胜汲井供潺湲 小床方簟嚼春雪 一实自可轻玙璠 扁舟行逐东南奔 回首稻粱江上村 相欢孰若弟与昆 古来唱和须箎埙,"7,7,7,7,7,7,7,7,7,7,7,7,7,7,7,7",c6d37614679dd5992dfdc38ed3bae0be,葵花 已 过 荷花 繁 南风 入户 清 而 温 担头 有 李初 入眼 令人 引 脰 怀 家园 三年 为 客 在 两处 李熟 未果 登清 樽 翻思整冠诚 可乐 何苦 鑚 核 辄 不 存 急 宜 买 冰致凝凛 全胜 汲井 供 潺湲 小床 方 簟 嚼 春雪 一实 自可 轻 玙 璠 扁舟 行 逐 东南 奔 回首 稻粱 江上 村 相欢 孰若 弟 与 昆 古来 唱和 须 箎 埙
a36ef1af-3018-4e75-82f3-0f92bb36106a,用子蔺韵赋九日小酌,王之道,唐,诗,七言古体,春日归来忽重九 潦旱相仍岁无有 庭前岩桂独青青 此意于人亦良厚 欲酬佳节拚一醉 会有白衣来送酒 须臾殽核第罗列 无蟹犹空把螯手 坐来灵雨洒珠玑 洗出湖山竞高秀 三公在望无百里 咫尺银屏拥其后 长篇落纸箭离筈 大白浮醪簷注溜 细看黄菊与红茱 想像年时还话旧 登高何必须人扶 我有笻杖颇坚痩 明朝写出醉中语 牵帅不知谁唱首,"7,7,7,7,7,7,7,7,7,7,7,7,7,7,7,7,7,7,7,7",f735d8dd0ce1a3098d176d3c10679cab,春日 归来 忽 重九 潦 旱相 仍 岁 无有 庭前 岩 桂独 青青 此 意于 人 亦 良厚 欲酬 佳节 拚一 醉 会 有 白衣 来 送 酒 须臾 殽 核 第 罗列 无蟹犹空 把 螯 手 坐来 灵雨洒 珠玑 洗出 湖山 竞 高秀 三公 在 望无 百里 咫尺 银屏 拥 其后 长篇 落 纸 箭 离 筈 大白 浮 醪簷 注溜 细看 黄菊 与 红茱 想像 年时 还 话旧 登高 何 必须 人 扶 我 有 笻 杖 颇 坚 痩 明朝 写出 醉 中语 牵帅 不知 谁 唱 首
91d8b41c-8117-4117-84f8-08abc15c6a13,春晚书怀,王之道,唐,诗,七言古体,十年萍梗三到吴 走俗未暇观西湖 是行信步至湖上 水光山色开天壶 游人杂遝半罗绮 一径不惮穿云纡 归来神思顿清发 诗中写出钱塘图 张侯妙语何所似 青玉为案黄金铺 要当聨辔事幽讨 邂逅得句相招呼 东坡已死不可作 因君对景还嗟吁 水仙配食竟莫举 但见旧隠环菰蒲 山间有寺过三百 终期徧走参能儒 还家儿辈若问我 庶免不知空嗫嚅,"7,7,7,7,7,7,7,7,7,7,7,7,7,7,7,7,7,7,7,7",119ddf26e5785ebc6f7d1d526898ca96,十年 萍 梗 三 到 吴 走俗 未暇 观 西湖 是 行 信步 至 湖上 水光山色 开 天壶 游人 杂 遝 半 罗绮 一 径 不惮 穿 云 纡 归来 神思 顿 清 发 诗 中 写出 钱塘 图 张侯 妙语 何 所似 青玉 为 案 黄金 铺 要当聨辔 事 幽 讨 邂逅 得 句 相 招呼 东坡 已 死 不可 作 因 君对景 还 嗟吁 水仙 配食 竟莫 举 但 见 旧 隠 环 菰 蒲 山间 有 寺 过 三百 终期 徧 走 参 能 儒 还 家 儿辈 若 问 我 庶免 不知 空 嗫嚅
d07728b5-f08c-4d39-8365-5853fb29f73a,和刘春卿夏日闵旱次韵,王之道,唐,诗,七言古体,何人夜作秋虫号 吟诗坐对山月高 想当龙门夺锦袍 从臣拱手看挥毫 衡茅咫尺临江皋 浮光灔灔翻金涛 满帆何处乘风艘 千山过眼同奔逃 不防鲙鲤兼炰羔 酒酣起舞如飞猱 醉中往往笑成咷 一时辈流籍湜翺 嗟予蹇剥意欎陶 七年坐困山林牢 迩来天旱地不毛 釡鱼薪蚁何嗷嗷 谁能读诗夜焚膏 只益心蓬增目蒿 丈人纯白羞桔橰 终日抱瓮忘其劳 今春属国纷旗旄 两淮供亿争鸣鼛 干戈载戢弓其弢 此行辅弼环萧曹 藁街伫见悬酋豪 买牛卖剑犊卖刀 我虽不饮当漱醪 堆盘况有瑶池桃 鹿鸣会赋嘉宾敖 予衰尚可追风骚,"7,7,7,7,7,7,7,7,7,7,7,7,7,7,7,7,7,7,7,7,7,7,7,7,7,7,7,7,7,7",975744e33a745cbca7110a9206839ff2,何人 夜作 秋虫 号 吟诗 坐 对 山 月 高 想 当 龙门 夺 锦袍 从 臣 拱手 看 挥毫 衡茅 咫尺 临江 皋 浮光 灔 灔 翻 金 涛 满帆 何处 乘风 艘 千山 过眼 同 奔逃 不 防 鲙 鲤 兼 炰 羔 酒 酣 起舞 如 飞 猱 醉 中 往往 笑 成 咷 一时 辈流 籍 湜 翺 嗟予 蹇 剥 意 欎 陶 七年 坐困 山林 牢 迩来 天 旱地 不 毛 釡 鱼 薪 蚁 何 嗷嗷 谁 能 读诗 夜 焚 膏 只益 心蓬增目 蒿 丈人 纯白 羞 桔 橰 终日 抱 瓮忘其劳 今春 属国 纷旗旄 两淮 供 亿 争鸣 鼛 干戈 载 戢 弓其 弢 此行 辅弼 环 萧 曹 藁街 伫见 悬 酋豪 买牛卖剑 犊 卖 刀 我 虽 不 饮当漱 醪 堆盘况 有 瑶池 桃 鹿鸣 会 赋 嘉宾 敖 予 衰 尚可 追 风骚
8de845b2-1fab-467c-ab9c-18c6a1fd988d,过集湖德济庙用赵尉廉留题韵示周钦夫程彦游,王之道,唐,诗,七言古体,秋阳泛泛流清晖 帆腹不张旗脚垂 灵祠轮奂湖之麋 水天一色成玻瓈 西轩爽垲高不危 凭栏下瞰群山卑 鬼神亮我心无欺 风涛纵险夫何疑 区区奔走劳驱驰 和光未免世俗随 相逢一笑聊伸眉 明朝掺袂还东之 萧曹有节未见奇 往往樵牧相鄙夷 吾生倾否会有时 穷愁过眼无足悲,"7,7,7,7,7,7,7,7,7,7,7,7,7,7,7,7",2b905440ae67b4ce71202fc2879dbce1,秋阳 泛泛 流 清晖 帆腹 不张 旗脚 垂 灵祠 轮 奂 湖 之 麋 水天一色 成玻 瓈 西轩 爽 垲 高 不 危 凭栏 下瞰 群山 卑 鬼神 亮 我心 无欺 风涛 纵险 夫 何疑 区区 奔走 劳 驱驰 和 光 未免 世俗 随 相逢 一 笑 聊伸 眉 明朝 掺 袂 还 东之 萧 曹 有 节 未 见 奇 往往 樵牧相 鄙夷 吾 生倾否 会 有时 穷愁 过眼 无足悲
75a23cd6-896d-4661-852c-402d94d54a30,次韵张文伯喜雨,王之道,唐,诗,七言古体,新诗句句堪流传 令人读之神凛然 孟君已死不可见 如公笔力今无前 天生百谷养万姓 暄润稍阙功难全 江城秋旱望一溉 斯民穷极伊谁怜 滂沱忽澍三尺雨 稿苗厌厌藨緜緜 不知何以遽得此 有贤太守方承宣 焚香默祷辞未绝 精诚已格高高天 油云垂布若可揽 沾濡车盖初言旋 西成指日多黍稌 颂歌未负赓丰年 豚蹄盂酒谢神贶 鼓腹一笑非予偏,"7,7,7,7,7,7,7,7,7,7,7,7,7,7,7,7,7,7,7,7",ece0cf3dd96422b7910b075d9fc86848,新诗 句句 堪 流传 令人 读 之 神 凛然 孟君 已 死 不 可见 如 公 笔力 今 无前 天生 百谷 养万姓 暄 润 稍 阙 功难 全 江城 秋旱望 一溉 斯民 穷极 伊 谁怜 滂沱 忽 澍 三尺 雨 稿苗 厌厌 藨 緜 緜 不知 何以 遽得此 有 贤 太守 方承宣 焚香 默祷 辞 未绝 精诚 已格 高高 天 油云 垂布 若 可揽 沾濡 车盖 初言 旋 西成指 日 多 黍 稌 颂歌 未 负 赓 丰年 豚蹄盂 酒 谢神贶 鼓腹 一 笑非 予 偏
59ed6f37-a7a7-45bd-a0fc-34a98bb2e317,和董令升喜雨用前韵,王之道,唐,诗,七言古体,夜听簷声翻急雨 想见膏润均率土 先生休戚共斯民 忧在惔焚非惮暑 人情类被饥所移 我尔相忘自甘苦 宁从祷旱身暴日 肯对驱蝗歌侑俎 用心何独追老杜 大庇寒儒欢广宇 要令匹夫被惠泽 上致吾君尧舜数 嗟予粪朽伏邱壑 尺短寸长无足取 洊蒙珠玉过称扬 丈夫殆以气相许,"7,7,7,7,7,7,7,7,7,7,7,7,7,7,7,7",5fb9f4a8b101a13a63dff46d4348b386,夜听簷声翻急雨 想见 膏润 均 率 土 先生 休戚 共斯民 忧 在 惔 焚 非 惮 暑 人情 类 被 饥所移 我 尔 相忘 自 甘苦 宁 从 祷 旱 身暴 日 肯对 驱蝗 歌 侑 俎 用心 何独 追 老 杜 大 庇 寒儒欢 广宇 要 令 匹夫 被 惠泽 上致 吾 君 尧舜 数 嗟予 粪朽 伏邱壑 尺短寸长 无 足取 洊 蒙 珠玉 过 称扬 丈夫 殆以 气相 许
26341e48-4435-4a78-bd74-049c2decd330,次韵毕少董游西湖,王之道,唐,诗,七言古体,西湖春晚未全热 湖上山光互明灭 往来冠盖竞骈阗 断续笙箫共伊咽 我怜湖山山见怜 波间涌出佳人钿 太真一去不复返 圆荷万点臙脂钱 船头美眄珠的皪 不必洞房深处覔 忽然相值更相呼 嫩蓝衫子山争碧 肠断骚人一轴诗 细看烟柳想腰肢 明年我亦西湖去 迟日光风二月时,"7,7,7,7,7,7,7,7,7,7,7,7,7,7,7,7",b3f5399b62099762af51748aaf8451fc,西湖 春晚 未 全 热 湖 上山 光互 明灭 往来 冠盖 竞 骈阗 断续 笙箫 共 伊咽 我 怜 湖山山 见怜 波间 涌出 佳人 钿 太真 一去不复返 圆荷 万点 臙脂 钱 船头 美 眄 珠 的 皪 不必 洞房 深处 覔 忽然 相值 更 相呼 嫩 蓝衫子 山争 碧 肠断 骚人 一 轴 诗 细看 烟柳 想 腰肢 明年 我 亦 西湖 去 迟 日光 风 二月 时
6d13f08a-75a2-4970-95af-bfec84895b2c,西湖游次韵赵见烛,王之道,唐,诗,七言古体,山镇在越泽在吴 东南形势凭江湖 不知弱水竟何处 恍若员峤连方壶 海门潮至飞雪涌 天竺雨过遥青纡 十年不见看愈好 正复妙笔那能图 苍松揺风翠盖偃 芳草藉地柔茵铺 僧舍朝游恣登览 酒楼夕醉争歌呼 朅来俛仰春又晓 对花无语空长吁 作诗既非拙者事 强欲写书编泽蒲 伟哉得志佐明主 进退百辟称鸿儒 应怜伺候奔走辈 终日趦趄仍嗫嚅,"7,7,7,7,7,7,7,7,7,7,7,7,7,7,7,7,7,7,7,7",3c451b43a41999d2f39f6b5d5ae0c9b1,山镇 在 越泽 在 吴 东南 形势 凭 江湖 不知 弱水 竟 何处 恍若 员峤 连 方壶 海门 潮 至 飞雪 涌 天竺 雨 过 遥 青 纡 十年 不见 看 愈好 正复 妙笔 那 能 图 苍松 揺 风 翠 盖偃 芳草 藉 地 柔 茵 铺 僧舍 朝游 恣登览 酒楼 夕醉争歌呼 朅 来 俛 仰 春 又 晓 对 花无语 空长吁 作诗 既 非 拙 者 事 强 欲 写 书 编泽 蒲 伟哉 得志 佐 明主 进退 百 辟 称 鸿儒 应怜 伺候 奔走 辈 终日 趦 趄 仍 嗫嚅
62115d75-3847-4b93-807d-c98f17ad45ac,天宝歌和魏定公文次韵,王之道,唐,诗,七言古体,连昌宫中马为乐 一时舞马黄金络 君王养欲臣养文 忠鲠漫多宁救药 嗷嗷万国风中船 樯倾柂坏夫何言 潼闗莫拒范阳贼 伤哉天廐空连钱 翠华西去遥指蜀 应念霓裳旧家曲 六军敢怒谁敢呵 马足空污太真肉 始皇布漆徒坚城 元海斩木徒轻兵 驱鱼驱雀强鹯獭 乃使后世蒙佳声 乱离每忆升平日 忽对新诗重嗟泣 望仙花草自春秋 怊怅六龙归未得,"7,7,7,7,7,7,7,7,7,7,7,7,7,7,7,7,7,7,7,7",30b2d58d8a7b555c3d76f39ff2e1bee9,连昌宫 中马 为 乐 一时 舞马 黄金 络 君王 养欲臣 养文 忠鲠漫 多宁 救药 嗷嗷 万国 风 中 船 樯 倾 柂 坏 夫 何 言 潼 闗 莫 拒 范 阳 贼 伤哉 天 廐 空 连 钱 翠 华西 去 遥指 蜀 应念 霓裳 旧 家曲 六 军 敢 怒 谁 敢 呵 马足空 污太 真肉 始皇 布漆 徒 坚城 元 海 斩 木徒 轻兵 驱 鱼 驱 雀 强 鹯 獭 乃使 后世 蒙佳声 乱离 每 忆升 平日 忽对 新诗 重 嗟泣 望仙 花草 自 春秋 怊 怅六龙归 未 得
4674eadf-7779-4528-b233-a1b8eb1baf92,和江和仲司理喜雨,王之道,唐,诗,七言古体,天怜辙鲋嘘残湿 震奋雷霆起幽蛰 清风入夜送雨来 大慰焦枯望霓急 新诗如雨雨未休 相对自可忘为忧 东皋秋稔想多秫 预期剧饮无论筹 老蟾宿毕君知否 欲烦更问东家丘 我今已具西归舟 会见扶桑升赤虬,"7,7,7,7,7,7,7,7,7,7,7,7",29e62f1452c366ddd27815db181b9396,天怜辙 鲋 嘘 残湿 震奋 雷霆 起 幽 蛰 清风 入夜 送 雨来 大慰 焦枯 望霓 急 新诗 如雨雨未休 相对 自可忘为忧 东皋 秋 稔 想 多 秫 预期 剧饮 无论 筹 老蟾 宿毕君 知否 欲 烦 更 问 东家 丘 我 今 已 具 西归舟 会见 扶桑 升 赤 虬
f50e4830-c5fa-4ffb-b4c0-69404cd3d84a,鹿泉居士王觉民颇有杜子美不彻之恼和东坡忆梅韵箴其膏肓,王之道,唐,诗,七言古体,鹿泉居士身若槁 不惯看花梦颠倒 桐庐有客燕新昬 妄托娇痴重伊恼 冻云垂地雪欲落 断雁呌群天尚早 一枝何处寄春来 便觉寒窗自华好 琼瑶万里眼界净 咫尺前村莫轻扫 留将青女伴孤芳 长向茅斋照衰老 先生才思老不进 寤寐池塘见春草 对花酌酒祝东君 烦把穷通问苍昊,"7,7,7,7,7,7,7,7,7,7,7,7,7,7,7,7",50b8acc139ed9ba38b0adfe014b8743d,鹿泉 居士 身若槁 不惯 看 花梦 颠倒 桐庐 有 客 燕 新 昬 妄托 娇痴 重 伊 恼 冻云 垂地雪欲落 断 雁 呌 群 天 尚 早 一枝 何处 寄 春来 便 觉 寒窗 自 华 好 琼瑶 万里 眼界 净 咫尺 前村 莫轻 扫 留 将 青 女伴 孤芳 长 向 茅斋 照 衰老 先生 才思 老 不 进 寤寐 池塘 见 春草 对 花 酌酒 祝 东君 烦 把 穷通 问 苍昊
ed156827-82e7-4188-8ed3-fbf02b60c20c,次韵胡德辉松轩时乞兵戍淮,王之道,唐,诗,杂言,伐蛟生得须髯苍 隠然为屋分三梁 广寒恍若东西厢 清风入座衣披猖 萧萧终日声奏篁 一洗郑衞无伊凉 嗟予顽钝铁石肠 时危命蹇甘皇皇 江城正苦夏烈日 淮甸已惧秋飞霜 绿尊翠杓且径醉 喜与夫子参翺翔 平生邱壑老增剧 梦想朝露珠玑香 何时元戎北渡森旗章 料敌制胜一一尽所长 鸡群野鹤看昂昂,"7,7,7,7,7,7,7,7,7,7,7,7,7,7,9,9,7",6e70198a97fd536161ff2326e0dc9337,伐 蛟 生 得 须髯苍 隠 然 为 屋 分 三 梁 广寒 恍若 东西 厢 清风 入座 衣披 猖 萧萧 终日 声 奏 篁 一 洗 郑 衞 无 伊 凉 嗟予 顽钝 铁石 肠 时 危命 蹇 甘 皇皇 江城 正 苦夏 烈日 淮甸 已 惧 秋飞霜 绿尊翠 杓 且 径 醉 喜 与 夫子 参 翺 翔 平生 邱壑老 增剧 梦想 朝露 珠玑 香 何时 元戎 北渡森 旗章 料敌制胜 一一 尽 所长 鸡群 野鹤 看 昂昂
