id,title,author,dynasty,genre,poem_type,sentences_simplified,meter_pattern,hash,words
ff5440c2-4175-45c1-8741-7be6c8ad8ca1,王质过洞庭,张经,宋,诗,五言律诗,云可有无水 风能奔走沙 蟠深鸣老𧌑 飞倦落长鸦 地有湘头尾 山无楚正斜 人间与天上 何处碍浮槎,"5,5,5,5,5,5,5,5",198c6f54ee629721127c93e619632ab0,云 可有 无水 风能 奔走 沙 蟠 深鸣 老 𧌑 飞倦 落长 鸦 地 有 湘 头尾 山 无楚正斜 人间 与 天上 何处 碍 浮 槎
fba9e7cf-53ff-4e37-b0b3-45e448342983,飞来山,安稹,宋,诗,七言律诗,升山游罢到贤沙 松桧阴中一境赊 自愧簪缨趋仕路 翻怜泉石属僧家 寻穷越国真仙迹 见尽闽封好物华 幸接凭熊拥千骑 红旌归去照残霞,"7,7,7,7,7,7,7,7",9a56cb48ba3bcc33ae0afc8740890b21,升 山游 罢到 贤沙 松桧 阴中 一境 赊 自愧 簪缨 趋仕 路 翻怜 泉石 属 僧家 寻 穷 越国 真仙迹 见 尽 闽 封 好 物华 幸接 凭 熊拥千 骑 红 旌 归去 照 残霞
3294607d-6d3c-4814-a226-1590143032f7,句,汤夏,宋,诗,五言古体,浄瓶常带水 破衲任生尘,"5,5",c70dc5248ca6046792b73cdfa84b5f2d,浄 瓶 常 带 水 破衲任 生尘
60aa7ce9-7d0d-4631-9636-17dd9b2e8fdf,启至大寨闻擒鬼章捷书上奏喜而为诗,王纯臣,宋,诗,七言绝句,黄城匹马捷音来 且喜洮东破虏回 纵使淮西功第一 未闻生缚七渠魁,"7,7,7,7",44feee9e6ac1ec2462c98f44d281fe54,黄城 匹马 捷音 来 且 喜 洮东 破虏 回 纵使 淮西 功 第一 未闻 生缚 七 渠魁
f54be5b8-6f98-4dde-8f2b-a5cddb097bc7,和王纯臣启至大寨闻擒鬼章捷书上奏喜而为诗,刘禹卿,宋,诗,七言绝句,英主龙飞嗣位来 洮东首奏捷师回 若评后圣勋臣序 功占凌烟第一魁,"7,7,7,7",ab130e147e06b144313c8ed6d33b6568,英主 龙飞 嗣位 来 洮 东首 奏捷 师 回 若 评后 圣勋 臣序 功 占 凌烟 第一 魁
f9d35b14-e8d8-4363-ae1b-eebf74344a6c,行至龙门先寄尧夫先生,李复圭,宋,诗,七言绝句,碧洛青嵩刮眼明 马头次第似相迎 天街高士还知否 好约南轩醉一觥,"7,7,7,7",dc84e1b5284d080e31f6941d11ec0dca,碧洛青 嵩 刮 眼明 马头 次第 似 相迎 天街 高士 还 知否 好 约 南轩 醉 一 觥
716510d2-9b3d-4e4a-8eb0-ffbbecc8d484,石桥,李复圭,宋,诗,七言律诗,石梁嵲屼据山流 异迹尝闻记道猷 五百真如谁化灭 三千色界妄探求 灯龛焰古长年在 茗盏花浓继日浮 静境少留尘虑息 松风萧飒又惊秋,"7,7,7,7,7,7,7,7",b4f2a81bc9fb5fa52bd28e23c53a797e,石 梁 嵲 屼 据 山 流 异迹尝闻 记道 猷 五百 真 如 谁 化灭 三千 色界 妄 探求 灯龛 焰古 长年 在 茗 盏 花 浓 继 日 浮 静境 少留 尘虑息 松风 萧飒 又 惊 秋
2afb6bb0-be89-4aac-9be3-9f0443c929df,先照亭,李复圭,宋,诗,七言律诗,危梁上下庆云端 禅刹翚飞插翠峦 华藏贝多缄秘典 香厨莆塞供珍餐 回廊跨壑千重峻 悬溜当空六月寒 盘礴迥知灵秀境 极高方见地形宽,"7,7,7,7,7,7,7,7",6c26c5a2edf3a718e769845b3413ee0e,危梁 上下 庆 云端 禅 刹 翚 飞 插 翠 峦 华藏 贝多 缄 秘典 香厨 莆塞 供珍餐 回廊 跨壑 千重 峻 悬 溜 当空 六月 寒 盘礴 迥知灵秀 境 极 高 方见 地形 宽
5ac8ecdf-bad0-4ecb-b7ab-67e32eda4fe1,秀峰上方,李复圭,宋,诗,七言绝句,吴王昔日馆娃宫 殿阁鳞差轶碧空 寂寂香魂招不得 惟余松柏韵天风,"7,7,7,7",f7a8650bb38ef2444376aa67bf6b9ade,吴王 昔日 馆 娃 宫 殿阁 鳞差 轶 碧空 寂寂 香魂 招 不得 惟余 松柏 韵 天 风
bb1241dc-1db2-4f92-a363-f87abfd46dc4,句,李复圭,宋,诗,七言古体,老凤池边蹲不去 饥乌台上噤无声,"7,7",01d0bb4ade8a74ee4db12963df01d59a,老凤 池边 蹲 不 去 饥 乌 台上 噤 无声
36663058-1b72-47d8-a106-a361062b0937,题西岩寺三绝  其一,裴大亮,宋,诗,七言绝句,清溪如鉴照行人 谷鸟山花景渐新 五马频来无别事 为思江上若邪春,"7,7,7,7",31f1e5468480bedd1488172721c3fa9f,清溪 如 鉴照 行人 谷鸟 山花 景 渐新 五马 频来 无别 事 为 思江 上 若 邪 春
0ef55aa7-c0ee-4863-9bc4-e97fd826a1df,题西岩寺三绝  其二,裴大亮,宋,诗,七言绝句,几领笙歌来赏胜 为怜山水每忘归 洞中时与林僧语 不信红尘有是非,"7,7,7,7",9d237ab6d1650899a7fa20df29e98a44,几 领 笙歌 来赏 胜 为怜 山水 每 忘归 洞 中 时 与 林僧语 不 信 红尘 有 是非
02ad561e-8837-48f1-89c5-67357e633979,题西岩寺三绝  其三,裴大亮,宋,诗,七言绝句,□□□□送行人 山水清音益怆神 莫惜少留题石□ □□□□□红尘,"7,7,7,7",3ac8286193e3b055cec67d9deb6cbb8c,□ □ □ □ 送行人 山水 清音 益 怆 神 莫惜 少留 题石 □ □ □ □ □ □ 红尘
15475443-7755-43ad-96ad-21dcb93c55a3,广慧教寺,裴大亮,宋,诗,七言绝句,政余飞棹入烟村 数里菰蒲接寺门 惟爱弁峰供醉眼 役人诗思到黄昏,"7,7,7,7",7578aa9304a0a85950476489ba731180,政余 飞 棹 入 烟村 数里 菰 蒲 接 寺 门 惟 爱 弁 峰 供 醉眼 役 人 诗思 到 黄昏
1d1c85e1-0b73-4bac-98c0-c9e39d00c8e6,游安乐山,鲁某,宋,诗,五言绝句,苔径傍岩斜 林间是道家 夜潭鱼戏月 春地鹿眠花,"5,5,5,5",9d3c2d1c391504d1d1691afb523d33f2,苔径 傍 岩 斜 林间 是 道家 夜 潭 鱼 戏 月 春地 鹿眠花
560f28bf-fa9c-4d2c-8db8-4039d7ab1d00,百丈甘,鲁某,宋,诗,七言绝句,碧玉纤纤百丈高 仙家曾用酝香醪 至今绿叶挼成酒 不使刘伶更藉糟,"7,7,7,7",29e1d179399e0ccef5821fa5a476d57b,碧玉 纤纤 百丈 高 仙家 曾 用 酝香 醪 至今 绿叶 挼 成 酒 不使 刘 伶更藉 糟
14a0fb01-447f-48fc-a886-a3db5f61aa2e,句  其一,鲁某,宋,诗,七言古体,锦步斜开四十里,7,06d31b1147385d2756355d38b43dc53b,锦步 斜 开 四十里
7492ecbb-feef-422d-9308-f0621a419648,句  其二,鲁某,宋,诗,七言古体,万仞青崖碧玉寒 岩萝相引彻仙坛,"7,7",deafeb2dd59069f2da4c604d4275aec2,万仞青 崖 碧玉 寒 岩萝相 引彻 仙坛
98ef71b0-532f-4491-893b-462fdb24782d,句  其三,鲁某,宋,诗,七言古体,一条仙帔织青霓 松雪岩前伴鹤栖,"7,7",698e21c7df892e9447322285d4ec20ed,一条 仙 帔 织 青 霓 松雪 岩前 伴 鹤 栖
fe4ed788-3923-4446-b08f-2e22bfc1a13a,食粥歌,朱申,宋,诗,杂言,龙平江水清洋洋 尉山高兮秋叶黄 钓翁落落兮栖山房 偕室人兮甘糟糠 丈夫壮图兮在四方 道岂终穷兮业不彰 刍荛有谋兮怀庙堂 一言而兴兮悟君王 荣禄不计兮德有常 𫗴粥供飧兮何可忘,"7,7,8,7,8,8,8,8,8,8",30b5b4cfe095a82f29c97bf7ac9fbe09,龙平 江水 清 洋洋 尉山 高 兮 秋叶 黄 钓翁 落落 兮 栖 山房 偕 室 人 兮 甘 糟糠 丈夫 壮图 兮 在 四方 道 岂终 穷兮业 不彰 刍荛 有谋兮怀 庙堂 一言而兴兮 悟 君王 荣禄 不计 兮 德 有常 𫗴 粥 供 飧 兮 何 可 忘
70550c9f-d055-48d2-af70-f330f08593dc,题棋山,徐俛,宋,诗,七言绝句,风驭云转□渺茫 石奇松老尚苍苍 留题尽有争先意 谁识棋山是道场,"7,7,7,7",ada14225059659dc85acb5a63886354f,风驭云转 □ 渺茫 石奇松 老尚 苍苍 留题 尽有 争先 意 谁 识 棋 山 是 道场
9baa4b3b-ec57-4656-b698-5b787927b2c2,董奉山,陈师韩,宋,诗,七言律诗,院宇萧萧锁暮烟 昔人曾见此升仙 静看今日流渠水 应是当年炼药泉 座上山川疑改旧 林中僧行尽长年 我来寄宿应怀古 始信乡民不妄传,"7,7,7,7,7,7,7,7",df60316a38e6fd0176ef1b7b5115712f,院宇 萧萧 锁 暮 烟 昔人 曾 见 此 升仙 静看 今日 流 渠水 应 是 当年 炼药 泉 座 上 山川 疑改 旧 林中 僧行 尽 长年 我 来 寄宿 应 怀古 始信 乡民 不妄传
a222442a-8c1d-4407-bc54-8e9022bf94b7,题清远峡和光洞,安昌期,宋,诗,五言律诗,蕙帐将辞去 猨猱不忍啼 琴书自为乐 朋友孰相携 丹灶非无药 青云别有梯 峡山余暂隠 人莫拟夷齐,"5,5,5,5,5,5,5,5",e1cdbb079f1ac06fd0959f151c3792bd,蕙 帐 将 辞去 猨 猱 不忍 啼 琴书 自为 乐 朋友 孰 相 携 丹灶非 无药 青云 别 有 梯 峡山 余暂 隠 人 莫 拟 夷 齐
ba68eccc-fd8c-4378-8570-a39a18030811,赋新繁周表权如诏亭,阎灏,宋,诗,五言律诗,承家爱以义 能诲仕之忠 故里推全德 先生有古风 中郎银组白 刺史锦衣红 浩矣无穷乐 春熙醉笑中,"5,5,5,5,5,5,5,5",012bca87b02a8127f82dc17905b6efcd,承家爱 以 义 能 诲 仕 之 忠 故里 推 全德 先生 有 古风 中郎 银组 白 刺史 锦衣 红 浩 矣 无穷 乐 春熙 醉 笑 中
f1d700b6-4a09-42ea-8fcb-43c20d87d46e,诗一首,员安舆,宋,诗,五言绝句,国初吾乡民 万户一逢掖 盖自咸平后 俊髦始接迹,"5,5,5,5",8e29fa9503c77ef177febfc4a0e815e8,国初 吾 乡民 万户 一 逢 掖 盖自 咸平 后 俊 髦 始 接迹
5c9b5f1c-78b6-4a30-9142-dca88f81d032,和周茂叔席上酬孟翱太博,傅耆,宋,诗,五言古体,古人务乐善 见士即推毂 今也多忌才 对面远贤蜀 顾予尝喜学 幽室未偶烛 幸会才翘翘 深惭识碌碌 升堂听高论 惟愁日景促 经义许叩击 诗章容往复 荷公引重语 玞珉变良玉 一违几席来 羲娥变昏旭 远闻落帽节 宾朋相追逐 剩摘篱下黄 痛饮杯中醁 清谈已忘倦 佳篇又相勗 毕力为徒弟 强勉攀高躅 异时公行道 其势不可独 首愿策疲蹇 助公施蕴蓄 舒张太平策 散作苍生福 此心答此惠 庶几不忝辱,"5,5,5,5,5,5,5,5,5,5,5,5,5,5,5,5,5,5,5,5,5,5,5,5,5,5,5,5,5,5,5,5",7ce4e17aab8fc292125a1a7cddccb352,古人 务 乐善 见士 即 推毂 今 也 多 忌才 对面 远 贤 蜀 顾予 尝喜 学 幽室 未 偶烛 幸会 才 翘翘 深惭识 碌碌 升堂 听 高论 惟愁 日景 促 经义 许 叩击 诗章 容 往复 荷 公引 重语 玞 珉 变 良玉 一 违 几席 来 羲 娥变 昏 旭 远 闻落 帽节 宾朋 相 追逐 剩摘 篱下 黄 痛饮 杯中 醁 清谈 已 忘倦 佳篇 又 相 勗 毕力 为 徒弟 强勉 攀 高躅 异 时 公行 道 其 势 不可 独 首愿策 疲 蹇 助公施 蕴蓄 舒张 太平 策 散作 苍生 福 此 心答 此 惠 庶几 不 忝 辱
a1c547d1-2a0a-4fc6-876a-37895aaba82c,矸轩,陈宝之,宋,诗,七言律诗,谢公楼上风流客 紫髯萧疏双鬓白 胸中有气吐虹霓 床头无金失颜色 问君借取骑鹤钱 更欲吸尽长鲸川 出门双桨破寒碧 去学五湖风月仙,"7,7,7,7,7,7,7,7",c2fcf96a500a4cc6e4625b2b637f9b73,谢公 楼上 风流 客 紫髯 萧疏 双鬓 白 胸中 有 气 吐 虹霓 床头 无金 失 颜色 问君 借取 骑 鹤 钱 更 欲 吸尽 长鲸川 出门 双桨 破寒碧 去 学 五湖 风月 仙
956ad363-7af3-419f-ba4c-3e85f23afe68,自述,陈宝之,宋,诗,七言绝句,少年落魄走京华 老大无钱赴酒家 羞作寺丞门里客 一片明月照梅花,"7,7,7,7",34ed6f92aef5ab853d7c97dc551439a2,少年 落魄 走 京华 老大 无 钱 赴 酒家 羞作 寺丞 门里 客 一片 明月照 梅花
7333a016-0d4d-4379-a1ad-3293a40ce64b,漫兴,陈宝之,宋,诗,七言绝句,二十年前学采樵 采樵只采嫩枝条 何如斫倒大松树 勾得三年两载烧,"7,7,7,7",5ce271eebb4c8b53e05afa563201ffb7,二十年 前学 采 樵 采樵 只 采 嫩枝 条 何如 斫 倒 大 松树 勾得 三年 两载 烧
fbbbb0a4-2d96-4b38-a43e-95c574b75a02,游东禅院,王某,宋,诗,七言绝句,曲曲青溪叠叠山 石门深处有禅关 我心自得闲滋味 坐听风口尽日还,"7,7,7,7",7474c20b014f9b10cc53bbf5c4b4fdd4,曲曲 青溪 叠叠 山 石门 深处 有 禅 关 我心 自 得闲 滋味 坐 听 风口 尽日 还
b0a2a8b5-cd40-4006-bad2-ee6580d98537,偈二首  其一,舜禅师,宋,诗,七言绝句,无端被谮枉遭迍 卷载有余作俗人 今日再归三峡寺 几多道好几多嗔,"7,7,7,7",f09021bfced233cabdcbcfbd9c2e42cb,无端 被 谮 枉 遭 迍 卷载 有余 作 俗人 今日 再 归 三峡 寺 几多 道 好几 多 嗔
d672773e-42a7-4137-8d16-2702b70efa52,偈二首  其二,舜禅师,宋,诗,七言绝句,寻求就理两俱愆 不涉二途病亦然 孰谓个中端的处 椎胸贫子一分钱,"7,7,7,7",0e7e58283422fd3fea0326f4b2d5bf22,寻求 就理 两 俱 愆 不涉 二途 病 亦然 孰谓 个 中 端的 处 椎胸 贫子 一分钱
9b856f41-0537-40c7-ad8f-f2775f85f62f,化前题壁,释自在,宋,诗,七言绝句,邑尉非常气势豪 因谈真教反称褒 吾家微密皆彰露 又往西天去一遭,"7,7,7,7",d36f70634f3e67c1ecf67fc63408cc25,邑 尉 非常 气势 豪 因 谈 真教 反称 褒 吾 家 微密 皆 彰露 又 往 西天 去 一遭
06cfb81f-21c0-482c-be3c-5b1f47bac2b6,襄阳,贾黯,宋,诗,七言绝句,带水依山一万家 襄阳自古富豪奢 北轩二月回头望 红日连城尽是花,"7,7,7,7",a694b3ee43346c5772e6f7da93c56be8,带 水依山 一万家 襄阳 自古 富 豪奢 北轩 二月 回头 望 红日 连城 尽是 花
41639b99-7b70-4d72-8277-2094eb253741,重建羊侯祠和王原叔句,贾黯,宋,诗,五言古体,古郡襄水阳 群山绕郛郭 其间岘首者 羊公最所乐 登临见洲渚 气象真磅礴 公乎既已没 高碑此镵凿 庙食有遗像 当时盛丹雘 到今仅千载 碑庙皆颓落 乔木荒榛间 庙址存依约 碑倒石屡易 文字免缺错 我侯至之初 亭庙皆新作 为诗道其意 风化思所托 侯慕羊公心 仁政及物博 将见襄阳治 与古相侔若,"5,5,5,5,5,5,5,5,5,5,5,5,5,5,5,5,5,5,5,5,5,5,5,5",c3274541d61ab4fbf53b04844e787d89,古郡 襄水阳 群山 绕 郛 郭 其间 岘 首者 羊公 最 所 乐 登临 见 洲 渚 气象 真 磅礴 公乎 既 已 没 高碑此 镵 凿 庙食 有 遗像 当时 盛 丹 雘 到 今 仅 千载 碑庙 皆 颓落 乔木 荒 榛间 庙址 存 依约 碑 倒 石 屡易 文字 免缺 错 我 侯至之 初 亭 庙 皆 新作 为 诗道 其意 风化 思所 托 侯慕羊 公心 仁政 及 物博 将 见 襄阳 治 与 古相侔 若
6638fea2-6583-48c6-b12a-e7a53bb4bdc4,寄夹山芳别圃,赵世延,宋,诗,七言绝句,本来包却太虚空 万象森罗立下风 假使悠悠千百世 圣人复出此心同,"7,7,7,7",437ec793a55d7b0ae1ef8c09932dd200,本来 包却 太 虚空 万象森罗 立下 风 假使 悠悠 千百 世 圣人 复出 此 心同
473a655d-ea96-4945-a874-d30da63bbd88,舒州寄王介甫,曾宰,宋,诗,七言律诗,官居隠几望灊山 不似茅檐旧日闲 顾我尘沙添白发 怜君道路失朱颜 江涵秋老鲈鱼美 岸入春风荻笋斑 此味纵佳吾不乐 惟思一马返乡关,"7,7,7,7,7,7,7,7",ece8d9993145198588b98c0e15c62fb2,官 居 隠 几 望 灊 山 不 似 茅檐 旧日 闲 顾 我 尘沙 添 白发 怜 君 道路 失 朱颜 江涵秋 老 鲈鱼 美 岸入 春风 荻 笋 斑 此 味 纵 佳 吾 不 乐 惟思一马 返乡 关
13fea458-95c9-4db9-8ce7-2db7af3b3d91,杂兴三首  其一,郑獬,宋,诗,五言古体,女娲炼五石 上补天之缺 如锢黄金液 万古无由裂 尧舜首制度 巨防高巀嵲 后世日破穿 通为万鼠穴 譬彼果蓏虫 熟烂恣攻啮 岂无良工手 一起为施设 非若天之难 前辈有夔卨 苟或不关心 女娲亦为拙,"5,5,5,5,5,5,5,5,5,5,5,5,5,5,5,5",0b6b044817863ccc30e5def85f40da25,女娲 炼五 石 上补天之缺 如 锢 黄金 液 万古 无由裂 尧舜 首 制度 巨防 高 巀 嵲 后世 日 破穿 通为 万 鼠穴 譬彼果 蓏 虫 熟烂 恣攻 啮 岂 无良 工手 一起 为 施设 非 若天之难 前辈 有 夔 卨 苟 或 不 关心 女娲 亦 为 拙
6fa4a43d-cb6d-4861-9fce-f7a5a2863a37,杂兴三首  其二,郑獬,宋,诗,五言古体,块泥封两耳 师旷亦为聋 离朱捏两目 触面不得通 折弓断其臂 安得为逢蒙 白日照六合 光耀当天中 苟为物所蚀 𫠜齿犹成童 君子诚其意 默通大化工 所以虞舜明 不在双重瞳,"5,5,5,5,5,5,5,5,5,5,5,5,5,5",fe6db8bd76b70c998a0241f062bdb9d4,块 泥封 两 耳 师旷 亦 为 聋 离 朱 捏 两目 触面 不得 通 折弓 断其臂 安得 为 逢 蒙 白 日照 六合 光耀 当天 中 苟为物 所 蚀 𫠜 齿犹成童 君子 诚 其意 默通大 化工 所以 虞舜 明 不 在 双重 瞳
91987060-99cf-4639-a83b-ce115d328207,杂兴三首  其三,郑獬,宋,诗,五言古体,秦皇按长剑 杀人如刈草 何独李斯辈 竟以丞相老 汉元服儒衣 收谏如蓄宝 何独萧望之 诛鉏恨不早 沧海飞天波 枯泽淤行潦 刘累婴其喉 蛟龙不为暴 鲁士固多贤 亲师仲尼道 至于出处间 惟有颜生到,"5,5,5,5,5,5,5,5,5,5,5,5,5,5,5,5",2e1a85e52f5b94c088de61ea2bb80e20,秦皇 按 长剑 杀人 如 刈草 何独 李斯 辈 竟以 丞相 老 汉元服 儒衣 收谏如蓄宝 何独 萧望之 诛鉏 恨 不 早 沧海 飞天 波 枯泽 淤行 潦 刘累 婴 其 喉 蛟龙 不为 暴 鲁士固 多贤 亲师 仲尼 道 至于 出处 间 惟有 颜生 到
dd85e5e2-b580-4886-a29c-6b05691d626e,感秋六首  其一,郑獬,宋,诗,五言古体,落日在高木 辉辉淡秋容 白云起天镜 飞去忽无踪 雨藓烂漫紫 幽径谁相从 孤虑如有根 纠结生心胸 良时忽已晚 撇耳过晨钟 事业余濩落 抚己真何庸 投箸不能食 却立倚长松 酒敲百万兵 此忧不可攻,"5,5,5,5,5,5,5,5,5,5,5,5,5,5,5,5",3c3ab1e85ac8190330a29198f7f86258,落日 在 高木 辉 辉淡 秋容 白云 起 天镜 飞去 忽 无踪 雨藓 烂漫 紫 幽径 谁 相 从 孤虑 如有 根 纠结 生 心胸 良 时 忽 已晚 撇耳 过 晨钟 事业 余 濩 落 抚 己 真 何庸 投 箸 不能 食 却 立 倚 长松 酒 敲 百万 兵 此 忧 不可 攻
cbae606e-880f-4297-a263-785faa9a2922,感秋六首  其二,郑獬,宋,诗,五言古体,短松青铁干 童童三尺余 花实少姿媚 独与寒心俱 暴霜时侵凌 奋怒张雄须 长楸拥肿材 旁荫可容车 秋风一夕来 解剥惟朽株 物性在坚柔 何必长短殊 楸叶已泥滓 松干犹青肤 无烦问高下 且辨荣与枯,"5,5,5,5,5,5,5,5,5,5,5,5,5,5,5,5",1efaeb12f3b06458a64e90b986623346,短松青 铁干 童童 三尺 余 花实 少 姿 媚 独与 寒心 俱 暴霜 时 侵凌 奋怒 张雄 须 长 楸 拥 肿材 旁荫可容车 秋风 一夕 来 解剥 惟 朽 株 物性 在 坚柔 何必 长短 殊 楸 叶 已 泥滓 松干犹 青肤 无烦 问 高下 且 辨荣 与 枯
c0c022b7-7140-4e5c-9ce9-12e40c5daadc,感秋六首  其三,郑獬,宋,诗,五言古体,我思洞庭橘 赤金三寸圆 磊落火齐珠 缀树团紫烟 病肺燥不治 嘘吐气欲然 玉醴埋九地 凿井不得泉 我欲涉洞庭 采橘秋云边 骇浪破我舟 蛟龙怒腾骞 安得万里风 吹落堕我前,"5,5,5,5,5,5,5,5,5,5,5,5,5,5",e9c04d4e5b6c02e1b18d2e6eefae6d6c,我 思 洞庭 橘 赤金 三寸 圆 磊落 火 齐珠 缀 树团 紫烟 病 肺 燥 不 治 嘘 吐气 欲然 玉 醴埋九地 凿井 不得 泉 我 欲 涉 洞庭 采橘 秋 云边 骇浪 破 我 舟 蛟龙 怒 腾 骞 安 得 万里风 吹落 堕 我 前
4c82d2bc-c533-4978-a671-7b8b18c6caa1,感秋六首  其四,郑獬,宋,诗,五言古体,日车辗东井 一阴穿土生 死草出飞火 杀机从此萌 况及八月秋 大昴腾光精 气势日发励 乾坤露峥嵘 万木赤立死 百虫相吊鸣 菲菲黄菊花 幽丛发孤英 采撷对樽酒 悲歌不能倾 所悲阳德消 日与群阴争,"5,5,5,5,5,5,5,5,5,5,5,5,5,5,5,5",fbad9bf0a8b1133674e96aac7562d187,日 车 辗东井 一 阴 穿 土生 死草 出飞 火 杀机 从此 萌 况及 八月 秋 大 昴 腾 光 精 气势 日 发励 乾坤 露 峥嵘 万木赤 立死 百虫 相吊鸣 菲菲 黄菊花 幽丛 发孤 英 采撷 对 樽 酒 悲歌 不能 倾 所 悲 阳德 消 日 与 群 阴争
93752a1b-0afd-47a5-aff4-ff1bf7874431,感秋六首  其五,郑獬,宋,诗,五言古体,林杪一蝉噪 翛翛凉风来 清响断复连 裂耳增余哀 浩露洗明月 珠树凉璀璀 蜕飞各有时 讵能人力裁 儒生守文字 舌腐犹蒿莱 空肠贮古书 独立谁为媒 咄哉丈夫气 胡为久徘徊,"5,5,5,5,5,5,5,5,5,5,5,5,5,5",9f70d1b52566bbce784fb04926f292a9,林杪 一蝉噪 翛 翛 凉风 来 清响 断复 连 裂耳 增余 哀 浩露 洗 明月 珠树凉 璀璀 蜕飞 各 有时 讵 能 人力 裁 儒生 守 文字 舌腐 犹 蒿 莱 空肠 贮 古书 独立 谁 为 媒 咄哉 丈夫 气 胡为久 徘徊
17a154f6-02f6-481c-877b-f2045cfa75a2,感秋六首  其六,郑獬,宋,诗,五言古体,轩轩苍角鹰 杀气凌高秋 一息一万里 独与长风游 猎骑走霹雳 落臂无虚投 古冢白鼻狐 立死不得留 飞霜未杀草 拥翅寒胡愁 畜力以待奋 仁如林中鸠 今兹顺天诛 狡穴破奸谋 美哉青骹姿 识时谁与俦,"5,5,5,5,5,5,5,5,5,5,5,5,5,5,5,5",aafbf693aa565c683716ce4f7d73baff,轩轩 苍角鹰 杀气 凌高秋 一 息 一万里 独与 长风 游 猎骑 走 霹雳 落臂无虚投 古冢白 鼻 狐 立死 不得 留 飞霜 未 杀 草 拥 翅 寒 胡愁 畜力 以待 奋 仁 如林 中鸠 今兹顺 天诛 狡穴破 奸谋 美 哉 青 骹 姿 识 时 谁 与 俦
3a0b4a45-156c-4a8f-8fef-91fa4dc7dd9f,秋声,郑獬,宋,诗,五言律诗,蚯蚓如嘒管 逢时土中鸣 秋蝉抱枝死 不敢鼓秋声 听者何无厌 忽如鸣秦筝 大雨漂九土 旷荡空太清,"5,5,5,5,5,5,5,5",910194e8a06e7bff628a93efa4eaf936,蚯蚓 如 嘒 管 逢时 土 中 鸣 秋蝉 抱枝死 不敢 鼓秋 声 听者 何无厌 忽如鸣 秦筝 大雨 漂 九 土 旷荡空 太 清
7ba03306-bb79-4189-8ec5-87dbfdd6cfe1,回次妫川大寒,郑獬,宋,诗,五言古体,地风如狂兕 来自黑山旁 坤维欲倾动 冷日青无光 飞沙击我面 积雪沾我裳 岂无玉壶酒 饮之冰满肠 鸟兽不留迹 我行安可当 云中本汉土 几年非我疆 元气遂隳裂 老阴独盛强 东日拂沧海 此地埋寒霜 况在穷腊后 堕指乃为常 安得天子泽 浩荡渐穷荒 扫去妖氛俗 沐以楚兰汤 东风十万家 画楼春日长 草踏锦靴缘 花入罗衣香 行人卷双袖 长歌归故乡,"5,5,5,5,5,5,5,5,5,5,5,5,5,5,5,5,5,5,5,5,5,5,5,5,5,5,5,5",e042fc1c2ea0011ea2aac3a502c44b1a,地风 如 狂 兕 来自 黑山 旁 坤维 欲 倾动 冷日青 无 光 飞沙 击 我 面 积雪 沾 我裳 岂 无 玉壶 酒 饮之冰满肠 鸟兽 不留 迹 我行 安可 当 云中 本 汉土 几年 非 我 疆 元气 遂 隳 裂 老阴 独盛 强 东日 拂 沧海 此地 埋 寒霜 况 在 穷 腊 后 堕指 乃为 常 安 得 天子 泽 浩荡 渐穷 荒 扫 去 妖氛 俗 沐以 楚兰汤 东风 十万家 画楼 春日 长 草 踏 锦 靴 缘 花入 罗衣香 行人 卷 双袖 长 歌 归 故乡
a6285d36-ec31-4e46-82ac-d429112771ee,大寒呈张太博,郑獬,宋,诗,五言古体,寒风怒蓬勃 排户入吾室 沙灰涨天黑 白日赤黄色 捉衣拥肩坐 心脾寒憀栗 须臾天气变 阴黯如涂漆 跳空雨雹飞 四走珠玑出 数子方叹惊 共怪天公逸 先生携书来 昂颐杖飞策 乃召二三子 环坐与之席 呼童令取酒 盘饤杂梨栗 酒行寒气除 春阳生四壁 先生说大义 驰骛何纤悉 洞彻人精神 两耳飞霹雳 老语植根节 九牛不可屈 尧眉与舜目 缅若曾相识 如当夜黑中 光耀见赤日 退思圣贤业 所积在劘剔 韦皮画山龙 块泥亦瓦砾 人固有识智 非如物之植 而不自刻苦 昼夜如刀尺 年齿方壮健 男儿宜努力 方今太平民 尚未获苏息 谁能拱两手 看人树勋绩,"5,5,5,5,5,5,5,5,5,5,5,5,5,5,5,5,5,5,5,5,5,5,5,5,5,5,5,5,5,5,5,5,5,5,5,5,5,5,5,5,5,5,5,5",b64f0ff592dde10278a11ec2d0664c71,寒风 怒 蓬勃 排户 入 吾 室 沙灰 涨 天黑 白日 赤 黄色 捉衣拥肩坐 心脾 寒 憀 栗 须臾 天气 变 阴 黯如 涂漆 跳空 雨雹 飞 四 走 珠玑 出 数 子方 叹 惊 共怪 天公 逸 先生 携书 来 昂颐 杖 飞策 乃召 二 三子 环坐 与 之 席 呼童令 取酒 盘饤 杂梨 栗 酒行 寒气 除 春阳 生 四壁 先生 说 大义 驰骛何 纤悉 洞彻 人 精神 两 耳 飞 霹雳 老语 植根 节 九 牛 不可 屈 尧 眉 与 舜 目 缅 若 曾 相识 如 当夜 黑中 光耀 见 赤 日 退思 圣贤 业 所积 在 劘 剔 韦皮画 山龙 块 泥 亦 瓦砾 人 固有 识 智 非如物 之 植 而 不 自 刻苦 昼夜 如刀尺 年 齿 方 壮健 男儿 宜 努力 方今 太 平民 尚未 获苏 息 谁 能 拱 两手 看 人树 勋绩
caaabf31-3e3b-4b3b-9dba-5525bd79cd49,迫晚风雪出省咏张公达红梅之句,郑獬,宋,诗,五言古体,雪花障路飞 飘湿红杏鞯 归马碧蹄疾 踏破白玉田 揽辔独长想 物境真可怜 朝绂未挂身 豪逸倚少年 结客上高楼 珠箔遮碧天 烧酒紫烟沸 割炙白膏鲜 美人挪素手 笑弄琵琶弦 醉眼生乱云 不省到家眠 俊游或如失 倒指还掺然 薄莫出华省 下马灯已燃 强笑破老颜 寄恨挥华笺 玩世张公子 嗜酒真神仙 抛掷咏红梅 负伊清樽前 再读再三叹 心断空悁悁 起予如茧丝 织愁成短篇,"5,5,5,5,5,5,5,5,5,5,5,5,5,5,5,5,5,5,5,5,5,5,5,5,5,5,5,5,5,5",24018d7d70cb82f682d8487b02dfa376,雪花 障路 飞 飘湿红 杏 鞯 归马 碧蹄 疾 踏破 白玉 田 揽辔 独长 想 物境 真可怜 朝 绂 未 挂身 豪 逸 倚 少年 结客 上 高楼 珠箔 遮碧天 烧酒 紫烟 沸 割 炙白膏鲜 美 人 挪 素 手 笑 弄 琵琶 弦 醉眼 生乱云 不省 到 家 眠 俊 游 或 如 失 倒 指 还 掺 然 薄 莫 出 华省 下 马灯 已 燃 强 笑 破 老 颜 寄恨 挥华 笺 玩世 张公子 嗜酒 真 神仙 抛掷 咏 红梅 负 伊 清 樽 前 再 读 再三 叹 心断 空 悁 悁 起予 如 茧丝 织愁 成 短篇
