id,title,author,dynasty,genre,poem_type,sentences_simplified,meter_pattern,hash,words
08a81706-2f90-446b-8a74-1077a1e4554d,酬上饶徐季益学正,吕祖谦,唐,诗,五言古体,吾家紫微翁 独守固穷节 金銮罢直归 朝饭尚薇蕨 峩峩李杜坛 总角便高蹑 暮年自誓斋 铭几深刻责 名章与俊语 扫去秋一叶 冷淡静工夫 槁干迂事业 有来媚学子 随叩无不竭 辞受去就间 告戒意尤切 典刑自耆老 护持何敢阙 嗟予生苦晚 名在诸孙列 拊头虽逮事 提耳未亲接 徐侯南州秀 少也尝鼓箧 示我百篇诗 照坐光玉雪 因之理前话 讲绎霏谈屑 两都弟子员 家法严城堞 取善则未周 守旧犹有说 同门风雨散 孤学丝桐绝 怀哉五马桥 寒迳寻遗屧,"5,5,5,5,5,5,5,5,5,5,5,5,5,5,5,5,5,5,5,5,5,5,5,5,5,5,5,5,5,5,5,5,5,5,5,5",33cbd82312f893ac918c376c69b6cc3b,吾 家 紫微翁 独守 固穷 节 金銮 罢 直 归 朝 饭 尚薇 蕨 峩 峩 李 杜 坛 总角 便 高蹑 暮年 自 誓 斋 铭 几 深刻 责 名章 与 俊语 扫 去秋 一叶 冷淡 静 工夫 槁 干 迂 事业 有 来 媚 学子 随 叩 无 不竭 辞受 去 就 间 告戒 意 尤切 典刑 自 耆老 护持 何敢 阙 嗟予 生苦晚 名 在 诸孙列 拊 头 虽 逮事 提 耳 未 亲 接 徐侯 南州秀 少 也 尝 鼓箧 示 我 百篇 诗 照 坐 光玉雪 因之 理前 话 讲绎 霏谈 屑 两 都 弟子 员 家法 严城 堞 取善 则 未周 守旧 犹 有 说 同门 风雨 散 孤学 丝桐 绝 怀哉 五马 桥 寒 迳 寻 遗 屧
a1224f11-6c14-4846-ae89-c80e8cdd7ee2,何茂恭母王夫人挽章,吕祖谦,唐,诗,七言律诗,南朝人物盛诸何 寿母皤然乐事多 堂下无忧萱弄色 天边有信桂交柯 黄金籝满经方重 白玉楼成恨未磨 空诵安仁旧时赋 版舆零落故山阿,"7,7,7,7,7,7,7,7",5b5bcc5a8d6ac5c4ce2957aa875677fe,南朝 人物 盛 诸何 寿母皤 然 乐事 多 堂 下 无忧 萱弄 色 天边 有信桂 交 柯 黄金 籝 满 经 方 重 白玉 楼成 恨未 磨 空 诵 安仁 旧时 赋 版 舆 零落 故山 阿
07c7d629-0539-4f9a-a02b-56deeb7eac0f,夜宿浦城鱼梁徐删定子出示林谦之挽其父二诗时谦之方按刑广东有怀次韵  其一,吕祖谦,唐,诗,七言绝句,五年不说空山雨 今夜鱼梁著钓船 为问故人今健否 桄榔叶暗瘴江边,"7,7,7,7",dbcd16612e6480f8e7d4be111b97eae8,五年 不说 空 山雨 今夜 鱼梁著 钓船 为 问 故人 今 健否 桄榔 叶 暗瘴 江边
b97fd43e-f048-4fa8-a26b-fd6a3895aaf6,夜宿浦城鱼梁徐删定子出示林谦之挽其父二诗时谦之方按刑广东有怀次韵  其二,吕祖谦,唐,诗,七言绝句,两章宛转复清哀 读到鱼梁首重回 便使短牋无姓字 也应知自艾轩来,"7,7,7,7",a532201df5d2a30bb12f8a382f49d983,两章 宛转 复 清哀 读到 鱼梁 首 重回 便 使 短 牋 无 姓字 也 应知 自艾 轩 来
f6558d7d-82a9-4e79-853d-41ecbc446667,题刘氏绿映亭二首  其一,吕祖谦,唐,诗,七言绝句,凉叶翻翻不受尘 芒鞋藤杖及清晨 开窗小放前溪入 澄绿光中独岸巾,"7,7,7,7",49700d508b1175fcf87cbfe348f48dde,凉叶 翻翻 不 受 尘 芒鞋 藤杖 及 清晨 开窗 小放前 溪入 澄 绿光 中 独岸巾
2543ba87-2431-4a7d-b105-494a560a3ad8,题刘氏绿映亭二首  其二,吕祖谦,唐,诗,七言绝句,鹭浴鱼跳在镜屏 摇青浮碧太鲜明 墙东种得阴成幄 隔叶看来却有情,"7,7,7,7",da40396020b2e621977ded1ac3bf7a17,鹭 浴 鱼 跳 在 镜屏 摇青 浮 碧太 鲜明 墙东 种 得 阴成幄 隔叶 看来 却 有情
88cdc6f7-b1dc-4b8c-a5d1-85aa7c9727f3,题归庵,吕祖谦,唐,诗,五言律诗,云壁开苍峡 风林卷翠涛 诸松皆老大 一嶂独孤高 发兴虽公等 寻幽许我曹 秋光端可赋 不是楚人骚,"5,5,5,5,5,5,5,5",df9d7b6e6ce4487190b9ee9a013163b9,云壁 开 苍峡 风林 卷 翠涛 诸松皆 老大 一 嶂 独孤 高 发兴 虽 公等 寻幽许 我 曹 秋光端 可 赋 不是 楚 人 骚
f6b7f333-a160-46c6-baf7-aa0c41f05f8a,王通直挽章,吕祖谦,唐,诗,五言律诗,近来南国冢 半是北人坟 异县谁怜我 同乡又失君 深居传雅尚 坚坐挹清芬 日落长安第 三槐拂暮云,"5,5,5,5,5,5,5,5",642c7e038a567f3a7a9f5462f95cb7cc,近来 南国 冢 半 是 北 人 坟 异 县 谁怜 我 同乡 又 失 君 深居 传雅尚 坚坐 挹 清芬 日落 长安 第 三 槐 拂 暮云
ea6205ab-6f82-47ba-afda-a300a6fe73e1,刘梧州挽章,吕祖谦,唐,诗,七言律诗,驷马高车照路光 幡然改辙兴何长 空山猿鹤惊无恙 同社鸡豚乐未央 祗见岁华来冉冉 不知耆旧去堂堂 北邙道上麒麟冢 谁得归休十载强,"7,7,7,7,7,7,7,7",5c5c625063686de71f2409e1699bd98f,驷马高车 照路 光 幡然 改辙 兴何长 空山 猿 鹤 惊 无恙 同社 鸡豚 乐未央 祗 见 岁 华 来 冉冉 不知 耆 旧 去 堂堂 北邙 道 上 麒麟 冢 谁 得归 休 十载 强
7bcf55f8-7896-4753-a2ec-4589014fd837,许著作挽章,吕祖谦,唐,诗,七言律诗,清文丽藻百川增 窘步追随愧不能 麟趾差肩台岌岌 鴈飞联翼塔层层 莼鲈归兴都门酒 薤露悲歌大隧灯 独向梁间诵遗句 寒松衰菊绕崚嶒,"7,7,7,7,7,7,7,7",12171419b56e2b646f7c7158672935ff,清文丽藻 百川 增 窘步 追随 愧 不能 麟 趾差 肩台 岌岌 鴈 飞 联 翼 塔 层层 莼鲈 归兴 都 门 酒 薤 露 悲歌 大 隧灯 独向 梁 间 诵 遗句 寒松 衰 菊 绕 崚嶒
604c9eb8-6961-4e35-ba4c-710207351ea2,次韵叶丞相陈尚书游南园,吕祖谦,唐,诗,七言律诗,乐事良辰古所难 三分春色一分宽 润花雨过红裙湿 倚竹风斜翠袖寒 自有南堂谁举白 可无东绢为施丹 两翁醉墨曾题品 便作平泉草木看,"7,7,7,7,7,7,7,7",cb4e88d16a2d6bafed66d7ae11decae2,乐事 良辰 古所 难 三分 春色 一分 宽 润 花雨 过 红裙 湿 倚 竹风 斜翠 袖寒 自有 南堂 谁 举白 可无 东绢 为 施丹 两 翁醉墨 曾 题品 便 作 平泉 草木 看
e840d399-1952-4987-a90b-a4546cfb5050,宣城李君尝游东湖居士之门袖诗见过次韵以谢,吕祖谦,唐,诗,七言律诗,人去湖空古豫章 溪荪水荇换年芳 闻风我是通家旧 觅句君犹弟子行 须发苍浪休叹老 齿牙沆瀣尚生香 宛陵自昔诗人国 今日谁升小谢堂,"7,7,7,7,7,7,7,7",d08c213b67e58067aa357216b767bc89,人 去 湖空 古 豫章 溪 荪 水 荇 换 年 芳 闻风 我 是 通家 旧 觅句 君犹 弟子 行 须发 苍浪 休叹 老 齿牙 沆瀣 尚 生香 宛陵 自 昔 诗人 国 今日 谁 升 小 谢堂
032de539-2170-4fb6-8b4b-1063e1f99806,何叔京挽章二首  其一,吕祖谦,唐,诗,五言律诗,濮州以谏死 何氏得其真 天下中庸义 人间父子亲 再传犹易简 小出复逡巡 埋骨虽南土 倾心向北辰,"5,5,5,5,5,5,5,5",8422fcec722e3150c9ee0cddfbdd8da3,濮州 以 谏 死 何氏 得 其 真 天下 中庸 义 人间 父子 亲 再 传 犹易 简 小 出复 逡巡 埋骨 虽 南土 倾心 向 北辰
1bd6cfd8-0718-47b2-9622-cb6c8ad76be2,何叔京挽章二首  其二,吕祖谦,唐,诗,五言律诗,倾盖黄亭夜 翛然涧壑姿 倚天唯直干 到地绝旁枝 亹亹今何许 悠悠只自知 寒碑卧风雨 千载有深期,"5,5,5,5,5,5,5,5",c1026d0d2369621a6b907740226a06c6,倾盖 黄亭 夜 翛 然 涧 壑 姿 倚天 唯直 干 到 地 绝 旁枝 亹 亹 今 何许 悠悠 只 自知 寒碑 卧 风雨 千载 有 深期
be189eb3-71e7-4731-bbf1-09bd27a4e4f2,鲁少卿挽章,吕祖谦,唐,诗,七言律诗,庆源衮衮接天流 老桂传香次第秋 人物西都九卿选 光华南国十州游 翛然径下滕王阁 已矣长怀范蠡舟 身后楚骚谁著录 灵光旧草合兼收,"7,7,7,7,7,7,7,7",46269bf94e2483f0e7d3ae8e6a362917,庆源 衮衮 接 天流 老桂传香 次第 秋 人物 西 都 九卿 选 光华 南国 十州 游 翛 然 径 下 滕王阁 已 矣 长 怀 范蠡 舟 身后 楚骚 谁 著录 灵光 旧 草合 兼收
c5af9e4d-a0a7-4c03-8b8a-edfe2d5d4925,萧果卿祭酒挽章二首  其一,吕祖谦,唐,诗,五言律诗,虚心观世态 实行播乡评 璧玉中边厚 冰壶表里清 家声到萧傅 人望似阳城 殄瘁无穷恨 湘江日夜倾,"5,5,5,5,5,5,5,5",1433ecf504299435497b4f678716a030,虚心 观 世态 实行 播乡 评 璧玉 中边 厚 冰壶 表里 清 家声 到 萧傅 人望 似 阳城 殄 瘁 无穷 恨 湘江 日夜 倾
823ccd7a-af6c-4971-a066-c622e68123c2,萧果卿祭酒挽章二首  其二,吕祖谦,唐,诗,五言律诗,摩揣诚斯薄 雕镌质自销 平生但真朴 直上绝枝条 氛雾终澄霁 丘山亦动摇 朝阳旧时凤 声人舜箫韶,"5,5,5,5,5,5,5,5",7d59b2c4a26cf7c5d0721070a115a9a2,摩 揣 诚斯薄 雕 镌 质 自销 平生 但 真朴 直 上绝 枝条 氛雾 终澄霁 丘山 亦 动摇 朝阳 旧时 凤 声 人 舜 箫 韶
4c4cc372-b36f-417e-a929-68e4d25a26cd,送喻叔奇通判会稽,吕祖谦,唐,诗,七言古体,鸣驺前日饯出使 椎鼓今日送作州 会稽别驾官尚薄 道傍羡者何其稠 版舆有亲余九十 东南之美供甘柔 先春铸牙入午啜 破腊箭茁充晨羞 况复诗坛执牛耳 所至风月相献酬 千岩万壑徧题品 会有采者人名遒,"7,7,7,7,7,7,7,7,7,7,7,7",d4c6d48d3bb4f05c01ecb882b8305f53,鸣 驺 前日 饯 出使 椎鼓 今日 送作 州 会 稽 别 驾 官 尚 薄 道 傍 羡 者 何其 稠 版舆 有 亲余 九十 东南之美 供甘柔 先春 铸牙入 午 啜 破腊箭 茁充晨 羞 况复 诗坛 执牛耳 所 至 风月 相献酬 千岩万壑 徧 题 品 会 有 采者 人名 遒
983ecfff-7ac0-4b7f-9db6-d4b08e2b3263,与同馆游张氏园分韵得日字,吕祖谦,唐,诗,五言古体,出门厌嚣尘 入门倦占毕 驾言城北园 滞思顿觉失 方池环修篁 广陌卫行栗 先雪梅已苞 后霜草犹茁 上跻极高明 旁穿复深密 主人真喜事 秀句屡盈帙 招呼文字饮 及此三余日 山林与钟鼎 零茂本非匹 斯游岂偶然 书板记甲乙,"5,5,5,5,5,5,5,5,5,5,5,5,5,5,5,5,5,5",3eea417c8f3285db353dd80f95e0b95a,出门 厌嚣 尘 入门 倦 占 毕 驾言 城北 园 滞思 顿觉 失 方池 环 修 篁 广 陌 卫行栗 先 雪梅 已 苞 后 霜 草 犹 茁 上 跻极 高明 旁 穿复 深密 主人 真 喜事 秀 句 屡盈帙 招呼 文字 饮 及此 三余 日 山林 与 钟鼎 零 茂本 非匹 斯游 岂 偶然 书板 记 甲乙
39119825-b859-4d83-9a7b-a7cb6cc3566d,送胡子远著作知汉州分韵得行字,吕祖谦,唐,诗,五言古体,定交不在蚤 意合盖已倾 胡侯西南来 两载同书檠 与人徐有味 于世初无营 虚舟澹容与 未易宠辱惊 鱼龙同一波 中有千丈清 道气自深稳 名言常简明 南宫接东观 天衢势方亨 梦回得远信 窥簷渚鸿鸣 开书见连环 归兴浩已盈 子政方校录 令伯俄陈情 都门日毂击 杂袭炎凉并 谁知此麾盖 独为思亲行 夹道皆叹息 始识真重轻 古来聚散地 雪野天峥嵘 别袖不可挽 宿昔洲渚生 君臣有大义 忠孝相持衡 勉哉楙明德 清庙须栋甍,"5,5,5,5,5,5,5,5,5,5,5,5,5,5,5,5,5,5,5,5,5,5,5,5,5,5,5,5,5,5,5,5,5,5",23a70f9248b4a6ffdb624cfc1789ffeb,定交 不 在 蚤 意 合盖 已 倾 胡侯 西南 来 两载 同 书 檠 与 人 徐 有 味 于 世初 无营 虚舟 澹容 与 未易 宠辱 惊 鱼龙 同一 波 中 有 千丈 清 道气 自深 稳 名言 常 简明 南宫 接 东观 天衢 势方 亨 梦回 得 远 信 窥 簷 渚 鸿 鸣 开书 见 连环 归兴浩 已 盈 子政 方校 录 令伯 俄 陈 情 都 门 日 毂 击 杂袭 炎凉 并 谁知 此 麾盖 独为 思亲 行 夹道 皆 叹息 始识 真 重轻 古来 聚散 地 雪野天 峥嵘 别袖 不可 挽 宿昔 洲 渚 生 君臣 有 大义 忠孝 相持 衡 勉 哉 楙 明德 清 庙 须栋 甍
f0579399-d1a0-4ee0-8e7e-6116565d4350,薛叔云左史母方夫人挽章二首  其一,吕祖谦,唐,诗,五言律诗,彤管传遗范 形容欲付谁 初年柏舟赋 晚岁艾轩诗 □□□□□ □金□赤墀 莆中称寿母 不独蔡三司,"5,5,5,5,5,5,5,5",b7aae325ed0f4d4a345e28a280b96301,彤管 传遗 范 形容 欲 付 谁 初年 柏舟赋 晚岁 艾轩 诗 □ □ □ □ □ □ 金 □ 赤墀 莆中 称 寿母 不独 蔡三司
c11a6157-3c66-4530-968c-97bb9555578a,薛叔云左史母方夫人挽章二首  其二,吕祖谦,唐,诗,五言律诗,往在西雍日 从容许拜亲 杏花坛壝古 萱草户庭春 曾是升堂客 应为执绋人 壶公天一角 吹泪洒车尘,"5,5,5,5,5,5,5,5",7342ed8f7de1123a0dfd6b6e5a4cd004,往在 西雍 日 从 容许 拜 亲 杏花 坛 壝 古 萱草 户庭 春 曾 是 升堂 客 应为 执 绋 人 壶 公天 一角 吹泪洒车尘
68da3d60-fb0b-4878-a810-ee34347e8280,端明汪公挽章二首  其一,吕祖谦,唐,诗,五言律诗,异时忧世士 太息恨才难 每见公身健 犹令我意宽 雕零竟何极 回复岂无端 此理终难解 天风大隧寒,"5,5,5,5,5,5,5,5",ffb07c881631579abd6517fa83f64e67,异时 忧 世士 太息 恨 才 难 每 见 公身 健 犹令 我 意宽 雕 零竟 何 极 回复 岂 无端 此理 终 难解 天风 大 隧寒
e3043eb7-66ed-408f-a2f3-cd21947d4227,端明汪公挽章二首  其二,吕祖谦,唐,诗,五言律诗,四海膺门峻 亲承二纪中 论交从父祖 受教自儿童 山岳千寻上 江河万折东 微言藏肺腑 欲吐与谁同,"5,5,5,5,5,5,5,5",4d36f8ff83103453957cc4146c247fe4,四海 膺 门 峻 亲承 二纪 中 论交 从 父祖 受教 自 儿童 山岳 千寻上 江河 万折 东 微言 藏 肺腑 欲 吐 与 谁 同
ad8af69c-d2a8-4cf7-91c4-cc27b001ec4d,赵路分挽章二首  其一,吕祖谦,唐,诗,五言律诗,鲁卫封虽近 原颜室自贫 一家唯四壁 九族自三春 子舍龙头贵 佳城马鬣新 升堂如昨日 南望涕沾巾,"5,5,5,5,5,5,5,5",a8183575e61ff107de44c231a6f7ea43,鲁卫封 虽 近 原 颜室 自贫 一家 唯 四壁 九族 自 三 春 子舍 龙头 贵 佳城 马 鬣 新 升堂 如 昨日 南望涕沾巾
40c574a9-f546-4423-9e53-10a8c0b9f8b6,赵路分挽章二首  其二,吕祖谦,唐,诗,五言律诗,晨昏生死际 至性极民彝 巨孝东都传 劬劳小雅诗 固应为世表 何止秀天枝 令子传遗绪 累然不自持,"5,5,5,5,5,5,5,5",c683e355d364077028465464fe201673,晨昏 生死 际 至 性极民 彝 巨孝东 都 传 劬劳 小雅 诗 固 应为 世表 何止 秀天枝 令子 传 遗绪 累然 不 自持
a8888f5c-ec4f-4660-908c-799cb9c122bf,陈能之少卿挽章二首  其一,吕祖谦,唐,诗,五言律诗,往在西台日 调娱用力艰 善人终有恃 公道亦徐还 既去言方白 重来鬓已班 清名配詹事 千载赤城山,"5,5,5,5,5,5,5,5",db8a3189625175b7623997c149240145,往在 西台 日 调娱 用力 艰 善人 终 有 恃 公道 亦徐 还 既 去 言方 白 重来 鬓 已 班 清名 配 詹 事 千载 赤城 山
74195140-2140-466e-9df8-355f8dff3c6b,陈能之少卿挽章二首  其二,吕祖谦,唐,诗,五言律诗,二父官曹接 诸郎砚席通 流年何鼎鼎 见日每匆匆 马走谁怜我 麟书近得公 又成交臂失 楚些铎声中,"5,5,5,5,5,5,5,5",a9bce324e4000531061821ec2089b300,二 父官 曹 接 诸郎 砚席 通 流年何 鼎鼎 见 日 每 匆匆 马 走 谁怜 我 麟 书 近 得 公 又 成交 臂 失 楚 些 铎 声 中
fa859d62-1ba6-4b15-87a7-dbc7d13d7fde,恭和御制秋日幸秘书省近体诗,吕祖谦,唐,诗,七言律诗,麟阁龙旗日月章 中兴再见赭袍光 仰观焜燿人文盛 始识扶持德意长 功利从今卑管晏 浮华自昔陋卢王 愿将实学酬天造 敢效明河织女襄,"7,7,7,7,7,7,7,7",2b8010cb7a3f127acc35a0ec42519541,麟阁 龙旗 日月 章 中兴 再见 赭袍 光 仰 观 焜 燿 人文 盛 始识 扶持 德 意长 功利 从今 卑管 晏 浮华 自 昔 陋 卢王 愿 将 实学 酬 天造 敢 效明 河 织女 襄
47f97fd1-e1df-4416-9a67-276b87f2bbe0,贺车驾幸秘书省二首  其一,吕祖谦,唐,诗,七言律诗,麟台高柳识雕舆 共记中兴幸省初 黄道再传天子跸 青编重入史臣书 需云下际君恩盛 晨露高张乐节舒 若写鸿猷参大雅 定非周鼓颂田渔,"7,7,7,7,7,7,7,7",e8a0d4cb76b731995dcc9acc8ea79b7b,麟 台 高 柳识雕 舆 共记 中兴 幸省 初 黄道 再 传 天子 跸 青编 重入 史臣 书 需云 下际 君恩 盛 晨露 高 张 乐节 舒 若写鸿猷 参 大雅 定非 周鼓颂 田渔
e5c6b29a-b1c5-48c2-96b9-50c791402da4,贺车驾幸秘书省二首  其二,吕祖谦,唐,诗,七言律诗,紫清丹极与天邻 阖辟乾坤系笑嚬 独为斯文回一顾 坐令吾道重千钧 先王旧物参差见 列圣明谟次第陈 墨客区区感荣遇 岂知深意在彝伦,"7,7,7,7,7,7,7,7",60c4d653c06c8a4d63afcd39bc813ac6,紫清丹 极 与 天邻 阖辟 乾坤 系 笑 嚬 独为 斯文 回 一顾 坐令 吾 道 重 千钧 先王 旧物 参差 见 列 圣明 谟 次第 陈 墨客 区区 感荣 遇 岂知 深意 在 彝 伦
aabb1db8-13aa-46a2-9afe-b416a452f4da,题真觉僧房芦,吕祖谦,唐,诗,七言古体,何人夜折苕溪雪 吹落山堂寄清绝 梦回轩槛非人间 一岸扶疎碎残月 秋风索索秋意晚 叶外参差明叠𪩘 颇似江南短棹归 平沙鴈落汀洲远 苍涛遶窗碧玉寒 中有渔父千古闲 知君胸次五湖阔 波声髣髴游杏坛 少林之孙韵枮木 避世避人何用逐 渭川谩复千亩多 江上由来一苇足,"7,7,7,7,7,7,7,7,7,7,7,7,7,7,7,7",a7116dcbac3271ac12beb34229c61d41,何人 夜折苕 溪雪 吹 落山 堂 寄 清绝 梦回 轩 槛 非 人间 一岸 扶 疎 碎 残月 秋风 索索 秋意 晚 叶外 参差 明叠 𪩘 颇似 江南 短 棹 归 平沙 鴈 落 汀洲 远 苍 涛 遶 窗 碧玉 寒 中 有 渔父 千古 闲 知君 胸次 五湖 阔 波 声 髣 髴 游 杏坛 少林 之 孙 韵 枮 木 避世 避人 何用 逐 渭川 谩复 千亩 多 江上 由来 一苇 足
27182d0c-2e5c-4540-b55d-d0c775c2589d,再赋真觉僧房芦三首  其一,吕祖谦,唐,诗,七言绝句,湖山近减江湖趣 寂历颓垣仲蔚蒿 纵有秋风何处著 遶篱无叶起苍涛,"7,7,7,7",f281d90e7df41efb42d28a0780717e14,湖山 近 减 江湖 趣 寂 历 颓 垣 仲蔚蒿 纵 有 秋风 何处 著 遶篱 无 叶 起 苍 涛
6c834273-6892-40bc-ba97-77c05650c5d6,再赋真觉僧房芦三首  其二,吕祖谦,唐,诗,七言绝句,屋角清渠濑浅沙 风斜雨重倒苍葭 沙鸥不下投前浦 塞雁重来失旧花,"7,7,7,7",fc2d360c54b07a188cb570646e8cb38e,屋角 清渠 濑浅沙 风斜雨 重倒 苍葭 沙鸥 不下 投前 浦 塞雁 重来 失旧 花
73a6cd3b-5d6e-44be-9c6b-92dd13fb54a2,再赋真觉僧房芦三首  其三,吕祖谦,唐,诗,七言绝句,清晓霜钟唤客兴 余声知度几棱层 烟霞深处无人到 时见凭栏一两僧,"7,7,7,7",b573d32ff8dd80f1012b58f9611d05e1,清晓霜 钟唤 客兴 余声 知度 几 棱层 烟霞 深处 无人 到 时 见 凭栏 一两 僧
4aceed65-4a28-4b07-b0ef-38d56d1f0ccc,汉铜弩机歌,吕祖谦,唐,诗,七言古体,甘泉宫中烽火催 武库掣鏁殷春雷 山西都尉部千弩 意气欲压天山摧 朔风惨惨随旗尾 角声满天日色死 眼吞单于方发机 南风不竞羽倒飞 血视空弮尚思战 边庭无竹可续箭 断弦已作塞上尘 零落铜牙时一见 土花蚀尽缪篆青 千年遗恨今未平 雕鞍过尽不回首 落身几案依书檠 藓苔暗淡生古色 中有少卿千斛力 从汉至今无大黄 妇玩儿嬉固其职 长平箭头豪士怜 赤壁折戟传青篇 古来慷慨共如此 脱畧形器求天全 是机虽缺神凛然 想成风沙射雕天 径欲匹马南山边 何必一臂三十絭,"7,7,7,7,7,7,7,7,7,7,7,7,7,7,7,7,7,7,7,7,7,7,7,7,7,7,7,7",5f68db112ca33a64ec3e8114bb8c3488,甘泉 宫中 烽火 催 武库 掣 鏁 殷 春雷 山西 都尉 部 千弩 意气 欲 压 天山 摧 朔风 惨惨 随旗尾 角声 满天 日 色 死 眼 吞 单于 方发机 南风不竞 羽 倒 飞 血视 空 弮 尚 思 战 边庭 无 竹 可续 箭 断弦 已 作 塞上 尘 零落 铜牙 时 一 见 土花 蚀 尽 缪 篆 青 千年 遗恨 今 未 平 雕鞍 过尽 不 回首 落身 几案 依 书 檠 藓苔 暗淡 生古色 中 有 少 卿 千 斛 力 从汉 至今 无 大黄 妇 玩儿 嬉固 其职 长平 箭头 豪士 怜 赤壁 折戟 传青篇 古来 慷慨 共 如此 脱 畧 形 器 求 天全 是 机 虽 缺神 凛然 想 成 风沙 射雕 天 径 欲 匹马 南山 边 何必 一 臂 三十 絭
2deb8439-12aa-4ea9-ab9d-ca4bf221f858,晚步溪上,吕祖谦,唐,诗,七言律诗,疎疎屐齿印平堤 露著乌纱客未知 别浦归舟争占岸 横林宿鸟自分枝 开张渔父胸中趣 漏泄骚人句外悲 会与清溪约长夏 风帘水簟答涟漪,"7,7,7,7,7,7,7,7",8ed772471f0bac0999e6a32582ccafb6,疎 疎 屐 齿印 平堤 露著 乌纱客 未知 别浦 归 舟 争 占 岸 横林 宿鸟 自 分枝 开张 渔父 胸中 趣 漏泄 骚人 句 外 悲 会 与 清溪 约 长 夏 风帘 水 簟 答 涟漪
8799750f-f0b8-4955-9e1f-a0f413a86019,秋日,吕祖谦,唐,诗,五言律诗,堂下梧桐树 清阴欲满帘 风前数叶落 枝外几山添 世故真难犯 幽栖不用占 新凉入书幌 好在邺侯签,"5,5,5,5,5,5,5,5",792125f2651b69830eeccc3b19781d89,堂 下 梧桐树 清 阴欲满帘 风 前 数叶 落 枝 外 几山 添 世故 真难 犯 幽 栖 不用 占 新 凉 入 书 幌 好 在 邺 侯 签
f6099bbb-ac3b-4619-94af-54359e8e3691,夏夜,吕祖谦,唐,诗,五言律诗,晚市收声尽 虚堂一味凉 炎蒸渠酷吏 闲静我羲皇 露沐疎萤湿 风梳细草长 典移无定在 随月转胡床,"5,5,5,5,5,5,5,5",cebc4b5486f90c4c2dcaaed580571e26,晚市 收声 尽 虚堂 一味 凉 炎 蒸渠 酷吏 闲静 我 羲 皇 露 沐 疎萤 湿 风梳 细草长 典移 无定 在 随月 转 胡床
f3949725-7642-42f1-acb3-3d1bdc05add8,应春坊挽章,吕祖谦,唐,诗,五言律诗,铅椠青灯夜 韬钤紫塞秋 请缨虽拜疏 投笔未封侯 帏白风烟惨 旗丹雾雨愁 从来桑梓接 助挽不成讴,"5,5,5,5,5,5,5,5",df2d37f28d21d1baf6725aa82c557f28,铅 椠 青灯 夜 韬钤 紫塞秋 请缨 虽 拜 疏 投笔 未 封侯 帏白 风烟 惨 旗 丹雾雨 愁 从来 桑梓 接 助 挽 不成 讴
fb31bd5a-294f-4d3d-ab9a-e649eba57cb2,和虞仲逸初夏怀黄岩村居,吕祖谦,唐,诗,七言律诗,几曲江村雨外明 钓矶渔屋入新晴 参天乔木浅深绿 盖水圆荷先后生 归梦每烦春鸟唤 故林可忍晓猿惊 功成共祖东门道 不负溪山旧主盟,"7,7,7,7,7,7,7,7",409bdd02e402bd9af2e8809375f9cd0f,几 曲江 村雨 外明 钓矶 渔屋 入 新 晴 参天 乔木 浅 深绿 盖水 圆 荷 先后 生 归梦 每 烦 春 鸟 唤 故林 可忍 晓猿 惊 功成 共祖 东门 道 不负 溪山 旧主 盟
f0205610-f81d-4e65-9722-62cf61586495,次前韵答石秀才,吕祖谦,唐,诗,七言律诗,幽轩返照可窗明 政用高谈答晚晴 共听铜瓶秋雨急 不知石鼎晓云生 清诗未读心先醉 别日无多梦已惊 闻道乌衣盛文史 祇愁异姓后宗盟,"7,7,7,7,7,7,7,7",5a7768b02040be071494cafdf14fae80,幽 轩 返照 可 窗明 政用 高 谈答 晚晴 共 听 铜 瓶 秋雨 急 不知 石鼎 晓云生 清 诗 未 读 心 先 醉 别日 无多梦 已 惊 闻道 乌衣盛 文史 祇 愁 异姓 后宗盟
242b574b-9602-4f13-a0f7-56a60d238667,效进士作三年通一经,吕祖谦,唐,诗,五言古体,岁月去如矢 横经徒慨然 谁能通一艺 真不负三年 用意窥园外 收功刻楮边 幽光回蠹简 新意出陈编 上相黄金重 诸儒白首鲜 同声不同调 叹息伯牙弦,"5,5,5,5,5,5,5,5,5,5,5,5",5c55d2b855020429246703b9352cac5d,岁月 去 如 矢 横 经徒 慨然 谁 能 通一艺 真 不负 三年 用意 窥 园外 收功刻 楮 边 幽光 回 蠹简 新意 出 陈 编 上 相 黄金 重 诸儒 白首 鲜 同声 不同 调 叹息 伯牙 弦
69e67d30-292d-4a23-9a14-c06f172ebc29,过九江赠同舍陈伯秀,吕祖谦,唐,诗,五言古体,异时夫子门 论交心独可 晨窗并几案 莫檠共灯火 同升大宗伯 道阻山砐硪 淡墨湿栖鸦 天开棘闱锁 高张三百丈 徧数不及我 咫尺判飞沈 鹏抟笑鸢堕 音尘两疎阔 岁月悉箭笴 风吹樊口帆 雨系浔阳柁 故人尚一尉 旌旗穿紫逻 相逢话旧游 拨置朱墨伙 握手忘寒温 屈指半𫐘轲 官居岸平湖 波涛日舂簸 饱看五老面 此计殊未左 山房旧闻名 欲往辄不果 须君发其藏 万卷书绕坐,"5,5,5,5,5,5,5,5,5,5,5,5,5,5,5,5,5,5,5,5,5,5,5,5,5,5,5,5,5,5",47a0af5d8f879006ba5dc4a961d68964,异 时 夫子 门 论交 心独可 晨窗 并 几案 莫 檠 共 灯火 同 升 大宗 伯 道 阻 山 砐 硪 淡墨 湿栖 鸦 天开 棘 闱 锁 高 张 三百丈 徧 数 不及 我 咫尺 判飞 沈 鹏 抟 笑 鸢 堕 音尘 两 疎 阔 岁月 悉 箭 笴 风吹 樊口 帆 雨系 浔阳 柁 故人 尚一尉 旌旗 穿 紫 逻 相逢 话 旧游 拨置 朱墨 伙 握手 忘 寒温 屈指 半 𫐘 轲 官 居岸 平湖 波涛 日 舂 簸 饱 看 五 老面 此 计 殊 未 左 山房 旧 闻名 欲 往辄 不果 须君 发 其 藏 万卷书 绕 坐
2119d018-a5c7-4e27-93f7-e60482058070,睢阳五老图赞,吕祖谦,唐,诗,七言律诗,同支派别胄遥遥 南渡衣冠尚北朝 千载画图文献在 两朝开济政明昭 公卿倡和遵皇运 嗣子传家念祖饶 幸得庆源流自远 匡扶人世释尘嚣,"7,7,7,7,7,7,7,7",b279c49e56668f5084122412afa9d045,同 支 派别 胄 遥遥 南渡 衣冠 尚 北朝 千载 画图 文献 在 两 朝 开济 政明 昭 公卿 倡 和 遵 皇运 嗣子 传家 念祖饶 幸得 庆 源流 自远 匡扶 人世 释 尘嚣
464d3dbf-36fe-496b-855a-ba44b9b33eef,方斋行,吕祖谦,唐,诗,七言古体,世皆尚圆君独方 富贵可取君不忙 闭门读书声琅琅 旧书重叠堆在床 点勘同异分边旁 运精竭思心力彊 十年足不离僧房 荒山野路秋水长 客虽欲至嫌路妨 幽兰无人为君芳 采菊落英充糇粮 客即不来有余香,"7,7,7,7,7,7,7,7,7,7,7,7",3ea643fd1949e8eb4044991ac3052918,世皆 尚圆君 独方 富贵 可取 君 不忙 闭门 读 书声琅琅 旧书 重叠 堆 在 床 点勘 同 异分 边旁 运精 竭思 心力 彊 十年 足 不离 僧房 荒山 野路 秋水 长 客 虽 欲 至 嫌路 妨 幽兰 无人 为 君 芳 采菊 落英 充 糇 粮 客 即 不 来 有 余香
