id,title,author,dynasty,genre,poem_type,sentences_simplified,meter_pattern,hash,words
8a58a614-17c5-466a-957e-ff337062d218,游春十二首 八,姚合,唐,诗,五言律诗,处处春光遍 游人亦不稀 向阳倾冷酒 看影试新衣 嫩树行移长 幽禽语旋飞 同来皆去尽 冲夜独吟归,"5,5,5,5,5,5,5,5",4ae641cc6d2d1385c407d4a561aaa119,处处 春光 遍 游人 亦 不稀 向阳 倾 冷酒 看 影试 新衣 嫩 树行 移长 幽禽 语旋 飞 同来 皆 去 尽 冲夜 独吟 归
50ca9831-47ce-4abe-b8a5-de350bdfd94a,游春十二首 九,姚合,唐,诗,五言律诗,朝朝看春色 春色似相怜 酒醒莺啼里 诗成蝶舞前 摘花盈手露 折竹满庭烟 亲故多相笑 疎狂似少年,"5,5,5,5,5,5,5,5",7dcb2de5c3e4cf46df0805aad7b33108,朝朝 看 春色 春色 似 相怜 酒醒 莺啼 里 诗 成 蝶舞 前 摘花 盈手 露 折竹 满庭 烟 亲故 多相 笑 疎 狂 似 少年
3b9a1107-1f79-40dd-81c2-32fbcdc0b7cb,游春十二首 十,姚合,唐,诗,五言律诗,卑官还不恶 行止得逍遥 晴野花侵路 春陂水上桥 尘埃生暖色 药草长新苗 看却烟光散 狂风处处飘,"5,5,5,5,5,5,5,5",3c8df2536cd9721d1cca19322520f3b3,卑官 还 不恶 行止 得 逍遥 晴 野花 侵路 春 陂 水上 桥 尘埃 生 暖色 药草 长 新苗 看 却 烟光散 狂风 处处 飘
0327b3fd-a962-4cb5-9e0c-83ecaf751252,游春十二首 十一,姚合,唐,诗,五言律诗,身被春光引 经时更不归 嚼花香满口 书竹粉黏衣 弄日莺狂语 迎风蝶倒飞 自知疎嬾性 得事亦应稀,"5,5,5,5,5,5,5,5",419b3269d43ea1ae30e204ee4d2a2968,身 被 春光 引 经时 更 不 归 嚼 花香 满口 书 竹粉 黏衣 弄 日 莺 狂语 迎风 蝶 倒 飞 自知 疎 嬾 性 得 事 亦 应 稀
41eae769-5ec5-463e-8398-b9f6493f2855,游春十二首 十二,姚合,唐,诗,五言律诗,晓脱青衫出 闲行气味长 一瓶春酒色 数顷野花香 朝客闻应羡 山僧见亦狂 不将僮仆去 恐为损风光,"5,5,5,5,5,5,5,5",2a6f1c1c79cd17a5f246dc8b8976ad20,晓脱 青衫 出 闲行 气味 长 一瓶 春 酒色 数顷 野花 香 朝 客闻 应羡 山僧 见 亦 狂 不 将 僮仆 去 恐为 损 风光
c4f92a5b-e448-4ebb-b7cc-788dcf57cc56,赏春,姚合,唐,诗,七言律诗,闲人祗是爱春光 迎得春来喜欲狂 买酒怕迟教走马 看花嫌远自移床 娇莺语足方离树 戏蝶飞高始过墙 颠倒醉眠三数日 人间百事不思量,"7,7,7,7,7,7,7,7",8ee1dcdff44655b79ff38c22cb40dbd6,闲人 祗 是 爱 春光 迎得 春来 喜欲狂 买酒 怕 迟 教 走马 看 花 嫌 远自 移床 娇 莺语 足 方离树 戏蝶 飞 高始 过 墙 颠倒 醉眠 三数日 人间 百事 不 思量
b2d14d5b-7cc1-4243-8557-d9f2fbd1482b,春日即事,姚合,唐,诗,五言律诗,春来眠不得 谁复念生涯 夜听四邻乐 朝寻九陌花 轻烟浮草色 微雨濯年华 乞假非关病 朝衣在酒家,"5,5,5,5,5,5,5,5",c3b71f3102a24895eab9bc3b56c86552,春来 眠 不得 谁 复念 生涯 夜 听 四邻 乐 朝 寻九陌 花 轻 烟 浮 草色 微雨 濯 年华 乞假 非 关病 朝衣 在 酒家
71a6362f-1573-4537-b64b-d7aa7a0717f5,春日江次,姚合,唐,诗,五言律诗,野步出茆斋 闲行坐石台 久悲乡路远 犹喜杏花开 鸥鹭皆飞去 帆樯何处来 因凝千里目 落日尚徘徊,"5,5,5,5,5,5,5,5",98404ed0a9f0a8e4db559e68b113d23e,野 步出 茆 斋 闲行 坐 石台 久 悲 乡 路 远 犹喜 杏花 开 鸥 鹭 皆 飞去 帆樯 何处 来 因凝 千里目 落日 尚 徘徊
c4a046cc-ff98-437d-b8ae-881274efe64b,扬州春词三首 一,姚合,唐,诗,五言律诗,广陵寒食天 无雾复无烟 煖日凝花柳 春风散管弦 园林多是宅 车马少于船 莫唤游人住 游人困不眠,"5,5,5,5,5,5,5,5",8e00178c072ce22fcb2677dc0079d006,广陵 寒食 天 无雾复 无烟 煖 日 凝 花柳 春风 散 管弦 园林 多 是 宅 车马 少于 船 莫唤 游人 住 游人 困不眠
7ded0943-f1e2-4bb8-ae6d-bbd4542b23e7,扬州春词三首 二,姚合,唐,诗,五言律诗,满郭是春光 街衢土亦香 竹风轻履舃 花露腻衣裳 谷鸟鸣还艳 山夫到更狂 可怜游赏地 炀帝国倾亡,"5,5,5,5,5,5,5,5",e1acd8669168e5d11017b3cdd8aff236,满郭 是 春光 街衢 土 亦 香 竹风 轻 履 舃 花露 腻 衣裳 谷 鸟鸣 还 艳 山夫 到 更 狂 可怜 游赏 地 炀帝 国 倾亡
7f5138f9-63f2-4ee1-b651-c3560b9a60a0,扬州春词三首 三,姚合,唐,诗,五言律诗,江北烟光里 淮南胜事多 市鄽持烛入 邻里漾船过 有地惟栽竹 无家不养鹅 春风荡城郭 满耳是笙歌,"5,5,5,5,5,5,5,5",cdb8fcfc1e7b0a3e4803f764543811e2,江北 烟光 里 淮南 胜事 多 市 鄽 持 烛 入 邻里 漾 船 过 有地 惟 栽 竹 无家不养鹅 春风 荡 城郭 满 耳 是 笙歌
13382b76-2ff1-430b-8475-2d0a3cbdef3f,寒食二首 一,姚合,唐,诗,五言律诗,今朝一百五 出户雨初晴 舞爱双飞蝶 歌闻百啭莺 江深青草岸 花满白云城 为政多孱懦 应无酷吏名,"5,5,5,5,5,5,5,5",a633697436dc7139ef5f040d84d4af76,今朝 一百 五 出户 雨初 晴 舞 爱 双飞 蝶 歌闻 百 啭 莺 江 深 青草 岸 花满 白云 城 为政 多 孱懦 应无 酷吏 名
6e6b95c4-65b6-4cc9-9b5e-ff5461ed464c,寒食二首 二,姚合,唐,诗,五言律诗,出城烟火少 况复是今朝 闲坐将谁语 临觞只自谣 堦前春藓徧 衣上落花飘 伎乐州人戏 使君心寂寥,"5,5,5,5,5,5,5,5",0d3ff4bbabaad5f94aa51b21831a40b8,出 城 烟火 少 况复 是 今朝 闲坐 将 谁 语 临觞 只 自 谣 堦前春藓 徧 衣 上 落花 飘 伎 乐州 人戏 使君 心 寂寥
f5763570-1110-4202-9c30-4c8fff33ff39,暮春书事,姚合,唐,诗,五言律诗,穷巷少芳菲 苍苔一径微 酒醒闻客别 年长送春归 宿愿眠云峤 浮名系锁闱 未因丞相庇 难得脱朝衣,"5,5,5,5,5,5,5,5",6b61650073840014d088be782047acf4,穷巷 少 芳菲 苍苔 一径微 酒醒 闻客 别 年长 送 春 归 宿愿 眠 云峤 浮名 系锁闱 未 因 丞相 庇 难得 脱朝衣
a0a326e6-2128-4fea-ac0c-7a87c934a062,春晚雨中,姚合,唐,诗,五言律诗,寂寂春将老 闲人强自欢 迎风莺语涩 带雨蝶飞难 傍砌木初长 眠花景渐阑 临轩平目望 情思若为宽,"5,5,5,5,5,5,5,5",cb54d1c1a2e3d06f37085de291ade5f4,寂寂 春 将 老 闲人 强 自欢 迎风 莺语 涩 带 雨蝶飞 难 傍 砌 木 初 长 眠 花景 渐 阑 临轩平目望 情思 若为 宽
2b18f67e-8081-4aac-a7bc-f7800e3feae3,送春,姚合,唐,诗,五言律诗,昨迎今复送 来晚去逡巡 芳尽空繁树 愁多独病身 静思倾酒嬾 闲望上楼频 为向春风道 明年早报春,"5,5,5,5,5,5,5,5",3b28bbacf13e8635fa0ef8aedebddba4,昨 迎今 复送 来 晚去 逡巡 芳 尽 空繁 树 愁多独病身 静思 倾 酒 嬾 闲望 上楼 频 为 向 春风 道 明年 早报 春
59b515ba-c71f-46fd-98cd-03d889532e88,别春,姚合,唐,诗,七言律诗,留春不得被春欺 春若无情遣泥谁 寂寞自疑生冷病 凄凉还似别亲知 随风未辨归何处 浇酒唯求住少时 一去近当三百日 从朝至夜是相思,"7,7,7,7,7,7,7,7",1834e83730ff70974eacbe309dbb8d02,留 春 不得 被 春 欺 春若 无情 遣 泥 谁 寂寞 自疑 生冷 病 凄凉 还 似别 亲知 随风 未 辨归 何处 浇酒 唯求 住 少时 一 去近 当 三百 日 从朝 至夜 是 相思
ea0eb551-059a-4cce-8fc6-950155b17ec3,夏夜,姚合,唐,诗,五言律诗,闲斋深夜静 独坐又闲行 密树月笼影 疎篱水隔声 断猨时叫谷 栖鸟每摇柽 寂寞求名士 谁知此夕情,"5,5,5,5,5,5,5,5",8b88c352f066e03ce8e25ca4cb0fb110,闲 斋 深夜 静 独坐 又 闲行 密树 月笼 影 疎篱 水 隔声 断 猨 时 叫 谷 栖 鸟 每 摇 柽 寂寞 求 名士 谁知 此夕 情
134127c0-b1fd-4369-b7c8-986f86b06fea,秋日有怀,姚合,唐,诗,五言律诗,秋来不复眠 但觉思悠然 菊色欲经露 虫声渐替蝉 诗情生酒里 心事在山边 旧里无因到 西风又一年,"5,5,5,5,5,5,5,5",eaa737655924bbc1124fa1973153eb5e,秋来 不 复眠 但 觉思 悠然 菊 色欲 经露 虫声 渐 替 蝉 诗情 生酒 里 心事 在 山边 旧 里 无 因 到 西风 又 一年
c2e27cd4-9cf4-4679-874e-0aaa3de2b713,秋夕遣怀,姚合,唐,诗,五言律诗,昨宵白露下 秋气满山城 风劲衣巾脆 窗虚笔墨轻 临书爱真迹 避酒怕狂名 祗拟随麋鹿 悠悠过一生,"5,5,5,5,5,5,5,5",239793c247adc67aa76faab17fe67615,昨宵 白露 下 秋气 满 山城 风劲 衣巾 脆 窗虚 笔墨 轻 临书 爱 真迹 避酒 怕 狂名 祗 拟 随 麋鹿 悠悠 过 一生
42efbc7c-2dd8-4d50-b5a9-344642e25223,秋中夜坐,姚合,唐,诗,五言绝句,疎散永无事 不眠常夜分 月中松露滴 风引鹤同闻,"5,5,5,5",108381ea4fbc713d68e66f5b9c58c69b,疎 散 永无 事 不眠 常 夜分 月 中 松露 滴 风引鹤 同闻
0e550ae0-942e-49ad-94d3-9db5f291fceb,同卫尉崔少卿九月六日饮,姚合,唐,诗,五言律诗,酒熟菊还芳 花飘盏亦香 与君先一醉 举世待重阳 风色初晴利 虫声向晚长 此时如不饮 心事亦应伤,"5,5,5,5,5,5,5,5",3e8642b7778ee8b6cc335162689bf641,酒 熟 菊 还 芳 花 飘 盏 亦 香 与 君 先 一 醉 举世 待 重阳 风色 初晴利 虫声 向晚 长 此时 如 不 饮 心事 亦 应伤
a52eac00-0de8-4559-94e9-2c92044f126e,九日忆砚山旧居,姚合,唐,诗,五言律诗,帝里闲人少 谁同把酒桮 砚山篱下菊 今日几枝开 晓角惊眠起 秋风引病来 长年归思切 更值雁声催,"5,5,5,5,5,5,5,5",150e4fa7d741ed85f7c8ebbc2cdf5861,帝里 闲人 少 谁 同 把酒 桮 砚山 篱下 菊 今日 几枝 开 晓角 惊眠 起 秋风 引病 来 长年 归思切 更值 雁声 催
ca1d24d4-4786-4bef-8d2d-02c62f8f38a8,秋晚江次,姚合,唐,诗,五言律诗,萧萧晚景寒 独立望江壖 沙渚几行鴈 风湾一只船 落霞澄返照 孤屿隔微烟 极目思无尽 乡心到眼前,"5,5,5,5,5,5,5,5",1c914814117a39d64fd5b04ad655c07c,萧萧 晚景 寒 独立 望江 壖 沙渚 几行 鴈 风湾 一只 船 落霞 澄 返照 孤屿 隔 微烟 极目 思 无尽 乡心 到 眼前
e885eaff-e326-4188-91b3-96dee2f198d0,除夜二首 一,姚合,唐,诗,五言律诗,衰残归未遂 寂寞此宵情 旧国当千里 新年隔数更 寒犹近北峭 风渐向东生 谁见长安陌 晨钟度火城,"5,5,5,5,5,5,5,5",ec2b32044c004afcc1b9a82ab6f09f87,衰残 归 未遂 寂寞 此宵 情 旧国 当 千里 新年 隔数 更 寒犹 近北 峭 风 渐 向东 生 谁 见 长安 陌 晨钟 度 火城
a4e5f63d-176c-4677-8f92-f1246e386160,除夜二首 二,姚合,唐,诗,五言律诗,慇懃惜此夜 此夜在逡巡 烛尽年还别 鸡鸣老更新 傩声方去疫 酒色已迎春 明日持杯处 谁为最后人,"5,5,5,5,5,5,5,5",ff7fd5865aa4757387df19f8428e51aa,慇 懃 惜 此 夜 此夜 在 逡巡 烛 尽年 还 别 鸡鸣 老 更新 傩 声方 去 疫 酒色 已 迎春 明日 持 杯 处 谁 为 最后 人
32984601-8267-4833-afa7-1b425d1faa86,晦日送穷三首 一,姚合,唐,诗,五言绝句,年年到此日 沥酒拜街中 万户千门看 无人不送穷,"5,5,5,5",4f81519eaf435539e7ad36750654770a,年 年 到 此日 沥酒 拜 街中 万户千门 看 无人 不 送 穷
2e6a3bc5-b392-4832-a02b-f776b63abfb0,晦日送穷三首 二,姚合,唐,诗,五言绝句,送穷穷不去 相泥欲何为 今日官家宅 淹留又几时,"5,5,5,5",dab911c9b356e6b65d322c13058db424,送 穷穷不去 相泥 欲 何为 今日 官家 宅 淹留 又 几时
ce41b67a-3235-459e-8648-1a2d138f203d,晦日送穷三首 三,姚合,唐,诗,五言绝句,古人皆恨别 此别恨消魂 只是空相送 年年不出门,"5,5,5,5",13c67899d7064def07e9ecbe0c906381,古人 皆 恨别 此 别 恨 消魂 只是 空相 送 年年 不 出门
012c08f7-eb3b-4f39-bd56-b7b85e2820c6,咏云,姚合,唐,诗,七言律诗,霭霭纷纷不可穷 戛笙歌处尽随龙 来依银汉一千里 归傍巫山十二峰 呈瑞每闻开丽色 避风仍见挂乔松 怜君翠染双蝉鬓 镜里朝朝近玉容,"7,7,7,7,7,7,7,7",1b69433c286a02b6c1aa40d94eeb9a78,霭霭 纷纷 不可 穷 戛 笙歌 处 尽 随 龙 来 依 银汉 一千里 归 傍 巫山 十二峰 呈 瑞 每 闻 开 丽色 避风 仍 见 挂 乔松 怜 君 翠 染 双 蝉 鬓 镜 里 朝 朝 近 玉容
4d040743-238d-4421-b6ce-701d86f1892a,咏雪,姚合,唐,诗,七言律诗,愁云残腊下阳台 混却乾坤六出开 与月交光呈瑞色 共花争艳傍寒梅 飞随郢客歌声远 散逐宫娥舞袖回 其那知音不相见 剡溪乘兴为君来,"7,7,7,7,7,7,7,7",9691cb84841b7bb1b8778cdfec9f7c72,愁云 残 腊 下 阳台 混 却 乾坤 六出 开 与 月 交光 呈 瑞色 共花 争艳 傍 寒梅 飞 随 郢 客 歌声 远 散 逐 宫娥 舞袖 回 其 那 知音 不 相见 剡溪 乘兴 为 君 来
8c66a34d-a5d3-4154-a785-5f60f42565ae,郡中对雪,姚合,唐,诗,五言律诗,霏微著草树 渐布与阶平 远近如空色 飘飏无落声 飞鸦疑翅重 去马觉蹄轻 遥想故山下 樵夫应滞行,"5,5,5,5,5,5,5,5",c1611268f6e8fc8ff2f1aa4e2b42657f,霏微 著 草树 渐布 与 阶平 远近 如 空色 飘 飏 无 落 声 飞鸦 疑翅重 去 马觉 蹄轻 遥想 故 山下 樵夫 应滞 行
1d8f9ea1-7c40-4b6d-9245-64a850c85149,对月,姚合,唐,诗,七言绝句,银轮玉兔向东流 莹净三更正好游 一片黑云何处起 皂罗笼却水精毬,"7,7,7,7",a8a4426a5e6a8cadb5d8dd96357f7311,银轮 玉兔 向东流 莹 净 三 更 正好 游 一片 黑云 何处 起 皂罗笼 却 水精 毬
372fe890-a023-4ef4-9f6d-4ce2b6291487,八月十五夜看月,姚合,唐,诗,五言律诗,亭亭千万里 三五复秋中 此夕光应绝 常时思不同 九霄微有露 四海静无风 惆怅逡巡别 谁能看碧空,"5,5,5,5,5,5,5,5",353447d868bd4473ed26cb7cb89a90ca,亭亭 千万里 三五 复秋 中 此夕 光应 绝 常时 思 不同 九霄 微 有露 四海 静无风 惆怅 逡巡 别 谁 能 看 碧空
9b5ecbe4-82b1-4618-90a5-6b803ff38bf9,赋月华临静夜,姚合,唐,诗,五言古体,长空埃𡏖灭 皎皎月华临 色正秋将半 光鲜夜自深 九霄晴更彻 四野气难侵 静照遥山出 孤明列宿沈 高人应不寐 惊鹊复何心,"5,5,5,5,5,5,5,5,5,5",f24d01c7b29edfc7d726f193dd1008f6,长空 埃 𡏖 灭 皎皎 月华 临 色 正秋 将半 光鲜 夜 自 深 九霄 晴 更 彻 四野 气难 侵 静照 遥山 出 孤明列宿 沈 高 人 应 不寐 惊鹊复何心
7031d564-be3d-4e8c-a178-fa82e689d859,酬任畴协律夏中苦雨见寄,姚合,唐,诗,五言古体,银汉波澜溢 经旬雨未休 细听宜隔牖 远望忆高楼 风急飘还断 云低落更稠 走童惊掣电 饥鸟啄浮沤 丝网张空际 蛛绳续瓦沟 青蛙多入户 潢潦欲胜舟 雷怒疑山破 池浑似土流 灰人漫禳厌 水马恣沈浮 广陌应翻浪 贫居恐作湫 阳精藏不耀 阴气盛难收 远色重林暮 繁声四壁秋 望晴思见日 防冷欲披裘 枕润眠还嬾 车羸出转忧 散空烟漠漠 迸溜竹修修 树暗蝉吟咽 巢倾燕语愁 琴书凉簟净 灯烛夜窗幽 天下那能向 龙边岂易求 湿烟凝灶额 荒草覆墙头 酒思凄方罢 诗情耿始抽 下床先仗屐 汲井恐飘瓯 危坐徒相忆 佳期未有由 劳君寄新什 终日不能酬,"5,5,5,5,5,5,5,5,5,5,5,5,5,5,5,5,5,5,5,5,5,5,5,5,5,5,5,5,5,5,5,5,5,5,5,5,5,5,5,5,5,5,5,5",e186a08857b172cd2f673b0417c004bd,银汉 波澜 溢 经 旬 雨 未 休 细 听 宜 隔 牖 远望 忆 高楼 风 急飘 还断 云 低落 更 稠 走童 惊 掣电 饥鸟 啄 浮 沤 丝网 张 空际 蛛绳 续 瓦沟 青蛙 多 入户 潢潦欲胜 舟 雷怒 疑 山 破 池 浑似 土流 灰人 漫 禳 厌 水马 恣沈 浮 广 陌 应 翻 浪 贫居 恐 作 湫 阳精藏 不耀 阴气 盛 难 收 远色 重林 暮 繁声 四壁 秋 望晴思 见 日 防冷 欲 披 裘 枕润 眠 还 嬾 车 羸出 转 忧 散空 烟 漠漠 迸 溜 竹 修修 树暗 蝉吟 咽 巢倾 燕语 愁 琴书 凉 簟 净 灯烛 夜 窗 幽 天下 那 能 向 龙 边 岂 易求 湿 烟凝灶 额 荒草 覆 墙头 酒思 凄方 罢 诗情 耿 始 抽 下床 先 仗 屐 汲井恐 飘 瓯 危坐 徒 相忆 佳期 未有 由 劳君 寄新 什 终日 不能 酬
6bf4c054-d1e0-432d-8f7a-b1bdb667bc35,和座主相公雨中作,姚合,唐,诗,五言古体,清气润华屋 东风吹雨匀 花低惊艳重 竹净觉声真 山际凝如雾 云中散似尘 萧萧下碧落 点点救生民 缓洒雷霆细 微沾瓦砾新 诗成难继和 造化笔通神,"5,5,5,5,5,5,5,5,5,5,5,5",df37efac3bd334e473e2974c9d7212f6,清 气润 华屋 东风 吹 雨 匀 花 低 惊艳 重 竹 净觉 声 真 山际 凝 如雾 云中 散似 尘 萧萧 下 碧落 点点 救生 民 缓洒 雷霆 细 微 沾 瓦砾 新 诗 成 难继 和 造化 笔 通神
0113f856-278b-4fd5-8ff2-ef1516543fbf,恶神行雨,姚合,唐,诗,七言律诗,凶神扇𥳽恶神行 汹涌挨排白雾生 风击水凹波扑凸 雨漴山口地嵌坑 龙喷黑气翻腾滚 鬼掣红光劈划揁 哮吼忽雷声揭石 满天啾唧闹轰轰,"7,7,7,7,7,7,7,7",a6c9130de3bf0a8f13bcb6659385ab0d,凶神 扇 𥳽 恶神 行 汹涌 挨排 白雾 生 风 击水 凹 波 扑 凸 雨 漴 山口 地嵌坑 龙喷 黑气 翻腾 滚 鬼 掣 红光 劈 划 揁 哮吼 忽 雷声 揭石 满天 啾 唧 闹 轰轰
278ca1e4-c864-4792-a5ee-302b3b8ff195,苦雨,姚合,唐,诗,五言律诗,江昏山半晴 南阻绝人行 葭菼连云色 松杉共雨声 早秋仍燕舞 深夜更鼍鸣 为报迷津客 讹言未可轻,"5,5,5,5,5,5,5,5",ddbf4327e929193653f0f296c9dbda9d,江昏山 半 晴 南 阻绝 人行 葭 菼 连云 色 松杉共 雨声 早秋 仍 燕舞 深夜 更 鼍 鸣 为 报 迷津 客 讹言 未 可轻
f10e0221-c19e-48b1-93ad-3e472ff907e7,题凤翔西郭新亭,姚合,唐,诗,五言古体,西郭尘埃外 新亭制度奇 地形当要处 人力是闲时 结搆方殊绝 高低更合宜 栋梁清俸买 松竹远山移 佛寺幽难敌 仙家景可追 良工慙巧尽 上客恨逢迟 两面寒波涨 当前软柳垂 清虚宜月入 凉冷胜风吹 宴赏军容静 登临妓乐随 鱼龙听弦管 凫鹤识旌旗 泛鹢春流阔 飞觞白日欹 闲花长在户 嫩藓乍缘墀 永望情无极 频来困不辞 云峰晴转翠 烟树晓逾滋 向野惟贪静 临空遽觉危 行人如不到 游乐更何为,"5,5,5,5,5,5,5,5,5,5,5,5,5,5,5,5,5,5,5,5,5,5,5,5,5,5,5,5,5,5,5,5",1f444f10cd62c1b1ce3127d8b30d8623,西郭 尘埃 外 新亭 制度 奇 地形 当要 处 人力 是 闲时 结 搆 方 殊 绝 高低 更 合宜 栋梁 清 俸 买 松竹 远山 移 佛寺 幽难 敌 仙 家景 可 追 良 工 慙 巧 尽 上 客 恨 逢 迟 两面 寒波 涨 当前 软 柳 垂 清虚 宜 月入 凉冷 胜 风吹 宴赏 军容 静 登临 妓乐 随 鱼龙 听 弦 管 凫鹤 识 旌旗 泛 鹢 春 流 阔 飞觞 白日 欹 闲花长 在 户 嫩藓 乍 缘墀 永望 情 无极 频来 困不辞 云峰晴 转 翠 烟树 晓 逾 滋 向野 惟 贪静 临空 遽觉 危 行人 如 不到 游乐 更 何为
6370019c-cebc-4327-a50a-e1fe227718f3,题金州西园九首 江榭,姚合,唐,诗,五言古体,亭亭白云榭 下有清江流 见江不得亲 不如波上鸥 有榭江可见 无榭无双眸,"5,5,5,5,5,5",d8dc0aaa97d3efdb17b95c0a6cb032a1,亭亭 白云 榭 下 有 清江 流 见 江 不得 亲 不如 波上鸥 有 榭 江 可见 无榭无 双眸
584b73b9-aff3-4486-94cf-78ceb3aef9fc,题金州西园九首 药堂,姚合,唐,诗,五言古体,僮仆不到阈 双扉常自关 四壁画远水 堂前耸秋山 时闻有仙鼠 窃药簷隙间,"5,5,5,5,5,5",a01b1c2e56deb42d5cbb59da4aa6ada2,僮仆 不到 阈 双扉 常自 关 四 壁画 远 水 堂 前 耸 秋 山 时闻 有 仙鼠 窃 药 簷 隙间
f3d670ef-e4f8-4a68-a788-8e4ad1e26a03,题金州西园九首 草阁,姚合,唐,诗,五言古体,编草覆柏椽 轩扉皆竹织 合成似僧居 学僧居未得 有时公府劳 还复来此息,"5,5,5,5,5,5",eb5c2de646ec2bcf6e6891486f68abae,编草 覆 柏 椽 轩扉 皆 竹织 合成 似 僧 居 学僧 居未 得 有时 公府 劳 还 复来 此 息
55b7ee47-2a20-4fb0-809a-bbad81776117,题金州西园九首 松坛,姚合,唐,诗,五言古体,盘盘松上盖 下覆青石坛 月中零露垂 日出露尚漙 山翁称绝境 海桥无所观,"5,5,5,5,5,5",94e39c28cfba7a99683e8906eb625d25,盘盘松 上盖 下覆 青石 坛 月 中 零 露垂 日出 露 尚 漙 山翁 称 绝境 海桥 无所观
8f56cb26-2cea-40b9-8db2-86a92c47d8bd,题金州西园九首 葼径,姚合,唐,诗,五言古体,药院径亦高 往来踏葼影 方当繁暑日 草𪨗微微冷 爱此不能行 折薪坐煎茗,"5,5,5,5,5,5",dbe3ab585d19846b0b2fba92827f4354,药院 径 亦 高 往来 踏 葼 影 方当 繁暑 日 草 𪨗 微微 冷 爱 此 不能 行 折薪 坐 煎 茗
9e752556-5028-4859-980f-1550bd4050ac,题金州西园九首 垣竹,姚合,唐,诗,五言古体,种竹爱庭际 亦以资玩赏 穷秋雨萧条 但见墙垣长 宣尼高数仞 固应非土壤,"5,5,5,5,5,5",128750e28c46357fbec2754afcdf0591,种竹 爱庭际 亦 以 资 玩赏 穷 秋雨 萧条 但 见 墙垣 长 宣尼 高数 仞 固应非 土壤
6670ed57-670b-4c27-b984-b3afe617a896,题金州西园九首 石庭,姚合,唐,诗,五言古体,布石满山庭 磷磷洁还清 幽人常履此 月下屐齿鸣 药草枝叶动 似向山中生,"5,5,5,5,5,5",4708769fe119a8d362ba8bbac89b0e50,布石 满山 庭 磷磷 洁 还清 幽人 常履此 月 下 屐 齿 鸣 药草 枝叶 动 似向 山中 生
4704b7da-b988-4c89-aa15-502881ebe6a6,题金州西园九首 莓苔,姚合,唐,诗,五言古体,茅堂阶岂高 数寸是苔藓 只恐秋雨中 窗户亦不溅 眼前无此物 我情何由遣,"5,5,5,5,5,5",bab326f82523d4eacb6e0b156d9fe10b,茅堂阶 岂 高 数寸 是 苔藓 只恐 秋雨 中 窗户 亦 不 溅 眼前 无 此物 我 情何 由 遣
c665aab3-22a8-4fdc-9653-597c45ab3592,题金州西园九首 芭蕉屏,姚合,唐,诗,五言古体,芭蕉丛丛生 月照参差影 数叶大如墙 作我门之屏 稍稍闻见稀 耳目得安静,"5,5,5,5,5,5",326bfe34f918f1e8dcf517731c67914d,芭蕉 丛 丛生 月 照 参差 影 数叶 大 如 墙 作 我 门 之 屏 稍稍 闻见 稀 耳目 得 安静
8e0f1791-98e2-4cc2-8b14-4ee2aa1c6664,杏溪十首 杏溪,姚合,唐,诗,五言古体,桃花四散飞 桃子压枝垂 寂寂青阴里 幽人举步迟 慇懃念此径 我去复来谁,"5,5,5,5,5,5",855af53f3401c5ff17d421719fdad38e,桃花 四散 飞 桃子 压枝 垂 寂寂 青阴 里 幽 人 举步 迟 慇 懃 念 此 径 我 去 复来 谁
840ef4eb-4fc6-452e-b78d-fb6c5e65db73,杏溪十首 莲塘,姚合,唐,诗,五言古体,方塘菡萏高 繁艳相照耀 幽人夜眠起 忽疑野中烧 晓寻不知休 白石岸亦峭,"5,5,5,5,5,5",9b79c51ed2ab0c37b04d92720915bf9d,方塘 菡萏 高 繁艳 相 照耀 幽人 夜眠 起 忽疑 野中 烧 晓寻 不知 休 白石 岸 亦 峭
b8e031d3-d542-4cd0-b3d9-9f00c2841660,杏溪十首 架水藤,姚合,唐,诗,五言古体,蒙蒙紫花藤 下复清溪水 若遣随波流 不如风飘起 风飘或近堤 随波千万里,"5,5,5,5,5,5",45ff8879077802f42c55b8c0b59370f1,蒙蒙 紫花 藤 下复 清 溪水 若 遣随 波流 不如 风 飘起 风 飘 或 近 堤 随 波 千万里
174ea8b8-9870-4f2d-b38a-9f54c5a8526c,杏溪十首 石潭,姚合,唐,诗,五言古体,晓向潭上行 夕就潭边宿 清冷无波澜 潎潎鱼相逐 钓翁坐不起 见我往来熟,"5,5,5,5,5,5",5651b97978d099740578bdc9f31a4d9f,晓向潭 上行 夕 就 潭边 宿 清冷 无 波澜 潎 潎 鱼 相 逐 钓翁 坐不起 见 我 往来 熟
04dd77dd-ddb4-4351-ad0d-0cb988262b35,杏溪十首 溪路,姚合,唐,诗,五言古体,此路何潇洒 永无公卿迹 日日多往来 藜杖与桑屐 路边何所有 磊磊青渌石,"5,5,5,5,5,5",b145c080e4596075fc6d8a7aa647b0a5,此路 何 潇洒 永无 公卿 迹 日日 多 往来 藜 杖 与 桑屐 路边 何 所有 磊磊 青渌石
a1d34136-d364-4fd6-bc9b-78d139f9d11b,杏溪十首 望江峰,姚合,唐,诗,五言古体,念昔有此峰 在彼江陵先 举世未能知 愚亦望同贤 我来心益闷 欲上天公牋,"5,5,5,5,5,5",a2001252a8456cf280e6200bd1edaeea,念昔有此峰 在 彼 江陵 先 举世 未能 知 愚亦望同贤 我 来 心益 闷 欲 上 天公 牋
b198c284-e998-44fa-8c3e-eeb07f493739,杏溪十首 杏水,姚合,唐,诗,五言古体,不与江水接 自出林中央 穿花复远水 一山闻杏香 我来持茗瓯 日屡此来尝,"5,5,5,5,5,5",fc6f803dbf394036c3def3feaef7ba4e,不 与 江水 接 自出 林 中央 穿 花 复远 水 一 山 闻杏香 我 来持 茗 瓯 日 屡此 来尝
9c830533-c2a4-41a4-94fc-4937bcfbcb74,杏溪十首 渚上竹,姚合,唐,诗,五言古体,叶叶新春筠 下复清浅流 微风屡此来 决决复修修 诗人月下吟 月堕吟不休,"5,5,5,5,5,5",e90e6e14c4a7c9b8c57ac88527201645,叶叶 新春 筠 下复 清浅 流 微风 屡此 来 决决 复 修修 诗人 月 下吟 月 堕吟 不休
7c598b1f-1f69-42bc-9308-32d38c39b674,杏溪十首 枫林堰,姚合,唐,诗,五言古体,森森枫树林 护此石门堰 杏隄数里余 枫影覆亦徧 鸬鹚与钓童 质异同所愿,"5,5,5,5,5,5",39bed627ed0e4922043672a7a446dc49,森森 枫树 林 护 此 石门 堰 杏 隄 数里 余 枫 影 覆 亦 徧 鸬鹚 与 钓童 质 异同 所 愿
aaf9b941-19d9-4fd4-93fc-a21c6bd5a1f9,杏溪十首 石濑,姚合,唐,诗,五言古体,散漫复潺湲 半砂半和石 清风波亦无 历历鱼可搦 我来亦屡久 归路常日夕,"5,5,5,5,5,5",aec003d7fa7553d929c010426a0cd597,散漫 复 潺湲 半 砂 半 和 石 清 风波 亦 无 历历 鱼 可 搦 我 来 亦 屡 久 归路 常 日夕
4a839e92-fca6-4b37-9c8b-c31b800975a9,陕下厉玄侍御宅五题 濯缨溪,姚合,唐,诗,五言律诗,旧山宁要去 此有濯缨泉 晓景松枝覆 秋光月色连 行寻屐齿尽 坐对角巾偏 寂寂幽栖处 无妨请俸钱,"5,5,5,5,5,5,5,5",2dde184ff3225eff70a5ec3a0cf6026c,旧山宁 要 去 此 有 濯缨 泉 晓景松 枝覆 秋光 月色 连 行 寻 屐 齿 尽 坐 对角 巾 偏 寂寂 幽 栖 处 无妨 请 俸钱
