id,title,author,dynasty,genre,poem_type,sentences_simplified,meter_pattern,hash,words
2187e5ea-af1d-4503-a3b5-29432a5c2316,送沈处士赴苏州李中丞招以诗赠行,杜牧,唐,诗,五言古体,山城树叶红 下有碧溪水 溪桥向吴路 酒旗夸酒美 下马此送君 高歌为君醉 念君苞材能 百工在城垒 空山三十年 鹿裘挂窓睡 自言陇西公 飘然我知己 举酒属吴门 今朝为君起 悬弓三百斤 囊书数万纸 战贼即战贼 为吏即为吏 尽我所有无 惟公之指使 予曰陇西公 滔滔大君子 常思抡群材 一为国家治 譬如匠见木 碍眼皆不弃 大者麤十围 小者细一指 㨝橛与栋梁 施之皆有位 忽然竖明堂 一挥立能致 予亦何为者 亦受公恩纪 处士有常言 残虏为犬豕 常恨两手空 不得一马箠 今依陇西公 如虎傅两翅 公非刺史材 当坐岩廊地 处士魁奇姿 必展平生志 东吴饶风光 翠𪩘多名寺 疎烟亹亹秋 独酌平生思 因书问故人 能忘批纸尾 公或忆姓名 为说都憔悴,"5,5,5,5,5,5,5,5,5,5,5,5,5,5,5,5,5,5,5,5,5,5,5,5,5,5,5,5,5,5,5,5,5,5,5,5,5,5,5,5,5,5,5,5,5,5,5,5,5,5,5,5",8a14df6a3ae6fdd9c722f257dc062971,山城 树叶 红 下有 碧 溪水 溪桥 向 吴路 酒旗 夸酒 美 下马 此 送君 高歌 为 君 醉 念君苞 材能 百工 在 城垒 空山 三十年 鹿裘 挂 窓 睡 自言 陇西 公 飘然 我 知己 举酒 属 吴 门 今朝 为 君 起 悬弓 三百斤 囊 书 数万 纸 战贼 即 战贼 为 吏 即为 吏 尽 我 所有 无 惟公之 指使 予 曰 陇西 公 滔滔 大 君子 常思抡 群材 一 为 国家 治 譬如 匠 见 木 碍眼 皆 不弃 大者 麤 十 围 小者 细 一 指 㨝 橛与 栋梁 施之皆 有 位 忽然 竖 明堂 一 挥立 能致 予 亦 何为 者 亦 受 公恩纪 处士 有 常言 残虏 为 犬 豕 常 恨 两手 空 不得 一 马 箠 今 依 陇西 公 如虎傅 两 翅 公非 刺史 材 当 坐 岩廊 地 处士 魁奇 姿 必展 平生 志 东吴 饶 风光 翠 𪩘 多名 寺 疎 烟 亹 亹 秋 独酌 平生 思 因书 问 故人 能 忘 批 纸 尾 公 或 忆 姓名 为 说 都 憔悴
d312c06e-0822-4f79-976e-a17d24284aec,长安送友人游湖南,杜牧,唐,诗,五言古体,子性剧弘和 愚衷深褊狷 相舍嚣𫍢中 吾过何由鲜 楚南饶风烟 湘岸苦萦宛 山密夕阳多 人稀芳草远 青梅繁枝低 斑笋新梢短 莫哭葬鱼人 酒醒且眠饭,"5,5,5,5,5,5,5,5,5,5,5,5",3b3dda5445a6f0439d62fb4f8bd5f6ec,子性 剧弘 和 愚衷 深 褊 狷 相舍嚣 𫍢 中 吾 过 何 由 鲜 楚南 饶 风烟 湘 岸 苦 萦 宛 山密 夕阳 多 人 稀 芳草 远 青梅 繁枝 低 斑笋 新 梢 短 莫哭 葬 鱼 人 酒醒 且 眠 饭
3f98de59-a2b3-494f-a29f-d54bf52b2f19,皇风,杜牧,唐,诗,七言律诗,仁圣天子神且武 内兴文教外披攘 以德化人汉文帝 侧身修道周宣王 迒蹊巢穴尽窒塞 礼乐刑政皆弛张 何当提笔侍巡狩 前驱白斾吊河湟,"7,7,7,7,7,7,7,7",e7d6471f0eb17fa10d9d4eb332b86b97,仁圣 天子 神 且 武 内兴 文教 外 披攘 以 德化 人 汉文帝 侧身 修道 周宣王 迒蹊 巢穴 尽 窒塞 礼乐 刑政 皆 弛张 何 当 提笔 侍巡 狩 前驱 白 斾 吊 河 湟
8c6e2c3e-933f-4b97-b448-e2b87508bca4,雪中书怀,杜牧,唐,诗,五言古体,腊雪一尺厚 云冻寒顽痴 孤城大泽畔 人疎烟火微 愤悱欲谁语 忧愠不能持 天子号仁圣 任贤如事师 凡称曰治具 小大无不施 明庭开广敞 才隽受羁维 如日月縆升 若鸾凤葳蕤 人才自朽下 弃去亦其宜 北虏坏亭障 闻屯千里师 牵连久不解 他盗恐旁窥 臣实有长策 彼可徐鞭笞 如蒙一召议 食肉寝其皮 斯乃庙堂事 尔微非尔知 向来躐等语 长作陷身机 行当腊欲破 酒齐不可迟 且想春候暖 瓮间倾一巵,"5,5,5,5,5,5,5,5,5,5,5,5,5,5,5,5,5,5,5,5,5,5,5,5,5,5,5,5,5,5,5,5",20729f429f0f6df976ccdad27e2acd07,腊雪 一尺 厚 云 冻 寒 顽 痴 孤城 大泽 畔 人 疎 烟火 微 愤悱欲谁语 忧 愠 不能 持 天子 号 仁圣 任贤 如 事师 凡 称 曰 治 具 小大 无不 施 明庭 开 广敞 才 隽受 羁维 如 日月 縆 升 若 鸾凤 葳蕤 人才 自朽 下 弃 去 亦其宜 北虏坏亭 障 闻屯 千里 师 牵连 久 不解 他 盗恐 旁 窥 臣 实有 长策 彼 可 徐 鞭笞 如 蒙 一 召议 食肉 寝其皮 斯乃 庙堂 事 尔微 非尔 知 向来 躐 等 语 长 作 陷身 机 行当 腊 欲 破 酒齐 不可 迟 且 想 春候 暖 瓮 间 倾 一 巵
1ea22471-a39a-45de-a8f2-91b4f18058a0,雨中作,杜牧,唐,诗,五言古体,贱子本幽慵 多为隽贤侮 得州荒僻中 更值连江雨 一褐拥秋寒 小窗侵竹坞 浊醪气色严 皤腹瓶甖古 酣酣天地宽 怳怳嵇刘伍 但为适性情 岂是藏鳞羽 一世一万朝 朝朝醉中去,"5,5,5,5,5,5,5,5,5,5,5,5,5,5",8ed52361508a134173bb2229c92e936b,贱子 本 幽 慵 多 为 隽 贤 侮 得 州 荒僻 中 更值 连江 雨 一 褐 拥 秋寒 小窗 侵 竹 坞 浊 醪 气色 严 皤 腹 瓶 甖 古 酣 酣 天地 宽 怳 怳 嵇 刘 伍 但为 适 性情 岂 是 藏鳞羽 一世 一万 朝 朝朝醉 中 去
06c0883b-c3f2-4ad5-bb48-b95e9565ecf1,偶游石盎僧舍,杜牧,唐,诗,五言古体,敬岑草浮光 句沚水解脉 益郁乍怡融 凝严忽颓坼 梅颣暖眠酣 风绪和无力 凫浴涨汪汪 雏娇村幂幂 落日美楼台 轻烟饰阡陌 潋绿古津远 积润苔基释 孰谓汉陵人 来作江汀客 载笔念无能 捧筹慙所画 任辔偶追闲 逢幽果遭适 僧语淡如云 尘事繁堪织 今古几辈人 而我何能息,"5,5,5,5,5,5,5,5,5,5,5,5,5,5,5,5,5,5,5,5,5,5",f9cf831eff3b9a3305f21319f6bdeb92,敬岑草 浮光 句 沚 水解 脉 益 郁乍怡 融 凝严忽 颓 坼 梅 颣 暖 眠 酣 风绪 和 无力 凫浴 涨 汪汪 雏 娇 村 幂 幂 落日 美 楼台 轻 烟饰 阡陌 潋绿古津远 积润 苔 基释 孰谓 汉陵 人 来作 江汀 客 载 笔念 无能 捧 筹 慙 所 画 任 辔偶 追闲 逢 幽果 遭 适 僧语 淡 如云 尘事 繁堪 织 今古 几辈 人 而 我何 能息
3ac6f62b-3cf7-4c7d-8e00-28964220dcce,赴京初入汴口晓景即事先寄兵部李郎中,杜牧,唐,诗,五言古体,清淮控隋漕 北走长安道 樯形栉栉斜 浪态迤迤好 初旭红可染 明河澹如扫 泽阔鸟来迟 村饥人语早 露蔓虫丝多 风蒲燕雏老 秋思高萧萧 客态长褭褭 因怀京洛间 宦游何戚草 什伍持津梁 澒涌争追讨 翾便讵可寻 几秘安能考 小人乏馨香 上下将何祷 唯有君子心 显豁知幽抱,"5,5,5,5,5,5,5,5,5,5,5,5,5,5,5,5,5,5,5,5,5,5",fff7161dcf20989e6a53e61af0615fb9,清淮 控 隋 漕 北 走 长安 道 樯 形 栉 栉 斜 浪态 迤迤 好 初旭红 可染 明河 澹如 扫 泽 阔 鸟 来 迟 村 饥人语 早 露 蔓虫 丝多 风 蒲燕雏 老 秋思 高 萧萧 客态 长 褭 褭 因 怀 京洛 间 宦游 何戚草 什伍 持 津梁 澒 涌 争 追讨 翾 便 讵 可 寻 几 秘安能 考 小人 乏 馨香 上下 将 何祷 唯有 君子 心 显豁 知 幽 抱
4e167af1-7d67-4417-aa13-bff4bbe8f9f1,独酌,杜牧,唐,诗,五言律诗,长空碧杳杳 万古一飞鸟 生前酒伴闲 愁醉闲多少 烟深隋家寺 殷叶暗相照 独佩一壶游 秋毫泰山小,"5,5,5,5,5,5,5,5",b585bec33946b23426684bfa2d61c6fa,长空 碧 杳 杳 万古 一 飞鸟 生前 酒伴 闲 愁醉闲 多少 烟 深 隋家寺 殷叶 暗相 照 独佩 一 壶 游 秋毫 泰山 小
e4621776-8acc-4c77-9d0e-26c2a8689b43,惜春,杜牧,唐,诗,五言律诗,春半年已除 其余强为有 即此醉残花 便同尝腊酒 怅望送春杯 殷勤扫花箒 谁为驻东流 年年长在手,"5,5,5,5,5,5,5,5",8a0916a07325bacf021620da4e441245,春 半年 已 除 其余 强为 有 即此 醉 残花 便 同尝 腊酒 怅望 送 春杯 殷勤 扫 花 箒 谁 为 驻 东流 年 年长 在手
ae9b1b8f-777e-482a-9cf7-92ce97b1b2f0,题安州浮云寺楼寄湖州张郎中,杜牧,唐,诗,五言律诗,去夏疎雨余 同倚朱阑语 当时楼下水 今日到何处 恨如春草多 事与孤鸿去 楚岸柳何穷 别愁纷若絮,"5,5,5,5,5,5,5,5",85791617831f3ea3cd766dec513fc292,去夏 疎 雨 余 同 倚 朱阑语 当时 楼下 水 今日 到 何处 恨 如 春草 多 事 与 孤鸿 去 楚岸柳 何穷 别愁纷 若絮
5d156a2c-d295-4474-8422-786d994266a2,过骊山作,杜牧,唐,诗,七言律诗,始皇东游出周鼎 刘项纵观皆引颈 削平天下实辛勤 却为道傍穷百姓 黔首不愚尔益愚 千里函关囚独夫 牧童火入九泉底 烧作灰时犹未枯,"7,7,7,7,7,7,7,7",2c1c4a0a4239aa6dbbdb9e848b127c16,始皇 东游 出 周鼎 刘 项 纵观 皆 引颈 削平 天下 实 辛勤 却 为 道 傍 穷 百姓 黔首 不 愚 尔益愚 千里 函关 囚 独夫 牧童 火入 九泉 底 烧作 灰时犹未枯
86292a61-8f33-4b35-bbcb-498430f26245,池州送孟迟先辈,杜牧,唐,诗,杂言,昔子来陵阳 时当苦炎热 我虽在金台 头角长垂折 奉披尘意惊 立语平生豁 寺楼最𬸣轩 坐送飞鸟没 一罇中夜酒 半破前峰月 烟院松飘萧 风廊竹交戛 时步郭西南 缭径苔圆折 好鸟响丁丁 小溪光汃汃 篱落见娉婷 机丝弄哑轧 烟湿树姿娇 雨余山态活 仲秋往历阳 同上牛矶歇 大江吞天去 一练横坤抹 千帆美满风 晓日殷鲜血 历阳裴太守 襟韵苦超越 鞔鼓画麒麟 看君击狂节 离袖飐应劳 恨粉啼还咽 明年忝谏官 绿树秦川阔 子提健笔来 势若夸父渴 九衢林马挝 千门织车辙 秦台破心胆 黥阵惊毛髪 子既屈一鸣 余固宜三刖 慵忧长者来 病怯长街喝 僧炉风雪夜 相对眠一褐 暖灰重拥瓶 晓粥还分钵 青云马生角 黄州使持节 秦岭望樊川 秖得回头别 商山四皓祠 心与樗蒲说 大泽蒹葭风 孤城狐兔窟 且复考诗书 无因见簪笏 古训屹如山 古风冷刮骨 周鼎列瓶罂 荆璧横抛𢫬 力尽不可取 忽忽狂歌发 三年未为苦 两郡非不达 秋浦倚吴江 去檝飞青鹘 溪山好画图 洞壑深闺闼 竹冈森羽林 花坞团宫缬 景物非不佳 独坐如鞲绁 丹鹊东飞来 喃喃送君札 呼儿旋供衫 走门空踏袜 手把一枝物 桂花香带雪 喜极至无言 笑余翻不悦 人生直作百岁翁 亦是万古一瞬中 我欲东召龙伯翁 上天揭取北斗柄 蓬莱顶上斡海水 水尽到底看海空 月于何处去 日于何处来 跳丸相趁走不住 尧舜禹汤文武周孔皆为灰 酌此一杯酒 与君狂且歌 离别岂足更关意 衰老相随可奈何,"5,5,5,5,5,5,5,5,5,5,5,5,5,5,5,5,5,5,5,5,5,5,5,5,5,5,5,5,5,5,5,5,5,5,5,5,5,5,5,5,5,5,5,5,5,5,5,5,5,5,5,5,5,5,5,5,5,5,5,5,5,5,5,5,5,5,5,5,5,5,5,5,5,5,5,5,5,5,5,5,5,5,7,7,7,7,7,7,5,5,7,11,5,5,7,7",45defba64d4f8aa7c3564a7cdebe8e8c,昔 子来陵阳 时 当苦 炎热 我 虽 在 金台 头角 长 垂折 奉 披尘意惊 立语 平生 豁 寺楼 最 𬸣 轩 坐送 飞鸟 没 一 罇 中 夜 酒 半 破 前峰 月 烟院 松飘萧 风廊 竹交戛 时步 郭 西南 缭 径 苔 圆 折 好 鸟 响 丁丁 小溪 光 汃 汃 篱落 见 娉婷 机丝 弄 哑 轧 烟湿 树姿 娇 雨余山态 活 仲秋 往 历阳 同 上牛矶歇 大江 吞天去 一练横坤 抹 千帆 美满 风 晓日殷 鲜血 历阳 裴 太守 襟 韵 苦 超越 鞔 鼓画 麒麟 看 君 击 狂节 离 袖 飐 应 劳 恨 粉 啼 还 咽 明年 忝 谏官 绿树 秦川 阔 子提健 笔 来 势 若 夸父 渴 九 衢林马挝 千门 织 车辙 秦台 破 心胆 黥 阵 惊 毛 髪 子 既 屈一鸣 余 固宜 三 刖 慵 忧 长者 来 病 怯 长街 喝 僧炉 风雪 夜 相对 眠 一 褐 暖 灰重拥瓶 晓 粥 还 分 钵 青云 马生角 黄州 使 持节 秦岭 望 樊川 秖 得 回头 别 商山 四 皓祠 心 与 樗蒲 说 大泽 蒹 葭 风 孤城 狐 兔 窟 且 复考 诗书 无 因 见簪 笏 古训 屹如 山 古风 冷 刮骨 周鼎 列 瓶 罂 荆璧 横 抛 𢫬 力尽 不 可取 忽忽 狂歌 发 三年 未 为 苦 两 郡 非不 达 秋浦倚 吴江 去 檝 飞 青 鹘 溪山 好 画图 洞 壑 深闺 闼 竹冈 森羽林 花坞 团 宫 缬 景物 非不 佳 独坐 如 鞲 绁 丹鹊东 飞来 喃喃 送君 札 呼儿 旋供 衫 走 门空 踏 袜 手把 一枝 物 桂花香 带雪 喜 极至 无言 笑余翻 不悦 人生 直作 百岁 翁 亦 是 万古 一瞬 中 我 欲 东召 龙伯翁 上天 揭取 北斗 柄 蓬莱 顶上 斡 海水 水 尽 到底 看 海空 月 于 何处 去 日 于 何处 来 跳 丸 相 趁 走 不住 尧舜禹汤 文武 周孔皆 为 灰 酌此 一 杯酒 与 君狂 且 歌 离别 岂足 更 关意 衰老 相随 可 奈何
a337ea22-8120-47eb-a23b-f8e3af843077,重送,杜牧,唐,诗,杂言,手撚金仆姑 腰悬玉辘轳 爬头峰北正好去 系取可汗钳作奴 六宫虽念相如赋 其那防边重武夫,"5,5,7,7,7,7",5bcf247a38c80cde08af27141cde456b,手 撚 金 仆 姑 腰 悬 玉 辘轳 爬 头峰 北 正好 去 系 取 可汗 钳作奴 六宫 虽 念 相如 赋 其 那 防 边 重 武夫
dbfba3c0-60a7-4b6a-95f0-1cf8ab994ff8,题池州弄水亭,杜牧,唐,诗,五言古体,弄水亭前溪 飐滟翠绡舞 绮席草芊芊 紫岚峰伍伍 螭蟠得形势 翚飞如轩户 一镜匳曲堤 万丸跳猛雨 槛前燕鴈栖 枕上巴帆去 丛筠侍修廊 密蕙媚幽圃 杉树碧为幢 花骈红作堵 停樽迟晚月 咽咽上幽渚 客舟耿孤灯 万里人夜语 漫流罥苔槎 饥凫晒雪羽 玄丝落钩饵 冰鳞看吞吐 断霓天帔垂 狂烧汉旗怒 旷朗半秋晓 萧瑟好风露 光洁疑可揽 欲以襟怀贮 幽抱吟九歌 羁情思湘浦 四时皆异状 终日为良遇 小山浸石棱 撑舟入幽处 孤歌倚桂岩 晚酒眠松坞 纡余带竹村 蚕乡足砧杵 塍泉落环珮 畦苗差纂组 风俗知所尚 豪强耻孤侮 隣丧不相舂 公租无诟负 农时贵伏腊 簪瑱事礼赂 乡校富华礼 征行产强弩 不能自勉去 但媿来何暮 故园汉上林 信美非吾土,"5,5,5,5,5,5,5,5,5,5,5,5,5,5,5,5,5,5,5,5,5,5,5,5,5,5,5,5,5,5,5,5,5,5,5,5,5,5,5,5,5,5,5,5,5,5,5,5,5,5,5,5",65d78610bf980817270b77b0d524c189,弄水 亭 前 溪 飐 滟 翠 绡 舞 绮 席草 芊芊 紫岚峰 伍伍 螭 蟠 得 形势 翚 飞 如 轩 户 一 镜 匳 曲 堤 万丸跳猛雨 槛 前 燕 鴈 栖 枕上 巴帆 去 丛筠 侍修廊 密 蕙 媚 幽 圃 杉树 碧 为 幢 花 骈红 作堵 停 樽 迟 晚月 咽咽 上 幽 渚 客舟 耿 孤灯 万里 人夜 语 漫流 罥 苔 槎 饥 凫晒 雪羽 玄丝 落钩 饵 冰鳞 看 吞吐 断霓 天帔 垂 狂烧 汉旗 怒 旷朗 半秋晓 萧瑟 好 风 露 光洁 疑可揽 欲 以 襟怀 贮 幽 抱吟 九歌 羁 情思 湘浦 四时 皆 异状 终日 为 良遇 小山 浸 石 棱 撑 舟 入 幽处 孤歌倚 桂岩 晚 酒 眠 松坞 纡 余带 竹村 蚕乡 足 砧杵 塍 泉 落 环 珮 畦 苗 差纂 组 风俗 知所 尚 豪强 耻 孤侮 隣 丧 不 相 舂 公租 无 诟负 农时 贵伏腊 簪瑱 事 礼 赂 乡校 富华 礼 征行 产强 弩 不能 自勉 去 但 媿 来 何 暮 故园 汉上林 信美 非吾土
03c19b2c-c28a-4b55-a963-bf71b354f7a2,题宣州开元寺,杜牧,唐,诗,五言古体,南朝谢眺城 东吴最深处 亡国去如鸿 遗寺藏烟坞 楼飞九十尺 廊环四百柱 高高下下中 风绕松桂树 青苔照朱阁 白鸟两相语 溪声入僧梦 月色晖粉堵 阅景无旦夕 凭阑有今古 留我酒一罇 前山看春雨,"5,5,5,5,5,5,5,5,5,5,5,5,5,5,5,5",d6decaaa2bd8f2c423426529f90834e5,南朝 谢眺城 东吴 最深处 亡国 去 如 鸿 遗寺 藏 烟 坞 楼飞 九十 尺 廊 环 四百 柱 高高 下下 中 风 绕 松 桂树 青苔 照 朱阁 白鸟 两 相语 溪声 入 僧 梦 月色 晖 粉 堵 阅景 无 旦夕 凭 阑 有 今古 留 我 酒一 罇 前山 看 春雨
4c4f47e6-7e0d-4787-ac88-7e6921b33667,大雨行,杜牧,唐,诗,七言古体,东垠黑风驾海水 海底卷上天中央 三吴六月忽凄惨 晚后点滴来苍茫 铮栈雷车轴辙壮 矫躩蛟龙爪尾长 神鞭鬼驭载阴帝 来往喷洒何顚狂 四面崩腾玉京仗 万里横互羽林枪 云缠风束乱敲磕 黄帝未胜蚩尤强 百川气势苦豪俊 坤关密鏁愁开张 太和六年亦如此 我时壮气神洋洋 东楼耸首看不足 恨无羽翼高飞翔 尽召邑中豪健者 阔展朱盘开酒场 奔觥槌鼓助声势 眼底不顾纤腰娘 今年阘茸鬓已白 奇游壮观唯深藏 景物不尽人自老 谁知前事堪悲伤,"7,7,7,7,7,7,7,7,7,7,7,7,7,7,7,7,7,7,7,7,7,7,7,7,7,7",bb9f0e0cfc96ea4891206dabfa7cdb5f,东垠 黑风 驾 海水 海底 卷 上天 中央 三 吴 六月 忽 凄惨 晚后 点滴 来 苍茫 铮栈 雷 车轴 辙 壮 矫 躩 蛟龙 爪尾 长 神鞭鬼驭载 阴帝 来往 喷洒 何 顚 狂 四面 崩腾 玉京 仗 万里 横互 羽林 枪 云 缠 风束 乱 敲 磕 黄帝 未 胜 蚩尤 强 百川 气势 苦 豪 俊 坤关 密 鏁 愁 开张 太和 六年 亦 如此 我时 壮气 神 洋洋 东楼 耸首 看 不足 恨 无 羽翼 高 飞翔 尽 召 邑 中 豪健 者 阔 展 朱盘 开 酒场 奔 觥槌鼓助 声势 眼底 不顾 纤腰 娘 今年 阘茸 鬓 已 白 奇游 壮观 唯 深藏 景物 不尽 人 自 老 谁知 前事堪 悲伤
80501b83-39ec-4237-b760-69cc32067ba0,自宣州赴官入京路逢裴坦判官归宣州因题赠,杜牧,唐,诗,杂言,敬亭山下百顷竹 中有诗人小谢城 城高跨楼满金碧 下听一溪寒水声 梅花落径香缭绕 雪白玉珰花下行 萦风酒斾挂朱阁 半醉游人闻弄笙 我初到此未三十 头脑钐利筋骨轻 画堂檀板秋拍碎 一引有时联十觥 老闲腰下丈二组 尘土高悬千载名 重游鬓白事皆改 唯见东流春水平 对酒不敢起 逢君还眼明 云罍看人捧 波脸任他横 一醉六十日 古来闻阮生 是非离别际 始见醉中情 今日送君话前事 高歌引劒还一倾 江湖酒伴如相问 终老烟波不计程,"7,7,7,7,7,7,7,7,7,7,7,7,7,7,7,7,5,5,5,5,5,5,5,5,7,7,7,7",e4878a48a746e42d474d74ea8058cf02,敬亭山 下 百顷 竹 中 有 诗人 小谢城 城 高 跨 楼 满 金碧 下听 一 溪 寒 水声 梅花 落径 香 缭绕 雪白 玉 珰 花 下行 萦 风 酒 斾 挂 朱 阁 半 醉 游人 闻弄笙 我 初到 此 未 三十 头脑 钐 利 筋骨 轻 画堂 檀板 秋 拍碎 一 引 有时 联十 觥 老 闲 腰 下 丈 二组 尘土 高悬 千载 名 重游 鬓白事 皆 改 唯见 东流 春 水平 对 酒 不敢 起 逢 君 还 眼明 云 罍 看 人 捧 波 脸 任 他 横 一 醉 六十日 古来 闻阮生 是非 离别 际 始见 醉 中情 今日 送君 话 前 事 高歌 引 劒 还 一 倾 江湖 酒伴 如 相问 终老 烟波 不 计程
87007df8-aaeb-4050-aa30-c3ca59e9433c,赠宣州元处士,杜牧,唐,诗,五言律诗,陵阳北郭隐 身世两忘者 蓬蒿三亩居 宽于一天下 罇酒对不酌 默与玄相话 人生自不足 爱叹遭逢寡,"5,5,5,5,5,5,5,5",5bc594796bbe8da1837a5116af96c086,陵阳北 郭隐 身世 两 忘 者 蓬蒿 三亩 居 宽 于 一 天下 罇 酒 对 不 酌 默与玄 相话 人生 自 不足 爱叹 遭逢 寡
cd34c792-ce55-4e8c-9625-88802d985c38,村行,杜牧,唐,诗,五言律诗,春半南阳西 柔桑过村坞 褭褭垂柳风 点点回塘雨 蓑唱牧牛儿 篱窥蒨裙女 半湿解征衫 主人馈鸡黍,"5,5,5,5,5,5,5,5",d21adaf6642f1f2a3a9783ec603f7bb9,春半 南阳 西 柔桑 过 村坞 褭 褭 垂柳 风 点点 回 塘 雨 蓑唱 牧牛 儿 篱窥蒨 裙 女 半 湿解 征衫 主人 馈鸡 黍
62c91e86-2423-4741-84ab-d392d7df173d,史将军二首 一,杜牧,唐,诗,五言律诗,长鉟周都尉 闲如秋岭云 取蝥弧登垒 以骈隣翼军 百战百胜价 河南河北闻 今遇太平日 老去谁怜君,"5,5,5,5,5,5,5,5",b5579469dd0dc805c27e28c954c0127d,长 鉟 周 都尉 闲如 秋岭云 取 蝥 弧 登垒 以 骈隣 翼 军 百战百胜 价 河南 河北 闻 今 遇 太平 日 老 去 谁 怜 君
f1a5a818-4f0b-4a55-a237-cc85e3767b7b,史将军二首 二,杜牧,唐,诗,五言律诗,壮气盖燕赵 耽耽魁杰人 弯弧五百步 长戟八十斤 河湟非内地 安史有遗尘 何日武台坐 兵符授虎臣,"5,5,5,5,5,5,5,5",e1bf00704440f074f15a83b336ca6e40,壮气 盖 燕赵 耽 耽魁 杰人 弯弧 五百步 长 戟 八十斤 河 湟非 内地 安史 有 遗尘 何日 武台 坐 兵符 授 虎 臣
0532d507-dd36-4bb4-868a-fe771d68c11e,华清宫三十韵,杜牧,唐,诗,五言古体,绣岭明珠殿 层峦下缭墙 仰窥丹槛影 犹想赭袍光 昔帝登封后 中原自古强 一千年际会 三万里农桑 几席延尧舜 轩墀接禹汤 雷霆驰号令 星斗焕文章 钓筑乘时用 芝兰在处芳 北扉闲木索 南面富循良 至道思玄圃 平居厌未央 钩陈裹岩谷 文陛压青苍 歌吹千秋节 楼台八月凉 神仙高缥缈 环珮碎丁当 泉暖涵窓镜 云娇惹粉囊 嫩岚滋翠葆 清渭照红粧 帖泰生灵寿 懽娱岁序长 月闻仙曲调 霓作舞衣裳 雨露偏金穴 乾坤入醉乡 玩兵师汉武 回手倒干将 黥鬣掀东海 胡牙揭上阳 喧呼马嵬血 零落羽林枪 倾国留无路 还魂怨有香 蜀峰横惨澹 秦树远微茫 鼎重山难转 天扶业更昌 望贤余故老 花萼旧池塘 往事人谁问 幽襟泪独伤 碧簷斜送日 殷叶半凋霜 迸水倾瑶砌 疎风罅玉房 尘埃羯鼓索 片段荔枝筐 鸟啄摧寒木 蜗涎蠹画梁 孤烟知客恨 遥起泰陵傍,"5,5,5,5,5,5,5,5,5,5,5,5,5,5,5,5,5,5,5,5,5,5,5,5,5,5,5,5,5,5,5,5,5,5,5,5,5,5,5,5,5,5,5,5,5,5,5,5,5,5,5,5,5,5,5,5,5,5,5,5",303c7241bd2dc6eeb57d4ee461a04468,绣 岭 明珠 殿 层峦 下 缭 墙 仰窥 丹槛 影 犹想 赭袍 光 昔 帝 登封 后 中原 自古 强 一千年 际会 三万里 农桑 几席 延 尧舜 轩墀 接 禹 汤 雷霆 驰 号令 星斗 焕 文章 钓筑 乘时 用 芝兰 在 处 芳 北扉 闲木 索 南面 富循良 至 道思玄 圃 平居厌 未央 钩 陈裹岩 谷 文 陛压 青苍 歌 吹 千秋 节 楼台 八月 凉 神仙 高 缥缈 环珮碎 丁当 泉 暖 涵 窓 镜 云娇 惹 粉 囊 嫩 岚 滋 翠葆 清渭 照 红 粧 帖 泰生 灵寿 懽 娱 岁序 长 月 闻仙 曲调 霓作舞 衣裳 雨露 偏 金穴 乾坤 入 醉乡 玩兵 师汉武 回手 倒 干将 黥 鬣 掀 东海 胡牙 揭 上阳 喧呼 马嵬 血 零落 羽林 枪 倾国 留 无 路 还魂 怨 有 香 蜀峰 横 惨 澹 秦树远 微茫 鼎 重山 难 转 天扶业 更 昌 望贤余 故 老 花萼 旧 池塘 往事 人 谁 问 幽襟 泪 独伤 碧 簷 斜 送 日 殷叶 半凋霜 迸 水倾瑶 砌 疎 风 罅玉 房 尘埃 羯鼓 索 片段 荔枝 筐 鸟 啄 摧寒木 蜗涎蠹 画梁 孤 烟 知客 恨 遥起 泰陵 傍
7d9eee90-19c6-46c5-95bc-3e34c86359aa,长安杂题长句六首 一,杜牧,唐,诗,七言律诗,觚棱金碧照山高 万国珪璋捧赭袍 舐笔和铅欺贾马 赞功论道鄙萧曹 东南楼日珠帘卷 西北天宛玉厄豪 四海一家无一事 将军携镜泣霜毛,"7,7,7,7,7,7,7,7",96f03aa0590159243af871fdf88cf1bb,觚 棱 金碧 照山 高 万国 珪 璋 捧 赭袍 舐 笔 和 铅 欺 贾马 赞功 论道 鄙 萧 曹 东南 楼日 珠帘 卷 西北 天宛 玉厄豪 四海一家 无 一事 将军 携镜 泣 霜 毛
a62027b9-ac14-4a96-a5b6-1471d107f42d,长安杂题长句六首 二,杜牧,唐,诗,七言律诗,晴云似絮惹低空 紫陌微微弄袖风 韩嫣金丸莎覆绿 许公鞯汗杏粘红 烟生窈窕深东第 轮撼流苏下北宫 自笑苦无楼护智 可怜铅椠竟何功,"7,7,7,7,7,7,7,7",038147df678c33d2e8e7fd3f822ef322,晴云 似 絮 惹 低空 紫陌 微微 弄袖 风 韩嫣 金丸 莎覆 绿 许公 鞯 汗 杏 粘 红 烟生 窈窕 深东 第 轮撼 流苏 下 北宫 自笑苦无楼 护 智 可怜 铅 椠 竟 何功
435da91f-fece-442b-8567-107ba31ebaa0,长安杂题长句六首 三,杜牧,唐,诗,七言律诗,雨晴九陌铺江练 岚嫩千峰叠海涛 南苑草芳眠锦雉 夹城云暖下霓旄 少年羁络青纹玉 游女花簪紫蒂桃 江碧柳深人尽醉 一瓢颜巷日空高,"7,7,7,7,7,7,7,7",1807ca8789ed1b6756a4367a6ad8afdd,雨晴九陌 铺江 练 岚嫩 千峰 叠 海涛 南苑 草 芳 眠 锦 雉 夹城 云 暖 下霓 旄 少年 羁络 青纹玉 游女 花簪 紫蒂桃 江碧柳 深人尽醉 一瓢 颜巷 日 空 高
afc6681b-6e31-4b0f-988e-f2566d2808a5,长安杂题长句六首 四,杜牧,唐,诗,七言律诗,束带谬趋文石陛 有章曾拜皂囊封 期严无奈睡留癖 势窘犹为酒泥慵 偷钓侯家池上雨 醉吟隋寺日沈钟 九原可作吾谁与 师友瑯琊邴曼容,"7,7,7,7,7,7,7,7",e475d5c03ec1c6a8973adb08b79b075a,束带 谬 趋 文石 陛 有章 曾 拜 皂囊 封 期 严 无奈 睡留 癖 势 窘 犹为 酒 泥 慵 偷 钓 侯家 池上 雨 醉吟 隋寺 日 沈钟 九原可作 吾 谁 与 师友 瑯 琊 邴 曼 容
48b8d48b-5e63-4cf2-be67-9f110823d690,长安杂题长句六首 五,杜牧,唐,诗,七言律诗,洪河清渭天池濬 太白终南地轴横 祥云辉映汉宫紫 春光绣画秦川明 草妬佳人钿朵色 风回公子玉衔声 六飞南幸芙蓉苑 十里飘香入夹城,"7,7,7,7,7,7,7,7",f3ba3553e784608677b36feca9914bbb,洪河 清 渭 天池 濬 太白 终南 地轴 横 祥云 辉映 汉宫 紫 春光 绣画 秦川 明 草 妬 佳人 钿 朵 色 风 回 公子 玉衔声 六 飞南幸 芙蓉 苑 十里 飘香 入 夹 城
26ad42b7-b471-43d8-a403-61c70d011cf2,长安杂题长句六首 六,杜牧,唐,诗,七言律诗,丰貂长组金张辈 驷马文衣许史家 白鹿原头回猎骑 紫云楼下醉江花 九重树影连清汉 万寿山光学翠华 谁识大君谦让德 一毫名利鬬鼃蟇,"7,7,7,7,7,7,7,7",1407f4a3db5fc22ec05e4e71b616256b,丰 貂 长 组金 张 辈 驷马 文衣 许 史家 白鹿原 头 回猎 骑 紫云 楼下 醉江花 九重 树影 连清汉 万寿山 光学 翠华 谁 识 大君 谦让 德 一毫 名利 鬬 鼃 蟇
22e1a6e4-3934-4d1d-a3ad-ce4606e423e4,河湟,杜牧,唐,诗,七言律诗,元载相公曾借箸 宪宗皇帝亦留神 旋见衣冠就东市 忽遗弓劒不西巡 牧羊驱马虽戎服 白发丹心尽汉臣 唯有凉州歌舞曲 流传天下乐闲人,"7,7,7,7,7,7,7,7",575dfd964f235b5683882361790e2f93,元 载 相公 曾 借 箸 宪宗 皇帝 亦 留神 旋见 衣冠 就 东市 忽 遗 弓 劒 不 西 巡 牧羊 驱马 虽 戎服 白发丹心 尽 汉 臣 唯有 凉州 歌舞 曲 流传 天下 乐 闲人
