id,title,author,dynasty,genre,poem_type,sentences_simplified,meter_pattern,hash,words
6f28258d-8b0b-4f91-ad25-8360194587be,题后山集后次可正平韵  其二,周孚,唐,诗,五言律诗,甚美元非恶 嗟公堕此间 真为四君次 可厌七年闲 汴泗空千载 晁何仅一班 凄凉大阳履 埋没若河山,"5,5,5,5,5,5,5,5",c949990cc1a638d315dd0d3b384846b5,甚 美元 非 恶 嗟公堕 此间 真 为 四 君次 可厌 七年 闲 汴泗 空 千载 晁 何仅 一班 凄凉 大阳 履 埋没 若 河山
8cb3af0e-acaa-4ae1-9dca-ffa69cdb43f0,哭员著作,周孚,唐,诗,五言律诗,每憎鸡荩谷 自许凤鸣冈 论事方刘向 修文遽卜商 高名宁泯没 老意自凄凉 叹息褚中惠 此生那可忘,"5,5,5,5,5,5,5,5",95d2091aa2b0128c91b4a506eb2390d5,每 憎 鸡 荩 谷 自许 凤鸣 冈 论事方 刘向 修文 遽 卜 商 高名宁 泯没 老意 自 凄凉 叹息 褚中惠 此生 那 可 忘
76421062-6958-4c01-9056-77c7c9f7d01e,登普照山有怀宛陵陈丈侍郎二首  其一,周孚,唐,诗,五言律诗,登临才昨日 时序亦匆匆 败幕无巢燕 寒空有断鸿 老怀空对月 病骨不禁风 远水澄寒练 令人忆谢公,"5,5,5,5,5,5,5,5",c7b721760968084cdf8da65a350d710c,登临 才 昨日 时序 亦 匆匆 败幕 无 巢燕 寒空 有 断鸿 老怀空 对 月 病骨 不禁 风 远 水 澄 寒练 令人 忆谢公
5a05ead9-c92a-4120-9b1c-6815e14c50c9,登普照山有怀宛陵陈丈侍郎二首  其二,周孚,唐,诗,五言律诗,遥闻宛陵老 犹寄梵王宫 获稻虽终亩 诛茅未毕工 斯文元有托 吾道岂终穷 莫作居东想 君王识郑崇,"5,5,5,5,5,5,5,5",45d66d62cd0c417bf376fb2a9e4dd7c5,遥闻 宛陵 老 犹 寄 梵 王宫 获稻 虽 终亩 诛茅未毕工 斯文 元 有 托 吾 道 岂 终穷 莫作居东 想 君王 识 郑崇
844a6dff-ce7a-4404-8d7b-8e9ed4b2c525,邓才卿同年两顾敝庐病睡不克见别后次庭藻送行韵谢之,周孚,唐,诗,七言律诗,富贵移人或望尘 独于衰病却情亲 澜翻未听渠侬语 肮脏悬知我辈人 正续黄粱今日梦 敢寻紫陌向时春 三年两踏蓬蒿径 此客他时不是新,"7,7,7,7,7,7,7,7",32bc17eb73311edb8b8e2ed5121beec6,富贵 移人 或 望 尘 独于 衰病 却 情亲 澜 翻 未 听 渠 侬 语 肮脏 悬知 我辈 人 正续 黄粱 今日 梦 敢 寻紫陌 向 时 春 三年 两 踏 蓬蒿 径 此 客 他时 不是 新
19b1ffb4-97a6-4516-8adf-04ef16b39fa4,送刘元畸解官归宣城兼问讯侍郎陈丈,周孚,唐,诗,七言古体,群书讽诵不离口 君才岂止王季友 力探千载自青眼 智效一官今白首 三年拄颊京江上 车如鸡栖马如狗 旁人窃叹君则笑 一哄从来有奇偶 椎鼓发船忽复去 聚散匆匆一翻手 泾川绿涨三百里 试脱征衣濯尘垢 人间至计只樗栎 身外虚名本箕斗 君归更问且过翁 富贵何如一杯酒,"7,7,7,7,7,7,7,7,7,7,7,7,7,7,7,7",a72c66e86ca0d29c2e8b759205f7987f,群书 讽诵 不 离 口 君 才 岂止 王 季友 力 探 千载 自 青眼 智效 一 官 今 白首 三年 拄 颊 京江 上 车 如 鸡 栖 马 如 狗 旁人 窃 叹 君 则 笑 一 哄 从来 有 奇偶 椎鼓 发船 忽复 去 聚散 匆匆 一 翻手 泾川 绿 涨 三百里 试脱 征衣 濯 尘垢 人间 至 计 只 樗 栎 身外 虚名 本 箕斗 君 归 更 问 且过 翁 富贵 何如 一 杯酒
e0670690-5aab-4163-972c-28c52fc2a9db,寄史伯强,周孚,唐,诗,五言古体,一日抵三岁 子行逾十旬 昔如宫应商 今若参与辰 力挽殊未来 叹息寒江滨 附书双鲤鱼 沧波正奫沦 平生金石交 如子不数人 饱更松桂秋 不羡桃李春 向来相期处 可但髯绝伦 一朝忽去眼 那能不酸辛 悠悠世网中 双鬓各已新 岂无耦耕约 奈此离别频 富贵朝露耳 莫负头上巾 归来建德国 与子同问津,"5,5,5,5,5,5,5,5,5,5,5,5,5,5,5,5,5,5,5,5,5,5,5,5",3f393ae73d823c2b7b6eccef158fa6a8,一日 抵 三岁 子行 逾 十旬 昔 如 宫应 商 今 若 参与 辰 力挽殊 未来 叹息 寒 江滨 附书 双 鲤鱼 沧波 正奫沦 平生 金石交 如子 不数 人 饱 更 松 桂秋 不 羡 桃李 春 向来 相期 处 可但 髯 绝伦 一朝 忽 去 眼 那 能 不 酸辛 悠悠 世网 中 双鬓 各 已新 岂 无 耦耕 约 奈 此 离别 频 富贵 朝露 耳 莫 负 头上 巾 归来 建 德国 与 子 同 问津
57d630db-fab4-48fd-b0be-568da0e7de54,戏题小庵画轴三首  其一,周孚,唐,诗,七言绝句,扁舟渺渺入平湖 秋叶经霜半已无 不是幽林欠残雪 为君题作剡溪图,"7,7,7,7",a6e542b7a5622973d9e57d2b7c3668eb,扁舟 渺渺 入 平湖 秋叶 经霜 半 已 无 不是 幽林 欠 残雪 为 君题 作 剡溪 图
d703983c-58ff-463e-921e-df279c4b71c7,戏题小庵画轴三首  其二,周孚,唐,诗,五言绝句,一落絷维中 永别啸云友 秋月耿寒林 时来梦中否,"5,5,5,5",67c9c496999c51e10ac9bcea7c3a30d5,一 落 絷 维 中 永别 啸云友 秋月 耿寒林 时 来 梦 中 否
69681d6e-79f5-4dd5-a0f9-24c7ed22aa57,戏题小庵画轴三首  其三,周孚,唐,诗,五言绝句,当时饿鸱箭 惊皇无复魂 困卧阶下草 深愧主人恩,"5,5,5,5",2e7f12aa0f5e5ca247947dfda3bb97c4,当时 饿 鸱 箭 惊皇无复魂 困卧 阶下 草 深愧 主人 恩
3a9964ed-3b22-4446-8c04-fff8ae88ebc3,次韵侯彦康,周孚,唐,诗,七言律诗,箪瓢从古亦山雌 叹息渠侬定可师 挽士真难九牛尾 酬君谁可五羊皮 过逢政自艰难际 感慨俱非少壮时 樗散郑虔官益冷 得钱沽酒不须疑,"7,7,7,7,7,7,7,7",7e1841c68fbb49ffe611dd0cfa20d856,箪瓢 从 古亦山 雌 叹息 渠侬 定 可 师 挽士 真 难 九 牛尾 酬 君 谁 可 五 羊皮 过逢政 自 艰难 际 感慨 俱 非 少壮 时 樗 散 郑虔 官益 冷 得 钱 沽酒 不须 疑
4be95d22-1870-458a-a625-7823c63b1ba4,朱毅夫挽词,周孚,唐,诗,五言律诗,卖药长安市 退藏三十秋 来从阿戎语 始与德公游 一别俄黄壤 遥怜尚黑头 心知漆灯在 应为此翁留,"5,5,5,5,5,5,5,5",f7df8210476d9a789661aca31e3d7b6e,卖药 长安 市 退藏 三十 秋 来 从 阿戎语 始 与 德 公游 一别 俄 黄壤 遥怜 尚 黑头 心知 漆灯 在 应为 此 翁 留
8d86ea57-df75-4a83-9973-872b9db6603f,送辛幼安,周孚,唐,诗,七言律诗,西风掠面不胜尘 老欲从君自濯薰 两意未成还忤俗 一饥相迫又离群 只今参佐须孙楚 何日公卿属范云 节物关心那可别 断红疎绿正春分,"7,7,7,7,7,7,7,7",a47458e637494eab1ffcba6a6eaa330f,西风 掠面 不胜 尘 老 欲 从 君 自 濯 薰 两 意 未 成 还 忤 俗 一 饥 相迫 又 离群 只今 参佐 须孙楚 何日 公卿 属 范云 节物 关心 那 可别 断 红 疎 绿 正 春分
b2c53c06-02d8-437c-abaa-3d4213205ea2,次韵彦康,周孚,唐,诗,五言古体,读书策新功 子久勗此课 蒲梢𥬞寒云 了不见坎轲 深怀浃背耻 但欲袖手坐 新诗忽来辱 快读起疲懦 还疑正始在 欲突黄初过 斯文未易到 吾党真可贺 向来豫章法 政复如此作 钮头三寸泽 子质况黄稬 只今百尺的 已见一矢破 更期十载后 凛凛谁子奈 耆年日凋丧 我亦老寒饿 奇穷不自惜 乃复珍此货 但恐黄禾空 子驹谁秣莝,"5,5,5,5,5,5,5,5,5,5,5,5,5,5,5,5,5,5,5,5,5,5,5,5,5,5",4d63f34ab2e27b71be1e368fc2c05c4b,读书 策 新 功 子久勗 此 课 蒲梢 𥬞 寒云 了 不见 坎 轲 深怀浃背耻 但 欲 袖手 坐 新诗 忽来 辱 快 读起 疲懦 还疑 正始 在 欲 突 黄初 过 斯文 未易 到 吾 党 真 可贺 向来 豫章 法 政复 如此 作 钮 头 三寸 泽 子质况 黄 稬 只今 百尺 的 已 见 一矢破 更期 十载 后 凛凛 谁 子 奈 耆 年 日 凋丧 我 亦 老 寒饿 奇穷不自惜 乃 复珍此货 但 恐 黄 禾 空 子驹 谁 秣 莝
bf9b3123-f877-4e3f-91d2-6747b29ccfec,赠顿昂伯高兼简王丈公瑞顿尝识先君,周孚,唐,诗,七言律诗,凄凉元祐几遗民 邂逅京江两病身 阮籍莫年唯可醉 扬雄平日固当贫 久知丘壑须吾党 晚喜箪瓢有若人 同识嵇公更谁在 仲任虽健鬓如银,"7,7,7,7,7,7,7,7",6d3678e20b46587bc8ac837de67d695a,凄凉 元 祐 几 遗民 邂逅 京江 两 病身 阮籍 莫年 唯 可醉 扬雄 平日 固当 贫 久 知 丘壑 须吾党 晚 喜 箪瓢 有若人 同识 嵇公 更 谁 在 仲任 虽 健 鬓 如 银
9ee9f15a-69fa-4aff-a996-3f2a857f9e8d,寄辛滁州,周孚,唐,诗,七言律诗,江皋追送仅逾旬 节物俄惊一度新 西涧潮生还值雨 南山雪尽正逢春 遥知风韵如前辈 可有篇章忆故人 拟向瑯琊问幽事 两翁遗迹未埃尘,"7,7,7,7,7,7,7,7",f1f9221a5735cec2d424e62fe71786e6,江皋 追送 仅 逾 旬 节物 俄 惊 一度 新 西涧潮 生还 值 雨 南山 雪 尽 正逢 春 遥知 风韵 如 前辈 可 有 篇章 忆 故人 拟向 瑯 琊 问 幽 事 两 翁 遗迹 未埃尘
8126cc39-6a83-4214-bcf2-af5aa4339381,次韵庭藻留王用宾韵别赵楚才,周孚,唐,诗,五言律诗,落魄山阳市 悲歌独子听 相过常出日 小住亦翻星 此际心还折 何方鬓解青 一杯寒食酒 相与记沉冥,"5,5,5,5,5,5,5,5",27df3e6b8113ca5f505d01d896fc8278,落魄 山阳 市 悲歌 独子 听 相过常 出 日 小 住 亦 翻 星 此际 心 还 折 何方 鬓解 青 一杯 寒食 酒 相与 记 沉冥
a7622597-3ed5-4920-9c9d-735232ae0763,离山阳戏次庭藻韵简叔异二首  其一,周孚,唐,诗,七言绝句,匆匆掠面只黄沙 行尽孤城不见花 政是江南好时节 暖风吹柳欲藏鸦,"7,7,7,7",afd06f4aafe6c81153ad798103be7e84,匆匆 掠面 只 黄沙 行 尽 孤 城 不见 花 政是 江南 好时节 暖风 吹 柳欲 藏 鸦
f8661806-e2d9-401b-bcca-bf8dcc9a0e35,离山阳戏次庭藻韵简叔异二首  其二,周孚,唐,诗,七言绝句,去日寒亭尚有梅 归来已过海棠开 叩门剥啄家人笑 惊怪安西老友回,"7,7,7,7",9f6db4dfdd5ddf48f1dd456c7cc3386b,去日 寒亭 尚有 梅 归来 已 过 海棠 开 叩门 剥啄 家人 笑 惊怪 安西 老友 回
5cfcec5c-b5d1-4704-b823-8b1d4dfe2ca3,寄朝美,周孚,唐,诗,五言古体,君才秀吾乡 真可歌大雅 疏通信而静 少有似君者 十年卧墙东 樲棘笑梧槚 摩挲怀中璧 顾我知者寡 一朝𥬞云去 始骇天下马 宁如不祥金 未铸先跃冶 煌煌汉家业 条画待董贾 皇文阅石室 秘署向金马 飞腾吾敢羡 拙艺真毁瓦 出处判殊涂 归耕弋阳野,"5,5,5,5,5,5,5,5,5,5,5,5,5,5,5,5,5,5,5,5",7aae5130e19ffa33587804d2b7ce450f,君 才 秀 吾 乡 真 可歌 大雅 疏 通信 而 静 少有 似 君者 十年 卧墙 东 樲 棘 笑 梧槚 摩挲 怀中 璧 顾 我 知者 寡 一朝 𥬞 云 去 始骇 天下 马 宁如 不祥 金 未 铸 先跃 冶 煌煌 汉 家业 条画 待 董贾 皇文 阅 石室 秘署 向 金马 飞腾 吾 敢 羡 拙 艺 真 毁 瓦 出处 判 殊涂 归耕 弋阳 野
6945e23e-f58d-4c7a-9dc5-642266ab0b25,赠王南仲,周孚,唐,诗,五言古体,妙语富停蓄 高标邈巉岩 半面逆旅中 知子固不凡 语离今几时 岁月如惊帆 南谯再相遇 黄尘扑征衫 握手互叹息 白发不可芟 吾侪与世疎 触事俱殽函 饥鹰久已疲 狡兔方自毚 二顷可以休 此意神所监 纵复落痴钝 犹应免贪馋 一语子可思 病马愁辔衔 寄语同社人 吾将老寒岩,"5,5,5,5,5,5,5,5,5,5,5,5,5,5,5,5,5,5,5,5,5,5",daadd84cfd3c6688fc7c255a9d569f99,妙语 富停 蓄 高标 邈 巉岩 半面 逆旅 中 知子 固 不凡 语离 今 几时 岁月 如惊帆 南谯再 相遇 黄尘 扑 征 衫 握手 互 叹息 白发 不可 芟 吾侪 与 世 疎 触事 俱 殽 函 饥鹰 久已 疲 狡兔 方 自 毚 二顷 可以 休 此 意神 所 监 纵复 落 痴钝 犹 应免 贪馋 一 语子 可思 病马 愁 辔衔 寄语 同 社人 吾 将 老 寒岩
71148105-3d48-4870-b9aa-297d264b7eb8,道士刘先觉之金陵,周孚,唐,诗,五言律诗,挽袂小徘徊 秋风菊正开 方惊鸥可狎 忽与雁同回 老干元如腊 衰怀久已灰 丹砂未得诀 伫子寄方来,"5,5,5,5,5,5,5,5",016d7da86b52570947e1b05738ef0423,挽 袂 小 徘徊 秋风 菊 正开 方惊鸥 可 狎 忽 与 雁同 回 老干元 如 腊 衰怀 久已 灰 丹砂 未 得 诀 伫 子寄方 来
02b9adac-acf9-4dfa-b5d5-54f0b2d81ce1,次韵答李清宇姜德光,周孚,唐,诗,五言古体,匆匆一席地 劳子数追寻 厚意嗟虚辱 衰年愧不任 高怀元淡薄 妙语不崎嵚 老桧千寻直 寒泉百尺深 世方憎落落 吾自畏骎骎 生计贫非病 羁穷古亦今 未须悲龃龉 直可付呻吟 谁复明兹事 深思话此心 空垂老任钓 莫辩伯牙琴 试采南山蕨 同君洁釜鬵,"5,5,5,5,5,5,5,5,5,5,5,5,5,5,5,5,5,5,5,5",9e3d7eda11ccd000a638c90c94e6fb90,匆匆 一席 地 劳子 数 追寻 厚意 嗟虚辱 衰 年愧 不任 高怀元 淡薄 妙语 不崎 嵚 老桧 千寻直 寒泉 百尺 深 世方 憎 落落 吾 自 畏 骎 骎 生计 贫 非 病 羁 穷 古 亦 今 未须 悲 龃龉 直 可付 呻吟 谁 复明 兹 事 深思 话 此 心 空 垂老 任钓 莫辩 伯牙 琴 试采 南山 蕨 同 君洁釜 鬵
7c0ea8d8-c540-44f3-9237-114b23b8972d,次韵奉答杨判官继甫,周孚,唐,诗,七言古体,向君官升今复滁 十年两地无此儒 喧啾蹇吃方一区 君自鹄白渠自乌 士安门人有挚虞 斯文灰冷今复苏 胸次与古真合符 鄙夫濩落世所无 逃禅政自萦瓠壶 岂有笔力凌三都 老伧人方笑玄谟 愧君清坐客歌呼 君才如鲁我则邾 气味莫间沂与洙 甲辰虽俱那得如 苍髯直干霜不枯 归来破屋从绳枢 飞腾付君吾敢谀,"7,7,7,7,7,7,7,7,7,7,7,7,7,7,7,7,7,7",e234dd29dd1d8433d678154f0623bbce,向君官 升 今 复 滁 十年 两地 无此 儒 喧 啾 蹇 吃 方 一区 君 自 鹄 白渠 自 乌 士安 门人 有 挚 虞 斯文 灰冷 今 复苏 胸次 与 古真合 符 鄙夫 濩 落 世 所 无 逃禅 政 自 萦 瓠 壶 岂 有 笔力 凌三 都 老伧 人方 笑 玄谟 愧 君 清 坐客 歌呼 君 才 如 鲁 我 则 邾 气味 莫间沂 与 洙 甲辰 虽 俱 那 得 如 苍髯直 干 霜 不 枯 归来 破屋 从 绳枢 飞腾 付君吾 敢 谀
5d90d3b0-01fd-46a9-a945-43509223ac80,谢端砚辛滁州幼安,周孚,唐,诗,五言古体,君家即墨君 不与世同调 紫云覆寒冰 色与质俱妙 谁知穷荒地 尤物来越徼 探囊忽见畀 此事出吾料 隋珠暗投处 叹息真可吊 物生各有用 瑚琏荐清庙 君才两汉余 妙句出长啸 吾衰亦粗尔 老语世不要 摩挲冰玉质 自庆还自谯 愿君为追琢 勿令研空笑,"5,5,5,5,5,5,5,5,5,5,5,5,5,5,5,5,5,5,5,5",44dde7f48063a0f04fb1b7b8d2c190fe,君家 即墨 君 不 与 世 同调 紫云 覆 寒 冰 色 与 质 俱 妙 谁知 穷 荒地 尤物 来 越 徼 探囊 忽 见 畀 此事 出吾料 隋珠 暗 投处 叹息 真 可吊 物生 各 有用 瑚 琏 荐 清 庙 君 才 两汉 余 妙句 出 长啸 吾 衰 亦 粗 尔 老语 世 不要 摩挲 冰 玉质 自庆 还 自 谯 愿君 为 追琢 勿令 研空 笑
ab7a4bc0-680b-423b-9613-67629dff47a0,次韵史伯强,周孚,唐,诗,五言古体,金陵望京江 与子俱异乡 以胶投漆中 非子吾谁望 平生山林愿 儿乳宁可断 招子独不来 同谁弋凫雁 乖离念存没 一饭再三歇 往者十年梦 在者千里别 寄声问平安 此去何时还 炽火暖浊酒 此盟安可寒,"5,5,5,5,5,5,5,5,5,5,5,5,5,5,5,5",3f55e972e6142a8b2d0689ab834cc369,金陵 望京 江 与 子 俱 异乡 以胶投漆 中 非子 吾 谁 望 平生 山林 愿 儿乳 宁可 断 招子 独不来 同 谁 弋 凫雁 乖离 念存 没 一 饭 再三 歇 往者 十年 梦 在 者 千里 别 寄声 问 平安 此去 何时 还 炽 火 暖 浊酒 此 盟安 可寒
9c38e4b0-698a-4892-b7c7-401bb4e5e5c6,赵漕生日  其一,周孚,唐,诗,五言律诗,治世才难得 公生瑞圣朝 高怀元稷契 异骨更松乔 骥𫘧须千里 鹓雏合九霄 明年东府宴 相与记今朝,"5,5,5,5,5,5,5,5",14e42d497f2817eae63fd57177dc2962,治世 才 难得 公生 瑞圣 朝 高怀元 稷 契 异骨 更 松 乔 骥 𫘧 须 千里 鹓 雏 合 九霄 明年 东府 宴 相与 记 今朝
a4c68f5f-4fbb-406d-809e-2f240dc5a3cc,赵漕生日  其二,周孚,唐,诗,五言律诗,名族仍前辈 高才更望郎 经年滞龙节 数日冠鹓行 白鹤开新历 青黏屏旧方 春风柳条绿 传赐看勾芒,"5,5,5,5,5,5,5,5",6ec20968bcad93140e187f80bf2e15a1,名族 仍 前辈 高 才 更 望 郎 经 年 滞 龙节 数日 冠 鹓 行 白鹤 开 新历 青 黏屏 旧方 春风 柳条 绿 传赐 看 勾芒
29dca7af-73ae-4508-be65-3df81082ab41,金山海书记寄七骑,周孚,唐,诗,杂言,两骑并驱争欲前 两骑舍矢俱应弦 一骑挥挝一负箭 一骑力挽弓初圆 寒风潇潇沙漠漠 封豨可擒熊可搏 汉家飞将未出关 政使渠侬专此乐 君不见往年胡瓌写此图 宛陵诗翁最爱渠 戏将醉墨作长句 岁月政当嘉祐初 故家文物今星散 老笔凭谁辩真赝 胡儿走马大梁城 对君此画空三叹,"7,7,7,7,7,7,7,7,10,7,7,7,7,7,7,7",df6d2ce7edc14a7354f510fc62e1db90,两 骑 并 驱争 欲 前 两 骑 舍矢俱应弦 一 骑 挥 挝 一 负箭 一 骑力 挽 弓初圆 寒风 潇潇 沙漠 漠 封 豨可 擒 熊 可搏 汉家飞 将 未 出关 政使 渠侬 专此 乐 君不见 往年 胡 瓌 写 此 图 宛陵 诗翁 最爱 渠 戏 将 醉 墨 作 长句 岁月 政当 嘉 祐 初 故家 文物 今 星散 老笔 凭 谁 辩真 赝 胡儿 走马 大梁 城 对 君 此 画空 三 叹
0a23a453-52a1-40ce-baeb-31f3a23405c9,次韵赣州知府陈侍郎二首前篇寄幼安后篇寄季陵  其一,周孚,唐,诗,七言律诗,乘轺西去定何人 惊倒吴侬政要君 平日比肩空绛灌 此行知已有华勋 不令残孽终烦国 信是高才可冠军 锋猬斧螗当著语 病夫今岁懒于文,"7,7,7,7,7,7,7,7",6663d881b8a9a060272a45e2680a013c,乘 轺 西 去 定 何人 惊 倒 吴侬 政要 君 平日 比肩 空绛灌 此行 知 已有 华勋 不令 残孽 终烦 国 信 是 高 才 可 冠军 锋 猬 斧 螗 当著 语 病夫 今 岁 懒于 文
b82419c4-6b67-49d7-b991-7cc13a22ccc9,次韵赣州知府陈侍郎二首前篇寄幼安后篇寄季陵  其二,周孚,唐,诗,七言律诗,朝班数日待归来 又醉凌虚百尺台 两岁虽为汝曹福 一州那尽此翁才 只今音问逾千里 何日登临共一杯 宣室受厘知已久 问公藏缩独何哉,"7,7,7,7,7,7,7,7",aaf797b8b5706d1c14f5150165cd4425,朝班 数日 待 归来 又 醉 凌虚 百尺 台 两岁 虽为 汝 曹福 一 州 那 尽此 翁才 只 今音 问 逾 千里 何日 登临 共 一杯 宣室 受 厘 知 已久 问公藏 缩独何 哉
ecc493c9-7aa1-4fe7-952d-19350019e29c,高邮知军觅芍药一枝五花三绝  其一,周孚,唐,诗,七言绝句,芒种逢花已自难 瑞云攒处凭栏干 烦君问取同州例 一干三花奏牡丹,"7,7,7,7",2d8b3da8c754640d92924ce0c67569bd,芒种 逢 花 已自 难 瑞云 攒 处 凭栏 干 烦 君 问取 同州 例 一干三 花奏 牡丹
1a208730-a2e4-47d5-b76e-fc74dc8a846c,高邮知军觅芍药一枝五花三绝  其二,周孚,唐,诗,七言绝句,蜀锦团𪢮照眼明 游蜂乍见亦须惊 君知此种来何处 花萼楼中五弟兄,"7,7,7,7",1e56f944e6a204e53f1a7dc4370ad7a0,蜀锦 团 𪢮 照眼 明 游蜂 乍见 亦须 惊 君知 此种 来 何处 花萼 楼中 五 弟兄
ffab2179-92d5-4de2-a5f2-7398b844f957,高邮知军觅芍药一枝五花三绝  其三,周孚,唐,诗,七言绝句,泾川游女汉宫妃 压倒渠侬金带围 吾府只今虚席在 栈羊酾酒送公归,"7,7,7,7",91cbef1698d1c1a73d8690294bdccc53,泾川 游女 汉宫 妃 压倒 渠侬 金带 围 吾 府 只今 虚席 在 栈 羊 酾 酒 送 公归
ea106a3d-a760-4192-bb35-b041c84ac7c5,寄辛幼安,周孚,唐,诗,七言律诗,飞鸢跕跕瘴烟中 叹息渠侬伎已穷 欹壑老松真耐久 燎原荒草易成空 危机可畏浑如此 庄语能听只有公 已识柴车胜朱毂 快来相就北窗风,"7,7,7,7,7,7,7,7",2070a50fd8fa38c8ffc30ec6df3120d8,飞鸢 跕跕瘴 烟 中 叹息 渠 侬 伎 已穷 欹 壑 老松真 耐久 燎原 荒草 易成空 危机 可畏 浑 如此 庄语 能 听 只有 公 已识 柴车 胜 朱 毂 快来相 就 北窗 风
500dc4b2-f930-4ba3-a816-8e2fdbee0bc0,送陈唐卿尉繁昌二首  其一,周孚,唐,诗,五言律诗,一贫那可忍 子亦老夫如 晚岁难忘禄 生平误信书 相逢搔首处 共是折腰初 莫作高常侍 狂歌忆孟诸,"5,5,5,5,5,5,5,5",4055a224d3503589acc8655001be767a,一贫 那 可忍 子亦 老夫 如 晚岁 难忘 禄 生平 误信 书 相逢 搔首 处 共 是 折腰 初 莫作 高常 侍 狂歌 忆孟诸
6682a3f4-4ca8-4ffc-b3dc-566a6292499d,送陈唐卿尉繁昌二首  其二,周孚,唐,诗,五言律诗,老笔倦场屋 今年方自如 无为堕丹墨 可便废诗书 妙质嗟谁似 修涂记此初 摩挲和氏璧 吾语亦礛诸,"5,5,5,5,5,5,5,5",fc2f06d7fa2cc18c3a0b8fc02e6bf82d,老 笔 倦 场屋 今年 方 自如 无为 堕 丹墨 可便 废 诗书 妙质 嗟谁似 修涂记 此初 摩挲 和氏璧 吾 语 亦 礛 诸
824882b4-1546-46cb-90df-a4814456e38e,题彭氏韦经堂  其一,周孚,唐,诗,七言绝句,鲜卑语熟更琵琶 渠向人前亦自夸 棐几明窗那可负 喜君能记鲁东家,"7,7,7,7",db294a3aef9b19bcc7197c7c93614296,鲜卑语 熟 更 琵琶 渠向 人 前 亦 自夸 棐 几 明 窗 那 可 负 喜 君能记鲁 东家
e53ad2b4-ec8a-4cde-9521-d138a23bf1be,题彭氏韦经堂  其二,周孚,唐,诗,七言绝句,公圭侯印照乡闾 到了扶阳只汉儒 不向师门论官阀 未知回赐可无殊,"7,7,7,7",c18e9ac00269e8322843695f75be7ca9,公圭侯 印照乡闾 到 了 扶阳 只 汉 儒 不 向 师门 论 官阀 未知 回赐 可 无殊
c08e8bec-463a-4a14-8a5c-94fccd3ba273,天宁寺清宇壁间韵,周孚,唐,诗,七言绝句,风历寒窗竹自鸣 老谈还得片时醒 挽君小住君知否 恐有楞伽未了经,"7,7,7,7",24c921e04d44c637b44f1ae44bc54577,风历 寒窗 竹自鸣 老 谈 还 得 片时 醒 挽 君 小 住 君 知否 恐 有 楞伽 未了 经
42921b59-6b15-404f-bcd8-58a6c66d21ef,与王南仲李清宇夜坐十二月八日大雨,周孚,唐,诗,五言律诗,急景不可驻 十年无好怀 飘流还此日 团聚且吾侪 短日衣衫尽 寒云雨雪偕 昏灯照清夜 安得酒如淮,"5,5,5,5,5,5,5,5",691e5913b46c198518949237cdb6705b,急景 不可 驻 十年 无好 怀 飘流 还此 日 团聚 且 吾侪 短日 衣衫 尽 寒云 雨雪 偕 昏灯 照 清夜 安得 酒 如 淮
841801ff-a42d-426a-a194-e97196a19e1f,喜清宇伯强自外县归,周孚,唐,诗,七言律诗,不见尊前两友生 流年欲尽不胜情 寒窗孤坐风初定 短策同来雪正晴 浊酒只今俱入务 新诗从此试寻盟 黄尘掠面无佳思 乞得逢君眼便明,"7,7,7,7,7,7,7,7",e4428e6b5926160bdf77a1a2b04ff20a,不见 尊 前 两 友生 流年 欲 尽 不胜 情 寒窗 孤坐 风 初定 短策 同来 雪正晴 浊酒 只今 俱入务 新诗 从此 试 寻盟 黄尘 掠 面无佳思 乞得 逢 君 眼 便 明
71e59b0c-e496-4d33-9f9a-70c1d489d3b2,题滁倅燕丈文伯蘧庐,周孚,唐,诗,七言律诗,浮云过眼只斯须 兀兀粘黐政笑渠 万事悟来俱蚁穴 一官随处是蘧庐 已知要路真聊尔 试问高怀竟孰如 老树扶疎真可爱 因君又欲感归欤,"7,7,7,7,7,7,7,7",af2224e4932149f5c7802ca779f7aa4f,浮云 过眼 只 斯须 兀 兀 粘 黐 政 笑 渠 万事 悟 来 俱 蚁穴 一 官 随处 是 蘧 庐 已知 要 路 真 聊 尔 试问 高怀 竟 孰如 老树 扶 疎 真 可爱 因 君 又 欲 感归 欤
4be0a1c0-02cb-47fc-aece-0830f42ba3f3,以黄公金华伯五字为韵上黄仲秉侍郎  其一,周孚,唐,诗,五言律诗,求道固多岐 我马玄以黄 耳闻老叔度 欲聚三月粮 今日复何幸 得上君子堂 医门不拒疾 请试囊中方,"5,5,5,5,5,5,5,5",9cc0ad4efa9e2274653f1d379961b1c9,求道 固 多岐 我 马玄 以 黄 耳闻 老叔 度 欲 聚 三月 粮 今日 复何 幸 得 上 君子 堂 医门 不 拒 疾 请试 囊中 方
956b9e44-b1a6-478a-be35-7de09ce388c3,以黄公金华伯五字为韵上黄仲秉侍郎  其二,周孚,唐,诗,五言律诗,先朝盛文物 最盛元祐中 我生百年后 深思附冥鸿 人欲天不违 今复识此翁 何以知其然 风味如长公,"5,5,5,5,5,5,5,5",ff029f85c068046dbf777aba773e6b42,先朝 盛 文物 最 盛元 祐 中 我 生 百年 后 深思 附 冥 鸿 人欲天不违 今 复识 此 翁 何以 知其然 风味 如长 公
6a96171c-38a6-4706-b948-fcb74a1285e8,以黄公金华伯五字为韵上黄仲秉侍郎  其三,周孚,唐,诗,五言律诗,古货不易售 八荒孰知音 零落子云书 尘埃伯牙琴 我戆久病此 属公听呻吟 可笑朱汗漫 屠龙费千金,"5,5,5,5,5,5,5,5",d3301d71b33ed3ff8bb41e17d13ec29e,古货 不易 售 八荒 孰 知音 零落 子云书 尘埃 伯牙 琴 我 戆 久病 此 属 公听 呻吟 可笑 朱 汗漫 屠龙 费 千金
3f97a86a-27fb-470c-94f5-4c3583458971,以黄公金华伯五字为韵上黄仲秉侍郎  其四,周孚,唐,诗,五言律诗,硬语斡地轴 奇辞拔鲸牙 向来豫章公 一洗空百家 此灯不可传 公实优昙华 银河会可穷 从公丐灵槎,"5,5,5,5,5,5,5,5",11f0dee20dc9a9a00e9df6c83c484b78,硬语 斡 地轴 奇辞拔鲸牙 向来 豫章 公 一 洗 空 百家 此 灯 不可 传 公实 优 昙华 银河 会 可 穷 从 公丐 灵槎
1e36e80e-c573-417b-aafb-39464a427971,以黄公金华伯五字为韵上黄仲秉侍郎  其五,周孚,唐,诗,五言律诗,名如九鼎重 笔有万钧力 甘从颍川最 厌就承明直 顷时未承颜 既见有矜色 归语同舍生 吾几类河伯,"5,5,5,5,5,5,5,5",8f629235d0185aaea8d017d6ea6b9d56,名 如 九鼎 重 笔 有 万钧力 甘 从 颍川 最 厌 就 承明 直 顷时 未承 颜 既见 有 矜色 归语 同 舍生 吾 几类 河伯
