id,title,author,dynasty,genre,poem_type,sentences_simplified,meter_pattern,hash,words
64c55c5c-684b-4cb1-a755-64ca634b0f47,送阆州妓人归老,何扶,唐,诗,七言律诗,竹翠婵娟草迳幽 佳人归老傍汀洲 玉蟾露冷梁尘暗 金凤花开云鬓秋 十亩稻香新绿野 一声歌断旧青楼 芭蕉半卷西池雨 日暮门前双白鸥,"7,7,7,7,7,7,7,7",41b5936237b88db3f9d9491d70a8da8b,竹翠 婵娟 草 迳 幽 佳人 归老傍 汀洲 玉蟾 露 冷梁尘暗 金凤花 开 云鬓 秋 十亩 稻香 新 绿野 一声 歌断 旧 青楼 芭蕉 半卷 西池 雨 日暮 门前 双白鸥
5b54b1f8-7f9d-4efa-8a5e-38e7666cae6e,寄旧同年,何扶,唐,诗,七言绝句,金榜题名墨尚新 今年依旧去年春 花间每被红妆问 何事重来只一人,"7,7,7,7",4552e1fdb0308694762150d019c77d04,金榜题名 墨尚新 今年 依旧 去年 春 花间 每 被 红妆 问 何事 重来 只 一 人
3a4e6505-1883-421a-81d4-791f2fe109f4,望九华山,柴夔,唐,诗,七言律诗,九华如剑插云霓 青霭连空望欲迷 北截吴门疑地尽 南连楚界觉天低 龙池水蘸中秋月 石路人攀上汉梯 惆怅旧游无复到 会须登此出尘泥,"7,7,7,7,7,7,7,7",5e710ff6d9123027e83ec80151b69654,九华 如 剑 插 云霓 青霭 连空 望欲迷 北 截 吴门疑 地 尽 南连 楚界 觉 天 低 龙 池水 蘸 中秋月 石路 人 攀上 汉梯 惆怅 旧游 无复到 会 须 登 此 出尘 泥
80bc7242-0faf-4e71-bd08-87dc7797434f,寄妾赵氏,房千里,唐,诗,七言律诗,鸾凤分飞海树秋 忍听钟鼓越王楼 只应霜月明君意 缓抚瑶琴送我愁 山远莫教双泪尽 雁来空寄八行幽 相如若返临邛市 画舸朱轩万里游,"7,7,7,7,7,7,7,7",edea38a97a0ac7c00c4424d3e2b96732,鸾凤分飞 海树秋 忍听 钟鼓 越王楼 只 应 霜 月 明君意 缓抚 瑶 琴 送 我 愁 山远 莫教 双泪 尽 雁来空 寄 八行 幽 相 如若 返临 邛市 画 舸 朱轩 万里 游
ad146e03-747a-4a4b-865c-97a8aff9f099,早行,刘郇伯,唐,诗,五言律诗,钟静人犹寝 天高月自凉 一星深戍火 残月半桥霜 客老愁尘下 蝉寒怨路傍 青山依旧色 宛是马卿乡,"5,5,5,5,5,5,5,5",632c3ada5957b4d84fa8903fc00dc487,钟静 人犹寝 天 高 月 自凉 一星 深戍 火 残月 半 桥 霜 客老 愁尘下 蝉 寒 怨 路 傍 青山 依旧 色 宛 是 马卿 乡
3a6f6407-5231-4002-be02-0e6301f5c3b0,句,刘郇伯,唐,诗,五言古体,人生分外愁,5,d9645545b8704e17de11ba1bff89ed02,人生 分外 愁
6b394904-befe-4dd5-81b2-2ded491c6ea5,赠成都僧,李章武,唐,诗,七言绝句,南宗尚许通方便 何处心中更有经 好去苾𫇴云水畔 何山松栢不青青,"7,7,7,7",99f317057b32795c9ea767743e8151cc,南宗 尚许 通 方便 何处 心中 更 有 经 好 去 苾 𫇴 云水 畔 何 山松 栢 不 青青
1a388971-8cbd-4335-b787-db4dda3a604a,享太庙乐章,萧倣,唐,诗,杂言,圣祚无疆 庆传乐章 金枝繁茂 玉叶延长 海渎常晏 波涛不扬 汪汪美化 垂范今王,"4,4,4,4,4,4,4,4",daf8af716ce76b5810936fbbc96bff21,圣祚 无疆 庆传 乐章 金枝 繁茂 玉叶 延长 海渎常 晏 波涛 不 扬 汪汪 美化 垂范 今 王
26d2ab27-e7d2-4c53-9fb1-202bbc0138e0,享太庙乐章,萧倣,唐,诗,杂言,于铄丕嗣 惟帝之光 羽籥象德 金石荐祥 圣系无极 景命永昌 神降上哲 维天配长,"4,4,4,4,4,4,4,4",8626ede8c2c447f8c6c499562a36e874,于铄丕 嗣 惟帝 之 光 羽 籥 象 德 金石 荐 祥 圣系 无极 景命 永昌 神 降上 哲 维天 配长
ed41bb29-5728-4baf-a842-a124083eb671,荅杨尚书,柳棠,唐,诗,七言绝句,未向燕台逢厚礼 幸因社会接余欢 一鱼吃了终无媿 鹍化为鹏也不难,"7,7,7,7",3e17d87e814652e7164a43220bea6080,未 向 燕台 逢 厚礼 幸因 社会 接余欢 一 鱼 吃 了 终 无 媿 鹍 化为 鹏 也 不难
1a5db9d9-af47-4083-97d7-088dd9447897,席上戏东川杨尚书,柳棠,唐,诗,七言绝句,莫言名位未相俦 风月何曾阻献酬 前辈不须轻后辈 靖安今日在衡州,"7,7,7,7",c20b2e2fce981c9dcec6d94ed3b2f9e8,莫言 名位 未相 俦 风月 何曾 阻献酬 前辈 不须 轻 后辈 靖安 今日 在 衡州
d7e9facb-cdfa-45db-ad83-38f2ba42c0ad,缑山月夜闻王子晋吹笙,钟辂,唐,诗,五言古体,月满缑山夜 风传子晋笙 初闻盈谷远 渐听入云清 杳异人间曲 遥分鹤上情 孤鸾惊欲舞 万籁寂无声 此夕留烟驾 何时返玉京 唯愁音响绝 晓色出都城,"5,5,5,5,5,5,5,5,5,5,5,5",fd471b8652e70b3360407af55d0bc87d,月 满 缑 山夜 风传 子晋笙 初闻 盈谷 远 渐 听入 云清 杳 异 人间 曲 遥 分 鹤 上 情 孤鸾惊欲舞 万籁 寂 无声 此夕 留烟 驾 何时 返 玉京 唯 愁 音响 绝 晓色 出 都城
cb539b2b-56bb-41a5-8e69-7f43af8d2b19,南溪书院,杨发,唐,诗,五言律诗,茅屋住来久 山深不置门 草生垂井口 花发接篱根 入院将雏鸟 攀萝抱子猨 曾逢异人说 风景似桃源,"5,5,5,5,5,5,5,5",4617f12a95e5fe0468f437241cbc6f07,茅屋 住 来 久 山深 不 置 门 草生 垂 井口 花 发接 篱根 入院 将 雏鸟 攀萝 抱 子 猨 曾 逢 异 人 说 风景 似 桃源
b9d22e42-8b9b-4cdf-ad2e-94da89a8ccb3,春园醉醒闲卧小斋,杨发,唐,诗,五言律诗,酣醉送余春 醒来恨更频 花残蜂蠹物 叶暗鸟欺人 帘闭高眠贵 斋空浩气新 从今北牕蝶 长是梦中身,"5,5,5,5,5,5,5,5",0724236996bf1260764ab30286e647a8,酣醉 送 余春 醒来 恨 更频 花 残蜂 蠹物 叶暗鸟 欺 人 帘 闭 高 眠 贵 斋 空 浩气 新 从今 北 牕 蝶 长 是 梦 中 身
7d3748cf-ba8b-4f09-8628-b7e08f270193,小园秋兴,杨发,唐,诗,五言律诗,谁言帝城里 独作野人居 石磴晴看叠 山苗晚自锄 相惭五秉粟 尚癖一车书 昔日扬雄宅 还无乡相舆,"5,5,5,5,5,5,5,5",0ff2c6ddaeb6f9f450504b6fa3ca0e78,谁 言帝 城里 独作 野人 居 石 磴 晴 看叠 山苗 晚 自 锄 相惭 五秉粟 尚癖 一车 书 昔日 扬雄 宅 还 无 乡相 舆
f527aa98-54ca-4175-a89d-e0e40db27c9f,与诸公池上待月,杨发,唐,诗,五言律诗,树密云萦岸 池遥水际空 芰开方吐镜 苹动欲含风 渐映沙汀白 微分渚叶红 金波宜共赏 仙櫂一宵同,"5,5,5,5,5,5,5,5",16b218d1e05d20b90bf6b5fee98124ec,树 密云 萦岸 池遥 水际 空 芰 开方 吐镜 苹动 欲 含 风 渐映 沙汀 白 微分 渚 叶红 金波宜 共 赏 仙 櫂 一 宵 同
285f77cd-a017-4e27-ad44-acaeaac79b37,簷雀,杨发,唐,诗,五言律诗,弱羽怯孤飞 投簷幸所依 衔环唯报德 贺厦本知归 红觜休争顾 丹心自识机 从来攀凤足 生死恋光辉,"5,5,5,5,5,5,5,5",f168f7e2261087af9237a3f3ccc34193,弱 羽 怯 孤 飞 投簷 幸所依 衔环 唯 报德 贺 厦本 知归 红 觜 休 争顾 丹心 自识 机 从来 攀凤足 生死恋 光辉
f90f18d0-a857-4401-9b0c-88c70c642db5,残花,杨发,唐,诗,五言律诗,已笑良时晚 仍悲别酒催 暖芳随日薄 残片逐风回 黛歛愁歌扇 妆残泣镜台 繁阴莫矜衒 终是共尘埃,"5,5,5,5,5,5,5,5",998e41177c260e5c0852786964f6703f,已 笑良 时 晚 仍 悲别 酒 催 暖 芳 随 日 薄 残片 逐 风 回 黛 歛 愁 歌 扇 妆 残泣 镜台 繁阴 莫 矜 衒 终是 共 尘埃
e3eb03db-284c-4eef-bbed-223f82a01565,山泉,杨发,唐,诗,五言古体,半空飞下水 势去响如雷 静彻啼猨寺 高陵坐客台 耳同经劒阁 身若到天台 溅树吹成冻 邻祠触作灰 深中试榔栗 浅处落莓苔 半夜重城闭 潺湲枕底来,"5,5,5,5,5,5,5,5,5,5,5,5",c0970d7e1e561cf1a4a8c0d4a495e98f,半空 飞 下水 势 去 响 如雷 静彻 啼 猨 寺 高陵 坐客 台 耳同 经 劒 阁 身 若 到 天台 溅 树 吹 成冻 邻祠 触作 灰 深 中试 榔栗 浅 处 落 莓 苔 半夜 重城 闭 潺湲 枕 底 来
377bfc60-652a-45e0-a006-2b3429f87910,秋晚日少陵原游山泉之什,杨发,唐,诗,七言律诗,喧浊侵肌性未沈 每来云外恣幽寻 尘衣更喜秋泉洁 倦迹方依竹洞深 暂过偶然应系分 有期终去但劳心 唯怜一夜空山月 似许他年伴独吟,"7,7,7,7,7,7,7,7",6b6a8a87d6acf8ac412f13985345b04a,喧 浊 侵 肌性 未 沈 每 来云外恣幽 寻 尘衣 更 喜 秋泉洁 倦迹 方依竹 洞 深 暂过 偶然 应系 分 有 期终 去 但 劳心 唯怜 一夜 空山 月 似许 他 年 伴 独吟
5a00bd0c-8efa-4506-96d8-9a7a6cd8d64e,秋晴独立南亭,杨发,唐,诗,七言律诗,昼对南风独闭关 暗期幽鸟去仍还 如今有待终身贵 未若忘机尽日闲 心似蒙庄游物外 官惭许掾在人间 开襟自向清风笑 无限秋光为解颜,"7,7,7,7,7,7,7,7",9ba76d64621c6c3fc1d658201189409e,昼 对 南风 独 闭关 暗期 幽鸟 去 仍 还 如今 有待 终身 贵 未若忘机尽日闲 心似 蒙庄 游物 外 官 惭 许 掾 在 人间 开襟 自向 清风 笑 无限 秋光 为解 颜
fdefa73b-111d-4b67-ae50-343eb1acce7a,宿黄花馆,杨发,唐,诗,七言律诗,孤馆萧条槐叶稀 暮蝉声隔水声微 年年为客路无尽 日日送人身未归 何处迷鸿离浦月 谁家愁妇捣霜衣 夜深不卧帘犹卷 数点残萤入户飞,"7,7,7,7,7,7,7,7",a78fffc0e1cf268ecbbac5724fc57ee1,孤馆 萧条 槐叶 稀 暮 蝉声 隔 水声 微 年 年 为 客路 无尽 日日 送 人身 未归 何处 迷鸿离浦 月 谁家 愁妇捣霜 衣 夜深 不卧帘犹卷 数点 残 萤 入户 飞
3858aba8-a434-4161-b876-30932cdb1de5,南野逢田客,杨发,唐,诗,七言律诗,桑柘悠悠水蘸堤 晚风晴景不妨犂 高机犹织卧蚕子 下坂未饥逢饲妻 杏色满林羊酪熟 麦凉浮垅雉媒低 生时自乐死由命 万事在天管不迷,"7,7,7,7,7,7,7,7",fe543037233dec56bc751989fcbecc8d,桑柘 悠悠 水 蘸 堤 晚风 晴景 不妨 犂 高机 犹织 卧 蚕子 下 坂 未饥逢 饲妻 杏 色满 林 羊酪 熟 麦凉 浮 垅 雉 媒 低 生时 自乐 死 由 命 万事 在 天管 不迷
fd504db7-1451-43ed-8535-3d832aeeb913,东斋夜宴酬绍之起居见赠,杨发,唐,诗,七言律诗,龙门八上不知津 唯有君心困益亲 白社追游名自远 青袍相映道逾新 十年江海鱼缄尽 一夜笙歌凤吹频 渐老旧交情更重 莫将美酒负良辰,"7,7,7,7,7,7,7,7",efe0ecab9c1ea9eb09d3ec12ef2b81ec,龙门 八上 不知 津 唯有 君心 困益亲 白社 追 游名 自远 青袍 相映 道 逾 新 十年 江海 鱼缄尽 一夜 笙歌 凤吹频 渐 老 旧 交情 更 重 莫将 美酒 负 良辰
a3b5ae5a-7283-4968-b235-37d4115c5d03,玩残花,杨发,唐,诗,七言绝句,十日浓芳一岁程 东风初急眼偏明 低枝似泥幽人醉 莫道无情似有情,"7,7,7,7",cb2c38f8c432dc6e4b8bae5fff5f762b,十日 浓 芳 一岁 程 东风 初 急眼 偏明 低 枝 似 泥 幽 人 醉 莫道 无情 似 有情
3338fae3-9357-4a05-9492-bc4c75aea40e,咏蛙,杨收,唐,诗,五言绝句,兔边分玉树 龙底耀铜仪 会当同鼓吹 不复问官私,"5,5,5,5",3a6cefc2cefab79776f8a57b1f8dba18,兔 边 分 玉树 龙底 耀铜仪 会 当同 鼓吹 不复 问官 私
fbae43f0-12bb-40f6-853c-7d682bcf6c92,笔,杨收,唐,诗,五言绝句,虽匪囊中物 何坚不可钻 一朝操政柄 定使冠三端,"5,5,5,5",a7caa92f6fe4d869d190f91670f831de,虽 匪 囊中物 何坚 不可 钻 一朝 操 政柄 定 使 冠 三端
b1b78a63-bf5c-4a86-8496-faab8b5f77a2,嘲吴人观者,杨收,唐,诗,五言绝句,尔幸无羸角 何用触吾藩 若是升堂者 还应自得门,"5,5,5,5",0982c35cd853e1a96c7df164f74a628a,尔幸 无 羸角 何用 触 吾 藩 若 是 升堂 者 还 应 自得 门
795a0d30-7e33-4cb0-9c71-00640cc2630f,甲子岁书事,杨乘,唐,诗,五言古体,竖子未鼎烹 大君尚旰食 风雷随出师 云霞有战色 犒功椎万牛 募勇悬千帛 武士日曳柴 飞将竞执馘 喜气迎捷书 懽声送羽檄 天兵日雄强 桀犬稍离析 贼臂既已断 贼喉既已搤 乐祸但鲸鲵 同恶为肘腋 小大势难侔 逆顺初不敌 违命固天亡 恃险乖长策 虿毒久萌牙 狼顾非日夕 礼貌忽骄狂 疏奏遂指斥 动众岂佳兵 含忍恐无益 鸿恩既已孤 小效不足惜 腐儒一铅刀 投笔时感激 帝阍不敢干 恓恓坐长画,"5,5,5,5,5,5,5,5,5,5,5,5,5,5,5,5,5,5,5,5,5,5,5,5,5,5,5,5,5,5,5,5",a9e486480517e9b9fa1c1daf9548dce8,竖子 未鼎烹 大君 尚 旰食 风雷 随 出师 云霞 有 战色 犒功椎 万 牛 募 勇 悬千帛 武士 日 曳柴 飞 将 竞执 馘 喜气 迎 捷书 懽 声 送 羽 檄 天兵 日 雄强 桀 犬 稍 离析 贼 臂 既 已断 贼 喉 既 已 搤 乐祸 但 鲸 鲵 同 恶为 肘腋 小 大势 难 侔 逆 顺初 不敌 违命 固天亡 恃 险 乖 长策 虿 毒 久 萌牙 狼顾非 日夕 礼貌 忽 骄狂 疏奏 遂 指斥 动众 岂 佳 兵 含忍 恐 无益 鸿恩 既 已 孤 小 效 不足 惜 腐儒 一 铅 刀 投笔 时 感激 帝 阍 不敢 干 恓 恓 坐 长 画
f197988c-128c-4c5b-ba4c-12edc25ca5fb,南徐春日怀古,杨乘,唐,诗,五言古体,六代骄奢地 三春物象繁 灵湖通涨海 天堑隔中原 晓渡高帆驶 阴风巨舰翻 旌旗西日落 戈甲夏云屯 豹变资陈武 龙飞拥晋元 风流前事尽 文物旧仪存 邪侮尝移润 忠贞几度冤 兴亡山兀兀 今古水浑浑 露滴蜂偷蘂 莺啼日到轩 酒肠堆曲糵 诗思遶乾坤 愁梦全无蝶 离忧每愧萱 形骸劳大块 玉石任炎昆 出处宁由己 升沈未足言 且应中圣乐 坐起任昏昏,"5,5,5,5,5,5,5,5,5,5,5,5,5,5,5,5,5,5,5,5,5,5,5,5,5,5,5,5",de24925c26b8a8d78a00e9ba0b9af66a,六代 骄奢 地 三 春 物象 繁 灵湖 通涨 海 天堑 隔 中原 晓渡高帆 驶 阴风 巨舰 翻 旌旗 西 日落 戈甲 夏云屯 豹 变资 陈武 龙飞 拥 晋元 风流 前事 尽 文物 旧 仪存 邪 侮尝 移润 忠贞 几度 冤 兴亡 山 兀 兀 今古 水 浑浑 露 滴 蜂 偷 蘂 莺啼 日 到 轩 酒肠 堆 曲 糵 诗思 遶 乾坤 愁梦全无蝶 离忧 每 愧 萱 形骸 劳 大块 玉石 任炎昆 出处 宁由己 升 沈 未 足 言 且 应 中圣 乐 坐起 任 昏昏
4485534f-6f1d-42fc-9e4e-5e436390a2ea,吴中书事,杨乘,唐,诗,七言律诗,十万人家天堑东 管弦台榭满春风 名归范蠡五湖上 国破西施一笑中 香迳自生兰叶小 响廊深映月华空 尊前多暇但怀古 尽日愁吟谁与同,"7,7,7,7,7,7,7,7",7fbae19bef5ab4b46be964096c3eb66e,十万 人家 天堑 东 管弦 台榭 满 春风 名 归 范蠡 五 湖上 国破 西施 一 笑 中 香 迳自 生兰 叶小 响廊 深映 月华 空 尊 前多暇 但 怀古 尽日 愁 吟 谁 与 同
a611f612-6aac-4551-a73b-870f183cd0f3,建邺怀古,杨乘,唐,诗,七言绝句,故城故垒满江𣸣 尽是干戈旧苦辛 见此即须知帝力 生来便作太平人,"7,7,7,7",547bf90d6a9e3cf5fd38710534c32ac6,故城 故垒 满江 𣸣 尽 是 干戈 旧 苦辛 见 此 即 须知 帝力 生来 便 作 太平 人
4e3b4647-f4fb-433d-b152-262e74599ea4,牓句,杨乘,唐,诗,七言绝句,伶俜乖拙两何如 昼泥琴声夜泥书 数拍胡笳弹未熟 故人新命画胡车,"7,7,7,7",869cd22432c14792a2c95d6f62bbbb4f,伶 俜 乖 拙 两 何如 昼泥 琴声 夜 泥 书 数 拍 胡笳 弹 未熟 故人 新 命画 胡车
595aa16c-a3e3-4d0b-bc7a-3eba6dbe736b,题杨收相公宅,尹璞,唐,诗,七言绝句,祸福从来路不遥 偶然平地上烟霄 烟霄未稳还平地 门对孤峰占寂寥,"7,7,7,7",8538babbe133af7c3133d3da5e6355f6,祸福 从来 路 不 遥 偶然 平地上 烟霄 烟霄 未 稳 还 平地 门 对 孤峰 占 寂寥
09a4efce-fd84-4660-9ab4-ae9c502887e8,明月照高楼,雍陶,唐,诗,五言古体,朗月何高高 楼中帘影寒 一妇独含叹 四坐谁成欢 时节屡已移 游旅杳不还 沧溟傥未涸 妾泪终不干 君若无定云 妾若不动山 云行出山易 山逐云去难 愿为边塞尘 因风委君颜 君颜良洗多 荡妾浊水间,"5,5,5,5,5,5,5,5,5,5,5,5,5,5,5,5",1ebc55cc98062ac8658b912e4709f459,朗 月 何 高高 楼中 帘影 寒 一妇 独含 叹 四 坐 谁 成欢 时节 屡已 移 游旅 杳不还 沧 溟 傥 未涸 妾 泪 终不 干 君 若 无定 云 妾 若 不动 山 云行 出山 易 山逐云 去 难 愿 为 边塞 尘 因 风委 君颜 君 颜良洗 多 荡 妾 浊水 间
57436bfa-b684-4645-ab8c-5e40fd4c4320,酬秘书王丞见寄,雍陶,唐,诗,五言律诗,朝下有闲思 南沟边水行 因来见寥落 转自叹平生 白首丈夫气 赤心知己情 留诗本相慰 却忆苦吟声,"5,5,5,5,5,5,5,5",be2c0ba40ffdd73e7e3e2635050b6ae3,朝 下有 闲思 南 沟边 水行 因来 见 寥落 转自 叹 平生 白首 丈夫 气 赤心 知己 情 留 诗 本相 慰 却 忆苦 吟声
9ae12a8a-8cea-4e3a-8e07-6de76cfbb9a0,赠金河戍客,雍陶,唐,诗,五言律诗,惯猎金河路 曾逢雪不迷 射雕青冢北 走马黑山西 戍远旌幡少 年深帐幕低 酬恩须尽敌 休说梦中闺,"5,5,5,5,5,5,5,5",112f955070f7bd5a4b7e22cde1b52099,惯猎 金河 路 曾逢雪 不迷 射雕 青冢 北 走马 黑 山西 戍 远 旌幡 少 年 深 帐幕 低 酬 恩 须 尽 敌 休 说 梦 中 闺
05bab583-1916-4f9d-aa6c-dac73dee60ca,孤桐,雍陶,唐,诗,五言律诗,疎桐余一干 风雨日萧条 岁晚琴材老 天寒桂叶凋 已悲根半死 复恐尾全焦 幸在龙门下 知音肯寂寥,"5,5,5,5,5,5,5,5",3a52668fb05b9ce317698495eac96f11,疎 桐 余 一 干 风雨 日 萧条 岁晚 琴材 老 天寒 桂叶 凋 已 悲根 半死 复恐 尾 全 焦 幸在 龙门 下 知音 肯 寂寥
1b2afcfa-9338-4f4f-b953-2c7a775654f9,秋露,雍陶,唐,诗,五言律诗,白露暧秋色 月明清漏中 痕沾珠箔重 点落玉盘空 竹动时惊鸟 莎寒暗滴虫 满园生永夜 渐欲与霜同,"5,5,5,5,5,5,5,5",8f4347f205c5c0922dc323bd9910e4a1,白露 暧 秋色 月 明清 漏 中 痕 沾 珠箔 重 点落 玉盘 空 竹动 时 惊鸟 莎寒 暗 滴虫 满园 生永夜 渐 欲 与 霜 同
e9c4d4bc-c37f-43ac-8d77-3bd2b6ecb9cc,送徐使君赴岳州,雍陶,唐,诗,五言律诗,渺渺楚江上 风旗摇去舟 马归云梦晚 猨叫洞庭秋 别思满南渡 乡心生北楼 巴陵山水郡 应称谢公游,"5,5,5,5,5,5,5,5",4c0b3e72577c3e37c5ef40f8e66af563,渺渺 楚江 上 风旗摇去舟 马归 云梦 晚 猨 叫 洞庭 秋 别思满 南渡 乡心 生 北楼 巴陵 山水 郡 应 称谢 公游
d4553423-a81d-42e4-815c-3b5a43cc02b4,送裴璋还蜀因亦怀归,雍陶,唐,诗,五言律诗,客在劒门外 新年音信稀 自为千里别 已送几人归 陌上月初落 马前花正飞 离言殊未尽 春雨满行衣,"5,5,5,5,5,5,5,5",be24eb65bdcbcea0f5b5d3f292e11ebb,客 在 劒 门外 新年 音信 稀 自 为 千里 别 已 送 几 人 归 陌上 月初 落 马 前 花正飞 离言殊 未尽 春雨 满行 衣
7e089b32-773a-45a3-ab40-662a8693087b,送前鄠县李少府,雍陶,唐,诗,五言律诗,近出圭峰下 还期又不赊 身闲多宿寺 官满未移家 罢钓临秋水 开尊对月华 自当蓬阁选 岂得卧烟霞,"5,5,5,5,5,5,5,5",a856a567492ced26952ac07da36f62c9,近 出 圭峰 下 还期 又 不 赊 身闲多 宿寺 官 满未 移 家 罢 钓临 秋水 开尊 对 月华 自当 蓬阁 选 岂 得 卧 烟霞
f8573c60-f0b3-42b8-ab1d-f360c6b5f005,送宜春裴明府之任,雍陶,唐,诗,五言律诗,南行春已满 路半水茫然 楚望花当渡 湘阴橘满川 山横湖色上 帆出鸟行前 此任无辞远 亲人贵用还,"5,5,5,5,5,5,5,5",3af2202bdb8ada1e2c8d253f47716cbe,南行 春 已 满 路半水 茫然 楚望花 当渡 湘阴 橘满川 山横 湖色 上 帆 出 鸟 行前 此 任 无辞远 亲人 贵用 还
e2112e9f-7bdd-463b-9509-10deee22b235,赠宗静上人,雍陶,唐,诗,五言律诗,世上方传教 山中未得归 闲花飘讲席 驯鸽污禅衣 积雨谁过寺 残钟自掩扉 寒来垂顶帽 白发剃应稀,"5,5,5,5,5,5,5,5",8fdae5eed2e20543db75f842602d0077,世上 方 传教 山中 未 得 归 闲花 飘 讲席 驯鸽 污禅 衣 积雨 谁 过寺 残钟 自 掩扉 寒来 垂顶 帽 白发 剃应 稀
4dea4bdd-ba6f-4636-bfd7-08b28aee5412,同贾岛宿无可上人院,雍陶,唐,诗,五言律诗,何处销愁宿 携囊就远僧 中宵吟有雪 空屋语无灯 静境唯闻铎 寒床但枕肱 还因爱闲客 始得见南能,"5,5,5,5,5,5,5,5",36a9997ea9cc3b63540593ba24583579,何处 销愁宿 携 囊 就 远 僧 中宵 吟有 雪 空屋 语无灯 静境 唯闻 铎 寒床 但 枕肱 还 因 爱闲 客 始得 见 南 能
5d1de8d4-9452-4b6a-a1df-0e0012a2297a,和刘补阙秋园寓兴六首 一,雍陶,唐,诗,五言律诗,水木夕阴冷 池塘秋意多 庭风吹故叶 阶露净寒莎 愁燕窥灯语 情人见月过 砧声听已别 虫响复相和,"5,5,5,5,5,5,5,5",23e391248e3d1428466c9271f4b8a926,水木 夕 阴冷 池塘 秋意 多 庭 风吹 故叶 阶露 净寒 莎 愁 燕 窥 灯语 情人 见 月 过 砧声 听 已别 虫响 复相 和
87dc5771-82a5-4eb8-b1c0-6852e81c74e5,和刘补阙秋园寓兴六首 二,雍陶,唐,诗,五言律诗,闭门无事后 此地即山中 但觉鸟声异 不知人境同 晚花开为雨 残果落因风 独坐还吟酌 诗成酒已空,"5,5,5,5,5,5,5,5",188dee283e6c59d99952ebf7aa228577,闭门 无 事后 此地 即 山中 但 觉 鸟声 异 不知 人境 同 晚花 开为 雨 残果 落 因 风 独坐 还 吟酌 诗 成酒 已 空
5afec976-2eda-4c13-aaf8-9fed63e551be,和刘补阙秋园寓兴六首 三,雍陶,唐,诗,五言律诗,自得家林趣 常时在外稀 对僧餐野食 迎客著山衣 雀鬬翻簷散 蝉惊出树飞 功成他日后 何必五湖归,"5,5,5,5,5,5,5,5",192256bd382a0d6b81b823482dd5730a,自得 家 林趣 常时 在外 稀 对 僧餐 野食 迎客 著山 衣 雀 鬬 翻 簷 散 蝉 惊出 树 飞 功 成 他 日后 何必 五湖 归
d55ea231-d593-469f-a326-ca790f1e2385,和刘补阙秋园寓兴六首 四,雍陶,唐,诗,五言律诗,秋色庭芜上 清朝见露华 疎篁抽晚笋 幽药吐寒芽 引水新渠净 登台小径斜 人来多爱此 萧爽似仙家,"5,5,5,5,5,5,5,5",5595c49153cede996b079b67e725f7c6,秋色 庭芜 上 清朝 见露 华 疎 篁 抽 晚 笋 幽药 吐 寒芽 引水 新渠 净 登台 小径 斜 人 来 多 爱 此 萧爽 似 仙家
1bba2324-7492-4b19-b2ee-23b39efba0d7,和刘补阙秋园寓兴六首 五,雍陶,唐,诗,五言律诗,禁掖朝回后 林园胜赏时 野人来辨药 庭鹤往看棋 晚日明丹枣 朝霜润紫棃 还因重风景 犹自有秋诗,"5,5,5,5,5,5,5,5",8a4de8dbd73354e356ed4a86befe8623,禁掖 朝 回 后 林园 胜赏 时 野人 来 辨 药 庭鹤 往 看棋 晚日 明丹 枣 朝 霜润 紫 棃 还 因 重 风景 犹 自有 秋诗
64c5aa73-dfc1-4fa1-af9a-e6b0f2fefb1d,和刘补阙秋园寓兴六首 六,雍陶,唐,诗,五言律诗,圣代少封事 闲居方屏喧 漏寒云外阙 木落月中园 山鸟宿簷树 水萤流洞门 无人见清景 林下自开尊,"5,5,5,5,5,5,5,5",39074714010ad3b61576c1b4f65ba241,圣代 少封 事 闲居 方屏 喧 漏寒云外 阙 木落 月 中园 山鸟 宿簷 树 水 萤流 洞门 无人 见 清景 林下 自开 尊
4b11a699-03ff-45a1-99ed-a316198e32bb,岳阳晚景,雍陶,唐,诗,五言律诗,汉阳无远寺 见说过汾城 云雨经春客 江山几日程 终随鸥鸟去 祗在海潮生 前路逢渔父 多愁问姓名,"5,5,5,5,5,5,5,5",a3bc73c5893fa171952be1d25ba7a6cb,汉阳 无 远 寺 见 说 过 汾城 云雨 经春客 江山 几 日程 终随 鸥鸟 去 祗 在 海潮 生 前路 逢 渔父 多愁 问 姓名
06bef238-e5cb-4567-9189-181f7a5e69eb,塞上宿野寺,雍陶,唐,诗,五言律诗,塞上蕃僧老 天寒疾上关 远烟平似水 高树暗如山 去马朝常急 行人夜始闲 更深听刁斗 时到磬声间,"5,5,5,5,5,5,5,5",4949b7b226692e3da4ddbc5cce780e50,塞上 蕃僧 老 天寒 疾上 关 远 烟 平似 水 高树 暗如 山 去 马 朝 常急 行人 夜始闲 更深 听 刁斗 时 到 磬 声间
5adaa05a-f57b-4138-b9bf-028e672bac51,寒食夜池上对月怀友,雍陶,唐,诗,五言律诗,人间多别离 处处是相思 海内无烟夜 天涯有月时 跳鱼翻荇叶 惊鹊出花枝 亲友皆千里 三更独遶池,"5,5,5,5,5,5,5,5",f2ba227e4c4c534a9c2b232ecfe6b329,人间 多 别离 处处 是 相思 海内 无烟 夜 天涯 有 月 时 跳 鱼 翻 荇 叶 惊鹊出 花枝 亲友 皆 千里 三 更 独 遶 池
a1539263-1eb6-45df-8982-60a437696a1f,自述,雍陶,唐,诗,五言律诗,万事谁能问 一名犹未知 贫当多累日 闲过少年时 灯下和愁睡 花前带酒悲 无谋常委命 转觉命堪疑,"5,5,5,5,5,5,5,5",af7cc0172155b7e757761dd143ccd4a1,万事 谁 能 问 一名 犹 未知 贫当 多 累 日 闲过 少年 时 灯下 和 愁 睡 花前 带酒 悲 无谋 常委 命 转 觉命 堪疑
8412179c-bd1d-48e3-aade-f826edcbffaa,送契玄上人南游,雍陶,唐,诗,五言律诗,红叶落湘川 枫明映水天 寻钟过楚寺 拥锡上泷船 病客思留药 迷人待说禅 南中多古迹 应访虎溪泉,"5,5,5,5,5,5,5,5",510797b13716fec365b0b86cf64ddac1,红叶 落 湘川 枫 明映 水天 寻钟 过 楚寺 拥 锡 上 泷 船 病客 思留 药 迷人 待 说 禅 南中 多 古迹 应访 虎溪泉
808146d5-a8f9-46d0-884d-cde93df5ae4f,少年行,雍陶,唐,诗,七言律诗,不倚军功有侠名 可怜毬猎少年情 戴铃健鹘随声下 撼珮骄骢弄影行 觅匠重装燕客劒 对人新按越姬筝 岂知儒者心偏苦 吟向秋风白发生,"7,7,7,7,7,7,7,7",2dfcb1bb464decc3abb3a1eb87e18fd9,不 倚 军功 有 侠名 可怜 毬 猎 少年 情 戴铃健 鹘 随声 下 撼珮骄 骢 弄 影 行 觅 匠 重装 燕 客 劒 对 人 新 按 越姬筝 岂知 儒者 心 偏 苦 吟向 秋风 白 发生
93b34abe-9243-43b6-8505-2ad7af3ef323,咏双白鹭,雍陶,唐,诗,七言律诗,双鹭应怜水满池 风飘不动顶丝垂 立当青草人先见 行傍白莲鱼未知 一足独拳寒雨里 数声相叫早秋时 林塘得尔须增价 况与诗家物色宜,"7,7,7,7,7,7,7,7",e72df0bf79cd0d27b6654ddb76faaebe,双鹭 应怜 水 满池 风飘不动顶丝垂 立当 青草 人 先见 行 傍 白莲 鱼 未知 一足独拳寒雨 里 数声 相叫 早秋 时 林塘得尔 须 增价 况 与 诗家 物色 宜
