id,title,author,dynasty,genre,poem_type,sentences_simplified,meter_pattern,hash,words
8e1999b7-e273-4e25-8257-02aa5152fa05,襄阳行,鲍𫐐,宋,诗,七言古体,今日何日春气柔 东城骑马花绸缪 为君停马一呼酒 花前倒披紫绮裘 玉脂泛滥鱼鸟饫 歌舞倦矣蛾眉愁 千金万寿好宾主 今我不乐岁如流 岂比世上狂驰子 一语不合行掉头 呜呼天伦古所定 非有大故宁相尤,"7,7,7,7,7,7,7,7,7,7,7,7",b4498fb7abc7c5ff1665391c75cdda01,今日 何日 春气 柔 东城 骑马 花 绸缪 为 君 停马 一 呼酒 花前 倒 披 紫 绮裘 玉脂 泛滥 鱼 鸟 饫 歌舞 倦 矣 蛾眉 愁 千金 万寿 好 宾主 今 我 不 乐 岁 如 流 岂 比 世上 狂 驰 子 一语不合 行 掉头 呜呼 天伦 古 所定 非有 大故 宁相 尤
b539cc7e-f9f7-4939-8b5b-d0b2b059dcae,天马,鲍𫐐,宋,诗,五言古体,天马抱奇相 紧骨瞳方明 出入百万中 有如一鸟轻 宇宙莽超踏 风云惨经营 独倚雄杰态 萧萧随北征 朝饮南海头 夕秣乃幽并 失主坐黯淡 别群奋长鸣 岂无轻侠儿 金羁悬朱缨 但感束帛义 不忍负死生 低头为君老 喑喑万里情,"5,5,5,5,5,5,5,5,5,5,5,5,5,5,5,5,5,5",f84aeb83bdae6e62e42de344e7333e8a,天马 抱奇 相 紧 骨 瞳 方明 出入 百万 中 有如 一 鸟 轻 宇宙 莽 超踏 风云 惨 经营 独倚 雄杰 态 萧萧 随 北征 朝 饮 南海 头 夕 秣 乃 幽 并 失主 坐 黯淡 别群奋 长鸣 岂 无轻 侠儿 金羁悬 朱缨 但 感束 帛义 不忍 负死 生 低头 为 君 老 喑 喑 万里 情
e6fc1b01-51c5-498c-8c92-ebda18285f43,重到钱唐  其一,鲍𫐐,宋,诗,七言绝句,生死双飞正可怜 若为白髪上征船 未应分手江南去 更有春光七十年,"7,7,7,7",8b69f4d11bcddd58e8771daa975a7646,生死 双飞 正 可怜 若为 白 髪 上 征 船 未 应 分手 江南 去 更 有 春光 七十年
aac46538-2bae-4e4c-a71a-ee2ab7c6f6fb,重到钱唐  其二,鲍𫐐,宋,诗,七言绝句,无頼山光叠叠青 玉鱼金盌早飘零 冷思禹穴真奇事 千古衣冠托杳冥,"7,7,7,7",ace27b84ff6b56e96a157987bb644255,无 頼 山 光 叠叠 青 玉鱼 金 盌 早 飘零 冷思禹 穴 真 奇事 千古 衣冠 托杳冥
88706bd9-5ab6-49d0-acae-3bf613d36efd,重到钱唐  其三,鲍𫐐,宋,诗,七言绝句,万家歌舞送浮生 曾有涓埃答太平 猨鹤虫沙天始定 不须辛苦怨南征,"7,7,7,7",9d365927ab6e3ad7394ea2dde455b836,万家 歌舞 送 浮生 曾 有 涓埃 答 太平 猨 鹤 虫 沙 天 始定 不须 辛苦 怨 南征
89c9f7ee-62cf-4392-a9b7-7bba719f0b7d,重到钱唐  其四,鲍𫐐,宋,诗,七言绝句,闻道深春雪打围 谁怜身上藕丝衣 莫忧白璧成尘土 解逐南风万里归,"7,7,7,7",a7eba15b4736f0a5980e42ec624838b8,闻道深 春雪 打围 谁 怜 身上 藕丝 衣 莫忧白璧成 尘土 解逐 南风 万里 归
daa9c48e-e9c6-43d4-b0bf-7b60c59ad6c8,重到钱唐  其五,鲍𫐐,宋,诗,七言绝句,惟有寒潮不世情 朝朝莫莫过空城 百年车马阊门外 独被春风草又生,"7,7,7,7",707f58c2f154c6b5fc4b8b48cf537bdd,惟有 寒潮 不 世情 朝朝 莫 莫 过 空城 百年 车马 阊 门外 独 被 春风 草 又 生
12b6f959-ef54-478d-8e81-327a5fa07f4b,九龄行,曾澈,宋,诗,七言古体,我生九龄气食牛 喑呜顿挫无匹俦 白云无根起天末 一身万事同悠悠 低头拱手事先觉 谈笑未了成仇雠 一誉不足胜百毁 言语起灭如浮沤 圣贤可与知者道 麟凤岂在山中游 蘧然梦觉大槐国 江花昨夜生凉秋,"7,7,7,7,7,7,7,7,7,7,7,7",ac64823c8d6d07f32eac234311a8e72c,我 生九龄 气食 牛 喑 呜 顿挫 无匹 俦 白云 无根起天末 一身 万事 同 悠悠 低头 拱手 事先 觉 谈笑 未了 成仇 雠 一誉 不足 胜 百 毁 言语 起灭 如 浮 沤 圣贤 可 与 知者 道 麟 凤 岂 在 山 中游 蘧 然 梦觉 大槐国 江花 昨夜 生凉秋
5ca2962d-b55f-4720-adc4-8f5bdce988b8,甘泉洞,赵泽祖,宋,诗,七言律诗,银河泻落万山巅 玉界遥驰一道泉 夜浴丹沙浮暖气 晓凝寒碧沁晴烟 灵泉透海流香细 雪液澄虚抱影圆 三咽只因凡骨换 坐临盘石看飞钱,"7,7,7,7,7,7,7,7",9aecf2368387b6ad3a900b11c4f408fc,银河 泻 落 万 山巅 玉界 遥驰 一道 泉 夜浴丹沙 浮 暖气 晓 凝寒 碧沁晴 烟 灵泉 透 海流 香细 雪液 澄虚 抱影 圆 三 咽 只 因 凡 骨换 坐临 盘石 看 飞 钱
fd28c2c3-0a3a-444d-a9f9-d201b3c8df77,署中书怀,赵泽祖,宋,诗,七言绝句,庭下幽花照眼醒 绿阴成幄晚风清 何时抛掷铜章去 小艇烟波弄月明,"7,7,7,7",7bd970b555fbeb29b0f79dcf446fd22f,庭下 幽花 照眼 醒 绿阴 成幄 晚风 清 何时 抛掷 铜章 去 小艇 烟波 弄 月 明
7c517e94-7e07-4b42-b38a-633b393f3a0d,春晚三客同出郊归途甚醉,潘献可,宋,诗,五言律诗,寻友逢三益 追欢且一时 买鱼呼野艇 沽酒认村旗 暂觉行歌乐 何妨醉舞僛 牧儿休骇愕 横笛且须吹,"5,5,5,5,5,5,5,5",aa957812d60a0f53e5206d44bd730fa2,寻友逢 三益 追欢 且 一时 买 鱼 呼 野艇 沽酒 认村 旗 暂 觉行 歌乐 何妨 醉舞 僛 牧儿 休 骇愕 横笛 且 须 吹
aa7a3f14-bbc3-4746-8ee4-fa5f18aaeb0d,四月十八日之桐川,潘献可,宋,诗,五言律诗,白鸟苍烟外 黄鹂绿树间 雨晴初有路 云薄不藏山 村酒成孤酌 征鞍厌独攀 日长人自倦 更觉马蹄悭,"5,5,5,5,5,5,5,5",611c30cb7ba39c97eb80d92bab6b5dfd,白鸟 苍烟 外 黄鹂 绿树 间 雨晴初 有 路 云薄 不藏 山 村酒 成 孤酌 征 鞍厌独攀 日 长人 自倦 更觉 马蹄 悭
212615b1-8b17-40c1-9df0-a1c7ced2dac5,固城怀归,潘献可,宋,诗,五言律诗,税驾蚕将老 旋车燕欲归 人情秋思薄 酒力晚风微 青鬓愁边改 丹心老去违 吾庐元不远 望断白云飞,"5,5,5,5,5,5,5,5",eb36fe124ae58df4cf4c8093bae4ae61,税 驾 蚕 将 老 旋车 燕 欲 归 人情 秋思 薄 酒力 晚风 微 青鬓 愁 边 改 丹心 老 去 违 吾 庐 元 不远 望断白云 飞
d2765363-426b-45b1-ab28-1fabd856f8b2,山楼枕上,潘献可,宋,诗,五言律诗,山近寒偏早 愁多睡不浓 鸦啼半夜月 鹤唳五更风 晓接残灯里 吟成落叶中 尘埃今已厌 懒听上方钟,"5,5,5,5,5,5,5,5",d4493bbb65c19d0edf819d828ba8b1af,山近寒 偏早 愁 多 睡 不 浓 鸦啼 半夜 月 鹤唳 五更 风 晓接 残灯 里 吟成 落叶 中 尘埃 今 已 厌 懒 听 上方 钟
7115f62d-4f3c-4725-8f88-fd67aa5dafc8,宁川道中,潘献可,宋,诗,五言律诗,十日为山客 今朝问水程 沙横疑港断 滩迅觉舟轻 远近村舂合 高低渔火明 回头忽苍莽 一望一伤情,"5,5,5,5,5,5,5,5",019de56ca59388dad1962196949bac89,十日 为 山客 今朝 问 水程 沙横 疑 港 断 滩 迅觉 舟 轻 远近 村 舂 合 高低 渔火 明 回头 忽 苍莽 一 望 一 伤情
be59196b-092f-4e24-8dae-dfd68b12dc20,端居,潘献可,宋,诗,五言律诗,竹院秋逾静 柴门昼不开 病先携老去 懒渐逐衰来 莫遣新缘结 都将旧念灰 川鱼与云鸟 从此莫惊猜,"5,5,5,5,5,5,5,5",c7bfc3589a428c9dcd2da606be9b5963,竹院 秋逾静 柴门 昼不开 病 先 携 老 去 懒 渐 逐 衰来 莫遣 新缘 结 都 将 旧 念灰 川 鱼 与 云 鸟 从此 莫惊 猜
534a207e-6f2e-471c-ad50-8bf1d7fc3b04,初至庄舍,潘献可,宋,诗,五言律诗,鹭立汀沙晚 牛眠径草深 黄花浮荇带 红叶下枫林 客路溪中断 柴门水半侵 一廛收岁晚 聊复此幽寻,"5,5,5,5,5,5,5,5",f0e132c634452ab5d50595cd049d36e7,鹭立汀沙 晚 牛 眠 径 草 深 黄花 浮 荇 带 红叶 下 枫林 客路 溪 中断 柴门 水 半 侵 一廛 收 岁晚 聊复 此 幽 寻
1259afcd-5354-4dd0-947f-26a4c1aaac94,寓舍偶题,潘献可,宋,诗,五言律诗,习嬾身无用 幽偏性所欣 校书随马队 临帖爱鹅群 公子悲春草 佳人隔暮云 北山归计决 未信有移文,"5,5,5,5,5,5,5,5",1ab0f6ee178f3b375f574dfbbe4aeea9,习 嬾 身 无用 幽 偏性 所 欣 校书 随 马队 临帖 爱 鹅群 公子 悲 春草 佳人 隔 暮云 北山 归计 决 未信 有移 文
50e58f82-3d99-4476-b6a4-3dd48b5e51eb,游妙行寺,俞本,宋,诗,五言律诗,中峰苍翠里 微径入禅关 石座香尘积 莲池苔藓班 鹤盘云在树 龙过雨侵山 会得规中意 怡然一解颜,"5,5,5,5,5,5,5,5",7d44979500c75eb962fe983554b29b55,中峰 苍翠 里 微径 入 禅 关 石座 香 尘积 莲池 苔藓 班 鹤盘云 在 树 龙过雨 侵 山 会 得 规 中意 怡然 一解颜
0b70a329-c6c2-49ee-af4f-beb1846bf25b,笠泽亭,刘嘉谟,宋,诗,五言绝句,荷笠扁舟上 持纶巨泽中 无劳问名字 便是此亭公,"5,5,5,5",a4da202cbd4a0483126cb764187fdf54,荷笠 扁舟 上 持纶 巨泽 中 无劳问 名字 便是 此 亭 公
8528b309-8073-4c85-abae-55ac08513179,北津口水阁,刘嘉谟,宋,诗,五言绝句,沉沉卧虹底 小阁贴平湖 鱼戏几堪掬 鸥驯欲就呼,"5,5,5,5",da76a9da527a269327add7cc41141afb,沉沉 卧虹 底 小阁 贴 平湖 鱼戏 几堪掬 鸥 驯欲 就 呼
ba494a29-046a-441e-9912-d932274db7f2,大明桥,刘嘉谟,宋,诗,五言绝句,东望扶桑路 迢迢几万程 沧浪将尽处 忽见大明生,"5,5,5,5",c245ae9c2c016ea9f03b5f39c816a026,东望 扶桑 路 迢迢 几万 程 沧浪 将 尽处 忽 见 大明 生
8dce37ac-8c3f-49e1-965c-6f17cafad2e7,万顷桥,刘嘉谟,宋,诗,五言绝句,巨浸莽无极 聊为万顷看 世无黄叔度 君试倚阑干,"5,5,5,5",195f3834a27e24642a238f4351096095,巨浸莽 无极 聊为 万顷 看 世 无黄 叔度 君 试 倚 阑干
1a8322c5-4bd3-4fd1-9bd7-f2d74822b535,定海桥,刘嘉谟,宋,诗,五言绝句,昔日松江上 潮翻定海来 而今旧桥水 不到半江回,"5,5,5,5",8e908fc8b7b692db945a0fcfe0151e37,昔日 松江 上 潮 翻 定海 来 而今 旧桥 水 不到 半江 回
b7bc356d-bd61-4952-bf49-4eaa83d7af7e,顾公祠,刘嘉谟,宋,诗,五言绝句,博洽倾当世 江东孔子儒 荒墟访遗庙 老稚辄名呼,"5,5,5,5",5f66785f3bb65ea63ac82ef4823832e5,博洽 倾当 世 江东 孔子 儒 荒墟 访 遗庙 老稚 辄 名 呼
720e98e3-5f79-43a7-a37d-dee9bd7e5749,栎园,吴龙起,宋,诗,五言律诗,栎园依古寺 景物久凄凉 荆棘无人翦 亭台逐处荒 数禽栖曲沼 独犬吠空堂 惆怅梅花发 凭谁管暗香,"5,5,5,5,5,5,5,5",aefd2cbd11ae1f630a6d72df1790f555,栎 园 依 古寺 景物 久 凄凉 荆棘 无人 翦 亭台 逐处 荒 数禽 栖曲 沼 独 犬吠 空堂 惆怅 梅花 发 凭 谁 管 暗香
2dcdf230-10bf-41e3-a8d3-1920006cec51,秋兴,吴龙起,宋,诗,七言绝句,定是凭高易得愁 客怀牢落怕登楼 不知昨夜梧桐雨 添得阑干几许秋,"7,7,7,7",21803cbb2b98632ff455e473d3dddf83,定是 凭 高 易得 愁 客 怀牢 落怕 登楼 不知 昨夜 梧桐雨 添 得 阑干 几许 秋
710899b6-d15f-4fe4-bba0-82621c1e3f59,玉马山,朱克家,宋,诗,七言古体,水石嵌空山荦确 瘦藤扶上青云幕 平川一望渺无际 东疑嵎夷北朔漠 驾天叠𪩘输翠浪 奔野细流横雪槊 疏峰点点雁聚沙 密屿喁喁鱼纵壑 一江净绿遶书元 几陇断畦成卦剥 乍惊渔唱出烟霭 时听村舂动篱落 幽遐异景争指说 老眼苦难觅渺邈 夜间支枕挂银窗 闪闪星河手可摸 何年标名称玉马 蹴踏风云跨寥廓 更连三十六奇峰 削玉排青相间错 偶因佳友得壮观 俗虑尘襟顿疏瀹 翛然物外岂非仙 不须更羡辽东鹤,"7,7,7,7,7,7,7,7,7,7,7,7,7,7,7,7,7,7,7,7,7,7,7,7",c0ec948b70a45a4d4e387aeef4878440,水石 嵌 空山 荦 确 瘦 藤 扶 上 青云 幕 平川 一望渺 无际 东 疑 嵎 夷 北 朔漠 驾天叠 𪩘 输翠 浪 奔野 细流 横 雪 槊 疏峰 点点 雁聚沙 密 屿 喁 喁 鱼 纵 壑 一 江 净 绿 遶 书 元 几 陇 断 畦 成卦 剥 乍 惊 渔唱 出 烟霭 时 听 村 舂 动 篱落 幽 遐 异 景争 指说 老 眼 苦难 觅 渺 邈 夜间 支枕 挂 银窗 闪闪 星河 手 可摸 何年 标 名称 玉马 蹴 踏 风云 跨 寥廓 更连 三十六 奇峰 削 玉 排 青 相间 错 偶因 佳友 得 壮观 俗虑 尘襟 顿 疏 瀹 翛 然 物 外 岂非 仙 不须 更 羡 辽东 鹤
93d79450-1571-4e07-9a61-fce88a182a65,掬水月在手,朱少游,宋,诗,七言绝句,十指纤纤弄碧波 分明掌上见姮娥 不知李白当年醉 曾向江边捉得么,"7,7,7,7",188f15e9dc09b882ff00f50252da974a,十指 纤纤 弄 碧波 分明 掌上 见 姮娥 不知 李白 当年 醉 曾 向 江边 捉得么
3ecf2f56-8898-4340-85c2-8f61c15de7bd,芭蕉,朱少游,宋,诗,七言绝句,剪得西园一片青 故将来此恼诗情 怪来昨夜窗前雨 减却潇潇数点声,"7,7,7,7",013b5b0f2c87f5ac453e2bc84b9b456d,剪 得 西园 一片 青 故 将来 此 恼 诗情 怪 来 昨夜 窗前 雨 减却 潇潇 数点 声
cfc46c9f-a2b4-496b-8afe-233ce448b3f9,寓钱塘得乡人消息,张眇,宋,诗,七言律诗,西子湖边放鹤仙 几回同醉木兰船 相思东路一千里 忆别西风十四年 远信有时凭雁寄 新诗近日頼僧传 不须更问垂纶叟 已有霜痕到鬓边,"7,7,7,7,7,7,7,7",34c4f0d5f21c460ef2864d6d928196c5,西子湖 边 放 鹤 仙 几回 同醉 木兰 船 相思 东路 一千里 忆 别 西风 十四年 远 信 有时 凭 雁寄 新诗 近日 頼 僧 传 不须 更 问 垂 纶 叟 已有 霜痕 到 鬓边
5cdc59d3-3dc8-4cfb-ad00-454e160e1166,陪秋山相公游大涤洞天一庵夜宿感梦,郑斗焕,宋,诗,七言律诗,天柱清游尾使星 笋舆轧轧入山深 龙行雨去泉花定 鹤叫云来木叶阴 松石已安通夕寐 江湖空老百年心 圆冠方袂何仙子 梦里将诗索共吟,"7,7,7,7,7,7,7,7",0670ececcfe369ff1792e621545e7895,天柱 清游 尾 使 星 笋 舆 轧轧 入山 深 龙行雨 去 泉 花定 鹤 叫 云 来 木叶 阴 松石 已 安通 夕 寐 江湖 空 老 百年 心 圆冠 方袂 何 仙子 梦 里 将 诗索 共吟
2933e2f7-6238-4d38-904a-fb2855a1d4a5,题庐陵义士传,郭彦章,宋,诗,七言绝句,淮海风回吹血腥 青原不改旧时青 中朝将帅论功赏 不及江南一白丁,"7,7,7,7",5d45c12ba63ffef0ac86eb4e5cf0260e,淮海 风 回吹 血腥 青原 不 改 旧时 青 中 朝 将帅 论功 赏 不及 江南 一 白丁
1cbd1d86-1f09-4d40-8c7a-aeb850546ffc,题新淦刘贞女传,郭彦章,宋,诗,七言绝句,百年节义仗英豪 一死翻怜女子高 不敢高歌题卷上 转喉恐触旧官曹,"7,7,7,7",7a101605b75a1d8396bc8322370df7e9,百年 节义 仗 英豪 一 死 翻怜 女子 高 不敢 高歌 题 卷上 转喉 恐 触 旧 官 曹
d4695880-b80b-49ff-abf5-1513d629c16d,咏史,杨再十一君,宋,诗,五言古体,张良大父父 相韩五世君 报仇误一击 佐命筹三军 灭秦复诛项 兴汉称元勋 始终心为韩 义烈千载闻 吾家世臣宋 绂冕兴如云 于今虽为庶 义不忘宋恩 国亡幸免死 忍复干禄云 耻为肤敏士 宁作殷顽民,"5,5,5,5,5,5,5,5,5,5,5,5,5,5,5,5",ea4ea45dc265390e0dc2fd5f90d139fe,张良 大 父父 相韩 五世 君 报仇 误一击 佐 命 筹 三军 灭 秦 复诛 项 兴汉 称 元勋 始终 心 为 韩 义烈 千载 闻 吾 家世 臣 宋 绂 冕 兴 如云 于今 虽为 庶 义 不 忘 宋恩 国亡 幸免 死 忍复 干禄 云 耻为 肤敏士 宁作殷 顽民
8c615f15-473a-40b3-a390-5da11b9e11a4,书感  其一,杨再十一君,宋,诗,七言绝句,枫江渡口草凄凄 桃浦桥边夕照低 惟有旧家双燕子 年年飞绕绿杨隄,"7,7,7,7",92b84fec34542f6df1883bb7695a02c5,枫江 渡口 草 凄凄 桃浦 桥边 夕照 低 惟有 旧家 双 燕子 年 年 飞绕 绿 杨 隄
8023b85d-15bc-4312-8e18-a86afdb1a403,书感  其二,杨再十一君,宋,诗,七言绝句,深湖两岸白云秋 芦荻花深隠钓舟 回首平原风浪急 却怜江海是安流,"7,7,7,7",74d7f7551aa190fe6f3d92e176e39bbe,深湖 两岸 白云 秋 芦荻 花 深 隠 钓 舟 回首 平原 风浪 急 却怜 江海 是 安流
eff3c63f-f5b5-4283-b849-29024757c080,书感  其三,杨再十一君,宋,诗,七言绝句,潦倒江南一布衣 家贫岁晚寸心违 不堪倚杖枫江路 手种青松大十围,"7,7,7,7",cef94e368de30228e8f5179a50367dd0,潦倒 江南 一 布衣 家贫 岁晚 寸心 违 不堪 倚 杖 枫 江 路 手种 青松 大十 围
7166d0d6-748c-410e-b67f-4bddae9618f2,夜坐,杨再十一君,宋,诗,七言绝句,竹窗吹雨夜潇潇 独拥寒𬬻叹寂寥 坐久不知更漏永 镫花零落篆香消,"7,7,7,7",719d10aed3663f277a9de58bbb3b8a82,竹窗 吹 雨夜 潇潇 独拥寒 𬬻 叹 寂寥 坐 久 不知 更漏 永 镫 花 零落 篆 香 消
fc85f1d2-20ec-4f11-90b5-ea5adef9ee65,华阳山堂落成,诸葛舜臣,宋,诗,七言律诗,小筑菟裘石磴间 登临极望意苍然 三更栗叶中峰雨 四月桃花一洞天 时听茅君归碧落 恍闻玉女炼丹铅 江湖万里尘埃远 留得深山一道泉,"7,7,7,7,7,7,7,7",5c6adfecdd2b24247a41d53eeaf3a381,小筑菟 裘石 磴 间 登临 极望 意 苍然 三 更 栗叶 中峰 雨 四月 桃花 一 洞天 时 听 茅君归 碧落 恍闻 玉女 炼丹 铅 江湖 万里 尘埃 远 留 得 深山 一道 泉
a9bbf345-6985-4f17-9e5e-e07d3c8a11f8,夜泛西湖,杨珂,宋,诗,七言绝句,明月欺人醉不知 夜深偷入读书帏 好将松户牢关锁 留此清光莫放归,"7,7,7,7",f49f52aecd1e7a41f5ca8a9653b38c2d,明月 欺人醉 不知 夜深 偷入 读书 帏 好 将 松 户 牢 关锁 留 此 清光 莫 放归
8ed8c9af-4e35-462d-ac6c-3aa2576956de,灵岩一线天,张清子,宋,诗,五言绝句,一画起于干 先天至后天 灵岩天一线 想在伏羲前,"5,5,5,5",127cc0e372974f4d32e95e7b80377309,一 画 起于 干 先天 至 后天 灵岩 天 一线 想 在 伏羲 前
c844ec0f-a10b-4d09-bab4-f1c17142cf7b,句,虞德观,宋,诗,七言古体,我因国破家何在 君为唇亡齿亦寒,"7,7",02dbc9ec86bc70af1b2f5b0c0fd866f6,我 因 国破家 何在 君 为 唇 亡 齿 亦 寒
da401873-39ec-4257-bf80-10afb2f5ce1b,落笔峝,倭倭才,宋,诗,七言律诗,峭壁凌空望渺微 层层烟锁雾云衣 深山古木高千丈 怪石青苔绕四围 空有石衔仙骨在 想应人逐彩鸾飞 洞中仙子今何往 欲上雕鞍不忍归,"7,7,7,7,7,7,7,7",63e94a75bd62db6a78914d0d79f0495d,峭壁 凌空 望 渺微 层层 烟锁雾 云衣 深山 古木高 千丈 怪石 青苔 绕 四围 空 有 石衔仙 骨 在 想 应人逐彩鸾飞 洞 中 仙子 今 何往 欲 上 雕鞍 不忍 归
eee3eaa6-f0e1-4674-8ebb-8666e4f3305c,读祖宗伯公临难遗弟诗有感,罗荣祖,宋,诗,七言律诗,豫章风节振荆湘 匪为殷亡为晋亡 执手痛罹鸣鹡难 焚裘梦断树藼乡 三诗聊寄忠臣愤 九死宁回国士肠 一展遗编一兴慨 令人千载挹辉光,"7,7,7,7,7,7,7,7",01bc749387ff05f0bbdc3b4621e0fd82,豫章 风节 振 荆湘 匪 为 殷 亡 为 晋亡 执手 痛 罹鸣 鹡 难 焚 裘 梦 断 树 藼 乡 三 诗 聊 寄 忠臣 愤 九 死 宁 回国 士肠 一展 遗编 一兴慨 令人 千载 挹 辉光
368a0d19-9745-42c3-87e5-d25c51f3176c,登齐云和祖天锡公韵,罗荣祖,宋,诗,七言律诗,名山今日始攀跻 峭壁巉崖路欲迷 荆棘拨开登月窟 脚根稳著步天梯 恍疑身在半空去 忽见鸟从平地飞 胜景可人观不徧 挥毫石上且留题,"7,7,7,7,7,7,7,7",fd43c6b9df2ccad5301cfe317ae92d5e,名山 今日 始 攀 跻 峭壁 巉 崖 路 欲 迷 荆棘 拨开 登月 窟 脚根 稳著 步 天梯 恍疑 身在 半空 去 忽 见 鸟 从 平地 飞 胜景 可 人观 不 徧 挥毫 石上 且 留题
dea30358-7793-4487-99e9-6823fd93cac3,题灵岩,罗荣祖,宋,诗,七言古体,巨鳌戴山凌空起 横绝碧云千万里 岚风飞净明彩霞 四宇八纮皆望里 雾障高悬五老峰 朵朵尖削成芙蓉 天柱南边五丁立 香炉凿出盘蛟龙 仙家七子烧丹处 瑶草琼花间琪树 洞门深锁苔自封 黄鹤飞来复飞去,"7,7,7,7,7,7,7,7,7,7,7,7",df00f21e4aa5645466d8ae30e38fe8b9,巨鳌 戴山 凌空 起 横绝 碧云 千万里 岚 风 飞净明 彩霞 四 宇八 纮 皆 望 里 雾障 高悬 五老峰 朵朵 尖削 成 芙蓉 天柱 南边 五丁 立 香炉 凿出 盘 蛟龙 仙家 七子 烧 丹 处 瑶草 琼花 间琪树 洞门 深 锁 苔 自封 黄鹤 飞来 复 飞去
f1844e1b-4ee9-4245-828d-5a3436ec15c7,咏陶,罗荣祖,宋,诗,五言古体,解体脱世纷 结志怀往义 织纬足充粮 种秫常供醉 素琴寄长谣 孤衿抗高视 国爵屏如膻 家贫甘若嗜 径荒早归来 园涉成佳致 依俗岂尚同 诡时非立异 遥遥五柳风 千载犹相喟,"5,5,5,5,5,5,5,5,5,5,5,5,5,5",293d3e248b48144117be1514a78b8021,解体 脱世纷 结志 怀往 义 织纬 足充 粮 种 秫常 供醉 素琴 寄长 谣 孤 衿 抗 高视 国爵屏 如 膻 家贫 甘若 嗜 径荒 早 归来 园 涉成 佳 致 依俗 岂 尚同 诡 时 非 立异 遥遥 五 柳 风 千载 犹相 喟
94c2851a-bd32-4b82-ad94-a13ed634293b,答招隠,罗荣祖,宋,诗,五言古体,荡荡唐尧德 乃有箕山臣 巍巍周武功 不乏采薇人 四皓自躭洛 两龚岂避新 并介实天性 离奇非世珍 君虽羞独割 余敢辱均茵 东臯足舒啸 南亩可充囷 弗罫圣人网 常期鸥鸟亲,"5,5,5,5,5,5,5,5,5,5,5,5,5,5",7ce7519ec2342c2ad3927f248d2caa47,荡荡 唐尧 德 乃 有 箕 山 臣 巍巍 周 武功 不乏 采薇 人 四 皓自 躭 洛 两 龚 岂 避新 并 介实 天性 离奇 非世 珍 君 虽 羞 独割 余 敢辱均茵 东 臯 足 舒 啸 南 亩 可 充 囷 弗 罫 圣人 网 常期 鸥鸟 亲
68c8717c-5745-4e66-bd89-e6bb02f1aa20,重沓岭,张爚,宋,诗,七言绝句,松间叠石步高低 啼鸟幽林听隔溪 七尺枯藤可扶老 青鞋香汗落花泥,"7,7,7,7",b409f8484070d7abfe76542dc34040bc,松间 叠石 步 高低 啼 鸟 幽林 听 隔溪 七尺 枯藤 可扶 老 青鞋 香汗 落花 泥
168030b8-f95a-4f90-99f0-ee0dee1fedb2,上赵主簿霁宇,张爚,宋,诗,五言律诗,辞棘鸾飞远 重来棹雪舟 政声清似水 官况冷于秋 谱系王侯贵 文章班马流 赈民问钱谷 名已在金瓯,"5,5,5,5,5,5,5,5",1aba433e27154458143a563dfa7a73e9,辞 棘 鸾 飞 远 重 来 棹 雪舟 政声 清似 水 官况 冷于 秋 谱系 王侯 贵 文章 班马流 赈民 问 钱谷 名 已 在 金瓯
ba1be7e5-4ad1-48c4-9963-54a98cfde35d,请赵季宪主玉虚道院,张爚,宋,诗,七言律诗,来自东山东复东 飞空一剑伴丝桐 能令矮屋疏篱下 如在十洲三岛中 炼句入神敲夜月 谈玄动客笑春风 闻师曾得长生诀 同采丹砂访葛翁,"7,7,7,7,7,7,7,7",1360e44eac02879ad509b5983465bc5a,来自 东 山东 复东 飞空 一剑 伴丝 桐 能令 矮屋 疏 篱下 如在 十洲 三岛 中 炼句 入神 敲 夜月 谈玄 动客 笑 春风 闻师 曾 得 长生 诀 同 采 丹砂 访葛翁
c4fa3d40-4e26-4dde-b4d8-d1ecc647add6,玉虚道院,朱鼎元,宋,诗,七言律诗,山东舍宅为琳宇 公子超然趣不群 帝足龟蛇交水火 将坛龙虎拥风云 花阶昼静迎仙客 月殿香清礼老君 何日投闲同采药 松边坐石许谁分,"7,7,7,7,7,7,7,7",284b0ea24601353c3681fc11e721e793,山东 舍宅 为琳 宇 公子 超然 趣 不 群 帝 足 龟 蛇 交 水火 将坛 龙虎 拥 风云 花阶昼 静迎 仙客 月 殿 香清礼 老君 何日 投闲 同 采药 松边 坐石 许 谁 分
1a6dc290-28dd-413b-ae80-afd81ce7a572,神仙名义,崔存,宋,诗,七言律诗,宿植灵根何太早 洞悟真风何年少 常令丹海飞日乌 又使玉液朝元脑 昆台气候四时春 紫府光阴夜如晓 来时不用五云车 跨著清风下蓬岛,"7,7,7,7,7,7,7,7",78292449dd5ee253a751f2d347dc7d79,宿植灵 根 何 太 早 洞悟 真风 何年 少 常令 丹海飞 日 乌 又 使 玉液 朝元 脑 昆台 气候 四时 春 紫府 光阴 夜如晓 来时 不用 五 云车 跨著 清风 下 蓬岛
59963cfc-4cc2-4fef-901e-0a68dec8af8a,为张莘畴题玉虚道院,崔存,宋,诗,七言律诗,小结烟霞作洞天 日长无事即神仙 栽松待化山中石 种秫因分屋外田 沧海十洲人不到 丹砂九转世空传 何如坐对黄连炷 一卷南华内外篇,"7,7,7,7,7,7,7,7",4af24af9172030c3f8b1e9dbcf788816,小结 烟霞 作 洞天 日 长 无 事 即 神仙 栽松 待化 山中 石 种 秫因 分 屋外 田 沧海 十洲 人 不到 丹砂 九 转世 空传 何如 坐 对 黄连 炷 一卷 南华 内外 篇
5ab8c21c-f5df-4f22-aa0e-a57862af794b,伤乱二首  其一,袁玧,宋,诗,七言律诗,龙蛇风浪起空潭 苍莽山河泣坠簪 乱向十年余史笔 贫无一字到诗函 心惊塞马过淮北 梦逐关鸿度岭南 肉食何人司重鼎 等闲挥麈事清谭,"7,7,7,7,7,7,7,7",613ecd7b560c5210926581a628793d6f,龙蛇 风浪 起 空 潭 苍莽 山河 泣 坠 簪 乱 向 十年 余史 笔 贫无一字到 诗函 心惊 塞马 过 淮北 梦 逐 关鸿度 岭南 肉食 何人 司重鼎 等闲 挥 麈 事 清 谭
7a86eb36-3cf2-43d8-846c-6aaf232ababe,伤乱二首  其二,袁玧,宋,诗,七言律诗,轰轰烈烈一乾坤 北马南船日夜奔 野老有怀悲故国 孤臣无泪哭中原 浮生似我仍留寓 季世何人不闭门 独惜两湖归隠后 枕戈谁是晋刘琨,"7,7,7,7,7,7,7,7",7f0be5e6de3e87fbdb5d5ac7105e3f55,轰轰烈烈 一 乾坤 北马南 船 日夜 奔 野老 有 怀 悲 故国 孤臣 无 泪 哭 中原 浮生 似 我 仍 留寓 季世 何人 不 闭门 独惜 两湖 归 隠 后 枕戈 谁 是 晋 刘琨
a9aa43d3-8542-4756-9e97-455cf7bbfb99,游白云山,袁瑨,宋,诗,五言古体,策杖白云岑 云深不知处 恍见云中君 白云乡里住 举手弄行云 招我登云路 漫漫云路长 愿乘黄鹤驭 黄鹤不复回 白云自来去,"5,5,5,5,5,5,5,5,5,5",5d6272c237825cc051735c26a0869489,策杖 白云 岑 云深 不知 处 恍见 云中君 白云 乡里 住 举手 弄 行云 招 我 登 云路 漫漫 云路 长 愿 乘 黄鹤 驭 黄鹤 不复 回 白云 自来 去
5142b37d-0cda-41f9-8182-ceb02dc67ed1,卜居,袁瑨,宋,诗,五言律诗,宦海茫茫阔 幽栖洵远图 折腰原为米 搔首却思鲈 笳鼓深秋动 田园旧梦无 干戈方满地 吾辈尚穷途,"5,5,5,5,5,5,5,5",bc414a5cccf688076db1d3e37669928b,宦海 茫茫 阔 幽 栖 洵 远图 折腰 原 为 米 搔首 却思鲈 笳 鼓 深秋 动 田园 旧梦 无 干戈 方 满地 吾辈 尚 穷途
