id,title,author,dynasty,genre,poem_type,sentences_simplified,meter_pattern,hash,words
ad6f1bc4-b02f-4058-8eea-0b8f551dcae0,送琼贞发述怀,张祜,唐,诗,五言律诗,送出南溪日 离情不忍看 渐遥犹顾首 帆去意难判 最恨临行夜 相期几百般 但能存岁节 终久得同欢,"5,5,5,5,5,5,5,5",e3b4bc75f72bed9d9d97d1e4df62011a,送 出 南溪 日 离情 不忍 看 渐 遥犹顾首 帆 去 意难 判 最 恨 临行 夜 相期 几 百般 但 能存 岁节 终久 得 同欢
d4ba62e4-f423-41db-aa27-d81167791722,寄灵澈上人,张祜,唐,诗,五言律诗,老僧何处寺 秋梦绕江滨 独树月中鹤 孤舟云外人 荣华长指幻 衰病久观身 应笑无成者 沧洲垂一轮,"5,5,5,5,5,5,5,5",1e1acdb9b48b238cdd4e43788997fa66,老僧 何处 寺 秋梦绕 江滨 独树 月 中 鹤 孤舟云 外人 荣华 长 指幻 衰病 久 观身 应笑 无成 者 沧洲 垂 一轮
5cc28d14-9742-45b7-bf7e-6a84e72ab1da,溪行寄京师故人道侣,张祜,唐,诗,五言律诗,白日长多事 清溪偶独寻 云归秋水阔 月出夜山深 坐想天涯去 行悲泽畔吟 东郊故人在 应笑未抽簪,"5,5,5,5,5,5,5,5",45388fff68487edff0a373d0bd038285,白日 长 多 事 清溪 偶独 寻 云归 秋水 阔 月 出 夜 山 深 坐想 天涯 去 行悲泽 畔 吟 东郊 故人 在 应笑 未 抽 簪
f3b76992-febb-40fb-8843-9fa3a00efe2f,赠僧云栖,张祜,唐,诗,五言律诗,麈尾与筇枝 几年离石坛 梵余林雪厚 棋罢岳钟残 开卷喜先悟 漱瓶知早寒 衡阳寺前鴈 今日到长安,"5,5,5,5,5,5,5,5",bbb2c94c8ccf83f13b6aaedaf4b049e5,麈 尾 与 筇 枝 几年 离石 坛 梵余林 雪厚 棋 罢 岳钟 残 开卷 喜先悟 漱 瓶 知 早 寒 衡阳 寺 前 鴈 今日 到 长安
8903eabd-bb69-4059-a61f-15184b624218,送魏尚书赴镇州行营,张祜,唐,诗,五言律诗,河塞日骎骎 恩讐报尽深 伍员忠是节 陆绩孝为心 坐激书生愤 行歌壮士吟 慙非燕地客 不得受黄金,"5,5,5,5,5,5,5,5",d2ac9b5baa620ac88acf248161405ba6,河塞 日 骎 骎 恩 讐 报 尽 深 伍员忠 是 节 陆绩 孝 为 心 坐激 书生 愤 行歌 壮士 吟 慙 非 燕 地 客 不得 受 黄金
8e8b5aab-e8bc-40f1-870a-077b448854a5,寄迁客,张祜,唐,诗,五言律诗,万里南迁客 辛勤岭路遥 溪行防水弩 野店避山魈 瘴海须求药 贪泉莫举瓢 但能坚志义 白日甚昭昭,"5,5,5,5,5,5,5,5",a551947a4349a5efd790fed85baf05c0,万里 南迁客 辛勤 岭 路遥 溪行 防水 弩 野店 避 山魈 瘴海 须 求 药 贪泉莫举瓢 但 能 坚志义 白日 甚 昭昭
cf6b43ab-bc18-4c23-9fdc-9bae67e6e126,题苏小小墓,张祜,唐,诗,五言律诗,漠漠穷尘地 萧萧古树林 脸浓花自发 眉恨柳长深 夜月人何待 春风鸟为吟 不知谁共穴 徒愿结同心,"5,5,5,5,5,5,5,5",a2dc336d43207d503b994e4c7ad49f68,漠漠 穷尘地 萧萧 古 树林 脸 浓花 自发 眉 恨 柳长深 夜月 人 何待 春风 鸟 为吟 不知 谁 共穴 徒愿 结 同心
09e0f9f0-c175-4baf-a440-ae73d419b8a7,江南作,张祜,唐,诗,五言古体,楚塞南行久 秦城北望遥 少年花已过 衰病柳先凋 客泪收回日 乡心寄落潮,"5,5,5,5,5,5",ee9cf724235956538d65bd875f039f2d,楚塞 南行 久 秦 城北 望遥 少年 花 已 过 衰 病 柳 先 凋 客泪 收回 日 乡心 寄 落潮
c71355fc-da6a-471f-8699-74ec1d2e0445,题王右丞山水障二首 一,张祜,唐,诗,五言律诗,精华在笔端 咫尺匠心难 日月中堂见 江湖满座看 夜凝岚气湿 秋浸壁光寒 料得昔人意 平生诗思残,"5,5,5,5,5,5,5,5",c7867df918e782876dc7ecd509076bf1,精华 在 笔端 咫尺 匠心 难 日月 中堂 见 江湖 满座 看 夜凝岚 气湿 秋浸壁 光寒 料 得 昔人 意 平生 诗思 残
8b6d2894-f861-4c32-b9b8-1bb2fd89c299,题王右丞山水障二首 二,张祜,唐,诗,五言律诗,右丞今已殁 遗画世间稀 咫尺江湖尽 寻常鸥鸟飞 山光全在掌 云气欲生衣 以此常为玩 平生沧海机,"5,5,5,5,5,5,5,5",7409c24d19a9fb4c2560f525170b3c94,右丞 今 已 殁 遗画 世间 稀 咫尺 江湖 尽 寻常 鸥鸟 飞 山光全 在 掌 云气 欲生 衣 以此 常为 玩 平生 沧海 机
d91cb921-c4c1-41e3-90be-c335549c3e15,将之衡阳道中作,张祜,唐,诗,五言律诗,万里南方去 扁舟泛自身 长年无爱物 深话少情人 醉卧襟长散 闲书字不真 衡阳路犹远 独与鴈为宾,"5,5,5,5,5,5,5,5",4306db7b972968166126107ee117ca5f,万里 南方 去 扁舟 泛 自身 长年 无 爱物 深 话 少 情人 醉卧 襟长 散 闲书 字 不 真 衡阳路 犹远 独 与 鴈 为 宾
cd3bd10a-c021-4ca3-b765-9a4d11af419f,读狄梁公传,张祜,唐,诗,五言律诗,失运庐陵厄 乘时武后尊 五丁扶造化 一柱正乾坤 上保储皇位 深然国老勋 圣朝虽百代 长合问王孙,"5,5,5,5,5,5,5,5",330a46ecbd310effe7b2eaf8a15c74bd,失运 庐陵 厄 乘 时武 后 尊 五丁 扶 造化 一柱 正 乾坤 上保储 皇位 深然国 老勋 圣朝 虽 百代 长合问 王孙
7ac446e1-0515-44f1-b2f7-dbe6458861a9,题真娘墓,张祜,唐,诗,五言律诗,佛地葬罗衣 孤魂此是归 舞为蝴蝶梦 歌谢伯劳飞 翠发朝云在 青蛾夜月微 伤心一花落 无复怨春辉,"5,5,5,5,5,5,5,5",5e18887134d159fdcc3d6116964dbbb7,佛地 葬 罗衣 孤魂 此是 归 舞 为 蝴蝶梦 歌谢 伯劳 飞 翠发朝云 在 青蛾 夜月 微 伤心 一 花落 无复怨 春辉
0cdf345b-ec6c-4f1b-9925-3093768879f1,洞庭南馆,张祜,唐,诗,五言律诗,一迳逗霜林 朱栏遶碧岑 地盘云梦角 山镇洞庭心 树白看烟起 沙红见日沉 还因此悲屈 惆怅又行吟,"5,5,5,5,5,5,5,5",08d2bb1b868ad2d4dca2e217cb3a9565,一迳 逗 霜 林 朱 栏 遶 碧 岑 地盘 云梦 角 山镇 洞庭 心 树白 看烟 起 沙红见 日 沉 还 因此 悲屈 惆怅 又 行吟
1a70b22b-f4f4-40b4-b217-e9e5287f3a1b,题赠仲仪上人院,张祜,唐,诗,五言律诗,星霜几朝寺 香火静居人 黄叶不经意 青山无事身 抛生台上日 结座履中尘 自说一时课 别来诗更新,"5,5,5,5,5,5,5,5",52fcd095dd8f46575902dbb35299012c,星霜 几 朝寺 香火 静居人 黄叶 不经意 青山 无事 身 抛生 台上 日 结座 履中 尘 自 说 一时 课 别 来 诗 更新
f7f5f9da-d2b8-4fcb-874a-8dc4d3145e05,题圣女庙,张祜,唐,诗,五言律诗,古庙无人入 苍皮涩老桐 蚁行蝉壳上 蛇窜雀巢中 浅水孤舟泊 轻尘一座蒙 晚来云雨去 荒草是残风,"5,5,5,5,5,5,5,5",b1f0bff22fa31db3895874ebb05b1049,古庙 无人 入 苍皮 涩 老桐 蚁 行 蝉 壳 上 蛇 窜 雀巢 中 浅水 孤舟泊 轻 尘 一座 蒙 晚 来 云雨 去 荒草 是 残风
5e44be48-0485-4dbe-b495-8ab1bbba49b7,题山水障子,张祜,唐,诗,五言律诗,一见秋山色 方怜画手稀 波涛连壁动 云物下簷飞 岭树冬犹发 江帆暮不归 端然是渔叟 相向日依依,"5,5,5,5,5,5,5,5",de1188a4c7e82876572864487007e0b2,一 见 秋 山色 方怜 画手 稀 波涛 连壁 动 云物 下 簷 飞 岭树 冬 犹 发 江帆 暮 不 归 端 然是 渔叟 相向 日 依依
b16c76f9-ee8d-488d-bb5e-9f2e57cbe702,咏风,张祜,唐,诗,五言律诗,摇摇歌扇举 悄悄舞衣轻 引笛秋临塞 吹沙夜遶城 向峰回鴈影 出峡送猨声 何似琴中奏 依依别带情,"5,5,5,5,5,5,5,5",fd6e4ae95137e286f6f7c243834d27a8,摇摇 歌扇 举 悄悄 舞衣 轻 引 笛 秋 临塞 吹沙 夜 遶 城 向 峰回 鴈 影 出峡 送 猨 声 何似琴 中 奏 依依 别 带 情
f81690f4-5328-40a0-a38b-c574af351b44,奉和令狐相公送陈肱侍御,张祜,唐,诗,五言律诗,高馆动离瑟 亲宾聊叹稀 笑歌情不尽 欢待礼无违 清露府莲结 碧云臯鹤飞 还家与□惠 雨露岂殊归,"5,5,5,5,5,5,5,5",bb7ef7d9b26b57cce1f2008d480bc443,高馆 动离瑟 亲宾 聊叹 稀 笑 歌情 不尽 欢待礼无违 清露 府 莲 结 碧云 臯 鹤 飞 还 家 与 □ 惠 雨露 岂 殊 归
246b35d4-4b94-46e9-af74-cdf154b67288,陪范宣城北楼夜䜩,张祜,唐,诗,五言律诗,华轩敞碧流 官妓拥诸侯 粉项高丛鬓 檀妆慢裹头 亚身摧蜡烛 斜眼送香毬 何处偏堪恨 千回下客筹,"5,5,5,5,5,5,5,5",45ea0e26338ae728eee3e4b1f3ae439d,华 轩敞 碧流 官妓 拥 诸侯 粉项 高丛 鬓 檀 妆 慢 裹 头 亚身 摧 蜡烛 斜眼 送 香 毬 何处 偏堪 恨 千回 下 客筹
f3bddf83-4da5-4094-8ae0-04ec65c23da2,宪宗皇帝挽歌词,张祜,唐,诗,五言律诗,呜咽上攀龙 升平不易逢 武皇虚好道 文帝未登封 寿域无千载 泉门是九重 桥山非远地 云去莫疑峰,"5,5,5,5,5,5,5,5",632a92b4f028e5a22908d9c240081b7f,呜咽 上攀龙 升平 不易 逢 武皇虚 好 道 文帝 未 登封 寿域 无 千载 泉门 是 九重 桥山 非远 地 云 去 莫疑峰
ce697a0b-c392-4c85-9ddb-e83f95a236c4,发蜀客,张祜,唐,诗,五言律诗,风吹鲁国人 飘荡蜀江滨 湿地饶蛙黾 衰年足鬼神 时清归去路 日复病来身 千万长堤柳 从他烂熳春,"5,5,5,5,5,5,5,5",6c192813a0562c1640787c415c63acef,风吹 鲁国 人 飘荡 蜀 江滨 湿地 饶蛙黾 衰 年 足 鬼神 时 清 归 去路 日 复病 来身 千万 长堤 柳 从 他 烂熳 春
2c59ed55-8d94-42c3-beda-d237f911e37b,江城晚眺,张祜,唐,诗,五言律诗,重槛构云端 江城四郁盘 河流出郭静 山色对楼寒 浪草侵天白 霜林映日丹 悠然此江思 树杪几樯竿,"5,5,5,5,5,5,5,5",cbcd6e405d2178eaffa13a4527d0077e,重槛 构 云端 江城 四 郁盘 河流 出 郭静 山色 对 楼寒 浪草 侵天 白 霜 林映 日丹 悠然 此 江思 树 杪 几 樯 竿
b52302ee-da79-4766-b62a-5460d4d8251d,题樟亭,张祜,唐,诗,五言律诗,晓霁凭虚槛 云山四望通 地盘江岸绝 天映海门空 树色连秋霭 潮声入夜风 年年此光景 催尽白头翁,"5,5,5,5,5,5,5,5",d0799138d55232e6eadd75880416da90,晓霁 凭 虚槛 云山 四望 通 地盘 江岸 绝 天映 海门 空 树色 连秋霭 潮声 入 夜风 年年 此 光景 催尽 白头翁
9d768f4a-8b6e-48ce-8376-fd45e7d58a75,乐静,张祜,唐,诗,五言律诗,引手强𥮾巾 徐徐起病身 远心群野鹤 闲话对村人 发匣琴徽静 开瓶酒味真 纵闻兵赋急 原宪本家贫,"5,5,5,5,5,5,5,5",49cf3df5382d440771820efd66624f71,引手 强 𥮾 巾 徐徐 起病 身 远 心群 野鹤 闲话 对 村人 发匣琴 徽静 开瓶 酒味 真 纵闻 兵赋 急 原 宪本 家贫
5f66ef86-de8c-43a5-becb-26a5333aad46,登广武原,张祜,唐,诗,五言律诗,广武原西北 华夷此浩然 地盘山入海 河遶国连天 远树千门邑 高樯万里船 乡心日云暮 犹在楚城边,"5,5,5,5,5,5,5,5",cde00e0800573ee7ba573d6a4526e43b,广武原 西北 华夷 此 浩然 地 盘山 入海 河 遶 国 连天 远 树 千门 邑 高 樯 万里 船 乡心 日 云 暮 犹 在 楚城 边
eba8b869-2b97-462c-a8db-e7eccc05567b,观宋州田大夫打毬,张祜,唐,诗,五言律诗,白马顿红缨 梢毬紫袖轻 晓冰蹄下裂 寒瓦杖头鸣 叉手胶黏去 分鬃线道絣 自言无战伐 髀肉已曾生,"5,5,5,5,5,5,5,5",7a126676f0c2367434a8f2706f35ed9a,白马 顿 红缨 梢 毬 紫 袖 轻 晓冰蹄 下裂 寒瓦杖 头 鸣 叉手 胶 黏 去 分 鬃 线 道 絣 自言无战伐 髀 肉 已曾 生
bab45eb4-da2d-4368-b3ab-01f2fbb32516,题丹阳永泰寺练湖亭,张祜,唐,诗,五言律诗,小槛俯澄鲜 龙宫浸浩然 孤光悬夜月 一片割秋天 浅派胤沙草 余波漂岸船 聊当因畎浍 披拂坐潺湲,"5,5,5,5,5,5,5,5",673b4397e447b62517c98dbd7590ab14,小槛 俯 澄鲜 龙宫 浸 浩然 孤光悬 夜月 一片 割 秋天 浅 派 胤 沙草 余波 漂岸 船 聊当 因 畎 浍 披拂 坐 潺湲
23553ffd-b8dd-446a-80c5-2b7e4e9e734c,题程氏书斋,张祜,唐,诗,五言律诗,僻巷难通马 深园不藉篱 青萝缠栢叶 红粉坠莲枝 雨燕衔泥近 风鱼咂网迟 缘君寻小阮 好是更题诗,"5,5,5,5,5,5,5,5",128c96b024781a4e907c3e40522fab5d,僻巷 难 通马 深园 不藉 篱 青萝 缠 栢 叶 红粉 坠 莲枝 雨燕 衔泥 近 风鱼 咂 网 迟 缘 君 寻 小 阮 好 是 更 题诗
dc1558e5-7994-47f7-8c42-66cef9229046,毁浮图年逢东林寺旧,张祜,唐,诗,五言律诗,可惜东林寺 空门失所依 翻经谢灵运 画壁陆探微 隙地泉声在 荒途马迹稀 殷勤话僧辈 未敢保儒衣,"5,5,5,5,5,5,5,5",de55bb1ee23325fea42df5c1fdbbf86c,可惜 东林寺 空门 失所 依 翻 经 谢灵运 画壁 陆探微 隙地 泉声 在 荒途 马迹 稀 殷勤 话 僧 辈 未 敢保 儒衣
255c4435-29ed-49a7-ac0e-2d41e75c8786,贵池道中作,张祜,唐,诗,五言律诗,羸骖驱野岸 山远路盘盘 清露月华晓 碧江星影寒 离群徒长泣 去国自加餐 霄汉宁无旧 相哀自语端,"5,5,5,5,5,5,5,5",589389982cc5a212a66bb18e18cfa135,羸骖 驱 野 岸 山 远路 盘盘 清露 月华 晓 碧江星 影寒 离群 徒长 泣 去国 自 加餐 霄汉 宁 无旧 相哀 自语 端
7bc6dbff-6141-4453-aca6-f7af8bae486f,喜王子载话旧,张祜,唐,诗,五言律诗,相逢青眼日 相叹白头时 累话三朝事 重看一局棋 欢娱非老大 成长是婴儿 且尽尊中物 无烦更后期,"5,5,5,5,5,5,5,5",561d898af8e040b212034abe30966c12,相逢 青眼 日 相叹 白头 时 累话 三朝 事 重 看 一局 棋 欢娱 非 老大 成长 是 婴儿 且 尽 尊 中物 无烦 更 后期
0682aa38-f390-49e9-8685-b8195c3a5420,秋日病中,张祜,唐,诗,五言律诗,析析簷前竹 秋声拂簟凉 病加阴已久 愁觉夜初长 坐拾车前子 行看肘后方 无端忧食忌 开镜倍萎黄,"5,5,5,5,5,5,5,5",349efbdedd7336495836d48cf62c4d77,析 析 簷 前 竹 秋声 拂 簟 凉 病加阴 已久 愁觉 夜初 长 坐拾 车前子 行 看 肘后方 无端 忧食忌 开镜 倍 萎黄
f0958fb4-f2de-40dc-a56e-7af16de68faf,访许用晦,张祜,唐,诗,五言律诗,远郭日曛曛 停桡一访君 小桥通野水 高树入江云 酒兴曾无敌 诗情旧逸群 怪来音信少 五十我无闻,"5,5,5,5,5,5,5,5",0c9bd6cdbbef5e4f7b9a0dfc8eacd38e,远 郭 日 曛 曛 停 桡一访君 小桥 通野 水 高树 入 江云 酒兴 曾 无敌 诗情 旧 逸群 怪 来 音信 少 五十 我 无闻
5502e22e-e55f-4e74-9af1-31f64cef2223,题海盐南馆,张祜,唐,诗,五言律诗,故人营此地 台馆尚依依 黑夜山魈语 黄昏海燕归 旧阴杨叶在 残雨槿花稀 无复南亭赏 高簷红烛辉,"5,5,5,5,5,5,5,5",9f9f48f1e93960402328d6e12b05fe54,故人 营 此地 台馆 尚 依依 黑夜 山魈 语 黄昏 海燕 归 旧 阴 杨叶 在 残 雨 槿 花 稀 无复 南亭 赏 高 簷 红烛 辉
6cca6f72-4783-4d6e-99d1-08f6cd768459,晚秋江上作,张祜,唐,诗,五言律诗,万里穷秋客 萧条对落晖 烟霞山鸟散 风雨庙神归 地远蛩声切 天长鴈影稀 那堪正砧杵 幽思想寒衣,"5,5,5,5,5,5,5,5",7a5575615b7cea8ccf23575ed9ea3a2c,万里 穷秋 客 萧条 对 落晖 烟霞 山 鸟散 风雨 庙神 归 地 远 蛩 声 切 天长 鴈 影 稀 那堪 正 砧杵 幽 思想 寒衣
ffaf9870-e688-45d5-94ed-d66d4843783e,吴宫曲,张祜,唐,诗,五言律诗,日下苑西宫 花飘香径红 玉钗斜白燕 罗带弄青虫 皓齿初含雪 柔枝欲断风 可怜倾国艳 谁信女为戎,"5,5,5,5,5,5,5,5",f0abbf210bfe21d88db1df13d958f8d0,日 下 苑 西宫 花 飘香 径红 玉钗 斜 白燕 罗 带 弄 青虫 皓齿 初含雪 柔枝欲断风 可怜 倾国 艳 谁 信女 为 戎
4869ef2f-3ebd-45f2-84d9-4235d3047681,赋昭君冢,张祜,唐,诗,五言律诗,万里关山冢 明妃旧死心 恨为秋色晚 愁结暮云阴 夜切胡风起 天高汉月临 已知无玉貌 何事送黄金,"5,5,5,5,5,5,5,5",21b61686e659623ea2d2bf2d55a1da9f,万里 关山 冢 明妃 旧 死心 恨 为 秋色 晚 愁 结 暮云 阴 夜 切 胡风 起 天高汉 月 临 已知 无 玉貌 何事 送 黄金
5b2ef31a-a526-458d-997a-cf47b28081ce,哭汴州陆大夫,张祜,唐,诗,五言律诗,利劒太坚操 何妨拔一毛 冤深陆机雾 愤积伍员涛 直道非无验 明时不录劳 谁当青史上 卒为显词褒,"5,5,5,5,5,5,5,5",f184bb78a09b99664cf746f5954ef83f,利 劒 太 坚 操 何妨 拔一毛 冤 深 陆机 雾 愤积 伍员涛 直道 非 无验 明时 不录 劳 谁 当 青史 上 卒 为 显词 褒
44bd0cd6-7abf-4c99-89c9-207af5f06fb2,晚夏归别业,张祜,唐,诗,五言律诗,古岸扁舟晚 荒园一径微 鸟啼新果熟 花落故人稀 宿润侵苔甃 斜阳照竹扉 相逢尽乡老 无复话时机,"5,5,5,5,5,5,5,5",4e9d54485eb4dd08a370137264d5969b,古岸 扁舟 晚 荒园 一径 微 鸟啼 新果 熟 花落 故人 稀 宿润 侵 苔 甃 斜阳 照 竹扉 相逢 尽 乡 老 无复话 时机
22ec3a40-03e1-4ed4-b676-461cb5413f53,公子行,张祜,唐,诗,五言律诗,春色满城池 杯盘著处移 镫金斜鴈子 鞍帕嫩鹅儿 买笑歌桃李 寻歌折柳枝 可怜明月夜 长是管弦随,"5,5,5,5,5,5,5,5",37e5b6ac8d8c11d282e9ef357eaa80ba,春色 满 城池 杯盘 著 处移 镫 金 斜 鴈 子 鞍帕嫩 鹅儿 买笑 歌 桃李 寻歌 折 柳枝 可怜 明月 夜 长 是 管弦 随
71770c5a-2ae6-438e-96f6-0e98dcdb8c3f,题曾氏园林,张祜,唐,诗,五言律诗,十亩长堤宅 萧疎半老槐 醉眠风卷簟 棋罢月移堦 斫树遗桑斧 浇花湿笋鞋 还将齐物论 终岁自安排,"5,5,5,5,5,5,5,5",3242e880c2799dbe8b6236bbcef685b8,十亩 长堤 宅 萧 疎 半 老 槐 醉眠风 卷 簟 棋 罢 月 移 堦 斫 树遗桑斧 浇花 湿 笋 鞋 还 将 齐物 论 终岁 自 安排
1dd04cce-7799-4b5c-b4ea-a675bc2517e0,读始兴公传,张祜,唐,诗,五言律诗,殁世议方存 升平道几论 诗情光日月 笔力动乾坤 乱首光雄筭 朝纲在典坟 明时封禅绩 山下见丘门,"5,5,5,5,5,5,5,5",5e782d6616047a01ac5541bf208e9996,殁 世议 方存 升平 道 几论 诗情 光 日月 笔力 动 乾坤 乱 首 光 雄 筭 朝纲 在 典坟 明 时 封禅 绩 山下 见 丘门
e5e7282c-6608-491e-b386-79c4c22528be,中秋月,张祜,唐,诗,五言古体,碧落桂含姿 清秋是素期 一年逢好夜 万里见明时 绝域行应久 高城下更迟,"5,5,5,5,5,5",12a1350713a97fa4a16a3a05f7fcee5b,碧落 桂含姿 清秋 是 素期 一年 逢 好夜 万里 见 明时 绝域 行应 久 高 城下 更迟
0468380b-83f8-4ea8-bf36-e95d71bc7b6a,江西道中作三首 一,张祜,唐,诗,五言律诗,日落江村远 烟霞度几重 问人孤驿路 驱马乱山峰 夜入霜林火 寒生水寺钟 凄凉哭途意 行处又饥凶,"5,5,5,5,5,5,5,5",56c6bfa7389619740af66614122cf48f,日落 江村 远 烟霞 度 几重 问人 孤 驿路 驱马 乱 山峰 夜入霜 林火 寒 生水 寺 钟 凄凉 哭途意 行处 又 饥凶
c56496ca-aa35-4ede-8617-223b709a085f,江西道中作三首 二,张祜,唐,诗,五言律诗,西江江上月 远远照征衣 夜色草中网 秋声林外机 渚田牛路熟 石岸客船稀 无复是乡井 鹧鸪聊自飞,"5,5,5,5,5,5,5,5",69b59ad7a7eb7acd7cb1e572bc693ce6,西江 江上 月 远远 照 征衣 夜色 草 中 网 秋声 林外 机 渚 田 牛路 熟 石岸 客船 稀 无复 是 乡井 鹧鸪 聊自 飞
1d6cf905-0e0f-470c-99eb-aeac30da4387,江西道中作三首 三,张祜,唐,诗,五言律诗,秋滩一望平 远远见山城 落日啼乌桕 空林露寄生 烧畬残火色 荡桨夜溪声 况是曾游处 桑田小变更,"5,5,5,5,5,5,5,5",8585e69af32f6c21bd4a3b59e1cbcadd,秋滩 一望 平 远远 见 山城 落日 啼 乌桕 空林 露 寄生 烧 畬 残 火色 荡 桨 夜 溪 声 况是 曾 游 处 桑田 小 变更
1bac9f9a-7997-4257-b489-4f545b3a8326,题常州水西馆,张祜,唐,诗,五言律诗,隟地丛筠植 修廊列堵环 楼台疎占水 冈岸远成山 尽日草深映 无风舟自闲 聊当俟芳夕 一泛芰荷间,"5,5,5,5,5,5,5,5",45ef3929a018b520b3f7698e6dec24e2,隟 地 丛 筠 植 修廊 列堵 环 楼台 疎 占 水 冈岸远 成山 尽 日 草 深映 无风舟自闲 聊 当 俟 芳 夕 一泛 芰 荷 间
f17426ee-fed4-4748-86f3-0797f4b4729e,题李渎山居玉潭,张祜,唐,诗,五言律诗,古树千年色 苍崖百尺阴 发寒泉气静 神骇玉光沉 上穴青冥小 中连碧海深 何当烟月下 一听夜龙吟,"5,5,5,5,5,5,5,5",1fb1d2289ea0a4bb85de955195b12880,古树 千年 色 苍崖 百尺 阴 发寒 泉气 静 神骇 玉光 沉 上穴青 冥 小 中连 碧海 深 何 当 烟 月 下 一 听 夜 龙吟
bca936e1-9ae3-4381-9cff-944ef52ae7f4,题陆墉金沙洞居,张祜,唐,诗,五言律诗,东溪泉一眼 归卧惬高疎 决水金沙静 梯云石壁虚 细吟搔短发 深话笑长裾 莫道遗名品 尝闻入洛初,"5,5,5,5,5,5,5,5",32c3f88d4b9b2246a0de459e8fade669,东溪 泉 一眼 归卧 惬高 疎 决水 金沙 静 梯云 石壁 虚 细吟 搔 短发 深 话 笑 长 裾 莫道 遗 名品 尝 闻入 洛 初
4d091a80-4b04-4182-adc8-67134550ec8e,题陆敦礼山居伏牛潭,张祜,唐,诗,五言律诗,伏牛真怪事 余胜几人谙 日彩沉青壁 烟容静碧潭 泛心何虑冷 漱齿讵忘甘 幸挈壶中物 期君正兴酣,"5,5,5,5,5,5,5,5",9e955c89a53b2b8f53ab373155f31182,伏牛 真 怪事 余胜 几 人 谙 日 彩 沉 青壁 烟 容静 碧潭 泛心 何虑 冷 漱 齿 讵 忘 甘 幸 挈 壶中物 期君 正兴 酣
63de0ccb-8500-4ba7-aa56-9ed242c13c55,旅次石头岸,张祜,唐,诗,五言律诗,行行石头岸 身事两相违 旧国日边远 故人江上稀 水声寒不尽 山色暮相依 惆怅未成语 数行鵶又飞,"5,5,5,5,5,5,5,5",22c577afc414b5f04fd94f859dc1fc1a,行 行 石头 岸 身事 两 相违 旧国 日 边远 故人 江上 稀 水声 寒 不尽 山色 暮 相依 惆怅 未 成语 数行 鵶 又 飞
f2b0b0f1-ab53-4073-ae79-25809269c906,观宋州于使君家乐琵琶,张祜,唐,诗,五言律诗,历历四弦分 重来上界闻 玉盘飞夜雹 金磬入秋云 陇雾笳凝水 砂风鴈咽群 不堪天塞恨 青冢是昭君,"5,5,5,5,5,5,5,5",0377f60e90d5b759b822edeee93b1e09,历历 四 弦 分 重来 上界 闻 玉盘 飞夜 雹 金磬 入秋 云 陇 雾 笳 凝 水 砂 风 鴈 咽 群 不堪 天塞恨 青冢 是 昭君
242d5465-f3be-4024-837b-98481381a915,筝,张祜,唐,诗,五言律诗,绰绰下云烟 微收皓腕鲜 夜风生碧柱 春水咽红弦 翠佩轻犹触 莺枝涩未迁 芳音何更妙 清月共婵娟,"5,5,5,5,5,5,5,5",6109b125a88036db0eedda5637dbedb9,绰绰下 云烟 微收 皓腕 鲜 夜风 生碧柱 春水 咽 红 弦 翠佩 轻犹触 莺枝涩 未 迁 芳音 何 更妙 清月 共 婵娟
fabbd19f-4b61-4c3a-98a9-e00e97fafc96,歌,张祜,唐,诗,五言律诗,一夜列三清 闻歌曲阜城 雪飞红烬影 珠贯碧云声 皓齿娇微发 青蛾怨自生 不知新弟子 谁解啭喉轻,"5,5,5,5,5,5,5,5",8a51d02f43dc127eb3e2bf6c5236e95b,一夜 列 三清 闻 歌曲 阜城 雪 飞红 烬 影 珠 贯 碧云 声 皓齿 娇微 发 青蛾 怨自生 不知 新 弟子 谁 解啭 喉轻
b25b532b-b89c-45aa-84c7-af0093a606da,笙,张祜,唐,诗,五言律诗,董双成一妙 历历韵风篁 清露鹤声远 碧云仙吹长 气侵银项湿 膏胤漆瓢香 曲罢不知处 巫山空夕阳,"5,5,5,5,5,5,5,5",b75309fc5f3f8e649717b3f9f0d076e7,董双成 一妙 历历 韵 风 篁 清露 鹤声 远 碧云 仙 吹长 气 侵 银 项湿 膏 胤 漆 瓢 香 曲 罢 不知 处 巫山 空 夕阳
0e78a10e-17cb-43ab-b509-55724b206df9,五弦,张祜,唐,诗,五言律诗,小小月轮中 斜抽半袖红 玉瓶秋滴水 珠箔夜悬风 徵调侵弦乙 商声过指拢 只愁才曲罢 云雨去巴东,"5,5,5,5,5,5,5,5",94e76f48248268888f6508317dfdd6e3,小小 月 轮 中 斜 抽 半袖 红 玉瓶 秋 滴水 珠箔 夜 悬 风 徵 调 侵弦 乙 商声 过 指拢 只 愁 才 曲 罢 云雨 去 巴东
3917e030-def4-4749-8c3f-e04262954563,𥷑篥,张祜,唐,诗,五言律诗,一管妙清商 纤红玉指长 雪藤新换束 霞锦旋抽囊 并揭声犹远 深含曲未央 坐中知密顾 微笑是周郎,"5,5,5,5,5,5,5,5",9b13d3c35acdcdbbe242fdacf9078f01,一管 妙 清 商 纤 红玉 指长 雪藤新 换束 霞 锦 旋 抽 囊 并 揭声 犹远 深 含曲 未央 坐中知密顾 微笑 是 周郎
40dbe539-a4d5-4dbf-accb-519472d8e09f,笛,张祜,唐,诗,五言律诗,紫清人一管 吹在月堂中 鴈起雪云夕 龙吟烟水空 虏尘深汉地 羌思切边风 试弄阳春曲 西园桃已红,"5,5,5,5,5,5,5,5",77447cfa4afdff8cb0bff15e35c98d85,紫 清人 一 管 吹 在 月堂 中 鴈 起 雪 云 夕 龙吟 烟水 空 虏 尘 深汉 地 羌 思 切边 风 试弄 阳春 曲 西园 桃 已 红
46245022-d7dc-4bff-806e-5c1c8f516c8d,舞,张祜,唐,诗,五言律诗,荆台呈妙舞 云雨半罗衣 褭褭腰疑折 褰褰袖欲飞 雾轻红踯躅 风艳紫蔷薇 强许传新态 人间弟子稀,"5,5,5,5,5,5,5,5",3356f681fa6643ea7d43b15cc1abb2de,荆台 呈 妙 舞 云雨 半 罗衣 褭 褭 腰 疑 折 褰 褰 袖欲飞 雾轻红 踯躅 风艳 紫 蔷薇 强许 传 新态 人间 弟子 稀
fb3cd026-e2b5-4438-926d-4f72a4a972b3,箜篌,张祜,唐,诗,五言律诗,星汉夜牢牢 深帘调更高 乱流公莫度 沉骨妪空嘷 向月轻轮甲 迎风重纫绦 不堪闻别引 沧海恨波涛,"5,5,5,5,5,5,5,5",47998cd090b61f6f753b2ed79cf75634,星汉 夜 牢牢 深 帘调 更 高 乱流 公莫度 沉 骨 妪 空 嘷 向 月 轻 轮 甲 迎风 重纫绦 不堪 闻别引 沧海 恨 波涛
78635faa-875b-4359-a027-9381da646165,箫,张祜,唐,诗,五言律诗,清籁远愔愔 秦楼夜思深 碧空人已去 沧海凤难寻 杳妙和云绝 依微向水沉 还将九成意 高阁𥩟芳音,"5,5,5,5,5,5,5,5",6c80fb1efb2df57a07c206ddfbdeb6ff,清 籁 远 愔 愔 秦楼 夜思深 碧空 人 已 去 沧海 凤 难寻 杳妙和云绝 依微 向 水 沉 还 将 九成 意 高阁 𥩟 芳音
6e0fcac2-79cb-4774-8307-2f5831ef41a9,夕次桐庐,张祜,唐,诗,五言律诗,百里清溪口 扁舟此去过 晚潮风势急 寒叶雨声多 戍出山头鼓 樵通竹里歌 不堪无酒夜 廻首梦烟波,"5,5,5,5,5,5,5,5",eb3b583e5b94be0c841aa86507694be8,百里 清溪 口 扁舟 此 去过 晚潮 风势 急 寒叶 雨声 多 戍出 山头 鼓 樵通竹 里 歌 不堪 无酒 夜 廻 首 梦 烟波
2666512f-a08f-4a6a-9043-4d053b499361,入潼关,张祜,唐,诗,五言律诗,都城三百里 雄险此廻环 地势遥尊岳 河流侧让关 秦皇曾虎视 汉祖昔龙颜 何处枭凶辈 干戈自不闲,"5,5,5,5,5,5,5,5",6f1f8163d3071c34854e6bcbcff82955,都城 三百里 雄险 此 廻 环 地势 遥 尊 岳 河流 侧 让 关 秦皇 曾 虎视 汉祖昔 龙颜 何处 枭凶辈 干戈 自不闲
