id,title,author,dynasty,genre,poem_type,sentences_simplified,meter_pattern,hash,words
8f298148-1b63-4c6b-ba5f-ff1807199dfc,再和五首  其五,劉克莊,唐,诗,七言律诗,杖屦暇时常检点 细分枝干数株桩 试呼童子调霜弄 绝胜奴兵擂晓逄 色映岩松寒引鹤 根连园杞夜闻尨 社中作者铦锋颖 甘树降旛束短杠,"7,7,7,7,7,7,7,7",a9c1a87ca8f8efcdea1e78dba9b736a0,杖 屦 暇 时常 检点 细分 枝干 数株 桩 试呼 童子 调霜 弄 绝胜 奴兵 擂晓 逄 色 映岩松 寒引鹤 根 连 园杞夜 闻 尨 社 中 作者 铦 锋 颖 甘树 降 旛 束 短 杠
1eba1458-64d0-4c45-adcf-53943350ba54,賦西淙瀑布得斷字,劉克莊,唐,诗,五言古体,苍山七百亩 主人新买断 于时积雾开 素瀑挂青汉 泠泠瑟初铿 璀璀珠乍贯 久晴雨瓢翻 忽暖冰柱泮 恍如白浪涌 翔舞下凫鴈 又疑黄河决 禜祭沉玉瓒 不然蟒出穴 或是虹吸涧 客言下有潭 龙伏不可玩 攫拏起云气 喷薄苏岁旱 平生爱奇心 欲此筑飞观 沿流踏浅清 陟𪩘腾汗漫 低头拜主人 分我华山半,"5,5,5,5,5,5,5,5,5,5,5,5,5,5,5,5,5,5,5,5,5,5,5,5",720b6a4d8b8d17d94ec8b16104b44ea6,苍山 七 百亩 主人 新 买断 于时 积雾 开 素 瀑 挂 青汉 泠 泠 瑟 初 铿 璀璀珠 乍 贯 久 晴 雨 瓢 翻 忽 暖 冰柱 泮 恍如 白 浪涌 翔 舞下 凫鴈 又 疑 黄河 决 禜 祭 沉 玉 瓒 不然 蟒出穴 或是 虹吸 涧 客言 下 有 潭 龙伏 不可 玩 攫拏 起 云气 喷薄 苏 岁 旱 平生 爱奇 心 欲此筑 飞观 沿流 踏浅清 陟 𪩘 腾 汗漫 低头 拜 主人 分 我 华山 半
8410855c-590d-44de-adf3-c2a767b97864,送陳寺丞守延平,劉克莊,唐,诗,五言律诗,诏免延英对 轻装见吏民 极知忙捄旱 岂是急颁春 邑为搜空坏 州因献羡贫 此行休戚系 未敢贺朱轮,"5,5,5,5,5,5,5,5",b8ce63301ba513d8f42d5b6467ef7792,诏 免 延英 对 轻装 见 吏民 极 知 忙 捄 旱 岂 是 急 颁 春 邑 为 搜空坏 州 因献 羡贫 此行 休戚 系 未敢 贺朱 轮
7a312adf-4de9-4267-80fc-38843c9266fc,送丁元暉知南海,劉克莊,唐,诗,五言律诗,不用急符催 先行要看梅 岁时亲祭海 休沐必登台 鲍井聊供饮 韩碑待拭苔 遥知蛮俗喜 令尹带琴来,"5,5,5,5,5,5,5,5",258b70fddd2ed1f1d4f75867c3ffe805,不用 急符 催 先行 要 看 梅 岁 时亲 祭 海 休沐 必 登台 鲍井 聊供 饮 韩碑 待 拭 苔 遥知 蛮俗 喜 令 尹带琴 来
b34b105a-473e-4079-b030-c4e8c38fb261,黄檗道中崖居者,劉克莊,唐,诗,七言绝句,种竹成林橘满园 牛归童子掩篱门 主人虽不知名氏 想见孤高可与言,"7,7,7,7",ccbb10e308ae6bc90cae66e72191f53d,种 竹 成林 橘 满园 牛归 童子 掩篱门 主人 虽 不知 名氏 想见 孤高 可 与 言
7c57735b-5055-402b-b63f-a08ed6cb8892,橫塘,劉克莊,唐,诗,七言绝句,水松百本映门栽 池上荷花似锦开 记取横塘风景好 归程摹入小诗来,"7,7,7,7",fbc373161dada7e1084c3b629fc2db25,水松 百本映门 栽 池上 荷 花似锦 开 记取 横塘 风景 好 归程 摹入 小 诗 来
1c59f0fa-17b8-4f69-a3c4-755054042f22,蒜溪,劉克莊,唐,诗,七言绝句,日烁千山草树然 海乡极目少炊烟 蒜溪一脉涓涓水 只绿庵西数丈田,"7,7,7,7",b37bdcb295d1dfc78eab522361fa3363,日 烁 千山 草树 然 海乡 极目 少 炊烟 蒜 溪 一 脉 涓涓 水 只 绿 庵 西 数丈 田
2d8d7c98-bc82-47e5-9d06-c6462190aa84,哭囊山覺初長老  其一,劉克莊,唐,诗,五言律诗,岂谓茶毗速 龛前一怆情 空留尊宿貌 难问小师名 骨已迎归塔 衣多唱入城 百年如此过 何异不曾生,"5,5,5,5,5,5,5,5",59e4874ae15718c22b7601f76768805c,岂谓 茶 毗速 龛 前 一怆 情 空 留 尊 宿貌 难 问 小师 名 骨 已 迎归 塔 衣 多 唱入 城 百年 如此 过 何异 不曾 生
b87e44bd-f97b-44e8-b8d9-3bf33a42f5e1,哭囊山覺初長老  其二,劉克莊,唐,诗,七言律诗,雪峰寺里曾相识 面皱颧高五十余 削发入山参最久 白头出世瘦如初 觉心不共真身坏 遗偈犹能战手书 何必塔铭并语录 吾诗自可表幽墟,"7,7,7,7,7,7,7,7",e6489be60849b79fcef74c9f3b852c4d,雪峰 寺里 曾 相识 面皱 颧高 五十余 削发 入 山参 最 久 白头 出世 瘦 如初 觉心 不 共 真身 坏 遗 偈 犹能 战 手书 何必 塔铭 并 语录 吾 诗 自 可表 幽墟
ea1cc969-7980-4e94-8b41-433cf0d776c2,贈蕭高士,劉克莊,唐,诗,五言律诗,玉笥萧高士 超然物外姿 能弹广陵操 会作豫章诗 紫府非无分 丹房未有基 西山多隠者 何必远求师,"5,5,5,5,5,5,5,5",e4d677b8046b01440e6dcbd6d1ba9859,玉笥萧 高士 超然物外 姿 能弹 广陵 操 会 作 豫章 诗 紫府 非无分 丹房 未有 基 西山 多 隠 者 何必 远求 师
e21ce946-bfc8-466a-b79e-f6dee17ea3fd,挽李端,劉克莊,唐,诗,五言律诗,要识君操履 全如字画真 病能妨献赋 穷不废修身 月旦推先辈 春官失此人 如闻埋玉速 里巷共酸辛,"5,5,5,5,5,5,5,5",b8517df455f6d0ada5c5d5a8776c5317,要识 君操 履 全 如 字画 真 病能 妨献 赋 穷不废 修身 月旦 推 先辈 春官 失 此人 如 闻 埋 玉速 里巷 共 酸辛
f66346fe-13f2-490a-a0fa-c603677b3603,海口三首  其一,劉克莊,唐,诗,七言律诗,暂游不得久婆娑 柰此龙江景物何 天势去随帆际尽 海声来傍枕边多 昏窗微见灯明屿 霁阁遥看日浴波 定有后人寻旧迹 已留小篆识山阿,"7,7,7,7,7,7,7,7",899ae782b888fd7df361328569981afe,暂 游 不得 久 婆娑 柰 此 龙江 景物 何 天势 去 随 帆际 尽 海声 来 傍 枕边 多 昏窗 微见 灯明屿 霁 阁 遥 看 日 浴波 定 有 后人 寻 旧迹 已 留 小篆 识 山 阿
cfa7dd50-f860-4f0e-b14b-78ca8c0a083b,海口三首  其二,劉克莊,唐,诗,七言律诗,岛烟常至晏方开 沙际参差辨远桅 风挟寒声从树起 潮分末势过桥来 吏人不禁山排闼 客子思倾海入杯 归忆斯游非冷淡 如尝橄榄味初回,"7,7,7,7,7,7,7,7",450ec471fed297e67869b9a037886a07,岛 烟 常 至 晏方 开 沙际 参差 辨远 桅 风 挟 寒声 从 树起 潮分 末势 过桥 来 吏人 不禁 山 排 闼 客子 思倾海 入 杯 归忆斯 游非 冷淡 如 尝 橄榄 味 初 回
84783427-468c-44c9-acf3-0b4e871e4a44,海口三首  其三,劉克莊,唐,诗,七言律诗,人烟穷处屋三间 目断寒云接浅山 石塔有风铃自语 水亭无税印常闲 沙晴火伏如棋布 浪急渔舟似洗还 自古诗从登览得 莫辞绝境共追攀,"7,7,7,7,7,7,7,7",2280b8ece6aa31dc7d4091619b4520da,人烟 穷 处 屋 三间 目断寒云接浅山 石塔 有 风铃 自语 水亭 无税 印常 闲 沙晴 火 伏 如 棋布 浪急 渔舟 似 洗 还 自 古诗 从 登览 得 莫辞 绝境 共 追 攀
ad78ebd5-436d-4b0e-90a4-5e10a045728f,黄檗寺一首,劉克莊,唐,诗,七言律诗,犹记垂髫到此山 重游客鬓已雕残 寺经水后增轮奂 僧比年时减钵单 绝壑云兴潭影黑 疎林霜下叶声干 平生酷嗜朱翁字 细看荒碑倚石栏,"7,7,7,7,7,7,7,7",fc6a7458cf9a1528c96ed8808cd6e113,犹记 垂髫 到 此 山 重 游客 鬓 已 雕残 寺 经水 后 增 轮 奂 僧比 年 时 减 钵 单 绝壑 云兴 潭影 黑 疎 林 霜 下叶 声干 平生 酷 嗜 朱翁 字 细看 荒碑 倚 石栏
ce80ea8e-3ac5-4596-9094-26a3cb9f984e,和西外趙知宗,劉克莊,唐,诗,五言律诗,斤妙斲如神 源深汲愈新 岱宗疑有趾 海若忽无津 传远须公等 钻坚尽此身 平生师友意 非为雨中巾,"5,5,5,5,5,5,5,5",c3e526e87c8d997a797eb8c7eff1a8a3,斤 妙 斲 如 神 源深 汲愈 新 岱宗 疑有趾 海若忽 无津 传 远须 公等 钻 坚尽 此身 平生 师友 意 非为 雨中巾
5659b89d-528e-49ce-b6ea-98095e9e44a9,悼秦醫,劉克莊,唐,诗,五言律诗,最晓阴阳证 于身独不灵 有妻持旧肆 无子学遗经 虫蚀抄方箧 莎生晒药庭 城中医绝少 堪惜尔雕零,"5,5,5,5,5,5,5,5",5306aa9af6994a1f768dede19386f2ec,最晓 阴阳 证 于 身 独 不灵 有 妻 持 旧 肆 无子学 遗经 虫蚀 抄 方 箧 莎生 晒 药庭 城 中医 绝少 堪 惜尔雕 零
14313c29-578e-476f-bcb6-1eb8c5edf6a4,十月二十二夜同方寺丞宿瀑庵讀劉賓客集,劉克莊,唐,诗,七言律诗,瀑山木落霜寒夜 共读吾家梦得诗 坐对遗篇忘漏尽 手遮残烛怕风吹 森严似听元戎令 机警如看国手棋 千载愚溪相对垒 未应地下友微之,"7,7,7,7,7,7,7,7",1a04ab9d85f68290b08d81c8cd060d00,瀑 山木 落霜 寒夜 共读 吾 家 梦 得 诗 坐 对 遗篇 忘 漏尽 手 遮 残烛 怕 风吹 森严 似 听 元戎 令 机警 如 看 国手 棋 千载 愚溪 相对 垒 未 应 地下 友微 之
7ab44a69-1da3-49c6-8858-4fc847903c61,戍婦詞三首  其一,劉克莊,唐,诗,七言绝句,织锦为书寄鴈飞 功名从古恨无机 良人白首沙场里 何日封侯建节归,"7,7,7,7",a6cba8daedf8e4549986ded68d05a9c1,织锦 为 书 寄 鴈 飞 功名 从 古恨 无机 良人 白首 沙场 里 何日 封侯 建节 归
5b571845-30bf-4f83-bb3b-de32cd0c0425,戍婦詞三首  其二,劉克莊,唐,诗,七言绝句,昨日人回问塞垣 阵前多有未招魂 营司不许分明哭 寒月家家照泪痕,"7,7,7,7",7a2b49d0b41b4a2094484210d05ae73f,昨日 人 回问 塞垣 阵前 多 有 未 招魂 营司 不许 分明 哭 寒月 家家 照 泪痕
1995b1d8-68ec-4fa9-95d9-ea2ba16eb066,戍婦詞三首  其三,劉克莊,唐,诗,七言绝句,九月严霜塞下飞 连营回首望寒衣 将军纵上移屯奏 无柰公卿半是非,"7,7,7,7",8d9df67d81a692d9f9befebfdb88c476,九月 严霜 塞下 飞 连营 回首 望 寒衣 将军 纵 上移 屯奏 无 柰 公卿 半 是非
28e6b8dd-4863-4c49-8379-368b9495378e,游水南一首,劉克莊,唐,诗,七言律诗,九马如飞不用鞭 微尘一道起晴川 有司误谤为山贼 好事俄传是地仙 何处名楼风月爽 谁家修竹主人贤 橐诗三百高无价 难向旗亭当酒钱,"7,7,7,7,7,7,7,7",51d050348e5ad7d53d21a29ccc93a1c1,九 马如飞 不用 鞭 微尘 一道 起 晴川 有司 误谤 为 山贼 好事 俄 传 是 地仙 何处 名楼 风月 爽 谁家 修竹 主人 贤 橐 诗三百 高 无价 难 向旗亭 当 酒钱
232b4c60-12f1-4571-99fc-d4de87035f7a,哭陳鑰主簿,劉克莊,唐,诗,五言律诗,不但心孤介 生形亦怪奇 在为官长骂 没使邑人思 魂远乡犹隔 名微世未知 空存朋友谊 到此力何施,"5,5,5,5,5,5,5,5",e203c4dae153890a4d55e656d1dc8514,不但 心 孤介 生形 亦 怪奇 在 为 官长 骂 没 使 邑 人 思 魂远乡犹隔 名 微 世 未知 空存 朋友 谊 到此力何施
726753d9-b003-441d-a4d1-9adf6ef8fcfc,傅諫議和予所贈傅監倉詩復用前韻一首,劉克莊,唐,诗,七言律诗,谏草如山不论兵 当年出处最分明 中朝安可无耆旧 故事犹应问老更 敢与凤毛评句法 素知牛耳执文盟 诗坛亦合先生筑 遥望偏师已拔营,"7,7,7,7,7,7,7,7",ebab186ccf2fb751ece7542dd5001906,谏 草 如 山 不论 兵 当年 出处 最 分明 中朝安 可 无 耆 旧 故事 犹应 问 老 更 敢 与 凤毛 评 句法 素知 牛耳 执文盟 诗坛 亦 合 先生 筑 遥望 偏师 已 拔营
4face2d8-09ce-494a-9903-7bd8c2a0da4b,宿別瀑上二首  其一,劉克莊,唐,诗,七言绝句,十里荒荆手共开 屐痕历历在青苔 山中猿鸟愁予去 争问先生几日回,"7,7,7,7",e314b46870e077fb0d8fc18a018f67b5,十里 荒荆 手 共 开 屐 痕 历历 在 青苔 山中 猿 鸟 愁 予去 争问 先生 几日 回
60e31916-ba63-4487-b882-d42ffdf9cb87,宿別瀑上二首  其二,劉克莊,唐,诗,七言绝句,两日相疎鄙吝生 今当远别若为情 夜窗看到千峰黑 枕上犹贪落涧声,"7,7,7,7",f6c65fd0a55f1f3b97ced8aec6acfe1f,两日 相 疎 鄙吝 生 今 当 远别 若 为 情 夜窗 看到 千峰 黑 枕上 犹 贪落 涧 声
2c932a42-1954-48fc-8323-e29e68a45fe7,初宿囊山和方雲臺韻一首,劉克莊,唐,诗,七言律诗,客游万里践霜冰 旦旦披衣坐待明 絫黍功名成未易 跳丸岁月去堪惊 即今纸被携寻宿 当日油幢听报更 頼有云台公好事 追程来送老门生,"7,7,7,7,7,7,7,7",fb0679a6691013e517ccf87816d6db97,客游 万里 践 霜 冰 旦旦 披衣 坐待 明 絫 黍 功名 成未易 跳 丸 岁月 去 堪 惊 即 今 纸 被 携 寻宿 当日 油 幢 听 报 更 頼 有 云台 公 好事 追程 来送 老 门生
1c0a8936-6b06-4890-8ea3-4a08da2aaa1c,白鹿寺,劉克莊,唐,诗,七言律诗,岁晚霜林落叶稠 携家来作鹿门游 偈言恍似前生说 诗稾犹烦侍者收 身上征衫抛未得 山中灵药采无由 十年不独行人老 入定高僧白尽头,"7,7,7,7,7,7,7,7",fb0fb88c96ea349caaa00fc75763cd2e,岁 晚霜 林 落叶 稠 携家 来作 鹿门 游 偈 言 恍 似 前生 说 诗 稾 犹 烦 侍者 收 身上 征衫 抛 未 得 山中 灵药 采无 由 十年 不 独行 人 老 入定 高僧 白 尽头
7b7bf7a6-57b5-4e31-ac34-0aeafe116a3d,答婦兄林公遇四首  其一,劉克莊,唐,诗,五言绝句,霜下石桥滑 蛩吟茅店清 梦廻残月在 错认是天明,"5,5,5,5",a63541a87e8eb56eb784f68b078c3d30,霜 下 石桥 滑 蛩 吟 茅店 清 梦 廻 残月 在 错认 是 天明
d670c869-aa69-4cdc-8ddf-c10ac75297dd,答婦兄林公遇四首  其二,劉克莊,唐,诗,五言绝句,恨余行李速 愧子酒杯长 日暮于谁屋 天寒陟彼冈,"5,5,5,5",53e1a8bc73e341b7ccce92b2cde19c0f,恨 余 行李 速 愧 子 酒杯 长 日暮 于 谁 屋 天寒 陟 彼冈
bbb0bb3e-ffaa-406c-ae9b-7736e649495f,答婦兄林公遇四首  其三,劉克莊,唐,诗,五言绝句,自笑如穷鬼 相从不记年 每烦诗饯送 不止办车船,"5,5,5,5",f3d203105568903ad736010a68f8fcf1,自笑如 穷鬼 相 从不 记年 每 烦 诗 饯送 不止 办 车船
48c56ea0-3049-43b9-b427-e8609cfef2a2,答婦兄林公遇四首  其四,劉克莊,唐,诗,五言绝句,挹君如玉雪 未易得亲疎 何日深山里 同灯共读书,"5,5,5,5",27e3372cd3918318194c15343df5918d,挹 君 如玉 雪 未 易得 亲 疎 何日 深山 里 同灯 共 读书
e9847a09-7cd2-4227-8e8a-3f76c2976f82,發枕峰,劉克莊,唐,诗,五言古体,苍头奉辟书 严装犯萧辰 岂不谋出处 岁俭水菽贫 曛黑投山中 明发趋江滨 渔父隠者欤 叶舟方垂缗 相逢飘然逝 似笑来往频 白鸥我同盟 青山吾故人 即之欲与言 邈若不可亲 昔迎归轩喜 今见行橐嗔 素愿怅未谐 抱慙终此身 先贤远志喻 千载犹如新,"5,5,5,5,5,5,5,5,5,5,5,5,5,5,5,5,5,5,5,5",9953629a95924e96091d57e01f466206,苍头 奉辟 书 严 装犯 萧辰 岂不谋 出处 岁 俭 水 菽 贫 曛 黑 投 山中 明发 趋 江滨 渔父 隠 者 欤 叶舟方 垂 缗 相逢 飘然 逝 似 笑 来往 频 白鸥 我 同盟 青山 吾 故人 即之 欲 与 言 邈 若 不可 亲 昔 迎归轩 喜 今 见 行 橐 嗔 素愿 怅未 谐 抱 慙 终 此 身 先贤 远志 喻 千载 犹如 新
bf6eb2fa-011c-44e6-8935-b8e20236e107,嵩溪驛,劉克莊,唐,诗,五言律诗,舟子初辞去 风吹薄酒醒 一茎新鬓白 数点晚山青 潦倒弹长铗 荒凉宿短亭 邻鸡空喔喔 不似昔年听,"5,5,5,5,5,5,5,5",0f42532fd11e3cbc2e5fd9d91c821216,舟子 初 辞去 风吹 薄 酒醒 一 茎 新 鬓 白 数点 晚 山青 潦倒 弹长 铗 荒凉 宿短亭 邻鸡 空 喔 喔 不 似 昔年 听
4bd4886f-ec25-4a27-a4ba-64a82e6e458e,環翠閣,劉克莊,唐,诗,七言绝句,大陆题诗小陆和 宝鞍画戟传呼过 两片顽碑未百年 已有牧儿来打破,"7,7,7,7",f07f140575bc66dce5e732137938aabf,大陆 题诗 小陆 和 宝鞍画 戟 传呼 过 两片 顽 碑 未 百年 已有 牧儿 来 打破
fcdfb720-c83a-412b-814c-333c10f1f2b7,崇化麻沙道中,劉克莊,唐,诗,七言律诗,经行爱此人烟好 面俯清溪背负山 半𦩘何妨呼渡去 小桥不碍负薪还 远闻清磬来林杪 忽有朱栏出竹间 深处安知无隠者 卜邻容我设柴关,"7,7,7,7,7,7,7,7",ad7d98f3325fb45f3180a35aec6e0dbc,经行 爱 此人 烟 好 面 俯 清溪 背负 山 半 𦩘 何妨 呼渡 去 小桥 不 碍 负薪 还 远 闻清磬 来 林 杪 忽 有 朱栏 出 竹间 深处 安知 无 隠 者 卜 邻容 我 设 柴关
f690e642-550b-4214-abc8-865c4ecf0e0b,過劉尚書墓,劉克莊,唐,诗,七言律诗,士林方卜道穷通 一旦骑鲸万事空 帷下有人师董相 墓傍无客哭乔公 白头稍得谈经力 青简尤高绝币功 尚记长衣横麈柄 今看华表立西风,"7,7,7,7,7,7,7,7",229c8f38057fcd45bb2c6458d5ea201a,士林 方卜道 穷通 一旦 骑鲸 万事 空 帷下 有人 师董相 墓 傍 无 客 哭 乔公 白头 稍 得 谈 经力 青简 尤 高 绝币 功 尚记 长衣 横 麈 柄 今 看 华表 立 西风
7b522b4c-059a-483a-a21b-ee984179c086,謝墳,劉克莊,唐,诗,七言绝句,一月山行未有梅 晓来戏著小诗催 谢家坟寺更衣处 初见墙西半树开,"7,7,7,7",fa9740c85d7ade47ad5b8b0ffbb5073d,一月 山行 未有 梅 晓来 戏著 小诗 催 谢家 坟 寺 更衣 处 初见 墙 西半 树 开
b48b2ceb-dff8-4a34-98da-8614b0b29928,大乾記夢,劉克莊,唐,诗,五言绝句,昔梦游湘水 琴书寄叶舟 安知三十载 真作梦中游,"5,5,5,5",fcb1a89d2cc90d8b9fd77910978715d4,昔 梦游 湘水 琴书 寄 叶舟 安知 三十 载 真 作梦 中游
0a016ce7-b94f-4447-8ff6-034405ead8b4,館頭,劉克莊,唐,诗,七言绝句,雨雪萧萧驿堠长 不堪流潦入车箱 抚州城外黄泥路 即是人间小太行,"7,7,7,7",f2864bea8fa66867c02ae6e47ca0c329,雨雪 萧萧 驿 堠 长 不堪 流潦入 车箱 抚州 城外 黄泥 路 即 是 人间 小 太行
5cf65185-a12c-4ff9-b1ae-29b73d511652,發臨川,劉克莊,唐,诗,五言古体,始予丱角来 家君绾铜墨 县斋多休暇 县圃足戏剧 虽云嗜梨栗 亦颇窥简册 弟妹俱孩幼 亲发方如漆 后予捧檄至 轩盖候广陌 于时志气锐 门户况烜赫 郡花照席红 湖柳拂鞍碧 耆老互问讯 酒饩纷狼籍 今予挑包过 城郭宛如昔 高年凋落尽 满眼少朋识 管子仕瘴烟 屈叟掩泉穸 荜门访旧师 目暗面黧黑 买醪与之酌 往事话历历 既生异县感 遂起故乡忆 吾翁墓草深 高堂已斑白 贫居滫髓空 远游温凊隔 二季官海滨 女子各有适 曾不如阿奴 碌碌在母侧 回思盛壮时 去矣复难得 因成临川吟 吟罢泪横臆,"5,5,5,5,5,5,5,5,5,5,5,5,5,5,5,5,5,5,5,5,5,5,5,5,5,5,5,5,5,5,5,5,5,5,5,5,5,5,5,5",f0146cb5dcbd028d74cfcc27d5f0c58c,始 予 丱 角 来 家 君 绾 铜 墨 县 斋 多 休 暇 县 圃 足 戏剧 虽 云 嗜 梨 栗 亦 颇 窥 简册 弟妹 俱孩 幼 亲发方 如 漆 后 予捧 檄至 轩 盖候 广 陌 于时 志气 锐 门户 况 烜 赫 郡花 照席 红 湖 柳 拂 鞍 碧 耆老 互 问讯 酒 饩 纷 狼籍 今 予 挑 包过 城郭 宛如 昔 高 年 凋落 尽 满眼 少 朋识 管子 仕 瘴烟 屈叟 掩 泉 穸 荜 门 访旧 师 目暗 面 黧黑 买 醪与之 酌 往事 话 历历 既生 异县 感 遂 起 故乡 忆 吾 翁 墓 草 深 高堂 已 斑白 贫 居 滫 髓 空 远游 温 凊 隔 二季 官 海滨 女子 各 有 适 曾 不如 阿奴 碌碌 在 母侧 回思 盛壮 时 去 矣 复 难得 因 成 临川 吟 吟 罢 泪横臆
514be988-6d7d-4dca-965f-5b6761f20f32,曾景建自臨川送予至豐城示詩爲別次韻一首,劉克莊,唐,诗,七言律诗,追程送我剑池边 亹亹清谈晋宋前 岂意白头趋幕日 廼逢紫气出关年 夜深续炬俱忘寝 地冷吹薪久未然 临别祝君加帽絮 高峰雪后尚童颠,"7,7,7,7,7,7,7,7",faf6ac5d9528fe518e7a7af9cc81af9f,追程 送 我 剑 池边 亹 亹 清谈 晋宋 前 岂意 白头 趋幕 日 廼 逢 紫气 出关 年 夜深 续炬 俱 忘 寝 地 冷吹薪久 未然 临别 祝君 加帽 絮 高峰 雪 后 尚童 颠
d2c46729-0584-4223-be63-4c9eb206257c,自撫至袁連日雨霰風雪一首,劉克莊,唐,诗,五言古体,穷腊天地闭 云气匝野垂 何况袁抚间 积潦盈路歧 寸晷拔寸步 一堠费一时 忽跌落深淖 有似鸟著𥻿 寒日已西匿 游子方南驰 孤店渺烟际 僮马饥以羸 霏霏雪没骭 憯憯风裂肌 古人贵遗体 不肯临深危 儿行风雪中 慈母安得知 终当投绂去 重补南陔诗,"5,5,5,5,5,5,5,5,5,5,5,5,5,5,5,5,5,5,5,5",f554df237fa890ac893a9a3b66ee5c93,穷 腊 天地 闭 云气 匝野 垂 何况 袁抚间 积潦盈 路歧 寸 晷 拔 寸步 一 堠 费 一时 忽 跌落 深淖 有似 鸟著 𥻿 寒日 已 西匿 游子 方南驰 孤 店 渺 烟际 僮马 饥 以 羸 霏霏 雪没 骭 憯 憯 风 裂 肌 古人 贵 遗体 不肯 临深 危 儿行 风雪 中 慈母 安 得知 终当 投 绂 去 重补 南 陔 诗
44f43e02-9831-4c46-9dd5-d933c7eb5504,安仁驛,劉克莊,唐,诗,七言绝句,偶向溪边洗客尘 数株如玉照青苹 凄风冷雨分宜县 頼有梅花管领人,"7,7,7,7",41ba4d7e80b59b75432a624c0247ff6f,偶向 溪边 洗 客尘 数株 如 玉照 青 苹 凄风冷雨 分宜县 頼 有 梅花 管领 人
98420f0d-14b1-4c91-8b8f-cc56fdcc6b21,萍鄉,劉克莊,唐,诗,五言绝句,闻说萍乡县 家家有绢机 荒年丝价贵 未敢议寒衣,"5,5,5,5",86938d14b9a19e2cf5f0cbf5568a5c75,闻 说 萍乡 县 家家 有 绢 机 荒年 丝价贵 未敢 议 寒衣
77bf4e0a-219c-4828-a4d1-e47ef00b6463,牛田鋪大雪,劉克莊,唐,诗,五言古体,暝色蟠空起 狞飚激地吹 渐看云布濩 稍有霰纷披 蔌蔌初飘瓦 轻轻已点墀 居人朝未觉 客子夜先知 巧似庄严就 匀如剪刻为 充庭冰氏喜 缟户染人疑 洒密苔缄遍 擎多树压垂 高峰迷顶踵 远渡失津涯 窘兔低蹲草 僵禽默堕枝 马难分牝牡 乌不辨雄雌 倏忽斜还整 冥蒙合又离 半埋官路堠 乱打寺廊碑 猛势欺袍絮 寒光照鬓丝 店荒敲尽闭 桥滑步尤危 破釜羹霜菜 残炉燎湿萁 废粧怜妇怯 露骭笑儿痴 乍起毛皆猬 深藏手亦龟 犬惊邻吠急 鸡噤野鸣迟 偏滞南辕路 翻思北戍时 旌旗鸣鴈塞 刁斗乱鹅池 呵笔堪飞檄 收灯可覆棋 暮营蒙虎卧 晓猎臂鹰随 浴铁成何事 披蓑自一奇 空山吟忍冻 穷巷啮充饥 授简悲才退 烘衣感气衰 稍欣茅瘴薄 已觉麦畦滋 病怕村茶冷 愁嫌市酒醨 带间三十韵 聊补昔人遗,"5,5,5,5,5,5,5,5,5,5,5,5,5,5,5,5,5,5,5,5,5,5,5,5,5,5,5,5,5,5,5,5,5,5,5,5,5,5,5,5,5,5,5,5,5,5,5,5,5,5,5,5,5,5,5,5",5ee87fed36e2234ffe8586e7246af8c8,暝 色 蟠 空起 狞飚 激地 吹 渐 看 云 布 濩 稍 有 霰 纷披 蔌 蔌 初 飘 瓦 轻轻 已点 墀 居人 朝 未觉 客 子夜 先知 巧似 庄严 就 匀 如 剪刻 为 充庭 冰氏喜 缟户 染人 疑 洒密 苔 缄 遍 擎 多 树压 垂 高峰 迷 顶踵 远渡 失津涯 窘兔 低 蹲 草 僵禽 默堕枝 马 难分 牝牡 乌 不 辨 雄 雌 倏忽 斜 还 整 冥蒙合 又 离 半 埋 官路 堠 乱打 寺 廊 碑 猛势 欺 袍 絮 寒光 照鬓 丝 店 荒 敲 尽 闭 桥 滑步 尤危 破釜羹霜 菜 残炉 燎 湿 萁 废 粧 怜 妇 怯 露 骭 笑 儿 痴 乍 起毛 皆 猬 深藏 手 亦 龟 犬惊邻吠急 鸡 噤野鸣迟 偏滞 南辕路 翻思 北戍 时 旌旗 鸣 鴈 塞 刁斗 乱 鹅池 呵笔 堪飞 檄 收灯可覆棋 暮 营 蒙虎卧 晓猎 臂 鹰 随 浴铁 成 何事 披蓑自一奇 空山 吟 忍冻 穷巷 啮 充饥 授 简悲 才 退 烘衣 感气 衰 稍 欣茅瘴薄 已觉麦 畦 滋 病 怕 村 茶 冷 愁 嫌 市 酒 醨 带间 三十 韵 聊补 昔人 遗
5a5caa8d-9bd0-43f7-8c72-438813e3b628,醴陵客店,劉克莊,唐,诗,七言律诗,县郭依稀隔渡头 解鞍来倚店家楼 已攀桂树吟招隠 因看梅花赋远游 市上俚音多楚语 桥边碧色是湘流 直南乡国三千里 目送覊鸿起暮愁,"7,7,7,7,7,7,7,7",2cf9e399892861bb57214be7ee5568b6,县 郭 依稀 隔 渡头 解鞍来 倚 店家 楼 已 攀 桂树 吟 招 隠 因 看 梅花 赋 远游 市上 俚音 多楚 语 桥边 碧色 是 湘流 直南乡国 三千里 目送 覊 鸿 起 暮 愁
a7d517bc-8a24-4512-beaf-bcdc73e839dd,湘潭道中即事二首  其一,劉克莊,唐,诗,七言绝句,败絮龙钟拥病身 十分寒事在湘滨 若非野店黏官历 不记今朝是立春,"7,7,7,7",be9f4fafc6e261d2bd5e435974172cb2,败絮 龙钟 拥病 身 十分 寒事 在 湘滨 若非 野店 黏官 历 不记 今朝 是立 春
ff164e40-6798-47cc-919b-246d89fb0551,湘潭道中即事二首  其二,劉克莊,唐,诗,七言绝句,傩鼓冬冬匝庙门 可怜楚俗至今存 屈原章句无人诵 别有山歌侑桂尊,"7,7,7,7",cbc038cfe24d9db4966b947f5e80261c,傩 鼓 冬冬 匝 庙门 可怜 楚俗 至今 存 屈原 章句 无人 诵 别 有 山歌 侑 桂尊
