id,title,author,dynasty,genre,poem_type,sentences_simplified,meter_pattern,hash,words
a11d45f2-7637-4b2e-ab9d-c074bc861fdc,忠烈侯酷好山水作葬书以行于世元翁其族子传其书侍父仕赣上尽得杨氏术凡谈阴阳家者见之辄屈膝余闻其论洒洒然起忘倦矣夫既谓之地理理非儒不精元翁儒者精于理固宜为赋,黎廷瑞,宋,诗,五言古体,英英太极翁 器明吴楚甲 驰辂使沙漠 杖钺帅巴峡 南瞻岭表缩 东睨溟涨狭 林居念环辙 简脱卑藏䇲 夫君玉树彦 同祖宝剑匣 六籍既淹通 异闻更博洽 姬公卜宅洛 成后鼎定郏 理也匪荒唐 古甿遗检柙 支分景纯书 嫡出杨氏法 苍苍鬰孤台 仙枝竹林插 芳春适游衍 千金日娱狎 厚坤行万龙 立特飞次夹 幽幽何绵绵 意脉能擢掐 神文遂尔授 玄镐了然胠 俗师守橐囊 群喙閙凫鸭 青霄孤鹤唳 未吐气先压 蹇予少狂走 黄尘满乌帢 山川子长笔 天地伯伦锸 某丘可以老 白石盟愿歃 祝君昌兹术 四海救贫乏,"5,5,5,5,5,5,5,5,5,5,5,5,5,5,5,5,5,5,5,5,5,5,5,5,5,5,5,5,5,5,5,5,5,5,5,5,5,5,5,5",c621839d9fd07c90a74f073ffd8b20d0,英 英 太极 翁 器明 吴楚 甲 驰 辂 使 沙漠 杖 钺 帅巴峡 南瞻岭 表缩 东 睨 溟 涨 狭 林居念 环辙 简脱 卑藏 䇲 夫君 玉树 彦 同 祖 宝剑 匣 六籍 既 淹通 异闻 更 博洽 姬公 卜宅洛 成后鼎 定 郏 理 也 匪 荒唐 古 甿 遗 检 柙 支分 景纯 书 嫡出 杨氏 法 苍苍 鬰 孤 台 仙枝 竹林 插 芳 春 适游 衍 千金 日 娱 狎 厚坤 行 万龙 立特飞 次 夹 幽幽 何 绵绵 意脉 能 擢 掐 神文遂 尔 授 玄镐 了然 胠 俗师 守 橐 囊 群 喙 閙 凫鸭 青霄 孤 鹤唳 未 吐气 先压 蹇 予少 狂 走 黄尘 满乌 帢 山川 子长 笔 天地 伯伦 锸 某 丘 可以 老 白石 盟愿 歃 祝君 昌兹术 四海 救 贫乏
66b4f5e3-c68d-4331-8c56-2ee0a25b882c,山中夜起月色皎然,黎廷瑞,宋,诗,五言古体,倦寐不知夜 开门风露深 明河挂屋角 月出东山岑 双犊卧啮草 满地梧桐阴 蔌蔌堕落叶 翻翻动栖禽 浮生谅余几 两鬓黄尘侵 偶此值清赏 泠然得初心 幽隠良足尚 吾盟在云林,"5,5,5,5,5,5,5,5,5,5,5,5,5,5",764e030adb0884fdbbad959285886879,倦 寐 不知 夜 开门 风露深 明河 挂 屋角 月 出 东山 岑 双犊 卧 啮草 满地 梧桐 阴 蔌 蔌 堕落 叶 翻翻 动 栖 禽 浮生 谅 余几 两鬓 黄尘 侵 偶此 值清 赏 泠然 得 初心 幽 隠 良 足 尚 吾 盟 在 云林
9ccd550c-bda9-481e-b7c6-6dc571097daa,晚晴欲适西村不果,黎廷瑞,宋,诗,五言古体,雨歇无余春 草木忽而长 东风吹旷野 千里绿莽莽 夕阳澹微明 命策赴幽赏 徘徊石上坐 鬰鬰念畴曩 子规叫重云 意散不复往,"5,5,5,5,5,5,5,5,5,5",0edbba11a0c44c90df61456f0c7bdcfc,雨歇 无余 春 草木 忽而 长 东风 吹 旷野 千里 绿 莽莽 夕阳 澹 微明 命策 赴 幽赏 徘徊 石 上 坐 鬰 鬰 念 畴 曩 子规 叫 重云 意散 不复 往
e05f2081-f889-479f-bfd4-9197b427dbfd,学圃,黎廷瑞,宋,诗,五言古体,西园艺我麻 南园树我桑 东风吹时雨 青青久成行 春服朝犹赊 大布冬可裳 十年湖海役 尘暗貂裘黄 曾无一事成 祇取三迳荒 何如老农圃 卒岁心不忙 邻翁取余喜 笑语倾壶浆 择术子已卜 守之慎勿忘,"5,5,5,5,5,5,5,5,5,5,5,5,5,5,5,5",e79922240272f3b9364e1f321b028496,西 园艺 我 麻 南园 树 我 桑 东风 吹 时 雨 青青 久 成行 春服朝 犹 赊 大布冬 可 裳 十年 湖海 役 尘暗 貂裘 黄 曾 无 一事 成 祇取三 迳 荒 何如 老农 圃 卒岁 心 不忙 邻翁 取余 喜 笑语 倾壶 浆 择术子 已卜 守之慎 勿忘
24093f13-032a-4b9d-84fb-4cbfb6c3b33b,三月二十九日还家花事已过独碧桃盛开,黎廷瑞,宋,诗,五言律诗,出门红未芳 还家绿成幄 仙葩独婉娩 书声共寥落 日暮碧云合 天寒翠袖薄 念远怅悠悠 缑山缈孤鹤,"5,5,5,5,5,5,5,5",46121f0f5a3975ccaf7ce6739e91c5bd,出门 红未芳 还 家绿成幄 仙葩 独婉 娩 书声 共 寥落 日暮 碧云 合 天寒 翠袖 薄 念 远怅 悠悠 缑山 缈 孤鹤
37f0e507-7555-4445-9187-130e02014bd7,九日和陶,黎廷瑞,宋,诗,五言古体,开门见秋山 忻然如故交 烟云淡相媚 卉木青未雕 兹游忽自念 谁与为登高 目涉已千仞 神游还九霄 世短奚足叹 意多亦徒劳 奈何怨迟暮 况复怀覆蕉 至乐岂必酒 天真自陶陶 长吟对寒花 万期犹一朝,"5,5,5,5,5,5,5,5,5,5,5,5,5,5,5,5",a33add7fb5e7bdbf5ef6d4c6e1a6b4da,开门 见 秋 山 忻然 如 故交 烟云 淡 相媚 卉 木青 未 雕 兹 游 忽自 念 谁 与 为 登高 目涉已千仞 神游 还 九霄 世短 奚足 叹 意 多 亦 徒劳 奈何 怨 迟暮 况复怀 覆 蕉 至 乐 岂 必酒 天真 自 陶陶 长吟 对 寒花 万期 犹 一朝
4c12d541-2ec7-4ad5-b115-0ae832eb76f9,春雪,黎廷瑞,宋,诗,五言古体,青神怯春寒 頳紫染未办 临河来素女 剪冰作花瓣 银屏移佛地 玉楼坠仙汉 朽株缴琼瑶 断甓化圭瓒 东风翻覆手 转眼忽吹散 乃知太空中 何物当把玩 开门见青山 且喜还旧观,"5,5,5,5,5,5,5,5,5,5,5,5,5,5",34bab332c9013491921955f31f5fae5b,青神 怯 春寒 頳 紫 染 未办 临河 来 素女 剪冰 作 花瓣 银屏 移 佛地 玉楼 坠 仙 汉 朽株 缴 琼瑶 断 甓 化圭瓒 东风 翻覆 手 转眼 忽 吹散 乃知 太空 中 何物 当 把玩 开门 见 青山 且 喜 还 旧观
2c8171eb-70e1-4d03-be76-d9f1207bf662,我有绿绮琴,黎廷瑞,宋,诗,五言古体,我有绿绮琴 宝匣生蛛丝 拂拭聊一鼓 意淡音愈微 隠几忽自笑 持兹将付谁 所以绝弦者 痛惜无钟期 吾人天与游 岂在知音知 惆怅箫韶远 不见凤来仪 后夔不并世 已矣奚所悲,"5,5,5,5,5,5,5,5,5,5,5,5,5,5",f91f0d08ca1967c4a017ad0d7a5a27d7,我 有 绿 绮琴 宝匣 生 蛛丝 拂拭 聊一鼓 意 淡音 愈微 隠 几 忽 自 笑 持 兹将 付 谁 所以 绝弦者 痛惜 无钟 期 吾人 天 与 游 岂 在 知音 知 惆怅 箫 韶远 不见 凤来仪 后 夔 不 并 世 已 矣 奚 所 悲
fe47f9af-7b63-4d5b-8958-86ce166715e2,赠初心相士,黎廷瑞,宋,诗,五言古体,王识九江黥 侯许平阳奴 臭奇恒互出 冠屦奄相逾 此说偶奇验 人人生妄图 曷不返吾照 湛然观本初 天地付我形 森列万理俱 形拘有枯菀 理充无智愚 涂人可以禹 为善即舜徒 奈何遗此心 豢此尺寸肤 君颛唐举术 乃取荀卿书 论心不论形 名象足启余 宇宙共一轨 纷纷落迷涂 愿言述吾语 一呼旋其车,"5,5,5,5,5,5,5,5,5,5,5,5,5,5,5,5,5,5,5,5,5,5,5,5",f372ff9c93132ad77b08864767cc01ad,王识 九江 黥 侯许 平阳 奴 臭 奇 恒 互出 冠 屦 奄相逾 此说 偶 奇验 人 人生 妄图 曷 不 返 吾 照 湛然 观 本初 天地 付 我 形 森列 万理 俱 形拘 有 枯 菀 理充 无 智愚 涂人 可以 禹 为善 即 舜 徒 奈何 遗 此 心 豢 此 尺寸 肤 君 颛 唐 举术 乃取 荀卿 书 论心 不论 形 名象 足启 余 宇宙 共 一 轨 纷纷 落 迷涂 愿 言 述 吾 语 一 呼旋 其车
9ec0a703-123f-44bc-8799-110f727b27b1,泊三江口,黎廷瑞,宋,诗,五言古体,潮寒闻雁声 野霁见虎迹 眼中无故人 莽莽欲谁适 当年此防秋 筑垒如铁壁 哀哉不崇朝 遽此陵谷易 土道蚀残砖 沙草埋折戟 林墟稍亦集 农亩犹未辟 人心嗜新乐 畴复念曩昔 亭亭千尺塔 独立苍烟碧 稽首塔中仙 此心如铁石,"5,5,5,5,5,5,5,5,5,5,5,5,5,5,5,5,5,5",c3504788455efd8e2e26201f99d25f1a,潮寒 闻雁声 野霁见虎迹 眼中 无故人 莽莽 欲 谁 适 当年 此 防秋 筑 垒 如 铁壁 哀哉 不崇 朝 遽此 陵 谷易 土道 蚀 残 砖 沙草 埋 折戟 林墟 稍 亦 集 农亩 犹 未 辟 人心 嗜 新乐 畴 复念 曩 昔 亭亭 千尺 塔 独立 苍烟碧 稽首 塔中 仙 此 心如铁石
0a215ba7-3eb1-47a4-a125-257711d8ce6e,泊雷江口,黎廷瑞,宋,诗,五言古体,解缆风雨息 傍晚复大吼 浪如雪山来 船作骑马走 鱼龙欲作势 问予惊怖否 那知狂书生 有胆大如斗 庄周论天地 我见仅如缶 可怜一勺多 浩荡夸己有 大方付一笑 河伯亦俯首 天开镜面平 荡桨泊江口 新月照船窗 烹鱼酝我酒,"5,5,5,5,5,5,5,5,5,5,5,5,5,5,5,5,5,5",b6bfdfdb71f306597a297fb4de9f173d,解缆 风雨 息 傍晚 复大 吼 浪 如 雪山 来 船作 骑马 走 鱼龙 欲 作势 问予 惊怖 否 那 知狂 书生 有 胆 大如斗 庄周 论 天地 我 见 仅 如 缶 可怜 一勺 多 浩荡 夸 己 有 大方 付一笑 河伯 亦 俯首 天开 镜面 平 荡 桨 泊 江口 新月 照船 窗 烹鱼 酝我 酒
252d9948-9fb3-46d9-ab89-8cbaa3fcc5b6,虎溪三笑图,黎廷瑞,宋,诗,五言古体,阴壁掺苦竹 秋池淡芙蓉 二老庐山间 风味夙昔同 亦有栗里人 心事黄花丛 囊中无一钱 眼底四海空 羲皇未渠惬 上与无怀通 众羽集新条 云霄一冥鸿 净社亦可人 念尔名教宗 博酒空勤渠 攒眉一声钟 苍苔片石在 醉卧空山中 良辰入奇怀 杖屦闲相从 偶然出岫云 儵尔风飘蓬 虎溪有严禁 讵敢待此翁 行行不知远 大笑分西东 风流一时散 千载留高踪 溪光与山色 隠隠尚笑容 笑意果何如 画史安能穷 按图付一嘿 翳景生长松,"5,5,5,5,5,5,5,5,5,5,5,5,5,5,5,5,5,5,5,5,5,5,5,5,5,5,5,5,5,5,5,5,5,5",879bdeb161318c968147c4b1ee28a238,阴壁 掺 苦竹 秋池 淡 芙蓉 二老 庐山 间 风味 夙昔 同 亦 有 栗里人 心事 黄 花丛 囊中 无 一 钱 眼底 四海 空 羲 皇 未 渠 惬 上 与 无怀 通 众羽 集新 条 云霄 一 冥 鸿 净 社 亦可 人 念尔 名教 宗 博酒 空勤 渠 攒眉 一声 钟 苍苔 片石 在 醉卧 空山 中 良辰 入奇 怀 杖 屦 闲 相 从 偶然 出 岫云 儵 尔 风 飘蓬 虎溪 有 严禁 讵 敢 待 此 翁 行 行 不知 远 大笑 分 西东 风流 一时 散 千载 留高 踪 溪光 与 山色 隠 隠 尚 笑容 笑意 果 何如 画史 安能 穷 按 图付 一 嘿 翳 景 生长 松
b17d1c2b-9eb7-4bf4-b0c6-0da96d0c0a40,避暑招真观听琴,黎廷瑞,宋,诗,五言古体,驱车畏火伞 投扇倦风箑 起行青松径 往就白云榻 窈窕一壑深 苍苍两崖夹 玄菟狞爪齿 白龙老鳞甲 竹树拥青掺 花草霭丛杂 渺沫洒空岩 冷飚下危峡 始知忘解带 久坐思御裌 丹丘逢羽人 瑶琴开宝匣 古意鬰苍茫 秋风淡萧飒 悲蝉为噫吟 鸣鹤相和答 岁华坐晼晚 尘路嗟隘狭 飞仙倘来归 遗我度世法,"5,5,5,5,5,5,5,5,5,5,5,5,5,5,5,5,5,5,5,5,5,5,5,5",fd2c1e2ca05951397da03e2104579171,驱车 畏 火伞 投扇 倦 风 箑 起 行 青松 径 往 就 白云 榻 窈窕 一 壑 深 苍苍 两 崖 夹 玄菟 狞 爪 齿 白龙 老 鳞甲 竹树 拥青 掺 花草 霭 丛杂 渺沫洒空 岩 冷飚 下 危峡 始知 忘解 带 久坐 思 御 裌 丹丘 逢 羽 人 瑶琴 开 宝匣 古意 鬰 苍茫 秋风 淡 萧飒 悲蝉为 噫 吟 鸣鹤相 和 答 岁 华 坐 晼 晚 尘 路嗟 隘 狭 飞仙 倘来 归 遗我度 世法
922b6b63-ac29-409d-8497-f3ae4aacf74b,南北舟,黎廷瑞,宋,诗,七言古体,东流滔滔江似箭 南船挂帆北船羡 阴云黯黯天色变 北船搥鼓南船怨 焚香酿酒争祝愿 一望风长一祈转 世间万事无两便 龙伯应酬毋乃倦 龙伯应酬如已倦 祇遣澄江净如练,"7,7,7,7,7,7,7,7,7,7",fb1426a1c86083a893f322383de10dd6,东流 滔滔 江 似 箭 南船 挂帆 北船 羡 阴云 黯黯 天色 变 北 船 搥 鼓 南 船 怨 焚香 酿酒 争 祝愿 一 望风 长 一 祈转 世间 万事 无两 便 龙伯 应酬 毋乃 倦 龙伯 应酬 如 已 倦 祇 遣 澄江 净 如 练
135e993f-9a19-4f92-8c46-68766310b05e,二陶,黎廷瑞,宋,诗,七言律诗,清言洒洒南华玄 净社济济东林禅 一陶运甓不挥麈 一陶采菊不种莲 爱惜分阴树志业 盘礴千载希圣贤 吾评东晋人物薮 惟有二陶真卓然,"7,7,7,7,7,7,7,7",2f6ce81f8e40de3b4da9bf5980889971,清言 洒洒 南华 玄 净 社 济济 东林 禅 一 陶运 甓 不 挥 麈 一 陶采菊 不种 莲 爱惜 分阴 树 志业 盘礴 千载 希 圣贤 吾 评 东晋 人物 薮 惟有 二陶 真 卓然
c1b882cc-6a22-4292-b08d-8a85f05d7247,饮芝山分韵得草字,黎廷瑞,宋,诗,七言律诗,漠漠轻阴送幽讨 梅柳之间春正好 万古烧痕青未了 一片湖光白如扫 永怀雨露涵三秀 颇恨风尘遮五老 松根啸咏欲忘归 可惜长瓶卧芳草,"7,7,7,7,7,7,7,7",b75d222a9ac1b72acc009b0f5186bf40,漠漠 轻 阴 送 幽讨 梅柳 之间 春 正好 万古 烧痕 青未了 一片 湖光 白 如 扫 永怀 雨露 涵三秀 颇 恨 风尘 遮 五 老 松根 啸咏 欲 忘归 可惜 长 瓶 卧 芳草
6406ad97-fde2-4668-b7d2-17f32d4a87c9,探梅,黎廷瑞,宋,诗,七言古体,山中岁晚甘恬澹 花史时时闻校勘 天街未省薇药贵 尘世颇嫌桃李滥 南枝相见眼独明 东风久要交非暂 长意孤山访突兀 径度平湖浮碧绀 暗香疏影夜蒙蒙 半树横枝春淡淡 琥珀浓倾酒拍船 珠玑乱唾诗成担 画角吹寒凄别语 青衣天晚生孤憾,"7,7,7,7,7,7,7,7,7,7,7,7,7,7",cea0d24159591cf59fd0d25e1b8bb307,山中 岁晚 甘恬 澹 花史 时时 闻 校勘 天街 未 省 薇 药 贵 尘世 颇 嫌 桃李 滥 南枝 相见 眼 独明 东风 久 要 交非 暂 长意 孤山 访 突兀 径度 平湖 浮 碧 绀 暗香疏影 夜 蒙蒙 半树横枝春 淡淡 琥珀 浓 倾酒 拍船 珠玑 乱 唾 诗 成担 画角 吹寒 凄别 语 青衣 天 晚生 孤憾
cd2ff0c2-e74e-4ee6-aa9c-3fc77a20f2bb,偕仲退周南翁登曲岛山分韵得曲字,黎廷瑞,宋,诗,七言古体,吴子精悍锦满腹 周郎英妙人如玉 凌晨樽酒惜分携 飞鞚联翩相趁逐 积雨新晴马气骄 振鬣长鸣踏平陆 村南村北枫叶赤 高田低田麦苗绿 坡陀磊落如培𪣻 一岛轩然立于独 平生梦寐千仞冈 第取惬心那计足 迢迢鸟道入青天 杳杳钟声出乔木 遥观疑雪复疑石 稍动始知樵与牧 传闻隋代高隠君 避世曾兹结茅屋 李菀杨枯了不闻 坐拥玉书林下读 灵君冠剑从飞龙 云雨苍茫手翻覆 瓢中但出是丰年 何惜穿崖悬一瀑 毳虫自得餐松诀 一扫四山寒翠秃 天根突兀有孤梅 道气昂藏自修竹 回看下界暗黄尘 蚁垤蜂房几陵谷 山空鸟啼尘虑绝 天寒日暮归心速 会当摆落悠悠谈 八极神游纵吾目 玉井莲花十丈开 瑶池桃子千年熟 廓然天地臯方圆 岂但山川见纡曲 已呼鸾凰作先导 岁晚期君两黄鹄,"7,7,7,7,7,7,7,7,7,7,7,7,7,7,7,7,7,7,7,7,7,7,7,7,7,7,7,7,7,7,7,7,7,7,7,7,7,7,7,7",8315f251844eb37318b1d4d634f9a283,吴子 精悍 锦 满腹 周郎英 妙 人 如玉 凌晨 樽 酒 惜 分 携 飞 鞚 联翩 相 趁 逐 积雨 新 晴 马气 骄 振 鬣 长鸣 踏平 陆 村 南村 北 枫叶 赤 高 田 低 田 麦苗 绿 坡陀 磊落 如 培 𪣻 一 岛 轩然 立于 独 平生 梦寐 千仞 冈 第 取 惬心 那 计足 迢迢 鸟道 入 青天 杳 杳 钟声 出 乔木 遥观 疑雪 复疑 石 稍 动始 知樵 与 牧 传闻 隋代 高 隠 君 避世 曾兹 结 茅屋 李菀杨 枯 了 不 闻 坐拥 玉 书林 下读 灵君冠剑 从 飞龙 云雨 苍茫 手 翻覆 瓢 中 但 出 是 丰年 何惜 穿 崖 悬 一 瀑 毳 虫 自得 餐松 诀 一 扫 四山 寒 翠秃 天根 突兀 有 孤梅 道气 昂藏 自修 竹 回看 下界 暗 黄尘 蚁 垤 蜂房 几陵谷 山空 鸟啼 尘虑绝 天寒 日暮 归心 速 会 当 摆落 悠悠 谈 八极 神游 纵 吾 目 玉井 莲花 十丈 开 瑶池 桃子 千年 熟 廓然 天地 臯 方圆 岂但 山川 见 纡 曲 已 呼 鸾 凰 作 先导 岁 晚期 君 两 黄 鹄
dc463a09-b34a-4975-b7c6-66dc504e6ea5,甲午孟夏祝公辅道过山中遂偕如上饶赴孟史君之约至万村阻水卧楼上共谈己丑同舟雁汊遇风之苦明日水退途中得长句呈公辅,黎廷瑞,宋,诗,七言古体,南山有田不归种 大瓠濩落无所用 遂令沉沉走长江 万里艰危忆君共 尝疑公佩延平剑 引得九渊龙子哄 雁汊渡头鏖北风 真是脱身人鲊瓮 当时意气杯溟渤 笑杀篙师穷欲恸 千金之子不垂堂 默坐沉思还自痛 归来结屋万山中 手植桃花欲成洞 敲门者谁吾故人 色笔荧荧如彩凤 连宵剧谈山月落 一浣胸中尘土空 忻然共驾赴幽期 满路薰风入吟讽 万村孤馆明且洁 浴罢桃笙玉壶冻 神君谒帝愁昼热 夜半骑𬳮不施鞚 偷决银河灌火轮 玄化阴机神簸弄 小溪如线不自容 更奈乱流趋者众 划尔掀波似转雷 居然入室如流汞 须臾便恐化桑田 咫尺还忧没茅栋 绝怜榻上閙蛙黾 安得天边明䗖𬟽 午楼欹枕听涛声 唤醒六年淮海梦 青山淡淡坐神驰 白鹭悠悠空目送 明朝水退得新晴 两鸟故应天所纵 乃知处险自有道 一静可以该百动 横石断桥沙迳曲 苍藤翠木烟霏重 小车穿壁我徐行 瘦蹇涉流君自控 狂游满眼惊俗辈 疲役回头惭仆从 倩谁写作山行图 持似衡湖作清供,"7,7,7,7,7,7,7,7,7,7,7,7,7,7,7,7,7,7,7,7,7,7,7,7,7,7,7,7,7,7,7,7,7,7,7,7,7,7,7,7,7,7,7,7,7,7,7,7,7,7",450ea51580fb95c8ec98facefb108673,南山 有 田 不 归 种 大 瓠 濩 落 无 所用 遂 令 沉沉 走 长江 万里 艰危 忆君 共 尝疑 公佩 延平 剑 引得 九渊 龙子 哄 雁汊 渡头 鏖 北风 真是 脱身 人 鲊 瓮 当时 意气 杯 溟 渤 笑 杀 篙 师 穷 欲 恸 千金之子 不 垂 堂 默坐 沉思 还 自痛 归来 结屋 万山 中 手植 桃花 欲 成 洞 敲门 者 谁 吾 故人 色笔 荧荧 如 彩 凤 连宵 剧谈山 月 落 一 浣 胸中 尘土 空 忻然 共 驾 赴 幽期 满路 薰风 入吟 讽 万 村 孤 馆明 且 洁 浴 罢 桃 笙 玉壶 冻 神君谒帝 愁 昼热 夜半 骑 𬳮 不 施 鞚 偷决 银河 灌 火轮 玄化阴 机神 簸弄 小溪 如 线 不自 容 更奈 乱流 趋者 众 划 尔 掀 波 似 转雷 居然 入室 如 流 汞 须臾 便 恐化 桑田 咫尺 还 忧没茅栋 绝怜 榻 上 閙 蛙 黾 安 得 天边 明 䗖 𬟽 午 楼 欹 枕 听 涛声 唤醒 六年 淮海 梦 青山 淡淡 坐 神驰 白鹭 悠悠 空 目送 明朝 水 退 得 新 晴 两 鸟 故 应天 所纵 乃知 处险 自有 道 一静 可以 该 百动 横石 断桥 沙 迳 曲 苍藤翠 木 烟霏 重 小车 穿 壁 我 徐行 瘦 蹇 涉 流 君 自控 狂游 满眼 惊俗 辈 疲役 回头 惭 仆从 倩 谁 写作 山行图 持似 衡湖 作清 供
a168e00c-c346-4f44-8615-70d0213bfb1c,有邀余游中原者余以亲老辞王子贤未知来饯别并示所和陈君人生贵适意五诗敬次韵奉谢  其一,黎廷瑞,宋,诗,七言律诗,有客六辔濡且均 要我共看中都春 孔林乔木故无恙 首阳高风应未泯 亦知江山不负我 政恐风尘能涴人 故友贻书复相过 但祝自爱千金身,"7,7,7,7,7,7,7,7",2a15a8fae05522d34c1beeeed49c572b,有 客 六辔濡且均 要 我 共 看中 都 春 孔林 乔木 故 无恙 首 阳高 风应 未泯 亦 知 江山 不负 我 政恐 风尘 能 涴 人 故友 贻书 复 相过 但 祝 自爱 千金 身
6a7ec063-cff0-4acb-b689-a013097883c3,有邀余游中原者余以亲老辞王子贤未知来饯别并示所和陈君人生贵适意五诗敬次韵奉谢  其二,黎廷瑞,宋,诗,七言律诗,飞电歘然度天隙 百岁能堪几行役 游子来归意恐迟 大人幸在何辞白 风涛念尔去何之 日暮怜渠行故逆 世间步步是危机 绵上可耕聊自适,"7,7,7,7,7,7,7,7",d37a3ab75e6fb1d91ce31883ccc1a13e,飞电 歘 然 度 天 隙 百岁 能堪 几行 役 游子 来 归意 恐迟 大人 幸 在 何 辞白 风涛念尔去何 之 日暮 怜渠行故逆 世间 步步 是 危机 绵上可耕聊 自适
0193363e-e258-4480-9292-70b46c2e1edd,赠姜卜隠,黎廷瑞,宋,诗,七言古体,君家鼻祖磻溪钓 何人为卜非熊兆 君是磻溪几代孙 无人卜君君卜人 自言避世归人境 焚香下帘清昼永 岂无龙韬老渭滨 英雄自昔多沉沦 倘有猎者从君卜 但说后车富狐兔,"7,7,7,7,7,7,7,7,7,7",982ca0f8121359351147f3091d2dd8ba,君家 鼻祖 磻溪 钓 何人 为 卜非 熊兆 君 是 磻溪 几代 孙 无人 卜君君 卜 人 自言 避世 归 人境 焚香 下帘 清昼 永 岂无龙 韬老 渭滨 英雄 自 昔 多 沉沦 倘 有 猎者 从君卜 但说 后车 富狐 兔
c8506e1c-a0b8-4b5f-bf1c-094410d0a464,丙申上元喜晴孤坐怀旧二十韵,黎廷瑞,宋,诗,七言古体,少年意气凌嵩华 尚记京城逢午夜 璧月琼枝彩凤飞 银花铁锁金鳌跨 楼台上下沸笙韶 巷陌东西暗兰麝 樗蒲百万不供掷 美酒十千宁论价 狂游但恐星河曙 醉卧不知风露下 悠悠人世半悲欢 忽忽天时更代谢 蚁国惊心城郭非 蜃楼转眼烟云化 微生幸尔脱干戈 暮年聊此依桑柘 每当佳节强逢迎 忽思往事还惊咤 新年半月雨不止 此夕一晴天所借 草市冬冬村鼓閙 竹簷烂烂华灯挂 颠狂社舞喧戏剧 落魄儒冠寄嘲骂 亦知陋俗多浮薄 尚喜疲甿少闲暇 先生清坐懒出门 诸少并游惟守舍 虽无画烛千炬围 犹有残梅一枝亚 孤灯隠隠耿相照 疏影离离淡如画 划尔喧风扑短檠 炯然霁月明虚榭 百念无营冷似灰 一闲有味甘如蔗 已拚暮境渔樵侣 独忆平生诗酒社 白云霭霭隔江山 可惜无人谈旧话,"7,7,7,7,7,7,7,7,7,7,7,7,7,7,7,7,7,7,7,7,7,7,7,7,7,7,7,7,7,7,7,7,7,7,7,7,7,7,7,7",bbd1125466ab66386176ca946f2af7f0,少年 意气 凌嵩华 尚记 京城 逢 午夜 璧月 琼枝彩 凤飞 银花 铁锁 金鳌 跨 楼台 上下 沸笙 韶 巷陌 东西 暗兰 麝 樗蒲 百万 不供 掷 美酒 十千 宁 论价 狂游 但 恐 星河 曙 醉卧 不知 风露 下 悠悠 人世 半 悲欢 忽忽 天时 更 代谢 蚁国 惊心 城郭 非 蜃楼 转眼 烟云 化 微生 幸尔脱 干戈 暮年 聊 此 依 桑柘 每当 佳节 强 逢迎 忽思 往事 还 惊咤 新年 半月 雨 不止 此夕 一 晴天 所 借 草市 冬冬 村 鼓 閙 竹簷 烂烂 华灯 挂 颠狂 社舞 喧 戏剧 落魄 儒冠 寄 嘲骂 亦 知 陋俗 多 浮薄 尚喜 疲 甿 少 闲暇 先生 清 坐 懒 出门 诸少 并 游惟守舍 虽 无画烛千炬 围 犹有 残梅 一枝 亚 孤灯 隠 隠 耿 相 照 疏影 离离 淡 如 画 划 尔 喧 风 扑 短 檠 炯然 霁月 明虚榭 百念 无营 冷似 灰 一闲有味 甘如 蔗 已 拚 暮境 渔樵 侣 独忆 平生 诗酒 社 白云 霭霭 隔 江山 可惜 无人 谈 旧 话
9e4c7735-d663-4a38-859b-5632c78edcbf,乌沙夹阻风,黎廷瑞,宋,诗,七言古体,黄沙满江日色薄 北风吹天云欲落 鱼龙贾勇气凌人 八月海风无此恶 书生性命可轻试 拏舟早傍沙湾泊 嵯峨万里下水船 搥鼓张帆无奈乐 篙师瘦坐攒两眉 羡彼何速嗟我迟 玄冥行权故应尔 速何足喜迟何悲 一年三百六十日 须有一日顺风时 乘流遇坎姑听之 涛山雪屋方堪诗,"7,7,7,7,7,7,7,7,7,7,7,7,7,7,7,7",1779580fdd9947a61681e05f610b61ff,黄沙 满江 日 色 薄 北风吹 天云欲落 鱼龙 贾 勇气 凌人 八月 海风 无此 恶 书生 性命 可轻 试 拏 舟 早 傍 沙湾 泊 嵯峨 万里 下水船 搥 鼓 张 帆 无奈 乐 篙 师 瘦 坐 攒 两 眉 羡 彼 何速 嗟我迟 玄冥 行权 故 应尔 速何足喜迟 何悲 一年 三百六十日 须 有 一日 顺风 时 乘流 遇 坎 姑 听 之 涛 山 雪屋 方堪 诗
dfffc688-723b-4793-ab8a-edb051c22c74,春锄行,黎廷瑞,宋,诗,七言律诗,有鸟有鸟鸣春锄 雪衣楚楚清且癯 茫然跂立奚所须 蹄涔之中伺游鱼 游鱼所得能几何 鸬鹚同俦失已多 若非区区营一饱 如此风标岂不好,"7,7,7,7,7,7,7,7",46cf6a4c8fdcada66d3a8216e70d8686,有 鸟 有 鸟鸣 春 锄 雪衣 楚楚 清 且 癯 茫然 跂 立 奚 所 须 蹄 涔 之中 伺 游鱼 游鱼 所得 能 几何 鸬鹚 同 俦 失 已多 若非 区区 营一 饱 如此 风标 岂 不好
ae9082db-0042-4f0c-b176-7bd59ea3fc06,彭蠡阻风,黎廷瑞,宋,诗,七言古体,玄云如垒沙如箭 阳侯击鼓飞廉扇 穹龟带甲鱼负剑 万怪腾空助龙战 庐君玉立金芙蓉 笑我块坐如樊笼 子胡不来此山中 与子跨鹤蓬莱宫 江流茫茫去不息 嗟我棹往何终极 灵君如愿倘可乞 但觅金丹生羽翼,"7,7,7,7,7,7,7,7,7,7,7,7",ba90d42a18c37f204f1602c22348c331,玄云 如 垒 沙 如 箭 阳侯 击鼓 飞廉 扇 穹龟 带 甲鱼 负剑 万 怪 腾空 助 龙战 庐君 玉立 金 芙蓉 笑 我块 坐如 樊笼 子胡 不来此 山中 与 子 跨 鹤 蓬莱 宫 江流 茫茫 去 不息 嗟我 棹 往 何 终极 灵君 如愿 倘 可乞 但 觅 金丹 生 羽翼
73755ef4-6575-4a6d-a472-ae7aca0d0899,壬戌正旦日蚀值阴有诗明日雨微雪再赋,黎廷瑞,宋,诗,七言古体,艳娥煽妖悖且饕 云师围之骑周遭 飞廉喑呜挟箭号 万鼓动地助战鏖 吴刚弃斧北且逃 扶桑君还骑巨鳌 银蜍腹聚流清膏 玉兔颡折飞白毛 苍茫杀气横四郊 冻鸢无语饥鸿嗷 紫皇第功封二豪 汝马可归弓可櫜 黄道肃穆君请遨 黔首颙颙光勿韬 愿驾丹毂扬锦旄 疾驱六龙升海涛 五色烂烂中天高 衣披水子绛锦袍 葵心不宁忧忉忉 矫首东方歌楚骚,"7,7,7,7,7,7,7,7,7,7,7,7,7,7,7,7,7,7,7,7",bddcb339b1de8f9f43e78291131949b6,艳娥 煽妖 悖 且 饕 云师围 之 骑 周遭 飞廉喑 呜挟 箭号 万 鼓动 地 助战 鏖 吴刚 弃 斧 北 且 逃 扶桑 君 还 骑 巨 鳌 银蜍 腹聚流 清膏 玉兔 颡 折 飞 白毛 苍茫 杀气 横 四郊 冻 鸢 无语饥鸿嗷 紫皇第 功 封二 豪 汝马 可归 弓 可 櫜 黄道 肃穆 君 请 遨 黔首 颙颙光勿韬 愿 驾 丹 毂 扬 锦 旄 疾驱 六 龙 升 海涛 五色 烂烂 中天 高 衣披 水子 绛 锦袍 葵心 不宁 忧 忉 忉 矫 首 东方 歌楚骚
