id,title,author,dynasty,genre,poem_type,sentences_simplified,meter_pattern,hash,words
13b1b26e-21d7-47a4-a90a-1c050ce5f705,送少年禪師二首 一,貫休,唐,诗,七言绝句,秀眉青目树花衣 一钵随缘智不知 佛与轮王嫌不作 世间刚有个痴儿,"7,7,7,7",1bcb37a3c2b5d4a721706113769df3f0,秀眉 青目 树 花衣 一 钵 随缘 智 不知 佛 与 轮王 嫌 不作 世间 刚 有 个 痴儿
4568800d-6951-4c00-a1fc-98a9c28f4c5d,送少年禪師二首 二,貫休,唐,诗,七言绝句,万水千山一鹤飞 岂愁游子暮何之 古今此著无人会 王积新输更不疑,"7,7,7,7",90ccf2638dd6ed97bc6dddba27732a6d,万水千山 一 鹤 飞 岂 愁 游子 暮何之 古今 此 著 无人 会 王积新 输 更 不疑
4b249508-0611-4674-86bb-7ea073dabd98,古劒池,貫休,唐,诗,七言绝句,秋水莲花三四枝 我来慷慨步迟迟 不决浮云斩邪佞 真成龙去拟何为,"7,7,7,7",841bd09342bc41b01ccca1fb4ceb05b1,秋水 莲花 三 四枝 我 来 慷慨 步 迟迟 不决 浮云 斩 邪佞 真 成龙 去 拟 何为
bead3a53-0606-4b5e-827a-35daa5f40fa8,曹娥碑,貫休,唐,诗,七言绝句,高碑说尔孝应难 弹指端思白浪间 堪叹行人不回首 前山应是苎萝山,"7,7,7,7",727e7fc3c222629e7751eda98cbf1066,高 碑 说 尔 孝 应 难 弹指 端思 白浪 间 堪叹 行人 不 回首 前山 应 是 苎萝山
a1fcc4c3-a0c9-41f5-bb28-889e9ab1aa29,比干傳,貫休,唐,诗,七言绝句,昏王亡国岂堪陈 只见明诚不见身 想得先生也知自 欲将留与后来人,"7,7,7,7",08d7ebd3e6a9a51791c0595bbbe0d2a7,昏 王 亡国 岂堪陈 只见 明诚 不见 身 想 得 先生 也 知自 欲 将 留 与 后来 人
c9474027-c994-4c16-a569-e1ecbcea2769,送人遊茆山,貫休,唐,诗,七言绝句,鸟啼花笑煖纷纷 路入青云白石门 君到前头好看好 老僧或恐是茆君,"7,7,7,7",d47c2400a08db8b793fa0f3501f3ee36,鸟啼 花 笑 煖 纷纷 路入 青云 白石 门 君 到 前头 好看 好 老僧 或 恐 是 茆 君
b67d1517-f383-45b5-bfe4-3867ef9d26b4,聞杜宇,貫休,唐,诗,七言绝句,咽雨哀风更不停 春光于尔岂无情 宜须唤得谢豹出 方始年年无此声,"7,7,7,7",8ce080576305317be60e4a05df985716,咽 雨哀风 更 不停 春光 于尔 岂 无情 宜 须 唤 得 谢豹 出 方始 年 年 无此 声
2eefe0f8-ef53-45d1-9bf4-43935fd784f9,聽曉角,貫休,唐,诗,七言绝句,三会单于满阁风 五行无忒月朦胧 如何十万家休戚 只在呜呜咽咽中,"7,7,7,7",544de2b7918b934e09c062852ba79748,三 会 单于 满阁 风 五行 无 忒 月 朦胧 如何 十万家 休戚 只 在 呜呜咽咽 中
d9aa6ac4-66cc-4d19-9a12-061b8580c342,宿赤松山觀題道人水閣兼寄郡守,貫休,唐,诗,七言律诗,珠殿香𫐌倚翠棱 寒栖吾道寄孙登 岂应肘后终无分 见说仙中亦有僧 云敛石泉飞险窦 月明山鼠下枯藤 还如华顶清谈夜 因有新诗寄郑弘,"7,7,7,7,7,7,7,7",d5f52527d4ae148adbe5ff51a84c1b13,珠殿 香 𫐌 倚 翠 棱 寒栖吾 道 寄 孙登 岂 应 肘 后 终 无分 见 说 仙 中 亦 有 僧 云敛 石泉 飞险 窦 月 明 山鼠 下 枯藤 还 如 华顶 清谈 夜 因有 新诗 寄 郑弘
bef28a93-ce6b-4710-859f-b00747c763a2,春遊涼泉寺,貫休,唐,诗,杂言,一到凉泉未拟归 迸珠喷玉落阶 墀 几多僧祗因泉在 无限松如泼墨为 云堑含香啼鸟细 茗瓯擎乳落花迟 青山看著不可上 多病多慵争奈伊,"7,6,1,7,7,7,7,7,7",562ff5959a66ed1143d30e25377ad6d6,一 到 凉泉 未 拟 归 迸 珠喷 玉落 阶 墀 几多 僧祗 因泉 在 无限 松如 泼墨 为 云堑 含香啼 鸟细 茗 瓯 擎 乳 落花 迟 青山 看著 不可 上 多 病 多 慵 争 奈 伊
ff0a8bd0-7d58-4239-b835-867b5c0f235c,經吳宮,貫休,唐,诗,七言律诗,夫差昏暗霸图倾 千古凄凉地不灵 妖艳恩余宫露浊 忠臣心苦海山青 萧条陵陇侵寒水 仿佛楼台出杳冥 此是前车况非远 六朝何更不惺惺,"7,7,7,7,7,7,7,7",e5bd6faa7483c677bf51d24c31d02aad,夫差 昏暗 霸图 倾 千古 凄凉 地 不灵 妖艳 恩余宫 露 浊 忠臣 心 苦海 山青 萧条 陵 陇 侵 寒 水 仿佛 楼台 出 杳 冥 此 是 前 车况 非远 六朝 何 更 不 惺惺
7c9ec1bf-b9a9-4f1b-a95e-e6990821b1d6,送薛侍郎貶峽州司馬,貫休,唐,诗,七言律诗,得罪唯惊恩未酬 夷陵山谁称闲游 人知八凯须当国 猨到三声不用愁 花落扁舟香冉冉 草侵公署雨修修 因人好寄新诗好 不独江东有沃州,"7,7,7,7,7,7,7,7",ae20c2886719413eac575a6cf423adf7,得罪 唯惊恩未酬 夷陵 山 谁 称 闲游 人知 八 凯 须 当 国 猨 到 三声 不用 愁 花落 扁舟 香 冉冉 草 侵 公署 雨 修修 因 人 好 寄 新诗 好 不独 江东 有 沃州
d54aba44-4de7-4479-9938-44fe131616c1,將入匡山宿韓判官宅,貫休,唐,诗,七言律诗,一宿兰堂接上才 白云归去几裴回 黛青峰朵孤吟后 雪白猨儿必寄来 帘卷茶烟萦堕叶 月明棋子落深苔 明朝江上空回首 始觉清风不可陪,"7,7,7,7,7,7,7,7",9e3e56d3cc4a4929906ec3459c7fba0e,一 宿兰堂 接上 才 白云 归去 几 裴 回 黛 青峰 朵 孤吟 后 雪白 猨 儿 必 寄 来 帘 卷 茶 烟 萦 堕 叶 月 明 棋子 落 深 苔 明朝 江 上空 回首 始觉 清风 不可 陪
d01b6b15-b0bd-437f-b3c5-90b87ff65d79,送鄭侍郎騫赴闕,貫休,唐,诗,七言律诗,文章国器尽琅玕 朝骑骎骎岁欲残 彩笔祗宜天上用 绣衣偏称雪中看 休惊断鴈离三楚 渐入祥烟下七槃 翰苑旧知凭与说 紫金轮畔寄书难,"7,7,7,7,7,7,7,7",c5a715083bc40497c0f32e70c3656c2f,文章 国器 尽 琅玕 朝 骑 骎 骎 岁 欲 残 彩笔 祗 宜 天上 用 绣衣 偏 称 雪 中 看 休惊 断 鴈 离 三 楚 渐入 祥烟下七 槃 翰苑 旧知 凭 与 说 紫 金轮 畔 寄 书 难
a350cc5e-3f0d-4a6a-b55e-113886e8fe32,上盧使君,貫休,唐,诗,七言律诗,一别旌旗已一年 二林真子劝安禅 常思双戟华堂里 还似孤峰峭壁前 步出林泉多吉梦 帆侵分野入祥烟 自怜酷似随阳鴈 霜打风飘到日边,"7,7,7,7,7,7,7,7",65208f54e6b8dba18d115e3916d27777,一 别 旌旗 已 一年 二林 真子 劝 安禅 常思双戟 华堂 里 还 似 孤峰 峭壁 前 步出 林泉 多吉 梦 帆 侵 分野 入祥 烟 自怜 酷似 随 阳 鴈 霜 打风 飘到 日边
3c5033b1-2b3b-499e-8fcd-a0a86220d2e7,寄匡山大願和尚,貫休,唐,诗,七言律诗,一听玄音下竹亭 却思窗雪与囊萤 祗将清净酬恩德 敢信文章有性灵 梦历山床闻鹤语 吟思海月上沙汀 不堪回首沧江上 万仞庐峰在杳冥,"7,7,7,7,7,7,7,7",9d921df5eb8223ce039f6965271c6c55,一 听 玄音 下 竹亭 却 思 窗雪 与 囊 萤 祗 将 清净 酬 恩德 敢 信 文章 有 性灵 梦 历山 床 闻鹤语 吟 思海 月 上沙汀 不堪回首 沧江 上 万仞庐 峰 在 杳 冥
cbff8bb7-1890-4df0-9e9c-ef9169544c04,別盧使君歸東陽二首 一,貫休,唐,诗,七言律诗,雨气蒙蒙草满庭 式微吟剧更谁听 诗逢匠化唯贪住 日觉恩深不易铭 心苦祗应消鬓黑 梦游频入倚天青 从兹还似归回首 唯祝台星与福星,"7,7,7,7,7,7,7,7",52d4d89af29b765d6644ce7637e411a5,雨气 蒙蒙 草满庭 式微 吟剧 更 谁 听 诗 逢 匠化 唯 贪住 日 觉恩 深 不易 铭 心苦 祗 应 消鬓 黑 梦游 频入 倚 天青 从兹 还 似归 回首 唯祝 台星 与 福星
1ea3444e-8165-4907-9795-02e0f601fb28,別盧使君歸東陽二首 二,貫休,唐,诗,七言律诗,家在严陵钓渚旁 细涟嘉树拂窗凉 难医林薮烟霞癖 又出芝兰父母乡 孤帆好风千里煖 深花黄鸟一声长 终期金鼎调羹日 再近尼丘日月光,"7,7,7,7,7,7,7,7",41b00954f62fd8ac99b7777331efc38a,家 在 严陵钓 渚 旁 细涟 嘉树 拂 窗 凉 难 医林 薮 烟霞 癖 又 出 芝兰 父母 乡 孤帆 好 风 千里 煖 深花 黄鸟 一声 长 终期 金鼎 调羹 日 再 近 尼丘 日 月光
4f58e728-9449-48f3-b276-a2b123235bf6,溪寺水閣閑眺因寄宋使君,貫休,唐,诗,七言律诗,溪木萧条一凭阑 玉霜飞后浪花寒 钓鱼船上风烟暝 古木林中砧杵干 至竟道心方始是 空耽山色亦无端 谁如太守分忧外 时把西经尽日看,"7,7,7,7,7,7,7,7",fbe4800e0a2b09d6b4741fcc972e815e,溪木 萧条 一 凭 阑 玉霜飞 后 浪花 寒 钓鱼 船上 风烟 暝 古木 林中 砧杵 干 至竟 道心 方始 是 空 耽 山色 亦 无端 谁 如 太守 分忧 外 时 把 西经 尽日 看
1f7ba2c9-3692-4cb7-9814-804ba910666d,春送趙文觀送故合州座主神櫬歸洛,貫休,唐,诗,杂言,喜继于悲锦水东 还乡仙骑却寻嵩 再烧良玉尧云动 方报深恩绛帐空 远道灵 輀 春欲尽 乱山羸马恨无穷 他年必立吾君侧 好把书绅荅至公,"7,7,7,7,3,1,3,7,7,7",53a77936208d02051018ef515b2e20fa,喜 继于 悲锦 水东 还乡 仙骑 却 寻 嵩 再 烧 良玉 尧 云动 方报 深恩 绛 帐空 远道 灵 輀 春 欲 尽 乱山 羸马 恨 无穷 他 年 必立 吾 君 侧 好 把 书绅 荅 至 公
ca1d5eb2-46e6-48a4-90b3-58e5e064e98d,{巩/言}光大師草書歌,貫休,唐,诗,七言古体,雪压千峰横枕上 穷困虽多还激壮 看师逸迹两相宜 高适歌行李白诗 海上惊驱山猛烧 吹断狂烟著沙草 江楼曾见落星石 几回试发将军砲 别有寒雕掠绝壁 提上玄猨更生力 又见吴中磨角来 舞槊盘刀初触击 好文天子挥宸翰 御制本多推玉案 晨开水殿教题壁 题罢紫衣亲宠锡 僧家爱诗自拘束 僧家爱画亦局促 唯师草圣艺偏高 一掬山泉心便足,"7,7,7,7,7,7,7,7,7,7,7,7,7,7,7,7,7,7,7,7",9eadd31231abaccacfb4e2b5ed64a6e6,雪压 千峰 横 枕上 穷困 虽 多 还 激壮 看 师 逸 迹 两相宜 高适 歌行 李白诗 海上 惊驱山猛烧 吹断 狂烟 著 沙草 江楼 曾 见落 星石 几回 试发 将军 砲 别 有 寒雕 掠 绝壁 提上 玄 猨 更 生力 又 见 吴中 磨角 来 舞 槊 盘 刀 初 触击 好 文 天子 挥 宸 翰 御制 本 多 推 玉案 晨 开水 殿 教 题壁 题 罢 紫衣 亲 宠 锡 僧家 爱 诗 自 拘束 僧家 爱画 亦 局促 唯师 草圣 艺 偏 高 一 掬 山泉 心 便 足
41002bdd-8178-4a0c-855a-04893a35a6ae,題成都玉局觀孫位畫龍,貫休,唐,诗,杂言,我见苏州昆山佛殿中 金城柱上有二龙 老僧相传道是僧繇手 寻常入海共龙鬬 又闻蜀国玉局观有孙遇迹 蟠屈身长八十尺 游人争看不敢近 头覻寒泉万丈碧,"9,7,9,7,11,7,7,7",fdf12746b8c8d9c384b24a0859f74025,我 见 苏州 昆山 佛殿 中 金城 柱 上 有 二龙 老僧 相传 道 是 僧 繇 手 寻常 入海 共 龙 鬬 又 闻 蜀国 玉局 观有 孙遇迹 蟠 屈身 长 八十 尺 游人 争看 不敢 近 头 覻 寒 泉 万丈 碧
b0e33ac1-1d66-4f21-965d-6fd48693fee2,觀地獄圖,貫休,唐,诗,五言律诗,峨峨非劒阁 有树不堪攀 佛手遮不得 人心似等闲 周王应未雪 白起作何颜 尽日空弹指 茫茫尘世间,"5,5,5,5,5,5,5,5",732aa08732bff6ad186e2e828dd3ed6e,峨峨非 劒 阁 有 树 不堪 攀 佛手 遮 不得 人心 似 等闲 周王 应未雪 白起 作何 颜 尽 日 空 弹指 茫茫 尘世间
d604def2-02ce-45b6-99c2-9f8f0e1a7651,贈雷卿張明府,貫休,唐,诗,五言律诗,任官征战后 度日寄闲身 封卷还高客 飞书问野人 废田教种谷 生路遣寻薪 若起柴桑兴 无先漉酒巾,"5,5,5,5,5,5,5,5",cf478af40b1cfc3e5c35b2163f927200,任官 征战 后 度日 寄 闲身 封卷 还 高 客 飞书 问 野人 废田 教种 谷 生路 遣 寻薪 若 起 柴桑兴 无先 漉 酒巾
c39edcf7-7ab6-46a8-9bb0-ef3b5a628753,獻錢尚父,貫休,唐,诗,七言律诗,贵逼人来不自由 龙骧凤翥势难收 满堂花醉三千客 一劒霜寒十四州 鼓角揭天嘉气冷 风涛动地海山秋 东南永作金天柱 谁羡当时万户侯,"7,7,7,7,7,7,7,7",54b74e467553e18729d91ef3e8d66b91,贵 逼人 来 不 自由 龙骧 凤翥 势 难 收 满堂 花醉 三千 客 一 劒 霜寒 十四 州 鼓角 揭天嘉 气冷 风涛动 地 海山 秋 东南 永作金 天柱 谁 羡 当时 万户侯
c76f37f1-efad-4125-aa0a-a0da55b293ec,繡州張相公見訪,貫休,唐,诗,七言律诗,德符唐德瑞通天 曾叱谗谀玉座前 千袭彩衣宫锦薄 数床御札主恩偏 出师暂放张良箸 得罪惟撑范蠡船 未报君恩终必报 不妨金地礼青莲,"7,7,7,7,7,7,7,7",0495351983eb97065a0ae0f1da065bd9,德符 唐德瑞 通天 曾 叱谗谀玉 座 前 千袭 彩衣 宫锦薄 数床 御 札 主恩 偏 出师 暂放 张 良 箸 得罪 惟撑 范蠡 船 未报 君恩 终必 报 不妨 金地 礼 青莲
1206a6b8-5634-4094-81a7-32a0caf50a83,題某公宅,貫休,唐,诗,七言律诗,宅成天下借图看 始笑平生眼力悭 地占百湾多是水 楼无一面不当山 荷深似入苕溪路 石怪疑行鴈荡间 只恐中原方鼎沸 天心未遣主人闲,"7,7,7,7,7,7,7,7",f76e2927df0721122d05474be9c9eebf,宅 成 天下 借图 看 始 笑 平生 眼力 悭 地 占 百湾 多 是 水 楼 无 一面 不当 山 荷 深似 入苕 溪路 石 怪疑 行 鴈 荡 间 只恐 中原 方 鼎沸 天心 未 遣 主人 闲
ca22768e-68f7-49f6-9d79-8510fbde9b7f,海覺禪師山院,貫休,唐,诗,七言律诗,人言海觉老宗师 隐绝层巅世莫知 青草不生行道迹 白云常护坐禅扉 六环金锡飞来后 一派银河泻落时 借问大心能济物 龙门风雹卷天池,"7,7,7,7,7,7,7,7",fa1aa9a46f01b4cdcab50086689bfe0b,人言 海觉 老 宗师 隐 绝层 巅世 莫 知 青草 不 生行 道迹 白云 常护 坐禅 扉 六 环金 锡 飞来 后 一派 银河 泻 落 时 借问 大心 能济物 龙门 风雹 卷 天池
86db44bb-e795-46ea-93c8-1639f9d38bcb,悼張道古,貫休,唐,诗,七言律诗,清河逝水大悤悤 东观无人失至公 天上君恩三载隔 鉴中鸾影一时空 坟生苦雾苍茫外 门掩寒云寂寞中 惆怅斯人又如此 一声蛮笛满江风,"7,7,7,7,7,7,7,7",f09900a660bacaed6aefee8330ae5c90,清河 逝水 大 悤 悤 东观 无人 失至 公 天上 君恩 三载 隔 鉴 中 鸾 影一 时空 坟生 苦雾 苍茫 外 门 掩寒云 寂寞 中 惆怅 斯人 又 如此 一声 蛮笛 满江 风
b14b868b-a12f-40f7-a9f9-40d3b976e7e6,月夕,貫休,唐,诗,五言绝句,霜月夜裴回 楼中羌笛催 晓风吹不尽 江上落残梅,"5,5,5,5",2383bac239d09c0393b2bdd90bb40786,霜 月夜 裴 回 楼中 羌笛 催 晓 风吹 不尽 江上 落残 梅
250caca0-1923-45da-af7c-b6e30bafe065,夜雨,貫休,唐,诗,五言绝句,夜雨山草湿 爽籁杂枯木 闲吟笁仙偈 清绝过于玉,"5,5,5,5",025d9391547212e855e055da0de9b6f5,夜雨 山草 湿 爽 籁 杂 枯木 闲 吟 笁 仙 偈 清绝 过于 玉
84290a47-4e78-4463-a1a5-59124b398cd7,晚望,貫休,唐,诗,五言绝句,落日碧江静 莲唱清且闲 更寻花发处 借月过前湾,"5,5,5,5",e5460e9fcc60aad5306e7301a9f004f0,落日 碧江静 莲 唱 清 且 闲 更 寻花 发处 借 月 过 前湾
841abb9e-9d47-4d1b-ab12-e12faaaedb60,早霜寄蔡大,貫休,唐,诗,五言绝句,昨夜楚钟鸣 飞霜下楚城 定知迁客鬓 先向鉴中生,"5,5,5,5",a151b160f49f62333829a1d2f4be6db6,昨夜 楚钟鸣 飞霜 下 楚城 定 知迁 客鬓 先 向鉴 中生
34bd8a4d-e3b7-4da1-abbb-8fefa4256a05,贈寫經僧楚雲,貫休,唐,诗,七言绝句,剔皮刺血诚何苦 为写灵山九会文 十指沥干终七轴 后来求法更无君,"7,7,7,7",976f9db9a6f92c44510ccdf141652c15,剔皮 刺血 诚 何苦 为 写 灵山 九会文 十指 沥 干终 七 轴 后来 求法 更 无 君
577c4ebf-a237-43c8-ace3-0f32a8418607,寄題詮律師院,貫休,唐,诗,七言律诗,锦溪光里耸楼台 师院高凌积翠开 深竹杪闻残磐尽 一茶中见数帆来 焚香只是看新律 幽步犹疑损绿苔 莫讶题诗又东去 石房清冷在天台,"7,7,7,7,7,7,7,7",30a7b5bac46b350501851c22602da390,锦溪 光 里 耸 楼台 师院 高 凌积翠 开 深 竹 杪 闻残磐尽 一 茶 中 见 数 帆 来 焚香 只是 看 新律 幽步 犹疑 损 绿苔 莫讶 题诗 又 东去 石房 清冷 在 天台
1ff4ac11-4a8f-4ad9-977e-d7deb6127bd1,寄天台葉道士,貫休,唐,诗,七言律诗,负局高风不可陪 玉霄峰北置楼台 注参同契未将出 寻楖栗僧多宿来 飕槭松风山枣落 闲关溪鸟术花开 终须肘后相传好 莫便乘鸾去不回,"7,7,7,7,7,7,7,7",57c4f894d80b47508ae044dca943ae35,负局 高风 不可 陪 玉霄峰 北置 楼台 注 参同 契 未 将 出 寻 楖 栗 僧 多 宿 来 飕 槭 松 风 山枣 落 闲 关溪 鸟术花 开 终须 肘 后 相传 好 莫 便 乘 鸾 去 不 回
4a502043-8347-4426-9f2f-d9ecce39a62e,送道友歸天台,貫休,唐,诗,七言律诗,藓浓苔湿冷层层 珍重先生独去登 气养三田传未得 药非八石许还曾 云根应狎玉斧子 月迳多寻银地僧 太守苦留终不住 可怜江上去腾腾,"7,7,7,7,7,7,7,7",6c53ac3042d3ce75306a8d953f8807d2,藓浓苔 湿冷 层层 珍重 先生 独去 登 气养 三田 传 未 得 药 非 八石 许 还 曾 云根 应 狎玉 斧子 月 迳 多 寻 银 地 僧 太守 苦留 终 不住 可怜 江 上去 腾腾
3b99d516-4282-45fd-9abd-5ebbdbe1e8df,陶種柑橙令山童買之,貫休,唐,诗,五言绝句,高步南山南 高歌北山北 数载买柑橙 山资近又足,"5,5,5,5",bff0fedef88dec0a8dcafd3e9c19cbce,高步 南 山南 高歌 北山 北 数载 买 柑 橙 山资近 又 足
0ae9b7d7-62ef-460a-a241-bdc13382c555,春送僧,貫休,唐,诗,七言绝句,蜀魄关关花雨深 送师冲雨到江浔 不能更折江头柳 自有青青松柏心,"7,7,7,7",02e96d6df93ff72542de35f6d5985621,蜀 魄 关关 花雨深 送 师冲雨 到 江浔 不能 更 折 江头 柳 自有 青青 松柏 心
b9880c4d-e0a5-485c-8b1f-3c3553d38006,律師,貫休,唐,诗,七言绝句,薝卜花红径草青 雪肤冰骨步轻轻 今朝暂到焚香处 只恐床前有虱声,"7,7,7,7",0c96d5785e5278805fdb49be0610fe70,薝 卜 花红 径草 青 雪肤 冰骨 步 轻轻 今朝 暂到 焚香 处 只恐 床 前 有 虱声
9e5d341d-73a5-4352-81b9-49dc9673e9b3,書石壁禪居屋壁,貫休,唐,诗,七言绝句,赤旃檀塔六七级 白菡萏花三四枝 禅客相逢只弹指 此心能有几人知,"7,7,7,7",2fd65651c8f0688c9a2f4d9b8efbdbd0,赤 旃檀 塔 六七 级 白 菡萏 花三 四枝 禅客 相逢 只 弹指 此 心 能 有 几 人 知
82945f4b-9b24-4610-a96a-b61fb9bf0c4a,句,貫休,唐,诗,杂言,今日再三难更识 谶辞唯道待钱来 鴈荡经行云漠漠 龙湫宴坐雨蒙蒙 刻成筝柱鴈相挨 黄昏风雨黑如磐 别我不知何处去 郭尚父休夸塞北 裴中令莫说淮西 万计交人买 华轩保惜深 如何忠为主 至竟不封侯 但看千骑去 知有几人归 一生不蓄买田钱 华屋何心亦偶然 客至多逢僧在坐 钓归惟许鹤随船 家为买琴添旧价 厨因养鹤减晨炊 黏粉为题栖凤竹 带香因洗落花泉,"7,7,7,7,7,7,7,7,7,5,5,5,5,5,5,7,7,7,7,7,7,7,7",cd3e4cf3968fb25be901f8a39c94334b,今日 再三 难 更 识 谶辞 唯道 待 钱 来 鴈 荡 经 行云 漠漠 龙湫 宴 坐 雨蒙蒙 刻成 筝 柱 鴈 相 挨 黄昏 风雨 黑如磐 别我 不知 何处 去 郭 尚父 休夸 塞北 裴中令 莫 说 淮西 万 计交人 买 华轩 保惜 深 如何 忠 为主 至竟 不 封侯 但 看 千 骑 去 知有 几 人 归 一生 不 蓄买 田 钱 华屋 何心亦 偶然 客 至多 逢 僧 在 坐 钓归 惟许 鹤随船 家 为 买琴 添 旧 价 厨因 养鹤 减 晨炊 黏粉 为题 栖 凤竹 带 香因 洗 落花 泉
d56305d8-52ec-43b1-bb8f-d31eabfd0185,夏日草堂作,齊己,唐,诗,五言律诗,沙泉带草堂 纸帐卷空床 静是真消息 吟非俗肺肠 园林坐清影 梅杏嚼红香 谁住原西寺 钟声送夕阳,"5,5,5,5,5,5,5,5",67de383805c37aec2bacfbfb85fbaeff,沙泉 带 草堂 纸 帐 卷 空床 静 是 真 消息 吟非 俗 肺肠 园林 坐 清影 梅杏 嚼 红香 谁 住 原西寺 钟声 送 夕阳
bbc775ba-d10c-4bc5-80bd-44e37559a24d,寄鏡湖方干處士,齊己,唐,诗,五言律诗,贺监旧山川 空来近百年 闻君与琴鹤 终日在渔船 岛露深秋石 湖澄半夜天 云门几回去 题徧好林泉,"5,5,5,5,5,5,5,5",b168a3ffd9cb591ad94ac09a83822cff,贺监旧 山川 空 来 近 百年 闻君 与 琴 鹤 终日 在 渔船 岛 露 深秋 石 湖 澄 半夜 天 云门 几 回去 题 徧 好 林 泉
07ad9594-0b2f-4dbf-9e0a-15b78b3175c8,送人歸吳,齊己,唐,诗,五言律诗,比说归耕钓 迢迢向海涯 春寒游子路 村晚主人家 □□□□□ □山绿过茶 重寻旧邻里 菱藕正开花,"5,5,5,5,5,5,5,5",ed5d53714fffe722018b47050d76a771,比 说 归耕钓 迢迢 向海 涯 春寒 游子 路 村 晚 主人家 □ □ □ □ □ □ 山绿 过 茶 重 寻 旧 邻里 菱 藕 正 开花
44dcf956-3bba-47c6-82e2-bbd2aa3dee77,贈仰上人,齊己,唐,诗,五言律诗,避地依真境 安闲似旧溪 干戈百里外 泉石乱峰西 草瑞香难歇 松灵盖尽低 寻应报休马 瓶锡向南携,"5,5,5,5,5,5,5,5",9593d79b68f48582a422ef7a7e8cc3f7,避 地 依 真境 安闲 似旧 溪 干戈 百里 外 泉石 乱峰 西 草 瑞香 难 歇 松灵盖 尽 低 寻应 报休 马 瓶 锡 向 南 携
b56350fa-e151-41c0-95e0-255f150fce02,夜坐,齊己,唐,诗,五言律诗,百虫声里坐 夜色共冥冥 远忆诸峰顶 曾栖此性灵 月华澄有象 诗思在无形 彻曙都忘寝 虚牕日照经,"5,5,5,5,5,5,5,5",4acfb6df2613f16de5e5fdb1ffea7d2f,百 虫声 里 坐 夜色 共 冥冥 远忆 诸 峰顶 曾 栖 此 性灵 月华 澄有 象 诗思 在 无形 彻 曙都 忘寝 虚 牕 日照 经
089af8ba-1989-4556-8c4a-bfad31509fee,新栽松,齊己,唐,诗,五言律诗,野僧教种法 苒苒出蓬蒿 百岁催人老 千年待尔高 静宜兼竹石 幽合近猨猱 他日成阴后 秋风吹海涛,"5,5,5,5,5,5,5,5",d13091f2895a7ab93a7d2e18b68c0ab6,野僧 教种 法 苒 苒 出 蓬蒿 百岁 催人老 千年 待 尔 高 静宜 兼 竹石 幽合 近 猨 猱 他 日 成阴 后 秋风 吹 海涛
3437e6d0-4bc3-436e-a3bd-01819bd789dd,期友人,齊己,唐,诗,五言律诗,早晚逐兹来 闲门日为开 乱蛩鸣白草 残菊藉苍苔 困卧谁惊起 闲行自欲回 何时此携手 吾子本多才,"5,5,5,5,5,5,5,5",a05a854680bd95928451ebd4fab42382,早晚 逐 兹 来 闲门 日为 开 乱 蛩 鸣 白草 残 菊 藉 苍苔 困卧 谁 惊起 闲行 自欲回 何时 此 携手 吾子 本多才
63a24942-856d-4cb0-8cff-9cf8ffd413be,和鄭谷郎中看棊,齊己,唐,诗,五言律诗,个是仙家事 何人合用心 几时终一局 万木老千岑 有路如飞出 无机似陆沈 樵夫可能解 也此废光阴,"5,5,5,5,5,5,5,5",4d0f2598cf1d6a5119908b3984c41579,个 是 仙 家事 何人 合 用心 几时 终 一局 万木 老千 岑 有 路 如 飞出 无机 似 陆沈 樵夫 可能 解 也此 废 光阴
fdc10952-f0bf-4d70-959a-34ae4379c98d,寄錢塘羅給事,齊己,唐,诗,五言律诗,愤愤呕谗书 无人诵子虚 伤心天祐末 搔首懿宗初 海树青丛短 湖山翠点疎 秋涛看足否 罗刹石边居,"5,5,5,5,5,5,5,5",4dd794fc38d00ddc47a5eae1c16bca58,愤愤 呕 谗 书 无人 诵 子虚 伤心 天 祐 末 搔首 懿 宗 初 海树青 丛 短 湖山 翠点 疎 秋涛 看足否 罗刹 石边 居
93a1791f-1127-44f0-bad8-4f18ea9f999f,戊辰歲湘中寄鄭谷郎中,齊己,唐,诗,五言律诗,白发久慵簪 常闻病亦吟 瘦应成鹤骨 闲想似禅心 上国杨花乱 沧洲荻笋深 不堪思翠𪩘 西望独沾襟,"5,5,5,5,5,5,5,5",4b18df097e49e7f0f55151b72a473570,白发 久 慵 簪 常闻病 亦 吟 瘦 应成 鹤 骨 闲想 似 禅心 上国 杨花 乱 沧洲 荻 笋 深 不堪 思翠 𪩘 西望 独 沾襟
e619aaab-2603-43fc-a3a5-2e222a37abe0,寓言,齊己,唐,诗,五言律诗,造化安能保 山川凿欲翻 精华销地底 珠玉聚侯门 始作骄奢本 终为祸乱根 亡家与亡国 云此更何言,"5,5,5,5,5,5,5,5",237c0754d8f88ed88b48d8f0e12cdf82,造化 安能保 山川 凿 欲 翻 精华 销 地底 珠玉 聚侯门 始作 骄奢 本 终为 祸乱 根 亡家 与 亡国 云 此 更 何言
e187a5bb-1427-43ed-8813-02fe5f7528db,寄王振拾遺,齊己,唐,诗,五言律诗,折槛意何如 平安信不虚 近来焚谏草 深去觅山居 □□□□□ □□□□余 分明知在处 难寄乱离书,"5,5,5,5,5,5,5,5",5724ad1c1cb07251980826ce51655390,折槛 意 何如 平安 信不虚 近来 焚 谏 草 深去 觅 山居 □ □ □ □ □ □ □ □ □ 余 分 明知 在 处 难 寄 乱离 书
71f16b34-f83a-4089-8b40-68a5da849811,經賈島舊居,齊己,唐,诗,五言律诗,先生居处所 野烧几为灰 若有吟魂在 应随夜魄回 地宁销志气 天忍罪清才 古木霜风晚 江禽共宿来,"5,5,5,5,5,5,5,5",f7b2fc77ec12fd08382ae8865c9ea625,先生 居 处所 野烧 几 为 灰 若有吟 魂 在 应 随夜魄 回 地宁 销 志气 天 忍罪 清才 古木霜 风 晚 江 禽 共 宿 来
b6b781b8-b71c-466e-8110-000e9973f48e,送人游塞,齊己,唐,诗,五言律诗,槐柳野桥边 行尘暗马前 秋风来汉地 客路入胡天 鴈聚河流浊 羊群碛草膻 那堪陇头宿 乡梦逐潺湲,"5,5,5,5,5,5,5,5",8ddc7d7c3b0b65b51f2817e641228b17,槐 柳野 桥边 行尘 暗马 前 秋风 来汉 地 客路 入 胡天 鴈 聚 河流 浊 羊群 碛 草 膻 那堪 陇头 宿 乡 梦 逐 潺湲
22293a4c-c4c3-4010-9948-a5c1ea760360,桃花,齊己,唐,诗,五言律诗,千株含露态 何处照人红 风暖仙源里 春和水国中 流莺应见落 舞蜨未知空 拟欲求图画 枝枝带竹丛,"5,5,5,5,5,5,5,5",715c03cfbd77d1d3f9e0db7dc3243c33,千株 含露 态 何处 照人 红 风 暖 仙源 里 春 和 水国 中 流莺 应见 落 舞 蜨 未知 空 拟 欲求 图画 枝枝 带 竹丛
62a5d50e-5aa3-43b9-a7cb-4572d868c088,聞鴈,齊己,唐,诗,五言律诗,何处人惊起 飞来过草堂 丹心劳避弋 万里念随阳 影断风天月 声孤荻岸霜 明年趁春去 江上别鸳鸯,"5,5,5,5,5,5,5,5",864fcf01a2b38ae45894e9e9fc00492f,何处 人 惊起 飞来 过 草堂 丹心 劳避弋 万里 念随阳 影断 风天 月 声 孤荻岸 霜 明年 趁 春去 江上 别 鸳鸯
