id,title,author,dynasty,genre,poem_type,sentences_simplified,meter_pattern,hash,words
33f55345-d6b7-4fd4-a383-9962faacf871,雨中题柏氏壁二首  其二,陈造,唐,诗,七言绝句,苏端颇惯招新客 御叔何烦讶圣人 未用平章旧新雨 一樽聊喜对情亲,"7,7,7,7",7db37698a6b40784c725129c0c366f71,苏端 颇 惯 招新 客 御 叔 何 烦讶 圣人 未用 平章 旧 新 雨 一 樽 聊喜 对 情亲
f0a0334d-2b86-47d4-b7c8-16f9313c1768,次韵杨宰爱竹,陈造,唐,诗,七言绝句,看竹排门爱靓深 青青不受雪霜侵 谁知倦客幽寻去 老越风波亦此心,"7,7,7,7",7fc0bcbcb1de921e406612761f30ca3b,看 竹排 门爱靓 深 青青 不 受 雪 霜 侵 谁知 倦 客 幽 寻去 老越 风波 亦 此心
a3101bf4-3bee-475f-b844-bb900463f8a0,次韵杨宰思庭竹,陈造,唐,诗,七言绝句,数寻脆碧袅轻阴 岁不知寒暑不侵 属厌吟风仍啸雨 尽收县解入琴心,"7,7,7,7",64ef50440783d5f6265d60766d29626d,数 寻脆 碧袅轻阴 岁 不知 寒暑 不 侵 属 厌吟 风 仍 啸 雨 尽收 县 解入 琴心
e789d417-4784-4064-acb0-e59df7d0ee04,寄郢州崔守八首  其一,陈造,唐,诗,七言绝句,阳关声断酒杯残 昨梦回思变暑寒 七见蟾蜍作圆缺 四冯鳞羽问平安,"7,7,7,7",04b839ee316f0af631cb1c4befbb0b4d,阳关 声断 酒杯 残 昨 梦回 思变 暑 寒 七 见 蟾蜍 作圆 缺 四 冯鳞羽 问 平安
d72057f8-f42a-4379-b7b1-074065d634e8,寄郢州崔守八首  其二,陈造,唐,诗,七言绝句,尝记停骖古郢州 待晴曾是贾胡留 锦囊亦有阳春句 不得亲题白雪楼,"7,7,7,7",9d441646fc84e9bc34a90a3d06c16621,尝记 停 骖 古 郢州 待 晴 曾 是 贾胡 留 锦囊 亦 有 阳春 句 不得 亲题 白雪 楼
9c3cb154-6bf1-4991-ab75-285f282ad8b3,寄郢州崔守八首  其三,陈造,唐,诗,七言绝句,楚郢繁雄亚上都 莫愁风韵未应殊 小园依旧深红色 曾辱遨头载酒无,"7,7,7,7",4487986e03f1f09b927fe13e8492e937,楚郢 繁雄亚 上 都 莫愁 风韵 未 应 殊 小园 依旧 深红色 曾辱 遨头 载 酒 无
eb09c28e-295a-46bc-a602-21b0e84fc4ad,寄郢州崔守八首  其四,陈造,唐,诗,七言绝句,碧香当日荐金船 桑落宜城不直钱 一自黄堂沉醉后 至今追忆尚流涎,"7,7,7,7",b970b0de468be171cc895a894530573b,碧香 当日 荐 金船 桑落 宜城 不直 钱 一 自 黄堂 沉醉 后 至今 追忆 尚 流涎
a3866822-8393-428a-8bde-024fe7356f2f,寄郢州崔守八首  其五,陈造,唐,诗,七言绝句,别乘修程骥𫘧驰 书来犹肯记衰迟 每思胶漆班荆地 敢忘风波在莒时,"7,7,7,7",cd483314a6b210f0237d2f0a5e1896f5,别乘修 程骥 𫘧 驰 书 来 犹 肯记 衰迟 每 思 胶漆 班荆地 敢 忘 风波 在 莒 时
a5cb4a0a-8ce0-4353-be2d-29a3a1878e90,寄郢州崔守八首  其六,陈造,唐,诗,七言绝句,雍郎高韵似文同 水墨仍参二米风 解搴山川归短幅 可能陆续寄来鸿,"7,7,7,7",191d0e9d9febf504dfb95fa5d3a2a8ad,雍郎 高 韵 似 文 同 水墨 仍 参 二米 风 解 搴 山川 归 短幅 可能 陆续 寄来 鸿
a8cb6dae-f9ac-46a6-b061-f8eceb5019de,寄郢州崔守八首  其七,陈造,唐,诗,七言绝句,将军竞病旧能诗 黄绢于今玩色丝 何日酒兵鏖笔阵 未应羽檄谂交绥,"7,7,7,7",e9c761949c1496983be8dc4b6928b786,将军 竞病 旧 能 诗 黄绢 于今 玩 色丝 何日 酒兵 鏖 笔阵 未 应 羽 檄谂 交 绥
be031ba7-d0e6-4877-a9de-199aa5ebdfd4,寄郢州崔守八首  其八,陈造,唐,诗,七言绝句,牙板声中敛翠眉 时应歌我遣怀词 岂知薄宦飘零去 无复风情似旧时,"7,7,7,7",20191bd4b34bfea0b654e3edee213811,牙板 声 中 敛 翠眉 时应歌 我 遣怀 词 岂知 薄 宦 飘零 去 无复 风情 似 旧时
4e1b9b42-c032-4bd3-86e2-f8288435aaa2,送吴子隆节推之官信州五首  其一,陈造,唐,诗,七言绝句,人生穷达后愚贤 宦路何妨小著鞭 三釜吾今嗟弗洎 奉亲东下羡登仙,"7,7,7,7",0e1069fea1e9be93c07b55b4fbfae9e7,人生 穷达 后愚贤 宦路 何妨 小著 鞭 三釜吾今嗟弗洎 奉亲 东下 羡登 仙
8d0341e7-efef-4cb7-b49e-bea444c55f91,送吴子隆节推之官信州五首  其二,陈造,唐,诗,七言绝句,行行幕府泛莲初 井井官曹游刃余 当路急贤饥渴似 不须衔袖子公书,"7,7,7,7",fb6aa8124b7c14852b99aba4057c4a8f,行 行 幕府 泛 莲 初 井井 官 曹 游刃 余 当 路 急 贤 饥渴 似 不须 衔 袖子 公书
65860205-30b7-4b4c-b52e-1862726664bc,送吴子隆节推之官信州五首  其三,陈造,唐,诗,七言绝句,共把离杯柳影边 柳枝如线拂归船 枝枝似恨人轻别 颦不成眠更可怜,"7,7,7,7",eccde46436a92b6d1eb10655229cda80,共 把 离杯 柳影 边 柳枝 如 线 拂 归 船 枝枝 似 恨 人 轻别 颦 不 成眠 更 可怜
55416bb7-1381-4710-aa0d-c60251975fb8,送吴子隆节推之官信州五首  其四,陈造,唐,诗,七言绝句,幕中婉画得斯人 郡政应从到日新 银錵金苗休刺口 祇将耕稼富州民,"7,7,7,7",a4b5ddd69123ef5c623fb34305d786b6,幕中 婉 画 得 斯人 郡 政 应从 到 日 新 银 錵 金苗 休刺 口 祇 将 耕稼 富州民
acf45486-5e09-4d39-99d5-884ca44b506a,送吴子隆节推之官信州五首  其五,陈造,唐,诗,七言绝句,连城照乘动分珍 他日词坛著散人 诗笔有神官有暇 楚鳞燕翼要频频,"7,7,7,7",e90d1ae752f7390da14af596a19197be,连城 照 乘动分 珍 他 日 词坛 著散 人 诗笔 有神 官 有暇 楚鳞燕 翼 要 频频
f31af09b-1eb3-4c6b-a555-e6430d15ac2b,次程平叔韵二首  其一,陈造,唐,诗,七言绝句,故人常叹别时长 一笑眉开色便黄 领畧西园好风景 凭君更唤郭汾阳,"7,7,7,7",dc20cbf3125bc580d321018fce27f16f,故人 常 叹 别时 长 一笑眉开色 便 黄 领 畧 西园 好 风景 凭 君 更 唤 郭汾阳
645934c9-fb0a-4e23-aa55-3b5bb84dcd12,次程平叔韵二首  其二,陈造,唐,诗,七言绝句,诗情对景可胜长 酒与鹅儿鬭嫩黄 忠贯主人真好事 肯来訾省沈东阳,"7,7,7,7",1bf52eb1e274aca4c0446f3f45732538,诗情 对 景可胜 长 酒 与 鹅 儿 鬭 嫩黄 忠 贯 主人 真 好事 肯来 訾 省 沈 东阳
3196cc90-bca9-477b-bb34-afd95fb8800c,阅水教次前韵,陈造,唐,诗,七言绝句,戈船干柂截江长 杀气氛昏日气黄 江畔诗翁泚椽笔 射蛟无复羡枞阳,"7,7,7,7",4305e7f8e0eb0464700cb7bcbb039306,戈船 干 柂 截 江 长 杀 气氛 昏日气 黄 江畔 诗翁 泚 椽 笔 射 蛟 无复 羡 枞阳
849de906-2780-40a7-a858-9435bd5cfe82,程言聚散有感次前韵  其一,陈造,唐,诗,七言绝句,不须劝醉翠眉长 莫问何时腰下黄 賸喜相逢各强健 免教闻笛赋山阳,"7,7,7,7",d90c4930506d2125a2c9cd14762656a2,不须 劝 醉翠眉 长 莫 问 何时 腰 下 黄 賸 喜相逢 各 强健 免教 闻笛赋 山阳
f7599d6d-4bd0-4976-896a-65064823f5a8,程言聚散有感次前韵  其二,陈造,唐,诗,七言绝句,群芳围坐引杯长 满目深红间浅黄 寄语东君好怜客 水西花外慢颓阳,"7,7,7,7",85623f0142105dd307fe0bf4ce1bf363,群芳 围坐 引杯 长 满目 深红 间 浅黄 寄语 东君 好怜 客 水西花外慢 颓阳
8a36b280-46e7-4af2-800b-9722f5dead44,程言聚散有感次前韵  其三,陈造,唐,诗,七言绝句,垂柳摇丝千尺长 柳阴深处转鹂黄 把杯借听歌声醉 绝胜酸寒尉溧阳,"7,7,7,7",a660cf01db5f16a99ec2765c5ccdb241,垂柳 摇丝 千尺 长 柳阴 深处 转鹂 黄 把 杯 借 听 歌声 醉 绝胜酸 寒尉 溧阳
6181a782-724a-42d4-98ae-b4804c00a31e,程言聚散有感次前韵  其四,陈造,唐,诗,七言绝句,步趁游人欢意长 谁交鶑燕强雌黄 凭栏凝伫多佳丽 底羡簪花醉洛阳,"7,7,7,7",2e55ef8fcdd9ee94452a7ae58544d0f2,步 趁 游人 欢 意长 谁 交 鶑 燕 强 雌黄 凭栏 凝 伫 多 佳丽 底 羡 簪花 醉 洛阳
4a2a8911-0687-4996-8bb8-2ee4e2b25044,再次韵  其一,陈造,唐,诗,七言绝句,掉鞅词场缺寸长 端如策蹇趁蜚黄 弥明小贷凌侯喜 太白犹堪客紫阳,"7,7,7,7",3662d2439f3cc7c2b96dcab9513810e2,掉 鞅 词场 缺 寸长 端如策 蹇 趁蜚黄 弥明 小贷 凌侯喜 太白 犹堪 客 紫阳
fe646f05-8ea4-42b7-9b40-cc7e70f9d293,再次韵  其二,陈造,唐,诗,七言绝句,微风不放浪纹长 𪡋暖跳鱼三尺黄 祇欠高荷护千袜 醉粧浓艳媚斜阳,"7,7,7,7",71acba8c4d57b63b6414b8d2ef45b08c,微风 不 放浪 纹长 𪡋 暖 跳 鱼 三尺 黄 祇 欠 高 荷 护 千 袜 醉 粧 浓艳 媚 斜阳
27eb574f-c9b4-4709-b516-f6206e671ae1,再次韵,陈造,唐,诗,七言绝句,二子峨冠共我长 即看紫绶映银黄 不须握手论家谱 更举宣尼与伯阳,"7,7,7,7",96026a3f9ced7577ac18a70f2f22f31d,二子 峨冠共 我 长 即 看 紫绶映 银黄 不须 握手 论 家谱 更举 宣尼 与 伯阳
cbbd7d60-24f3-48f3-9e07-070bac140daf,次韵赠郭侯,陈造,唐,诗,七言绝句,郭侯智勇两俱长 驿骑何时诏检黄 胡运于今已灰囗 看君万旅出渔阳,"7,7,7,7",7040558e360ace55c38136518ca1c0c4,郭侯 智勇 两 俱长 驿骑 何时 诏 检黄 胡运 于今 已 灰 囗 看 君 万 旅出 渔阳
7336a292-055f-49ac-aa32-120435cfea52,侯拉客归置饮再次韵,陈造,唐,诗,七言绝句,将军恩意为谁长 酒未阑残日脚黄 傥有春风四弦手 真成留客醉浔阳,"7,7,7,7",1f9ea048dac5bc79bdf653b3c893c807,将军 恩 意 为 谁 长 酒未阑残日脚 黄 傥 有 春风 四 弦 手 真 成 留客 醉 浔阳
d93df257-26d5-40a6-bd3c-3613fd425d4f,赵通判有诗次韵二首  其一,陈造,唐,诗,七言绝句,霍王无短似无长 惊见新诗写硬黄 鱼在九渊终玉食 世间濡足羡浮阳,"7,7,7,7",21434cd4e6eb9eceb34ac45417e6b6ea,霍王 无 短似 无长 惊 见 新诗 写 硬 黄 鱼 在 九渊 终 玉食 世间 濡足 羡浮 阳
e1510cb8-5151-4594-9831-273fab5b4a98,赵通判有诗次韵二首  其二,陈造,唐,诗,七言绝句,短歌对酒不能长 犹胜车尘扑面黄 我自关门宝崇鼎 从渠睎价尚咸阳,"7,7,7,7",49aab3d2fc56549115811bf86ba282f3,短歌 对 酒 不能 长 犹胜 车尘 扑面 黄 我 自 关门 宝崇鼎 从 渠 睎 价 尚 咸阳
9f771925-869d-49e8-8970-9727a7c3e63d,吟诗自笑用前韵  其一,陈造,唐,诗,七言绝句,文字光腾万丈长 锦官老杜豫章黄 投荒忍死经人鲊 讨饭充肠上岳阳,"7,7,7,7",489cd6844b37eb716e5a37070c7a653c,文字 光腾 万丈 长 锦官 老杜 豫章 黄 投荒 忍死 经 人 鲊 讨饭 充肠 上 岳阳
732df4ff-caae-4dbe-b6d1-259f81019b3b,吟诗自笑用前韵  其二,陈造,唐,诗,七言绝句,退归我欲学真长 君定才名江夏黄 考父旧尝睎吉甫 陵阳端的嗣黔阳,"7,7,7,7",4809a4dc646bba1ac8a085b5f4ea7dbd,退归 我 欲 学 真长 君定 才 名 江夏 黄 考父 旧 尝 睎 吉 甫 陵阳 端的 嗣 黔阳
d44977b0-461b-4888-a534-94a29466eba2,病起二首  其一,陈造,唐,诗,七言绝句,老去难堪痼疾缠 支离甘受众人怜 出门定被将迎困 紧闭风窗听雨眠,"7,7,7,7",bb70c18b94c762d52b0b66fa186c94db,老 去 难堪 痼疾 缠 支离 甘受 众人 怜 出门 定 被 将 迎 困 紧闭 风窗 听 雨 眠
45b13e10-0cf4-4639-b720-7eeb1520781a,病起二首  其二,陈造,唐,诗,七言绝句,舞席歌筵自阔疎 曲生久送绝交书 平生嗜好消磨尽 留得枯棋了索居,"7,7,7,7",17efd6193de00fc5ae772f8d4a156132,舞席 歌筵 自 阔 疎 曲生久 送 绝交 书 平生 嗜好 消磨 尽 留得 枯棋 了 索居
82676784-1098-4cb8-abfc-75f08dbfc5f9,口号十首呈程殿撰  其一,陈造,唐,诗,七言绝句,白璧明玑每堕前 续貂辄复耸双肩 一从归作漳滨卧 不寄诗筒恰五年,"7,7,7,7",a6ac079833d21351c90cb54a67e82ad3,白璧明玑 每 堕前 续 貂 辄 复耸 双肩 一 从 归作 漳滨 卧 不 寄 诗筒 恰 五年
a92d34d7-cfae-48a1-8def-e7e807664028,口号十首呈程殿撰  其二,陈造,唐,诗,七言绝句,欢意长随夜漏长 隆宽尽贷酒边狂 东归祇有南窗梦 夜夜掀髯锦瑟傍,"7,7,7,7",d59d5c75c40521bc851fa93bd60fa434,欢意 长随 夜 漏长 隆宽 尽 贷酒 边 狂 东 归 祇 有 南 窗 梦 夜夜 掀 髯 锦 瑟 傍
99d0b8f5-9e20-4239-814c-5b6306505c1b,口号十首呈程殿撰  其三,陈造,唐,诗,七言绝句,八月襄城暑始回 水仙争趁玉梅开 当时二物知天意 共报公家福鼎来,"7,7,7,7",68a8abb235a26580fbb9611bb86b5476,八月 襄城 暑 始 回 水仙 争 趁 玉梅 开 当时 二物 知 天意 共报 公家 福鼎 来
d85383e7-cedd-4913-b591-83804f95e4c8,口号十首呈程殿撰  其四,陈造,唐,诗,七言绝句,芳信飞来自月宫 月中桂茂劣能容 素娥封殖非无意 准拟公家不尽供,"7,7,7,7",c4d074c57d596e8fbda7e3007966a89c,芳信 飞 来自 月宫 月 中桂 茂劣 能容 素娥 封殖 非 无意 准拟 公家 不尽 供
6d3b3761-9c1c-4161-b32f-981ac98aa5ff,口号十首呈程殿撰  其五,陈造,唐,诗,七言绝句,福地常披十幅图 仙翁隠处玉为壶 九华山侧双峰下 还许侬分半席无,"7,7,7,7",b4c207e20bcf39eeccde459e973c7bed,福地 常 披 十幅 图 仙翁 隠 处 玉 为 壶 九华山 侧 双峰 下 还 许侬 分 半席 无
c8927a2b-5156-4088-ae5f-28e8a45c3336,口号十首呈程殿撰  其六,陈造,唐,诗,七言绝句,郎君衮绣照鸳行 诗老时须住帝乡 即见翘材辟新馆 预应绿野敞深堂,"7,7,7,7",19e6d222a1e1b6cbfab1e232a3b359ee,郎君 衮 绣 照 鸳行 诗 老 时 须 住 帝乡 即见 翘材 辟 新馆 预应 绿野 敞 深 堂
923cecfe-4e61-4490-822f-13ff4a0273d9,口号十首呈程殿撰  其七,陈造,唐,诗,七言绝句,公家昆季尽时贤 叔也骅骝拟度前 书谂亲庭先静退 至今文采照林泉,"7,7,7,7",730822cecf9f59d39625321908132b63,公家 昆季 尽 时贤 叔 也 骅骝 拟度 前 书 谂 亲庭 先静 退 至今 文采 照 林泉
2bfd2b23-f8e8-482f-8fe2-c8987c0893d3,口号十首呈程殿撰  其八,陈造,唐,诗,七言绝句,童颜缓缓阅庄灵 鬓影青青表帝庭 后四六年同此夜 台星光映老人星,"7,7,7,7",e0f45b4258650877163117e8599fff26,童颜 缓缓 阅 庄灵 鬓影 青青 表帝庭 后四 六年 同此 夜 台 星光 映 老人星
b89d1240-7adc-47d4-901d-1edcaad97226,口号十首呈程殿撰  其九,陈造,唐,诗,七言绝句,故人折柳送东辕 不羡当年李郭船 囊锦鸱夷有供给 自疑身是御风仙,"7,7,7,7",270306bf65bc09b05b35e05eeefa9ae1,故人 折 柳 送 东辕 不 羡 当年 李郭 船 囊 锦 鸱 夷 有 供给 自疑身 是 御 风 仙
4bcf5206-81e4-4eb6-a5ea-a35c70a3e6f5,口号十首呈程殿撰  其一○,陈造,唐,诗,七言绝句,帝所乡关等是家 奚囊纳纳尽天葩 西湖久待公题品 莫遣波神妬九华,"7,7,7,7",4a4d841286474791e46bf9f38f398085,帝所 乡关 等 是 家 奚 囊 纳纳 尽 天葩 西湖 久 待 公题 品 莫 遣 波 神 妬 九华
f7822952-d317-430a-9610-94eda88feab3,题史髯词卷二首  其一,陈造,唐,诗,七言绝句,方朔岁星仍客星 窃桃他日太狂生 几时又泛灵槎去 平掇天孙翠织成,"7,7,7,7",df8a5cb89c32682ea4d8281fdff66d5c,方朔 岁星 仍 客星 窃 桃 他 日 太 狂生 几时 又 泛 灵 槎 去 平掇 天孙翠 织成
a591ff63-16c4-4240-9b89-795abf9639e5,题史髯词卷二首  其二,陈造,唐,诗,七言绝句,南风未蛰浙江波 倦客闲愁似许多 安得双鬟如阿素 红檀声里釂金荷,"7,7,7,7",87c0c95e9ae397fbc6196c3536bb99e9,南风 未蛰 浙江 波 倦 客 闲愁 似 许多 安得 双鬟 如 阿素 红檀声里 釂 金 荷
5fc8040d-02a1-40d8-97a0-2b378af7f218,赠包道二首  其一,陈造,唐,诗,七言绝句,吟风啸月是真常 何处无何更有乡 我与吕仙俱不死 静看乌兔幻炎凉,"7,7,7,7",47d55141976460fad2082c7f8b08c2df,吟 风啸 月 是 真常 何处 无 何 更 有 乡 我 与 吕仙俱 不 死 静看 乌兔 幻 炎凉
8483d262-008e-4b86-b06a-2e06346efd38,赠包道二首  其二,陈造,唐,诗,七言绝句,何妨尘外却尘中 风舞寒漪月印空 洗钵与渠同一饱 未忧交臂失回公,"7,7,7,7",eac14c77ec40d16b851ad0227039d272,何妨 尘 外 却 尘 中 风舞 寒漪 月 印空 洗 钵 与 渠 同一 饱 未忧 交臂 失回 公
53e515b3-653a-4059-8bb4-ae2798dc3fc9,暮春泛西湖次口号韵呈程待制十首  其一,陈造,唐,诗,七言绝句,客舟日日野芳前 𫛸鴂鸣时始息肩 无絮可漂花可藉 良辰乐事属明年,"7,7,7,7",f034ab2ec67367328005358b37c79b71,客舟 日日 野芳 前 𫛸 鴂 鸣 时 始 息肩 无絮可 漂花可藉 良辰 乐事 属 明年
bea5b563-b227-4955-a27c-0b5f3399c799,暮春泛西湖次口号韵呈程待制十首  其二,陈造,唐,诗,七言绝句,湖山引兴尚能长 小贷诗愁放酒狂 蝴蝶应怜落春后 无聊时近绿樽傍,"7,7,7,7",9d1311b0bce1e5dbee259c9a9f0baf1b,湖山 引兴 尚 能 长 小贷 诗 愁 放 酒狂 蝴蝶 应怜落 春后 无聊 时 近 绿 樽 傍
45e036f4-465d-4e60-9052-50c83c6cf353,暮春泛西湖次口号韵呈程待制十首  其三,陈造,唐,诗,七言绝句,重到西湖可便回 前年待得水芝开 凭君问取闲鸥鹭 亲见跳珠溅客来,"7,7,7,7",6d5b4a2ff613d89ce653b047e498ecd9,重 到 西湖 可便 回 前年 待 得 水芝 开 凭 君 问取 闲 鸥 鹭 亲见 跳 珠 溅 客 来
c9b513d8-a92f-4961-9d98-6d1e44c40d25,暮春泛西湖次口号韵呈程待制十首  其四,陈造,唐,诗,七言绝句,几饭南山佛老宫 诗昌谭胜每舂容 不妨重就山间宿 蔬笋香茶未阙供,"7,7,7,7",5f4e4f985ee528f0322f9d383d422878,几 饭 南山 佛老 宫 诗昌 谭胜 每 舂 容 不妨 重 就 山间 宿 蔬笋 香茶 未 阙 供
757449c6-7cc2-49df-8da5-8ff8216e8f81,暮春泛西湖次口号韵呈程待制十首  其五,陈造,唐,诗,七言绝句,何须履道写新图 不用悲歌缺唾壶 岩壑清奇皆我有 利名缰锁向来无,"7,7,7,7",15c52139929edd1fdd3979a7894e9d21,何须 履道 写 新 图 不用 悲歌 缺 唾壶 岩壑 清奇 皆 我 有 利名 缰锁 向来 无
9c53d56c-8e8b-4ced-bc13-2c674df1af89,暮春泛西湖次口号韵呈程待制十首  其六,陈造,唐,诗,七言绝句,老来已谢著书忙 但向清游访睡乡 寄语深师与包叟 可无客枕假云堂,"7,7,7,7",67fd063280096f82d3c3151ec8d657f9,老来 已 谢 著书 忙 但 向 清 游访 睡乡 寄语 深 师 与 包叟 可 无客枕假云堂
1e5fa8ec-d844-47f5-b5b2-7f11eb7b8a63,暮春泛西湖次口号韵呈程待制十首  其七,陈造,唐,诗,七言绝句,行行抚事念前贤 修竹祠西碧嶂前 不复船归下双鹤 空缘酒渴酌寒泉,"7,7,7,7",32eca37cac5f82b272ec4027796fac66,行行抚 事念 前贤 修竹祠 西碧嶂 前 不 复船 归下 双鹤 空缘 酒 渴酌 寒泉
920070b0-0179-4359-9873-f39304c5213c,暮春泛西湖次口号韵呈程待制十首  其八,陈造,唐,诗,七言绝句,已规觞咏了余龄 径自无何到大庭 左界何人与调护 酒星移近少微星,"7,7,7,7",f6141148f5fdfd6617b606288d3bf7f6,已 规觞 咏了 余龄 径自 无何到 大庭 左界 何人 与 调护 酒星 移近 少 微星
3732ba39-7ef9-41ef-a77e-0920c0a04bcd,暮春泛西湖次口号韵呈程待制十首  其九,陈造,唐,诗,七言绝句,矲矮栏干锦绣筵 栏边仍泊女郎船 凭栏笑指玄真子 不是诗仙是酒仙,"7,7,7,7",c71c4235b5cce4afeb63ae7fb5789b3b,矲 矮 栏干 锦绣 筵 栏边 仍 泊 女郎 船 凭栏 笑 指 玄真子 不是 诗仙 是 酒仙
92c9357e-affc-4b18-ad6b-5b132c903d41,暮春泛西湖次口号韵呈程待制十首  其一○,陈造,唐,诗,七言绝句,诗到双峰自一家 纷纶仙卉杂天葩 几时共载西湖去 千纸看公写物华,"7,7,7,7",fc50fe235ef507690c067d8f34f73b62,诗 到 双峰 自 一家 纷纶 仙卉 杂天葩 几时 共载 西湖 去 千纸 看 公写 物华
3f09b84f-641b-461e-945d-3b917d351cd5,题济胜七物 一拄杖,陈造,唐,诗,七言绝句,惊蛇却犬破莓苔 筇竹随公几往回 龙化葛陂应未忍 为扶衰病作陈雷,"7,7,7,7",68d1094ba2c948b84e7696d2937f16b9,惊蛇却犬破 莓 苔 筇竹 随 公几 往回 龙化葛 陂 应 未 忍 为 扶 衰病 作 陈雷
995ef786-6342-4a42-89f3-8f2045769cff,题济胜七物 二扇,陈造,唐,诗,七言绝句,何人月样剪霜绨 改就新诗却自题 为惜持杯折花手 免教遮日步苏堤,"7,7,7,7",82b4eaf143188ee8bf6e3670e46e8dc7,何人 月 样 剪 霜 绨 改 就 新诗 却 自 题 为 惜持 杯折花手 免教 遮 日步 苏堤
248026ac-fae4-4502-bc73-6f1f3297b34c,题济胜七物 三钱箧,陈造,唐,诗,七言绝句,与人替得杖头闲 日日莲塘柳岸边 烂醉质衣吾不问 归时犹有买舟钱,"7,7,7,7",c42b043167ad093d2e1178095204e687,与 人 替得 杖 头 闲 日日 莲塘 柳 岸边 烂醉 质衣 吾 不问 归 时 犹 有 买 舟 钱
f25669f1-99b4-4c79-ba12-838c0b32e3cc,题济胜七物 四笔囊,陈造,唐,诗,七言绝句,毛锥老去未轻投 革带罗囊特命收 准拟西胡持酒处 偕翁濡首破诗愁,"7,7,7,7",cbc90f98cd45a4c5a7673e69d175993f,毛 锥 老 去 未轻 投 革带 罗囊 特命 收 准拟 西 胡持 酒处 偕 翁 濡 首 破 诗 愁
a5a44429-655e-48ed-a967-202199404c38,题济胜七物 五酒榼,陈造,唐,诗,七言绝句,相从有命每倾舒 不寄辕端即坐隅 肯落苏家悭妇手 深藏云待不时须,"7,7,7,7",ec75f6eddcbeda3bc5efbba405472f03,相从 有命 每 倾 舒 不 寄 辕端 即 坐 隅 肯落 苏家 悭 妇 手 深藏 云待 不时 须
d6c02dfc-16b5-4586-ab58-5f741118df15,题济胜七物 六钉鞋,陈造,唐,诗,七言绝句,几步山间属雨余 徐行犹可当安舆 计功高出芒鞋上 傍险冲泥得屡书,"7,7,7,7",7c8168fd2dc961d800e1a203037e69a1,几步 山间 属 雨 余 徐行 犹可 当 安舆 计功 高出 芒鞋 上 傍 险 冲 泥 得 屡书
05001288-64b0-4abe-b0fb-a867cace6f8c,题济胜七物 七村童,陈造,唐,诗,七言绝句,貌野言伧却近真 客前疎畧不能嗔 折花替我簪纱帽 看竹须渠问主人,"7,7,7,7",17345533a83babed952b5af8160a4479,貌 野 言 伧 却 近 真 客 前 疎 畧 不能 嗔 折花 替 我 簪 纱帽 看 竹 须渠 问 主人
fc86f2e9-946a-4d7d-b9b2-395e624c6bbf,题史髯诗卷后二首  其一,陈造,唐,诗,七言绝句,平生一士万金多 更恨诗人饿涧薖 羁旅忽成开笑口 软红尘底得阴何,"7,7,7,7",ce2cb38c7c91eeb964358991cbcc23b3,平生 一士 万金 多 更 恨 诗人 饿 涧 薖 羁旅 忽成 开笑 口 软 红尘 底 得 阴何
d0809f88-a0ad-466f-8b6c-bd1677c5a78b,题史髯诗卷后二首  其二,陈造,唐,诗,七言绝句,脑脂侵眼耐昏眵 诗卷犹便小字题 浪信奇方须损读 即今刮膜胜金篦,"7,7,7,7",7b274fe933781107ade1b0e084525853,脑脂 侵眼 耐 昏 眵 诗卷 犹便 小字 题 浪信 奇方 须 损读 即今 刮膜胜 金篦
5826d2b0-a088-4bc9-ab2f-5ee7e5ca0ce1,寄题高宾王诗后卷,陈造,唐,诗,七言绝句,韶頀充庭簉汉官 铺纾宏伟叹才难 高郎袖有如椽笔 却伴秋虫吊夜寒,"7,7,7,7",0d9b4e791da705bcceb2645fdfa3436e,韶 頀 充 庭 簉 汉官 铺 纾 宏伟 叹 才 难 高郎袖 有如 椽笔 却 伴 秋虫 吊夜 寒
8bef92a3-a55e-4d39-a8ed-91442ff894f6,泛湖十绝句  其一,陈造,唐,诗,七言绝句,荷面跳珠小溅衣 酒边团扇已停挥 湿云收尽人间暑 却度西山载雨归,"7,7,7,7",d331686dc9fe36c6ffd4002eeaab4af2,荷面 跳 珠 小 溅 衣 酒边 团扇 已 停挥 湿云 收尽 人间 暑 却度 西山 载雨 归
b5f1bcb1-57b1-4bc8-9e92-512ed0fb8c09,泛湖十绝句  其二,陈造,唐,诗,七言绝句,浦溆楼台远近殊 樽罍随处小踟蹰 高郎颇胜高常侍 解把西湖敌孟诸,"7,7,7,7",9849e24855bc773410774bd60571262b,浦 溆 楼台 远近 殊 樽 罍 随处 小 踟蹰 高郎 颇 胜 高常 侍 解 把 西湖 敌 孟诸
3198601f-0366-43fe-97f2-9a7bd1e2281b,泛湖十绝句  其三,陈造,唐,诗,七言绝句,银笔曾烦赞此君 即今墨色俨如新 因君细数登龙日 十九年前入幕宾,"7,7,7,7",05e7492a5146bef56e4c25983b197c2c,银笔 曾 烦 赞 此君 即 今 墨色 俨如 新 因 君 细数 登龙 日 十九年 前入 幕宾
dfdb6126-42c6-4877-9994-8ec5c7aa4685,泛湖十绝句  其四,陈造,唐,诗,七言绝句,嫩绿摇漪红藕香 雨膏烟腻午供凉 西湖到眼真西子 莫信温柔别有乡,"7,7,7,7",1f6a121cdaa728303b575138f23241bc,嫩绿 摇 漪 红藕香 雨膏烟腻 午 供 凉 西湖 到 眼 真 西子 莫信 温柔 别 有 乡
295b3562-c7cc-4fad-b187-160a50b2d9b1,泛湖十绝句  其五,陈造,唐,诗,七言绝句,桃叶相逢但交臂 李鬟何许费凝眸 尔曹岂解文字饮 应道吾侪输此筹,"7,7,7,7",acad3674119b2ac2a2fcbe5f9e121bca,桃叶 相逢 但 交臂 李鬟 何许 费 凝眸 尔曹 岂解 文字 饮 应道 吾侪 输 此 筹
b2431404-3cda-4deb-88f0-e17aa16da127,泛湖十绝句  其六,陈造,唐,诗,七言绝句,酒边凉意雨余生 望夜重期看月明 安得水仙会事发 巧随人意作阴晴,"7,7,7,7",6c4e66a8501a4fc5741d0506e4676b46,酒边 凉意 雨 余生 望夜 重期 看 月 明 安 得 水仙 会 事发 巧随人意作 阴晴
0788fe98-4d3a-4c44-903c-4c4d8d2c6245,泛湖十绝句  其七,陈造,唐,诗,七言绝句,底许行庖旋不空 小舟如织浪花中 盘珍俎实随供给 亦有红衣载短蓬,"7,7,7,7",a2561538d3bce3e331e840b3ba4c3907,底 许行 庖 旋 不 空 小舟 如织 浪花 中 盘珍 俎 实随 供给 亦 有 红衣 载 短蓬
3f7ab9e7-53d5-4f4c-86d3-61d9115ca499,泛湖十绝句  其八,陈造,唐,诗,七言绝句,寻得诗人到醉乡 银壶玉麈倍增光 小囊赋就鸳鸯锦 一路荷花别漾香,"7,7,7,7",82f07db00e8fbf92e1aafd1198525df7,寻得 诗人 到 醉乡 银壶 玉麈 倍增 光 小囊 赋 就 鸳鸯 锦 一路 荷花 别漾香
b560e369-39b5-4c62-920a-a20773bbaae5,泛湖十绝句  其九,陈造,唐,诗,七言绝句,玉人罢浴试梅粧 诗客挥毫落夜光 因病覆觞今破戒 为渠豪饮为君狂,"7,7,7,7",814608b10d9c676f4f2651eba4dd5e3e,玉人 罢浴 试 梅 粧 诗客 挥毫 落 夜光 因病 覆觞 今 破戒 为 渠 豪饮 为 君 狂
49490f55-7ed2-410a-bde0-f433cb2822e4,泛湖十绝句  其一○,陈造,唐,诗,七言绝句,楼前行客竞昂头 楼上齐声唱石州 衮遍实催犹未彻 暑风晴月各新秋,"7,7,7,7",c64adf82f6afb78ad631c3822cd483ba,楼前 行客 竞 昂头 楼上 齐声 唱 石州 衮遍实 催犹未彻 暑 风 晴 月 各 新秋
