id,title,author,dynasty,genre,poem_type,sentences_simplified,meter_pattern,hash,words
8adf009c-df04-4679-916b-3b4efa3efbc9,矮僧求頌,釋居簡,唐,诗,七言绝句,见说矮人多计较 大家知道不曾藏 只将丈六金襕挂 莫与诸方论短长,"7,7,7,7",075b8ad2f1952bbe685ebf0c12d63693,见 说 矮 人 多 计较 大家 知道 不曾 藏 只 将 丈 六 金 襕 挂 莫 与 诸 方论 短长
a18b778c-642d-44a7-84ec-8428386f9b34,示僧,釋居簡,唐,诗,七言绝句,善财去后无消息 重到华严更几人 尔向那边重到此 为吾拈却故园春,"7,7,7,7",ceb158248669e85290ee9e96d836eef0,善财 去后 无 消息 重到 华严 更 几 人 尔 向 那边 重到 此 为 吾 拈 却 故园 春
3766d391-8325-4daf-9b1f-abd09793c48e,示僧,釋居簡,唐,诗,七言绝句,近时直指似兰亭 枣木梅花总不真 哮本不逃萧翼眼 诸方亦有姓萧人,"7,7,7,7",00651fbb15194ed64fb49cd410cc872d,近时 直指 似 兰亭 枣木 梅花 总 不 真 哮本 不 逃 萧翼 眼 诸方亦 有 姓 萧 人
4c4fd5e4-f897-4028-bb97-ae64c067ded9,枯山,釋居簡,唐,诗,七言绝句,嵌岩礧砢无津润 踞地盘空隠雾深 万窍怒号从定起 试听枯木里龙吟,"7,7,7,7",f672a777da592d6ccc6e4b6b6aeaa8ab,嵌 岩 礧 砢 无 津 润 踞 地盘 空 隠 雾 深 万 窍 怒号 从定 起 试听 枯木 里 龙吟
f12a8903-7a80-4d65-b243-a8b478a6f91f,鐵巖,釋居簡,唐,诗,七言绝句,大铁围连小铁围 此岩应是此分支 是中别有三禅乐 弗是曾来可得知,"7,7,7,7",0d9d506ba1a7a5b719fcddbfef128ecb,大 铁围 连小 铁围 此 岩应 是 此 分支 是 中 别 有 三 禅乐 弗 是 曾来 可 得知
1e939bcc-325e-4a49-a862-382d64c6605d,砥堂,釋居簡,唐,诗,七言绝句,寸地了无凹凸处 不容刬削岂容耕 从生至死如周道 凡圣从教一路行,"7,7,7,7",c3bbe1776b7f4e39431c2cc71f1fd94a,寸地了无 凹凸 处 不容 刬 削 岂容 耕 从 生 至死 如周 道 凡圣 从教 一路行
59c64e81-7c8c-4458-b767-ccdc92629ad4,寓適,釋居簡,唐,诗,七言绝句,收雨岭云随所住 含风渊水偶然回 虚怀任性如云水 闲里徒将日月催,"7,7,7,7",cc508acd5e86d8782bdacda2e8277576,收雨 岭 云 随 所 住 含风渊 水 偶然 回 虚怀 任性 如云 水 闲里徒 将 日月 催
7404341c-626c-482d-997e-45fd469633c9,示徒,釋居簡,唐,诗,七言绝句,东山不管诸庄旱 无人领话最忧深 儿孙渐渐生涯别 翻笑当年错用心,"7,7,7,7",625603d25dd75437aa989f52b16629fa,东山 不管 诸 庄旱 无人 领话 最 忧 深 儿孙 渐渐 生涯 别 翻笑 当年 错 用心
b97a5191-aa48-4928-b753-9c5109fa9fe8,示徒弟,釋居簡,唐,诗,七言绝句,直上南山落发归 不传心法不传衣 衣盂自是闲家具 别有生涯尔合知,"7,7,7,7",651ebb88b2f9bba742d7efc5086c04a1,直 上 南山 落发 归 不 传 心法 不传 衣 衣盂 自是 闲 家具 别 有 生涯 尔 合知
91072d5c-458a-4a3c-90a8-a737361d28b8,悼越州空首座  其一,釋居簡,唐,诗,七言绝句,诸方已自懒相酬 有甚工夫缀袜头 要向折铛煨死饭 截流过了复随流,"7,7,7,7",010db317e3069a8ec4f73da3c0fec953,诸方 已自 懒 相酬 有 甚 工夫 缀 袜头 要 向 折铛 煨 死 饭 截流 过 了 复随 流
f35a9bcf-e1c1-4c7e-9fbf-f3671d4336c9,悼越州空首座  其二,釋居簡,唐,诗,七言绝句,生畏人知死便烧 何须书偈费𫍢𫍢 当时若受常师记 底用傍人为解嘲,"7,7,7,7",d3882dafd973374d5849113994744e1f,生畏 人 知死 便 烧 何须 书 偈 费 𫍢 𫍢 当时 若 受 常师 记 底 用 傍 人为 解嘲
ddbb9fd4-0a36-42bc-acc4-7fbfcc44a5b6,寄南翔遠講主  其一,釋居簡,唐,诗,七言绝句,白发垂垂尽入期 无人不笑此翁痴 人间五欲波澜阔 真忏何曾有尽时,"7,7,7,7",58fa74e54d557da659b9cc896651d201,白发 垂垂 尽入 期 无人 不笑此翁痴 人间 五欲 波澜 阔 真 忏 何曾 有 尽时
aac183d4-ac49-4b88-963b-b8cfcde752fd,寄南翔遠講主  其二,釋居簡,唐,诗,七言绝句,趁此身轻未死前 两忘隆暑与祁寒 从头打并东西了 车轴花中占一单,"7,7,7,7",2792b5515ef7cbbe7361ff1371e23d00,趁此 身 轻未 死 前 两 忘 隆暑 与 祁寒 从头 打并 东西 了 车轴 花 中 占 一单
b10e0404-7ce4-4477-9440-bdd234a9b901,彰教建法堂,釋居簡,唐,诗,七言绝句,善法堂倾法不倾 欲支一木要重新 行看堂下如云拥 孰谓今无老斲轮,"7,7,7,7",e054eba0cd8106bf196c57788487e2b1,善 法堂 倾法 不 倾 欲支 一 木要 重新 行 看 堂 下 如云 拥 孰谓 今 无 老 斲 轮
6d72e84a-3d21-4df7-9d0e-6cfe7e8a3167,相藏主往景山看藏經,釋居簡,唐,诗,七言绝句,梦中无字法门开 藏海云涛诈望崖 须信矮人多计较 逢人只道不曾斋,"7,7,7,7",0d1fb128c3419c2aa2bfefc8a8fd54f5,梦 中 无 字 法门 开 藏 海云涛 诈望 崖 须信 矮 人 多 计较 逢 人 只道 不曾 斋
805c153e-18f7-409b-b021-cccde0c79704,昌誦蓮經一日十二部滿十三萬部,釋居簡,唐,诗,七言绝句,十三万部粲芬陁 奈尔犹存数量何 回向是真精进处 动人春色不须多,"7,7,7,7",9b21091d86d77a432c39b3dca0abfb11,十三万 部 粲芬 陁 奈尔 犹存 数量 何 回向 是 真 精进 处 动人 春色 不须 多
c9f917df-4b99-42ef-8e0e-c050226f327d,綿州演兄歸鄉  其一,釋居簡,唐,诗,七言绝句,笑中曾捋鬼头巾 说甚瞿昙鬼眼睛 附子天雄州土外 自余都是个般僧,"7,7,7,7",6bef626185f78f1a8b838d246ae0326c,笑 中曾 捋 鬼 头巾 说 甚 瞿 昙鬼 眼睛 附子 天雄 州 土 外 自余 都 是 个般 僧
dfc0cf4f-e874-49fa-9b83-86250b79e6ae,綿州演兄歸鄉  其二,釋居簡,唐,诗,七言绝句,南方搅吵丛林徧 西蜀来归呈旧面 相逢道伴若交肩 掣电之机徒劈箭,"7,7,7,7",be3fc8805e0ab36ebee261f25637eb92,南方 搅吵 丛林 徧 西蜀来 归 呈 旧面 相逢 道伴 若 交肩 掣电 之 机徒 劈 箭
01b267d1-83d1-4699-a72c-eff7d26d6ceb,寄照長老,釋居簡,唐,诗,七言绝句,梁普通年雪砌深 有人立雪觅安心 何如瞥转单于调 一鼓猊弦绝众音,"7,7,7,7",1c9c164f1c49c6c11afb6d87337ee242,梁 普通 年 雪 砌 深 有人 立雪觅 安心 何如 瞥转 单于 调 一 鼓猊 弦绝众音
693a0bd1-e9f5-41e1-9e20-f1bfb87238e5,化柴,釋居簡,唐,诗,七言绝句,死火何妨且活埋 傍城傍郭采无柴 家风不与疎山别 莫是遭他受记来,"7,7,7,7",060456333aad06575ad643e2361b6edc,死 火 何妨 且 活埋 傍城傍郭采无柴 家风 不 与 疎 山 别 莫 是 遭 他 受 记来
750b6a16-bcb4-41cb-abf8-b8a1e694a9df,靈隠散知識會首求頌,釋居簡,唐,诗,七言绝句,无识无知五十三 劳佗童子遍咨参 朝来灵隠罗斋去 添得从前满面惭,"7,7,7,7",14fb410935f45015a718b0c7b6cd1515,无识 无知 五十三 劳佗 童子 遍 咨参 朝 来 灵 隠 罗 斋 去 添 得 从前 满面 惭
908c0c90-25be-4a76-b74b-b83018095c2d,斷臂化士求語,釋居簡,唐,诗,七言绝句,勇猛身心断一支 腕头无数火星飞 毗卢处处开楼阁 徒效齐腰立雪时,"7,7,7,7",607e2067124dda24dd43dc84d4de814e,勇猛 身心 断 一支 腕头 无数 火星 飞 毗卢 处处 开 楼阁 徒效 齐腰 立雪 时
de5ce78c-65da-4555-8669-fcaddd0b8629,謝簟化主,釋居簡,唐,诗,七言绝句,三载归来打葛藤 打成秋水水无痕 脇尊者睡长开眼 脇亦何曾印簟纹,"7,7,7,7",bf8a2626913ae86cda35adb7acfa9388,三载 归来 打 葛藤 打成 秋水 水无痕 脇 尊者 睡长 开眼 脇 亦 何曾 印 簟 纹
328f2cec-1d0a-45b3-a669-bde210c3f915,化齋,釋居簡,唐,诗,七言绝句,解结冬年办四斋 赤洪崖打白洪崖 信心檀越家家是 只告诸天次第排,"7,7,7,7",b5174e6521caf5d17c822901560b2b10,解结 冬年 办 四 斋 赤洪崖 打 白洪崖 信心 檀 越 家家 是 只 告 诸天 次第 排
a9c41f6d-3866-44a7-be26-a2e09e3649c7,道場火後化緣,釋居簡,唐,诗,七言绝句,千间百堵尽飞灰 见说恩光早晚回 覩史夜摩新样范 定随丛玉下天来,"7,7,7,7",87e4a184dec39ebdb1850c7afedb93aa,千间 百堵 尽飞灰 见 说 恩光 早晚 回 覩 史 夜 摩 新 样 范 定随 丛玉 下天 来
809e6584-21d4-453e-a5d8-d1bfcecc9732,化鍾,釋居簡,唐,诗,七言绝句,试看大扣大鸣时 出冶顽铜亦自奇 弗是神通非妙用 虎岩炉鞴只如斯,"7,7,7,7",78adea3b0597f7d797f65d86ff587179,试看 大 扣 大 鸣 时 出 冶 顽 铜 亦 自奇 弗 是 神通 非 妙用 虎岩 炉 鞴 只 如 斯
1f515591-5f65-4a04-bcd7-ea9e0505f1ba,化桶,釋居簡,唐,诗,七言绝句,雪峰道底曾知有 已落曾郎陷虎机 若也诸人得受用 何须二子下针锥,"7,7,7,7",4f3d68129506cb141d5187f3cb13dee2,雪峰 道 底 曾 知有 已 落 曾郎 陷 虎 机 若 也 诸人 得 受用 何须 二子 下 针 锥
392ed45e-a4bb-4d35-91dc-902dc15be565,行者往淮南求僧,釋居簡,唐,诗,七言绝句,尘埃千里走长淮 要觅袈裟裹草鞋 尽洗淮山当日恨 好将诸祖一坑埋,"7,7,7,7",0fa97cdb8ac11f08dd950d636a3b8bd9,尘埃 千里 走 长淮 要觅 袈裟 裹 草鞋 尽 洗 淮山 当日 恨 好 将 诸祖 一 坑 埋
406c0367-663e-4903-b0f2-951d6952fd2e,趙希旦求頌化錢還度牒債,釋居簡,唐,诗,七言绝句,天源流入梵王家 出斗何曾有跳虾 拈却债根除却病 莫教话堕似师爷,"7,7,7,7",d6f3111d6216ad2c11e759b8e2161595,天 源 流入 梵 王家 出斗 何曾 有 跳 虾 拈 却 债 根除 却 病 莫教话 堕似 师爷
67444afe-ebf7-4389-a34f-7fa4395aa8d2,行者念蓮經求頌,釋居簡,唐,诗,七言绝句,纸上陈言六万余 一音清彻夜堂虚 逢人若问经头字 但道从来不识书,"7,7,7,7",d8f14d3c5059c784f4673e6fb6f0c034,纸 上 陈言 六万余 一 音 清 彻夜 堂虚 逢 人 若 问经头 字 但 道 从来不 识书
3403cfa5-9efb-4ac9-94a4-63e8a7f466fc,行者求頌,釋居簡,唐,诗,七言绝句,好将长剑割髭须 头上蓬蓬亦刬除 办取一生都弗会 听佗会底费分疎,"7,7,7,7",02e46868bcff0f7ac4ac824a5017bb0b,好 将 长剑 割 髭须 头上 蓬蓬 亦 刬 除 办取 一生 都 弗 会 听 佗 会 底 费分 疎
6bf31e6b-0dc8-42aa-9c7c-cef69608dde9,送僧見孤雲掩室,釋居簡,唐,诗,七言绝句,若见孤云与老开 款从囚口录将来 须知北磵无涓滴 但道亲曾探水回,"7,7,7,7",abbec3444831f69a8c3d6874ba49cae1,若 见 孤云 与 老 开 款 从 囚口录 将来 须知 北 磵 无 涓滴 但 道亲 曾 探水 回
e3998e5b-58be-41e9-a97f-0245808b7cd8,看經僧求語,釋居簡,唐,诗,七言绝句,尘中埋没大经卷 要出此经须破尘 识得此经无一字 百千万遍一般春,"7,7,7,7",5778422b5f247ea6cd9998180cd6632a,尘 中 埋没 大 经卷 要出 此 经须 破尘 识 得 此经无一字 百 千万遍 一般 春
35cca50b-a516-48a1-a32a-db5d7160d00e,簡沙彌,釋居簡,唐,诗,七言绝句,借得山翁一字名 切须作福保长生 要知闽蜀同风句 为我提撕折脚铛,"7,7,7,7",cf689564c5660891085befcf3808b55e,借 得 山翁 一 字 名 切须 作福 保长 生 要知 闽 蜀 同 风句 为 我 提 撕折 脚铛
c96d5ca0-fd4a-434a-a0c6-29f70ce9b83a,修塔,釋居簡,唐,诗,七言绝句,许玄度至歌来暮 多宝尊临便放光 况是太平无事日 人中王敬法中王,"7,7,7,7",32461783e962864cd6fb0856b5dc489c,许玄度 至 歌来 暮 多 宝尊临 便 放光 况是 太平无事 日 人 中 王敬法 中王
eb0d63c6-dcab-4156-8fde-552282473f56,圓覺會首求頌,釋居簡,唐,诗,七言绝句,大圆觉海胜伽蓝 七佛之师首发谭 引得上乘菩萨子 大光明藏作同参,"7,7,7,7",de965f8e813d83536b06c3af3b2180a5,大圆 觉海 胜 伽蓝 七 佛 之 师 首发 谭 引得 上乘 菩萨 子 大 光明 藏 作同 参
ae7cec75-caee-4c0d-ad37-34e72235f965,寄勝樂居士,釋居簡,唐,诗,七言绝句,邪法难扶只自谙 东西不辨作司南 输佗胜乐无玄解 禅板蒲团老住庵,"7,7,7,7",ab1b1101fda1f1114fc0f560720aec31,邪法 难 扶 只 自谙 东西 不 辨作 司南 输 佗 胜 乐无玄解 禅板 蒲团 老 住 庵
9e0aa3f8-e630-4819-b8da-67f710808e69,寄了菴居士,釋居簡,唐,诗,七言绝句,炼得精明富绝隣 人间天上散闲人 去年贫与今年别 未必香严有此贫,"7,7,7,7",c89d4be08ba01ab73afe083a19149324,炼得 精明 富绝 隣 人间天上 散 闲人 去年 贫 与 今年 别 未必 香严 有此 贫
7dfef98a-174a-406a-845d-68f1c54d57d5,寄暉道友,釋居簡,唐,诗,七言绝句,昔闻万法谁为侣 不觉连声叫了晖 想见老来新活计 不将三点作圆伊,"7,7,7,7",d9be479b2c3c717ba38957ed40dff460,昔 闻 万法 谁 为 侣 不觉 连声 叫 了 晖 想见 老 来 新 活计 不 将 三点 作圆 伊
ce869415-6c18-4f8b-b8ff-445e90935d9a,送言道士,釋居簡,唐,诗,七言绝句,净极光通跬步初 谨终宜密不宜疎 掌中秽浊三千刹 觑定根源著一锄,"7,7,7,7",50c18f9f5670e2a668fc893319821193,净 极光 通 跬步 初 谨终宜 密 不宜 疎 掌中 秽浊 三千 刹 觑 定 根源 著 一 锄
43b1c979-4366-41ac-b089-46937894ea73,寄逸長老,釋居簡,唐,诗,七言绝句,平高就下得其宜 出谷迁乔只旧蹊 天上好风人不见 共观百草一头低,"7,7,7,7",3bd247ec754182c75dd68ca16024ca98,平高 就 下得 其 宜 出 谷迁乔 只旧 蹊 天上 好 风人 不见 共观 百草 一头 低
85733e2a-ee54-406c-adc5-1bfed8f98967,送楊知官,釋居簡,唐,诗,七言绝句,铛煮乾坤不作难 至神至妙弗相谩 回头总在乾坤里 毕竟铛从底处安,"7,7,7,7",fd3e4f9bb5217a00b62848edfb52d446,铛 煮 乾坤 不 作难 至 神 至 妙弗相 谩 回头 总 在 乾坤 里 毕竟 铛 从 底处 安
d99c6172-6748-4eb9-b661-7eed396dedf5,送夔州何道士,釋居簡,唐,诗,七言绝句,夔峡希声洞杳微 赏音犹笑武当迟 灵蛇束破玄龟壳 应恨从前骨裹皮,"7,7,7,7",723b98c6c4c2fcb9d46e75d085a2bc00,夔峡 希声洞 杳微 赏音 犹 笑 武当 迟 灵蛇 束破玄 龟壳 应恨 从前 骨裹 皮
8d36b6bc-45bf-4261-91c5-2cd94102d969,浄髮人求頌,釋居簡,唐,诗,七言绝句,一毛头上宝王刹 百亿毛头三昧门 抹过顶门犹欠在 要须刬草尽除根,"7,7,7,7",4c0268b92da059608c0ed754460ed5e3,一 毛 头上 宝王 刹 百亿 毛头 三昧 门 抹 过 顶门 犹 欠 在 要 须 刬 草 尽 除根
5a3d40c8-dce8-4b9d-ac47-2328ee1a7ddc,道友求頌,釋居簡,唐,诗,七言绝句,平常退一步行时 浑似输机国手棋 成就自家行履处 路逢巇崄亦平夷,"7,7,7,7",316f632eb6c81d659bf6f7bed10f7294,平常 退一步 行时 浑似 输机 国手 棋 成就 自家 行履 处 路 逢 巇 崄 亦 平 夷
7edd0a27-f3c4-4020-8dd0-9bab4ad69845,幹元宵燈,釋居簡,唐,诗,七言绝句,门前来往沸笙箫 门里何曾厌寂寥 我欲烧灯看佛面 莫将风雨罢元宵,"7,7,7,7",b664b8d9e86e578d1cba388365deef04,门前 来往 沸 笙箫 门 里 何曾 厌 寂寥 我 欲 烧 灯 看 佛面 莫将 风雨 罢 元宵
add15433-2fe1-4e20-8e37-5065519bfff8,行者刺血寫蓮經求語,釋居簡,唐,诗,七言绝句,一会灵山未陆沈 纷然血指痛连心 比丘身在普门品 空向指头尖上寻,"7,7,7,7",1380210217383da6a5db9b9dbf45756a,一会 灵山 未陆 沈 纷然 血指痛连心 比丘 身 在 普门品 空向 指头 尖 上 寻
7b937d82-6831-4d90-a377-8436234e5243,端炭頭求語,釋居簡,唐,诗,七言绝句,袖间束手不知寒 炙手从他向热官 除却火炉头上事 别无分付越州端,"7,7,7,7",e9a3026a29bc47d1ff8e81f8be632f85,袖间 束手 不知 寒 炙手从 他 向 热官 除却 火炉 头上 事 别 无 分付 越州 端
579751f9-6845-442f-98cf-b716c4b36328,十人書經,釋居簡,唐,诗,七言绝句,葛藤本子燎无余 正好忘筌复纵鱼 便是太平无事日 如何又倩十人书,"7,7,7,7",e2f50a8d0bf7abfe4ac5796d293be528,葛藤 本子 燎 无余 正好 忘 筌 复纵 鱼 便是 太平无事 日 如何 又 倩 十 人 书
7db1aef7-3f5f-4f1d-80bf-a7cda98e4397,藏雲,釋居簡,唐,诗,七言绝句,层层叠叠烂银堆 无蒂无根卷复开 犹有壮心诛旱魃 出山为雨却归来,"7,7,7,7",5928e64dc3cf801cc66ea7351367470e,层层叠叠 烂 银堆 无蒂无根卷复开 犹 有 壮心 诛 旱魃 出山 为 雨 却 归来
08c7daf1-093b-4bd4-b72d-bec3f5be691f,書三生石畫圖,釋居簡,唐,诗,七言绝句,不觉担泉带月归 三生旧话水滨知 更酬十二年前约 何似晴簷一笑时,"7,7,7,7",c27bddfe518834a8f582a1b8caaf0f15,不觉 担泉 带 月 归 三生 旧 话 水滨 知 更酬 十二年 前 约 何似晴 簷 一 笑 时
026fd7f4-d466-4740-a888-fa4331c6fc9c,其源,釋居簡,唐,诗,杂言,未达其源 十分成现 若是其源 岂无方便 后箭尤深 何如前箭 铁壁银山通一线,"4,4,4,4,4,4,7",84d63396df0749ae4edf26b2a3ee24ca,未 达 其 源 十分 成现 若是 其 源 岂 无 方便 后箭 尤深 何如 前箭 铁壁 银山 通 一线
9a5c52fe-d3fd-4f35-88a7-43af898be7aa,行者求頌,釋居簡,唐,诗,七言绝句,曩时随我起鄞江 望我山灵与径双 狡兔有时平地起 莫于旧处守枯桩,"7,7,7,7",a49fc1cf9fe63de62a1b9ce942f40487,曩 时 随 我 起 鄞江 望 我 山灵 与 径 双 狡兔 有时 平地 起 莫于 旧 处守 枯桩
f5768103-85de-41e6-bb57-3c75e98683d7,天童俊侍者求頌,釋居簡,唐,诗,七言绝句,笑将三应谩痴绝 老贼豩哉诈受谩 听尔情忘恩义断 珊瑚枝上月团团,"7,7,7,7",8becb8469759318860435eda3681e5eb,笑 将 三 应 谩痴 绝 老贼 豩 哉 诈 受 谩 听尔情 忘 恩义 断 珊瑚 枝 上 月 团团
ae9961fc-e804-4b02-90b1-cf6607a7c37b,相士求語,釋居簡,唐,诗,七言绝句,先生眸子碧于秋 把我形容内外搜 我有未生前面目 拟于何处说来由,"7,7,7,7",b821fa2c53e450eb27ae36cf4f7b8ca9,先生 眸子 碧于秋 把 我 形容 内外 搜 我 有 未 生前 面目 拟 于 何处 说来 由
66bae164-a6ee-4b41-bf5a-994ca2fbd95c,求僧,釋居簡,唐,诗,七言绝句,不去选官来选佛 有心作佛已非真 丈夫别有翀天志 肯学佗家不正因,"7,7,7,7",ecf074abe3fcaa426701878d323684b3,不 去 选 官 来 选佛 有心 作佛 已非 真 丈夫 别 有 翀 天 志 肯学佗 家 不正 因
debb5008-6e99-472e-b655-f863be6a94b9,笑堂,釋居簡,唐,诗,七言绝句,汝向谁家悟此机 有谁相委破颜时 若提金色头陁话 后二千年尚皱眉,"7,7,7,7",db129f0e6d4133db112e152d322e5cc1,汝向 谁家 悟 此 机 有 谁 相 委破 颜时 若 提 金色 头 陁 话 后 二千年 尚 皱眉
d9f1a398-a401-4694-8da7-b77563343f1c,竹坡丘知府哭子以偈寄之,釋居簡,唐,诗,七言绝句,绝杨合为扬雄叹 无子当于伯道哀 尚有曾元养曾子 少宽夫子哭颜回,"7,7,7,7",0ebec0468ab2d4695d780b0d41433dce,绝 杨 合为 扬雄 叹 无子 当于 伯道哀 尚有 曾元养 曾子 少 宽 夫子 哭 颜回
11dd8dde-4591-4af2-8417-7d42b65a1cd6,趙郡王施鬬綵法被薦女因爲說偈,釋居簡,唐,诗,杂言,倚福修慧 深丹浓翠 倚慧修福 砌锦层縠 福慧两全 众彩明鲜 紫不乱朱 缟不碍玄 惟茜惟碧 参鳞差翼 空王座上 一片如织 善哉命妇 巧思精究 劝化诸女 如出一手 惟此命妇 诸善女人 于寿域中 克康克宁 女子有行 归宁母家 载殒淑身 发明心花,"4,4,4,4,4,4,4,4,4,4,4,4,4,4,4,4,4,4,4,4,4,4,4,4",df7b0084ac15e77390b7e0ab31e71b62,倚 福修慧 深丹 浓翠 倚 慧修福 砌 锦 层 縠 福慧 两全 众彩 明鲜 紫 不乱 朱 缟 不碍 玄 惟 茜 惟碧 参鳞差翼 空 王座 上 一片 如织 善哉 命妇 巧思 精究 劝化 诸 女 如出 一手 惟此 命妇 诸善 女人 于 寿域 中 克康克宁 女子 有行 归宁 母家 载殒 淑身 发明 心花
65c1d581-5361-412a-b754-8e0dc8f3e19a,寄壞庵,釋居簡,唐,诗,七言古体,坏庵老牛老捏怪 刚把虚空立疆界 不知烧作一聚灰 问云此怪坏不坏 今犹不死亦不烧 掩息弗与生同条 苕溪清印故山月 一点灵犀通夜遥 倒刹拈花各三昧 会底不知渠不会 珊瑚树林日杲杲 东倒何妨复西攂,"7,7,7,7,7,7,7,7,7,7,7,7",15292d01219bae33e20cc37ccb027ede,坏 庵 老牛 老 捏 怪 刚 把 虚空 立 疆界 不知 烧作 一 聚灰 问云 此 怪 坏 不坏 今 犹 不 死 亦 不烧 掩息 弗 与 生同 条 苕溪 清 印故山 月 一点灵犀 通夜 遥 倒 刹 拈花 各 三昧 会底 不知 渠 不会 珊瑚 树林 日 杲杲 东 倒 何妨 复 西 攂
7577c765-9f5c-45f0-a300-261b36d2882d,偈頌一百三十三首  其一,釋居簡,唐,诗,杂言,趁鼠入角 吹糠著米 直下翻身 剑去久矣,"4,4,4,4",5863582cc3a37e11348394708e3ba2dd,趁鼠入角 吹 糠 著 米 直 下 翻身 剑 去 久 矣
cd470706-2e50-4d32-9753-5d39f9e3527a,偈頌一百三十三首  其二,釋居簡,唐,诗,杂言,信脚行 信口道 一步登高 全身入草 知心若解相扶 好把禅床靠倒,"3,3,4,4,6,6",83349d6d4ee6507d5f39f1eed140f28a,信 脚行 信口 道 一步 登高 全身 入 草 知心 若 解 相扶 好 把 禅床 靠 倒
5d0fdf20-3740-41a1-a559-3edd21616740,偈頌一百三十三首  其三,釋居簡,唐,诗,杂言,面门一思 长时无间 便与么去 讨甚么盌 得路塞路 看楼打楼 攀缘四天下 屋里贩杨州,"4,4,4,4,4,4,5,5",5b8e89fa5de4a5fee63c0e3f96471ba8,面门 一 思 长 时 无间 便 与 么 去 讨 甚么 盌 得路塞路 看楼 打楼 攀缘 四 天下 屋里 贩 杨州
e4afa5e6-f27b-4483-a3e5-544e34686222,偈頌一百三十三首  其四,釋居簡,唐,诗,七言绝句,无愧于心对圣僧 不图人爱爱人憎 打刀不是并州铁 谁与诸方剪葛藤,"7,7,7,7",6c714f3c55b6bc3e826a91fc458475e1,无愧于心 对 圣僧 不图 人 爱 爱人 憎 打 刀 不是 并州 铁 谁 与 诸 方 剪 葛藤
556d7047-668b-4a80-9283-69989154f7c8,偈頌一百三十三首  其五,釋居簡,唐,诗,杂言,以大圆觉为我伽蓝 身心安居 平等性智 吃官酒 卧官街 当处死 当处埋 本来无位次 何用强安排,"8,4,4,3,3,3,3,5,5",42d58dc13891382b8a44a53c357a0b8b,以 大圆 觉为 我 伽蓝 身心 安居 平等性 智 吃 官酒 卧官街 当 处死 当处 埋 本来 无 位次 何用 强 安排
bef02586-5c3d-4418-b5eb-e54cbf8d88cb,偈頌一百三十三首  其六,釋居簡,唐,诗,七言绝句,七宝莲花品字开 一花一叶一楼台 水禽啼在深花里 花在水禽啼处开,"7,7,7,7",7dcdc9992141749773d45e86057b9092,七宝 莲花 品字 开 一 花 一叶 一 楼台 水禽 啼 在 深花里 花 在 水禽 啼 处开
b175dcf4-6d61-412e-a8c2-cd9a1277eb14,偈頌一百三十三首  其七,釋居簡,唐,诗,五言绝句,还债金轮种 陈年甘蔗苗 九龙翻雪浪 滴水也难消,"5,5,5,5",d0e2cebdd8c9b3bcd46d468a3135bd9f,还债 金轮 种 陈年 甘蔗 苗 九龙 翻雪浪 滴水 也 难 消
ba404244-da23-4507-a035-59bc9e3a8268,偈頌一百三十三首  其八,釋居簡,唐,诗,杂言,师子当门 谁敢觑著 仁义道中 放过一著,"4,4,4,4",5a280b3c5994f176ee3c75c2969da1ce,师子 当门 谁 敢 觑 著 仁义 道 中 放过 一 著
fe731dd6-c515-49e7-b0a6-99a76c134dee,偈頌一百三十三首  其九,釋居簡,唐,诗,杂言,节外生枝 劣中取胜 辍己为人 无乃太甚,"4,4,4,4",09fb15267493a2898934bbc8813da228,节外生枝 劣 中 取胜 辍 己 为 人 无 乃 太甚
08a540b5-ac76-48f8-b48e-5e2b564afedc,偈頌一百三十三首  其一○,釋居簡,唐,诗,杂言,黄梅七百 如龙争珠 因甚今日 劫在这里 争之不足 让之有余,"4,4,4,4,4,4",17d3dccfc11c4bc398d30374fca74585,黄梅 七百 如 龙争 珠 因甚 今日 劫 在 这里 争之 不足 让 之 有余
e89228b9-1f5d-49ba-a613-f6cb5ec22567,偈頌一百三十三首  其一一,釋居簡,唐,诗,七言绝句,从来不解强安排 掷地金声破草鞋 无位真人无面目 何妨运水及搬柴,"7,7,7,7",37b2122a54cff5675a4970835a22de17,从来不 解强 安排 掷地金声 破 草鞋 无位 真人 无 面目 何妨 运水 及 搬 柴
cf9c8810-a8e1-44c8-a887-73769d4327c3,偈頌一百三十三首  其一二,釋居簡,唐,诗,七言绝句,试问卧云深处客 不知何以答升平 荡然至化难逃避 万里尧天一点云,"7,7,7,7",88d2accb78b5976e756964f338ed113b,试问 卧云 深处 客 不知 何以 答 升平 荡然 至 化难 逃避 万里 尧 天 一点 云
814400de-7a41-499c-83fe-f152250c5331,偈頌一百三十三首  其一三,釋居簡,唐,诗,杂言,枯木寒灰 铜崖铁壁 春到无痕 春归无迹 桃花红 李花白 明眼人前 一场狼藉,"4,4,4,4,3,3,4,4",5d6eb02d83550dacc07d165eaeec7897,枯木 寒灰 铜崖 铁壁 春 到 无 痕 春归无迹 桃花 红 李 花白 明眼人 前 一场 狼藉
c5e84d19-6237-4978-bb33-6675ac95ba3d,偈頌一百三十三首  其一四,釋居簡,唐,诗,杂言,初于闻中 入流忘所 圆通路绝 满面尘埃 洞门无锁钥 俗客不曾来,"4,4,4,4,5,5",c8f765eed2a6dfefdc59477a8d3cb1a7,初于 闻 中 入流 忘所 圆通 路 绝 满面 尘埃 洞门 无 锁钥 俗 客 不曾 来
a0e002e1-5ea8-4637-8cec-8c3642a893fb,偈頌一百三十三首  其一五,釋居簡,唐,诗,五言绝句,学道如钻火 逢烟未可休 直待金星现 曹门取郑州,"5,5,5,5",8d5573e19434749e53ea6b66c6cb4a18,学道 如 钻 火 逢烟未可休 直待 金星 现 曹门 取 郑州
bddee133-c4f0-4285-bfac-cb98e9611469,偈頌一百三十三首  其一六,釋居簡,唐,诗,七言绝句,鼎湖龙去不知还 遥想清都虎豹闲 欲借刚风朝紫阙 九天阊阖正开关,"7,7,7,7",430ed0f9a0e3c4390633d949f74fd745,鼎湖龙去 不知 还 遥想 清 都 虎豹 闲 欲 借 刚风 朝 紫阙 九天 阊 阖正 开关
1fa7d867-609b-4df0-b392-be0cc1f35d8e,偈頌一百三十三首  其一七,釋居簡,唐,诗,杂言,晷运推移 日南长至 应时纳祜 看楼打楼 群阴消剥尽 特地一场愁,"4,4,4,4,5,5",d7b3965812b54105102fc529e8f4955e,晷 运 推移 日南 长至 应 时 纳祜 看楼 打楼 群阴 消剥 尽 特地 一场 愁
7171051b-f3d7-4a50-a0bf-69539e8832f0,偈頌一百三十三首  其一八,釋居簡,唐,诗,七言绝句,六年勤苦竟何如 为问君王记得无 直下虽知难抵讳 到头终不受涂糊,"7,7,7,7",35623d9d99fff03fd9736c94d909e2a5,六年 勤苦 竟 何如 为 问 君王 记得 无 直下 虽 知难 抵讳 到头 终不 受涂 糊
