id,title,author,dynasty,genre,poem_type,sentences_simplified,meter_pattern,hash,words
798e097e-12cc-41e9-868e-888046f3cc06,次韵程给事会稽怀古即事,赵抃,宋,诗,五言古体,东南杭与越 形势夹长川 地占一方秀 天生万象全 两城俱卓尔 列郡岂加焉 异世称无间 同时较有偏 厥民如贵简 彼国实居先 大海收淮渎 群山冠幅员 古人踪欲见 游客目先穿 况自醇风俗 从来省朴鞭 有年人既庶 乐教志弥坚 每得前朝事 尝由众口传 土疆归阙下 州宇辟湖边 未苦秦来幸 先经霸擅权 有贤思避世 择地效高眠 盘屈稽山势 嵯峨玉笥巅 茂林侵碧汉 修竹挂青烟 东浙潮声近 西陵草色鲜 四明登陆显 五泄夹溪沿 渔浦从舟楫 仙居远市廛 山青难入画 花灼正如燃 石伞阴遮径 松潭韵写弦 千峰云叆叇 双涧水潺湲 灵迹曾游处 清风可坐延 龟浮山出浪 龙去井迷年 泉涌寻源出 萝繁附木缠 屏危开石上 星摘射岩前 仙髻传今古 峰形露丑妍 法华初赐号 释子已超禅 一感因人异 群言可理诠 遍随高下赏 潜解利名牵 民室常盈目 城𬮱异及肩 通幽云底路 朝接洞中天 必有千年隐 都忘万事煎 严园烟水乱 樊榭柳花颠 圣阁迎仙母 湖楼望彩船 越台凌缥缈 溪女鬭婵娟 野景诚无限 游人岂独专 清虚宫刹古 恍惚岁时迁 宝相灵犹验 云门瑞复还 尘埃笼古壁 章句列前贤 醮礼因勤甚 龙宫尚俨然 鱼池乖本意 僧罟触轻涟 凿石成金像 营庵对玉莲 瑰奇天桂室 潇洒宝林篇 历历森豪俊 昭昭著简编 兰亭真翰笔 桃谷旧神仙 想像人堪慕 凄凉物足怜 公卿夸道路 父子遁林泉 废宅仙宫立 还乡世事捐 嗟时徒役役 味道益干干 种墓藏山穴 耸祠阚水壖 方干栖逸地 祖贯起英躔 相隐今遗迹 侯封昔见旜 锦衣渐我得 车帐为民褰 臣力难堪矣 君仁未舍旃 挺身徒尽瘁 报德乏微涓 所向知师古 干时愧学圆 玑衡中切冒 条教外颁宣 每慕黄居颍 曾卑隗相燕 有为怀黾勉 无术可收甄 得请乡邦便 躬祠祖垅虔 耕桑初劝谕 饥疫偶成连 赈发无深惠 疲劳获少痊 阖封方富稔 载路息迍邅 近幸同年代 前符昔日缘 一麾来镇抚 千骑为盘旋 弊政因民革 烦文到日蠲 恩随和气浃 令比置邮遄 美誉皆腾实 清香已胜膻 善良陶静化 奸猾洗前愆 吏畏输心鉴 民深入善渊 课书人第一 轺召里逾千 身起侯藩政 班趋秘殿联 谋猷光帝座 议论溢经筵 道合风云会 功高玉石镌 正宜裨日月 未可问园田 士论逾时望 人心曷月湔 声名加显显 歌颂转翾翾 预喜明贤遇 须知直道便 中宸深有眷 外补实难铨 行为山阴老 聊收一大钱,"5,5,5,5,5,5,5,5,5,5,5,5,5,5,5,5,5,5,5,5,5,5,5,5,5,5,5,5,5,5,5,5,5,5,5,5,5,5,5,5,5,5,5,5,5,5,5,5,5,5,5,5,5,5,5,5,5,5,5,5,5,5,5,5,5,5,5,5,5,5,5,5,5,5,5,5,5,5,5,5,5,5,5,5,5,5,5,5,5,5,5,5,5,5,5,5,5,5,5,5,5,5,5,5,5,5,5,5,5,5,5,5,5,5,5,5,5,5,5,5,5,5,5,5,5,5,5,5,5,5,5,5,5,5,5,5,5,5,5,5,5,5,5,5,5,5,5,5,5,5,5,5,5,5,5,5,5,5,5,5",1237f9827c6fe31d7bd64f2606b95675,东南 杭与越 形势 夹 长川 地 占 一方 秀 天生 万象 全 两城 俱 卓尔 列郡 岂加 焉 异 世 称 无间 同时 较 有 偏 厥 民如贵 简 彼国 实居 先 大海 收 淮渎 群山 冠 幅员 古人 踪 欲 见 游客 目先 穿 况自醇 风俗 从来 省 朴 鞭 有 年 人 既 庶 乐教志 弥坚 每 得 前朝 事 尝 由 众 口传 土疆 归 阙 下 州 宇辟 湖边 未 苦 秦来 幸 先经 霸 擅权 有贤思 避世 择 地效 高 眠 盘 屈稽 山势 嵯峨 玉笥巅 茂林 侵 碧 汉 修竹 挂 青烟 东浙 潮声 近 西陵 草色 鲜 四明 登陆 显 五 泄 夹 溪 沿 渔 浦 从 舟楫 仙居 远 市廛 山青 难 入画 花灼 正如 燃 石伞 阴遮径 松潭韵 写 弦 千峰 云 叆 叇 双 涧水 潺湲 灵迹 曾 游 处 清风 可坐 延 龟 浮山 出浪 龙 去 井 迷 年 泉涌 寻源出 萝繁附木 缠 屏危 开石 上 星 摘射 岩前 仙 髻 传 今古 峰 形露 丑 妍 法华 初 赐 号 释子 已 超 禅 一 感因 人异 群言 可理 诠 遍随 高下 赏 潜解 利名 牵 民室 常盈目 城 𬮱 异 及 肩 通幽 云底路 朝 接 洞 中天 必 有 千年 隐 都 忘 万事 煎 严园 烟水 乱 樊榭 柳花颠 圣阁 迎仙母 湖楼望 彩船 越台凌 缥缈 溪 女 鬭 婵娟 野景 诚 无限 游人 岂独 专 清虚 宫 刹古 恍惚 岁 时 迁 宝相灵 犹验 云门瑞 复 还 尘埃 笼 古壁 章句 列 前贤 醮 礼 因勤 甚 龙宫 尚 俨然 鱼池 乖 本意 僧 罟 触 轻涟 凿石 成 金像 营 庵 对 玉莲 瑰奇 天桂室 潇洒 宝林 篇 历历 森豪俊 昭昭 著 简编 兰亭 真翰 笔 桃谷 旧 神仙 想像 人 堪慕 凄凉 物足怜 公卿 夸 道路 父子 遁 林泉 废宅 仙宫 立 还乡 世事 捐 嗟时 徒役 役 味道 益干干 种 墓 藏 山穴 耸 祠 阚 水 壖 方干 栖逸 地 祖贯 起 英 躔 相隐 今 遗迹 侯封昔 见 旜 锦衣 渐 我 得 车帐 为民 褰 臣力 难堪 矣 君仁 未 舍 旃 挺身 徒 尽瘁 报德 乏微 涓 所向 知 师古 干 时 愧 学圆 玑 衡 中 切冒 条教 外 颁 宣 每 慕 黄居颍 曾 卑 隗相燕 有 为 怀 黾勉 无术 可收 甄 得请 乡邦 便 躬 祠 祖垅虔 耕桑 初 劝谕 饥疫偶 成连 赈发 无 深惠 疲劳 获少 痊 阖封方 富稔 载路息 迍邅 近 幸同 年代 前 符 昔日 缘 一 麾来镇 抚 千 骑 为 盘旋 弊政 因 民革 烦文 到 日 蠲 恩 随和 气浃 令比 置 邮 遄 美誉 皆 腾 实 清香 已 胜 膻 善良 陶静化 奸猾 洗 前愆 吏 畏 输心 鉴 民 深入 善渊 课书人 第一 轺 召 里 逾 千 身起 侯藩 政 班 趋 秘殿 联 谋 猷 光 帝 座 议论 溢经 筵 道合 风云 会 功 高 玉石 镌 正宜 裨 日月 未 可 问 园田 士论 逾时 望 人心 曷 月 湔 声名 加 显显 歌颂 转 翾 翾 预喜 明贤 遇 须知 直道 便 中宸 深有 眷 外补 实难 铨 行为 山阴 老 聊收 一大 钱
89f072b2-aa24-4f17-b24f-394dafc987e9,次韵程给事同孙觉学士杨宪景略天衣谒禹庙夜归,赵抃,宋,诗,五言古体,梵守近灵祠 偕游薄晚归 云疎通日影 风景作霜威 博约诗情健 盘桓酒力微 旌麾分颉颃 戈戟耸光辉 左右车帷彻 周连烛炬围 湖流平杳杳 泉派溅霏霏 却念观珪剑 仍欣赏钵衣 庙楼临浩渺 寺阁倚峩巍 灯火还城市 烟波远石矶 鼓钟初警动 驺驭始分飞 胜槩同时遇 贤朋共乐稀 佳章蒙寄贶 隣愧得仁依,"5,5,5,5,5,5,5,5,5,5,5,5,5,5,5,5,5,5,5,5,5,5,5,5",fd7fcf0af5ebe97b981225550515a853,梵守 近 灵 祠 偕 游 薄 晚归 云 疎 通 日影 风景 作霜 威 博约 诗情 健 盘桓 酒力 微 旌 麾分 颉颃 戈戟 耸 光辉 左右 车 帷 彻 周 连 烛 炬 围 湖流 平 杳 杳 泉 派 溅 霏霏 却 念 观 珪 剑 仍 欣赏 钵衣 庙楼 临 浩渺 寺 阁 倚 峩 巍 灯火 还 城市 烟波 远 石矶 鼓钟 初 警动 驺 驭始分 飞 胜 槩 同时 遇 贤朋 共乐 稀 佳章 蒙寄贶 隣 愧 得 仁 依
8464fa1e-51fc-4242-bcf0-dc80a67e060f,次韵林希喜赵少师概游杭,赵抃,宋,诗,五言古体,维岳生台辅 于时正典刑 我尝同政府 公早谢明廷 官贵跻三少 身闲越八龄 所难惟寿算 岂易是康宁 求旧心犹壮 寻幽足未停 宋都俄暂别 吴语喜重听 宗契今逾厚 交情久可铭 摛辞工咏物 吐屑妙谈经 岚色迎红旆 湖光动彩舲 游名多写壁 燕席旋张屏 忽遇瀛洲客 新辞使者星 承恩来玉陛 涖事傍沙汀 厌赏尘中景 思登野外亭 爱忘嘉意重 溢美雅章形 叙远才超绝 搜奇思杳冥 道山宁久去 归路入云青,"5,5,5,5,5,5,5,5,5,5,5,5,5,5,5,5,5,5,5,5,5,5,5,5,5,5,5,5,5,5,5,5",0e54b905866c9e53359cffa87cd5b53c,维岳 生台 辅 于时 正典 刑 我 尝同 政府 公早 谢明廷 官贵 跻三少 身 闲越 八龄 所难惟寿算 岂易 是 康宁 求旧心犹壮 寻 幽足 未 停 宋都 俄 暂别 吴语喜 重听 宗契 今 逾 厚 交情 久可铭 摛 辞工 咏物 吐屑妙谈 经 岚 色 迎 红 旆 湖光 动 彩 舲 游名 多 写 壁 燕席旋 张屏 忽 遇 瀛洲 客 新辞 使者 星 承 恩来 玉 陛 涖 事 傍 沙汀 厌赏 尘 中景 思登 野外 亭 爱 忘 嘉 意重 溢美 雅章 形 叙远 才 超绝 搜奇思 杳冥 道山宁 久 去 归路 入云 青
0b461d34-b121-4254-9bba-f92a0ed9e6bc,麓山十咏 真身湖,赵抃,宋,诗,五言绝句,晓光澄水月 秋影颤风幡 宛是真如地 荷花获翠轩,"5,5,5,5",4548a3b8a286cc31521689b6b22259f0,晓光澄 水 月 秋 影颤 风幡 宛 是 真 如 地 荷花 获 翠轩
666a569d-9ee0-404c-bbcb-6674dd7ac4ba,升中古柏,赵抃,宋,诗,五言绝句,雪挫更霜摧 寒心未易回 庭前皆古意 何必问西来,"5,5,5,5",c4e56385fe062438add394636b87d352,雪 挫 更 霜 摧 寒心 未易 回 庭前 皆 古意 何必 问西 来
d7bc87d9-3eaa-4f5d-bb6f-d189374be9b0,书院,赵抃,宋,诗,五言绝句,雨久藏书蠹 风高老屋斜 邻居尽金碧 一一梵王家,"5,5,5,5",54a1123b11d6bfff83c4643226222e36,雨久 藏书 蠹 风高 老屋 斜 邻居 尽 金碧 一一 梵 王家
52dad72c-990d-4c8c-935c-294d7a0c8cd4,四绝堂,赵抃,宋,诗,五言绝句,千灯传静刹 四绝号虚堂 已是金银界 仍为翰墨场,"5,5,5,5",7e2465eb714cd2aa117dfcacc8f088a0,千灯传 静刹 四绝 号 虚堂 已 是 金银 界 仍为 翰墨 场
c44e41ed-aab7-4477-bc43-3445a13a84a2,洞真观,赵抃,宋,诗,五言绝句,木老岩坰冷 泉飞月殿寒 栖真无一事 清啸倚栏干,"5,5,5,5",66cdfa40d15c1b333642c76d8a43627f,木老 岩 坰 冷 泉 飞 月 殿 寒 栖 真 无 一事 清啸 倚栏 干
1cd4e345-f350-4d24-a4be-4c4abb74df1b,抱黄洞,赵抃,宋,诗,五言绝句,灵洞古坛基 烟萝接翠微 日西春又晚 不见羽人归,"5,5,5,5",756fad3c59258396df8e48c4e272e3b0,灵洞 古坛 基 烟萝 接 翠微 日西 春 又 晚 不见 羽 人 归
ee247a1d-1836-4f04-a33a-bf0731e4ac44,岳麓寺,赵抃,宋,诗,五言绝句,古木与云齐 门前百丈梯 我来烦想涤 疑是过灵溪,"5,5,5,5",9ef68e0c1a339ce59cc886864a568fa4,古木 与 云齐 门前 百丈 梯 我 来 烦 想涤 疑 是 过 灵 溪
e453b50d-b22b-457d-91bd-1ec98c7a316a,白鹤泉,赵抃,宋,诗,五言绝句,灵派本无源 因禽潄玉泉 自非流异禀 谁识洞中僊,"5,5,5,5",e9bf752901d155ed3af010ffcfded2d2,灵派本 无源 因 禽 潄 玉泉 自 非流 异禀 谁 识 洞 中 僊
f28add97-17a0-4134-a641-177f3be8f1a0,法华堂,赵抃,宋,诗,五言绝句,峰顶已崔嵬 因高更筑台 夜分僧定起 咫尺见云雷,"5,5,5,5",cb0a80cfbfceb342f3604fa0a89ed34f,峰顶 已 崔嵬 因 高 更 筑 台 夜分 僧定 起 咫尺 见 云雷
5ebb26f2-fdda-441c-9273-48f7d9c24a91,拜岳石,赵抃,宋,诗,五言绝句,片石倚中天 云深鸟道间 人多祝尧寿 登此拜南山,"5,5,5,5",f6b95ff482038b1420cedaa46d2647b3,片石 倚 中天 云 深 鸟 道 间 人 多 祝尧寿 登此 拜 南山
b2759248-7aa6-483f-89cd-78690a2800d4,过云安军下岩僧舍,赵抃,宋,诗,五言绝句,幽寺倚岩阿 云扉掩薜萝 老僧中燕息 谁问世风波,"5,5,5,5",5b0f1edccf801d4f58b91b4ed53bd1ff,幽 寺 倚 岩 阿 云扉 掩 薜萝 老僧 中 燕息 谁 问世 风波
938046a1-4877-4d51-9a91-96c5574580b1,横溪洞飞泉,赵抃,宋,诗,五言绝句,寒瀑落春岩 天垂百丈缣 更疑仙客宴 不卷水晶帘,"5,5,5,5",9c741250059d25695ccce20093d70a5e,寒 瀑落 春岩 天垂 百丈 缣 更疑 仙客 宴 不卷 水晶 帘
c7fcc288-d061-4ff6-80e8-6e8ac78bcde8,和范御史过陈州,赵抃,宋,诗,五言绝句,湾尽疑无路 堤回忽见桥 冬空仍水后 物物称萧条,"5,5,5,5",fa6e9896f59d4a505b5a42912c5eaece,湾 尽 疑无路 堤 回 忽 见 桥 冬空 仍 水 后 物物 称 萧条
c5251df8-7e73-4659-a1f3-b30d2a88618b,题鱼关,赵抃,宋,诗,五言绝句,奔流出万山 乱石销孱颜 彼跃龙门者 何尝惧此关,"5,5,5,5",4c57754a4cf510c54cb7ef0e111d0406,奔流 出 万山 乱石 销 孱颜 彼 跃龙门 者 何尝 惧 此 关
6acd0841-dc9a-48a9-884d-9131f071019f,男㞦生日,赵抃,宋,诗,五言绝句,重九登高节 阳秋禀气和 家家懽会日 祺寿所宜多,"5,5,5,5",8637dbb578aa789fd8f08aae3a60269c,重九登高 节 阳秋 禀气 和 家家 懽 会 日 祺 寿 所 宜 多
f3ea85cb-1697-4be0-84c6-6fcc9375fa2a,次韵吴天常,赵抃,宋,诗,五言绝句,尘事不留毫 谁云梦寐劳 因思四老会 今复数年高,"5,5,5,5",d9a3f86044a2494b0e582a966cc5444b,尘事 不留 毫 谁 云 梦寐 劳 因思 四 老会 今 复数 年 高
763ebe90-1d71-409c-959f-e82b90647fc3,书琴坛,赵抃,宋,诗,五言绝句,制动必原静 治人先正心 风乎昼坛上 退食鸣瑶琴,"5,5,5,5",6198f1a60366766204f216652c01ba2a,制动 必 原静 治 人 先 正心 风乎 昼坛 上 退食 鸣瑶琴
94681dfa-ae62-4fc5-a11c-7c70474c2739,和范御史石仓晚泊,赵抃,宋,诗,五言绝句,天迥旅怀阔 风长野叫来 沧波清可爱 先为濯京埃,"5,5,5,5",de80870a7a71aef22873013dacd1b7fe,天迥 旅 怀阔 风 长野 叫 来 沧波 清 可爱 先为 濯 京 埃
81eb8527-c067-4234-952a-f0a229f5ac4e,觉林寺,赵抃,宋,诗,五言绝句,古寺无碑刻 僧云不记年 自余安所问 惟是爱林泉,"5,5,5,5",45d522a9b17b68946437803931f8b2e7,古寺 无 碑刻 僧云 不 记 年 自余 安所 问 惟 是 爱林泉
0210ef92-f551-4425-9865-47018ec8a6fe,禁籞见牡丹仍蒙恩赐,赵抃,宋,诗,七言律诗,校文春殿籥天关 内籞千葩放牡丹 风卷异香来幕帟 日披浓艳出栏干 芳菲喜向禁中见 憔悴忆曾江外看 剪赐从臣君意重 数枝和露入金盘,"7,7,7,7,7,7,7,7",e5990b99e3750fa2c6bc2583e48fc657,校文 春 殿 籥 天 关 内 籞 千 葩 放 牡丹 风卷 异香 来 幕 帟 日 披 浓艳 出栏 干 芳菲 喜 向禁 中 见 憔悴 忆曾 江外 看 剪赐 从 臣 君 意重 数枝 和 露入 金盘
b268cd39-d984-4f29-8a6c-49a902d866cb,次韵三司蔡襄芦鴈獐猿二首  其一,赵抃,宋,诗,七言律诗,省宇屏图哲匠成 写传芦鴈笔尤精 斜依风苇丛丛袅 远飏烟波渺渺平 弋者定嗟何所慕 鹏抟莫怪不能鸣 公看羽翼飞胜处 有意青云万里程,"7,7,7,7,7,7,7,7",0987887ae8b4390bc6a650f21e961c9e,省宇 屏图 哲匠 成 写 传 芦 鴈 笔 尤 精 斜 依 风 苇丛 丛 袅 远 飏 烟波 渺渺 平 弋者 定 嗟何 所慕 鹏 抟 莫怪 不能 鸣 公看 羽翼 飞胜处 有意 青云万里 程
558a2833-d006-4735-be98-2e9f68800299,次韵三司蔡襄芦鴈獐猿二首  其二,赵抃,宋,诗,七言律诗,獐狎猿驯遂性情 恍然疑不是丹青 岂忧夜猎林中去 只欠秋吟月下听 举目便同临涧谷 此身全恐寄郊坰 山容野态穷微妙 造化争功六幅屏,"7,7,7,7,7,7,7,7",174f8448064c1d735c7c9411a038d7b4,獐狎 猿 驯 遂 性情 恍然 疑 不是 丹青 岂忧 夜猎 林中 去 只 欠 秋吟 月 下 听 举目 便同 临涧 谷 此身 全 恐 寄 郊 坰 山容 野态 穷 微妙 造化 争功 六幅 屏
28ee26fb-8e17-4649-a466-058ebcbf9ac2,忆信安五弟拊,赵抃,宋,诗,七言律诗,腊残鹦鹉洲边过 忆汝东吴住旧庐 诵圣穷愁千卷外 觅官留滞十年余 也知失意能平气 底事多时不寄书 兄在松溪我荆楚 别怀三处一欷歔,"7,7,7,7,7,7,7,7",ce5d1623b1801b52036e6ac0ab4cb172,腊 残 鹦鹉 洲 边 过 忆汝 东吴 住 旧 庐 诵 圣 穷愁 千卷 外 觅 官 留滞 十年 余 也 知 失意 能 平气 底事 多 时 不 寄 书 兄 在 松溪 我 荆楚 别怀 三处 一 欷 歔
c4e9fb56-1005-4e29-83b7-aab125ee86af,饮酒,赵抃,宋,诗,七言律诗,江头落寞穷冬日 天末崎岖薄宦身 休问世途千态巧 且贪杯酒十分醇 颜间戚戚成何事 醉里熙熙即是真 梅雪半残烟柳吐 一番消息又青春,"7,7,7,7,7,7,7,7",3f47b34de75725c8d290b794269a512e,江头 落寞 穷 冬日 天末 崎岖 薄 宦身 休 问世 途 千态巧 且 贪 杯酒 十分 醇 颜间 戚戚 成 何事 醉 里 熙熙 即是 真 梅雪 半残 烟柳 吐 一番 消息 又 青春
2001c280-28d5-45af-be5e-ceca5a2b4d2f,和十二弟扬腊月立春,赵抃,宋,诗,七言律诗,二十四日立春节 六七千里孤舟行 呼儿倒酒迎春醉 忽尔持诗属我赓 海上去年宾燕乐 江头今岁客心情 兴来极目寻春色 岸柳汀芜绿未成,"7,7,7,7,7,7,7,7",2874ebd0ec2c415f907b06dd05b372d5,二十四日 立 春节 六七千 里 孤舟行 呼儿 倒 酒 迎春 醉 忽尔 持 诗 属 我 赓 海上 去年 宾燕乐 江头 今岁 客 心情 兴来 极目 寻 春色 岸 柳 汀芜 绿 未成
d2079bdb-62b4-4098-9910-8901de2ee7e8,除夜泊临江县言怀,赵抃,宋,诗,七言律诗,县封萧索楚江澄 旅况吟怀冷似冰 漏促已交新岁鼓 酒兰犹剪隔宵灯 立身从道思无愧 得路由机患不能 未报君恩逾四十 青春还是一番增,"7,7,7,7,7,7,7,7",792f6cac2cb64bbbddd5a94b0262d38e,县 封 萧索 楚江 澄 旅况 吟怀 冷似 冰 漏促 已 交 新岁 鼓 酒兰 犹 剪 隔 宵 灯 立身 从 道 思 无愧 得 路由 机患 不能 未 报 君 恩 逾 四十 青春 还是 一番 增
fd446cf8-ae74-425f-80b3-aac12e1babbc,泊巴陵闻晓角,赵抃,宋,诗,七言律诗,五更钟后斗沈杓 画角三番塞角调 青草湖平无俗籁 岳阳楼迥有寒飚 酒肠唤醒维舟静 梦眼惊回去国遥 我爱清余起倾耳 欲吟情思已飘飘,"7,7,7,7,7,7,7,7",15123ca7ed219d5e16c543736ca59561,五更 钟 后 斗 沈 杓 画角 三番 塞角 调 青草湖 平无俗籁 岳阳楼 迥 有 寒飚 酒肠 唤醒 维舟静 梦眼惊 回去 国遥 我 爱 清余起 倾耳 欲 吟 情思 已 飘飘
f9b11bb4-fceb-4ee5-9762-7a2ce504d959,忆辇下寄同年杨子卿,赵抃,宋,诗,七言律诗,一思平日禁城春 直上青霄步步云 在月香名欣共得 掞天彩藻愧相闻 满头竞插花千柄 没案谁辞酒十分 莲水今为从事乐 伊予无复叹离群,"7,7,7,7,7,7,7,7",fa9d8992c299246ba0f17e34c8ccba09,一 思 平日 禁城 春 直 上青霄 步步 云 在 月香 名欣共得 掞 天 彩 藻 愧 相闻 满头 竞 插花 千 柄 没案 谁 辞酒 十分 莲水 今 为 从事 乐 伊予 无复 叹 离群
ed0cb115-106c-4a7f-bb53-98c7e0f6f730,送交代杨推官,赵抃,宋,诗,七言律诗,三载从军绩用成 代还京阙黯离情 亭长且作班荆饮 江迥愁闻唱棹声 前席去当回帝问 初筵今已号宾荣 交承参袂宜敦好 莫惜殷勤重报琼,"7,7,7,7,7,7,7,7",4997dc861d436f5ce7851e7dd977201a,三载 从军 绩用 成 代 还 京 阙 黯 离情 亭长 且 作班荆 饮 江 迥愁闻 唱 棹 声 前席 去 当 回帝 问 初筵 今 已 号 宾荣 交承 参袂 宜敦 好 莫惜 殷勤 重报 琼
863562d9-9aa4-45fa-8c5b-1bbd12a9ca34,早雾,赵抃,宋,诗,七言律诗,山光全暝水光浮 数里霏霏晓未收 露彩乍凝迷汉殿 日华不透掩秦楼 岂饶文豹迟留隐 应有灵蛇取次游 圣世妖氛已销尽 结成佳气满南州,"7,7,7,7,7,7,7,7",9ff1d59f9b16d432b135a4174ffa8dc9,山光全 暝 水 光 浮 数里 霏霏 晓 未收 露彩 乍 凝迷 汉 殿 日 华 不 透掩 秦楼 岂 饶 文豹 迟留隐 应有 灵蛇 取次游 圣世 妖氛 已销 尽 结成 佳气 满南州
75e2b0c3-0793-4ac0-91c7-b4c7a7d1a3e6,寄里中亲友,赵抃,宋,诗,七言律诗,记得城南数刻懽 破欢为别泪阑干 间关远道初随牒 寂寞长亭一据鞍 郊外此时凉叶乱 岭头平日腊梅残 不辞频寄南州信 草檄无功楯墨干,"7,7,7,7,7,7,7,7",058a77290909b0adfff903b61551fa7d,记得 城南 数 刻 懽 破欢 为 别泪 阑干 间 关 远道 初随牒 寂寞 长亭 一 据 鞍 郊外 此时 凉叶 乱 岭头 平日 腊梅 残 不 辞 频 寄 南州 信 草 檄 无功 楯 墨 干
6cd9d45a-b155-4e45-89c3-fdfdfb32d4d4,席上感别送桂倅,赵抃,宋,诗,七言律诗,照人冰骨是真仙 失臂江西仅十年 子拥倅车袍著茜 我趋宾席幕依莲 今宵把酒方欢甚 明日班荆又黯然 八桂到须多假日 府中佳醑主公贤,"7,7,7,7,7,7,7,7",e95095d52c15daeb31ceb89fb803f250,照人 冰骨 是 真仙 失臂 江西 仅 十年 子 拥 倅 车 袍 著 茜 我 趋宾席 幕 依莲 今宵 把酒 方欢 甚 明日 班荆 又 黯然 八桂 到须 多 假日 府 中 佳 醑 主公 贤
db02babb-e294-4381-b969-2467926c6daa,和人清明有感,赵抃,宋,诗,七言律诗,湖外清明物态繁 晓林莺舌鬭关关 枉缘春意无时尽 自是人心不暂闲 旧隐东君曾藉草 新官南郡亦登山 满头花卉盈樽酒 且向东风一破颜,"7,7,7,7,7,7,7,7",6e7f47df95c5aac656f4ffabc69171e7,湖 外 清明 物态 繁 晓林莺 舌 鬭 关关 枉 缘 春意 无时 尽 自 是 人心 不暂 闲 旧 隐 东君 曾 藉 草 新 官 南郡 亦 登山 满头 花卉 盈 樽 酒 且 向 东风 一破颜
b14aa9bf-d699-48b1-9257-8d993ace9adc,和三兄得书喜授掌庾,赵抃,宋,诗,七言律诗,区区宦况远南州 长得归鸿与寄愁 已胜折腰嗟五斗 岂辞衔尾运千舟 冰含白玉期无累 路迫青云愧可求 家有旧埙流韵远 勉将文藻赞宸猷,"7,7,7,7,7,7,7,7",62eea9f2f1411836fbea51a5452b1867,区区 宦况 远 南州 长 得 归 鸿 与 寄愁 已 胜 折腰 嗟 五斗 岂 辞 衔尾 运千舟 冰含 白玉 期 无累 路 迫 青云 愧 可求 家 有 旧 埙 流韵 远 勉 将 文藻 赞 宸 猷
923ee1a2-18a7-4657-bf59-63fd627181a9,赠狄节推,赵抃,宋,诗,七言律诗,唐嗣几危国步艰 梁公忠力世难攀 不辞鼎镬君臣际 为正朝廷子母间 今见裔孙仍白首 去从幕府绾青纶 旌贤有后十二代 转觉勋名重泰山,"7,7,7,7,7,7,7,7",ac8fa3bd288d0f9efe7c43525e3c65cb,唐嗣几 危 国步 艰 梁公忠 力世难攀 不 辞 鼎 镬 君臣 际 为 正 朝廷 子母 间 今 见 裔 孙 仍 白首 去 从 幕府 绾 青纶 旌贤 有 后 十二代 转觉 勋名 重 泰山
8136f4ee-3e66-4f75-b6a1-995fa2360d5e,劝学示江原诸生,赵抃,宋,诗,七言律诗,古人名教自诗书 浅俗颓风好力扶 口诵圣贤皆进士 身为仁义妈真儒 任从客笑原思病 莫管时讥孟子迂 通要设施穷要乐 不须随世问荣枯,"7,7,7,7,7,7,7,7",569be129e6c8ca9108ad9f7d996b726f,古人 名教 自 诗书 浅俗 颓风 好力 扶 口诵 圣贤 皆 进士 身为 仁义 妈 真儒 任从客 笑 原 思病 莫管 时 讥 孟子 迂 通要 设施 穷要 乐 不须 随世问荣枯
5663f1b4-dc99-450a-ab6a-3ec6ffae8f22,送何孟侯先生之平原,赵抃,宋,诗,七言律诗,束书携剑出西州 恩旧相欢事远游 架上昔曾穷圣卷 幄中今好赞宾筹 也知贤帅须青眼 应念慈闱已白头 到日欲凭归信杳 寒鸿成阵叫清秋,"7,7,7,7,7,7,7,7",b0059151174cd92e1d7e78d61464d3f4,束书携剑 出 西州 恩 旧 相欢 事 远游 架上 昔 曾 穷 圣 卷 幄 中 今 好 赞宾 筹 也 知 贤帅 须 青眼 应念 慈 闱 已 白头 到 日欲凭归信 杳 寒鸿成 阵 叫 清秋
7b7c571a-c187-45ad-862d-d9dbd79be518,题杜子美书室,赵抃,宋,诗,七言律诗,直将骚雅镇浇淫 琼贝千章照古今 天地不能笼大句 鬼神无处避幽吟 几逃兵火覊危极 欲厚民生意思深 茅屋一间遗像在 有谁于世是知音,"7,7,7,7,7,7,7,7",9cd25606e7b8beb60bdfefb7624c043c,直 将 骚 雅镇 浇淫 琼贝 千章 照 古今 天地 不能 笼 大句 鬼神 无处 避 幽吟 几 逃 兵火 覊 危 极 欲 厚 民生 意思 深 茅屋 一间 遗像 在 有 谁 于 世是 知音
b1f8fcb9-7d08-4f57-ab0a-fbeadd50f3b5,春日雪雷并作,赵抃,宋,诗,七言律诗,东君新用少阳时 正月群阴老未归 千里雪花铺夜景 数声雷鼓作春威 欲开桃李嗟寒勒 尚蛰龙蛇恨力微 一挫芳菲一惊物 惘然无处问天机,"7,7,7,7,7,7,7,7",e696ae85da6128593f65c57a0c3744b0,东君 新 用 少阳 时 正月 群阴 老 未归 千里 雪花 铺 夜景 数声 雷鼓作春威 欲 开 桃李 嗟寒勒 尚 蛰 龙蛇 恨力微 一 挫 芳菲 一惊物 惘然 无处 问 天机
3c101e79-bed1-4c60-ac1a-6ff84911dacb,初入峡,赵抃,宋,诗,七言律诗,浃江初过三游洞 天气新调二月风 樵户人家随处见 仙源云路有时通 峰峦压岸东西碧 桃李临波上下红 险碛恶滩知几许 晚停征棹问渔翁,"7,7,7,7,7,7,7,7",23c3eb8c0e65571e901ae12d26682d67,浃 江 初 过 三 游洞 天气 新 调 二月 风 樵户 人家 随处 见 仙源 云路 有时 通 峰峦 压岸 东西 碧 桃李 临波 上下 红 险碛 恶滩 知 几许 晚 停征 棹 问 渔翁
c7916d57-f8c8-4094-ac12-e368fdf37c64,过岭回寄张景通先生示邑下同人,赵抃,宋,诗,七言律诗,二年官役愧能名 贤得斯人幸合并 几度孝廉交郡辟 一生文行出乡评 君庐皂水江头远 我马青泥岭顶行 西首胡为书以赠 欲持同邑寄诸生,"7,7,7,7,7,7,7,7",7efd05064d7b5befd66cf4e0c6e491b7,二年 官役 愧能 名 贤 得 斯人 幸 合并 几度 孝廉 交郡 辟 一生 文行 出乡 评 君庐皂 水江 头 远 我 马青 泥岭 顶行 西首 胡为书 以 赠 欲 持同 邑 寄 诸生
5e539b35-314c-4581-a0df-abc569542dca,下牢津,赵抃,宋,诗,七言律诗,拖舟百丈苦攀跻 一过牢津恍似迷 花放乱红迎彩旆 谷传深响答鸣鼙 避人幽鸟凌云噪 抱子惊猿走险啼 春岫重重春水绿 却疑身在武陵溪,"7,7,7,7,7,7,7,7",3806d20610acff37eaa6ab4aaf0c9e84,拖舟 百丈 苦 攀 跻 一过牢 津恍似迷 花放 乱 红 迎 彩 旆 谷传深 响答 鸣 鼙 避人 幽鸟 凌云 噪 抱子 惊 猿 走险 啼 春 岫 重重 春水 绿 却 疑身 在 武陵 溪
95ee5512-21c6-4dce-b78d-78314657563d,同万州相里殿丞游溪西山寺,赵抃,宋,诗,七言律诗,使君呼客入山行 晓径前驱照彩旌 蛮女背樵岩侧避 野僧携刺马头迎 千层云水迷三峡 一哄人烟认百城 楼阁凭余清我听 竹风萧瑟涧泉鸣,"7,7,7,7,7,7,7,7",499efd444bd4c8ccf60854e2f9943769,使君 呼客 入 山行 晓径 前驱 照彩 旌 蛮女 背 樵岩 侧避 野僧 携刺 马头 迎 千层 云水 迷 三峡 一 哄 人烟 认 百城 楼阁 凭 余 清 我 听 竹风 萧瑟 涧泉鸣
